source,date,headline,url,chosen_label,positive,negative,neutral,compound
Global,2023-09-06,‘I’m starving’: N.W.T. evacuees waiting for government support,https://globalnews.ca/news/9940777/nwt-evacuees-waiting-government-support/,negative,0.01748098,0.6068021,0.37571692,-0.3679032114368965
Global,2023-09-06,Cancer cases soared 79% globally among young adults over past 3 decades: study,https://globalnews.ca/news/9938796/cancer-cases-young-adults-study/,negative,0.03336041,0.4009832,0.56565636,-0.159674620480029
Global,2023-09-06,‘Playing fields for sure would be a challenge’: Surrey considers placing schools in condo developments,https://globalnews.ca/video/9940934/playing-fields-for-sure-would-be-a-challenge-surrey-considers-placing-schools-in-condo-developments/,negative,0.017819228,0.31593546,0.6662454,-0.09949766513847358
Global,2023-09-06,Highly-anticipated criminal trial of ‘Freedom Convoy’ organizers underway,https://globalnews.ca/video/9940991/highly-anticipated-criminal-trial-of-freedom-convoy-organizers-underway/,neutral,0.09277397,0.07855769,0.8286683,0.0024356984481084254
Global,2023-09-06,Edmonton business on Fort Road closes after string of problems,https://globalnews.ca/news/9940679/edmonton-business-fort-road-closes/,negative,0.008891664,0.700209,0.2908993,-0.4902136331893754
Global,2023-09-06,Canada’s tech sector latest industry to experience shift away from remote work,https://globalnews.ca/news/9941400/canada-tech-sector-remote-work/,neutral,0.03971156,0.079484634,0.88080394,-0.004740793494736106
Global,2023-09-06,RBC poll suggests more post-secondary students are relying on parents to finish school,https://globalnews.ca/news/9941385/rbc-poll-post-secondary/,neutral,0.034686875,0.124173194,0.8411399,-0.014215803955996975
Global,2023-09-06,RCMP investigates ex-RCAF pilots reportedly training China’s air force,https://globalnews.ca/news/9938777/rcmp-rcaf-pilots-china-air-force-investigation/,negative,0.011636666,0.43977037,0.5485929,-0.19326257953299475
Global,2023-09-06,Surrey’s school enrolment dilemma,https://globalnews.ca/video/9941189/surreys-school-enrolment-dilemma/,neutral,0.017010653,0.13817617,0.84481317,-0.01880329341443021
Global,2023-09-06,"Heat warnings in effect across Ontario, Quebec",https://globalnews.ca/video/9940995/heat-warnings-in-effect-across-ontario-quebec/,neutral,0.036002137,0.116930746,0.84706724,-0.012376635753794218
Global,2023-09-06,Canada’s teachers say ongoing shortage creating ‘crisis’ What’s behind it?,https://globalnews.ca/news/9940451/canada-teacher-shortage/,negative,0.0069280616,0.67684364,0.3162283,-0.45806929898009585
Global,2023-09-06,‘Enough is enough’: Ford says Bank of Canada personally responsible for creating inflation,https://globalnews.ca/video/9939478/enough-is-enough-ford-says-bank-of-canada-personally-responsible-for-creating-inflation/,negative,0.011428953,0.67585397,0.31271705,-0.4566479844633484
Global,2023-09-06,"Overworked and underappreciated: Teachers urge action, lament ‘challenges’ in recruiting colleagues amid shortage",https://globalnews.ca/video/9940986/overworked-and-underappreciated-teachers-urge-action-lament-challenges-in-recruiting-colleagues-amid-shortage/,negative,0.011951272,0.76957864,0.21846993,-0.5921085678991833
Global,2023-09-06,‘Irreversible damage’ done to Great Wall of China by workers looking for shortcut: police,https://globalnews.ca/news/9939158/great-wall-china-damaged-workers-arrested/,negative,0.0066513424,0.8276727,0.16567601,-0.6849978298383119
Global,2023-09-06,Trudeau kicks off Indo-Pacific tour in Indonesia,https://globalnews.ca/video/9940996/trudeau-kicks-off-indo-pacific-tour-in-indonesia/,neutral,0.08230021,0.011029875,0.9066698,0.00665167463517502
Global,2023-09-06,TIFF to see fewer stars amid Hollywood strikes,https://globalnews.ca/video/9940999/tiff-to-see-fewer-stars-amid-hollywood-strikes/,negative,0.012714991,0.6467808,0.3405043,-0.41816368032676365
Global,2023-09-06,"Gen Z, millennials would choose job with pension plan over higher salary: survey",https://globalnews.ca/video/9940072/young-canadians-want-to-save-for-retirement-despite-high-cost-of-living-survey/,neutral,0.13840449,0.041140154,0.82045543,0.017463282936295954
Global,2023-09-06,International students pay sky-high fees. Whose job is it to house them?,https://globalnews.ca/news/9939599/housing-for-international-students-canada/,negative,0.014707068,0.68384326,0.3014496,-0.4674253389001919
Global,2023-09-06,Nisga’a First Nation to bring home stolen totem pole,https://globalnews.ca/video/9941604/nisgaa-first-nation-to-bring-home-stolen-totem-pole/,negative,0.033867024,0.32717565,0.63895744,-0.10589689322656426
Global,2023-09-06,What Prigozhin’s death means for Putin,https://globalnews.ca/video/9923625/what-prigozhins-death-means-for-putin/,negative,0.026179137,0.25055158,0.7232693,-0.062090747832126425
Global,2023-09-06,Air Canada customers kicked off plane for refusing vomit-covered seat,https://globalnews.ca/news/9938774/air-canada-vomit-seat-passenger-apology/,negative,0.006540393,0.8427089,0.15075082,-0.7101153892443186
Global,2023-09-06,Toronto home sales little changed from July to August but expect volatility: board,https://globalnews.ca/news/9941304/toronto-home-sales-july-august-2023/,neutral,0.052692752,0.06530543,0.88200176,-0.0014882734091554717
Global,2023-09-06,Montreal university student says he’s out $700 due to a fraudulent landlord,https://globalnews.ca/news/9940359/montreal-university-student-victim-apartment-fraud-warning/,negative,0.0054115374,0.86494356,0.12964484,-0.7480981093750252
Global,2023-09-06,Your Saskatchewan photo of the day: September 2023,https://globalnews.ca/news/9934027/your-saskatchewan-photo-of-the-day-september-2023/,neutral,0.05792735,0.009367172,0.9327056,0.0032678290750181027
Global,2023-09-06,‘Unpredictable’ Bank of Canada looms over fall housing market. Here’s why,https://globalnews.ca/news/9938953/canada-interest-rate-fall-housing-market-remax/,negative,0.013530018,0.5054982,0.48097184,-0.2553453247421089
Global,2023-09-06,Vancouver Island school enacts rules to limit phone use,https://globalnews.ca/video/9940896/vancouver-island-school-enacts-rules-to-limit-phone-use/,neutral,0.027394578,0.11816405,0.8544415,-0.013212265723062444
Global,2023-09-06,‘Freedom Convoy’ trial to hear from Ottawa police on 2nd day of hearing,https://globalnews.ca/news/9941369/freedom-convoy-trial-day-2/,neutral,0.030881817,0.039060805,0.9300573,-0.0005720606415331453
Global,2023-09-06,Canada’s teachers say ongoing staff shortages creating ‘crisis.’ What’s behind it?,https://globalnews.ca/video/9940955/canadas-teachers-say-ongoing-staff-shortages-creating-crisis-whats-behind-it/,negative,0.006298662,0.6976828,0.29601866,-0.4867215309451005
Global,2023-09-06,"TimShop: Tim Hortons introduces nostalgic, vintage-inspired clothing line",https://globalnews.ca/news/9939487/tim-hortons-new-clothing-line-timshop/,positive,0.6620151,0.0035067496,0.3344783,0.438251610784965
Global,2023-09-06,"Princeton, B.C. links removed from community Facebook groups",https://globalnews.ca/video/9940939/princeton-b-c-links-removed-from-community-facebook-groups/,neutral,0.01784545,0.14019994,0.84195447,-0.019337580661233034
Global,2023-09-06,Bank of Canada holds key interest rate steady at 5.0%,https://globalnews.ca/news/9941362/bank-of-canada-interest-rate-september/,neutral,0.17676073,0.028519467,0.7947198,0.03043099459628884
Global,2023-09-06,Vancouver store manager beaten by would-be youth shoplifters,https://globalnews.ca/video/9940924/vancouver-store-manager-beaten-by-shoplifters/,negative,0.016540665,0.65682906,0.3266302,-0.4311508771675623
Global,2023-09-06,Winning $1M B.C. lottery ticket set to expire if left unclaimed,https://globalnews.ca/news/9940968/winning-1m-b-c-lottery-ticket-set-to-expire-if-left-unclaimed/,neutral,0.123541504,0.026869042,0.8495895,0.01454055053389336
Global,2023-09-06,"Cold, flu, or COVID? Know your options if a co-worker comes in sick",https://globalnews.ca/video/9939717/cold-flu-or-covid-know-your-options-if-a-co-worker-comes-in-sick/,negative,0.03834209,0.37282464,0.5888333,-0.1375280957590448
Global,2023-09-06,"Alberta’s ‘war room’ spent $22M on oil and gas ads, revealed in annual report",https://globalnews.ca/news/9941485/albertas-war-room-22m-ad-spend-revealed-annual-report/,negative,0.029128715,0.26528767,0.70558363,-0.06952906095477207
CTV,2023-09-06,"EU targets Apple, Amazon, Alphabet, ByteDance, Meta, Microsoft in next phase of digital crackdown",https://www.ctvnews.ca/sci-tech/eu-targets-apple-amazon-alphabet-bytedance-meta-microsoft-in-next-phase-of-digital-crackdown-1.6549503,neutral,0.07769424,0.12520052,0.79710513,-0.009638781897989723
CTV,2023-09-06,"Manitoba premier kicks off election campaign, calls provincial vote for Oct. 3",https://winnipeg.ctvnews.ca/manitoba-premier-kicks-off-election-campaign-calls-provincial-vote-for-oct-3-1.6548251,neutral,0.041854925,0.010148521,0.9479966,0.0016488402878724884
CTV,2023-09-06,"More structures confirmed to have been destroyed, damaged due to wildfire in B.C.'s Shuswap",https://bc.ctvnews.ca/more-structures-confirmed-to-have-been-destroyed-damaged-due-to-wildfire-in-b-c-s-shuswap-1.6549197,negative,0.008020996,0.72585446,0.26612467,-0.5268002699455643
CTV,2023-09-06,"Indo-Pacific leaders see a partner in Canada, elevating its status within ASEAN-bloc",https://www.ctvnews.ca/politics/indo-pacific-leaders-see-a-partner-in-canada-elevating-its-status-within-asean-bloc-1.6549432,positive,0.48375288,0.0064035733,0.5098436,0.2339758256654889
CTV,2023-09-06,"Stolen car crashes into illegal magic mushroom shop in Barrie, Ont.",https://barrie.ctvnews.ca/stolen-car-crashes-into-illegal-magic-mushroom-shop-in-barrie-ont-1.6549674,negative,0.009301072,0.70152295,0.28917587,-0.49204801694955336
CTV,2023-09-06,Spanish soccer federation fires women's national team coach Jorge Vilda amid Rubiales controversy,https://www.ctvnews.ca/sports/spanish-soccer-federation-fires-women-s-national-team-coach-jorge-vilda-amid-rubiales-controversy-1.6548212,negative,0.017533882,0.40630478,0.5761614,-0.16477612341103054
CTV,2023-09-06,"After 'jumping around on couches,' this Yellowknife evacuee is returning home",https://www.ctvnews.ca/canada/after-jumping-around-on-couches-this-yellowknife-evacuee-is-returning-home-1.6549520,neutral,0.04570394,0.0307356,0.92356044,0.0011441732660475434
CTV,2023-09-06,Brantford City Council voices show of support for SC Johnson plant,https://kitchener.ctvnews.ca/brantford-city-council-voices-show-of-support-for-sc-johnson-plant-1.6549474,positive,0.2592787,0.0060103396,0.7347108,0.06718935771606027
CTV,2023-09-06,Structural damage forces evacuation of north Edmonton condo building,https://edmonton.ctvnews.ca/structural-damage-forces-evacuation-of-north-edmonton-condo-building-1.6549065,negative,0.012045793,0.5000723,0.48788202,-0.249927146170009
CTV,2023-09-06,"Six-year-old girl struck by vehicle in Quebec City, suffers serious head injury",https://montreal.ctvnews.ca/six-year-old-girl-struck-by-vehicle-in-quebec-city-suffers-serious-head-injury-1.6549682,negative,0.009993407,0.7286963,0.26131028,-0.5308984094966043
CTV,2023-09-06,'Freedom Convoy' trial to hear from Ottawa police on second day,https://www.ctvnews.ca/canada/freedom-convoy-trial-to-hear-from-ottawa-police-on-second-day-1.6549420,neutral,0.024726996,0.07222812,0.9030449,-0.004605477247139778
CTV,2023-09-06,A snapshot of wait times at hospital emergency departments across Canada,https://www.ctvnews.ca/health/a-snapshot-of-wait-times-at-hospital-emergency-departments-across-canada-1.6544823,neutral,0.04358485,0.048477262,0.90793794,-0.0004504055605958346
CTV,2023-09-06,UAW's clash with Big 3 automakers shows off a more confrontational union as strike deadline looms,https://www.ctvnews.ca/business/uaw-s-clash-with-big-3-automakers-shows-off-a-more-confrontational-union-as-strike-deadline-looms-1.6547152,negative,0.031201072,0.2769625,0.6918364,-0.07573472114489554
CTV,2023-09-06,Montreal could see record-breaking heat on Wednesday,https://montreal.ctvnews.ca/montreal-could-see-record-breaking-heat-on-wednesday-1.6549536,neutral,0.07087451,0.06436431,0.8647611,0.0008804329477118955
CTV,2023-09-06,Students head back to school as heat warnings blanket Central Canada,https://www.ctvnews.ca/canada/students-head-back-to-school-as-heat-warnings-blanket-central-canada-1.6547788,neutral,0.02733213,0.17849803,0.7941699,-0.0311144924282587
CTV,2023-09-06,"Joe Jonas files for divorce from Sophie Turner after 4 years of marriage, 2 daughters",https://www.ctvnews.ca/entertainment/joe-jonas-files-for-divorce-from-sophie-turner-after-4-years-of-marriage-2-daughters-1.6549032,negative,0.01898807,0.22694609,0.75406575,-0.05114399749216858
CTV,2023-09-06,"U.S. teen dies after participating in 'One Chip Challenge,' police say",https://www.ctvnews.ca/world/u-s-teen-dies-after-participating-in-one-chip-challenge-police-say-1.6548677,negative,0.0067523816,0.69485617,0.29839143,-0.4827795185773489
CTV,2023-09-06,Ontario Premier Doug Ford says his government will 're-evaluate' more Greenbelt lands,https://toronto.ctvnews.ca/ontario-premier-doug-ford-says-his-government-will-re-evaluate-more-greenbelt-lands-1.6547804,neutral,0.13380408,0.0063345586,0.85986143,0.017863396468897896
CTV,2023-09-06,One in hospital in critical condition after another Sudbury shooting,https://northernontario.ctvnews.ca/one-in-hospital-in-critical-condition-after-another-sudbury-shooting-1.6549100,negative,0.01147703,0.73503804,0.25348496,-0.5401491574109087
CTV,2023-09-06,U.S. moves to force recall of 52 million air bag inflators that can explode and hurl shrapnel,https://www.ctvnews.ca/business/u-s-moves-to-force-recall-of-52-million-air-bag-inflators-that-can-explode-and-hurl-shrapnel-1.6548380,negative,0.010039268,0.6669153,0.32304543,-0.4446752271098937
CTV,2023-09-06,Maine resident captures nature in action in N.B. as shark snacks on whale carcass,https://atlantic.ctvnews.ca/maine-resident-captures-nature-in-action-in-n-b-as-shark-snacks-on-whale-carcass-1.6547840,neutral,0.09799947,0.044287752,0.85771275,0.007642492607370599
CTV,2023-09-06,BTS' Jung Kook to join Global Citizen Festival lineup to make one of his first U.S. solo appearances,https://www.ctvnews.ca/entertainment/bts-jung-kook-to-join-global-citizen-festival-lineup-to-make-one-of-his-first-u-s-solo-appearances-1.6549559,positive,0.25345004,0.0024542843,0.7440957,0.06423089727867648
CTV,2023-09-06,"'The landlords have no accountability': Wrongfully evicted B.C. woman wins tenancy branch battle, but says former landlord refuses to pay up",https://bc.ctvnews.ca/the-landlords-have-no-accountability-wrongfully-evicted-b-c-woman-wins-tenancy-branch-battle-but-says-former-landlord-refuses-to-pay-up-1.6546310,negative,0.0041805035,0.88184893,0.11397069,-0.7776399630652588
CTV,2023-09-06,First day at Waterloo Region’s newest Catholic school,https://kitchener.ctvnews.ca/first-day-at-waterloo-region-s-newest-catholic-school-1.6548318,neutral,0.17462513,0.004790234,0.8205847,0.030470976533972127
CTV,2023-09-06,"Drought, smoke and grasshoppers make for challenging growing season in Sask.",https://saskatoon.ctvnews.ca/drought-smoke-and-grasshoppers-make-for-challenging-growing-season-in-sask-1.6549120,negative,0.019087417,0.67285746,0.3080551,-0.4523728358693866
CTV,2023-09-06,"About 750 pigs die in barn fire, damage estimated at $5 million",https://london.ctvnews.ca/about-750-pigs-die-in-barn-fire-damage-estimated-at-5-million-1.6549595,negative,0.010024773,0.7988842,0.19109097,-0.6381155129094562
CTV,2023-09-06,Bank of Canada to announce interest rate decision this morning,https://www.ctvnews.ca/business/bank-of-canada-to-announce-interest-rate-decision-this-morning-1.6549401,neutral,0.10413541,0.023537356,0.8723272,0.01029017883785599
CTV,2023-09-06,Canadian Tulip Festival exec concerned over budding Ottawa Tourism proposal,https://ottawa.ctvnews.ca/canadian-tulip-festival-exec-concerned-over-budding-ottawa-tourism-proposal-1.6548952,neutral,0.023878928,0.1348173,0.84130377,-0.017605501586348993
CTV,2023-09-06,"Fatal motorcycle crash in Ramara Township, Ont.",https://barrie.ctvnews.ca/fatal-motorcycle-crash-in-ramara-township-ont-1.6549546,negative,0.0086554745,0.82427067,0.16707386,-0.6793472006092074
CTV,2023-09-06,On-demand bus service coming to Blackburn Hamlet streets this fall,https://ottawa.ctvnews.ca/on-demand-bus-service-coming-to-blackburn-hamlet-streets-this-fall-1.6549414,neutral,0.07549936,0.0048824754,0.9196182,0.005676313161797175
CTV,2023-09-06,Federal government declines comment on First Nations elver quota court ruling,https://atlantic.ctvnews.ca/federal-government-declines-comment-on-first-nations-elver-quota-court-ruling-1.6548269,negative,0.013047422,0.3222227,0.6647299,-0.10365723005403105
CTV,2023-09-06,Police seek man accused of trying to abduct child in northwestern New Brunswick,https://atlantic.ctvnews.ca/police-seek-man-accused-of-trying-to-abduct-child-in-northwestern-new-brunswick-1.6549653,negative,0.011834321,0.42273253,0.56543314,-0.17856274242126347
CTV,2023-09-06,Dark sky designation: Quebec's Mont-Tremblant Park is officially star gazers' paradise,https://montreal.ctvnews.ca/dark-sky-designation-quebec-s-mont-tremblant-park-is-officially-star-gazers-paradise-1.6541540,positive,0.45245674,0.009746676,0.5377966,0.20462209307245516
CTV,2023-09-06,NHL stars hit the links in Muskoka to support Special Olympics,https://barrie.ctvnews.ca/nhl-stars-hit-the-links-in-muskoka-to-support-special-olympics-1.6549110,positive,0.28960752,0.0040829363,0.70630944,0.08385587352615076
CTV,2023-09-06,"It will be many months before Canada's new disability benefit is ready, minister vows to 'get it right'",https://www.ctvnews.ca/politics/it-will-be-many-months-before-canada-s-new-disability-benefit-is-ready-minister-vows-to-get-it-right-1.6548352,negative,0.020388726,0.5619516,0.4176596,-0.31537392405599185
CTV,2023-09-06,"Greek ferry captain, 3 seamen face homicide charges over death of tardy passenger pushed into sea",https://www.ctvnews.ca/world/greek-ferry-captain-3-seamen-face-homicide-charges-over-death-of-tardy-passenger-pushed-into-sea-1.6549594,negative,0.005800259,0.84339184,0.15080777,-0.7112762704511599
CTV,2023-09-06,Sask. woman with terminal cancer seeks new home for 3 dogs,https://regina.ctvnews.ca/sask-woman-with-terminal-cancer-seeks-new-home-for-3-dogs-1.6541793,negative,0.022339256,0.48111612,0.4965446,-0.23097368849580135
CTV,2023-09-06,China authorities arrest 2 for smashing shortcut through Great Wall with excavator,https://www.ctvnews.ca/world/china-authorities-arrest-2-for-smashing-shortcut-through-great-wall-with-excavator-1.6549428,negative,0.01397881,0.6350154,0.35100573,-0.4030491859445995
CTV,2023-09-06,Trio of Canadian Olympians the first players to sign with Ottawa's new pro women's hockey team,https://ottawa.ctvnews.ca/trio-of-canadian-olympians-the-first-players-to-sign-with-ottawa-s-new-pro-women-s-hockey-team-1.6548554,neutral,0.17258078,0.0055566514,0.82186264,0.029753236250363635
CTV,2023-09-06,4 exceptionally preserved Roman swords discovered in a Dead Sea cave in Israel,https://www.ctvnews.ca/sci-tech/4-exceptionally-preserved-roman-swords-discovered-in-a-dead-sea-cave-in-israel-1.6549408,neutral,0.07677149,0.020674795,0.9025538,0.005466409977026743
CTV,2023-09-06,New Brunswick farm's corn maze memorializes Canadian music legends,https://atlantic.ctvnews.ca/new-brunswick-farm-s-corn-maze-memorializes-canadian-music-legends-1.6549138,positive,0.6048283,0.00381788,0.3913537,0.36580278370344743
CTV,2023-09-06,Beyonce got a birthday serenade from Diana Ross,https://www.ctvnews.ca/entertainment/beyonce-got-a-birthday-serenade-from-diana-ross-1.6548249,positive,0.35106772,0.011745956,0.6371863,0.12311058786806228
CTV,2023-09-06,'Just disgusting': Travellers kicked off Air Canada plane after speaking up about vomit-soiled seats,https://montreal.ctvnews.ca/just-disgusting-travellers-kicked-off-air-canada-plane-after-speaking-up-about-vomit-soiled-seats-1.6547493,negative,0.004186536,0.919315,0.076498464,-0.8451225474191411
CTV,2023-09-06,More than 20 wildfires burning out of control on Vancouver Island,https://vancouverisland.ctvnews.ca/more-than-20-wildfires-burning-out-of-control-on-vancouver-island-1.6548406,negative,0.013496124,0.76442593,0.2220779,-0.5841649076142517
CTV,2023-09-06,New 500-bed residence at University of Waterloo to prioritize Indigenous design principles,https://kitchener.ctvnews.ca/new-500-bed-residence-at-university-of-waterloo-to-prioritize-indigenous-design-principles-1.6548113,neutral,0.12368945,0.013808832,0.8625017,0.01510840038532324
CTV,2023-09-06,Any Canadians at Burning Man 2023? We want to hear from you,https://www.ctvnews.ca/canada/any-canadians-at-burning-man-2023-we-want-to-hear-from-you-1.6548216,positive,0.22620001,0.022220653,0.7515794,0.05067267373023476
CTV,2023-09-06,Winnipeg man arrested for string of downtown assaults,https://winnipeg.ctvnews.ca/winnipeg-man-arrested-for-string-of-downtown-assaults-1.6549608,negative,0.009951817,0.70987546,0.28017262,-0.5038241986725289
CTV,2023-09-06,'They're terribly ill': 56 E. coli cases now linked to outbreak at Calgary daycares,https://calgary.ctvnews.ca/they-re-terribly-ill-56-e-coli-cases-now-linked-to-outbreak-at-calgary-daycares-1.6547638,negative,0.0058499277,0.8784423,0.11570779,-0.7716265978627712
CTV,2023-09-06,Investigator called to east Windsor fire,https://windsor.ctvnews.ca/investigator-called-to-east-windsor-fire-1.6549675,neutral,0.06706713,0.18856044,0.74437237,-0.03105704708886492
CTV,2023-09-06,No kidding! OPP seek owner of goats that chased jogger in eastern Ontario,https://ottawa.ctvnews.ca/no-kidding-opp-seek-owner-of-goats-that-chased-jogger-in-eastern-ontario-1.6547249,negative,0.04688599,0.517179,0.4359349,-0.2652758760895857
CTV,2023-09-06,"Teen hit by projectile, believed to be from BB gun",https://london.ctvnews.ca/teen-hit-by-projectile-believed-to-be-from-bb-gun-1.6549633,negative,0.019717142,0.45763308,0.5226497,-0.20903929399583632
CTV,2023-09-06,More than one in five Canadian workers considering leaving their jobs: survey,https://www.ctvnews.ca/health/more-than-one-in-five-canadian-workers-considering-leaving-their-jobs-survey-1.6549292,negative,0.018342528,0.27634183,0.7053157,-0.07602834105149725
CTV,2023-09-06,"Raptors tickets, golf games and a $1M payday for Greenbelt land. Who is Mr. X?",https://toronto.ctvnews.ca/raptors-tickets-golf-games-and-a-1m-payday-for-greenbelt-land-who-is-mr-x-1.6543896,neutral,0.2191489,0.017438695,0.76341236,0.04772214310133727
CTV,2023-09-06,Alberta's 'war room' is back with massive ad spend revealed in annual report,https://edmonton.ctvnews.ca/alberta-s-war-room-is-back-with-massive-ad-spend-revealed-in-annual-report-1.6549526,neutral,0.15533645,0.15043703,0.6942265,0.0014981150153836609
CTV,2023-09-06,Calgary police chief says Falconridge clash was 'largest violent event' in recent memory,https://calgary.ctvnews.ca/calgary-police-chief-says-falconridge-clash-was-largest-violent-event-in-recent-memory-1.6548998,negative,0.012701581,0.53946865,0.4478297,-0.29086513726157115
CTV,2023-09-06,Ottawa police to provide update on double-homicide outside wedding,https://ottawa.ctvnews.ca/ottawa-police-to-provide-update-on-double-homicide-outside-wedding-1.6549591,neutral,0.014398599,0.17755356,0.8080478,-0.03131795810867288
CTV,2023-09-06,Cape Breton teen to represent Canada at World Cup of Darts in Denmark,https://atlantic.ctvnews.ca/cape-breton-teen-to-represent-canada-at-world-cup-of-darts-in-denmark-1.6546488,neutral,0.099511765,0.0076710903,0.89281714,0.009843746455655555
CTV,2023-09-06,Burning Man: Montreal woman among 70K mired in mud at desert event,https://montreal.ctvnews.ca/burning-man-montreal-woman-among-70k-mired-in-mud-at-desert-event-1.6548705,negative,0.010120666,0.7170374,0.27284205,-0.5140400913123386
CTV,2023-09-06,Winnipeg Water Treatment Plant damaged by excavator: Man arrested,https://winnipeg.ctvnews.ca/winnipeg-water-treatment-plant-damaged-by-excavator-man-arrested-1.6548739,negative,0.009357715,0.63914084,0.35150144,-0.40841347130184147
CTV,2023-09-06,The U.S. sent cluster munitions to Ukraine but activists still seek to bolster a treaty banning them,https://www.ctvnews.ca/world/the-u-s-sent-cluster-munitions-to-ukraine-but-activists-still-seek-to-bolster-a-treaty-banning-them-1.6547977,negative,0.008915177,0.6551272,0.33595753,-0.4291122419352291
CTV,2023-09-06,Pickup truck with items not properly secured 'could have killed someone:' OPP,https://barrie.ctvnews.ca/pickup-truck-with-items-not-properly-secured-could-have-killed-someone-opp-1.6549011,negative,0.005572891,0.8742626,0.12016473,-0.7643037985595198
CTV,2023-09-06,"Three stabbed teens were driven from a party to a nearby hospital, only to find that the ER was closed. Their story is one of many",https://www.ctvnews.ca/health/three-stabbed-teens-were-driven-from-a-party-to-a-nearby-hospital-only-to-find-that-the-er-was-closed-their-story-is-one-of-many-1.6545043,negative,0.0061136405,0.78902423,0.20486216,-0.6225218298563995
CTV,2023-09-06,Newly-minted Ontario housing minister set to face questions over Greenbelt review,https://toronto.ctvnews.ca/newly-minted-ontario-housing-minister-set-to-face-questions-over-greenbelt-review-1.6549444,neutral,0.016408939,0.054109428,0.9294816,-0.0026585772115108597
CTV,2023-09-06,"Police investigating after elderly man struck and killed in Toronto parking lot, woman critically injured",https://toronto.ctvnews.ca/police-investigating-after-elderly-man-struck-and-killed-in-toronto-parking-lot-woman-critically-injured-1.6549602,negative,0.011170592,0.66002333,0.3288062,-0.43550595875345444
