source,date,headline,url,chosen_label,positive,negative,neutral,compound
CTV,2023-11-04,Proposed class action lawsuit alleges Ozempic maker failed to disclose serious side effects,https://www.ctvnews.ca/health/proposed-class-action-lawsuit-alleges-ozempic-maker-failed-to-disclose-serious-side-effects-1.6629998,negative,0.009252864,0.7758366,0.21491061,-0.6018367602211301
CTV,2023-11-04,MP George Chahal hosting second annual job fair at Genesis Centre,https://calgary.ctvnews.ca/mp-george-chahal-hosting-second-annual-job-fair-at-genesis-centre-1.6631320,neutral,0.16806933,0.0060595796,0.8258711,0.028210577217731014
CTV,2023-11-04,Tens of thousands of ancient coins have been found off Sardinia. They may be spoils of a shipwreck,https://www.ctvnews.ca/world/tens-of-thousands-of-ancient-coins-have-been-found-off-sardinia-they-may-be-spoils-of-a-shipwreck-1.6631394,negative,0.02244546,0.53853124,0.43902323,-0.2895121489017267
CTV,2023-11-04,"'We will enjoy this together': Birthday lottery ticket wins Belle River man $100,000",https://windsor.ctvnews.ca/we-will-enjoy-this-together-birthday-lottery-ticket-wins-belle-river-man-100-000-1.6631317,positive,0.9562805,0.0018725393,0.04184699,0.9144688878075868
CTV,2023-11-04,Pre-trial hearings for Coutts protesters adjourned to December 11,https://calgary.ctvnews.ca/pre-trial-hearings-for-coutts-protesters-adjourned-to-december-11-1.6631361,negative,0.012380341,0.24116932,0.7464503,-0.058009374048268114
CTV,2023-11-04,Ukraine minister says he wants to turn his country into a weapons production hub for the West,https://www.ctvnews.ca/world/ukraine-minister-says-he-wants-to-turn-his-country-into-a-weapons-production-hub-for-the-west-1.6631220,neutral,0.048012618,0.1293556,0.8226318,-0.014427659917504165
CTV,2023-11-04,"65,000 Quebec teachers to launch indefinite strike Nov. 23",https://montreal.ctvnews.ca/65-000-quebec-teachers-to-launch-indefinite-strike-nov-23-1.6629468,negative,0.013860354,0.40574425,0.58039546,-0.1644362676135671
CTV,2023-11-04,Deer with arrow stuck in its side wandering Greater Victoria: conservation officers,https://bc.ctvnews.ca/deer-with-arrow-stuck-in-its-side-wandering-greater-victoria-conservation-officers-1.6627264,negative,0.013459256,0.35306036,0.6334804,-0.1244704490760924
CTV,2023-11-04,Eastern Ontario man taken to hospital following tarantula-involved collision,https://ottawa.ctvnews.ca/eastern-ontario-man-taken-to-hospital-following-tarantula-involved-collision-1.6630146,negative,0.016984928,0.43668932,0.54632574,-0.19040907160729503
CTV,2023-11-04,Fatal single-vehicle crash closes Highway 101 in west Timmins,https://northernontario.ctvnews.ca/fatal-single-vehicle-crash-closes-highway-101-in-west-timmins-1.6631259,negative,0.011349821,0.74312097,0.24552915,-0.5521000211171465
CTV,2023-11-04,"'Liberals fight for every seat that we get,' Alberta minister says following backlash to Hutchings' carbon policy comments",https://www.ctvnews.ca/politics/liberals-fight-for-every-seat-that-we-get-alberta-minister-says-following-backlash-to-hutchings-carbon-policy-comments-1.6631363,neutral,0.077967934,0.031517196,0.89051497,0.005085660436632278
CTV,2023-11-04,Pressure on Premier Danielle Smith to keep Alberta in CPP,https://www.ctvnews.ca/video?playlistId=1.6607610,neutral,0.052815627,0.02520124,0.9219832,0.00215438657355016
CTV,2023-11-04,Alberta would need to negotiate international agreements if it quits CPP: Freeland,https://www.ctvnews.ca/politics/alberta-would-need-to-negotiate-international-agreements-if-it-quits-cpp-freeland-1.6629658,neutral,0.025132636,0.10419222,0.87067527,-0.01022435993708637
CTV,2023-11-04,U.S. says a 'ceasefire would allow Hamas to regroup',https://www.ctvnews.ca/video?playlistId=1.6595387,neutral,0.033166997,0.14234193,0.82449096,-0.019161186597253188
CTV,2023-11-04,"Air Canada admits it violated disability regulations, apologizes to B.C. man",https://bc.ctvnews.ca/air-canada-admits-it-violated-disability-regulations-apologizes-to-b-c-man-1.6630775,negative,0.023047261,0.40871415,0.56823856,-0.1665160875815186
CTV,2023-11-04,Vast digital trove of recordings by Canadian literature greats nears completion,https://www.ctvnews.ca/entertainment/vast-digital-trove-of-recordings-by-canadian-literature-greats-nears-completion-1.6631347,positive,0.68229365,0.0043027145,0.31340373,0.4655060351950624
CTV,2023-11-04,"Supporters celebrate opening of Gay Games in Hong Kong, first in Asia, despite lawmakers' opposition",https://www.ctvnews.ca/sports/supporters-celebrate-opening-of-gay-games-in-hong-kong-first-in-asia-despite-lawmakers-opposition-1.6631261,positive,0.84036076,0.0030802002,0.15655902,0.7061967454926528
CTV,2023-11-04,Thousands attend Pro-Palestinian rally at U.S. consulate in Toronto,https://toronto.ctvnews.ca/thousands-attend-pro-palestinian-rally-at-u-s-consulate-in-toronto-1.6631388,neutral,0.040328372,0.13113655,0.8285352,-0.015570407004499742
CTV,2023-11-04,"Israeli rescuers release aftermath video of Hamas attack on music festival, adding chilling details",https://www.ctvnews.ca/world/israeli-rescuers-release-aftermath-video-of-hamas-attack-on-music-festival-adding-chilling-details-1.6631423,negative,0.012699763,0.50786126,0.47943896,-0.25776178698428076
CTV,2023-11-04,Poilievre supportive of Saskatchewan's renewed push against carbon tax,https://regina.ctvnews.ca/poilievre-supportive-of-saskatchewan-s-renewed-push-against-carbon-tax-1.6630758,neutral,0.21314278,0.019338904,0.76751834,0.04505584665662532
CTV,2023-11-04,N.B. woman raising awareness about the dangers of radon gas after terminal lung cancer diagnosis,https://atlantic.ctvnews.ca/more/n-b-woman-raising-awareness-about-the-dangers-of-radon-gas-after-terminal-lung-cancer-diagnosis-1.6627224,negative,0.022033742,0.4618803,0.516086,-0.21284790897398764
CTV,2023-11-04,Memorial for Making Treaty 7 founding member Troy Emery Twigg to be held Saturday at Fort Calgary,https://calgary.ctvnews.ca/memorial-for-making-treaty-7-founding-member-troy-emery-twigg-to-be-held-saturday-at-fort-calgary-1.6631371,neutral,0.058844198,0.009485614,0.9316701,0.0033726656617916184
CTV,2023-11-04,Fatal collision claims life of 18-year-old,https://london.ctvnews.ca/fatal-collision-claims-life-of-18-year-old-1.6631297,negative,0.012063423,0.80905026,0.1788864,-0.6544167165955805
CTV,2023-11-04,Palestinians report deadly Israeli airstrikes including in southern Gaza,https://www.ctvnews.ca/world/palestinians-report-deadly-israeli-airstrikes-including-in-southern-gaza-1.6631252,negative,0.005405879,0.87053895,0.124055006,-0.7578089620920228
CTV,2023-11-04,A young race car driver from Canada is inspiring people all around the world,https://www.ctvnews.ca/w5/a-young-race-car-driver-from-canada-is-inspiring-people-all-around-the-world-1.6629956,positive,0.9637036,0.0030413314,0.033255033,0.9287153908787955
CTV,2023-11-04,"Police investigating serious crash in Tiny, Ont.",https://barrie.ctvnews.ca/police-investigating-serious-crash-in-tiny-ont-1.6631345,negative,0.022660498,0.32048315,0.6568564,-0.10219593248162795
CTV,2023-11-04,'Take your job seriously': Employment Minister tells Alberta to stick with Canada Pension Plan,https://www.ctvnews.ca/politics/take-your-job-seriously-employment-minister-tells-alberta-to-stick-with-canada-pension-plan-1.6631128,neutral,0.16873156,0.018165689,0.8131027,0.028140349864770542
CTV,2023-11-04,"Olympic skier speaks out against illegal fishing, finds salmon carcass in his mailbox",https://montreal.ctvnews.ca/olympic-skier-speaks-out-against-illegal-fishing-finds-salmon-carcass-in-his-mailbox-1.6625000,negative,0.019806156,0.50891787,0.47127593,-0.25860514221880493
CTV,2023-11-04,Tupac Shakur has an Oakland street named for him 27 years after his death,https://www.ctvnews.ca/entertainment/tupac-shakur-has-an-oakland-street-named-for-him-27-years-after-his-death-1.6631372,neutral,0.18028037,0.052227788,0.76749176,0.029773283130673178
CTV,2023-11-04,"Canadians still not cleared to leave Gaza, Blair says movement likely in coming days",https://www.ctvnews.ca/politics/canadians-still-not-cleared-to-leave-gaza-blair-says-movement-likely-in-coming-days-1.6629626,negative,0.0089067165,0.5170064,0.47408685,-0.26721630023918763
CTV,2023-11-04,U.K.'s Sunak to discuss AI risks with Kamala Harris at summit before chat with Elon Musk,https://www.ctvnews.ca/sci-tech/u-k-s-sunak-to-discuss-ai-risks-with-kamala-harris-at-summit-before-chat-with-elon-musk-1.6627986,neutral,0.040284917,0.018289143,0.9414261,0.0012883782760583218
CTV,2023-11-04,How the Grinch stole copper: N.B. nursing home fundraiser festival robbed,https://atlantic.ctvnews.ca/more/how-the-grinch-stole-copper-n-b-nursing-home-fundraiser-festival-robbed-1.6628881,negative,0.012992615,0.58208066,0.40492678,-0.33864905525908284
CTV,2023-11-04,Displaced CNN journalist and family leave Gaza for Egypt,https://www.ctvnews.ca/video?playlistId=1.6595428,negative,0.012079927,0.58329046,0.40462953,-0.3400818668282497
CTV,2023-11-04,"Hundreds of Canadians, their families could leave Gaza 'as early as Sunday': Global Affairs email",https://www.ctvnews.ca/politics/hundreds-of-canadians-their-families-could-leave-gaza-as-early-as-sunday-global-affairs-email-1.6630699,negative,0.016889965,0.3024683,0.6806417,-0.09120181020015572
CTV,2023-11-04,'The most Edmonton experience I've ever had': Hundreds of transit lovers show up to ride first Valley Line train,https://edmonton.ctvnews.ca/the-most-edmonton-experience-i-ve-ever-had-hundreds-of-transit-lovers-show-up-to-ride-first-valley-line-train-1.6631286,positive,0.9278238,0.0025336167,0.0696426,0.8608505511807287
CTV,2023-11-04,Murderer dies in B.C. prison amid overdose prevention debate,https://bc.ctvnews.ca/murderer-dies-in-b-c-prison-amid-overdose-prevention-debate-1.6631152,negative,0.0067621837,0.76632345,0.22691442,-0.5872058417413983
CTV,2023-11-04,Jaguar Land Rover parts shortage impact could be present until 2024,https://www.ctvnews.ca/autos/jaguar-land-rover-parts-shortage-impact-could-be-present-until-2024-1.6630947,negative,0.018616082,0.61454225,0.36684167,-0.3773156135074913
CTV,2023-11-04,B.C. conditions are magic for mushrooms in bumper season for fungi,https://bc.ctvnews.ca/b-c-conditions-are-magic-for-mushrooms-in-bumper-season-for-fungi-1.6631391,positive,0.87044907,0.0044453726,0.12510557,0.7576618025279211
CBC,2023-11-04,Liberals go online to test messages attacking Poilievre's record,https://www.cbc.ca/news/politics/liberal-testing-videos-targeting-conservative-leader-1.7018171,negative,0.022049643,0.27600265,0.70194775,-0.07569126631825718
CBC,2023-11-04,Why so much recycled clothing is still going in the garbage,https://www.cbc.ca/news/business/marketplace-recycled-clothing-garbage-1.7009225,negative,0.010084507,0.82143766,0.16847782,-0.6746581388907584
CBC,2023-11-04,"UCP general meeting kicks off in Calgary with high turnout, questions of unity",https://www.cbc.ca/news/canada/calgary/united-conservative-party-annual-general-meeting-bmo-centre-1.7018740,neutral,0.19705251,0.023600219,0.77934724,0.038272725895764026
CBC,2023-11-04,"The bombshell moments in Cameron Ortis's national security trial, so far",https://www.cbc.ca/news/politics/ortis-top-moments-so-far-1.7015408,neutral,0.09805275,0.23648264,0.6654647,-0.046309681583622364
CBC,2023-11-04,Halifax campground to stay open all winter for people living in RVs amid housing crisis,https://www.cbc.ca/news/canada/nova-scotia/halifax-campground-open-all-winter-for-people-living-in-rvs-1.7018133,neutral,0.039742716,0.053139035,0.90711826,-0.0012442734069659789
CBC,2023-11-04,WATCH: CBC News Network,https://www.cbc.cahttps://gem.cbc.ca/benefits-premium?cmp=DM_NewsTile_Gem_PremiumNN,neutral,0.10073908,0.018231502,0.88102955,0.00981596340483426
CBC,2023-11-04,How Gaza's refugee camps became targets in Israel's war with Hamas,https://www.cbc.ca/news/world/gaza-refugee-camps-israel-hamas-war-1.7018274,negative,0.010208938,0.6215008,0.36829028,-0.3861589909477825
CBC,2023-11-04,Israeli military announces brief window for Gaza residents trapped by fighting to flee south,https://www.cbc.ca/news/world/israel-hamas-gaza-day-29-1.7018816,neutral,0.018714659,0.21209876,0.76918656,-0.044635652592464936
CBC,2023-11-04,Why you can't tap to pay on Montreal public transit,https://www.cbc.ca/player/play/2279431747781,negative,0.020559307,0.41837448,0.5610662,-0.1746145192601638
CBC,2023-11-04,My dad's blood sugar tells me a lot as a med student. But there's a story behind that number,https://www.cbc.ca/news/canada/my-dad-s-blood-sugar-tells-me-a-lot-as-a-med-student-but-there-s-a-story-behind-that-number-1.7017268,neutral,0.072864234,0.092716895,0.83441883,-0.003287226704524304
CBC,2023-11-04,Daylight time ends for much of Canada this weekend,https://www.cbc.ca/news/canada/canada-daylight-time-region-changes-2023-1.7018844,neutral,0.047386043,0.01678058,0.9358334,0.001963848689586878
CBC,2023-11-04,'Sponge cities': An absorbing idea in the face of climate change,https://www.cbc.ca/news/climate/sponge-cities-montreal-canada-china-1.7013728,positive,0.35773215,0.03243215,0.6098356,0.12692047443093202
CBC,2023-11-04,"Photographer handcuffed, fined after taking pictures of Quebec City's iconic Château Frontenac",https://www.cbc.ca/news/canada/montreal/photographer-handcuffed-near-chateau-frontenac-1.7018543,negative,0.028734915,0.45166788,0.51959723,-0.20317816098329722
CBC,2023-11-04,"The U.S. economy is on a 'sugar rush,' while Canada's is souring",https://www.cbc.ca/news/business/armstrong-economy-us-canada-stimulus-interest-rate-1.7016698,negative,0.037373096,0.4688614,0.49376553,-0.21843425227836555
CBC,2023-11-04,Half an hour later in Newfoundland: The origin of Canada's 30-minute time zone,https://www.cbc.ca/news/canada/newfoundland-labrador/newfoundland-half-hour-time-zone-1.7001193,neutral,0.030312099,0.009447015,0.9602407,0.0008295806313896037
CBC,2023-11-04,Go beyond the headlines | Stream CBC News Explore,https://www.cbc.cahttps://www.cbc.ca/news/cbc-news-explore-1.6512577,neutral,0.09185704,0.0112939505,0.89684886,0.008310174861161368
CBC,2023-11-04,This car was stolen from a driveway in Canada. We found it in West Africa,https://www.cbc.ca/news/world/auto-theft-canada-1.6953242,negative,0.012415422,0.49483937,0.4927452,-0.24471187434463992
CBC,2023-11-04,"Space mining is getting closer to becoming a reality, and Canada could play a major role",https://www.cbc.ca/news/science/space-mining-1.7012869,positive,0.7299416,0.007282013,0.26277637,0.5327617211355573
CBC,2023-11-04,Does your makeup contain 'forever chemicals'?,https://www.cbc.ca/news/business/marketplace-makeup-pfas-forever-chemicals-1.7016203,negative,0.024467673,0.352957,0.6225752,-0.1239800132555775
CBC,2023-11-04,Canada's best beer winner is brewed by a pair of bat biologists in northern B.C.,https://www.cbc.ca/news/canada/british-columbia/prince-george-gold-beer-deadfall-1.7018135,positive,0.80122197,0.003705696,0.19507226,0.6419429792287783
CBC,2023-11-04,How Marketplace caught tech repair technicians snooping,https://www.cbc.ca/player/play/2275172419897,neutral,0.04390801,0.22210369,0.73398817,-0.047402157079050156
CBC,2023-11-04,"At least 128 killed, dozens injured after earthquake rocks northwestern Nepal",https://www.cbc.ca/news/world/nepal-earthquake-1.7018563,negative,0.00848034,0.80206424,0.18945538,-0.6432351402019805
CBC,2023-11-04,IN PHOTOS | This week's most compelling Canadian images,https://www.cbc.ca/news/world/photos/in-photos-this-week-s-most-compelling-canadian-images-1.7013939,positive,0.6136785,0.0044785333,0.38184288,0.3765813170976884
CBC,2023-11-04,Underdog curling nations take unlikely paths to Pan Continental championships,https://www.cbc.ca/news/canada/british-columbia/underdog-curling-nations-take-unlikely-paths-to-championships-1.7018355,neutral,0.026238693,0.16495726,0.80880404,-0.026522428981330393
CBC,2023-11-04,How made-in-Ukraine 'Shark' drones are keeping a predatory watch on battlefield targets,https://www.cbc.ca/news/world/ukraine-drones-russia-war-1.7018873,negative,0.017577857,0.51022017,0.47220194,-0.260015655529255
CBC,2023-11-04,Concerns raised after RCMP rejects 86% of complaints from Fairy Creek protesters,https://www.cbc.ca/news/canada/rcmp-complaints-unit-policing-resource-protests-1.7017512,negative,0.008598874,0.6169825,0.3744185,-0.3805935615863518
CBC,2023-11-04,Montreal Canadiens doctor saw some of the game's most brutal injuries in 60-year career,https://www.cbc.ca/radio/whitecoat/montreal-canadiens-doctor-david-mulder-1.7014470,negative,0.021578498,0.75082916,0.22759224,-0.5632788726312761
CBC,2023-11-04,"Ken Mattingly, astronaut who missed Apollo 13 mission but helped bring crew home, dead at 87",https://www.cbc.ca/news/science/astronaut-ken-mattingly-obituary-1.7018912,neutral,0.042682737,0.1883309,0.7689864,-0.03364670671101688
CBC,2023-11-04,"Check out Inuksuk II, described as Canada's largest fishing vessel",https://www.cbc.ca/news/canada/newfoundland-labrador/inuksuk-ii-baffin-fisheries-1.7016089,positive,0.24156497,0.0076166578,0.7508184,0.058295623336096725
CBC,2023-11-04,Cruise ship visitors to P.E.I. have fun in surprise snowfall,https://www.cbc.ca/player/play/2278988867527,positive,0.92364633,0.0025886698,0.07376503,0.853115795112735
CBC,2023-11-04,"Worrying about AI as an 'existential' threat distracts from immediate risks, Balsillie says",https://www.cbc.ca/news/politics/jim-balsillie-artificial-intelligence-threats-1.7017897,negative,0.0181055,0.45022318,0.53167135,-0.2023730874544558
CBC,2023-11-04,How Vivek Shraya made a TV show about her failed childhood dream of becoming a pop star,https://www.cbc.ca/news/entertainment/vivek-shraya-how-to-fail-as-a-pop-star-1.7016406,negative,0.042113155,0.38104564,0.57684124,-0.14342225145764687
