source,date,headline,url,chosen_label,positive,negative,neutral,compound
Global,2023-10-04,Regina domestic violence survivor shares story to raise awareness,https://globalnews.ca/news/10005354/regina-domestic-violence-survivor-awareness/,neutral,0.0318851,0.13427304,0.833842,-0.017012576589545247
Global,2023-10-04,Family of Alberta fatal bear attack victims shares memories,https://globalnews.ca/video/10006134/family-of-alberta-fatal-bear-attack-victims-shares-memories/,negative,0.02319855,0.34863162,0.62816983,-0.12100583425853628
Global,2023-10-04,Ombudsperson report reveals need for change for B.C.’s emergency support programs,https://globalnews.ca/news/10006149/ombudsperson-report-bc-emergency-support-programs/,neutral,0.038335893,0.112192,0.8494722,-0.011117394490656629
Global,2023-10-04,Airdrie residents devastated by near-drowning of 4-year-old child,https://globalnews.ca/video/10006124/airdrie-residents-devastated-by-near-drowning-of-4-year-old-child/,negative,0.009163468,0.82750225,0.16333422,-0.6846760794120765
Global,2023-10-04,Girl abducted on family camping trip found ‘safe’ thanks to fingerprint on ransom note,https://globalnews.ca/video/10001840/girl-abducted-on-family-camping-trip-found-safe-thanks-to-fingerprint-on-ransom-note/,neutral,0.16913816,0.02388828,0.8069736,0.02803706644585624
Global,2023-10-04,Kelowna project aimed at helping first time home buyers has official groundbreaking,https://globalnews.ca/news/10005941/kelowna-project-youth-home-ownership-groundbreaking/,positive,0.3590066,0.008996486,0.63199687,0.12880482219051004
Global,2023-10-04,"Hot, dry conditions ideal for boxelder bug infestations",https://globalnews.ca/news/10005843/hot-dry-conditions-boxelder-bug-infestation/,positive,0.31709632,0.07402257,0.6088812,0.09507072384588255
Global,2023-10-04,"Voter turnout in Manitoba’s 2023 election on par with previous years, says expert",https://globalnews.ca/news/10005429/voter-turnout-manitoba-election-2023-expert/,neutral,0.10207197,0.013893915,0.88403416,0.010225642325721651
Global,2023-10-04,What Canada can learn from the U.K.’s pricey high-speed rail project,https://globalnews.ca/video/10006240/what-canada-can-learn-from-the-u-k-s-pricey-high-speed-rail-project/,neutral,0.07788406,0.06335287,0.85876304,0.0020523418429938545
Global,2023-10-04,"Cost of RSV vaccine a barrier to older Canadians amid respiratory season, experts warn",https://globalnews.ca/video/10004563/cost-of-rsv-vaccine-a-barrier-to-older-canadians-amid-respiratory-season-experts-warn/,negative,0.017155264,0.43013307,0.5527116,-0.18472018347272012
Global,2023-10-04,RSV vaccine for older Canadians comes at a cost. Why experts are worried,https://globalnews.ca/news/10001009/rsv-vaccine-cost-older-canadians-cost/,negative,0.014204031,0.60749537,0.37830058,-0.3688488849144047
Global,2023-10-04,25 years after implosion Calgary woman wants commemorative park for General Hospital,https://globalnews.ca/video/10006099/25-years-after-implosion-calgary-woman-wants-commemorative-park-for-general-hospital/,neutral,0.04339897,0.14903842,0.8075626,-0.020328982237790783
Global,2023-10-04,New $2B Alberta KAPS pipeline begins operation,https://globalnews.ca/video/10006151/new-2b-alberta-kaps-pipeline-begins-operation/,neutral,0.1664161,0.01586891,0.817715,0.02744249371455787
Global,2023-10-04,"With no permanent location in sight, sleeping cabins return to Portsmouth Olympic Harbour",https://globalnews.ca/news/10005810/sight-sleeping-cabins-return-portsmouth-olympic-harbour/,neutral,0.01952542,0.16321506,0.81725955,-0.026257908074398983
Global,2023-10-04,McDougall Creek wildfire: Order lifted restricting access to backcountry,https://globalnews.ca/news/10005988/mcdougall-creek-wildfire-area-restriction-order-lifted/,negative,0.012497686,0.3723123,0.61519015,-0.13846020825569738
Global,2023-10-04,Historic Manitoba election of Wab Kninew inspires Indigenous Albertans,https://globalnews.ca/video/10006217/historic-manitoba-election-of-wab-kninew-inspires-indigenous-albertans/,positive,0.5564603,0.008048428,0.43549126,0.30958331180430676
Global,2023-10-04,"Grimes sues Elon Musk, claims he won’t let her ‘see my son’",https://globalnews.ca/news/10001647/grimes-sues-elon-musk-parental-rights/,negative,0.018423405,0.47543013,0.50614643,-0.2256944010708537
Global,2023-10-04,Manitoba election results: Live numbers from the 2023 vote,https://globalnews.ca/news/9971242/manitoba-election-live-results-numbers-2023-vote/,neutral,0.02954977,0.028166376,0.94228387,7.984414978778887e-05
Global,2023-10-04,"Canadians are facing a ‘financial storm,’ and experts say it’s time to plan ahead",https://globalnews.ca/news/10001501/canadians-financial-stress-money/,neutral,0.04774095,0.14795266,0.8043064,-0.019610791453171572
Global,2023-10-04,"Penticton, B.C.’s largest housing project moving forward",https://globalnews.ca/news/10006156/penticton-largest-housing-project-moving-forward/,positive,0.33592233,0.0038544533,0.6602232,0.11282896529188413
Global,2023-10-04,Slain B.C. Mountie had his ‘dream job’ with RCMP,https://globalnews.ca/video/10006242/slain-b-c-mountie-had-his-dream-job-with-rcmp/,neutral,0.11360016,0.07240567,0.81399405,0.007662419062741677
Global,2023-10-04,Thousands gather to honour fallen RCMP officer Const. Rick O’Brien,https://globalnews.ca/video/10006250/thousands-gather-to-honour-fallen-rcmp-officer-const-rick-obrien/,positive,0.2682247,0.044100042,0.6876753,0.06999966163534488
Global,2023-10-04,Canadian oil output to hit new heights within 2 years: report,https://globalnews.ca/news/10005868/canadian-oil-output-high-2025/,positive,0.41706395,0.010653409,0.5722826,0.17382885667882597
Global,2023-10-04,‘Bear attack bad’: Harrowing final message from Alberta couple killed by grizzly,https://globalnews.ca/news/10005074/bear-attack-bad-harrowing-final-message-from-alberta-couple-killed-by-grizzly/,negative,0.00441024,0.8787221,0.116867505,-0.7721331655435497
Global,2023-10-04,"Missing girl, 9, found thanks to kidnapper’s fingerprint on ransom note",https://globalnews.ca/news/10001048/missing-girl-charlotte-sena-found-ransom-note-fingerprint-craig-nelson-ross/,negative,0.030947201,0.23924941,0.7298033,-0.05628256205336868
Global,2023-10-04,Global News Hour at 6 Calgary: Oct. 4,https://globalnews.ca/video/10006227/global-news-hour-at-6-calgary-oct-4-3/,neutral,0.035840943,0.010502491,0.9536565,0.001174272700984469
Global,2023-10-04,Calgary’s Michael Myers arrested for failing to register as a sex offender,https://globalnews.ca/video/10006127/calgarys-michael-myers-arrested-for-failing-to-register-as-a-sex-offender/,negative,0.0110971,0.5685632,0.42033967,-0.3231410099898291
Global,2023-10-04,80 million-year-old marine reptile to become B.C.’s fossil emblem,https://globalnews.ca/news/10005962/bc-fossil-emblem-lana-popham/,neutral,0.08835261,0.0847298,0.8269176,0.000627045558093009
Global,2023-10-04,Sisters in Spirit Walk honours Missing and Murdered Indigenous Women in Regina,https://globalnews.ca/news/10006061/sisters-in-spirit-walk-missing-and-murdered-indigenous-women-regina/,negative,0.025514642,0.3872795,0.58720565,-0.14933449825189626
Global,2023-10-04,"Canadians are facing a ‘financial storm,’ and experts say it’s time to plan ahead",https://globalnews.ca/video/10002873/canadians-are-facing-a-financial-storm-what-some-experts-say-could-help/,neutral,0.04774095,0.14795266,0.8043064,-0.019610791453171572
Global,2023-10-04,"Murders of Indigenous women, girls far likelier but result in lower charges: report",https://globalnews.ca/news/10005800/mmiwg-homicide-rates-indigenous-women-girls/,negative,0.008355464,0.690767,0.30087754,-0.47708924171037026
Global,2023-10-04,"RSV vaccine cost significant barrier to older Canadians despite availability, experts say",https://globalnews.ca/video/10005456/rsv-vaccine-cost-significant-barrier-to-older-canadians-despite-availability-experts-say/,negative,0.017930003,0.49181682,0.49025315,-0.2415623123564341
Global,2023-10-04,Poll finds grizzly hunt ban supported by most in B.C.,https://globalnews.ca/video/10006264/poll-finds-grizzly-hunt-ban-supported-by-most-in-b-c/,neutral,0.18326007,0.019499319,0.7972406,0.033204029276244995
Global,2023-10-04,Kevin McCarthy kicked out as U.S. House speaker,https://globalnews.ca/video/10003376/kevin-mccarthy-kicked-out-as-u-s-house-speaker/,negative,0.013124351,0.7037954,0.2830803,-0.49515565861448074
Global,2023-10-04,Family describes night Alberta couple was killed by bear in Banff National Park,https://globalnews.ca/video/10005924/family-describes-night-alberta-couple-was-killed-by-bear-in-banff-national-park/,negative,0.010345494,0.64736533,0.34228915,-0.41897484286715425
Global,2023-10-04,Calgary’s hot dry summer created perfect conditions for boxelder bugs,https://globalnews.ca/video/10006102/calgarys-hot-dry-summer-created-perfect-conditions-for-boxelder-bugs/,positive,0.33952326,0.08121319,0.57926357,0.10868046124934949
CTV,2023-10-04,Canadian public libraries played an important role during the pandemic: report,https://www.ctvnews.ca/canada/canadian-public-libraries-played-an-important-role-during-the-pandemic-report-1.6589164,positive,0.68713444,0.0073299143,0.30553573,0.4720999360407738
CTV,2023-10-04,More than half of young Canadians say relationship status affected their mental health post-pandemic,https://www.ctvnews.ca/lifestyle/more-than-half-of-young-canadians-say-relationship-status-affected-their-mental-health-post-pandemic-1.6587164,negative,0.016503436,0.5945665,0.38893008,-0.3532369530710895
CTV,2023-10-04,Does your child have head lice? How to get rid of it for good,https://www.ctvnews.ca/lifestyle/does-your-child-have-head-lice-how-to-get-rid-of-it-for-good-1.6588601,negative,0.024465641,0.56663114,0.40890324,-0.32047228033187025
CTV,2023-10-04,Indigenous guardians train to protect B.C.'s coastal ecosystems,https://vancouverisland.ctvnews.ca/indigenous-guardians-train-to-protect-b-c-s-coastal-ecosystems-1.6589105,neutral,0.14312588,0.012597977,0.84427613,0.02032630949771086
CTV,2023-10-04,13 charged after investigation into 'grandparent scam' targeting seniors in the U.S.,https://montreal.ctvnews.ca/13-charged-after-investigation-into-grandparent-scam-targeting-seniors-in-the-u-s-1.6588109,negative,0.00855209,0.6951375,0.2963104,-0.483143027451689
CTV,2023-10-04,"Temperature hits 29 degrees in Montreal, breaks record",https://montreal.ctvnews.ca/temperature-hits-29-degrees-in-montreal-breaks-record-1.6589040,neutral,0.13413942,0.034293223,0.83156717,0.016817378064546418
CTV,2023-10-04,Why a B.C. city ended its decades-long ban on tattoo shops,https://bc.ctvnews.ca/why-a-b-c-city-ended-its-decades-long-ban-on-tattoo-shops-1.6582469,negative,0.02064882,0.36441752,0.6149337,-0.13237373744303227
CTV,2023-10-04,Suspects wanted for pouring gasoline on driveway and damaging cars at Barrie home,https://barrie.ctvnews.ca/suspects-wanted-for-pouring-gasoline-on-driveway-and-damaging-cars-at-barrie-home-1.6588675,negative,0.008389494,0.7535759,0.23803437,-0.5678064632091235
CTV,2023-10-04,"Google packs more artificial intelligence into new Pixel phones, raises prices for devices by US$100",https://www.ctvnews.ca/business/google-packs-more-artificial-intelligence-into-new-pixel-phones-raises-prices-for-devices-by-us-100-1.6588790,neutral,0.20418158,0.07478266,0.7210356,0.036097689937836464
CTV,2023-10-04,'I am a white nationalist': accused in fatal truck attack in London penned his own manifesto,https://windsor.ctvnews.ca/i-am-a-white-nationalist-accused-in-fatal-truck-attack-in-london-penned-his-own-manifesto-1.6588573,negative,0.0075148023,0.78180385,0.2106814,-0.6111607708040312
CTV,2023-10-04,'Don’t foresee large mandatory restrictions': MLHU provides fall preview with increasing COVID cases,https://london.ctvnews.ca/don-t-foresee-large-mandatory-restrictions-mlhu-provides-fall-preview-with-increasing-covid-cases-1.6589187,neutral,0.021293035,0.22209027,0.7566168,-0.04887068179522114
CTV,2023-10-04,"Health-care workers picket outside U.S. hospitals in multiple states, kicking off 3-day strike",https://www.ctvnews.ca/world/health-care-workers-picket-outside-u-s-hospitals-in-multiple-states-kicking-off-3-day-strike-1.6589510,negative,0.029645136,0.26440066,0.7059543,-0.06902885131093583
CTV,2023-10-04,What's Kinew's plan? One-on-one with Man. premier-designate,https://www.ctvnews.ca/video?playlistId=1.6548407,neutral,0.025385158,0.03217473,0.9424402,-0.00039080625016552073
CTV,2023-10-04,'We can not continue to just warehouse our seniors in shelters': Growing homeless crisis sees more seniors with nowhere to live,https://bc.ctvnews.ca/we-can-not-continue-to-just-warehouse-our-seniors-in-shelters-growing-homeless-crisis-sees-more-seniors-with-nowhere-to-live-1.6589522,negative,0.010416547,0.7820562,0.20752719,-0.6115034375147044
CTV,2023-10-04,'Unrelenting' fast-food ads using privacy 'loopholes' to target children: study,https://www.ctvnews.ca/health/unrelenting-fast-food-ads-using-privacy-loopholes-to-target-children-study-1.6586555,negative,0.0062434194,0.79252934,0.20122734,-0.6280637115471901
CTV,2023-10-04,Toronto Blue Jays eliminated from playoffs,https://toronto.ctvnews.ca/toronto-blue-jays-eliminated-from-playoffs-1.6588058,negative,0.015460822,0.5938759,0.39066318,-0.35244958066459375
CTV,2023-10-04,Biden administration waives 26 federal laws to allow border wall construction in South Texas,https://www.ctvnews.ca/world/biden-administration-waives-26-federal-laws-to-allow-border-wall-construction-in-south-texas-1.6589299,neutral,0.056850456,0.09430062,0.84884894,-0.005660632109513841
CTV,2023-10-04,U.K. plans to raise legal smoking age each year until it applies to whole population,https://www.ctvnews.ca/health/u-k-plans-to-raise-legal-smoking-age-each-year-until-it-applies-to-whole-population-1.6588310,neutral,0.04185628,0.065303065,0.89284074,-0.0025125398891727713
CTV,2023-10-04,A woman was found trapped under a driverless car. It wasn't the first car to hit her,https://www.ctvnews.ca/autos/a-woman-was-found-trapped-under-a-driverless-car-it-wasn-t-the-first-car-to-hit-her-1.6588576,negative,0.008900276,0.6476652,0.3434344,-0.41939107575953116
CTV,2023-10-04,"Rabbits on Granville Island being trapped, euthanized amid coyote concerns",https://bc.ctvnews.ca/rabbits-on-granville-island-being-trapped-euthanized-amid-coyote-concerns-1.6580291,negative,0.01010561,0.52400136,0.46589303,-0.2744753018671986
CTV,2023-10-04,"Rail outage that stranded Via, GO Train, other passengers caused by software upgrade: CN",https://toronto.ctvnews.ca/rail-outage-that-stranded-via-go-train-other-passengers-caused-by-software-upgrade-cn-1.6588779,negative,0.008734125,0.62703687,0.3642289,-0.39309902482689196
CTV,2023-10-04,'I'm sorry': Saskatoon woman seen in FreshCo arrest video apologizes to guard,https://saskatoon.ctvnews.ca/i-m-sorry-saskatoon-woman-seen-in-freshco-arrest-video-apologizes-to-guard-1.6588881,neutral,0.049744423,0.18599209,0.7642634,-0.032118562390785144
CTV,2023-10-04,Unifor sets Oct. 9 deadline for contract talks with General Motors,https://www.ctvnews.ca/autos/unifor-sets-oct-9-deadline-for-contract-talks-with-general-motors-1.6582637,neutral,0.029673597,0.021372909,0.94895357,0.00042372050379113624
CTV,2023-10-04,"'Well done, Rick. We love you': Fallen B.C. RCMP officer remembered at regimental funeral",https://bc.ctvnews.ca/well-done-rick-we-love-you-fallen-b-c-rcmp-officer-remembered-at-regimental-funeral-1.6588730,positive,0.9011735,0.009039172,0.08978749,0.812031807889535
CTV,2023-10-04,Manitoba-made game going to New York toy fair,https://winnipeg.ctvnews.ca/manitoba-made-game-going-to-new-york-toy-fair-1.6579722,neutral,0.15838261,0.009671672,0.8319458,0.024991500861840876
CTV,2023-10-04,Trudeau spars with Poilievre over affordability in Canada,https://www.ctvnews.ca/video?playlistId=1.6588998,neutral,0.05178846,0.09315953,0.8550519,-0.00599665845908115
CTV,2023-10-04,OPP launches suspicious death investigation after woman's body is found inside Fenelon Falls home,https://barrie.ctvnews.ca/opp-launches-suspicious-death-investigation-after-woman-s-body-is-found-inside-fenelon-falls-home-1.6588522,negative,0.009364164,0.516976,0.47365987,-0.267176465148772
CTV,2023-10-04,'A very nice man': 93-year-old super fan gets one-on-one with Sidney Crosby,https://atlantic.ctvnews.ca/a-very-nice-man-93-year-old-super-fan-gets-one-on-one-with-sidney-crosby-1.6587325,positive,0.93282187,0.0036535473,0.063524626,0.8701432718477458
CTV,2023-10-04,Woman says 'system failed' her family in Collingwood man's murder case,https://barrie.ctvnews.ca/woman-says-system-failed-her-family-in-collingwood-man-s-murder-case-1.6588770,negative,0.005829995,0.84431976,0.1498502,-0.712841907177431
CTV,2023-10-04,Ottawa school bus authority appoints interim operations manager,https://ottawa.ctvnews.ca/ottawa-school-bus-authority-appoints-interim-operations-manager-1.6589035,neutral,0.024985364,0.048697557,0.9263172,-0.0017471804632300802
CTV,2023-10-04,73 year old from London dies in single-vehicle crash,https://london.ctvnews.ca/73-year-old-from-london-dies-in-single-vehicle-crash-1.6588942,negative,0.016227623,0.71322274,0.2705496,-0.5084233862674594
CTV,2023-10-04,Canada-India tensions: How we got here and what's at stake,https://www.ctvnews.ca/canada/canada-india-tensions-how-we-got-here-and-what-s-at-stake-1.6589053,negative,0.013221751,0.31322426,0.673554,-0.0979346201432385
CTV,2023-10-04,Construction set to begin on new joint-use school in north Regina,https://regina.ctvnews.ca/construction-set-to-begin-on-new-joint-use-school-in-north-regina-1.6588807,neutral,0.11385043,0.009163372,0.87698627,0.012877945922197043
CTV,2023-10-04,"Storms, firewall issues cause Manitoba election day delays",https://winnipeg.ctvnews.ca/storms-firewall-issues-cause-manitoba-election-day-delays-1.6589264,negative,0.010890021,0.727473,0.26163688,-0.5290984674480015
CTV,2023-10-04,Historic Manitoulin Island ferry being towed away for recycling,https://northernontario.ctvnews.ca/historic-manitoulin-island-ferry-being-towed-away-for-recycling-1.6588456,negative,0.03694459,0.32169974,0.64135563,-0.1021258269205525
CTV,2023-10-04,Kinew says federal role in landfill search wasn't part of conversation with PM,https://www.ctvnews.ca/politics/kinew-says-federal-role-in-landfill-search-wasn-t-part-of-conversation-with-pm-1.6589213,neutral,0.02005644,0.20616211,0.7737814,-0.042100560291409295
CTV,2023-10-04,Cloud of $20 bills causes disturbance in southeast Calgary,https://calgary.ctvnews.ca/cloud-of-20-bills-causes-disturbance-in-southeast-calgary-1.6588279,negative,0.011426611,0.57668036,0.41189304,-0.33242965551046666
CTV,2023-10-04,"Mould halts in-person visits at Newfoundland's notorious, rodent-infested jail",https://atlantic.ctvnews.ca/mould-halts-in-person-visits-at-newfoundland-s-notorious-rodent-infested-jail-1.6588071,negative,0.009123052,0.65666556,0.3342114,-0.43112643276870344
CTV,2023-10-04,Richard Nygard trial: Victim says she feared for her life,https://www.ctvnews.ca/video?playlistId=1.6557328,negative,0.009653729,0.8059503,0.18439601,-0.6494626298565214
CTV,2023-10-04,Veterans' headstones vandalized in Fredericton cemetery,https://atlantic.ctvnews.ca/veterans-headstones-vandalized-in-fredericton-cemetery-1.6588430,negative,0.0074556954,0.59611595,0.39642832,-0.35529865197574395
CTV,2023-10-04,Prosecutors accuse rapper YNW Melly of witness tampering as his murder retrial looms,https://www.ctvnews.ca/entertainment/prosecutors-accuse-rapper-ynw-melly-of-witness-tampering-as-his-murder-retrial-looms-1.6589487,negative,0.012867847,0.5897509,0.3973813,-0.3476404910842632
CTV,2023-10-04,Ottawa puts more money toward studying possible Winnipeg landfill search,https://winnipeg.ctvnews.ca/ottawa-puts-more-money-toward-studying-possible-winnipeg-landfill-search-1.6588565,neutral,0.068775706,0.06574493,0.86547947,0.0004077017274539685
CTV,2023-10-04,SZA postpones Toronto concert minutes before doors open due to illness,https://toronto.ctvnews.ca/sza-postpones-toronto-concert-minutes-before-doors-open-due-to-illness-1.6589315,negative,0.008044145,0.6539795,0.33797655,-0.4276243564325757
CTV,2023-10-04,Liberal MP sides with Conservatives on failed motion to 'repeal all carbon taxes',https://www.ctvnews.ca/politics/liberal-mp-sides-with-conservatives-on-failed-motion-to-repeal-all-carbon-taxes-1.6588972,negative,0.008791804,0.7326012,0.258607,-0.5366272380283146
CTV,2023-10-04,Saskatchewan discussing what to do about 'QAnon queen': Moe,https://www.ctvnews.ca/video?playlistId=1.6588854,neutral,0.018214373,0.06185147,0.9199339,-0.0034938515020641603
CTV,2023-10-04,How tropical storm Philippe will impact the Maritimes on Thanksgiving weekend,https://atlantic.ctvnews.ca/how-tropical-storm-philippe-will-impact-the-maritimes-on-thanksgiving-weekend-1.6588880,neutral,0.03576031,0.04851189,0.91572773,-0.0010746044741836158
CTV,2023-10-04,Cost of groceries puts damper on Thanksgiving,https://atlantic.ctvnews.ca/cost-of-groceries-puts-damper-on-thanksgiving-1.6588977,negative,0.013397081,0.816021,0.17058195,-0.6657107715132371
CTV,2023-10-04,"Ontario 'asking questions' about Ottawa clinic charging membership fee, health minister says",https://ottawa.ctvnews.ca/ontario-asking-questions-about-ottawa-clinic-charging-membership-fee-health-minister-says-1.6588472,neutral,0.012422391,0.12766847,0.85990924,-0.016144911326203992
CTV,2023-10-04,Memo leaked by NDP shows Ontario government knew urban boundary changes were contentious,https://toronto.ctvnews.ca/memo-leaked-by-ndp-shows-ontario-government-knew-urban-boundary-changes-were-contentious-1.6588631,negative,0.016499192,0.25666958,0.7268312,-0.06560705761481955
CTV,2023-10-04,'Bear attack bad': Alberta couple identified as pair killed in grizzly attack,https://calgary.ctvnews.ca/bear-attack-bad-alberta-couple-identified-as-pair-killed-in-grizzly-attack-1.6588878,negative,0.0045153406,0.879178,0.11630679,-0.7729334346683014
CTV,2023-10-04,"Complainant at Nygard trial says shame, fear for career prevented her coming forward",https://toronto.ctvnews.ca/complainant-at-nygard-trial-says-shame-fear-for-career-prevented-her-coming-forward-1.6588505,negative,0.0068097236,0.8076855,0.18550459,-0.6523096528067747
CTV,2023-10-04,City expects Edmonton homeless population to have 'sufficient shelter' spaces for upcoming winter,https://edmonton.ctvnews.ca/city-expects-edmonton-homeless-population-to-have-sufficient-shelter-spaces-for-upcoming-winter-1.6589385,neutral,0.16231541,0.010760813,0.8269238,0.026230496037634943
CTV,2023-10-04,Evacuated Moose Jaw apartment was home to more than 40 people,https://regina.ctvnews.ca/evacuated-moose-jaw-apartment-was-home-to-more-than-40-people-1.6589334,neutral,0.06003832,0.119436294,0.8205253,-0.01066043408457329
CTV,2023-10-04,460-room hotel proposed for Vancouver's Granville Street amid hotel-room shortage,https://bc.ctvnews.ca/460-room-hotel-proposed-for-vancouver-s-granville-street-amid-hotel-room-shortage-1.6589497,neutral,0.03827088,0.17126335,0.7904658,-0.027866475815384817
CTV,2023-10-04,Ontario widower stuck with US$100K+ medical bill after late wife hospitalized on vacation,https://toronto.ctvnews.ca/ontario-widower-stuck-with-us-100k-medical-bill-after-late-wife-hospitalized-on-vacation-1.6579045,negative,0.00869994,0.7684465,0.22285363,-0.5904342740353741
CTV,2023-10-04,Andretti Global clears first hurdle to join Formula One as an 11th team with FIA expansion approval,https://www.ctvnews.ca/autos/andretti-global-clears-first-hurdle-to-join-formula-one-as-an-11th-team-with-fia-expansion-approval-1.6585762,neutral,0.21224605,0.0060978606,0.781656,0.04501121210996217
CTV,2023-10-04,'Impactful on the whole nation': Sask. premier congratulates Wab Kinew on historic win,https://regina.ctvnews.ca/impactful-on-the-whole-nation-sask-premier-congratulates-wab-kinew-on-historic-win-1.6589447,positive,0.85478425,0.00442447,0.14079116,0.730636652751242
CTV,2023-10-04,Premier Wab Kinew: From rapper to reporter to Manitoba's top political office,https://winnipeg.ctvnews.ca/premier-wab-kinew-from-rapper-to-reporter-to-manitoba-s-top-political-office-1.6588342,neutral,0.20588222,0.011034904,0.7830829,0.04226571415808955
CTV,2023-10-04,Supporters of U.S. aid to Ukraine are watching the turmoil in the House with growing alarm,https://www.ctvnews.ca/world/supporters-of-u-s-aid-to-ukraine-are-watching-the-turmoil-in-the-house-with-growing-alarm-1.6589321,negative,0.035891104,0.33958456,0.6245244,-0.11402947351252912
CTV,2023-10-04,'Dynamic duo': Victims in deadly bear attack remembered,https://www.ctvnews.ca/video?playlistId=1.6585555,negative,0.02164566,0.23936528,0.738989,-0.0568272152701681
CTV,2023-10-04,Timmins police investigating fatal parking lot explosion,https://northernontario.ctvnews.ca/timmins-police-investigating-fatal-parking-lot-explosion-1.6588360,negative,0.022617737,0.2945187,0.68286353,-0.08622971656386547
CTV,2023-10-04,Manitoba Tory cabinet minister denounces right-wing pivot in election campaign,https://winnipeg.ctvnews.ca/manitoba-tory-cabinet-minister-denounces-right-wing-pivot-in-election-campaign-1.6588948,negative,0.017096696,0.29344958,0.6894538,-0.08582034283091389
CTV,2023-10-04,Florida man arrested after McDonald's drive-thru meltdown,https://www.ctvnews.ca/video?playlistId=1.6588871,negative,0.025390618,0.5430662,0.43154317,-0.2942762176483349
CTV,2023-10-04,COVID-19 outbreak declared at Victoria hospital,https://bc.ctvnews.ca/covid-19-outbreak-declared-at-victoria-hospital-1.6588685,negative,0.03310236,0.44212642,0.52477115,-0.1943800319418365
