source,date,headline,url,chosen_label,positive,negative,neutral,compound
CTV,2023-09-27,"Canada watching nervously as Biden, Trump do battle in Michigan over EV strategy",https://www.ctvnews.ca/autos/canada-watching-nervously-as-biden-trump-do-battle-in-michigan-over-ev-strategy-1.6578255,neutral,0.026334494,0.22279952,0.750866,-0.04894611967054541
CTV,2023-09-27,Turkiye senior diplomat 'disappointed' by Canada's ongoing arms-export embargo,https://www.ctvnews.ca/canada/turkiye-senior-diplomat-disappointed-by-canada-s-ongoing-arms-export-embargo-1.6579760,negative,0.0086950045,0.7052356,0.28606936,-0.4972816697951359
CTV,2023-09-27,Donatella Versace slams Italian government's anti-gay policies from La Scala stage,https://www.ctvnews.ca/world/donatella-versace-slams-italian-government-s-anti-gay-policies-from-la-scala-stage-1.6578670,negative,0.012161591,0.57170844,0.4161299,-0.32670266979256013
CTV,2023-09-27,Three astronauts return to Earth after a year in space. Frank Rubio sets U.S. space record,https://www.ctvnews.ca/sci-tech/three-astronauts-return-to-earth-after-a-year-in-space-frank-rubio-sets-u-s-space-record-1.6579377,positive,0.485735,0.002870642,0.51139444,0.23593020563055056
CTV,2023-09-27,"Kane jokes he's aiming for '100 goals, 100 assists' on Oilers top line with McDavid and Brown",https://edmonton.ctvnews.ca/kane-jokes-he-s-aiming-for-100-goals-100-assists-on-oilers-top-line-with-mcdavid-and-brown-1.6580173,positive,0.23607665,0.013283015,0.7506406,0.05555569450645592
CTV,2023-09-27,Toronto woman hospitalized overseas with botulism,https://toronto.ctvnews.ca/toronto-woman-hospitalized-overseas-with-botulism-1.6575637,negative,0.011559363,0.6191263,0.36931425,-0.38318381721887107
CTV,2023-09-27,'We can achieve these targets': Vancouver Island mayors address new B.C. housing requirements,https://vancouverisland.ctvnews.ca/we-can-achieve-these-targets-vancouver-island-mayors-address-new-b-c-housing-requirements-1.6579746,positive,0.51489365,0.005990745,0.47911558,0.26507959800613534
CTV,2023-09-27,Impaired driving charge laid in fatal hit-and-run: Winnipeg police,https://winnipeg.ctvnews.ca/impaired-driving-charge-laid-in-fatal-hit-and-run-winnipeg-police-1.6579415,negative,0.01285376,0.5705691,0.4165772,-0.3253838602921828
CTV,2023-09-27,15 potential gravesites found near former Yukon residential school,https://www.ctvnews.ca/canada/15-potential-gravesites-found-near-former-yukon-residential-school-1.6578854,negative,0.01569,0.24242435,0.74188554,-0.058523414977402766
CTV,2023-09-27,Bruce Springsteen postpones all 2023 tour dates until 2024 as he recovers from peptic ulcer disease,https://www.ctvnews.ca/entertainment/bruce-springsteen-postpones-all-2023-tour-dates-until-2024-as-he-recovers-from-peptic-ulcer-disease-1.6580064,neutral,0.02436398,0.21718358,0.7584524,-0.04657510750439542
CTV,2023-09-27,Officials believe there was no link between Gordon Block fire and gas meter sabotage,https://regina.ctvnews.ca/officials-believe-there-was-no-link-between-gordon-block-fire-and-gas-meter-sabotage-1.6579781,negative,0.010830199,0.5215187,0.4676511,-0.27186445307612495
CTV,2023-09-27,Victoria traffic disrupted after dump truck flips on Pat Bay Highway,https://vancouverisland.ctvnews.ca/victoria-traffic-disrupted-after-dump-truck-flips-on-pat-bay-highway-1.6580138,negative,0.0105704535,0.66042334,0.32900622,-0.4360472317913455
CTV,2023-09-27,"'ET Canada' cancelled by Corus Entertainment, blames 'challenging' advertising market",https://www.ctvnews.ca/entertainment/et-canada-cancelled-by-corus-entertainment-blames-challenging-advertising-market-1.6579971,negative,0.005895607,0.8013993,0.19270523,-0.6422059579556061
CTV,2023-09-27,Students tasked with investigating minor crimes in Sarnia,https://london.ctvnews.ca/students-tasked-with-investigating-minor-crimes-in-sarnia-1.6579903,negative,0.01795376,0.26283896,0.71920717,-0.06876201066185672
CTV,2023-09-27,"Apple leverages idea of switching to Bing to pry more money out of Google, Microsoft exec says",https://www.ctvnews.ca/business/apple-leverages-idea-of-switching-to-bing-to-pry-more-money-out-of-google-microsoft-exec-says-1.6580175,neutral,0.09841275,0.053932037,0.84765524,0.0067764039890774175
CTV,2023-09-27,Poilievre's Conservatives maintain summer lead over Trudeau's Liberals: poll,https://www.ctvnews.ca/politics/poilievre-s-conservatives-maintain-summer-lead-over-trudeau-s-liberals-poll-1.6579307,neutral,0.07108729,0.01676863,0.91214406,0.004772216907598104
CTV,2023-09-27,Two women found dead in apartment on Montreal's South Shore,https://montreal.ctvnews.ca/two-women-found-dead-in-apartment-on-montreal-s-south-shore-1.6580020,negative,0.017099526,0.3541159,0.6287846,-0.12510566907173093
CTV,2023-09-27,‘They quite literally have nowhere else to go’: 16 dogs evacuated from N.W.T. come to Nova Scotia,https://atlantic.ctvnews.ca/they-quite-literally-have-nowhere-else-to-go-16-dogs-evacuated-from-n-w-t-come-to-nova-scotia-1.6579810,negative,0.023210125,0.35367125,0.6231185,-0.12454467404156233
CTV,2023-09-27,How was veteran Yaroslav Hunka's military unit linked to the Nazis?,https://www.ctvnews.ca/canada/how-was-veteran-yaroslav-hunka-s-military-unit-linked-to-the-nazis-1.6578579,negative,0.014986301,0.42062014,0.5643935,-0.17669672775367928
CTV,2023-09-27,"Explosive device safely detonated by police in Barrie, Ont.",https://www.ctvnews.ca/video?playlistId=1.6579858,positive,0.3409451,0.012923503,0.64613134,0.11607656015420886
CTV,2023-09-27,"A London, Ont., ER doctor was under the microscope for murder. The hospital didn't tell him",https://www.ctvnews.ca/health/a-london-ont-er-doctor-was-under-the-microscope-for-murder-the-hospital-didn-t-tell-him-1.6578718,negative,0.0072121844,0.7904144,0.20237339,-0.6247029439811129
CTV,2023-09-27,Pfeffer Derby brings youth together for pinewood car race at Elgin Railway Museum,https://london.ctvnews.ca/pfeffer-derby-brings-youth-together-for-pinewood-car-race-at-elgin-railway-museum-1.6580102,positive,0.3558399,0.0044338326,0.63972634,0.12660234985314922
CTV,2023-09-27,Ontario launches review into workplace injury pay after Jamaican migrant workers win legal battle,https://toronto.ctvnews.ca/ontario-launches-review-into-workplace-injury-pay-after-jamaican-migrant-workers-win-legal-battle-1.6579779,negative,0.020934757,0.23972209,0.73934305,-0.05702843808631464
CTV,2023-09-27,Nova Scotia government promises 222 public housing units to address long waiting list,https://atlantic.ctvnews.ca/nova-scotia-government-promises-222-public-housing-units-to-address-long-waiting-list-1.6579989,neutral,0.0793132,0.03406764,0.8866191,0.005129983340129485
CTV,2023-09-27,Hyundai and Kia recall nearly 3.4 million U.S. vehicles due to fire risk and urge owners to park outdoors,https://www.ctvnews.ca/autos/hyundai-and-kia-recall-nearly-3-4-million-u-s-vehicles-due-to-fire-risk-and-urge-owners-to-park-outdoors-1.6579399,negative,0.02544822,0.4565139,0.518038,-0.20775728743573296
CTV,2023-09-27,1987: Deschenes report on Nazi war criminals in Canada,https://www.ctvnews.ca/video?playlistId=1.6579588,negative,0.015044009,0.49030623,0.49464983,-0.24017384723120827
CTV,2023-09-27,Details leading up to Hardeep Singh Nijjar's death revealed,https://bc.ctvnews.ca/details-leading-up-to-hardeep-singh-nijjar-s-death-revealed-1.6579163,negative,0.022720587,0.22607854,0.75120074,-0.05059530833960846
CTV,2023-09-27,"IED explodes in Barrie, Ont. parking lot, sparking road closures and evacuations",https://barrie.ctvnews.ca/ied-explodes-in-barrie-ont-parking-lot-sparking-road-closures-and-evacuations-1.6579336,negative,0.010050256,0.62085575,0.36909404,-0.3853608351652156
CTV,2023-09-27,"Suspects sought after $10K in sunglasses stolen, guard attacked at Metrotown",https://bc.ctvnews.ca/suspects-sought-after-10k-in-sunglasses-stolen-guard-attacked-at-metrotown-1.6580112,negative,0.011705753,0.6585718,0.32972255,-0.4335797064917717
CTV,2023-09-27,"Interac expanding e-transfer service, Wealthsimple to join",https://www.ctvnews.ca/business/interac-expanding-e-transfer-service-wealthsimple-to-join-1.6580065,positive,0.40413296,0.008156074,0.58771086,0.16325697702853859
CTV,2023-09-27,Driver in fatal hit and run confessed to daughter in conversation taped by police,https://kitchener.ctvnews.ca/driver-in-fatal-hit-and-run-confessed-to-daughter-in-conversation-taped-by-police-1.6580178,negative,0.021145687,0.47834563,0.50050867,-0.2283674034945733
CTV,2023-09-27,Be on the lookout for these porch pirates: WPS,https://windsor.ctvnews.ca/be-on-the-lookout-for-these-porch-pirates-wps-1.6579761,neutral,0.1265295,0.039324332,0.83414626,0.014463303748755152
CTV,2023-09-27,"Bruce Springsteen postpones all 2023 shows, including in Ottawa",https://ottawa.ctvnews.ca/bruce-springsteen-postpones-all-2023-shows-including-in-ottawa-1.6579809,neutral,0.021395551,0.20741956,0.7711849,-0.04256509853632906
CBC,2023-09-27,B.C. premier says Ottawa has promised changes are coming to Canada's espionage law,https://www.cbc.ca/news/politics/csis-act-changes-eby-nijjar-1.6979629,neutral,0.088998765,0.011380131,0.8996211,0.0077912710666110385
CBC,2023-09-27,These goats are 'constantly eating' to prevent wildfires in the California countryside,https://www.cbc.ca/radio/asithappens/firefighting-goats-california-1.6978953,neutral,0.06830863,0.20564799,0.7260433,-0.037625038287572465
CBC,2023-09-27,Trudeau apologizes on Canada's behalf after Nazi unit soldier celebrated in House of Commons,https://www.cbc.ca/news/politics/yaroslav-hunka-fallout-1.6979628,neutral,0.08910501,0.23501587,0.67587894,-0.047292782025898816
CBC,2023-09-27,Pop singer Shakira charged with tax evasion for a 2nd time by Spanish authorities,https://www.cbc.ca/news/entertainment/shakira-charged-tax-evasion-again-1.6980152,negative,0.013248257,0.5992963,0.38745558,-0.3589804350122705
CBC,2023-09-27,"Man killed in northwest Winnipeg had long-running feud with rival gangs in India, expert says",https://www.cbc.ca/news/canada/manitoba/winnipeg-homicide-india-gang-rivalry-1.6979157,negative,0.012989492,0.3175183,0.6694923,-0.10064911282496247
CBC,2023-09-27,"AI shows major promise in breast cancer detection, new studies suggest",https://www.cbc.ca/news/health/mammography-artificial-intelligence-scans-1.6954753,positive,0.921226,0.0030226945,0.07575133,0.848648231389447
CBC,2023-09-27,Haida elder in 'extreme' appendicitis pain was allegedly released from B.C. hospital without treatment,https://www.cbc.ca/news/canada/british-columbia/bc-penny-kerrigan-appendicitis-anti-indigenous-racism-1.6970791,negative,0.008934318,0.6420996,0.34896597,-0.41221215515965604
CBC,2023-09-27,Target closing 9 stores in U.S. due to growing theft problem,https://www.cbc.ca/news/business/target-stores-theft-1.6979493,negative,0.009488128,0.79836375,0.19214821,-0.6372945984979879
CBC,2023-09-27,Entertainment Tonight Canada to end after 18 seasons,https://www.cbc.ca/news/entertainment/et-canada-ending-18-seasons-1.6979727,negative,0.043945126,0.29235336,0.6637015,-0.08353932081053905
CBC,2023-09-27,'The world did nothing': Exhausted refugees flee Azerbaijan's crackdown on Nagorno-Karabakh,https://www.cbc.ca/news/world/nagorno-karabakh-refugees-1.6979410,negative,0.007793323,0.7791014,0.21310513,-0.6069383612615926
CBC,2023-09-27,Bruce Springsteen postpones all 2023 tour dates to next year amid peptic ulcer disease recovery,https://www.cbc.ca/news/entertainment/springsteen-postponing-remaining-2023-tour-dates-1.6979864,negative,0.024158299,0.2574213,0.7184204,-0.06568210986119993
CBC,2023-09-27,Are we voting with our wallets to overheat the planet?,https://www.cbc.ca/news/business/climate-cost-column-don-pittis-1.6977550,negative,0.016751671,0.4913144,0.49193388,-0.24110924608430118
CBC,2023-09-27,This has been the worst wildfire season on record. What could 2024 have in store?,https://www.cbc.ca/news/science/2024-wildfire-season-el-nino-1.6978559,negative,0.0054070544,0.95579976,0.038793217,-0.9135239315703068
CBC,2023-09-27,Scientists drop antimatter to see if it falls,https://www.cbc.ca/news/science/antimatter-gravity-alpha-g-1.6979540,neutral,0.056537434,0.06292319,0.8805393,-0.0007628471951353077
CBC,2023-09-27,U.S. regains custody of soldier who ran into North Korean territory,https://www.cbc.ca/news/world/north-korea-us-soldier-king-1.6979432,neutral,0.029594723,0.03808894,0.9323163,-0.000574920004060786
CBC,2023-09-27,The sight of my friend's coffin delivered a gut-wrenching punch — and a final gift,https://www.cbc.ca/news/canada/first-person-final-gift-1.6968995,negative,0.08550028,0.62212425,0.29237553,-0.3797282390242742
CBC,2023-09-27,Unifor meeting with skilled trade workers over issues with Ford deal,https://www.cbc.ca/news/canada/windsor/unifor-meeting-with-skilled-trade-workers-over-issues-with-ford-deal-1.6979091,neutral,0.035715017,0.12075965,0.84352535,-0.0133073298514228
CBC,2023-09-27,Ottawa unveils new AI code of conduct for Canadian companies,https://www.cbc.ca/news/politics/ai-federal-government-champagne-1.6979301,neutral,0.07430845,0.017340377,0.9083512,0.005221056277759928
CBC,2023-09-27,"Nygard's private office bedroom suite not a 'hidden secret,' defence says",https://www.cbc.ca/news/canada/toronto/peter-nygard-sexual-assault-trial-1.6979722,neutral,0.030792078,0.034049913,0.9351581,-0.00021124431471608585
CBC,2023-09-27,AI brings researchers one step closer to restoring speech in people with paralysis,https://www.cbc.ca/news/health/paralysis-brain-speech-1.6943743,positive,0.6412541,0.0069441325,0.35180178,0.4111586157218525
CBC,2023-09-27,One of Toronto's last affordable neighbourhoods is no longer affordable for many who live there,https://www.cbc.ca/radio/thecurrent/weston-housing-costs-gentrification-1.6978979,negative,0.012718083,0.7837396,0.20354222,-0.6140861098507555
CBC,2023-09-27,"As Toronto ponders EV mandate for rideshare drivers, experts say they can't lead the charge without chargers",https://www.cbc.ca/news/canada/toronto/toronto-rideshare-electric-vehicles-1.6976064,neutral,0.038752593,0.16626868,0.7949787,-0.02614351749754107
CBC,2023-09-27,Documentary about music icon Buffy Sainte-Marie nominated for International Emmy Award,https://www.cbc.ca/news/entertainment/buffy-sainte-marie-doc-international-emmy-1.6980006,positive,0.6087844,0.003302616,0.38791293,0.37060754707903953
CBC,2023-09-27,Why rez radio has our hearts,https://www.cbc.ca/player/play/2267281475554,positive,0.7218498,0.01117284,0.26697728,0.5209423639274409
CBC,2023-09-27,"2023 is now officially B.C.'s most expensive, most destructive wildfire season on record",https://www.cbc.ca/news/canada/british-columbia/wildfire-danger-reducing-1.6980041,negative,0.008173165,0.90578026,0.08604653,-0.8203711112430163
CBC,2023-09-27,"Criminal record should have disqualified top Sask. First Nations chief from last election, critics say",https://www.cbc.ca/news/canada/saskatoon/criminal-record-saskatchewan-first-nation-chief-1.6977859,negative,0.009581925,0.69256866,0.2978494,-0.4795595556097254
CBC,2023-09-27,Can the free market ensure artificial intelligence won't wipe out human workers?,https://www.cbc.ca/news/business/post-ai-jobs-column-don-pittis-1.6962905,negative,0.058288276,0.3086829,0.63302886,-0.09188759520055001
CBC,2023-09-27,"Artificial intelligence poses 'risk of extinction,' tech execs and experts warn",https://www.cbc.ca/news/world/artificial-intelligence-extinction-risk-1.6859118,negative,0.013635445,0.60558546,0.38077912,-0.36654780107377327
CBC,2023-09-27,WATCH: CBC News Network,https://www.cbc.cahttps://gem.cbc.ca/benefits-premium?cmp=DM_NewsTile_Gem_PremiumNN,neutral,0.10073908,0.018231502,0.88102955,0.00981596340483426
CBC,2023-09-27,Space station crew back on Earth after unplanned year-long stay,https://www.cbc.ca/news/science/space-station-crew-return-frank-rubio-1.6979504,neutral,0.106225654,0.02770754,0.8660667,0.010516190700313288
CBC,2023-09-27,"Learn AI now or risk losing your job, experts warn",https://www.cbc.ca/news/canada/artificial-intelligence-jobs-careers-training-panle-the-national-1.6978515,negative,0.05185384,0.27677578,0.6713704,-0.07391601065748432
CBC,2023-09-27,Meatloaf likely source of Calgary daycare E. coli outbreak as shared kitchen charged,https://www.cbc.ca/news/canada/calgary/smith-calgary-e-coli-outbreak-update-1.6979566,negative,0.014611674,0.5719976,0.41339087,-0.32696766776223285
CBC,2023-09-27,Migrants are driving a population surge — and Alberta is the fastest growing province: StatsCan,https://www.cbc.ca/news/politics/alberta-fastest-growing-population-statscan-1.6979680,positive,0.5734843,0.010112686,0.41640303,0.3287819605952347
CBC,2023-09-27,Go beyond the headlines | Stream CBC News Explore,https://www.cbc.cahttps://www.cbc.ca/news/cbc-news-explore-1.6512577,neutral,0.10185861,0.013737929,0.8844034,0.010186449934611819
