source,date,headline,url,chosen_label,positive,negative,neutral,compound
CTV,2023-11-06,'I’m not going to be homeless': Motel tenants won’t be evicted after homeless hub plan cancelled,https://london.ctvnews.ca/i-m-not-going-to-be-homeless-motel-tenants-won-t-be-evicted-after-homeless-hub-plan-cancelled-1.6632783,neutral,0.05859886,0.22768055,0.7137205,-0.04840462099963361
CTV,2023-11-06,"Veltman jury on 'standby': Evidence concludes in Windsor, Ont. terror trial",https://london.ctvnews.ca/veltman-jury-on-standby-evidence-concludes-in-windsor-ont-terror-trial-1.6633529,neutral,0.037430663,0.108336076,0.8542332,-0.010335655391370935
CTV,2023-11-06,Threads of love: How knitters are bringing comfort to children in warzones,https://www.ctvnews.ca/canada/threads-of-love-how-knitters-are-bringing-comfort-to-children-in-warzones-1.6631335,positive,0.8516311,0.009272571,0.13909633,0.7251895457055086
CTV,2023-11-06,Backstage with the Fugees: Pras on his hip-hop legacy as he awaits sentencing in conspiracy case,https://www.ctvnews.ca/entertainment/backstage-with-the-fugees-pras-on-his-hip-hop-legacy-as-he-awaits-sentencing-in-conspiracy-case-1.6633510,neutral,0.04906577,0.026076796,0.9248574,0.0017274517221026464
CTV,2023-11-06,"UN Security Council fails to agree on Israel-Hamas war as Gaza death toll passes 10,000",https://www.ctvnews.ca/world/un-security-council-fails-to-agree-on-israel-hamas-war-as-gaza-death-toll-passes-10-000-1.6633782,negative,0.0053097443,0.85246766,0.14222248,-0.726672999565392
CTV,2023-11-06,"Carbon-tax: 'Treat all families equal,' Sask. premier says",https://www.ctvnews.ca/video?playlistId=1.6630638,neutral,0.15341273,0.021970201,0.824617,0.023052781868353023
CTV,2023-11-06,Police investigating Ont. Christmas market cancellation,https://www.ctvnews.ca/video?playlistId=1.6620916,negative,0.008910429,0.4736098,0.5174799,-0.22422679655608135
CTV,2023-11-06,"Morale down, cronyism up after DeSantis takeover of Disney World government, ex-employees say",https://www.ctvnews.ca/world/morale-down-cronyism-up-after-desantis-takeover-of-disney-world-government-ex-employees-say-1.6632854,negative,0.02001804,0.59663683,0.38334507,-0.35557482141141605
CTV,2023-11-06,Quebec retirees win $55M lottery jackpot on Halloween,https://montreal.ctvnews.ca/quebec-retirees-win-55m-lottery-jackpot-on-halloween-1.6632987,positive,0.5013427,0.0062942,0.492363,0.25130494413519955
CTV,2023-11-06,"TVO workers reach tentative deal with employer, ending 11-week strike",https://toronto.ctvnews.ca/tvo-workers-reach-tentative-deal-with-employer-ending-11-week-strike-1.6632224,neutral,0.08963378,0.05196067,0.8584056,0.00533430153756953
CTV,2023-11-06,Watch what Trump did while walking out of the courtroom,https://www.ctvnews.ca/video?playlistId=1.6581103,neutral,0.03810987,0.10159635,0.8602938,-0.008869454408118482
CTV,2023-11-06,Feds put $5M toward security for community groups who fear hate-motivated crimes,https://www.ctvnews.ca/politics/feds-put-5m-toward-security-for-community-groups-who-fear-hate-motivated-crimes-1.6633401,negative,0.040448565,0.2963944,0.66315705,-0.08621354999963238
CTV,2023-11-06,"Ailing Pope Francis meets with European rabbis and condemns antisemitism, terrorism, war",https://www.ctvnews.ca/world/ailing-pope-francis-meets-with-european-rabbis-and-condemns-antisemitism-terrorism-war-1.6632448,neutral,0.0900353,0.13806215,0.77190244,-0.01095480773130486
CTV,2023-11-06,Police pass animal cruelty investigation to provincial welfare agency,https://northernontario.ctvnews.ca/police-pass-animal-cruelty-investigation-to-provincial-welfare-agency-1.6633222,negative,0.016772756,0.54030055,0.44292668,-0.29164337281098973
CTV,2023-11-06,Fighting climate change shouldn't come at expense of working class: Manitoba premier,https://www.ctvnews.ca/politics/fighting-climate-change-shouldn-t-come-at-expense-of-working-class-manitoba-premier-1.6633844,negative,0.03699067,0.28350362,0.67950565,-0.0790060084355666
CTV,2023-11-06,Judge chides Trump as ex-president testifies in civil fraud trial: 'This is not a political rally',https://www.ctvnews.ca/world/judge-chides-trump-as-ex-president-testifies-in-civil-fraud-trial-this-is-not-a-political-rally-1.6632460,negative,0.02143003,0.48739848,0.49117154,-0.23709799921229902
CTV,2023-11-06,"Victim uncooperative after stabbing at Gallery nightclub, Vancouver police say",https://bc.ctvnews.ca/victim-uncooperative-after-stabbing-at-gallery-nightclub-vancouver-police-say-1.6633508,negative,0.009626044,0.5555631,0.43481076,-0.30855775405956365
CTV,2023-11-06,Why we could see more bouts of intense northern lights in the next year,https://www.ctvnews.ca/sci-tech/why-we-could-see-more-bouts-of-intense-northern-lights-in-the-next-year-1.6633741,neutral,0.038692165,0.19147451,0.7698332,-0.03516542368577902
CTV,2023-11-06,"Don't put that rhinestone emblem on your car's steering wheel, U.S. regulators say",https://www.ctvnews.ca/autos/don-t-put-that-rhinestone-emblem-on-your-car-s-steering-wheel-u-s-regulators-say-1.6633161,negative,0.028001482,0.4466411,0.52535737,-0.19870420273617384
CTV,2023-11-06,"Ottawans rally to donate blood after hospital fire, but the need is still strong",https://ottawa.ctvnews.ca/ottawans-rally-to-donate-blood-after-hospital-fire-but-the-need-is-still-strong-1.6633565,neutral,0.10573065,0.13914116,0.7551282,-0.008181290204986702
CTV,2023-11-06,"Olympic skier speaks out against illegal fishing, finds salmon carcass in his mailbox",https://montreal.ctvnews.ca/olympic-skier-speaks-out-against-illegal-fishing-finds-salmon-carcass-in-his-mailbox-1.6625000,negative,0.019806156,0.50891787,0.47127593,-0.25860514221880493
CTV,2023-11-06,"Alleged impaired driver hits two cars, drives through front yards in Kitchener",https://kitchener.ctvnews.ca/alleged-impaired-driver-hits-two-cars-drives-through-front-yards-in-kitchener-1.6633380,negative,0.01134791,0.66677636,0.3218758,-0.44446189935790414
CTV,2023-11-06,Suspect sought after hateful messaging scrawled on window of North York store,https://toronto.ctvnews.ca/suspect-sought-after-hateful-messaging-scrawled-on-window-of-north-york-store-1.6633775,negative,0.007899011,0.78394794,0.20815307,-0.6145119859218333
CTV,2023-11-06,"Winter travel season extended as Air Transat kicks off flights to sunny destinations out of London, Ont.",https://london.ctvnews.ca/winter-travel-season-extended-as-air-transat-kicks-off-flights-to-sunny-destinations-out-of-london-ont-1.6633246,positive,0.4785985,0.0029976845,0.5184038,0.22904752887801472
CTV,2023-11-06,Canada manhunt: Escaped sex offender cut off ankle monitor,https://www.ctvnews.ca/video?playlistId=1.6632324,negative,0.014038053,0.6146258,0.37133622,-0.3775677862753497
CTV,2023-11-06,N.B. woman raising awareness about the dangers of radon gas after terminal lung cancer diagnosis,https://atlantic.ctvnews.ca/more/n-b-woman-raising-awareness-about-the-dangers-of-radon-gas-after-terminal-lung-cancer-diagnosis-1.6627224,negative,0.022033742,0.4618803,0.516086,-0.21284790897398764
CTV,2023-11-06,Kitchener Christmas market cancellation being investigated by police,https://kitchener.ctvnews.ca/kitchener-christmas-market-cancellation-being-investigated-by-police-1.6632503,negative,0.012426101,0.5676698,0.41990417,-0.3220945713788552
CTV,2023-11-06,Wanted B.C. sex offender still missing after monitoring bracelet cut off,https://bc.ctvnews.ca/wanted-b-c-sex-offender-still-missing-after-monitoring-bracelet-cut-off-1.6632808,negative,0.007820518,0.6790383,0.3131413,-0.4610317531728647
CTV,2023-11-06,Social media warning about 'extremely violent' Vancouver sexual assault prompts police investigation,https://bc.ctvnews.ca/social-media-warning-about-extremely-violent-vancouver-sexual-assault-prompts-police-investigation-1.6633050,negative,0.011147838,0.5114657,0.47738633,-0.26147296123061103
CTV,2023-11-06,B.C. police watchdog investigating woman's death at Victoria hotel,https://bc.ctvnews.ca/b-c-police-watchdog-investigating-woman-s-death-at-victoria-hotel-1.6633329,negative,0.014378372,0.2482503,0.7373713,-0.061421476765701755
CTV,2023-11-06,Rafah border: Canadian critical of GAC's evacuation efforts,https://www.ctvnews.ca/video?playlistId=1.6595428,neutral,0.016633488,0.20774889,0.7756174,-0.04288296845095907
CTV,2023-11-06,Premiers say Ottawa must ensure carbon pricing measures are fair to all Canadians,https://www.ctvnews.ca/canada/premiers-say-ottawa-must-ensure-carbon-pricing-measures-are-fair-to-all-canadians-1.6632535,neutral,0.10802667,0.025979603,0.86599386,0.010994811039721775
CTV,2023-11-06,Man accused of threatening Ottawa rabbi,https://ottawa.ctvnews.ca/man-accused-of-threatening-ottawa-rabbi-1.6633261,negative,0.013099143,0.6540288,0.33287206,-0.4275820681049769
CTV,2023-11-06,'Absolutely horrendous': City exploring options for lights at St. James Costco,https://winnipeg.ctvnews.ca/absolutely-horrendous-city-exploring-options-for-lights-at-st-james-costco-1.6633650,negative,0.0071179727,0.87531155,0.117570505,-0.7661196111068511
CTV,2023-11-06,'All of a sudden I started smelling smoke': Woman recounts escaping from burning vehicle on Hwy. 401,https://toronto.ctvnews.ca/all-of-a-sudden-i-started-smelling-smoke-woman-recounts-escaping-from-burning-vehicle-on-hwy-401-1.6633305,negative,0.015877923,0.37249595,0.6116261,-0.13850113411492337
CTV,2023-11-06,Eastern Ontario man taken to hospital following tarantula-involved collision,https://ottawa.ctvnews.ca/eastern-ontario-man-taken-to-hospital-following-tarantula-involved-collision-1.6630146,negative,0.016984928,0.43668932,0.54632574,-0.19040907160729503
CTV,2023-11-06,Rogers to lock out former Shaw technicians Monday after contract talks break down,https://www.ctvnews.ca/business/rogers-to-lock-out-former-shaw-technicians-monday-after-contract-talks-break-down-1.6631277,negative,0.009955857,0.3888835,0.6011607,-0.15113123597729938
CTV,2023-11-06,Two Nigerian workers killed in generator explosion at Canada's high commission,https://www.ctvnews.ca/canada/two-nigerian-workers-killed-in-generator-explosion-at-canada-s-high-commission-1.6632877,negative,0.007291575,0.7523334,0.24037492,-0.5659524707540413
CTV,2023-11-06,"Trial begins for Adam Roland Hook, accused in 2021 murder of Jeffrey Gerald Lehto",https://regina.ctvnews.ca/trial-begins-for-adam-roland-hook-accused-in-2021-murder-of-jeffrey-gerald-lehto-1.6633594,negative,0.035117187,0.2993803,0.6655026,-0.08839532558380547
CTV,2023-11-06,Fort Saskatchewan couple celebrating doubly unique birth of daughter,https://edmonton.ctvnews.ca/fort-saskatchewan-couple-celebrating-doubly-unique-birth-of-daughter-1.6633348,positive,0.8718141,0.0033934365,0.12479263,0.7600481640714674
CTV,2023-11-06,'Making life less affordable': Smith among premiers pushing for halt of carbon tax,https://calgary.ctvnews.ca/making-life-less-affordable-smith-among-premiers-pushing-for-halt-of-carbon-tax-1.6633250,negative,0.011858707,0.59163624,0.39650503,-0.34989282952463263
CTV,2023-11-06,A new apple variety is now coming out of an Ontario orchard. Here's what it tastes like,https://toronto.ctvnews.ca/a-new-apple-variety-is-now-coming-out-of-an-ontario-orchard-here-s-what-it-tastes-like-1.6630363,positive,0.5504371,0.0050509814,0.44451183,0.30295554595570096
CBC,2023-11-06,Grieving daughter says father might still be alive if Air Canada had diverted long-haul flight,https://www.cbc.ca/news/gopublic/air-canada-medical-crisis-diversion-1.7015799,negative,0.019687148,0.47524288,0.50507003,-0.22546818694194926
CBC,2023-11-06,Stellantis workers vote to accept new deal,https://www.cbc.ca/news/canada/windsor/stellantis-uinifor-deal-1.7020276,neutral,0.13407302,0.027300803,0.8386263,0.017230224575259356
CBC,2023-11-06,"Lawyer for alleged Winnipeg serial killer argues that judge should hear his case, not a jury",https://www.cbc.ca/news/canada/manitoba/jeremy-skibicki-pretrial-day-one-1.7019889,negative,0.018454123,0.38216174,0.59938407,-0.14570705943562245
CBC,2023-11-06,PHOTOS | Stunning scenes of the northern lights,https://www.cbc.ca/news/world/photos/photos-stunning-scenes-of-the-northern-lights-1.6769762,positive,0.84753937,0.0041259676,0.14833458,0.718306040207902
CBC,2023-11-06,Politicians condemn display of swastika at Parliament Hill rally,https://www.cbc.ca/news/politics/politicians-condemn-swastika-ottawa-rally-1.7019234,negative,0.010909548,0.5720031,0.41708723,-0.3270686080432412
CBC,2023-11-06,"Canada's premiers united in their criticism of federal housing policy, carbon tax changes",https://www.cbc.ca/news/politics/premiers-carbon-tax-federal-housing-policy-1.7020068,neutral,0.04671891,0.13392057,0.8193605,-0.015752063812001893
CBC,2023-11-06,Canadian skating coach Richard Gauthier given 12 months for sexual assault,https://www.cbc.ca/sports/olympics/winter/figure-skating/olympics-figure-skating-gauthier-sex-assault-1.7020105,negative,0.008562508,0.70893973,0.28249767,-0.5025222884845348
CBC,2023-11-06,"Mayor of Humboldt, Sask., calls death of child, 2 adults who fell through ice 'extremely tragic'",https://www.cbc.ca/news/canada/saskatchewan/drownings-humboldt-lake-1.7019831,negative,0.010308055,0.74076927,0.24892287,-0.5486327318954469
CBC,2023-11-06,"These shoes cost $650, only last one race — and pack an environmental wallop",https://www.cbc.ca/radio/asithappens/adidas-super-shoe-1.7020258,negative,0.0124605615,0.8683808,0.1191585,-0.7539300298593998
CBC,2023-11-06,Blinken says U.S. working 'very aggressively' to get more aid into Gaza,https://www.cbc.ca/player/play/2279825987710,neutral,0.057779543,0.0416662,0.9005542,0.0016024047623535154
CBC,2023-11-06,CRTC allows smaller internet companies to sell service over telecoms' fibre networks,https://www.cbc.ca/news/politics/crtc-independent-internet-services-1.7020247,neutral,0.08845979,0.01936723,0.892173,0.007450043662649897
CBC,2023-11-06,Quebec public sector workers have started striking. Here's why,https://www.cbc.ca/player/play/2279859267827,negative,0.014087723,0.3811885,0.6047237,-0.1451062391234501
CBC,2023-11-06,"Former Fast Fired pizza franchise owners, investors say they were burned by company",https://www.cbc.cahttps://www.cbc.ca/newsinteractives/features/fast-fired-carbone-pizza,negative,0.009551489,0.7366307,0.25381777,-0.5425335905438633
CBC,2023-11-06,Inuit leader warns of Labrador group's 'illegitimate claims' to Inuit identity,https://www.cbc.ca/news/indigenous/natan-obed-nunatukavut-open-letter-1.7020059,negative,0.010540722,0.4971936,0.4922656,-0.24709040271078475
CBC,2023-11-06,"Defence rests its case in murder-terrorism trial of man accused of killing Muslim family in London, Ont.",https://www.cbc.ca/news/canada/london/defence-rests-its-case-in-murder-terrorism-trial-of-man-accused-of-killing-muslim-family-in-london-ont-1.7020183,negative,0.010818803,0.49532136,0.49385986,-0.24522619177954397
CBC,2023-11-06,'We're going to see some doors shut': P.E.I. restaurants feeling pinch of higher costs,https://www.cbc.ca/news/canada/prince-edward-island/pei-restaurant-revenues-costs-1.7019924,negative,0.016449196,0.49712256,0.48642823,-0.24686027435167723
CBC,2023-11-06,WATCH: CBC News Network,https://www.cbc.cahttps://gem.cbc.ca/benefits-premium?cmp=DM_NewsTile_Gem_PremiumNN,neutral,0.10073908,0.018231502,0.88102955,0.00981596340483426
CBC,2023-11-06,United Nations leaders call for ceasefire in Hamas-Israel conflict: 'No one is safe',https://www.cbc.ca/news/world/israel-hamas-war-1.7019481,negative,0.015507,0.6447893,0.33970365,-0.415512803424436
CBC,2023-11-06,'Exhaustion on a daily basis' among reasons why Quebec workers are striking,https://www.cbc.ca/player/play/2280007747921,negative,0.0077689276,0.77270544,0.21952558,-0.5970133797779198
CBC,2023-11-06,"Trump 'rambled' and 'hurled insults' on witness stand in civil fraud trial, N.Y. attorney general says",https://www.cbc.ca/news/world/trump-testimony-ny-civil-trial-1.7019520,negative,0.012169261,0.6478441,0.3399866,-0.419553913396431
CBC,2023-11-06,"Patients, doctors, advocates launch campaign to press for increased use of key HIV medication in B.C.",https://www.cbc.ca/news/canada/british-columbia/long-acting-hiv-medication-transparency-eligibility-concerns-1.7019102,neutral,0.09893893,0.033980675,0.86708033,0.008634229366179191
CBC,2023-11-06,"'No ceasefire, no votes': Biden gets stern warning from thousands of pro-Palestinian protesters",https://www.cbc.ca/news/world/biden-protests-analysis-1.7019077,negative,0.008007687,0.77994645,0.21204583,-0.6082523474412822
CBC,2023-11-06,Go beyond the headlines | Stream CBC News Explore,https://www.cbc.cahttps://www.cbc.ca/news/cbc-news-explore-1.6512577,neutral,0.09185704,0.0112939505,0.89684886,0.008310174861161368
CBC,2023-11-06,Officer responds to 911 call — from child who just wanted a hug,https://www.cbc.ca/player/play/2279976003664,neutral,0.16216283,0.028911056,0.80892617,0.025460926954878893
CBC,2023-11-06,"With focus on Gaza, Israeli settlers ramping up attacks on Palestinians in West Bank",https://www.cbc.ca/news/world/west-bank-settlers-violence-israel-palestinians-1.7019263,negative,0.010188863,0.6859595,0.30385166,-0.47043660676866494
CBC,2023-11-06,The National,https://www.cbc.ca/player/play/2262215235747,neutral,0.12646915,0.062769786,0.8107611,0.012054398075619588
CBC,2023-11-06,Info from 5.6 million patient visits among data stolen in ransomware attack on Ontario hospitals,https://www.cbc.ca/news/canada/windsor/ransomware-attack-third-bunch-data-hospital-1.7019701,negative,0.011931138,0.55385345,0.43421537,-0.3066113271645605
CBC,2023-11-06,"Canadians can start leaving Gaza early Tuesday morning, Global Affairs says",https://www.cbc.ca/news/canada/canadians-gaza-gac-1.7020481,neutral,0.028628299,0.07244352,0.89892805,-0.004428490432442089
CBC,2023-11-06,Captain found criminally negligent in deaths of 34 people in fire aboard California dive boat,https://www.cbc.ca/news/world/boylan-conception-fire-boat-trial-1.7020452,negative,0.006800359,0.8278642,0.16533536,-0.6853129869133099
CBC,2023-11-06,"2 killed, 2 hospitalized after explosion, fire at Canadian High Commission in Nigeria",https://www.cbc.ca/news/politics/two-killed-canadian-high-commisison-nigeria-1.7019572,negative,0.007325962,0.7238599,0.2688142,-0.5239194515865719
CBC,2023-11-06,This grandmother works gruelling 70-hour weeks just to pay the bills. And she's not alone,https://www.cbc.ca/news/canada/newfoundland-labrador/kelly-young-the-grind-1.7012745,negative,0.08404525,0.6212971,0.2946575,-0.37894659176788714
CBC,2023-11-06,"As Holocaust education becomes compulsory in some provinces, advocates call for wider adoption",https://www.cbc.ca/news/canada/compulsory-holocaust-education-1.7016316,neutral,0.051258232,0.06997832,0.8787635,-0.002269557845321346
CBC,2023-11-06,"When we renewed our vows, we also celebrated 20 years of our right to marry",https://www.cbc.ca/radio/nowornever/when-we-renewed-our-vows-we-also-celebrated-20-years-of-our-right-to-marry-1.7014112,positive,0.8040193,0.003243195,0.19273761,0.6464364002812726
CBC,2023-11-06,Ethics watchdog investigating Zara Canada over alleged ties to forced labour,https://www.cbc.ca/news/business/zara-canada-investigation-forced-labour-1.7020134,negative,0.010110551,0.5635209,0.42636856,-0.31745357429668
CBC,2023-11-06,"B.C. sex offender Randall Hopley removed ankle bracelet to avoid court date, police say",https://www.cbc.ca/news/canada/british-columbia/sex-offender-randall-hopley-removed-ankle-bracelet-at-large-1.7019812,negative,0.011075115,0.30733415,0.68159074,-0.09433162468909728
