source,date,headline,url,chosen_label,positive,negative,neutral,compound
Global,2023-10-17,Inflation cooled to 3.8% in September: Statcan,https://globalnews.ca/video/10030212/inflation-cooled-to-3-8-in-september-statcan/,neutral,0.10186421,0.042096812,0.8560389,0.0086041788263711
Global,2023-10-17,Chinese military jet intercepts Canadian Forces plane in ‘aggressive manner’,https://globalnews.ca/news/10027324/chinese-military-aircraft-intercept-canadian-forces/,negative,0.01519833,0.24620688,0.7385948,-0.0603868416240978
Global,2023-10-17,"Montreal’s Olympic Stadium deserves a new roof, Quebec’s premier declares",https://globalnews.ca/news/10030643/montreal-olympic-stadium-legault/,positive,0.25071213,0.013721751,0.735566,0.06266830869015472
Global,2023-10-17,Calgary Stampeders receiver Reggie Begelton recipient of Harrison Award,https://globalnews.ca/news/10030836/calgary-stampeders-receiver-reggie-begelton-recipient-of-harrison-award/,neutral,0.19174933,0.006020183,0.8022305,0.03673156455049309
Global,2023-10-17,Chinese military jet intercepts Canadian Forces plane in ‘aggressive manner’,https://globalnews.ca/video/10027624/chinese-military-jet-intercepts-canadian-forces-plane-in-aggressive-manner/,negative,0.01519833,0.24620688,0.7385948,-0.0603868416240978
Global,2023-10-17,Cousin of Canadian woman killed in Hamas attack remembers her ‘always smiling’,https://globalnews.ca/video/10025652/cousin-of-canadian-woman-killed-in-hamas-attack-remembers-her-always-smiling/,positive,0.26471168,0.07740059,0.6578877,0.06408142596819033
Global,2023-10-17,Holiday spending expected to drop 11% this year: Deloitte,https://globalnews.ca/video/10028547/holiday-spending-expected-to-drop-11-this-year-deloitte/,negative,0.030161293,0.45331287,0.51652586,-0.2045828454819265
Global,2023-10-17,Manitoba RCMP investigate after man dies falling from his residence in Churchill,https://globalnews.ca/news/10030456/manitoba-rcmp-man-dies-falling-from-residence-churchill/,negative,0.01906144,0.28502834,0.6959101,-0.08087784668435916
Global,2023-10-17,Canadian to help carry out Israel’s ground offensive into Gaza,https://globalnews.ca/video/10029404/canadian-to-help-carry-out-israels-ground-offensive-into-gaza/,negative,0.02244879,0.32406256,0.6534887,-0.10451258359030824
Global,2023-10-17,A rise in N.S. opioid overdoses has expert worried about drug poisoning,https://globalnews.ca/news/10030447/harm-reduction-ns-opioid-overdoses/,negative,0.018671256,0.4195225,0.56180626,-0.17565050767035473
Global,2023-10-17,"A Canadian-Israeli woman missing since Hamas attack has died, family says",https://globalnews.ca/news/10024968/shir-georgy-death-israel/,negative,0.0079554,0.6138347,0.37820983,-0.3767297975761039
Global,2023-10-17,Olds school bicycle theft caught on camera,https://globalnews.ca/video/10030405/olds-school-bicycle-theft-caught-on-camera/,negative,0.017677167,0.5823704,0.3999525,-0.33884274983531526
Global,2023-10-17,"Israel-Hamas conflict: Canada working to get its citizens out of Israel, West Bank",https://globalnews.ca/video/10029416/israel-hamas-conflict-canada-working-to-get-its-citizens-out-of-israel-west-bank/,neutral,0.019002145,0.19770385,0.78329384,-0.03872576157303875
Global,2023-10-17,Pot industry calls for greater urgency in review of Cannabis Act,https://globalnews.ca/news/10027112/cannabis-act-review-canada/,neutral,0.11297934,0.054610614,0.83241004,0.009782012238414017
Global,2023-10-17,"Foothills Academy expert discusses ADHD misconceptions, solutions",https://globalnews.ca/video/10030773/foothills-academy-expert-discusses-adhd-misconceptions-solutions/,neutral,0.11426449,0.02200276,0.86373264,0.012572262968877368
Global,2023-10-17,4-year-old dies in hospital nearly 2 weeks after being pulled from Airdrie pond,https://globalnews.ca/news/10030640/4-year-old-dies-hospital-2-weeks-pulled-from-airdrie-pond/,negative,0.011602298,0.6788212,0.30957645,-0.46066365665090814
Global,2023-10-17,Several Town of Whitby services impacted as worker strike continues,https://globalnews.ca/news/10030099/town-of-whitby-services-impacted-worker-strike-continues/,negative,0.01461925,0.575818,0.4095626,-0.33135275011377985
Global,2023-10-17,Regina fire responds to downtown blaze,https://globalnews.ca/news/10030905/regina-downtown-fire/,neutral,0.023597406,0.094215505,0.88218707,-0.008319725435323111
Global,2023-10-17,Canadian security czar buys Napa winery for $57 million. It’s not his first,https://globalnews.ca/news/10029947/canadian-security-czar-buys-napa-winery/,neutral,0.07644976,0.08961118,0.833939,-0.00218559849433575
Global,2023-10-17,Chinese fighter jet was ‘dangerous and reckless’ towards Canadian surveillance plane: Blair,https://globalnews.ca/video/10029406/chinese-fighter-jet-was-dangerous-and-reckless-towards-canadian-surveillance-plane-blair/,negative,0.008081644,0.7414701,0.25044832,-0.5497125726056797
Global,2023-10-17,Israel-Gaza Conflict: Trudeau confirms over 1300 Canadians evacuated from Tel Aviv,https://globalnews.ca/video/10030883/israel-gaza-conflict-trudeau-confirms-over-1300-canadians-evacuated-from-tel-aviv/,neutral,0.03201981,0.15260802,0.81537217,-0.02226394024612155
Global,2023-10-17,Halifax looking into Hammonds Plains Road safety plan 5 months after wildfires,https://globalnews.ca/news/10030746/hammonds-plains-road-wildfire-plan/,neutral,0.030192738,0.08854559,0.88126165,-0.006928721361415757
Global,2023-10-17,Cryptocurrency scams continue to cost victims more: Calgary police,https://globalnews.ca/video/10030527/cryptocurrency-scams-continue-to-cost-victims-more-calgary-police/,negative,0.0065779844,0.8828107,0.11061131,-0.7793114898334936
Global,2023-10-17,"Feds monitoring banks for mortgage rules compliance, taking steps to make banking more affordable: Freeland",https://globalnews.ca/video/10030902/feds-monitoring-banks-for-mortgage-rules-compliance-taking-steps-to-make-banking-more-affordable-freeland/,neutral,0.1945058,0.011210923,0.7942833,0.03770682265331082
Global,2023-10-17,Woman with Canadian connections confirmed dead in Hamas attack on Israel,https://globalnews.ca/news/10029565/sixth-canadian-confirmed-dead-in-hamas-attack-on-israel/,negative,0.0075175045,0.7000734,0.29240912,-0.490046240457076
Global,2023-10-17,Calgary city council green-lights new public transit safety strategy,https://globalnews.ca/news/10030894/calgary-city-council-public-transit-safety-strategy/,positive,0.26133424,0.006007251,0.7326585,0.06825949812244403
Global,2023-10-17,Will Smith says Jada Pinkett Smith’s memoir ‘woke him up’,https://globalnews.ca/news/10027783/will-smith-jada-pinkett-smith-memoir-worthy/,positive,0.28761375,0.008984187,0.70340204,0.08264096174779922
Global,2023-10-17,"Anonymous donor for Nova Scotia Acadian church disappears, creating uncertainty",https://globalnews.ca/news/10030941/ns-sainte-marie-church-donor-disappears/,negative,0.0114199985,0.4852765,0.5033036,-0.23536281315418073
Global,2023-10-17,Analysis on Israel-Hamas conflict,https://globalnews.ca/video/10029878/analysis-on-israel-hamas-conflict/,neutral,0.04194732,0.18441883,0.7736337,-0.03225074530401528
Global,2023-10-17,Be winter ready – Take care of those eavestroughs,https://globalnews.ca/video/10030087/be-winter-ready-take-care-of-those-eavestroughs/,positive,0.3104948,0.026221657,0.66328347,0.09571946859591662
Global,2023-10-17,BIV: Lululemon makes a splash,https://globalnews.ca/video/10029874/biv-business-news-12/,positive,0.59784955,0.010076715,0.39207375,0.357322541964038
Global,2023-10-17,Saskatoon police investigate scene of serious collision on McKercher Avenue,https://globalnews.ca/video/10030151/saskatoon-police-investigate-scene-of-serious-collision-on-mckercher-avenue/,negative,0.022038177,0.23196688,0.74599504,-0.053322931655223726
Global,2023-10-17,"As Hamas releases its first prisoner video, a sleepless Israeli father waits",https://globalnews.ca/news/10029561/hamas-prisoners-video-father-israel/,negative,0.015236797,0.674999,0.30976424,-0.4553914685849083
Global,2023-10-17,Inflation cools to 3.8% in September. What that means for the Bank of Canada,https://globalnews.ca/news/10029648/canada-inflation-september-2023/,neutral,0.056130257,0.038219687,0.90564996,0.0016898629863408843
Global,2023-10-17,"Tired of banking fees? Ottawa pushes for more no-, low-cost accounts",https://globalnews.ca/news/10030668/bank-fees-low-cost-accounts-chrystia-freeland/,negative,0.048090145,0.4116578,0.54025203,-0.16714948922932749
Global,2023-10-17,Winter furnace check-up,https://globalnews.ca/video/10030134/winter-furnace-check-up/,neutral,0.13260168,0.058322206,0.8090761,0.01418172869848533
CTV,2023-10-17,"Here are the food prices that increased, decreased in September",https://www.ctvnews.ca/business/here-are-the-food-prices-that-increased-decreased-in-september-1.6604733,neutral,0.04372335,0.086056314,0.8702203,-0.005493959462432141
CTV,2023-10-17,"21-year-old Israeli-Canadian jumped on grenade to save fiancee during Hamas attack, family says",https://www.ctvnews.ca/canada/21-year-old-israeli-canadian-jumped-on-grenade-to-save-fiancee-during-hamas-attack-family-says-1.6602981,negative,0.026672868,0.30165234,0.6716748,-0.09028269349318663
CTV,2023-10-17,U.S. father on the run after allegedly starving son to death,https://www.ctvnews.ca/video?playlistId=1.6604451,negative,0.01018164,0.6913184,0.2985001,-0.4778173523514049
CTV,2023-10-17,"Seals, seabirds and scientists: Why this remote island is a radio astronomer's paradise",https://montreal.ctvnews.ca/seals-seabirds-and-scientists-why-this-remote-island-is-a-radio-astronomer-s-paradise-1.6592079,positive,0.27311814,0.017186869,0.7096949,0.07429814388243727
CTV,2023-10-17,Massive manhunt for escaped inmates after Georgia jailbreak,https://www.ctvnews.ca/video?playlistId=1.6604477,negative,0.018172568,0.48866656,0.49316075,-0.23846482506575573
CTV,2023-10-17,Sask. man in court battle with crypto exchange lost over $240K to fraud,https://regina.ctvnews.ca/sask-man-in-court-battle-with-crypto-exchange-lost-over-240k-to-fraud-1.6590663,negative,0.009331115,0.7746093,0.21605943,-0.5999326430367429
CTV,2023-10-17,B.C. produce prices could rise despite falling inflation,https://bc.ctvnews.ca/b-c-produce-prices-could-rise-despite-falling-inflation-1.6604727,positive,0.2259366,0.031197177,0.74286616,0.05007409802411544
CTV,2023-10-17,LIVE: Federal officials give technical briefing on Israel,https://www.ctvnews.ca/video?playlistId=1.6593355,neutral,0.028068088,0.068501025,0.9034309,-0.003904573223650676
CTV,2023-10-17,"'He went airborne': Car loses control, lands in Fla. canal",https://www.ctvnews.ca/video?playlistId=1.6605126,negative,0.008812172,0.66207063,0.32911715,-0.4382598865234293
CTV,2023-10-17,"UAW breaks pattern of adding factories to strikes on Fridays, says more plants could come any time",https://www.ctvnews.ca/autos/uaw-breaks-pattern-of-adding-factories-to-strikes-on-fridays-says-more-plants-could-come-any-time-1.6600054,neutral,0.088104986,0.02573102,0.88616407,0.0071003984763784445
CTV,2023-10-17,"Illinois boy killed in alleged hate crime remembered as kind, playful as suspect appears in court",https://www.ctvnews.ca/world/illinois-boy-killed-in-alleged-hate-crime-remembered-as-kind-playful-as-suspect-appears-in-court-1.6605134,neutral,0.051818494,0.14783576,0.8003458,-0.019170253551354932
CTV,2023-10-17,Homeowners on the brink face tough choice of selling home as mortgage payments climb,https://www.ctvnews.ca/canada/homeowners-on-the-brink-face-tough-choice-of-selling-home-as-mortgage-payments-climb-1.6602963,negative,0.027139312,0.42066342,0.5521973,-0.17622116795137188
CTV,2023-10-17,Soccer match between Belgium and Sweden suspended after gunman kills 2 Swedes in Brussels,https://www.ctvnews.ca/sports/soccer-match-between-belgium-and-sweden-suspended-after-gunman-kills-2-swedes-in-brussels-1.6603928,negative,0.009708586,0.42326942,0.567022,-0.17906273372118697
CTV,2023-10-17,"Albertans demand details, risk assessment in telephone town hall on quitting CPP",https://edmonton.ctvnews.ca/albertans-demand-details-risk-assessment-in-telephone-town-hall-on-quitting-cpp-1.6604564,neutral,0.03239896,0.13070075,0.8369002,-0.016033004890535718
CTV,2023-10-17,Fredericton man charged with possessing child pornography,https://atlantic.ctvnews.ca/more/fredericton-man-charged-with-possessing-child-pornography-1.6605184,negative,0.010233814,0.72917664,0.2605895,-0.5315938634311852
CTV,2023-10-17,‘Ring of fire’ eclipse appears over the Americas,https://www.ctvnews.ca/sci-tech/ring-of-fire-eclipse-appears-over-the-americas-1.6602103,neutral,0.07166615,0.005982684,0.92235124,0.005100239861013378
CTV,2023-10-17,Guard charged with sexual assault of prisoner at Alberta RCMP detachment,https://calgary.ctvnews.ca/guard-charged-with-sexual-assault-of-prisoner-at-alberta-rcmp-detachment-1.6605140,negative,0.0094009135,0.7016314,0.2889678,-0.49219819956946154
CTV,2023-10-17,Parts of Cape Breton pick up over 100 mm of rain; yet another rainy weekend ahead for Maritimes,https://atlantic.ctvnews.ca/more/parts-of-cape-breton-pick-up-over-100-mm-of-rain-yet-another-rainy-weekend-ahead-for-maritimes-1.6605201,negative,0.027233738,0.44489336,0.5278728,-0.19718846211770114
CTV,2023-10-17,"Drug used in diabetes treatment Mounjaro helped dieters shed 27 kg, study finds",https://www.ctvnews.ca/health/drug-used-in-diabetes-treatment-mounjaro-helped-dieters-shed-27-kg-study-finds-1.6602178,positive,0.26890448,0.012823458,0.71827203,0.07214518438477846
CTV,2023-10-17,Digital services tax would rate $7.2 billion in federal revenues over five years: PBO,https://www.ctvnews.ca/politics/digital-services-tax-would-rate-7-2-billion-in-federal-revenues-over-five-years-pbo-1.6605021,neutral,0.09605915,0.023051832,0.88088894,0.008695978804752258
CTV,2023-10-17,"Families, non-essential embassy staff at Canadian missions in Israel leave: Global Affairs",https://www.ctvnews.ca/politics/families-non-essential-embassy-staff-at-canadian-missions-in-israel-leave-global-affairs-1.6604306,neutral,0.017189255,0.18451884,0.798292,-0.03375172098838508
CTV,2023-10-17,Residents can now share their thoughts on a proposed highway interchange near Indian Head,https://regina.ctvnews.ca/residents-can-now-share-their-thoughts-on-a-proposed-highway-interchange-near-indian-head-1.6604808,neutral,0.10212397,0.008892835,0.8889833,0.010350211982733004
CTV,2023-10-17,"4-year-old boy pulled from Airdrie, Alta., pond dies in hospital",https://calgary.ctvnews.ca/4-year-old-boy-pulled-from-airdrie-alta-pond-dies-in-hospital-1.6605020,negative,0.012955421,0.48623717,0.5008074,-0.23625874075499098
CTV,2023-10-17,"Ford Executive Chair Bill Ford calls on autoworkers to end strike, says company's future is at stake",https://www.ctvnews.ca/autos/ford-executive-chair-bill-ford-calls-on-autoworkers-to-end-strike-says-company-s-future-is-at-stake-1.6603082,negative,0.093602926,0.26310644,0.64329064,-0.06046348875170082
CTV,2023-10-17,"Study finds withdrawing less blood for ICU lab tests reduces patient strain, waste",https://www.ctvnews.ca/health/study-finds-withdrawing-less-blood-for-icu-lab-tests-reduces-patient-strain-waste-1.6599497,neutral,0.09327366,0.14260812,0.76411813,-0.011637104200498793
CTV,2023-10-17,"Bear breaks into vehicle, leaves 'smelly surprise' for owner: B.C. RCMP",https://bc.ctvnews.ca/bear-breaks-into-vehicle-leaves-smelly-surprise-for-owner-b-c-rcmp-1.6597871,negative,0.014488283,0.36103448,0.6244773,-0.13013595647533016
CTV,2023-10-17,"Video shows suspect stealing over $1,000 in items from Windsor pharmacy: police",https://windsor.ctvnews.ca/video-shows-suspect-stealing-over-1-000-in-items-from-windsor-pharmacy-police-1.6605143,negative,0.012166244,0.65067935,0.33715445,-0.4232355604039242
CTV,2023-10-17,"Ontario childcare educators among lowest paid in Canada, advocates say",https://toronto.ctvnews.ca/ontario-childcare-educators-among-lowest-paid-in-canada-advocates-say-1.6605130,negative,0.013761125,0.61036754,0.37587136,-0.3723591617077737
CTV,2023-10-17,What should you do after receiving an inheritance? Financial expert weighs in,https://www.ctvnews.ca/business/what-should-you-do-after-receiving-an-inheritance-financial-expert-weighs-in-1.6605072,neutral,0.08092273,0.023942402,0.8951348,0.005975252985033208
CTV,2023-10-17,Final complainant in Nygard trial testifies about aftermath of alleged Toronto rape,https://toronto.ctvnews.ca/final-complainant-in-nygard-trial-testifies-about-aftermath-of-alleged-toronto-rape-1.6604741,negative,0.015901828,0.3778757,0.60622245,-0.14253717630740148
CTV,2023-10-17,Ontario tables bill to return Greenbelt land and enhance legal protections,https://toronto.ctvnews.ca/ontario-tables-bill-to-return-greenbelt-land-and-enhance-legal-protections-1.6602708,neutral,0.17775945,0.012169111,0.8100714,0.03145034111392775
CTV,2023-10-17,Hamas releases video of 21-year-old French-Israeli hostage,https://www.ctvnews.ca/video?playlistId=1.6604512,negative,0.009002854,0.51472956,0.4762675,-0.26486551299108285
CTV,2023-10-17,New B.C. program offers free legal advice to sexual assault survivors,https://bc.ctvnews.ca/new-b-c-program-offers-free-legal-advice-to-sexual-assault-survivors-1.6605165,neutral,0.10508408,0.028997522,0.8659184,0.01020180664951198
CTV,2023-10-17,Quebec common front members vote in favour of strike action,https://montreal.ctvnews.ca/quebec-common-front-members-vote-in-favour-of-strike-action-1.6604465,neutral,0.116753794,0.0265281,0.85671806,0.012927712538839842
CTV,2023-10-17,Saskatoon area semi crash leaves family of four dead,https://saskatoon.ctvnews.ca/saskatoon-area-semi-crash-leaves-family-of-four-dead-1.6605171,negative,0.010349076,0.73949236,0.25015852,-0.5467418636974664
CTV,2023-10-17,Shooting in Exchange District sends youth to hospital: police,https://winnipeg.ctvnews.ca/shooting-in-exchange-district-sends-youth-to-hospital-police-1.6604822,negative,0.00824462,0.6913276,0.30042773,-0.4778658783566314
CTV,2023-10-17,"Can New York's mayor speak Mandarin? No, but with AI he's making robocalls in different languages",https://www.ctvnews.ca/sci-tech/can-new-york-s-mayor-speak-mandarin-no-but-with-ai-he-s-making-robocalls-in-different-languages-1.6605043,neutral,0.047481224,0.22068651,0.7318322,-0.046448079483498717
CTV,2023-10-17,Appeals court allows Alex Murdaugh to argue for new trial because of possible jury tampering,https://www.ctvnews.ca/world/appeals-court-allows-alex-murdaugh-to-argue-for-new-trial-because-of-possible-jury-tampering-1.6604826,negative,0.030756615,0.25205523,0.7171882,-0.06258586141330902
CTV,2023-10-17,Cambridge woman recounts evacuation flight from Israel,https://kitchener.ctvnews.ca/cambridge-woman-recounts-evacuation-flight-from-israel-1.6605221,negative,0.019821566,0.35583717,0.6243412,-0.12622722494949024
CTV,2023-10-17,"Upcoming 'Sesame Street' season stars Ariana DeBose, Brandi Carlile, ASL and an octopus chef",https://www.ctvnews.ca/entertainment/upcoming-sesame-street-season-stars-ariana-debose-brandi-carlile-asl-and-an-octopus-chef-1.6604555,neutral,0.14542319,0.0052686715,0.84930795,0.021120169935366917
CTV,2023-10-17,Versailles Palace evacuated again for security alert amid high vigilance in France against attacks,https://www.ctvnews.ca/world/versailles-palace-evacuated-again-for-security-alert-amid-high-vigilance-in-france-against-attacks-1.6604478,neutral,0.04217531,0.08580447,0.8720203,-0.0055836464056067125
CTV,2023-10-17,"Slowdown in inflation supports interest rate pause next week, economists say",https://www.ctvnews.ca/business/slowdown-in-inflation-supports-interest-rate-pause-next-week-economists-say-1.6604400,neutral,0.037991215,0.13156983,0.8304389,-0.015867292924611753
CTV,2023-10-17,Charges laid in 'tragic' case where mother was struck and killed by runaway delivery van in Surrey,https://bc.ctvnews.ca/charges-laid-in-tragic-case-where-mother-was-struck-and-killed-by-runaway-delivery-van-in-surrey-1.6605000,negative,0.0076062274,0.7103596,0.28203413,-0.5045529318962227
CTV,2023-10-17,Heated exchange leads to abrupt ending of Sarnia council meeting,https://london.ctvnews.ca/heated-exchange-leads-to-abrupt-ending-of-sarnia-council-meeting-1.6604732,negative,0.023530057,0.295825,0.6806449,-0.08695876932676683
CTV,2023-10-17,Ottawa resident tells convoy organizers' trial he felt 'threatened' during protest,https://www.ctvnews.ca/canada/ottawa-resident-tells-convoy-organizers-trial-he-felt-threatened-during-protest-1.6604446,negative,0.00586279,0.810112,0.18402517,-0.656247127588891
CTV,2023-10-17,Waterloo council approves $2.5 million for 'winter bubble' over Laurier’s University Stadium,https://kitchener.ctvnews.ca/waterloo-council-approves-2-5-million-for-winter-bubble-over-laurier-s-university-stadium-1.6605168,neutral,0.08644162,0.0063305036,0.907228,0.007432069029263744
CTV,2023-10-17,"Australian safety watchdog fines social platform X US $385,000 for not tackling child abuse content",https://www.ctvnews.ca/sci-tech/australian-safety-watchdog-fines-social-platform-x-us-385-000-for-not-tackling-child-abuse-content-1.6602851,negative,0.007793089,0.7475065,0.24470043,-0.558705234558829
CTV,2023-10-17,"Four people, including 2 police officers, injured in Pickering, Ont. crash: SIU",https://toronto.ctvnews.ca/four-people-including-2-police-officers-injured-in-pickering-ont-crash-siu-1.6604744,negative,0.008557957,0.64700234,0.34443972,-0.41853876917309485
CTV,2023-10-17,"With Trump back at civil fraud trial, accountant testifies after key witness Michael Cohen postpones",https://www.ctvnews.ca/world/with-trump-back-at-civil-fraud-trial-accountant-testifies-after-key-witness-michael-cohen-postpones-1.6604685,negative,0.023911333,0.33165303,0.64443564,-0.1094219798986984
CTV,2023-10-17,"'You shouldn't lose hope, but this is pretty crazy': N.B. woman reunites with cat missing for 5 years",https://atlantic.ctvnews.ca/more/you-shouldn-t-lose-hope-but-this-is-pretty-crazy-n-b-woman-reunites-with-cat-missing-for-5-years-1.6603794,negative,0.019839399,0.65491736,0.32524332,-0.4285230887693814
CTV,2023-10-17,Northern Ont. police investigating animal abuse claims as video circulates online,https://northernontario.ctvnews.ca/northern-ont-police-investigating-animal-abuse-claims-as-video-circulates-online-1.6604998,negative,0.008069486,0.62867004,0.36326042,-0.3951609165803216
CTV,2023-10-17,Christmas craft show returns to Barrie's Sadlon Arena,https://barrie.ctvnews.ca/christmas-craft-show-returns-to-barrie-s-sadlon-arena-1.6605023,positive,0.29568586,0.0065156682,0.69779855,0.08738764638344598
CTV,2023-10-17,Regina fire crews respond to tent encampment blaze,https://regina.ctvnews.ca/regina-fire-crews-respond-to-tent-encampment-blaze-1.6605252,neutral,0.02611657,0.15145421,0.82242906,-0.02225632339579242
CTV,2023-10-17,Stroke presents differently in women than men. Here are 7 symptoms to look for,https://www.ctvnews.ca/health/stroke-presents-differently-in-women-than-men-here-are-7-symptoms-to-look-for-1.6605074,neutral,0.024305742,0.07035818,0.90533614,-0.004359501401867583
CTV,2023-10-17,Grandmother and granddaughter flight attendant duo hits the skies,https://www.ctvnews.ca/lifestyle/grandmother-and-granddaughter-flight-attendant-duo-hits-the-skies-1.6602893,positive,0.28323,0.018055962,0.6987141,0.07989320263774147
CTV,2023-10-17,Doggy paddler of the bay: Missing dog from Maine found on island in New Brunswick,https://atlantic.ctvnews.ca/doggy-paddler-of-the-bay-missing-dog-from-maine-found-on-island-in-new-brunswick-1.6595389,neutral,0.03212004,0.11617418,0.8517058,-0.012464741551818648
CTV,2023-10-17,"Opioid overdose deaths among Ontario homeless people have risen dramatically, study finds",https://toronto.ctvnews.ca/opioid-overdose-deaths-among-ontario-homeless-people-have-risen-dramatically-study-finds-1.6604418,negative,0.009752358,0.7136153,0.27663234,-0.5091517069012692
CTV,2023-10-17,Parents want arrest after son 'deliberately kicked' in neck during Edmonton hockey game,https://edmonton.ctvnews.ca/parents-want-arrest-after-son-deliberately-kicked-in-neck-during-edmonton-hockey-game-1.6587475,negative,0.007784246,0.7560725,0.23614335,-0.571584973617945
CTV,2023-10-17,PM calls reported Israeli bombing at hospital 'unacceptable',https://www.ctvnews.ca/video?playlistId=1.6593069,negative,0.0066347243,0.8283376,0.16502766,-0.6860991885941159
CTV,2023-10-17,Canadian government 'actively examining' options to crack down on short-term rentals: Freeland,https://www.ctvnews.ca/politics/canadian-government-actively-examining-options-to-crack-down-on-short-term-rentals-freeland-1.6605271,neutral,0.023037773,0.036316447,0.94064575,-0.0007881456985121549
CTV,2023-10-17,Police seek public assistance in locating driver in fatal Hwy. 11 crash,https://northernontario.ctvnews.ca/police-seek-public-assistance-in-locating-driver-in-fatal-hwy-11-crash-1.6603700,neutral,0.047608294,0.13520986,0.8171818,-0.01601515815250032
CTV,2023-10-17,Striking Prince Albert workers could have a new contract by Wednesday,https://saskatoon.ctvnews.ca/striking-prince-albert-workers-could-have-a-new-contract-by-wednesday-1.6605133,neutral,0.12564847,0.019765964,0.85458547,0.015396854552722328
CTV,2023-10-17,"Hundreds killed in Israeli airstrike on Gaza City hospital, Gaza Health Ministry says",https://www.ctvnews.ca/world/hundreds-killed-in-israeli-airstrike-on-gaza-city-hospital-gaza-health-ministry-says-1.6604432,negative,0.007274873,0.8155911,0.177134,-0.6651359377196115
CTV,2023-10-17,Prosecutors seeking to recharge Alec Baldwin in fatal shooting on movie set,https://www.ctvnews.ca/entertainment/prosecutors-seeking-to-recharge-alec-baldwin-in-fatal-shooting-on-movie-set-1.6605197,negative,0.021257797,0.35077325,0.627969,-0.12258995628644698
