source,date,headline,url,chosen_label,positive,negative,neutral,compound
CTV,2023-09-18,"Parliament resuming as parties jockey for position on cost of living, housing fixes",https://www.ctvnews.ca/politics/parliament-resuming-as-parties-jockey-for-position-on-cost-of-living-housing-fixes-1.6565482,neutral,0.05014739,0.03518836,0.91466427,0.0012765400730607723
CTV,2023-09-18,3 people seriously injured in collision on Highway 7 in Kawartha Lakes,https://barrie.ctvnews.ca/3-people-seriously-injured-in-collision-on-highway-7-in-kawartha-lakes-1.6566369,negative,0.012471481,0.70389295,0.2836355,-0.4953097827440942
CTV,2023-09-18,Manitoba Tories promise $120 million to address health-care staffing shortages,https://winnipeg.ctvnews.ca/manitoba-tories-promise-120-million-to-address-health-care-staffing-shortages-1.6566323,neutral,0.112472124,0.030574663,0.85695314,0.011715174150527474
CTV,2023-09-18,'Could have been fatal': Large metal bolt comes crashing through family's windshield on B.C. highway,https://bc.ctvnews.ca/could-have-been-fatal-large-metal-bolt-comes-crashing-through-family-s-windshield-on-b-c-highway-1.6558891,negative,0.008949475,0.8066292,0.18442126,-0.6505706258879007
CTV,2023-09-18,Montreal developer repurposes staircase space to create tiny homes amid housing crisis,https://www.ctvnews.ca/canada/montreal-developer-repurposes-staircase-space-to-create-tiny-homes-amid-housing-crisis-1.6565800,neutral,0.05252157,0.082994,0.86448437,-0.004129490232207544
CTV,2023-09-18,Gallagher family marks third anniversary of her disappearance,https://saskatoon.ctvnews.ca/gallagher-family-marks-third-anniversary-of-her-disappearance-1.6566379,negative,0.021133453,0.48083648,0.49803007,-0.23075709850085246
CTV,2023-09-18,"Veltman trial, day 8: Crown continues case",https://windsor.ctvnews.ca/veltman-trial-day-8-crown-continues-case-1.6566187,neutral,0.06399809,0.018641088,0.91736084,0.003748264285904357
CTV,2023-09-18,"19-year-old charged with first-degree murder following weekend homicide, Regina police say",https://regina.ctvnews.ca/19-year-old-charged-with-first-degree-murder-following-weekend-homicide-regina-police-say-1.6566239,negative,0.008570518,0.72647965,0.2649499,-0.5276992064681583
CTV,2023-09-18,Meet the Montreal LEGO artist recreating the city's most iconic buildings,https://montreal.ctvnews.ca/meet-the-montreal-lego-artist-recreating-the-city-s-most-iconic-buildings-1.6565540,positive,0.7186763,0.0043974095,0.27692607,0.5164764773262576
CTV,2023-09-18,Hailstorm showers Wasaga Beach,https://barrie.ctvnews.ca/hailstorm-showers-wasaga-beach-1.6558466,neutral,0.076894864,0.17921871,0.7438864,-0.02620652717118066
CTV,2023-09-18,Gabriel 'Fluffy' Iglesias returns to Caesars Windsor,https://windsor.ctvnews.ca/gabriel-fluffy-iglesias-returns-to-caesars-windsor-1.6566199,neutral,0.21996617,0.0063787485,0.77365524,0.04834439381521616
CTV,2023-09-18,New closures as Alberta parents warn of adverse E. coli effects,https://calgary.ctvnews.ca/new-closures-as-alberta-parents-warn-of-adverse-e-coli-effects-1.6564349,negative,0.0101061305,0.60255545,0.3873383,-0.36297099365212304
CTV,2023-09-18,Hamilton and Sainz warn that Red Bull still has the advantage despite a dismal weekend in Singapore,https://www.ctvnews.ca/autos/hamilton-and-sainz-warn-that-red-bull-still-has-the-advantage-despite-a-dismal-weekend-in-singapore-1.6565893,neutral,0.1727708,0.051144283,0.776085,0.027233997934486
CTV,2023-09-18,"Liberals, Tories compete on housing policy as MPs return to Ottawa after summer break",https://www.ctvnews.ca/politics/liberals-tories-compete-on-housing-policy-as-mps-return-to-ottawa-after-summer-break-1.6565989,neutral,0.049163196,0.011897476,0.9389393,0.00227547181891552
CTV,2023-09-18,Hunter Biden sues the IRS over tax disclosures after agent testimony,https://www.ctvnews.ca/world/hunter-biden-sues-the-irs-over-tax-disclosures-after-agent-testimony-1.6566017,negative,0.02571188,0.27508092,0.69920725,-0.07500840026781308
CTV,2023-09-18,"Rock climbers offered poo bags as Squamish, B.C., wilderness spotted with waste",https://bc.ctvnews.ca/rock-climbers-offered-poo-bags-as-squamish-b-c-wilderness-spotted-with-waste-1.6560459,negative,0.03707447,0.28596017,0.6769654,-0.08039868583931664
CTV,2023-09-18,Saint John mayor calls metal recycling facility a ‘black eye on our community’,https://atlantic.ctvnews.ca/saint-john-mayor-calls-metal-recycling-facility-a-black-eye-on-our-community-1.6566357,negative,0.004839266,0.8527382,0.14242253,-0.7271390475100503
CTV,2023-09-18,Calgary hosts global oil-producing nations at 24th World Petroleum Congress,https://calgary.ctvnews.ca/calgary-hosts-global-oil-producing-nations-at-24th-world-petroleum-congress-1.6565964,neutral,0.19512603,0.00899851,0.79587543,0.03799319866844186
CTV,2023-09-18,"$4,000 in tools, other items allegedly stolen from Lucan, Ont. garage",https://london.ctvnews.ca/4-000-in-tools-other-items-allegedly-stolen-from-lucan-ont-garage-1.6566003,negative,0.011771944,0.6185137,0.36971426,-0.3824206955184195
CTV,2023-09-18,"OPP investigating fatal crash northeast of Kingston, Ont.",https://ottawa.ctvnews.ca/opp-investigating-fatal-crash-northeast-of-kingston-ont-1.6566425,negative,0.01660822,0.37098932,0.6124025,-0.13735723438123948
CTV,2023-09-18,Here's how much you need to make each year to buy a home in Vancouver,https://bc.ctvnews.ca/here-s-how-much-you-need-to-make-each-year-to-buy-a-home-in-vancouver-1.6566365,neutral,0.08218039,0.046875045,0.8709446,0.004556344559234482
CTV,2023-09-18,Woolwich testing emergency sirens this week,https://kitchener.ctvnews.ca/woolwich-testing-emergency-sirens-this-week-1.6566267,neutral,0.026727388,0.029845633,0.94342715,-0.00017640801684148943
CTV,2023-09-18,Sturgeon Creek crash sends 2 to hospital,https://winnipeg.ctvnews.ca/sturgeon-creek-crash-sends-2-to-hospital-1.6565960,negative,0.008421864,0.71355873,0.27801928,-0.5090952438152421
CTV,2023-09-18,Trajectory for 'Freedom Convoy' organizers' trial uncertain as third week begins,https://www.ctvnews.ca/politics/trajectory-for-freedom-convoy-organizers-trial-uncertain-as-third-week-begins-1.6565877,negative,0.01222372,0.32577324,0.662003,-0.10597880268190352
CTV,2023-09-18,Granville Street fire causes 'extensive damage' to Samesun Hostel in Vancouver,https://bc.ctvnews.ca/granville-street-fire-causes-extensive-damage-to-samesun-hostel-in-vancouver-1.6564644,negative,0.010139252,0.44219998,0.54766077,-0.195438013586255
CTV,2023-09-18,Italy mulls new migrant crackdown as talk turns to naval blockade to prevent launching of boats,https://www.ctvnews.ca/world/italy-mulls-new-migrant-crackdown-as-talk-turns-to-naval-blockade-to-prevent-launching-of-boats-1.6566273,negative,0.010700466,0.5734118,0.41588756,-0.32868670189062144
CTV,2023-09-18,This Canadian robotics start-up is using AI to help artists make nearly-identical copies of original paintings,https://www.ctvnews.ca/sci-tech/this-canadian-robotics-start-up-is-using-ai-to-help-artists-make-nearly-identical-copies-of-original-paintings-1.6563479,positive,0.30193317,0.008305992,0.689761,0.09109460542843628
CBC,2023-09-18,De Grasse stuns 200m field to become Canada's 1st Diamond League champion since 2011,https://www.cbc.ca/sports/olympics/summer/trackandfield/arop-brown-degrasse-diamond-league-final-recap-eugene-1.6969746,positive,0.6219081,0.0029233282,0.3751685,0.3867612111519705
CBC,2023-09-18,WATCH: CBC News Network,https://www.cbc.cahttps://gem.cbc.ca/benefits-premium?cmp=DM_NewsTile_Gem_PremiumNN,neutral,0.10073908,0.018231502,0.88102955,0.00981596340483426
CBC,2023-09-18,A Toronto landlord is banning electric vehicles on its property. Tenants' advocates say that's 'unreasonable',https://www.cbc.ca/news/canada/toronto/e-scooters-ban-parkdale-building-tenants-1.6966666,negative,0.0072721504,0.72588426,0.26684365,-0.5268550518888215
CBC,2023-09-18,Taiwan faces threat of invasion. Many Taiwanese aren't worried,https://www.cbc.ca/news/world/taiwan-china-invasion-1.6969717,negative,0.022561837,0.48433402,0.49310407,-0.23407043521067816
CBC,2023-09-18,Cleanup from Lee continues as tens of thousands remain without power in Nova Scotia,https://www.cbc.ca/news/canada/nova-scotia/post-tropical-storm-lee-aftermath-sept-18-1.6969939,negative,0.018393965,0.5726937,0.40891245,-0.32763965879717105
CBC,2023-09-18,One Ottawa neighbour survived the 2013 bus-train crash — the other's son didn't,https://www.cbc.cahttps://www.cbc.ca/newsinteractives/features/barrhaven-bus-train-fallowfield-collision-crash-victims-survivors-father-son-10-year-anniversary,negative,0.02638484,0.44379988,0.5298152,-0.19626221430435464
CBC,2023-09-18,Trans teens and youth say gender-affirming care is 'life-changing.' So why is it so hard to find in Canada?,https://www.cbc.ca/news/health/gender-affirming-care-canada-1.6967503,neutral,0.16988428,0.16722685,0.6628889,0.0008958486467154358
CBC,2023-09-18,Some Hay River evacuees returning to heavy losses after harrowing escapes from wildfire,https://www.cbc.ca/news/canada/north/patterson-paradise-gardens-wildfire-hay-river-1.6969025,negative,0.009375764,0.6921122,0.29851213,-0.4789313419011503
CBC,2023-09-18,"Danielle Smith has embraced the electric vehicle. No, not the EV you're thinking of",https://www.cbc.ca/news/canada/calgary/hydrogen-fuel-cell-electric-vehicles-danielle-smith-zippy-1.6963522,positive,0.260134,0.05831883,0.68154705,0.0642686428177015
CBC,2023-09-18,Can the free market ensure artificial intelligence won't wipe out human workers?,https://www.cbc.ca/news/business/post-ai-jobs-column-don-pittis-1.6962905,negative,0.058288276,0.3086829,0.63302886,-0.09188759520055001
CBC,2023-09-18,Canada's housing agency examines 1970s tax shelter as it seeks solutions to rental crisis,https://www.cbc.ca/news/canada/nova-scotia/cmhc-tax-shelter-1970s-rental-crisis-1.6967692,neutral,0.061404463,0.057418954,0.88117653,0.0004735720366975116
CBC,2023-09-18,"Vancouver Island MLA Adam Walker booted from B.C. NDP, says Premier David Eby",https://www.cbc.ca/news/canada/british-columbia/mla-adam-walker-ousted-1.6969885,neutral,0.0153934555,0.18426636,0.8003402,-0.033717135103991325
CBC,2023-09-18,"Evacuation orders issued, expanded as B.C.'s wildfire threat refuses to subside",https://www.cbc.ca/news/canada/british-columbia/evac-orders-expanded-wildfires-bc-1.6969772,negative,0.0100253895,0.63097787,0.3589968,-0.3980325259137132
CBC,2023-09-18,"Lee threatened to cancel this N.S. couple's wedding, so they got married at a fish plant",https://www.cbc.ca/news/canada/nova-scotia/post-tropical-storm-lee-wedding-1.6969689,negative,0.008977972,0.73644954,0.25457245,-0.5422773642488181
CBC,2023-09-18,Mike Babcock resigns as coach of NHL's Columbus Blue Jackets amid privacy invasion probe,https://www.cbc.ca/sports/hockey/nhl/mike-babcock-resigns-blue-jackets-head-coach-1.6969776,negative,0.012942034,0.43338403,0.55367404,-0.1876541717021567
CBC,2023-09-18,Watch the inaugural Professional Women's Hockey League draft,https://www.cbc.ca/sports/hockey/pwhl-draft-live-stream-1.6969900,neutral,0.10173951,0.0073540495,0.8909066,0.010296833354569657
CBC,2023-09-18,"Diamond vanishes in consignment deal gone wrong, B.C. woman claims",https://www.cbc.ca/news/canada/british-columbia/consignment-deal-missing-diamond-west-vancouver-1.6966647,negative,0.008956878,0.69830596,0.29273722,-0.48755097431573624
CBC,2023-09-18,"$10,000 homes? It's tax sale season in B.C., and one expert is cautioning prospective buyers",https://www.cbc.ca/news/canada/british-columbia/tax-sale-season-bc-prospective-bidders-caution-1.6968864,negative,0.024869448,0.54622805,0.42890257,-0.2977465636819332
CBC,2023-09-18,Freeland says government's aim is to 'stabilize' prices as meeting with grocery CEOs begins,https://www.cbc.ca/news/politics/freeland-champagne-grocery-ceos-meeting-1.6970207,neutral,0.083531916,0.02252957,0.8939385,0.006470001206585252
CBC,2023-09-18,"Iran, U.S. exchanging prisoners, $6B in funds unfrozen for Iran",https://www.cbc.ca/news/world/us-iran-prisoner-swap-1.6969934,neutral,0.029281816,0.07764432,0.89307386,-0.005171215702277632
CBC,2023-09-18,Métro Média to declare bankruptcy as local journalism takes another hit,https://www.cbc.ca/news/canada/montreal/metro-media-bankruptcy-1.6969803,negative,0.015789503,0.5934391,0.39077145,-0.35192062496835774
CBC,2023-09-18,Family remembers Sask. couple who used MAID to die together,https://www.cbc.ca/news/canada/saskatoon/couple-journey-maid-program-together-1.6965395,negative,0.024251787,0.3696165,0.6061316,-0.1360282449591832
CBC,2023-09-18,Go beyond the headlines | Stream CBC News Explore,https://www.cbc.cahttps://www.cbc.ca/news/cbc-news-explore-1.6512577,neutral,0.10185861,0.013737929,0.8844034,0.010186449934611819
CBC,2023-09-18,"Liberals hope focus on housing, crime halts their plummet in the polls as Parliament returns",https://www.cbc.ca/news/politics/house-returns-fall-priorities-1.6968508,neutral,0.15687454,0.12410139,0.71902406,0.009208465024092227
CBC,2023-09-18,Indigo founder Heather Reisman returns as CEO,https://www.cbc.ca/news/business/heather-reisman-indigo-1.6969961,positive,0.2580275,0.004285306,0.7376873,0.06655980110443771
CBC,2023-09-18,"The sun sets on a century of prohibition in Cardston, Alta.",https://www.cbc.ca/news/canada/calgary/cardston-alcohol-sales-1.6969102,neutral,0.03173501,0.05903719,0.9092278,-0.0024782792120847663
CBC,2023-09-18,Ontario court dismisses sex workers' Charter challenge,https://www.cbc.ca/news/canada/toronto/sex-workers-1.6970016,negative,0.010789396,0.63118225,0.35802847,-0.3982745519699016
CBC,2023-09-18,"Rescue of boring machine trapped under Toronto street turning into expensive, years-long odyssey",https://www.cbc.ca/news/canada/toronto/boring-machine-rescue-delayed-1.6968452,negative,0.024250008,0.6398311,0.33591884,-0.4087958054807963
CBC,2023-09-18,A fire burning for 173 years: First Nations tradition endures amid Robinson treaties land resources case,https://www.cbc.cahttps://www.cbc.ca/newsinteractives/features/spiritual-tradition-robinson-huron-superior-treaty-1850-court-case,negative,0.023892617,0.4454827,0.5306246,-0.19788400520218374
