source,date,headline,url,chosen_label,positive,negative,neutral,compound
CTV,2023-12-27,Man seriously injured after being hit by the CTrain,https://calgary.ctvnews.ca/man-seriously-injured-after-being-hit-by-the-ctrain-1.6702037,negative,0.013925966,0.75027704,0.23579687,-0.5627217954864285
CTV,2023-12-27,New reptile alert: Orange-tongued iguana species discovered in China,https://www.ctvnews.ca/sci-tech/new-reptile-alert-orange-tongued-iguana-species-discovered-in-china-1.6702060,neutral,0.12790774,0.020585664,0.8515066,0.01593662071626145
CTV,2023-12-27,"Comedian Tom Smothers, one-half of the Smothers Brothers, dies at 86",https://www.ctvnews.ca/entertainment/comedian-tom-smothers-one-half-of-the-smothers-brothers-dies-at-86-1.6702068,neutral,0.050930373,0.06771213,0.88135755,-0.0019910284933688516
CTV,2023-12-27,Manitoba to join other provinces in excise tax on vape products,https://winnipeg.ctvnews.ca/manitoba-to-join-other-provinces-in-excise-tax-on-vape-products-1.6701291,neutral,0.05378328,0.08673474,0.8594819,-0.004630277926303661
CTV,2023-12-27,'Elegance personified': Canadian menswear mogul Harry Rosen dies at 92,https://www.ctvnews.ca/business/elegance-personified-canadian-menswear-mogul-harry-rosen-dies-at-92-1.6700970,neutral,0.14062248,0.032694764,0.8266828,0.01870572911017554
CTV,2023-12-27,Rideshare driver charged with sexually assaulting teen,https://kitchener.ctvnews.ca/rideshare-driver-charged-with-sexually-assaulting-teen-1.6701968,negative,0.009682881,0.7559036,0.2344136,-0.5712964298332714
CTV,2023-12-27,Premier Moe says it's 'unfortunate' for Saskatchewan to break federal emissions law,https://regina.ctvnews.ca/premier-moe-says-it-s-unfortunate-for-saskatchewan-to-break-federal-emissions-law-1.6701999,negative,0.007458647,0.75074095,0.2418003,-0.5635564355706606
CTV,2023-12-27,Thinking of travelling next year? Here's how to get a deal,/video/c2835443--deals-to-be-had--on-travel-for-2024?playlistId=1.6701365,positive,0.34657612,0.014683873,0.63874006,0.11989937413193275
CTV,2023-12-27,Ottawa cancer survivor gifted Taylor Swift tickets after CTV story airs,https://ottawa.ctvnews.ca/ottawa-cancer-survivor-gifted-taylor-swift-tickets-after-ctv-story-airs-1.6701546,neutral,0.09531082,0.02035271,0.88433653,0.00866991569283293
CTV,2023-12-27,Picket continues outside Kitchener long-term care home,https://kitchener.ctvnews.ca/picket-continues-outside-kitchener-long-term-care-home-1.6701488,neutral,0.020929568,0.10253995,0.8765304,-0.010076400449392509
CTV,2023-12-27,Windsor man facing several charges after getting stopped going 150km/h on Highway 401,https://windsor.ctvnews.ca/windsor-man-facing-several-charges-after-getting-stopped-going-150km-h-on-highway-401-1.6701937,negative,0.015429906,0.56289744,0.4216727,-0.31661541732675147
CTV,2023-12-27,"Argument over Christmas gifts turns deadly as 14-year-old kills his older sister, deputies say",https://www.ctvnews.ca/world/argument-over-christmas-gifts-turns-deadly-as-14-year-old-kills-his-older-sister-deputies-say-1.6702073,negative,0.009162323,0.72075325,0.27008435,-0.5194013667539021
CTV,2023-12-27,Shoppers forced to hunt for deals amid high inflation,/video/c2835668-ctv-national-news--hunting-for-inflation-era-deals?playlistId=1.6701334,negative,0.023865826,0.47945514,0.4966789,-0.22930772492629892
CTV,2023-12-27,"Dube says his health reform won't make a 'big bang,' but critics are worried",https://montreal.ctvnews.ca/dube-says-his-health-reform-won-t-make-a-big-bang-but-critics-are-worried-1.6700954,negative,0.024265679,0.37569287,0.6000415,-0.14055629170535155
CTV,2023-12-27,Nearly one in eight Canadians on wait list for health care,/video/c2835431-over-3-1m-canadians-on-healthcare-waitlist?playlistId=1.6447863,negative,0.042488202,0.4088684,0.54864347,-0.1653681024330922
CTV,2023-12-27,Boxing Day was the warmest on record for these northern Ont. cities,https://northernontario.ctvnews.ca/boxing-day-was-the-warmest-on-record-for-these-northern-ont-cities-1.6702091,positive,0.61487335,0.01006806,0.37505868,0.3779678162450377
CTV,2023-12-27,Emergency rooms overflowing across Quebec,https://montreal.ctvnews.ca/emergency-rooms-overflowing-across-quebec-1.6701789,negative,0.022334816,0.6099853,0.36767977,-0.37158328253869044
CTV,2023-12-27,Moving forward from B.C.'s historically destructive 2023 wildfire season,https://bc.ctvnews.ca/moving-forward-from-b-c-s-historically-destructive-2023-wildfire-season-1.6696404,negative,0.010052858,0.7354874,0.25445965,-0.5408407226128915
CTV,2023-12-27,"In Christmas message, Trudeau urges Canadians to find strength in differences",https://www.ctvnews.ca/politics/in-christmas-message-trudeau-urges-canadians-to-find-strength-in-differences-1.6700772,positive,0.4072312,0.015151087,0.57761765,0.16560772779143917
CTV,2023-12-27,Winnipeg fire crews save cat in Christmas Eve deep fryer blaze,https://winnipeg.ctvnews.ca/winnipeg-fire-crews-save-cat-in-christmas-eve-deep-fryer-blaze-1.6701344,neutral,0.054256316,0.08520903,0.8605346,-0.004316831914153996
CTV,2023-12-27,Regina mayor discusses infamous tourism campaign flop and city hall encampment in year-end interview,https://regina.ctvnews.ca/regina-mayor-discusses-infamous-tourism-campaign-flop-and-city-hall-encampment-in-year-end-interview-1.6701979,negative,0.009578024,0.68989575,0.30052623,-0.4758643853141553
CTV,2023-12-27,Stock market today: Wall Street ends higher at the start of a holiday-shortened week,https://www.ctvnews.ca/business/stock-market-today-wall-street-ends-higher-at-the-start-of-a-holiday-shortened-week-1.6701235,positive,0.7219573,0.004560184,0.27348256,0.5212015425377814
CTV,2023-12-27,Saskatoon major crime unit investigating after dead body found in west industrial area,https://saskatoon.ctvnews.ca/saskatoon-major-crime-unit-investigating-after-dead-body-found-in-west-industrial-area-1.6701517,negative,0.016135326,0.31963816,0.66422653,-0.10190819707133869
CTV,2023-12-27,"Christmas Day windstorm leaves some 28,000 customers without power in in B.C.",https://bc.ctvnews.ca/christmas-day-windstorm-leaves-some-28-000-customers-without-power-in-in-b-c-1.6701446,negative,0.011256937,0.76813966,0.22060338,-0.5899118418270799
CBC,2023-12-27,The federal government wants Canadians to switch to electric vehicles. It's not that simple,https://www.cbc.ca/news/canada/electric-vehicles-mandates-market-government-1.7066264,negative,0.03128474,0.49398926,0.47472602,-0.2430466386704655
CBC,2023-12-27,"Big waves forecast to hit Vancouver Island, some may cause coastal infrastructure damage: Environment Canada",https://www.cbc.ca/news/canada/british-columbia/bc-weather-dec-27-1.7069627,negative,0.012300432,0.61175686,0.37594265,-0.3740951923470348
CBC,2023-12-27,What will it be like to live in Calgary's converted office towers?,https://www.cbc.ca/news/canada/calgary/calgary-downtown-office-conversion-revitalization-1.7061792,neutral,0.04004689,0.09384824,0.8661048,-0.007203744045347404
CBC,2023-12-27,Airline apologizes after 6-year-old got on wrong flight,https://www.cbc.ca/player/play/2295167043877,negative,0.030306308,0.5177572,0.45193657,-0.2671539932529301
CBC,2023-12-27,Mumbai doctors blame pigeons for spike in lung disease,https://www.cbc.ca/news/world/mumbai-india-pigeons-lung-disease-1.7062418,negative,0.01259375,0.6504365,0.33696964,-0.422909121884242
CBC,2023-12-27,WATCH : CBC News Explore,https://www.cbc.cahttps://gem.cbc.ca/live,neutral,0.09840742,0.014817321,0.88677526,0.009464467482493077
CBC,2023-12-27,Thousands of ethnic minority Russians fled to avoid the draft. Life in their new homes hasn't been easy,https://www.cbc.cahttps://www.cbc.ca/newsinteractives/features/ethnic-russian-migration,negative,0.006858886,0.83904785,0.15409324,-0.7039542737045217
CBC,2023-12-27,The EU has opened membership talks with Ukraine. Here's why that matters,https://www.cbc.ca/news/world/european-union-ukraine-moldova-1.7060106,positive,0.43558177,0.00482231,0.5595958,0.18970826522505746
CBC,2023-12-27,"Thunderstorms, flooding in Australia kill 10 and cause widespread blackouts",https://www.cbc.ca/news/world/australia-weather-floods-1.7069633,negative,0.007642692,0.8668339,0.12552337,-0.7513426561074974
CBC,2023-12-27,"Missing Alberta family of 3 found dead, RCMP says",https://www.cbc.ca/news/canada/edmonton/rcmp-finds-missing-family-of-3-dead-in-lac-ste-anne-county-1.7069571,negative,0.01277693,0.42454782,0.56267524,-0.1800776023335544
CBC,2023-12-27,"Yes, that's a yellow New York City cab cruising around Vancouver — meet the driver",https://www.cbc.ca/news/canada/british-columbia/new-york-city-taxi-1.7058728,neutral,0.11696557,0.0096025085,0.87343204,0.013588723475303155
CBC,2023-12-27,"Taylor Swift fan died of heat exhaustion at Rio de Janeiro show last month, forensics report says",https://www.cbc.ca/news/entertainment/taylor-swift-concert-death-rio-1.7069687,negative,0.0103942,0.5781361,0.41146964,-0.3341333285942767
CBC,2023-12-27,"Here's looking at you, squid: 150 years ago, a photo of a giant squid changed the world",https://www.cbc.cahttps://www.cbc.ca/newsinteractives/features/giant-squid-photo,positive,0.721094,0.008567033,0.27033895,0.5199031804257679
CBC,2023-12-27,4 teens charged with manslaughter in fatal Winnipeg stabbing,https://www.cbc.ca/news/canada/manitoba/winnipeg-police-arlington-homicide-arrests-stabbing-1.7069760,negative,0.009238552,0.7372244,0.25353694,-0.5434145521600158
CBC,2023-12-27,Israel's military chief says the war on Hamas will grind on for months,https://www.cbc.ca/news/world/israel-hamas-war-1.7069636,negative,0.010354971,0.7237677,0.2658773,-0.5237324544583011
CBC,2023-12-27,Ukraine attacks Russian warship in Crimea,https://www.cbc.ca/player/play/2295164995942,negative,0.012132278,0.57885396,0.4090136,-0.3349248046308091
CBC,2023-12-27,"Moroccan man charged with making bomb threats in Ontario, Belgium",https://www.cbc.ca/news/canada/london/moroccan-man-charged-with-making-bomb-threats-in-ontario-belgium-1.7069709,negative,0.008649942,0.6879193,0.30343089,-0.4731580662356354
CBC,2023-12-27,"New York Times sues OpenAI, Microsoft for copyright infringement",https://www.cbc.ca/news/business/new-york-times-openai-lawsuit-copyright-1.7069701,neutral,0.033656918,0.22040755,0.7459356,-0.047446680847903266
CBC,2023-12-27,"For these adult siblings, living together is an art",https://www.cbc.ca/news/canada/ottawa/adult-siblings-bangladesh-newfoundland-creator-network-ottawa-1.7061141,positive,0.530331,0.021555075,0.44811383,0.280786410706547
CBC,2023-12-27,Ontario couple on 'long and expensive' IVF journey have renewed hope with financial help,https://www.cbc.ca/news/canada/london/ivf-grant-london-ontario-1.7065256,positive,0.4680229,0.037130598,0.49484652,0.217666752979083
CBC,2023-12-27,Canada’s Paralympic athletes hope to ride this year’s momentum into Paris 2024,https://www.cbc.ca/sports/paralympics/para-sport-year-in-review-1.7068220,positive,0.7663476,0.0026450728,0.2310075,0.5872815026631404
CBC,2023-12-27,Halifax Explosion survivors heard on tapes lost for decades,https://www.cbc.ca/news/canada/nova-scotia/halifax-explosion-survivors-lost-tapes-1.7058870,negative,0.015322617,0.6781023,0.3065751,-0.4595879462837651
CBC,2023-12-27,"Lee Sun-kyun of Oscar-winning Parasite found dead, South Korean officials say",https://www.cbc.ca/news/entertainment/lee-sun-kyun-parasite-actor-unconscious-1.7069604,neutral,0.029535908,0.21739154,0.7530725,-0.0463867213086715
CBC,2023-12-27,Ukraine digs in as the West stumbles to keep up with Russian war production,https://www.cbc.ca/news/politics/ukraine-russia-congress-europe-1.7067232,negative,0.015261191,0.5468705,0.4378682,-0.2988345203221332
CBC,2023-12-27,Why Canada's ban on foreign buyers hasn't made homes more affordable,https://www.cbc.ca/news/canada/british-columbia/canada-foreign-buyer-ban-housing-affordability-1.7058154,negative,0.025349123,0.5189239,0.4557269,-0.26863947329605065
CBC,2023-12-27,A 'tough' decision: When it's time to say good-bye to a family pet,https://www.cbc.ca/news/canada/prince-edward-island/pei-pet-euthanasia-decision-1.7064124,negative,0.042053897,0.2347145,0.72323155,-0.05332237484670799
CBC,2023-12-27,Go beyond the headlines | Stream CBC News Explore,https://www.cbc.cahttps://www.cbc.ca/news/cbc-news-explore-1.6512577,neutral,0.09185704,0.0112939505,0.89684886,0.008310174861161368
CBC,2023-12-27,WATCH: CBC News Network,https://www.cbc.cahttps://gem.cbc.ca/live,neutral,0.10073908,0.018231502,0.88102955,0.00981596340483426
CBC,2023-12-27,At least 5 killed in Russian attack on Ukraine train station,https://www.cbc.ca/news/world/ukraine-russia-war-1.7069642,negative,0.0060953605,0.8223922,0.17151245,-0.6762917945605569
CBC,2023-12-27,Premier claims former PC government tried to ram through silica mining approval days after Manitoba election,https://www.cbc.ca/news/canada/manitoba/sio-silica-kinew-pcs-approval-rush-manitoba-1.7069415,negative,0.008889833,0.5469534,0.44415674,-0.2990789865436483
CBC,2023-12-27,Trafficker got tips from Manitoba Finance official to avoid getting caught with illegal cigarettes: court doc,https://www.cbc.ca/news/canada/manitoba/project-dawgpound-dealer-sentenced-1.7065153,negative,0.027620232,0.27333662,0.6990432,-0.07395001582405669
CBC,2023-12-27,"Ukrainian leader's rude awakening: In Washington, his country's destiny is a bargaining chip",https://www.cbc.ca/news/world/zelenskyy-washington-dc-visit-funding-analysis-1.7057334,negative,0.013655075,0.63669986,0.34964514,-0.4052002077969803
CBC,2023-12-27,Could some policy wins lift the NDP's political fortunes?,https://www.cbc.ca/news/politics/ndp-liberal-agreement-polling-1.7066016,positive,0.4674634,0.01080596,0.52173066,0.21840525154578216
CBC,2023-12-27,University of New Brunswick curler brings down the hammer with one-of-a-kind prosthetic,https://www.cbc.ca/news/canada/new-brunswick/unb-student-athlete-prosthetic-1.7064893,neutral,0.13659938,0.045217287,0.8181833,0.01661478910288139
CBC,2023-12-27,Why bison are being reintroduced on the Prairies,https://www.cbc.ca/player/play/2295175747938,negative,0.027619395,0.24590121,0.72647935,-0.05970458507158494
CBC,2023-12-27,Manitoba family waits for return of son's body from Ukraine's front lines,https://www.cbc.ca/news/politics/family-waits-return-austin-lathlin-bercier-ukraine-1.7066348,neutral,0.03457417,0.06868727,0.8967385,-0.0035225686662254674
