source,date,headline,url,chosen_label,positive,negative,neutral,compound
Global,2023-11-06,"Canadians ‘trapped’ in Gaza put all of their hopes on Sunday’s evacuation, NDP MP says",https://globalnews.ca/video/10074612/canadians-trapped-in-gaza-put-all-of-their-hopes-on-sundays-evacuation-ndp-mp-says/,negative,0.016202323,0.3970588,0.5867388,-0.15739319821569353
Global,2023-11-06,Gaza suffers 3rd communications blackout as death toll climbs,https://globalnews.ca/video/10072722/gaza-suffers-3rd-communications-blackout-as-death-toll-climbs/,negative,0.0075068115,0.8208789,0.17161441,-0.6737857573017436
Global,2023-11-06,Atlantic premiers call on Trudeau to address complaints about carbon pricing carve-out,https://globalnews.ca/video/10074179/atlantic-premiers-call-on-trudeau-to-address-complaints-about-carbon-pricing-carve-out/,neutral,0.03926267,0.095974736,0.86476254,-0.0076695953446686005
Global,2023-11-06,45-minute long orca attack sinks yet another yacht off Morocco,https://globalnews.ca/news/10073433/orca-attack-sinks-yacht-morskie-mile/,negative,0.014273215,0.69375145,0.2919753,-0.48108737567949156
Global,2023-11-06,Peterborough 2024 draft budget shows potential for heavy rate increase,https://globalnews.ca/video/10074577/peterborough-2024-draft-budget-shows-potential-for-heavy-rate-increase/,negative,0.025301326,0.27668542,0.69801337,-0.0759146321800408
Global,2023-11-06,"Issue with carbon pricing pause is the implementation, not the policy: Saskatchewan premier",https://globalnews.ca/video/10074700/issue-with-carbon-pricing-pause-is-the-implementation-not-the-policy-saskatchewan-premier/,negative,0.01350584,0.44402257,0.5424716,-0.1969736313050987
Global,2023-11-06,Hamilton cardiologist faces criticism over comment about pro-Palestinian protest,https://globalnews.ca/news/10072655/deport-hamilton-cardiologist-mcmaster-professor-pro-palestine-protst/,negative,0.012366163,0.47137943,0.5162543,-0.2220456849192125
Global,2023-11-06,Poilievre pushes Trudeau to make his motion on carbon pricing a ‘confidence vote’,https://globalnews.ca/video/10067410/poilievre-pushes-trudeau-to-make-his-motion-on-carbon-pricing-a-confidence-vote/,neutral,0.057374645,0.04664146,0.89598376,0.0011164254354769643
Global,2023-11-06,"Direct departures doubling to sun and sand as Air Transat expands at London, Ont. airport",https://globalnews.ca/news/10074166/direct-departures-doubling-air-transat-london/,neutral,0.06073595,0.03337406,0.9058901,0.0025750243889848257
Global,2023-11-06,Canada will officially be in a recession if downward data trends continue,https://globalnews.ca/video/10062637/canada-will-officially-be-in-a-recession-if-downward-data-trends-continue/,negative,0.013479738,0.77903366,0.2074866,-0.606711765041311
Global,2023-11-06,Are rate hikes over? Market watchers give their forecast to Bank of Canada,https://globalnews.ca/news/10073251/bank-of-canada-rates-market-survey-q3-2023/,neutral,0.05844604,0.020868251,0.9206857,0.0029804554363033198
Global,2023-11-06,Loyalist College suspends journalism programs indefinitely,https://globalnews.ca/news/10074596/loyalist-college-suspends-journalism-programs/,negative,0.0065712384,0.8652077,0.12822104,-0.74854118596582
Global,2023-11-06,Vernon organization aims to brighten holidays for seniors,https://globalnews.ca/news/10074140/vernon-organization-brighten-holidays-seniors/,positive,0.85428715,0.0036472322,0.14206553,0.7297933296976566
Global,2023-11-06,City and private Edmonton developer turning former YMCA into affordable housing,https://globalnews.ca/news/10074097/city-affordable-housing-grant-edmonton-developer-ymca-downtown/,neutral,0.109909005,0.017003337,0.87308764,0.011790877463177196
Global,2023-11-06,MPs vote down Poilievre’s push to expand carbon price pause,https://globalnews.ca/news/10073006/carbon-pricing-home-heating-vote/,negative,0.017645316,0.2733237,0.70903087,-0.07439451825106147
Global,2023-11-06,Bank of Canada holds rates at 5%,https://globalnews.ca/video/10050495/bank-of-canada-holds-rates-at-5/,neutral,0.10681851,0.024384355,0.86879724,0.010815588442680824
Global,2023-11-06,English universities propose new plan to address concerns over tuition and French language,https://globalnews.ca/video/10074613/english-universities-propose-new-plan-to-address-concerns-over-tuition-and-french-language/,neutral,0.03236109,0.08764492,0.8799939,-0.0066343959196402125
Global,2023-11-06,MPs vote down Poilievre’s push to expand carbon price pause,https://globalnews.ca/video/10074599/mps-vote-down-poilievres-push-to-expand-carbon-price-pause/,negative,0.017645316,0.2733237,0.70903087,-0.07439451825106147
Global,2023-11-06,"N.B. coroner’s inquest begins into death of Lexi Daken, teen who died by suicide in 2021",https://globalnews.ca/news/10074013/coroners-inquest-death-lexi-daken/,negative,0.01645425,0.31384403,0.66970176,-0.09822732091948616
Global,2023-11-06,London Fire Department partners with Wounded Warriors Canada for mental health supports,https://globalnews.ca/news/10074388/london-fire-department-wounded-warriors-canada-mental-health/,neutral,0.08622734,0.01249587,0.9012768,0.00727900513077806
Global,2023-11-06,Ste. Anne’s Hospital veterans honoured in Remembrance Day ceremony,https://globalnews.ca/video/10074583/ste-annes-hospital-veterans-honoured-in-remembrance-day-ceremony/,positive,0.6807692,0.0034709293,0.31575984,0.4634346630590436
Global,2023-11-06,COVID-19 wastewater testing now used to discover other human viruses in Canadian lakes,https://globalnews.ca/video/10072733/covid-19-wastewater-testing-now-used-to-discover-other-human-viruses-in-canadian-lakes/,negative,0.029330296,0.26027554,0.71039414,-0.06688309518926516
Global,2023-11-06,Global News at 6 New Brunswick: Nov. 6,https://globalnews.ca/video/10074528/global-news-at-6-new-brunswick-nov-6-5/,neutral,0.029169763,0.014263492,0.9565667,0.0006474286436597421
Global,2023-11-06,Global News at 5:30 Montreal: Nov. 6,https://globalnews.ca/video/10074691/global-news-at-530-montreal-nov-6-3/,neutral,0.035300683,0.012356155,0.9523432,0.0010934622264313631
Global,2023-11-06,Rogers to lock out former Shaw technicians across Lower Mainland,https://globalnews.ca/news/10071008/rogers-lock-out-former-shaw-technicians/,negative,0.014615402,0.24739988,0.73798466,-0.06099310526772683
Global,2023-11-06,No trick! Meet a couple who won a $55-million lottery jackpot on Halloween,https://globalnews.ca/news/10073153/no-trick-meet-a-couple-who-won-a-55-million-lottery-jackpot-on-halloween/,positive,0.7979849,0.0042465273,0.19776854,0.6367618881937176
Global,2023-11-06,Halifax set to host national conference with goal of ending homelessness,https://globalnews.ca/news/10074478/national-conference-homelessness-halifax/,neutral,0.12583072,0.024168437,0.8500008,0.015249261645994938
Global,2023-11-06,Global News at 6 Halifax: Nov. 6,https://globalnews.ca/video/10074517/global-news-at-6-halifax-nov-6-5/,neutral,0.04139391,0.012214852,0.9463912,0.001564253611033628
Global,2023-11-06,Conservative MP accuses Liberal MP of giving ‘the finger’ after question period,https://globalnews.ca/video/10074619/conservative-mp-accuses-liberal-mp-of-giving-the-finger-after-question-period/,negative,0.01850757,0.3062963,0.6751962,-0.09347487790991238
Global,2023-11-06,"Quebec students, parents join teachers on picket lines in province-wide strike",https://globalnews.ca/video/10074582/quebec-students-parents-join-teachers-on-picket-lines-in-province-wide-strike/,negative,0.02351801,0.24681129,0.7296707,-0.06036271386674308
Global,2023-11-06,Scotch Creek Water System upgrade underway,https://globalnews.ca/news/10074249/scotch-creek-water-system-upgrade-underway/,neutral,0.089231096,0.01052843,0.9002403,0.00785135417177063
Global,2023-11-06,"Study on short-term rentals in N.B. taking too long, says tenants advocate",https://globalnews.ca/news/10074288/tenants-advocate-provincial-study-short-term-rentals/,negative,0.01173917,0.5054578,0.48280305,-0.25534978359176286
Global,2023-11-06,Collisions closes lane on Calgary’s Glenmore Trail,https://globalnews.ca/news/10074598/collisions-close-lanes-calgary-glenmore-trail-downtown/,negative,0.014923962,0.5041256,0.48095044,-0.25391989104644264
Global,2023-11-06,Crescent Point solidifies Montney dominance in $2.55B deal for Hammerhead Energy,https://globalnews.ca/news/10074455/crescent-point-hammerhead-energy-deal-montney/,neutral,0.16075157,0.0058389306,0.83340967,0.025806947562172056
Global,2023-11-06,Winnipeg’s Rainbow Gala celebrates 50 years of RRC empowering 2SLGBTQ+ community,https://globalnews.ca/video/10074803/winnipegs-rainbow-gala-celebrates-50-years-of-rrc-empowering-2slgbtq-community/,positive,0.9084405,0.0020175746,0.08954187,0.8252601128059771
Global,2023-11-06,"High-risk sex offender expected to live in Winnipeg, police caution",https://globalnews.ca/news/10074217/high-risk-sex-offender-winnipeg-police/,negative,0.013198652,0.53185433,0.45494702,-0.28269480948302217
CTV,2023-11-06,'I’m not going to be homeless': Motel tenants won’t be evicted after homeless hub plan cancelled,https://london.ctvnews.ca/i-m-not-going-to-be-homeless-motel-tenants-won-t-be-evicted-after-homeless-hub-plan-cancelled-1.6632783,neutral,0.05859886,0.22768055,0.7137205,-0.04840462099963361
CTV,2023-11-06,Jewish group speaks out after cafes targeted in pro-Palestinian rallies,https://toronto.ctvnews.ca/jewish-group-speaks-out-after-cafes-targeted-in-pro-palestinian-rallies-1.6633496,negative,0.017488109,0.54749167,0.4350202,-0.2994412939308404
CTV,2023-11-06,"Ontario to consult on banning NDAs in cases of workplace harassment, misconduct",https://toronto.ctvnews.ca/ontario-to-consult-on-banning-ndas-in-cases-of-workplace-harassment-misconduct-1.6632398,negative,0.012759109,0.40676892,0.58047205,-0.1652981223295047
CTV,2023-11-06,Aid trickles in as survivors salvage belongings from rubble in Nepal villages struck by earthquake,https://www.ctvnews.ca/world/aid-trickles-in-as-survivors-salvage-belongings-from-rubble-in-nepal-villages-struck-by-earthquake-1.6633217,neutral,0.12871064,0.07357197,0.79771733,0.011153597212656408
CTV,2023-11-06,Police pass animal cruelty investigation to provincial welfare agency,https://northernontario.ctvnews.ca/police-pass-animal-cruelty-investigation-to-provincial-welfare-agency-1.6633222,negative,0.016772756,0.54030055,0.44292668,-0.29164337281098973
CTV,2023-11-06,"'Priscilla' stars Cailee Spaeny, Jacob Elordi on trust, Sofia and souvenirs",https://www.ctvnews.ca/entertainment/priscilla-stars-cailee-spaeny-jacob-elordi-on-trust-sofia-and-souvenirs-1.6633192,neutral,0.14901143,0.0057705753,0.845218,0.022171105485605302
CTV,2023-11-06,Rogers to lock out former Shaw technicians Monday after contract talks break down,https://www.ctvnews.ca/business/rogers-to-lock-out-former-shaw-technicians-monday-after-contract-talks-break-down-1.6631277,negative,0.009955857,0.3888835,0.6011607,-0.15113123597729938
CTV,2023-11-06,"Alleged impaired driver hits two cars, drives through front yards in Kitchener",https://kitchener.ctvnews.ca/alleged-impaired-driver-hits-two-cars-drives-through-front-yards-in-kitchener-1.6633380,negative,0.01134791,0.66677636,0.3218758,-0.44446189935790414
CTV,2023-11-06,'All of a sudden I started smelling smoke': Woman recounts escaping from burning vehicle on Hwy. 401,https://toronto.ctvnews.ca/all-of-a-sudden-i-started-smelling-smoke-woman-recounts-escaping-from-burning-vehicle-on-hwy-401-1.6633305,negative,0.015877923,0.37249595,0.6116261,-0.13850113411492337
CTV,2023-11-06,"TVO workers reach tentative deal with employer, ending 11-week strike",https://toronto.ctvnews.ca/tvo-workers-reach-tentative-deal-with-employer-ending-11-week-strike-1.6632224,neutral,0.08963378,0.05196067,0.8584056,0.00533430153756953
CTV,2023-11-06,A young race car driver from Canada is inspiring people all around the world,https://www.ctvnews.ca/w5/a-young-race-car-driver-from-canada-is-inspiring-people-all-around-the-world-1.6629956,positive,0.9637036,0.0030413314,0.033255033,0.9287153908787955
CTV,2023-11-06,Quebec man facing charges for allegedly smuggling counterfeit $2 coins into Canada,https://montreal.ctvnews.ca/quebec-man-facing-charges-for-allegedly-smuggling-counterfeit-2-coins-into-canada-1.6632878,negative,0.011817923,0.62323344,0.36494863,-0.3882802541458119
CTV,2023-11-06,Quebec retirees win $55M lottery jackpot on Halloween,https://montreal.ctvnews.ca/quebec-retirees-win-55m-lottery-jackpot-on-halloween-1.6632987,positive,0.5013427,0.0062942,0.492363,0.25130494413519955
CTV,2023-11-06,Wanted B.C. sex offender still missing after monitoring bracelet cut off,https://bc.ctvnews.ca/wanted-b-c-sex-offender-still-missing-after-monitoring-bracelet-cut-off-1.6632808,negative,0.007820518,0.6790383,0.3131413,-0.4610317531728647
CTV,2023-11-06,"Israel-Hamas conflict causes surge of discrimination, B.C. human rights commissioner says",https://bc.ctvnews.ca/israel-hamas-conflict-causes-surge-of-discrimination-b-c-human-rights-commissioner-says-1.6633235,negative,0.0071688625,0.7306093,0.2622219,-0.5337384883114638
CTV,2023-11-06,Opening of new Saskatoon community market delayed until March,https://saskatoon.ctvnews.ca/opening-of-new-saskatoon-community-market-delayed-until-march-1.6633498,negative,0.012203569,0.24022004,0.7475764,-0.05755673363924352
CTV,2023-11-06,"Man accused of killing four women, disposing of bodies, pleads not guilty in Winnipeg",https://winnipeg.ctvnews.ca/man-accused-of-killing-four-women-disposing-of-bodies-pleads-not-guilty-in-winnipeg-1.6632625,negative,0.00897644,0.73537225,0.25565115,-0.5406918705910204
CTV,2023-11-06,NDP-backed Conservative motion to expand carbon tax carve-out to all home heating defeated in the House,https://www.ctvnews.ca/politics/ndp-backed-conservative-motion-to-expand-carbon-tax-carve-out-to-all-home-heating-defeated-in-the-house-1.6632908,negative,0.020800652,0.41177455,0.5674248,-0.1691256212642429
CTV,2023-11-06,How the Grinch stole copper: N.B. nursing home fundraiser festival robbed,https://atlantic.ctvnews.ca/more/how-the-grinch-stole-copper-n-b-nursing-home-fundraiser-festival-robbed-1.6628881,negative,0.012992615,0.58208066,0.40492678,-0.33864905525908284
CTV,2023-11-06,Mounties investigating suspicious death in Surrey,https://bc.ctvnews.ca/mounties-investigating-suspicious-death-in-surrey-1.6633509,neutral,0.019017646,0.12634568,0.8546366,-0.015601567048373344
CTV,2023-11-06,"Google's antitrust headaches compound with another trial, this one targeting its Play Store",https://www.ctvnews.ca/sci-tech/google-s-antitrust-headaches-compound-with-another-trial-this-one-targeting-its-play-store-1.6632439,negative,0.013730581,0.7970475,0.18922204,-0.6350960882690835
CTV,2023-11-06,"Cody Dorman, who watched namesake horse win Breeders' Cup race, dies on trip home",https://www.ctvnews.ca/sports/cody-dorman-who-watched-namesake-horse-win-breeders-cup-race-dies-on-trip-home-1.6632928,negative,0.0333996,0.31430814,0.6522922,-0.09767408747779527
CTV,2023-11-06,Social media warning about 'extremely violent' Vancouver sexual assault prompts police investigation,https://bc.ctvnews.ca/social-media-warning-about-extremely-violent-vancouver-sexual-assault-prompts-police-investigation-1.6633050,negative,0.011147838,0.5114657,0.47738633,-0.26147296123061103
CTV,2023-11-06,"Mind-altering ketamine becomes new pain treatment in the U.S., despite little research or regulation",https://www.ctvnews.ca/lifestyle/mind-altering-ketamine-becomes-new-pain-treatment-in-the-u-s-despite-little-research-or-regulation-1.6633347,neutral,0.066577874,0.105706945,0.82771516,-0.006741345785998831
CTV,2023-11-06,Ontario to make it mandatory for salaries to be disclosed in job postings,https://toronto.ctvnews.ca/ontario-to-make-it-mandatory-for-salaries-to-be-disclosed-in-job-postings-1.6632099,neutral,0.03677302,0.060392205,0.9028347,-0.002294964988492021
CTV,2023-11-06,Canadian poet Rupi Kaur declines White House invitation over Gaza,https://www.ctvnews.ca/world/canadian-poet-rupi-kaur-declines-white-house-invitation-over-gaza-1.6633374,negative,0.00982359,0.53090376,0.45927265,-0.2817623119759194
CTV,2023-11-06,Police investigating fatal daylight shooting at Scarborough apartment building,https://toronto.ctvnews.ca/police-investigating-fatal-daylight-shooting-at-scarborough-apartment-building-1.6633073,neutral,0.021115996,0.20428509,0.77459896,-0.04128650560678793
CTV,2023-11-06,Windsor man uses Apple AirTag to track down stolen car,https://windsor.ctvnews.ca/windsor-man-uses-apple-airtag-to-track-down-stolen-car-1.6633207,negative,0.03617069,0.2481105,0.7157188,-0.0602505027725897
CTV,2023-11-06,Man accused of threatening Ottawa rabbi,https://ottawa.ctvnews.ca/man-accused-of-threatening-ottawa-rabbi-1.6633261,negative,0.013099143,0.6540288,0.33287206,-0.4275820681049769
CTV,2023-11-06,Eastern Ontario man taken to hospital following tarantula-involved collision,https://ottawa.ctvnews.ca/eastern-ontario-man-taken-to-hospital-following-tarantula-involved-collision-1.6630146,negative,0.016984928,0.43668932,0.54632574,-0.19040907160729503
CTV,2023-11-06,B.C. police watchdog investigating woman's death at Victoria hotel,https://bc.ctvnews.ca/b-c-police-watchdog-investigating-woman-s-death-at-victoria-hotel-1.6633329,negative,0.014378372,0.2482503,0.7373713,-0.061421476765701755
CTV,2023-11-06,Northwest Calgary elementary school placed into lockdown due to nearby police investigation,https://calgary.ctvnews.ca/northwest-calgary-elementary-school-placed-into-lockdown-due-to-nearby-police-investigation-1.6633504,neutral,0.011143121,0.21874075,0.77011603,-0.04772336669856703
CTV,2023-11-06,'Doc' Antle of Netflix's 'Tiger King' pleads guilty to wildlife trafficking and money laundering,https://www.ctvnews.ca/entertainment/doc-antle-of-netflix-s-tiger-king-pleads-guilty-to-wildlife-trafficking-and-money-laundering-1.6632960,negative,0.030851541,0.37775803,0.5913904,-0.14174932927524253
CTV,2023-11-06,Ottawa police investigating daytime shooting in Centretown,https://ottawa.ctvnews.ca/ottawa-police-investigating-daytime-shooting-in-centretown-1.6633118,neutral,0.016726505,0.1063836,0.8768899,-0.011037695699451788
CTV,2023-11-06,Police investigating Ont. Christmas market cancellation,https://www.ctvnews.ca/video?playlistId=1.6620916,negative,0.008910429,0.4736098,0.5174799,-0.22422679655608135
CTV,2023-11-06,"Garbage fire dumped onto Horseshoe Valley Road takes 60,000 gallons water to extinguish",https://barrie.ctvnews.ca/garbage-fire-dumped-onto-horseshoe-valley-road-takes-60-000-gallons-water-to-extinguish-1.6633140,negative,0.0137382625,0.7211686,0.26509297,-0.5198955037302042
CTV,2023-11-06,"Don't put that rhinestone emblem on your car's steering wheel, U.S. regulators say",https://www.ctvnews.ca/autos/don-t-put-that-rhinestone-emblem-on-your-car-s-steering-wheel-u-s-regulators-say-1.6633161,negative,0.028001482,0.4466411,0.52535737,-0.19870420273617384
CTV,2023-11-06,Red Bull's Perez gets some solace at sprint race of Brazilian Formula One Grand Prix,https://www.ctvnews.ca/sports/red-bull-s-perez-gets-some-solace-at-sprint-race-of-brazilian-formula-one-grand-prix-1.6631486,positive,0.5569968,0.007996212,0.43500704,0.3101814881543348
CTV,2023-11-06,Canada manhunt: Escaped sex offender cut off ankle monitor,https://www.ctvnews.ca/video?playlistId=1.6632324,negative,0.014038053,0.6146258,0.37133622,-0.3775677862753497
CTV,2023-11-06,Former Canadian skating coach Richard Gauthier sentenced to 12 months for sex assault,https://montreal.ctvnews.ca/former-canadian-skating-coach-richard-gauthier-sentenced-to-12-months-for-sex-assault-1.6633244,negative,0.008695718,0.71782935,0.27347478,-0.5152034610162701
CTV,2023-11-06,Sunak says agreements at UK summit tip the balance in favor of humanity in fight against AI threats,https://www.ctvnews.ca/sci-tech/sunak-says-agreements-at-uk-summit-tip-the-balance-in-favor-of-humanity-in-fight-against-ai-threats-1.6629668,positive,0.35194883,0.01669289,0.6313582,0.1235893550200533
CTV,2023-11-06,Fort Saskatchewan couple celebrating doubly unique birth of daughter,https://edmonton.ctvnews.ca/fort-saskatchewan-couple-celebrating-doubly-unique-birth-of-daughter-1.6633348,positive,0.8718141,0.0033934365,0.12479263,0.7600481640714674
CTV,2023-11-06,"Victim uncooperative after stabbing at Gallery nightclub, Vancouver police say",https://bc.ctvnews.ca/victim-uncooperative-after-stabbing-at-gallery-nightclub-vancouver-police-say-1.6633508,negative,0.009626044,0.5555631,0.43481076,-0.30855775405956365
CTV,2023-11-06,"Veltman jury on 'standby': Evidence concludes in Windsor, Ont. terror trial",https://london.ctvnews.ca/veltman-jury-on-standby-evidence-concludes-in-windsor-ont-terror-trial-1.6633529,neutral,0.037430663,0.108336076,0.8542332,-0.010335655391370935
CTV,2023-11-06,'A public health concern': Should Canadians stop turning back the clocks?,https://www.ctvnews.ca/health/a-public-health-concern-should-canadians-stop-turning-back-the-clocks-1.6631140,negative,0.011867934,0.31826717,0.6698649,-0.1011531413348905
CTV,2023-11-06,"Ailing Pope Francis meets with European rabbis and condemns antisemitism, terrorism, war",https://www.ctvnews.ca/world/ailing-pope-francis-meets-with-european-rabbis-and-condemns-antisemitism-terrorism-war-1.6632448,neutral,0.0900353,0.13806215,0.77190244,-0.01095480773130486
CTV,2023-11-06,Quebec English universities pitch more French courses for students instead of tuition hikes,https://montreal.ctvnews.ca/quebec-english-universities-pitch-more-french-courses-for-students-instead-of-tuition-hikes-1.6632444,neutral,0.1307792,0.052724198,0.8164967,0.01432335410058716
CTV,2023-11-06,"Morale down, cronyism up after DeSantis takeover of Disney World government, ex-employees say",https://www.ctvnews.ca/world/morale-down-cronyism-up-after-desantis-takeover-of-disney-world-government-ex-employees-say-1.6632854,negative,0.02001804,0.59663683,0.38334507,-0.35557482141141605
CTV,2023-11-06,Sask. man turns old cars into NASCAR replicas,https://saskatoon.ctvnews.ca/sask-man-turns-old-cars-into-nascar-replicas-1.6633526,neutral,0.113574445,0.16664357,0.719782,-0.014870925629308474
CTV,2023-11-06,Could the waiting game finally be over for Boblo Island residents as ferry shutdown continues?,https://windsor.ctvnews.ca/could-the-waiting-game-finally-be-over-for-boblo-island-residents-as-ferry-shutdown-continues-1.6633624,neutral,0.06934747,0.11068563,0.81996685,-0.00744223916398834
CTV,2023-11-06,Average rental prices in Canada surge to record highs in October 2023: report,https://www.ctvnews.ca/business/average-rental-prices-in-canada-surge-to-record-highs-in-october-2023-report-1.6631480,neutral,0.04078871,0.12012958,0.83908165,-0.012767401913321486
CTV,2023-11-06,Sask. man convicted in high-profile murder case dies in B.C. prison,https://saskatoon.ctvnews.ca/sask-man-convicted-in-high-profile-murder-case-dies-in-b-c-prison-1.6633079,negative,0.012312274,0.53986937,0.44781837,-0.29130732630448897
CTV,2023-11-06,Backstage with the Fugees: Pras on his hip-hop legacy as he awaits sentencing in conspiracy case,https://www.ctvnews.ca/entertainment/backstage-with-the-fugees-pras-on-his-hip-hop-legacy-as-he-awaits-sentencing-in-conspiracy-case-1.6633510,neutral,0.04906577,0.026076796,0.9248574,0.0017274517221026464
CTV,2023-11-06,"Ontario tribunal deliberates fate of Wasaga Beach doctor accused of sexual abuse, unprofessional conduct",https://barrie.ctvnews.ca/ontario-tribunal-deliberates-fate-of-wasaga-beach-doctor-accused-of-sexual-abuse-unprofessional-conduct-1.6633404,negative,0.009391273,0.6664494,0.32415932,-0.4440666440113539
CTV,2023-11-06,Canada Post pays tribute to N.S. war hero Mona Parsons,https://atlantic.ctvnews.ca/more/canada-post-pays-tribute-to-n-s-war-hero-mona-parsons-1.6633468,positive,0.2749935,0.016918194,0.7080882,0.07533522820085814
CTV,2023-11-06,Two Nigerian workers killed in generator explosion at Canada's high commission,https://www.ctvnews.ca/canada/two-nigerian-workers-killed-in-generator-explosion-at-canada-s-high-commission-1.6632877,negative,0.007291575,0.7523334,0.24037492,-0.5659524707540413
CTV,2023-11-06,Trudeau confirms appointment of Alberta judge Mary Moreau to Supreme Court of Canada,https://www.ctvnews.ca/politics/trudeau-confirms-appointment-of-alberta-judge-mary-moreau-to-supreme-court-of-canada-1.6632868,neutral,0.12380607,0.011968785,0.86422515,0.01518469038797221
CTV,2023-11-06,Online game opened Alberta mom's accounts to hackers,https://calgary.ctvnews.ca/online-game-opened-alberta-mom-s-accounts-to-hackers-1.6627998,negative,0.011181854,0.7510525,0.23776558,-0.5639548887769585
CTV,2023-11-06,Watch what Trump did while walking out of the courtroom,https://www.ctvnews.ca/video?playlistId=1.6581103,neutral,0.03810987,0.10159635,0.8602938,-0.008869454408118482
CTV,2023-11-06,"Ottawans rally to donate blood after hospital fire, but the need is still strong",https://ottawa.ctvnews.ca/ottawans-rally-to-donate-blood-after-hospital-fire-but-the-need-is-still-strong-1.6633565,neutral,0.10573065,0.13914116,0.7551282,-0.008181290204986702
CTV,2023-11-06,Man facing first-degree murder charge following fatal Halifax stabbing,https://atlantic.ctvnews.ca/man-facing-first-degree-murder-charge-following-fatal-halifax-stabbing-1.6632679,negative,0.010223113,0.7491667,0.24060997,-0.5611464275160873
CTV,2023-11-06,Judge chides Trump as ex-president testifies in civil fraud trial: 'This is not a political rally',https://www.ctvnews.ca/world/judge-chides-trump-as-ex-president-testifies-in-civil-fraud-trial-this-is-not-a-political-rally-1.6632460,negative,0.02143003,0.48739848,0.49117154,-0.23709799921229902
CTV,2023-11-06,Canadians wait to flee Gaza Strip as border crossing reopens for approved evacuees,https://www.ctvnews.ca/canada/canadians-wait-to-flee-gaza-strip-as-border-crossing-reopens-for-approved-evacuees-1.6632715,neutral,0.063517354,0.054867834,0.8816148,0.001023975186378756
