source,date,headline,url,chosen_label,positive,negative,neutral,compound
CTV,2023-10-04,'Bunny Hug' trademarked by Sask. vendor,https://regina.ctvnews.ca/bunny-hug-trademarked-by-sask-vendor-1.6580677,neutral,0.09399016,0.009807638,0.8962024,0.008737945096080058
CTV,2023-10-04,New York City moves to suspend 'right to shelter' as migrant influx continues,https://www.ctvnews.ca/world/new-york-city-moves-to-suspend-right-to-shelter-as-migrant-influx-continues-1.6588680,negative,0.01223068,0.34442708,0.64334214,-0.11848045254027895
CTV,2023-10-04,GTA home sales drop 7.1% in September as higher rates bite,https://toronto.ctvnews.ca/gta-home-sales-drop-7-1-in-september-as-higher-rates-bite-1.6588048,negative,0.018711854,0.5873916,0.39389652,-0.3446787753813645
CTV,2023-10-04,How rate hikes have sparked debate on the causes of inflation and how to fight it,https://www.ctvnews.ca/business/how-rate-hikes-have-sparked-debate-on-the-causes-of-inflation-and-how-to-fight-it-1.6588126,neutral,0.024841543,0.18263611,0.7925223,-0.03273885164191981
CTV,2023-10-04,"After critical report, N.S. promises to fine ambulance company for poor service",https://atlantic.ctvnews.ca/after-critical-report-n-s-promises-to-fine-ambulance-company-for-poor-service-1.6588519,negative,0.008255572,0.8023432,0.1894012,-0.6436864509703133
CTV,2023-10-04,'QAnon queen' supporters allegedly threaten Sask. village leaders with 'executions',https://saskatoon.ctvnews.ca/qanon-queen-supporters-allegedly-threaten-sask-village-leaders-with-executions-1.6588739,negative,0.006951097,0.74681115,0.24623777,-0.5576785672834674
CTV,2023-10-04,New Nanos polling: Poilievre's CPC in majority territory,https://www.ctvnews.ca/video?playlistId=1.6570046,neutral,0.075234435,0.01154997,0.9132156,0.0055268193806341515
CTV,2023-10-04,This family bought a cheap house in Italy because the U.S. is too expensive,https://www.ctvnews.ca/lifestyle/this-family-bought-a-cheap-house-in-italy-because-the-u-s-is-too-expensive-1.6588639,negative,0.091312125,0.3455848,0.563103,-0.11109097439650384
CTV,2023-10-04,Record-breaking heat in Kitchener-Waterloo,https://kitchener.ctvnews.ca/record-breaking-heat-in-kitchener-waterloo-1.6587342,neutral,0.061953563,0.15418445,0.78386194,-0.019934605268234762
CTV,2023-10-04,U.K. police open a corporate manslaughter investigation into a hospital where a nurse killed 7 babies,https://www.ctvnews.ca/world/u-k-police-open-a-corporate-manslaughter-investigation-into-a-hospital-where-a-nurse-killed-7-babies-1.6588205,negative,0.0047769677,0.8329482,0.16227473,-0.6937799840584873
CTV,2023-10-04,SQ targets 'grandparent scam' gang in Montreal conning elderly people in the U.S.,https://montreal.ctvnews.ca/sq-targets-grandparent-scam-gang-in-montreal-conning-elderly-people-in-the-u-s-1.6588109,negative,0.008748701,0.64918536,0.34206602,-0.42136503377169277
CTV,2023-10-04,Cloud of $20 bills causes disturbance in southeast Calgary,https://calgary.ctvnews.ca/cloud-of-20-bills-causes-disturbance-in-southeast-calgary-1.6588279,negative,0.011426611,0.57668036,0.41189304,-0.33242965551046666
CTV,2023-10-04,Suspect charged in rapper Tupac Shakur's fatal shooting makes first court appearance in Las Vegas,https://www.ctvnews.ca/entertainment/suspect-charged-in-rapper-tupac-shakur-s-fatal-shooting-makes-first-court-appearance-in-las-vegas-1.6588491,negative,0.021579348,0.31442556,0.6639952,-0.09839772795814383
CTV,2023-10-04,'Bear attack bad': Alberta couple identified as pair killed in grizzly attack,https://calgary.ctvnews.ca/bear-attack-bad-alberta-couple-identified-as-pair-killed-in-grizzly-attack-1.6588878,negative,0.0045153406,0.879178,0.11630679,-0.7729334346683014
CTV,2023-10-04,U.S. in antitrust trial accuses Google of illegal methods to push up ad prices,https://www.ctvnews.ca/sci-tech/u-s-in-antitrust-trial-accuses-google-of-illegal-methods-to-push-up-ad-prices-1.6588689,negative,0.015982408,0.57389,0.41012773,-0.3290942119078437
CTV,2023-10-04,'Time to unite as Manitobans': Kinew following majority win,https://www.ctvnews.ca/video?playlistId=1.6548407,positive,0.42692983,0.00843129,0.564639,0.1821979570348482
CTV,2023-10-04,Accused downloaded and viewed white nationalism manifesto: Windsor police testimony,https://windsor.ctvnews.ca/accused-downloaded-and-viewed-white-nationalism-manifesto-windsor-police-testimony-1.6588573,negative,0.017488843,0.37107882,0.6114324,-0.13739361997162725
CTV,2023-10-04,Accident at Cypress Mountain kills heavy equipment operator,https://bc.ctvnews.ca/accident-at-cypress-mountain-kills-heavy-equipment-operator-1.6588738,negative,0.009817684,0.6974216,0.2927607,-0.4863005366378559
CTV,2023-10-04,Sirens blare across Russia as it holds nationwide emergency drills,https://www.ctvnews.ca/world/sirens-blare-across-russia-as-it-holds-nationwide-emergency-drills-1.6588418,negative,0.020371001,0.2679642,0.7116648,-0.07138983849935876
CTV,2023-10-04,A look back at election day in Manitoba,https://winnipeg.ctvnews.ca/a-look-back-at-election-day-in-manitoba-1.6586510,neutral,0.0913914,0.02679408,0.88181454,0.0076344644336314715
CTV,2023-10-04,2030 World Cup set to be hosted by Spain-Portugal-Morocco with 3 South American countries added,https://www.ctvnews.ca/sports/2030-world-cup-set-to-be-hosted-by-spain-portugal-morocco-with-3-south-american-countries-added-1.6588611,neutral,0.11542791,0.007942999,0.87662894,0.013260528320097276
CTV,2023-10-04,Suspects wanted for vandalism at Barrie residence,https://barrie.ctvnews.ca/suspects-wanted-for-vandalism-at-barrie-residence-1.6588675,negative,0.009744271,0.6891117,0.30114394,-0.4747800376739022
CTV,2023-10-04,"Here's how much it costs to raise children in Canada, according to new statistics",https://www.ctvnews.ca/canada/here-s-how-much-it-costs-to-raise-children-in-canada-according-to-new-statistics-1.6588427,neutral,0.06009884,0.114965096,0.82493603,-0.009605104176053203
CTV,2023-10-04,Timmins police investigating fatal parking lot explosion,https://northernontario.ctvnews.ca/timmins-police-investigating-fatal-parking-lot-explosion-1.6588360,negative,0.022617737,0.2945187,0.68286353,-0.08622971656386547
CTV,2023-10-04,"Rabbits on Granville Island being trapped, euthanized amid coyote concerns",https://bc.ctvnews.ca/rabbits-on-granville-island-being-trapped-euthanized-amid-coyote-concerns-1.6580291,negative,0.01010561,0.52400136,0.46589303,-0.2744753018671986
CTV,2023-10-04,"Rideau Hall reviewing medals granted to Nazi veteran, amid Hill talk about unsealing documents",https://www.ctvnews.ca/politics/rideau-hall-reviewing-medals-granted-to-nazi-veteran-amid-hill-talk-about-unsealing-documents-1.6588673,neutral,0.020703666,0.11826717,0.8610292,-0.013558477612789943
CTV,2023-10-04,Veterans' headstones vandalized in Fredericton cemetery,https://atlantic.ctvnews.ca/veterans-headstones-vandalized-in-fredericton-cemetery-1.6588430,negative,0.0074556954,0.59611595,0.39642832,-0.35529865197574395
CTV,2023-10-04,"Man shot by police after ramming RCMP cruiser was not seriously harmed, IIO finds",https://bc.ctvnews.ca/vancouver-news-headlines/man-shot-by-police-after-ramming-rcmp-cruiser-was-not-seriously-harmed-iio-finds-1.6588507,negative,0.028157696,0.25966325,0.712179,-0.06663215998747862
CTV,2023-10-04,Mariah Carey is going on a Christmas tour. Here's when it comes to Toronto,https://toronto.ctvnews.ca/mariah-carey-is-going-on-a-christmas-tour-here-s-when-it-comes-to-toronto-1.6586438,positive,0.5205778,0.0023287965,0.4770934,0.27099581035612275
CTV,2023-10-04,B.C. family rallying around little girls who lost their firefighter dad in highway crash,https://bc.ctvnews.ca/b-c-family-rallying-around-little-girls-who-lost-their-firefighter-dad-in-highway-crash-1.6579070,neutral,0.069336936,0.22851606,0.70214707,-0.04741196820318372
CTV,2023-10-04,"Google packs more artificial intelligence into new Pixel phones, raises prices for devices by US$100",https://www.ctvnews.ca/business/google-packs-more-artificial-intelligence-into-new-pixel-phones-raises-prices-for-devices-by-us-100-1.6588790,neutral,0.20418158,0.07478266,0.7210356,0.036097689937836464
CTV,2023-10-04,'I'm sorry': Saskatoon woman seen in FreshCo arrest video apologizes to guard,https://saskatoon.ctvnews.ca/i-m-sorry-saskatoon-woman-seen-in-freshco-arrest-video-apologizes-to-guard-1.6588881,neutral,0.049744423,0.18599209,0.7642634,-0.032118562390785144
CBC,2023-10-04,Trudeau 'looking carefully' at releasing names of ex-Nazis in Canada,https://www.cbc.ca/news/politics/trudeau-deschenes-commission-ex-nazis-1.6986364,neutral,0.03237433,0.074606076,0.8930197,-0.0045179658632790165
CBC,2023-10-04,Protesters push Manitoba government to search landfill for murdered women,https://www.cbc.ca/player/play/2264804931524,negative,0.008108606,0.656228,0.33566344,-0.43056940742688
CBC,2023-10-04,"In Manitoba, Wab Kinew to become Canada's 1st First Nations provincial premier",https://www.cbc.ca/news/canada/manitoba/2023-manitoba-election-results-1.6985468,neutral,0.093337625,0.010678101,0.8959842,0.008597899143715892
CBC,2023-10-04,What warmer weather — and a warmer climate — means for the fall leaves,https://www.cbc.ca/player/play/2269364291942,positive,0.36285594,0.007095289,0.6300488,0.13161408039791844
CBC,2023-10-04,Ontario apartment buildings bring investors double-digit returns. Some tenants say they're paying the price,https://www.cbc.ca/news/canada/hamilton/equiton-apartment-buildings-1.6978668,positive,0.27782646,0.061093513,0.66108,0.07345513047780017
CBC,2023-10-04,Pope Francis warns of 'point of no return' on climate change as key Vatican summit begins,https://www.cbc.ca/news/world/pope-francis-environment-update-1.6986107,negative,0.021727586,0.35797793,0.6202944,-0.12767613784644105
CBC,2023-10-04,FTX founder Sam Bankman-Fried accused of stealing at least $10B US as fraud trial gets underway,https://www.cbc.ca/news/world/ftx-bankman-fried-fraud-trial-1.6986574,negative,0.015227659,0.71020347,0.27456895,-0.5041570228600509
CBC,2023-10-04,'This is a business proposition': Crown releases Cameron Ortis's emails to an RCMP target,https://www.cbc.ca/news/politics/cameron-ortis-trial-start-jury-1.6986376,neutral,0.037772432,0.04330289,0.9189246,-0.0004483839257771738
CBC,2023-10-04,WestJet suspends flights between Toronto and Montreal until next April,https://www.cbc.ca/news/business/westjet-flights-toronto-montreal-1.6986307,negative,0.009010778,0.5075148,0.48347437,-0.257490081984308
CBC,2023-10-04,WATCH: CBC News Network,https://www.cbc.cahttps://gem.cbc.ca/benefits-premium?cmp=DM_NewsTile_Gem_PremiumNN,neutral,0.10073908,0.018231502,0.88102955,0.00981596340483426
CBC,2023-10-04,New blockade goes up at Winnipeg's Brady Road landfill as protesters demand search for women's remains,https://www.cbc.ca/news/canada/manitoba/brady-road-landfill-blockade-returns-1.6980394,negative,0.00874769,0.62015545,0.37109673,-0.38451633741630076
CBC,2023-10-04,Manitoba's decision not to search landfill 'heartless': Crown-Indigenous relations minister,https://www.cbc.ca/news/canada/manitoba/miller-stefanson-landfill-1.6904881,negative,0.011424671,0.5185871,0.46998814,-0.2688021156472651
CBC,2023-10-04,Joni Mitchell releases 1972 song featuring Neil Young ahead of album release,https://www.cbc.ca/news/entertainment/joni-mitchell-demo-neil-young-1.6986578,neutral,0.09922046,0.0044181566,0.89636135,0.009825182821643352
CBC,2023-10-04,Federal government commits $740K toward further review of possible search Winnipeg-area landfill,https://www.cbc.ca/news/canada/manitoba/federal-funding-landfill-search-manitoba-winnipeg-1.6986471,neutral,0.11164525,0.021943644,0.8664111,0.011983140023597016
CBC,2023-10-04,Minor hockey players required to wear bottom layer to dressing room or change in washroom,https://www.cbc.ca/news/canada/nova-scotia/hockey-canada-dressing-room-bottom-layer-new-policy-1.6985217,neutral,0.03961896,0.02847146,0.9319097,0.0007590369026038157
CBC,2023-10-04,"Backcountry campers killed by bear in Banff National Park were on multi-day trip, family says",https://www.cbc.ca/news/canada/calgary/bear-attack-parks-canada-1.6985580,negative,0.0140054915,0.42128912,0.5647055,-0.17728832943598505
CBC,2023-10-04,"Wales lowered speed limits on most roads, and people are not happy",https://www.cbc.ca/news/world/wales-traffic-lower-speed-limit-1.6985184,negative,0.01164897,0.84201103,0.1463399,-0.7088469830824806
CBC,2023-10-04,Feasibility committee chairs reject province's claims that safe landfill search isn't possible,https://www.cbc.ca/news/canada/manitoba/assembly-manitoba-chiefs-update-landfill-search-winnipeg-1.6908881,negative,0.011888682,0.64645517,0.34165618,-0.41776292547877425
CBC,2023-10-04,"RCMP holds regimental funeral for officer killed in Coquitlam, B.C.",https://www.cbc.ca/news/canada/british-columbia/rcmp-regimental-funeral-1.6985562,negative,0.011059874,0.3375765,0.6513637,-0.11383555869272755
CBC,2023-10-04,Judge at Trump trial pounds his fist in frustration with defence lawyer,https://www.cbc.ca/news/world/trump-fraud-trial-judge-1.6986653,negative,0.023626246,0.60033983,0.37603384,-0.3598497452298943
CBC,2023-10-04,"Nobel chemistry prize winners for work on quantum dots leaked early, and then announced",https://www.cbc.ca/news/science/nobel-prize-chemistry-leak-1.6984249,neutral,0.0845534,0.018301565,0.897145,0.006814333669589168
CBC,2023-10-04,"France turns to sniffer dogs to hunt for possible bedbugs on trains, subway cars",https://www.cbc.ca/news/world/france-bedbugs-sniffer-dogs-1.6986492,negative,0.027724741,0.36379838,0.6084769,-0.13158059984817783
CBC,2023-10-04,"Manifesto of man accused of terror attack against London, Ont., Muslim family read at murder trial",https://www.cbc.ca/news/canada/london/manifesto-of-man-accused-of-terror-attack-against-london-ont-muslim-family-read-at-murder-trial-1.6986403,negative,0.0073758513,0.6656472,0.32697695,-0.4430318034754528
CBC,2023-10-04,"Protesters at Winnipeg landfill hoist flag targeting 'Heartless Heather,' remain steadfast",https://www.cbc.ca/news/canada/manitoba/brady-landfill-protest-winnipeg-flag-1.6908856,negative,0.028956877,0.3038897,0.66715336,-0.0915104597029881
CBC,2023-10-04,2 Republicans step forward as candidates to replace deposed U.S. House Speaker,https://www.cbc.ca/news/world/us-house-speaker-candidates-1.6986712,neutral,0.04138725,0.016827663,0.941785,0.0014297368052054171
CBC,2023-10-04,Woman with terminal cancer searches for someone to take in her 3 senior dogs,https://www.cbc.ca/news/canada/saskatoon/woman-terminal-cancer-needs-home-three-dogs-1.6985308,negative,0.032644514,0.37879032,0.58856523,-0.14241642105968566
CBC,2023-10-04,What's gained and lost in private-public partnerships between Ontario colleges,https://www.cbc.ca/news/canada/sudbury/post-secondary-education-international-students-housing-immigration-1.6984469,neutral,0.03382202,0.07022572,0.8959524,-0.0037877179484679946
CBC,2023-10-04,Go beyond the headlines | Stream CBC News Explore,https://www.cbc.cahttps://www.cbc.ca/news/cbc-news-explore-1.6512577,neutral,0.10185861,0.013737929,0.8844034,0.010186449934611819
CBC,2023-10-04,"When I was at my lowest, the people I relied on offered little more than thoughts and prayers",https://www.cbc.ca/news/canada/edmonton/first-person-medgine-mathurin-communities-of-support-1.6970438,negative,0.016362369,0.7875549,0.19608268,-0.6199750474367534
CBC,2023-10-04,Canada's defence minister steals a page from Stephen Harper's playbook to justify cuts,https://www.cbc.ca/news/politics/department-national-defence-budget-bill-blair-1.6985796,negative,0.01695932,0.57805806,0.4049825,-0.33386357404365796
CBC,2023-10-04,U.S. Congress headless after a first-in-history ouster of House Speaker,https://www.cbc.ca/news/world/kevin-mccarthy-ousted-house-speaker-1.6985653,negative,0.018169397,0.6756137,0.30621696,-0.4561237070482349
CBC,2023-10-04,"Accountability in Greenbelt controversy leads back to Premier Doug Ford, political experts say",https://www.cbc.ca/news/canada/toronto/greenbelt-accountability-ford-1.6985348,neutral,0.019888617,0.1943245,0.785787,-0.03736643634885084
CBC,2023-10-04,"Years after scathing report into mistreatment of Indigenous people in Quebec, few calls to action imposed",https://www.cbc.ca/news/canada/montreal/calls-to-action-first-update-viens-commission-1.6986248,negative,0.0066733896,0.8007687,0.19255807,-0.6411858276249909
CBC,2023-10-04,What The Golden Bachelor gets right — and wrong — about the love lives of seniors,https://www.cbc.ca/news/entertainment/golden-bachelor-senior-representation-1.6985609,negative,0.04608298,0.32431725,0.62959975,-0.10305804433841992
