source,date,headline,url,chosen_label,positive,negative,neutral,compound
CTV,2023-10-08,'Reprehensible and disgusting': Doug Ford speaks out against rallies celebrating Israel attacks,https://toronto.ctvnews.ca/reprehensible-and-disgusting-doug-ford-speaks-out-against-rallies-celebrating-israel-attacks-1.6594073,negative,0.006055761,0.8744743,0.11947005,-0.764668509250479
CTV,2023-10-08,"Disrupting Saudi-Israel ties may have motivated Hamas attack, Blinken says",https://www.ctvnews.ca/world/disrupting-saudi-israel-ties-may-have-motivated-hamas-attack-blinken-says-1.6593843,negative,0.006769404,0.6546477,0.3385828,-0.4285178350967769
CTV,2023-10-08,Kitchener's Dogtoberfest: A Pawsome Oktoberfest Experience,https://kitchener.ctvnews.ca/kitchener-s-dogtoberfest-a-pawsome-oktoberfest-experience-1.6593585,positive,0.6179981,0.004420898,0.37758094,0.38190217266333804
CTV,2023-10-08,'Bunny Hug' trademarked by Sask. vendor,https://regina.ctvnews.ca/bunny-hug-trademarked-by-sask-vendor-1.6580677,neutral,0.09399016,0.009807638,0.8962024,0.008737945096080058
CTV,2023-10-08,Health Canada issues turkey recall for western provinces,https://www.ctvnews.ca/health/health-canada-issues-turkey-recall-for-western-provinces-1.6593375,neutral,0.018349115,0.09873884,0.8829121,-0.009412663920264741
CTV,2023-10-08,Goderich boardwalk to be renamed in honour of former mayor,https://london.ctvnews.ca/goderich-boardwalk-to-be-renamed-in-honour-of-former-mayor-1.6594029,neutral,0.12533754,0.009756149,0.8649062,0.015614330567117918
CTV,2023-10-08,Sask. lawyers call out premier for 'judicial overreach' comments,https://saskatoon.ctvnews.ca/sask-lawyers-call-out-premier-for-judicial-overreach-comments-1.6594014,negative,0.012064004,0.6313175,0.35661843,-0.39841629688384117
CTV,2023-10-08,Officials respond to Tri-Cities parents' concerns about youth violence,https://bc.ctvnews.ca/officials-respond-to-tri-cities-parents-concerns-about-youth-violence-1.6593657,neutral,0.016566727,0.16902256,0.8144106,-0.028294183129661477
CTV,2023-10-08,Canadian Embassy in Israel closed for Thanksgiving as citizens reach out for support amid war,https://www.ctvnews.ca/canada/canadian-embassy-in-israel-closed-for-thanksgiving-as-citizens-reach-out-for-support-amid-war-1.6593980,negative,0.013025944,0.46941906,0.51755506,-0.22018455359606293
CTV,2023-10-08,1 killed and 8 wounded in shooting at Pennsylvania community centre party,https://www.ctvnews.ca/world/1-killed-and-8-wounded-in-shooting-at-pennsylvania-community-centre-party-1.6594086,negative,0.0097764665,0.6645169,0.32570666,-0.44148712623954367
CTV,2023-10-08,"Desperate people dig out dead and injured from quakes that killed over 2,000 in Afghanistan",https://www.ctvnews.ca/world/desperate-people-dig-out-dead-and-injured-from-quakes-that-killed-over-2-000-in-afghanistan-1.6593810,negative,0.0056017605,0.8873676,0.10703073,-0.7873898033049862
CTV,2023-10-08,"Two dead, driver arrested following crash in Buckingham, Que.",https://ottawa.ctvnews.ca/two-dead-driver-arrested-following-crash-in-buckingham-que-1.6593900,negative,0.009347105,0.6509576,0.33969533,-0.423658408736614
CTV,2023-10-08,'It was like Niagara Falls': Montreal condo residents sue city after building floods several times,https://montreal.ctvnews.ca/it-was-like-niagara-falls-montreal-condo-residents-sue-city-after-building-floods-several-times-1.6593519,negative,0.010212171,0.69687253,0.2929153,-0.4855270172229087
CTV,2023-10-08,Boo at the Zoo returns,https://winnipeg.ctvnews.ca/boo-at-the-zoo-returns-1.6594038,positive,0.4900998,0.018298652,0.49160165,0.23986291893093714
CTV,2023-10-08,Nearly 100 refugees in Toronto transferred to other Ontario cities for shelter,https://toronto.ctvnews.ca/nearly-100-refugees-in-toronto-transferred-to-other-ontario-cities-for-shelter-1.6592335,neutral,0.028109929,0.06819532,0.90369475,-0.003860433570492816
CTV,2023-10-08,2 teens die in single-vehicle collision west of Hinton,https://edmonton.ctvnews.ca/2-teens-die-in-single-vehicle-collision-west-of-hinton-1.6593289,negative,0.0144898845,0.5631623,0.4223478,-0.31694183310199975
CTV,2023-10-08,How a lonely mountain lion led to the creation of the world’s largest wildlife overpass,https://www.ctvnews.ca/lifestyle/how-a-lonely-mountain-lion-led-to-the-creation-of-the-world-s-largest-wildlife-overpass-1.6593883,neutral,0.16704069,0.13065128,0.70230794,0.010832838589792004
CTV,2023-10-08,Disability advocates warn eligibility for federal dental-care plan may be cumbersome,https://www.ctvnews.ca/politics/disability-advocates-warn-eligibility-for-federal-dental-care-plan-may-be-cumbersome-1.6592170,negative,0.016308825,0.5462449,0.4374463,-0.2981175018789628
CTV,2023-10-08,These books are being used to train AI. No one told the authors,https://www.ctvnews.ca/sci-tech/these-books-are-being-used-to-train-ai-no-one-told-the-authors-1.6594068,negative,0.01425377,0.5690599,0.4166864,-0.32362595905726366
CTV,2023-10-08,"Are people more disrespectful, unkind since the pandemic? Experts say yes and here's why",https://www.ctvnews.ca/canada/are-people-more-disrespectful-unkind-since-the-pandemic-experts-say-yes-and-here-s-why-1.6593991,negative,0.013410293,0.71758825,0.26900154,-0.5147530132894005
CTV,2023-10-08,Turkey recall in Western Canada: What you need to know,https://www.ctvnews.ca/video?playlistId=1.6593600,neutral,0.032865625,0.04113775,0.9259966,-0.0006121654596062953
CTV,2023-10-08,Why is India so worried about Sikh separatist calls for Khalistan?,https://www.ctvnews.ca/world/why-is-india-so-worried-about-sikh-separatist-calls-for-khalistan-1.6592993,negative,0.013880036,0.4480625,0.53805745,-0.20056735661110991
CTV,2023-10-08,"Cloudy, rainy conditions likely to wrap up weekend",https://windsor.ctvnews.ca/cloudy-rainy-conditions-likely-to-wrap-up-weekend-1.6593841,negative,0.038516887,0.28924194,0.67224115,-0.0821773572274811
CTV,2023-10-08,"Canadian universities bet on international students, but global shifts present risks",https://bc.ctvnews.ca/canadian-universities-bet-on-international-students-but-global-shifts-present-risks-1.6594075,neutral,0.061054375,0.09697634,0.8419693,-0.00567677283816681
CTV,2023-10-08,"Amid attack on Israel, police across Canada monitoring religious centres, say 'no threat at this time'",https://www.ctvnews.ca/canada/amid-attack-on-israel-police-across-canada-monitoring-religious-centres-say-no-threat-at-this-time-1.6593936,neutral,0.03159775,0.14534959,0.8230527,-0.02012808109699815
CTV,2023-10-08,Israel suspects Iran assisted Hamas in surprise attack,https://www.ctvnews.ca/video?playlistId=1.6593355,negative,0.012950046,0.6072051,0.3798449,-0.36853028530650533
CTV,2023-10-08,Manitoba-made game going to New York toy fair,https://winnipeg.ctvnews.ca/manitoba-made-game-going-to-new-york-toy-fair-1.6579722,neutral,0.15838261,0.009671672,0.8319458,0.024991500861840876
CTV,2023-10-08,Families in anguish as Quebec truck driver charged in fatal northern Ont. crash eludes police,https://northernontario.ctvnews.ca/families-in-anguish-as-quebec-truck-driver-charged-in-fatal-northern-ont-crash-eludes-police-1.6592179,negative,0.007486597,0.7678002,0.22471322,-0.5894611051669241
CTV,2023-10-08,Veterans' headstones vandalized in Fredericton cemetery,https://atlantic.ctvnews.ca/veterans-headstones-vandalized-in-fredericton-cemetery-1.6588430,negative,0.0074556954,0.59611595,0.39642832,-0.35529865197574395
CTV,2023-10-08,"'Very clear' Iran involved in attacks on Israel, Canada's ambassador to the UN says",https://www.ctvnews.ca/politics/very-clear-iran-involved-in-attacks-on-israel-canada-s-ambassador-to-the-un-says-1.6593803,negative,0.016251715,0.35308254,0.6306658,-0.12440315017911985
CTV,2023-10-08,Four sent to hospital following Saturday night crash in Greater Sudbury,https://northernontario.ctvnews.ca/four-sent-to-hospital-following-saturday-night-crash-in-greater-sudbury-1.6593974,negative,0.0143754855,0.4294188,0.5562057,-0.18419386573626007
CTV,2023-10-08,New Hockey Canada rules say players must wear 'minimum attire' in change rooms,https://saskatoon.ctvnews.ca/new-hockey-canada-rules-say-players-must-wear-minimum-attire-in-change-rooms-1.6593957,neutral,0.02288825,0.1166931,0.8604187,-0.013093405199777308
CTV,2023-10-08,Unifor says it's facing resistance as GM contract deadline nears,https://www.ctvnews.ca/autos/unifor-says-it-s-facing-resistance-as-gm-contract-deadline-nears-1.6591463,negative,0.0118563725,0.5034068,0.4847367,-0.2532778993917191
CTV,2023-10-08,"Vaping nicotine can be a 'crutch,' and for those trying to quit, the process can be painful",https://www.ctvnews.ca/health/vaping-nicotine-can-be-a-crutch-and-for-those-trying-to-quit-the-process-can-be-painful-1.6590347,negative,0.010224898,0.80019367,0.18958145,-0.6402053572197239
CTV,2023-10-08,New Calgary opera company looks to produce works by living composers and Canadian artists,https://calgary.ctvnews.ca/new-calgary-opera-company-looks-to-produce-works-by-living-composers-and-canadian-artists-1.6594070,neutral,0.13895099,0.007034966,0.8540141,0.01925787854869121
CTV,2023-10-08,"Rabbits on Granville Island being trapped, euthanized amid coyote concerns",https://bc.ctvnews.ca/rabbits-on-granville-island-being-trapped-euthanized-amid-coyote-concerns-1.6580291,negative,0.01010561,0.52400136,0.46589303,-0.2744753018671986
CTV,2023-10-08,WARNING: Sights and sound in Israel as rockets hit,https://www.ctvnews.ca/video?playlistId=1.6593363,negative,0.0126099745,0.7358378,0.25155222,-0.54129828215288
CBC,2023-10-08,5 generations thrive under Circo Osorio's big top,https://www.cbc.cahttps://www.cbc.ca/newsinteractives/features/circo-osorio-photos,positive,0.8800607,0.008092912,0.111846395,0.77444128556666
CBC,2023-10-08,Age is just a number — unless you're a bride in your late 60s,https://www.cbc.ca/news/canada/age-is-just-a-number-unless-you-re-a-bride-in-your-late-60s-1.6989490,neutral,0.055307753,0.14837973,0.7963126,-0.01895759130164798
CBC,2023-10-08,"Remnants of post-tropical storm Philippe bring high winds, heavy rain to Maritimes",https://www.cbc.ca/news/canada/nova-scotia/post-tropical-storm-philippe-maritimes-1.6990480,neutral,0.03389435,0.17968085,0.7864248,-0.031136380517170714
CBC,2023-10-08,"Death toll from earthquakes in western Afghanistan rises to over 2,000, Taliban says",https://www.cbc.ca/news/world/afghanistan-earthquakes-1.6990467,negative,0.007012078,0.7970439,0.19594404,-0.6352298170532134
CBC,2023-10-08,"New U.K. law allowing deportation of illegal migrants benefits traffickers, says former PM",https://www.cbc.ca/news/world/modern-slavery-migrants-traffickers-theresa-may-1.6989373,negative,0.015601905,0.4289287,0.5554695,-0.18373636366118262
CBC,2023-10-08,"Could you live like a monk for a month? In this university class, it's the final project",https://www.cbc.ca/radio/tapestry/living-deliberately-university-pennsylvania-tapestry-1.6988112,neutral,0.13449433,0.10030765,0.765198,0.008027101943904213
CBC,2023-10-08,Hundreds feared dead after powerful earthquake rocks western Afghanistan,https://www.cbc.ca/news/world/afghanistan-earthquake-dead-1.6990380,negative,0.014441876,0.6815387,0.30401954,-0.4642863744280348
CBC,2023-10-08,"Hamas operation designed to 'change the status quo,' expert says",https://www.cbc.ca/player/play/2270649923897,negative,0.016726783,0.25619638,0.72707677,-0.06535681772617963
CBC,2023-10-08,'Game Boy Mom' photo traced to Sask. after more than a decade of memes,https://www.cbc.ca/news/canada/saskatchewan/game-boy-mom-meme-sask-family-1.6989557,neutral,0.07550147,0.04559103,0.87890744,0.0036219318679160395
CBC,2023-10-08,47-year mortgages; Big chains promise grocery relief: CBC's Marketplace cheat sheet,https://www.cbc.ca/news/business/marketplace-cheat-sheet-oct8-1.6989349,neutral,0.114026986,0.11404038,0.7719326,-3.055223686487807e-06
CBC,2023-10-08,Listen to the Music: Impromptu Doobie Brothers set in 1980 part of Halifax lore,https://www.cbc.ca/news/canada/nova-scotia/doobie-brothers-1980-halifax-lore-1.6988803,neutral,0.119448826,0.0053005386,0.87525064,0.014239926275307013
CBC,2023-10-08,This noted feminist is really worried about men's problems,https://www.cbc.ca/radio/sunday/caitlin-moran-feminism-men-overlooked-1.6982762,negative,0.019796753,0.6825549,0.29764843,-0.4654892424101149
CBC,2023-10-08,WATCH: CBC News Network,https://www.cbc.cahttps://gem.cbc.ca/benefits-premium?cmp=DM_NewsTile_Gem_PremiumNN,neutral,0.10073908,0.018231502,0.88102955,0.00981596340483426
CBC,2023-10-08,Who will get to see Queen Elizabeth's private papers?,https://www.cbc.ca/news/world/queen-elizabeth-private-papers-royal-ceo-six-the-musical-1.6988995,neutral,0.023076903,0.061423693,0.91549927,-0.0032403317307818646
CBC,2023-10-08,Danielle Smith's big-money sales pitch on Alberta pension plan hasn't worked yet,https://www.cbc.ca/news/canada/calgary/analysis-alberta-pension-abacus-poll-briefing-note-1.6989983,negative,0.024076544,0.6155857,0.3603377,-0.3783661093039914
CBC,2023-10-08,Alarm bells are ringing: What markets are trying to warn us about the economy,https://www.cbc.ca/news/business/bonds-markets-recession-economy-armstrong-1.6989733,neutral,0.045784947,0.0803587,0.87385637,-0.0043612587839623185
CBC,2023-10-08,B.C. has doubled its old wildfire record. Experts say we can take action now to slow crisis,https://www.cbc.ca/news/canada/british-columbia/experts-say-action-needed-now-after-bc-doubles-old-wildfire-record-1.6989473,negative,0.029137703,0.3096089,0.6612533,-0.0950087028158535
CBC,2023-10-08,Canada on sidelines as Haiti finally gets an armed intervention against gang violence,https://www.cbc.ca/news/politics/canada-haiti-un-security-council-1.6989881,negative,0.017854387,0.45682603,0.52531964,-0.20837121729197605
CBC,2023-10-08,How just a 10-minute work break could improve your mental and physical health,https://www.cbc.ca/radio/whitecoat/10-minute-work-break-1.6987596,positive,0.8157053,0.011083335,0.17321137,0.6652522704844941
CBC,2023-10-08,Foreign doctors take up more medical residency spots as Canadians struggle to get in,https://www.cbc.ca/news/politics/foreign-nationals-medical-residency-canadians-struggle-1.6988983,neutral,0.03981243,0.20057118,0.7596164,-0.03864377075598924
CBC,2023-10-08,Donated Taylor Swift tickets a gold rush for mental health foundation,https://www.cbc.ca/news/canada/newfoundland-labrador/kristi-allan-taylor-swift-jacob-puddester-memorial-foundation-1.6988800,positive,0.616303,0.009221617,0.37447533,0.3797444006288231
CBC,2023-10-08,Canadian men's volleyball team earns spot at Paris Olympics,https://www.cbc.ca/sports/olympics/summer/volleyball/canada-mexico-men-volleyball-olympic-qualifier-recap-oct-8-1.6990458,positive,0.47245815,0.0033787952,0.5241631,0.22320524896037952
CBC,2023-10-08,Go beyond the headlines | Stream CBC News Explore,https://www.cbc.cahttps://www.cbc.ca/news/cbc-news-explore-1.6512577,neutral,0.10185861,0.013737929,0.8844034,0.010186449934611819
CBC,2023-10-08,Cult of self-proclaimed 'Queen of Canada' threatens Sask. village with public executions,https://www.cbc.ca/news/canada/saskatchewan/cult-of-self-proclaimed-queen-of-canada-threaten-sask-village-with-public-executions-1.6988680,negative,0.00863908,0.7629476,0.22841327,-0.5820144465181736
CBC,2023-10-08,Why the Hamas surprise attack on Israel is such a significant strike,https://www.cbc.ca/news/world/israel-hamas-invasion-war-1.6990268,negative,0.010531026,0.8228435,0.16662554,-0.6769604739301069
CBC,2023-10-08,"Israel formally declares war, approves 'significant' steps to retaliate for Hamas attack",https://www.cbc.ca/news/world/israel-gaza-hamas-hezbollah-1.6990466,negative,0.014173868,0.5596164,0.42620978,-0.31296958576276346
CBC,2023-10-08,Canada clinches 1st-ever berth to T20 cricket World Cup with win over Bermuda,https://www.cbc.ca/sports/canada-bermuda-cricket-mens-t20-americas-world-cup-qualifier-final-1.6990412,positive,0.42927077,0.004497927,0.5662314,0.18425311563800761
CBC,2023-10-08,Is the carbon tax an easy scapegoat for high food prices?,https://www.cbc.ca/news/politics/carbon-tax-food-prices-wherry-analysis-1.6989547,negative,0.01535649,0.6967599,0.28788355,-0.485238569216186
CBC,2023-10-08,"How seniors can access 4 key vaccines this fall — for COVID, flu, pneumonia, and RSV",https://www.cbc.ca/news/health/covid-vaccine-seniors-fall-1.6988082,neutral,0.15328321,0.02664625,0.8200705,0.02278572283280056
CBC,2023-10-08,How the first novel written in Inuktitut continues to influence later generations,https://www.cbc.cahttps://www.cbc.ca/radiointeractives/ideas/sanaaq-inuktitut-novel-mitiarjuk-nappaaluk,neutral,0.15610279,0.021952607,0.82194465,0.023886156226121003
CBC,2023-10-08,"Canadians in Israel, Gaza urged to be 'extremely cautious'",https://www.cbc.ca/news/world/global-affairs-warning-gaza-israel-1.6990496,neutral,0.038051352,0.09024557,0.871703,-0.006696359750823611
CBC,2023-10-08,She buys all her groceries across the U.S. border — and finds big savings,https://www.cbc.ca/radio/costofliving/cross-border-grocery-shopping-1.6984492,positive,0.6621137,0.009642923,0.3282434,0.43830158139478925
CBC,2023-10-08,"Violence draws international concern, condemnation",https://www.cbc.ca/news/world/israel-hamas-war-external-reaction-1.6990244,negative,0.017061189,0.66990215,0.31303656,-0.44847787920060966
CBC,2023-10-08,Cross Country Checkup: What's your question about the Israel-Hamas conflict?,https://www.cbc.ca/player/play/2068510275642,neutral,0.020661471,0.046712134,0.9326265,-0.0017551246874325521
