source,date,headline,url,chosen_label,positive,negative,neutral,compound
CTV,2023-09-04,Metallica postpones Arizona concert after lead singer tests positive for COVID-19,https://www.ctvnews.ca/entertainment/metallica-postpones-arizona-concert-after-lead-singer-tests-positive-for-covid-19-1.6546578,negative,0.009408685,0.7078298,0.28276154,-0.5009344434650291
CTV,2023-09-04,"Billie Eilish music helped her in the ICU, then the quadriplegic teen got to meet her in person",https://montreal.ctvnews.ca/billie-eilish-music-helped-her-in-the-icu-then-the-quadriplegic-teen-got-to-meet-her-in-person-1.6535010,positive,0.8108042,0.004031424,0.18516448,0.6573871072098267
CTV,2023-09-04,Shelter-in-place order issued in Maskwacis due to 'firearms complaint': RCMP,https://edmonton.ctvnews.ca/shelter-in-place-order-issued-in-maskwacis-due-to-firearms-complaint-rcmp-1.6547028,neutral,0.015874729,0.12632194,0.8578032,-0.015705237446843157
CTV,2023-09-04,"Math anxiety develops at a young age for some students, here's how to prevent it",https://www.ctvnews.ca/lifestyle/math-anxiety-develops-at-a-young-age-for-some-students-here-s-how-to-prevent-it-1.6543641,negative,0.038551137,0.36942336,0.5920255,-0.13498742963854227
CTV,2023-09-04,Heat warning in effect for Waterloo-Wellington,https://kitchener.ctvnews.ca/heat-warning-in-effect-for-waterloo-wellington-1.6546717,neutral,0.036877938,0.08745487,0.8756671,-0.006288376962775288
CTV,2023-09-04,Manitoba premier expected to launch campaign Tuesday for Oct. 3 election,https://winnipeg.ctvnews.ca/manitoba-premier-expected-to-launch-campaign-tuesday-for-oct-3-election-1.6547177,neutral,0.041600898,0.010051295,0.9483477,0.0016296099333565905
CTV,2023-09-04,Multiple power outages restored in Windsor,https://windsor.ctvnews.ca/multiple-power-outages-restored-in-windsor-1.6546746,negative,0.029055238,0.24329166,0.727653,-0.058346641501849206
CTV,2023-09-04,Aerosmith singer and Maui homeowner Steven Tyler urges tourists to return to the island,https://www.ctvnews.ca/entertainment/aerosmith-singer-and-maui-homeowner-steven-tyler-urges-tourists-to-return-to-the-island-1.6546554,neutral,0.17287031,0.006338045,0.82079166,0.029843970147644505
CTV,2023-09-04,Serious crash on Horseshoe Valley Road under investigation,https://barrie.ctvnews.ca/serious-crash-on-horseshoe-valley-road-under-investigation-1.6546443,negative,0.021617826,0.47967172,0.4987105,-0.22961759792500658
CTV,2023-09-04,"'The landlords have no accountability': Wrongfully evicted B.C. woman wins tenancy branch battle, but says former landlord refuses to pay up",https://bc.ctvnews.ca/the-landlords-have-no-accountability-wrongfully-evicted-b-c-woman-wins-tenancy-branch-battle-but-says-former-landlord-refuses-to-pay-up-1.6546310,negative,0.0041805035,0.88184893,0.11397069,-0.7776399630652588
CTV,2023-09-04,Early lab tests suggest new COVID-19 variant BA.2.86 may be less contagious and less immune-evasive than feared,https://www.ctvnews.ca/health/coronavirus/early-lab-tests-suggest-new-covid-19-variant-ba-2-86-may-be-less-contagious-and-less-immune-evasive-than-feared-1.6547033,neutral,0.11729685,0.0595467,0.82315654,0.01021273669341749
CTV,2023-09-04,Resistance group claims responsibility for drone attack on Myanmar police that reportedly killed 5,https://www.ctvnews.ca/world/resistance-group-claims-responsibility-for-drone-attack-on-myanmar-police-that-reportedly-killed-5-1.6547135,negative,0.007543858,0.72404987,0.26840612,-0.5241914056593657
CTV,2023-09-04,Bob Barker's little-known connection to a Manitoba animal rescue,https://winnipeg.ctvnews.ca/bob-barker-s-little-known-connection-to-a-manitoba-animal-rescue-1.6538311,neutral,0.038212363,0.032164525,0.929623,0.000425628608229367
CTV,2023-09-04,What's open and closed this Labour Day weekend in Toronto?,https://toronto.ctvnews.ca/what-s-open-and-closed-this-labour-day-weekend-in-toronto-1.6543374,neutral,0.042290322,0.0068892785,0.9508204,0.0017410095933401148
CTV,2023-09-04,What's open and closed Labour Day weekend in Windsor-Essex,https://windsor.ctvnews.ca/what-s-open-and-closed-labour-day-weekend-in-windsor-essex-1.6544725,neutral,0.07869195,0.008207294,0.9131008,0.006125062091636213
CTV,2023-09-04,NDP 'absolutely' angling to leverage Liberal dip in polls for movement on key policies,https://www.ctvnews.ca/politics/ndp-absolutely-angling-to-leverage-liberal-dip-in-polls-for-movement-on-key-policies-1.6543583,neutral,0.06130213,0.17748491,0.7612129,-0.027742953003149218
CTV,2023-09-04,RCMP search for suspect after 2 injured in P.E.I. sword attack,https://atlantic.ctvnews.ca/rcmp-search-for-suspect-after-2-injured-in-p-e-i-sword-attack-1.6545802,negative,0.013048368,0.41973275,0.5672188,-0.176005357094823
CTV,2023-09-04,"Canada set to become strategic partner with ASEAN bloc, symbolizing trade progress",https://www.ctvnews.ca/politics/canada-set-to-become-strategic-partner-with-asean-bloc-symbolizing-trade-progress-1.6547141,positive,0.5065852,0.0060695596,0.48734528,0.256591706037387
CTV,2023-09-04,People with precarious employment more likely to die early than those with secure employment: study,https://www.ctvnews.ca/health/people-with-precarious-employment-more-likely-to-die-early-than-those-with-secure-employment-study-1.6545966,negative,0.011863758,0.64481413,0.34332198,-0.4156445934072117
CTV,2023-09-04,Canada's envoy to Ukraine says Canadian support will outlast Russian invasion,https://www.ctvnews.ca/canada/canada-s-envoy-to-ukraine-says-canadian-support-will-outlast-russian-invasion-1.6545812,neutral,0.18617795,0.015643742,0.7981782,0.034417521594370726
CTV,2023-09-04,'Compiling Summer into one weekend': Extremely warm temperatures arrive on final long weekend of summer,https://london.ctvnews.ca/compiling-summer-into-one-weekend-extremely-warm-temperatures-arrive-on-final-long-weekend-of-summer-1.6546759,neutral,0.16367233,0.07592479,0.76040286,0.021024058964236314
CTV,2023-09-04,Over 250 charges laid in OPP crackdown on illegal car rally in Wasaga Beach,https://barrie.ctvnews.ca/over-250-charges-laid-in-opp-crackdown-on-illegal-car-rally-in-wasaga-beach-1.6546051,negative,0.019380273,0.5961159,0.38450387,-0.3549785388216513
CTV,2023-09-04,James Smith residents look for healing on anniversary of massacre,https://saskatoon.ctvnews.ca/james-smith-residents-look-for-healing-on-anniversary-of-massacre-1.6547183,negative,0.029949944,0.31771562,0.65233445,-0.10004621353239429
CTV,2023-09-04,What Ontario parents need to know about teacher bargaining as school starts,https://toronto.ctvnews.ca/what-ontario-parents-need-to-know-about-teacher-bargaining-as-school-starts-1.6547091,neutral,0.048253834,0.045592748,0.9061533,0.0002497341410068188
CTV,2023-09-04,CRA fires 120 employees after review of 'inappropriately claimed' CERB payments,https://www.ctvnews.ca/politics/cra-fires-120-employees-after-review-of-inappropriately-claimed-cerb-payments-1.6544492,negative,0.0057303766,0.8032174,0.19105199,-0.6451255383927403
CTV,2023-09-04,France's Rugby World Cup preparations disturbed by calls to drop Chalureau in racism controversy,https://www.ctvnews.ca/sports/france-s-rugby-world-cup-preparations-disturbed-by-calls-to-drop-chalureau-in-racism-controversy-1.6547172,negative,0.0125742,0.616197,0.3712288,-0.37954062009966094
CTV,2023-09-04,City workers in Prince Albert set deadline for strike action,https://saskatoon.ctvnews.ca/city-workers-in-prince-albert-set-deadline-for-strike-action-1.6546817,neutral,0.033573084,0.10378406,0.8626428,-0.009643981670056867
CTV,2023-09-04,'All hell was breaking loose': Rival Eritrean groups clash in northeast Calgary Saturday night,https://calgary.ctvnews.ca/all-hell-was-breaking-loose-rival-eritrean-groups-clash-in-northeast-calgary-saturday-night-1.6546333,negative,0.0069376985,0.75313264,0.23992975,-0.5671605883786892
CBC,2023-09-04,"Greenbelt controversy putting pressure on Ford government, experts say",https://www.cbc.ca/news/canada/toronto/greenbelt-controversy-ford-government-1.6953746,neutral,0.020187015,0.16533704,0.81447595,-0.026928819181809338
CBC,2023-09-04,Victims identified in shooting at Ottawa wedding reception,https://www.cbc.ca/news/canada/ottawa/ottawa-south-shooting-wedding-convention-centre-two-men-dead-6-others-injured-1.6956075,negative,0.012703459,0.37784377,0.6094528,-0.14260453496181213
CBC,2023-09-04,New detectors are sniffing out teen vape-users in these northern Alberta schools,https://www.cbc.ca/news/canada/edmonton/vape-detectors-schools-youth-alberta-1.6954866,neutral,0.0296256,0.18010548,0.7902688,-0.03156032961815569
CBC,2023-09-04,Mysterious consultant known as 'Mr. X' in Greenbelt report ID'd as former Clarington mayor: sources,https://www.cbc.ca/news/canada/toronto/greenbelt-unregistered-lobbyist-development-1.6955297,neutral,0.024339817,0.12307126,0.85258895,-0.01455410556604253
CBC,2023-09-04,Canadian men's basketball team clinches Olympic spot with comeback win over Spain,https://www.cbc.ca/sports/olympics/summer/basketball/world-cup-basketball-men-roundup-canada-spain-1.6956074,positive,0.5363607,0.003291385,0.46034798,0.2876719311906992
CBC,2023-09-04,Go beyond the headlines | Stream CBC News Explore,https://www.cbc.cahttps://www.cbc.ca/news/cbc-news-explore-1.6512577,neutral,0.10185861,0.013737929,0.8844034,0.010186449934611819
CBC,2023-09-04,"Canadian army needs dedicated climate disaster force, says former top soldier",https://www.cbc.ca/news/canada/british-columbia/former-top-soldier-says-canadian-army-needs-new-disaster-response-force-1.6955373,neutral,0.048267134,0.148697,0.8030359,-0.01978107749854674
CBC,2023-09-04,Ontario Housing Minister Steve Clark resigns amid Greenbelt land swap controversy,https://www.cbc.ca/news/canada/toronto/steve-clark-resigns-greenbelt-1.6956402,negative,0.015246186,0.28643167,0.6983221,-0.0818106636828464
CBC,2023-09-04,Upholding ancient tradition of making Parmesan cheese takes high-tech turn,https://www.cbc.ca/news/world/italy-parmesan-cheese-tradition-1.6955161,positive,0.30550194,0.017133616,0.6773644,0.09303788158455895
CBC,2023-09-04,B.C.'s Imogen Moon reimagines her late grandfather's cult 1971 album with elements of jazz and soul,https://www.cbc.ca/news/canada/british-columbia/imogen-moon-doug-randle-when-they-start-rebelling-1.6955454,neutral,0.09009072,0.00609023,0.9038191,0.008079244116849793
CBC,2023-09-04,Russia strikes Ukrainian port as Putin says he won't renew grain-exporting deal,https://www.cbc.ca/news/world/russia-ukraine-sept4-1.6956353,negative,0.008888291,0.5909127,0.40019906,-0.34909878202253
CBC,2023-09-04,New 'immersive' exhibit gives visitors a virtual peek inside Parliament,https://www.cbc.ca/news/politics/parliament-immersive-experience-virtual-1.6954589,neutral,0.22031553,0.005496243,0.7741882,0.048508724405364134
CBC,2023-09-04,"Jimmy Buffett sang about P.E.I., but died before he could see it",https://www.cbc.ca/news/canada/prince-edward-island/pei-jimmy-buffet-death-lennie-gallant-1.6956210,negative,0.042732377,0.5162045,0.44106314,-0.2646410044450169
CBC,2023-09-04,Calgary airport becoming a connection of choice for U.S. travellers heading overseas,https://www.cbc.ca/news/canada/calgary/bakx-westjet-transatlantic-flights-1.6954757,neutral,0.13799486,0.010041518,0.8519637,0.018941738526577545
CBC,2023-09-04,Orientation week at University of Waterloo still about fun but more safety elements added after stabbings,https://www.cbc.ca/news/canada/kitchener-waterloo/university-waterloo-orientation-week-stabbing-safety-1.6952221,positive,0.27461135,0.09120764,0.634181,0.06709255964430838
CBC,2023-09-04,"Ukraine's defence minister to be replaced, Zelenskyy says",https://www.cbc.ca/news/world/ukraine-defence-minister-replace-zelenskyy-1.6956276,neutral,0.01928201,0.08705999,0.893658,-0.007207646761981046
CBC,2023-09-04,How developers influenced the Ford government to open up their Greenbelt land for housing,https://www.cbc.ca/news/canada/toronto/auditor-general-greenbelt-lobbying-1.6934275,neutral,0.079995416,0.032184396,0.8878202,0.005363431433923482
CBC,2023-09-04,"Meet the crossing guard who's served the same Quebec neighbourhood for 50 years, with no plans to retire",https://www.cbc.ca/news/canada/montreal/crossing-guard-quebec-city-50-years-beauport-neighbourhood-lucille-grenier-1.6955038,neutral,0.19297493,0.06915611,0.737869,0.032456746724491836
CBC,2023-09-04,Back to school means back to basics this fall as Canadians come up against high prices,https://www.cbc.ca/news/canada/back-to-school-shopping-second-hand-1.6946884,neutral,0.14917015,0.08517283,0.76565707,0.01499731810251781
CBC,2023-09-04,"Gabon coup leader sworn in as interim president, pledges 'credible' elections",https://www.cbc.ca/news/world/gabon-coup-nguema-swearing-in-1.6956370,neutral,0.119080596,0.037213273,0.8437061,0.012795365432146433
CBC,2023-09-04,Canada kept vast documents with the Chinese Exclusion Act. So why couldn't I find my great-grandpa?,https://www.cbc.cahttps://www.cbc.ca/newsinteractives/features/first-person-searching-for-proof,negative,0.010559456,0.68645316,0.3029874,-0.47110644408322244
CBC,2023-09-04,Why people with Down syndrome are living longer than ever,https://www.cbc.ca/news/canada/nova-scotia/why-people-with-down-syndrome-are-living-longer-than-ever-1.6890226,negative,0.14279394,0.28412494,0.57308125,-0.06033685405882139
CBC,2023-09-04,Canadian at Burning Man in good spirits despite 'muddy mess',https://www.cbc.ca/news/world/burning-man-festival-flood-1.6956024,positive,0.4234261,0.036786836,0.53978705,0.17793639617631385
CBC,2023-09-04,Ford stands by Ontario housing minister as opponents call for firing over Greenbelt land swap,https://www.cbc.ca/news/canada/toronto/ford-news-conference-etobicoke-1.6952957,neutral,0.0354305,0.08245631,0.88211334,-0.005543716339930782
CBC,2023-09-04,"Significant rain in Hay River, N.W.T., expected to reduce fire activity for next 2 days",https://www.cbc.ca/news/canada/north/significant-rain-in-hay-river-n-w-t-expected-to-reduce-fire-activity-for-next-2-days-1.6956216,neutral,0.0393033,0.09068539,0.8700114,-0.006679086612765284
CBC,2023-09-04,Searching for solace a year after tragedy in James Smith Cree Nation,https://www.cbc.ca/news/canada/saskatchewan/james-smith-cree-nation-one-year-1.6953080,negative,0.04616579,0.43156555,0.52226865,-0.1841175459449218
CBC,2023-09-04,"High rents, scams and paperwork make housing a struggle for international students in Winnipeg",https://www.cbc.ca/news/canada/manitoba/international-students-housing-crisis-winnipeg-1.6955737,negative,0.008841867,0.85527927,0.13587904,-0.7314242942174758
CBC,2023-09-04,Why it's so much cheaper to ship stuff from China than within Canada,https://www.cbc.ca/radio/costofliving/shipping-canada-china-1.6950967,negative,0.070928745,0.37139228,0.557679,-0.132901328667403
CBC,2023-09-04,'Violent conflict' in Calgary involving 150 people may be linked to clashes within Eritrean community: police,https://www.cbc.ca/news/canada/calgary/calgary-police-150-people-1.6956168,negative,0.006219423,0.6470126,0.34676787,-0.41858666915559617
CBC,2023-09-04,"B.C. wildfires prompt First Nation, regional district in central Interior to issue evacuation orders",https://www.cbc.ca/news/canada/british-columbia/bc-wildfires-september-3-1.6956298,negative,0.018098164,0.22834955,0.7535522,-0.051815993076914424
CBC,2023-09-04,"Ontario government's Greenbelt land swap influenced by well-connected developers, AG finds",https://www.cbc.ca/news/canada/toronto/ontario-auditor-general-greenbelt-report-1.6930390,neutral,0.027326316,0.07154496,0.9011286,-0.0043719597252520614
CBC,2023-09-04,Air Canada passengers delayed after 1 plane hits another on tarmac at Vancouver airport,https://www.cbc.ca/news/canada/british-columbia/air-canada-collision-yvr-1.6956333,negative,0.012694352,0.5240137,0.463292,-0.274429178574529
CBC,2023-09-04,War in Ukraine expected to block consensus at G20 as Trudeau visits Asia,https://www.cbc.ca/news/politics/g20-asean-indonesia-trudeau-trade-ukraine-1.6954507,negative,0.019630782,0.33935216,0.6410171,-0.11477451153156082
CBC,2023-09-04,WATCH: CBC News Network,https://www.cbc.cahttps://gem.cbc.ca/benefits-premium?cmp=DM_NewsTile_Gem_PremiumNN,neutral,0.10073908,0.018231502,0.88102955,0.00981596340483426
