source,date,headline,url,chosen_label,positive,negative,neutral,compound
CTV,2023-09-26,"Neve Campbell on her ballet past, Karen Kain and the need for change in dance world",https://www.ctvnews.ca/canada/neve-campbell-on-her-ballet-past-karen-kain-and-the-need-for-change-in-dance-world-1.6577748,neutral,0.061655704,0.028555429,0.90978885,0.0029860141705242427
CTV,2023-09-26,Canadian air force investigating 'inappropriate and unapproved' call sign broadcast on U.K. flight,https://toronto.ctvnews.ca/canadian-air-force-investigating-inappropriate-and-unapproved-call-sign-broadcast-on-u-k-flight-1.6576905,negative,0.008020863,0.57830095,0.4136783,-0.33436758967422975
CTV,2023-09-26,Arguments set to begin in Peter Nygard sex-assault case in Toronto,https://toronto.ctvnews.ca/arguments-set-to-begin-in-peter-nygard-sex-assault-case-in-toronto-1.6577820,neutral,0.016270075,0.21932451,0.76440537,-0.04783853641786884
CTV,2023-09-26,Poster advertising segregated 'whites-only' playtime in B.C.,https://www.ctvnews.ca/video?playlistId=1.6577731,neutral,0.026542453,0.2102946,0.7631629,-0.04351932415934989
CTV,2023-09-26,What's open and closed in Ottawa on National Day for Truth and Reconciliation,https://ottawa.ctvnews.ca/what-s-open-and-closed-in-ottawa-on-national-day-for-truth-and-reconciliation-1.6576540,neutral,0.041159898,0.019751765,0.93908834,0.0013040048333259335
CTV,2023-09-26,"Speaker's Nazi veteran invite 'profoundly embarrassing' Trudeau says, as Rota faces calls to resign",https://www.ctvnews.ca/politics/speaker-s-nazi-veteran-invite-profoundly-embarrassing-trudeau-says-as-rota-faces-calls-to-resign-1.6576350,negative,0.0051770355,0.8652224,0.12960064,-0.748582939076762
CTV,2023-09-26,'He had a big heart': Father of fallen teenage wildland firefighter remembers his son,https://bc.ctvnews.ca/he-had-a-big-heart-father-of-fallen-teenage-wildland-firefighter-remembers-his-son-1.6574450,positive,0.3193758,0.04934093,0.6312832,0.09956639025707226
CTV,2023-09-26,Saskatoon police requesting public’s assistance locating missing 15-year-old,https://saskatoon.ctvnews.ca/saskatoon-police-requesting-public-s-assistance-locating-missing-15-year-old-1.6577798,neutral,0.04897727,0.076230876,0.8747919,-0.00341237160334229
CTV,2023-09-26,Saudi delegation visits Palestinian territories as Israel and Saudi Arabia eye normalization,https://www.ctvnews.ca/world/saudi-delegation-visits-palestinian-territories-as-israel-and-saudi-arabia-eye-normalization-1.6577793,neutral,0.20103689,0.015291099,0.783672,0.040182020007504704
CTV,2023-09-26,"Winnipeg crash leaves one dead, three injured",https://winnipeg.ctvnews.ca/winnipeg-crash-leaves-one-dead-three-injured-1.6576522,negative,0.010691204,0.73621315,0.25309554,-0.5418955613217413
CTV,2023-09-26,Cost of living: Pepsi and Coca-Cola absent in meeting with federal industry minister,https://www.ctvnews.ca/politics/cost-of-living-pepsi-and-coca-cola-absent-in-meeting-with-federal-industry-minister-1.6576953,negative,0.01938643,0.5497017,0.4309119,-0.3017961158093243
CTV,2023-09-26,Biden will join the UAW strike picket line. Experts can't recall the last time a president did that,https://www.ctvnews.ca/world/biden-will-join-the-uaw-strike-picket-line-experts-can-t-recall-the-last-time-a-president-did-that-1.6577754,neutral,0.09594178,0.17179875,0.7322595,-0.02030998183810695
CTV,2023-09-26,Ship aground in St. Lawrence Seaway is causing traffic jam,https://www.ctvnews.ca/video?playlistId=1.6577716,negative,0.007337443,0.73978025,0.25288215,-0.5472210851198245
CTV,2023-09-26,Serbia demands that NATO takes over the policing of Kosovo's north after a deadly shootout,https://www.ctvnews.ca/world/serbia-demands-that-nato-takes-over-the-policing-of-kosovo-s-north-after-a-deadly-shootout-1.6577871,negative,0.011400802,0.610035,0.37856412,-0.3720127609592083
CTV,2023-09-26,Passengers stuck upside down on Canada's Wonderland ride,https://toronto.ctvnews.ca/passengers-stuck-upside-down-on-canada-s-wonderland-ride-1.6575480,negative,0.031163873,0.36315838,0.6056778,-0.1309128085827691
CTV,2023-09-26,Unifor contract talks with General Motors begin after workers ratify Ford deal,https://www.ctvnews.ca/business/unifor-contract-talks-with-general-motors-begin-after-workers-ratify-ford-deal-1.6577735,neutral,0.0640668,0.019941995,0.9159911,0.0037068750704460918
CTV,2023-09-26,Kremlin says Canadian recognition of veteran from Nazi unit is 'outrageous',https://www.ctvnews.ca/politics/kremlin-says-canadian-recognition-of-veteran-from-nazi-unit-is-outrageous-1.6576499,negative,0.00589344,0.83176494,0.16234145,-0.6917982995921932
CTV,2023-09-26,'Not how we wanted to find her': Saskatoon police renew calls for details in historic homicide,https://saskatoon.ctvnews.ca/not-how-we-wanted-to-find-her-saskatoon-police-renew-calls-for-details-in-historic-homicide-1.6576925,negative,0.0066187987,0.70136815,0.29201305,-0.49187347769219514
CTV,2023-09-26,Amherstburg votes in favour of regional garbage collection,https://windsor.ctvnews.ca/amherstburg-votes-in-favour-of-regional-garbage-collection-1.6577728,neutral,0.07608452,0.036800858,0.8871146,0.004434552205596853
CTV,2023-09-26,Possible 'vehicle convoy' prompts police to shut down roads around Queen's Park,https://toronto.ctvnews.ca/possible-vehicle-convoy-prompts-police-to-shut-down-roads-around-queen-s-park-1.6577734,negative,0.012726486,0.4563833,0.5308903,-0.20812371559745912
CTV,2023-09-26,Federal minister criticizes Manitoba Tory ad that cites rejection of landfill search,https://winnipeg.ctvnews.ca/federal-minister-criticizes-manitoba-tory-ad-that-cites-rejection-of-landfill-search-1.6577771,negative,0.009299445,0.58141375,0.40928677,-0.3379554810468388
CTV,2023-09-26,Ford pausing construction of Michigan battery plant amid contract talks with auto workers union,https://www.ctvnews.ca/autos/ford-pausing-construction-of-michigan-battery-plant-amid-contract-talks-with-auto-workers-union-1.6577192,negative,0.019021917,0.32483125,0.65614676,-0.10515352371278652
CTV,2023-09-26,Ontario businessman loses $38K in cheque-cashing scam,https://toronto.ctvnews.ca/ontario-businessman-loses-38k-in-cheque-cashing-scam-1.6577559,negative,0.010427669,0.7529369,0.23663543,-0.5668052499733474
CTV,2023-09-26,"London's Gatwick Airport limits flights this week due to staff illness, including COVID-19",https://www.ctvnews.ca/health/coronavirus/london-s-gatwick-airport-limits-flights-this-week-due-to-staff-illness-including-covid-19-1.6577779,negative,0.017488793,0.45647895,0.5260322,-0.20806720368462095
CTV,2023-09-26,"Man, 49, dies in hospital after being stabbed in Westmount, Que.",https://montreal.ctvnews.ca/man-49-dies-in-hospital-after-being-stabbed-in-westmount-que-1.6577708,negative,0.01063783,0.74186486,0.24749729,-0.5502503291714937
CTV,2023-09-26,Photo giant Getty took a leading AI image-maker to court. Now it's also embracing the technology,https://www.ctvnews.ca/sci-tech/photo-giant-getty-took-a-leading-ai-image-maker-to-court-now-it-s-also-embracing-the-technology-1.6576211,positive,0.48512316,0.017610257,0.49726668,0.23503431517293727
CTV,2023-09-26,Calls for Halifax-area campgrounds to stay open into the fall amid housing crisis,https://atlantic.ctvnews.ca/calls-for-halifax-area-campgrounds-to-stay-open-into-the-fall-amid-housing-crisis-1.6577763,neutral,0.030234326,0.059093505,0.910672,-0.0025779325239450035
CTV,2023-09-26,WARNING: Video shows pit bull attack that killed small dog,https://www.ctvnews.ca/video?playlistId=1.6577014,negative,0.007901957,0.8392903,0.1528076,-0.7043459007450537
CTV,2023-09-26,Canada's largest private sector union sets sights on GM for next round of auto talks,https://www.ctvnews.ca/autos/canada-s-largest-private-sector-union-sets-sights-on-gm-for-next-round-of-auto-talks-1.6576754,neutral,0.083742686,0.018642556,0.89761466,0.006665299432238925
CTV,2023-09-26,'Disbelief. Stunned. Numb': Friend remembers murdered B.C. Mountie,https://bc.ctvnews.ca/disbelief-stunned-numb-friend-remembers-murdered-b-c-mountie-1.6577538,negative,0.006353965,0.79434323,0.19930276,-0.6309408224792641
CTV,2023-09-26,It's here! Rare asteroid sample lands on Earth after OSIRIS-REx drops cargo,https://www.ctvnews.ca/sci-tech/it-s-here-rare-asteroid-sample-lands-on-earth-after-osiris-rex-drops-cargo-1.6575450,positive,0.62082905,0.004540575,0.37463027,0.3854081608331761
CTV,2023-09-26,"Parole board staff feared threats as public learned of Sask. mass killer's prior release, emails show",https://regina.ctvnews.ca/parole-board-staff-feared-threats-as-public-learned-of-sask-mass-killer-s-prior-release-emails-show-1.6576724,negative,0.0066572567,0.7238989,0.26944375,-0.5239853661386462
CTV,2023-09-26,Canada names new ambassador to Armenia amid Nagorno-Karabakh tensions,https://www.ctvnews.ca/politics/canada-names-new-ambassador-to-armenia-amid-nagorno-karabakh-tensions-1.6577223,neutral,0.029800607,0.04800272,0.92219675,-0.0014161836224346747
CTV,2023-09-26,B.C. storm: Flying scrap forces Lions Gate Bridge closure,https://www.ctvnews.ca/video?playlistId=1.6576266,negative,0.009841533,0.6145938,0.37556475,-0.3776286153496322
CTV,2023-09-26,4 families relocated after fire rips through homes in Laval,https://montreal.ctvnews.ca/4-families-relocated-after-fire-rips-through-homes-in-laval-1.6577775,negative,0.014711451,0.3786864,0.6066021,-0.14318699431951032
CTV,2023-09-26,Toymaker Lego to stick to its quest to find sustainable materials despite failed recycle attempt,https://www.ctvnews.ca/lifestyle/toymaker-lego-to-stick-to-its-quest-to-find-sustainable-materials-despite-failed-recycle-attempt-1.6576020,positive,0.2723123,0.062829286,0.6648583,0.07020650179537569
CBC,2023-09-26,Biden set to make 'unprecedented' presidential visit to autoworkers' picket line,https://www.cbc.ca/news/world/us-biden-michigan-auto-strike-1.6978230,neutral,0.15134363,0.010515761,0.8381408,0.02279428748553336
CBC,2023-09-26,"David McCallum, star of hit TV shows NCIS and The Man from U.N.C.L.E., dead at 90",https://www.cbc.ca/news/entertainment/david-mccallum-obit-1.6978144,neutral,0.09366155,0.024721043,0.8816175,0.008161350311076454
CBC,2023-09-26,Fighting to return a stolen Ethiopian prince and his treasures taken in a 19th century British raid,https://www.cbc.ca/player/play/2266923587619,negative,0.029662663,0.33933893,0.6309984,-0.1142710436834804
CBC,2023-09-26,This Saskatoon street has a bad rap; these folks want you to take a closer look,https://www.cbc.cahttps://www.cbc.ca/newsinteractives/features/20th-street-saskatoon,negative,0.004298006,0.93875486,0.056947194,-0.8812421311066387
CBC,2023-09-26,Homelessness is getting worse. Here's how people are coping,https://www.cbc.cahttps://www.cbc.ca/newsinteractives/features/unhoused,negative,0.009981762,0.8350314,0.15498686,-0.697177787241003
CBC,2023-09-26,B.C. municipality ends 36-year ban on tattoo shops,https://www.cbc.ca/news/canada/british-columbia/tattoo-shop-langley-1.6978117,negative,0.022311516,0.28393158,0.6937569,-0.08011934829761991
CBC,2023-09-26,Legacy Awards unapologetically honour Black Canadian talent,https://www.cbc.ca/news/entertainment/legacy-awards-2023-1.6977170,positive,0.8817179,0.0060664453,0.11221561,0.7773897153675939
CBC,2023-09-26,Will switching to a heat pump save you money? Here's how to find out,https://www.cbc.ca/news/science/heat-pump-cost-savings-1.6975426,positive,0.24319793,0.023405965,0.73339605,0.058597404971301614
CBC,2023-09-26,3 dead after fishing boat sinks near Quebec's Lower North Shore,https://www.cbc.ca/news/canada/montreal/fishing-boat-sinks-la-tabatiere-1.6977742,negative,0.009195363,0.7247009,0.26610368,-0.5251068795103002
CBC,2023-09-26,It's messy days in world affairs. Now Canada has egg on its face,https://www.cbc.ca/news/world/ukraine-nazi-speaker-india-diplomacy-1.6977998,negative,0.0075295228,0.88315487,0.10931551,-0.7799059403583026
CBC,2023-09-26,"For this First Nation, deciding to dig at a former residential school was 1st uneasy step in healing",https://www.cbc.cahttps://www.cbc.ca/newsinteractives/features/pine-creeks-search,neutral,0.08572979,0.18051913,0.73375106,-0.025237561723816526
CBC,2023-09-26,General Motors will be next target in Unifor's bargaining with Detroit 3 automakers,https://www.cbc.ca/news/canada/windsor/gm-unfor-bargaining-1.6977669,neutral,0.060309686,0.020192489,0.91949785,0.0032295206874435323
CBC,2023-09-26,"What is a 'bomb cyclone,' the weather pattern battering B.C.'s coast and Haida Gwaii?",https://www.cbc.ca/news/canada/british-columbia/what-is-a-bomb-cyclone-bombogenesis-1.6977647,negative,0.015316947,0.26221165,0.72247124,-0.0685203812797397
CBC,2023-09-26,Go beyond the headlines | Stream CBC News Explore,https://www.cbc.cahttps://www.cbc.ca/news/cbc-news-explore-1.6512577,neutral,0.10185861,0.013737929,0.8844034,0.010186449934611819
CBC,2023-09-26,WATCH: CBC News Network,https://www.cbc.cahttps://gem.cbc.ca/benefits-premium?cmp=DM_NewsTile_Gem_PremiumNN,neutral,0.10073908,0.018231502,0.88102955,0.00981596340483426
CBC,2023-09-26,The Speaker isn't supposed to be a problem — and that's a big problem for Anthony Rota,https://www.cbc.ca/news/politics/anthony-rota-ukraine-analysis-wherry-1.6977946,negative,0.032611683,0.5170862,0.45030212,-0.26631462546902185
CBC,2023-09-26,How Halifax is dealing with climate change — and what other action is needed,https://www.cbc.ca/news/canada/nova-scotia/how-halifax-is-dealing-with-climate-change-and-what-else-is-needed-1.6974264,neutral,0.039207797,0.08605226,0.87473994,-0.00586774011451241
CBC,2023-09-26,House Speaker under pressure to resign,https://www.cbc.ca/player/play/2266975299523,negative,0.021168204,0.2511154,0.72771645,-0.062610843414177
CBC,2023-09-26,Poland's education minister says he's 'taken steps' to extradite Yaroslav Hunka,https://www.cbc.ca/news/politics/yaroslav-hunka-poland-minister-extradite-1.6978266,neutral,0.078178965,0.011336412,0.9104846,0.005983437336027464
CBC,2023-09-26,"Selwyn Romilly, B.C.'s first Black judge, remembered as 'trailblazer' after death at 83",https://www.cbc.ca/news/canada/british-columbia/selwyn-romilly-bc-black-judge-obituary-1.6978159,neutral,0.084455706,0.104244165,0.8113001,-0.0037340802456133915
CBC,2023-09-26,Russia's Black Sea commander shown working after Ukraine forces claimed they killed him,https://www.cbc.ca/news/world/russia-ukraine-viktor-sokolov-1.6978289,negative,0.012260864,0.6108253,0.3769138,-0.3729572545152138
CBC,2023-09-26,More than $1.4M spent on hotel as Labrador town debates new shelter,https://www.cbc.cahttps://www.cbc.ca/newsinteractives/features/a-town-divided-labrador,neutral,0.070913695,0.03793349,0.8911529,0.0035897989175595058
CBC,2023-09-26,Wildland firefighters in many parts of Canada struggle to get compensated for serious illness,https://www.cbc.ca/news/canada/wildland-firefighters-compensation-canada-1.6974808,negative,0.007837862,0.81663495,0.175527,-0.666831383615424
CBC,2023-09-26,How petro-nations are approaching the shift to net zero and the future of oil,https://www.cbc.ca/news/canada/calgary/wpc-canada-us-ghana-guyana-bahrain-1.6966843,neutral,0.06320122,0.061124485,0.87567437,0.00025819125149473265
CBC,2023-09-26,Trudeau calls invite for Ukrainian who fought with Nazis 'deeply embarrassing',https://www.cbc.ca/news/politics/anthony-rota-ukrainian-veteran-1.6977384,negative,0.006789485,0.87143564,0.1217749,-0.7593539425330986
CBC,2023-09-26,"Senior Liberals believe Anthony Rota should step aside, Radio-Canada sources say",https://www.cbc.ca/news/politics/senior-liberals-anthony-rota-1.6978150,neutral,0.013876938,0.11413275,0.8719904,-0.012833707837784925
CBC,2023-09-26,"Murder trial jury shown photos of accused's apartment, damaged truck that struck London, Ont., Muslim family",https://www.cbc.ca/news/canada/london/murder-trial-jury-shown-photos-of-accused-s-apartment-damaged-truck-that-struck-london-ont-muslim-family-1.6977591,negative,0.016980408,0.3891965,0.59382313,-0.1511855587512354
CBC,2023-09-26,This 77-year-old spent a night alone on a mountain. He raised over $30K for his rescuers,https://www.cbc.ca/radio/asithappens/search-and-rescue-mountain-1.6977636,positive,0.4044576,0.0097265,0.585816,0.163491297576023
CBC,2023-09-26,Businesses fear they'll have to borrow more to repay government-backed pandemic loans,https://www.cbc.ca/news/politics/businesses-refinance-ceba-loan-forgiveness-deadline-1.6975663,negative,0.015574241,0.6225989,0.36182675,-0.3873869076818863
CBC,2023-09-26,Pandemic floods 12 big food banks with $168M in reserves,https://www.cbc.ca/news/canada/ottawa/food-bank-donation-canada-reserves-pandemic-covid-1.6965882,negative,0.025490854,0.5929844,0.38152477,-0.35098067107630193
CBC,2023-09-26,Peter Nygard sexual assault trial in Toronto to hear opening arguments,https://www.cbc.ca/news/canada/manitoba/opening-arguments-peter-nygard-sexual-assault-trial-1.6977917,neutral,0.021255597,0.13525742,0.8434869,-0.017842778525951175
CBC,2023-09-26,Calgary bylaw aimed at protecting LGBTQ events faces legal challenge,https://www.cbc.ca/news/canada/calgary/calgary-bylaw-lgbt-events-1.6975678,negative,0.028263029,0.24523434,0.7265026,-0.05934108918954628
CBC,2023-09-26,What we know about the Hollywood writers' strike tentative deal | About That,https://www.cbc.ca/player/play/2266917443674,neutral,0.024854885,0.03880208,0.93634284,-0.0008878388519450997
