source,date,headline,url,chosen_label,positive,negative,neutral,compound
CTV,2023-10-04,Stock market today: Wall Street steadies after selloff as reports suggest U.S. economy may be cooling,https://www.ctvnews.ca/business/stock-market-today-wall-street-steadies-after-selloff-as-reports-suggest-u-s-economy-may-be-cooling-1.6588296,positive,0.33649752,0.013257351,0.65024513,0.11305482044900117
CTV,2023-10-04,City of Windsor set to expand 311 services,https://windsor.ctvnews.ca/city-of-windsor-set-to-expand-311-services-1.6589020,neutral,0.1334852,0.0076118293,0.85890293,0.017760363821665237
CTV,2023-10-04,Too much Taylor? Travis Kelce says NFL TV coverage is 'overdoing it' with Swift during games,https://www.ctvnews.ca/sports/too-much-taylor-travis-kelce-says-nfl-tv-coverage-is-overdoing-it-with-swift-during-games-1.6589503,negative,0.039288122,0.23097244,0.7297395,-0.05180470277823357
CTV,2023-10-04,Some of the key impacts AI is having on our everyday finances,https://www.ctvnews.ca/business/some-of-the-key-impacts-ai-is-having-on-our-everyday-finances-1.6587192,positive,0.3574746,0.0153939035,0.62713146,0.12755112393458035
CTV,2023-10-04,"What Wab Kinew has planned for health-care, homelessness and the landfill search",https://winnipeg.ctvnews.ca/what-wab-kinew-has-planned-for-health-care-homelessness-and-the-landfill-search-1.6588927,neutral,0.026427293,0.10076706,0.87280566,-0.009455598324505932
CTV,2023-10-04,U.S. in antitrust trial accuses Google of illegal methods to push up ad prices,https://www.ctvnews.ca/sci-tech/u-s-in-antitrust-trial-accuses-google-of-illegal-methods-to-push-up-ad-prices-1.6588689,negative,0.015982408,0.57389,0.41012773,-0.3290942119078437
CTV,2023-10-04,Boil water advisory lifted for Wheatley area following treatment plant fire,https://windsor.ctvnews.ca/boil-water-advisory-lifted-for-wheatley-area-following-treatment-plant-fire-1.6589127,neutral,0.02545374,0.094281465,0.8802648,-0.008241100246896504
CTV,2023-10-04,‘This is an abuse of power’: Saint John councillors say suspensions due to support of striking city employees,https://atlantic.ctvnews.ca/this-is-an-abuse-of-power-saint-john-councillors-say-suspensions-due-to-support-of-striking-city-employees-1.6589355,negative,0.007488918,0.77870834,0.21380268,-0.6063306505608024
CTV,2023-10-04,Canada opens applications for scholarships commemorating victims of Iran flight PS752,https://www.ctvnews.ca/canada/canada-opens-applications-for-scholarships-commemorating-victims-of-iran-flight-ps752-1.6588912,neutral,0.042455174,0.057979695,0.8995652,-0.0015592019003278779
CTV,2023-10-04,Edmonton considering compensating businesses constricted by construction following tight vote,https://edmonton.ctvnews.ca/edmonton-considering-compensating-businesses-constricted-by-construction-following-tight-vote-1.6589318,neutral,0.024680326,0.09923452,0.8760851,-0.009238375735860505
CTV,2023-10-04,Sask. fatal crash: SUV struck deer before colliding with car,https://saskatoon.ctvnews.ca/sask-fatal-crash-suv-struck-deer-before-colliding-with-car-1.6589223,negative,0.012120754,0.66906065,0.31881857,-0.4474952366280718
CTV,2023-10-04,"Rideau Hall apologizes for honouring Nazi veteran, Trudeau 'carefully' considering unsealing records",https://www.ctvnews.ca/politics/rideau-hall-apologizes-for-honouring-nazi-veteran-trudeau-carefully-considering-unsealing-records-1.6588673,neutral,0.06940194,0.088251956,0.8423461,-0.002971778685340709
CTV,2023-10-04,Tropical storm Philippe headed towards Atlantic Canada,https://www.ctvnews.ca/video?playlistId=1.6589086,neutral,0.06227284,0.099550426,0.8381766,-0.006032385531583806
CTV,2023-10-04,Caught on camera: Edmonton restaurant worker robbed at gunpoint,https://edmonton.ctvnews.ca/caught-on-camera-edmonton-restaurant-worker-robbed-at-gunpoint-1.6589116,negative,0.012371602,0.63702977,0.35059863,-0.4056538676119992
CTV,2023-10-04,This family bought a cheap house in Italy because the U.S. is too expensive,https://www.ctvnews.ca/lifestyle/this-family-bought-a-cheap-house-in-italy-because-the-u-s-is-too-expensive-1.6588639,negative,0.091312125,0.3455848,0.563103,-0.11109097439650384
CTV,2023-10-04,GTA home sales drop 7.1% in September as higher rates bite,https://toronto.ctvnews.ca/gta-home-sales-drop-7-1-in-september-as-higher-rates-bite-1.6588048,negative,0.018711854,0.5873916,0.39389652,-0.3446787753813645
CTV,2023-10-04,Number of veterans' headstones vandalized in N.B. cemetery,https://www.ctvnews.ca/video?playlistId=1.6589071,negative,0.0075731385,0.67819434,0.3142327,-0.4598900961126233
CTV,2023-10-04,"Paris, Ont. family says vehicle stolen using key fob copying technology",https://kitchener.ctvnews.ca/paris-ont-family-says-vehicle-stolen-using-key-fob-copying-technology-1.6589057,negative,0.009806456,0.6108417,0.3793518,-0.37303144134811106
CTV,2023-10-04,Quebec police arrest 4 students after video shows teen repeatedly hit in the face,https://montreal.ctvnews.ca/quebec-police-arrest-4-students-after-video-shows-teen-repeatedly-hit-in-the-face-1.6589513,negative,0.009267165,0.6753139,0.31541893,-0.45596298975583593
CTV,2023-10-04,How rate hikes have sparked debate on the causes of inflation and how to fight it,https://www.ctvnews.ca/business/how-rate-hikes-have-sparked-debate-on-the-causes-of-inflation-and-how-to-fight-it-1.6588126,neutral,0.024841543,0.18263611,0.7925223,-0.03273885164191981
CTV,2023-10-04,Simone Biles leads U.S. women to record 7th straight team title at gymnastics world championships,https://www.ctvnews.ca/sports/simone-biles-leads-u-s-women-to-record-7th-straight-team-title-at-gymnastics-world-championships-1.6588968,positive,0.79767966,0.0028272353,0.19949304,0.6362849103002715
CTV,2023-10-04,3 scientists win Nobel Prize in physics for looking at electrons in atoms during split seconds,https://www.ctvnews.ca/sci-tech/3-scientists-win-nobel-prize-in-physics-for-looking-at-electrons-in-atoms-during-split-seconds-1.6586301,positive,0.74873525,0.004132529,0.24713236,0.5605873067626383
CTV,2023-10-04,"Man shot by police after ramming RCMP cruiser was not seriously harmed, IIO finds",https://bc.ctvnews.ca/vancouver-news-headlines/man-shot-by-police-after-ramming-rcmp-cruiser-was-not-seriously-harmed-iio-finds-1.6588507,negative,0.028157696,0.25966325,0.712179,-0.06663215998747862
CTV,2023-10-04,Park users question continued closure of Roos Island,https://kitchener.ctvnews.ca/park-users-question-continued-closure-of-roos-island-1.6589171,negative,0.0151713025,0.29410598,0.69072276,-0.08626814926494752
CTV,2023-10-04,U.S. House is left paralyzed as divided Republicans search for new leader after McCarthy's ouster,https://www.ctvnews.ca/world/u-s-house-is-left-paralyzed-as-divided-republicans-search-for-new-leader-after-mccarthy-s-ouster-1.6588747,negative,0.008344682,0.68731904,0.30433637,-0.4723377480338833
CTV,2023-10-04,Parents want arrest after son 'deliberately kicked' in neck during Edmonton hockey game,https://edmonton.ctvnews.ca/parents-want-arrest-after-son-deliberately-kicked-in-neck-during-edmonton-hockey-game-1.6587475,negative,0.007784246,0.7560725,0.23614335,-0.571584973617945
CTV,2023-10-04,IMF expects continuing U.S. support for Ukraine despite Congress dropping aid,https://www.ctvnews.ca/world/imf-expects-continuing-u-s-support-for-ukraine-despite-congress-dropping-aid-1.6588725,neutral,0.082373776,0.06138516,0.85624087,0.0030173053631492586
CTV,2023-10-04,Lethbridge police investigate alleged sexual assault involving high school football players,https://calgary.ctvnews.ca/lethbridge-police-investigate-alleged-sexual-assault-involving-high-school-football-players-1.6589206,negative,0.014637455,0.37553784,0.6098248,-0.14081439498460213
CTV,2023-10-04,B.C. family rallying around little girls who lost their firefighter dad in highway crash,https://bc.ctvnews.ca/b-c-family-rallying-around-little-girls-who-lost-their-firefighter-dad-in-highway-crash-1.6579070,neutral,0.069336936,0.22851606,0.70214707,-0.04741196820318372
CTV,2023-10-04,'QAnon queen' supporters allegedly threaten Sask. village leaders with 'executions',https://saskatoon.ctvnews.ca/qanon-queen-supporters-allegedly-threaten-sask-village-leaders-with-executions-1.6588739,negative,0.006951097,0.74681115,0.24623777,-0.5576785672834674
CTV,2023-10-04,Condo sales drop in Ottawa,https://ottawa.ctvnews.ca/condo-sales-drop-in-ottawa-1.6589222,negative,0.027507462,0.2359955,0.7364969,-0.05493724144383805
CTV,2023-10-04,Investigator was 'totally shocked' to see sensitive records sent to criminal suspect,https://www.ctvnews.ca/politics/investigator-was-totally-shocked-to-see-sensitive-records-sent-to-criminal-suspect-1.6588746,negative,0.00958113,0.7596355,0.23078339,-0.5769542731672601
CTV,2023-10-04,'Bunny Hug' trademarked by Sask. vendor,https://regina.ctvnews.ca/bunny-hug-trademarked-by-sask-vendor-1.6580677,neutral,0.09399016,0.009807638,0.8962024,0.008737945096080058
CTV,2023-10-04,"Trio wins Nobel Prize in chemistry for quantum dots, tiny particles that power TVs and phones",https://www.ctvnews.ca/sci-tech/trio-wins-nobel-prize-in-chemistry-for-quantum-dots-tiny-particles-that-power-tvs-and-phones-1.6588146,positive,0.86365855,0.003006944,0.13333453,0.745897032016023
CTV,2023-10-04,"Here's how much it costs to raise children in Canada, according to new statistics",https://www.ctvnews.ca/canada/here-s-how-much-it-costs-to-raise-children-in-canada-according-to-new-statistics-1.6588427,neutral,0.06009884,0.114965096,0.82493603,-0.009605104176053203
CTV,2023-10-04,'It was chaos': Violent fight on board CTrain forces passengers into Calgary LRT tunnel,https://calgary.ctvnews.ca/it-was-chaos-violent-fight-on-board-ctrain-forces-passengers-into-calgary-lrt-tunnel-1.6588181,negative,0.0056571495,0.8366936,0.15764913,-0.7000242756859443
CTV,2023-10-04,Two people arrested for alleged carjacking at Conestoga Mall,https://kitchener.ctvnews.ca/two-people-arrested-for-alleged-carjacking-at-conestoga-mall-1.6588837,negative,0.010692903,0.58828956,0.40101743,-0.3459703359590094
CBC,2023-10-04,British government says controversial statues to stay — with 'comprehensive' explanations,https://www.cbc.ca/news/world/britain-statues-racism-toppled-1.6987186,negative,0.013280944,0.37250274,0.61421645,-0.13858185706297732
CBC,2023-10-04,Minor hockey players required to wear bottom layer to dressing room or change in washroom,https://www.cbc.ca/news/canada/nova-scotia/hockey-canada-dressing-room-bottom-layer-new-policy-1.6985217,neutral,0.03961896,0.02847146,0.9319097,0.0007590369026038157
CBC,2023-10-04,What does Canada’s House Speaker do?,https://www.cbc.ca/player/play/2269404739612,neutral,0.021511814,0.028058806,0.95042944,-0.00032453810281829476
CBC,2023-10-04,2 Republicans step forward as candidates to replace deposed U.S. House Speaker,https://www.cbc.ca/news/world/us-house-speaker-candidates-1.6986712,neutral,0.04138725,0.016827663,0.941785,0.0014297368052054171
CBC,2023-10-04,Woman with terminal cancer searches for someone to take in her 3 senior dogs,https://www.cbc.ca/news/canada/saskatoon/woman-terminal-cancer-needs-home-three-dogs-1.6985308,negative,0.032644514,0.37879032,0.58856523,-0.14241642105968566
CBC,2023-10-04,"My win shows Manitobans want unity, says 1st First Nations premier-designate Wab Kinew",https://www.cbc.cahttps://www.cbc.ca/listen/live-radio/1-63-the-current/clip/16013463-wab-kinew-says-win-shows-manitobans-unity ,positive,0.71227,0.008901533,0.2788284,0.5072493670507239
CBC,2023-10-04,Go beyond the headlines | Stream CBC News Explore,https://www.cbc.cahttps://www.cbc.ca/news/cbc-news-explore-1.6512577,neutral,0.10185861,0.013737929,0.8844034,0.010186449934611819
CBC,2023-10-04,Manitoba grand chief never thought she'd see an Anishinaabe premier,https://www.cbc.ca/news/canada/manitoba/anishinaabe-premier-sight-to-behold-for-grand-chief-1.6986771,negative,0.05065091,0.43181923,0.51752996,-0.18390228608663506
CBC,2023-10-04,What The Golden Bachelor gets right — and wrong — about the love lives of seniors,https://www.cbc.ca/news/entertainment/golden-bachelor-senior-representation-1.6985609,negative,0.04608298,0.32431725,0.62959975,-0.10305804433841992
CBC,2023-10-04,Joni Mitchell releases 1972 song featuring Neil Young ahead of album release,https://www.cbc.ca/news/entertainment/joni-mitchell-demo-neil-young-1.6986578,neutral,0.09922046,0.0044181566,0.89636135,0.009825182821643352
CBC,2023-10-04,Trudeau 'looking carefully' at releasing names of ex-Nazis in Canada,https://www.cbc.ca/news/politics/trudeau-deschenes-commission-ex-nazis-1.6986364,neutral,0.03237433,0.074606076,0.8930197,-0.0045179658632790165
CBC,2023-10-04,Wab Kinew's win an inspiration for Indigenous Manitobans,https://www.cbc.ca/player/play/2269449283816,positive,0.7899659,0.015825383,0.19420867,0.6237957353114103
CBC,2023-10-04,Ontario apartment buildings bring investors double-digit returns. Some tenants say they're paying the price,https://www.cbc.ca/news/canada/hamilton/equiton-apartment-buildings-1.6978668,positive,0.27782646,0.061093513,0.66108,0.07345513047780017
CBC,2023-10-04,"Burden of RSV falls mainly on youngest children, study finds, stressing need for better prevention",https://www.cbc.ca/news/health/rsv-jama-1.6986661,negative,0.017414896,0.61027473,0.37231028,-0.3721320417066494
CBC,2023-10-04,Thousands mourn B.C. RCMP officer Rick O'Brien at regimental funeral,https://www.cbc.ca/news/canada/british-columbia/rcmp-regimental-funeral-1.6985562,negative,0.017657757,0.4228924,0.55945,-0.17852613025911168
CBC,2023-10-04,"When I was at my lowest, the people I relied on offered little more than thoughts and prayers",https://www.cbc.ca/news/canada/edmonton/first-person-medgine-mathurin-communities-of-support-1.6970438,negative,0.016362369,0.7875549,0.19608268,-0.6199750474367534
CBC,2023-10-04,Former friend testifies against FTX founder Sam Bankman-Fried at fraud trial,https://www.cbc.ca/news/world/ftx-bankman-fried-fraud-trial-1.6986574,negative,0.023767669,0.325513,0.6507193,-0.10539382297468691
CBC,2023-10-04,How Wab Kinew led Manitoba's NDP to a majority victory,https://www.cbc.ca/news/canada/manitoba/2023-election-analysis-kinew-stefanson-1.6986075,neutral,0.20459573,0.013570498,0.7818339,0.041675231307642946
CBC,2023-10-04,Federal government commits $740K toward further review of possible search Winnipeg-area landfill,https://www.cbc.ca/news/canada/manitoba/federal-funding-landfill-search-manitoba-winnipeg-1.6986471,neutral,0.11164525,0.021943644,0.8664111,0.011983140023597016
CBC,2023-10-04,Canada's defence minister steals a page from Stephen Harper's playbook to justify cuts,https://www.cbc.ca/news/politics/department-national-defence-budget-bill-blair-1.6985796,negative,0.01695932,0.57805806,0.4049825,-0.33386357404365796
CBC,2023-10-04,"Manifesto of man accused of terror attack against London, Ont., Muslim family read at murder trial",https://www.cbc.ca/news/canada/london/manifesto-of-man-accused-of-terror-attack-against-london-ont-muslim-family-read-at-murder-trial-1.6986403,negative,0.0073758513,0.6656472,0.32697695,-0.4430318034754528
CBC,2023-10-04,British actor Julia Ormond sues Harvey Weinstein saying he sexually assaulted her,https://www.cbc.ca/news/entertainment/julia-ormond-sues-harvey-weinstein-assault-1.6986776,negative,0.018012492,0.4448664,0.53712124,-0.19758160327448593
CBC,2023-10-04,Peter Nygard's defence lawyer tries to poke holes in sex assault allegations,https://www.cbc.ca/news/canada/toronto/peter-nygard-cross-examination-1.6986512,negative,0.012653722,0.64536786,0.34197855,-0.41633948398276743
CBC,2023-10-04,Pope Francis warns of 'point of no return' on climate change as key Vatican summit begins,https://www.cbc.ca/news/world/pope-francis-environment-update-1.6986107,negative,0.021727586,0.35797793,0.6202944,-0.12767613784644105
CBC,2023-10-04,Judge at Trump trial pounds his fist in frustration with defence lawyer,https://www.cbc.ca/news/world/trump-fraud-trial-judge-1.6986653,negative,0.023626246,0.60033983,0.37603384,-0.3598497452298943
CBC,2023-10-04,The National,https://www.cbc.ca/player/play/2262215235747,neutral,0.12646915,0.062769786,0.8107611,0.012054398075619588
CBC,2023-10-04,"France turns to sniffer dogs to hunt for possible bedbugs on trains, subway cars",https://www.cbc.ca/news/world/france-bedbugs-sniffer-dogs-1.6986492,negative,0.027724741,0.36379838,0.6084769,-0.13158059984817783
CBC,2023-10-04,'This is a business proposition': Crown releases emails in Cameron Ortis trial,https://www.cbc.ca/news/politics/cameron-ortis-trial-start-jury-1.6986376,neutral,0.04724927,0.054122664,0.8986279,-0.0006967706715479416
CBC,2023-10-04,Toronto Blue Jays eliminated from MLB playoffs as post-season struggles continue,https://www.cbc.ca/sports/baseball/mlb/blue-jays-twins-mlb-al-wild-card-game-2-recap-1.6986874,negative,0.006638522,0.80874276,0.18461883,-0.6540206888018076
CBC,2023-10-04,"Who was Hardeep Singh Nijjar, the man India is accused of killing?",https://www.cbc.ca/player/play/2269673539663,negative,0.011271295,0.57382494,0.41490382,-0.32914798850192994
CBC,2023-10-04,"Wales lowered speed limits on most roads, and people are not happy",https://www.cbc.ca/news/world/wales-traffic-lower-speed-limit-1.6985184,negative,0.01164897,0.84201103,0.1463399,-0.7088469830824806
CBC,2023-10-04,WestJet suspends flights between Toronto and Montreal until next April,https://www.cbc.ca/news/business/westjet-flights-toronto-montreal-1.6986307,negative,0.009010778,0.5075148,0.48347437,-0.257490081984308
CBC,2023-10-04,"1st First Nations premier of a Canadian province, explained for kids",https://www.cbc.cahttps://www.cbc.ca/kidsnews/post/wab-kinew-becomes-canadas-1st-first-nations-premier-of-a-province,neutral,0.17614062,0.024488514,0.79937077,0.030425847233672698
CBC,2023-10-04,WATCH: CBC News Network,https://www.cbc.cahttps://gem.cbc.ca/benefits-premium?cmp=DM_NewsTile_Gem_PremiumNN,neutral,0.10073908,0.018231502,0.88102955,0.00981596340483426
CBC,2023-10-04,Heather Stefanson stepping down as Manitoba Progressive Conservative leader after loss to NDP,https://www.cbc.ca/news/canada/manitoba/heather-stefanson-pc-leader-election-outcome-1.6985856,neutral,0.025727693,0.14722909,0.8270432,-0.02101449647683573
