source,date,headline,url,chosen_label,positive,negative,neutral,compound
Global,2023-12-27,U.S. announces naval coalition to defend Red Sea shipping from Yemen’s Houthi attacks: White House,https://globalnews.ca/video/10180923/u-s-announces-naval-coalition-to-defend-red-sea-shipping-from-yemens-houthi-attacks-white-house/,neutral,0.08088028,0.030206136,0.8889135,0.005629212283729146
Global,2023-12-27,Canada enters 5th year of COVID-19. Are we falling short in treatment?,https://globalnews.ca/news/10154267/covid-treatments-canada-options/,negative,0.01242805,0.74699384,0.24057794,-0.5578454716519303
Global,2023-12-27,S&P/TSX composite up more than 100 points; US markets mixed,https://globalnews.ca/news/10191794/tsx-december-27-2023/,positive,0.57155746,0.009089773,0.41935274,0.3265953254959051
Global,2023-12-27,Canada ready to pay two Michaels settlement for China prison time: report,https://globalnews.ca/news/10190574/two-michaels-china-settlement/,neutral,0.03319866,0.09017844,0.8766228,-0.0070300058332235515
Global,2023-12-27,17-year-old swimmer Summer McIntosh named Canadian Press female athlete of the year,https://globalnews.ca/news/10191755/summer-mcintosh-female-athlete-of-the-year-canadian-press/,positive,0.38939017,0.0051797493,0.60543007,0.15159787499671395
Global,2023-12-27,Canadian woman sets new record for deepest underwater photoshoot,https://globalnews.ca/news/10162876/canadian-record-modelling-underwater/,positive,0.36035514,0.014749311,0.6248956,0.12963827335222788
Global,2023-12-27,Vancouver furniture retailer warns potential new tariffs could hit consumers hard,https://globalnews.ca/video/10191270/vancouver-furniture-retailer-warns-potential-new-tariffs-could-hit-consumers-hard/,negative,0.013909043,0.7029778,0.28311318,-0.49398429284535084
Global,2023-12-27,ANALYSIS: Winnipeg Jets’ Gabriel Vilardi on a run like never before following blockbuster trade,https://globalnews.ca/news/10191632/analysis-winnipeg-jets-gabriel-vilardi-trade/,positive,0.55895853,0.0049277213,0.43611372,0.31241038958281564
Global,2023-12-27,"Can Poilievre, federal Conservatives sustain rising popularity?",https://globalnews.ca/video/10191254/can-poilievre-federal-conservatives-sustain-rising-popularity/,neutral,0.22042269,0.012681253,0.7668962,0.04842532136727229
Global,2023-12-27,Quebec inks tentative deals on working conditions with all ‘common front’ labour unions,https://globalnews.ca/news/10191746/quebec-tentative-deal-common-front-unions/,neutral,0.070096366,0.01621408,0.91368943,0.004650610569471247
Global,2023-12-27,"Canada ready to pay 2 Michaels settlement for China prison time, report finds",https://globalnews.ca/video/10191261/canada-ready-to-pay-2-michaels-settlement-for-china-prison-time-report-finds/,neutral,0.03409907,0.09248148,0.87341934,-0.007390083802225389
Global,2023-12-27,Saskatoon storm ponds ready for ice skating,https://globalnews.ca/news/10191638/saskatoon-storm-ponds-ice-skating/,positive,0.2855141,0.011215147,0.7032709,0.08139247311007125
Global,2023-12-27,Year-end interview with Nova Scotia Premier Tim Houston,https://globalnews.ca/video/10191776/year-end-interview-with-nova-scotia-premier-tim-houston/,neutral,0.04255382,0.0067568333,0.95068944,0.0017651695569487202
Global,2023-12-27,‘Dixie Chicks’ founder Laura Lynch dies in car crash,https://globalnews.ca/video/10189569/dixie-chicks-founder-laura-lynch-dies-in-car-crash/,negative,0.022050736,0.48746717,0.49048212,-0.23713799266384683
Global,2023-12-27,‘Skimpflation’ hits grocery store aisles amid rising inflationary pressures,https://globalnews.ca/news/10158591/inflation-skimpflation-grocery-store/,negative,0.017511047,0.60037625,0.3821126,-0.3601450541420004
Global,2023-12-27,Kelowna condo owner concerned over impacts of B.C.’s short-term rental market crackdown,https://globalnews.ca/video/10191242/kelowna-condo-owner-concerned-over-impacts-of-b-c-s-short-term-rental-market-crackdown/,negative,0.012795067,0.29761383,0.68959105,-0.08841029482861984
Global,2023-12-27,Korean actor Lee Sun-kyun dead at 48,https://globalnews.ca/video/10191505/korean-actor-lee-sun-kyun-dead-at-48/,neutral,0.030462187,0.18817954,0.7813583,-0.034483588640704
Global,2023-12-27,The Trudeau Liberals had a tough year. What will they do in 2024?,https://globalnews.ca/news/10191631/trudeau-liberals-tough-year-2024/,negative,0.012406995,0.74713093,0.24046196,-0.5580507700645843
Global,2023-12-27,Regina police remain on scene of 6th Avenue homicide,https://globalnews.ca/video/10191905/regina-police-remain-on-scene-of-6th-avenue-homicide/,negative,0.021243667,0.24328278,0.73547363,-0.0587352013662894
Global,2023-12-27,Big deal? Canadians seek Boxing Day bargains,https://globalnews.ca/video/10191251/big-deal-canadians-seek-boxing-day-bargains/,neutral,0.13521338,0.06396918,0.80081743,0.014190601876944875
Global,2023-12-27,"14-year-old arrested after Boxing Day vehicle theft, chase and crash: Halifax police",https://globalnews.ca/news/10191775/halifax-vehicle-theft-14-year-old/,negative,0.013034394,0.52992755,0.45703804,-0.28065331442988395
Global,2023-12-27,"‘Parasite’ actor Lee Sun-kyun found dead in Seoul, police say",https://globalnews.ca/news/10191461/parasite-actor-lee-sun-kyun-dead/,negative,0.010822404,0.4506148,0.53856283,-0.2029365560945422
Global,2023-12-27,Regina fire investigators looking into St. John Street house fire,https://globalnews.ca/video/10191904/regina-fire-investigators-looking-into-st-john-street-house-fire/,neutral,0.014238805,0.056050234,0.92971104,-0.0029388816976694265
Global,2023-12-27,Global News at 6 Maritimes: Dec.26,https://globalnews.ca/video/10191200/global-news-at-6-maritimes-dec-26-2/,neutral,0.034421764,0.009369498,0.9562087,0.0010970711567823699
Global,2023-12-27,"Winnipeg police arrest four, continue investigation into fatal stabbing",https://globalnews.ca/news/10191811/winnipeg-police-arrest-four-continue-investigation-into-fatal-stabbing/,negative,0.020746417,0.30482304,0.6744306,-0.09248665584571825
Global,2023-12-27,Retiring Saskatoon police Chief Troy Cooper reflects on his career,https://globalnews.ca/news/10191635/retiring-saskatoon-police-chief-troy-cooper-career/,neutral,0.029752007,0.0146895945,0.9555583,0.0006693992060844423
Global,2023-12-27,"CPL commissioner says soccer league headed in right direction, with more teams coming",https://globalnews.ca/news/10191676/cpl-commissioner-soccer-league-teams/,positive,0.6329559,0.003828432,0.36321554,0.400618619505849
Global,2023-12-27,"Neonatal assessment team relieves pressure on families, health-care teams",https://globalnews.ca/video/10191197/neonatal-assessment-team-relieves-pressure-on-families-health-care-teams-2/,positive,0.32771116,0.023392607,0.6488963,0.10684737493198071
Global,2023-12-27,Quebec emergency rooms see occupancy rates surge after dropping earlier this month,https://globalnews.ca/news/10191637/quebec-emergency-rooms-overcrowding-surging/,neutral,0.03299506,0.11728829,0.84971666,-0.012667868066110088
Global,2023-12-27,Premier Moe says it’s ‘unfortunate’ for Saskatchewan to break federal emissions law,https://globalnews.ca/news/10191615/premier-scott-moe-saskatchewan-break-federal-emissions-law-unfortunate/,negative,0.0070321886,0.7676323,0.22533558,-0.5892098252417526
Global,2023-12-27,Why there is no easy fix to Canada’s skyrocketing cost of housing,https://globalnews.ca/video/10191252/why-there-is-no-easy-fix-to-canadas-skyrocketing-cost-of-housing/,negative,0.007872794,0.8723087,0.11981857,-0.760860385511954
Global,2023-12-27,Here are the best Boxing Day deals in Canada,https://globalnews.ca/the-curator/10186651/boxing-day-deals-2023/,positive,0.8741792,0.0033173927,0.12250351,0.7641781439291773
Global,2023-12-27,Man killed in Vancouver tent fire,https://globalnews.ca/video/10191278/man-killed-in-vancouver-tent-fire/,negative,0.010222826,0.6450322,0.344745,-0.4159620104552282
Global,2023-12-27,A generation scarred and scared: Marking 50 years ago of ‘The Exorcist’,https://globalnews.ca/video/10191257/a-generation-scarred-and-scared-marking-50-years-ago-of-the-exorcist/,negative,0.00834422,0.85005856,0.14159714,-0.7225299844415494
CTV,2023-12-27,Honda recalling more than 2.5 million cars in U.S. due to fuel pump defect,https://www.ctvnews.ca/autos/honda-recalling-more-than-2-5-million-cars-in-u-s-due-to-fuel-pump-defect-1.6696905,negative,0.016464671,0.5597465,0.4237888,-0.3130450962115816
CTV,2023-12-27,Saint John police seek public’s help locating missing vulnerable adult,https://atlantic.ctvnews.ca/saint-john-police-seek-public-s-help-locating-missing-vulnerable-adult-1.6701988,neutral,0.061672065,0.04159399,0.89673394,0.002073383620757374
CTV,2023-12-27,"Sask. premier looks back on tumultuous year with Ottawa, feels province fared well in 2023",https://regina.ctvnews.ca/sask-premier-looks-back-on-tumultuous-year-with-ottawa-feels-province-fared-well-in-2023-1.6697123,positive,0.6552796,0.011099402,0.33362114,0.4292680503116486
CTV,2023-12-27,Missing B.C. man last heard from in Winnipeg,https://winnipeg.ctvnews.ca/missing-b-c-man-last-heard-from-in-winnipeg-1.6701932,negative,0.026771685,0.37720224,0.596026,-0.14156482909723067
CTV,2023-12-27,'Everybody's here!': Family's Christmas surprise goes viral,/video/c2835695-family-surprises-grandparents-for-christmas,positive,0.8588452,0.003400617,0.13775423,0.7376034437035734
CTV,2023-12-27,"Heat exhaustion killed Taylor Swift fan attending Rio concert, forensics report says",https://www.ctvnews.ca/entertainment/heat-exhaustion-killed-taylor-swift-fan-attending-rio-concert-forensics-report-says-1.6701923,negative,0.007997448,0.6447645,0.34723803,-0.4156572982252733
CTV,2023-12-27,"Chatham, Ont. man found 'crawling in the middle of the intersection' arrested for public intoxication",https://windsor.ctvnews.ca/chatham-ont-man-found-crawling-in-the-middle-of-the-intersection-arrested-for-public-intoxication-1.6701868,negative,0.011584464,0.40072417,0.5876914,-0.16044563957461122
CTV,2023-12-27,"A long-overlooked climate solution, geothermal could be in for its hottest decade yet",https://calgary.ctvnews.ca/a-long-overlooked-climate-solution-geothermal-could-be-in-for-its-hottest-decade-yet-1.6702103,positive,0.8706591,0.00710689,0.12223411,0.7579966735204939
CTV,2023-12-27,Woman pregnant in each of her two uteruses gives birth to twins,https://www.ctvnews.ca/world/woman-pregnant-in-each-of-her-two-uteruses-gives-birth-to-twins-1.6700826,neutral,0.052576985,0.11665126,0.83077186,-0.01084317064537288
CTV,2023-12-27,Eiffel Tower closed while workers strike on the 100th anniversary of its founder's death,https://www.ctvnews.ca/world/eiffel-tower-closed-while-workers-strike-on-the-100th-anniversary-of-its-founder-s-death-1.6701809,negative,0.020552665,0.5568757,0.4225716,-0.3096881727740026
CTV,2023-12-27,Apple files appeal after Biden administration allows U.S. ban on watch imports,https://www.ctvnews.ca/business/apple-files-appeal-after-biden-administration-allows-u-s-ban-on-watch-imports-1.6701510,neutral,0.04996315,0.18183918,0.76819766,-0.030569174426362977
CTV,2023-12-27,'Accountability missing' as senior scams on the rise,/video/c2835436-scams-targeting-seniors-on-the-rise?playlistId=1.6701347,negative,0.010320671,0.79090333,0.19877599,-0.6254215727041164
CTV,2023-12-27,"Meet Summer McIntosh, The Canadian Press female athlete of the year",https://www.ctvnews.ca/sports/meet-summer-mcintosh-the-canadian-press-female-athlete-of-the-year-1.6702036,positive,0.2470124,0.0037089384,0.7492786,0.061001383621158034
CTV,2023-12-27,The lights are back on for almost all N.B. customers after wind storm last week,https://atlantic.ctvnews.ca/the-lights-are-back-on-for-almost-all-n-b-customers-after-wind-storm-last-week-1.6701225,positive,0.31199586,0.016977152,0.67102695,0.09705320389063132
CTV,2023-12-27,"From a rail museum in Illinois to the streets of Kenosha, Wisconsin: A look at where TTC vehicles end up after being decommissioned",https://toronto.ctvnews.ca/from-a-rail-museum-in-illinois-to-the-streets-of-kenosha-wisconsin-a-look-at-where-ttc-vehicles-end-up-after-being-decommissioned-1.6696403,neutral,0.022496335,0.03223797,0.9452657,-0.0005332014241243854
CTV,2023-12-27,1-2-3 and counting: Las Vegas weddings could hit record on New Year's Eve thanks to date's pattern,https://www.ctvnews.ca/lifestyle/1-2-3-and-counting-las-vegas-weddings-could-hit-record-on-new-year-s-eve-thanks-to-date-s-pattern-1.6701579,positive,0.66241056,0.0029993975,0.3345901,0.4387786908769318
CTV,2023-12-27,"Passenger seriously injured after jumping from moving vehicle in Smiths Falls, Ont., police say",https://ottawa.ctvnews.ca/passenger-seriously-injured-after-jumping-from-moving-vehicle-in-smiths-falls-ont-police-say-1.6701818,negative,0.009415593,0.6808469,0.3097375,-0.46346388857744714
CTV,2023-12-27,"3 members of a Alta. family, including a child, found dead",/video/c2835645-three-family-members-found-dead,negative,0.015196411,0.50367653,0.4811271,-0.25345909052135074
CTV,2023-12-27,"Surging Conservatives pose threat to B.C.'s 'prosperity,' premier says in year-end interview",https://bc.ctvnews.ca/surging-conservatives-pose-threat-to-b-c-s-prosperity-premier-says-in-year-end-interview-1.6701586,negative,0.013703971,0.4168932,0.5694028,-0.173612153017352
CTV,2023-12-27,Site for Canada's underground nuclear waste repository to be selected next year,https://toronto.ctvnews.ca/site-for-canada-s-underground-nuclear-waste-repository-to-be-selected-next-year-1.6701775,neutral,0.042134687,0.018254189,0.9396111,0.0014421175767675987
CTV,2023-12-27,Search for four-year-old girl who fell into Quebec river no longer a rescue mission: police,https://montreal.ctvnews.ca/search-for-four-year-old-girl-who-fell-into-quebec-river-no-longer-a-rescue-mission-police-1.6701309,negative,0.009114929,0.5650519,0.4258332,-0.3192005663256392
CTV,2023-12-27,Downtown Eastside overdose prevention workers continue to save lives on Christmas Day,https://bc.ctvnews.ca/downtown-eastside-overdose-prevention-workers-continue-to-save-lives-on-christmas-day-1.6701346,positive,0.8802405,0.004561826,0.11519766,0.7748025273954795
CTV,2023-12-27,N.S. meat market sees lines 'down the street',https://atlantic.ctvnews.ca/more/n-s-meat-market-sees-lines-down-the-street-1.6701903,neutral,0.023122542,0.08451096,0.8923666,-0.006607444887960945
CTV,2023-12-27,"Third baseman, outfielder Isiah Kiner-Falefa signs with Toronto Blue Jays: reports",https://toronto.ctvnews.ca/third-baseman-outfielder-isiah-kiner-falefa-signs-with-toronto-blue-jays-reports-1.6702065,neutral,0.045666967,0.006008397,0.9483247,0.002049369220433306
CTV,2023-12-27,"FTQ completes all negotiations at sectoral tables, threat of indefinite strike still looms",https://montreal.ctvnews.ca/ftq-completes-all-negotiations-at-sectoral-tables-threat-of-indefinite-strike-still-looms-1.6701887,negative,0.019306816,0.42811677,0.55257636,-0.1829112390596741
CTV,2023-12-27,Two hurt in machete attack at Calgary Zoo parking lot,https://calgary.ctvnews.ca/two-hurt-in-machete-attack-at-calgary-zoo-parking-lot-1.6701716,negative,0.010298501,0.6570202,0.3326813,-0.4315694990442154
CTV,2023-12-27,Stolen ATV returned to Chatsworth owner on Christmas Day,https://barrie.ctvnews.ca/stolen-atv-returned-to-chatsworth-owner-on-christmas-day-1.6701952,neutral,0.02735946,0.057079647,0.9155608,-0.0025095493662163904
CTV,2023-12-27,Sask. Kwanza celebration pays tribute to legendary Roughrider George Reed,https://regina.ctvnews.ca/sask-kwanza-celebration-pays-tribute-to-legendary-roughrider-george-reed-1.6701610,positive,0.5287748,0.006312709,0.4649126,0.27956287409531555
CTV,2023-12-27,From anger to generosity: N.B. man tells of lessons learned after his car is stolen,https://atlantic.ctvnews.ca/more/from-anger-to-generosity-n-b-man-tells-of-lessons-learned-after-his-car-is-stolen-1.6698634,negative,0.047448948,0.35839778,0.59415317,-0.12619760584755113
CTV,2023-12-27,Israel says war will last months; Gaza death toll nears 21k,/video/c2835673-ctv-national-news--israel-s-warnings-of-long-war?playlistId=1.6595387,negative,0.004513691,0.9039681,0.09151808,-0.8171380721991812
CTV,2023-12-27,5 vehicles stolen in 2 days from same Chatsworth property: OPP,https://barrie.ctvnews.ca/5-vehicles-stolen-in-2-days-from-same-chatsworth-property-opp-1.6701939,negative,0.013069601,0.52510214,0.46182823,-0.27556144065783883
CTV,2023-12-27,Poilievre's deputy says Conservative plans to cut spending will be outlined during next campaign,https://www.ctvnews.ca/politics/poilievre-s-deputy-says-conservative-plans-to-cut-spending-will-be-outlined-during-next-campaign-1.6695248,neutral,0.03973775,0.06641246,0.8938498,-0.00283152569291123
CTV,2023-12-27,U.S. delegation will meet with Mexican government for talks on the surge of migrants at border,https://www.ctvnews.ca/world/u-s-delegation-will-meet-with-mexican-government-for-talks-on-the-surge-of-migrants-at-border-1.6701998,neutral,0.046739463,0.017850863,0.93540955,0.0018659277889412351
CTV,2023-12-27,"The New York Times sues OpenAI, Microsoft over alleged use of articles",https://www.ctvnews.ca/sci-tech/the-new-york-times-sues-openai-microsoft-over-alleged-use-of-articles-1.6701974,negative,0.024801869,0.2707242,0.704474,-0.07267645283197766
CTV,2023-12-27,"Wind warnings in effect for parts of Vancouver Island, Sunshine Coast",https://bc.ctvnews.ca/wind-warnings-in-effect-for-parts-of-vancouver-island-sunshine-coast-1.6701997,neutral,0.047314234,0.09893896,0.8537468,-0.0075502823606869995
CTV,2023-12-27,Three family members found dead in Lac Ste Anne County,https://edmonton.ctvnews.ca/three-family-members-found-dead-in-lac-ste-anne-county-1.6701543,negative,0.012878455,0.5703579,0.41676372,-0.3251422338273109
CTV,2023-12-27,South Korean actor Lee Sun-kyun of Oscar-winning film 'Parasite' is found dead,https://www.ctvnews.ca/entertainment/south-korean-actor-lee-sun-kyun-of-oscar-winning-film-parasite-is-found-dead-1.6701692,neutral,0.03788572,0.22445057,0.7376636,-0.048942745569631185
CTV,2023-12-27,"London, Ont. couple reflects on making it through COVID-19 pandemic",https://london.ctvnews.ca/london-ont-couple-reflects-on-making-it-through-covid-19-pandemic-1.6701991,neutral,0.05291108,0.14089853,0.8061904,-0.01705281408408421
CTV,2023-12-27,Sask. bingo hall 'overtly' tried to undermine newly-formed union: Labour Board,https://saskatoon.ctvnews.ca/sask-bingo-hall-overtly-tried-to-undermine-newly-formed-union-labour-board-1.6702000,negative,0.0070824106,0.7642182,0.22869934,-0.5839793477085218
CTV,2023-12-27,She died weeks after fleeing the Maui wildfire. Her family fought to have her listed as a victim,https://www.ctvnews.ca/world/she-died-weeks-after-fleeing-the-maui-wildfire-her-family-fought-to-have-her-listed-as-a-victim-1.6701777,negative,0.0068892986,0.7856462,0.20746435,-0.6171926172762552
CTV,2023-12-27,"More Canadians to feel pinch of high rates in 2024, making way for lower inflation",https://www.ctvnews.ca/politics/more-canadians-to-feel-pinch-of-high-rates-in-2024-making-way-for-lower-inflation-1.6700419,neutral,0.08700551,0.18104106,0.73195344,-0.025205905753211688
CTV,2023-12-27,"Fredericton man, 26, dies following single-vehicle crash in Sainte-Anne-de-Madawaska",https://atlantic.ctvnews.ca/fredericton-man-26-dies-following-single-vehicle-crash-in-sainte-anne-de-madawaska-1.6701966,negative,0.017004514,0.46448976,0.5185059,-0.2154615149297765
CTV,2023-12-27,New guest guidelines circulating after MPs applauded man who fought for Nazis,https://www.ctvnews.ca/politics/new-guest-guidelines-circulating-after-mps-applauded-man-who-fought-for-nazis-1.6701173,negative,0.013976244,0.62830985,0.35771382,-0.3945780010972726
CTV,2023-12-27,Nearly 300K Honda vehicles from 2017 to 2020 recalled over engine failure risk,https://www.ctvnews.ca/autos/nearly-300k-honda-vehicles-from-2017-to-2020-recalled-over-engine-failure-risk-1.6697198,negative,0.01739793,0.59010214,0.39249983,-0.3479178939531842
CTV,2023-12-27,"The 15 best art, design and archeology discoveries of 2023",https://www.ctvnews.ca/sci-tech/the-15-best-art-design-and-archeology-discoveries-of-2023-1.6687662,positive,0.9013578,0.0044452515,0.09419707,0.8124260363053608
CTV,2023-12-27,'Like we were in a Hallmark movie': 4 strangers drive to Winnipeg together after their flight was cancelled due to fog,https://www.ctvnews.ca/lifestyle/like-we-were-in-a-hallmark-movie-4-strangers-drive-to-winnipeg-together-after-their-flight-was-cancelled-due-to-fog-1.6701058,negative,0.023742357,0.44500053,0.531257,-0.19746183475361967
CTV,2023-12-27,Michigan Supreme Court rejects ‘insurrectionist ban’ case and keeps Trump on 2024 primary ballot,https://www.ctvnews.ca/world/michigan-supreme-court-rejects-insurrectionist-ban-case-and-keeps-trump-on-2024-primary-ballot-1.6701875,neutral,0.022354068,0.16261433,0.8150316,-0.025943718339225263
CTV,2023-12-27,Man rescued after spending days trapped in crashed truck,/video/c2835689-man-survived-for-days-in-crashed-truck,neutral,0.088832244,0.17540859,0.73575914,-0.022877007301005392
CTV,2023-12-27,"'He hits like a tank': London, Ont. teen boxer set to turn professional in 2024",https://london.ctvnews.ca/he-hits-like-a-tank-london-ont-teen-boxer-set-to-turn-professional-in-2024-1.6701807,neutral,0.11080424,0.023790568,0.8654052,0.011711587251951094
CTV,2023-12-27,Quebec classroom cellphone ban starts after winter break,https://montreal.ctvnews.ca/quebec-classroom-cellphone-ban-starts-after-winter-break-1.6701203,negative,0.012578571,0.33984387,0.6475774,-0.11533568361107527
CTV,2023-12-27,Toronto diner featured on Food Network TV show to close its doors before 2024,https://toronto.ctvnews.ca/toronto-diner-featured-on-food-network-tv-show-to-close-its-doors-before-2024-1.6701851,neutral,0.0451054,0.14412248,0.81077206,-0.018736798629454654
CTV,2023-12-27,'A huge honour': B.C. high school teacher calling the shots at World Juniors,https://bc.ctvnews.ca/a-huge-honour-b-c-high-school-teacher-calling-the-shots-at-world-juniors-1.6702100,positive,0.91047454,0.002388806,0.08713666,0.8289581454474559
CTV,2023-12-27,A North American military command is tracking Santa's every move and kids can follow along,https://www.ctvnews.ca/canada/a-north-american-military-command-is-tracking-santa-s-every-move-and-kids-can-follow-along-1.6698568,neutral,0.13075012,0.055599973,0.81364995,0.014004233484707918
CTV,2023-12-27,Manitoba offers money as step to full school nutrition program,https://winnipeg.ctvnews.ca/manitoba-offers-money-as-step-to-full-school-nutrition-program-1.6701798,neutral,0.18305379,0.008818709,0.80812734,0.03343094680543679
CTV,2023-12-27,"Police arrest 2nd suspect in forcible confinement case, 3rd still at large",https://winnipeg.ctvnews.ca/police-arrest-2nd-suspect-in-forcible-confinement-case-3rd-still-at-large-1.6701506,neutral,0.017805848,0.12279192,0.8594022,-0.014760812825045377
CTV,2023-12-27,Here are the major recalls of the year in Canada,https://www.ctvnews.ca/canada/here-are-the-major-recalls-of-the-year-in-canada-1.6693346,neutral,0.06091881,0.041455247,0.8976259,0.001992564519486706
CTV,2023-12-27,Nova Scotia lifts stop work order for Donkin Mine,https://atlantic.ctvnews.ca/nova-scotia-lifts-stop-work-order-for-donkin-mine-1.6702020,neutral,0.023386348,0.049493153,0.9271206,-0.001902647577777472
CTV,2023-12-27,"Arrest made in Morocco related to bomb threats that closed schools in Ontario, including in the north",https://northernontario.ctvnews.ca/arrest-made-in-morocco-related-to-bomb-threats-that-closed-schools-in-ontario-including-in-the-north-1.6701945,negative,0.009777931,0.57471746,0.4155046,-0.3302045706384913
CTV,2023-12-27,WRH seeks input on products and services at new mega hospital,https://windsor.ctvnews.ca/wrh-seeks-input-on-products-and-services-at-new-mega-hospital-1.6702055,neutral,0.10728415,0.009752088,0.8829637,0.011414790212993964
CTV,2023-12-27,Waterloo family honours son’s legacy with a day of action to raise funds for cancer research,https://kitchener.ctvnews.ca/waterloo-family-honours-son-s-legacy-with-a-day-of-action-to-raise-funds-for-cancer-research-1.6701528,positive,0.54189575,0.008186832,0.44991738,0.29358400865309164
CTV,2023-12-27,Police searching for suspect on bike after 'suspicious death' of man in his 60s in Toronto,https://toronto.ctvnews.ca/police-searching-for-suspect-on-bike-after-suspicious-death-of-man-in-his-60s-in-toronto-1.6701251,negative,0.013442919,0.31331554,0.6732416,-0.09798589841625471
CTV,2023-12-27,Allegedly impaired driver handed lengthy licence suspension on Christmas Day,https://barrie.ctvnews.ca/allegedly-impaired-driver-handed-lengthy-licence-suspension-on-christmas-day-1.6702026,negative,0.010390245,0.7685356,0.22107413,-0.5905390558871471
CTV,2023-12-27,Canada ready to pay settlements to Spavor and Kovrig after 2018 imprisonment in China: report,https://www.ctvnews.ca/politics/canada-ready-to-pay-settlements-to-spavor-and-kovrig-after-2018-imprisonment-in-china-report-1.6701397,neutral,0.02727269,0.06404909,0.9086783,-0.003358483377410515
CTV,2023-12-27,Individual from Morocco charged after bomb threats made against Ontario schools,https://toronto.ctvnews.ca/individual-from-morocco-charged-after-bomb-threats-made-against-ontario-schools-1.6701943,negative,0.0077608675,0.7057966,0.28644246,-0.4980886500187296
CTV,2023-12-27,"EV, hybrid and gas-powered: Some interesting cars coming in 2024",https://www.ctvnews.ca/autos/ev-hybrid-and-gas-powered-some-interesting-cars-coming-in-2024-1.6699985,positive,0.89594907,0.0026065917,0.101444304,0.8027179873387524
CTV,2023-12-27,'It sucked': N.B. family spends Christmas without power,https://atlantic.ctvnews.ca/it-sucked-n-b-family-spends-christmas-without-power-1.6701607,negative,0.007237212,0.87719834,0.11556449,-0.7694245286316237
