source,date,headline,url,chosen_label,positive,negative,neutral,compound
Global,2023-11-04,B.C. travellers take Air Canada to task for treatment of disabled passengers,https://globalnews.ca/video/10070722/b-c-travellers-take-air-canada-to-task-for-treatment-of-disabled-passengers/,negative,0.013503624,0.60580915,0.3806872,-0.3668223989396715
Global,2023-11-04,AI influencers: Why big brands are turning to virtual trendsetters,https://globalnews.ca/news/10069079/ai-influencers-social-media/,neutral,0.18012333,0.016124582,0.80375206,0.032184416634333246
Global,2023-11-04,Alberta politicians could have final say in public health emergency if bill passes,https://globalnews.ca/video/10070705/alberta-politicians-could-have-final-say-in-public-health-emergency-if-bill-passes/,neutral,0.044259787,0.03972416,0.91601616,0.00038091933381889653
Global,2023-11-04,How Alberta became a green energy leader then squandered it,https://globalnews.ca/news/10045504/alberta-renewable-energy-industry/,negative,0.03114522,0.58367044,0.3851843,-0.33970118793348547
Global,2023-11-04,"Poilievre urges for economic stability, free enterprise system at Saskatchewan Party convention",https://globalnews.ca/video/10071223/poilievre-urges-for-economic-stability-free-enterprise-system-at-saskatchewan-party-convention/,neutral,0.17063229,0.019649254,0.8097186,0.028729262046311987
Global,2023-11-04,"Lobbyist registry rules in full effect in Pickering, Ont.",https://globalnews.ca/news/10068841/pickering-lobbyist-registry/,neutral,0.028625289,0.16462776,0.80674696,-0.0262828900606209
Global,2023-11-04,Canadian military aircraft was in international airspace during Chinese intercept: DND,https://globalnews.ca/video/10068212/canadian-military-aircraft-was-in-international-airspace-during-chinese-intercept-dnd/,neutral,0.030008588,0.040938478,0.92905295,-0.0007754434621487505
Global,2023-11-04,"Puppetry’s next act: imagination, innovation and activism",https://globalnews.ca/news/10060628/puppetry-imagination-innovation-activism/,positive,0.40849882,0.009579276,0.5819218,0.16677956214929424
Global,2023-11-04,‘I felt like I was in a MMA fight’: Disabled B.C. man shares horrible Air Canada experience,https://globalnews.ca/news/10070423/disabled-b-c-man-horrible-air-canada-experience/,negative,0.00606762,0.9183345,0.07559793,-0.8433013677284809
Global,2023-11-04,What’s next for Alberta’s renewables revolution?,https://globalnews.ca/video/10069807/whats-next-for-albertas-renewables-revolution/,neutral,0.05151345,0.023344368,0.9251421,0.002108677955150462
Global,2023-11-04,Flip flop on carbon pricing could mean free heat pumps for some homeowners,https://globalnews.ca/video/10070672/carbon-price-pause-debate/,neutral,0.18186796,0.09598296,0.7221492,0.023863215356060063
Global,2023-11-04,Global News Hour at 6 BC: Nov. 3,https://globalnews.ca/video/10070751/global-news-hour-at-6-bc-nov-3-3/,neutral,0.041134644,0.0076641734,0.9512011,0.001633322767549128
Global,2023-11-04,‘It’s like a treasure hunt’: B.C. conditions are magic for mushrooms,https://globalnews.ca/news/10070861/bc-fall-2023-mushroom-foraging/,positive,0.66413724,0.011618857,0.32424393,0.4409432619835165
Global,2023-11-04,Guelph.Beer bus wins at Ontario Tourism Summit,https://globalnews.ca/news/10069375/guelph-beer-bus-win-ontario-tourism-summit/,positive,0.59260976,0.0045789164,0.40281138,0.351165347631488
Global,2023-11-04,‘Young and the Restless’ star Eric Braeden lays into ‘dismal’ Air Canada,https://globalnews.ca/news/10069235/eric-braeden-air-canada-complaints-young-and-restless/,negative,0.019291405,0.47408006,0.5066286,-0.22437972774871362
Global,2023-11-04,‘I didn’t think it would be in my house’: Lung cancer survivor warns of radon risks,https://globalnews.ca/news/10063017/radon-detector-house-cancer/,negative,0.01288789,0.6820419,0.30507025,-0.4650150130227946
Global,2023-11-04,"Two ‘unsafe’ intercepts involving Chinese fighter jets and Canadian Cyclone helicopter, Blair says",https://globalnews.ca/video/10069162/two-unsafe-intercepts-involving-chinese-fighter-jets-and-canadian-cyclone-helicopter-blair-says/,negative,0.010627968,0.44229388,0.5470781,-0.19551096354416764
Global,2023-11-04,Vast digital trove of recordings by Canadian literature greats nears completion,https://globalnews.ca/news/10071117/canadian-literature-digital-recordings-project-nears-completion/,positive,0.68229365,0.0043027145,0.31340373,0.4655060351950624
Global,2023-11-04,White House signals it’s running out of funding to support Ukraine,https://globalnews.ca/news/10070399/ukraine-funding-white-house-running-out/,negative,0.015251777,0.4758435,0.50890476,-0.22619439549739973
Global,2023-11-04,Northern B.C. First Nations call for more action over missing members,https://globalnews.ca/video/10070684/northern-b-c-first-nations-call-for-more-action-over-missing-members-2/,neutral,0.018745655,0.17896932,0.8022849,-0.031678638104406076
Global,2023-11-04,"Freeland, provincial and territorial finance ministers discuss possible Alberta CPP exit",https://globalnews.ca/video/10070783/freeland-provincial-and-territorial-finance-ministers-discuss-possible-alberta-cpp-exit/,neutral,0.027716076,0.028454073,0.9438299,-4.14533568584563e-05
Global,2023-11-04,"Passenger volumes nearing pre-pandemic levels, Winnipeg Airports Authority says",https://globalnews.ca/video/10070778/passenger-volumes-nearing-pre-pandemic-levels-winnipeg-airports-authority-says/,neutral,0.06895691,0.024828866,0.90621424,0.0041385824018576045
Global,2023-11-04,Sidney Island deer eradication dividing community,https://globalnews.ca/video/10070699/sidney-island-deer-eradication-dividing-community/,negative,0.020477269,0.53692937,0.4425934,-0.28787379687524606
Global,2023-11-04,Rogers to lock out former Shaw technicians across Lower Mainland,https://globalnews.ca/video/10071239/rogers-to-lock-out-former-shaw-technicians-across-lower-mainland/,negative,0.014615402,0.24739988,0.73798466,-0.06099310526772683
Global,2023-11-04,Canadians can leave Gaza as early as Sunday as families grow desperate,https://globalnews.ca/video/10070782/canadians-can-leave-gaza-as-early-as-sunday-as-families-grow-desperate/,negative,0.016169807,0.64208794,0.34174225,-0.41201547473203703
Global,2023-11-04,"Some Alberta retirees fear ‘ridiculous’ new pension plan, as province previews CPP exit strategy",https://globalnews.ca/video/10068214/some-alberta-retirees-fear-ridiculous-new-pension-plan-as-province-previews-cpp-exit-strategy/,negative,0.007051045,0.7996264,0.19332242,-0.6393527727483388
Global,2023-11-04,"Chinese jets intercept, fire flares near Canadian helicopter in ‘significantly unsafe’ moves",https://globalnews.ca/news/10069025/chinese-intercept-helicopter-flare/,negative,0.008956976,0.6601856,0.33085737,-0.4357648250133348
Global,2023-11-04,Canada will officially be in a recession if downward data trends continue,https://globalnews.ca/video/10062637/canada-will-officially-be-in-a-recession-if-downward-data-trends-continue/,negative,0.013479738,0.77903366,0.2074866,-0.606711765041311
Global,2023-11-04,Interest rates could stay higher for longer. What that means for your portfolio,https://globalnews.ca/news/10069430/stock-market-interest-rates-impact/,neutral,0.047567762,0.07485034,0.8775821,-0.003339876970805733
Global,2023-11-04,Danielle Smith’s message could get ‘lost in the noise’: political scientist,https://globalnews.ca/news/10071018/danielle-smiths-message-could-get-lost-in-the-noise-political-scientist/,neutral,0.025650272,0.20726828,0.7670815,-0.04230219346978714
Global,2023-11-04,Mary Ellen Turpel-Lafond removed from Order of Canada at own request,https://globalnews.ca/news/10069918/mary-ellen-turpel-lafond-order-of-canada/,negative,0.018430647,0.31633368,0.6652357,-0.0997273002070127
Global,2023-11-04,Veterans lead the way as Frontenacs double up Colts 4-2,https://globalnews.ca/news/10070541/veterans-lead-the-way-as-frontenacs-double-up-colts-4-2/,neutral,0.096320555,0.0064361943,0.89724326,0.009236224010455985
Global,2023-11-04,Hundreds of Edmontonians line up to be the first to ride Valley Line LRT,https://globalnews.ca/news/10071083/hundreds-of-edmontonians-line-up-to-be-the-first-to-ride-valley-line-lrt/,neutral,0.20202962,0.007181624,0.7907887,0.04076439850345981
Global,2023-11-04,Historic deal signed to protect more B.C. land and water,https://globalnews.ca/video/10070654/historic-deal-signed-to-protect-more-b-c-land-and-water/,positive,0.7661408,0.0058998056,0.22795936,0.5869369690896775
Global,2023-11-04,Rogers to lock out former Shaw technicians across Lower Mainland,https://globalnews.ca/news/10071008/rogers-lock-out-former-shaw-technicians/,negative,0.014615402,0.24739988,0.73798466,-0.06099310526772683
CTV,2023-11-04,"Canada's jobless rate rises to 5.7 per cent, fuelling bets Bank of Canada rate hikes are done",https://www.ctvnews.ca/business/canada-s-jobless-rate-rises-to-5-7-per-cent-fuelling-bets-bank-of-canada-rate-hikes-are-done-1.6629614,negative,0.020161882,0.5000286,0.47980952,-0.2496221101613969
CTV,2023-11-04,Some Ottawa Senators players to wear neck guards in Saturday game vs. Tampa Bay,https://ottawa.ctvnews.ca/some-ottawa-senators-players-to-wear-neck-guards-in-saturday-game-vs-tampa-bay-1.6631398,neutral,0.027600499,0.025819955,0.9465797,9.511717602084246e-05
CTV,2023-11-04,Pedestrian seriously hurt in Kitchener hit-and-run,https://kitchener.ctvnews.ca/pedestrian-seriously-hurt-in-kitchener-hit-and-run-1.6631282,negative,0.014929128,0.756152,0.22891885,-0.5715429737709599
CTV,2023-11-04,U.S. school janitor allegedly contaminated food,https://www.ctvnews.ca/video?playlistId=1.6631390,negative,0.007968317,0.69860756,0.29342425,-0.48798895219979954
CTV,2023-11-04,"Toronto police warn drivers, pedestrians to be careful as Daylight Saving Time ends",https://toronto.ctvnews.ca/toronto-police-warn-drivers-pedestrians-to-be-careful-as-daylight-saving-time-ends-1.6629962,neutral,0.04777749,0.07160018,0.8806224,-0.002843895578518385
CTV,2023-11-04,"‘It’s a silent city’: Ukrainian-Jewish teen escapes war zones in Ukraine and Israel, finds safety in Canada",https://northernontario.ctvnews.ca/it-s-a-silent-city-ukrainian-jewish-teen-escapes-war-zones-in-ukraine-and-israel-finds-safety-in-canada-1.6630723,neutral,0.08652688,0.09373429,0.81973886,-0.0012992156458935256
CTV,2023-11-04,N.B. family hopes inquest will give answers on daughter’s death,https://atlantic.ctvnews.ca/more/n-b-family-hopes-inquest-will-give-answers-on-daughter-s-death-1.6630523,neutral,0.077573195,0.053711634,0.8687151,0.003132662468309233
CTV,2023-11-04,"Trudeau in D.C. to talk hemispheric trade, migration at White House summit",https://www.ctvnews.ca/politics/trudeau-in-d-c-to-talk-hemispheric-trade-migration-at-white-house-summit-1.6629657,neutral,0.055109836,0.009236783,0.9356534,0.002951775543631019
CTV,2023-11-04,Police searching for suspect in downtown shooting,https://winnipeg.ctvnews.ca/police-searching-for-suspect-in-downtown-shooting-1.6631321,neutral,0.032707993,0.1418186,0.82547337,-0.019042707033029238
CTV,2023-11-04,Ontario to add provincial tax to vaping products; meant to discourage youth uptake,https://toronto.ctvnews.ca/ontario-to-add-provincial-tax-to-vaping-products-meant-to-discourage-youth-uptake-1.6630059,negative,0.011343599,0.6850711,0.30358544,-0.4691936491334303
CTV,2023-11-04,Newfoundland fishermen get 'best news' on northern cod stocks in a generation,https://www.ctvnews.ca/canada/newfoundland-fishermen-get-best-news-on-northern-cod-stocks-in-a-generation-1.6630263,positive,0.890426,0.0042672195,0.10530664,0.7928403621438518
CTV,2023-11-04,"Sask. man took officer's gun and shot him, agency says",https://regina.ctvnews.ca/sask-man-took-officer-s-gun-and-shot-him-agency-says-1.6630573,negative,0.011557269,0.5588543,0.4295884,-0.3121845539667589
CTV,2023-11-04,"Burton Cummings, Randy Bachman sue former Guess Who bandmates over use of name",https://winnipeg.ctvnews.ca/burton-cummings-randy-bachman-sue-former-guess-who-bandmates-over-use-of-name-1.6628569,neutral,0.03256326,0.13408567,0.833351,-0.01691860621286434
CTV,2023-11-04,"Man who tried to record wife having affair guilty of voyeurism, B.C. judge rules",https://bc.ctvnews.ca/man-who-tried-to-record-wife-having-affair-guilty-of-voyeurism-b-c-judge-rules-1.6630236,negative,0.015797758,0.54642236,0.43777987,-0.2983278454577274
CTV,2023-11-04,Lonely garage hours pay off for Canada's Laos-Loo at Pan American Games,https://www.ctvnews.ca/sports/lonely-garage-hours-pay-off-for-canada-s-laos-loo-at-pan-american-games-1.6630882,positive,0.30847183,0.072646245,0.6188819,0.08987740267823963
CTV,2023-11-04,Elon Musk’s conversation with British prime minister finishes off the U.K.’s AI Safety Summit,https://www.ctvnews.ca/sci-tech/elon-musk-s-conversation-with-british-prime-minister-finishes-off-the-u-k-s-ai-safety-summit-1.6629033,neutral,0.12493179,0.006455167,0.8686131,0.015566273230795069
CTV,2023-11-04,Regina police investigate after man found with serious injuries,https://regina.ctvnews.ca/regina-police-investigate-after-man-found-with-serious-injuries-1.6631381,negative,0.013063097,0.46965563,0.5172811,-0.22040583696163374
CTV,2023-11-04,'We will conquer cancer in our lifetime': Cancer patient finds hope in advanced precision medicine,https://www.ctvnews.ca/health/we-will-conquer-cancer-in-our-lifetime-cancer-patient-finds-hope-in-advanced-precision-medicine-1.6629934,positive,0.91149014,0.0035954295,0.0849145,0.8308013052566396
CTV,2023-11-04,Mark Zuckerberg undergoes knee surgery after the Meta CEO got hurt during martial arts training,https://www.ctvnews.ca/business/mark-zuckerberg-undergoes-knee-surgery-after-the-meta-ceo-got-hurt-during-martial-arts-training-1.6631409,negative,0.014273038,0.52372193,0.46200505,-0.2740809284212453
CTV,2023-11-04,Mary Ellen Turpel-Lafond removed from Order of Canada after Indigenous ID questions,https://www.ctvnews.ca/canada/mary-ellen-turpel-lafond-removed-from-order-of-canada-after-indigenous-id-questions-1.6630513,negative,0.011089244,0.5555233,0.4333874,-0.30848317118822166
CTV,2023-11-04,London fire crews respond to blaze at boarded up home,https://london.ctvnews.ca/london-fire-crews-respond-to-blaze-at-boarded-up-home-1.6631264,neutral,0.028572863,0.21293665,0.7584904,-0.044525629961049695
CTV,2023-11-04,Freezing rain statement issued for southern Manitoba,https://winnipeg.ctvnews.ca/freezing-rain-statement-issued-for-southern-manitoba-1.6631353,negative,0.039212123,0.2315454,0.7292425,-0.052075677640562645
CTV,2023-11-04,Online game opened Alberta mom's accounts to hackers,https://calgary.ctvnews.ca/online-game-opened-alberta-mom-s-accounts-to-hackers-1.6627998,negative,0.011181854,0.7510525,0.23776558,-0.5639548887769585
CTV,2023-11-04,Your favourite paper towel brand may be cut from Canada's boreal forest,https://www.ctvnews.ca/climate-and-environment/your-favourite-paper-towel-brand-may-be-cut-from-canada-s-boreal-forest-1.6630217,negative,0.061740022,0.43857896,0.49968106,-0.18853966684542733
CTV,2023-11-04,Ensuring Windsor-Essex kids keep warm this winter,https://windsor.ctvnews.ca/ensuring-windsor-essex-kids-keep-warm-this-winter-1.6631425,positive,0.36874813,0.016299289,0.6149525,0.13570954727186724
CTV,2023-11-04,"OC Transpo reducing bus service by 74,000 hours in 2024",https://ottawa.ctvnews.ca/oc-transpo-reducing-bus-service-by-74-000-hours-in-2024-1.6630985,negative,0.028850595,0.4407804,0.530369,-0.19345501811715415
CTV,2023-11-04,"Man dies following ATV crash in Taxis River, N.B.",https://atlantic.ctvnews.ca/man-dies-following-atv-crash-in-taxis-river-n-b-1.6631254,negative,0.01184341,0.58792657,0.40022993,-0.3455174506611911
CTV,2023-11-04,"Assaults against police in Quebec rose 9% in 2022, says association",https://montreal.ctvnews.ca/assaults-against-police-in-quebec-rose-9-in-2022-says-association-1.6631351,negative,0.01607153,0.4666067,0.5173217,-0.21746355127500294
CTV,2023-11-04,NDP side with Tories to remove carbon tax from home heating,https://www.ctvnews.ca/video?playlistId=1.6626267,neutral,0.03876031,0.12506153,0.836178,-0.01413803845394046
CTV,2023-11-04,Montrealers call for ceasefire in Gaza as protests erupt across Canada,https://montreal.ctvnews.ca/montrealers-call-for-ceasefire-in-gaza-as-protests-erupt-across-canada-1.6631237,neutral,0.041184288,0.13544078,0.823375,-0.016648053887543313
CTV,2023-11-04,'He's so evil': Mother of Toronto toddler who died after eating poisoned breakfast cereal speaks out after sentencing hearing,https://toronto.ctvnews.ca/he-s-so-evil-mother-of-toronto-toddler-who-died-after-eating-poisoned-breakfast-cereal-speaks-out-after-sentencing-hearing-1.6629927,negative,0.0040901033,0.92484576,0.071064234,-0.8553228317982189
CTV,2023-11-04,Singapore’s Changi Airport fully reopens Terminal 2 following dramatic makeover,https://www.ctvnews.ca/lifestyle/singapore-s-changi-airport-fully-reopens-terminal-2-following-dramatic-makeover-1.6630459,positive,0.5428262,0.0029940545,0.45417976,0.29465129261552647
CTV,2023-11-04,Iranians mark the anniversary of the 1979 U.S. embassy takeover while calling for a ceasefire in Gaza,https://www.ctvnews.ca/world/iranians-mark-the-anniversary-of-the-1979-u-s-embassy-takeover-while-calling-for-a-ceasefire-in-gaza-1.6631268,neutral,0.03823033,0.1695098,0.7922599,-0.027272013602811285
CTV,2023-11-04,"Pedestrian struck in North Bay, OPP investigating",https://northernontario.ctvnews.ca/pedestrian-struck-in-north-bay-opp-investigating-1.6631314,negative,0.016170416,0.40409935,0.5797303,-0.16303478700169904
CTV,2023-11-04,Moose Jaw holds events to honour and support veterans in city,https://regina.ctvnews.ca/moose-jaw-holds-events-to-honour-and-support-veterans-in-city-1.6631370,positive,0.48950133,0.0109538445,0.4995449,0.23949153419206493
CTV,2023-11-04,"Biden will host Americas summit that focuses on supply chains, migration and new investment",https://www.ctvnews.ca/business/biden-will-host-americas-summit-that-focuses-on-supply-chains-migration-and-new-investment-1.6630199,positive,0.33819136,0.0064781024,0.6553306,0.11433141057333174
CTV,2023-11-04,"Nepal rushes aid and rescue operations after strong quake shakes its northwest, killing at least 157",https://www.ctvnews.ca/world/nepal-rushes-aid-and-rescue-operations-after-strong-quake-shakes-its-northwest-killing-at-least-157-1.6631233,negative,0.013176655,0.64412206,0.3427013,-0.4147195897887723
CTV,2023-11-04,Rogers to lock out former Shaw technicians Monday after contract talks break down,https://www.ctvnews.ca/business/rogers-to-lock-out-former-shaw-technicians-monday-after-contract-talks-break-down-1.6631277,negative,0.009955857,0.3888835,0.6011607,-0.15113123597729938
CTV,2023-11-04,Western U coach under fire for allegedly ignoring harassment,https://www.ctvnews.ca/video?playlistId=1.6631195,negative,0.008987661,0.70890206,0.28211027,-0.5024613539442591
CTV,2023-11-04,Barrie Christmas Arts and Crafts show returns for 27th edition,https://barrie.ctvnews.ca/barrie-christmas-arts-and-crafts-show-returns-for-27th-edition-1.6631419,positive,0.36528665,0.003269629,0.6314436,0.13342367721103088
CTV,2023-11-04,"'Not tasting one day of real jail': Criminal defence lawyer calls Dawn Walker sentence 'very, very light'",https://saskatoon.ctvnews.ca/not-tasting-one-day-of-real-jail-criminal-defence-lawyer-calls-dawn-walker-sentence-very-very-light-1.6630494,negative,0.044782046,0.34748784,0.6077302,-0.11874233852110727
CTV,2023-11-04,Tensions spike in Rio de Janeiro ahead of Copa Libertadores soccer final and after Copacabana brawl,https://www.ctvnews.ca/sports/tensions-spike-in-rio-de-janeiro-ahead-of-copa-libertadores-soccer-final-and-after-copacabana-brawl-1.6630432,negative,0.015458943,0.4121642,0.5723769,-0.16964033453792382
CTV,2023-11-04,Andaz Hotel Ottawa seeks approval to demolish York Street building to add onto hotel,https://ottawa.ctvnews.ca/andaz-hotel-ottawa-seeks-approval-to-demolish-york-street-building-to-add-onto-hotel-1.6631290,negative,0.020747017,0.29473737,0.6845158,-0.0864396374969747
CTV,2023-11-04,Police release photos of gas theft suspect,https://kitchener.ctvnews.ca/police-release-photos-of-gas-theft-suspect-1.6631315,negative,0.009291435,0.61471117,0.37599745,-0.3777834685510548
CTV,2023-11-04,Bed bugs detected at CRA office building in Toronto,https://toronto.ctvnews.ca/bed-bugs-detected-at-cra-office-building-in-toronto-1.6630578,negative,0.017132023,0.39894757,0.5839204,-0.15886565510894712
CTV,2023-11-04,"'We're just more vigilant,' synagogue and mosque leaders in Canada say amid rise in hate crimes",https://www.ctvnews.ca/canada/we-re-just-more-vigilant-synagogue-and-mosque-leaders-in-canada-say-amid-rise-in-hate-crimes-1.6630632,negative,0.019156806,0.46697623,0.51386696,-0.21769981155840767
CTV,2023-11-04,"Toyota recalls hundreds of thousands vehicles in Canada, warning they may catch fire while being driven",https://www.ctvnews.ca/autos/toyota-recalls-hundreds-of-thousands-vehicles-in-canada-warning-they-may-catch-fire-while-being-driven-1.6628169,negative,0.011468292,0.67283326,0.31569844,-0.4525730792704685
CTV,2023-11-04,"After immigrating to Canada, are you now planning to leave the country? We want to hear from you",https://www.ctvnews.ca/canada/after-immigrating-to-canada-are-you-now-planning-to-leave-the-country-we-want-to-hear-from-you-1.6630229,neutral,0.07555011,0.013236038,0.9112137,0.0055326360298972865
CTV,2023-11-04,'A child is going to die here': Calls for change at Norfolk County crosswalk,https://kitchener.ctvnews.ca/a-child-is-going-to-die-here-calls-for-change-at-norfolk-county-crosswalk-1.6630916,negative,0.006180205,0.84575075,0.14806886,-0.7152562720351128
CTV,2023-11-04,Main Street reopens two months after Penetanguishene building collapse,https://barrie.ctvnews.ca/main-street-reopens-two-months-after-penetanguishene-building-collapse-1.6631433,neutral,0.07033725,0.1222976,0.8073652,-0.010009372541475159
CTV,2023-11-04,Sask. family besieged by bats forced to get dozens of rabies shots,https://saskatoon.ctvnews.ca/sask-family-besieged-by-bats-forced-to-get-dozens-of-rabies-shots-1.6625102,negative,0.012755326,0.6560064,0.33123836,-0.430181635286349
CTV,2023-11-04,"Saint John auction features three rare, early Maud Lewis paintings",https://atlantic.ctvnews.ca/more/saint-john-auction-features-three-rare-early-maud-lewis-paintings-1.6630545,neutral,0.1919286,0.0064348346,0.80163664,0.03679516762732149
CTV,2023-11-04,London Police Service kicks off Crime Prevention Week,https://london.ctvnews.ca/london-police-service-kicks-off-crime-prevention-week-1.6631350,neutral,0.21609443,0.020059176,0.76384634,0.046294445968889875
CTV,2023-11-04,LIVE: Pro-Palestinian demonstrators rally in Washington,https://www.ctvnews.ca/video?playlistId=1.6594703,neutral,0.02992212,0.13442303,0.8356548,-0.017174223808924527
CTV,2023-11-04,Nepal: Devastating earthquake leaves 157 dead,https://www.ctvnews.ca/video?playlistId=1.6631250,negative,0.009072063,0.8353935,0.15553436,-0.6978000519821581
CTV,2023-11-04,"Demonstration to disrupt traffic in Churchill Square, Ice District Saturday afternoon: police",https://edmonton.ctvnews.ca/demonstration-to-disrupt-traffic-in-churchill-square-ice-district-saturday-afternoon-police-1.6631386,negative,0.009793255,0.40518463,0.58502215,-0.16407866205271837
CTV,2023-11-04,Sunak says agreements at UK summit tip the balance in favor of humanity in fight against AI threats,https://www.ctvnews.ca/sci-tech/sunak-says-agreements-at-uk-summit-tip-the-balance-in-favor-of-humanity-in-fight-against-ai-threats-1.6629668,positive,0.35194883,0.01669289,0.6313582,0.1235893550200533
CTV,2023-11-04,"Welcome to Mexican 'muerteadas,' a traditional parade to portray how death can be as joyful as life",https://www.ctvnews.ca/lifestyle/welcome-to-mexican-muerteadas-a-traditional-parade-to-portray-how-death-can-be-as-joyful-as-life-1.6630136,positive,0.83020204,0.008051426,0.16174647,0.68917063086921
CTV,2023-11-04,Three people arrested after allegedly shooting woman and child with pellet gun,https://windsor.ctvnews.ca/three-people-arrested-after-allegedly-shooting-woman-and-child-with-pellet-gun-1.6631256,negative,0.011552934,0.74905,0.23939696,-0.560942529965736
CTV,2023-11-04,U.S. climate article predicts snow deficit for Maritimes for upcoming El Nino winter,https://atlantic.ctvnews.ca/more/u-s-climate-article-predicts-snow-deficit-for-maritimes-for-upcoming-el-nino-winter-1.6630111,neutral,0.025500927,0.18994313,0.7845558,-0.03542812186163147
CTV,2023-11-04,Sask. school's move to change Halloween to 'harvest celebration' gets mixed reviews,https://regina.ctvnews.ca/sask-school-s-move-to-change-halloween-to-harvest-celebration-gets-mixed-reviews-1.6625715,negative,0.0130166495,0.37956187,0.60742146,-0.1438977921146556
CTV,2023-11-04,Man charged with murder in death of Toronto filmmaker,https://toronto.ctvnews.ca/man-charged-with-murder-in-death-of-toronto-filmmaker-1.6631417,negative,0.00806193,0.7670911,0.22484688,-0.5883638103027344
CTV,2023-11-04,Province giving family doctors $20M boost ahead of new payment model,https://saskatoon.ctvnews.ca/province-giving-family-doctors-20m-boost-ahead-of-new-payment-model-1.6631422,positive,0.4568999,0.0042616194,0.5388384,0.20873940794737678
CTV,2023-11-04,Russia opens a vast national exposition as presidential election approaches,https://www.ctvnews.ca/world/russia-opens-a-vast-national-exposition-as-presidential-election-approaches-1.6631285,neutral,0.109973624,0.033848427,0.856178,0.010948479190135085
CTV,2023-11-04,Man charged in elderly relative’s death: Brandon Police,https://winnipeg.ctvnews.ca/man-charged-in-elderly-relative-s-death-brandon-police-1.6631376,negative,0.011506712,0.44383252,0.54466087,-0.19685485990695817
