source,date,headline,url,chosen_label,positive,negative,neutral,compound
Global,2023-10-04,"Vehicle of missing Calgary woman found, police continue search",https://globalnews.ca/news/10004956/vehicle-missing-calgary-woman-found-police-continue-search/,neutral,0.0354923,0.08406511,0.88044256,-0.005807240652005774
Global,2023-10-04,‘Bear attack bad’: Harrowing final message from Alberta couple killed by grizzly,https://globalnews.ca/news/10005074/bear-attack-bad-harrowing-final-message-from-alberta-couple-killed-by-grizzly/,negative,0.00441024,0.8787221,0.116867505,-0.7721331655435497
Global,2023-10-04,Kingston-area farmers assess their crops as end of season approaches,https://globalnews.ca/news/10004909/kingston-area-farmers-harvest/,neutral,0.058762737,0.013064107,0.9281731,0.0032823896383726847
Global,2023-10-04,Kevin McCarthy kicked out as U.S. House speaker,https://globalnews.ca/video/10003376/kevin-mccarthy-kicked-out-as-u-s-house-speaker/,negative,0.013124351,0.7037954,0.2830803,-0.49515565861448074
Global,2023-10-04,"Manitoba Election: Wab Kinew addresses province on promises, vision for future following win",https://globalnews.ca/video/10004392/manitoba-election-wab-kinew-addresses-province-on-promises-vision-for-future-following-win/,neutral,0.20763569,0.009137462,0.783227,0.04302904922906414
Global,2023-10-04,Judge gives jury instruction in Halifax murder retrial of Randy Riley,https://globalnews.ca/news/10004771/jury-instruction-randy-riley-murder-retrial/,neutral,0.02811269,0.11907021,0.8528171,-0.013387390270004573
Global,2023-10-04,A brief look into the Manitoba Legislature and it’s unique history,https://globalnews.ca/video/10004084/a-brief-look-into-the-manitoba-legislature-and-its-unique-history/,positive,0.2275318,0.0134870475,0.758981,0.05158885738512353
Global,2023-10-04,Six provinces raise minimum wage,https://globalnews.ca/video/10004068/six-provinces-raise-minimum-wage/,positive,0.24801628,0.06542936,0.6865543,0.05723108364636609
Global,2023-10-04,Rail outage that stranded thousands in Toronto area caused by software upgrade: CN,https://globalnews.ca/news/10005045/go-transit-outage-cn-rail/,negative,0.0069038034,0.71105057,0.28204566,-0.5055452083128742
Global,2023-10-04,"Winnipeg landfill search: Canada commits $740,000 into further study of feasibility as calls grow",https://globalnews.ca/video/10004638/winnipeg-landfill-search-canada-to-fund-740000-for-further-study-after-wab-kinews-historic-win/,neutral,0.109033816,0.025012925,0.8659531,0.011262740903844382
Global,2023-10-04,Sales slow as record listings hit Waterloo region real estate market,https://globalnews.ca/news/10004898/kitchener-waterloo-cambridge-house-prices-september-2023/,negative,0.029406857,0.37607285,0.5945202,-0.14056605979601144
Global,2023-10-04,"Average cost of raising a child in Canada roughly $290K, new data reveals",https://globalnews.ca/video/10004532/average-cost-of-raising-a-child-in-canada-roughly-290k-new-data-reveals/,neutral,0.030897312,0.17423366,0.794869,-0.029402729164100805
Global,2023-10-04,Halifax street closures to last months as part of Cogswell redevelopment project,https://globalnews.ca/news/10004608/halifax-street-closures-to-last-months-as-part-of-cogswell-redevelopment-project/,neutral,0.024300631,0.11629756,0.8594019,-0.01293459427618604
Global,2023-10-04,"Cost of RSV vaccine a barrier to older Canadians amid respiratory season, experts warn",https://globalnews.ca/video/10004563/cost-of-rsv-vaccine-a-barrier-to-older-canadians-amid-respiratory-season-experts-warn/,negative,0.017155264,0.43013307,0.5527116,-0.18472018347272012
Global,2023-10-04,B.C. wildfires: Satellite photos reveal damage can be seen from space,https://globalnews.ca/news/10004701/bc-wildfires-satellite-photos/,negative,0.019483272,0.4408543,0.5396624,-0.1939729257757925
Global,2023-10-04,Ryan Belleville talks stand-up comedy,https://globalnews.ca/video/10003690/ryan-belleville-talks-stand-up-comedy/,neutral,0.12937889,0.009764559,0.8608565,0.01664355907142001
Global,2023-10-04,"U.S. sanctions Canadian businessman, lab in fentanyl supply chain crackdown",https://globalnews.ca/news/10003940/u-s-sanctions-canadian-businessman-lab-fentanyl/,negative,0.008144138,0.6357337,0.35612223,-0.4040909842425542
Global,2023-10-04,Girl abducted on family camping trip found ‘safe’ thanks to fingerprint on ransom note,https://globalnews.ca/video/10001840/girl-abducted-on-family-camping-trip-found-safe-thanks-to-fingerprint-on-ransom-note/,neutral,0.16913816,0.02388828,0.8069736,0.02803706644585624
Global,2023-10-04,"Tim Hortons joins app to reduce food waste, save money",https://globalnews.ca/video/10005007/tim-hortons-joins-app-to-reduce-food-waste-save-money/,positive,0.47095156,0.021871276,0.5071771,0.22131704356145576
Global,2023-10-04,Saskatoon mother advocates for better public transit amid high school struggles,https://globalnews.ca/news/10004220/saskatoon-mother-better-public-transit-high-school-struggles/,positive,0.28119102,0.032095354,0.6867137,0.07803825985592283
Global,2023-10-04,"Manitoba’s reliance on payments, population dispersion different than Saskatchewan, political sciences prof says",https://globalnews.ca/video/10005148/manitobas-reliance-on-payments-population-dispersion-different-than-saskatchewan-political-sciences-prof-says/,neutral,0.01948066,0.07984784,0.9006715,-0.005996182708479125
Global,2023-10-04,Missing 4-year-old child rescued from Airdrie pond remains in critical condition,https://globalnews.ca/news/10004635/airdrie-child-rescued-pond-critical-condition/,negative,0.018735887,0.532679,0.44858503,-0.28339593701886656
Global,2023-10-04,Canadian shoppers prioritizing cost over nutrition at the grocery store: report,https://globalnews.ca/video/10004331/canadian-shoppers-prioritizing-cost-over-nutrition-at-the-grocery-store-report/,neutral,0.036318466,0.10175942,0.8619222,-0.009035942495348337
Global,2023-10-04,At least 21 dead after tourist bus plunges off overpass near Venice,https://globalnews.ca/video/10004065/at-least-21-dead-after-tourist-bus-plunges-off-overpass-near-venice/,negative,0.007951498,0.8202489,0.17179945,-0.6727451556971271
Global,2023-10-04,"2 children, 1 employee injured after car smashes through fence at Vaughan daycare",https://globalnews.ca/video/10004459/2-children-1-employee-injured-after-car-smashes-through-fence-at-vaughan-daycare/,negative,0.008994435,0.70435137,0.28665423,-0.4960299044159484
Global,2023-10-04,Sleepy puppies from the Cochrane Humane Society,https://globalnews.ca/video/10005104/sleepy-puppies-from-the-cochrane-humane-society/,neutral,0.09945868,0.1926606,0.7078806,-0.027226087554454992
Global,2023-10-04,"Winnipeg fires crews fight blazes at two homes, 15 minutes a part",https://globalnews.ca/news/10004887/winnipeg-house-fires-ottawa-avenue-kenaston-boulevard/,neutral,0.030969366,0.103772484,0.86525816,-0.009809626187403442
Global,2023-10-04,The National Ballet of Ukraine is making a stop in Edmonton in 2024,https://globalnews.ca/video/10004204/the-national-ballet-of-ukraine-is-making-a-stop-in-edmonton-in-2024/,neutral,0.075011835,0.0050037517,0.9199844,0.005601738841282788
Global,2023-10-04,"Canadians are facing a ‘financial storm,’ and experts say it’s time to plan ahead",https://globalnews.ca/video/10002873/canadians-are-facing-a-financial-storm-what-some-experts-say-could-help/,neutral,0.04774095,0.14795266,0.8043064,-0.019610791453171572
Global,2023-10-04,Poilievre blames Trudeau for rising food prices ahead of Thanksgiving,https://globalnews.ca/video/10005076/poilievre-blames-trudeau-for-rising-food-prices-ahead-of-thanksgiving/,negative,0.012949356,0.679051,0.30799967,-0.46094255055247757
Global,2023-10-04,British Columbians overwhelmingly oppose return of grizzly trophy hunting: poll,https://globalnews.ca/news/10004720/bc-oppose-return-grizzly-trophy-hunting/,negative,0.009156872,0.6473825,0.34346065,-0.41902023091901164
CTV,2023-10-04,Province names 2023 Order of Nova Scotia recipients,https://atlantic.ctvnews.ca/province-names-2023-order-of-nova-scotia-recipients-1.6588387,neutral,0.038739763,0.01686643,0.9443937,0.0012162952148080386
CTV,2023-10-04,Andretti Global clears first hurdle to join Formula One as an 11th team with FIA expansion approval,https://www.ctvnews.ca/autos/andretti-global-clears-first-hurdle-to-join-formula-one-as-an-11th-team-with-fia-expansion-approval-1.6585762,neutral,0.21224605,0.0060978606,0.781656,0.04501121210996217
CTV,2023-10-04,"Rail outage that stranded Via, GO Train, other passengers caused by software upgrade: CN",https://toronto.ctvnews.ca/rail-outage-that-stranded-via-go-train-other-passengers-caused-by-software-upgrade-cn-1.6588779,negative,0.008734125,0.62703687,0.3642289,-0.39309902482689196
CTV,2023-10-04,A woman was found trapped under a driverless car. It wasn't the first car to hit her,https://www.ctvnews.ca/autos/a-woman-was-found-trapped-under-a-driverless-car-it-wasn-t-the-first-car-to-hit-her-1.6588576,negative,0.008900276,0.6476652,0.3434344,-0.41939107575953116
CTV,2023-10-04,More than half of young Canadians say relationship status affected their mental health post-pandemic,https://www.ctvnews.ca/lifestyle/more-than-half-of-young-canadians-say-relationship-status-affected-their-mental-health-post-pandemic-1.6587164,negative,0.016503436,0.5945665,0.38893008,-0.3532369530710895
CTV,2023-10-04,Florida man arrested after McDonald's drive-thru meltdown,https://www.ctvnews.ca/video?playlistId=1.6588871,negative,0.025390618,0.5430662,0.43154317,-0.2942762176483349
CTV,2023-10-04,September real estate market shows 'balance between sellers and buyers': LSTAR,https://london.ctvnews.ca/september-real-estate-market-shows-balance-between-sellers-and-buyers-lstar-1.6588809,positive,0.22440566,0.00845406,0.7671402,0.05028644584054209
CTV,2023-10-04,Damage from fire at Cambridge hospital estimated at $1 million,https://kitchener.ctvnews.ca/damage-from-fire-at-cambridge-hospital-estimated-at-1-million-1.6588442,negative,0.013654418,0.46598458,0.52036095,-0.21695521552703667
CTV,2023-10-04,Politician faces fine for returning to Yellowknife during wildfire evacuation,https://www.ctvnews.ca/canada/politician-faces-fine-for-returning-to-yellowknife-during-wildfire-evacuation-1.6587613,neutral,0.10662319,0.023539124,0.86983764,0.010814417412129629
CTV,2023-10-04,COVID-19 outbreak declared at Victoria hospital,https://bc.ctvnews.ca/covid-19-outbreak-declared-at-victoria-hospital-1.6588685,negative,0.03310236,0.44212642,0.52477115,-0.1943800319418365
CTV,2023-10-04,Saskatchewan discussing what to do about 'QAnon queen': Moe,https://www.ctvnews.ca/video?playlistId=1.6588854,neutral,0.018214373,0.06185147,0.9199339,-0.0034938515020641603
CTV,2023-10-04,Manitoba-made game going to New York toy fair,https://winnipeg.ctvnews.ca/manitoba-made-game-going-to-new-york-toy-fair-1.6579722,neutral,0.15838261,0.009671672,0.8319458,0.024991500861840876
CTV,2023-10-04,"Regina woman facing weapons, traffic-related charges after fleeing from police",https://regina.ctvnews.ca/regina-woman-facing-weapons-traffic-related-charges-after-fleeing-from-police-1.6588818,negative,0.00790441,0.65784013,0.33425546,-0.4326911605051009
CTV,2023-10-04,Ottawa puts more money toward studying possible Winnipeg landfill search,https://winnipeg.ctvnews.ca/ottawa-puts-more-money-toward-studying-possible-winnipeg-landfill-search-1.6588565,neutral,0.068775706,0.06574493,0.86547947,0.0004077017274539685
CTV,2023-10-04,U.S. hunts for Canadian man allegedly behind Ponzi scheme,https://www.ctvnews.ca/video?playlistId=1.6588480,negative,0.017614305,0.31904104,0.66334474,-0.10147689675934757
CTV,2023-10-04,"Boy in critical condition after being found in Airdrie, Alta., pond",https://calgary.ctvnews.ca/boy-in-critical-condition-after-being-found-in-airdrie-alta-pond-1.6588683,negative,0.01875117,0.47120047,0.5100483,-0.2216783132234461
CTV,2023-10-04,Historic Manitoulin Island ferry being towed away for recycling,https://northernontario.ctvnews.ca/historic-manitoulin-island-ferry-being-towed-away-for-recycling-1.6588456,negative,0.03694459,0.32169974,0.64135563,-0.1021258269205525
CTV,2023-10-04,U.K. plans to raise legal smoking age each year until it applies to whole population,https://www.ctvnews.ca/health/u-k-plans-to-raise-legal-smoking-age-each-year-until-it-applies-to-whole-population-1.6588310,neutral,0.04185628,0.065303065,0.89284074,-0.0025125398891727713
CTV,2023-10-04,"Ontario 'asking questions' about Ottawa clinic charging membership fee, health minister says",https://ottawa.ctvnews.ca/ontario-asking-questions-about-ottawa-clinic-charging-membership-fee-health-minister-says-1.6588472,neutral,0.012422391,0.12766847,0.85990924,-0.016144911326203992
CTV,2023-10-04,Calgary's 5 most expensive homes for sale right now,https://calgary.ctvnews.ca/calgary-s-5-most-expensive-homes-for-sale-right-now-1.6588696,neutral,0.057702586,0.12879732,0.81350005,-0.013259165026946462
CTV,2023-10-04,Amherstburg expected to consider proposal for historic Belle Vue House,https://windsor.ctvnews.ca/amherstburg-expected-to-consider-proposal-for-historic-belle-vue-house-1.6588853,neutral,0.068435945,0.0064358045,0.9251282,0.004642060789326052
CTV,2023-10-04,BC SPCA slams 'infuriating' disregard for animal welfare after seizing dogs and cats from repeat offender,https://bc.ctvnews.ca/bc-spca-slams-infuriating-disregard-for-animal-welfare-after-seizing-dogs-and-cats-from-repeat-offender-1.6588798,negative,0.0063800323,0.85278815,0.14083166,-0.7272070633718748
CTV,2023-10-04,Investigator was 'totally shocked' to see sensitive records sent to criminal suspect,https://www.ctvnews.ca/politics/investigator-was-totally-shocked-to-see-sensitive-records-sent-to-criminal-suspect-1.6588746,negative,0.00958113,0.7596355,0.23078339,-0.5769542731672601
CTV,2023-10-04,"Liberal Greg Fergus makes history, elected first Black House Speaker",https://www.ctvnews.ca/politics/liberal-greg-fergus-makes-history-elected-first-black-house-speaker-1.6586482,positive,0.58059824,0.0042215753,0.41518036,0.33707640319284593
CTV,2023-10-04,Fallen B.C. RCMP Const. Rick O'Brien being honoured at regimental funeral Wednesday,https://bc.ctvnews.ca/fallen-b-c-rcmp-const-rick-o-brien-being-honoured-at-regimental-funeral-wednesday-1.6588730,neutral,0.055370133,0.07304842,0.8715814,-0.002270221282930196
CTV,2023-10-04,"One dead after explosion in Timmins, Ont. hotel parking lot",https://www.ctvnews.ca/video?playlistId=1.6588581,negative,0.011970618,0.6613756,0.32665387,-0.43727430648955057
CTV,2023-10-04,Toronto talent agency co-founder accused of withholding $600K in wages from clients,https://toronto.ctvnews.ca/toronto-talent-agency-co-founder-accused-of-withholding-600k-in-wages-from-clients-1.6588789,negative,0.0086219115,0.71522254,0.2761554,-0.5114690247109159
CTV,2023-10-04,"Windsor man wanted for passing counterfeit bills in Sarnia, Ont.",https://windsor.ctvnews.ca/windsor-man-wanted-for-passing-counterfeit-bills-in-sarnia-ont-1.6588663,negative,0.011374147,0.54853016,0.4400956,-0.3007559980919936
CTV,2023-10-04,Does your child have head lice? How to get rid of it for good,https://www.ctvnews.ca/lifestyle/does-your-child-have-head-lice-how-to-get-rid-of-it-for-good-1.6588601,negative,0.024465641,0.56663114,0.40890324,-0.32047228033187025
CTV,2023-10-04,U.S. House is left paralyzed as divided Republicans search for new leader after McCarthy's ouster,https://www.ctvnews.ca/world/u-s-house-is-left-paralyzed-as-divided-republicans-search-for-new-leader-after-mccarthy-s-ouster-1.6588747,negative,0.008344682,0.68731904,0.30433637,-0.4723377480338833
CTV,2023-10-04,Suspicious death under investigation in Fenelon Falls,https://barrie.ctvnews.ca/suspicious-death-under-investigation-in-fenelon-falls-1.6588522,negative,0.016024096,0.32754925,0.65642667,-0.10703173924433429
CTV,2023-10-04,Ontario widower stuck with US$100K+ medical bill after late wife hospitalized on vacation,https://toronto.ctvnews.ca/ontario-widower-stuck-with-us-100k-medical-bill-after-late-wife-hospitalized-on-vacation-1.6579045,negative,0.00869994,0.7684465,0.22285363,-0.5904342740353741
CTV,2023-10-04,"A parking spot in Whistler, B.C., just sold for $195K",https://bc.ctvnews.ca/a-parking-spot-in-whistler-b-c-just-sold-for-195k-1.6587742,neutral,0.037663694,0.041843653,0.9204927,-0.00033233715860148116
CTV,2023-10-04,Stock market today: Wall Street steadies after selloff as reports suggest U.S. economy may be cooling,https://www.ctvnews.ca/business/stock-market-today-wall-street-steadies-after-selloff-as-reports-suggest-u-s-economy-may-be-cooling-1.6588296,positive,0.33649752,0.013257351,0.65024513,0.11305482044900117
CTV,2023-10-04,Former Ellerslie Rugby Park officially bought by developer with mixed-use dreams,https://edmonton.ctvnews.ca/former-ellerslie-rugby-park-officially-bought-by-developer-with-mixed-use-dreams-1.6588749,neutral,0.1979808,0.008824699,0.79319453,0.03911851882442363
CTV,2023-10-04,Nijjar fallout: India reportedly tells Canada to bring home 'dozens' of its diplomats,https://www.ctvnews.ca/politics/nijjar-fallout-india-reportedly-tells-canada-to-bring-home-dozens-of-its-diplomats-1.6586292,negative,0.01615699,0.3222019,0.66164106,-0.10355302971469449
CTV,2023-10-04,Late-night shows return after writers strike as actors resume talks that could end their standoff,https://www.ctvnews.ca/entertainment/late-night-shows-return-after-writers-strike-as-actors-resume-talks-that-could-end-their-standoff-1.6586211,neutral,0.02601289,0.21233097,0.7616562,-0.04440775213290671
CTV,2023-10-04,October heatwave continues for another day,https://ottawa.ctvnews.ca/october-heatwave-continues-for-another-day-1.6588115,negative,0.064766236,0.29345682,0.64177704,-0.08192222198863419
CTV,2023-10-04,Some of the key impacts AI is having on our everyday finances,https://www.ctvnews.ca/business/some-of-the-key-impacts-ai-is-having-on-our-everyday-finances-1.6587192,positive,0.3574746,0.0153939035,0.62713146,0.12755112393458035
CTV,2023-10-04,Fatal crash involving 2 motorcycles and passenger vehicle under investigation,https://barrie.ctvnews.ca/fatal-crash-involving-2-motorcycles-and-passenger-vehicle-under-investigation-1.6588587,negative,0.015598663,0.54654765,0.43785375,-0.29847098545464945
CTV,2023-10-04,Unifor sets Oct. 9 deadline for contract talks with General Motors,https://www.ctvnews.ca/autos/unifor-sets-oct-9-deadline-for-contract-talks-with-general-motors-1.6582637,neutral,0.029673597,0.021372909,0.94895357,0.00042372050379113624
CTV,2023-10-04,Premier Wab Kinew: From rapper to reporter to Manitoba's top political office,https://winnipeg.ctvnews.ca/premier-wab-kinew-from-rapper-to-reporter-to-manitoba-s-top-political-office-1.6588342,neutral,0.20588222,0.011034904,0.7830829,0.04226571415808955
CTV,2023-10-04,Violent brawl forces train passengers into Alta. LRT tunnel,https://www.ctvnews.ca/video?playlistId=1.6588529,negative,0.0067196386,0.7935499,0.19973046,-0.6296762826288038
CTV,2023-10-04,Mischief and armed assault in Montreal as residents protest new bike lanes,https://montreal.ctvnews.ca/mischief-and-armed-assault-in-montreal-as-residents-protest-new-bike-lanes-1.6588057,negative,0.006547133,0.8367066,0.15674625,-0.7000350460506191
CTV,2023-10-04,"Trio wins Nobel Prize in chemistry for quantum dots, tiny particles that power TVs and phones",https://www.ctvnews.ca/sci-tech/trio-wins-nobel-prize-in-chemistry-for-quantum-dots-tiny-particles-that-power-tvs-and-phones-1.6588146,positive,0.86365855,0.003006944,0.13333453,0.745897032016023
CTV,2023-10-04,The Imagine Build will house four Oneida family with accessible homes,https://london.ctvnews.ca/the-imagine-build-will-house-four-oneida-family-with-accessible-homes-1.6588722,positive,0.2811229,0.00571321,0.7131639,0.07899743188109376
CTV,2023-10-04,"Mould halts in-person visits at Newfoundland's notorious, rodent-infested jail",https://atlantic.ctvnews.ca/mould-halts-in-person-visits-at-newfoundland-s-notorious-rodent-infested-jail-1.6588071,negative,0.009123052,0.65666556,0.3342114,-0.43112643276870344
CTV,2023-10-04,3 scientists win Nobel Prize in physics for looking at electrons in atoms during split seconds,https://www.ctvnews.ca/sci-tech/3-scientists-win-nobel-prize-in-physics-for-looking-at-electrons-in-atoms-during-split-seconds-1.6586301,positive,0.74873525,0.004132529,0.24713236,0.5605873067626383
CTV,2023-10-04,Liberal MP Greg Fergus elected as first Black House Speaker,https://www.ctvnews.ca/video?playlistId=1.6576365,neutral,0.10182429,0.009014461,0.8891612,0.010286927053197559
CTV,2023-10-04,Parks Canada reveals additional details about deadly bear attack in Banff,https://calgary.ctvnews.ca/parks-canada-reveals-additional-details-about-deadly-bear-attack-in-banff-1.6587263,negative,0.014002494,0.49220562,0.49379185,-0.24207031636482235
CTV,2023-10-04,Sask. Métis entrepreneur partners with artist to illustrate Indigenous teachings,https://saskatoon.ctvnews.ca/sask-m%C3%A9tis-entrepreneur-partners-with-artist-to-illustrate-indigenous-teachings-1.6588728,neutral,0.10780162,0.009338713,0.8828597,0.01153397407573209
CTV,2023-10-04,Parents want arrest after son 'deliberately kicked' in neck during Edmonton hockey game,https://edmonton.ctvnews.ca/parents-want-arrest-after-son-deliberately-kicked-in-neck-during-edmonton-hockey-game-1.6587475,negative,0.007784246,0.7560725,0.23614335,-0.571584973617945
CTV,2023-10-04,U.S. appeals court to hear arguments over 2010 hush-money settlement of Ronaldo rape case in Vegas,https://www.ctvnews.ca/sports/u-s-appeals-court-to-hear-arguments-over-2010-hush-money-settlement-of-ronaldo-rape-case-in-vegas-1.6588074,neutral,0.02980608,0.11354396,0.85665,-0.012003825528022816
CTV,2023-10-04,CHEO extending masking requirements in advance of viral season,https://ottawa.ctvnews.ca/cheo-extending-masking-requirements-in-advance-of-viral-season-1.6588688,neutral,0.06311816,0.1261546,0.8107272,-0.011931085162672161
CTV,2023-10-04,NDP to form majority government following historic Manitoba election,https://winnipeg.ctvnews.ca/ndp-to-form-majority-government-following-historic-manitoba-election-1.6587974,positive,0.23107149,0.007855177,0.76107335,0.05333232500562346
CTV,2023-10-04,'This could have been a terrible tragedy:' Two toddlers have minor injuries after car crashes through daycare fence,https://toronto.ctvnews.ca/this-could-have-been-a-terrible-tragedy-two-toddlers-have-minor-injuries-after-car-crashes-through-daycare-fence-1.6588321,negative,0.0055425204,0.90155834,0.09289908,-0.8127767802858066
CTV,2023-10-04,'A very nice man': 93-year-old super fan gets one-on-one with Sidney Crosby,https://atlantic.ctvnews.ca/a-very-nice-man-93-year-old-super-fan-gets-one-on-one-with-sidney-crosby-1.6587325,positive,0.93282187,0.0036535473,0.063524626,0.8701432718477458
CTV,2023-10-04,IMF expects continuing U.S. support for Ukraine despite Congress dropping aid,https://www.ctvnews.ca/world/imf-expects-continuing-u-s-support-for-ukraine-despite-congress-dropping-aid-1.6588725,neutral,0.082373776,0.06138516,0.85624087,0.0030173053631492586
CTV,2023-10-04,"Complainant at Nygard trial says shame, fear for career prevented her coming forward",https://toronto.ctvnews.ca/complainant-at-nygard-trial-says-shame-fear-for-career-prevented-her-coming-forward-1.6588505,negative,0.0068097236,0.8076855,0.18550459,-0.6523096528067747
CTV,2023-10-04,Quebec is not acting fast enough for Indigenous people: Ombudsperson,https://montreal.ctvnews.ca/quebec-is-not-acting-fast-enough-for-indigenous-people-ombudsperson-1.6588495,negative,0.008786414,0.7760022,0.21521139,-0.6021022110088836
CTV,2023-10-04,Toronto Blue Jays on brink of elimination ahead of Game 2 in AL wild-card series,https://toronto.ctvnews.ca/toronto-blue-jays-on-brink-of-elimination-ahead-of-game-2-in-al-wild-card-series-1.6588058,negative,0.016372906,0.25472227,0.7289047,-0.0646153863743848
CTV,2023-10-04,WRPS investigate alleged gunpoint car theft at at Conestoga Mall,https://kitchener.ctvnews.ca/wrps-investigate-alleged-gunpoint-car-theft-at-at-conestoga-mall-1.6588837,negative,0.017655779,0.32903448,0.65330976,-0.10795195117036194
CTV,2023-10-04,Why a B.C. city ended its decades-long ban on tattoo shops,https://bc.ctvnews.ca/why-a-b-c-city-ended-its-decades-long-ban-on-tattoo-shops-1.6582469,negative,0.02064882,0.36441752,0.6149337,-0.13237373744303227
CTV,2023-10-04,'Unrelenting' fast-food ads using privacy 'loopholes' to target children: study,https://www.ctvnews.ca/health/unrelenting-fast-food-ads-using-privacy-loopholes-to-target-children-study-1.6586555,negative,0.0062434194,0.79252934,0.20122734,-0.6280637115471901
CTV,2023-10-04,Turkiye warns it will strike Kurdish militants in Iraq and Syria after suicide bombing in Ankara,https://www.ctvnews.ca/world/turkiye-warns-it-will-strike-kurdish-militants-in-iraq-and-syria-after-suicide-bombing-in-ankara-1.6588363,negative,0.0065456005,0.7651487,0.22830558,-0.5854097775256832
CTV,2023-10-04,Adolescent ER visits in Ontario for eating disorders saw big jump during pandemic: study,https://toronto.ctvnews.ca/adolescent-er-visits-in-ontario-for-eating-disorders-saw-big-jump-during-pandemic-study-1.6586311,neutral,0.029811898,0.21180448,0.75838363,-0.04397238515507773
CTV,2023-10-04,Construction set to begin on new joint-use school in north Regina,https://regina.ctvnews.ca/construction-set-to-begin-on-new-joint-use-school-in-north-regina-1.6588807,neutral,0.11385043,0.009163372,0.87698627,0.012877945922197043
CTV,2023-10-04,"Poilievre defends Truth and Reconciliation Day post, calls criticism 'appalling politicization'",https://www.ctvnews.ca/politics/poilievre-defends-truth-and-reconciliation-day-post-calls-criticism-appalling-politicization-1.6586971,negative,0.037609495,0.31750375,0.64488673,-0.09939416624099096
