source,date,headline,url,chosen_label,positive,negative,neutral,compound
Global,2023-09-27,‘Many people have been hurt’: Rota quits as House Speaker after celebrating Nazi veteran,https://globalnews.ca/video/9987879/many-people-have-been-hurt-rota-quits-as-house-speaker-after-celebrating-nazi-veteran/,negative,0.0039984034,0.918473,0.07752854,-0.8435767287693849
Global,2023-09-27,Senior care expert busts myths surrounding dementia for Alzheimer’s Awareness Month,https://globalnews.ca/news/9989080/myths-and-misconceptions-alzheimers-awareness-month/,positive,0.3330807,0.012987299,0.65393215,0.11077404140354297
Global,2023-09-27,"Canada in global top 10 for cyber breaches, report finds amid health hack",https://globalnews.ca/news/9989008/canada-global-top-10-cyber-breaches-report-health-hack/,negative,0.009659988,0.7317582,0.25858173,-0.535376778869777
Global,2023-09-27,Killing of B.C. Sikh leader reportedly captured on camera,https://globalnews.ca/news/9986719/killing-bc-sikh-leader-reportedly-captured-on-camera/,negative,0.0101904515,0.5748486,0.4149611,-0.33034699192671724
Global,2023-09-27,‘People are freezing’: Hotel-turned-homeless shelter with empty rooms under scrutiny,https://globalnews.ca/news/9986379/staff-shortage-the-bridge-health-floor-ns-housing-crisis/,negative,0.008505371,0.77368873,0.21780586,-0.5985219611903858
Global,2023-09-27,"Ontario will not compensate Greenbelt developers, housing minister says",https://globalnews.ca/news/9989446/ontario-will-not-compensate-greenbelt-developers-minister-says/,negative,0.00819105,0.6825674,0.30924147,-0.465831226509259
Global,2023-09-27,Yellowknife businesses worry about future after devastating wildfires,https://globalnews.ca/video/9987889/yellowknife-businesses-worry-about-future-after-devastating-wildfires/,negative,0.009448497,0.78536457,0.20518677,-0.6167083817827432
Global,2023-09-27,Rob Schneider cancels Canada trip after man who fought for Nazis honoured in Parliament,https://globalnews.ca/news/9985697/rob-schneider-cancels-trip-canada-honoured-fought-nazi-parliament/,negative,0.008578553,0.73344946,0.257972,-0.5378745176892039
Global,2023-09-27,Largest jackpot in Lotto 6/49 history could be won in next draw,https://globalnews.ca/video/9979494/largest-jackpot-in-lotto-6-49-history-could-be-won-in-next-draw/,positive,0.798276,0.0053648665,0.19635896,0.6372159078727053
Global,2023-09-27,Hardeep Singh Nijjar murder: Indian minister visits UN as spat with Canada grows,https://globalnews.ca/video/9987883/hardeep-singh-nijjar-murder-indian-minister-visits-un-as-spat-with-canada-grows/,negative,0.012669033,0.39188293,0.5954481,-0.153411712324365
Global,2023-09-27,Dogs find new home in Nova Scotia after fleeing devastating N.W.T wildfires,https://globalnews.ca/news/9988568/nova-scotia-spca-adopt-dogs-northwest-territories-wildfire-hay-river/,neutral,0.10857012,0.07181673,0.8196131,0.006629830788908997
Global,2023-09-27,Metro Vancouver crisis centres push for suicide barriers on bridges,https://globalnews.ca/video/9987842/metro-vancouver-crisis-centres-push-for-suicide-barriers-on-bridges/,negative,0.012872131,0.5390821,0.4480458,-0.2904437973903029
Global,2023-09-27,What we know about the company linked to the E.coli outbreak at Calgary daycares,https://globalnews.ca/news/9989427/what-we-know-company-linked-e-coli-outbreak-calgary-daycares/,neutral,0.012786254,0.21472608,0.77248764,-0.04594380523212749
Global,2023-09-27,Hardeep Singh Nijjar: Jagmeet Singh claims there is ‘clear’ evidence on India’s role in assassination,https://globalnews.ca/video/9987848/hardeep-singh-nijjar-jagmeet-singh-claims-there-is-clear-evidence-on-indias-role-in-assassination/,negative,0.022098344,0.2550041,0.7228976,-0.06453874769655155
Global,2023-09-27,TransLink presents accessibility plan amid HandyDART concerns,https://globalnews.ca/news/9989035/translink-accessibility-plan-handydart/,neutral,0.08106571,0.06920559,0.84972864,0.0017822359126862253
Global,2023-09-27,"Flames winger Pelletier out indefinitely, will undergo shoulder surgery",https://globalnews.ca/news/9989145/flames-winger-pelletier-out-indefinitely-will-undergo-shoulder-surgery/,negative,0.009846747,0.50476265,0.48539066,-0.2546883444425134
Global,2023-09-27,Liberals try to strike Hunka recognition from official record. What that means,https://globalnews.ca/news/9988421/canada-parliament-nazi-unit-veteran-tribute-hansard/,negative,0.013004651,0.55706286,0.4299325,-0.31014989737443344
Global,2023-09-27,Oilers autograph session to return to West Edmonton Mall,https://globalnews.ca/news/9989310/oilers-autograph-session-west-edmonton-mall/,neutral,0.059224874,0.0083490275,0.9324261,0.003437879603987337
Global,2023-09-27,Manitoba Liberal campaign promises funds for credit counselling to help people manage ‘crushing’ debt,https://globalnews.ca/news/9989147/manitoba-election-liberal-promise-debt/,neutral,0.115396984,0.035296254,0.8493068,0.01207063358726046
Global,2023-09-27,Global News Hour at 6 BC: Sept. 26,https://globalnews.ca/video/9987932/global-news-hour-at-6-bc-sept-26-3/,neutral,0.04099764,0.006611979,0.95239043,0.0016370863485892784
Global,2023-09-27,Canadian retailers struggle to stop shoplifting,https://globalnews.ca/video/9987887/canadian-retailers-struggle-to-stop-shoplifting/,negative,0.011589089,0.6951819,0.29322907,-0.4831435141540794
Global,2023-09-27,Trudeau offers ‘unreserved’ apology after tribute to man who fought with Nazis,https://globalnews.ca/news/9988260/anthony-rota-resigns-house-speaker-election/,negative,0.031750984,0.4367959,0.5314531,-0.18978254940989103
Global,2023-09-27,Drug to regrow teeth enters clinical trials for 1st time,https://globalnews.ca/video/9986142/drug-to-regrow-teeth-enters-clinical-trials-for-1st-time/,neutral,0.065458626,0.10611086,0.8284306,-0.0069746803375934086
Global,2023-09-27,World’s 1st drug to regrow teeth enters clinical trials,https://globalnews.ca/news/9984605/tooth-regrowth-drug/,neutral,0.21451691,0.021854712,0.7636283,0.045539889637708164
Global,2023-09-27,Truth and Reconciliation Day,https://globalnews.ca/video/9988494/truth-and-reconciliation-day-5/,neutral,0.1199047,0.08908595,0.79100937,0.006440829144064075
Global,2023-09-27,A record $68M Lotto 6/49 Gold Ball draw is guaranteed tonight. Here’s how it works,https://globalnews.ca/news/9986859/lotto-649-gold-ball-draw-68-million/,positive,0.5860175,0.0034777364,0.41050485,0.34340435107815814
Global,2023-09-27,Saskatoon’s Broadway Theatre offers range of events in lead-up to anniversary,https://globalnews.ca/news/9989457/saskatoon-broadway-theatre-events-anniversary/,positive,0.22542979,0.0034677708,0.7711024,0.050806567311859396
Global,2023-09-27,"St. Mary’s Road and Fermor Avenue scene of fatal pedestrian-involved collision, WPS say",https://globalnews.ca/video/9988749/st-marys-road-and-fermor-avenue-scene-of-fatal-pedestrian-involved-collision-wps-say/,negative,0.015556019,0.34175438,0.6426895,-0.11655409391351235
Global,2023-09-27,For-profit long-term care homes are underdelivering care in B.C. says report,https://globalnews.ca/video/9987847/for-profit-long-term-care-homes-are-underdelivering-care-in-b-c-says-report/,negative,0.013594214,0.42538467,0.56102103,-0.18076735216037143
Global,2023-09-27,Election speculation in New Brunswick grows louder as Higgs muses about snap vote,https://globalnews.ca/news/9989516/election-speculation-new-brunswick-blaine-higgs/,neutral,0.029605351,0.06019993,0.9101948,-0.002747551930031289
Global,2023-09-27,Teen convicted of killing Sgt. Andrew Harnett sentence to 12 years,https://globalnews.ca/video/9989348/teen-convicted-of-killing-sgt-andrew-harnett-sentence-to-12-years/,negative,0.011777329,0.7298222,0.2584005,-0.5325017219282913
Global,2023-09-27,Wealthy municipalities react to B.C.’s housing targets,https://globalnews.ca/video/9988092/wealthy-municipalities-react-to-b-c-s-housing-targets/,neutral,0.06957129,0.07191586,0.8585128,-0.0003317267495197562
Global,2023-09-27,"Winnipeg morning weather outlook: Wednesday, Sept. 27",https://globalnews.ca/video/9988784/winnipeg-morning-weather-outlook-wednesday-sept-27/,neutral,0.03176408,0.009149544,0.9590864,0.0009252416264011742
Global,2023-09-27,New evidence in killing of Hardeep Singh Nijjar,https://globalnews.ca/video/9987876/new-evidence-in-killing-of-hardeep-singh-nijjar/,negative,0.021976912,0.48498645,0.4930365,-0.23472893107550874
CTV,2023-09-27,Jury at Peter Nygard's Toronto sexual-assault trial set to hear more evidence today,https://toronto.ctvnews.ca/jury-at-peter-nygard-s-toronto-sexual-assault-trial-set-to-hear-more-evidence-today-1.6579350,neutral,0.021031983,0.070201166,0.9087669,-0.004485855723551424
CTV,2023-09-27,"Bruce Springsteen postpones remaining 2023 tour dates, including stop in Montreal",https://montreal.ctvnews.ca/bruce-springsteen-postpones-remaining-2023-tour-dates-including-stop-in-montreal-1.6580120,neutral,0.029877814,0.030727616,0.9393948,-5.1502446769324806e-05
CTV,2023-09-27,Election speculation in New Brunswick grows louder as Higgs muses about snap vote,https://atlantic.ctvnews.ca/election-speculation-in-new-brunswick-grows-louder-as-higgs-muses-about-snap-vote-1.6580067,neutral,0.029605351,0.06019993,0.9101948,-0.002747551930031289
CTV,2023-09-27,'He had a big heart': Father of fallen teenage wildland firefighter remembers his son,https://bc.ctvnews.ca/he-had-a-big-heart-father-of-fallen-teenage-wildland-firefighter-remembers-his-son-1.6574450,positive,0.3193758,0.04934093,0.6312832,0.09956639025707226
CTV,2023-09-27,Cutting obituary for B.C. man thanks karma for 'doing what she does best',https://bc.ctvnews.ca/cutting-obituary-for-b-c-man-thanks-karma-for-doing-what-she-does-best-1.6570913,positive,0.49093676,0.052094005,0.45696926,0.23830509930664334
CTV,2023-09-27,Loaded firearm stolen from police vehicle in East Gwillimbury,https://barrie.ctvnews.ca/loaded-firearm-stolen-from-police-vehicle-in-east-gwillimbury-1.6580024,negative,0.020005716,0.39847174,0.58152246,-0.1583795355506794
CTV,2023-09-27,Police seek help identifying 4 who robbed southeast Edmonton liquor store,https://edmonton.ctvnews.ca/police-seek-help-identifying-4-who-robbed-southeast-edmonton-liquor-store-1.6580036,neutral,0.026114335,0.1722043,0.8016814,-0.028972358631385475
CTV,2023-09-27,Driver sentenced to 12 years in hit and run death of Calgary police officer,https://calgary.ctvnews.ca/driver-sentenced-to-12-years-in-hit-and-run-death-of-calgary-police-officer-1.6579988,negative,0.009880094,0.7889886,0.20113137,-0.6224053566078709
CTV,2023-09-27,Man dead after shooting in Kitchener,https://kitchener.ctvnews.ca/man-dead-after-shooting-in-kitchener-1.6579355,negative,0.01091484,0.6917511,0.29733393,-0.478400542100589
CTV,2023-09-27,"Pizza driver allegedly robbed, assaulted while out for delivery",https://london.ctvnews.ca/pizza-driver-allegedly-robbed-assaulted-while-out-for-delivery-1.6579716,negative,0.010515706,0.82134634,0.16813791,-0.6744992830389052
CTV,2023-09-27,A judge found Trump committed fraud in building his real-estate empire. Here's what happens next,https://www.ctvnews.ca/world/a-judge-found-trump-committed-fraud-in-building-his-real-estate-empire-here-s-what-happens-next-1.6580043,negative,0.019146651,0.56044585,0.42040747,-0.3137329844797634
CTV,2023-09-27,Danielle Smith says recognition of Nazi unit war veteran in Parliament was 'embarrassing',https://calgary.ctvnews.ca/danielle-smith-says-recognition-of-nazi-unit-war-veteran-in-parliament-was-embarrassing-1.6580021,negative,0.005253162,0.86769575,0.12705113,-0.7528683042051139
CTV,2023-09-27,Republicans face growing urgency to stop Trump as they enter the second presidential debate,https://www.ctvnews.ca/world/republicans-face-growing-urgency-to-stop-trump-as-they-enter-the-second-presidential-debate-1.6579423,neutral,0.11540097,0.029414807,0.85518426,0.012452150687076724
CTV,2023-09-27,Ghostly and rare 'Dumbo' octopus spotted off the coast of Hawaii,https://www.ctvnews.ca/sci-tech/ghostly-and-rare-dumbo-octopus-spotted-off-the-coast-of-hawaii-1.6579732,neutral,0.12216707,0.045699067,0.8321339,0.012836386730446847
CTV,2023-09-27,B.C. moving to join other provinces in allowing physician assistants,https://bc.ctvnews.ca/b-c-moving-to-join-other-provinces-in-allowing-physician-assistants-1.6580136,neutral,0.06981338,0.017312782,0.9128738,0.00457417737313337
CTV,2023-09-27,Travis Kelce notes Taylor Swift's 'bold' appearance at Chiefs game but is mum about any relationship,https://www.ctvnews.ca/sports/travis-kelce-notes-taylor-swift-s-bold-appearance-at-chiefs-game-but-is-mum-about-any-relationship-1.6579829,neutral,0.062455624,0.017581554,0.9199628,0.003591594031824741
CTV,2023-09-27,Immigrants to thank for Canada's record population growth this year: StatCan report,https://www.ctvnews.ca/canada/immigrants-to-thank-for-canada-s-record-population-growth-this-year-statcan-report-1.6579745,positive,0.3096114,0.020145738,0.6702428,0.09545339139060616
CTV,2023-09-27,Agar Hasan gets 16 years in death of Melinda Vasilije,https://kitchener.ctvnews.ca/agar-hasan-gets-16-years-in-death-of-melinda-vasilije-1.6579702,negative,0.020847235,0.39057505,0.58857775,-0.15211425263863987
CTV,2023-09-27,Transport truck driver from Simcoe County charged in construction zone crash that killed new mother,https://barrie.ctvnews.ca/transport-truck-driver-from-simcoe-county-charged-in-construction-zone-crash-that-killed-new-mother-1.6579943,negative,0.010283828,0.6746177,0.31509867,-0.4550031558772982
CTV,2023-09-27,Company at centre of E. coli outbreak at Calgary daycares faces licensing charges,https://calgary.ctvnews.ca/company-at-centre-of-e-coli-outbreak-at-calgary-daycares-faces-licensing-charges-1.6579495,negative,0.010946921,0.65517426,0.3338789,-0.42913341203816735
CTV,2023-09-27,Hollywood writers strike declared over after boards vote to approve contract with studios,https://www.ctvnews.ca/entertainment/hollywood-writers-strike-declared-over-after-boards-vote-to-approve-contract-with-studios-1.6579074,negative,0.018968008,0.40588227,0.5751498,-0.16438060771611163
CTV,2023-09-27,Wells hits two-run homer in ninth inning to lead Yankees over Blue Jays 2-0,https://toronto.ctvnews.ca/wells-hits-two-run-homer-in-ninth-inning-to-lead-yankees-over-blue-jays-2-0-1.6579192,neutral,0.19702789,0.0057555432,0.7972166,0.03878685819269201
CTV,2023-09-27,'Stuff them wherever they can': Regina family blasts plan to shuffle care home residents,https://regina.ctvnews.ca/stuff-them-wherever-they-can-regina-family-blasts-plan-to-shuffle-care-home-residents-1.6578928,negative,0.024773236,0.27387932,0.7013475,-0.07439616076264244
CTV,2023-09-27,Ontario widower stuck with US$100K+ medical bill after late wife hospitalized on vacation,https://toronto.ctvnews.ca/ontario-widower-stuck-with-us-100k-medical-bill-after-late-wife-hospitalized-on-vacation-1.6579045,negative,0.00869994,0.7684465,0.22285363,-0.5904342740353741
CTV,2023-09-27,Watch: Hawrelak Park rehabilitation progress,https://edmonton.ctvnews.ca/watch-hawrelak-park-rehabilitation-progress-1.6579800,neutral,0.1017104,0.011705218,0.8865844,0.01020799158722685
CTV,2023-09-27,Fountain at centre of neighbourhood dispute in Ottawa,https://www.ctvnews.ca/video?playlistId=1.6578939,negative,0.014911541,0.31909972,0.6659887,-0.10160229837616441
CTV,2023-09-27,B.C. fire bans lifting as cooler weather eases wildfire season,https://vancouverisland.ctvnews.ca/b-c-fire-bans-lifting-as-cooler-weather-eases-wildfire-season-1.6579963,neutral,0.10779431,0.012965092,0.8792406,0.011451521911324924
CTV,2023-09-27,"Bruce Springsteen postpones all 2023 shows, including Winnipeg",https://winnipeg.ctvnews.ca/bruce-springsteen-postpones-all-2023-shows-including-winnipeg-1.6579882,neutral,0.022708647,0.14039035,0.83690095,-0.019193774261475838
CTV,2023-09-27,Ontario councillor calls herself a 'modern-day slave' after pay docked,https://toronto.ctvnews.ca/ontario-councillor-calls-herself-a-modern-day-slave-after-pay-docked-1.6579859,negative,0.016260527,0.5839101,0.39982927,-0.34068667742744196
CTV,2023-09-27,Password sharing will no longer be an option for Disney+ users. Here's when,https://www.ctvnews.ca/business/password-sharing-will-no-longer-be-an-option-for-disney-users-here-s-when-1.6579435,negative,0.027491864,0.479679,0.49282917,-0.22933611570968004
CTV,2023-09-27,Manitoba-made game going to New York toy fair,https://winnipeg.ctvnews.ca/manitoba-made-game-going-to-new-york-toy-fair-1.6579722,neutral,0.15838261,0.009671672,0.8319458,0.024991500861840876
CTV,2023-09-27,Passengers stuck upside down on Canada's Wonderland ride,https://toronto.ctvnews.ca/passengers-stuck-upside-down-on-canada-s-wonderland-ride-1.6575480,negative,0.031163873,0.36315838,0.6056778,-0.1309128085827691
CTV,2023-09-27,"Pulp workers to return to Crofton mill, but curtailment of paper operations continues",https://vancouverisland.ctvnews.ca/pulp-workers-to-return-to-crofton-mill-but-curtailment-of-paper-operations-continues-1.6579932,negative,0.02540312,0.24308175,0.7315151,-0.05844342482605036
CTV,2023-09-27,Prince Albert city workers reach tentative deal,https://saskatoon.ctvnews.ca/prince-albert-city-workers-reach-tentative-deal-1.6579194,neutral,0.08921715,0.019918332,0.89086443,0.007562965951204426
CTV,2023-09-27,Sask. sisters' sanctuary gives ponies and donkeys with special needs a second chance at life,https://regina.ctvnews.ca/sask-sisters-sanctuary-gives-ponies-and-donkeys-with-special-needs-a-second-chance-at-life-1.6573334,positive,0.5230363,0.010512061,0.46645164,0.273456469027451
CTV,2023-09-27,"$95K in cocaine, crack cocaine seized in Windsor drug bust",https://windsor.ctvnews.ca/95k-in-cocaine-crack-cocaine-seized-in-windsor-drug-bust-1.6579944,negative,0.032585755,0.3036776,0.6637366,-0.09115826163829865
CTV,2023-09-27,Canadian man billed $124K for late wife's Fla. hospital trip,https://www.ctvnews.ca/video?playlistId=1.6579419,negative,0.010198881,0.5705381,0.41926298,-0.3254097269556624
CTV,2023-09-27,The next tool in Canada's wildfire fight could be eyes in the sky watching around the clock,https://www.ctvnews.ca/sci-tech/the-next-tool-in-canada-s-wildfire-fight-could-be-eyes-in-the-sky-watching-around-the-clock-1.6578339,neutral,0.060144123,0.0739737,0.8658823,-0.0018547914663220588
CTV,2023-09-27,B.C. family rallying around little girls who lost their firefighter dad in highway crash,https://bc.ctvnews.ca/b-c-family-rallying-around-little-girls-who-lost-their-firefighter-dad-in-highway-crash-1.6579070,neutral,0.069336936,0.22851606,0.70214707,-0.04741196820318372
CTV,2023-09-27,Azerbaijan arrests the former head of separatist government after recapturing Nagorno-Karabakh,https://www.ctvnews.ca/world/azerbaijan-arrests-the-former-head-of-separatist-government-after-recapturing-nagorno-karabakh-1.6579403,negative,0.016184835,0.27440926,0.7094059,-0.07503849541137697
CTV,2023-09-27,PM Trudeau apologizes for Parliament's recognition of Nazi veteran during Zelenskyy visit,https://www.ctvnews.ca/politics/pm-trudeau-apologizes-for-parliament-s-recognition-of-nazi-veteran-during-zelenskyy-visit-1.6579301,neutral,0.061807297,0.1583563,0.7798363,-0.02125658466749858
CTV,2023-09-27,Former Spain women's national team coach Jorge Vilda added to probe into Rubiales' kissing a player,https://www.ctvnews.ca/sports/former-spain-women-s-national-team-coach-jorge-vilda-added-to-probe-into-rubiales-kissing-a-player-1.6579584,neutral,0.032242287,0.0740249,0.8937329,-0.004440116978468023
CTV,2023-09-27,Minister urges U.S. to stand strong with Canada in regulating tech giants like Meta,https://www.ctvnews.ca/politics/minister-urges-u-s-to-stand-strong-with-canada-in-regulating-tech-giants-like-meta-1.6579796,neutral,0.09368372,0.0259027,0.88041365,0.008105684230914179
CTV,2023-09-27,Man who fatally struck Sask. Mountie with stolen vehicle pleads guilty to manslaughter,https://regina.ctvnews.ca/man-who-fatally-struck-sask-mountie-with-stolen-vehicle-pleads-guilty-to-manslaughter-1.6579634,negative,0.021574354,0.4424499,0.5359759,-0.1952964091492504
CTV,2023-09-27,"Housing protest for international students was a ‘publicity stunt,’ northern Ont. college says",https://northernontario.ctvnews.ca/housing-protest-for-international-students-was-a-publicity-stunt-northern-ont-college-says-1.6580130,negative,0.014058672,0.27977827,0.7061631,-0.07807821913194957
CTV,2023-09-27,"26-year-old tech CEO brutally murdered, manhunt for suspect",https://www.ctvnews.ca/video?playlistId=1.6579376,negative,0.013393505,0.7063632,0.28024334,-0.4987695442094022
CTV,2023-09-27,Fire rips through buildings on Toronto's Queen St. West,https://www.ctvnews.ca/video?playlistId=1.6579527,negative,0.014422098,0.52644086,0.4591371,-0.27693193457239396
CTV,2023-09-27,Saskatoon Tribal Council shelter to evict dozens with 'complex needs',https://saskatoon.ctvnews.ca/saskatoon-tribal-council-shelter-to-evict-dozens-with-complex-needs-1.6578907,negative,0.015734345,0.24202684,0.7422388,-0.05832941958548332
CTV,2023-09-27,Working with federal government to lower food prices a 'benefit' to Canada's grocery leaders: Champagne,https://www.ctvnews.ca/politics/working-with-federal-government-to-lower-food-prices-a-benefit-to-canada-s-grocery-leaders-champagne-1.6578789,positive,0.48613,0.01011642,0.5037537,0.23621996303424986
CTV,2023-09-27,Calls for Halifax-area campgrounds to stay open into the fall amid housing crisis,https://atlantic.ctvnews.ca/calls-for-halifax-area-campgrounds-to-stay-open-into-the-fall-amid-housing-crisis-1.6577763,neutral,0.030234326,0.059093505,0.910672,-0.0025779325239450035
CTV,2023-09-27,Windsor police officer charged after criminal harassment investigation,https://windsor.ctvnews.ca/windsor-police-officer-charged-after-criminal-harassment-investigation-1.6580073,negative,0.010477766,0.6928928,0.29662934,-0.47999069532500016
CTV,2023-09-27,Nygard used secret bedroom in his company's Toronto HQ for sexual assaults: Crown,https://toronto.ctvnews.ca/nygard-used-secret-bedroom-in-his-company-s-toronto-hq-for-sexual-assaults-crown-1.6577820,negative,0.013017902,0.42554092,0.56144124,-0.18091558793805973
CTV,2023-09-27,Unifor contract talks with General Motors begin after workers ratify Ford deal,https://www.ctvnews.ca/business/unifor-contract-talks-with-general-motors-begin-after-workers-ratify-ford-deal-1.6577735,neutral,0.0640668,0.019941995,0.9159911,0.0037068750704460918
CTV,2023-09-27,Four people charged following controversy at northern Ont. fishing tournament,https://northernontario.ctvnews.ca/four-people-charged-following-controversy-at-northern-ont-fishing-tournament-1.6578623,negative,0.00929069,0.5877607,0.4029486,-0.345376325257682
CTV,2023-09-27,Anthony Rota resigns as House Speaker amid condemnation for inviting Nazi veteran to Parliament,https://www.ctvnews.ca/politics/anthony-rota-resigns-as-house-speaker-amid-condemnation-for-inviting-nazi-veteran-to-parliament-1.6577796,negative,0.00546744,0.7926419,0.20189078,-0.6282511956880903
CTV,2023-09-27,'Disgraced' New Westminster school trustee resigns after social media scandal,https://bc.ctvnews.ca/disgraced-new-westminster-school-trustee-resigns-after-social-media-scandal-1.6579993,negative,0.004490834,0.9165806,0.078928515,-0.8400998740806882
CTV,2023-09-27,Closing arguments underway in trial of jail guard charged in Manitoba inmate’s death,https://winnipeg.ctvnews.ca/closing-arguments-underway-in-trial-of-jail-guard-charged-in-manitoba-inmate-s-death-1.6580180,neutral,0.017834408,0.18138108,0.8007845,-0.03258102631963222
CTV,2023-09-27,U.S. government shutdown expected as GOP infighting worsens,https://www.ctvnews.ca/video?playlistId=1.6573753,negative,0.010357317,0.64484996,0.3447927,-0.4157242106245107
CTV,2023-09-27,"B.C. sets housing targets for 10 municipalities, including Victoria, Saanich, Oak Bay",https://vancouverisland.ctvnews.ca/b-c-sets-housing-targets-for-10-municipalities-including-victoria-saanich-oak-bay-1.6578707,neutral,0.048943806,0.013483576,0.9375725,0.00221369424188822
CTV,2023-09-27,Residents in Laval's west end urged not to use tap water,https://montreal.ctvnews.ca/residents-in-laval-s-west-end-urged-not-to-use-tap-water-1.6578668,negative,0.01595393,0.27280426,0.71124166,-0.07416767486032505
CTV,2023-09-27,"City of Ottawa owed millions in outstanding fines for red light running, photo radar violations",https://ottawa.ctvnews.ca/city-of-ottawa-owed-millions-in-outstanding-fines-for-red-light-running-photo-radar-violations-1.6579374,negative,0.013403727,0.708461,0.27813518,-0.5017373928706519
CTV,2023-09-27,Death of man found in Saskatoon dumpster no longer considered suspicious,https://saskatoon.ctvnews.ca/death-of-man-found-in-saskatoon-dumpster-no-longer-considered-suspicious-1.6580060,neutral,0.018492538,0.22132476,0.7601828,-0.048642655970354554
CTV,2023-09-27,PM offers apology after Nazi vet recognized in Parliament,https://www.ctvnews.ca/video?playlistId=1.6576365,negative,0.029013066,0.49225897,0.478728,-0.2414771176863244
CTV,2023-09-27,Manitoulin drug dealer deemed dangerous offender in child sexual abuse case,https://northernontario.ctvnews.ca/manitoulin-drug-dealer-deemed-dangerous-offender-in-child-sexual-abuse-case-1.6579875,negative,0.009122686,0.72605085,0.26482654,-0.5270665763663231
CTV,2023-09-27,Prosecutors say cheek swab from Gilgo Beach murder suspect adds to evidence of guilt,https://www.ctvnews.ca/world/prosecutors-say-cheek-swab-from-gilgo-beach-murder-suspect-adds-to-evidence-of-guilt-1.6579939,neutral,0.07952471,0.1300143,0.79046106,-0.010579534909034294
CTV,2023-09-27,Her family inherited a 900-year-old Italian castle. Here's what it's like living there,https://www.ctvnews.ca/lifestyle/her-family-inherited-a-900-year-old-italian-castle-here-s-what-it-s-like-living-there-1.6579759,neutral,0.07064981,0.015168798,0.9141815,0.004761298922576707
