source,date,headline,url,chosen_label,positive,negative,neutral,compound
CTV,2023-09-06,'I was gutted': Cambridge residents shocked over tree removal in nearby park,https://kitchener.ctvnews.ca/i-was-gutted-cambridge-residents-shocked-over-tree-removal-in-nearby-park-1.6548829,negative,0.012724956,0.79161155,0.19566342,-0.6264869952788619
CTV,2023-09-06,Here's why Sask. saw virtually no tornadoes this year,https://regina.ctvnews.ca/here-s-why-sask-saw-virtually-no-tornadoes-this-year-1.6543286,neutral,0.19128321,0.091891214,0.7168256,0.028145268634595766
CTV,2023-09-06,"Trial for 'Freedom Convoy' organizers not about their political beliefs, Crown says",https://www.ctvnews.ca/canada/trial-for-freedom-convoy-organizers-not-about-their-political-beliefs-crown-says-1.6547836,neutral,0.020784004,0.20857055,0.7706455,-0.043069690272954375
CTV,2023-09-06,Thousands start journey home as Yellowknife evacuation order scheduled to lift,https://www.ctvnews.ca/canada/thousands-start-journey-home-as-yellowknife-evacuation-order-scheduled-to-lift-1.6549388,negative,0.022164118,0.24581285,0.73202294,-0.05993272806935224
CTV,2023-09-06,"Political pressure to stop rate hikes now coming from premiers, as BoC decision nears",https://www.ctvnews.ca/politics/political-pressure-to-stop-rate-hikes-now-coming-from-premiers-as-boc-decision-nears-1.6548302,neutral,0.045781106,0.08980151,0.86441743,-0.005968399735617247
CTV,2023-09-06,New regulations in effect for Halifax short-term rentals,https://atlantic.ctvnews.ca/new-regulations-in-effect-for-halifax-short-term-rentals-1.6548827,neutral,0.030292409,0.050020307,0.9196873,-0.0015844013846511018
CTV,2023-09-06,"More post-secondary students rely on parents, stay home to finish school: RBC poll",https://www.ctvnews.ca/business/more-post-secondary-students-rely-on-parents-stay-home-to-finish-school-rbc-poll-1.6549425,neutral,0.04101194,0.14041576,0.8185723,-0.01803460696177339
CTV,2023-09-06,"More than 5 million people have been displaced by a monthslong conflict in Sudan, UN agency says",https://www.ctvnews.ca/world/more-than-5-million-people-have-been-displaced-by-a-monthslong-conflict-in-sudan-un-agency-says-1.6549547,negative,0.005864177,0.8292691,0.1648668,-0.6876527716841707
CTV,2023-09-06,Regina Floral Conservatory reopens after summer break,https://regina.ctvnews.ca/regina-floral-conservatory-reopens-after-summer-break-1.6549142,neutral,0.13659528,0.005245379,0.8581593,0.01863076217670212
CTV,2023-09-06,Man dead after stabbing in Copperfield park,https://calgary.ctvnews.ca/man-dead-after-stabbing-in-copperfield-park-1.6549332,negative,0.011133762,0.786539,0.20232731,-0.6185195733632547
CTV,2023-09-06,'Balance the narrative': Rallies speak to both sides of school division conflict,https://winnipeg.ctvnews.ca/balance-the-narrative-rallies-speak-to-both-sides-of-school-division-conflict-1.6549339,neutral,0.058656078,0.054494265,0.8868497,0.0004709103118041291
CTV,2023-09-06,Sask. family's camper consumed by flames after fridge explodes,https://saskatoon.ctvnews.ca/sask-family-s-camper-consumed-by-flames-after-fridge-explodes-1.6548857,negative,0.013289884,0.57442313,0.41228697,-0.3297853333594922
CTV,2023-09-06,Russia says southeast Ukraine is now the main focus of fighting in the war,https://www.ctvnews.ca/world/russia-says-southeast-ukraine-is-now-the-main-focus-of-fighting-in-the-war-1.6548158,negative,0.018675717,0.27447763,0.7068467,-0.07498917227133006
CTV,2023-09-06,"Sask. teachers, province digging in during negotiations as school begins not a good sign, expert says",https://regina.ctvnews.ca/sask-teachers-province-digging-in-during-negotiations-as-school-begins-not-a-good-sign-expert-says-1.6548984,negative,0.009037004,0.71666706,0.27429575,-0.5135301281186386
CTV,2023-09-06,Working like a dog on the Gordie Howe International Bridge project,https://windsor.ctvnews.ca/working-like-a-dog-on-the-gordie-howe-international-bridge-project-1.6549496,neutral,0.1558187,0.14442067,0.6997607,0.0034221375214649186
CTV,2023-09-06,Windsor moving to biweekly garbage pickup in 2025,https://windsor.ctvnews.ca/windsor-moving-to-biweekly-garbage-pickup-in-2025-1.6549387,neutral,0.05056565,0.20103239,0.74840194,-0.03785713993130102
CTV,2023-09-06,"Child dead, youth arrested after stabbing at Toronto apartment building: police",https://toronto.ctvnews.ca/child-dead-youth-arrested-after-stabbing-at-toronto-apartment-building-police-1.6549253,negative,0.007709481,0.7442993,0.24799116,-0.5539220334007968
CTV,2023-09-06,'A very long wait': Yellowknife prepares for people to return home,https://www.ctvnews.ca/canada/a-very-long-wait-yellowknife-prepares-for-people-to-return-home-1.6547849,negative,0.011304165,0.64030325,0.3483925,-0.40986054864561083
CTV,2023-09-06,Six students from the same Toronto high school graduate with 100 per cent grades,https://toronto.ctvnews.ca/six-students-from-the-same-toronto-high-school-graduate-with-100-per-cent-grades-1.6538542,positive,0.38934737,0.0124947615,0.59815794,0.1514352249453399
CTV,2023-09-06,Multiple school districts cut ties with popular Vancouver Island Christian summer camp over 'homophobic language' in staff contract,https://bc.ctvnews.ca/multiple-school-districts-cut-ties-with-popular-vancouver-island-christian-summer-camp-over-homophobic-language-in-staff-contract-1.6549326,negative,0.009847217,0.6120307,0.37812215,-0.37448455560919314
CTV,2023-09-06,B.C. First Nation buys former residential school site,https://bc.ctvnews.ca/b-c-first-nation-buys-former-residential-school-site-1.6548696,neutral,0.030263202,0.0587321,0.9110048,-0.0025335957530088216
CTV,2023-09-06,Read 'Secret' memo for Trudeau on unidentified object shot down over Yukon,https://www.ctvnews.ca/canada/read-secret-memo-for-trudeau-on-unidentified-object-shot-down-over-yukon-1.6548510,neutral,0.021470413,0.12155581,0.8569738,-0.014314831753086121
CTV,2023-09-06,'Slow down and be alert': School zones are back in effect as Vancouver Island students return to class,https://vancouverisland.ctvnews.ca/slow-down-and-be-alert-school-zones-are-back-in-effect-as-vancouver-island-students-return-to-class-1.6548888,neutral,0.09688233,0.01911846,0.8839992,0.009020668958159561
CTV,2023-09-06,Carmakers are failing the privacy test. Owners have little to no control of the data they hand over,https://www.ctvnews.ca/sci-tech/carmakers-are-failing-the-privacy-test-owners-have-little-to-no-control-of-the-data-they-hand-over-1.6549469,negative,0.009789627,0.7947759,0.19543451,-0.63157285239582
CTV,2023-09-06,Greenbelt's 'Mr. X' is a former Ontario mayor: sources,https://toronto.ctvnews.ca/greenbelt-s-mr-x-is-a-former-ontario-mayor-sources-1.6548698,neutral,0.032298934,0.008102858,0.9595981,0.000977566832309651
CTV,2023-09-06,B.C. island imposes tax on short-term rentals to fight housing crisis,https://vancouverisland.ctvnews.ca/b-c-island-imposes-tax-on-short-term-rentals-to-fight-housing-crisis-1.6548628,neutral,0.024350572,0.22282906,0.7528203,-0.04905985106726085
CTV,2023-09-06,Just four organizations bid to operate London's first homeless hubs,https://london.ctvnews.ca/just-four-organizations-bid-to-operate-london-s-first-homeless-hubs-1.6549583,neutral,0.065145515,0.031082967,0.9037715,0.0032777873721503425
CBC,2023-09-06,"Canada has a lot of trees, and they're telling us something",https://www.cbc.cahttps://www.cbc.ca/newsinteractives/features/canadian-wildfires-boreal-forest-tipping-point,neutral,0.21251799,0.072630785,0.71485126,0.03988866270474034
CBC,2023-09-06,Tired of checking your email? This man went a year without going online,https://www.cbc.ca/news/canada/british-columbia/aron-lee-rosenberg-book-1.6955060,negative,0.023687594,0.7213233,0.25498906,-0.5197462378122619
CBC,2023-09-06,Spanish player Jenni Hermoso accuses Luis Rubiales of sexual assault after World Cup kiss,https://www.cbc.ca/sports/soccer/jenni-hermoso-sexual-assault-accusation-luis-rubiales-spanish-soccer-1.6957834,negative,0.01274592,0.53214276,0.4551113,-0.28301347236809526
CBC,2023-09-06,Humanitarian group calls on Canada to push allies away from banned cluster weapons,https://www.cbc.ca/news/politics/cluster-munitions-bombs-ukraine-russia-1.6957188,neutral,0.039990768,0.22272539,0.7372837,-0.048007362963375044
CBC,2023-09-06,Ontario has a new housing minister. But the Greenbelt is still his problem,https://www.cbc.ca/news/canada/toronto/new-ontario-housing-minister-1.6956615,negative,0.027699461,0.53932184,0.43297875,-0.2901007557332562
CBC,2023-09-06,This car was stolen from a driveway in Canada. We found it in West Africa,https://www.cbc.ca/news/world/auto-theft-canada-1.6953242,negative,0.012415422,0.49483937,0.4927452,-0.24471187434463992
CBC,2023-09-06,New Ontario housing minister to take questions amid ongoing Greenbelt controversy,https://www.cbc.ca/news/canada/toronto/calandra-greenbelt-review-news-conference-1.6957793,neutral,0.020796396,0.06379811,0.9154054,-0.003637712888739486
CBC,2023-09-06,WATCH: CBC News Network,https://www.cbc.cahttps://gem.cbc.ca/benefits-premium?cmp=DM_NewsTile_Gem_PremiumNN,neutral,0.10073908,0.018231502,0.88102955,0.00981596340483426
CBC,2023-09-06,Mysterious consultant known as 'Mr. X' in Greenbelt report ID'd as former Clarington mayor: sources,https://www.cbc.ca/news/canada/toronto/greenbelt-unregistered-lobbyist-development-1.6955297,neutral,0.024339817,0.12307126,0.85258895,-0.01455410556604253
CBC,2023-09-06,"Fatal wedding shooting was targeted, says Ottawa police chief",https://www.cbc.ca/news/canada/ottawa/wedding-shooting-update-ottawa-1.6957271,negative,0.0064967247,0.7581968,0.23530655,-0.5748201027031161
CBC,2023-09-06,New Democrats vow to push for swift action on housing as caucus meets in Ottawa,https://www.cbc.ca/news/politics/ndp-singh-housing-1.6957005,neutral,0.16282623,0.015423646,0.82175016,0.026274486517792184
CBC,2023-09-06,Air Canada sorry for booting passengers who refused vomit-soiled seats,https://www.cbc.ca/news/canada/montreal/air-canada-booted-passengers-vomit-filled-seats-1.6957790,negative,0.0053347466,0.9160696,0.07859567,-0.8391550746218073
CBC,2023-09-06,"Ontario will 're-evaluate' sites in Greenbelt land swap as part of review, Ford says",https://www.cbc.ca/news/canada/toronto/ford-clark-resignation-greenbelt-1.6956787,neutral,0.028890612,0.015814248,0.9552952,0.0005845761316145559
CBC,2023-09-06,Doug Ford shuffles cabinet after resignation,https://www.cbc.ca/news/canada/toronto/ontario-cabinet-shuffle-1.6956641,negative,0.022087703,0.28988683,0.6880255,-0.08354650931300966
CBC,2023-09-06,Ontario opposition politicians react to Housing Minister's resignation,https://www.cbc.ca/player/play/2260891203517,neutral,0.030268125,0.057506386,0.9122254,-0.002390826772401544
CBC,2023-09-06,"Man accused in killing of Muslim family in London, Ont., pleads not guilty as jury selection begins",https://www.cbc.ca/news/canada/london/nathaniel-veltman-pleads-not-guilty-in-killing-of-muslim-family-in-london-ont-as-jury-selection-begins-1.6957104,negative,0.026440313,0.3569755,0.6165841,-0.12673243366542408
CBC,2023-09-06,More companies are calling people back to the office. Some workers refuse to go,https://www.cbc.ca/news/business/back-to-office-mandate-september-2023-1.6949749,negative,0.041334923,0.43284556,0.5258195,-0.18564671661705923
CBC,2023-09-06,Trial for convoy leaders starts in Ottawa with police witness,https://www.cbc.ca/news/canada/ottawa/tamara-lich-chris-barber-trial-begins-1.6956948,neutral,0.02869531,0.06932038,0.9019843,-0.003981896009699337
CBC,2023-09-06,"Canada's energy drink crackdown needs more than recalls to dissuade kids, say parents and teachers",https://www.cbc.ca/news/canada/energy-drink-recall-health-canada-1.6957040,negative,0.026631692,0.31730974,0.6560586,-0.09997621411721092
CBC,2023-09-06,P.E.I. salmon streams get boost from new watershed project,https://www.cbc.ca/news/canada/prince-edward-island/pei-salmon-streams-connectivity-project-1.6957250,positive,0.749705,0.0038396318,0.24645539,0.5620428582000825
CBC,2023-09-06,Ex-Proud Boys leader sentenced to 22 years. Here's what other Jan. 6 figures got,https://www.cbc.ca/news/world/proud-boys-sentence-jan-6-attack-1.6957120,negative,0.030293187,0.3540294,0.6156774,-0.12441912927590693
CBC,2023-09-06,How developers influenced the Ford government to open up their Greenbelt land for housing,https://www.cbc.ca/news/canada/toronto/auditor-general-greenbelt-lobbying-1.6934275,neutral,0.079995416,0.032184396,0.8878202,0.005363431433923482
CBC,2023-09-06,Does your generation have it better or worse? Compare past and future temperatures to when you were born,https://www.cbc.cahttps://newsinteractives.cbc.ca/features/2023/climate-stripes/,negative,0.07119049,0.257192,0.6716175,-0.061079634300625685
CBC,2023-09-06,Priceless artifacts found near untouched Beothuk site in central Newfoundland,https://www.cbc.ca/news/canada/newfoundland-labrador/beothuk-lake-artifacts-house-pit-erosion-1.6956767,neutral,0.12101604,0.013112862,0.8658711,0.014472938217302556
CBC,2023-09-06,Workers arrested in China for breaking portion of the Great Wall,https://www.cbc.ca/news/world/china-great-wall-breach-arrests-1.6957786,negative,0.017568665,0.502654,0.4797773,-0.25235240138408255
CBC,2023-09-06,"This pie sold for $15,000 at an Ontario fair auction",https://www.cbc.ca/news/canada/windsor/pie-auction-harrow-1.6957075,neutral,0.12397654,0.036489457,0.8395339,0.01403870940356633
CBC,2023-09-06,Residents of Edmonton condo building ordered out over concerns of collapse,https://www.cbc.ca/news/canada/edmonton/edmonton-condo-structural-concerns-evacuation-1.6957207,negative,0.0135591,0.50627285,0.48016804,-0.2561283518238078
CBC,2023-09-06,"Sask. teachers prepare to navigate new name, pronoun policy as school year begins",https://www.cbc.ca/news/canada/saskatchewan/sask-name-pronoun-policy-new-school-year-1.6956559,neutral,0.07505944,0.028226545,0.896714,0.004837183882715479
CBC,2023-09-06,"Sword attack case misinformation leading to 'heightened sense of anxiety' in P.E.I., police say",https://www.cbc.ca/news/canada/prince-edward-island/pei-sword-attack-day-5-1.6957473,negative,0.0067851483,0.69220465,0.3010102,-0.4791012449998995
CBC,2023-09-06,TFW your grandma becomes a social media sensation,https://www.cbc.ca/news/canada/granfluencer-social-media-1.6936399,neutral,0.07793028,0.17078042,0.75128937,-0.0230928173360212
CBC,2023-09-06,Calgary daycares hit by E. coli outbreak could be shut down for another week,https://www.cbc.ca/news/canada/calgary/e-coli-daycare-shutdown-calgary-1.6957445,negative,0.009816613,0.7470635,0.24311984,-0.5580075778483788
CBC,2023-09-06,Go beyond the headlines | Stream CBC News Explore,https://www.cbc.cahttps://www.cbc.ca/news/cbc-news-explore-1.6512577,neutral,0.10185861,0.013737929,0.8844034,0.010186449934611819
CBC,2023-09-06,Yellowknife had no plan for city-wide evacuation as wildfire approached,https://www.cbc.ca/news/canada/north/yellowknife-never-had-plan-for-city-wide-evacuation-1.6957449,negative,0.014688438,0.3955064,0.58980507,-0.1562096057744693
CBC,2023-09-06,Former top banker says premiers are 'grandstanding' on interest rate hikes,https://www.cbc.ca/news/politics/bank-of-canada-interest-ford-furey-eby-1.6957173,neutral,0.061162785,0.0830398,0.8557974,-0.003154721956996731
CBC,2023-09-06,"This famous Rocky Mountain glacier is dying, say scientists, warning us of what's to come",https://www.cbc.cahttps://www.cbc.ca/newsinteractives/features/the-canary-in-the-icefield,negative,0.012667685,0.7087449,0.2785874,-0.5021588819225897
