source,date,headline,url,chosen_label,positive,negative,neutral,compound
CTV,2023-11-06,Threads of love: How knitters are bringing comfort to children in warzones,https://www.ctvnews.ca/canada/threads-of-love-how-knitters-are-bringing-comfort-to-children-in-warzones-1.6631335,positive,0.8516311,0.009272571,0.13909633,0.7251895457055086
CTV,2023-11-06,"Winter travel season extended as Air Transat kicks off flights to sunny destinations out of London, Ont.",https://london.ctvnews.ca/winter-travel-season-extended-as-air-transat-kicks-off-flights-to-sunny-destinations-out-of-london-ont-1.6633246,positive,0.4785985,0.0029976845,0.5184038,0.22904752887801472
CTV,2023-11-06,Motorcycle vandalized with hate-motivated writing: Police,https://kitchener.ctvnews.ca/motorcycle-vandalized-with-hate-motivated-writing-police-1.6633532,negative,0.0065511717,0.87154764,0.12190108,-0.7595524861758678
CTV,2023-11-06,"Rain, freezing rain and snow in the forecast across central Ontario: Here's when to expect it",https://barrie.ctvnews.ca/rain-freezing-rain-and-snow-in-the-forecast-across-central-ontario-here-s-when-to-expect-it-1.6632438,neutral,0.031975973,0.1538747,0.8141493,-0.022654961033947707
CTV,2023-11-06,Premiers say Ottawa must ensure carbon pricing measures are fair to all Canadians,https://www.ctvnews.ca/canada/premiers-say-ottawa-must-ensure-carbon-pricing-measures-are-fair-to-all-canadians-1.6632535,neutral,0.10802667,0.025979603,0.86599386,0.010994811039721775
CTV,2023-11-06,Here's how a Canadian photographer took these astronomical photos of the northern lights,https://www.ctvnews.ca/sci-tech/here-s-how-a-canadian-photographer-took-these-astronomical-photos-of-the-northern-lights-1.6633296,neutral,0.12399664,0.0112545015,0.86474866,0.015248524988470624
CTV,2023-11-06,Alberta health minister says fundamental change needed as system is 'not working',https://edmonton.ctvnews.ca/alberta-health-minister-says-fundamental-change-needed-as-system-is-not-working-1.6633561,negative,0.010526938,0.71700615,0.27246687,-0.5139870189740385
CTV,2023-11-06,N.B. woman raising awareness about the dangers of radon gas after terminal lung cancer diagnosis,https://atlantic.ctvnews.ca/more/n-b-woman-raising-awareness-about-the-dangers-of-radon-gas-after-terminal-lung-cancer-diagnosis-1.6627224,negative,0.022033742,0.4618803,0.516086,-0.21284790897398764
CTV,2023-11-06,"Burton Cummings, Randy Bachman sue former Guess Who bandmates over use of name",https://winnipeg.ctvnews.ca/burton-cummings-randy-bachman-sue-former-guess-who-bandmates-over-use-of-name-1.6628569,neutral,0.03256326,0.13408567,0.833351,-0.01691860621286434
CTV,2023-11-06,Stellantis auto workers ratify new collective agreement: Unifor,https://windsor.ctvnews.ca/stellantis-auto-workers-ratify-new-collective-agreement-unifor-1.6633476,positive,0.23427257,0.006998106,0.7587294,0.054834646349116944
CTV,2023-11-06,Montreal police investigating possible drive-by shooting in Saint-Michel,https://montreal.ctvnews.ca/montreal-police-investigating-possible-drive-by-shooting-in-saint-michel-1.6633489,neutral,0.01613157,0.18028307,0.8035854,-0.0322417504615391
CTV,2023-11-06,A new apple variety is now coming out of an Ontario orchard. Here's what it tastes like,https://toronto.ctvnews.ca/a-new-apple-variety-is-now-coming-out-of-an-ontario-orchard-here-s-what-it-tastes-like-1.6630363,positive,0.5504371,0.0050509814,0.44451183,0.30295554595570096
CTV,2023-11-06,"LIVE: Trudeau, Liberal caucus attend Diwali celebration",https://www.ctvnews.ca/video?playlistId=1.6633622,positive,0.2798175,0.0045175473,0.7156649,0.07827742859959663
CTV,2023-11-06,Rafah border: Canadian critical of GAC's evacuation efforts,https://www.ctvnews.ca/video?playlistId=1.6595428,neutral,0.016633488,0.20774889,0.7756174,-0.04288296845095907
CTV,2023-11-06,Two dead after multiple serious crashes across Saskatchewan: RCMP,https://regina.ctvnews.ca/two-dead-after-multiple-serious-crashes-across-saskatchewan-rcmp-1.6633163,negative,0.0112047335,0.66478056,0.32401475,-0.44180762395399675
CTV,2023-11-06,International student victim of northern Ont. college’s ‘overbooking’ policy,https://northernontario.ctvnews.ca/international-student-victim-of-northern-ont-college-s-overbooking-policy-1.6633022,negative,0.009339104,0.66469276,0.32596812,-0.4417292654014382
CTV,2023-11-06,St. James shooting incident now being investigated as homicide,https://winnipeg.ctvnews.ca/st-james-shooting-incident-now-being-investigated-as-homicide-1.6632937,negative,0.011628972,0.54184645,0.44652447,-0.2934623939714971
CTV,2023-11-06,Vancouver man's family in Gaza ponders whether to stay together so they die together,https://bc.ctvnews.ca/vancouver-man-s-family-in-gaza-ponders-whether-to-stay-together-so-they-die-together-1.6632784,negative,0.009918338,0.6274691,0.36261258,-0.39361910786165843
CTV,2023-11-06,"Olympic skier speaks out against illegal fishing, finds salmon carcass in his mailbox",https://montreal.ctvnews.ca/olympic-skier-speaks-out-against-illegal-fishing-finds-salmon-carcass-in-his-mailbox-1.6625000,negative,0.019806156,0.50891787,0.47127593,-0.25860514221880493
CTV,2023-11-06,Feds put $5M toward security for community groups who fear hate-motivated crimes,https://www.ctvnews.ca/politics/feds-put-5m-toward-security-for-community-groups-who-fear-hate-motivated-crimes-1.6633401,negative,0.040448565,0.2963944,0.66315705,-0.08621354999963238
CTV,2023-11-06,"Sask. to enshrine its refusal to collect carbon tax on heating into law, premier says",https://regina.ctvnews.ca/sask-to-enshrine-its-refusal-to-collect-carbon-tax-on-heating-into-law-premier-says-1.6633071,neutral,0.015290794,0.21873401,0.76597524,-0.047610750031712
CTV,2023-11-06,Gun in Glastonbury weapons complaint found to be airsoft gun: police,https://edmonton.ctvnews.ca/gun-in-glastonbury-weapons-complaint-found-to-be-airsoft-gun-police-1.6632250,negative,0.020317843,0.25068244,0.7289996,-0.0624288969234712
CTV,2023-11-06,Two men and a child are dead after falling through the ice on a Sask. lake,https://saskatoon.ctvnews.ca/two-men-and-a-child-are-dead-after-falling-through-the-ice-on-a-sask-lake-1.6632900,negative,0.009567689,0.7536933,0.23673898,-0.5679620681342357
CTV,2023-11-06,Father of boy abducted by Randall Hopley in 2011 speaks on high-risk sex offender’s latest flight from law,https://calgary.ctvnews.ca/father-of-boy-abducted-by-randall-hopley-in-2011-speaks-on-high-risk-sex-offender-s-latest-flight-from-law-1.6633286,negative,0.009470319,0.55839556,0.43213415,-0.3117158863897487
CTV,2023-11-06,'I owe everything to her:' Bombers' Brady Oliveira credits success to mom Shani,https://winnipeg.ctvnews.ca/i-owe-everything-to-her-bombers-brady-oliveira-credits-success-to-mom-shani-1.6633030,positive,0.91150534,0.003346499,0.08514815,0.8308307953228895
CTV,2023-11-06,Kitchener Christmas market cancellation being investigated by police,https://kitchener.ctvnews.ca/kitchener-christmas-market-cancellation-being-investigated-by-police-1.6632503,negative,0.012426101,0.5676698,0.41990417,-0.3220945713788552
CTV,2023-11-06,Man wanted for hitting pedestrian with car arrested: Truro police,https://atlantic.ctvnews.ca/man-wanted-for-hitting-pedestrian-with-car-arrested-truro-police-1.6632748,negative,0.014242375,0.3498863,0.6358714,-0.12221754623244863
CTV,2023-11-06,Some legions struggling to pay the bills as membership declines,https://www.ctvnews.ca/canada/some-legions-struggling-to-pay-the-bills-as-membership-declines-1.6630033,negative,0.027719107,0.49559006,0.47669074,-0.24484120126960107
CTV,2023-11-06,Two men and a child dead after falling through ice in Sask.,https://www.ctvnews.ca/video?playlistId=1.6633100,negative,0.0102841025,0.7195284,0.27018738,-0.5176154066939489
CTV,2023-11-06,Westbound Glenmore Trail closed during Monday evening commute due to rollover,https://calgary.ctvnews.ca/westbound-glenmore-trail-closed-during-monday-evening-commute-due-to-rollover-1.6633461,negative,0.017691419,0.30280915,0.67949945,-0.09138039497207018
CTV,2023-11-06,"Carbon-tax: 'Treat all families equal,' Sask. premier says",https://www.ctvnews.ca/video?playlistId=1.6630638,neutral,0.15341273,0.021970201,0.824617,0.023052781868353023
CTV,2023-11-06,'We will conquer cancer in our lifetime': Cancer patient finds hope in advanced precision medicine,https://www.ctvnews.ca/health/we-will-conquer-cancer-in-our-lifetime-cancer-patient-finds-hope-in-advanced-precision-medicine-1.6629934,positive,0.91149014,0.0035954295,0.0849145,0.8308013052566396
CTV,2023-11-06,Nobel Peace Prize laureate Narges Mohammadi goes on a hunger strike while imprisoned in Iran,https://www.ctvnews.ca/world/nobel-peace-prize-laureate-narges-mohammadi-goes-on-a-hunger-strike-while-imprisoned-in-iran-1.6632964,negative,0.01890106,0.45212182,0.52897716,-0.20405688115517506
CTV,2023-11-06,'Legislate in your own area': Smith on Alta.-feds relations,https://www.ctvnews.ca/video?playlistId=1.6607610,neutral,0.046934716,0.014619521,0.9384458,0.001989135741709447
CTV,2023-11-06,Canada Post honours Mona Parsons in special Remembrance Day stamp,https://www.ctvnews.ca/canada/canada-post-honours-mona-parsons-in-special-remembrance-day-stamp-1.6633366,neutral,0.22048311,0.0064452207,0.77307177,0.04857124158888837
CTV,2023-11-06,Deer with arrow stuck in its side wandering Greater Victoria: conservation officers,https://bc.ctvnews.ca/deer-with-arrow-stuck-in-its-side-wandering-greater-victoria-conservation-officers-1.6627264,negative,0.013459256,0.35306036,0.6334804,-0.1244704490760924
CTV,2023-11-06,Sask. school's move to change Halloween to 'harvest celebration' gets mixed reviews,https://regina.ctvnews.ca/sask-school-s-move-to-change-halloween-to-harvest-celebration-gets-mixed-reviews-1.6625715,negative,0.0130166495,0.37956187,0.60742146,-0.1438977921146556
CTV,2023-11-06,"Quebec public sector unions go on strike, announce 72-hour walkout later this month",https://montreal.ctvnews.ca/quebec-public-sector-unions-go-on-strike-announce-72-hour-walkout-later-this-month-1.6632407,negative,0.01867915,0.38138747,0.5999335,-0.14510745033103944
CTV,2023-11-06,Proposed class action lawsuit alleges Ozempic maker failed to disclose serious side effects,https://www.ctvnews.ca/health/proposed-class-action-lawsuit-alleges-ozempic-maker-failed-to-disclose-serious-side-effects-1.6629998,negative,0.009252864,0.7758366,0.21491061,-0.6018367602211301
CTV,2023-11-06,Manitoba woman charged in fatal rollover had three-times legal blood alcohol limit: RCMP,https://winnipeg.ctvnews.ca/manitoba-woman-charged-in-fatal-rollover-had-three-times-legal-blood-alcohol-limit-rcmp-1.6633238,negative,0.01856875,0.25689918,0.7245322,-0.06565236062791868
CBC,2023-11-06,Politicians condemn display of swastika at Parliament Hill rally,https://www.cbc.ca/news/politics/politicians-condemn-swastika-ottawa-rally-1.7019234,negative,0.010909548,0.5720031,0.41708723,-0.3270686080432412
CBC,2023-11-06,Google's latest antitrust trial to focus on Play Store app prices,https://www.cbc.ca/news/business/google-antitrust-trial-1.7019579,neutral,0.07588534,0.04813899,0.8759757,0.0034412208054952487
CBC,2023-11-06,Info from 5.6 million patient visits among data stolen in ransomware attack on Ontario hospitals,https://www.cbc.ca/news/canada/windsor/ransomware-attack-third-bunch-data-hospital-1.7019701,negative,0.011931138,0.55385345,0.43421537,-0.3066113271645605
CBC,2023-11-06,"2 killed, 2 hospitalized after explosion, fire at Canadian High Commission in Nigeria",https://www.cbc.ca/news/politics/two-killed-canadian-high-commisison-nigeria-1.7019572,negative,0.007325962,0.7238599,0.2688142,-0.5239194515865719
CBC,2023-11-06,"'No ceasefire, no votes': Biden gets stern warning from thousands of pro-Palestinian protesters",https://www.cbc.ca/news/world/biden-protests-analysis-1.7019077,negative,0.008007687,0.77994645,0.21204583,-0.6082523474412822
CBC,2023-11-06,Ethics watchdog investigating Zara Canada over alleged ties to forced labour,https://www.cbc.ca/news/business/zara-canada-investigation-forced-labour-1.7020134,negative,0.010110551,0.5635209,0.42636856,-0.31745357429668
CBC,2023-11-06,Quebec public sector workers have started striking. Here's why,https://www.cbc.ca/player/play/2279859267827,negative,0.014087723,0.3811885,0.6047237,-0.1451062391234501
CBC,2023-11-06,'We're going to see some doors shut': P.E.I. restaurants feeling pinch of higher costs,https://www.cbc.ca/news/canada/prince-edward-island/pei-restaurant-revenues-costs-1.7019924,negative,0.016449196,0.49712256,0.48642823,-0.24686027435167723
CBC,2023-11-06,CRTC allows smaller internet companies to sell service over telecoms' fibre networks,https://www.cbc.ca/news/politics/crtc-independent-internet-services-1.7020247,neutral,0.08845979,0.01936723,0.892173,0.007450043662649897
CBC,2023-11-06,"Former Fast Fired pizza franchise owners, investors say they were burned by company",https://www.cbc.cahttps://www.cbc.ca/newsinteractives/features/fast-fired-carbone-pizza,negative,0.009551489,0.7366307,0.25381777,-0.5425335905438633
CBC,2023-11-06,"Canada's premiers united in their criticism of federal housing policy, carbon tax changes",https://www.cbc.ca/news/politics/premiers-carbon-tax-federal-housing-policy-1.7020068,neutral,0.04671891,0.13392057,0.8193605,-0.015752063812001893
CBC,2023-11-06,"Defence rests its case in murder-terrorism trial of man accused of killing Muslim family in London, Ont.",https://www.cbc.ca/news/canada/london/defence-rests-its-case-in-murder-terrorism-trial-of-man-accused-of-killing-muslim-family-in-london-ont-1.7020183,negative,0.010818803,0.49532136,0.49385986,-0.24522619177954397
CBC,2023-11-06,Blinken says U.S. working 'very aggressively' to get more aid into Gaza,https://www.cbc.ca/player/play/2279825987710,neutral,0.057779543,0.0416662,0.9005542,0.0016024047623535154
CBC,2023-11-06,This grandmother works gruelling 70-hour weeks just to pay the bills. And she's not alone,https://www.cbc.ca/news/canada/newfoundland-labrador/kelly-young-the-grind-1.7012745,negative,0.08404525,0.6212971,0.2946575,-0.37894659176788714
CBC,2023-11-06,Officer responds to 911 call — from child who just wanted a hug,https://www.cbc.ca/player/play/2279976003664,neutral,0.16216283,0.028911056,0.80892617,0.025460926954878893
CBC,2023-11-06,Smoggy New Delhi to restrict vehicles to reduce air pollution,https://www.cbc.ca/news/world/india-new-delhi-cars-pollution-1.7019669,negative,0.029284852,0.5450989,0.4256163,-0.29627519472256125
CBC,2023-11-06,Ambassador hopes Canadians will be allowed to leave Gaza in the coming days,https://www.cbc.ca/player/play/2280009795664,positive,0.37320203,0.018719118,0.6080789,0.13892933660064166
CBC,2023-11-06,"As Holocaust education becomes compulsory in some provinces, advocates call for wider adoption",https://www.cbc.ca/news/canada/compulsory-holocaust-education-1.7016316,neutral,0.051258232,0.06997832,0.8787635,-0.002269557845321346
CBC,2023-11-06,"These super shoes may help you win a race, but that comes with an environmental cost",https://www.cbc.ca/radio/asithappens/adidas-super-shoe-1.7020258,neutral,0.2047231,0.21411504,0.58116186,-0.003933700064809642
CBC,2023-11-06,WATCH: CBC News Network,https://www.cbc.cahttps://gem.cbc.ca/benefits-premium?cmp=DM_NewsTile_Gem_PremiumNN,neutral,0.10073908,0.018231502,0.88102955,0.00981596340483426
CBC,2023-11-06,"Mayor of Humboldt, Sask., calls death of child, 2 adults who fell through ice 'extremely tragic'",https://www.cbc.ca/news/canada/saskatchewan/drownings-humboldt-lake-1.7019831,negative,0.010308055,0.74076927,0.24892287,-0.5486327318954469
CBC,2023-11-06,Go beyond the headlines | Stream CBC News Explore,https://www.cbc.cahttps://www.cbc.ca/news/cbc-news-explore-1.6512577,neutral,0.09185704,0.0112939505,0.89684886,0.008310174861161368
CBC,2023-11-06,PHOTOS | Stunning scenes of the northern lights,https://www.cbc.ca/news/world/photos/photos-stunning-scenes-of-the-northern-lights-1.6769762,positive,0.84753937,0.0041259676,0.14833458,0.718306040207902
CBC,2023-11-06,"Lawyer for alleged Winnipeg serial killer argues that judge should hear his case, not a jury",https://www.cbc.ca/news/canada/manitoba/jeremy-skibicki-pretrial-day-one-1.7019889,negative,0.018454123,0.38216174,0.59938407,-0.14570705943562245
CBC,2023-11-06,"With focus on Gaza, Israeli settlers ramping up attacks on Palestinians in West Bank",https://www.cbc.ca/news/world/west-bank-settlers-violence-israel-palestinians-1.7019263,negative,0.010188863,0.6859595,0.30385166,-0.47043660676866494
CBC,2023-11-06,Another ex-player alleges former video coach of Chicago's NHL team sexually assaulted him,https://www.cbc.ca/sports/hockey/nhl/chicago-nhl-team-lawsuit-sexual-assault-allegation-1.7019493,negative,0.009602481,0.7452539,0.24514346,-0.5553112970030538
CBC,2023-11-06,"Trump 'rambled' and 'hurled insults' on witness stand in civil fraud trial, N.Y. attorney general says",https://www.cbc.ca/news/world/trump-testimony-ny-civil-trial-1.7019520,negative,0.012169261,0.6478441,0.3399866,-0.419553913396431
CBC,2023-11-06,Surrey Eagles celebrate Punjabi culture at B.C. junior hockey game,https://www.cbc.ca/player/play/2279887939635,positive,0.7075848,0.00283579,0.28957918,0.5006683520389323
CBC,2023-11-06,"When we renewed our vows, we also celebrated 20 years of our right to marry",https://www.cbc.ca/radio/nowornever/when-we-renewed-our-vows-we-also-celebrated-20-years-of-our-right-to-marry-1.7014112,positive,0.8040193,0.003243195,0.19273761,0.6464364002812726
CBC,2023-11-06,UN urges ceasefire in Israel-Hamas war: 'No one is safe',https://www.cbc.ca/news/world/israel-hamas-war-1.7019481,negative,0.01530818,0.6271506,0.35754123,-0.39308350978307516
CBC,2023-11-06,Stellantis workers vote to accept new deal,https://www.cbc.ca/news/canada/windsor/stellantis-uinifor-deal-1.7020276,neutral,0.13407302,0.027300803,0.8386263,0.017230224575259356
CBC,2023-11-06,Canadian skating coach Richard Gauthier given 12 months for sexual assault,https://www.cbc.ca/sports/olympics/winter/figure-skating/olympics-figure-skating-gauthier-sex-assault-1.7020105,negative,0.008562508,0.70893973,0.28249767,-0.5025222884845348
CBC,2023-11-06,Grieving daughter says father might still be alive if Air Canada had diverted long-haul flight,https://www.cbc.ca/news/gopublic/air-canada-medical-crisis-diversion-1.7015799,negative,0.019687148,0.47524288,0.50507003,-0.22546818694194926
CBC,2023-11-06,"Patients, doctors, advocates launch campaign to press for increased use of key HIV medication in B.C.",https://www.cbc.ca/news/canada/british-columbia/long-acting-hiv-medication-transparency-eligibility-concerns-1.7019102,neutral,0.09893893,0.033980675,0.86708033,0.008634229366179191
