source,date,headline,url,chosen_label,positive,negative,neutral,compound
Global,2023-09-04,16-year-old girl fatally stabbed during fight over McDonald’s sauce packet,https://globalnews.ca/news/9928470/mcdonalds-sauce-fight-girl-killed-stabbed-washington/,negative,0.008241208,0.81630504,0.17545362,-0.6662860867866547
Global,2023-09-04,Your Saskatchewan photo of the day: September 2023,https://globalnews.ca/news/9934027/your-saskatchewan-photo-of-the-day-september-2023/,neutral,0.05792735,0.009367172,0.9327056,0.0032678290750181027
Global,2023-09-04,Return to school more expensive this September,https://globalnews.ca/video/9937400/return-to-school-more-expensive-this-september/,negative,0.012275459,0.7776522,0.21007213,-0.6045924232592466
Global,2023-09-04,Ask an Expert: Back-to-school safety tips,https://globalnews.ca/video/9936942/ask-an-expert-back-to-school-safety-tips/,neutral,0.08832343,0.03528503,0.8763915,0.006555998593406942
Global,2023-09-04,Most say they support LGBTQ2 Canadians: Poll,https://globalnews.ca/video/9937243/most-say-they-support-lgbtq2-canadians-poll/,neutral,0.15151957,0.012036079,0.8364444,0.022813307613333222
Global,2023-09-04,Canada wildfires: How labour shortages will impact reconstruction,https://globalnews.ca/video/9937123/canada-wildfires-how-labour-shortages-will-impact-reconstruction/,negative,0.012829616,0.5357186,0.4514517,-0.2868298876940294
Global,2023-09-04,Nova Scotia ceremony marks 25th anniversary of deadly Swissair crash,https://globalnews.ca/news/9937191/nova-scotia-ceremony-marks-25th-anniversary-swissair-crash/,negative,0.013660325,0.6960224,0.29031736,-0.484260524430141
Global,2023-09-04,Ceremony held in Peggy’s Cove to mark 25 years since the Swissair flight crash,https://globalnews.ca/video/9937269/ceremony-held-in-peggys-cove-to-mark-25-years-since-the-swissair-flight-crash/,neutral,0.043741148,0.16814162,0.7881172,-0.026358322892058084
Global,2023-09-04,More Guelph police officers to be deployed for first week of school,https://globalnews.ca/news/9934526/more-guelph-police-officers-to-be-deployed-for-first-week-of-school/,neutral,0.060542066,0.016501313,0.9229567,0.0033930448320340645
Global,2023-09-04,Bières et Saveurs de Chambly shows Quebec’s craft beer and spirits scene is booming,https://globalnews.ca/news/9937190/bieres-et-saveurs-de-chambly-shows-quebecs-craft-beer-and-spirits-scene-is-booming/,positive,0.8616984,0.0038931405,0.1344086,0.7425088549232441
Global,2023-09-04,Manitoba election: Campaigns heat up with 1 month left to go,https://globalnews.ca/video/9937429/manitoba-election-campaigns-heat-up-with-1-month-left-to-go/,neutral,0.060804687,0.0349519,0.90424335,0.002475576394245227
Global,2023-09-04,"UBC study: What happens when you give homeless people $7,500?",https://globalnews.ca/news/9933830/give-bc-homeless-people-7500-study/,neutral,0.019595487,0.14920084,0.8312037,-0.021876904141194586
Global,2023-09-04,Winnipeg’s Rainbow Community Garden grows connections and weeds out food inflation,https://globalnews.ca/news/9937260/winnipegs-rainbow-community-garden/,positive,0.3873891,0.010234644,0.6023762,0.14996557296786506
Global,2023-09-04,Swissair Flight 111: Nova Scotia marks 25 years since air disaster,https://globalnews.ca/video/9937425/swissair-flight-111-nova-scotia-marks-25-years-since-air-disaster/,negative,0.026718736,0.49988344,0.47339788,-0.24916953766270122
Global,2023-09-04,Saskatchewan joins New Brunswick in gender pronoun policy,https://globalnews.ca/video/9937430/saskatchewan-joins-new-brunswick-in-gender-pronoun-policy/,neutral,0.03042504,0.05295669,0.91661817,-0.001878730171778753
Global,2023-09-04,"Most say they support LGBTQ2S+ Canadians, but actions don’t line up: poll",https://globalnews.ca/news/9936840/support-allyship-lgbtq2s-canada-poll/,negative,0.017054463,0.41383657,0.569109,-0.1709698269634039
Global,2023-09-04,"Shooting at Ottawa wedding leaves 2 dead, 6 injured",https://globalnews.ca/video/9937106/shooting-at-ottawa-wedding-leaves-2-dead-6-injured/,negative,0.006778306,0.77330154,0.21992007,-0.597949397742628
Global,2023-09-04,N.S. RCMP search for boater missing from Cumberland County,https://globalnews.ca/news/9937224/cumberland-county-missing-boater-tidnish-river-rcmp/,neutral,0.021424437,0.11356318,0.8650124,-0.012437587366930458
Global,2023-09-04,"Canadians want urgent climate action, but high cost of living stands in the way: poll",https://globalnews.ca/video/9935199/canadians-want-urgent-climate-action-but-high-cost-of-living-stands-in-the-way-poll/,negative,0.014124615,0.72904354,0.25683182,-0.5313049828581633
Global,2023-09-04,Canada basketball punches its ticket to 2024 Paris Olympics with stunning win over Spain,https://globalnews.ca/video/9937428/canada-basketball-punches-its-ticket-to-2024-paris-olympics-with-stunning-win-over-spain/,positive,0.8044102,0.002334038,0.19325583,0.647070269250194
Global,2023-09-04,Francophone school district requests more funding as enrollment increases,https://globalnews.ca/video/9937270/francophone-school-district-requests-more-funding-as-enrollment-increases/,positive,0.34731606,0.0060435706,0.6466403,0.12059193853980332
Global,2023-09-04,Burning Man festival turns into muddy nightmare,https://globalnews.ca/video/9937436/burning-man-festival-turns-into-muddy-nightmare/,negative,0.01590725,0.8339604,0.15013228,-0.6952369930542579
Global,2023-09-04,Trudeau to sign strategic partnership with ASEAN trading bloc,https://globalnews.ca/news/9937611/trudeau-asea-strategic-partnership/,neutral,0.18342684,0.009153742,0.8074193,0.03356163624467001
Global,2023-09-04,Flights delayed at YVR after Air Canada plane hits another on the tarmac,https://globalnews.ca/news/9937377/flights-delayed-at-yvr/,negative,0.010106237,0.4777351,0.51215863,-0.2281287057872916
Global,2023-09-04,Ontario housing minister resigns amid Greenbelt land swap scandal,https://globalnews.ca/news/9937642/steve-clark-resign-greenbelt-land-swap/,negative,0.008777444,0.66190845,0.3293141,-0.4380457497470047
Global,2023-09-04,Family vlogger Ruby Franke arrested after malnourished son escapes home,https://globalnews.ca/news/9934179/ruby-franke-child-abuse-arrest-jodi-hildebrandt/,negative,0.011899008,0.55081093,0.43729,-0.30325113008975535
Global,2023-09-04,"Two Killings, the same day, one year apart: Why James Smith Cree Nation mourns",https://globalnews.ca/video/9936823/two-killings-the-same-day-one-year-apart-why-james-smith-cree-nation-mourns/,negative,0.008907906,0.76168174,0.22941042,-0.5800796591973159
Global,2023-09-04,New francophone elementary school in Moncton nears capacity days before opening,https://globalnews.ca/news/9937114/new-francophone-elementary-school-moncton/,neutral,0.06054911,0.037678704,0.90177226,0.0022465083289766596
Global,2023-09-04,"Hundreds celebrate LGBTQ2 joy, resilience in Calgary Pride Parade",https://globalnews.ca/news/9937012/calgary-pride-parade-2023/,positive,0.9654294,0.0021233447,0.032447137,0.9320495454273461
Global,2023-09-04,"Convoy plans to defy evacuation order, enter Yellowknife",https://globalnews.ca/video/9933636/convoy-plans-to-defy-evacuation-order-enter-yellowknife/,negative,0.007911311,0.59325135,0.39883736,-0.35188455486031955
Global,2023-09-04,Saskatchewan TikTok star receives life-saving surgery,https://globalnews.ca/news/9937086/saskatchewan-tiktok-star-bella-brave-surgery/,positive,0.47802055,0.0075436067,0.5144358,0.2284467533108714
Global,2023-09-04,Tourists sprint toward bear and cubs in Yellowstone National Park,https://globalnews.ca/video/9924390/tourists-sprint-toward-bear-and-cubs-in-yellowstone-national-park/,neutral,0.20385522,0.008207791,0.7879369,0.04148959300896138
Global,2023-09-04,‘Freedom Convoy’ organizers Tamara Lich and Chris Barber’s trial begins on Tuesday,https://globalnews.ca/news/9937624/freedom-convoy-trial-preview/,neutral,0.035448696,0.021283,0.94326836,0.0008036431703273283
Global,2023-09-04,"Two men dead after their vehicles collided near Lansdowne, N.B., early Saturday",https://globalnews.ca/news/9937237/two-men-dead-vehicles-collided-lansdowe-new-brunswick/,negative,0.0105654895,0.631196,0.35823837,-0.39829684352107364
Global,2023-09-04,‘Get the shovels on the ground’: Ontario Premier Ford doubles down on Greenbelt plans,https://globalnews.ca/video/9933629/get-the-shovels-on-the-ground-ontario-premier-ford-doubles-down-on-greenbelt-plans/,neutral,0.16806313,0.01284634,0.81909055,0.028080186339184188
Global,2023-09-04,Death at Burning Man under investigation as flooding strands thousands,https://globalnews.ca/news/9936821/burning-man-nevada-death-investigation-flooding/,negative,0.007880313,0.7965814,0.19553818,-0.6344798896086985
CTV,2023-09-04,"Faulty trunk latches prompt recall of nearly 20,000 Kia vehicles in Canada",https://www.ctvnews.ca/autos/faulty-trunk-latches-prompt-recall-of-nearly-20-000-kia-vehicles-in-canada-1.6543824,negative,0.00831837,0.7332568,0.25842482,-0.5375963642875909
CTV,2023-09-04,Winnipeg family frustrated with illegal dumping,https://winnipeg.ctvnews.ca/winnipeg-family-frustrated-with-illegal-dumping-1.6546880,negative,0.008917786,0.76584834,0.2252336,-0.5864443421788854
CTV,2023-09-04,"Online News Act could see Google, Meta pay combined $230 million to Canadian media",https://www.ctvnews.ca/canada/online-news-act-could-see-google-meta-pay-combined-230-million-to-canadian-media-1.6544576,neutral,0.08579262,0.07356469,0.8406426,0.0019486115017874894
CTV,2023-09-04,What’s open and closed in London this Labour Day Monday,https://london.ctvnews.ca/what-s-open-and-closed-in-london-this-labour-day-monday-1.6544850,neutral,0.041724604,0.011479267,0.94679606,0.0016091711406693854
CTV,2023-09-04,Flights delayed after one plane hits another on tarmac at YVR,https://bc.ctvnews.ca/flights-delayed-after-one-plane-hits-another-on-tarmac-at-yvr-1.6546934,negative,0.010563066,0.46853334,0.5209036,-0.21941190942436606
CTV,2023-09-04,Dark sky designation: Quebec's Mont-Tremblant Park is officially star gazers' paradise,https://montreal.ctvnews.ca/dark-sky-designation-quebec-s-mont-tremblant-park-is-officially-star-gazers-paradise-1.6541540,positive,0.45245674,0.009746676,0.5377966,0.20462209307245516
CTV,2023-09-04,Beyonce shines bright among Hollywood stars during Renaissance concert tour stop in Los Angeles,https://www.ctvnews.ca/entertainment/beyonce-shines-bright-among-hollywood-stars-during-renaissance-concert-tour-stop-in-los-angeles-1.6546696,positive,0.9555818,0.0015967629,0.0428213,0.9131341567046454
CTV,2023-09-04,"Back-to-office plans fall flat amid arbitrary rules, lack of communication",https://www.ctvnews.ca/business/back-to-office-plans-fall-flat-amid-arbitrary-rules-lack-of-communication-1.6547157,negative,0.010880413,0.78300923,0.20611027,-0.6129851416703289
CTV,2023-09-04,"At rock bottom in the polls, the Quebec Liberal Party goes on the offensive",https://montreal.ctvnews.ca/at-rock-bottom-in-the-polls-the-quebec-liberal-party-goes-on-the-offensive-1.6547181,negative,0.010845533,0.78075016,0.20840429,-0.6094531909256986
CTV,2023-09-04,"What's behind Canada's housing crisis? Decades of policy failures, says former deputy PM",https://www.ctvnews.ca/business/what-s-behind-canada-s-housing-crisis-decades-of-policy-failures-says-former-deputy-pm-1.6544653,negative,0.006054176,0.8489773,0.14496845,-0.7207258997016766
CTV,2023-09-04,Evacuations ordered in B.C. Interior due to Wells Creek wildfire,https://www.ctvnews.ca/canada/evacuations-ordered-in-b-c-interior-due-to-wells-creek-wildfire-1.6546388,negative,0.01947355,0.23390459,0.74662197,-0.05433211337554944
CTV,2023-09-04,The Canadian International Air Show has roared over the city this weekend. Here’s why some Torontonians aren’t happy about it,https://toronto.ctvnews.ca/the-canadian-international-air-show-has-roared-over-the-city-this-weekend-here-s-why-some-torontonians-aren-t-happy-about-it-1.6546454,negative,0.011041915,0.81770605,0.17125204,-0.6685212332718145
CTV,2023-09-04,Zimbabwean president at his inauguration says the disputed election reveals a 'mature democracy',https://www.ctvnews.ca/world/zimbabwean-president-at-his-inauguration-says-the-disputed-election-reveals-a-mature-democracy-1.6547194,neutral,0.21870479,0.011220881,0.77007425,0.0477058922619964
CTV,2023-09-04,4 astronauts return to Earth in SpaceX capsule to wrap up 6-month station mission,https://www.ctvnews.ca/sci-tech/4-astronauts-return-to-earth-in-spacex-capsule-to-wrap-up-6-month-station-mission-1.6547129,neutral,0.18824457,0.0067320666,0.80502343,0.03539068527842204
CTV,2023-09-04,Six students from the same Toronto high school graduate with 100 per cent grades,https://toronto.ctvnews.ca/six-students-from-the-same-toronto-high-school-graduate-with-100-per-cent-grades-1.6538542,positive,0.38934737,0.0124947615,0.59815794,0.1514352249453399
CTV,2023-09-04,Wildfire sparks in Coquitlam watershed,https://bc.ctvnews.ca/wildfire-sparks-in-coquitlam-watershed-1.6547204,negative,0.019336224,0.24883196,0.73183167,-0.061543487766758886
CTV,2023-09-04,Coco Gauff is the 1st US teen since Serena Williams to reach consecutive U.S. Open quarterfinals,https://www.ctvnews.ca/sports/coco-gauff-is-the-1st-us-teen-since-serena-williams-to-reach-consecutive-u-s-open-quarterfinals-1.6547008,positive,0.23420393,0.0036173793,0.7621787,0.05483839073288799
CTV,2023-09-04,"Regina woman who suffered stroke getting voice back thanks to A.I., brain implant",https://regina.ctvnews.ca/regina-woman-who-suffered-stroke-getting-voice-back-thanks-to-a-i-brain-implant-1.6535074,neutral,0.10101277,0.12909696,0.76989025,-0.006462445675035511
CTV,2023-09-04,Canada's Leylah Fernandez and partner Taylor Townsend advance at U.S. Open,https://www.ctvnews.ca/sports/canada-s-leylah-fernandez-and-partner-taylor-townsend-advance-at-u-s-open-1.6546754,neutral,0.106492445,0.0026355446,0.89087194,0.01133370167627712
CTV,2023-09-04,Regina athletes keeping skills sharp in Labour Day weekend HoopLife camp,https://regina.ctvnews.ca/regina-athletes-keeping-skills-sharp-in-labour-day-weekend-hooplife-camp-1.6547001,positive,0.518584,0.0036616782,0.47775438,0.2689159244968753
CTV,2023-09-04,"Hit-and-run pedestrian collision in northwest Calgary leaves man dead; police locate, arrest suspect",https://calgary.ctvnews.ca/hit-and-run-pedestrian-collision-in-northwest-calgary-leaves-man-dead-police-locate-arrest-suspect-1.6547171,negative,0.01294154,0.5559886,0.4310698,-0.3089558831461048
CTV,2023-09-04,98-year old N.S. woman defends her 1936 spelling bee title,https://atlantic.ctvnews.ca/98-year-old-n-s-woman-defends-her-1936-spelling-bee-title-1.6534452,neutral,0.17101087,0.012614323,0.8163749,0.029085581201307775
CTV,2023-09-04,'The Last of Us' picks up awards for its filming locations in Alberta,https://calgary.ctvnews.ca/the-last-of-us-picks-up-awards-for-its-filming-locations-in-alberta-1.6538808,positive,0.24706338,0.0058617275,0.74707484,0.06100596635791433
CTV,2023-09-04,No emergency text alerts? Questions surround lack of fire warnings in Shuswap,https://bc.ctvnews.ca/no-emergency-text-alerts-questions-surround-lack-of-fire-warnings-in-shuswap-1.6537336,negative,0.011822686,0.5102108,0.47796652,-0.2601752816751546
CTV,2023-09-04,Annual CCM Summer Shootout hockey tournament brings 24 teams to Moncton,https://atlantic.ctvnews.ca/annual-ccm-summer-shootout-hockey-tournament-brings-24-teams-to-moncton-1.6546701,neutral,0.069843076,0.0056501236,0.92450684,0.004846128501636571
CTV,2023-09-04,"Retired journalist reflects on covering Swissair Flight 111 disaster off Nova Scotia, 25 years later",https://atlantic.ctvnews.ca/retired-journalist-reflects-on-covering-swissair-flight-111-disaster-off-nova-scotia-25-years-later-1.6546419,neutral,0.03110394,0.17166632,0.7972298,-0.028501859266024
CTV,2023-09-04,Kia recalls cars in U.S. to fix trunk latch that could trap people,https://www.ctvnews.ca/business/kia-recalls-cars-in-u-s-to-fix-trunk-latch-that-could-trap-people-1.6542614,negative,0.015674535,0.50810736,0.47621804,-0.2579274319464133
CTV,2023-09-04,"2 Toronto men dead, 6 people hurt in shooting outside Ottawa wedding",https://ottawa.ctvnews.ca/2-toronto-men-dead-6-people-hurt-in-shooting-outside-ottawa-wedding-1.6546385,negative,0.0099392645,0.5717223,0.4183384,-0.3267676490773752
CTV,2023-09-04,What's open and closed this Labour Day weekend in the area?,https://kitchener.ctvnews.ca/what-s-open-and-closed-this-labour-day-weekend-in-the-area-1.6545865,neutral,0.056951143,0.010288591,0.93276006,0.003137587348715165
CTV,2023-09-04,'School might not be on their radar at the moment': Back-to-class will look different in Shuswap area,https://bc.ctvnews.ca/school-might-not-be-on-their-radar-at-the-moment-back-to-class-will-look-different-in-shuswap-area-1.6547050,negative,0.021778516,0.30235884,0.6758626,-0.09094656992605188
CTV,2023-09-04,U.S. students transform their drab dorm rooms into comfy living spaces,https://www.ctvnews.ca/lifestyle/u-s-students-transform-their-drab-dorm-rooms-into-comfy-living-spaces-1.6546477,positive,0.23621239,0.041397292,0.72239035,0.0540825507976983
CTV,2023-09-04,Labour groups in Moncton share common message this long weekend,https://atlantic.ctvnews.ca/labour-groups-in-moncton-share-common-message-this-long-weekend-1.6546804,neutral,0.08330715,0.01626452,0.9004284,0.006675540621173148
CTV,2023-09-04,Man in critical condition after being stabbed downtown Montreal,https://montreal.ctvnews.ca/man-in-critical-condition-after-being-stabbed-downtown-montreal-1.6547198,negative,0.023548761,0.63335,0.3431011,-0.40057775049633015
CTV,2023-09-04,'Freedom Convoy' organizers' criminal trial begins Tuesday,https://www.ctvnews.ca/canada/freedom-convoy-organizers-criminal-trial-begins-tuesday-1.6547121,neutral,0.022995349,0.20437686,0.7726278,-0.04124111795232732
CTV,2023-09-04,UAW's clash with Big 3 automakers shows off a more confrontational union as strike deadline looms,https://www.ctvnews.ca/business/uaw-s-clash-with-big-3-automakers-shows-off-a-more-confrontational-union-as-strike-deadline-looms-1.6547152,negative,0.031201072,0.2769625,0.6918364,-0.07573472114489554
CTV,2023-09-04,N.W.T. officials set to share details about lifting of Yellowknife evacuation order,https://www.ctvnews.ca/climate-and-environment/n-w-t-officials-set-to-share-details-about-lifting-of-yellowknife-evacuation-order-1.6545716,neutral,0.02671407,0.014365227,0.9589207,0.000507281605439891
CTV,2023-09-04,Calgary Hitmen training camp a wrap; pre-season play starts later this week,https://calgary.ctvnews.ca/calgary-hitmen-training-camp-a-wrap-pre-season-play-starts-later-this-week-1.6547185,neutral,0.083148204,0.0039376607,0.9129143,0.0068981074011560395
CTV,2023-09-04,How Tamara Lich transformed from spokeswoman to symbol of 'Freedom Convoy' movement,https://www.ctvnews.ca/canada/how-tamara-lich-transformed-from-spokeswoman-to-symbol-of-freedom-convoy-movement-1.6546406,neutral,0.10532248,0.016870866,0.87780654,0.010808208677892672
CTV,2023-09-04,"Household debt rises to $2.34 trillion in Canada as average credit card balance jumps to $4,000: TransUnion report",https://www.ctvnews.ca/business/household-debt-rises-to-2-34-trillion-in-canada-as-average-credit-card-balance-jumps-to-4-000-transunion-report-1.6545592,neutral,0.07853773,0.09060113,0.83086103,-0.002040390850091889
CTV,2023-09-04,Cape Breton teen to represent Canada at World Cup of Darts in Denmark,https://atlantic.ctvnews.ca/cape-breton-teen-to-represent-canada-at-world-cup-of-darts-in-denmark-1.6546488,neutral,0.099511765,0.0076710903,0.89281714,0.009843746455655555
CTV,2023-09-04,N.W.T. officials prepare to welcome back residents of Yellowknife and other communities,https://www.ctvnews.ca/canada/n-w-t-officials-prepare-to-welcome-back-residents-of-yellowknife-and-other-communities-1.6546058,positive,0.24159087,0.0053068637,0.75310206,0.05833803253564085
CTV,2023-09-04,Will updated COVID vaccines work against latest variant? Canadian scientists monitor global research,https://www.ctvnews.ca/health/coronavirus/will-updated-covid-vaccines-work-against-latest-variant-canadian-scientists-monitor-global-research-1.6544101,neutral,0.05416605,0.035740577,0.9100933,0.001656573252617477
CTV,2023-09-04,"Labour Day Battle of Alberta chance for Elks, Stampeders to generate needed momentum",https://calgary.ctvnews.ca/labour-day-battle-of-alberta-chance-for-elks-stampeders-to-generate-needed-momentum-1.6546901,positive,0.22535141,0.01467064,0.759978,0.050568020040528516
CTV,2023-09-04,Ukraine's defense minister resigns following Zelenskyy's announcement of his replacement,https://www.ctvnews.ca/world/ukraine-s-defense-minister-resigns-following-zelenskyy-s-announcement-of-his-replacement-1.6547150,negative,0.012174775,0.41609892,0.5717262,-0.17299012401872815
CTV,2023-09-04,Small B.C. athlete wins big at 2023 World Dwarf Games,https://vancouverisland.ctvnews.ca/small-b-c-athlete-wins-big-at-2023-world-dwarf-games-1.6546990,positive,0.82832867,0.0028461087,0.16882508,0.6861203943018657
CTV,2023-09-04,Copenhagen mayor urges foreigners to stop buying marijuana at city's drug oasis following shooting,https://www.ctvnews.ca/world/copenhagen-mayor-urges-foreigners-to-stop-buying-marijuana-at-city-s-drug-oasis-following-shooting-1.6547154,negative,0.010681476,0.47197977,0.51733875,-0.2226508065181747
CTV,2023-09-04,Parents worried about new supervised drug-use site near Montreal elementary school,https://montreal.ctvnews.ca/parents-worried-about-new-supervised-drug-use-site-near-montreal-elementary-school-1.6547104,negative,0.015906371,0.30659762,0.6774961,-0.09374907100870189
CTV,2023-09-04,"Air quality statements remain for Regina, southern Sask. due to intense wildfire smoke",https://regina.ctvnews.ca/air-quality-statements-remain-for-regina-southern-sask-due-to-intense-wildfire-smoke-1.6546557,negative,0.018781228,0.4231293,0.5580894,-0.17868571051256055
CTV,2023-09-04,"CSIS disinformation campaign leans on Soviet imagery, as Ottawa tracks 'grey media'",https://www.ctvnews.ca/politics/csis-disinformation-campaign-leans-on-soviet-imagery-as-ottawa-tracks-grey-media-1.6545974,negative,0.006433706,0.76795715,0.22560899,-0.5897168949802127
CTV,2023-09-04,Search for missing 57-year-old ATV rider in northern Ont.,https://northernontario.ctvnews.ca/search-for-missing-57-year-old-atv-rider-in-northern-ont-1.6546595,neutral,0.018051097,0.10876764,0.87318134,-0.011504550811388015
CTV,2023-09-04,Canada shut its land border to asylum seekers. More refugees came anyway,https://www.ctvnews.ca/canada/canada-shut-its-land-border-to-asylum-seekers-more-refugees-came-anyway-1.6546267,negative,0.033359345,0.33975023,0.6268903,-0.11431740937130996
CTV,2023-09-04,Pope acknowledges his Russia comments were faulty,https://www.ctvnews.ca/world/pope-acknowledges-his-russia-comments-were-faulty-1.6547193,negative,0.008508218,0.74579245,0.24569915,-0.5561341295341657
CTV,2023-09-04,"Green buildings, leaky pavement and trees could help cities meet net zero carbon emissions: study",https://www.ctvnews.ca/climate-and-environment/green-buildings-leaky-pavement-and-trees-could-help-cities-meet-net-zero-carbon-emissions-study-1.6545806,positive,0.4161674,0.024201114,0.55963147,0.1726096172244027
CTV,2023-09-04,'It's a great time to come out for the family!' Kids' Day at the Fall Fair,https://winnipeg.ctvnews.ca/it-s-a-great-time-to-come-out-for-the-family-kids-day-at-the-fall-fair-1.6547164,positive,0.9790145,0.0014314948,0.019553946,0.9584674442196766
CTV,2023-09-04,Steve Clark resigns as Ontario housing minister,https://toronto.ctvnews.ca/steve-clark-resigns-as-ontario-housing-minister-1.6547142,negative,0.017237138,0.3489416,0.6338213,-0.1214631078492534
CTV,2023-09-04,Smoke covers Edmonton for much of the long weekend,https://edmonton.ctvnews.ca/smoke-covers-edmonton-for-much-of-the-long-weekend-1.6546950,neutral,0.07994585,0.025837947,0.89421606,0.005723746887573711
CTV,2023-09-04,Sask. woman with terminal cancer seeks new home for 3 dogs,https://regina.ctvnews.ca/sask-woman-with-terminal-cancer-seeks-new-home-for-3-dogs-1.6541793,negative,0.022339256,0.48111612,0.4965446,-0.23097368849580135
CTV,2023-09-04,"Most-read stories of the week: Pride flags stolen, craft brewery struggles, kitten found during traffic stop",https://kitchener.ctvnews.ca/most-read-stories-of-the-week-pride-flags-stolen-craft-brewery-struggles-kitten-found-during-traffic-stop-1.6546555,negative,0.08525629,0.25657058,0.6581732,-0.05855981297006174
CTV,2023-09-04,"A massive wildfire in northeastern Greece is gradually abating, with over 700 firefighters deployed",https://www.ctvnews.ca/world/a-massive-wildfire-in-northeastern-greece-is-gradually-abating-with-over-700-firefighters-deployed-1.6547139,negative,0.04640377,0.34910783,0.6044883,-0.11972299576053835
CTV,2023-09-04,Riders edge Bombers in overtime thriller to take 58th Labour Day Classic,https://regina.ctvnews.ca/riders-edge-bombers-in-overtime-thriller-to-take-58th-labour-day-classic-1.6547045,neutral,0.20014824,0.0057568997,0.79409474,0.04002619914666461
CTV,2023-09-04,"HeroWork, a charity that helps other charities, to wind down operations",https://vancouverisland.ctvnews.ca/herowork-a-charity-that-helps-other-charities-to-wind-down-operations-1.6546236,neutral,0.13163579,0.088647865,0.7797164,0.00946953503246295
CTV,2023-09-04,"Raymond Moriyama, Canadian 'visionary architect,' has died",https://toronto.ctvnews.ca/raymond-moriyama-canadian-visionary-architect-has-died-1.6546019,negative,0.018425643,0.37185782,0.60971653,-0.13793873540265622
CTV,2023-09-04,'Strong defence': N.W.T. official describes fight against fires as residents gear up for Yellowknife return,https://www.ctvnews.ca/climate-and-environment/strong-defence-n-w-t-official-describes-fight-against-fires-as-residents-gear-up-for-yellowknife-return-1.6546836,positive,0.22804956,0.010142245,0.7618083,0.05190371769121782
