source,date,headline,url,chosen_label,positive,negative,neutral,compound
Global,2023-10-08,"Missing girl, 9, found thanks to kidnapper’s fingerprint on ransom note",https://globalnews.ca/news/10001048/missing-girl-charlotte-sena-found-ransom-note-fingerprint-craig-nelson-ross/,negative,0.030947201,0.23924941,0.7298033,-0.05628256205336868
Global,2023-10-08,Time to fall back: When daylight saving time 2023 ends in Canada,https://globalnews.ca/news/10002507/daylight-saving-time-ends-canada-2023/,neutral,0.076549076,0.021901777,0.90154916,0.005380072234347111
Global,2023-10-08,Canada’s industry minister is calling global CEOs in bid to boost competition,https://globalnews.ca/news/10010365/grocery-prices-competition-champagne-west-block/,neutral,0.18104374,0.0130051095,0.8059511,0.03260770945630043
Global,2023-10-08,Woman filmed during xenophobic rant against German tourists on train in New Jersey,https://globalnews.ca/video/10010180/woman-filmed-during-xenophobic-rant-against-german-tourists-fired-from-job/,negative,0.010620298,0.7148058,0.2745739,-0.5108345360529256
Global,2023-10-08,Calgary police in search of dashcam footage for missing woman investigation,https://globalnews.ca/video/10012856/calgary-police-in-search-of-dashcam-footage-for-missing-woman-investigation/,neutral,0.029546328,0.055631313,0.9148223,-0.00222185958766441
Global,2023-10-08,Sobeys issues western Canada turkey recall,https://globalnews.ca/video/10012429/sobeys-issues-western-canada-turkey-recall/,negative,0.015706258,0.26180103,0.7224926,-0.06829312803987087
Global,2023-10-08,Girl abducted on family camping trip found ‘safe’ thanks to fingerprint on ransom note,https://globalnews.ca/video/10001840/girl-abducted-on-family-camping-trip-found-safe-thanks-to-fingerprint-on-ransom-note/,neutral,0.16913816,0.02388828,0.8069736,0.02803706644585624
Global,2023-10-08,Edmonton’s Hilltop Pub damaged by fire less than a year after reopening,https://globalnews.ca/news/10012214/hilltop-pub-fire-closed-again-edmonton/,negative,0.011070911,0.6259424,0.36298668,-0.39168133444860587
Global,2023-10-08,"Manitoba election ‘momentous’ step to reconciliation, says Jody Wilson-Raybould",https://globalnews.ca/news/10011099/manitoba-election-reconciliation-jody-wilson-raybould/,positive,0.24261561,0.006774997,0.75060934,0.05881644793486274
Global,2023-10-08,"‘I kept saying it, I’m going to die,’ Vancouverite pleads for help getting out of Tel Aviv",https://globalnews.ca/video/10012301/i-kept-saying-it-im-going-to-die-vancouverite-pleads-for-help-getting-out-of-tel-aviv/,negative,0.017335301,0.7505736,0.2320911,-0.5630602016098489
Global,2023-10-08,Montreal food banks face obstacles ahead of Thanksgiving,https://globalnews.ca/video/10012181/montreal-food-banks-face-obstacles-ahead-of-thanksgiving/,negative,0.017644577,0.572344,0.41001144,-0.32726631230075043
Global,2023-10-08,Food banks needs balloon over long weekend: ‘Most challenging Thanksgiving’,https://globalnews.ca/news/10012601/10012601-food-bank-demand-thanksgiving/,negative,0.044778097,0.36069933,0.59452254,-0.1280989340382117
Global,2023-10-08,‘Unacceptable’: N.B. man finds 2 homeless people sleeping on his back step,https://globalnews.ca/news/10011700/moncton-man-finds-two-homeless-people-sleeping-back-step/,negative,0.005880249,0.8034184,0.19070132,-0.6454465805596943
Global,2023-10-08,B.C. man missing in southern Israel amid Hamas attacks on region,https://globalnews.ca/news/10012757/bc-man-missing-southern-israel/,negative,0.009835396,0.51594037,0.4742242,-0.2660977279863914
Global,2023-10-08,"Police in Lethbridge warn of ‘high-risk incident,’ public told to avoid area",https://globalnews.ca/news/10012902/lethbridge-high-risk-incident-oct-8-2023/,negative,0.01012799,0.42134956,0.56852245,-0.17743287150216247
Global,2023-10-08,Feds’ plan to boost grocery store competition: Canada’s industry minister,https://globalnews.ca/video/10012827/feds-plans-to-boost-grocery-store-competition-canadas-industry-minister/,neutral,0.14000663,0.013258375,0.84673506,0.01942606502466404
Global,2023-10-08,"On Thanksgiving, Montreal community groups grateful to public despite challenges",https://globalnews.ca/news/10012115/thanksgiving-montreal-challenges-foodbanks/,positive,0.8907977,0.0054705455,0.10373199,0.7934903589151361
Global,2023-10-08,"Israel facing security ‘earthquake’ and ‘battle for national survival,’ expert says",https://globalnews.ca/news/10012632/israel-hamas-attack-security-earthquake/,negative,0.018051839,0.25234926,0.72959876,-0.06335431398671432
Global,2023-10-08,Jays GM addresses post-season defeat,https://globalnews.ca/video/10012380/jays-gm-addresses-post-season-defeat/,negative,0.015256681,0.3347174,0.65002596,-0.11180295752945213
Global,2023-10-08,Quebec company Deep Sky has ambitious plans to help reverse climate change,https://globalnews.ca/video/10012178/quebec-company-deep-sky-has-ambitious-plans-to-help-reverse-climate-change/,positive,0.56283784,0.010153806,0.42700836,0.31668331641670555
Global,2023-10-08,Okanagan equestrian team jumps toward Olympic aspirations,https://globalnews.ca/news/10012243/kelowna-equestrian-olympic-dream/,positive,0.38320294,0.0047170613,0.61207986,0.1468222992169288
Global,2023-10-08,Municipalities looking to build ‘sponge cities’ for extreme rain events. What does that mean?,https://globalnews.ca/news/10012631/municipalities-looking-to-build-sponge-cities-for-extreme-rain-events-what-does-that-mean/,negative,0.020778183,0.25039977,0.728822,-0.06226832494793655
Global,2023-10-08,Family describes night Alberta couple was killed by bear in Banff National Park,https://globalnews.ca/video/10005924/family-describes-night-alberta-couple-was-killed-by-bear-in-banff-national-park/,negative,0.010345494,0.64736533,0.34228915,-0.41897484286715425
Global,2023-10-08,Israel-Gaza conflict: Expert unpacks what might be next as situation escalates,https://globalnews.ca/video/10012400/israel-gaza-conflict-expert-unpacks-what-might-be-next-as-situation-escalates/,negative,0.01687987,0.2834804,0.6996398,-0.08007619502777175
Global,2023-10-08,Global grocery CEOs called in bid to boost competition: Canada’s industry minister,https://globalnews.ca/video/10012003/global-grocery-ceos-called-in-bid-to-boost-competition-canadas-industry-minister/,neutral,0.16271351,0.011799976,0.8254865,0.02633645229920134
Global,2023-10-08,5 things to know about Hamas’s deadly attack on Israel,https://globalnews.ca/news/10012140/israel-attack-what-to-know/,negative,0.01614313,0.6805859,0.30327103,-0.4629365351282999
Global,2023-10-08,"Manitoba election ‘momentous’ step to reconciliation, says Jody Wilson-Raybould",https://globalnews.ca/video/10012014/manitoba-election-momentous-step-to-reconciliation-says-jody-wilson-raybould/,positive,0.24261561,0.006774997,0.75060934,0.05881644793486274
Global,2023-10-08,Volunteers in desperate race to rescue stranded salmon,https://globalnews.ca/video/10012303/volunteers-in-desperate-race-to-rescue-stranded-salmon/,neutral,0.08892249,0.14311923,0.7679583,-0.01257590405025244
Global,2023-10-08,Police step up downtown Toronto presence amidst threat of convoy protest,https://globalnews.ca/news/10012669/toronto-police-queens-park-protest-thanksgiving/,neutral,0.03747665,0.07428118,0.8882421,-0.004113195714037232
Global,2023-10-08,"The West Block: Oct. 8, 2023 |  Fallout from surprise Hamas attack in Israel and federal plan to lower grocery prices",https://globalnews.ca/video/10012812/the-west-block-oct-8-2023-fallout-from-surprise-hamas-attack-in-israel-and-federal-plan-to-lower-grocery-prices/,negative,0.0152582005,0.42470363,0.5600382,-0.18014034683099212
Global,2023-10-08,‘Bear attack bad’: Harrowing final message from Alberta couple killed by grizzly,https://globalnews.ca/news/10005074/bear-attack-bad-harrowing-final-message-from-alberta-couple-killed-by-grizzly/,negative,0.00441024,0.8787221,0.116867505,-0.7721331655435497
Global,2023-10-08,"The West Block – Episode 4, Season 13",https://globalnews.ca/news/10012677/the-west-block-episode-4-season-13/,neutral,0.04115712,0.009501331,0.9493415,0.0016036355186486162
Global,2023-10-08,Israeli Prime Minister declares the country ‘at war’,https://globalnews.ca/video/10011844/israeli-prime-minister-declares-the-country-at-war/,negative,0.008964758,0.7237022,0.26733297,-0.5236645385244003
Global,2023-10-08,Israel death toll soars as U.S. military shifts to ‘deterrence posture’,https://globalnews.ca/news/10012579/israel-hamas-attack-day-two/,negative,0.0063498816,0.80689615,0.18675403,-0.6510410405359881
Global,2023-10-08,Israel-Gaza conflict: International reactions pour in as death toll climbs,https://globalnews.ca/video/10012391/israel-gaza-conflict-international-reactions-pour-in-as-death-toll-climbs/,negative,0.008247043,0.74890894,0.24284385,-0.5607967260584035
CTV,2023-10-08,Barrie could reach 50 millimetres of rain as warnings persist,https://barrie.ctvnews.ca/barrie-could-reach-50-millimetres-of-rain-as-warnings-persist-1.6593977,negative,0.030570582,0.2704335,0.69899595,-0.07219970605311765
CTV,2023-10-08,South Bruce Peninsula replaces 'disgraced' mayor,https://london.ctvnews.ca/south-bruce-peninsula-replaces-disgraced-mayor-1.6594011,negative,0.0048474255,0.9073287,0.0878239,-0.8232218907041826
CTV,2023-10-08,Health care a priority for Man. premier-designate,https://www.ctvnews.ca/video?playlistId=1.6548407,positive,0.47871417,0.012323868,0.508962,0.22901537727719656
CTV,2023-10-08,"Trudeau, Poilievre condemn Hamas attack on Israel; Ambassador to Canada calls violence 'unimaginable'",https://www.ctvnews.ca/politics/trudeau-poilievre-condemn-hamas-attack-on-israel-ambassador-to-canada-calls-violence-unimaginable-1.6593134,negative,0.009720482,0.66013306,0.33014655,-0.43568109617422124
CTV,2023-10-08,Sask. man in court battle with crypto exchange lost over $240K to fraud,https://regina.ctvnews.ca/sask-man-in-court-battle-with-crypto-exchange-lost-over-240k-to-fraud-1.6590663,negative,0.009331115,0.7746093,0.21605943,-0.5999326430367429
CTV,2023-10-08,'For the safety of my family': MLHU vaccine clinic full on opening weekend,https://london.ctvnews.ca/for-the-safety-of-my-family-mlhu-vaccine-clinic-full-on-opening-weekend-1.6593992,positive,0.3174416,0.00735061,0.6752078,0.10071513642636454
CTV,2023-10-08,Worst road in Quebec? Locals plant flowers in giant potholes,https://montreal.ctvnews.ca/worst-road-in-quebec-locals-plant-flowers-in-giant-potholes-1.6593224,negative,0.008105014,0.91463053,0.077264465,-0.8364832851132578
CTV,2023-10-08,Tiger-Cats rough up slumping Riders 38-13 in CFL mismatch,https://regina.ctvnews.ca/tiger-cats-rough-up-slumping-riders-38-13-in-cfl-mismatch-1.6593704,neutral,0.051578414,0.05083979,0.8975817,7.564866650033863e-05
CTV,2023-10-08,"Terence Davies, filmmaker of the lyrical 'Distant Voices, Still Lives,' dies at the age of 77",https://www.ctvnews.ca/entertainment/terence-davies-filmmaker-of-the-lyrical-distant-voices-still-lives-dies-at-the-age-of-77-1.6593786,neutral,0.054228637,0.07086355,0.8749078,-0.0020808982566620227
CTV,2023-10-08,Over a dozen minor injuries after footbridge collapses northeast of Quebec City,https://montreal.ctvnews.ca/over-a-dozen-minor-injuries-after-footbridge-collapses-northeast-of-quebec-city-1.6593907,negative,0.009394721,0.7576725,0.23293287,-0.5739792950284013
CTV,2023-10-08,"3 dead after small plane crashes in Chilliwack, B.C.",https://bc.ctvnews.ca/3-dead-after-small-plane-crashes-in-chilliwack-b-c-1.6592570,negative,0.008910403,0.694519,0.29657054,-0.4822772635775294
CTV,2023-10-08,Three dead after plane crash in Chilliwack B.C.,https://www.ctvnews.ca/video?playlistId=1.6592991,negative,0.009642086,0.6380469,0.3523111,-0.40701084691074385
CTV,2023-10-08,Trans Mountain route change will 'desecrate' sacred site: Secwepemc knowledge keeper,https://www.ctvnews.ca/politics/trans-mountain-route-change-will-desecrate-sacred-site-secwepemc-knowledge-keeper-1.6593779,negative,0.010293999,0.72586846,0.26383755,-0.5267790381502575
CTV,2023-10-08,Air Canada temporarily cancelling flights to Tel Aviv after Hamas attack on Israel,https://toronto.ctvnews.ca/air-canada-temporarily-cancelling-flights-to-tel-aviv-after-hamas-attack-on-israel-1.6593493,negative,0.008330631,0.66292346,0.32874587,-0.4393981273977854
CTV,2023-10-08,U.S. autoworkers stop expanding strikes against Detroit Three after GM makes battery plant concession,https://www.ctvnews.ca/autos/u-s-autoworkers-stop-expanding-strikes-against-detroit-three-after-gm-makes-battery-plant-concession-1.6592182,negative,0.025038067,0.26533177,0.7096302,-0.06977403901168167
CTV,2023-10-08,Why a B.C. city ended its decades-long ban on tattoo shops,https://bc.ctvnews.ca/why-a-b-c-city-ended-its-decades-long-ban-on-tattoo-shops-1.6582469,negative,0.02064882,0.36441752,0.6149337,-0.13237373744303227
CTV,2023-10-08,"Cavalry FC seize the shield, celebrate regular season title with 3-0 win over Pacific",https://calgary.ctvnews.ca/cavalry-fc-seize-the-shield-celebrate-regular-season-title-with-3-0-win-over-pacific-1.6593909,positive,0.8137503,0.0020542522,0.18419556,0.6621852410066964
CTV,2023-10-08,B.C. family rallying around little girls who lost their firefighter dad in highway crash,https://bc.ctvnews.ca/b-c-family-rallying-around-little-girls-who-lost-their-firefighter-dad-in-highway-crash-1.6579070,neutral,0.069336936,0.22851606,0.70214707,-0.04741196820318372
CTV,2023-10-08,Israel's Security Cabinet says it is at war after surprise Hamas attack. Follow live updates,https://www.ctvnews.ca/world/israel-s-security-cabinet-says-it-is-at-war-after-surprise-hamas-attack-follow-live-updates-1.6593760,negative,0.0073076417,0.7860576,0.20663466,-0.6178332165588003
CTV,2023-10-08,Most Canadians see colonialism as a modern problem: Angus Reid survey,https://www.ctvnews.ca/canada/most-canadians-see-colonialism-as-a-modern-problem-angus-reid-survey-1.6592280,negative,0.020314928,0.25697625,0.72270864,-0.06562413729826488
CTV,2023-10-08,"Conservation groups oppose B.C.'s grizzly bear framework, say it could lead to return of trophy hunting",https://bc.ctvnews.ca/conservation-groups-oppose-b-c-s-grizzly-bear-framework-say-it-could-lead-to-return-of-trophy-hunting-1.6593537,negative,0.010837984,0.60359687,0.38556507,-0.3642117681591017
CTV,2023-10-08,"Kiptum sets world marathon record in Chicago in 2:00:35, breaking Kipchoge's mark",https://www.ctvnews.ca/sports/kiptum-sets-world-marathon-record-in-chicago-in-2-00-35-breaking-kipchoge-s-mark-1.6594015,positive,0.5223026,0.005282823,0.47241455,0.27277212658026073
CTV,2023-10-08,First-time home buyers line up for new development in Barrhaven,https://ottawa.ctvnews.ca/first-time-home-buyers-line-up-for-new-development-in-barrhaven-1.6593445,neutral,0.13633728,0.009223463,0.8544393,0.01850277418017754
CTV,2023-10-08,Ahmadiyya Muslim Youth Association charity run returns to Barrie,https://barrie.ctvnews.ca/ahmadiyya-muslim-youth-association-charity-run-returns-to-barrie-1.6594020,neutral,0.07017648,0.019145994,0.9106775,0.004558171035847991
CTV,2023-10-08,Ottawa mayor condemns Hamas attack in Israel; pro-Palestine rally held downtown,https://ottawa.ctvnews.ca/ottawa-mayor-condemns-hamas-attack-in-israel-pro-palestine-rally-held-downtown-1.6593869,negative,0.02143746,0.352695,0.6258676,-0.12393417003799811
CTV,2023-10-08,'The Exorcist: Believer' takes possession of box office with US $27.2 million opening,https://www.ctvnews.ca/entertainment/the-exorcist-believer-takes-possession-of-box-office-with-us-27-2-million-opening-1.6594064,neutral,0.15613802,0.014605747,0.82925624,0.02416575278760824
CTV,2023-10-08,Make it 23 titles: Unstoppable Biles wraps up world championships comeback with 2 more gold medals,https://www.ctvnews.ca/sports/make-it-23-titles-unstoppable-biles-wraps-up-world-championships-comeback-with-2-more-gold-medals-1.6593990,positive,0.8859215,0.0018939014,0.11218458,0.7848533381675873
CTV,2023-10-08,'No excuse for inaction': Kinew says Manitoba health-care plan can go ahead without extra federal dollars,https://www.ctvnews.ca/politics/no-excuse-for-inaction-kinew-says-manitoba-health-care-plan-can-go-ahead-without-extra-federal-dollars-1.6593250,neutral,0.07237084,0.18715699,0.7404721,-0.02979021044620822
CTV,2023-10-08,"Philippe will be no Lee, but accumulating weather damage makes Nova Scotia vulnerable",https://atlantic.ctvnews.ca/philippe-will-be-no-lee-but-accumulating-weather-damage-makes-nova-scotia-vulnerable-1.6593238,negative,0.020883022,0.49662757,0.48248938,-0.24620285598593306
CTV,2023-10-08,Woman in Canada facing terrorism charge: RCMP,https://www.ctvnews.ca/canada/woman-in-canada-facing-terrorism-charge-rcmp-1.6592193,negative,0.010916084,0.45917487,0.52990913,-0.21072236159778868
CTV,2023-10-08,Lowering food prices could take months: Minister,https://www.ctvnews.ca/video?playlistId=1.6588395,negative,0.025693882,0.29745406,0.67685205,-0.08781874112961319
CTV,2023-10-08,Victoria woman inspired to realize childhood writing dream after taking daily photos on breakwater,https://vancouverisland.ctvnews.ca/victoria-woman-inspired-to-realize-childhood-writing-dream-after-taking-daily-photos-on-breakwater-1.6593481,positive,0.74710673,0.007255788,0.24563749,0.5581158098616514
CTV,2023-10-08,Max Verstappen follows up F1 title with victory in Qatar Grand Prix,https://www.ctvnews.ca/sports/max-verstappen-follows-up-f1-title-with-victory-in-qatar-grand-prix-1.6594030,positive,0.74803174,0.002514269,0.24945405,0.5595451335591477
CTV,2023-10-08,Parents want arrest after son 'deliberately kicked' in neck during Edmonton hockey game,https://edmonton.ctvnews.ca/parents-want-arrest-after-son-deliberately-kicked-in-neck-during-edmonton-hockey-game-1.6587475,negative,0.007784246,0.7560725,0.23614335,-0.571584973617945
CTV,2023-10-08,Ontario politicians condemn attack on Israel after hundreds left dead,https://toronto.ctvnews.ca/ontario-politicians-condemn-attack-on-israel-after-hundreds-left-dead-1.6593340,negative,0.005407457,0.84886515,0.14572726,-0.7205429178434528
CTV,2023-10-08,"Canada 'closely monitoring' Afghanistan after quake reportedly kills more than 2,000",https://www.ctvnews.ca/politics/canada-closely-monitoring-afghanistan-after-quake-reportedly-kills-more-than-2-000-1.6593878,negative,0.01099072,0.5770434,0.41196585,-0.33285830543366046
CTV,2023-10-08,"From Coke floats to Cronuts, going viral can have a lasting effect on a small business",https://www.ctvnews.ca/business/from-coke-floats-to-cronuts-going-viral-can-have-a-lasting-effect-on-a-small-business-1.6593966,positive,0.33036646,0.025847547,0.64378595,0.10847391254124261
CTV,2023-10-08,Knife wielding impaired driver charged,https://barrie.ctvnews.ca/knife-wielding-impaired-driver-charged-1.6593989,negative,0.01922825,0.70840806,0.27236372,-0.5014722083853158
CTV,2023-10-08,Members of Calgary Jewish community say attacks in Israel hit close to home,https://calgary.ctvnews.ca/members-of-calgary-jewish-community-say-attacks-in-israel-hit-close-to-home-1.6594026,negative,0.009845659,0.67740005,0.3127543,-0.45877387399936254
CTV,2023-10-08,Rainfall and wind warnings issued in the Maritimes ahead of Philippe,https://atlantic.ctvnews.ca/rainfall-and-wind-warnings-issued-in-the-maritimes-ahead-of-philippe-1.6593262,negative,0.024819367,0.33187923,0.64330137,-0.10952783003366662
CTV,2023-10-08,"German conservative opposition seen winning 2 state elections, with far-right making gains",https://www.ctvnews.ca/world/german-conservative-opposition-seen-winning-2-state-elections-with-far-right-making-gains-1.6594016,positive,0.5256012,0.004086678,0.47031215,0.27623991363112665
CTV,2023-10-08,'A very nice man': 93-year-old super fan gets one-on-one with Sidney Crosby,https://atlantic.ctvnews.ca/a-very-nice-man-93-year-old-super-fan-gets-one-on-one-with-sidney-crosby-1.6587325,positive,0.93282187,0.0036535473,0.063524626,0.8701432718477458
CTV,2023-10-08,21 Savage cleared to legally travel abroad with plans of international performance in London,https://www.ctvnews.ca/entertainment/21-savage-cleared-to-legally-travel-abroad-with-plans-of-international-performance-in-london-1.6593125,positive,0.40864497,0.0033802069,0.58797485,0.1669792770727252
CTV,2023-10-08,Brantford Bulldogs host home opener in newly-renovated Civic Centre,https://kitchener.ctvnews.ca/brantford-bulldogs-host-home-opener-in-newly-renovated-civic-centre-1.6593902,neutral,0.08636523,0.004358144,0.9092766,0.007439961444801746
CTV,2023-10-08,Safeway issues turkey recall on eve of Thanksgiving long weekend,https://calgary.ctvnews.ca/safeway-issues-turkey-recall-on-eve-of-thanksgiving-long-weekend-1.6592894,neutral,0.019503636,0.21562733,0.764869,-0.04611476418012472
CTV,2023-10-08,Canadians in Israel describe scenes from Hamas attack,https://www.ctvnews.ca/canada/canadians-in-israel-describe-scenes-from-hamas-attack-1.6593644,negative,0.017507507,0.37773347,0.60475916,-0.14237601833908187
CTV,2023-10-08,Kitchener storage facility fire under investigation,https://kitchener.ctvnews.ca/kitchener-storage-facility-fire-under-investigation-1.6593932,negative,0.01692626,0.25483686,0.7282368,-0.06465534688198105
CTV,2023-10-08,Regina pharmacy holds ID clinic to help those without housing access services,https://regina.ctvnews.ca/regina-pharmacy-holds-id-clinic-to-help-those-without-housing-access-services-1.6593975,neutral,0.07049925,0.04376992,0.8857307,0.0030543423095386046
CTV,2023-10-08,Stabilizing food prices 'not like a switch you can flip': Industry Minister,https://www.ctvnews.ca/politics/stabilizing-food-prices-not-like-a-switch-you-can-flip-industry-minister-1.6593765,neutral,0.063640505,0.07508334,0.86127615,-0.001587393802804371
CTV,2023-10-08,Canadians in Israel on edge after Hamas attack,https://www.ctvnews.ca/video?playlistId=1.6593652,negative,0.024032202,0.4043943,0.57157344,-0.16295722467306817
CTV,2023-10-08,Warm start to Thanksgiving long weekend broke 14 temperature records in B.C.,https://bc.ctvnews.ca/warm-start-to-thanksgiving-long-weekend-broke-14-temperature-records-in-b-c-1.6593706,positive,0.61595815,0.0050647384,0.37897706,0.3793788326912164
CTV,2023-10-08,P.E.I. RCMP investigate impersonation of a peace officer,https://atlantic.ctvnews.ca/p-e-i-rcmp-investigate-impersonation-of-a-peace-officer-1.6593884,negative,0.019778512,0.3830851,0.5971364,-0.1463630054057674
CTV,2023-10-08,'Friendsgiving' dinner planned by 2SLGBTQIA+ community,https://windsor.ctvnews.ca/friendsgiving-dinner-planned-by-2slgbtqia-community-1.6593402,neutral,0.18724295,0.005516773,0.8072404,0.035029462382693666
CTV,2023-10-08,'A good confidence booster': Youth empowerment event shows First Nations kids the joy of cooking,https://winnipeg.ctvnews.ca/a-good-confidence-booster-youth-empowerment-event-shows-first-nations-kids-the-joy-of-cooking-1.6594018,positive,0.96199775,0.002283428,0.03571889,0.9254343625013264
CTV,2023-10-08,Canadian municipalities looking to become 'spongier' to build climate resilience,https://www.ctvnews.ca/climate-and-environment/canadian-municipalities-looking-to-become-spongier-to-build-climate-resilience-1.6593891,neutral,0.07281512,0.06431057,0.8628743,0.0011661917376701858
CTV,2023-10-08,'I wanted to collapse': A Canadian grandmother's journey from romance scam victim to unwitting drug mule,https://www.ctvnews.ca/w5/i-wanted-to-collapse-a-canadian-grandmother-s-journey-from-romance-scam-victim-to-unwitting-drug-mule-1.6592267,negative,0.014764841,0.6797195,0.30551565,-0.46180060848126914
CTV,2023-10-08,Israel declares war and approves 'significant' steps to retaliate for surprise attack by Hamas,https://www.ctvnews.ca/world/israel-declares-war-and-approves-significant-steps-to-retaliate-for-surprise-attack-by-hamas-1.6593753,negative,0.011638614,0.6724881,0.31587332,-0.4521047383703589
CTV,2023-10-08,Hawaii council members unanimously vote to support resolution postponing West Maui’s reopening to tourists,https://www.ctvnews.ca/business/hawaii-council-members-unanimously-vote-to-support-resolution-postponing-west-maui-s-reopening-to-tourists-1.6594079,neutral,0.09235736,0.011046424,0.8965962,0.008407860237161557
CTV,2023-10-08,'Most challenging Thanksgiving:' Long weekend marked with soaring food bank use,https://www.ctvnews.ca/canada/most-challenging-thanksgiving-long-weekend-marked-with-soaring-food-bank-use-1.6593775,negative,0.038919583,0.49107823,0.4700022,-0.23964307720505396
CTV,2023-10-08,Surging bond yields add to Canadian homeowners' mortgage pain as renewals loom,https://www.ctvnews.ca/business/surging-bond-yields-add-to-canadian-homeowners-mortgage-pain-as-renewals-loom-1.6593392,negative,0.017181085,0.6575882,0.32523072,-0.43212702943407066
CTV,2023-10-08,"Connected vehicles can be at risk of hacking, consumer awareness paramount: experts",https://www.ctvnews.ca/autos/connected-vehicles-can-be-at-risk-of-hacking-consumer-awareness-paramount-experts-1.6593854,negative,0.049854964,0.2595483,0.6905968,-0.06487978720365817
CTV,2023-10-08,Search for 78-year-old man in N.S. suspended,https://atlantic.ctvnews.ca/search-for-78-year-old-man-in-n-s-suspended-1.6593937,negative,0.011634881,0.44010392,0.5482613,-0.19355605002880694
CTV,2023-10-08,"Vikings had windows, another shift away from their image as barbaric Norsemen, Danish museum says",https://www.ctvnews.ca/sci-tech/vikings-had-windows-another-shift-away-from-their-image-as-barbaric-norsemen-danish-museum-says-1.6592020,neutral,0.039947886,0.14395851,0.8160936,-0.019128217454684737
CTV,2023-10-08,"Israel-Hamas war: Death toll in the region nears 1,000",https://www.ctvnews.ca/video?playlistId=1.6593069,negative,0.0067066043,0.8531281,0.14016533,-0.7277825349542582
CTV,2023-10-08,Vintage vinyl records find new life at Saskatoon record sale,https://saskatoon.ctvnews.ca/vintage-vinyl-records-find-new-life-at-saskatoon-record-sale-1.6593586,positive,0.2902138,0.00664394,0.7031422,0.08417991231399746
