source,date,headline,url,chosen_label,positive,negative,neutral,compound
CTV,2023-10-17,Chinese jets make 'dangerous and reckless' intercept of Canadian surveillance flight: Blair,https://www.ctvnews.ca/canada/chinese-jets-make-dangerous-and-reckless-intercept-of-canadian-surveillance-flight-blair-1.6604184,negative,0.008076658,0.7111679,0.2807553,-0.5056946143030512
CTV,2023-10-17,"Home resales fall by 1.9 per cent across Canada, new listings on the rise: RBC",https://www.ctvnews.ca/business/home-resales-fall-by-1-9-per-cent-across-canada-new-listings-on-the-rise-rbc-1.6604282,neutral,0.028631141,0.17186801,0.7995007,-0.028718892732797485
CTV,2023-10-17,"Historic Muskoka steamship inspections underway, temporarily closing large locks",https://barrie.ctvnews.ca/historic-muskoka-steamship-inspections-underway-temporarily-closing-large-locks-1.6605144,neutral,0.06929969,0.01848896,0.9122113,0.004460608157441648
CTV,2023-10-17,What statistics say about pot use in Canada 5 years after legalization,https://calgary.ctvnews.ca/what-statistics-say-about-pot-use-in-canada-5-years-after-legalization-1.6605267,neutral,0.031027693,0.14205976,0.8269126,-0.019218254100383803
CTV,2023-10-17,Veterans' headstones vandalized in Fredericton cemetery,https://atlantic.ctvnews.ca/veterans-headstones-vandalized-in-fredericton-cemetery-1.6588430,negative,0.0074556954,0.59611595,0.39642832,-0.35529865197574395
CTV,2023-10-17,P.E.I. piping plover numbers see a tiny bump this year from effects of Fiona,https://atlantic.ctvnews.ca/p-e-i-piping-plover-numbers-see-a-tiny-bump-this-year-from-effects-of-fiona-1.6595091,neutral,0.09086128,0.10791573,0.80122304,-0.00339003094499013
CTV,2023-10-17,Russian parliament moves to rescind ratification of global nuclear test ban,https://www.ctvnews.ca/world/russian-parliament-moves-to-rescind-ratification-of-global-nuclear-test-ban-1.6604438,negative,0.011920999,0.3474926,0.6405864,-0.12060901087345144
CTV,2023-10-17,Teens aged 13 to 16 charged in 'violent assault' in Leduc,https://edmonton.ctvnews.ca/teens-aged-13-to-16-charged-in-violent-assault-in-leduc-1.6605333,negative,0.008667981,0.6274979,0.36383405,-0.39367851300198886
CTV,2023-10-17,Raptors file motion to dismiss Knicks' lawsuit or move to arbitration,https://toronto.ctvnews.ca/raptors-file-motion-to-dismiss-knicks-lawsuit-or-move-to-arbitration-1.6604057,neutral,0.02860198,0.049448762,0.9219494,-0.0016271041422690757
CTV,2023-10-17,Sask. legislators ready for marathon school pronoun debate,https://regina.ctvnews.ca/sask-legislators-ready-for-marathon-school-pronoun-debate-1.6603113,neutral,0.11108857,0.045798793,0.8431126,0.010243143528056997
CTV,2023-10-17,Belgian police shoot dead suspected extremist accused of killing 2 Swedish soccer fans,https://www.ctvnews.ca/world/belgian-police-shoot-dead-suspected-extremist-accused-of-killing-2-swedish-soccer-fans-1.6604545,negative,0.006332034,0.73092353,0.26274443,-0.5342091170074355
CTV,2023-10-17,Man charged with second-degree murder in Dartmouth homicide,https://atlantic.ctvnews.ca/man-charged-with-second-degree-murder-in-dartmouth-homicide-1.6605087,negative,0.015849186,0.65390456,0.33024615,-0.4273400497388202
CTV,2023-10-17,"Freeland announces steps to make banking more affordable, create complaints mechanism",https://www.ctvnews.ca/politics/freeland-announces-steps-to-make-banking-more-affordable-create-complaints-mechanism-1.6605321,positive,0.4361212,0.012192122,0.5516865,0.19005311234634092
CTV,2023-10-17,Ottawa woman calling on federal government to help Canadians still in West Bank and Gaza,https://ottawa.ctvnews.ca/ottawa-woman-calling-on-federal-government-to-help-canadians-still-in-west-bank-and-gaza-1.6605202,neutral,0.07868398,0.060597215,0.86071885,0.0025191454901540844
CTV,2023-10-17,Mississauga family fears for safety of mother amid bombing in Gaza,https://toronto.ctvnews.ca/mississauga-family-fears-for-safety-of-mother-amid-bombing-in-gaza-1.6605291,negative,0.017166115,0.47531056,0.50752336,-0.2256254433751419
CTV,2023-10-17,"Manitoba man found not responsible for killing parents, attacking hospital worker",https://winnipeg.ctvnews.ca/manitoba-man-found-not-responsible-for-killing-parents-attacking-hospital-worker-1.6604812,negative,0.00856707,0.7147008,0.2767319,-0.5107239904914351
CTV,2023-10-17,"Up in smoke: 5 years after legalization, cannabis use higher while companies burn out",https://www.ctvnews.ca/canada/up-in-smoke-5-years-after-legalization-cannabis-use-higher-while-companies-burn-out-1.6604769,negative,0.050798234,0.25886664,0.6903351,-0.06443148152675882
CTV,2023-10-17,Poilievre says PM Trudeau is 'not worth the cost' for Canada,https://www.ctvnews.ca/video?playlistId=1.6427756,negative,0.015354528,0.6932217,0.29142368,-0.480320628792839
CTV,2023-10-17,Family of 7 displaced after fire ignites in child's closet,https://barrie.ctvnews.ca/family-of-7-displaced-after-fire-ignites-in-child-s-closet-1.6604534,negative,0.008810828,0.58954334,0.40164584,-0.3474837222753102
CTV,2023-10-17,"'It was horrible': Accused in London, Ont. truck attack shows remorse for actions that killed four people",https://windsor.ctvnews.ca/it-was-horrible-accused-in-london-ont-truck-attack-shows-remorse-for-actions-that-killed-four-people-1.6604764,negative,0.0048226686,0.9109731,0.08420413,-0.8298487946171922
CTV,2023-10-17,New Ottawa Community Housing building to offer 4-bedroom units in Centretown,https://ottawa.ctvnews.ca/new-ottawa-community-housing-building-to-offer-4-bedroom-units-in-centretown-1.6603847,neutral,0.07421711,0.008319155,0.91746366,0.005438976126379558
CTV,2023-10-17,Good Greens initiative aims to reduce food waste and provide healthy food downtown,https://windsor.ctvnews.ca/good-greens-initiative-aims-to-reduce-food-waste-and-provide-healthy-food-downtown-1.6605292,positive,0.74396354,0.012431683,0.24360475,0.5533272233596946
CTV,2023-10-17,Hydro Ottawa customers can now switch to new ultra-low overnight plan,https://ottawa.ctvnews.ca/hydro-ottawa-customers-can-now-switch-to-new-ultra-low-overnight-plan-1.6604762,neutral,0.108466476,0.0077886907,0.88374484,0.01170431279978601
CTV,2023-10-17,"Government plans business mission to Ukraine, introduces trade legislation",https://www.ctvnews.ca/politics/government-plans-business-mission-to-ukraine-introduces-trade-legislation-1.6605153,neutral,0.08771259,0.018837262,0.8934501,0.007338660564211175
CTV,2023-10-17,Trudeau calls report of Israel airstrike on Gaza hospital 'horrific' and 'unacceptable',https://www.ctvnews.ca/canada/trudeau-calls-report-of-israel-airstrike-on-gaza-hospital-horrific-and-unacceptable-1.6604605,negative,0.007251786,0.77980614,0.21294199,-0.60804508040487
CTV,2023-10-17,'My own son is trans': Sask. Human Rights commissioner resigns over pronoun policy,https://saskatoon.ctvnews.ca/my-own-son-is-trans-sask-human-rights-commissioner-resigns-over-pronoun-policy-1.6604089,negative,0.019736419,0.3243035,0.65596014,-0.10478322117332084
CTV,2023-10-17,"Hanover, Ont. man facing sexual assault charges",https://london.ctvnews.ca/hanover-ont-man-facing-sexual-assault-charges-1.6605223,negative,0.009186002,0.5952529,0.3955611,-0.3542415979081426
CTV,2023-10-17,Gun violence down in Montreal compared to last summer: SPVM,https://montreal.ctvnews.ca/gun-violence-down-in-montreal-compared-to-last-summer-spvm-1.6604807,neutral,0.016611816,0.2208224,0.76256573,-0.04848658943611639
CTV,2023-10-17,Canada's Leylah Fernandez wins first-round match at Jiangxi Open,https://www.ctvnews.ca/sports/canada-s-leylah-fernandez-wins-first-round-match-at-jiangxi-open-1.6604612,positive,0.22959237,0.0034580354,0.76694965,0.052700683941651505
CTV,2023-10-17,'A healing process': Winnipeg tattoo removal technician helps ex-gang members feel free,https://winnipeg.ctvnews.ca/a-healing-process-winnipeg-tattoo-removal-technician-helps-ex-gang-members-feel-free-1.6594894,positive,0.43084058,0.011352012,0.5578074,0.18549475133948512
CTV,2023-10-17,"Wind, rain warnings issued for Vancouver Island, coastal B.C.",https://bc.ctvnews.ca/wind-rain-warnings-issued-for-vancouver-island-coastal-b-c-1.6604810,neutral,0.02841596,0.18011536,0.7914686,-0.03163408392785527
CTV,2023-10-17,WARNING: Officer captured punching suspect in handcuffs,https://www.ctvnews.ca/video?playlistId=1.6605086,negative,0.014534623,0.5001299,0.48533562,-0.24991858225272434
CTV,2023-10-17,Unifor members at GM vote 80 per cent in favour of new contract,https://www.ctvnews.ca/autos/unifor-members-at-gm-vote-80-per-cent-in-favour-of-new-contract-1.6602335,positive,0.47995287,0.009498576,0.5105486,0.2302645223644788
CTV,2023-10-17,Nanaimo RCMP seek alleged hit-and-run driver,https://vancouverisland.ctvnews.ca/nanaimo-rcmp-seek-alleged-hit-and-run-driver-1.6605048,negative,0.013386123,0.42074388,0.5658701,-0.17684617774640898
CTV,2023-10-17,B.C. is bringing in new rules for short-term rentals. Here's what's changing,https://bc.ctvnews.ca/b-c-is-bringing-in-new-rules-for-short-term-rentals-here-s-what-s-changing-1.6603052,neutral,0.044948462,0.008929088,0.9461225,0.0019406328287847607
CTV,2023-10-17,"Will Smith responds to Jada Pinkett Smith's 'Worthy,' while she says they are in a 'beautiful' place",https://www.ctvnews.ca/entertainment/will-smith-responds-to-jada-pinkett-smith-s-worthy-while-she-says-they-are-in-a-beautiful-place-1.6604674,positive,0.8338332,0.006255423,0.15991144,0.695238617856865
CTV,2023-10-17,Crushing wine grapes by foot is back. Here's why winemakers say it makes a difference,https://www.ctvnews.ca/lifestyle/crushing-wine-grapes-by-foot-is-back-here-s-why-winemakers-say-it-makes-a-difference-1.6602787,positive,0.729751,0.008429638,0.2618193,0.5324654927263879
CTV,2023-10-17,"Sudbury may require use of clear plastic garbage bags to boost recycling, composting",https://northernontario.ctvnews.ca/sudbury-may-require-use-of-clear-plastic-garbage-bags-to-boost-recycling-composting-1.6603116,neutral,0.13646483,0.031850003,0.8316852,0.017608225966152524
CTV,2023-10-17,Cat shot with pellet gun: Police,https://kitchener.ctvnews.ca/cat-shot-with-pellet-gun-police-1.6605336,negative,0.020953752,0.34882423,0.6302221,-0.1212392664427
CBC,2023-10-17,Go beyond the headlines | Stream CBC News Explore,https://www.cbc.cahttps://www.cbc.ca/news/cbc-news-explore-1.6512577,neutral,0.10185861,0.013737929,0.8844034,0.010186449934611819
CBC,2023-10-17,"Pro-Europe, civic rights coalition wins in Poland, but change will be hard",https://www.cbc.ca/news/world/poland-election-coaliiton-1.6997607,positive,0.30021495,0.054502968,0.64528203,0.08715845552252688
CBC,2023-10-17,"LinkedIn lays off 668 people, about 3% of global workforce",https://www.cbc.ca/news/business/linkedin-layoffs-1.6998538,negative,0.03571349,0.52761674,0.43666977,-0.27710396992003083
CBC,2023-10-17,Canadian officials provide update on Israel-Hamas war,https://www.cbc.ca/player/play/2274302019548,neutral,0.025676709,0.0414069,0.9329164,-0.0010552377981456473
CBC,2023-10-17,A contentious export: The anatomy of Canada's horsemeat industry,https://www.cbc.ca/news/canada/edmonton/horsemeat-industry-live-exports-ban-canada-1.6987841,negative,0.012883392,0.4408572,0.54625946,-0.19418906501701017
CBC,2023-10-17,University of New Brunswick hockey camp aims to help Indigenous girls get on the ice,https://www.cbc.ca/sports/hockey/unb-indigenous-girls-hockey-lillian-george-1.6997822,positive,0.31409803,0.005073919,0.68082815,0.0986318005156317
CBC,2023-10-17,"As conditions in Gaza continue to deteriorate, Hamas releases first video of Israeli hostage",https://www.cbc.ca/news/world/gaza-rafah-border-egypt-1.6997153,negative,0.004714981,0.88995636,0.105328575,-0.7920001754090027
CBC,2023-10-17,What we know about the Canadians missing or killed after Hamas attack on Israel,https://www.cbc.ca/news/canada/israel-hamas-gaza-canadians-1.6992311,negative,0.007911239,0.53750294,0.45458585,-0.28884679563494586
CBC,2023-10-17,Report highlights slow start to creating daycare spaces in Sask. as long waitlists remain,https://www.cbc.ca/news/canada/saskatchewan/long-waitlists-daycares-remain-1.6994333,negative,0.015469718,0.51229817,0.4722322,-0.26221005469420433
CBC,2023-10-17,MPs block Conservative attempts to probe CBC coverage of Hamas attacks,https://www.cbc.ca/news/politics/conservative-motion-cbc-terrorists-israel-gaza-1.6998926,negative,0.010361609,0.5017809,0.4878575,-0.25167672123744467
CBC,2023-10-17,Oscar-winning actor Michelle Yeoh among 8 joining IOC as members after vote in India,https://www.cbc.ca/sports/olympics/michelle-yeoh-international-olympic-committee-member-vote-india-1.6998700,positive,0.2990354,0.006039361,0.6949253,0.0893856793170471
CBC,2023-10-17,India's top court rejects plea to legalize same-sex marriage,https://www.cbc.ca/news/world/india-lgbtq-same-sex-marriage-1.6998497,negative,0.019477082,0.3988101,0.58171284,-0.15867013056509904
CBC,2023-10-17,Russian lawmakers unanimously vote to de-ratify the nuclear test treaty. Here's what that means,https://www.cbc.ca/news/world/russia-nuclear-test-treaty-1.6998461,neutral,0.027360609,0.12869278,0.8439467,-0.015813219264790845
CBC,2023-10-17,Black man wrongfully imprisoned for 16 years shot and killed by Georgia deputy,https://www.cbc.ca/news/world/leonard-allen-cure-georgia-police-shooting-1.6998612,negative,0.006597571,0.8527441,0.14065817,-0.7271291023543132
CBC,2023-10-17,"Accused killer of London, Ont., Muslim family details attack, aftermath for jury",https://www.cbc.ca/news/canada/london/veltman-trial-london-1.6998755,negative,0.008781966,0.64958364,0.3416344,-0.42188177939712546
CBC,2023-10-17,"Trump, Republican candidates ramp up anti-refugee rhetoric amid Israel-Hamas conflict",https://www.cbc.ca/news/world/trump-republicans-israel-gaza-1.6998480,negative,0.008494331,0.7218541,0.26965144,-0.5210012811153337
CBC,2023-10-17,"Customers, workers say shuttered B.C. cleaning company owes them hundreds of dollars",https://www.cbc.ca/news/canada/british-columbia/scrubbi-customers-cleaners-owed-money-1.6998264,negative,0.013422172,0.70021564,0.2863623,-0.49012170216978745
CBC,2023-10-17,"Sask. human rights commissioner resigns, calls pronoun policy 'an attack' on gender-diverse kids",https://www.cbc.ca/news/canada/saskatchewan/sask-human-rights-commissioner-resigns-calls-pronoun-policy-an-attack-on-gender-diverse-kids-1.6998397,negative,0.00881696,0.7127194,0.27846348,-0.5078913029756009
CBC,2023-10-17,#TheMoment a couple swapped their Ontario home for a chateau in France,https://www.cbc.ca/player/play/2274134595550,neutral,0.029227544,0.07091756,0.8998549,-0.004175051088922466
CBC,2023-10-17,"For Canadians stuck in Gaza, agonizing uncertainty around closed border crossing",https://www.cbc.ca/news/world/canadians-stuck-in-gaza-rafah-border-crossing-1.6997705,negative,0.013696779,0.7096893,0.27661377,-0.5034714106120894
CBC,2023-10-17,Old Quebec church gets new lease on life as greenhouse to combat food insecurity,https://www.cbc.ca/news/canada/montreal/quebec-church-new-life-as-greenhouse-1.6997710,neutral,0.07330365,0.07542834,0.8512681,-0.00031600908223383684
CBC,2023-10-17,'Why aren't you letting me do this?': Woman alleges Nygard berated her during sex assault,https://www.cbc.ca/news/canada/toronto/peter-nygard-sexual-assault-trial-1.6998046,negative,0.0047889138,0.8714354,0.12377582,-0.7593765935400332
CBC,2023-10-17,Wave of billion-dollar oilpatch deals a sign of bullish Canadian energy sector,https://www.cbc.ca/news/canada/calgary/alberta-oil-gas-deals-mergers-energy-outlook-1.6998577,positive,0.7466874,0.008409123,0.24490345,0.5574713779529787
CBC,2023-10-17,Prosecutors seeking to recharge actor Alec Baldwin in fatal shooting on movie set,https://www.cbc.ca/news/entertainment/alec-baldwin-recharge-1.6999032,negative,0.019700155,0.39684,0.58345985,-0.15709389494520565
CBC,2023-10-17,"Hundreds killed in Israeli airstrike on Gaza City hospital, Gaza health ministry says",https://www.cbc.ca/news/world/gaza-airstrikes-israel-1.6998419,negative,0.0070248796,0.8232472,0.16972806,-0.6776864844443207
CBC,2023-10-17,"Is this your giant tortoise? Exotic reptile 'Frank the Tank' found in Richmond, B.C., spinach field",https://www.cbc.ca/news/canada/british-columbia/giant-tortoise-richmond-1.6997599,neutral,0.121811226,0.013518635,0.86467016,0.014655219771947614
CBC,2023-10-17,Canada's inflation rate slows to 3.8%,https://www.cbc.ca/news/business/canada-inflation-september-1.6998503,negative,0.03253893,0.31410816,0.65335286,-0.09760517356394871
CBC,2023-10-17,IN PHOTOS | The growing humanitarian crisis in southern Gaza,https://www.cbc.ca/news/world/photos/rafah-border-humanitarian-crisis-photo-scroller-1.6998517,negative,0.032465447,0.35652167,0.6110129,-0.12605369240532482
CBC,2023-10-17,Mother of Hamas hostage says 'bring my baby back home',https://www.cbc.ca/player/play/2274207811630,negative,0.031536616,0.46267134,0.5057921,-0.21307019785381165
CBC,2023-10-17,Family says Christian Brothers abuse led to death of loved one in Vancouver's Downtown Eastside,https://www.cbc.ca/news/canada/newfoundland-labrador/sean-munro-christian-brothers-vancouver-college-1.6993948,negative,0.0073645203,0.79116094,0.20147462,-0.6258813403332848
CBC,2023-10-17,Ex-wife of ISIS fighter convicted in death of James Foley and other hostages says she was 'oblivious',https://www.cbc.ca/news/world/isis-bride-1.6997437,negative,0.006967828,0.6301965,0.36283556,-0.3970991483069177
CBC,2023-10-17,Police shoot gunman accused of killing 2 Swedish soccer fans in Brussels,https://www.cbc.ca/news/world/brussels-shooting-swedes-1.6998429,negative,0.008267378,0.64097846,0.3507542,-0.41078499281187675
CBC,2023-10-17,The U.K. and New Zealand want to ban the next generation from smoking at any age. Should Canada follow?,https://www.cbc.ca/radio/whitecoat/teen-smoking-bans-1.6997984,neutral,0.028403902,0.19207281,0.7795233,-0.03608517699004388
CBC,2023-10-17,Regina school program uses First Nations drumming to connect kids with culture,https://www.cbc.ca/news/canada/saskatchewan/regina-school-first-nations-drumming-culture-1.6995352,positive,0.27068394,0.005833735,0.72348225,0.0732357808669164
CBC,2023-10-17,WATCH: CBC News Network,https://www.cbc.cahttps://gem.cbc.ca/benefits-premium?cmp=DM_NewsTile_Gem_PremiumNN,neutral,0.10073908,0.018231502,0.88102955,0.00981596340483426
