source,date,headline,url,chosen_label,positive,negative,neutral,compound
Global,2024-06-26,Bill 96: New language rules requires Quebec store signs to be two-thirds in French,https://globalnews.ca/news/10589481/quebec-store-signs-french-bill-96/,neutral,0.049168754,0.06386941,0.88696176,-0.001661736183468987
Global,2024-06-26,Alberta-raised musician k.d. lang to join Canadian Country Music Hall Of Fame,https://globalnews.ca/news/10589426/kd-lang-canadian-country-music-hall-of-fame/,neutral,0.16094884,0.007004973,0.83204633,0.025855437355035704
Global,2024-06-26,Closure of Ontario Science Centre means more than 50 food service workers to be laid off,https://globalnews.ca/video/10589756/closure-of-ontario-science-centre-means-more-than-50-food-service-workers-to-be-laid-off/,negative,0.008613836,0.81329006,0.17809601,-0.6613666069455002
Global,2024-06-26,"The message in Toronto-St. Paul’s loss is ‘loud and clear,’ minister says",https://globalnews.ca/news/10589287/justin-trudeau-future-marc-miller-toronto-st-pauls/,neutral,0.025359944,0.16479385,0.80984616,-0.02651389216379485
Global,2024-06-26,No charges in deadly Manitoba bus crash: RCMP,https://globalnews.ca/news/10588765/manitoba-rcmp-carberry-dauphin-crash-update/,negative,0.014533036,0.32084295,0.66462404,-0.10272898108554251
Global,2024-06-26,"Despite Toronto-St. Paul’s loss, Freeland says Trudeau should stay as leader",https://globalnews.ca/news/10586742/justin-trudeau-toronto-st-pauls-byelection-loss/,neutral,0.062668726,0.08989808,0.84743315,-0.00415429673963974
Global,2024-06-26,Former B.C. premier John Horgan battling cancer for third time,https://globalnews.ca/news/10586713/former-bc-premier-john-horgan-cancer-third-time/,negative,0.011934945,0.38852248,0.5995426,-0.15080726040281434
Global,2024-06-26,"Elon Musk announces birth of 12th child, third with Neuralink executive",https://globalnews.ca/news/10586300/elon-musk-12th-child-neuralink-shivon-zilis/,positive,0.26427677,0.0052879388,0.7304353,0.0698142425248971
Global,2024-06-26,Mayor Olivia Chow reflects on 1 year since by-election win,https://globalnews.ca/video/10589658/mayor-olivia-chow-reflects-on-1-year-since-by-election-win/,neutral,0.21682478,0.007818697,0.77535665,0.046951827253929324
Global,2024-06-26,University of Waterloo turns to court to end encampment on campus,https://globalnews.ca/news/10589591/university-of-waterloo-court-end-encampment/,negative,0.022637801,0.22555988,0.7518024,-0.05036477532054384
Global,2024-06-26,"Canada’s inflation rate rose to 2.9% in May, what does that mean for the Bank of Canada?",https://globalnews.ca/video/10587288/canadas-inflation-rate-rose-to-2-9-in-may-what-does-that-mean-for-the-bank-of-canada/,neutral,0.0403133,0.08437275,0.875314,-0.0054935969111982175
Global,2024-06-26,"Family fund: $115K is the average gift for 1st-time homebuyers, CIBC says",https://globalnews.ca/news/10586834/canadians-family-help-home/,positive,0.26047665,0.007702503,0.73182076,0.06778877867324873
Global,2024-06-26,An Ontario dog boarding business has been descended on by activists. Police demand peace,https://globalnews.ca/news/10588953/break-in-hamilton-dog-boarding/,negative,0.009876547,0.74707633,0.24304712,-0.5580255004599621
Global,2024-06-26,"Dane Cook, Bassem Youssef to perform at ‘revived’ Just for Laughs festival",https://globalnews.ca/news/10589401/revived-just-for-laughs-festival-montreal/,neutral,0.07914922,0.01127781,0.909573,0.006137406432270787
Global,2024-06-26,"Three years later, Lytton still rebuilding after devastating wildfire",https://globalnews.ca/video/10588348/three-years-later-lytton-still-rebuilding-after-devastating-wildfire/,negative,0.10261977,0.268653,0.62872726,-0.061643615723690814
Global,2024-06-26,Metro Vancouver introduces motion about travel,https://globalnews.ca/video/10588287/metro-vancouver-introduces-motion-about-travel/,neutral,0.07235692,0.010521383,0.9171216,0.005124830862046625
Global,2024-06-26,Ontario Liberal Leader Bonnie Crombie on the Trudeau effect,https://globalnews.ca/video/10587968/ontario-liberal-leader-bonnie-crombie-on-the-trudeau-effect/,neutral,0.03503362,0.044159237,0.92080724,-0.0007226827276887171
Global,2024-06-26,Liberals lose stranglehold Toronto riding to Conservatives after 31 years,https://globalnews.ca/video/10588297/liberals-lose-stranglehold-toronto-riding-to-conservatives-after-31-years/,negative,0.02030356,0.4094654,0.57023114,-0.1672496469036222
Global,2024-06-26,Ontario MPP ‘not aware’ of Tommy Robinson’s history before speaking to far-right figure,https://globalnews.ca/news/10589585/goldie-ghamari-tommy-robinson-meeting/,negative,0.012148726,0.26245436,0.7253968,-0.06873472200910236
Global,2024-06-26,WestJet mechanics’ union issues strike notice for possible job action Friday,https://globalnews.ca/video/10589075/westjet-mechanics-union-issues-strike-notice-for-possible-job-action-friday/,neutral,0.020189807,0.11212499,0.8676851,-0.01216439604288233
Global,2024-06-26,"Pride, heartbreak after Oilers lose Stanley Cup Final",https://globalnews.ca/video/10588304/pride-heartbreak-after-oilers-lose-stanley-cup-final/,negative,0.029821467,0.7701924,0.19998614,-0.5923070013059677
Global,2024-06-26,Fleming College shocked by city council motion in first interview since 29 program cuts,https://globalnews.ca/video/10588958/fleming-college-shocked-by-city-council-motion-in-first-interview-since-29-program-cuts/,negative,0.012536572,0.60157436,0.38588914,-0.36173449356691023
Global,2024-06-26,WestJet mechanics’ union issues strike notice for possible job action Friday,https://globalnews.ca/news/10588769/westjet-mechanics-union-strike-notice-june/,neutral,0.020189807,0.11212499,0.8676851,-0.01216439604288233
Global,2024-06-26,Halifax airport to carry out $18-million renovation on international travel facility,https://globalnews.ca/news/10589587/halifax-airport-renovation-international/,neutral,0.04929899,0.03248296,0.91821796,0.0013752493853547154
Global,2024-06-26,"Mortgage servicing costs, rent, gas prices all up",https://globalnews.ca/video/10588295/mortgage-servicing-costs-rent-gas-prices-all-up/,negative,0.016400067,0.69707555,0.28652444,-0.4856453349640333
Global,2024-06-26,‘Rolling spy vans’? Canada weighs possible security threat of Chinese EVs,https://globalnews.ca/news/10585303/china-electric-vehicles-canada-national-security/,negative,0.016920848,0.2697556,0.71332353,-0.0724817776326443
Global,2024-06-26,Canada could soon raise tariffs on Chinese electric vehicles,https://globalnews.ca/video/10582766/canada-could-soon-raise-tariffs-on-chinese-electric-vehicles/,neutral,0.035569765,0.19956943,0.76486075,-0.03856276110438728
Global,2024-06-26,"Ontario police identify family of 4 dead in Harrow, Ont., home",https://globalnews.ca/video/10589352/ontario-police-identify-family-of-4-dead-in-harrow-ont-home/,negative,0.011676036,0.413098,0.57522607,-0.17051358591164956
Global,2024-06-26,"Who’s happier, homeowners or renters? Data says it’s complicated",https://globalnews.ca/news/10589605/homeowners-renters-happiness-data-statcan/,positive,0.26627147,0.077088654,0.6566398,0.06495784748319977
Global,2024-06-26,No charges for driver of seniors’ bus involved in deadly crash: Manitoba RCMP,https://globalnews.ca/video/10589071/no-charges-for-driver-of-seniors-bus-involved-in-deadly-crash-manitoba-rcmp/,negative,0.011705105,0.50869215,0.47960278,-0.2586306745484048
Global,2024-06-26,11-year-old boy drowns after falling off tube at B.C. Interior lake,https://globalnews.ca/news/10589693/boy-drowns-bc-interior-lake/,negative,0.010201313,0.6808908,0.3089078,-0.4635082523169345
Global,2024-06-26,Can Trudeau survive Liberals’ stunning Toronto byelection loss?,https://globalnews.ca/video/10588298/can-trudeau-survive-liberals-stunning-toronto-byelection-loss/,negative,0.03544136,0.4668913,0.49766743,-0.2167313463191327
Global,2024-06-26,Canadian mortgage renewals will weigh on economic growth: Deloitte,https://globalnews.ca/news/10587328/canada-mortgage-rate-cuts-deloitte/,neutral,0.041527107,0.1370054,0.82146746,-0.017045982825933947
Global,2024-06-26,Adopt Lexi:  Sweetheart dog ready for adventures and cuddles,https://globalnews.ca/video/10589730/adopt-lexi-sweetheart-dog-ready-for-adventures-and-cuddles/,positive,0.9240734,0.0029243794,0.07300225,0.8539030656340927
Global,2024-06-26,Canada’s Walk of Fame celebrates Regina’s own Tatiana Maslany with Hometown Star,https://globalnews.ca/video/10589063/gnm-canadas-walk-of-fame/,positive,0.6613197,0.002915107,0.3357653,0.43733517301718905
CTV,2024-06-26,"After teen's death on e-scooter, Montreal councillor reiterates street should be safer",https://montreal.ctvnews.ca/after-teen-s-death-on-e-scooter-montreal-councillor-reiterates-street-should-be-safer-1.6941924,negative,0.035515666,0.3267273,0.6377571,-0.10548934057351822
CTV,2024-06-26,Canada is a force in AI research. So why can't we commercialize it?,https://www.ctvnews.ca/business/canada-is-a-force-in-ai-research-so-why-can-t-we-commercialize-it-1.6941310,positive,0.33735147,0.058750425,0.60389805,0.11035441977185201
CTV,2024-06-26,E.C. Row Expressway ramp at Dougall Avenue closed after truck rollover,https://windsor.ctvnews.ca/e-c-row-expressway-ramp-at-dougall-avenue-closed-after-truck-rollover-1.6941771,negative,0.018577049,0.25078258,0.7306403,-0.06254681238199744
CTV,2024-06-26,'Worrying rumours' of planned 'non-consensual sexual acts' at after-prom party prompts Quebec police investigation,https://montreal.ctvnews.ca/worrying-rumours-of-planned-non-consensual-sexual-acts-at-after-prom-party-prompts-quebec-police-investigation-1.6942110,negative,0.00618009,0.7163782,0.27744162,-0.513159591193876
CTV,2024-06-26,Elvis Presley's actual blue suede shoes are up for auction,https://www.ctvnews.ca/entertainment/elvis-presley-s-actual-blue-suede-shoes-are-up-for-auction-1.6941622,neutral,0.13062966,0.015015127,0.8543553,0.016838646853649664
CTV,2024-06-26,Critically endangered Vancouver Island marmots released into the wild,https://bc.ctvnews.ca/critically-endangered-vancouver-island-marmots-released-into-the-wild-1.6940951,negative,0.009754757,0.69560724,0.294638,-0.4837742631391162
CTV,2024-06-26,Same Sault suspect charged with another assault using a metal baseball bat,https://northernontario.ctvnews.ca/same-sault-suspect-charged-with-another-assault-using-a-metal-baseball-bat-1.6940270,negative,0.011720684,0.592849,0.39543024,-0.35133263414518723
CTV,2024-06-26,Federal government ends cod moratorium in Newfoundland after more than 30 years,https://www.ctvnews.ca/canada/federal-government-ends-cod-moratorium-in-newfoundland-after-more-than-30-years-1.6941712,neutral,0.029279336,0.19342667,0.7772941,-0.03655657948467894
CTV,2024-06-26,"Metis musician and TV host Ray St. Germain, dubbed 'Winnipeg's Elvis,' dies at 83",https://winnipeg.ctvnews.ca/metis-musician-and-tv-host-ray-st-germain-dubbed-winnipeg-s-elvis-dies-at-83-1.6941213,neutral,0.067376696,0.022942666,0.9096806,0.004013254674595679
CTV,2024-06-26,"Test water flowing through repaired Calgary pipe, full service days away",https://calgary.ctvnews.ca/test-water-flowing-through-repaired-calgary-pipe-full-service-days-away-1.6941888,neutral,0.10195882,0.022763865,0.8752772,0.009877414920141714
CTV,2024-06-26,'Deeply unserious': Councillor criticizes Vancouver mayor's conversion of boardroom into gym,https://bc.ctvnews.ca/deeply-unserious-councillor-criticizes-vancouver-mayor-s-conversion-of-boardroom-into-gym-1.6941635,negative,0.007439998,0.7551587,0.23740116,-0.5702094542685447
CTV,2024-06-26,Montreal peregrine falcon chicks take first flights into a world full of danger,https://montreal.ctvnews.ca/montreal-peregrine-falcon-chicks-take-first-flights-into-a-world-full-of-danger-1.6941858,negative,0.016875355,0.71062726,0.27249727,-0.5047064262904861
CTV,2024-06-26,WestJet to start cancelling flights as early as Thursday as mechanics prepare for possible job action,https://calgary.ctvnews.ca/westjet-to-start-cancelling-flights-as-early-as-thursday-as-mechanics-prepare-for-possible-job-action-1.6941381,negative,0.0077893957,0.6260173,0.36619338,-0.3918369326712021
CTV,2024-06-26,"Burlington, Ont. man facing terror charges in connection with incel posts on social media: RCMP",https://toronto.ctvnews.ca/burlington-ont-man-facing-terror-charges-in-connection-with-incel-posts-on-social-media-rcmp-1.6941554,negative,0.0061091557,0.7282625,0.2656284,-0.5303288806087707
CTV,2024-06-26,"Dawgs take down Gulls at Seaman Stadium, defeating Sylvan Lake 10-4",https://calgary.ctvnews.ca/dawgs-take-down-gulls-at-seaman-stadium-defeating-sylvan-lake-10-4-1.6941930,neutral,0.2077465,0.0074205436,0.78483284,0.043103570115022194
CTV,2024-06-26,Germany moves to ease the deportation of foreigners who glorify terrorist acts,https://www.ctvnews.ca/world/germany-moves-to-ease-the-deportation-of-foreigners-who-glorify-terrorist-acts-1.6941690,negative,0.023189548,0.47215328,0.50465715,-0.2223909746289756
CTV,2024-06-26,Western Labrador town without power as wildfire takes out transmission lines,https://www.ctvnews.ca/climate-and-environment/western-labrador-town-without-power-as-wildfire-takes-out-transmission-lines-1.6941666,negative,0.014039472,0.55087334,0.43508717,-0.30326434546552505
CTV,2024-06-26,Educational charity director charged with fraud,https://london.ctvnews.ca/educational-charity-director-charged-with-fraud-1.6942018,negative,0.013116438,0.75378436,0.23309928,-0.5680187745185137
CTV,2024-06-26,"Man shot dead in Princeton, B.C., was high-ranking gang member, court records suggest",https://bc.ctvnews.ca/man-shot-dead-in-princeton-b-c-was-high-ranking-gang-member-court-records-suggest-1.6937508,negative,0.017537545,0.33008072,0.65238184,-0.1086456872140662
CTV,2024-06-26,Que. language law stopping pre-med students from taking exam,/video/c2946879-pre-med-students-can-t-take-mcat-in-quebec,negative,0.012140803,0.50198865,0.48587066,-0.25184514642083755
CTV,2024-06-26,Electric vehicle infrastructure lags in Prairie provinces,https://www.ctvnews.ca/autos/electric-vehicle-infrastructure-lags-in-prairie-provinces-1.6941003,negative,0.01312988,0.74040943,0.2464607,-0.5480337140366807
CTV,2024-06-26,"Thieves smash truck through, rob adult toy store in Alta.",/video/c2946945-extended--truck-smashes-into-edmonton-adult-store,negative,0.020461807,0.62343156,0.35610652,-0.3882483009290638
CTV,2024-06-26,Possibility of WestJet mechanics job action is 'very real',/video/c2947629-disruption-to-air-travel-could-be--massive-?playlistId=1.6932705,neutral,0.08315477,0.040042363,0.87680286,0.005311324877841361
CTV,2024-06-26,Pre-med students can't take MCAT in Quebec because of Bill 96,https://montreal.ctvnews.ca/pre-med-students-can-t-take-mcat-in-quebec-because-of-bill-96-1.6939887,negative,0.00874372,0.65411484,0.33714148,-0.4277897554853123
CTV,2024-06-26,'Historic victory': Judge orders Quebec to pay taxi drivers $143 million for abolishing permits,https://montreal.ctvnews.ca/historic-victory-judge-orders-quebec-to-pay-taxi-drivers-143-million-for-abolishing-permits-1.6936639,positive,0.37287793,0.01611944,0.61100274,0.13877806821751193
CTV,2024-06-26,"Man facing charges for allegedly threatening Ottawa Coun. Plante, police say",https://ottawa.ctvnews.ca/man-facing-charges-for-allegedly-threatening-ottawa-coun-plante-police-say-1.6941698,negative,0.010764524,0.5126995,0.47653595,-0.2627449013936971
CTV,2024-06-26,OPP release names in death investigation in Harrow,https://windsor.ctvnews.ca/opp-release-names-in-death-investigation-in-harrow-1.6941521,negative,0.012572227,0.33266914,0.6547586,-0.11051071412158109
CTV,2024-06-26,Satellite imagery confirms 5 tornadoes hit Quebec during June 13 storm,https://montreal.ctvnews.ca/satellite-imagery-confirms-5-tornadoes-hit-quebec-during-june-13-storm-1.6936414,neutral,0.020159932,0.19959654,0.78024346,-0.039432369028401304
CTV,2024-06-26,'It's a tradition': Titanic model returning to Halifax Public Gardens,https://atlantic.ctvnews.ca/it-s-a-tradition-titanic-model-returning-to-halifax-public-gardens-1.6936194,neutral,0.19946207,0.0063554225,0.7941825,0.039744732186761667
CTV,2024-06-26,Ottawa Train Yards placed in receivership over owner's unpaid $39 million loan,https://ottawa.ctvnews.ca/ottawa-train-yards-placed-in-receivership-over-owner-s-unpaid-39-million-loan-1.6941817,negative,0.015130411,0.41332477,0.57154477,-0.17060846294327092
CTV,2024-06-26,Meet the centenarians: Canada's oldest age group is also its fastest-growing,https://bc.ctvnews.ca/meet-the-centenarians-canada-s-oldest-age-group-is-also-its-fastest-growing-1.6941083,positive,0.48252797,0.005118334,0.5123538,0.23280700296502133
CTV,2024-06-26,Was a Toronto byelection a wake-up call on Trudeau's approach to antisemitism?,https://toronto.ctvnews.ca/was-a-toronto-byelection-a-wake-up-call-on-trudeau-s-approach-to-antisemitism-1.6941293,negative,0.022037,0.26925552,0.70870745,-0.07201291248756192
CTV,2024-06-26,"Wildfire jumps Churchill river, forcing out hydro workers",/video/c2947563-update-on-churchill-falls-wildfire-situation?playlistId=1.6934260,negative,0.009139009,0.62608147,0.3647796,-0.3918944447950068
CTV,2024-06-26,"Charges laid in violent Calgary kidnapping that saw victim restrained, assaulted",https://calgary.ctvnews.ca/charges-laid-in-violent-calgary-kidnapping-that-saw-victim-restrained-assaulted-1.6941836,negative,0.012265055,0.65567917,0.3320558,-0.42976473826539063
CTV,2024-06-26,LIVE SOON: Calgary officials update on water main repairs,/video/c104070-live--calgary-water-main-repair-update?playlistId=1.6915886,neutral,0.031300213,0.01621554,0.95248413,0.0007167613349565727
CTV,2024-06-26,"Aer Lingus pilots launch work-to-rule actions, tossing travel plans of passengers into disarray",https://www.ctvnews.ca/business/aer-lingus-pilots-launch-work-to-rule-actions-tossing-travel-plans-of-passengers-into-disarray-1.6942115,negative,0.006789175,0.8082191,0.18499175,-0.6531720048777903
CTV,2024-06-26,"Sudbury, Ont., Crown takes over criminal prosecution of Ontario’s Ministry of Labour",https://northernontario.ctvnews.ca/sudbury-ont-crown-takes-over-criminal-prosecution-of-ontario-s-ministry-of-labour-1.6941953,neutral,0.022540413,0.06350715,0.91395235,-0.0035250911885853498
CTV,2024-06-26,"Bracebridge, Ont. man who lost his life trying to save another honoured posthumously",https://barrie.ctvnews.ca/bracebridge-ont-man-who-lost-his-life-trying-to-save-another-honoured-posthumously-1.6940235,negative,0.027963178,0.58584297,0.38619372,-0.34243012675373663
CTV,2024-06-26,Police investigating at 82 Avenue apartment building,https://edmonton.ctvnews.ca/police-investigating-at-82-avenue-apartment-building-1.6941455,neutral,0.03409546,0.11025939,0.8556451,-0.010994635351546655
CTV,2024-06-26,Automatic Ontario licence plate renewals start Canada Day,https://toronto.ctvnews.ca/automatic-ontario-licence-plate-renewals-start-canada-day-1.6941586,neutral,0.046187893,0.035809234,0.91800296,0.0008510192666122407
CTV,2024-06-26,More than a hundred Haitian migrants arrived in a sailboat off the Florida Keys,https://www.ctvnews.ca/world/more-than-a-hundred-haitian-migrants-arrived-in-a-sailboat-off-the-florida-keys-1.6941945,neutral,0.032746326,0.033350103,0.9339034,-3.9907571197650427e-05
CTV,2024-06-26,"Child drowns after tube flips over in lake near Cranbrook, B.C.",https://bc.ctvnews.ca/child-drowns-after-tube-flips-over-in-lake-near-cranbrook-b-c-1.6942000,negative,0.010277808,0.58841336,0.40130883,-0.34612464622922445
CTV,2024-06-26,Canada's youngest athlete at the Paris 2024 Olympics could be a 14-year-old skateboarder,https://www.ctvnews.ca/sports/canada-s-youngest-athlete-at-the-paris-2024-olympics-could-be-a-14-year-old-skateboarder-1.6942106,neutral,0.12809138,0.007550339,0.8643583,0.016350391355968164
CTV,2024-06-26,Mother wants answers after 5-year-old dropped off at wrong bus stop,https://www.ctvnews.ca/world/mother-wants-answers-after-5-year-old-dropped-off-at-wrong-bus-stop-1.6941981,negative,0.014431481,0.6306712,0.35489732,-0.3975378989489151
CTV,2024-06-26,Where is Louis Riel? Heritage Minute of Métis leader quietly removed,https://winnipeg.ctvnews.ca/where-is-louis-riel-heritage-minute-of-m%C3%A9tis-leader-quietly-removed-1.6936849,negative,0.011766046,0.44232994,0.54590404,-0.1955173259566969
CTV,2024-06-26,"One of Canada's most popular vehicles recalled over transmission issue; 95,000 impacted",https://www.ctvnews.ca/autos/one-of-canada-s-most-popular-vehicles-recalled-over-transmission-issue-95-000-impacted-1.6939936,negative,0.018216224,0.61971205,0.3620717,-0.3837111989281716
CTV,2024-06-26,CSA provides grant to Western for Martian geology research,https://london.ctvnews.ca/csa-provides-grant-to-western-for-martian-geology-research-1.6942134,neutral,0.17463048,0.00844278,0.8169267,0.030424528368016013
CTV,2024-06-26,No charges for driver in 2023 Manitoba bus crash that killed 17 seniors: RCMP,https://winnipeg.ctvnews.ca/no-charges-for-driver-in-2023-manitoba-bus-crash-that-killed-17-seniors-rcmp-1.6940691,negative,0.008574912,0.6537674,0.33765766,-0.4273383126442347
CTV,2024-06-26,'Disturbing incident': Toronto police identify suspect who allegedly concealed dead body in Riverside apartment,https://toronto.ctvnews.ca/disturbing-incident-toronto-police-identify-suspect-who-allegedly-concealed-dead-body-in-riverside-apartment-1.6941776,negative,0.005238481,0.7835936,0.21116781,-0.613991573352223
CTV,2024-06-26,New $1 coin honouring author of Anne of Green Gables entering circulation,https://atlantic.ctvnews.ca/new-1-coin-honouring-author-of-anne-of-green-gables-entering-circulation-1.6942026,positive,0.254737,0.00610113,0.7391619,0.06485370272527824
CTV,2024-06-26,"B.C. coroner says 11 people died of heat injuries in 2023, urges residents to prepare",https://bc.ctvnews.ca/b-c-coroner-says-11-people-died-of-heat-injuries-in-2023-urges-residents-to-prepare-1.6941784,negative,0.010193046,0.59713763,0.39266944,-0.3564693809094024
CTV,2024-06-26,Are car dealership employees linked to auto thefts in Canada? CTV News investigates,https://www.ctvnews.ca/autos/are-car-dealership-employees-linked-to-auto-thefts-in-canada-ctv-news-investigates-1.6941928,negative,0.014164023,0.35874063,0.62709534,-0.12849421824822116
CTV,2024-06-26,'I just really like the sport': Meet the 90-year-old local slo-pitch player still living out his passion,https://regina.ctvnews.ca/i-just-really-like-the-sport-meet-the-90-year-old-local-slo-pitch-player-still-living-out-his-passion-1.6940480,positive,0.9374853,0.0027445608,0.059770267,0.878871019212015
CTV,2024-06-26,'The federal government can't interfere': Sask. will not comply with federal clean electricity regulations,https://saskatoon.ctvnews.ca/the-federal-government-can-t-interfere-sask-will-not-comply-with-federal-clean-electricity-regulations-1.6941111,negative,0.018622244,0.44806808,0.5333097,-0.20041820543533362
CTV,2024-06-26,Kenya's president says he won't sign a finance bill that led protesters to storm the parliament,https://www.ctvnews.ca/world/kenya-s-president-says-he-won-t-sign-a-finance-bill-that-led-protesters-to-storm-the-parliament-1.6941436,negative,0.0078658005,0.621145,0.3709893,-0.38575919801155223
CTV,2024-06-26,Sask. Party catches heat after using Russian filmed stock footage in campaign ad,https://regina.ctvnews.ca/sask-party-catches-heat-after-using-russian-filmed-stock-footage-in-campaign-ad-1.6941703,negative,0.010403919,0.65733737,0.33225864,-0.4319842115344201
CTV,2024-06-26,Family confronts Ont. man convicted of killing his wife,/video/c2947039-family-seeks-maximum-sentence-for-wife-killer,negative,0.009502998,0.6580511,0.332446,-0.4329408502763332
CTV,2024-06-26,Halifax icon who wore high heels with pride dies at 86,https://atlantic.ctvnews.ca/more/halifax-icon-who-wore-high-heels-with-pride-dies-at-86-1.6941646,positive,0.33018884,0.049581937,0.62022924,0.10656629284802932
CTV,2024-06-26,Police still investigating cause after woman found dead in Kelowna park,https://bc.ctvnews.ca/police-still-investigating-cause-after-woman-found-dead-in-kelowna-park-1.6937902,negative,0.011651847,0.44828284,0.54006535,-0.20082172425051503
CTV,2024-06-26,Walk of Fame inductee Tatiana Maslany celebrated in 'Hometown Stars' event,https://regina.ctvnews.ca/walk-of-fame-inductee-tatiana-maslany-celebrated-in-hometown-stars-event-1.6941544,positive,0.7745513,0.0022471596,0.22320162,0.5999245893355019
CTV,2024-06-26,"Vertical farming company did not mislead investors, B.C. regulator rules",https://bc.ctvnews.ca/vertical-farming-company-did-not-mislead-investors-b-c-regulator-rules-1.6942085,neutral,0.11090514,0.032698505,0.8563964,0.011230756267132325
CTV,2024-06-26,Indigenous burial grounds in northern Ont. to be protected,https://northernontario.ctvnews.ca/indigenous-burial-grounds-in-northern-ont-to-be-protected-1.6940945,neutral,0.064443916,0.032095797,0.90346026,0.0031228788348993675
CTV,2024-06-26,"Gassy cows and pigs will face a carbon tax in Denmark, a world first",https://www.ctvnews.ca/climate-and-environment/gassy-cows-and-pigs-will-face-a-carbon-tax-in-denmark-a-world-first-1.6941379,negative,0.11361772,0.2631448,0.6232375,-0.05633619520341426
CTV,2024-06-26,"House explodes in Transcona, others dealt significant damage: WFPS",https://winnipeg.ctvnews.ca/house-explodes-in-transcona-others-dealt-significant-damage-wfps-1.6941816,negative,0.012568111,0.6551623,0.33226964,-0.4290796296749253
CTV,2024-06-26,Accused at Coutts murder-conspiracy trial said he feared attack by Chinese communists,https://calgary.ctvnews.ca/accused-at-coutts-murder-conspiracy-trial-said-he-feared-attack-by-chinese-communists-1.6941879,negative,0.007980416,0.7080861,0.28393346,-0.5013222421861201
