source,date,headline,url,chosen_label,positive,negative,neutral,compound
Global,2024-04-30,Feds not ruling out possibility of additional international student caps,https://globalnews.ca/video/10401083/feds-not-ruling-out-possibility-of-additional-international-student-caps/,neutral,0.020913167,0.09748817,0.88159865,-0.009066583690369168
Global,2024-04-30,Gardeners need to watch out for these 2 worms in Ontario. Here’s why,https://globalnews.ca/news/10450806/hammerhead-worm-ontario-2024/,negative,0.05377344,0.2759528,0.67027366,-0.07325838460797485
Global,2024-04-30,Posters promoting ‘Steal From Loblaws Day’ are circulating. How did we get here?,https://globalnews.ca/news/10449334/steal-from-loblaws-day-posters-food-inflation/,negative,0.01877658,0.5707495,0.41047394,-0.32540242257118024
Global,2024-04-30,Animal activists thrilled after parts of Ontario agriculture law unconstitutional,https://globalnews.ca/news/10459086/animal-activists-thrilled-ontario-agriculture-law-unconstitutional/,negative,0.08127005,0.36008638,0.55864364,-0.12305736622416674
Global,2024-04-30,"Gaza protests: McGill Pro-Palestinian demonstrations spread to UBC, uOttawa",https://globalnews.ca/video/10458802/gaza-protests-mcgill-pro-palestinian-demonstrations-spread-to-ubc-uottawa/,neutral,0.022062896,0.15946558,0.81847155,-0.024942496031595596
Global,2024-04-30,Syrian refugee family traumatized after son murdered in Halifax,https://globalnews.ca/video/10458806/syrian-refugee-family-traumatized-after-son-murdered-in-halifax/,negative,0.008098169,0.8180499,0.17385201,-0.6691399863764813
Global,2024-04-30,B.C. backtracking on drug decriminalization spurs advocates’ fears of worsening crisis,https://globalnews.ca/video/10458807/b-c-backtracking-on-drug-decriminalization-spurs-advocates-fears-of-worsening-crisis/,negative,0.008032881,0.6845261,0.3074409,-0.46851153620574415
Global,2024-04-30,Pace of economic growth likely slowed through 1st quarter of 2024: StatCan,https://globalnews.ca/news/10459173/canada-gdp-february-2024/,negative,0.029031996,0.34839147,0.6225766,-0.12053374307108555
Global,2024-04-30,International students will get to work more hours per week starting this fall,https://globalnews.ca/news/10457360/canada-international-students-work-24-hours/,neutral,0.19734247,0.006520442,0.796137,0.038901557251858065
Global,2024-04-30,Seattle Storm head coach says WNBA game in Edmonton ‘gives a dreamer something tangible’,https://globalnews.ca/news/10459195/edmonton-wnba-pre-season-game/,positive,0.5152222,0.0056441454,0.4791337,0.26542203540151554
Global,2024-04-30,New recruits prepare for wildfire season,https://globalnews.ca/video/10458752/new-recruits-prepare-for-wildfire-season/,neutral,0.12337618,0.018729638,0.857894,0.014870902084560988
Global,2024-04-30,"Manitoba First Nations file lawsuit against province, building materials company",https://globalnews.ca/video/10458849/manitoba-first-nations-file-lawsuit-against-province-building-materials-company/,negative,0.018661018,0.35390788,0.627431,-0.12490259598343911
Global,2024-04-30,Your Saskatchewan photo of the day: April 2024,https://globalnews.ca/news/10395080/your-saskatchewan-photo-of-the-day-april-2024/,neutral,0.060045578,0.009589147,0.93036544,0.003513511192394514
Global,2024-04-30,B.C. opposition parties want government to back off of drug decriminalization,https://globalnews.ca/video/10458732/b-c-opposition-parties-want-government-to-back-off-of-drug-decriminalization/,negative,0.018829254,0.32319093,0.6579798,-0.10409784379987919
Global,2024-04-30,Cyberattack prompts all London Drugs locations to close temporarily,https://globalnews.ca/video/10458805/cyberattack-prompts-all-london-drugs-locations-to-close-temporarily/,negative,0.010955704,0.6154133,0.37363097,-0.37861353068182524
Global,2024-04-30,Here’s where Canada’s first Shake Shack will open in downtown Toronto,https://globalnews.ca/news/10459093/shake-shack-yonge-dundas-square-toronto/,neutral,0.1182202,0.003655004,0.8781248,0.013962659833260727
Global,2024-04-30,Pro-Palestinian encampment emerges at UBC,https://globalnews.ca/video/10458785/pro-palestinian-encampment-emerges-at-ubc/,negative,0.011104049,0.5951957,0.39370024,-0.3541346341204985
Global,2024-04-30,Loblaw boycott: CEO responds to plans from ‘deeply unhappy’ customers,https://globalnews.ca/news/10456810/loblaw-may-boycott-per-bank/,negative,0.0047779293,0.89893997,0.09628219,-0.8080701761832509
Global,2024-04-30,"All 787 Dreamliners should be grounded, Boeing whistleblower warns",https://globalnews.ca/video/10431523/all-787-dreamliners-should-be-grounded-boeing-whistleblower-warns/,negative,0.0086429035,0.80650926,0.1848478,-0.6503825044510307
Global,2024-04-30,Listeria fears spur recall of T&T meat and vegetable products,https://globalnews.ca/news/10456763/meat-vegetable-product-recall-listeria-canada/,negative,0.0130076585,0.58318686,0.40380555,-0.3399376866314441
Global,2024-04-30,Conestoga is a foreign student mecca. Is its climb to riches leading it off a cliff?,https://globalnews.ca/news/10459197/conestoga-is-a-foreign-student-mecca-is-its-climb-to-riches-leading-it-off-a-cliff/,negative,0.013620766,0.64396954,0.34240964,-0.41451125583564696
Global,2024-04-30,Alberta First Nations hope for new chapter as Trans Mountain pipeline enables record oil output,https://globalnews.ca/news/10459168/trans-mountain-pipeline-alberta-first-nations/,positive,0.54206425,0.00807529,0.4498605,0.2937684083549357
Global,2024-04-30,Denver looks to Calgary for solutions to downtown vacancy woes,https://globalnews.ca/video/10458615/denver-looks-to-calgary-for-solutions-to-downtown-vacancy-woes/,neutral,0.073221505,0.09736753,0.829411,-0.004119047466411008
Global,2024-04-30,Edmonton couple finds potential obsidian artifact in front yard,https://globalnews.ca/news/10458681/edmonton-obsidian-artifact-yard/,neutral,0.04667281,0.08039871,0.87292856,-0.004285598522154599
Global,2024-04-30,Disturbing details in case of Langley man accused of killing wife,https://globalnews.ca/video/10458816/disturbing-details-in-case-of-langley-man-accused-of-killing-wife/,negative,0.0056605223,0.82905245,0.16528708,-0.6872958712648938
Global,2024-04-30,Talks conclude over a global plastic pollution treaty. What to know,https://globalnews.ca/news/10459123/talks-conclude-over-a-global-plastic-pollution-treaty-what-to-know/,neutral,0.03900808,0.1308765,0.83011544,-0.0156070255698193
Global,2024-04-30,FBI warns Chinese hackers targeted Canadian politicians,https://globalnews.ca/video/10458801/fbi-warns-chinese-hackers-targeted-canadian-politicians/,negative,0.016361544,0.42101958,0.56261885,-0.176989802306867
Global,2024-04-30,Canada grounded Boeing MAX-8s after chance encounter led to new data: docs,https://globalnews.ca/news/10456481/canada-boeing-new-data/,neutral,0.037171565,0.09389166,0.8689367,-0.007433921557635337
Global,2024-04-30,Federal minister Randy Boissonnault defends business ties to lobbyist,https://globalnews.ca/news/10457716/federal-minister-randy-boissonnault-defends-business-ties-to-lobbyist/,neutral,0.023599952,0.071862124,0.9045379,-0.0046072074558676235
Global,2024-04-30,Consumers gear up for Loblaw boycott as petition for investigation gains traction,https://globalnews.ca/video/10455546/consumers-gear-up-for-loblaw-boycott-as-petition-for-investigation-gains-traction/,negative,0.04766792,0.23396614,0.71836585,-0.052467941576933796
Global,2024-04-30,Victim of fatal Blue Mountains crash identified by police,https://globalnews.ca/news/10459245/blue-mountains-fatal-crash/,neutral,0.022346927,0.1992403,0.77841276,-0.03919731339305432
Global,2024-04-30,Part of Highway 401 closed after deadly crash in Durham Region,https://globalnews.ca/video/10459192/part-of-highway-401-closed-after-deadly-crash-in-durham-region/,negative,0.009791494,0.6825941,0.3076143,-0.46583892015447326
Global,2024-04-30,Tourists flock to Manitoba town for peacocks,https://globalnews.ca/video/10458809/tourists-flock-to-manitoba-town-for-peacocks/,neutral,0.07319399,0.03298155,0.8938245,0.0042695753415877835
Global,2024-04-30,Infant among 4 dead in Highway 401 crash after officer pursuit,https://globalnews.ca/news/10459095/highway-401-crash-durham-region/,negative,0.009787899,0.6934842,0.2967278,-0.48082457559935676
CTV,2024-04-30,"Over 1,500 students in Huron-Perth sent suspension notices",https://london.ctvnews.ca/over-1-500-students-in-huron-perth-sent-suspension-notices-1.6867236,negative,0.016809475,0.42567733,0.5575132,-0.1809186428035634
CTV,2024-04-30,Trudeau promises to protect local construction jobs — and to hold EV plants to it,https://windsor.ctvnews.ca/trudeau-promises-to-protect-local-construction-jobs-and-to-hold-ev-plants-to-it-1.6867275,positive,0.5056411,0.014821596,0.47953734,0.2554532307036883
CTV,2024-04-30,Netanyahu vows to invade Rafah 'with or without a deal' as cease-fire talks with Hamas continue,https://www.ctvnews.ca/world/netanyahu-vows-to-invade-rafah-with-or-without-a-deal-as-cease-fire-talks-with-hamas-continue-1.6867103,negative,0.009042116,0.63798517,0.35297278,-0.40694326039965567
CTV,2024-04-30,Richmond residents call out city councillors over conduct,https://bc.ctvnews.ca/richmond-residents-call-out-city-councillors-over-conduct-1.6866873,negative,0.021298444,0.40701637,0.5716852,-0.16520869930364057
CTV,2024-04-30,"Health authority confirms cockroaches at B.C. hospital, insists they 'do not bite'",https://bc.ctvnews.ca/health-authority-confirms-cockroaches-at-b-c-hospital-insists-they-do-not-bite-1.6866559,neutral,0.044030536,0.20079145,0.7551779,-0.038378534314410295
CTV,2024-04-30,Northern Ont. volunteer firefighters compete in challenge,https://northernontario.ctvnews.ca/northern-ont-volunteer-firefighters-compete-in-challenge-1.6866191,neutral,0.07752828,0.011928185,0.91054356,0.005868351092921387
CTV,2024-04-30,B.C. man rescues starving dachshund trapped in carrier: BC SPCA,https://bc.ctvnews.ca/b-c-man-rescues-starving-dachshund-trapped-in-carrier-bc-spca-1.6860519,neutral,0.046962813,0.0621451,0.89089215,-0.0016565066682936447
CTV,2024-04-30,"RCMP in Coaldale, Alta., area conduct check stops, pull over more than 200 vehicles",https://calgary.ctvnews.ca/rcmp-in-coaldale-alta-area-conduct-check-stops-pull-over-more-than-200-vehicles-1.6865979,neutral,0.025007982,0.19875923,0.7762328,-0.038879834332980145
CTV,2024-04-30,Statistics Canada says real GDP grew 0.2 per cent in February,https://www.ctvnews.ca/business/statistics-canada-says-real-gdp-grew-0-2-per-cent-in-february-1.6867091,neutral,0.08021767,0.102640145,0.8171421,-0.004100126518268965
CTV,2024-04-30,"Costs associated with youth eating disorders reached $39.5 million during COVID pandemic, study suggests",https://ottawa.ctvnews.ca/costs-associated-with-youth-eating-disorders-reached-39-5-million-during-covid-pandemic-study-suggests-1.6867257,negative,0.016099919,0.53982276,0.44407728,-0.2911494171069169
CTV,2024-04-30,UN experts say North Korea missile landed in Ukraine's Kharkiv: Reuters exclusive,https://www.ctvnews.ca/world/un-experts-say-north-korea-missile-landed-in-ukraine-s-kharkiv-reuters-exclusive-1.6867100,neutral,0.0157748,0.18127102,0.8029542,-0.03261033463392238
CTV,2024-04-30,Site chosen for Windsor's homelessness and housing hub,https://windsor.ctvnews.ca/site-chosen-for-windsor-s-homelessness-and-housing-hub-1.6867182,neutral,0.07223236,0.04936867,0.87839895,0.0027802485764671925
CTV,2024-04-30,"Less alcohol, or none at all, is one path to better health",https://www.ctvnews.ca/health/less-alcohol-or-none-at-all-is-one-path-to-better-health-1.6866072,positive,0.5892585,0.05227378,0.35846776,0.34449298717653676
CTV,2024-04-30,Police charge Corunna man after investigation at Canatara Park,https://london.ctvnews.ca/police-charge-corunna-man-after-investigation-at-canatara-park-1.6867154,neutral,0.02158701,0.07474199,0.90367097,-0.005120367736604736
CTV,2024-04-30,Pierre Poilievre weighs in on BC NDP plan to recriminalize public drug use,https://bc.ctvnews.ca/pierre-poilievre-weighs-in-on-bc-ndp-plan-to-recriminalize-public-drug-use-1.6866945,neutral,0.018392744,0.08278069,0.89882654,-0.006514351443891897
CTV,2024-04-30,"Cisco reveals security breach, warns of state-sponsored spy campaign",https://www.ctvnews.ca/sci-tech/cisco-reveals-security-breach-warns-of-state-sponsored-spy-campaign-1.6864044,negative,0.006548847,0.8033785,0.19007263,-0.6453741869260767
CTV,2024-04-30,CRA to audit Sask. for not paying carbon levies on home heating,https://regina.ctvnews.ca/cra-to-audit-sask-for-not-paying-carbon-levies-on-home-heating-1.6866331,negative,0.01960287,0.3141409,0.6662562,-0.09830024154018702
CTV,2024-04-30,"Road closed in Oak Bay, B.C., so elephant seal can cross",https://bc.ctvnews.ca/road-closed-in-oak-bay-b-c-so-elephant-seal-can-cross-1.6865332,negative,0.029255848,0.2781308,0.6926134,-0.07650081822335952
CTV,2024-04-30,Interim commissioner Duheme to head RCMP permanently,https://www.ctvnews.ca/politics/interim-commissioner-duheme-to-head-rcmp-permanently-1.6866756,neutral,0.037184946,0.026888736,0.93592626,0.000659716738742766
CTV,2024-04-30,"Ahead of the Paris Olympics, police clear a migrant camp near City Hall",https://www.ctvnews.ca/sports/ahead-of-the-paris-olympics-police-clear-a-migrant-camp-near-city-hall-1.6867119,neutral,0.033684935,0.05345795,0.91285723,-0.0017230751130612454
CTV,2024-04-30,Multi-vehicle crash in northeast London,https://london.ctvnews.ca/multi-vehicle-crash-in-northeast-london-1.6867172,negative,0.021849513,0.5263882,0.45176226,-0.276607165292706
CTV,2024-04-30,Anne Hathaway reveals she's now five years sober,https://www.ctvnews.ca/entertainment/anne-hathaway-reveals-she-s-now-five-years-sober-1.6865752,positive,0.47218177,0.0045443163,0.52327394,0.2229349565397314
CTV,2024-04-30,Sinkhole closes downtown Windsor intersection,https://windsor.ctvnews.ca/sinkhole-closes-downtown-windsor-intersection-1.6866627,negative,0.009956112,0.7993741,0.1906697,-0.6388998918822004
CTV,2024-04-30,Arrest made in fatal White Rock stabbing,https://bc.ctvnews.ca/arrest-made-in-fatal-white-rock-stabbing-1.6866753,negative,0.02276648,0.36155176,0.6156818,-0.13020134394489702
CTV,2024-04-30,'It was a journey': Historical society brings Fokker jetliner home to Lethbridge,https://calgary.ctvnews.ca/it-was-a-journey-historical-society-brings-fokker-jetliner-home-to-lethbridge-1.6866479,neutral,0.10982362,0.010202484,0.879974,0.011957126127868811
CTV,2024-04-30,"Singh still not ready to say if NDP will back budget, holding out for 'clarity' on disability benefit",https://www.ctvnews.ca/politics/singh-still-not-ready-to-say-if-ndp-will-back-budget-holding-out-for-clarity-on-disability-benefit-1.6866269,negative,0.02035999,0.3544825,0.6251575,-0.12524332468699484
CTV,2024-04-30,Mystery surrounds abandoned car found in South Bruce Peninsula,https://barrie.ctvnews.ca/mystery-surrounds-abandoned-car-found-in-south-bruce-peninsula-1.6867180,neutral,0.044503946,0.13686104,0.81863505,-0.016750340977385036
CTV,2024-04-30,WATCH: $90K worth of golf carts stolen from Ont. club,/video/c2912865-opp-investigating-11-stolen-golf-carts,negative,0.015974546,0.49064365,0.4933818,-0.24047600527949697
CTV,2024-04-30,"Police searching for 'armed man' in Dartmouth, N.S., residents asked to shelter in place",https://atlantic.ctvnews.ca/police-searching-for-armed-man-in-dartmouth-n-s-residents-asked-to-shelter-in-place-1.6867261,neutral,0.015016301,0.114985466,0.86999816,-0.012996175500544105
CTV,2024-04-30,Toronto transit workers vote 'overwhelmingly' in support of strike mandate,https://toronto.ctvnews.ca/toronto-transit-workers-vote-overwhelmingly-in-support-of-strike-mandate-1.6865498,neutral,0.121894896,0.08763147,0.7904736,0.0071790926758597
CTV,2024-04-30,Drinks outside on Rice Howard Way? Council to review proposal next month,https://edmonton.ctvnews.ca/drinks-outside-on-rice-howard-way-council-to-review-proposal-next-month-1.6866500,neutral,0.023223458,0.034256265,0.9425202,-0.0006341635097876219
CTV,2024-04-30,Sask. school divisions struggling to 'maintain a status quo' amid years of underfunding,https://saskatoon.ctvnews.ca/sask-school-divisions-struggling-to-maintain-a-status-quo-amid-years-of-underfunding-1.6866839,negative,0.010699645,0.6813865,0.307914,-0.4641729805404431
CTV,2024-04-30,What is Road Soup? Winnipeg test drives new pothole patching project,https://winnipeg.ctvnews.ca/what-is-road-soup-winnipeg-test-drives-new-pothole-patching-project-1.6866588,neutral,0.05303395,0.05098237,0.89598376,0.00021339771924000495
CTV,2024-04-30,Man charged with two break-ins in one night: OPP,https://barrie.ctvnews.ca/man-charged-with-two-break-ins-in-one-night-opp-1.6867060,negative,0.011345551,0.60696214,0.38169226,-0.36827434060246134
CTV,2024-04-30,Encampments 'will not be tolerated' for pro-Palestinian demonstration: uOttawa,https://ottawa.ctvnews.ca/encampments-will-not-be-tolerated-for-pro-palestinian-demonstration-uottawa-1.6865685,negative,0.008805381,0.73052096,0.26067358,-0.5335833864106903
CTV,2024-04-30,680 fake identities created in major credit card scheme,/video/c2912860-busted-fraud-scheme-created-680-fake-identities?playlistId=1.6867044,negative,0.029474493,0.5303694,0.44015616,-0.28042292567413796
CTV,2024-04-30,"In a world first, king-size cigarettes in Canada must feature one of these warnings starting Tuesday",https://www.ctvnews.ca/health/in-a-world-first-king-size-cigarettes-in-canada-must-feature-one-of-these-warnings-starting-tuesday-1.6865690,positive,0.33400896,0.026300447,0.6396906,0.11087027243870295
CTV,2024-04-30,Rolls-Royce is growing its factory so it can build its 'bespoke' cars more slowly,https://www.ctvnews.ca/autos/rolls-royce-is-growing-its-factory-so-it-can-build-its-bespoke-cars-more-slowly-1.6866283,positive,0.3959751,0.0142831355,0.58974177,0.15659228251308477
CTV,2024-04-30,Twins from Toronto were Canada's top two female finishers at this year's Boston Marathon,https://toronto.ctvnews.ca/twins-from-toronto-were-canada-s-top-two-female-finishers-at-this-year-s-boston-marathon-1.6859612,positive,0.41708407,0.0029341555,0.5799818,0.1739504982045048
CTV,2024-04-30,Sikh rally in Toronto with multi-party support prompts India diplomatic rebuke,https://www.ctvnews.ca/politics/sikh-rally-in-toronto-with-multi-party-support-prompts-india-diplomatic-rebuke-1.6867244,negative,0.015403484,0.42621255,0.55838394,-0.18141988217109883
CTV,2024-04-30,"Britney and Jamie Spears settlement avoids long, potentially ugly and revealing trial",https://www.ctvnews.ca/entertainment/britney-and-jamie-spears-settlement-avoids-long-potentially-ugly-and-revealing-trial-1.6866821,negative,0.020572387,0.52555066,0.4538769,-0.27578030779995544
CTV,2024-04-30,A group of Toronto tenants have been on a rent strike for a year and say there's no resolution in sight,https://toronto.ctvnews.ca/a-group-of-toronto-tenants-have-been-on-a-rent-strike-for-a-year-and-say-there-s-no-resolution-in-sight-1.6867029,negative,0.005474084,0.8670661,0.12745984,-0.7517736178380341
CTV,2024-04-30,Winner of US$1.3 billion Powerball jackpot is an immigrant from Laos who has cancer,https://www.ctvnews.ca/lifestyle/winner-of-us-1-3-billion-powerball-jackpot-is-an-immigrant-from-laos-who-has-cancer-1.6866364,neutral,0.09529048,0.13164333,0.7730662,-0.008249687989239973
CTV,2024-04-30,Green Party deputy leader released pending appeal of jail sentence for Fairy Creek protests,https://bc.ctvnews.ca/green-party-deputy-leader-released-pending-appeal-of-jail-sentence-for-fairy-creek-protests-1.6866495,neutral,0.05531085,0.038679346,0.9060099,0.0015631963902462687
CTV,2024-04-30,"At plastics treaty talks in Ottawa, sharp disagreements on whether to limit plastic production",https://www.ctvnews.ca/climate-and-environment/at-plastics-treaty-talks-in-ottawa-sharp-disagreements-on-whether-to-limit-plastic-production-1.6867142,negative,0.015960397,0.3060594,0.67798024,-0.09341760752985984
CTV,2024-04-30,McGill calls for police assistance to de-escalate protests,/video/c2913189-mcgill-calls-for-police-assistance-amid-protests?playlistId=1.6865144,neutral,0.041551333,0.09192434,0.8665243,-0.006723573370559732
CTV,2024-04-30,Federal addictions minister says B.C public decriminalization reversal under review,https://www.ctvnews.ca/politics/federal-addictions-minister-says-b-c-public-decriminalization-reversal-under-review-1.6865984,neutral,0.023640344,0.074077286,0.90228236,-0.004928579254386278
CTV,2024-04-30,B.C. breweries take home awards at World Beer Cup,https://bc.ctvnews.ca/b-c-breweries-take-home-awards-at-world-beer-cup-1.6864834,positive,0.36876705,0.0067499676,0.624483,0.13594357736604223
CTV,2024-04-30,Third youth charged with second-degree murder in death of 16-year-old: Halifax police,https://atlantic.ctvnews.ca/third-youth-charged-with-second-degree-murder-in-death-of-16-year-old-halifax-police-1.6865928,negative,0.0072891274,0.75800925,0.23470165,-0.574524888228451
CTV,2024-04-30,Cybersecurity expert weighs in on the possibility of a U.S. ban of TikTok,https://atlantic.ctvnews.ca/cybersecurity-expert-weighs-in-on-the-possibility-of-a-u-s-ban-of-tiktok-1.6865156,neutral,0.025727155,0.15341833,0.8208545,-0.022875302110518803
CTV,2024-04-30,Police seek help in determining how a young man died in Blue Mountains crash,https://barrie.ctvnews.ca/police-seek-help-in-determining-how-a-young-man-died-in-blue-mountains-crash-1.6866986,negative,0.017270492,0.37916008,0.6035693,-0.14346412551801713
CTV,2024-04-30,'He was watching from up above': Canucks comeback win takes on special meaning for grieving B.C. family,https://bc.ctvnews.ca/he-was-watching-from-up-above-canucks-comeback-win-takes-on-special-meaning-for-grieving-b-c-family-1.6865786,positive,0.5099492,0.015754344,0.47429633,0.25980005365019565
CTV,2024-04-30,NDP says Ottawa's new grocery task force isn't living up to government promises,https://www.ctvnews.ca/politics/ndp-says-ottawa-s-new-grocery-task-force-isn-t-living-up-to-government-promises-1.6867069,negative,0.010374205,0.7268226,0.26280308,-0.528163574817313
CTV,2024-04-30,Alberta Municipalities say proposed provincial bill will create chill effect,https://edmonton.ctvnews.ca/alberta-municipalities-say-proposed-provincial-bill-will-create-chill-effect-1.6866512,neutral,0.03397982,0.11935179,0.8466683,-0.013090229208557957
CTV,2024-04-30,Police warn of malicious 'Cheat Lab' program targeting gamers,https://ottawa.ctvnews.ca/police-warn-of-malicious-cheat-lab-program-targeting-gamers-1.6866813,negative,0.007912353,0.7920388,0.2000488,-0.6272628997119725
CTV,2024-04-30,U.S. military ships are working to build a pier for Gaza aid. It's going to cost at least US$320 million,https://www.ctvnews.ca/world/u-s-military-ships-are-working-to-build-a-pier-for-gaza-aid-it-s-going-to-cost-at-least-us-320-million-1.6867204,negative,0.041542456,0.42355478,0.5349028,-0.17767285042931746
CTV,2024-04-30,What we know about the deadly crash on Ontario's Highway 401,/video/c2913194-deadly-crash-on-ontario-s-highway-401?playlistId=1.6867050,negative,0.011271198,0.5836993,0.40502936,-0.3405779193466074
CTV,2024-04-30,Tractor-trailers with no one aboard? The future is near for self-driving trucks on U.S. roads,https://www.ctvnews.ca/autos/tractor-trailers-with-no-one-aboard-the-future-is-near-for-self-driving-trucks-on-u-s-roads-1.6865492,positive,0.43792224,0.0150027815,0.54707503,0.19155077884754235
CTV,2024-04-30,Waterloo exploring potential MZO for new affordable housing project,https://kitchener.ctvnews.ca/waterloo-exploring-potential-mzo-for-new-affordable-housing-project-1.6866456,neutral,0.20191824,0.0073680016,0.7907137,0.04071669580437565
CTV,2024-04-30,Thousands without power as heavy snow blankets Calgary,https://calgary.ctvnews.ca/thousands-without-power-as-heavy-snow-blankets-calgary-1.6867216,negative,0.0148267,0.7564925,0.22868076,-0.5720610864293949
CTV,2024-04-30,Kazakhstan arrests ex-interior minister in connection with unrest that left 238 dead,https://www.ctvnews.ca/world/kazakhstan-arrests-ex-interior-minister-in-connection-with-unrest-that-left-238-dead-1.6867075,negative,0.005267725,0.7627343,0.23199792,-0.5817358879327195
CTV,2024-04-30,"'It was instant karma': Viral video captures failed theft attempt in Nanaimo, B.C.",https://bc.ctvnews.ca/it-was-instant-karma-viral-video-captures-failed-theft-attempt-in-nanaimo-b-c-1.6860578,negative,0.010843112,0.73182815,0.25732863,-0.5354549588889626
CTV,2024-04-30,"4 dead, including infant, in wrong-way crash involving police on Ontario's Highway 401",https://toronto.ctvnews.ca/4-dead-including-infant-in-wrong-way-crash-involving-police-on-ontario-s-highway-401-1.6867192,negative,0.007840815,0.7300627,0.26209635,-0.5329301875069952
CTV,2024-04-30,Plenty of smiles at Tim Hortons across Canada,https://northernontario.ctvnews.ca/plenty-of-smiles-at-tim-hortons-across-canada-1.6866220,positive,0.9690276,0.0036281932,0.027344167,0.939001342282701
CTV,2024-04-30,Search crews called in after missing Kelowna senior's truck found,https://bc.ctvnews.ca/search-crews-called-in-after-missing-kelowna-senior-s-truck-found-1.6859073,neutral,0.034902282,0.06520745,0.89989036,-0.003033839513589154
CTV,2024-04-30,"Arrest made in fatal White Rock, B.C. park stabbing",/video/c2913002-arrest-made-in-fatal-white-rock-stabbing?playlistId=1.6867061,negative,0.017625926,0.4028201,0.5795539,-0.16195339090320005
CTV,2024-04-30,Explosion in Cambodia that killed 20 at an army base was likely caused by mishandling of ammunition,https://www.ctvnews.ca/world/explosion-in-cambodia-that-killed-20-at-an-army-base-was-likely-caused-by-mishandling-of-ammunition-1.6867134,negative,0.0050046104,0.83973813,0.15525723,-0.7051351318173715
