source,date,headline,url,chosen_label,positive,negative,neutral,compound
Global,2024-04-10,Bank of Canada holds key interest rate steady at 5%,https://globalnews.ca/video/10414445/business-matters-the-bank-of-canada-holds-key-interest-rate-steady-at-5/,neutral,0.18054213,0.025273561,0.79418427,0.03195671339946582
Global,2024-04-10,"Winnipeg man arrested and charged with 2nd-degree murder, police say",https://globalnews.ca/news/10414784/winnipeg-police-second-degree-murder/,negative,0.0075462363,0.7990786,0.19337514,-0.6384696607157476
Global,2024-04-10,"Threatening politicians could result in $1,500 fine under new Quebec bill",https://globalnews.ca/news/10414915/quebec-bill-politicians-threats-fines/,negative,0.00956905,0.73295707,0.2574739,-0.5371344925914805
Global,2024-04-10,"Cannabis stores coming to Surrey, council approves framework",https://globalnews.ca/video/10414484/cannabis-stores-coming-to-surrey-council-approves-framework/,neutral,0.1097733,0.008627768,0.88159895,0.011975737687990318
Global,2024-04-10,Saskatoon Muslim community celebrates end of Ramadan,https://globalnews.ca/news/10414510/muslim-community-celebrates-end-of-ramadan-saskatoon/,positive,0.4985579,0.004785362,0.4966568,0.24853704599660187
Global,2024-04-10,"Saskatoon Fire Department talks safety around dry conditions, controlled burns",https://globalnews.ca/news/10414800/saskatoon-fire-department-fire-safety-dry-conditions-controlled-burns/,neutral,0.06627031,0.023298306,0.9104313,0.0038489449448295687
Global,2024-04-10,Apple to pay up to $14.4M in iPhone throttling settlement,https://globalnews.ca/video/10335454/apple-to-pay-up-to-14-4m-in-iphone-throttling-settlement/,neutral,0.055886347,0.1341618,0.80995196,-0.014876097106179209
Global,2024-04-10,Dry conditions mean a slow start to mosquito season in Edmonton,https://globalnews.ca/news/10414540/edmonton-mosquito-population-spring-2024/,negative,0.011299886,0.80689216,0.18180811,-0.6509471221967047
Global,2024-04-10,Muslims in Toronto celebrate Eid,https://globalnews.ca/video/10414452/muslims-in-toronto-celebrate-eid/,positive,0.5711269,0.0063217343,0.4225515,0.3261458794949732
Global,2024-04-10,"3 arrested after drugs, weapons, open alcohol found in car: Manitoba First Nations police",https://globalnews.ca/news/10414291/mfnps-drugs-weapons/,negative,0.012939097,0.48840365,0.49865732,-0.23837067498237285
Global,2024-04-10,Woman accused of solar eclipse shootings said God told her to do it: police,https://globalnews.ca/news/10411690/solar-eclipse-shooting-god-woman-taylon-nichelle-celestine/,negative,0.01646041,0.5386119,0.44492763,-0.2898318525876391
Global,2024-04-10,"Housing crisis: Fraser fears builders will hit ceiling of homes they can build, urges rapid industry growth",https://globalnews.ca/video/10414871/housing-crisis-fraser-fears-builders-will-hit-ceiling-of-homes-they-can-build-urges-rapid-industry-growth/,negative,0.014950835,0.63013214,0.35491708,-0.3968429671501106
Global,2024-04-10,Premier Ford says he only wants ‘Ontario students’ at medical schools,https://globalnews.ca/news/10400024/ontario-students-universities-ford-comments/,neutral,0.032605335,0.1408098,0.82658494,-0.01876428501924643
Global,2024-04-10,"Bank of Canada holds key rate, but signals June cut in ‘realm of possibilities’",https://globalnews.ca/news/10413855/bank-of-canada-interest-rate-april-2024/,neutral,0.057711672,0.066885844,0.87540245,-0.0011430793287914298
Global,2024-04-10,Season’s first pelican touches down in Saskatoon’s ‘splash zone’ on Monday,https://globalnews.ca/news/10414907/pelican-touches-down-in-saskatoon-splash-zone/,neutral,0.050014347,0.022819301,0.92716634,0.0019807146395971476
Global,2024-04-10,"Guns, ammunition, drugs found in Lac du Bonnet, Man. home, 2 arrested: RCMP",https://globalnews.ca/news/10414724/rcmp-lac-du-bonnet-drugs-weapons/,negative,0.018050255,0.2361437,0.74580604,-0.05543803550089965
Global,2024-04-10,Got an old iPhone? Here’s how to submit a class-action settlement claim,https://globalnews.ca/news/10414139/apple-class-action-settlement-iphone-6-7/,neutral,0.07937535,0.1307717,0.7898528,-0.010800798638215259
Global,2024-04-10,Central Alberta family of 6 located safe: RCMP,https://globalnews.ca/news/10411973/central-alberta-missing-family/,neutral,0.17263632,0.015700746,0.8116628,0.029556807401959873
Global,2024-04-10,Canadians warned to prepare for early and stronger wildfire season,https://globalnews.ca/video/10414716/canadians-warned-to-prepare-for-early-and-stronger-wildfire-season/,neutral,0.05258535,0.12589517,0.8215194,-0.013084383194261306
Global,2024-04-10,‘Oatzempic’ is gaining steam online. What is this weight loss trend?,https://globalnews.ca/news/10403175/oatzempic-trend-weight-loss/,neutral,0.08146039,0.060603198,0.85793644,0.0029630464601202444
Global,2024-04-10,"Fire at iconic theatre in The Pas considered arson, Manitoba RCMP say",https://globalnews.ca/video/10413617/fire-at-iconic-theatre-in-the-pas-considered-arson-manitoba-rcmp-say/,negative,0.013741819,0.4229961,0.56326216,-0.17873682956319747
Global,2024-04-10,International student cap allocated among provinces,https://globalnews.ca/video/10414571/international-student-cap-allocated-among-provinces/,neutral,0.076661244,0.053532984,0.86980575,0.003011166380276764
Global,2024-04-10,"Bank of Canada holds key rate, signals June cut in the ‘realm of possibilities’",https://globalnews.ca/video/10414406/bank-of-canada-holds-key-rate-signals-june-cut-in-the-realm-of-possibilities/,neutral,0.08815737,0.036202546,0.87564015,0.006461093976951382
Global,2024-04-10,Caught on camera? Winnipeg business owner says overflowing bin staged by garbage company,https://globalnews.ca/news/10414242/waste-management-fine-winnipeg/,negative,0.013708181,0.61143464,0.37485707,-0.37366447437175054
Global,2024-04-10,Resurfacing roads and addressing resurfacing potholes in Winnipeg,https://globalnews.ca/video/10414001/resurfacing-roads-and-addressing-resurfacing-potholes-in-winnipeg/,neutral,0.064278096,0.060588,0.87513393,0.0004607679643309215
Global,2024-04-10,Canadian researchers create natural supplement to combat postpartum blues,https://globalnews.ca/news/10413933/postpartum-blues-natural-supplement-blues-away-canada/,neutral,0.1672527,0.021587612,0.81115973,0.027507435735133257
Global,2024-04-10,BC First Nations Health Authority makes major changes to counselling services,https://globalnews.ca/video/10414304/bc-first-nations-health-authority-makes-major-changes-to-counselling-services/,neutral,0.039203096,0.038297594,0.9224993,7.01770852482575e-05
Global,2024-04-10,Health Canada recalls multiple medical devices including one that may cause death,https://globalnews.ca/news/10399989/health-care-products-recalled-canada/,negative,0.0101575935,0.80500555,0.18483669,-0.6479309017438197
Global,2024-04-10,"Regina seniors seek help from province over safety concerns in, around their home",https://globalnews.ca/video/10414274/regina-seniors-seek-help-from-province-over-safety-concerns-in-around-their-home/,neutral,0.048964288,0.1048559,0.8461798,-0.00859726023736962
Global,2024-04-10,Canadian recaps chaotic journey home from Haiti,https://globalnews.ca/video/10414282/canadian-recaps-chaotic-journey-home-from-haiti/,negative,0.016095152,0.27903858,0.7048663,-0.07760346610594482
Global,2024-04-10,"As AUKUS looks to collaborate with other allies, why is Canada not mentioned?",https://globalnews.ca/news/10412323/aukus-canada-membership-explainer/,neutral,0.046192147,0.064098306,0.8897095,-0.001974879736735602
CTV,2024-04-10,B.C. man who killed 2 black bears in yard had left beehive debris on property,https://bc.ctvnews.ca/b-c-man-who-killed-2-black-bears-in-yard-had-left-beehive-debris-on-property-1.6840892,negative,0.007935494,0.70166075,0.2904038,-0.49226477674840297
CTV,2024-04-10,Fighting for change: Bradley Pogue’s mother petitions for parole reform,https://kitchener.ctvnews.ca/fighting-for-change-bradley-pogue-s-mother-petitions-for-parole-reform-1.6841412,positive,0.26044232,0.013738084,0.7258195,0.06764148375582923
CTV,2024-04-10,"Meals, beverages on some flights could be impacted by potential strike involving Toronto Pearson airport food service workers",https://toronto.ctvnews.ca/meals-beverages-on-some-flights-could-be-impacted-by-potential-strike-involving-toronto-pearson-airport-food-service-workers-1.6841225,negative,0.01827862,0.3850928,0.59662855,-0.14796236334904123
CTV,2024-04-10,Elon Musk announces Tesla will unveil a 'robotaxi' on August 8,https://www.ctvnews.ca/autos/elon-musk-announces-tesla-will-unveil-a-robotaxi-on-august-8-1.6835863,positive,0.41241625,0.0036069276,0.5839768,0.17007416520711693
CTV,2024-04-10,Calgary police seek missing seniors last spotted in Monterey Park,https://calgary.ctvnews.ca/calgary-police-seek-missing-seniors-last-spotted-in-monterey-park-1.6841632,neutral,0.031675816,0.038307253,0.93001693,-0.0004640883356883396
CTV,2024-04-10,Students sent home early after fire breaks out in Barrie high school,https://barrie.ctvnews.ca/students-sent-home-early-after-fire-breaks-out-in-barrie-high-school-1.6841324,negative,0.009086643,0.5558487,0.43506464,-0.3088852131180264
CTV,2024-04-10,Court addresses former World Junior hockey players' sexual assault case,https://london.ctvnews.ca/court-addresses-former-world-junior-hockey-players-sexual-assault-case-1.6840385,negative,0.0129598575,0.5632218,0.42381844,-0.3170508031961816
CTV,2024-04-10,Two separate shooting incidents under investigation,https://windsor.ctvnews.ca/two-separate-shooting-incidents-under-investigation-1.6841639,negative,0.016623607,0.45870826,0.5246681,-0.21013693312471204
CTV,2024-04-10,Winnipeg ready for another year of Whiteout Street Parties outside Canada Life Centre,https://winnipeg.ctvnews.ca/winnipeg-ready-for-another-year-of-whiteout-street-parties-outside-canada-life-centre-1.6841005,positive,0.3329937,0.016544394,0.65046203,0.11061104009901612
CTV,2024-04-10,Man accused of killing Canadians in Dominica demands bail,/video/c2900807-ctv-national-news--what-we-know-about-bail-request?playlistId=1.6671378,negative,0.008280051,0.7464466,0.24527332,-0.5571140037856637
CTV,2024-04-10,Both drivers charged following fatal Huron County crash,https://london.ctvnews.ca/both-drivers-charged-following-fatal-huron-county-crash-1.6841202,negative,0.013930256,0.6165508,0.36951894,-0.3799408407321714
CTV,2024-04-10,"Time ticks down for orca calf stranded in B.C. lagoon as rescue efforts ramp up, but no set date",https://bc.ctvnews.ca/time-ticks-down-for-orca-calf-stranded-in-b-c-lagoon-as-rescue-efforts-ramp-up-but-no-set-date-1.6841106,negative,0.023218168,0.23436478,0.7424171,-0.054387756226606854
CTV,2024-04-10,"Despite errors, court upholds acquittal of North Bay man charged with assaulting police",https://northernontario.ctvnews.ca/despite-errors-court-upholds-acquittal-of-north-bay-man-charged-with-assaulting-police-1.6841608,neutral,0.087600216,0.12788008,0.7845198,-0.008679513761478574
CTV,2024-04-10,Carbon tax meeting: Poilievre pushes for meeting with PM,/video/c2901036-mps-to-vote-on-carbon-tax-meeting-with-trudeau?playlistId=1.6828302,neutral,0.05654893,0.013736795,0.9297141,0.0030090901434109973
CTV,2024-04-10,"NDP says carbon price is not 'be-all, end-all' of climate policy, backs Tory motion",https://www.ctvnews.ca/politics/ndp-says-carbon-price-is-not-be-all-end-all-of-climate-policy-backs-tory-motion-1.6841567,negative,0.020719277,0.37819347,0.60108703,-0.14260108473448518
CTV,2024-04-10,Quebec teacher fired after taking leave to be on 'Survivor' reality TV series,https://montreal.ctvnews.ca/quebec-teacher-fired-after-taking-leave-to-be-on-survivor-reality-tv-series-1.6840465,negative,0.020093823,0.44581363,0.53409266,-0.19834597648157626
CTV,2024-04-10,B.C. doesn't know where all its groundwater is going. Experts worry as drought looms,https://bc.ctvnews.ca/b-c-doesn-t-know-where-all-its-groundwater-is-going-experts-worry-as-drought-looms-1.6841267,negative,0.010960815,0.60286355,0.38617575,-0.3633242500660572
CTV,2024-04-10,Six children of Canadian mother to be repatriated from Syrian detention camp,https://www.ctvnews.ca/politics/six-children-of-canadian-mother-to-be-repatriated-from-syrian-detention-camp-1.6840704,negative,0.016129835,0.2309684,0.7529017,-0.0530862497692155
CTV,2024-04-10,'It was surreal': Ontario mother gives birth to son on day of solar eclipse,https://toronto.ctvnews.ca/it-was-surreal-ontario-mother-gives-birth-to-son-on-day-of-solar-eclipse-1.6840144,positive,0.60947406,0.005427487,0.38509846,0.3714291758353738
CTV,2024-04-10,"Knives shouldn't be for sale in convenience stores, community group and police argue",https://edmonton.ctvnews.ca/knives-shouldn-t-be-for-sale-in-convenience-stores-community-group-and-police-argue-1.6841578,negative,0.018712802,0.5774531,0.4038342,-0.33310183641527047
CTV,2024-04-10,Unique photo exhibit put cameras in the hands of survivors of domestic and sexual violence,https://www.ctvnews.ca/canada/unique-photo-exhibit-put-cameras-in-the-hands-of-survivors-of-domestic-and-sexual-violence-1.6840661,neutral,0.21155028,0.04815821,0.7402916,0.04243429302368895
CTV,2024-04-10,"Bermuda Shorts Day party closes street, draws police to frustration of neighbours",https://calgary.ctvnews.ca/bermuda-shorts-day-party-closes-street-draws-police-to-frustration-of-neighbours-1.6841528,negative,0.009937586,0.72075593,0.26930636,-0.5193904465797239
CTV,2024-04-10,"Rundle Park Golf Course opens Wednesday, Victoria and Riverside to open later",https://edmonton.ctvnews.ca/rundle-park-golf-course-opens-wednesday-victoria-and-riverside-to-open-later-1.6841411,neutral,0.080884404,0.0031814666,0.9159342,0.006532159379482039
CTV,2024-04-10,"Sask. man finds US$4,200 in counterfeit bills in his mailbox",https://regina.ctvnews.ca/sask-man-finds-us-4-200-in-counterfeit-bills-in-his-mailbox-1.6841506,negative,0.016435405,0.54396117,0.43960342,-0.29562364541861186
CTV,2024-04-10,Sault police charge driver who hit school bus with students on board,https://northernontario.ctvnews.ca/sault-police-charge-driver-who-hit-school-bus-with-students-on-board-1.6841454,negative,0.01433065,0.5243682,0.46130118,-0.2747566549637934
CTV,2024-04-10,Tesla settles case over fatal Autopilot crash of Apple engineer,https://www.ctvnews.ca/autos/tesla-settles-case-over-fatal-autopilot-crash-of-apple-engineer-1.6838742,negative,0.0147173535,0.67348963,0.31179306,-0.45337166227356285
CTV,2024-04-10,Dentist who let officer extract teeth from N.L. inmate granted absolute discharge,https://www.ctvnews.ca/canada/dentist-who-let-officer-extract-teeth-from-n-l-inmate-granted-absolute-discharge-1.6839703,negative,0.0114819165,0.70723647,0.28128153,-0.5000516292962232
CTV,2024-04-10,'I'm not paying it': Family furious over $400/day hospital fine for not moving to LTC,https://windsor.ctvnews.ca/i-m-not-paying-it-family-furious-over-400-day-hospital-fine-for-not-moving-to-ltc-1.6840953,negative,0.008610013,0.80625015,0.18513991,-0.6499651206889423
CTV,2024-04-10,Mandarin Ogilvie set to close after 36 years in business,https://ottawa.ctvnews.ca/mandarin-ogilvie-set-to-close-after-36-years-in-business-1.6840945,negative,0.026239099,0.35817954,0.61558133,-0.12760410214993634
CTV,2024-04-10,New Ontario housing bill to eliminate parking requirements near transit,https://toronto.ctvnews.ca/new-ontario-housing-bill-to-eliminate-parking-requirements-near-transit-1.6841408,neutral,0.04227468,0.14929281,0.8084325,-0.02050119316282295
CTV,2024-04-10,"'I'm indebted to these guys': First responder, former cop save N.S. man's life in hockey rink",https://atlantic.ctvnews.ca/more/i-m-indebted-to-these-guys-first-responder-former-cop-save-n-s-man-s-life-in-hockey-rink-1.6829184,positive,0.9084342,0.0065061743,0.085059695,0.8252103409476144
CTV,2024-04-10,B.C. nurses union says patients and staff at Vancouver Island hospitals exposed to harmful illicit drugs,https://bc.ctvnews.ca/b-c-nurses-union-says-patients-and-staff-at-vancouver-island-hospitals-exposed-to-harmful-illicit-drugs-1.6841443,negative,0.013073758,0.6251498,0.36177647,-0.3906413327863163
CTV,2024-04-10,Black cart swap begins next week in Saskatoon,https://saskatoon.ctvnews.ca/black-cart-swap-begins-next-week-in-saskatoon-1.6841483,neutral,0.028640589,0.026860107,0.9444994,9.881786708842988e-05
CTV,2024-04-10,NBA Commissioner says Toronto Raptor Jontay Porter could be to banned from league following gambling probe result,https://toronto.ctvnews.ca/nba-commissioner-says-toronto-raptor-jontay-porter-could-be-to-banned-from-league-following-gambling-probe-result-1.6841651,negative,0.009742454,0.4989673,0.49129033,-0.248873412141009
CTV,2024-04-10,Missing family from central Alberta found safe: RCMP,https://edmonton.ctvnews.ca/missing-family-from-central-alberta-found-safe-rcmp-1.6839929,neutral,0.098157935,0.020694358,0.8811478,0.00920671612852475
CTV,2024-04-10,"Grocery inflation to fall below two per cent this spring, report predicts",https://www.ctvnews.ca/business/grocery-inflation-to-fall-below-two-per-cent-this-spring-report-predicts-1.6841393,negative,0.01622586,0.4949309,0.48884338,-0.24469325392690422
CTV,2024-04-10,Trump says Arizona's abortion ban goes too far while defending the overturning of Roe v. Wade,https://www.ctvnews.ca/world/trump-says-arizona-s-abortion-ban-goes-too-far-while-defending-the-overturning-of-roe-v-wade-1.6841641,negative,0.015095834,0.49836445,0.48653972,-0.24813923949362504
CTV,2024-04-10,Conditions in place for another devastating wildfire season,/video/c2901103-canada-could-face-another-tough-wildfire-season?playlistId=1.6712527,negative,0.009114269,0.86257464,0.12831104,-0.7439519853212531
CTV,2024-04-10,Four men arrested in southern Manitoba for child pornography charges,https://winnipeg.ctvnews.ca/four-men-arrested-in-southern-manitoba-for-child-pornography-charges-1.6841382,negative,0.009098394,0.69418836,0.29671332,-0.48181463183331275
CTV,2024-04-10,Intimate partner violence could be declared an epidemic in Ontario after Ford government backs NDP bill,https://toronto.ctvnews.ca/intimate-partner-violence-could-be-declared-an-epidemic-in-ontario-after-ford-government-backs-ndp-bill-1.6841280,negative,0.006770295,0.820964,0.17226584,-0.6739359081064906
CTV,2024-04-10,"30 cats, owner living in 'unsafe condition' in eastern Ontario, OPP say",https://ottawa.ctvnews.ca/30-cats-owner-living-in-unsafe-condition-in-eastern-ontario-opp-say-1.6841329,negative,0.010320952,0.47565284,0.5140262,-0.22613909161924006
CTV,2024-04-10,Couple lucky to be alive after piece of Montreal highway crashes into their windshield,https://montreal.ctvnews.ca/couple-lucky-to-be-alive-after-piece-of-montreal-highway-crashes-into-their-windshield-1.6836533,neutral,0.27289754,0.22095586,0.50614655,0.02565157683424424
CTV,2024-04-10,Saskatoon firefighters battle grass fire after controlled burn spreads,https://saskatoon.ctvnews.ca/saskatoon-firefighters-battle-grass-fire-after-controlled-burn-spreads-1.6841428,neutral,0.032273144,0.09704385,0.870683,-0.008375952455300872
CTV,2024-04-10,252 charges handed out in Essex County OPP Easter weekend traffic blitz,https://windsor.ctvnews.ca/252-charges-handed-out-in-essex-county-opp-easter-weekend-traffic-blitz-1.6841182,neutral,0.045256265,0.11725038,0.83749336,-0.01169952227665716
CTV,2024-04-10,Tanker truck goes up in flames on highway 11,https://barrie.ctvnews.ca/tanker-truck-goes-up-in-flames-on-highway-11-1.6841427,negative,0.018397113,0.5571263,0.42447656,-0.3100512750153541
CTV,2024-04-10,"SiRT looking for SUV driver following fatal February crash in Hammonds Plains, N.S.",https://atlantic.ctvnews.ca/sirt-looking-for-suv-driver-following-fatal-february-crash-in-hammonds-plains-n-s-1.6841321,negative,0.013451357,0.54026645,0.44628227,-0.2917068716656317
CTV,2024-04-10,"Canada heading into wildfire season with above-average temps, minimal snow",https://www.ctvnews.ca/canada/canada-heading-into-wildfire-season-with-above-average-temps-minimal-snow-1.6841277,neutral,0.08627502,0.06710858,0.8466163,0.0029398189158929
CTV,2024-04-10,"Dartmouth, N.S., walk-in medical clinic to close",https://atlantic.ctvnews.ca/more/dartmouth-n-s-walk-in-medical-clinic-to-close-1.6841546,neutral,0.023994405,0.21288094,0.7631247,-0.044742554566024495
CTV,2024-04-10,Calgary man charged in McKenzie Towne murder was victim’s tenant: police,https://calgary.ctvnews.ca/calgary-man-charged-in-mckenzie-towne-murder-was-victim-s-tenant-police-1.6841557,negative,0.012839745,0.27674615,0.7104142,-0.07642355914704524
CTV,2024-04-10,Police share video of distracted North Vancouver driver taking 15 seconds to notice them,https://bc.ctvnews.ca/police-share-video-of-distracted-north-vancouver-driver-taking-15-seconds-to-notice-them-1.6841603,negative,0.015168378,0.45742676,0.52740484,-0.2090091714400426
CTV,2024-04-10,Ontario family's car stolen from parking lot of Montreal hotel,https://montreal.ctvnews.ca/ontario-family-s-car-stolen-from-parking-lot-of-montreal-hotel-1.6831200,negative,0.015756005,0.40689242,0.5773516,-0.16531316533040297
CTV,2024-04-10,'Like an underwater puppy': B.C. woman forms lasting friendship with octopus,https://bc.ctvnews.ca/like-an-underwater-puppy-b-c-woman-forms-lasting-friendship-with-octopus-1.6833760,positive,0.33912757,0.006927808,0.6539447,0.11495949453538046
CTV,2024-04-10,New security plan for Montreal metro amid rise in mental health and addictions issues,https://montreal.ctvnews.ca/new-security-plan-for-montreal-metro-amid-rise-in-mental-health-and-addictions-issues-1.6841465,neutral,0.028929293,0.21250956,0.7585611,-0.044323421748692304
CTV,2024-04-10,LIVE NOW: PM Trudeau testifies at interference inquiry,/video/c68596-live--trudeau-to-testify-at-interference-inquiry?playlistId=1.6754210,neutral,0.033045854,0.020818945,0.94613516,0.000658600478036675
CTV,2024-04-10,Mosquito activity expected to be low during dry spring: city,https://edmonton.ctvnews.ca/mosquito-activity-expected-to-be-low-during-dry-spring-city-1.6841529,neutral,0.03942869,0.11831002,0.84226125,-0.012442642139216975
CTV,2024-04-10,AI-operated fighter jet will fly Air Force secretary in a test of military's future drone warplanes,https://www.ctvnews.ca/world/ai-operated-fighter-jet-will-fly-air-force-secretary-in-a-test-of-military-s-future-drone-warplanes-1.6840485,neutral,0.07527642,0.01960443,0.90511906,0.005282210653227537
CTV,2024-04-10,"Ontario truck driver facing 14 charges, including cocaine possession on Hwy. 417",https://ottawa.ctvnews.ca/ontario-truck-driver-facing-14-charges-including-cocaine-possession-on-hwy-417-1.6841463,negative,0.014635493,0.5010394,0.48432526,-0.25082619568198616
CTV,2024-04-10,Three-time Grey Cup champion Shawn Lemon announces retirement from football,https://montreal.ctvnews.ca/three-time-grey-cup-champion-shawn-lemon-announces-retirement-from-football-1.6841478,neutral,0.11178767,0.012446042,0.8757662,0.01234158655013573
CTV,2024-04-10,Multiple people reported injured after a shooting in West Philadelphia,https://www.ctvnews.ca/world/multiple-people-reported-injured-after-a-shooting-in-west-philadelphia-1.6841599,negative,0.010609397,0.68059987,0.3087907,-0.46310364157275963
CTV,2024-04-10,"Wind, solar operators urged to invest now to protect infrastructure from climate risk",https://calgary.ctvnews.ca/wind-solar-operators-urged-to-invest-now-to-protect-infrastructure-from-climate-risk-1.6841488,neutral,0.1538191,0.0469419,0.79923904,0.021456769397310005
CTV,2024-04-10,Controversial wind-powered hydrogen project gets final approval in Newfoundland,https://www.ctvnews.ca/business/controversial-wind-powered-hydrogen-project-gets-final-approval-in-newfoundland-1.6840333,neutral,0.1733018,0.008850262,0.81784797,0.029955182228590616
CTV,2024-04-10,A man's world? Art exhibit about misogyny was only open to women -- until a man complained,https://www.ctvnews.ca/lifestyle/a-man-s-world-art-exhibit-about-misogyny-was-only-open-to-women-until-a-man-complained-1.6841333,negative,0.015274477,0.6735072,0.31121838,-0.45337861824383907
CTV,2024-04-10,"French woman found dead in Italian church was searching for ghosts in possible TikTok stunt, police say",https://www.ctvnews.ca/world/french-woman-found-dead-in-italian-church-was-searching-for-ghosts-in-possible-tiktok-stunt-police-say-1.6841570,negative,0.017195305,0.25985563,0.7229489,-0.06722930886856737
CTV,2024-04-10,Key questions Trudeau could face at the foreign interference inquiry,https://www.ctvnews.ca/politics/key-questions-trudeau-could-face-at-the-foreign-interference-inquiry-1.6841071,neutral,0.02505713,0.13542128,0.8395215,-0.017711069677139868
CTV,2024-04-10,'I wanted to find my daughter': Sask. mother testifies in case against ex-husband accused in abduction,https://regina.ctvnews.ca/i-wanted-to-find-my-daughter-sask-mother-testifies-in-case-against-ex-husband-accused-in-abduction-1.6841180,neutral,0.040841814,0.17143443,0.7877237,-0.027721714373294404
CTV,2024-04-10,Health minister compares dentists' 'fears' on dental-care program to medicare rollout,https://www.ctvnews.ca/politics/health-minister-compares-dentists-fears-on-dental-care-program-to-medicare-rollout-1.6841494,negative,0.030196793,0.2890877,0.68071544,-0.08265987522234042
CTV,2024-04-10,Ottawa snowbirds embark on epic bicycle journey back to Canada,https://ottawa.ctvnews.ca/ottawa-snowbirds-embark-on-epic-bicycle-journey-back-to-canada-1.6830326,positive,0.5234403,0.005924182,0.47063565,0.27395459172225856
CTV,2024-04-10,"Thousands in London, Ont. come together for Eid al-Fitr",https://london.ctvnews.ca/thousands-in-london-ont-come-together-for-eid-al-fitr-1.6841311,positive,0.2996871,0.007974519,0.69233847,0.0897487403115349
