source,date,headline,url,chosen_label,positive,negative,neutral,compound
CTV,2024-04-10,'I'm really struggling': Parents paying the cost of Sask. teacher job action,https://saskatoon.ctvnews.ca/i-m-really-struggling-parents-paying-the-cost-of-sask-teacher-job-action-1.6840717,negative,0.01150068,0.74665695,0.24184248,-0.5573642765569176
CTV,2024-04-10,Merlin the Macaw leaving Halifax for Ontario due to depression and stress,https://atlantic.ctvnews.ca/more/merlin-the-macaw-leaving-halifax-for-ontario-due-to-depression-and-stress-1.6833611,negative,0.016059985,0.66724545,0.31669462,-0.4449585251471362
CTV,2024-04-10,B.C.'s average snowpack for April lowest in more than 50 years,https://bc.ctvnews.ca/b-c-s-average-snowpack-for-april-lowest-in-more-than-50-years-1.6841230,negative,0.04288704,0.3163386,0.64077437,-0.09823081152879354
CTV,2024-04-10,Tennessee Senate advances bill to arm teachers a year after deadly Nashville school shooting,https://www.ctvnews.ca/world/tennessee-senate-advances-bill-to-arm-teachers-a-year-after-deadly-nashville-school-shooting-1.6841518,neutral,0.024337571,0.14869468,0.8269678,-0.021517786349654955
CTV,2024-04-10,Waterton-Glacier International Peace Park named the best place for stargazing,https://calgary.ctvnews.ca/waterton-glacier-international-peace-park-named-the-best-place-for-stargazing-1.6841119,positive,0.92781687,0.0021626267,0.07002055,0.8608394149586602
CTV,2024-04-10,Sask. premier willing to attend televised meeting over carbon tax,https://regina.ctvnews.ca/sask-premier-willing-to-attend-televised-meeting-over-carbon-tax-1.6841231,neutral,0.09009233,0.018516673,0.891391,0.0077737619627500365
CTV,2024-04-10,$2 million worth of drugs seized in investigation into criminal network importing illegal narcotics into Canada,https://toronto.ctvnews.ca/2-million-worth-of-drugs-seized-in-investigation-into-criminal-network-importing-illegal-narcotics-into-canada-1.6841600,negative,0.012934286,0.6419269,0.3451388,-0.4119028674525538
CTV,2024-04-10,Star Trek superfan turns his home into a Trekkie’s dream,https://atlantic.ctvnews.ca/star-trek-superfan-turns-his-home-into-a-trekkie-s-dream-1.6836305,neutral,0.16609181,0.03245524,0.80145293,0.026533150555192897
CTV,2024-04-10,German museum worker fired after hanging his own art in gallery,https://www.ctvnews.ca/lifestyle/german-museum-worker-fired-after-hanging-his-own-art-in-gallery-1.6841373,negative,0.006995273,0.7985039,0.19450079,-0.6375595648592087
CTV,2024-04-10,B.C. makes it easier to salvage timber damaged by wildfires,https://bc.ctvnews.ca/b-c-makes-it-easier-to-salvage-timber-damaged-by-wildfires-1.6841501,positive,0.26741964,0.032015078,0.70056534,0.0704882821389674
CTV,2024-04-10,Man airlifted after fall in Wilmot,https://kitchener.ctvnews.ca/man-airlifted-after-fall-in-wilmot-1.6841445,neutral,0.027118433,0.1456116,0.82727,-0.020467328568079424
CTV,2024-04-10,A closer look at the sexual misconduct lawsuits against Sean 'Diddy' Combs,https://www.ctvnews.ca/entertainment/a-closer-look-at-the-sexual-misconduct-lawsuits-against-sean-diddy-combs-1.6840088,negative,0.021703474,0.23523448,0.74306196,-0.0548642411199296
CTV,2024-04-10,Ancient sea turtle housed at Boston aquarium for more than 50 years passes another physical,https://www.ctvnews.ca/world/ancient-sea-turtle-housed-at-boston-aquarium-for-more-than-50-years-passes-another-physical-1.6839952,neutral,0.08851822,0.039795104,0.87168676,0.006251820630327254
CTV,2024-04-10,WARNING: School bus aide punches non-verbal boy,/video/c2900853-warning--school-bus-aide-punches-non-verbal-boy,negative,0.012603723,0.71219635,0.27519983,-0.5070648712326182
CTV,2024-04-10,What are the chances police can find your stolen car? Canadians believe odds are low,https://www.ctvnews.ca/politics/what-are-the-chances-police-can-find-your-stolen-car-canadians-believe-odds-are-low-1.6832937,negative,0.015995856,0.6350741,0.3489302,-0.4030631260741533
CTV,2024-04-10,Biden says he's considering Australia's request to drop prosecution of Wikileaks founder Assange,https://www.ctvnews.ca/world/biden-says-he-s-considering-australia-s-request-to-drop-prosecution-of-wikileaks-founder-assange-1.6841476,neutral,0.056998458,0.021914324,0.92108727,0.0027685851129746197
CTV,2024-04-10,Ont. officer injured after tackling car theft suspect,/video/c2900561-video-shows-arrest-where-cop-s-leg-was-injured?playlistId=1.6840911,negative,0.009563111,0.7462406,0.24419619,-0.5567836809176985
CTV,2024-04-10,"Man dead, suspect at large after stabbing in Victoria",https://bc.ctvnews.ca/man-dead-suspect-at-large-after-stabbing-in-victoria-1.6841322,negative,0.010665882,0.64758736,0.3417468,-0.41925558822507014
CTV,2024-04-10,Former Thunder Bay police lawyer second charged in misconduct investigation,https://northernontario.ctvnews.ca/former-thunder-bay-police-lawyer-second-charged-in-misconduct-investigation-1.6841047,negative,0.0091604,0.62814313,0.3626964,-0.39447991791966786
CTV,2024-04-10,Bike Winnipeg calling for Russ Wyatt to be removed from city committee following 'offensive' comments,https://winnipeg.ctvnews.ca/bike-winnipeg-calling-for-russ-wyatt-to-be-removed-from-city-committee-following-offensive-comments-1.6841617,negative,0.007842049,0.72178626,0.2703718,-0.5209138229228927
CTV,2024-04-10,Muhammad Ali's 'Thrilla in Manila' trunks poised to sell for US$6 million at auction,https://www.ctvnews.ca/sports/muhammad-ali-s-thrilla-in-manila-trunks-poised-to-sell-for-us-6-million-at-auction-1.6841309,neutral,0.069836505,0.012451575,0.91771203,0.004722089283248909
CTV,2024-04-10,"Evacuation of Kelowna, B.C., apartment near construction site extended for two weeks",https://bc.ctvnews.ca/evacuation-of-kelowna-b-c-apartment-near-construction-site-extended-for-two-weeks-1.6836568,negative,0.010701711,0.3426924,0.64660597,-0.11732352802822277
CTV,2024-04-10,"$18,000 in drugs seized from east Windsor home",https://windsor.ctvnews.ca/18-000-in-drugs-seized-from-east-windsor-home-1.6841367,negative,0.014416737,0.64982474,0.3357586,-0.4220642911569623
CTV,2024-04-10,Early start to golf season in Greater Sudbury,https://northernontario.ctvnews.ca/early-start-to-golf-season-in-greater-sudbury-1.6841536,positive,0.37389758,0.0043924195,0.62170994,0.1397801307564066
CTV,2024-04-10,Transport truck rollover closes 12th Line in New Tecumseth,https://barrie.ctvnews.ca/transport-truck-rollover-closes-12th-line-in-new-tecumseth-1.6841474,negative,0.019739198,0.28543192,0.6948288,-0.08108176120214239
CTV,2024-04-10,MPPs to debate bill declaring intimate partner violence an epidemic,https://london.ctvnews.ca/mpps-to-debate-bill-declaring-intimate-partner-violence-an-epidemic-1.6841336,negative,0.009305649,0.68499166,0.3057027,-0.4691269759322836
CTV,2024-04-10,'Chill' marmot takes up residence in busy North Vancouver neighbourhood,https://bc.ctvnews.ca/chill-marmot-takes-up-residence-in-busy-north-vancouver-neighbourhood-1.6841625,neutral,0.11004496,0.019429045,0.870526,0.011732404291650678
CTV,2024-04-10,Hundreds of coins and artifacts looted from Roman sites,/video/c2901026-hundreds-of-coins-and-artifacts-looted,negative,0.012583484,0.68501014,0.3024065,-0.4690804608053831
CTV,2024-04-10,Ground-breaking Canadian giraffe researcher Anne Innis Dagg dies at 91,https://kitchener.ctvnews.ca/ground-breaking-canadian-giraffe-researcher-anne-innis-dagg-dies-at-91-1.6833600,neutral,0.08652028,0.064951986,0.8485277,0.0032669979915582736
CTV,2024-04-10,"April rain, showers return to the Maritimes",https://atlantic.ctvnews.ca/more/april-rain-showers-return-to-the-maritimes-1.6841200,neutral,0.035206772,0.12919006,0.8356032,-0.015450553438870696
CTV,2024-04-10,These are the factors the Bank of Canada says it considered in latest interest rate decision,https://www.ctvnews.ca/business/these-are-the-factors-the-bank-of-canada-says-it-considered-in-latest-interest-rate-decision-1.6840916,neutral,0.06684339,0.02057407,0.91258264,0.004044741989810419
CTV,2024-04-10,Okanagan winemaker puts a cork in punny bottles after Dom Perignon complaint,https://bc.ctvnews.ca/okanagan-winemaker-puts-a-cork-in-punny-bottles-after-dom-perignon-complaint-1.6840763,neutral,0.03376157,0.13586709,0.8303713,-0.017320024665939737
CTV,2024-04-10,Sudbury police looking for man wanted for intimate partner violence,https://northernontario.ctvnews.ca/sudbury-police-looking-for-man-wanted-for-intimate-partner-violence-1.6841163,negative,0.009806881,0.5269285,0.46326473,-0.27755740675286766
CTV,2024-04-10,"Your work schedule as a young adult may harm your health decades later, study finds",https://www.ctvnews.ca/lifestyle/your-work-schedule-as-a-young-adult-may-harm-your-health-decades-later-study-finds-1.6841368,negative,0.013500509,0.6414185,0.34508094,-0.41123546838209535
CTV,2024-04-10,Lethbridge post-secondary students gearing up for final exams,https://calgary.ctvnews.ca/lethbridge-post-secondary-students-gearing-up-for-final-exams-1.6840494,neutral,0.057343107,0.023018187,0.9196385,0.002758401694234358
CTV,2024-04-10,The U.S. is asking states to be ready with testing for avian flu. What is Canada doing?,https://www.ctvnews.ca/canada/the-u-s-is-asking-states-to-be-ready-with-testing-for-avian-flu-what-is-canada-doing-1.6841418,neutral,0.023071801,0.07892822,0.8979999,-0.005697360794271411
CTV,2024-04-10,Quebec Superior Court judge authorizes QMJHL hazing class-action lawsuit,https://montreal.ctvnews.ca/quebec-superior-court-judge-authorizes-qmjhl-hazing-class-action-lawsuit-1.6841642,negative,0.018924087,0.23397706,0.7470989,-0.0543871296052032
CTV,2024-04-10,Renee Zellweger and Hugh Grant set to star in new 'Bridget Jones' movie,https://www.ctvnews.ca/entertainment/renee-zellweger-and-hugh-grant-set-to-star-in-new-bridget-jones-movie-1.6840169,neutral,0.16265999,0.002792246,0.8345478,0.026450467887127793
CTV,2024-04-10,Three retirees from Kitchener-Waterloo split $1M lotto prize,https://kitchener.ctvnews.ca/three-retirees-from-kitchener-waterloo-split-1m-lotto-prize-1.6841618,neutral,0.1640346,0.008773746,0.82719153,0.02683039156901046
CTV,2024-04-10,"2 men injured after 'road rage' incident with Dodge Ram driver, Kelowna RCMP say",https://bc.ctvnews.ca/2-men-injured-after-road-rage-incident-with-dodge-ram-driver-kelowna-rcmp-say-1.6830790,negative,0.0069282767,0.69293135,0.30014032,-0.48010590145158716
CTV,2024-04-10,Justin Trudeau testifying at public inquiry into foreign interference in Canada's elections,https://www.ctvnews.ca/politics/justin-trudeau-testifying-at-public-inquiry-into-foreign-interference-in-canada-s-elections-1.6840914,neutral,0.030428493,0.06502592,0.90454555,-0.0033024784855584244
CTV,2024-04-10,Starting over: Women emerging from prison face formidable challenges to resuming their lives,https://www.ctvnews.ca/world/starting-over-women-emerging-from-prison-face-formidable-challenges-to-resuming-their-lives-1.6841587,neutral,0.048343536,0.120269686,0.8313868,-0.012127697436987717
CTV,2024-04-10,"Unstable nearby construction site forces evacuation of apartment in Kelowna, B.C.",https://bc.ctvnews.ca/unstable-nearby-construction-site-forces-evacuation-of-apartment-in-kelowna-b-c-1.6829299,negative,0.008912125,0.5259611,0.46512675,-0.2765556534751852
CTV,2024-04-10,Bank of Canada holds key interest rate at five per cent,/video/c2901035-boc-governor-discusses-interest-rate-hold?playlistId=1.6840113,neutral,0.13163973,0.02252184,0.84583855,0.016821773324693368
CTV,2024-04-10,Lethbridge police looking for 'prolific offender' wanted on multiple warrants,https://calgary.ctvnews.ca/lethbridge-police-looking-for-prolific-offender-wanted-on-multiple-warrants-1.6840114,negative,0.019599123,0.2778479,0.70255303,-0.07681531499736849
CBC,2024-04-10,"Data showing $134M paid to suspended Ontario police officers indicates system is failing: union, researcher",https://www.cbc.ca/news/canada/thunder-bay/suspended-with-pay-northwestern-ontario-officers-1.7168254,negative,0.005132764,0.86849886,0.12636836,-0.7542639665592077
CBC,2024-04-10,Palestinians in Gaza resolute in marking Eid despite ruins of war,https://www.cbc.ca/player/play/9.4200579,positive,0.5238738,0.022017837,0.4541084,0.27395896452894064
CBC,2024-04-10,It's rare for a PM to face questions under oath. Trudeau is up again — this time about foreign interference,https://www.cbc.ca/news/politics/trudeau-interference-inquiry-1.7168665,neutral,0.05567367,0.1545919,0.78973436,-0.020799104448414596
CBC,2024-04-10,Trump tries to dump abortion issue before it can tank his re-election chances,https://www.cbc.ca/news/world/trump-abortion-policy-2024-1.7167424,negative,0.01278426,0.76011354,0.22710209,-0.5776092529693289
CBC,2024-04-10,"Central bank being cautious about lowering interest rate, Macklem says",https://www.cbc.ca/player/play/1.7169453,neutral,0.028915407,0.075547464,0.8955371,-0.004871321115752725
CBC,2024-04-10,"Facebook removed false article about Trudeau during 2019 election, inquiry hears",https://www.cbc.ca/news/politics/facebook-2019-election-trudeau-1.7164757,negative,0.012480417,0.5156259,0.4718937,-0.2657142863136741
CBC,2024-04-10,WATCH : CBC News Explore,https://www.cbc.cahttps://gem.cbc.ca/live,neutral,0.09840742,0.014817321,0.88677526,0.009464467482493077
CBC,2024-04-10,How an Afghan supermarket chain in Hamilton is helping newcomers find work,https://www.cbc.ca/news/canada/hamilton/samir-supermarket-1.7165020,neutral,0.12176451,0.016168851,0.8620667,0.014565159751609436
CBC,2024-04-10,"India, Pakistan attempted to interfere in Canada's elections: CSIS",https://www.cbc.ca/news/politics/pakistan-india-elections-canada-1.7164378,negative,0.016336706,0.39032027,0.59334296,-0.15208304837315367
CBC,2024-04-10,"Ontario paramedic, among lives lost in Switzerland avalanche, 'died while doing what she loved'",https://www.cbc.ca/news/canada/kitchener-waterloo/paramedic-from-ontario-s-perth-county-among-local-lives-lost-in-switzerland-avalanche-1.7169266,negative,0.0132080335,0.71805304,0.26873887,-0.515425762313491
CBC,2024-04-10,Ontario man guilty of allergy testing fraud in U.S. was key employee of DNA lab in paternity controversy,https://www.cbc.ca/news/canada/tsui-us-viaguard-1.7167672,negative,0.014403323,0.5338644,0.45173234,-0.28480368783174725
CBC,2024-04-10,"IN PHOTOS | Prayer, parades and more: Celebrating Eid al-Fitr",https://www.cbc.ca/news/world/photos/in-photos-prayer-parades-and-more-celebrating-eid-al-fitr-1.7169197,positive,0.6234249,0.002636633,0.3739385,0.3886516388303498
CBC,2024-04-10,Trade of safe-supply drugs detailed in Prince George RCMP warrant,https://www.cbc.ca/news/canada/british-columbia/safe-supply-arrest-diversion-prince-george-1.7168486,neutral,0.04510552,0.07043881,0.88445556,-0.0029271206559582374
CBC,2024-04-10,"10 people in Kingston, Ont., sent to hospital with eye injuries. 2 patients blame a foam party",https://www.cbc.ca/news/canada/kingston-stages-foam-party-1.7168200,negative,0.006380778,0.80780363,0.18581565,-0.6525059317065178
CBC,2024-04-10,Buying and selling Maud Lewis paintings is big business — if they're real,https://www.cbc.ca/player/play/1.7166999,neutral,0.20871522,0.057347484,0.73393726,0.0402733108514326
CBC,2024-04-10,Poilievre and Trudeau trade barbs over carbon tax ahead of budget,https://www.cbc.ca/player/play/9.4199769,negative,0.020211577,0.3471729,0.6326157,-0.12012045628339862
CBC,2024-04-10,How wrong prenatal paternity tests left a trail of shattered lives,https://www.cbc.ca/player/play/1.7168719,negative,0.0054948223,0.9173847,0.077120475,-0.8415644721997801
CBC,2024-04-10,"Canada at risk of another devastating wildfire season, federal government warns",https://www.cbc.ca/news/climate/canada-wildfires-update-federal-government-1.7169287,negative,0.010297538,0.7496985,0.24000397,-0.5619418091494133
CBC,2024-04-10,A Canadian couple's near-death experience in Taiwan earthquake,https://www.cbc.ca/player/play/1.7169023,negative,0.011823694,0.5754204,0.41275594,-0.3309687962994854
CBC,2024-04-10,The way you pronounce Calgary says a lot about where you're from,https://www.cbc.ca/news/canada/saskatoon/good-question-calgary-pronunciation-1.7164863,negative,0.025532069,0.37955597,0.59491193,-0.14341085880387183
CBC,2024-04-10,Palestinians in Gaza mark sombre first Eid since outbreak of Israel-Hamas war,https://www.cbc.ca/news/world/gaza-eid-al-fitr-1.7169075,neutral,0.05814858,0.16966395,0.7721875,-0.025404599100120606
CBC,2024-04-10,PMO officials refute allegations against Han Dong at foreign interference inquiry,https://www.cbc.ca/news/politics/foreign-interference-inquiry-pmo-1.7167956,negative,0.01376996,0.29078335,0.6954467,-0.08436533423508052
CBC,2024-04-10,"Displaced Kelowna, B.C., tenants call for stop-work order at UBC construction site",https://www.cbc.ca/news/canada/british-columbia/ubc-properties-trust-construction-evacuation-building-safety-risks-ubc-okanagan-downtown-campus-1.7167547,negative,0.013404116,0.34448162,0.64211416,-0.118487954137521
CBC,2024-04-10,"Big grocers, retailers want Ontario's recycling plan changed",https://www.cbc.ca/news/canada/toronto/ontario-blue-box-recycling-costs-industry-doug-ford-1.7168813,negative,0.038408052,0.3320757,0.6295162,-0.10879910938512616
CBC,2024-04-10,"15,000 endangered turtles just got freed into the Amazon",https://www.cbc.ca/player/play/1.7168638,neutral,0.14127132,0.20210405,0.6566247,-0.020888456377958775
CBC,2024-04-10,New rule forces U.S. chemical plants to reduce cancer-causing emissions,https://www.cbc.ca/news/science/chemical-plants-us-environmental-protection-agency-cancer-emissions-1.7168436,neutral,0.042252943,0.2160916,0.74165547,-0.04491026712892143
CBC,2024-04-10,"As golf's civil war rages, top PGA Tour and LIV players are all at the Masters",https://www.cbc.ca/sports/golf/masters-preview-pga-tour-liv-1.7168776,negative,0.038013406,0.34812984,0.6138568,-0.11974935687790378
CBC,2024-04-10,"Having been through 'hell and back,' Penny Oleksiak returns to pool with full focus on Olympics",https://www.cbc.ca/sports/olympics/summer/aquatics/swimming/swimming-canadian-open-penny-oleksiak-april-10-1.7169368,neutral,0.15742013,0.06318823,0.7793917,0.020788337840499604
CBC,2024-04-10,Undocumented woman says she was denied emergency C-section at Edmonton hospital,https://www.cbc.ca/news/canada/edmonton/undocumented-woman-says-she-was-denied-emergency-c-section-at-edmonton-hospital-1.7167490,negative,0.007471811,0.6763944,0.31613365,-0.45745366026798884
CBC,2024-04-10,"WATCH | 15,000 endangered turtles just got freed into the Amazon",https://www.cbc.cahttps://www.cbc.ca/player/play/1.7168638,positive,0.23582537,0.015526103,0.74864846,0.055372560681808736
CBC,2024-04-10,Former Conservative leader alleges Chinese interference may have played a part in his ouster,https://www.cbc.ca/news/politics/otoole-leadership-interference-1.7162568,negative,0.008390094,0.6182803,0.37332955,-0.38220018019867297
CBC,2024-04-10,"Track & field to be 1st sport to introduce Olympic prize money, with $50K US for gold-medal win",https://www.cbc.ca/sports/olympics/summer/trackandfield/world-athletics-olympics-track-prize-money-1.7169068,positive,0.5122628,0.0049294746,0.4828077,0.2623888981792071
CBC,2024-04-10,The way you pronounce Calgary says a lot about where you're from,https://www.cbc.ca/player/play/1.7167814,negative,0.025532069,0.37955597,0.59491193,-0.14341085880387183
CBC,2024-04-10,Spike in Canadians Googling 'my eyes hurt' during and after solar eclipse,https://www.cbc.ca/player/play/1.7169254,negative,0.037229877,0.43255433,0.5302158,-0.18571718930333247
CBC,2024-04-10,Poilievre turns to Parliament to force Trudeau meet with premiers on the carbon tax,https://www.cbc.ca/news/politics/poilievre-carbon-tax-motion-premiers-1.7168220,neutral,0.02973605,0.15553765,0.81472635,-0.023307719984401842
CBC,2024-04-10,"Bank of Canada holds key interest rate at 5%, says things moving in right direction",https://www.cbc.ca/news/business/bank-of-canada-interest-april-10-interest-rates-1.7169183,positive,0.44379926,0.011213404,0.5449874,0.1968320277082558
CBC,2024-04-10,WATCH: CBC News Network,https://www.cbc.cahttps://gem.cbc.ca/live,neutral,0.10073908,0.018231502,0.88102955,0.00981596340483426
CBC,2024-04-10,How 2 Canadians fought to survive the Taiwan earthquake,https://www.cbc.ca/news/world/canadians-taiwan-earthquake-1.7168112,neutral,0.07140597,0.12031701,0.808277,-0.009377371269430945
CBC,2024-04-10,The Pornhub Empire: Tech journalist Samantha Cole answers your questions,https://www.cbc.cahttps://www.reddit.com/r/podcasts/comments/1c0s0z6/im_tech_journalist_samantha_cole_ive_spent_six/,neutral,0.090302184,0.008751608,0.9009463,0.008077884711525929
CBC,2024-04-10,Hitching a ride? Horse surprises passengers at train station,https://www.cbc.ca/player/play/9.4200183,positive,0.2992336,0.015741428,0.685025,0.08929294588865844
CBC,2024-04-10,What's the most expensive home you could afford?,https://www.cbc.ca/news/canada/what-s-the-most-expensive-home-you-could-afford-1.7151065,neutral,0.11025993,0.03667291,0.8530672,0.010812344780346983
CBC,2024-04-10,Unique team of artistic swimmers gets ready for Quebec provincial championships,https://www.cbc.ca/player/play/1.7168454,positive,0.5322303,0.0052942764,0.46247536,0.2832411131480228
CBC,2024-04-10,Whistleblower alleges safety issues with Boeing 787 and 777 jets,https://www.cbc.ca/news/business/boeing-whistleblower-safety-allegations-787-777-jets-1.7169114,negative,0.014551099,0.5372056,0.44824335,-0.28837808167069845
CBC,2024-04-10,Alberta seeks intervener status in Sask. court case over controversial pronoun policy,https://www.cbc.ca/news/canada/saskatchewan/alberta-seeks-intervener-status-court-case-pronoun-policy-1.7168700,neutral,0.0239056,0.1361792,0.83991516,-0.01797330109642825
