source,date,headline,url,chosen_label,positive,negative,neutral,compound
CTV,2024-08-11,Maritimers mark 10th anniversary of ALS Ice Bucket Challenge with calls to bring it back,https://atlantic.ctvnews.ca/maritimers-mark-10th-anniversary-of-als-ice-bucket-challenge-with-calls-to-bring-it-back-1.6990716,neutral,0.15636992,0.030543786,0.81308633,0.023518624614612627
CTV,2024-08-11,"For losers in bids for federal cash to protect against climate disaster, fears remain",https://atlantic.ctvnews.ca/for-losers-in-bids-for-federal-cash-to-protect-against-climate-disaster-fears-remain-1.6996570,negative,0.030501986,0.5274335,0.44206458,-0.2772556964028272
CTV,2024-08-11,Three vehicles extensively damaged after crash in Kitchener,https://kitchener.ctvnews.ca/three-vehicles-extensively-damaged-after-crash-in-kitchener-1.6996727,negative,0.0119832335,0.75018895,0.23782776,-0.5626399133262625
CTV,2024-08-11,Austrian Taylor Swift plot suspect's lawyer plays down attack plan,https://www.ctvnews.ca/entertainment/austrian-taylor-swift-plot-suspect-s-lawyer-plays-down-attack-plan-1.6996597,negative,0.010527239,0.46437585,0.5250969,-0.21553411029071867
CTV,2024-08-11,Weeks may stretch into months for stranded NASA astronauts,https://www.ctvnews.ca/sci-tech/weeks-may-stretch-into-months-for-stranded-nasa-astronauts-1.6993971,negative,0.025760226,0.23128581,0.7429539,-0.052829548750374045
CTV,2024-08-11,Final stages of water infrastructure project to close intersection in Lethbridge starting Monday,https://calgary.ctvnews.ca/final-stages-of-water-infrastructure-project-to-close-intersection-in-lethbridge-starting-monday-1.6996924,neutral,0.040544163,0.06605119,0.8934046,-0.0027189318979901067
CTV,2024-08-11,Lethbridge's Agri-Food Hub and Trade Centre turns 1,https://calgary.ctvnews.ca/lethbridge-s-agri-food-hub-and-trade-centre-turns-1-1.6995693,neutral,0.18244223,0.0037718085,0.81378585,0.0332709604428727
CTV,2024-08-11,B.C. court overturns eviction of social housing tenant who owed $45 in unpaid rent,https://bc.ctvnews.ca/b-c-court-overturns-eviction-of-social-housing-tenant-who-owed-45-in-unpaid-rent-1.6996365,negative,0.018428208,0.4476288,0.5339429,-0.2000319914704498
CTV,2024-08-11,"Stratford, Ont. police to discuss protocols, more training after neighbour dispute turned deadly",https://kitchener.ctvnews.ca/stratford-ont-police-to-discuss-protocols-more-training-after-neighbour-dispute-turned-deadly-1.6995462,neutral,0.0150371315,0.21118318,0.77377975,-0.04437220649200313
CTV,2024-08-11,'It was amazing': Riverhawks clinch first playoff win in front of record-setting crowd,https://edmonton.ctvnews.ca/it-was-amazing-riverhawks-clinch-first-playoff-win-in-front-of-record-setting-crowd-1.6996855,positive,0.97712064,0.0017186787,0.021160774,0.9547616780586279
CTV,2024-08-11,Last day of Paris Olympics: Looking back at Canada's wins,/video/c2975162-looking-back-at-canada-s-big-wins-in-paris?playlistId=1.6995224,positive,0.31983975,0.0059022396,0.6742581,0.1022625985718939
CTV,2024-08-11,Who won at the box office this weekend? The Reynolds-Lively household,https://www.ctvnews.ca/entertainment/who-won-at-the-box-office-this-weekend-the-reynolds-lively-household-1.6996689,positive,0.2644899,0.0054789726,0.730031,0.06992491313474147
CTV,2024-08-11,Sandcastle contest sculpting community in Grand Beach,https://winnipeg.ctvnews.ca/sandcastle-contest-sculpting-community-in-grand-beach-1.6996972,neutral,0.13342075,0.0065738894,0.8600053,0.017757886361228437
CTV,2024-08-11,Bones creator Hart Hanson creates a new kind of private investigator with The Seminarian,https://calgary.ctvnews.ca/bones-creator-hart-hanson-creates-a-new-kind-of-private-investigator-with-the-seminarian-1.6996682,neutral,0.053054508,0.011538007,0.9354075,0.0026816538173783933
CTV,2024-08-11,'We lost our baby': Family remembers Chilliwack crash victims,https://bc.ctvnews.ca/we-lost-our-baby-family-remembers-chilliwack-crash-victims-1.6995825,negative,0.01269997,0.7428136,0.24448639,-0.5516107798041148
CTV,2024-08-11,"Camper fined $1,150 for violating fire ban, causing grass fire in B.C. Interior",https://bc.ctvnews.ca/camper-fined-1-150-for-violating-fire-ban-causing-grass-fire-in-b-c-interior-1.6992687,negative,0.0077159354,0.7166816,0.27560255,-0.5135729161056979
CTV,2024-08-11,Peacekeeper and Korea veteran honoured with stone at London’s Remembrance Gardens,https://london.ctvnews.ca/peacekeeper-and-korea-veteran-honoured-with-stone-at-london-s-remembrance-gardens-1.6996805,positive,0.4290225,0.0066441875,0.56433344,0.18401610216153585
CTV,2024-08-11,"Living out of his car, Quebec man chronicles experience as he pays off debt",https://montreal.ctvnews.ca/living-out-of-his-car-quebec-man-chronicles-experience-as-he-pays-off-debt-1.6987760,neutral,0.07118862,0.109951206,0.81886023,-0.007021445500197565
CTV,2024-08-11,"Ontario police lay more than 8,000 traffic-related charges over August long weekend",https://toronto.ctvnews.ca/ontario-police-lay-more-than-8-000-traffic-related-charges-over-august-long-weekend-1.6993756,negative,0.016554251,0.5815584,0.40188742,-0.33793610357977855
CTV,2024-08-11,Police investigating after Sask. man dies in PA,https://saskatoon.ctvnews.ca/police-investigating-after-sask-man-dies-in-pa-1.6996210,negative,0.014935963,0.33823398,0.64683,-0.11417914999954526
CTV,2024-08-11,Police searching for suspect after suspected hate-motivated assault at Toronto restaurant,https://toronto.ctvnews.ca/police-searching-for-suspect-after-suspected-hate-motivated-assault-at-toronto-restaurant-1.6996753,negative,0.009207109,0.6604708,0.33032218,-0.43613682667439413
CTV,2024-08-11,Dawgs advance to WCBL West Division Final with thrilling 4-3 win over Bulls in 13 innings,https://calgary.ctvnews.ca/dawgs-advance-to-wcbl-west-division-final-with-thrilling-4-3-win-over-bulls-in-13-innings-1.6996121,positive,0.6731786,0.00350827,0.32331303,0.4531571971671653
CTV,2024-08-11,Number of inmates released into homelessness is climbing in Newfoundland and Labrador,https://www.ctvnews.ca/canada/number-of-inmates-released-into-homelessness-is-climbing-in-newfoundland-and-labrador-1.6990437,negative,0.012047713,0.6486835,0.33926892,-0.42064504492077504
CTV,2024-08-11,"Ottawa driver, 19, caught going nearly 200 km/h on Highway 417 facing charges",https://ottawa.ctvnews.ca/ottawa-driver-19-caught-going-nearly-200-km-h-on-highway-417-facing-charges-1.6996668,negative,0.020916075,0.6113488,0.36773527,-0.37330981350136483
CTV,2024-08-11,"2 dead, 3 injured in vehicle rollover near The Pas: RCMP",https://winnipeg.ctvnews.ca/2-dead-3-injured-in-vehicle-rollover-near-the-pas-rcmp-1.6996883,negative,0.011935297,0.56443983,0.423625,-0.3184498081636775
CTV,2024-08-11,NDP calls for an investigation into bot posts about Poilievre rally,https://www.ctvnews.ca/politics/ndp-calls-for-an-investigation-into-bot-posts-about-poilievre-rally-1.6995411,neutral,0.01742891,0.21061744,0.77195364,-0.044055941329482984
CTV,2024-08-11,Two Flair passengers in B.C. were told a bird strike cancelled their flight. Then they did their own research,https://bc.ctvnews.ca/two-flair-passengers-in-b-c-were-told-a-bird-strike-cancelled-their-flight-then-they-did-their-own-research-1.6992121,negative,0.011451166,0.583425,0.40512377,-0.34025361805936427
CTV,2024-08-11,'It's been very emotional': Dakota Family Foods closes after 20 years,https://winnipeg.ctvnews.ca/it-s-been-very-emotional-dakota-family-foods-closes-after-20-years-1.6996938,negative,0.025771478,0.63396,0.34026858,-0.40124106801050274
CTV,2024-08-11,"Crash closes part of Hwy. 69 near Estaire, third northern Ont. highway crash on Sunday",https://northernontario.ctvnews.ca/crash-closes-part-of-hwy-69-near-estaire-third-northern-ont-highway-crash-on-sunday-1.6996930,negative,0.013664827,0.528609,0.45772618,-0.2792407235077299
CTV,2024-08-11,Families of Brazilian plane crash victims gather in Sao Paulo as French experts join probe,https://www.ctvnews.ca/world/families-of-brazilian-plane-crash-victims-gather-in-sao-paulo-as-french-experts-join-probe-1.6996554,negative,0.019929271,0.31671184,0.66335887,-0.09990922494522003
CTV,2024-08-11,Sask. woman writes children's book about role of service dogs,https://regina.ctvnews.ca/sask-woman-writes-children-s-book-about-role-of-service-dogs-1.6989758,neutral,0.13460867,0.010956092,0.8544353,0.017999447283116865
CTV,2024-08-11,Nova Scotia Health searching for patient missing from Dartmouth hospital,https://atlantic.ctvnews.ca/nova-scotia-health-searching-for-patient-missing-from-dartmouth-hospital-1.6996376,neutral,0.019200942,0.08685961,0.8939394,-0.007175920793661028
CTV,2024-08-11,Friday's storm shattered rainfall records in Montreal and across Quebec,https://montreal.ctvnews.ca/friday-s-storm-shattered-rainfall-records-in-montreal-and-across-quebec-1.6996725,neutral,0.08172467,0.10047673,0.8177986,-0.0034166501067716126
CTV,2024-08-11,A B.C. ranch on the market for $2.5M comes with its own hobbit hole,https://bc.ctvnews.ca/a-b-c-ranch-on-the-market-for-2-5m-comes-with-its-own-hobbit-hole-1.6994075,neutral,0.10139884,0.06306921,0.83553195,0.00630399968273565
CTV,2024-08-11,Here's the latest on Alberta's wildfire situation,https://edmonton.ctvnews.ca/here-s-the-latest-on-alberta-s-wildfire-situation-1.6996956,neutral,0.021134157,0.09507702,0.8837889,-0.008592983454727587
CTV,2024-08-11,Sudbury police release images of man who vandalized downtown Pride crosswalk,https://northernontario.ctvnews.ca/sudbury-police-release-images-of-man-who-vandalized-downtown-pride-crosswalk-1.6996286,negative,0.00974297,0.6171271,0.3731299,-0.38075095728382635
CBC,2024-08-11,WATCH | Toronto house set for demolition gets a last art-filled hurrah,https://www.cbc.cahttps://www.cbc.ca/player/play/video/9.6477350,neutral,0.049874533,0.08751411,0.8626114,-0.0051712482912260604
CBC,2024-08-11,"Jasper, Alta., re-entry details coming on Monday, mayor says",https://www.cbc.ca/news/canada/edmonton/jasper-wildfire-reentry-1.7291324,neutral,0.023518946,0.016572623,0.9599084,0.0002784890415358232
CBC,2024-08-11,Watch The National,https://www.cbc.ca/player/play/video/9.4236164,neutral,0.117607355,0.016542768,0.86584985,0.013557828998542298
CBC,2024-08-11,Best moments of 2024 Paris Olympics,https://www.cbc.ca/player/play/video/9.6477480,positive,0.9548023,0.0026876158,0.04251012,0.9116401355802248
CBC,2024-08-11,"Kelowna, B.C., residents remember Mindy Tran 30 years after the 8-year-old was killed",https://www.cbc.ca/news/canada/british-columbia/mindy-tran-anniversary-death-1.7291800,negative,0.025823206,0.39124876,0.5829281,-0.15240872361725444
CBC,2024-08-11,Zelenskyy says surprise Ukrainian attack in Russia puts 'necessary pressure on the aggressor',https://www.cbc.ca/news/world/zelenskyy-ukraine-invastion-kursk-1.7291574,negative,0.019616578,0.30524915,0.6751342,-0.09279226192442991
CBC,2024-08-11,More than 2 million sunflowers to bloom in Ontario community in memory of 2-year-old boy,https://www.cbc.ca/news/canada/london/stop-and-smell-the-sunflowers-lambton-county-fields-bloom-for-boy-taken-by-leukemia-1.7287884,positive,0.73572445,0.0031813516,0.26109412,0.5412804096694366
CBC,2024-08-11,Toronto house set for demolition gets a last art-filled hurrah,https://www.cbc.ca/player/play/video/9.6477350,negative,0.07937249,0.28503022,0.6355973,-0.07494223099276098
CBC,2024-08-11,Au revoir to a wonderful Olympics,https://www.cbc.ca/sports/olympics/summer/the-buzzer-olympic-newsletter-day-closing-ceremony-1.7291911,positive,0.9717377,0.006543472,0.021718863,0.9442313037793628
CBC,2024-08-11,This Nova Scotian's dad flew a Spitfire during WW II. He just went to Poland to see it,https://www.cbc.ca/news/canada/nova-scotia/nova-scotia-spitfire-poland-1.7281259,neutral,0.19657718,0.03911721,0.7643056,0.03711243548934817
CBC,2024-08-11,"Airlines flee small cities, cutting key links to the rest of Canada",https://www.cbc.ca/news/canada/newfoundland-labrador/airlines-flee-small-canadian-cities-1.7291608,negative,0.013140865,0.5247124,0.46214676,-0.27515040352909637
CBC,2024-08-11,Man climbing Eiffel Tower prompts evacuation hours before Olympic closing ceremony,https://www.cbc.ca/sports/olympics/summer/olympics-evacuation-eiffel-tower-aug-11-1.7291659,negative,0.034696326,0.26125407,0.7040496,-0.06704985859719415
CBC,2024-08-11,Beware of power bill scams; 'Google is a monopolist': CBC's Marketplace cheat sheet,https://www.cbc.ca/news/business/marketplace-watchdog-1.7289326,negative,0.011270397,0.7870832,0.20164637,-0.6193729667558889
CBC,2024-08-11,Flag-bearers McIntosh and Katzberg enter closing ceremony at Paris 2024,https://www.cbc.ca/player/play/video/9.6478670,neutral,0.10490289,0.0069027967,0.8881942,0.010956978611753598
CBC,2024-08-11,Phil (Wizard) Kim wins Canada's 9th Olympic gold to extend record 'breaking' medal haul,https://www.cbc.ca/player/play/video/9.6478117,positive,0.664724,0.002994526,0.3322816,0.4418489398644283
CBC,2024-08-11,"McIntosh, Katzberg on being selected as Canada's flag-bearers for Paris 2024 closing ceremony",https://www.cbc.ca/player/play/video/9.6478436,neutral,0.110716,0.009308215,0.8799759,0.012171376160159397
CBC,2024-08-11,Marco Arop extends Canada's Olympic Summer Games overall medal count record to 26 with silver in 800m,https://www.cbc.ca/player/play/video/9.6478021,positive,0.60925484,0.0033066848,0.38743854,0.37118048615649
CBC,2024-08-11,Stronach civil case highlights Succession-like battle over family's billions,https://www.cbc.ca/news/canada/stronach-family-civil-lawsuit-1.7290457,neutral,0.06803857,0.061932117,0.87002933,0.0007936595462272322
CBC,2024-08-11,These 17 cancers are on the rise in younger generations,https://www.cbc.ca/news/health/cancer-millennials-genx-1.7287779,negative,0.02466195,0.40233412,0.57300395,-0.16126452377540623
CBC,2024-08-11,"Residents feeling helpless after sewers back up in Dollard-des-Ormeaux, Que.",https://www.cbc.ca/news/canada/montreal/sewers-backup-ddo-flooding-basements-1.7291380,negative,0.005345202,0.82675767,0.16789709,-0.6834996847986243
CBC,2024-08-11,WATCH: CBC News Network,https://www.cbc.cahttps://gem.cbc.ca/live,neutral,0.10073908,0.018231502,0.88102955,0.00981596340483426
CBC,2024-08-11,Reframing the heat: Why 'global warming' misses the mark in climate talk,https://www.cbc.ca/radio/whatonearth/here-s-a-hot-take-let-s-focus-on-how-we-feel-heat-not-global-warming-1.7289451,negative,0.019578269,0.46938458,0.5110371,-0.21993858917358722
CBC,2024-08-11,"Having trouble reaching 10,000 steps a day? You might not need that many, anyway",https://www.cbc.ca/radio/10k-steps-explained-1.7288791,negative,0.09147197,0.3085762,0.5999518,-0.08685215416416092
CBC,2024-08-11,"Journey of once-sunken sailboat reaches end, volunteer salvor feels left high and dry",https://www.cbc.ca/news/canada/new-brunswick/boat-sunk-st-john-river-removed-disposed-not-a-starship-mark-griffin-coast-guard-1.7275358,negative,0.040394656,0.3939413,0.565664,-0.1535580397826184
CBC,2024-08-11,Your kid wants to get into hammer throwing. What are coaches looking for?,https://www.cbc.ca/sports/olympics/summer/athletics/olympics-coaching-unique-sports-1.7290164,neutral,0.17271869,0.017077452,0.8102039,0.02954009935751678
CBC,2024-08-11,Team Canada enters closing ceremony at Paris 2024,https://www.cbc.ca/player/play/video/9.6478675,neutral,0.14686184,0.00812624,0.8450119,0.021502367259504496
CBC,2024-08-11,"Weather alone may not explain why Brazil plane crashed, killing 62, expert says",https://www.cbc.ca/news/world/brazil-plane-crash-1.7291668,negative,0.006301924,0.77215713,0.22154106,-0.5961868203140686
CBC,2024-08-11,Is Canada's food supply under threat from Russian hackers?,https://www.cbc.cahttps://www.cbc.ca/newsinteractives/features/agri-food-canada-hacking,negative,0.0093359705,0.63366014,0.3570039,-0.4014379906471337
CBC,2024-08-11,"Win or lose, rise or fall, Team Canada had us glued to our screens at the Paris Olympics",https://www.cbc.ca/player/play/video/9.6478513,positive,0.88864833,0.006499898,0.10485178,0.7896536079582184
CBC,2024-08-11,Canada joins international condemnation of deadly Israeli strike on Gaza school compound,https://www.cbc.ca/news/world/airstrike-100-gaza-city-august-10-1.7291161,negative,0.026690653,0.41654631,0.5567632,-0.17279838297632466
CBC,2024-08-11,"It's a mass wedding! 4 couples share special day of love, faith and tradition in St. John's",https://www.cbc.ca/news/canada/newfoundland-labrador/mass-wedding-filipino-community-st-johns-1.7291619,positive,0.95973194,0.0015367118,0.03873119,0.921083167534162
CBC,2024-08-11,"'Really, that song?': Celine Dion disavows Trump's usage of My Heart Will Go On at rally",https://www.cbc.ca/news/entertainment/celine-dion-trump-rally-my-heart-will-go-on-1.7291413,negative,0.045776054,0.25241646,0.7018076,-0.06161859528372027
CBC,2024-08-11,"Moscow, Kyiv trade blame for blaze at Russian-occupied Zaporizhzhia nuclear power plant",https://www.cbc.ca/news/world/zaporizhzhia-fire-nuclear-power-plant-1.7291822,negative,0.009904211,0.40321833,0.58687747,-0.16248692751096883
CBC,2024-08-11,"Summer McIntosh, Ethan Katzberg chosen as Canada's flag-bearers for closing ceremony",https://www.cbc.ca/sports/olympics/summer/canada-olympics-flag-bearer-paris-2024-closing-ceremony-1.7291565,neutral,0.075789765,0.0077218097,0.9164884,0.005684463047469279
CBC,2024-08-11,Tom Cruise stunt at Paris 2024 closing ceremony shines,https://www.cbc.ca/player/play/video/9.6478713,positive,0.38439196,0.0046842177,0.61092377,0.1477352624001469
CBC,2024-08-11,"Buckle up, stargazers: the Perseid meteor shower promises a celestial extravaganza",https://www.cbc.ca/news/science/2024-perseids-1.7282740,positive,0.6808886,0.003579439,0.31553203,0.46359642360035735
CBC,2024-08-11,IN PHOTOS | 2024 Paris Olympic Games closing ceremony,https://www.cbc.ca/sports/olympics/summer/in-photos-2024-paris-olympic-games-closing-ceremony-1.7291780,neutral,0.15973128,0.0096127605,0.83065605,0.025421664558393786
CBC,2024-08-11,Canadian Olympians bid Paris 'adieu' in 2024 Paris Olympic Games closing ceremony,https://www.cbc.ca/sports/olympics/summer/cbc-olympics-paris-2024-closing-ceremony-live-stream-1.7291516,neutral,0.052476574,0.013980896,0.93354255,0.0025583246411231553
CBC,2024-08-11,7 Canadians who could emerge as superstars at the 2028 Los Angeles Olympics,https://www.cbc.ca/sports/olympics/summer/olympics-los-angeles-lookahead-1.7291714,positive,0.2914646,0.0056657717,0.7028698,0.08491946765635205
CBC,2024-08-11,'He was our village healer': L'Arche Homefires mourns founder John MacNeil,https://www.cbc.ca/news/canada/nova-scotia/larche-homefires-mourns-founder-john-macneil-1.7258041,neutral,0.16219568,0.07322811,0.76457614,0.02094508881042012
CBC,2024-08-11,Montreal Pride parade interrupted by pro-Palestinian protesters,https://www.cbc.ca/news/canada/montreal/pride-parade-montreal-2024-1.7291646,negative,0.018283684,0.6455136,0.33620277,-0.4163534891278218
CBC,2024-08-11,This Montreal shop sells food at 3 prices depending on what you can afford,https://www.cbc.ca/player/play/video/9.6476608,neutral,0.15282239,0.0093475785,0.83783007,0.023267301550617958
CBC,2024-08-11,"Family, community honour Tina Fontaine as 10-year mark since her death nears",https://www.cbc.ca/news/canada/manitoba/family-community-honour-tina-fontaine-1.7291546,neutral,0.10835757,0.1996009,0.6920415,-0.028099158821283332
CBC,2024-08-11,"Canada was 'highly confident' it heard man-made noises during search for Titan submersible, documents show",https://www.cbc.ca/news/canada/canada-search-titan-submersible-banging-sounds-1.7290441,neutral,0.12939471,0.012973991,0.8576314,0.01657465606296249
