source,date,headline,url,chosen_label,positive,negative,neutral,compound
CTV,2024-07-01,Alberta RCMP officer fires pistol in Lloydminster campground after suspect tries to steal occupied RV,https://saskatoon.ctvnews.ca/alberta-rcmp-officer-fires-pistol-in-lloydminster-campground-after-suspect-tries-to-steal-occupied-rv-1.6947509,negative,0.010929573,0.5137,0.4753706,-0.26376815290251443
CTV,2024-07-01,"U.S. Supreme Court rules Trump has immunity for official, not private acts",https://www.ctvnews.ca/world/u-s-supreme-court-rules-trump-has-immunity-for-official-not-private-acts-1.6947349,neutral,0.044020355,0.080502935,0.8754768,-0.004542928425522508
CTV,2024-07-01,"Man arrested following firearms complaint in Chestermere, Alta.: RCMP",https://calgary.ctvnews.ca/man-arrested-following-firearms-complaint-in-chestermere-alta-rcmp-1.6947687,neutral,0.013324639,0.19884013,0.7878351,-0.03935987212904024
CTV,2024-07-01,'Lab-grown' meat maker hosts Miami tasting party as Florida ban goes into effect,https://www.ctvnews.ca/sci-tech/lab-grown-meat-maker-hosts-miami-tasting-party-as-florida-ban-goes-into-effect-1.6946742,negative,0.028703164,0.27865157,0.6926454,-0.07682279692470484
CTV,2024-07-01,Canada Day fireworks: Montreal's Old Port to light up the skies tonight,https://montreal.ctvnews.ca/canada-day-fireworks-montreal-s-old-port-to-light-up-the-skies-tonight-1.6947508,positive,0.7037106,0.0029588623,0.2933304,0.4951999802777749
CTV,2024-07-01,"Raves, weddings, and field trips: GTA residents share memories of shuttered Ontario Science Centre",https://toronto.ctvnews.ca/raves-weddings-and-field-trips-gta-residents-share-memories-of-shuttered-ontario-science-centre-1.6943871,neutral,0.035227332,0.15975639,0.80501634,-0.024281132763210422
CTV,2024-07-01,Creators urge Ottawa to force disclosure of 'black box' AI system training,https://www.ctvnews.ca/sci-tech/creators-urge-ottawa-to-force-disclosure-of-black-box-ai-system-training-1.6946862,neutral,0.019579755,0.20254704,0.7778732,-0.04064193539076211
CTV,2024-07-01,AHS water quality tests come back clean: Calgary moves forward with stabilizing service,https://calgary.ctvnews.ca/ahs-water-quality-tests-come-back-clean-calgary-moves-forward-with-stabilizing-service-1.6946800,positive,0.52825,0.0073456382,0.4644044,0.27899408224731914
CTV,2024-07-01,5 members of Georgia family killed after small plane crashes near Cooperstown,https://www.ctvnews.ca/world/5-members-of-georgia-family-killed-after-small-plane-crashes-near-cooperstown-1.6947552,negative,0.01019174,0.71359944,0.27620882,-0.5091202941358937
CTV,2024-07-01,Suspect arrested after 7-hour standoff with Windsor police,https://windsor.ctvnews.ca/suspect-arrested-after-7-hour-standoff-with-windsor-police-1.6946774,negative,0.01639179,0.22924961,0.7543586,-0.05228669696216759
CTV,2024-07-01,Brawl erupts at Rick Ross show in Vancouver during Drake diss track,https://bc.ctvnews.ca/brawl-erupts-at-rick-ross-show-in-vancouver-during-drake-diss-track-1.6947467,neutral,0.10695562,0.027582942,0.8654614,0.010678687747072146
CTV,2024-07-01,Fire ban ended for Lethbridge area,https://calgary.ctvnews.ca/fire-ban-ended-for-lethbridge-area-1.6946552,neutral,0.025079913,0.18419473,0.7907253,-0.03329870514493116
CTV,2024-07-01,Hurricane Beryl makes landfall near Grenada,/video/c2950862-hurricane-season-arrives-early,negative,0.028901558,0.38725904,0.5838393,-0.14913430448735454
CTV,2024-07-01,"If you qualify for this tax credit, you can expect a payment in your bank account this week",https://www.ctvnews.ca/canada/if-you-qualify-for-this-tax-credit-you-can-expect-a-payment-in-your-bank-account-this-week-1.6947458,positive,0.5918651,0.005043102,0.4030917,0.35027894273220284
CTV,2024-07-01,Where to see London and area Canada Day fireworks,https://london.ctvnews.ca/where-to-see-london-and-area-canada-day-fireworks-1.6947008,neutral,0.1651263,0.010875262,0.82399845,0.02714842176789034
CTV,2024-07-01,'I am very proud': Manitoba grandfather and grandson graduate high school in same class,https://winnipeg.ctvnews.ca/i-am-very-proud-manitoba-grandfather-and-grandson-graduate-high-school-in-same-class-1.6944596,positive,0.95382726,0.0022612342,0.043911476,0.9097813714620508
CTV,2024-07-01,WestJet mechanics strike ends after tentative agreement,/video/c2950460-westjet-mechanics-strike-ends?playlistId=1.6932705,neutral,0.026066333,0.20969069,0.76424295,-0.04329073724317034
CTV,2024-07-01,"These ultraprocessed foods may shorten your life, study says",https://www.ctvnews.ca/health/these-ultraprocessed-foods-may-shorten-your-life-study-says-1.6947492,negative,0.009772798,0.8139322,0.17629507,-0.6623900631512853
CTV,2024-07-01,RCMP says a police chase involving an RV in Lloydminster has resulted in multiple injuries,https://edmonton.ctvnews.ca/rcmp-says-a-police-chase-involving-an-rv-in-lloydminster-has-resulted-in-multiple-injuries-1.6946955,negative,0.008014516,0.71665657,0.27532887,-0.5135324431383168
CTV,2024-07-01,"50-year-old Halifax church hall coming down at end of summer, forcing daycare, non-profit to move",https://atlantic.ctvnews.ca/more/50-year-old-halifax-church-hall-coming-down-at-end-of-summer-forcing-daycare-non-profit-to-move-1.6945518,negative,0.011466828,0.5359683,0.45256478,-0.2871305975465255
CTV,2024-07-01,Police investigating homicide after injured man dies in Sask. hospital on Canada Day,https://saskatoon.ctvnews.ca/police-investigating-homicide-after-injured-man-dies-in-sask-hospital-on-canada-day-1.6947674,negative,0.013101148,0.46298778,0.5239112,-0.21418599092024593
CTV,2024-07-01,Are coffee intake habits linked to genetics?,/video/c2950303-ctv-national-news--coffee-intake-linked-to-dna-,neutral,0.044332843,0.033836,0.92183113,0.0008205263929639273
CTV,2024-07-01,Unknown First World War soldier honoured in N.L.,/video/c2950453-furey--n-l--s-unknown-soldier--answered-the-call-?playlistId=1.6947203,neutral,0.12853001,0.027352273,0.8441178,0.015771806202635297
CTV,2024-07-01,Here's what's happening in Regina on Canada Day,https://regina.ctvnews.ca/here-s-what-s-happening-in-regina-on-canada-day-1.6947168,neutral,0.111819014,0.006867903,0.88131315,0.012456317568743103
CTV,2024-07-01,"NHL reinstates Bowman, Quenneville after being banned for their role in Blackhawks assault scandal",https://www.ctvnews.ca/sports/nhl-reinstates-bowman-quenneville-after-being-banned-for-their-role-in-blackhawks-assault-scandal-1.6947660,negative,0.01809562,0.28588903,0.6960154,-0.08140507003567166
CTV,2024-07-01,Official says security cam photo taken in northern Ont. appears to be a cougar,https://northernontario.ctvnews.ca/official-says-security-cam-photo-taken-in-northern-ont-appears-to-be-a-cougar-1.6947429,negative,0.013230713,0.330779,0.65599036,-0.10923966707503041
CTV,2024-07-01,"Owen Sound fire, death under investigation",https://barrie.ctvnews.ca/owen-sound-fire-death-under-investigation-1.6947593,negative,0.01899472,0.4986733,0.4823319,-0.24831429371834624
CTV,2024-07-01,"Oilers ink Arvidsson to 2-year contract, re-sign Brown and Perry to 1-year deals",https://edmonton.ctvnews.ca/oilers-ink-arvidsson-to-2-year-contract-re-sign-brown-and-perry-to-1-year-deals-1.6947504,neutral,0.04986823,0.014064009,0.9360677,0.0022890460913265187
CTV,2024-07-01,"Renauld White, 'The Guiding Light' actor and fashion model, dead at 80",https://www.ctvnews.ca/entertainment/renauld-white-the-guiding-light-actor-and-fashion-model-dead-at-80-1.6947459,neutral,0.060924336,0.07921639,0.8598593,-0.002563461551109647
CTV,2024-07-01,Fire breaks out at Simcoe Hotel,https://barrie.ctvnews.ca/fire-breaks-out-at-simcoe-hotel-1.6947479,negative,0.015552755,0.39828297,0.58616424,-0.15838745123016196
CTV,2024-07-01,"Man who confessed to killing 4 people in Maine, including parents, is sentenced to life in prison",https://www.ctvnews.ca/world/man-who-confessed-to-killing-4-people-in-maine-including-parents-is-sentenced-to-life-in-prison-1.6947635,negative,0.0066984002,0.86999816,0.123303235,-0.7568520786369461
CTV,2024-07-01,70 per cent of Canadians say the country is 'broken': Poll,/video/c2950591-poll--canadian-pride-on-the-decline,negative,0.010575323,0.7135375,0.2758872,-0.5090239473309772
CTV,2024-07-01,Scientists wary of bird flu pandemic 'unfolding in slow motion',https://www.ctvnews.ca/health/scientists-wary-of-bird-flu-pandemic-unfolding-in-slow-motion-1.6947424,negative,0.01254013,0.5134124,0.47404754,-0.2634350248711357
CTV,2024-07-01,TV personality Carlos Watson testifies in his trial over collapse of startup Ozy Media,https://www.ctvnews.ca/entertainment/tv-personality-carlos-watson-testifies-in-his-trial-over-collapse-of-startup-ozy-media-1.6947651,neutral,0.034561813,0.12476517,0.840673,-0.014371828040569135
CTV,2024-07-01,"'Peace, love, unity and respect': Thousands celebrate Pride in downtown Toronto",https://toronto.ctvnews.ca/peace-love-unity-and-respect-thousands-celebrate-pride-in-downtown-toronto-1.6946727,positive,0.9458039,0.0022863597,0.051909912,0.8945395950530377
CTV,2024-07-01,French-Montrealers vote in ‘historic’ election amid surge in far-right,https://montreal.ctvnews.ca/french-montrealers-vote-in-historic-election-amid-surge-in-far-right-1.6946238,neutral,0.045665227,0.08300609,0.87132865,-0.004804699379282518
CTV,2024-07-01,How to exercise when it's too hot outside,https://www.ctvnews.ca/health/how-to-exercise-when-it-s-too-hot-outside-1.6942863,negative,0.04290639,0.41278315,0.5443105,-0.16854894403160614
CTV,2024-07-01,"Friends, partners, allies: Ambassador praises U.S-Canada relationship on Canada Day",https://www.ctvnews.ca/canada/friends-partners-allies-ambassador-praises-u-s-canada-relationship-on-canada-day-1.6947602,positive,0.8706772,0.0042865733,0.1250363,0.7580603133519404
CTV,2024-07-01,"Faulty brakes, airbag systems: Here are the cars recalled in Canada",https://www.ctvnews.ca/autos/faulty-brakes-airbag-systems-here-are-the-cars-recalled-in-canada-1.6943435,negative,0.00831473,0.78280145,0.20888361,-0.6127091358809462
CTV,2024-07-01,Man in his 70s struck and killed by a vehicle on Montreal's South Shore,https://montreal.ctvnews.ca/man-in-his-70s-struck-and-killed-by-a-vehicle-on-montreal-s-south-shore-1.6946767,negative,0.012096152,0.6569319,0.33097202,-0.4314131355158537
CTV,2024-07-01,Severe thunderstorm watch in effect for B.C. Interior,https://bc.ctvnews.ca/severe-thunderstorm-watch-in-effect-for-b-c-interior-1.6947042,negative,0.02484769,0.2601719,0.71498024,-0.06707204704607506
CTV,2024-07-01,"Brandon Montour, Stanley Cup champ from Six Nations, signs with Seattle Kraken",https://kitchener.ctvnews.ca/brandon-montour-stanley-cup-champ-from-six-nations-signs-with-seattle-kraken-1.6947447,neutral,0.08298248,0.006422653,0.91059506,0.006844826761687628
CTV,2024-07-01,'Very proud and very happy': Looking back at Pride Month in Manitoba,https://winnipeg.ctvnews.ca/very-proud-and-very-happy-looking-back-at-pride-month-in-manitoba-1.6947676,positive,0.9821307,0.0019891497,0.01588005,0.9645768826707785
CTV,2024-07-01,How Barrie is celebrating Canada Day,https://barrie.ctvnews.ca/how-barrie-is-celebrating-canada-day-1.6947539,neutral,0.17457159,0.022560675,0.8028676,0.02996627833539378
CTV,2024-07-01,Judge calls Jeffrey Epstein 'most infamous pedophile in American history' as he releases transcripts,https://www.ctvnews.ca/world/judge-calls-jeffrey-epstein-most-infamous-pedophile-in-american-history-as-he-releases-transcripts-1.6947553,negative,0.010940931,0.72679037,0.26226875,-0.5281045149950234
CTV,2024-07-01,Saskatoon crews tackle garage fire on Canada Day,https://saskatoon.ctvnews.ca/saskatoon-crews-tackle-garage-fire-on-canada-day-1.6947471,neutral,0.05962646,0.04060316,0.89977044,0.001906696935570551
CTV,2024-07-01,Travellers watch as WestJet cancels flights with no end to mechanics strike in sight,https://www.ctvnews.ca/canada/travellers-watch-as-westjet-cancels-flights-with-no-end-to-mechanics-strike-in-sight-1.6946736,negative,0.009528121,0.721374,0.26909783,-0.5202896911518877
CTV,2024-07-01,What's open and closed? Where are the fireworks? What to know for Canada Day 2024 in Toronto,https://toronto.ctvnews.ca/what-s-open-and-closed-where-are-the-fireworks-what-to-know-for-canada-day-2024-in-toronto-1.6940453,neutral,0.036195673,0.06375179,0.9000525,-0.0027541650286972974
CTV,2024-07-01,One charged with impaired after northern Ont. police spot vehicle without lights,https://northernontario.ctvnews.ca/one-charged-with-impaired-after-northern-ont-police-spot-vehicle-without-lights-1.6947345,negative,0.008769103,0.7344414,0.25678945,-0.53932731563593
CBC,2024-07-01,Boil water order in effect for big chunk of Halifax Regional Municipality,https://www.cbc.ca/news/canada/nova-scotia/boil-water-order-in-effect-for-big-chunk-of-halifax-regional-municipality-1.7251689,neutral,0.05305303,0.030282326,0.9166649,0.001897598834684544
CBC,2024-07-01,"Usher wins lifetime achievement award, Will Smith performs new single at BET Awards",https://www.cbc.ca/news/world/bet-awards-usher-will-smith-1.7251385,positive,0.85631883,0.001738923,0.14194235,0.7332788408861006
CBC,2024-07-01,Timeline for easing Calgary indoor water restrictions coming on Tuesday,https://www.cbc.ca/news/canada/calgary/calgary-jyoti-gondek-canada-day-water-main-break-1.7251456,neutral,0.02289051,0.02940671,0.9477028,-0.00034077882821814676
CBC,2024-07-01,Robert Bateman's lesser known works to be on display in Penticton,https://www.cbc.ca/news/canada/british-columbia/robert-bateman-unexpected-art-1.7246634,neutral,0.06359786,0.025170619,0.91123134,0.0034111347433571915
CBC,2024-07-01,#TheMoment a man swam 510 km in the Yukon River without stopping,https://www.cbc.ca/player/play/video/9.6436996,neutral,0.039798878,0.045758374,0.91444254,-0.000509879336938468
CBC,2024-07-01,These award-winning photos of pets will make you LOL,https://www.cbc.cahttps://www.cbc.ca/kidsnews/post/photos-these-award-winning-photos-of-pets-will-make-you-lol,positive,0.96756023,0.003690295,0.028749393,0.936159253626528
CBC,2024-07-01,"I'm fluent in English, but my accent still feels like a barrier to acceptance",https://www.cbc.ca/news/canada/saskatchewan/english-accent-speaking-1.7237648,negative,0.10576133,0.27699652,0.61724216,-0.0655416171516876
CBC,2024-07-01,"Canada 'sleepwalking' into cashless society, consumer advocates warn",https://www.cbc.ca/news/canada/ottawa/canada-sleepwalking-into-cashless-society-consumer-advocates-warn-1.7248846,negative,0.023390943,0.23675011,0.7398589,-0.05550348174568942
CBC,2024-07-01,"NHL reinstates former Chicago executives, coach after ban for mishandling sexual assault scandal",https://www.cbc.ca/sports/hockey/nhl/nhl-lifts-employment-ban-chicago-assault-scandal-1.7251638,negative,0.014209578,0.49519944,0.49059093,-0.24502060410002713
CBC,2024-07-01,Canadians secure Olympic spots at track and field trials,https://www.cbc.ca/player/play/video/9.6436994,positive,0.40221268,0.0038254869,0.5939619,0.16176038137236048
CBC,2024-07-01,Michael J. Fox joins Coldplay on stage for 'mind blowing' Glastonbury performance,https://www.cbc.ca/news/entertainment/michael-j-fox-coldplay-1.7251517,positive,0.6737611,0.0028763844,0.3233624,0.45394582576786746
CBC,2024-07-01,"U.S. Supreme Court says Trump, ex-presidents have some immunity from prosecution",https://www.cbc.ca/news/world/trump-supreme-court-immunity-1.7251423,neutral,0.11783924,0.022338035,0.85982275,0.013387096534298593
CBC,2024-07-01,Justin Trudeau's 2024 Canada Day message,https://www.cbc.ca/player/play/video/9.6436982,neutral,0.09346703,0.016080255,0.8904528,0.008477504253376456
CBC,2024-07-01,Trudeau says he is 'committed' to staying as PM after byelection loss,https://www.cbc.ca/news/politics/justin-trudeau-committed-staying-prime-minister-resign-1.7251448,neutral,0.20576242,0.012790144,0.78144747,0.04217457836781513
CBC,2024-07-01,Traveller affected by WestJet delays says vacations 'a hard thing to come by these days',https://www.cbc.ca/player/play/video/9.6436623,negative,0.01235913,0.71246266,0.27517816,-0.5074503195622171
CBC,2024-07-01,He’s home. Unknown Soldier entombed at Newfoundland’s National War Memorial,https://www.cbc.ca/player/play/video/9.6437108,neutral,0.19231161,0.014335455,0.79335284,0.03677826785341409
CBC,2024-07-01,Toronto travellers 'so disappointed' by cancellations,https://www.cbc.ca/player/play/video/9.6436636,negative,0.008696083,0.8154343,0.1758697,-0.6648573903207904
CBC,2024-07-01,WestJet strike over as sides reach tentative agreement,https://www.cbc.ca/news/canada/calgary/westjet-strike-over-canada-day-weekend-cancellations-1.7251357,neutral,0.06446885,0.054208204,0.881323,0.0012177032503535301
CBC,2024-07-01,Is 13 too young to work? A Saskatchewan proposal has reignited debate around kids and labour,https://www.cbc.ca/news/canada/calgary/canada-child-labour-laws-minimum-working-age-by-province-1.7242616,negative,0.01984677,0.2620796,0.71807355,-0.06829184240133124
CBC,2024-07-01,WATCH | Eggs meet roulette for a smashing good time in U.K. contest,https://www.cbc.cahttps://www.cbc.ca/player/play/video/9.6437139,positive,0.905957,0.0032282532,0.09081478,0.8207476277669046
CBC,2024-07-01,'Extremely dangerous' Hurricane Beryl makes landfall in Caribbean,https://www.cbc.ca/news/world/hurricane-beryl-1.7251378,negative,0.01412925,0.776842,0.2090288,-0.6032838437486481
CBC,2024-07-01,"Parties, parades and protest mark Pride worldwide",https://www.cbc.ca/news/world/pride-worldwide-parties-protests-1.7251166,positive,0.5871701,0.007063403,0.4057667,0.34471874210015585
CBC,2024-07-01,Break your iPhone again? Apple will finally let you fix its products yourself,https://www.cbc.ca/news/canada/apple-self-repair-canada-1.7250634,negative,0.12427191,0.3769847,0.4987434,-0.12667394822589273
CBC,2024-07-01,"'Everyone's brains are going crazy,' WestJet passenger says as fallout from strike continues",https://www.cbc.ca/news/business/westjet-cancellations-continue-1.7251644,negative,0.0117695145,0.7907766,0.19745389,-0.6251891023883438
CBC,2024-07-01,How some young Canadians are saving money by embracing the digital nomad lifestyle,https://www.cbc.ca/news/business/canadian-digital-nomads-1.7249543,positive,0.23182465,0.027191514,0.7409837,0.053003311577700885
CBC,2024-07-01,"Israel orders Palestinians to flee Khan Younis, signalling possible return of troops",https://www.cbc.ca/news/world/gaza-prisoner-exchange-shifa-hospital-director-released-1.7251433,negative,0.014870237,0.37899396,0.60613585,-0.14341528589405073
CBC,2024-07-01,"2-time Stanley Cup champion Steven Stamkos leaves Tampa Bay, signs with Nashville Predators",https://www.cbc.ca/sports/hockey/nhl/nhl-free-agency-rndup-july1-1.7251408,neutral,0.07813234,0.014107424,0.90776014,0.005905649242659905
CBC,2024-07-01,WATCH: CBC News Network,https://www.cbc.cahttps://gem.cbc.ca/live,neutral,0.10073908,0.018231502,0.88102955,0.00981596340483426
CBC,2024-07-01,Unknown Soldier from WW I laid to rest as N.L. marks Memorial Day,https://www.cbc.ca/news/canada/newfoundland-labrador/newfoundland-memorial-day-2024-1.7249823,neutral,0.08033021,0.112546116,0.80712354,-0.00621369026444718
CBC,2024-07-01,WATCH : CBC News Explore,https://www.cbc.cahttps://gem.cbc.ca/live,neutral,0.09840742,0.014817321,0.88677526,0.009464467482493077
CBC,2024-07-01,New Canadian citizens share what Canada Day means to them,https://www.cbc.ca/player/play/video/9.6437134,positive,0.24483213,0.007088526,0.7480793,0.05989253445298459
CBC,2024-07-01,'This language belongs to us. I want it back': Scottish Gaelic revival spans North America,https://www.cbc.ca/news/canada/nova-scotia/scottish-gaelic-revitalization-efforts-span-north-america-1.7245666,positive,0.65694654,0.008337681,0.33471584,0.4315092007488488
CBC,2024-07-01,N.L. premier on importance of 'closure' as Unknown Soldier goes to final resting place,https://www.cbc.ca/player/play/video/9.6437104,neutral,0.05079576,0.034898736,0.9143056,0.0013622855349837426
CBC,2024-07-01,Thousands gather for Pride parade in downtown Toronto,https://www.cbc.ca/player/play/video/9.6436920,positive,0.3390527,0.0112495115,0.6496977,0.1148302061033668
CBC,2024-07-01,Celebrations mark Canada Day from coast to coast to coast,https://www.cbc.ca/news/canada/canada-day-2024-1.7250830,positive,0.8053054,0.0024331766,0.19226155,0.6485107816534086
CBC,2024-07-01,Sheree Fertuck's murder illustrates Saskatchewan's deep-seated misogyny problem: expert,https://www.cbc.ca/news/canada/saskatoon/sheree-fertuck-greg-intimate-partner-violence-1.7249265,negative,0.0062699425,0.83029073,0.16343936,-0.689343367639017
CBC,2024-07-01,Eggs meet roulette for a smashing good time in U.K. contest,https://www.cbc.ca/player/play/video/9.6437139,positive,0.8692118,0.008724509,0.12206372,0.7554530046763444
CBC,2024-07-01,'Give us $600 and also we hate you': WestJet's new UltraBasic fare gets roasted online,https://www.cbc.ca/news/canada/westjet-ultrabasic-fare-1.7227809,negative,0.0052934987,0.9332341,0.061472356,-0.8708979114297932
CBC,2024-07-01,Man charged in alleged $7.8M Ponzi scheme drowns in B.C. before Edmonton fraud trial,https://www.cbc.ca/news/canada/edmonton/man-charged-in-alleged-7-8m-ponzi-scheme-drowns-in-b-c-before-edmonton-fraud-trial-1.7249776,negative,0.010913622,0.7039957,0.28509063,-0.4954908865845624
CBC,2024-07-01,What the U.S. Supreme Court's ruling on immunity means for Donald Trump,https://www.cbc.ca/player/play/video/9.6437189,neutral,0.031228667,0.04026802,0.92850333,-0.0006462835058201888
CBC,2024-07-01,Was your WestJet flight cancelled this weekend? Here's what you need to know,https://www.cbc.ca/news/canada/westjet-strike-passenger-rights-1.7250797,negative,0.02110736,0.44227806,0.5366146,-0.19516435995407733
CBC,2024-07-01,"3 years after a devastating wildfire, Lytton, B.C., still hasn't rebuilt despite record-high recovery funding",https://www.cbc.ca/news/canada/lytton-fire-recovery-funds-rebuild-3-years-later-1.7247999,negative,0.009304967,0.8337899,0.15690513,-0.6951190273377588
CBC,2024-07-01,Thousands of ultra-Orthodox Jewish men clash with Israeli police over draft,https://www.cbc.ca/news/world/ultra-orthodox-draft-israel-military-1.7251400,negative,0.00965629,0.58498996,0.4053537,-0.3421200319281379
CBC,2024-07-01,See how inflation in Canada has affected the wages of workers in your region,https://www.cbc.ca/news/business/canada-wages-inflation-interactive-1.7234065,neutral,0.032123003,0.176076,0.79180104,-0.029970864621622795
CBC,2024-07-01,Violinist plays Ode to Newfoundland atop Signal Hill in Memorial Day tribute,https://www.cbc.ca/player/play/video/9.6436652,neutral,0.11383979,0.0043788454,0.8817814,0.012940319452879212
