source,date,headline,url,chosen_label,positive,negative,neutral,compound
CTV,2024-01-07,Busy time for collectors as the Christmas 'clean-up' continues in northern Ont.,https://northernontario.ctvnews.ca/busy-time-for-collectors-as-the-christmas-clean-up-continues-in-northern-ont-1.6714466,neutral,0.09070566,0.08201399,0.8272803,0.0015012238124665345
CTV,2024-01-07,Meet some of the new inductees of the North American Indigenous Athletics Hall of Fame,https://www.ctvnews.ca/sports/meet-some-of-the-new-inductees-of-the-north-american-indigenous-athletics-hall-of-fame-1.6711443,positive,0.26022485,0.004270835,0.7355042,0.06769876262278274
CTV,2024-01-07,"Five-year-old Moncton, N.B., boy mourned in hockey pre-game ceremony",https://atlantic.ctvnews.ca/five-year-old-moncton-n-b-boy-mourned-in-hockey-pre-game-ceremony-1.6714919,negative,0.024081009,0.41186118,0.5640578,-0.16904972547267505
CTV,2024-01-07,The 'clucking code': Humans can understand how a chicken feels from its clucks,https://www.ctvnews.ca/sci-tech/the-clucking-code-humans-can-understand-how-a-chicken-feels-from-its-clucks-1.6713257,neutral,0.06868093,0.036815338,0.8945037,0.0033617013674183127
CTV,2024-01-07,"First-degree murder charge laid in baby's death in Thornhill, Ont.",https://toronto.ctvnews.ca/first-degree-murder-charge-laid-in-baby-s-death-in-thornhill-ont-1.6712683,negative,0.0076979278,0.78927135,0.2030306,-0.6228900945571478
CTV,2024-01-07,"Tesla recalls over 1.6 million EVs exported to China to fix automatic steering, door latch glitches",https://www.ctvnews.ca/autos/tesla-recalls-over-1-6-million-evs-exported-to-china-to-fix-automatic-steering-door-latch-glitches-1.6712496,negative,0.024954295,0.50498986,0.47005582,-0.25439205892600825
CTV,2024-01-07,Israel signals it has wrapped up major combat in northern Gaza as the war enters its fourth month,https://www.ctvnews.ca/world/israel-signals-it-has-wrapped-up-major-combat-in-northern-gaza-as-the-war-enters-its-fourth-month-1.6714931,neutral,0.032746017,0.21616115,0.75109285,-0.04565333700749097
CTV,2024-01-07,"A group representing TikTok, Meta and X sues Ohio over new law limiting kids' use of social media",https://www.ctvnews.ca/business/a-group-representing-tiktok-meta-and-x-sues-ohio-over-new-law-limiting-kids-use-of-social-media-1.6713810,neutral,0.024895266,0.22046463,0.75464,-0.04798490298494684
CTV,2024-01-07,"'Cutting edge' lab probes weight loss mysteries in children, adults in Canada",https://www.ctvnews.ca/canada/cutting-edge-lab-probes-weight-loss-mysteries-in-children-adults-in-canada-1.6713620,neutral,0.031798545,0.0469264,0.921275,-0.0011909401887906235
CTV,2024-01-07,'This is a troubling case': Vancouver police investigate reported child-luring attempt at home daycare,https://bc.ctvnews.ca/this-is-a-troubling-case-vancouver-police-investigate-reported-child-luring-attempt-at-home-daycare-1.6713262,negative,0.0059560644,0.7907246,0.2033195,-0.6252097745088507
CTV,2024-01-07,OPP officers cleared of wrongdoing in arrest of man in Shelburne,https://barrie.ctvnews.ca/opp-officers-cleared-of-wrongdoing-in-arrest-of-man-in-shelburne-1.6714372,neutral,0.035131626,0.13423721,0.8306312,-0.016785395044748963
CTV,2024-01-07,"With banku and jollof rice, Ghanaian chef tries to break world cook-a-thon record",https://www.ctvnews.ca/lifestyle/with-banku-and-jollof-rice-ghanaian-chef-tries-to-break-world-cook-a-thon-record-1.6713404,positive,0.45255727,0.0102966735,0.5371461,0.20470204414415605
CTV,2024-01-07,Blinken meets Jordan's king and foreign minister on Mideast push to keep Gaza war from spreading,https://www.ctvnews.ca/world/blinken-meets-jordan-s-king-and-foreign-minister-on-mideast-push-to-keep-gaza-war-from-spreading-1.6714917,neutral,0.038507592,0.09908929,0.86240315,-0.008335850174412407
CTV,2024-01-07,"Hasina is set to stay in power in Bangladesh after opposition boycotts election, saying it's unfair",https://www.ctvnews.ca/world/hasina-is-set-to-stay-in-power-in-bangladesh-after-opposition-boycotts-election-saying-it-s-unfair-1.6714900,negative,0.0156441,0.5420824,0.4422735,-0.2936086227217771
CTV,2024-01-07,"This visually impaired man travelled to Japan to run 2,300 km in 40 days – and wants to tackle South Korea next",https://www.ctvnews.ca/lifestyle/this-visually-impaired-man-travelled-to-japan-to-run-2-300-km-in-40-days-and-wants-to-tackle-south-korea-next-1.6712386,neutral,0.19577955,0.01727523,0.7869453,0.0380311868808203
CTV,2024-01-07,RIDE Campaign results in hundreds of charges during the holiday season,https://windsor.ctvnews.ca/ride-campaign-results-in-hundreds-of-charges-during-the-holiday-season-1.6714652,neutral,0.09574595,0.19320908,0.711045,-0.028162456393943103
CTV,2024-01-07,'We don't deserve it': B.C. man with Stage 4 cancer says he was denied insurance coverage,https://bc.ctvnews.ca/we-don-t-deserve-it-b-c-man-with-stage-4-cancer-says-he-was-denied-insurance-coverage-1.6704542,negative,0.004692585,0.89339864,0.10190881,-0.7981390542730025
CTV,2024-01-07,Charges laid after fiery fail-to-remain crash in Gravenhurst on New Year's Eve,https://barrie.ctvnews.ca/charges-laid-after-fiery-fail-to-remain-crash-in-gravenhurst-on-new-year-s-eve-1.6714378,negative,0.011600942,0.66316086,0.32523826,-0.4396476861628553
CTV,2024-01-07,"'Those cries haunt me to this day': Final victim impact statements heard in London, Ont. courtroom in Veltman sentencing",https://london.ctvnews.ca/those-cries-haunt-me-to-this-day-final-victim-impact-statements-heard-in-london-ont-courtroom-in-veltman-sentencing-1.6712493,negative,0.017925499,0.61665255,0.36542183,-0.37993911313348505
CTV,2024-01-07,'More sweet than sour': New survey shows Canadians are optimistic entering 2024,https://www.ctvnews.ca/canada/more-sweet-than-sour-new-survey-shows-canadians-are-optimistic-entering-2024-1.6714772,positive,0.7500852,0.0066086096,0.24330609,0.5625841958537086
CTV,2024-01-07,"Rogers, Bell to soon increase phone plan prices",/video/c2841595-ctv-national-news--costly-connections,neutral,0.037017208,0.16288526,0.80009747,-0.025161342654286045
CTV,2024-01-07,‘It’s time to step up’: St. Norbert residents renew calls for preservation of Lemay Forest,https://winnipeg.ctvnews.ca/it-s-time-to-step-up-st-norbert-residents-renew-calls-for-preservation-of-lemay-forest-1.6714726,positive,0.34958372,0.0073101437,0.6431061,0.12215534581082821
CTV,2024-01-07,Son of veteran correspondent is the fifth member of his family killed by Israeli strikes on Gaza,https://www.ctvnews.ca/world/son-of-veteran-correspondent-is-the-fifth-member-of-his-family-killed-by-israeli-strikes-on-gaza-1.6714892,negative,0.0069525084,0.8713494,0.12169807,-0.7592014422723148
CTV,2024-01-07,"Hope abounds for the NFL's final four as Browns, Lions, Texans and Jaguars eye elusive Super Bowl",https://www.ctvnews.ca/sports/hope-abounds-for-the-nfl-s-final-four-as-browns-lions-texans-and-jaguars-eye-elusive-super-bowl-1.6713605,positive,0.8703214,0.004410688,0.12526774,0.7574400278386832
CTV,2024-01-07,Show goes on in Vancouver after Gaza tensions scrap play's Victoria run,https://bc.ctvnews.ca/show-goes-on-in-vancouver-after-gaza-tensions-scrap-play-s-victoria-run-1.6714458,negative,0.013326125,0.44894525,0.5377286,-0.20137425520677255
CTV,2024-01-07,Quebec man charged with 2nd-degree murder in death of spouse,https://montreal.ctvnews.ca/quebec-man-charged-with-2nd-degree-murder-in-death-of-spouse-1.6714312,negative,0.007299273,0.8190399,0.1736608,-0.6707731085547941
CTV,2024-01-07,Sixth Edmonton encampment torn down downtown Saturday,https://edmonton.ctvnews.ca/sixth-edmonton-encampment-torn-down-downtown-saturday-1.6714654,negative,0.008127837,0.72073233,0.2711399,-0.5193890108370169
CTV,2024-01-07,The 2024 award season is weird. Here’s a guide to unpacking it,https://www.ctvnews.ca/entertainment/the-2024-award-season-is-weird-here-s-a-guide-to-unpacking-it-1.6713291,negative,0.01697798,0.7527054,0.23031656,-0.5662772154880518
CTV,2024-01-07,A greener Parliament Hill? House of Commons looking into swapping out shuttles for EV option,https://www.ctvnews.ca/politics/a-greener-parliament-hill-house-of-commons-looking-into-swapping-out-shuttles-for-ev-option-1.6713912,positive,0.28358704,0.013667649,0.7027452,0.08023483612464588
CTV,2024-01-07,Alberta Premier Danielle Smith wants Prime Minister Justin Trudeau to find a new environment minister,https://www.ctvnews.ca/politics/alberta-premier-danielle-smith-wants-prime-minister-justin-trudeau-to-find-a-new-environment-minister-1.6713329,neutral,0.03812389,0.02734751,0.93452835,0.0007055473757233699
CTV,2024-01-07,'The black was staring back': B.C. couple discovers bear living under their deck,https://bc.ctvnews.ca/the-black-was-staring-back-b-c-couple-discovers-bear-living-under-their-deck-1.6710211,neutral,0.031976186,0.05848118,0.90954256,-0.002397573838379685
CTV,2024-01-07,"'Grandpa, I’m not lying': Ontario man thought his grandson was joking that he won the lottery",https://toronto.ctvnews.ca/grandpa-i-m-not-lying-ontario-man-thought-his-grandson-was-joking-that-he-won-the-lottery-1.6713552,positive,0.2901578,0.12651128,0.5833309,0.0681864430751169
CTV,2024-01-07,New signage to commemorate new Outdoor Hockey League season,https://regina.ctvnews.ca/new-signage-to-commemorate-new-outdoor-hockey-league-season-1.6714756,positive,0.42536622,0.0038857367,0.57074815,0.18092127428246485
CTV,2024-01-07,Back on track: NDP bill aims to make train passengers a priority,https://www.ctvnews.ca/politics/back-on-track-ndp-bill-aims-to-make-train-passengers-a-priority-1.6713761,positive,0.6318745,0.007232003,0.36089337,0.3992131583944314
CTV,2024-01-07,Ice fishers are holding out in Simcoe County amid near-record-low ice levels,https://barrie.ctvnews.ca/ice-fishers-are-holding-out-in-simcoe-county-amid-near-record-low-ice-levels-1.6714487,negative,0.015212158,0.46250108,0.5222868,-0.21367583847213467
CTV,2024-01-07,Family grieves daughter who died after Thunder Bay police did not respond to 911 call,https://northernontario.ctvnews.ca/family-grieves-daughter-who-died-after-thunder-bay-police-did-not-respond-to-911-call-1.6714353,negative,0.006226533,0.73126966,0.2625039,-0.5347164775243041
CTV,2024-01-07,One dead in fire at Kanata seniors' residence,https://ottawa.ctvnews.ca/one-dead-in-fire-at-kanata-seniors-residence-1.6714304,negative,0.009812823,0.5551238,0.43506333,-0.30806616456970914
CTV,2024-01-07,Canadians' top concerns are all economic issues: Nanos,/video/c2841388-canadians_-top-national-issues-of-concern?playlistId=1.6588395,negative,0.036851216,0.39778277,0.565366,-0.15687311061122244
CTV,2024-01-07,Saskatoon SPCA opens new location,https://saskatoon.ctvnews.ca/saskatoon-spca-opens-new-location-1.6714525,neutral,0.09456812,0.008309755,0.8971222,0.008874070626865738
CTV,2024-01-07,Eclipse excitement: N.B. communities in 'path of totality' plan for perfect view in 2024,https://atlantic.ctvnews.ca/eclipse-excitement-n-b-communities-in-path-of-totality-plan-for-perfect-view-in-2024-1.6704468,positive,0.8931855,0.0020401038,0.104774386,0.797776195453169
CBC,2024-01-07,B.C. town rallies around 2 boys seriously burned after explosive object thrown into bonfire,https://www.cbc.ca/news/canada/british-columbia/smithers-bc-explosion-support-1.7076612,negative,0.008694608,0.72367865,0.2676267,-0.5236352329901095
CBC,2024-01-07,Families of PS752 victims push for government action against Iran on anniversary of deadly crash,https://www.cbc.ca/news/politics/families-ps752-canada-iran-irgc-terrorist-listing-1.7075536,negative,0.02432144,0.47813314,0.49754542,-0.22801976918150402
CBC,2024-01-07,"After this week, Israel and Hezbollah are on the brink of wider war",https://www.cbc.ca/news/world/israel-hezbollah-threats-1.7075816,negative,0.012114918,0.7216162,0.26626882,-0.5205832017701937
CBC,2024-01-07,I worked Saturdays at the dump because I'm fascinated by what people throw out,https://www.cbc.ca/news/canada/first-person-saturdays-at-the-dump-1.7075154,positive,0.5660743,0.048198868,0.38572684,0.318116979056164
CBC,2024-01-07,These women donated organs to complete strangers. Both say they have no regrets,https://www.cbc.ca/radio/whitecoat/living-organ-donors-canada-1.7074790,positive,0.4871985,0.07628377,0.43651775,0.23154315242847723
CBC,2024-01-07,Carbon offsets are helping protect B.C.'s Great Bear Rainforest. But is that sustainable?,https://www.cbc.ca/radio/whatonearth/great-bear-rainforest-carbon-offsets-1.7072839,neutral,0.06515906,0.17370205,0.761139,-0.025926688876349413
CBC,2024-01-07,"PWHL showcases physicality of women's game, with full approval from players",https://www.cbc.ca/sports/hockey/pwhl/pwhl-physicality-officiating-2024-1.7076009,positive,0.63631475,0.004162919,0.35952234,0.4048791309086255
CBC,2024-01-07,Which airline ranked the worst for being on time? Phone plans are going up: CBC's Marketplace cheat sheet,https://www.cbc.ca/news/business/marketplace-cheat-sheet-jan05-1.7075830,negative,0.012990538,0.80800116,0.17900828,-0.652697145277541
CBC,2024-01-07,U.S. officials ground certain Boeing 737-9 Max planes after panel blowout during Alaska Airlines flight,https://www.cbc.ca/news/world/alaska-airlines-grounds-boeing-737-9-aircraft-wind-blew-out-1.7076487,negative,0.022106577,0.2887505,0.68914306,-0.0828881099929113
CBC,2024-01-07,"The Golden Globes are tonight. These are the stars, films and TV shows up for the big awards",https://www.cbc.ca/news/entertainment/2024-golden-globe-nominations-1.7055081,positive,0.45891345,0.0057947156,0.5352919,0.21056794483367014
CBC,2024-01-07,"'Try not to let moose lick your car,' warns Parks Canada, as more moose flock to highways",https://www.cbc.ca/news/canada/british-columbia/dont-let-moose-lick-1.7074587,negative,0.050070416,0.3123564,0.6375732,-0.09505948291660005
CBC,2024-01-07,"'Consider switching' mobile carriers, says federal department over price hikes",https://www.cbc.ca/news/business/mobile-wireless-pricing-competition-1.7076073,neutral,0.04150379,0.059158515,0.89933777,-0.001777163955580363
CBC,2024-01-07,This man says moving to Canada was the 'toughest experience ever' with no credit history. So he created an app,https://www.cbc.ca/news/canada/kitchener-waterloo/newcomer-banking-app-credit-union-for-immigrants-1.7050746,negative,0.028437916,0.7570886,0.21447349,-0.5723744357909766
CBC,2024-01-07,Go beyond the headlines | Stream CBC News Explore,https://www.cbc.cahttps://www.cbc.ca/news/cbc-news-explore-1.6512577,neutral,0.09185704,0.0112939505,0.89684886,0.008310174861161368
CBC,2024-01-07,"It might be a simple game, but cornhole is taking North America by storm",https://www.cbc.ca/news/canada/ottawa/it-might-be-a-simple-game-but-cornhole-is-taking-north-america-by-storm-1.7072449,positive,0.5500457,0.07383473,0.37611964,0.29709869559146007
CBC,2024-01-07,'Good Samaritan's nightmare': Renowned Niagara winemaker's killer found not criminally responsible,https://www.cbc.ca/news/canada/hamilton/paul-pender-winemaker-stabbing-verdict-1.7075676,negative,0.014562094,0.6607782,0.32465982,-0.4364157310029668
CBC,2024-01-07,Here's how a Canada-wide plastics registry could save you money,https://www.cbc.ca/news/politics/canada-national-plastics-registry-1.7075740,positive,0.2833401,0.038706984,0.67795295,0.07878337205160513
CBC,2024-01-07,Montreal father warns against counterfeit synthetic opioids after death of teen son,https://www.cbc.ca/news/canada/montreal/montreal-teen-isotonitazene-overdose-1.7076042,negative,0.014442558,0.55325675,0.4323008,-0.3058843796794406
CBC,2024-01-07,This newborn waited 5 hours for a doctor. Experts say Ontario's ER wait times have never been worse,https://www.cbc.ca/news/canada/toronto/ontario-emergency-room-wait-times-1.7075415,negative,0.018234024,0.7975775,0.18418849,-0.6357973897687117
CBC,2024-01-07,"NHL all-star, rookie forward Connor Bedard out indefinitely with broken jaw",https://www.cbc.ca/sports/hockey/nhl/connor-bedard-leaves-game-hit-brendan-smith-nhl-1.7076563,negative,0.014785442,0.37116766,0.6140469,-0.13754683307257842
CBC,2024-01-07,IN PHOTOS | This week's most compelling Canadian images,https://www.cbc.ca/news/canada/photos/in-photos-this-week-s-most-compelling-canadian-images-1.7073620,positive,0.6136785,0.0044785333,0.38184288,0.3765813170976884
CBC,2024-01-07,U.S. diplomacy tour hopes to calm tensions as Israel-Hamas war enters 4th month,https://www.cbc.ca/news/world/israel-hamas-war-day-93-1.7076753,positive,0.2920623,0.016465003,0.69147277,0.08502927316646236
CBC,2024-01-07,WATCH: CBC News Network,https://www.cbc.cahttps://gem.cbc.ca/live,neutral,0.10073908,0.018231502,0.88102955,0.00981596340483426
CBC,2024-01-07,WATCH : CBC News Explore,https://www.cbc.cahttps://gem.cbc.ca/live,neutral,0.09840742,0.014817321,0.88677526,0.009464467482493077
CBC,2024-01-07,Former 'Namgis Nation chief remembered as 'example of how we should carry ourselves in this world',https://www.cbc.ca/news/canada/british-columbia/bill-cranmer-obit-1.7076468,neutral,0.07574852,0.0748226,0.8494289,0.00013941693626229323
CBC,2024-01-07,"Woman in her 90s found alive in collapsed home, 5 days after deadly Japan quake",https://www.cbc.ca/news/world/elderly-woman-found-alive-japan-quake-1.7076527,negative,0.020685997,0.5456498,0.43366417,-0.2973058394464516
CBC,2024-01-07,"Canadian killed, 11 injured in New York rollover of bus coming from Montreal",https://www.cbc.ca/news/canada/montreal/montreal-bus-crash-new-york-1.7076064,negative,0.008876838,0.6287198,0.36240333,-0.39520979665462264
CBC,2024-01-07,Here's what Ontario could do to close the gap on accessibility as the clock ticks toward its deadline,https://www.cbc.ca/news/canada/toronto/aoda-ontario-accessibility-2025-solutions-1.7053948,positive,0.22598436,0.013745941,0.76026976,0.05087996976492093
CBC,2024-01-07,Rescuers search for missing helicopter travelling from Calgary believed to have crashed in B.C.,https://www.cbc.ca/news/canada/british-columbia/missing-helicopter-glacier-national-park-1.7076676,neutral,0.018049402,0.13838115,0.84356934,-0.018823575167041362
CBC,2024-01-07,"Make your new year's resolutions about values rather than outcomes, experts say",https://www.cbc.ca/radio/whitecoat/white-coat-black-art-the-dose-new-years-resolutions-1.7074207,neutral,0.16068994,0.08249241,0.75681764,0.019016258508735895
