source,date,headline,url,chosen_label,positive,negative,neutral,compound
CTV,2024-03-16,Shohei Ohtani reveals his new wife's identity -- she's also a star athlete,https://www.ctvnews.ca/sports/shohei-ohtani-reveals-his-new-wife-s-identity-she-s-also-a-star-athlete-1.6809334,positive,0.34065154,0.003554338,0.65579414,0.1160308296229573
CTV,2024-03-16,"Ministry says Kelowna case 'had no impact' on latest public warning, as sex offender gets detention order",https://bc.ctvnews.ca/ministry-says-kelowna-case-had-no-impact-on-latest-public-warning-as-sex-offender-gets-detention-order-1.6809513,neutral,0.028155573,0.19024076,0.7816037,-0.035398803595811046
CTV,2024-03-16,P.E.I. fire survivor sharing journey after amputation,https://atlantic.ctvnews.ca/p-e-i-fire-survivor-sharing-journey-after-amputation-1.6804584,neutral,0.04442252,0.10704118,0.8485363,-0.00948445283387489
CTV,2024-03-16,"Sask. TikTok star 'Bella Brave' hospitalized after medical emergency, condition 'stable': family",https://regina.ctvnews.ca/sask-tiktok-star-bella-brave-hospitalized-after-medical-emergency-condition-stable-family-1.6808930,neutral,0.038822696,0.11231013,0.8488672,-0.01110636280268551
CTV,2024-03-16,"Newfoundland capelin out of 'critical zone,' but not because there are more fish",https://www.ctvnews.ca/climate-and-environment/newfoundland-capelin-out-of-critical-zone-but-not-because-there-are-more-fish-1.6807121,neutral,0.06497147,0.124899134,0.81012934,-0.011378504980832371
CTV,2024-03-16,Golfers hit Lethbridge fairways; skiers take in 'great conditions' at nearby slopes,https://calgary.ctvnews.ca/golfers-hit-lethbridge-fairways-skiers-take-in-great-conditions-at-nearby-slopes-1.6809816,positive,0.7907396,0.0025997942,0.20666057,0.6252623966509816
CTV,2024-03-16,"With Navalny dead, his allies keep fighting to undermine Putin's grip on power",https://www.ctvnews.ca/world/with-navalny-dead-his-allies-keep-fighting-to-undermine-putin-s-grip-on-power-1.6810305,negative,0.016552474,0.6606406,0.32280692,-0.4361720345098057
CTV,2024-03-16,"Manitoulin Health Centre affected by phone, Internet outage",https://northernontario.ctvnews.ca/manitoulin-health-centre-affected-by-phone-internet-outage-1.6809658,negative,0.016420811,0.42425907,0.5593202,-0.17972607606569824
CTV,2024-03-16,Northern Ont. youth meets his NHL idol Connor Bedard during March Break trip,https://northernontario.ctvnews.ca/northern-ont-youth-meets-his-nhl-idol-connor-bedard-during-march-break-trip-1.6809415,neutral,0.08042325,0.0053680623,0.9142089,0.006439068087008337
CTV,2024-03-16,Hundreds of people in Mexico City stretch out for a 'mass nap' to commemorate World Sleep Day,https://www.ctvnews.ca/lifestyle/hundreds-of-people-in-mexico-city-stretch-out-for-a-mass-nap-to-commemorate-world-sleep-day-1.6810294,positive,0.43877372,0.0065242117,0.554702,0.19247985203333506
CTV,2024-03-16,"Neighbours worry long-time eyesore in south London, Ont. becoming magnet for crime",https://london.ctvnews.ca/neighbours-worry-long-time-eyesore-in-south-london-ont-becoming-magnet-for-crime-1.6810140,negative,0.010949311,0.6448587,0.34419197,-0.4157228786061573
CTV,2024-03-16,Water leak forces relocation of Halifax hospital patients,https://atlantic.ctvnews.ca/water-leak-forces-relocation-of-halifax-hospital-patients-1.6810138,negative,0.008514818,0.69976425,0.2917209,-0.4895975263849959
CTV,2024-03-16,The 'drinking bird' makes a comeback and could power your gadgets with clean energy,https://www.ctvnews.ca/sci-tech/the-drinking-bird-makes-a-comeback-and-could-power-your-gadgets-with-clean-energy-1.6809342,positive,0.73190343,0.006053033,0.26204365,0.5356459107016214
CTV,2024-03-16,"Seriously injured man found on B.C. highway in Kamloops, RCMP say",https://bc.ctvnews.ca/seriously-injured-man-found-on-b-c-highway-in-kamloops-rcmp-say-1.6806538,negative,0.013494246,0.4408901,0.5456157,-0.1942019758278235
CTV,2024-03-16,Latest from Calgary police on standoff with armed man,/video/c2886450-extended--police-update-on-armed-standoff?playlistId=1.6808848,neutral,0.014842828,0.13363433,0.85152286,-0.01763782156972704
CTV,2024-03-16,'Plan in advance': Eclipse glasses are hot sellers ahead of rare celestial event,https://montreal.ctvnews.ca/plan-in-advance-eclipse-glasses-are-hot-sellers-ahead-of-rare-celestial-event-1.6809533,positive,0.47445467,0.006342042,0.5192034,0.22506694357510781
CTV,2024-03-16,School board trustee to call for reconsideration of school naming policy,https://windsor.ctvnews.ca/school-board-trustee-to-call-for-reconsideration-of-school-naming-policy-1.6809545,neutral,0.024302699,0.038948365,0.93674886,-0.0009263550300282475
CTV,2024-03-16,Do you have a video doorbell? Some models can be hacked,https://toronto.ctvnews.ca/do-you-have-a-video-doorbell-some-models-can-be-hacked-1.6810286,negative,0.020718366,0.29931056,0.6799711,-0.08915755532893499
CTV,2024-03-16,"Noah Madrano case: Deadline for plea deal or trial set for Friday, source says",https://edmonton.ctvnews.ca/noah-madrano-case-deadline-for-plea-deal-or-trial-set-for-friday-source-says-1.6809852,neutral,0.033006884,0.018533375,0.9484596,0.0007459700801319968
CTV,2024-03-16,Group that helps struggling youth in Sudbury forced to close,https://northernontario.ctvnews.ca/group-that-helps-struggling-youth-in-sudbury-forced-to-close-1.6809683,negative,0.012737645,0.60645133,0.380811,-0.3676209892050952
CTV,2024-03-16,University of Guelph develops tomato-picking robot,/video/c2886645-ctv-national-news--tomato-picking-robot,neutral,0.065994225,0.043630023,0.8903758,0.002451658007097679
CTV,2024-03-16,6 people charged after stolen property and drugs seized from Coaldale residence,https://calgary.ctvnews.ca/6-people-charged-after-stolen-property-and-drugs-seized-from-coaldale-residence-1.6809931,negative,0.010681604,0.7099868,0.27933148,-0.5039672298953626
CTV,2024-03-16,Significant police presence and a eulogy from Wayne Gretzky: Details revealed about funeral for Brian Mulroney,https://www.ctvnews.ca/politics/significant-police-presence-and-a-eulogy-from-wayne-gretzky-details-revealed-about-funeral-for-brian-mulroney-1.6809148,neutral,0.038305152,0.05190347,0.90979123,-0.0012266876282511774
CTV,2024-03-16,B.C. man's balloon-popping videos earn hundreds of millions of views worldwide,https://vancouverisland.ctvnews.ca/b-c-man-s-balloon-popping-videos-earn-hundreds-of-millions-of-views-worldwide-1.6805805,positive,0.5228409,0.011370454,0.46578866,0.27323330630206755
CTV,2024-03-16,Carbon tax tiff: PM Trudeau accuses Premier Furey of bowing to 'political pressure',https://www.ctvnews.ca/politics/carbon-tax-tiff-pm-trudeau-accuses-premier-furey-of-bowing-to-political-pressure-1.6809080,negative,0.0165996,0.31448865,0.6689117,-0.09862758176474529
CTV,2024-03-16,Majority of provinces opposed to carbon tax hike,/video/c2886642-ctv-national-news--impending-carbon-tax-hike?playlistId=1.6806264,negative,0.024855843,0.39716926,0.577975,-0.15712557614091516
CTV,2024-03-16,'This has become an alarming crisis': Windsor-Essex Children’s Aid Society renting a house for surrendered youth,https://windsor.ctvnews.ca/this-has-become-an-alarming-crisis-windsor-essex-children-s-aid-society-renting-a-house-for-surrendered-youth-1.6809857,negative,0.010644604,0.65146714,0.33788818,-0.42429617072298953
CTV,2024-03-16,Man accused of violently assaulting senior at trailer park maintains his innocence,https://barrie.ctvnews.ca/man-accused-of-violently-assaulting-senior-at-trailer-park-maintains-his-innocence-1.6809661,negative,0.026511794,0.41023868,0.5632495,-0.1675929022906537
CTV,2024-03-16,WATCH: Massive tornado rips through Ohio and Indiana,/video/c2886190--thank-god-it-ain-t-in-my-house-,negative,0.04685884,0.34155634,0.61158484,-0.11446497336762285
CTV,2024-03-16,Former U.S. Vice President Mike Pence says he's not endorsing Trump,https://www.ctvnews.ca/world/former-u-s-vice-president-mike-pence-says-he-s-not-endorsing-trump-1.6809664,neutral,0.033447947,0.12255428,0.8439977,-0.013900791891163777
CTV,2024-03-16,"Still without a contract agreement, Quebec nurses set to demonstrate Saturday",https://montreal.ctvnews.ca/still-without-a-contract-agreement-quebec-nurses-set-to-demonstrate-saturday-1.6810310,negative,0.009526881,0.53883326,0.4516398,-0.2902505364510066
CTV,2024-03-16,Edmonton officers killed in the line of duty honoured on 1-year anniversary,https://edmonton.ctvnews.ca/edmonton-officers-killed-in-the-line-of-duty-honoured-on-1-year-anniversary-1.6809023,negative,0.018482922,0.59048504,0.39103198,-0.3483309938131782
CTV,2024-03-16,'No': Prime Minister Trudeau rejects Quebec request for full powers over immigration,https://montreal.ctvnews.ca/no-prime-minister-trudeau-rejects-quebec-request-for-full-powers-over-immigration-1.6809035,negative,0.01367109,0.45883045,0.5274984,-0.21033849246878056
CTV,2024-03-16,February housing starts increased 14% from January: Canada Mortgage and Housing Corp,https://www.ctvnews.ca/business/february-housing-starts-increased-14-from-january-canada-mortgage-and-housing-corp-1.6808793,positive,0.34317818,0.007628595,0.64919317,0.11771308979453465
CTV,2024-03-16,This is why an electric vehicle will cost you more in Ontario than other provinces,https://toronto.ctvnews.ca/this-is-why-an-electric-vehicle-will-cost-you-more-in-ontario-than-other-provinces-1.6809366,negative,0.020300742,0.76467216,0.21502715,-0.584311347851667
CTV,2024-03-16,"Heavy police presence in Exeter, Ont. for second day in a row",https://london.ctvnews.ca/heavy-police-presence-in-exeter-ont-for-second-day-in-a-row-1.6809367,negative,0.01742311,0.34624523,0.6363315,-0.11958224255340433
CTV,2024-03-16,Boeing plane found to have missing panel after flight from California to southern Oregon,https://www.ctvnews.ca/world/boeing-plane-found-to-have-missing-panel-after-flight-from-california-to-southern-oregon-1.6809958,negative,0.016484799,0.39180154,0.5917137,-0.15323667277439057
CTV,2024-03-16,Baby born on Air Canada flight bound for Toronto,https://toronto.ctvnews.ca/baby-born-on-air-canada-flight-bound-for-toronto-1.6803236,neutral,0.12761523,0.010316582,0.8620681,0.0161792233983844
CTV,2024-03-16,Some doctors sneak education into their online content to drown out misinformation,https://www.ctvnews.ca/health/some-doctors-sneak-education-into-their-online-content-to-drown-out-misinformation-1.6810288,negative,0.021776376,0.50964755,0.468576,-0.2592664418187951
CTV,2024-03-16,Toronto could turn decommissioned Scarborough RT into linear park,https://toronto.ctvnews.ca/toronto-could-turn-decommissioned-scarborough-rt-into-linear-park-1.6809653,neutral,0.12534206,0.020826401,0.8538317,0.015276875000863832
CTV,2024-03-16,Sault police hope new video attracts new recruits,https://northernontario.ctvnews.ca/sault-police-hope-new-video-attracts-new-recruits-1.6809759,positive,0.4710813,0.020270752,0.508648,0.22150666130760932
CTV,2024-03-16,Galapagos Islands to double tourist entry fees amid concerns over rising visitor numbers,https://www.ctvnews.ca/lifestyle/galapagos-islands-to-double-tourist-entry-fees-amid-concerns-over-rising-visitor-numbers-1.6809393,negative,0.02917579,0.30092484,0.6698994,-0.08970452316437338
CTV,2024-03-16,Rally marks International Day Against Police Brutality in Winnipeg,https://winnipeg.ctvnews.ca/rally-marks-international-day-against-police-brutality-in-winnipeg-1.6809827,neutral,0.063945904,0.15414695,0.78190714,-0.019672204869882748
CTV,2024-03-16,Dangerous journey through South America’s Darien Gap,/video/c2886644-ctv-national-news--the-darien-gap,negative,0.007819011,0.8417413,0.15043977,-0.7084672443677409
CTV,2024-03-16,Public funeral service for Ottawa's mass killing victims to take place Sunday,https://ottawa.ctvnews.ca/public-funeral-service-for-ottawa-s-mass-killing-victims-to-take-place-sunday-1.6808682,negative,0.017166605,0.3627309,0.6201024,-0.13127903717331435
CTV,2024-03-16,'His only mistake was wanting his crackers': Owner demands justice after emu viciously killed,https://kitchener.ctvnews.ca/his-only-mistake-was-wanting-his-crackers-owner-demands-justice-after-emu-viciously-killed-1.6809689,negative,0.006271449,0.86208004,0.13164856,-0.7431426477324923
CTV,2024-03-16,Dancers honour Ukrainian heritage at annual Tavria Ukrainian Dance Festival in Regina,https://regina.ctvnews.ca/dancers-honour-ukrainian-heritage-at-annual-tavria-ukrainian-dance-festival-in-regina-1.6809860,positive,0.6541863,0.003541295,0.34227246,0.4279471465552973
CTV,2024-03-16,'An amazing feeling': Sask. community comes together in hockey night fundraiser for boy battling cancer,https://regina.ctvnews.ca/an-amazing-feeling-sask-community-comes-together-in-hockey-night-fundraiser-for-boy-battling-cancer-1.6803883,positive,0.96278715,0.0025484413,0.034664262,0.9269527293508935
CTV,2024-03-16,"Husky covered in own waste left in parking lot in Woodstock, Ont.",https://kitchener.ctvnews.ca/husky-covered-in-own-waste-left-in-parking-lot-in-woodstock-ont-1.6809693,negative,0.015530316,0.5733462,0.41112357,-0.3284846392076659
CTV,2024-03-16,Russia says Ukrainian shelling killed 2 in a border city while it thwarted an incursion,https://www.ctvnews.ca/world/russia-says-ukrainian-shelling-killed-2-in-a-border-city-while-it-thwarted-an-incursion-1.6810315,negative,0.006377094,0.7177688,0.27585408,-0.5151513872964486
CBC,2024-03-16,"A year after deadly Old Montreal fire, families remain heartbroken, angry",https://www.cbc.ca/news/canada/montreal/one-year-after-old-montreal-airbnb-fire-1.7142328,negative,0.009991395,0.8689611,0.121047586,-0.7549934810116099
CBC,2024-03-16,Families of Montreal Airbnb fire victims still searching for justice,https://www.cbc.ca/player/play/2319322179619,negative,0.050330997,0.25127646,0.69839257,-0.06060664579490371
CBC,2024-03-16,Storms leave widespread damage across multiple U.S. states,https://www.cbc.ca/player/play/2318958147614,negative,0.01220027,0.7694929,0.21830688,-0.5919704342020662
CBC,2024-03-16,WATCH : CBC News Explore,https://www.cbc.cahttps://gem.cbc.ca/live,neutral,0.09840742,0.014817321,0.88677526,0.009464467482493077
CBC,2024-03-16,"Massive storm system hits multiple U.S. states, at least 3 deaths reported",https://www.cbc.ca/news/world/severe-weather-ohio-1.7144755,negative,0.012766916,0.73773974,0.24949326,-0.5440970085786301
CBC,2024-03-16,Meet some of the 6 million Canadians without a doctor,https://www.cbc.ca/news/politics/meet-the-canadians-without-a-family-doctor-1.7116475,neutral,0.050469816,0.20471914,0.7448111,-0.039362712950839374
CBC,2024-03-16,She could have died from meningitis. Now this student wants more people to get vaccinated,https://www.cbc.ca/news/canada/meningitis-vaccine-students-1.7138517,negative,0.009546234,0.8667827,0.1236712,-0.7512210404377493
CBC,2024-03-16,'Baloney factory': B.C. premier mocks Poilievre's letter asking province to join carbon tax fight,https://www.cbc.ca/news/canada/british-columbia/bc-poilievre-carbon-tax-1.7145985,negative,0.011405131,0.5478316,0.44076315,-0.29998945981035696
CBC,2024-03-16,"India's national election to start April 19, with Narendra Modi favoured to win",https://www.cbc.ca/news/world/india-election-announced-1.7146171,positive,0.31967238,0.0041256803,0.6762021,0.10217335022796092
CBC,2024-03-16,WATCH: CBC News Network,https://www.cbc.cahttps://gem.cbc.ca/live,neutral,0.10073908,0.018231502,0.88102955,0.00981596340483426
CBC,2024-03-16,Chimpanzee moms play with their kids — even when they're hungry and tired,https://www.cbc.ca/radio/asithappens/chimp-mom-play-1.7143792,positive,0.53165615,0.024497429,0.4438464,0.2820581326051972
CBC,2024-03-16,Man killed after 30-hour armed standoff with Calgary police,https://www.cbc.ca/news/canada/calgary/calgary-police-memorial-drive-closed-situation-1.7144799,negative,0.007834092,0.71302986,0.2791359,-0.5083503156414615
CBC,2024-03-16,"'Goat yoga' strikes a pose in Thunder Bay, Ont.",https://www.cbc.ca/player/play/2319097411585,neutral,0.06102544,0.0062779956,0.9326965,0.0036846934082956917
CBC,2024-03-16,"New York Times marks 1,000th Wordle as it fights knockoffs",https://www.cbc.ca/news/world/wordle-milestone-game-thousand-1.7145016,neutral,0.07898991,0.015720308,0.9052898,0.005992274674968989
CBC,2024-03-16,Edward Burtynsky's photos are stunning — but do they move people to take environmental action?,https://www.cbc.ca/news/edward-burtynsky-exhibition-environment-action-1.7141168,positive,0.8261642,0.010543155,0.16329248,0.6824362375382531
CBC,2024-03-16,The Kate photo scandal has tested the public's trust. How do the Royals get it back?,https://www.cbc.ca/news/world/princess-of-wales-rumours-recovery-royal-family-public-trust-1.7144240,negative,0.019080957,0.55594754,0.42497146,-0.308713619514144
CBC,2024-03-16,'A scary feeling': Sask. woman concerned about wait times for breast cancer assessment,https://www.cbc.ca/news/canada/saskatoon/a-scary-feeling-sask-woman-concerned-about-wait-times-for-breast-cancer-assessment-1.7140767,negative,0.009504004,0.69042677,0.30006924,-0.4765987737205748
CBC,2024-03-16,Quebec asks Ottawa for full power over immigration. Trudeau says no,https://www.cbc.ca/news/canada/montreal/legault-immigration-ottawa-trudeau-1.7145010,neutral,0.032544713,0.14507782,0.8223774,-0.019988424955738715
CBC,2024-03-16,Hundreds line up at Ontario clinic in desperate bid for family doctor,https://www.cbc.ca/news/canada/ottawa/hundreds-line-up-outside-kingston-clinic-in-desperate-bid-for-family-doctor-1.7130133,negative,0.027600076,0.5340862,0.4383137,-0.28448635065249306
CBC,2024-03-16,N.L. health authority seeking 170 rental units for internationally recruited workers,https://www.cbc.ca/news/canada/newfoundland-labrador/nl-health-authority-housing-1.7139958,neutral,0.024318859,0.022467684,0.9532134,8.661019502231859e-05
CBC,2024-03-16,"Canada's GED high school equivalency test ends after March, leaving adult students in limbo",https://www.cbc.ca/news/canada/hamilton/ged-test-ending-1.7142821,negative,0.012350024,0.5210339,0.46661606,-0.2713237994298101
CBC,2024-03-16,"To compete in Eurovision, Israel had to change its song. Some say it should still be banned",https://www.cbc.ca/news/entertainment/israel-eurovision-competition-1.7145734,negative,0.014001178,0.62678176,0.35921723,-0.39265923381873336
CBC,2024-03-16,"Hidden cameras capture bank employees misleading customers, pushing products that help sales targets",https://www.cbc.ca/news/business/marketplace-hidden-camera-banks-1.7142427,negative,0.042854045,0.29350302,0.6636429,-0.08430756665984518
CBC,2024-03-16,Wayne Gretzky to deliver eulogy at Brian Mulroney's state funeral in Montreal,https://www.cbc.ca/news/politics/gretsky-funeral-montreal-euology-1.7145088,neutral,0.050776374,0.04269088,0.90653276,0.0007557286787385209
CBC,2024-03-16,Solar eclipse chasers travel the world for a few minutes in the shadow of the moon,https://www.cbc.ca/news/science/solar-eclipse-chasers-1.7142782,neutral,0.116063915,0.008959048,0.8749771,0.013390559897970888
CBC,2024-03-16,People waiting for a family doctor in Nova Scotia could face years without finding one,https://www.cbc.ca/news/canada/nova-scotia/family-practice-registry-record-number-1.7140349,negative,0.020040972,0.66529036,0.31466872,-0.44220957766714264
CBC,2024-03-16,"Canadians deeply frustrated with health care, survey finds",https://www.cbc.ca/news/politics/primary-care-canada-10-000-canadians-report-1.7125990,negative,0.0068677883,0.8547533,0.13837892,-0.7305560640555946
CBC,2024-03-16,"Airline must shell out $800 for seafood that spoiled in misplaced suitcase, small-claims court says",https://www.cbc.ca/news/canada/british-columbia/flair-spoiled-food-lawsuit-1.7145126,negative,0.009397458,0.7357118,0.2548906,-0.5411836679651554
CBC,2024-03-16,Banking insiders reveal how sales pressure can harm Canadians,https://www.cbc.ca/player/play/2318735939932,negative,0.008302519,0.75089604,0.24080156,-0.5637758486917299
CBC,2024-03-16,Planning to see the solar eclipse? It will depend on the weather,https://www.cbc.ca/player/play/2319075395707,neutral,0.061223783,0.012376883,0.9263992,0.0035951723509519695
CBC,2024-03-16,Toronto's $80M cost hike for hosting World Cup games prompts calls for more oversight,https://www.cbc.ca/news/canada/toronto/fifa-toronto-cost-increase-1.7145284,negative,0.024957554,0.3844822,0.5905602,-0.14720369643708153
CBC,2024-03-16,"Toronto Comicon begins, inviting fantasy to become reality",https://www.cbc.ca/player/play/2319184963589,positive,0.28889194,0.015348313,0.69575983,0.08322295851588812
CBC,2024-03-16,The world is sending soldiers back to Haiti — this time without Canada's help,https://www.cbc.ca/news/politics/haiti-canada-trudeau-rae-gang-violence-1.7145349,negative,0.009363157,0.77549124,0.21514541,-0.6012991276158175
CBC,2024-03-16,Trudeau responds to N.L. premier's carbon tax concerns,https://www.cbc.ca/player/play/2318996547658,neutral,0.03187354,0.034316666,0.93380964,-0.00016171148260024637
CBC,2024-03-16,Charge dropped against man Windsor police accused of organizing Ambassador Bridge blockade,https://www.cbc.ca/news/canada/windsor/charges-dropped-william-laframboise-1.7145256,negative,0.01149233,0.55712074,0.431387,-0.310251413643023
CBC,2024-03-16,Nothing about Ramadan to celebrate for this couple in Gaza,https://www.cbc.ca/player/play/2318644803548,negative,0.040135495,0.60591024,0.35395426,-0.3655163622942048
CBC,2024-03-16,"Canada heading toward major measles outbreak without vaccine boost, new modelling suggests",https://www.cbc.ca/news/health/canada-measles-outbreak-vaccination-1.7144915,negative,0.012749543,0.54586565,0.4413847,-0.2978068098185034
CBC,2024-03-16,"What's cheaper, EV or gas? This scholar crunched the numbers",https://www.cbc.ca/player/play/2319313987528,neutral,0.06427937,0.10690619,0.8288145,-0.007297093303115787
CBC,2024-03-16,Russians vote in election without viable opposition candidates,https://www.cbc.ca/player/play/2319311427738,negative,0.0175738,0.5766325,0.4057938,-0.33219616885408954
CBC,2024-03-16,"B.C. couple faces fines, legal action over custom-built tiny home on rural property",https://www.cbc.ca/news/canada/british-columbia/peachland-tiny-home-rdco-housing-crisis-homelessness-rvs-1.7144280,negative,0.014411279,0.39797863,0.5876101,-0.1581792966836737
CBC,2024-03-16,Canada's indie movie theatres say industry is in crisis,https://www.cbc.ca/news/entertainment/independent-theatres-in-crisis-1.7144390,negative,0.014217338,0.69333446,0.29244813,-0.48051060239408194
CBC,2024-03-16,Alberta government releases no-go zone map for renewable power projects,https://www.cbc.ca/news/canada/calgary/alberta-viewscapes-buffer-zones-renewables-map-1.7145368,neutral,0.054840762,0.038552515,0.90660673,0.001521212584231657
CBC,2024-03-16,"WATCH | What's cheaper, EV or gas? This scholar crunched the numbers",https://www.cbc.cahttps://www.cbc.ca/player/play/2319313987528,neutral,0.077080615,0.03545186,0.88746744,0.004684590276409661
CBC,2024-03-16,"Women in Gaza giving birth without enough painkillers, clean water or food",https://www.cbc.ca/news/world/women-gaza-birth-pregnancies-1.7143489,negative,0.0078058904,0.8240989,0.16809516,-0.6790781013514255
CBC,2024-03-16,Edmonton hospital patient had been hoping for a care home. He wound up at a hotel instead,https://www.cbc.ca/news/canada/edmonton/royal-alexandra-hospital-hotel-transfer-stroke-patient-1.7145856,negative,0.011503389,0.6449522,0.34354445,-0.41583096485533666
