source,date,headline,url,chosen_label,positive,negative,neutral,compound
Global,2024-08-13,Air safety expert on plane crash in Brazil: ‘I wouldn’t fly ’em’,https://globalnews.ca/news/10692621/brazil-plane-crash-air-safety-expert/,negative,0.010163644,0.73694855,0.25288764,-0.5429899731917534
Global,2024-08-13,Canada tipped off to potential terror attack by ally,https://globalnews.ca/video/10695676/canada-tipped-off-to-potential-terror-attack-by-ally/,negative,0.010515555,0.6754397,0.31404474,-0.45610821207777974
Global,2024-08-13,Paris 2024: USA Gymnastics files appeal after Jordan Chiles stripped of bronze medal,https://globalnews.ca/video/10694621/paris-2024-usa-gymnastics-files-appeal-after-jordan-chiles-stripped-of-bronze-medal/,neutral,0.03969644,0.1384213,0.8218822,-0.017584655482381528
Global,2024-08-13,Jasper residents allowed to return Friday,https://globalnews.ca/video/10695679/jasper-residents-allowed-to-return-friday/,neutral,0.11588346,0.006272203,0.87784433,0.01338963624969125
Global,2024-08-13,‘No one’s told us’: Parents of B.C. baby who died in care seek answers in agonizing case,https://globalnews.ca/news/10694939/bc-baby-died-care-answers-wanted/,negative,0.0071112555,0.71946895,0.27341974,-0.5175850443412102
Global,2024-08-13,Pregnant woman rushed to Toronto hospital after vehicle crashes in front of building,https://globalnews.ca/news/10695963/toronto-crash-car-into-building/,negative,0.013066853,0.55369824,0.43323484,-0.3064110492091565
Global,2024-08-13,"‘On the brink’: Airlines flee small cities, cutting key links to rest of the country",https://globalnews.ca/news/10693309/airlines-canada-small-cities/,negative,0.011837036,0.59672785,0.39143515,-0.3559439736667116
Global,2024-08-13,B.C. boy holds 2nd lemonade stand to honour dad who died 2 years ago,https://globalnews.ca/news/10695333/bc-lemonade-stand-honours-dad/,negative,0.05705356,0.33997768,0.60296875,-0.11232971462021979
Global,2024-08-13,Jasper officials ask visitors to wait for services to be restored,https://globalnews.ca/video/10695530/jasper-officials-ask-visitors-to-wait-for-services-to-be-restored/,neutral,0.04413056,0.013087987,0.9427816,0.0017762054643888359
Global,2024-08-13,Ukraine claims 1000KM of Russian territory,https://globalnews.ca/video/10695256/ukraine-claims-1000km-of-russian-territory/,neutral,0.033670098,0.1735183,0.79281163,-0.02897492081499564
Global,2024-08-13,Racialized workers in Canada less likely to be covered by union: report,https://globalnews.ca/news/10695961/racialized-workers-union-canada-report/,negative,0.0110369045,0.5280709,0.4608922,-0.2787370588942224
Global,2024-08-13,Athletes need ‘much more’ federal funding to succeed: Canadian Olympic Committee,https://globalnews.ca/video/10695681/athletes-need-much-more-federal-funding-to-succeed-canadian-olympic-committee/,neutral,0.20092846,0.027966434,0.771105,0.039590144149657114
Global,2024-08-13,Paris 2024: Canadian athletes receive warm welcome home from Paris Summer Games,https://globalnews.ca/video/10695760/paris-2024-canadian-athletes-receive-warm-welcome-home-from-paris-summer-games/,positive,0.8353056,0.002552015,0.16214234,0.6977289346388957
Global,2024-08-13,Family demands safety overhaul 5 years after firefighter dies at training school,https://globalnews.ca/news/10694187/nova-scotia-firefighters-school-skyler-blackie-death-safety/,negative,0.018550154,0.6096095,0.37184033,-0.3712796330726498
Global,2024-08-13,Searching for answers in death of infant boy in government care,https://globalnews.ca/video/10695596/searching-for-answers-in-death-of-newborn-in-government-care/,negative,0.01306876,0.62739646,0.35953474,-0.3934555682427856
Global,2024-08-13,CBC paid over $18M in bonuses after hundreds of job cuts,https://globalnews.ca/video/10695682/cbc-paid-over-18m-in-bonuses-after-hundreds-of-job-cuts/,negative,0.117840864,0.37993735,0.50222176,-0.1304659308892422
Global,2024-08-13,Calgary to host 2025 Centennial Cup,https://globalnews.ca/video/10695601/calgary-to-host-2025-centennial-cup/,neutral,0.10049593,0.007685399,0.89181876,0.0100403576713326
Global,2024-08-13,Plant-based milk recall: 3rd person dies as Listeriosis cases rise to 20,https://globalnews.ca/news/10695101/plant-based-milk-recall-listeria-3-deaths-canada/,negative,0.008379219,0.8253998,0.16622098,-0.6812146327941386
Global,2024-08-13,"Ukraine says its forces control 1,000 square kilometres of Russian territory",https://globalnews.ca/news/10694643/ukraine-russia-kursk-fighting-control/,neutral,0.02767208,0.07541875,0.89690936,-0.0049222345180792715
Global,2024-08-13,3rd person dies from Listeria outbreak linked to plant-based milk recall,https://globalnews.ca/video/10696021/3rd-person-dies-from-listeria-outbreak-linked-to-plant-based-milk-recall/,negative,0.007556145,0.8398255,0.15261836,-0.705249781230763
Global,2024-08-13,Calgary businesses prepare for feeder main construction,https://globalnews.ca/video/10695531/calgary-businesses-prepare-for-feeder-main-construction/,neutral,0.076525025,0.021661885,0.9018129,0.005386852006877163
Global,2024-08-13,Brazil plane crash: ATR-72 aircraft still used by some Canadian carriers,https://globalnews.ca/video/10692940/brazil-plane-crash-atr-72-aircraft-still-used-by-some-canadian-carriers/,neutral,0.017225454,0.18284726,0.79992735,-0.033136392226966294
Global,2024-08-13,"RCMP say one suspect in random shooting in custody, search still on for another",https://globalnews.ca/video/10695560/rcmp-say-one-suspect-in-random-shooting-in-custody-search-still-on-for-another/,neutral,0.015152171,0.19008885,0.79475886,-0.03590420468646549
Global,2024-08-13,Thousands forced to flee Jasper allowed to return home soon,https://globalnews.ca/video/10695538/thousands-forced-to-flee-jasper-allowed-to-return-home-soon/,negative,0.013008361,0.6111949,0.37579677,-0.37338998116607236
Global,2024-08-13,"Calgary businesses await plans for feeder main disruptions, water restrictions",https://globalnews.ca/news/10694928/calgary-business-concern-feeder-main-repair-water-restrictions/,negative,0.01817802,0.25593024,0.72589177,-0.06516984291681105
Global,2024-08-13,Travelling soon? This insect-transmitted virus is spreading at ‘unprecedented scale’,https://globalnews.ca/news/10694129/oropouche-fever-sloths-insects-canadian-travel/,negative,0.015950302,0.7643225,0.2197272,-0.5839344672811482
Global,2024-08-13,What risk do zoonotic diseases pose?,https://globalnews.ca/video/10565087/what-risk-do-zoonotic-diseases-pose/,neutral,0.018952455,0.21809155,0.76295596,-0.04720473331520658
Global,2024-08-13,Man suspected of attacking Surrey business owner wanted on assault charges in Alberta,https://globalnews.ca/video/10695658/witnesses-used-prayer-mat-and-jacket-to-put-out-fire-at-surrey-currency-exchange/,negative,0.009440855,0.6912428,0.29931635,-0.47772749854864216
Global,2024-08-13,"Calgary Flames re-sign Adam Klapka, Yan Kuznetsov to one-year extensions",https://globalnews.ca/news/10696049/calgary-flames-sign-klapka-kuznetsov/,neutral,0.039852325,0.010658957,0.9494889,0.0014745897556922571
Global,2024-08-13,Ontario government ignored expert advice to slow alcohol expansion,https://globalnews.ca/video/10695358/ontario-government-ignored-expert-advice-to-slow-alcohol-expansion/,negative,0.011947295,0.70196295,0.28608978,-0.4926092427868838
Global,2024-08-13,"Impending rail strike already affecting shipments, Fertilizer Canada says",https://globalnews.ca/news/10696031/rail-strike-affecting-shipments-fertilizer-canada/,negative,0.010287442,0.66752577,0.32218692,-0.4454847214730453
Global,2024-08-13,B.C. cities top the list for highest crime rates in Canada,https://globalnews.ca/news/10694573/bc-cities-top-list-high-crime-rate-canada/,negative,0.012539405,0.7571874,0.230273,-0.5731757062586817
Global,2024-08-13,"Jordan Chiles stripped of bronze medal, USA Gymnastics files appeal",https://globalnews.ca/news/10694089/jordan-chiles-gymnastics-bronze-medal-stripped-appeal/,negative,0.027572421,0.314425,0.6580027,-0.09810281117865749
Global,2024-08-13,N.B. woman set to study abroad told she can only get 28-day supplies of life-saving drug,https://globalnews.ca/news/10694548/cystic-fibrosis-medication-new-brunswick-student-needs/,negative,0.02150651,0.6147021,0.36379138,-0.3773961671719821
Global,2024-08-13,No go: Banff votes to get rid of pedestrian zone,https://globalnews.ca/news/10695985/banff-pedestrian-zone-dismantled/,negative,0.016684564,0.5773258,0.40598953,-0.3330267613185285
CTV,2024-08-13,A triumphant homecoming for Canadian athletes,https://montreal.ctvnews.ca/a-triumphant-homecoming-for-canadian-athletes-1.6998431,positive,0.9472728,0.0034456034,0.04928163,0.8973138111232455
CTV,2024-08-13,"Stratford, Ont. police to discuss protocols, more training after neighbour dispute turned deadly",https://kitchener.ctvnews.ca/stratford-ont-police-to-discuss-protocols-more-training-after-neighbour-dispute-turned-deadly-1.6995462,neutral,0.0150371315,0.21118318,0.77377975,-0.04437220649200313
CTV,2024-08-13,Small lakeside community near Rawdon trapped for days after historic storm,https://montreal.ctvnews.ca/small-lakeside-community-near-rawdon-trapped-for-days-after-historic-storm-1.6998394,negative,0.016691616,0.51371324,0.4695951,-0.26362269805518146
CTV,2024-08-13,Listeria deaths from recalled plant-based beverages rise to 3,https://www.ctvnews.ca/health/listeria-deaths-from-recalled-plant-based-beverages-rise-to-3-1.6997843,negative,0.008745217,0.809996,0.18125863,-0.6560171873163814
CTV,2024-08-13,Closures this week at La Fontaine Tunnel and Ile-aux-Tourtes Bridge,https://montreal.ctvnews.ca/closures-this-week-at-la-fontaine-tunnel-and-ile-aux-tourtes-bridge-1.6998819,neutral,0.021719206,0.2017768,0.776504,-0.040242156973403276
CTV,2024-08-13,Heritage fight over demolished barn reignites after stone wall council ordered to be saved—is destroyed,https://london.ctvnews.ca/heritage-fight-over-demolished-barn-reignites-after-stone-wall-council-ordered-to-be-saved-is-destroyed-1.6998577,negative,0.012389295,0.65046924,0.33714136,-0.42295679901234173
CTV,2024-08-13,"This Sask. town is offering $30,000 to people who build a home in the community",https://regina.ctvnews.ca/this-sask-town-is-offering-30-000-to-people-who-build-a-home-in-the-community-1.6997501,positive,0.22566807,0.0048041143,0.76952785,0.05090298959910999
CTV,2024-08-13,No injuries after capsized vessel reported in Lake Huron,https://london.ctvnews.ca/no-injuries-after-capsized-vessel-reported-in-lake-huron-1.6998757,neutral,0.042053264,0.08324764,0.87469923,-0.00516168677847384
CTV,2024-08-13,Sault police say impaired motorist was driving on the wrong side of the street,https://northernontario.ctvnews.ca/sault-police-say-impaired-motorist-was-driving-on-the-wrong-side-of-the-street-1.6997672,negative,0.012457121,0.5737287,0.41381422,-0.3290094020819261
CTV,2024-08-13,One person dead after industrial accident,https://windsor.ctvnews.ca/one-person-dead-after-industrial-accident-1.6998721,negative,0.012741277,0.7212285,0.26603025,-0.5200081809500539
CTV,2024-08-13,Weeks may stretch into months for stranded NASA astronauts,https://www.ctvnews.ca/sci-tech/weeks-may-stretch-into-months-for-stranded-nasa-astronauts-1.6993971,negative,0.025760226,0.23128581,0.7429539,-0.052829548750374045
CTV,2024-08-13,Ont. condo owner forced to pay $40K for new windows,/video/c2975945-condo-owner-faces-steep-window-replacement-prices,negative,0.021017166,0.552357,0.42662582,-0.3046565370569976
CTV,2024-08-13,South Okanagan police seek help identifying person of interest in string of thefts,https://bc.ctvnews.ca/south-okanagan-police-seek-help-identifying-person-of-interest-in-string-of-thefts-1.6989256,negative,0.019463466,0.30237037,0.6781662,-0.0910489964143224
CTV,2024-08-13,OPP investigating early morning shooting in Township of Puslinch,https://kitchener.ctvnews.ca/opp-investigating-early-morning-shooting-in-township-of-puslinch-1.6998309,negative,0.02740783,0.22870366,0.74388856,-0.05155416748720665
CTV,2024-08-13,"Majority of drivers caught by photo radar camera on King Edward Avenue are from Quebec, councillor says",https://ottawa.ctvnews.ca/majority-of-drivers-caught-by-photo-radar-camera-on-king-edward-avenue-are-from-quebec-councillor-says-1.6998784,neutral,0.024684727,0.10929372,0.8660216,-0.011335779937036161
CTV,2024-08-13,"Ontario police lay more than 8,000 traffic-related charges over August long weekend",https://toronto.ctvnews.ca/ontario-police-lay-more-than-8-000-traffic-related-charges-over-august-long-weekend-1.6993756,negative,0.016554251,0.5815584,0.40188742,-0.33793610357977855
CTV,2024-08-13,Jordan Chiles medal inquiry: USA Gymnastics says arbitration panel won't reconsider decision,https://www.ctvnews.ca/sports/jordan-chiles-medal-inquiry-usa-gymnastics-says-arbitration-panel-won-t-reconsider-decision-1.6998839,neutral,0.021142226,0.10792224,0.8709356,-0.011200208497921693
CTV,2024-08-13,Toronto driver found sleeping at Ontario police station charged with impaired driving: OPP,https://toronto.ctvnews.ca/toronto-driver-found-sleeping-at-ontario-police-station-charged-with-impaired-driving-opp-1.6997434,negative,0.0109284995,0.6263321,0.36273944,-0.3921724357120908
CTV,2024-08-13,A trove of ancient artifacts from Egypt's last dynasty has been discovered in 63 tombs,https://www.ctvnews.ca/world/a-trove-of-ancient-artifacts-from-egypt-s-last-dynasty-has-been-discovered-in-63-tombs-1.6997740,neutral,0.15212336,0.014045538,0.83383113,0.02294423600210571
CTV,2024-08-13,Resident details harrowing moment crane fell on neighbour's home during Vancouver fire,https://bc.ctvnews.ca/resident-details-harrowing-moment-crane-fell-on-neighbour-s-home-during-vancouver-fire-1.6998470,negative,0.013755868,0.57955235,0.4066919,-0.3356916381293473
CTV,2024-08-13,"Regina's proposed aquatic centre $80 million over budget, city says",https://regina.ctvnews.ca/regina-s-proposed-aquatic-centre-80-million-over-budget-city-says-1.6998415,neutral,0.061524775,0.017534988,0.92094016,0.0034778253319149854
CTV,2024-08-13,Kayakers have dangerous close encounter with shark in Calif.,/video/c2976101-kayakers-spot-shark-while-fishing,negative,0.0184385,0.62187195,0.35968962,-0.38638468711159923
CTV,2024-08-13,Back-to-school tips: What students and parents should do to prepare,https://www.ctvnews.ca/lifestyle/back-to-school-tips-what-students-and-parents-should-do-to-prepare-1.6998084,neutral,0.11231031,0.032228347,0.8554614,0.011574934264890757
CTV,2024-08-13,"Yemen's Houthis seized UN rights office in Sanaa, UN official says",https://www.ctvnews.ca/world/yemen-s-houthis-seized-un-rights-office-in-sanaa-un-official-says-1.6998576,negative,0.011401966,0.5105972,0.47800085,-0.26057951089554443
CTV,2024-08-13,Organized crime shifting to domestic fentanyl production: RCMP,https://www.ctvnews.ca/canada/organized-crime-shifting-to-domestic-fentanyl-production-rcmp-1.6998341,negative,0.014276086,0.44831616,0.5374077,-0.200783595708117
CTV,2024-08-13,Filipino gymnast who won 2 Olympic golds in Paris gets hero's welcome and free buffets for life,https://www.ctvnews.ca/sports/filipino-gymnast-who-won-2-olympic-golds-in-paris-gets-hero-s-welcome-and-free-buffets-for-life-1.6998856,positive,0.90173376,0.0027276732,0.095538534,0.8131163466437816
CTV,2024-08-13,B.C. family returns to home burned by Shetland Creek wildfire,https://bc.ctvnews.ca/b-c-family-returns-to-home-burned-by-shetland-creek-wildfire-1.6998503,negative,0.019369936,0.28464934,0.6959808,-0.08065003806976279
CTV,2024-08-13,Guelph Police investigating multiple restaurant break-ins believed to be related,https://kitchener.ctvnews.ca/guelph-police-investigating-multiple-restaurant-break-ins-believed-to-be-related-1.6997537,neutral,0.018233519,0.12018937,0.86157703,-0.014113030598068121
CTV,2024-08-13,Fatal single-vehicle crash in Georgian Bluffs,https://barrie.ctvnews.ca/fatal-single-vehicle-crash-in-georgian-bluffs-1.6998785,negative,0.014266757,0.7468487,0.23888455,-0.557579455672295
CTV,2024-08-13,Three dead after crash in Pictou County: N.S. RCMP,https://atlantic.ctvnews.ca/three-dead-after-crash-in-pictou-county-n-s-rcmp-1.6997876,negative,0.012969785,0.575816,0.41121417,-0.3313958558788386
CTV,2024-08-13,Aggressive dog and owner sought after fatal attack in B.C.,/video/c2976036-search-continues-for-aggressive-dog-and-owner?playlistId=1.6994480,negative,0.006400707,0.7968462,0.19675323,-0.6349227971136795
CTV,2024-08-13,A B.C. ranch on the market for $2.5M comes with its own hobbit hole,https://bc.ctvnews.ca/a-b-c-ranch-on-the-market-for-2-5m-comes-with-its-own-hobbit-hole-1.6994075,neutral,0.10139884,0.06306921,0.83553195,0.00630399968273565
CTV,2024-08-13,Ontario police seeing 'sharp increase' in motorcyclist fatalities: OPP,https://toronto.ctvnews.ca/ontario-police-seeing-sharp-increase-in-motorcyclist-fatalities-opp-1.6995407,negative,0.014304667,0.41002655,0.5756689,-0.16791711304652956
CTV,2024-08-13,"‘Lightning doesn't strike the same place twice, but Hydro One does’",https://northernontario.ctvnews.ca/lightning-doesn-t-strike-the-same-place-twice-but-hydro-one-does-1.6998209,neutral,0.066112734,0.032462582,0.9014248,0.003317069653707261
CTV,2024-08-13,New Mars study suggests an ocean's worth of water may be hiding beneath the red dusty surface,https://www.ctvnews.ca/sci-tech/new-mars-study-suggests-an-ocean-s-worth-of-water-may-be-hiding-beneath-the-red-dusty-surface-1.6997845,neutral,0.048046205,0.09195621,0.85999763,-0.00614750517081708
CTV,2024-08-13,Banksy unveils new rhino art in an animal-themed collection that has popped up across London,https://www.ctvnews.ca/lifestyle/banksy-unveils-new-rhino-art-in-an-animal-themed-collection-that-has-popped-up-across-london-1.6997911,positive,0.49198568,0.00281101,0.5052034,0.24204194790158695
CTV,2024-08-13,Tropical Storm Ernesto is headed for Puerto Rico. Here's where it could go next,https://www.ctvnews.ca/world/tropical-storm-ernesto-is-headed-for-puerto-rico-here-s-where-it-could-go-next-1.6998662,neutral,0.038347702,0.07028892,0.89136344,-0.0034699838140517247
CTV,2024-08-13,Halifax Transit fares set to increase by 25 cents in September,https://atlantic.ctvnews.ca/halifax-transit-fares-set-to-increase-by-25-cents-in-september-1.6998629,neutral,0.047399666,0.03807986,0.9145206,0.000796651107569879
CTV,2024-08-13,"Wildfire near Temiskaming Shores, Kirkland Lake 5, still not under control",https://northernontario.ctvnews.ca/wildfire-near-temiskaming-shores-kirkland-lake-5-still-not-under-control-1.6996952,negative,0.0144168185,0.3529113,0.6326719,-0.12433853656292015
CTV,2024-08-13,Rural emergency departments struggling with physician shortage,https://calgary.ctvnews.ca/rural-emergency-departments-struggling-with-physician-shortage-1.6998237,negative,0.022212781,0.4386486,0.5391387,-0.19191917207088238
CTV,2024-08-13,"Regatta a 'go,' bringing thousands to Quidi Vidi Lake in St. John's",https://www.ctvnews.ca/canada/regatta-a-go-bringing-thousands-to-quidi-vidi-lake-in-st-john-s-1.6992234,neutral,0.07342385,0.026674146,0.89990205,0.0046795496918483614
CTV,2024-08-13,"Edmonton man arrested and charged with murder, another identified in fatal shooting east of Calgary",https://calgary.ctvnews.ca/edmonton-man-arrested-and-charged-with-murder-another-identified-in-fatal-shooting-east-of-calgary-1.6998127,negative,0.007948529,0.7658552,0.22619629,-0.586470997921424
CTV,2024-08-13,Partygoer shoots victim,https://barrie.ctvnews.ca/partygoer-shoots-victim-1.6998615,negative,0.020205293,0.7127478,0.26704684,-0.5076012096236671
CTV,2024-08-13,Delays on Hwy. 417 in Ottawa after diesel fuel truck collides with concrete barrier,https://ottawa.ctvnews.ca/delays-on-hwy-417-in-ottawa-after-diesel-fuel-truck-collides-with-concrete-barrier-1.6998610,negative,0.017491711,0.47942865,0.5030796,-0.22954589745813792
CTV,2024-08-13,Crash on E.C. Row Expressway impacts traffic,https://windsor.ctvnews.ca/crash-on-e-c-row-expressway-impacts-traffic-1.6998869,negative,0.016609756,0.4784183,0.504972,-0.22860816296666542
CTV,2024-08-13,'Things have to change': North End Biz sounds alarm over exodus of businesses,https://winnipeg.ctvnews.ca/things-have-to-change-north-end-biz-sounds-alarm-over-exodus-of-businesses-1.6998331,negative,0.03993006,0.24114653,0.71892333,-0.056557256448602544
CTV,2024-08-13,B.C.-based crypto platform committed $13M fraud: securities commission,https://bc.ctvnews.ca/b-c-based-crypto-platform-committed-13m-fraud-securities-commission-1.6997931,negative,0.0105189,0.7571223,0.23235878,-0.5731235189816708
CTV,2024-08-13,Timelapse video shows colourful aurora from the ISS,/video/c2976165-stunning-timelapse-shows-aurora-from-space,positive,0.3139756,0.006241592,0.67978275,0.09854173979448433
CTV,2024-08-13,LIVE SOON: Emergency meeting on Toronto terror plot suspects,/video/c373266-live--emergency-meeting-on-terror-suspects?playlistId=1.6984252,neutral,0.02014827,0.17568485,0.8041669,-0.03045921094906845
CTV,2024-08-13,Saskatchewan residents step up to help food bank avoid cutting hampers in half,https://regina.ctvnews.ca/saskatchewan-residents-step-up-to-help-food-bank-avoid-cutting-hampers-in-half-1.6998071,neutral,0.08676455,0.11753882,0.7956966,-0.006287286582111307
CTV,2024-08-13,Manitoba to provide update on cellphones in school following Saskatchewan's ban,https://winnipeg.ctvnews.ca/manitoba-to-provide-update-on-cellphones-in-school-following-saskatchewan-s-ban-1.6998059,neutral,0.025047747,0.057812378,0.9171397,-0.0027148866546022887
CTV,2024-08-13,Community steps in to help after popular Ottawa pizzeria vandalized,https://ottawa.ctvnews.ca/community-steps-in-to-help-after-popular-ottawa-pizzeria-vandalized-1.6996958,negative,0.05084921,0.23461418,0.71453655,-0.05245818114008571
CTV,2024-08-13,"Police searching for arson suspect in Oak Bay, B.C.",https://bc.ctvnews.ca/police-searching-for-arson-suspect-in-oak-bay-b-c-1.6997813,neutral,0.021177279,0.13456887,0.84425366,-0.017660325697113066
CTV,2024-08-13,Taylor Swift fans get free Swarovski necklaces after cancelled shows,https://www.ctvnews.ca/entertainment/taylor-swift-fans-get-free-swarovski-necklaces-after-cancelled-shows-1.6998702,neutral,0.20552653,0.037360765,0.7571127,0.04084533364318865
CTV,2024-08-13,Calgary officer helps save choking child after pulling over speeding vehicle,https://calgary.ctvnews.ca/calgary-officer-helps-save-choking-child-after-pulling-over-speeding-vehicle-1.6993427,neutral,0.04598487,0.19973385,0.7542811,-0.03777903192386134
CTV,2024-08-13,"Quake felt from Los Angeles to San Diego, swaying buildings and knocking items off shelves but no big damage",https://www.ctvnews.ca/world/quake-felt-from-los-angeles-to-san-diego-swaying-buildings-and-knocking-items-off-shelves-but-no-big-damage-1.6997879,negative,0.034581494,0.30982545,0.6555931,-0.09479592245184243
CTV,2024-08-13,Calgary daycares closed over 'imminent danger' to children,/video/c2976017-three-daycares-ordered-closed-by-province,negative,0.014105729,0.5927616,0.3931327,-0.3511673143680696
CTV,2024-08-13,Halifax police continue to investigate Kimberly McAndrew’s 1989 disappearance,https://atlantic.ctvnews.ca/halifax-police-continue-to-investigate-kimberly-mcandrew-s-1989-disappearance-1.6998621,neutral,0.020549195,0.04482641,0.93462443,-0.0015871367370823286
CTV,2024-08-13,"Puerto Rico cancels classes, activates National Guard as Tropical Storm Ernesto approaches",https://www.ctvnews.ca/world/puerto-rico-cancels-classes-activates-national-guard-as-tropical-storm-ernesto-approaches-1.6998332,neutral,0.024580333,0.11262241,0.8627974,-0.012079604146030931
CTV,2024-08-13,"Thieves used pickup truck to break into Lululemon store in Kamloops, RCMP say",https://bc.ctvnews.ca/thieves-used-pickup-truck-to-break-into-lululemon-store-in-kamloops-rcmp-say-1.6990254,negative,0.015507982,0.46923706,0.51525503,-0.21994287936289503
CTV,2024-08-13,Temperatures will reach 30 C in some Canadian provinces. Here's where,https://www.ctvnews.ca/climate-and-environment/temperatures-will-reach-30-c-in-some-canadian-provinces-here-s-where-1.6997263,neutral,0.056576405,0.03421081,0.90921265,0.002030513230515618
CTV,2024-08-13,"Josh Classen's forecast: Scattered showers, staying warm, some smoke on the way",https://edmonton.ctvnews.ca/edmonton-area-weather/josh-classen-s-forecast-scattered-showers-staying-warm-some-smoke-on-the-way-1.6998880,neutral,0.04563789,0.021300744,0.9330614,0.001629094001027509
CTV,2024-08-13,B.C. sky gazers treated to rare 'double header' of northern lights and meteor shower,https://bc.ctvnews.ca/b-c-sky-gazers-treated-to-rare-double-header-of-northern-lights-and-meteor-shower-1.6998495,neutral,0.18039021,0.006900888,0.8127089,0.032493002597562715
CTV,2024-08-13,Woman struck in the head with 'edged weapon',https://windsor.ctvnews.ca/woman-struck-in-the-head-with-edged-weapon-1.6998600,negative,0.01048063,0.76098317,0.22853616,-0.5789855621245596
CTV,2024-08-13,Banff residents vote to do away with downtown pedestrian zone,https://calgary.ctvnews.ca/banff-residents-vote-to-do-away-with-downtown-pedestrian-zone-1.6998531,neutral,0.044434384,0.16380353,0.791762,-0.024857193565807734
CTV,2024-08-13,"Overall traffic speeds trending down on Ottawa streets with photo radar, data suggest",https://ottawa.ctvnews.ca/overall-traffic-speeds-trending-down-on-ottawa-streets-with-photo-radar-data-suggest-1.6998395,neutral,0.018212985,0.22376935,0.7580176,-0.04974102210769793
CTV,2024-08-13,NDP calls for an investigation into bot posts about Poilievre rally,https://www.ctvnews.ca/politics/ndp-calls-for-an-investigation-into-bot-posts-about-poilievre-rally-1.6995411,neutral,0.01742891,0.21061744,0.77195364,-0.044055941329482984
CTV,2024-08-13,Meet the trio bringing you the first St. John's Fashion Week,https://www.ctvnews.ca/lifestyle/meet-the-trio-bringing-you-the-first-st-john-s-fashion-week-1.6995714,positive,0.5673326,0.0027785536,0.42988873,0.321858654901348
