source,date,headline,url,chosen_label,positive,negative,neutral,compound
CTV,2024-08-24,Hwy. 17 reopens after crash near Espanola,https://northernontario.ctvnews.ca/hwy-17-reopens-after-crash-near-espanola-1.7013262,neutral,0.049123768,0.08537176,0.8655045,-0.004875192060187494
CTV,2024-08-24,Family of patient who died in Fredericton ER waiting room files lawsuit against Horizon Health,https://atlantic.ctvnews.ca/more/family-of-patient-who-died-in-fredericton-er-waiting-room-files-lawsuit-against-horizon-health-1.7011999,negative,0.011813275,0.58761305,0.40057364,-0.34514955553406246
CTV,2024-08-24,Canadian side of Sault lock closed due to 'mechanical issue',https://northernontario.ctvnews.ca/canadian-side-of-sault-lock-closed-due-to-mechanical-issue-1.7013200,negative,0.0070417523,0.51619714,0.47676116,-0.2664098758668487
CTV,2024-08-24,Newfoundland newspaper The Telegram reducing print run after Postmedia purchase,https://www.ctvnews.ca/business/newfoundland-newspaper-the-telegram-reducing-print-run-after-postmedia-purchase-1.7009862,neutral,0.023949692,0.17761487,0.7984354,-0.030973460077130532
CTV,2024-08-24,Young drivers share innovative ideas to combat distracted driving at road safety event,https://windsor.ctvnews.ca/young-drivers-share-innovative-ideas-to-combat-distracted-driving-at-road-safety-event-1.7013279,positive,0.53322476,0.016170632,0.4506047,0.2840671110527335
CTV,2024-08-24,Bill Morneau: Canada needs to spend more on defence faster to make inroads with next U.S. administration,https://www.ctvnews.ca/politics/bill-morneau-canada-needs-to-spend-more-on-defence-faster-to-make-inroads-with-next-u-s-administration-1.7011232,neutral,0.13382891,0.02980433,0.8363667,0.01702188299377827
CTV,2024-08-24,"They lit candles and chanted to 'manifest' Taylor Swift tickets. In a roundabout way, it worked",https://bc.ctvnews.ca/they-lit-candles-and-chanted-to-manifest-taylor-swift-tickets-in-a-roundabout-way-it-worked-1.7011411,positive,0.43383816,0.031428967,0.5347329,0.1872277683589445
CTV,2024-08-24,National security agencies should detail how they're using AI: federal advisory body,https://www.ctvnews.ca/sci-tech/national-security-agencies-should-detail-how-they-re-using-ai-federal-advisory-body-1.7012165,neutral,0.0620992,0.04077736,0.89712334,0.0021935198127636113
CTV,2024-08-24,Weekend rain dampening B.C. wildfire activity as active blazes numbers drop,https://bc.ctvnews.ca/weekend-rain-dampening-b-c-wildfire-activity-as-active-blazes-numbers-drop-1.7013375,neutral,0.021128006,0.22008477,0.75878733,-0.0479908899706718
CTV,2024-08-24,Flapjacks flying this weekend in Lethbridge as Whoop-Up Days winds up,https://calgary.ctvnews.ca/flapjacks-flying-this-weekend-in-lethbridge-as-whoop-up-days-winds-up-1.7013043,neutral,0.15859595,0.009197393,0.8322068,0.02506806298505726
CTV,2024-08-24,"Conservatives maintain silence as strife continues between union, railways",https://www.ctvnews.ca/politics/conservatives-maintain-silence-as-strife-continues-between-union-railways-1.7012148,negative,0.0113993725,0.5218803,0.46672034,-0.272229100956352
CTV,2024-08-24,"The biggest diamond in over a century is found in Botswana — a whopping 2,492 carats",https://www.ctvnews.ca/sci-tech/the-biggest-diamond-in-over-a-century-is-found-in-botswana-a-whopping-2-492-carats-1.7010164,positive,0.84968734,0.00484826,0.14546448,0.7219450163407828
CTV,2024-08-24,Labour board orders rail workers back on the job as Teamsters vow to appeal,https://www.ctvnews.ca/politics/labour-board-orders-rail-workers-back-on-the-job-as-teamsters-vow-to-appeal-1.7013079,neutral,0.074621245,0.030385474,0.8949932,0.004645057628072102
CTV,2024-08-24,Windsor Spitfires welcome Keanu Reeves to its roster,https://windsor.ctvnews.ca/windsor-spitfires-welcome-keanu-reeves-to-its-roster-1.7011275,positive,0.52293855,0.0031161194,0.4739454,0.2734549698255133
CTV,2024-08-24,Rail employees ordered back to work. What happens now?,/video/c2983151-cn-s-reaction-to-the-back-to-work-ruling?playlistId=1.7010215,neutral,0.017533213,0.11692115,0.86554563,-0.013363142314797294
CTV,2024-08-24,Broken elevator leaves Steinbach residents ‘trapped’ in suites,https://winnipeg.ctvnews.ca/broken-elevator-leaves-steinbach-residents-trapped-in-suites-1.7013314,negative,0.0065947995,0.7514139,0.24199131,-0.5645793528420047
CTV,2024-08-24,What a Kamala Harris presidency means for Canada,https://www.ctvnews.ca/politics/what-a-kamala-harris-presidency-means-for-canada-1.7013047,neutral,0.2013895,0.018596256,0.7800143,0.040211904189707326
CTV,2024-08-24,"Merritt, B.C., emergency room closing for 25 hours this weekend",https://bc.ctvnews.ca/merritt-b-c-emergency-room-closing-for-25-hours-this-weekend-1.7013172,neutral,0.0189638,0.09053104,0.89050525,-0.007836237275107738
CTV,2024-08-24,"As kids head back to school, make sure their vaccines are up to date, doctors say",https://www.ctvnews.ca/health/as-kids-head-back-to-school-make-sure-their-vaccines-are-up-to-date-doctors-say-1.7012944,neutral,0.19414261,0.020273415,0.78558403,0.03728033114364493
CTV,2024-08-24,'I don't want to move': N.B. residents concerned by covered bridge closures,https://atlantic.ctvnews.ca/i-don-t-want-to-move-n-b-residents-concerned-by-covered-bridge-closures-1.7013270,negative,0.009614302,0.7196098,0.2707759,-0.5177458253903922
CTV,2024-08-24,"Production begins on a new film in Regina, shot entirely using LED volume wall",https://regina.ctvnews.ca/production-begins-on-a-new-film-in-regina-shot-entirely-using-led-volume-wall-1.7012570,neutral,0.146099,0.0069757737,0.8469254,0.02129623604461628
CTV,2024-08-24,Railways prepare to restart after federal government forces binding arbitration in labour dispute,https://www.ctvnews.ca/politics/railways-prepare-to-restart-after-federal-government-forces-binding-arbitration-in-labour-dispute-1.7010508,neutral,0.0829101,0.01850601,0.8985839,0.006531611860971509
CTV,2024-08-24,Telegram CEO Pavel Durov detained at airport in France,https://www.ctvnews.ca/sci-tech/telegram-ceo-pavel-durov-detained-at-airport-in-france-1.7013395,neutral,0.016748173,0.17893471,0.804317,-0.031737147779566044
CTV,2024-08-24,Halifax streets and rotary closed until Monday,https://atlantic.ctvnews.ca/halifax-streets-and-rotary-closed-until-monday-1.7013088,neutral,0.01533619,0.15433298,0.83033085,-0.023583468211356262
CTV,2024-08-24,Why Ford's three-row electric 'personal bullet train' SUV went off the rails,https://www.ctvnews.ca/autos/why-ford-s-three-row-electric-personal-bullet-train-suv-went-off-the-rails-1.7010774,negative,0.016250568,0.60342014,0.38032928,-0.36385180047671817
CTV,2024-08-24,'Bigger every year': 2024 Lethbridge and District Pro Rodeo underway,https://calgary.ctvnews.ca/bigger-every-year-2024-lethbridge-and-district-pro-rodeo-underway-1.7012503,positive,0.782574,0.0026592838,0.21476673,0.6124150022569932
CTV,2024-08-24,Manitoba staple snacks marking milestone anniversaries,https://winnipeg.ctvnews.ca/manitoba-staple-snacks-marking-milestone-anniversaries-1.7012143,positive,0.7547138,0.004144829,0.24114133,0.5695757340470129
CTV,2024-08-24,Two tornadoes confirmed during storms southeast of Ottawa Wednesday,https://ottawa.ctvnews.ca/two-tornadoes-confirmed-during-storms-southeast-of-ottawa-wednesday-1.7013166,neutral,0.033581346,0.20915943,0.7572592,-0.042619967180081986
CTV,2024-08-24,6 people evacuated from house fire in Winnipeg’s Spence neighbourhood,https://winnipeg.ctvnews.ca/6-people-evacuated-from-house-fire-in-winnipeg-s-spence-neighbourhood-1.7013125,neutral,0.027751088,0.11694057,0.85530835,-0.012904973358209837
CTV,2024-08-24,Israeli airstrikes kill dozens in Gaza on the eve of high-level ceasefire talks in Egypt,https://www.ctvnews.ca/world/israeli-airstrikes-kill-dozens-in-gaza-on-the-eve-of-high-level-ceasefire-talks-in-egypt-1.7012950,negative,0.007243883,0.8303348,0.16242138,-0.6894033529889931
CTV,2024-08-24,Shohei Ohtani is baseball's fastest 40-40 man and has time to become the first member of 50-50 club,https://www.ctvnews.ca/sports/shohei-ohtani-is-baseball-s-fastest-40-40-man-and-has-time-to-become-the-first-member-of-50-50-club-1.7013170,positive,0.6481665,0.0035876662,0.34824577,0.4201069690911545
CTV,2024-08-24,"Surge in stabbings in Sudbury linked to personal disputes, drugs and alcohol",https://northernontario.ctvnews.ca/surge-in-stabbings-in-sudbury-linked-to-personal-disputes-drugs-and-alcohol-1.7012625,negative,0.00928376,0.6295144,0.3612018,-0.39620220490496827
CTV,2024-08-24,'Competitiveness has always been a part of me': Former Humboldt Bronco heading to Paris for Paralympics,https://regina.ctvnews.ca/competitiveness-has-always-been-a-part-of-me-former-humboldt-bronco-heading-to-paris-for-paralympics-1.7009059,positive,0.63531816,0.0047615967,0.35992032,0.40360645430197906
CTV,2024-08-24,"Neighbours disgusted by Nazi flag at Kitchener, Ont. home",https://kitchener.ctvnews.ca/neighbours-disgusted-by-nazi-flag-at-kitchener-ont-home-1.7012258,negative,0.009468098,0.8278506,0.16268127,-0.6852469996246846
CTV,2024-08-24,Hawaii's Big Island is under a tropical storm warning as Hone approaches with rain and wind,https://www.ctvnews.ca/climate-and-environment/hawaii-s-big-island-is-under-a-tropical-storm-warning-as-hone-approaches-with-rain-and-wind-1.7013000,neutral,0.043108553,0.14254193,0.8143495,-0.018459858960397035
CTV,2024-08-24,Judge dismisses charge for N.L. officer accused of assaulting volatile air passenger,https://www.ctvnews.ca/canada/judge-dismisses-charge-for-n-l-officer-accused-of-assaulting-volatile-air-passenger-1.7012161,negative,0.014482895,0.45097277,0.53454435,-0.20316668141351357
CTV,2024-08-24,Canadian Museum of Nature brings in bag checks after receiving threatening email,https://ottawa.ctvnews.ca/canadian-museum-of-nature-brings-in-bag-checks-after-receiving-threatening-email-1.7012668,negative,0.015317817,0.51327103,0.4714112,-0.2632124885825329
CTV,2024-08-24,‘Filling a truck with menstrual products’: Collection happening at Wortley on the Green Saturday,https://london.ctvnews.ca/filling-a-truck-with-menstrual-products-collection-happening-at-wortley-on-the-green-saturday-1.7013060,neutral,0.035338882,0.015379405,0.9492816,0.0010123133071784363
CTV,2024-08-24,Attempted kidnapping caught on video north of Toronto,/video/c2983044-attempted-kidnapping-caught-on-video,negative,0.021181995,0.33539397,0.64342403,-0.11204043477130199
CBC,2024-08-24,Union serves CN Rail with 72-hour strike notice; CPKC stoppage continues,https://www.cbc.ca/news/politics/cn-rail-stoppage-resuming-service-cpkc-1.7302978,neutral,0.0352918,0.071064144,0.893644,-0.003804604512020582
CBC,2024-08-24,What's driving the surge in support for the B.C. Conservatives?,https://www.cbc.ca/news/canada/british-columbia/bc-conservatives-surge-provincial-election-1.7302002,neutral,0.088385336,0.017641144,0.89397347,0.007500761435852432
CBC,2024-08-24,How Canadian researchers are trying to win the battle against a stubborn wheat disease,https://www.cbc.ca/news/canada/calgary/tan-spot-wheat-disease-1.7300976,neutral,0.08227671,0.1389535,0.77876973,-0.012538623142640759
CBC,2024-08-24,DNC 2024 in 5 minutes,https://www.cbc.ca/player/play/video/9.6489410,neutral,0.21615303,0.008059907,0.77578694,0.046657196343072194
CBC,2024-08-24,Here's how the rail stoppage will — or won't — affect you,https://www.cbc.ca/news/business/rail-lockout-questions-answered-1.7302074,neutral,0.04291316,0.21056364,0.7465232,-0.042495509731201864
CBC,2024-08-24,"Iceland volcano spews lava, smoke in 6th eruption since December",https://www.cbc.ca/player/play/video/9.6489643,negative,0.014064632,0.5195703,0.46636513,-0.26975545901398945
CBC,2024-08-24,Italy launches manslaughter investigation into mysterious sinking of luxury yacht,https://www.cbc.ca/news/world/sicily-ship-investigation-lynch-1.7304159,negative,0.008512861,0.676458,0.31502908,-0.45752299842156674
CBC,2024-08-24,WATCH : CBC News Explore,https://www.cbc.cahttps://gem.cbc.ca/live,neutral,0.09840752,0.014817287,0.88677514,0.009464492631846788
CBC,2024-08-24,"Baby, oh! Justin and Hailey Bieber welcome a baby boy",https://www.cbc.ca/news/entertainment/justin-hailey-bieber-baby-boy-jack-blues-1.7304148,positive,0.89916956,0.0026349528,0.09819556,0.8084989022289002
CBC,2024-08-24,Should parents of boys set aside the topic of toxic masculinity? This author thinks so,https://www.cbc.ca/radio/thecurrent/boy-moms-impossible-masculinity-1.7301385,neutral,0.057726093,0.15988134,0.7823926,-0.022229735294341246
CBC,2024-08-24,WATCH: CBC News Network,https://www.cbc.cahttps://gem.cbc.ca/live,neutral,0.100739144,0.018231448,0.88102955,0.009815978473616482
CBC,2024-08-24,Staying on the right side of doping controls can be even more complicated for Para athletes,https://www.cbc.ca/sports/paralympics/paris-paralympics-wada-doping-control-1.7299201,negative,0.03621948,0.37317914,0.59060144,-0.13795079817370492
CBC,2024-08-24,ISIS claims responsibility for fatal knife attack at German festival; suspect arrested after manhunt,https://www.cbc.ca/news/world/germany-solingen-festival-attack-1.7303920,negative,0.0068039754,0.7865909,0.20660508,-0.6186789555740333
CBC,2024-08-24,Ukraine and Russia swap more than 100 prisoners,https://www.cbc.ca/news/world/russia-ukraine-prisoner-swap-1.7304160,negative,0.018299602,0.29968777,0.68201274,-0.08947785203016423
CBC,2024-08-24,"Regina city council's rejection of Dewdney Avenue renaming disappointing for advocate, researchers",https://www.cbc.ca/news/canada/saskatchewan/regina-council-dewdney-avenue-renaming-reaction-1.7303983,negative,0.011754041,0.47695768,0.5112883,-0.22735047000027464
CBC,2024-08-24,What does a 27-metre dive feel like?,https://www.cbc.ca/player/play/video/9.6489818,neutral,0.06691971,0.06612158,0.86695874,0.00010618402940298921
CBC,2024-08-24,How the Bayesian superyacht sank in minutes | About That,https://www.cbc.ca/player/play/video/9.6489773,negative,0.025173284,0.42115697,0.55366975,-0.17673950175100117
CBC,2024-08-24,"L.A. Dodgers star Shohei Ohtani becomes fastest to hit 40 home runs, steal 40 bases in a single season",https://www.cbc.ca/sports/baseball/mlb/shohei-ohtani-40-40-club-1.7304231,positive,0.3269758,0.0037770637,0.66924727,0.10689886428938422
CBC,2024-08-24,P.E.I. fossil day allows Islanders to travel back in time before dinosaurs,https://www.cbc.ca/news/canada/prince-edward-island/pei-fossils-paleontology-education-1.7300087,positive,0.31823674,0.011592753,0.67017055,0.1011402208016321
CBC,2024-08-24,Generating power from poop,https://www.cbc.ca/player/play/video/9.6489565,negative,0.08659256,0.2785483,0.63485926,-0.07009086210890914
CBC,2024-08-24,"With a paddle and a pack, this B.C. MP meets his constituents where they live",https://www.cbc.ca/news/politics/taylor-bachrack-skeena-kispiox-1.7302187,neutral,0.07293122,0.03342179,0.893647,0.00420194626472159
CBC,2024-08-24,Blue Jays pitcher Bowden Francis loses no-hit bid in 9th inning — but Toronto still wins,https://www.cbc.ca/sports/baseball/mlb/jays-angels-aug-24-1.7304325,neutral,0.053694323,0.05498374,0.89132196,-0.0001401312187121473
CBC,2024-08-24,"Ontario needs holistic approach to drug treatment amid consumption site closures, doctor says",https://www.cbc.ca/radio/thecurrent/harm-reduction-drug-strategy-1.7303621,neutral,0.03000691,0.16559571,0.8043974,-0.02652152025379273
CBC,2024-08-24,Report warns number of young femicide victims in Ontario rising,https://www.cbc.ca/news/canada/toronto/ontario-femicide-young-victims-1.7302542,negative,0.0046901605,0.83111507,0.16419485,-0.6907301830175125
CBC,2024-08-24,"Suspect arrested, anti-terrorism team investigating after attempted arson against French synagogue",https://www.cbc.ca/news/world/arson-attempt-france-1.7304198,negative,0.014156131,0.5685239,0.41731992,-0.3230190607816965
CBC,2024-08-24,Railway work stoppage could mean higher prices,https://www.cbc.ca/player/play/video/9.6489957,negative,0.01311186,0.5537687,0.43311962,-0.30648773246590366
CBC,2024-08-24,What does Ottawa's binding arbitration on rail dispute mean?,https://www.cbc.ca/player/play/video/9.6488782,neutral,0.01116704,0.04409617,0.9447367,-0.0018197717543397829
CBC,2024-08-24,Presents from prison: How Manitoba inmates are able to read stories to their kids,https://www.cbc.ca/news/canada/manitoba/john-howard-society-books-prison-stories-manitoba-1.7298135,neutral,0.0690825,0.0164498,0.91446793,0.004501783476036358
CBC,2024-08-24,"Fan Expo Canada: cosplay, special guests and big personalities",https://www.cbc.ca/player/play/video/9.6489820,positive,0.43816173,0.005590417,0.55624783,0.19195446252650683
CBC,2024-08-24,How Alberta's reliance on rail shipments prompts unease amid labour uncertainty,https://www.cbc.ca/news/canada/calgary/western-canada-alberta-danielle-smith-steven-mackinnon-1.7302301,negative,0.010638987,0.5473977,0.4419633,-0.2995310399714768
CBC,2024-08-24,"RFK Jr. suspends campaign, pledges support for Trump",https://www.cbc.ca/player/play/video/9.6489978,neutral,0.08414506,0.053071294,0.8627836,0.004263830200869956
CBC,2024-08-24,Troubled water: How a cyanide spill at Yukon's Eagle mine has unsettled local residents,https://www.cbc.cahttps://www.cbc.ca/newsinteractives/features/victoria-gold,negative,0.009397311,0.54123664,0.44936612,-0.2928487420989274
CBC,2024-08-24,WATCH | #TheMoment a postcard arrived at a Wales address 121 years late,https://www.cbc.cahttps://www.cbc.ca/player/play/video/9.6489977,neutral,0.02965951,0.20104085,0.7692995,-0.0395377594735038
CBC,2024-08-24,U.S. federal judge rules Breonna Taylor's boyfriend the 'legal' cause of her death,https://www.cbc.ca/news/world/breonna-taylor-cause-of-death-boyfriend-judge-ruling-1.7304319,negative,0.014145523,0.39459163,0.59126294,-0.15550242423129745
CBC,2024-08-24,"How rural Guatemalan communities are fighting malnutrition, climate change",https://www.cbc.ca/player/play/video/9.6489903,negative,0.038357995,0.28770885,0.67393315,-0.08130504524225302
CBC,2024-08-24,IN PHOTOS | This week's most compelling Canadian images,https://www.cbc.cahttps://www.cbc.ca/newsinteractives/features/compelling-canadian-images-8-24,positive,0.61367935,0.004478514,0.38184214,0.3765822868181772
CBC,2024-08-24,This Canadian won the air guitar world championship — and it was epic,https://www.cbc.ca/player/play/video/9.6490088,positive,0.9756471,0.003197785,0.02115526,0.9518768843490406
CBC,2024-08-24,"Teamsters serve CN Rail with 72-hour strike notice, confirm CPKC workers 'on strike'",https://www.cbc.ca/player/play/video/9.6489319,neutral,0.02685282,0.15463434,0.8185128,-0.023190711568021882
CBC,2024-08-24,There's an air guitar world championship — and this Canadian just won,https://www.cbc.ca/news/world/knowles-air-guitar-world-championships-1.7304220,positive,0.6731962,0.011662987,0.31514087,0.45305707470517476
CBC,2024-08-24,Taylor Swift and Beyoncé were no-shows at the DNC. But will they endorse Kamala Harris?,https://www.cbc.ca/news/entertainment/taylor-swift-beyonce-endorsement-1.7303016,neutral,0.058316436,0.19477025,0.7469133,-0.03453464191363054
CBC,2024-08-24,"On a mission to fix health care, Jane Philpott is open to a return to politics",https://www.cbc.ca/news/politics/philpott-possible-politics-return-1.7303211,positive,0.6083963,0.0130998185,0.37850392,0.36997444330613405
CBC,2024-08-24,"Federal labour board orders rail employees back to work, imposes binding arbitration",https://www.cbc.ca/news/politics/cirb-decision-railway-dispute-1.7304194,neutral,0.023420408,0.16333215,0.8132475,-0.026128867155664537
CBC,2024-08-24,Ottawa has sent the rail dispute to arbitration — so what happens now?,https://www.cbc.ca/news/politics/what-can-government-do-rail-labour-dispute-shutdown-1.7302215,neutral,0.01908598,0.044645928,0.93626815,-0.0016289827995951134
CBC,2024-08-24,Microbes create energy out of stuff we flush,https://www.cbc.ca/news/canada/british-columbia/bc-microbes-biogas-energy-project-1.7295561,neutral,0.068098634,0.14233555,0.7895658,-0.015621985596236954
CBC,2024-08-24,Israeli families of the dead and captive vent their fury over Netanyahu's failure to end the war,https://www.cbc.ca/news/world/israel-hostage-families-fury-netanyahu-1.7303574,negative,0.005408978,0.87836444,0.11622668,-0.7714947282208291
CBC,2024-08-24,"Stranded astronauts will stay on space station until February, NASA says",https://www.cbc.ca/news/science/nasa-boeing-spacex-astronauts-stranded-1.7304258,neutral,0.07199335,0.0044044014,0.9236022,0.005163645328285504
