source,date,headline,url,chosen_label,positive,negative,neutral,compound
Global,2024-07-01,How to know your meat is cooked & other BBQ safety tips,https://globalnews.ca/video/3653680/how-to-know-your-meat-is-cooked-other-bbq-safety-tips/,neutral,0.06522651,0.065433554,0.86933994,-2.7052404924177154e-05
Global,2024-07-01,Canada Day celebrations in Montreal,https://globalnews.ca/video/10598806/canada-day-celebrations-in-montreal-2/,positive,0.6878685,0.0032885862,0.308843,0.4731522050808312
Global,2024-07-01,Driver dead after two-vehicle Canada Day crash in Brampton,https://globalnews.ca/news/10598077/brampton-canada-day-fatal-crash/,negative,0.012125633,0.66826594,0.31960848,-0.44643231490121593
Global,2024-07-01,‘Bleak picture’: Quebec moving day sees scores of renters still hunting for new home,https://globalnews.ca/news/10598260/quebec-moving-day-2024/,negative,0.007610911,0.65876275,0.33362636,-0.43391041928823704
Global,2024-07-01,"Pipeline explosion causes grassfire near Edson, closes Hwy 16",https://globalnews.ca/news/10598767/pipeline-explosion-causes-grassfire-near-edson/,negative,0.012851194,0.6623255,0.32482335,-0.4385098977119011
Global,2024-07-01,Pedestrian fatally struck by freight train in downtown Moncton,https://globalnews.ca/news/10597993/pedestrian-struck-by-cn-train-moncton-dead/,negative,0.019454734,0.5534222,0.4271231,-0.3058976434480911
Global,2024-07-01,‘Rolling spy vans’? Canada weighs possible security threat of Chinese EVs,https://globalnews.ca/news/10585303/china-electric-vehicles-canada-national-security/,negative,0.016920848,0.2697556,0.71332353,-0.0724817776326443
Global,2024-07-01,Canada Day 2024: Trudeau celebrates Canadian unity,https://globalnews.ca/video/10598409/canada-day-2024-trudeau-celebrates-canadian-unity/,positive,0.9281202,0.0021556444,0.06972416,0.8614024372988505
Global,2024-07-01,15 surprising facts about Canadian celebs that you probably didn’t know,https://globalnews.ca/news/10594456/canadian-celebrities-fun-surprising-facts/,neutral,0.18608634,0.061528504,0.75238514,0.030842371646215838
Global,2024-07-01,Calgary water emergency:  Pipe stabilization continues as crews monitor progress,https://globalnews.ca/video/10598724/calgary-water-emergency-pipe-stabilization-continues-as-crews-monitor-progress/,neutral,0.024364298,0.06715952,0.9084762,-0.003916782139359309
Global,2024-07-01,"Canada Day 2024: Here’s what events you can expect in Toronto, Ottawa",https://globalnews.ca/video/10598033/canada-day-2024-heres-what-events-you-can-expect-in-toronto-ottawa/,neutral,0.21924065,0.0034431906,0.7773163,0.04805458152022801
Global,2024-07-01,"WestJet strike averted as feds intervene, union says it will ‘comply’",https://globalnews.ca/news/10591136/westjet-flight-cancellations-june/,neutral,0.111755796,0.045671258,0.842573,0.0104034907768078
Global,2024-07-01,Global News at 6 Maritimes: July 1,https://globalnews.ca/video/10598778/global-news-at-6-maritimes-july-1-3/,neutral,0.037170377,0.010405903,0.95242363,0.0012733564989688695
Global,2024-07-01,Do former presidents have immunity? U.S. Supreme Court rules in Trump case,https://globalnews.ca/news/10598066/do-former-presidents-have-immunity-u-s-supreme-court-rules-in-trump-case/,neutral,0.031612862,0.04436264,0.92402446,-0.0009686711006064996
Global,2024-07-01,Moving Day 2024 sees Quebecers scramble to find housing,https://globalnews.ca/video/10598815/moving-day-2024-sees-quebecers-scramble-to-find-housing/,neutral,0.07276434,0.01935029,0.9078855,0.004920208646108648
Global,2024-07-01,Fredericton celebrates Canada Day,https://globalnews.ca/video/10598749/fredericton-celebrates-canada-day/,positive,0.8350118,0.0022626363,0.16272551,0.697239603218307
Global,2024-07-01,"Crowds gather to watch Peterborough’s Canada Day Parade, but it may be the city’s last",https://globalnews.ca/video/10598828/crowds-gather-to-watch-peterboroughs-canada-day-parade-but-it-may-be-the-citys-last/,neutral,0.20164448,0.018619314,0.7797361,0.040313836649876755
Global,2024-07-01,"Canada Day 2024: Freeland reflects on country’s values, celebrates Canadian kindness",https://globalnews.ca/video/10598390/canada-day-2024-freeland-reflects-on-countrys-values-celebrates-canadian-kindness/,positive,0.86935896,0.0034545665,0.12718636,0.7557731649899857
Global,2024-07-01,"Canada Day at The Forks highlighted reconciliation efforts, even with the rain",https://globalnews.ca/news/10598746/canada-day-at-the-forks-highlighted-reconciliation-efforts-even-with-the-rain/,positive,0.6911859,0.005586194,0.30322808,0.47770660848350843
Global,2024-07-01,"Global Montreal at 5:30: July 1, 2024",https://globalnews.ca/video/10598812/global-montreal-at-530-july-1-2024/,neutral,0.055706784,0.008249763,0.93604344,0.0030351877322389864
Global,2024-07-01,Firing up the BBQ this summer? Tips to minimize cancer risk from grilling,https://globalnews.ca/news/10586468/bbq-cancer-risk-meat/,neutral,0.105597526,0.10022105,0.79418135,0.001106578445565276
Global,2024-07-01,"Popular Calgary brewery destroyed, arson squad investigating",https://globalnews.ca/video/10597633/popular-calgary-brewery-destroyed-arson-squad-investigating/,negative,0.010381376,0.8168024,0.17281626,-0.6670583224793871
Global,2024-07-01,Trudeau speaks at Newfoundland Memorial Day as unknown WWI soldier laid to rest,https://globalnews.ca/video/10598426/trudeau-speaks-at-newfoundland-memorial-day-as-unknown-wwi-soldier-laid-to-rest/,neutral,0.027363788,0.20422384,0.7684123,-0.04095861346901675
Global,2024-07-01,"Canada, U.S. to see above-normal Atlantic hurricane season, officials stress to ‘be prepared’",https://globalnews.ca/video/10521034/canada-u-s-to-see-above-normal-atlantic-hurricane-season-officials-stress-to-be-prepared/,neutral,0.078532524,0.044756744,0.8767107,0.004164191880266399
Global,2024-07-01,More WestJet flight cancellations as strike hits tens of thousands of travellers,https://globalnews.ca/news/10597029/flight-cancellations-long-weekend-westjet/,negative,0.0074862544,0.80431044,0.18820335,-0.6468591817163558
Global,2024-07-01,Timeline for easing Calgary’s water restrictions to be revealed Tuesday,https://globalnews.ca/news/10598582/calgary-water-restrictions-timeline/,neutral,0.027217835,0.024162663,0.94861954,0.00015697613108189845
Global,2024-07-01,"WestJet says it has reached a deal with striking mechanics, ending strike",https://globalnews.ca/news/10597956/westjet-says-it-has-reached-a-deal-with-striking-mechanics-ending-strike/,neutral,0.10387155,0.017340567,0.8787879,0.010488604366891252
Global,2024-07-01,"Hurricanes becoming so strong, study proposes Category 6 for the worst",https://globalnews.ca/video/10277293/hurricanes-becoming-so-strong-study-proposes-category-6-for-the-worst/,negative,0.020433608,0.7503191,0.22924732,-0.5625612219116851
Global,2024-07-01,Young people are choosing to stay single and loving it. Here’s why,https://globalnews.ca/news/10589533/young-people-single-happy-study/,positive,0.46179178,0.027030952,0.51117724,0.21252099235270272
Global,2024-07-01,Where to catch fireworks in the Southern Interior this Canada Day,https://globalnews.ca/news/10598533/okanagan-fireworks/,neutral,0.132402,0.0155793335,0.8520187,0.01728756856446001
Global,2024-07-01,Hurricane Beryl makes landfall in Caribbean as powerful Category 4 storm,https://globalnews.ca/video/10598781/hurricane-beryl-makes-landfall-in-caribbean-as-powerful-category-4-storm/,negative,0.024119955,0.53988737,0.43599257,-0.2908966438660503
Global,2024-07-01,Chinese woman arrested after allegedly trying to smuggle 29 turtles into Canada,https://globalnews.ca/news/10598602/canada-us-turtle-smuggling-arrest/,negative,0.0100648,0.61395437,0.37598085,-0.3768386628029816
Global,2024-07-01,Why Craig Baird is Canada’s biggest cheerleader,https://globalnews.ca/video/10598832/why-craig-baird-is-canadas-biggest-cheerleader/,negative,0.06165385,0.6003354,0.3380108,-0.35660138588821155
Global,2024-07-01,Co-ops in Saskatchewan are still recovering from cybersecurity incident,https://globalnews.ca/news/10598617/co-ops-saskatchewan-recovering-cybersecurity-incident/,neutral,0.06940385,0.02249813,0.908098,0.004310730189223122
Global,2024-07-01,Heritage Park celebrates 60 years and Canada Day,https://globalnews.ca/news/10598801/heritage-park-celebrates-60-years-and-canada-day/,positive,0.86492866,0.0022661542,0.13280524,0.7480963918996553
CTV,2024-07-01,"Home sales sluggish in North Bay, increase in other northeastern Ont. cities",https://northernontario.ctvnews.ca/home-sales-sluggish-in-north-bay-increase-in-other-northeastern-ont-cities-1.6947675,neutral,0.036737565,0.13395926,0.8293031,-0.01659544458185458
CTV,2024-07-01,"Flash flooding in B.C. Interior affects at least 20 homes, emergency officials say",https://bc.ctvnews.ca/flash-flooding-in-b-c-interior-affects-at-least-20-homes-emergency-officials-say-1.6947612,negative,0.010125188,0.6436205,0.3462543,-0.4141448553607461
CTV,2024-07-01,Here's what you need to know about Canada Day fireworks in Ottawa,https://ottawa.ctvnews.ca/here-s-what-you-need-to-know-about-canada-day-fireworks-in-ottawa-1.6938282,positive,0.26233834,0.0111041665,0.7265575,0.06869810226831419
CTV,2024-07-01,"More than 200 people evacuated following apartment fire in Gatineau, Que.",https://ottawa.ctvnews.ca/more-than-200-people-evacuated-following-apartment-fire-in-gatineau-que-1.6946825,negative,0.012145643,0.44839412,0.5394602,-0.20090979608568205
CTV,2024-07-01,'This amount of stress is awful': B.C. woman says senior relatives stranded in Calgary amid WestJet strike,https://bc.ctvnews.ca/this-amount-of-stress-is-awful-b-c-woman-says-senior-relatives-stranded-in-calgary-amid-westjet-strike-1.6946711,negative,0.004900549,0.89042705,0.10467242,-0.7928362814508576
CTV,2024-07-01,Check out these local Canada Day celebrations,https://kitchener.ctvnews.ca/check-out-these-local-canada-day-celebrations-1.6932921,positive,0.7710836,0.0036517547,0.22526461,0.5945566185129891
CTV,2024-07-01,Some Canada Day celebrations rained out in Winnipeg,https://winnipeg.ctvnews.ca/some-canada-day-celebrations-rained-out-in-winnipeg-1.6947477,positive,0.33215967,0.022952022,0.64488834,0.10980324073858405
CTV,2024-07-01,"As fall elections loom, are fears for the state of democracy in Canada justified?",https://www.ctvnews.ca/politics/as-fall-elections-loom-are-fears-for-the-state-of-democracy-in-canada-justified-1.6946268,negative,0.021617226,0.38145527,0.5969275,-0.14504080935018138
CTV,2024-07-01,Scientists add more underwater robots to monitor endangered North Atlantic right whales,https://www.ctvnews.ca/canada/scientists-add-more-underwater-robots-to-monitor-endangered-north-atlantic-right-whales-1.6946604,neutral,0.06554299,0.026072476,0.9083845,0.003616110654270921
CTV,2024-07-01,'Roaring Kitty' is sued for alleged GameStop manipulation,https://www.ctvnews.ca/business/roaring-kitty-is-sued-for-alleged-gamestop-manipulation-1.6947485,negative,0.013266489,0.6528356,0.33389786,-0.4260183493946297
CTV,2024-07-01,'Absolutely amazing video': Basking shark spotted along eastern shore of Nova Scotia,https://atlantic.ctvnews.ca/absolutely-amazing-video-basking-shark-spotted-along-eastern-shore-of-nova-scotia-1.6943842,positive,0.96483827,0.0020293556,0.033132285,0.9309088480395307
CTV,2024-07-01,Vancouver Canucks sign left-winger Jake DeBrusk to seven-year deal,https://bc.ctvnews.ca/vancouver-canucks-sign-left-winger-jake-debrusk-to-seven-year-deal-1.6947685,neutral,0.04354638,0.00753098,0.94892263,0.0018395717016694846
CTV,2024-07-01,Heat warning issued in northern Manitoba,https://winnipeg.ctvnews.ca/heat-warning-issued-in-northern-manitoba-1.6947610,neutral,0.037677586,0.20762554,0.7546968,-0.04168877877758881
CTV,2024-07-01,"On July 1, 1916, a generation of Newfoundlanders died in one brief battle",https://www.ctvnews.ca/canada/on-july-1-1916-a-generation-of-newfoundlanders-died-in-one-brief-battle-1.6945329,negative,0.013464532,0.55180216,0.4347333,-0.30430434496832426
CTV,2024-07-01,"Brockville, Ont. celebrates Canada Day: 'It's really amazing'",https://ottawa.ctvnews.ca/brockville-ont-celebrates-canada-day-it-s-really-amazing-1.6947620,positive,0.9864221,0.0019068713,0.011671109,0.973024864814323
CTV,2024-07-01,One of Canada’s most wanted fugitives sought after Erie Street shots fired,https://windsor.ctvnews.ca/one-of-canada-s-most-wanted-fugitives-sought-after-erie-street-shots-fired-1.6947482,negative,0.012148059,0.6398712,0.3479808,-0.4092875137504919
CTV,2024-07-01,"Canada Day festivities attract hundreds at ceremonies, parties across the country",https://www.ctvnews.ca/canada/canada-day-festivities-attract-hundreds-at-ceremonies-parties-across-the-country-1.6947428,positive,0.9035936,0.0024309815,0.09397546,0.8164754503803273
CTV,2024-07-01,Skydiver injured after crashing at Canada Day performance,/video/c2950858-skydiver-crashes-in-canada-day-performance?playlistId=1.6947682,negative,0.010046197,0.77305853,0.21689516,-0.5975186616216526
CTV,2024-07-01,"Charges pending after 3-year-old Edmonton boy struck, killed by truck in marked crosswalk",https://edmonton.ctvnews.ca/charges-pending-after-3-year-old-edmonton-boy-struck-killed-by-truck-in-marked-crosswalk-1.6944426,negative,0.008348602,0.7171495,0.2745019,-0.5142337219918183
CTV,2024-07-01,"Police seek suspect, probe suspected hate crimes after two Toronto synagogues vandalized",https://toronto.ctvnews.ca/police-seek-suspect-probe-suspected-hate-crimes-after-two-toronto-synagogues-vandalized-1.6947134,negative,0.009377312,0.60707587,0.38354683,-0.3684531782121212
CTV,2024-07-01,"Eight 'tow truck-related' shootings in Toronto, no injuries reported: police",https://toronto.ctvnews.ca/eight-tow-truck-related-shootings-in-toronto-no-injuries-reported-police-1.6947268,neutral,0.01870898,0.22319762,0.75809336,-0.0494671628268506
CTV,2024-07-01,"Time crunch, rules mess could plague a Liberal leadership race",https://www.ctvnews.ca/politics/time-crunch-rules-mess-could-plague-a-liberal-leadership-race-1.6946503,negative,0.009857121,0.7575715,0.23257136,-0.5738174427451384
CTV,2024-07-01,Underwater gardeners work to restore B.C.'s majestic kelp forests,https://bc.ctvnews.ca/underwater-gardeners-work-to-restore-b-c-s-majestic-kelp-forests-1.6947397,positive,0.44331905,0.008122274,0.54855865,0.1964658240477295
CTV,2024-07-01,"Nearly 1,300 Quebec families still looking for a home on Moving Day",https://montreal.ctvnews.ca/nearly-1-300-quebec-families-still-looking-for-a-home-on-moving-day-1.6947473,neutral,0.049086947,0.096477084,0.85443586,-0.006898304465002392
CTV,2024-07-01,Cyclist dies after crash on Lauzon Road,https://windsor.ctvnews.ca/cyclist-dies-after-crash-on-lauzon-road-1.6947391,negative,0.016724145,0.5934016,0.38987425,-0.35184575673732965
CTV,2024-07-01,"Canada Day festivities underway in region, fireworks to come",https://london.ctvnews.ca/canada-day-festivities-underway-in-region-fireworks-to-come-1.6947534,positive,0.51418924,0.0038675913,0.48194313,0.26437565028879817
CTV,2024-07-01,Cup Noodles wants to rethink the way you eat ramen with new s'mores flavour,https://www.ctvnews.ca/lifestyle/cup-noodles-wants-to-rethink-the-way-you-eat-ramen-with-new-s-mores-flavour-1.6947285,negative,0.0719076,0.26592377,0.6621686,-0.06554474620433126
CTV,2024-07-01,"Man stabbed in Kelowna, suspect at large: RCMP",https://bc.ctvnews.ca/man-stabbed-in-kelowna-suspect-at-large-rcmp-1.6938918,negative,0.015369684,0.29978237,0.68484807,-0.0896332056254181
CTV,2024-07-01,Canada Day celebrations in Waterloo Region,https://kitchener.ctvnews.ca/canada-day-celebrations-in-waterloo-region-1.6947666,positive,0.45714563,0.0031119322,0.53974247,0.20897243059735615
CTV,2024-07-01,Grass fire caused by pipeline explosion blocks west-central Alberta highway,https://edmonton.ctvnews.ca/grass-fire-caused-by-pipeline-explosion-blocks-west-central-alberta-highway-1.6947693,negative,0.008253569,0.7652909,0.22645551,-0.585602064570228
CTV,2024-07-01,Northern Ont. teen facing impaired driving charges,https://northernontario.ctvnews.ca/northern-ont-teen-facing-impaired-driving-charges-1.6947160,negative,0.0101046795,0.624605,0.36529028,-0.39002933859858757
CTV,2024-07-01,This smiling robot has a face covered in 'living' skin,https://www.ctvnews.ca/sci-tech/this-smiling-robot-has-a-face-covered-in-living-skin-1.6947537,negative,0.11627344,0.36581877,0.5179078,-0.12030386034759033
CTV,2024-07-01,"NDP MP pays back some of the $17,000 her Christmas trip cost taxpayers",https://winnipeg.ctvnews.ca/ndp-mp-pays-back-some-of-the-17-000-her-christmas-trip-cost-taxpayers-1.6946401,negative,0.07122511,0.24202326,0.6867516,-0.05350224735469311
CTV,2024-07-01,Several WestJet flights still cancelled at Vancouver airport after strike ends,https://bc.ctvnews.ca/several-westjet-flights-still-cancelled-at-vancouver-airport-after-strike-ends-1.6947500,negative,0.009505064,0.51936,0.4711349,-0.26964446888749194
CTV,2024-07-01,Supreme Court rules Trump has immunity for 'official acts',/video/c2950461-u-s--supreme-court-rules-trump-has-some-immunity,neutral,0.05711737,0.061526593,0.88135606,-0.0005231276811468177
CTV,2024-07-01,Regina police renew call to find suspect in armed assault investigation,https://regina.ctvnews.ca/regina-police-renew-call-to-find-suspect-in-armed-assault-investigation-1.6947186,negative,0.013667675,0.304822,0.68151027,-0.09272966246452441
CTV,2024-07-01,3 charged in Alta. auto theft ring connected to organized crime,https://edmonton.ctvnews.ca/3-charged-in-alta-auto-theft-ring-connected-to-organized-crime-1.6943355,negative,0.018738417,0.50979704,0.4714645,-0.25954190486978135
CTV,2024-07-01,What you need to know about Canada Day fireworks in Edmonton,https://edmonton.ctvnews.ca/what-you-need-to-know-about-canada-day-fireworks-in-edmonton-1.6947077,neutral,0.14437714,0.024116442,0.83150643,0.020263154639390102
CTV,2024-07-01,Montreal Canadiens sign Juraj Slafkovsky to eight-year contract extension,https://montreal.ctvnews.ca/montreal-canadiens-sign-juraj-slafkovsky-to-eight-year-contract-extension-1.6947621,neutral,0.11180981,0.0120687345,0.8761214,0.012355785040040423
CTV,2024-07-01,'Hanging on for her life': Sask. family desperate to bring home sick niece from Philippines,https://saskatoon.ctvnews.ca/hanging-on-for-her-life-sask-family-desperate-to-bring-home-sick-niece-from-philippines-1.6943503,neutral,0.13387543,0.05480274,0.8113217,0.014919301518260042
CTV,2024-07-01,"Here’s how much more TransLink is charging for fares, effective Canada Day",https://bc.ctvnews.ca/here-s-how-much-more-translink-is-charging-for-fares-effective-canada-day-1.6947647,neutral,0.06777494,0.051952515,0.8802725,0.0018943788798755357
CTV,2024-07-01,"Deal reached in WestJet mechanics' strike, but travel disruptions still expected",https://www.ctvnews.ca/business/deal-reached-in-westjet-mechanics-strike-but-travel-disruptions-still-expected-1.6947258,neutral,0.03475806,0.20673144,0.75851035,-0.04152979053052519
CTV,2024-07-01,LGBTQ2S+ newcomers celebrate first Pride in Canada,https://toronto.ctvnews.ca/lgbtq2s-newcomers-celebrate-first-pride-in-canada-1.6946214,positive,0.8375283,0.0032153146,0.1592564,0.7014432955732026
CTV,2024-07-01,"WestJet mechanics strike ends, travellers in Sask. still experiencing disruptions",https://regina.ctvnews.ca/westjet-mechanics-strike-ends-travellers-in-sask-still-experiencing-disruptions-1.6947502,negative,0.010186404,0.5456847,0.4441288,-0.2976680551081401
CTV,2024-07-01,"As police increasingly use facial recognition technology, calls grow for regulations",https://www.ctvnews.ca/politics/as-police-increasingly-use-facial-recognition-technology-calls-grow-for-regulations-1.6946865,neutral,0.08490711,0.07832748,0.8367654,0.0010740232277166584
CTV,2024-07-01,Tourists expected to hit the road this Canada Day,https://calgary.ctvnews.ca/tourists-expected-to-hit-the-road-this-canada-day-1.6946025,neutral,0.10658231,0.010835918,0.88258165,0.011242383077564977
CTV,2024-07-01,'A disaster': Passengers sleep at Vancouver International Airport after WestJet flights cancelled,https://bc.ctvnews.ca/a-disaster-passengers-sleep-at-vancouver-international-airport-after-westjet-flights-cancelled-1.6947169,negative,0.0064730076,0.851364,0.14216298,-0.7247787888556552
CTV,2024-07-01,American Express is taking control of restaurant reservations,https://www.ctvnews.ca/business/american-express-is-taking-control-of-restaurant-reservations-1.6947287,neutral,0.047501788,0.21447466,0.7380236,-0.04374295633233771
CTV,2024-07-01,Eddie Murphy is still stung by that David Spade joke on 'Saturday Night Live',https://www.ctvnews.ca/entertainment/eddie-murphy-is-still-stung-by-that-david-spade-joke-on-saturday-night-live-1.6947525,negative,0.024241658,0.56727695,0.4084814,-0.32121546776057386
CTV,2024-07-01,Canada Day event in Cape Breton sees large crowd despite weather,https://atlantic.ctvnews.ca/canada-day-event-in-cape-breton-sees-large-crowd-despite-weather-1.6947608,positive,0.650961,0.0033941164,0.34564477,0.4237387569843456
CTV,2024-07-01,The small French town where Newfoundlanders were heroes,https://www.ctvnews.ca/canada/the-small-french-town-where-newfoundlanders-were-heroes-1.6945921,positive,0.35336712,0.01929513,0.6273378,0.12449599970925362
CTV,2024-07-01,In his own words: Prime Minister Justin Trudeau's message on Canada Day,https://www.ctvnews.ca/politics/in-his-own-words-prime-minister-justin-trudeau-s-message-on-canada-day-1.6947334,neutral,0.130494,0.0063689677,0.86313707,0.01698811623845664
CTV,2024-07-01,You might live to be 100 years old. But will you be able to afford it?,https://www.ctvnews.ca/lifestyle/you-might-live-to-be-100-years-old-but-will-you-be-able-to-afford-it-1.6942996,neutral,0.08425009,0.17453204,0.74121785,-0.023363356577409178
CTV,2024-07-01,Ottawa Celebrated Canada Day 2024: 'You get to just love the country that you live in',https://ottawa.ctvnews.ca/ottawa-celebrated-canada-day-2024-you-get-to-just-love-the-country-that-you-live-in-1.6947671,positive,0.96993095,0.0023394076,0.027729716,0.9407604858091476
CTV,2024-07-01,Update on Calgary indoor water-use measures expected Tuesday as stabilization work continues,https://calgary.ctvnews.ca/update-on-calgary-indoor-water-use-measures-expected-tuesday-as-stabilization-work-continues-1.6947372,neutral,0.039738614,0.015852112,0.94440925,0.0013278685203559348
CTV,2024-07-01,Sunday storm causes flash flooding in N.W. Calgary neighbourhood,https://calgary.ctvnews.ca/sunday-storm-causes-flash-flooding-in-n-w-calgary-neighbourhood-1.6947433,negative,0.017050192,0.48329884,0.49965087,-0.23328709908478729
CTV,2024-07-01,"World's largest hockey stick in B.C. to be chopped up, sold to collectors",https://bc.ctvnews.ca/world-s-largest-hockey-stick-in-b-c-to-be-chopped-up-sold-to-collectors-1.6944032,negative,0.054413807,0.23495471,0.7106315,-0.05224285254553429
CTV,2024-07-01,Ronaldo leads Portugal to dramatic win over Slovenia in Euro 2024 shootout,https://www.ctvnews.ca/sports/ronaldo-leads-portugal-to-dramatic-win-over-slovenia-in-euro-2024-shootout-1.6947694,positive,0.8231123,0.0031262191,0.17376152,0.6775040756037711
CTV,2024-07-01,Canada Day weather forecast and fireworks celebrations,https://www.ctvnews.ca/climate-and-environment/canada-day-weather-forecast-and-fireworks-celebrations-1.6947015,neutral,0.18842693,0.01387616,0.7976969,0.03531216424160277
CTV,2024-07-01,Police still investigating cause after woman found dead in Kelowna park,https://bc.ctvnews.ca/police-still-investigating-cause-after-woman-found-dead-in-kelowna-park-1.6937902,negative,0.011651847,0.44828284,0.54006535,-0.20082172425051503
CTV,2024-07-01,Pedestrian dead after being struck by train in Moncton,https://atlantic.ctvnews.ca/pedestrian-dead-after-being-struck-by-train-in-moncton-1.6947295,negative,0.014338223,0.6807255,0.30493626,-0.46318166263531424
CTV,2024-07-01,'A lot of work': Raymond Stampede ready to kick off in new location,https://calgary.ctvnews.ca/a-lot-of-work-raymond-stampede-ready-to-kick-off-in-new-location-1.6944008,neutral,0.07039962,0.08231457,0.8472858,-0.0018195825204623262
CTV,2024-07-01,"WestJet reaches deal to end strike, but passengers in London still stranded",https://london.ctvnews.ca/westjet-reaches-deal-to-end-strike-but-passengers-in-london-still-stranded-1.6947423,negative,0.014140694,0.47568825,0.5101711,-0.22607932334073766
CTV,2024-07-01,An unknown Newfoundland soldier killed in the First World War is being laid to rest,https://www.ctvnews.ca/canada/an-unknown-newfoundland-soldier-killed-in-the-first-world-war-is-being-laid-to-rest-1.6946764,negative,0.008786101,0.73565304,0.25556085,-0.5411082257917101
CTV,2024-07-01,Canada's story 'still being written': PM's Canada Day video,/video/c2950497-pm-trudeau-releases-canada-day-message?playlistId=1.6941682,neutral,0.078854665,0.008923359,0.91222215,0.006138419894176295
CTV,2024-07-01,This 12-year-old memorized the periodic table at age two. He's heading to NYU after finishing high school in just two years,https://www.ctvnews.ca/lifestyle/this-12-year-old-memorized-the-periodic-table-at-age-two-he-s-heading-to-nyu-after-finishing-high-school-in-just-two-years-1.6947518,positive,0.5311193,0.0050896113,0.46379104,0.28206180827355887
CTV,2024-07-01,"Three killed and two injured in shooting near University of Cincinnati campus, police say",https://www.ctvnews.ca/world/three-killed-and-two-injured-in-shooting-near-university-of-cincinnati-campus-police-say-1.6947614,negative,0.009259635,0.64049417,0.3502462,-0.41014703803725183
CTV,2024-07-01,Buying a car? Why you may have to pay more at some dealers if you use cash,https://toronto.ctvnews.ca/buying-a-car-why-you-may-have-to-pay-more-at-some-dealers-if-you-use-cash-1.6944225,negative,0.026680103,0.32203546,0.65128446,-0.10299500139679907
