source,date,headline,url,chosen_label,positive,negative,neutral,compound
Global,2024-03-04,Saskatoon services on hold as city faces a wall of snow,https://globalnews.ca/news/10333176/saskatoon-services-on-hold-city-wall-of-snow/,negative,0.015863642,0.51572293,0.4684134,-0.2657184853593755
Global,2024-03-04,Hundreds of Torontonians rally against Ontario Science Centre move,https://globalnews.ca/video/10332722/hundreds-of-torontonians-rally-against-ontario-science-centre-move/,negative,0.02890992,0.40212113,0.5689689,-0.16086563917522056
Global,2024-03-04,Upstate NY man gets 25 years to life for killing woman in car mistakenly in his driveway,https://globalnews.ca/video/10332763/upstate-ny-man-gets-25-years-to-life-for-killing-woman-in-car-mistakenly-in-his-driveway/,negative,0.010929011,0.75915724,0.22991371,-0.5762003174469328
Global,2024-03-04,Nunavut kids in care: Who is watching the children?,https://globalnews.ca/video/10328453/how-grassy-narrows-is-fighting-to-keep-its-kids-out-of-the-child-welfare-system/,neutral,0.018571,0.0782707,0.90315837,-0.005781416747998813
Global,2024-03-04,Repairs underway in Vancouver’s Gastown ahead of car-free street pilot,https://globalnews.ca/video/10332781/repairs-underway-in-vancouvers-gastown-ahead-of-car-free-street-pilot/,neutral,0.091204815,0.010251461,0.8985438,0.008213221503960977
Global,2024-03-04,Haunting ‘knocking’ sound from Titan sub heard for 1st time in new documentary,https://globalnews.ca/news/10325697/knocking-sound-titan-submersible-search-audio-documentary/,neutral,0.028681247,0.13223745,0.8390812,-0.01666413669853295
Global,2024-03-04,Global National: March 3,https://globalnews.ca/video/10332787/global-national-march-3/,neutral,0.06755703,0.011237722,0.9212054,0.0044376572295603545
Global,2024-03-04,"Canadian man facing rape charge in Bahamas, family says victim has Alzheimer’s",https://globalnews.ca/news/10326229/bahamas-canadian-sexual-assault-charge/,negative,0.006741923,0.73196316,0.26129493,-0.5357245887811448
Global,2024-03-04,Will Canada’s ‘wild’ winter continue into spring? Here’s what to expect,https://globalnews.ca/news/10326667/canada-spring-2024-forecast/,neutral,0.042747714,0.027817342,0.92943484,0.0010535640932933799
Global,2024-03-04,Trump eligible for Colorado ballot in 2024 U.S. election case: Supreme Court,https://globalnews.ca/news/10333282/donald-trump-supreme-court-colorado-case/,neutral,0.13190235,0.0074917176,0.86060584,0.017342116709339273
Global,2024-03-04,"Saskatchewan’s McEwen, Alberta’s Bottcher, Manitoba’s Carruthers out front at 2024 Brier",https://globalnews.ca/news/10333374/mcewen-bottcher-carruthers-brier-curling/,neutral,0.04317878,0.0064155944,0.9504056,0.0018232481263318334
Global,2024-03-04,Israel-Hamas Ceasefire Talks,https://globalnews.ca/video/10333396/israel-hamas-ceasefire-talks/,neutral,0.062441163,0.11130885,0.8262499,-0.008490765727455774
Global,2024-03-04,Emergency crews respond to train derailment in St. Albert,https://globalnews.ca/news/10333462/saint-albert-alberta-train-derailment-march/,neutral,0.026391415,0.188134,0.7854745,-0.03469791183610216
Global,2024-03-04,Saskatchewan residents with low incomes worry about not getting carbon rebate,https://globalnews.ca/news/10333230/saskatchewan-residents-with-low-incomes-worry-about-not-getting-carbon-rebate/,negative,0.0154661685,0.55925167,0.42528224,-0.3125231916809952
Global,2024-03-04,Snow slows and closes services in Saskatoon,https://globalnews.ca/video/10333363/snow-slows-and-closes-services-in-saskatoon/,negative,0.023754535,0.6711026,0.3051428,-0.4498144573016951
Global,2024-03-04,"Saskatoon morning news rewind: Monday, March 4",https://globalnews.ca/news/10333335/saskatoon-snow-weather-ageing/,neutral,0.02118661,0.016721448,0.9620919,0.00016926573456998995
Global,2024-03-04,"‘When am I coming home?’: Vulnerable Nunavut kids face loneliness, despair as millions spent sending them south",https://globalnews.ca/news/10324434/indigenous-kids-nunavut-sent-south-childrens-aid/,negative,0.006918327,0.8514376,0.14164418,-0.7248980711293846
Global,2024-03-04,Haunting ‘knocking’ sound from Titan sub heard in trailer for ‘Minute by Minute: The Titan Sub Disaster’,https://globalnews.ca/video/10326453/haunting-knocking-sound-from-titan-sub-heard-in-trailer-for-minute-by-minute-the-titan-sub-disaster/,negative,0.028782547,0.271858,0.6993595,-0.0730783335870715
Global,2024-03-04,Ottawa to table 2024 budget on April 16. What can you expect?,https://globalnews.ca/news/10333520/budget-2024-april-16-announcement/,neutral,0.024618564,0.019892277,0.95548904,0.00021037157334147238
Global,2024-03-04,Concerns of measles vulnerability increase as cases are confirmed in Ontario and Quebec,https://globalnews.ca/video/10332838/concerns-of-measles-vulnerability-increase-as-cases-are-confirmed-in-ontario-and-quebec/,neutral,0.027752325,0.18672602,0.7855216,-0.034096419290108315
Global,2024-03-04,Man gets 25 years to life for killing woman in car mistakenly in his driveway,https://globalnews.ca/news/10329755/kaylin-gillis-murder-kevin-monahan-sentenced-wrong-driveway/,negative,0.00975821,0.8017177,0.18852405,-0.6426560568767448
Global,2024-03-04,Will Donald Trump face criminal charges before the 2024 presidential election?,https://globalnews.ca/video/10332842/will-donald-trump-face-criminal-charges-before-the-2024-presidential-election/,negative,0.01317295,0.41884983,0.5679772,-0.1752616619867453
Global,2024-03-04,Health minister ‘deeply concerned’ about rise of measles cases in Canada,https://globalnews.ca/news/10333370/measles-canada-mark-holland-deeply-concerned/,negative,0.021583145,0.25577602,0.7226408,-0.06495554638667578
Global,2024-03-04,‘Discriminating against the poor’: Woman at Halifax encampment site pushing back on eviction,https://globalnews.ca/news/10333394/halifax-tent-encampments-victoria-park-fencing-eviction/,negative,0.0065886197,0.68993783,0.3034737,-0.47597067688472805
Global,2024-03-04,Zelenskyy points to weapons delay from Western allies amid fatal Russian drone strike on Odesa,https://globalnews.ca/video/10332827/zelenskyy-points-to-weapons-delay-from-western-allies-amid-fatal-russian-drone-strike-on-odesa/,negative,0.010948711,0.48634952,0.5027017,-0.23641601250709954
Global,2024-03-04,"Ontario teenager runs faster indoor 400-metre race, but loses record due to technicality",https://globalnews.ca/video/10332844/ontario-teenager-runs-faster-indoor-400-metre-race-but-loses-record-due-to-technicality/,negative,0.027450765,0.27955592,0.6929933,-0.07739797334222587
Global,2024-03-04,Trudeau-Meloni AGO reception cancelled after Toronto protestors block venue,https://globalnews.ca/video/10332731/trudeau-meloni-ago-reception-cancelled-after-toronto-protestors-block-venue/,negative,0.010620819,0.5680513,0.4213278,-0.3225695028654254
Global,2024-03-04,Nova Scotia man facing sexual assault charges in Bahamas against senior with Alzheimer’s,https://globalnews.ca/video/10332837/nova-scotia-man-facing-sexual-assault-charges-in-bahamas-against-senior-with-alzheimers/,negative,0.009147201,0.6082243,0.38262847,-0.3698531120310289
Global,2024-03-04,U.S. Supreme Court could decide on barring Trump from 2024 ballot Monday,https://globalnews.ca/news/10332385/supreme-court-trump-ruling-2024-election/,neutral,0.033521406,0.08324975,0.8832287,-0.005806842115696487
Global,2024-03-04,Saskatoon met with nightmare commute after being bombarded with heavy snowfall,https://globalnews.ca/video/10332834/saskatoon-met-with-nightmare-commute-after-being-bombarded-with-heavy-snowfall/,negative,0.011930158,0.80975693,0.17831282,-0.6555640237440628
Global,2024-03-04,France holding historic vote on abortion rights,https://globalnews.ca/news/10333163/france-abortion-right-vote/,neutral,0.07833726,0.04089658,0.88076615,0.004464196294245326
Global,2024-03-04,Where do the Jets Stand in Winnipeg?,https://globalnews.ca/video/10333388/where-do-the-jets-stand-in-winnipeg/,neutral,0.024229502,0.013880598,0.96188986,0.0003943981470567737
Global,2024-03-04,"Bedford ferry to be added to Halifax Transit system by 2028, new terminal coming",https://globalnews.ca/news/10333107/bedford-ferry-halifax-transit/,positive,0.28966048,0.005484323,0.7048552,0.08387311807204867
CTV,2024-03-04,Malaysia may renew hunt for missing MH370 aircraft,/video/c2878174-search-may-resume-for-missing-airline,neutral,0.03632398,0.058264103,0.90541196,-0.002075273287986512
CTV,2024-03-04,'Quite an extraordinary figure': Former prime minister Joe Clark reflects on passing of Brian Mulroney,https://www.ctvnews.ca/politics/quite-an-extraordinary-figure-former-prime-minister-joe-clark-reflects-on-passing-of-brian-mulroney-1.6792366,positive,0.39803985,0.012677008,0.58928317,0.1582750021218171
CTV,2024-03-04,Saskatoon digs out following major winter storm,https://saskatoon.ctvnews.ca/saskatoon-digs-out-following-major-winter-storm-1.6793438,negative,0.016815215,0.5198756,0.4633093,-0.2699878125140458
CTV,2024-03-04,Quebec to allow gender-neutral markers on IDs,https://montreal.ctvnews.ca/quebec-to-allow-gender-neutral-markers-on-ids-1.6793298,neutral,0.12444364,0.024473483,0.85108286,0.01488727045538596
CTV,2024-03-04,Temperature in Toronto nears record-breaking territory with high of 13 C expected,https://toronto.ctvnews.ca/temperature-in-toronto-nears-record-breaking-territory-with-high-of-13-c-expected-1.6793286,positive,0.2538236,0.0095945075,0.7365818,0.06433439146366027
CTV,2024-03-04,Here's what to expect as MLAs return for the spring sitting of the Saskatchewan Legislature,https://regina.ctvnews.ca/here-s-what-to-expect-as-mlas-return-for-the-spring-sitting-of-the-saskatchewan-legislature-1.6793114,neutral,0.054922767,0.0075081475,0.93756914,0.0029601354046260298
CTV,2024-03-04,Sinead O'Connor's estate asks Donald Trump to stop playing her music at rallies,https://www.ctvnews.ca/entertainment/sinead-o-connor-s-estate-asks-donald-trump-to-stop-playing-her-music-at-rallies-1.6793465,negative,0.030262962,0.28538424,0.6843528,-0.08052831719931319
CTV,2024-03-04,Calgary's Nick Tetz wins Lethbridge PBR championship,https://calgary.ctvnews.ca/calgary-s-nick-tetz-wins-lethbridge-pbr-championship-1.6792965,neutral,0.1711502,0.004536256,0.82431364,0.029271795916599785
CTV,2024-03-04,Ex-Trump Organization CFO pleads guilty to perjury charges,https://www.ctvnews.ca/world/ex-trump-organization-cfo-pleads-guilty-to-perjury-charges-1.6793297,negative,0.023497704,0.5814935,0.39500886,-0.3375825117340696
CTV,2024-03-04,Fire leaves northwestern Ont. First Nation community without health care hub,https://northernontario.ctvnews.ca/fire-leaves-northwestern-ont-first-nation-community-without-health-care-hub-1.6793043,negative,0.008291481,0.7638906,0.22781776,-0.5834602381505238
CTV,2024-03-04,"'No working smoke alarms': Charges pending after dog dies in overnight fire in London, Ont.",https://london.ctvnews.ca/no-working-smoke-alarms-charges-pending-after-dog-dies-in-overnight-fire-in-london-ont-1.6792819,negative,0.0064463667,0.76483923,0.2287145,-0.5849374273745536
CTV,2024-03-04,N.S. SiRT investigating after man dies during arrest,https://atlantic.ctvnews.ca/more/n-s-sirt-investigating-after-man-dies-during-arrest-1.6793531,negative,0.012713784,0.5214628,0.46582332,-0.2717618548527412
CTV,2024-03-04,More Ontario drivers being told to install tracking devices – but at their own expense,https://toronto.ctvnews.ca/more-ontario-drivers-being-told-to-install-tracking-devices-but-at-their-own-expense-1.6790379,negative,0.014875734,0.6294966,0.3556277,-0.39604466875248256
CTV,2024-03-04,'It was swimming around me': Free-diver captures close encounter with orca,https://vancouverisland.ctvnews.ca/it-was-swimming-around-me-free-diver-captures-close-encounter-with-orca-1.6793534,neutral,0.11727168,0.013260847,0.8694674,0.013576806109351303
CTV,2024-03-04,'I want to get off the plane.' The passengers refusing to fly on Boeing's 737 Max,https://www.ctvnews.ca/business/i-want-to-get-off-the-plane-the-passengers-refusing-to-fly-on-boeing-s-737-max-1.6793736,negative,0.011713522,0.74159974,0.24668664,-0.5498330531031534
CTV,2024-03-04,Police warn farmers about series of thefts in the South Okanagan,https://bc.ctvnews.ca/police-warn-farmers-about-series-of-thefts-in-the-south-okanagan-1.6773985,negative,0.012738044,0.53723085,0.4500311,-0.2884547275100253
CTV,2024-03-04,"Driver passed out on northern Ont. highway, charged with impaired, drug trafficking",https://northernontario.ctvnews.ca/driver-passed-out-on-northern-ont-highway-charged-with-impaired-drug-trafficking-1.6793400,negative,0.009131853,0.7129393,0.27792883,-0.5081990861836516
CTV,2024-03-04,Federal byelection being held today in Ontario riding previously held by Erin O'Toole,https://www.ctvnews.ca/politics/federal-byelection-being-held-today-in-ontario-riding-previously-held-by-erin-o-toole-1.6793305,neutral,0.03693118,0.0074833664,0.9555855,0.001307910468867135
CTV,2024-03-04,Police north of Toronto issue warning about 'Chinese police extortion scam',https://toronto.ctvnews.ca/police-north-of-toronto-issue-warning-about-chinese-police-extortion-scam-1.6793558,negative,0.01208374,0.5614535,0.42646262,-0.31508408817390254
CTV,2024-03-04,Driver charged after transport truck crash on Highway 401,https://windsor.ctvnews.ca/driver-charged-after-transport-truck-crash-on-highway-401-1.6793725,negative,0.015264284,0.4556733,0.5290624,-0.2074051779811903
CTV,2024-03-04,Oji-Cree singer Aysanabee shares stories of family and love in billboard-breaking music,https://www.ctvnews.ca/entertainment/oji-cree-singer-aysanabee-shares-stories-of-family-and-love-in-billboard-breaking-music-1.6791638,positive,0.5386954,0.0037475186,0.4575571,0.29017866871642184
CTV,2024-03-04,Major grocers expanding discount footprint as customers keep budgets tight,https://www.ctvnews.ca/business/major-grocers-expanding-discount-footprint-as-customers-keep-budgets-tight-1.6792684,neutral,0.1174495,0.097927414,0.7846231,0.004204606582569603
CTV,2024-03-04,Supreme Court rejects sexual assault appeal from Newfoundland police officer,https://www.ctvnews.ca/canada/supreme-court-rejects-sexual-assault-appeal-from-newfoundland-police-officer-1.6789654,negative,0.0113693485,0.62486947,0.36376122,-0.39033256897614876
CTV,2024-03-04,Trial delayed for Chatham man charged in fatal accident during 2022 RetroFest,https://windsor.ctvnews.ca/trial-delayed-for-chatham-man-charged-in-fatal-accident-during-2022-retrofest-1.6793679,negative,0.00896926,0.5689877,0.42204303,-0.32366658626677847
CTV,2024-03-04,These top surfers are going to the Olympics after winning the final qualifier,https://www.ctvnews.ca/sports/these-top-surfers-are-going-to-the-olympics-after-winning-the-final-qualifier-1.6793156,positive,0.7167316,0.0073507465,0.2759177,0.5136501220805911
CTV,2024-03-04,Quebec parents want son's mysterious death in Punta Cana investigated fully,https://montreal.ctvnews.ca/quebec-parents-want-son-s-mysterious-death-in-punta-cana-investigated-fully-1.6793070,neutral,0.021980993,0.1882592,0.78975976,-0.0349583722721043
CTV,2024-03-04,Apple hit with $2B fine for breaking competition laws,/video/c2878173-eu-slaps-apple-with--2b-fine,negative,0.01639232,0.7337924,0.2498152,-0.5381826340514095
CTV,2024-03-04,Shovelling brigade: Volunteers coming together to help stranded N.L. seniors,https://www.ctvnews.ca/canada/shovelling-brigade-volunteers-coming-together-to-help-stranded-n-l-seniors-1.6779545,neutral,0.19874671,0.012137815,0.7891155,0.03935292579724692
CTV,2024-03-04,New Zealand man reaches Vancouver on cross-Canada run inspired by Terry Fox,https://bc.ctvnews.ca/new-zealand-man-reaches-vancouver-on-cross-canada-run-inspired-by-terry-fox-1.6790392,neutral,0.13980341,0.0048742495,0.8553225,0.01952121697596887
CTV,2024-03-04,Poll says 7 in 10 Canadians are against carbon tax hike on April 1,https://calgary.ctvnews.ca/poll-says-7-in-10-canadians-are-against-carbon-tax-hike-on-april-1-1.6793517,negative,0.0271664,0.2570288,0.71580476,-0.06532579863806731
CTV,2024-03-04,"Toronto cop handed temporary demotion after 'harassing' domestic violence victim, dispute with tenant: tribunal",https://toronto.ctvnews.ca/toronto-cop-handed-temporary-demotion-after-harassing-domestic-violence-victim-dispute-with-tenant-tribunal-1.6793733,negative,0.005732148,0.7412187,0.25304908,-0.5493723711171192
CTV,2024-03-04,Terrorism charges laid against man in Edmonton City Hall shooting,https://edmonton.ctvnews.ca/terrorism-charges-laid-against-man-in-edmonton-city-hall-shooting-1.6793642,negative,0.008041611,0.7279299,0.2640285,-0.5298172573259059
CTV,2024-03-04,Blue Jays pitcher Alek Manoah bumped from spring start due to right shoulder soreness,https://toronto.ctvnews.ca/blue-jays-pitcher-alek-manoah-bumped-from-spring-start-due-to-right-shoulder-soreness-1.6792507,neutral,0.014073353,0.17757624,0.8083503,-0.03133527519466739
CTV,2024-03-04,"'The thought was always to be here long-term': Canucks forward Elias Pettersson on his 8-year, $92.8M contract extension",https://bc.ctvnews.ca/the-thought-was-always-to-be-here-long-term-canucks-forward-elias-pettersson-on-his-8-year-92-8m-contract-extension-1.6792261,positive,0.2668044,0.0071006743,0.7260949,0.07113417451878767
CTV,2024-03-04,4 arrested for plotting terror attack against Brussels concert hall,https://www.ctvnews.ca/world/4-arrested-for-plotting-terror-attack-against-brussels-concert-hall-1.6793661,negative,0.007971729,0.7737401,0.21828817,-0.5986102254732426
CTV,2024-03-04,Car slams into side of home in east London,https://london.ctvnews.ca/car-slams-into-side-of-home-in-east-london-1.6793239,negative,0.023717007,0.6268362,0.34944686,-0.39236108401041925
CTV,2024-03-04,Calgary Zoo’s lifelong peacock 17-year-old Norman passes away,https://calgary.ctvnews.ca/calgary-zoo-s-lifelong-peacock-17-year-old-norman-passes-away-1.6792421,neutral,0.07553371,0.087458916,0.83700734,-0.0019437209349435491
CTV,2024-03-04,Father of Kelowna crane collapse victim calls for better safety standards,https://bc.ctvnews.ca/father-of-kelowna-crane-collapse-victim-calls-for-better-safety-standards-1.6778328,negative,0.051164534,0.26857722,0.6802583,-0.06951590566434618
CTV,2024-03-04,Supreme Court rules Trump can stay on Colorado ballot,/video/c2878129-trump-can-stay-on-colorado-ballot--supreme-court?playlistId=1.6758095,neutral,0.09120984,0.022750007,0.88604015,0.007801672015469219
CTV,2024-03-04,Ontario woman charged with coordinating sexual exploitation of child: police,https://toronto.ctvnews.ca/ontario-woman-charged-with-coordinating-sexual-exploitation-of-child-police-1.6793750,negative,0.0067945765,0.78830546,0.2049,-0.6213793109858177
CTV,2024-03-04,OPP issue reminder to stay off Lake Simcoe ice,https://barrie.ctvnews.ca/opp-issue-reminder-to-stay-off-lake-simcoe-ice-1.6792390,neutral,0.042085193,0.20101237,0.7569024,-0.03863481471848296
CTV,2024-03-04,Huge interest in northern Ont. town's $10 land sale program as it nears launch,https://northernontario.ctvnews.ca/huge-interest-in-northern-ont-town-s-10-land-sale-program-as-it-nears-launch-1.6791179,positive,0.4676353,0.005001786,0.527363,0.2186577181004612
CTV,2024-03-04,UW researchers develop new technique to detect fentanyl in blood samples,https://kitchener.ctvnews.ca/uw-researchers-develop-new-technique-to-detect-fentanyl-in-blood-samples-1.6792796,neutral,0.06810721,0.034734506,0.89715827,0.0034321067709988107
CTV,2024-03-04,SIU investigating weekend crash near St. Thomas,https://london.ctvnews.ca/siu-investigating-weekend-crash-near-st-thomas-1.6793567,negative,0.017833013,0.25332215,0.7288449,-0.06385408710074714
CTV,2024-03-04,"Northern Ont. man charged for child sex offences, luring",https://northernontario.ctvnews.ca/northern-ont-man-charged-for-child-sex-offences-luring-1.6793648,negative,0.009517001,0.73567975,0.25480312,-0.5411342012045175
CTV,2024-03-04,"8 lost skiers helped by search-and-rescue crews near Whistler, B.C., over the weekend",https://bc.ctvnews.ca/8-lost-skiers-helped-by-search-and-rescue-crews-near-whistler-b-c-over-the-weekend-1.6793719,neutral,0.06673385,0.06634057,0.86692554,5.233537777149522e-05
CTV,2024-03-04,"Lethbridge parents charged in November, 2023 assault of 3-week-old baby",https://calgary.ctvnews.ca/lethbridge-parents-charged-in-november-2023-assault-of-3-week-old-baby-1.6792494,negative,0.0076183034,0.73059726,0.2617843,-0.5337144219477459
CTV,2024-03-04,Your company probably knows you're reading this story at work,https://www.ctvnews.ca/business/your-company-probably-knows-you-re-reading-this-story-at-work-1.6793372,neutral,0.08035457,0.15606344,0.763582,-0.01789893937677789
CTV,2024-03-04,Extreme cold warnings plague provinces across Canada,https://www.ctvnews.ca/climate-and-environment/extreme-cold-warnings-plague-provinces-across-canada-1.6793655,negative,0.015048214,0.7910068,0.19394492,-0.6254653725172199
CTV,2024-03-04,Complaints filed with privacy commissioner over facial recognition vending machines,https://kitchener.ctvnews.ca/complaints-filed-with-privacy-commissioner-over-facial-recognition-vending-machines-1.6790047,negative,0.021902157,0.29697126,0.68112665,-0.0877122098524481
CTV,2024-03-04,Thief breaks into 6 vehicles by smashing windows in Barrie carpool lot,https://barrie.ctvnews.ca/thief-breaks-into-6-vehicles-by-smashing-windows-in-barrie-carpool-lot-1.6793610,negative,0.012327772,0.7360532,0.25161916,-0.5416222511812165
CTV,2024-03-04,Arrest after victim hit in the face with bowling ball,https://kitchener.ctvnews.ca/arrest-after-victim-hit-in-the-face-with-bowling-ball-1.6793565,negative,0.0147211915,0.6581784,0.32710055,-0.4329819817950309
CTV,2024-03-04,Bank of Canada expected to hold interest rates this week as grey cloud hangs over economy,https://www.ctvnews.ca/business/bank-of-canada-expected-to-hold-interest-rates-this-week-as-grey-cloud-hangs-over-economy-1.6793251,neutral,0.045138698,0.06473012,0.89013106,-0.002152489127767998
CTV,2024-03-04,"Added fees may offset deals on low-cost Canadian airlines, analysts warn",https://ottawa.ctvnews.ca/added-fees-may-offset-deals-on-low-cost-canadian-airlines-analysts-warn-1.6792288,negative,0.02268364,0.27857232,0.6987441,-0.0770879671257152
CTV,2024-03-04,Toronto man shocked by package delivered to his mailbox,https://toronto.ctvnews.ca/toronto-man-shocked-by-package-delivered-to-his-mailbox-1.6793715,negative,0.0838398,0.25270015,0.6634601,-0.05682824806043918
CTV,2024-03-04,"Schools closed around Manitoba due to icy roads, poor visibility",https://winnipeg.ctvnews.ca/schools-closed-around-manitoba-due-to-icy-roads-poor-visibility-1.6793292,negative,0.008313956,0.8160822,0.17560384,-0.6659210260174397
CTV,2024-03-04,Government contracting process 'absolutely not' giving value for money: Botler whistleblowers,https://www.ctvnews.ca/politics/government-contracting-process-absolutely-not-giving-value-for-money-botler-whistleblowers-1.6792509,negative,0.010368592,0.80495834,0.18467306,-0.6478504390529416
CTV,2024-03-04,U.S. driver saved from truck dangling off bridge,/video/c2877810-u-s--man-rescued-from-dangling-truck,neutral,0.10772419,0.046035316,0.84624046,0.009485252822742263
CTV,2024-03-04,"Inaccurate data on forest fuels may stoke B.C. wildfires, study finds",https://bc.ctvnews.ca/inaccurate-data-on-forest-fuels-may-stoke-b-c-wildfires-study-finds-1.6792792,negative,0.00842879,0.629557,0.3620142,-0.39627096987846855
CTV,2024-03-04,Quebec mom says Air Canada bungled her family vacation because they overbooked the flight,https://montreal.ctvnews.ca/quebec-mom-says-air-canada-bungled-her-family-vacation-because-they-overbooked-the-flight-1.6792695,negative,0.008384331,0.7643998,0.22721574,-0.5842368651130325
CTV,2024-03-04,Suspects wanted for attempted break-in at former jail,https://kitchener.ctvnews.ca/suspects-wanted-for-attempted-break-in-at-former-jail-1.6793497,negative,0.014972479,0.45471463,0.5303129,-0.20654121606347786
CTV,2024-03-04,Quebec holds public health update on measles,https://montreal.ctvnews.ca/quebec-holds-public-health-update-on-measles-1.6793557,neutral,0.03307571,0.023747982,0.9431764,0.0005300351010839588
CTV,2024-03-04,Royal conspiracy theories take the Internet by storm,/video/c2878105-royal-conspiracy-theories-take-internet-by-storm?playlistId=1.6785214,negative,0.08506536,0.44857165,0.46636292,-0.19398043250580965
CTV,2024-03-04,Saskatchewan low-income residents 'a little screwed' by loss of carbon rebate,https://saskatoon.ctvnews.ca/saskatchewan-low-income-residents-a-little-screwed-by-loss-of-carbon-rebate-1.6793687,negative,0.010345953,0.6762581,0.31339592,-0.4572180017503058
CTV,2024-03-04,Canada sanctions more Russians over Navalny death,https://www.ctvnews.ca/politics/canada-sanctions-more-russians-over-navalny-death-1.6792894,negative,0.010190251,0.63606143,0.3537483,-0.40447032019305595
CTV,2024-03-04,Arrest made after man found dead inside southeast Manitoba home,https://winnipeg.ctvnews.ca/arrest-made-after-man-found-dead-inside-southeast-manitoba-home-1.6793712,negative,0.020451646,0.2523707,0.7271776,-0.0632727031973701
CTV,2024-03-04,"The Body Shop Canada parent took revenue, left company $3.3M in debt: court docs",https://www.ctvnews.ca/business/the-body-shop-canada-parent-took-revenue-left-company-3-3m-in-debt-court-docs-1.6793493,negative,0.01265027,0.5135073,0.47384238,-0.2635297548999205
CTV,2024-03-04,Windsor Police seek suspect after multiple thefts,https://windsor.ctvnews.ca/windsor-police-seek-suspect-after-multiple-thefts-1.6793529,negative,0.029679557,0.23588644,0.73443395,-0.05476154892595453
CTV,2024-03-04,"Reception for Trudeau, Italian PM cancelled after pro-Palestinian demonstrators blocked entrances",https://www.ctvnews.ca/politics/reception-for-trudeau-italian-pm-cancelled-after-pro-palestinian-demonstrators-blocked-entrances-1.6792416,negative,0.0098306835,0.5295827,0.46058676,-0.2803611259636085
