source,date,headline,url,chosen_label,positive,negative,neutral,compound
CTV,2024-02-04,Many immigrants leaving Canada within years of arriving: StatCan,https://www.ctvnews.ca/canada/many-immigrants-leaving-canada-within-years-of-arriving-statcan-1.6753003,neutral,0.025324052,0.135829,0.838847,-0.017808205862558157
CTV,2024-02-04,Tesla ordered to pay US$1.5 million over alleged hazardous waste violations in California,https://www.ctvnews.ca/business/tesla-ordered-to-pay-us-1-5-million-over-alleged-hazardous-waste-violations-in-california-1.6754141,negative,0.01758411,0.60113597,0.38128,-0.36105521857629697
CTV,2024-02-04,Lunar New Year celebration aims to bridge a gap in the Greater Moncton Area,https://atlantic.ctvnews.ca/lunar-new-year-celebration-aims-to-bridge-a-gap-in-the-greater-moncton-area-1.6755424,positive,0.60119057,0.0042458433,0.39456344,0.3614121776441692
CTV,2024-02-04,Bond denied for suspect charged with murder after Georgia state trooper dies during chase,https://www.ctvnews.ca/world/bond-denied-for-suspect-charged-with-murder-after-georgia-state-trooper-dies-during-chase-1.6755345,negative,0.006977051,0.7620176,0.23100545,-0.5806220993412916
CTV,2024-02-04,Man charged after Winnipeg bus driver assaulted,https://winnipeg.ctvnews.ca/man-charged-after-winnipeg-bus-driver-assaulted-1.6755306,negative,0.0097355945,0.7582089,0.23205549,-0.574785954904506
CTV,2024-02-04,WARNING: Targeted daytime shooting in B.C. caught on camera,/video/c2860310-content-warning--surrey-shooting-caught-on-camera,negative,0.013745437,0.42391813,0.56233644,-0.17951764249153257
CTV,2024-02-04,"B.C. senior wins right to sell home she paid $3.4M to build, despite objections of co-owners who paid just $115K",https://bc.ctvnews.ca/b-c-senior-wins-right-to-sell-home-she-paid-3-4m-to-build-despite-objections-of-co-owners-who-paid-just-115k-1.6745383,neutral,0.112835124,0.038765464,0.8483994,0.011229005433680328
CTV,2024-02-04,"AI brings deepfake pornography to the masses, as Canadian laws play catch-up",https://bc.ctvnews.ca/ai-brings-deepfake-pornography-to-the-masses-as-canadian-laws-play-catch-up-1.6754498,negative,0.057663452,0.39721107,0.5451254,-0.15445158581164264
CTV,2024-02-04,How to experience April’s 'once-in-a-lifetime' eclipse,https://kitchener.ctvnews.ca/how-to-experience-april-s-once-in-a-lifetime-eclipse-1.6755324,neutral,0.20083836,0.012898342,0.7862633,0.040169681331458484
CTV,2024-02-04,"Biden sets his sights on Nevada's primary, with November also high on his mind",https://www.ctvnews.ca/world/biden-sets-his-sights-on-nevada-s-primary-with-november-also-high-on-his-mind-1.6755115,positive,0.2297905,0.0038295821,0.7663797,0.05278905249110011
CTV,2024-02-04,Toronto to host Canada's first 2026 FIFA World Cup game,https://toronto.ctvnews.ca/toronto-to-host-canada-s-first-2026-fifa-world-cup-game-1.6755220,neutral,0.15163766,0.005938895,0.84242356,0.022958691536818066
CTV,2024-02-04,Montreal-born singer Allison Russell wins her first Grammy,https://montreal.ctvnews.ca/montreal-born-singer-allison-russell-wins-her-first-grammy-1.6755473,positive,0.6916973,0.0029081681,0.30539444,0.4784367582370308
CTV,2024-02-04,"West-end stabbing sends 1 to hospital, suspect in custody",https://windsor.ctvnews.ca/west-end-stabbing-sends-1-to-hospital-suspect-in-custody-1.6755266,negative,0.01749635,0.37780204,0.60470164,-0.14242825165510098
CTV,2024-02-04,Diplomatic tensions between Ecuador and Russia over military equipment threaten banana exports,https://www.ctvnews.ca/business/diplomatic-tensions-between-ecuador-and-russia-over-military-equipment-threaten-banana-exports-1.6755371,negative,0.0099273,0.47625065,0.513822,-0.2267161427559028
CTV,2024-02-04,Tactical officers arrest man in Kitchener,https://kitchener.ctvnews.ca/tactical-officers-arrest-man-in-kitchener-1.6755202,neutral,0.029293718,0.14978905,0.8209171,-0.021578650340501326
CTV,2024-02-04,Alta. premier creating a 'fake crisis' about gender: Notley,/video/c2860393-question-period--opposition-slams-alta--government?playlistId=1.6750850,negative,0.0107906675,0.60421276,0.38499647,-0.3649566931636521
CTV,2024-02-04,"Hundreds protest UCP's gender policies, call narrative 'misinformed, untrue and unjust'",https://edmonton.ctvnews.ca/hundreds-protest-ucp-s-gender-policies-call-narrative-misinformed-untrue-and-unjust-1.6754955,negative,0.005494325,0.8459624,0.14854342,-0.7156221035336507
CTV,2024-02-04,Edmontonians gather Sunday to call on Canada to uphold human rights in Gaza,https://edmonton.ctvnews.ca/edmontonians-gather-sunday-to-call-on-canada-to-uphold-human-rights-in-gaza-1.6755421,neutral,0.10920465,0.052889187,0.8379062,0.009128388426562717
CTV,2024-02-04,"More than 1,000 manufacturing jobs unfilled in London, Ont. area: CME",https://london.ctvnews.ca/more-than-1-000-manufacturing-jobs-unfilled-in-london-ont-area-cme-1.6755287,negative,0.028172662,0.2874536,0.68437374,-0.08183586801621345
CTV,2024-02-04,"Two dead, three more in hospital following a house fire in a remote First Nation community",https://northernontario.ctvnews.ca/two-dead-three-more-in-hospital-following-a-house-fire-in-a-remote-first-nation-community-1.6755261,negative,0.006572165,0.79569215,0.19773573,-0.6330827502502103
CTV,2024-02-04,Advocates say Canada needs to look at alternatives after 9th province decides to stop immigration detention in jails,https://www.ctvnews.ca/canada/advocates-say-canada-needs-to-look-at-alternatives-after-9th-province-decides-to-stop-immigration-detention-in-jails-1.6753808,neutral,0.03918948,0.07234731,0.8884632,-0.003698318607453732
CTV,2024-02-04,"Canada, Britain support U.S. in new attacks in Yemen",/video/c2860320-ctv-national-news--allies-join-u-s--in-attacks?playlistId=1.6754380,neutral,0.04569219,0.14821588,0.8060921,-0.019880154058320443
CTV,2024-02-04,Unique doggy dating service gives shelter dogs a chance to shine,https://www.ctvnews.ca/lifestyle/unique-doggy-dating-service-gives-shelter-dogs-a-chance-to-shine-1.6752954,positive,0.85219973,0.0029235596,0.14487654,0.7262359900920146
CTV,2024-02-04,"'Global concern': High stakes for Canada to have role in widening U.S.-Iran conflict, experts say",https://www.ctvnews.ca/politics/global-concern-high-stakes-for-canada-to-have-role-in-widening-u-s-iran-conflict-experts-say-1.6754630,neutral,0.024638208,0.17690635,0.7984554,-0.030688819060648242
CTV,2024-02-04,Big announcement coming about Olympic Stadium roof: reports,https://montreal.ctvnews.ca/big-announcement-coming-about-olympic-stadium-roof-reports-1.6755305,positive,0.4145131,0.003676462,0.58181036,0.17180762731182853
CTV,2024-02-04,Quebec going ahead with out-of-province tuition hikes despite advisory body concern,https://montreal.ctvnews.ca/quebec-going-ahead-with-out-of-province-tuition-hikes-despite-advisory-body-concern-1.6755346,neutral,0.018897526,0.1545181,0.82658434,-0.023518729770572122
CTV,2024-02-04,How a lost dog from the Saskatchewan countryside ended up in downtown Toronto,https://toronto.ctvnews.ca/how-a-lost-dog-from-the-saskatchewan-countryside-ended-up-in-downtown-toronto-1.6742039,negative,0.023886912,0.2984529,0.67766017,-0.08850355683216904
CTV,2024-02-04,Southern Manitoba curling club celebrates 50 years,https://winnipeg.ctvnews.ca/southern-manitoba-curling-club-celebrates-50-years-1.6748933,positive,0.758289,0.0035959645,0.23811509,0.5749892343877576
CTV,2024-02-04,Far-right Israel minister suggests that Trump would give more U.S. support to offensive in Gaza,https://www.ctvnews.ca/world/far-right-israel-minister-suggests-that-trump-would-give-more-u-s-support-to-offensive-in-gaza-1.6755179,negative,0.022912852,0.28205585,0.6950313,-0.07903050607590956
CTV,2024-02-04,Sask. Viterra workers say company pulled 'switcheroo' on negotiated wage increase,https://saskatoon.ctvnews.ca/sask-viterra-workers-say-company-pulled-switcheroo-on-negotiated-wage-increase-1.6755290,negative,0.034800492,0.24771146,0.717488,-0.0601499087246804
CTV,2024-02-04,Winnipeg police make impaired driving arrest after crash involving ambulance,https://winnipeg.ctvnews.ca/winnipeg-police-make-impaired-driving-arrest-after-crash-involving-ambulance-1.6755283,negative,0.012928877,0.60738397,0.37968716,-0.36874810844399697
CTV,2024-02-04,"Dozens of drivers facing hefty repair bills after filling up at Guelph, Ont. gas station",https://kitchener.ctvnews.ca/dozens-of-drivers-facing-hefty-repair-bills-after-filling-up-at-guelph-ont-gas-station-1.6750634,negative,0.011000891,0.7594719,0.22952724,-0.5766765375514638
CTV,2024-02-04,'Fewer and milder' tornadoes in Canada in 2023: Northern Tornadoes Project,https://london.ctvnews.ca/fewer-and-milder-tornadoes-in-canada-in-2023-northern-tornadoes-project-1.6754599,neutral,0.075071886,0.034880687,0.89004743,0.00441912565088165
CTV,2024-02-04,Cancellations and closures amid heavy snowfall in the Maritimes,https://atlantic.ctvnews.ca/cancellations-and-closures-amid-heavy-snowfall-in-the-maritimes-1.6754495,negative,0.01912283,0.42591897,0.5549582,-0.18104127095758216
CTV,2024-02-04,Five suspects sought after assault with wooden blunt objects in Barrie's downtown core,https://barrie.ctvnews.ca/five-suspects-sought-after-assault-with-wooden-blunt-objects-in-barrie-s-downtown-core-1.6755274,negative,0.009391819,0.71251386,0.27809426,-0.5075878206655737
CTV,2024-02-04,What are the stakes if the U.S. suspends aid to Ukraine?,/video/c2860390-question-period--u-s--stance-on-ukraine-russia-war?playlistId=1.6752197,negative,0.015208009,0.3135207,0.67127126,-0.09806395461191819
CTV,2024-02-04,Do hippos like snow? Calgary Zoo offers Sparky and Lobi a frosty treat during Sunday snowstorm,https://calgary.ctvnews.ca/do-hippos-like-snow-calgary-zoo-offers-sparky-and-lobi-a-frosty-treat-during-sunday-snowstorm-1.6755453,positive,0.51650715,0.0062648496,0.4772279,0.2667404317830435
CTV,2024-02-04,"It's called 'cozy cardio.' In a world seeking comfort, some seek a happier mode of exercise",https://www.ctvnews.ca/lifestyle/it-s-called-cozy-cardio-in-a-world-seeking-comfort-some-seek-a-happier-mode-of-exercise-1.6751359,positive,0.4858829,0.019071879,0.49504519,0.2357184778090442
CTV,2024-02-04,Simcoe Muskoka District Health Unit warns of potent tranquillizer in street drugs,https://barrie.ctvnews.ca/simcoe-muskoka-district-health-unit-warns-of-potent-tranquillizer-in-street-drugs-1.6755451,negative,0.014720791,0.48302323,0.5022559,-0.23309476314054223
CTV,2024-02-04,"Heavy snowfall continues in the Maritimes; delays, closures and cancellations piling up",https://atlantic.ctvnews.ca/heavy-snowfall-continues-in-the-maritimes-delays-closures-and-cancellations-piling-up-1.6755172,negative,0.012707651,0.7267778,0.2605144,-0.5280445809302687
CBC,2024-02-04,The 2024 Grammys: Montreal's Allison Russell wins during pre-ceremony,https://www.cbc.ca/news/entertainment/grammy-awards-2024-1.7104707,positive,0.2812725,0.0036593012,0.7150683,0.07910080432479738
CBC,2024-02-04,Argylle is as good as taking your phone out in the theatre,https://www.cbc.ca/news/entertainment/argylle-movie-review-1.7102399,positive,0.6083776,0.04569535,0.3459271,0.36803519172296184
CBC,2024-02-04,WATCH: CBC News Network,https://www.cbc.cahttps://gem.cbc.ca/live,neutral,0.10073908,0.018231502,0.88102955,0.00981596340483426
CBC,2024-02-04,His truck was stolen — twice. Authorities knew where it was. But it still took 17 days to get it back,https://www.cbc.ca/news/canada/toronto/stolen-truck-authorities-17-days-retreive-1.7096609,negative,0.0064193397,0.85207015,0.14151046,-0.7259823622350474
CBC,2024-02-04,IN PHOTOS | This week's most compelling Canadian images,https://www.cbc.cahttps://www.cbc.ca/newsinteractives/features/compelling-canadian-images-1-29,positive,0.6136785,0.0044785333,0.38184288,0.3765813170976884
CBC,2024-02-04,Manitoba woman heartbroken over delay in expanding medical assistance in dying for those with mental illnesses,https://www.cbc.ca/news/canada/manitoba/maid-manitoba-mental-illness-1.7104343,negative,0.01022402,0.81218654,0.1775893,-0.6595425389330813
CBC,2024-02-04,You can see a piece of the Eiffel Tower in Canada — just go to this bridge,https://www.cbc.cahttps://www.cbc.ca/player/play/2306099267712,positive,0.40649512,0.005781118,0.5877237,0.16520490046477754
CBC,2024-02-04,"School cancelled on P.E.I. Monday, byelection may be delayed as storm persists",https://www.cbc.ca/news/canada/prince-edward-island/pei-snow-storm-sunday-1.7104492,negative,0.012021149,0.40501985,0.582959,-0.16389657037296956
CBC,2024-02-04,Justin Bieber cheers Team Matthews to NHL all-star victory in Toronto,https://www.cbc.cahttps://www.cbc.ca/sports/hockey/nhl/2024-all-star-recap-feb-3-1.7104215,positive,0.7679743,0.0029406673,0.22908512,0.5897758358352778
CBC,2024-02-04,24 Sussex is now asbestos and rodent-free — and nobody knows what to do with it,https://www.cbc.ca/news/politics/24-sussex-abatement-future-plan-1.7103058,negative,0.11618121,0.45164242,0.43217638,-0.19048279209402885
CBC,2024-02-04,WATCH : CBC News Explore,https://www.cbc.cahttps://gem.cbc.ca/live,neutral,0.09840742,0.014817321,0.88677526,0.009464467482493077
CBC,2024-02-04,"Canadian men's soccer team to play 1st match of 2026 World Cup in Toronto, next 2 games in Vancouver",https://www.cbc.ca/sports/soccer/fifa-mens-world-cup-2026-canada-soccer-matches-1.7104623,neutral,0.04945336,0.0070031197,0.94354343,0.002396594658375051
CBC,2024-02-04,Measles has exploded in Europe. Clinicians say it's only a matter of time before outbreaks hit Canada,https://www.cbc.ca/news/health/measles-has-exploded-in-europe-clinicians-say-it-s-only-a-matter-of-time-before-outbreaks-hit-canada-1.7102005,negative,0.021233473,0.66019857,0.318568,-0.4354112513356512
CBC,2024-02-04,Hometown favourite sends Canada into Davis Cup Finals,https://www.cbc.ca/sports/tennis/davis-cup-qualifier-montreal-recap-feb-3-1.7104213,positive,0.6037135,0.0042914813,0.3919951,0.3644515347306534
CBC,2024-02-04,This article is real — but AI-generated deepfakes look damn close and are scamming people,https://www.cbc.ca/news/canada/deepfake-ai-scam-ads-1.7104225,negative,0.010360196,0.8830081,0.10663157,-0.7795961214745986
CBC,2024-02-04,Thousands of Ukrainians flee their country to avoid draft and horrors of the front,https://www.cbc.cahttps://www.cbc.ca/newsinteractives/features/desperate-to-avoid-the-draft,negative,0.010656848,0.7753385,0.21400473,-0.6010361536203934
CBC,2024-02-04,Transgender allies in Calgary and Edmonton protest against Alberta's proposed new policies,https://www.cbc.ca/news/canada/calgary/alberta-transgender-support-rallies-1.7104366,negative,0.012839603,0.5389449,0.44821554,-0.29029671819413494
CBC,2024-02-04,Foreign minister says Canada-Ukraine security assurance deal could be reached in weeks,https://www.cbc.ca/news/politics/canada-ukraine-security-assurances-1.7104590,neutral,0.18756168,0.0082560005,0.8041823,0.03511122602262162
CBC,2024-02-04,A primer on the messy U.S. migration debate now spreading everywhere from Ukraine to Canada,https://www.cbc.ca/news/world/us-migration-debate-primer-1.7102722,neutral,0.021324687,0.11717932,0.861496,-0.013276252742230099
CBC,2024-02-04,"Familial DNA searches come with risks, rewards in solving MMIWG cold cases",https://www.cbc.ca/news/canada/manitoba/familial-dna-searches-mmiwg-potential-harms-1.7103170,negative,0.031134024,0.42246673,0.54639924,-0.1775088054313798
CBC,2024-02-04,"In the line of fire: In Gaza, anyone can wind up a 'human shield'",https://www.cbc.ca/news/politics/israel-hamas-gaza-human-shields-1.7103756,neutral,0.066248745,0.2097325,0.7240188,-0.039598817958250265
CBC,2024-02-04,Cancellations pile up as winter storm pushes through Nova Scotia,https://www.cbc.ca/news/canada/nova-scotia/long-duration-snowstorm-this-weekend-1.7103273,negative,0.014924999,0.5073747,0.4777004,-0.2572062757208293
CBC,2024-02-04,"Canada's Gilles, Poirier win Four Continents ice dance title",https://www.cbc.ca/sports/olympics/winter/figure-skating/four-continents-figure-skating-recap-feb-4-1.7104426,positive,0.38306272,0.004760155,0.6121772,0.14671436614281674
CBC,2024-02-04,"U.S., U.K. hit dozens of Houthi targets in latest retaliatory strike, Pentagon says",https://www.cbc.ca/news/world/yeman-houthis-1.7097299,negative,0.017188901,0.25454962,0.72826153,-0.06450003767277224
CBC,2024-02-04,PHOTOS | Nova Scotia grapples with heavy snow from massive winter storm,https://www.cbc.ca/news/canada/nova-scotia/nova-scotia-grapples-with-heavy-snow-from-massive-winter-storm-1.7104746,negative,0.036675505,0.26389745,0.699427,-0.06829677700489967
CBC,2024-02-04,Let the spirits move you: A nightlife afterlife is planned for this historic stone church,https://www.cbc.ca/news/canada/newfoundland-labrador/nl-new-uses-churches-1.7101994,positive,0.5326773,0.005873728,0.4614489,0.2837106288717308
CBC,2024-02-04,Canadians can ask for legally produced psilocybin. Getting it isn't always easy,https://www.cbc.cahttps://www.cbc.ca/newsinteractives/features/magic-mushroom-medicine,neutral,0.07510632,0.19704458,0.727849,-0.033185618153169116
CBC,2024-02-04,"Cape Breton mayor calls for provincial, federal support",https://www.cbc.ca/player/play/2306297923868,neutral,0.12659192,0.012259443,0.8611485,0.015875238295577354
CBC,2024-02-04,"Snow, wind, rain expected across Newfoundland until Tuesday",https://www.cbc.ca/news/canada/newfoundland-labrador/snow-wind-rain-feb-04-1.7104491,negative,0.037444606,0.2971233,0.6654321,-0.08688016566419776
CBC,2024-02-04,B.C. oil and gas producers warned of potential water shortages in drought-stricken areas,https://www.cbc.ca/news/canada/british-columbia/bc-oil-gas-water-shortages-drought-1.7101670,negative,0.017420718,0.46234572,0.5202336,-0.2134600830829747
CBC,2024-02-04,Betty Brussel is 99. She just smashed 3 world swimming records,https://www.cbc.ca/radio/thecurrent/99-year-old-swimmer-betty-brussel-1.7101711,positive,0.9228609,0.0031680267,0.073971145,0.8516621391533326
CBC,2024-02-04,Government extends ban on foreign buying of Canadian housing,https://www.cbc.ca/news/politics/foreign-housing-buying-ban-extended-1.7104533,negative,0.015941117,0.35229468,0.63176423,-0.12385741487641688
CBC,2024-02-04,"Winter storm pounds Cape Breton, triggers local state of emergency",https://www.cbc.ca/news/canada/nova-scotia/cape-breton-february-snowstorm-1.7104545,negative,0.015086047,0.48486125,0.50005275,-0.2348628192513047
CBC,2024-02-04,How a Black pioneer helped the boom of northern B.C.'s gold rush,https://www.cbc.ca/news/canada/british-columbia/john-robert-giscome-history-1.7103203,positive,0.36900574,0.015453762,0.6155405,0.13592641735328925
CBC,2024-02-04,Chilean officials theorize deadly forest fires could have been intentionally caused,https://www.cbc.ca/news/world/central-chile-forest-fires-1.7104573,negative,0.00606094,0.7813656,0.2125736,-0.6104953201172085
