source,date,headline,url,chosen_label,positive,negative,neutral,compound
CTV,2024-05-15,Province announces inquests into 8 EMDC deaths,https://london.ctvnews.ca/province-announces-inquests-into-8-emdc-deaths-1.6887720,neutral,0.018560505,0.20425491,0.77718467,-0.04137556244533247
CTV,2024-05-15,"Bouchard scores late to lift Oilers over Canucks, tie series",https://edmonton.ctvnews.ca/bouchard-scores-late-to-lift-oilers-over-canucks-tie-series-1.6886502,positive,0.26351956,0.007212525,0.729268,0.06939051268619245
CTV,2024-05-15,'I'm just stressed': Birchwood Terrace residents trying to figure out what's next after evacuation order last week,https://winnipeg.ctvnews.ca/i-m-just-stressed-birchwood-terrace-residents-trying-to-figure-out-what-s-next-after-evacuation-order-last-week-1.6887350,negative,0.01542733,0.57775277,0.40681997,-0.3335602086448919
CTV,2024-05-15,Four Fort McMurray neighbourhoods evacuated due to wildfire,/video/c2922479-4-fort-mcmurray-neighbourhoods-evacuated?playlistId=1.6887606,negative,0.02052946,0.29304448,0.6864262,-0.08545356702758689
CTV,2024-05-15,"'Sudden death' draws large police presence to Middle Sackville, N.S., neighbourhood",https://atlantic.ctvnews.ca/sudden-death-draws-large-police-presence-to-middle-sackville-n-s-neighbourhood-1.6887249,negative,0.010503639,0.630093,0.35940346,-0.39690677947375264
CTV,2024-05-15,"Sun shoots out biggest solar flare in almost 2 decades, but Earth should be out of the way this time",https://www.ctvnews.ca/sci-tech/sun-shoots-out-biggest-solar-flare-in-almost-2-decades-but-earth-should-be-out-of-the-way-this-time-1.6887615,neutral,0.109450914,0.23794186,0.65260726,-0.04463682452247575
CTV,2024-05-15,"PQ leads while QS loses support, according to new Leger-Quebecor poll",https://montreal.ctvnews.ca/pq-leads-while-qs-loses-support-according-to-new-leger-quebecor-poll-1.6887731,neutral,0.02985718,0.078495204,0.8916475,-0.0052700505743819015
CTV,2024-05-15,"Caitlin Clark scores 20 points in WNBA debut, but Fever lose to Connecticut",https://www.ctvnews.ca/sports/caitlin-clark-scores-20-points-in-wnba-debut-but-fever-lose-to-connecticut-1.6886992,neutral,0.04517512,0.04761869,0.90720606,-0.0002267485513538503
CTV,2024-05-15,Hundreds of job seekers attend Lethbridge job fair,https://calgary.ctvnews.ca/hundreds-of-job-seekers-attend-lethbridge-job-fair-1.6887089,neutral,0.071158215,0.0965361,0.8323057,-0.004255725832076784
CTV,2024-05-15,B.C. musician's song catches attention of Canucks,https://bc.ctvnews.ca/b-c-musician-s-song-catches-attention-of-canucks-1.6887512,positive,0.31893268,0.0065735006,0.6744939,0.10167481701730097
CTV,2024-05-15,"B.C. needs dedicated, cross-government wildfire strategy: former minister",https://bc.ctvnews.ca/b-c-needs-dedicated-cross-government-wildfire-strategy-former-minister-1.6887787,neutral,0.054729868,0.046472277,0.89879787,0.0008356857229996351
CTV,2024-05-15,"Philippines seeking Canada's help to avoid 'great power rivalry' between China, U.S.",https://www.ctvnews.ca/politics/philippines-seeking-canada-s-help-to-avoid-great-power-rivalry-between-china-u-s-1.6886111,neutral,0.068613105,0.034333825,0.8970531,0.0035289447775950222
CTV,2024-05-15,New LEED-certified control tower being constructed at Victoria airport,https://bc.ctvnews.ca/new-leed-certified-control-tower-being-constructed-at-victoria-airport-1.6887200,neutral,0.085855216,0.008412905,0.90573174,0.007300352069629756
CTV,2024-05-15,Alberta announces the 4 health agencies that will replace AHS later this year,https://edmonton.ctvnews.ca/alberta-announces-the-4-health-agencies-that-will-replace-ahs-later-this-year-1.6886890,neutral,0.0446094,0.018515607,0.9368751,0.0016471680109808595
CTV,2024-05-15,Ottawa pizzeria places among top 20 deep-dish pizzas in the world at international competition,https://ottawa.ctvnews.ca/ottawa-pizzeria-places-among-top-20-deep-dish-pizzas-in-the-world-at-international-competition-1.6883494,positive,0.6642105,0.0056782346,0.33011124,0.4411433633519586
CTV,2024-05-15,Calgary-area dog among big Canadian winners at the Westminster Dog Show,https://calgary.ctvnews.ca/calgary-area-dog-among-big-canadian-winners-at-the-westminster-dog-show-1.6887797,positive,0.76882577,0.003134469,0.2280398,0.5910831930706593
CTV,2024-05-15,Partial lane closures on Lauzon Parkway South,https://windsor.ctvnews.ca/partial-lane-closures-on-lauzon-parkway-south-1.6887624,negative,0.01544183,0.41858387,0.56597424,-0.17497402993222977
CTV,2024-05-15,"At Westminster dog show, a display of dogs and devotion",https://www.ctvnews.ca/lifestyle/at-westminster-dog-show-a-display-of-dogs-and-devotion-1.6885463,positive,0.8361239,0.0042488766,0.15962718,0.6990851581235402
CTV,2024-05-15,Growing wildfires across Western Canada are forcing thousands from their homes,https://www.ctvnews.ca/climate-and-environment/growing-wildfires-across-western-canada-are-forcing-thousands-from-their-homes-1.6887583,negative,0.0069276094,0.82990223,0.16317026,-0.6886896365539199
CTV,2024-05-15,"Free parking returning to core businesses districts - one hour, limited locations",https://london.ctvnews.ca/free-parking-returning-to-core-businesses-districts-one-hour-limited-locations-1.6887434,positive,0.32560706,0.0058038,0.66858923,0.10598624581090732
CTV,2024-05-15,‘It was getting pretty hairy out’: Barn roof torn off during storm in Wellington County,https://kitchener.ctvnews.ca/it-was-getting-pretty-hairy-out-barn-roof-torn-off-during-storm-in-wellington-county-1.6887027,negative,0.010075341,0.7076053,0.28231934,-0.500603772389562
CTV,2024-05-15,Deadly southern Alberta highway crash kills two people,https://calgary.ctvnews.ca/deadly-southern-alberta-highway-crash-kills-two-people-1.6886449,negative,0.008438189,0.83541745,0.15614429,-0.697851186111702
CTV,2024-05-15,The jurors in Trump's hush money trial are getting a front row seat to history – most of the time,https://www.ctvnews.ca/world/the-jurors-in-trump-s-hush-money-trial-are-getting-a-front-row-seat-to-history-most-of-the-time-1.6887823,negative,0.16106284,0.3372719,0.5016653,-0.08781109124465836
CTV,2024-05-15,Here's how the County of Simcoe proposes pushing residents to participate in organics program,https://barrie.ctvnews.ca/here-s-how-the-county-of-simcoe-proposes-pushing-residents-to-participate-in-organics-program-1.6886599,neutral,0.107383326,0.0061509404,0.8864658,0.01149333931255292
CTV,2024-05-15,"Boeing breached 2021 737 MAX criminal prosecution deal, says U.S. DOJ",https://www.ctvnews.ca/business/boeing-breached-2021-737-max-criminal-prosecution-deal-says-u-s-doj-1.6887126,negative,0.012840113,0.5366542,0.45050585,-0.28783277241275584
CTV,2024-05-15,"Kansas City Chiefs kicker rails against Pride month, working women in commencement speech",https://www.ctvnews.ca/sports/kansas-city-chiefs-kicker-rails-against-pride-month-working-women-in-commencement-speech-1.6887422,negative,0.0072015277,0.7177329,0.27506548,-0.51508870483962
CTV,2024-05-15,Thieves caught on camera stealing pet chicken from North Vancouver backyard,https://bc.ctvnews.ca/thieves-caught-on-camera-stealing-pet-chicken-from-north-vancouver-backyard-1.6885857,negative,0.015581296,0.6553114,0.3291072,-0.4291903183677981
CTV,2024-05-15,From outer space? Sask. farmers baffled after discovering strange wreckage in field,https://regina.ctvnews.ca/from-outer-space-sask-farmers-baffled-after-discovering-strange-wreckage-in-field-1.6880353,negative,0.023750165,0.3044525,0.67179734,-0.09212726012857786
CTV,2024-05-15,Manitoba Metis Federation president blasts Ontario group during identity summit,https://winnipeg.ctvnews.ca/manitoba-metis-federation-president-blasts-ontario-group-during-identity-summit-1.6886538,negative,0.013162514,0.5643001,0.4225374,-0.31826137405248645
CTV,2024-05-15,Regulated area for invasive box tree moth expanded to parts of the Maritimes,https://atlantic.ctvnews.ca/regulated-area-for-invasive-box-tree-moth-expanded-to-parts-of-the-maritimes-1.6886190,neutral,0.034297958,0.056242313,0.9094596,-0.0019868508987581635
CTV,2024-05-15,Calgary city council passes blanket rezoning after marathon meeting,https://calgary.ctvnews.ca/calgary-city-council-passes-blanket-rezoning-after-marathon-meeting-1.6887281,neutral,0.057990644,0.010905549,0.93110365,0.003243991351254083
CTV,2024-05-15,"Evolving justice system gets strategic and widespread Alberta support, minister says",https://calgary.ctvnews.ca/evolving-justice-system-gets-strategic-and-widespread-alberta-support-minister-says-1.6887807,positive,0.4718657,0.008772737,0.5193615,0.22258031846411086
CTV,2024-05-15,Cambridge man arrested for hate-motivated attack on bus: WRPS,https://kitchener.ctvnews.ca/cambridge-man-arrested-for-hate-motivated-attack-on-bus-wrps-1.6887605,negative,0.008090106,0.74759316,0.24431656,-0.558830233400772
CBC,2024-05-15,"With an election on the horizon, Poilievre's Conservatives sign up dozens of new candidates",https://www.cbc.ca/news/politics/elections-nomination-conservatives-liberals-ndp-bloc-1.7203859,neutral,0.08216888,0.017516518,0.9003146,0.006444894584855643
CBC,2024-05-15,"I learned to push through pain watching my stoic dad on the farm. Now, I want to change",https://www.cbc.ca/news/canada/first-person-farmer-health-1.7199814,neutral,0.23148087,0.17391852,0.5946007,0.02333573818941659
CBC,2024-05-15,Truck driver spreads positivity of dance with Bhangra Crew Regina,https://www.cbc.ca/news/canada/saskatchewan/bhangra-dance-regina-art-1.7172679,positive,0.65341914,0.007338489,0.33924258,0.42690260001325697
CBC,2024-05-15,Conservative Party reports record-breaking fundraising haul in 2023,https://www.cbc.ca/news/politics/conservative-party-record-breaking-fundraising-haul-1.7100305,positive,0.8301501,0.0032585473,0.16659124,0.6891387022980178
CBC,2024-05-15,Miniature poodle Sage wins best in show at Westminster Kennel Club dog show,https://www.cbc.ca/news/world/westminster-dog-show-winner-2024-1.7204586,positive,0.7610561,0.0040757568,0.23486806,0.5791898476240442
CBC,2024-05-15,"Russia has its sights on Kharkiv, with potentially big consequences",https://www.cbc.ca/news/world/kharkiv-russia-attacks-wartime-uncertainties-1.7203058,negative,0.018350948,0.57735837,0.4042906,-0.3330059739928757
CBC,2024-05-15,Why big icebergs aren’t making it to Newfoundland this year,https://www.cbc.ca/player/play/video/9.4225032,negative,0.021093892,0.6873053,0.29160088,-0.47194354386796533
CBC,2024-05-15,"Slovakian PM Robert Fico shot, police detain suspect",https://www.cbc.ca/news/world/slovakia-pm-fico-shooting-1.7204751,negative,0.01870218,0.29327068,0.6880271,-0.0856579350394604
CBC,2024-05-15,"Alice Munro was 'very much in my soul,' famed soprano says",https://www.cbc.ca/player/play/video/9.4226407,positive,0.4229502,0.0094270315,0.56762284,0.17879797253512741
CBC,2024-05-15,Thousands ordered to evacuate Fort McMurray as wildfire threatens,https://www.cbc.ca/player/play/video/9.4226979,negative,0.013232265,0.53664166,0.4501261,-0.2878091436899979
CBC,2024-05-15,AI is offering more human-like responses. Experts say we'll need to be more skeptical of them,https://www.cbc.ca/news/business/google-openai-search-1.7204014,negative,0.058356762,0.23761308,0.70403016,-0.053054465042023935
CBC,2024-05-15,This miniature poodle just claimed a big title,https://www.cbc.ca/player/play/video/9.4226915,positive,0.5633464,0.055766128,0.38088745,0.31424932228404145
CBC,2024-05-15,PWHL Boston becomes 1st team to reach Walter Cup final after completing sweep over Montreal,https://www.cbc.ca/sports/hockey/pwhl/pwhl-montreal-boston-recap-may-14-1.7204292,positive,0.30620727,0.0059787855,0.6878139,0.09372716378227608
CBC,2024-05-15,5 coolest things Alice Munro told CBC about her writing,https://www.cbc.ca/player/play/video/1.3665255,positive,0.8683946,0.0047806753,0.12682462,0.7540864526844473
CBC,2024-05-15,"Boeing could be criminally charged, U.S. Justice Dept. suggests in court filing",https://www.cbc.ca/news/business/us-boeing-justice-courts-1.7204664,negative,0.017087478,0.52420497,0.4587075,-0.2744988989022801
CBC,2024-05-15,Ontario plans to toughen penalties for impaired drivers,https://www.cbc.ca/news/canada/toronto/ontario-impaired-drivers-new-rules-proposed-1.7204593,negative,0.023096856,0.2502264,0.72667664,-0.06207981077255731
CBC,2024-05-15,Zelenskyy cancels planned foreign trip as Russia makes gains in Ukraine's Kharkiv,https://www.cbc.ca/news/world/ukraine-kharkiv-russia-offensive-1.7204662,negative,0.024049098,0.2955234,0.68042743,-0.08675573976068307
CBC,2024-05-15,"Former journalist drops out of Conservative nomination race, claims the process has been 'corrupted'",https://www.cbc.ca/news/politics/conservative-nomination-fight-sabrina-maddeaux-1.7198969,negative,0.008442522,0.7334909,0.25806656,-0.5379376228028132
CBC,2024-05-15,Chunk of space debris lands in Sask. farm field,https://www.cbc.ca/news/canada/saskatoon/space-debris-farm-field-1.7204312,negative,0.01919662,0.3820634,0.59873986,-0.14560396575203072
CBC,2024-05-15,"Latest ChatGPT model talks back to you — no, really",https://www.cbc.ca/player/play/video/9.4226417,neutral,0.0694614,0.10627462,0.824264,-0.006469408729750992
CBC,2024-05-15,More female surgeons in the operating room could improve patient outcomes: study,https://www.cbc.ca/news/health/women-operating-room-1.7204360,positive,0.7106943,0.012089861,0.27721587,0.5049402213434071
CBC,2024-05-15,Buying and selling water is a reality in Alberta — sometimes for big money,https://www.cbc.ca/news/canada/calgary/alberta-water-alison-davie-davin-macintosh-crossiron-1.7186098,negative,0.031288005,0.40858963,0.5601224,-0.16596654800502364
CBC,2024-05-15,"Fear, anxiety as thousands flee their homes in Fort McMurray due to threat of wildfire",https://www.cbc.ca/news/canada/edmonton/fear-anxiety-as-thousands-flee-their-homes-in-fort-mcmurray-due-to-threat-of-wildfire-1.7204583,negative,0.011435256,0.78698766,0.20157702,-0.6192188498994522
CBC,2024-05-15,WATCH : CBC News Explore,https://www.cbc.cahttps://gem.cbc.ca/live,neutral,0.09840742,0.014817321,0.88677526,0.009464467482493077
CBC,2024-05-15,WATCH | Elephants say hello to each other too — take a look,https://www.cbc.cahttps://www.cbc.ca/player/play/video/9.4226685,positive,0.5795088,0.0029154618,0.4175758,0.33582191077226575
CBC,2024-05-15,Bouchard scores late as Oilers even series with 3-2 win over Canucks,https://www.cbc.ca/news/canada/edmonton/canucks-oilers-game-4-results-1.7204300,neutral,0.15164974,0.0074810483,0.840869,0.022941706415191554
CBC,2024-05-15,Sask. man previously charged with sexual assault against children now faces 60 new charges,https://www.cbc.ca/news/canada/saskatoon/assiniboia-sask-man-faces-more-charges-1.7204142,negative,0.008355276,0.76710033,0.22454442,-0.5883731010057591
CBC,2024-05-15,"'There’s no food.... There’s no life,' say Palestinians in Khan Younis",https://www.cbc.ca/player/play/video/9.4226787,negative,0.0045709736,0.89147156,0.10395748,-0.7947006505006429
CBC,2024-05-15,Saskatchewan farmer finds part of a SpaceX rocket in his field,https://www.cbc.ca/player/play/video/9.4226867,neutral,0.063209504,0.0820256,0.85476494,-0.002732757235861527
CBC,2024-05-15,"Alice Munro, Canadian author who mastered the short story, dead at 92",https://www.cbc.ca/news/canada/alice-munro-author-dead-obit-1.7203737,neutral,0.08520071,0.066183746,0.8486155,0.0028788734069262745
CBC,2024-05-15,Loophole leaves taxpayers picking up tab for MP travel,https://www.cbc.ca/news/politics/political-parties-spending-rules-1.7204136,negative,0.01320236,0.750973,0.23582466,-0.5637861124876791
CBC,2024-05-15,Teaching has changed a lot in Marlene Mutch's 63-year career. For example? She no longer stables horses,https://www.cbc.ca/news/canada/manitoba/elementary-school-teacher-retiring-1.7203091,negative,0.028482748,0.27474916,0.6967679,-0.07467587413324317
CBC,2024-05-15,Online sleuths keep trying to solve true crimes. The Baby Reindeer obsession is just the latest,https://www.cbc.ca/news/entertainment/baby-reindeer-true-crime-online-1.7202383,negative,0.02596148,0.7095608,0.2644776,-0.502802629398829
CBC,2024-05-15,Elephants say hello to each other too — take a look,https://www.cbc.ca/player/play/video/9.4226685,positive,0.6802059,0.0032504122,0.31654367,0.4626694963013236
CBC,2024-05-15,WATCH | Are you boycotting Loblaw? We asked people across Canada,https://www.cbc.ca/player/play/video/9.4225951,neutral,0.046252273,0.12069609,0.8330516,-0.012428274529838745
CBC,2024-05-15,New red-hued portrait of King Charles draws mixed reaction,https://www.cbc.ca/news/world/king-charles-portrait-1.7204691,neutral,0.02899725,0.10437,0.86663276,-0.010052255414562783
CBC,2024-05-15,Federal tests find no signs of bird flu virus in Canadian retail milk,https://www.cbc.ca/news/health/bird-flu-canadian-retail-milk-1.7203955,neutral,0.041445505,0.17843404,0.78012043,-0.030120979960215344
CBC,2024-05-15,WATCH: CBC News Network,https://www.cbc.cahttps://gem.cbc.ca/live,neutral,0.10073908,0.018231502,0.88102955,0.00981596340483426
CBC,2024-05-15,Destroying Michael Cohen: Trump team sets off on mission at trial,https://www.cbc.ca/news/world/michael-cohen-witness-cross-examination-1.7203950,negative,0.028510401,0.61401117,0.35747835,-0.3761969249303423
CBC,2024-05-15,RBC customer's cheque was cashed twice. He says his bank shouldn't have let it happen,https://www.cbc.ca/news/canada/montreal/rbc-cheque-cashed-twice-security-1.7202898,negative,0.016930962,0.61541736,0.36765173,-0.3784518540496009
CBC,2024-05-15,"Despite extensive DNA tests, identity of 1 of Winnipeg serial killer's victims remains a mystery, trial hears",https://www.cbc.ca/news/canada/manitoba/jeremy-skibicki-serial-killer-trial-dna-1.7203845,negative,0.015265195,0.3359051,0.6488297,-0.11259921325539324
