source,date,headline,url,chosen_label,positive,negative,neutral,compound
CTV,2024-03-26,Anne Hathaway had a miscarriage while acting as a pregnant woman onstage,https://www.ctvnews.ca/entertainment/anne-hathaway-had-a-miscarriage-while-acting-as-a-pregnant-woman-onstage-1.6822954,negative,0.01723806,0.48994187,0.49282008,-0.2397458808893944
CTV,2024-03-26,"Damage estimated at $100,000 after 'suspicious' trailer fire at Leisure Lake",https://windsor.ctvnews.ca/damage-estimated-at-100-000-after-suspicious-trailer-fire-at-leisure-lake-1.6822828,negative,0.010391787,0.6606181,0.32899022,-0.4363082424841309
CTV,2024-03-26,Travellers through Maine's biggest airport can now fly to the moon. Or at least a chunk of it,https://www.ctvnews.ca/sci-tech/travellers-through-maine-s-biggest-airport-can-now-fly-to-the-moon-or-at-least-a-chunk-of-it-1.6823101,positive,0.7721854,0.0035408218,0.22427392,0.5962576401656747
CTV,2024-03-26,Schroder leads Nets past Raptors 96-88; Toronto backup investigated by NBA,https://toronto.ctvnews.ca/schroder-leads-nets-past-raptors-96-88-toronto-backup-investigated-by-nba-1.6822339,neutral,0.055840384,0.006476839,0.9376829,0.003076191721236743
CTV,2024-03-26,Canadian military expects to secure contract for B.C. drone base by end of 2024,https://bc.ctvnews.ca/canadian-military-expects-to-secure-contract-for-b-c-drone-base-by-end-of-2024-1.6821185,neutral,0.10010316,0.011600046,0.8882967,0.009886087924333431
CTV,2024-03-26,Business owner disappointed in police efforts to locate $500K worth of stolen e-bikes,https://bc.ctvnews.ca/business-owner-disappointed-in-police-efforts-to-locate-500k-worth-of-stolen-e-bikes-1.6822229,negative,0.0076542096,0.8099463,0.18239936,-0.6559545395399269
CTV,2024-03-26,"The British Museum is suing a former curator over the alleged theft of almost 2,000 items",https://www.ctvnews.ca/world/the-british-museum-is-suing-a-former-curator-over-the-alleged-theft-of-almost-2-000-items-1.6823083,negative,0.009204098,0.69361985,0.2971761,-0.4810237569019318
CTV,2024-03-26,Calgary's Tegan and Sara call out Alberta government at Junos,https://calgary.ctvnews.ca/calgary-s-tegan-and-sara-call-out-alberta-government-at-junos-1.6820750,neutral,0.04367791,0.054159027,0.90216315,-0.0010254393399500294
CTV,2024-03-26,"With help from Pitbull, Newfoundland cabbie shows spoons aren't just for folk music",https://www.ctvnews.ca/entertainment/with-help-from-pitbull-newfoundland-cabbie-shows-spoons-aren-t-just-for-folk-music-1.6822383,positive,0.4510512,0.02141163,0.5275371,0.20298875770475888
CTV,2024-03-26,"'Absolutely worth it': Meet the B.C. woman who paid $50,000 to clone her dead cat",https://bc.ctvnews.ca/absolutely-worth-it-meet-the-b-c-woman-who-paid-50-000-to-clone-her-dead-cat-1.6818995,positive,0.63973004,0.028399704,0.3318703,0.4084479577780318
CTV,2024-03-26,Sean 'Diddy' Combs' homes were raided. A legal analyst explains why,https://www.ctvnews.ca/entertainment/sean-diddy-combs-homes-were-raided-a-legal-analyst-explains-why-1.6822805,negative,0.012173068,0.3820278,0.6057991,-0.14579708241769396
CTV,2024-03-26,"Residents of this B.C. city lost more than $16M to 'pig butchering' scams last year, RCMP say",https://bc.ctvnews.ca/residents-of-this-b-c-city-lost-more-than-16m-to-pig-butchering-scams-last-year-rcmp-say-1.6822974,negative,0.0055334363,0.85022455,0.14424193,-0.7228512243439056
CTV,2024-03-26,"'I was just like, holy cow!': Saskatoon dumpster divers reclaim wasted valuables",https://saskatoon.ctvnews.ca/i-was-just-like-holy-cow-saskatoon-dumpster-divers-reclaim-wasted-valuables-1.6822075,negative,0.11144313,0.5061325,0.3824244,-0.243750507367265
CTV,2024-03-26,Costco begins using verification scanners at some Ottawa stores,https://ottawa.ctvnews.ca/costco-begins-using-verification-scanners-at-some-ottawa-stores-1.6821645,neutral,0.064600065,0.007777854,0.92762196,0.004112680191735052
CTV,2024-03-26,Trump is selling 'God Bless the USA' Bibles for US$59.99 as he faces mounting legal bills,https://www.ctvnews.ca/world/trump-is-selling-god-bless-the-usa-bibles-for-us-59-99-as-he-faces-mounting-legal-bills-1.6822942,negative,0.04965915,0.6203163,0.33002445,-0.3823263666037331
CTV,2024-03-26,Record March snow in New Brunswick over the weekend,https://atlantic.ctvnews.ca/record-march-snow-in-new-brunswick-over-the-weekend-1.6821258,neutral,0.12703693,0.045968205,0.8269947,0.0140253175963867
CTV,2024-03-26,"Trucking company, director fined $140K for violating Environmental Protection Act",https://northernontario.ctvnews.ca/trucking-company-director-fined-140k-for-violating-environmental-protection-act-1.6820263,negative,0.0073454315,0.78751266,0.205142,-0.6201221528648464
CTV,2024-03-26,Lethbridge unveils first-aid trauma kit at Enmax Centre,https://calgary.ctvnews.ca/lethbridge-unveils-first-aid-trauma-kit-at-enmax-centre-1.6821195,neutral,0.042217698,0.019432595,0.9383498,0.0014047065315626606
CTV,2024-03-26,Stolen vehicle crashes after police try to initiate stop,https://london.ctvnews.ca/stolen-vehicle-crashes-after-police-try-to-initiate-stop-1.6822848,negative,0.009327329,0.6694906,0.32118204,-0.44813065125035756
CTV,2024-03-26,"Man, woman arrested after 14-month-old child dies in Quebec City daycare",https://montreal.ctvnews.ca/man-woman-arrested-after-14-month-old-child-dies-in-quebec-city-daycare-1.6823080,negative,0.008829847,0.6877345,0.30343568,-0.47290075547330446
CTV,2024-03-26,Why it will cost you more to buy chocolate this Easter,/video/c2891976-easter-chocolate-more-expensive-this-year?playlistId=1.6822328,negative,0.04188084,0.46581948,0.49229962,-0.2152338061218373
CTV,2024-03-26,Baltimore bridge collapse: Full coverage and analysis,/video/c375756-live--scene-after-baltimore-bridge-collapse?playlistId=1.6822437,negative,0.027910475,0.26086757,0.7112219,-0.06727291336172492
CTV,2024-03-26,Number of CRA employees fired for claiming CERB up to 232,https://www.ctvnews.ca/politics/number-of-cra-employees-fired-for-claiming-cerb-up-to-232-1.6823118,negative,0.0077060517,0.6806873,0.31160673,-0.46327576838052664
CTV,2024-03-26,"Stranded orca was pregnant, efforts to save her other calf turn on rising tide",https://bc.ctvnews.ca/stranded-orca-was-pregnant-efforts-to-save-her-other-calf-turn-on-rising-tide-1.6822536,negative,0.01502552,0.48865467,0.49631986,-0.2385575948713532
CTV,2024-03-26,Sault Ste. Marie chocolate shop on global cocoa shortage,https://northernontario.ctvnews.ca/sault-ste-marie-chocolate-shop-on-global-cocoa-shortage-1.6822380,neutral,0.050080802,0.2006645,0.74925476,-0.03775814536171662
CTV,2024-03-26,OPP seeks witnesses to Highway 10 crash that killed two people,https://barrie.ctvnews.ca/opp-seeks-witnesses-to-highway-10-crash-that-killed-two-people-1.6823012,negative,0.017418874,0.5481486,0.43443257,-0.3001634407413043
CTV,2024-03-26,Ottawa police officer docked 10 days pay for off-duty fight with teens,https://ottawa.ctvnews.ca/ottawa-police-officer-docked-10-days-pay-for-off-duty-fight-with-teens-1.6822754,negative,0.014579061,0.533643,0.45177785,-0.28456235670188335
CTV,2024-03-26,Canada Goose laying off 17 per cent of its entire workforce,/video/c2892468-canada-goose-laying-off-17-percent-of-workers,negative,0.013055562,0.78199047,0.20495395,-0.6113386565615277
CTV,2024-03-26,"Maternity leave behind temporary closure of Listowel, Ont.’s obstetrics department",https://kitchener.ctvnews.ca/maternity-leave-behind-temporary-closure-of-listowel-ont-s-obstetrics-department-1.6822174,negative,0.01616294,0.27014905,0.713688,-0.0727192700055923
CTV,2024-03-26,'Building a total loss': North Bay firefighters battle blaze downtown,https://northernontario.ctvnews.ca/building-a-total-loss-north-bay-firefighters-battle-blaze-downtown-1.6822401,negative,0.009870766,0.7186944,0.27143487,-0.5164241714106108
CTV,2024-03-26,New video evidence in Zameer trial shows moments of panic after Toronto police officer run over,https://toronto.ctvnews.ca/new-video-evidence-in-zameer-trial-shows-moments-of-panic-after-toronto-police-officer-run-over-1.6822804,negative,0.01772124,0.44815934,0.5341195,-0.20053272352681262
CTV,2024-03-26,Trump faces gag order in New York hush money criminal case,https://www.ctvnews.ca/world/trump-faces-gag-order-in-new-york-hush-money-criminal-case-1.6823071,negative,0.013015048,0.5672836,0.41970134,-0.3216412916453777
CTV,2024-03-26,Open casting call in Calgary for new Netflix series,https://calgary.ctvnews.ca/open-casting-call-in-calgary-for-new-netflix-series-1.6822763,neutral,0.084950194,0.006566336,0.9084836,0.0071734063583273056
CTV,2024-03-26,"Referencing 'In an emergency, break glass' signs, Bank of Canada official says, 'It's time to break the glass'",https://www.ctvnews.ca/business/referencing-in-an-emergency-break-glass-signs-bank-of-canada-official-says-it-s-time-to-break-the-glass-1.6822827,neutral,0.051242296,0.17202699,0.77673066,-0.026967520640319265
CTV,2024-03-26,Police investigating deadly tent fire in Saint John,https://atlantic.ctvnews.ca/police-investigating-deadly-tent-fire-in-saint-john-1.6822029,neutral,0.01869739,0.14709908,0.83420354,-0.02128854413310055
CTV,2024-03-26,'He understands Canadians': Inside what 'axe the tax' means to Poilievre's supporters,https://www.ctvnews.ca/politics/he-understands-canadians-inside-what-axe-the-tax-means-to-poilievre-s-supporters-1.6822969,neutral,0.09906674,0.054315206,0.84661806,0.0068640775908686
CTV,2024-03-26,B.C. warns of 'identical' government payment website made by 'malicious actors',https://bc.ctvnews.ca/b-c-warns-of-identical-government-payment-website-made-by-malicious-actors-1.6822007,negative,0.0074881394,0.7328476,0.25966412,-0.5370096204579511
CTV,2024-03-26,9 tickets issued for open alcohol in Ottawa parks over two years,https://ottawa.ctvnews.ca/9-tickets-issued-for-open-alcohol-in-ottawa-parks-over-two-years-1.6822815,neutral,0.06870049,0.037057888,0.89424163,0.0033464702544632186
CTV,2024-03-26,'Secret' RCMP report forecasts a bleak future in Canada,https://www.ctvnews.ca/canada/secret-rcmp-report-forecasts-a-bleak-future-in-canada-1.6821642,negative,0.0060123634,0.84090173,0.15308577,-0.7070796744404255
CTV,2024-03-26,Calgary will soon have a new public washroom and pickleball court in the East Village,https://calgary.ctvnews.ca/calgary-will-soon-have-a-new-public-washroom-and-pickleball-court-in-the-east-village-1.6823033,neutral,0.14087982,0.0042088223,0.8549112,0.019829431239678286
CTV,2024-03-26,"Father and wife's illnesses focus attention on future king, Prince William",https://www.ctvnews.ca/world/father-and-wife-s-illnesses-focus-attention-on-future-king-prince-william-1.6822581,neutral,0.13316457,0.08572179,0.7811137,0.010384575095650384
CTV,2024-03-26,"Anti-vax protester's 'race-based tirade' against security guard wasn't criminal, B.C. judge rules",https://bc.ctvnews.ca/anti-vax-protester-s-race-based-tirade-against-security-guard-wasn-t-criminal-b-c-judge-rules-1.6823109,negative,0.029816179,0.3729853,0.5971985,-0.13822904216340248
CTV,2024-03-26,"B.C. funds nearly 600 new affordable rental homes in the Interior, North",https://bc.ctvnews.ca/b-c-funds-nearly-600-new-affordable-rental-homes-in-the-interior-north-1.6818835,positive,0.3194329,0.0036868756,0.67688024,0.10202378425274716
CTV,2024-03-26,"Kitchener one step closer to fourplex construction, Waterloo decision coming later",https://kitchener.ctvnews.ca/kitchener-one-step-closer-to-fourplex-construction-waterloo-decision-coming-later-1.6822853,neutral,0.15547815,0.0059274035,0.8385945,0.02413831427737545
CTV,2024-03-26,"U.S. detects avian flu in milk, says dairy supplies are safe",https://www.ctvnews.ca/health/u-s-detects-avian-flu-in-milk-says-dairy-supplies-are-safe-1.6822624,neutral,0.08256795,0.036346253,0.8810859,0.005496413068476258
CTV,2024-03-26,How to safely view the solar eclipse using household materials,https://toronto.ctvnews.ca/how-to-safely-view-the-solar-eclipse-using-household-materials-1.6820257,neutral,0.14859046,0.031687718,0.8197218,0.021075013226887762
CBC,2024-03-26,Ontario finance minister set to deliver 2024 budget,https://www.cbc.ca/news/canada/toronto/ontario-budget-2024-1.7155581,neutral,0.07532062,0.009464523,0.91521496,0.005583611643327213
CBC,2024-03-26,Winnipeg Punjabi musicians celebrate Karan Aujla's groundbreaking Juno win,https://www.cbc.ca/news/canada/manitoba/winnipeg-punjabi-musicians-karan-aujla-juno-award-1.7155235,positive,0.7283542,0.0029279317,0.2687178,0.5304913120899482
CBC,2024-03-26,"WATCH | Zoo ostrich legs it, causes traffic chaos in South Korea",https://www.cbc.cahttps://www.cbc.ca/player/play/1.7156053,negative,0.008510792,0.677282,0.31420726,-0.458638441491626
CBC,2024-03-26,Canada is building a new lab to handle some of the most dangerous diseases in the world,https://www.cbc.ca/news/canada/manitoba/canada-high-containment-lab-1.7154838,negative,0.02179839,0.75430447,0.22389708,-0.5685001169402115
CBC,2024-03-26,A brain injury wrecked my inner calendar but hasn't stopped me from having the time of my life,https://www.cbc.ca/news/canada/edmonton/first-person-sheila-willis-brain-injury-1.7140614,negative,0.24185164,0.43458626,0.32356215,-0.13037298884336934
CBC,2024-03-26,Canada’s oldest practising architect walks us through his first design,https://www.cbc.ca/player/play/1.7155021,positive,0.29266927,0.005034126,0.70229673,0.08562992288980809
CBC,2024-03-26,More than 400 Art Gallery of Ontario workers on picket line as strike forces gallery to close,https://www.cbc.ca/news/canada/toronto/hundreds-of-ago-workers-on-picket-line-tuesday-as-strike-begins-1.7155877,negative,0.00932873,0.6950069,0.2956644,-0.4829475552518243
CBC,2024-03-26,"Start colon cancer screening at age 30, not 50, says this musician with cancer",https://www.cbc.ca/radio/whitecoat/colon-cancer-screening-1.7151051,negative,0.04037719,0.24117222,0.7184505,-0.05653374566204317
CBC,2024-03-26,"Palestinians, and some Israelis, see Marwan Barghouti as key to peace. They need him out of prison first",https://www.cbc.ca/news/world/marwan-barghouti-peace-1.7154912,negative,0.063015215,0.3038253,0.6331595,-0.08833888079296415
CBC,2024-03-26,Bridge collapses in Baltimore after cargo ship hits it,https://www.cbc.ca/player/play/1.7155510,negative,0.01127144,0.7592618,0.22946683,-0.5763513939676344
CBC,2024-03-26,Canada building new lab to work with world's most dangerous pathogens,https://www.cbc.ca/player/play/1.7156189,negative,0.037349813,0.4623274,0.50032264,-0.21235167064722837
CBC,2024-03-26,Parliamentary committee agrees to take on probe of Winnipeg lab scandal,https://www.cbc.ca/news/politics/winnipeg-lab-committee-1.7155676,neutral,0.047068894,0.029285071,0.92364615,0.0013578632790484102
CBC,2024-03-26,A bridge collapse from ship impact 'extremely unusual': expert,https://www.cbc.ca/player/play/1.7155705,negative,0.019875467,0.4129002,0.5672243,-0.17009154876330612
CBC,2024-03-26,Canada Goose is laying off 17 per cent of its global corporate staff,https://www.cbc.ca/news/business/canada-goose-layoffs-1.7155797,negative,0.014339031,0.724737,0.26092398,-0.5250380947892097
CBC,2024-03-26,"Blue Jays leaning on bats, looking for more after 3rd wild-card sweep in 4 seasons",https://www.cbc.ca/sports/baseball/mlb/toronto-blue-jays-season-preview-2024-mlb-1.7155777,neutral,0.109089345,0.005657068,0.8852535,0.01186849271995305
CBC,2024-03-26,Baltimore bridge collapse triggers search for survivors,https://www.cbc.ca/player/play/1.7155571,negative,0.013151078,0.67232025,0.31452867,-0.45184158365682947
CBC,2024-03-26,Poor cocoa harvests cause bitter price increase for Easter chocolate,https://www.cbc.ca/player/play/1.7155448,negative,0.01078397,0.8712289,0.11798707,-0.7589235333334621
CBC,2024-03-26,Bar nun: These Spanish sisters pour pious pints,https://www.cbc.ca/player/play/1.7155242,neutral,0.13180839,0.0721635,0.7960281,0.012165881928308142
CBC,2024-03-26,First airlift for Canadians fleeing Haiti succeeds after weather delay,https://www.cbc.ca/news/politics/airlift-canadians-fleeing-haiti-1.7155916,neutral,0.086273156,0.02875959,0.8849672,0.0066159459449544045
CBC,2024-03-26,"King Charles to attend Easter service, his first major event since cancer diagnosis",https://www.cbc.ca/news/world/king-charles-cancer-easter-1.7155527,positive,0.39226553,0.0062093716,0.60152495,0.1538337460105943
CBC,2024-03-26,They used to say photos don't lie. They were wrong,https://www.cbc.ca/news/canada/photo-editing-media-royal-family-1.7149755,negative,0.01603705,0.639652,0.3443109,-0.40889753044273114
CBC,2024-03-26,WATCH : CBC News Explore,https://www.cbc.cahttps://gem.cbc.ca/live,neutral,0.09840742,0.014817321,0.88677526,0.009464467482493077
CBC,2024-03-26,WATCH: CBC News Network,https://www.cbc.cahttps://gem.cbc.ca/live,neutral,0.10073908,0.018231502,0.88102955,0.00981596340483426
CBC,2024-03-26,Search continues in Baltimore for 6 people after bridge collapse,https://www.cbc.ca/news/world/bridge-collapse-baltimore-1.7155488,negative,0.022116786,0.43174118,0.546142,-0.1859113172572009
CBC,2024-03-26,Sean (Diddy) Combs residences searched in connection with sex trafficking investigation,https://www.cbc.ca/news/entertainment/sean-diddy-combs-search-1.7155667,neutral,0.019617427,0.22352855,0.7568539,-0.04958019933530622
CBC,2024-03-26,"British High Court wants more U.S. assurances on Julian Assange, extending his extradition fight",https://www.cbc.ca/news/world/assange-extradition-latest-1.7155496,neutral,0.13489237,0.011687627,0.8534201,0.018059341870816592
CBC,2024-03-26,"Canada's need to improve productivity has reached emergency level, says Bank of Canada official",https://www.cbc.ca/news/business/bank-of-canada-carolyn-rogers-productivity-1.7155832,neutral,0.11926744,0.07565893,0.8050736,0.008500448845825126
CBC,2024-03-26,"By taking cash, woman implicitly agreed to settlement with Robert Miller, Quebec judge rules",https://www.cbc.ca/news/canada/montreal/settlement-robert-miller-cash-envelope-underage-girls-1.7155622,neutral,0.06104958,0.015843876,0.9231065,0.003476025248533521
CBC,2024-03-26,"Government falling short on promise to roll out automatic tax filing pilot, experts say",https://www.cbc.ca/news/politics/automatic-tax-filing-system-1.7140438,negative,0.013126373,0.6046404,0.38223326,-0.36541770570634213
CBC,2024-03-26,Finding missing people is the NTSB's highest priority after Baltimore bridge collapse,https://www.cbc.ca/player/play/1.7156180,neutral,0.096311405,0.21099573,0.6926928,-0.0352433179913314
CBC,2024-03-26,Impact of bridge collapse on shipping and transportation,https://www.cbc.ca/player/play/1.7155941,negative,0.02540939,0.4647495,0.5098411,-0.21534645950558584
CBC,2024-03-26,"Drake Landing, a solar energy community south of Calgary, loses its sizzle as system starts to fail",https://www.cbc.ca/news/canada/calgary/okotoks-drake-landing-solar-energy-repairs-future-1.7148389,negative,0.009425799,0.8107299,0.17984436,-0.657194074939472
CBC,2024-03-26,Quebec biology students allege degrading hazing at Université de Sherbrooke,https://www.cbc.ca/news/canada/montreal/quebec-biology-students-allege-degrading-hazing-sherbrooke-1.7155890,negative,0.008056157,0.64524704,0.34669676,-0.4162788626556786
CBC,2024-03-26,What to expect from today's Ontario budget,https://www.cbc.ca/news/canada/toronto/ontario-budget-preview-doug-ford-economy-1.7154986,neutral,0.024508866,0.13722034,0.83827084,-0.01822873171940298
CBC,2024-03-26,"Can't find a family doctor? It might be because they're busy doing other specialties, report finds",https://www.cbc.ca/news/health/family-medicine-specialties-cihi-1.7155269,negative,0.012623306,0.5470345,0.4403422,-0.2990873984529685
CBC,2024-03-26,"Cinema says it postponed Hamilton Jewish Film Festival due to 'high tensions,' as event finds new home",https://www.cbc.ca/news/canada/hamilton/playhouse-jewish-film-festival-1.7155110,negative,0.009002056,0.65124965,0.33974826,-0.4240451046393261
CBC,2024-03-26,B.C. mining company denies ethics watchdog's claim it used forced Uyghur labour in China,https://www.cbc.ca/news/canada/british-columbia/forced-labour-watchdog-bc-mining-company-dynasty-1.7155795,negative,0.0077079,0.6522489,0.3400432,-0.42536924072234683
CBC,2024-03-26,"Zoo ostrich legs it, causes traffic chaos in South Korea",https://www.cbc.ca/player/play/1.7156053,negative,0.010432951,0.7500706,0.2394963,-0.5624971374403565
CBC,2024-03-26,"Shortage of wooden hydro poles threatens reliability of grid, say electricity producers",https://www.cbc.ca/news/politics/shortage-utility-poles-shortage-1.7156074,negative,0.015394519,0.6377369,0.34686854,-0.40647140236543144
