source,date,headline,url,chosen_label,positive,negative,neutral,compound
CTV,2024-03-31,An Israeli airstrike on a hospital tent camp in Gaza kills 2 Palestinians,https://www.ctvnews.ca/world/an-israeli-airstrike-on-a-hospital-tent-camp-in-gaza-kills-2-palestinians-1.6828173,negative,0.006261069,0.84196556,0.1517733,-0.7088668716960012
CTV,2024-03-31,'Like a cartel:' Shootings point to turf war over rights to screen South Indian films,https://toronto.ctvnews.ca/like-a-cartel-shootings-point-to-turf-war-over-rights-to-screen-south-indian-films-1.6828142,negative,0.009218539,0.60896516,0.3818162,-0.3707536547169248
CTV,2024-03-31,Nunavut celebrates 25th anniversary with optimism but also housing concerns,https://www.ctvnews.ca/canada/nunavut-celebrates-25th-anniversary-with-optimism-but-also-housing-concerns-1.6828182,positive,0.38216004,0.062379535,0.5554604,0.14215509710038
CTV,2024-03-31,"Shooting outside downtown Indianapolis mall wounds 7 youths, police say",https://www.ctvnews.ca/world/shooting-outside-downtown-indianapolis-mall-wounds-7-youths-police-say-1.6828212,negative,0.009788685,0.5643997,0.42581174,-0.31845114194174506
CTV,2024-03-31,Danielle Smith says she would consider changes to recall legislation,https://calgary.ctvnews.ca/danielle-smith-says-she-would-consider-changes-to-recall-legislation-1.6827932,neutral,0.07397349,0.0070088655,0.91901755,0.005422959279144379
CTV,2024-03-31,Busy Easter weekend so far for Collingwood OPP,https://barrie.ctvnews.ca/busy-easter-weekend-so-far-for-collingwood-opp-1.6828168,neutral,0.22608927,0.061448842,0.71246177,0.04734041693029667
CTV,2024-03-31,March 30: CAF deployed to Jamaica amid crisis in Haiti,/video/c2887597-ctv-national-news-for-saturday--march-30--2024?playlistId=1.6828132,neutral,0.020385807,0.1796466,0.7999675,-0.031857330517819804
CTV,2024-03-31,"Benches clear after Cabrera, Caballero exchange words in Blue Jays' 5-1 loss to Rays",https://www.ctvnews.ca/sports/benches-clear-after-cabrera-caballero-exchange-words-in-blue-jays-5-1-loss-to-rays-1.6828065,neutral,0.03942277,0.046944987,0.91363233,-0.0006496764111285636
CTV,2024-03-31,How Beyonce answered Dolly Parton’s call and switched up the lyrics to 'Jolene',https://www.ctvnews.ca/entertainment/how-beyonce-answered-dolly-parton-s-call-and-switched-up-the-lyrics-to-jolene-1.6827590,neutral,0.11941408,0.024224972,0.856361,0.013672871163698197
CTV,2024-03-31,Dog named 'Hero' kept stuck owner warm and safe from coyotes for 2 days: police,https://calgary.ctvnews.ca/dog-named-hero-kept-stuck-owner-warm-and-safe-from-coyotes-for-2-days-police-1.6828090,positive,0.40314317,0.009427705,0.58742905,0.16243556723873098
CTV,2024-03-31,Eastern Ontario could see up to 20 cm of snow Wednesday: Environment Canada,https://ottawa.ctvnews.ca/eastern-ontario-could-see-up-to-20-cm-of-snow-wednesday-environment-canada-1.6827888,neutral,0.036659166,0.14753245,0.81580836,-0.020421932100358475
CTV,2024-03-31,Chrystia Freeland stops by Toronto pharmacy to highlight drug coverage for diabetes and contraceptives in upcoming budget,https://toronto.ctvnews.ca/chrystia-freeland-stops-by-toronto-pharmacy-to-highlight-drug-coverage-for-diabetes-and-contraceptives-in-upcoming-budget-1.6828034,neutral,0.20728411,0.006460162,0.78625554,0.04292500658340881
CTV,2024-03-31,"Arnprior bowling alley, oldest in Canada, to be featured on HGTV renovation show",https://ottawa.ctvnews.ca/arnprior-bowling-alley-oldest-in-canada-to-be-featured-on-hgtv-renovation-show-1.6828008,neutral,0.14165111,0.007482671,0.8508661,0.02000906416939685
CTV,2024-03-31,Kitchener wins first game in series with Erie,https://kitchener.ctvnews.ca/kitchener-wins-first-game-in-series-with-erie-1.6827796,neutral,0.19851223,0.004944513,0.79654336,0.039382635556716394
CTV,2024-03-31,"15 years later, Winstead recalls 'Scott Pilgrim' shoot: 'Toronto was our playground'",https://toronto.ctvnews.ca/15-years-later-winstead-recalls-scott-pilgrim-shoot-toronto-was-our-playground-1.6827705,neutral,0.118189916,0.025011491,0.8567985,0.013343286931505105
CTV,2024-03-31,Suspect fled on foot following Riverside Drive crash,https://windsor.ctvnews.ca/suspect-fled-on-foot-following-riverside-drive-crash-1.6828061,negative,0.016646903,0.40173593,0.5816172,-0.1611146397588854
CTV,2024-03-31,Endangered North Atlantic right whales lose three of 19 calves this season,https://atlantic.ctvnews.ca/endangered-north-atlantic-right-whales-lose-three-of-19-calves-this-season-1.6827379,negative,0.015486434,0.65794754,0.32656595,-0.43265519402555164
CTV,2024-03-31,SIU investigation underway in Orillia after incident,https://barrie.ctvnews.ca/siu-investigation-underway-in-orillia-after-incident-1.6827866,negative,0.022881141,0.23090965,0.74620926,-0.05279570875719308
CTV,2024-03-31,"Teen dead, 3 youths arrested after stabbing in Prince George, B.C.",https://bc.ctvnews.ca/teen-dead-3-youths-arrested-after-stabbing-in-prince-george-b-c-1.6827423,negative,0.008161387,0.7032505,0.28858823,-0.4944946135070758
CTV,2024-03-31,Group of Tim Hortons franchisees in Quebec sue brand owner for $18.9 million,https://montreal.ctvnews.ca/group-of-tim-hortons-franchisees-in-quebec-sue-brand-owner-for-18-9-million-1.6828147,negative,0.030109158,0.34478757,0.62510324,-0.11797191438137844
CTV,2024-03-31,"Man exposed himself in view of children on Vancouver Island, RCMP say",https://bc.ctvnews.ca/man-exposed-himself-in-view-of-children-on-vancouver-island-rcmp-say-1.6826966,negative,0.014316689,0.2726788,0.7130045,-0.07414875659621956
CTV,2024-03-31,They met hiking Machu Picchu but didn't swap details and never expected to meet up again. That's not how it worked out,https://www.ctvnews.ca/lifestyle/they-met-hiking-machu-picchu-but-didn-t-swap-details-and-never-expected-to-meet-up-again-that-s-not-how-it-worked-out-1.6827271,negative,0.014253478,0.6425812,0.34316525,-0.41270748655014344
CTV,2024-03-31,Police in Haiti say two men were hacked to death by a mob who thought they were buying ammo for gangs,https://www.ctvnews.ca/world/police-in-haiti-say-two-men-were-hacked-to-death-by-a-mob-who-thought-they-were-buying-ammo-for-gangs-1.6827991,negative,0.005810709,0.83763695,0.1565524,-0.7016018169953497
CTV,2024-03-31,Iowa's Caitlin Clark of Iowa enters game vs. LSU at No. 6 on all-division list,https://www.ctvnews.ca/sports/iowa-s-caitlin-clark-of-iowa-enters-game-vs-lsu-at-no-6-on-all-division-list-1.6828013,neutral,0.048182495,0.005537528,0.94628,0.0022908874840492643
CTV,2024-03-31,"Study says since 1979 climate change has made heat waves last longer, spike hotter, hurt more people",https://www.ctvnews.ca/climate-and-environment/study-says-since-1979-climate-change-has-made-heat-waves-last-longer-spike-hotter-hurt-more-people-1.6827589,negative,0.012248727,0.77346194,0.21428925,-0.598093382771772
CTV,2024-03-31,Mother arrested after infant dies of fentanyl exposure,https://winnipeg.ctvnews.ca/mother-arrested-after-infant-dies-of-fentanyl-exposure-1.6827858,negative,0.008041963,0.81839234,0.17356564,-0.6697013790440147
CTV,2024-03-31,Saanich Peninsula chamber warns region will lose 27% of workers to 'discriminatory' housing policies,https://bc.ctvnews.ca/saanich-peninsula-chamber-warns-region-will-lose-27-of-workers-to-discriminatory-housing-policies-1.6827521,negative,0.0061217733,0.79856366,0.19531469,-0.6376663592426484
CTV,2024-03-31,"1 in critical condition after crash with OC Transpo bus south Ottawa, police seek witnesses",https://ottawa.ctvnews.ca/1-in-critical-condition-after-crash-with-oc-transpo-bus-south-ottawa-police-seek-witnesses-1.6827994,negative,0.022908853,0.38512802,0.59196305,-0.14779879817437802
CTV,2024-03-31,"Custom mobility bike returned after London, Ont. owner discovers it for sale online",https://london.ctvnews.ca/custom-mobility-bike-returned-after-london-ont-owner-discovers-it-for-sale-online-1.6827945,neutral,0.14440705,0.015010604,0.8405824,0.020628073473744735
CTV,2024-03-31,China's latest EV is a 'connected' car from smart phone and electronics maker Xiaomi,https://www.ctvnews.ca/autos/china-s-latest-ev-is-a-connected-car-from-smart-phone-and-electronics-maker-xiaomi-1.6825581,positive,0.24702695,0.009287772,0.74368525,0.06093605841489591
CTV,2024-03-31,Fog advisory issued for parts of southern Alberta Saturday morning,https://calgary.ctvnews.ca/fog-advisory-issued-for-parts-of-southern-alberta-saturday-morning-1.6827772,negative,0.01865326,0.52255255,0.45879412,-0.27271325276265657
CTV,2024-03-31,OPP investigating copper theft in Zorra,https://london.ctvnews.ca/opp-investigating-copper-theft-in-zorra-1.6827755,neutral,0.027813628,0.16783956,0.80434674,-0.027396529383929114
CTV,2024-03-31,Montreal doctors discover cerebral palsy genetic causes,/video/c2894832-ctv-national-news--breakthrough-by-mtl--doctors,neutral,0.03586305,0.18245636,0.7816805,-0.03200417293316882
CTV,2024-03-31,Niagara region under emergency in preparation for eclipse,/video/c2894831-ctv-national-news--solar-eclipse-emergency?playlistId=1.6808417,neutral,0.032918576,0.12874089,0.8383405,-0.015490586242432158
CTV,2024-03-31,"Ontario homeowner on the hook for $27,000 when contractor severed power line",https://toronto.ctvnews.ca/ontario-homeowner-on-the-hook-for-27-000-when-contractor-severed-power-line-1.6826797,negative,0.010455432,0.730928,0.2586166,-0.534146409242588
CTV,2024-03-31,Sask. RCMP advising drivers to check road conditions before venturing out,https://regina.ctvnews.ca/sask-rcmp-advising-drivers-to-check-road-conditions-before-venturing-out-1.6827330,neutral,0.025658915,0.07655882,0.8977822,-0.005202876277854429
CTV,2024-03-31,Lethbridge’s Christa Deguchi wins gold at Antalya Grand Slam judo competition,https://calgary.ctvnews.ca/lethbridge-s-christa-deguchi-wins-gold-at-antalya-grand-slam-judo-competition-1.6827779,positive,0.42823532,0.003108435,0.56865615,0.1833758668101364
CTV,2024-03-31,Hundreds take part in Saturday egg hunt at historic Magrath Mansion,https://edmonton.ctvnews.ca/hundreds-take-part-in-saturday-egg-hunt-at-historic-magrath-mansion-1.6828069,neutral,0.20815729,0.0066387313,0.7852038,0.04328541595683255
CTV,2024-03-31,"Avoiding shrinkflation is difficult, but these shoppers have a few tips",https://www.ctvnews.ca/business/avoiding-shrinkflation-is-difficult-but-these-shoppers-have-a-few-tips-1.6828156,neutral,0.18785939,0.11953244,0.6926082,0.021003143407571034
CTV,2024-03-31,"Teen's childhood dream realized, competing at FIRST Robotics competition",https://windsor.ctvnews.ca/teen-s-childhood-dream-realized-competing-at-first-robotics-competition-1.6827984,positive,0.8449859,0.0027340148,0.15228003,0.7139937505179788
CTV,2024-03-31,Killer whale rescue team puts boats back in lagoon in effort to entice calf to ocean,https://bc.ctvnews.ca/killer-whale-rescue-team-puts-boats-back-in-lagoon-in-effort-to-entice-calf-to-ocean-1.6826783,negative,0.013497271,0.7167426,0.26976016,-0.5135377211827823
CTV,2024-03-31,Where is the worst place for allergy sufferers in Canada?,https://www.ctvnews.ca/canada/where-is-the-worst-place-for-allergy-sufferers-in-canada-1.6825876,negative,0.0068671564,0.8975836,0.09554903,-0.8056093404332412
CTV,2024-03-31,Tipping is off the table at this Toronto restaurant,https://toronto.ctvnews.ca/tipping-is-off-the-table-at-this-toronto-restaurant-1.6824679,negative,0.10026028,0.42070627,0.47903353,-0.16694161350116765
CTV,2024-03-31,Fisheries officials monitoring orphaned orca calf in lagoon off Vancouver Island,https://bc.ctvnews.ca/fisheries-officials-monitoring-orphaned-orca-calf-in-lagoon-off-vancouver-island-1.6827610,neutral,0.026321411,0.070515096,0.9031636,-0.004279556838024945
CBC,2024-03-31,Heavy rains result in major washouts on Newfoundland's west coast,https://www.cbc.ca/news/canada/newfoundland-labrador/heavy-rains-result-in-major-washouts-on-newfoundland-s-west-coast-1.7159833,negative,0.01130166,0.79037523,0.1983231,-0.6245653046862962
CBC,2024-03-31,Youth are becoming the main market for nicotine pouches — and experts are having e-cigarette déjà vu,https://www.cbc.ca/radio/whitecoat/nicotine-pouches-youth-1.7158053,negative,0.044901658,0.37099102,0.58410734,-0.13561816835601626
CBC,2024-03-31,The current carbon tax debate is important — it's just not serious,https://www.cbc.ca/news/politics/carbon-tax-trudeau-poilievre-1.7159005,negative,0.05582545,0.536685,0.4074895,-0.2849143270938166
CBC,2024-03-31,WATCH | Poor cocoa harvests cause bitter price increase for Easter chocolate,https://www.cbc.cahttps://www.cbc.ca/player/play/1.7155448,negative,0.008700404,0.8323807,0.15891887,-0.692781940000609
CBC,2024-03-31,New Brunswick moves to pay farmers who set aside land for conservation,https://www.cbc.ca/news/canada/new-brunswick/farmers-paid-setting-aside-conservation-land-1.7159027,neutral,0.063760564,0.02756389,0.9086755,0.003305643216127141
CBC,2024-03-31,"Chance Perdomo, star of Chilling Adventures of Sabrina and Gen V, dies in motorcycle crash at 27",https://www.cbc.ca/news/entertainment/chance-perdomo-obit-1.7160047,neutral,0.039713193,0.12764432,0.8326425,-0.014715933863213237
CBC,2024-03-31,A dog named Hero saves his owner's life,https://www.cbc.ca/player/play/1.7159817,positive,0.8126977,0.00674444,0.18055794,0.6604320059869124
CBC,2024-03-31,It's the Easter Penguin! Adopt-an-egg conservation program launches in South Africa,https://www.cbc.ca/player/play/1.7159600,positive,0.58710724,0.003699513,0.4091932,0.3446812433977424
CBC,2024-03-31,"I solo hiked from Mexico to Canada for my inner journey. Instead, I found myself looking outward",https://www.cbc.cahttps://www.cbc.ca/newsinteractives/features/First-person-Jessica-Donnan-pacific-crest-trail,neutral,0.05865257,0.12658478,0.8147628,-0.012583575871358832
CBC,2024-03-31,The Easter bunny is coming for your wallet; Schools vs. social media giants: CBC's Marketplace cheat sheet,https://www.cbc.ca/news/business/marketplace-cheat-sheet-march31-1.7158977,negative,0.09177423,0.27919048,0.6290354,-0.06952479375932441
CBC,2024-03-31,The race to save a baby orca trapped in a lagoon off Vancouver Island,https://www.cbc.ca/player/play/1.7159812,neutral,0.059501063,0.16251266,0.7779862,-0.022869992323076183
CBC,2024-03-31,Can you ever really verify a photo?,https://www.cbc.ca/player/play/1.7159739,negative,0.016789896,0.5088768,0.47433332,-0.25867369794113326
CBC,2024-03-31,At Issue | Trudeau’s pre-budget charm offensive,https://www.cbc.ca/player/play/1.7159422,neutral,0.08386051,0.08921811,0.8269214,-0.000927286018657103
CBC,2024-03-31,How EV demand could revive California’s most polluted lake,https://www.cbc.ca/player/play/1.7159816,neutral,0.09768001,0.23950769,0.6628123,-0.0478225478137464
CBC,2024-03-31,"An orphaned boy from Gaza is getting a rare chance at a fresh start, possibly in Canada",https://www.cbc.ca/news/world/yahya-hamad-gaza-1.7159564,neutral,0.1314384,0.050666854,0.8178947,0.014708927668873883
CBC,2024-03-31,This week's most compelling Canadian images,https://www.cbc.cahttps://www.cbc.ca/newsinteractives/features/compelling-canadian-images-3-23,positive,0.5873562,0.006504753,0.4061391,0.3449449531195192
CBC,2024-03-31,WATCH: CBC News Network,https://www.cbc.cahttps://gem.cbc.ca/live,neutral,0.10073908,0.018231502,0.88102955,0.00981596340483426
CBC,2024-03-31,Daytime shooting closes down Vancouver's busy Robson Street to traffic and pedestrians,https://www.cbc.ca/news/canada/british-columbia/robson-street-shooting-1.7160073,negative,0.013411245,0.6074518,0.37913698,-0.3688178241833775
CBC,2024-03-31,Hamilton pizzeria wins big at Vegas pizza contest after 'buzzer beater' scramble to fly in its dough,https://www.cbc.ca/news/canada/hamilton/cowabunga-pizza-win-1.7158661,positive,0.72375554,0.005334416,0.27090997,0.523793666060989
CBC,2024-03-31,Canadian Zach Edey dominates NCAA March Madness,https://www.cbc.ca/player/play/1.7159417,positive,0.4040372,0.0038418437,0.5921208,0.16323135285257706
CBC,2024-03-31,Ottawa falling short of $10-per-day child care for all families,https://www.cbc.ca/player/play/1.7159811,negative,0.01971766,0.6298516,0.3504308,-0.3963242273282468
CBC,2024-03-31,"Yes, seasonal allergies are arriving earlier",https://www.cbc.ca/player/play/1.7157977,negative,0.049397126,0.60143787,0.34916502,-0.35928743291681897
CBC,2024-03-31,Crews begin painstaking process of removing steel from collapsed Baltimore bridge,https://www.cbc.ca/news/world/crews-begin-painstaking-process-of-removing-steel-from-collapsed-baltimore-bridge-1.7160011,negative,0.03761469,0.24158253,0.7208028,-0.05694725294311809
CBC,2024-03-31,The Salton Sea is drying up. Below it is one of the largest lithium deposits in North America,https://www.cbc.cahttps://www.cbc.ca/newsinteractives/features/lithium-valley,negative,0.045765314,0.27012056,0.6841141,-0.07087066058012326
CBC,2024-03-31,What can B.C. expect for this year's wildfire season?,https://www.cbc.ca/player/play/1.7159795,neutral,0.021982322,0.0509242,0.92709357,-0.0021100492102300583
CBC,2024-03-31,Afraid of the dark? Why Canadian schools are closing for the solar eclipse,https://www.cbc.ca/news/schools-cancel-for-eclipse-1.7159674,negative,0.011577169,0.54934496,0.4390779,-0.30164581828595516
CBC,2024-03-31,"Trans content creators say social media can be toxic, but won't let hate push them offline",https://www.cbc.ca/news/canada/anti-transgender-hate-online-1.7146085,negative,0.020115929,0.56934834,0.41053575,-0.32375287695628785
CBC,2024-03-31,Trump's 'law and order' message more complicated this time around on campaign trail,https://www.cbc.ca/news/world/trump-police-violent-crime-1.7159535,negative,0.03653577,0.4162904,0.54717386,-0.17196282535547525
CBC,2024-03-31,He ran luxury hotels in Dubai. Now he’s in a Canadian fast food war room,https://www.cbc.ca/news/business/a-w-test-kitchen-fast-food-wars-1.7151343,negative,0.018119916,0.6759787,0.30590135,-0.4566188982397428
CBC,2024-03-31,Canadian Forces personnel deploy to Jamaica to train troops for Haiti mission,https://www.cbc.ca/news/caf-members-deploy-jamaica-haiti-mission-1.7159885,neutral,0.025887137,0.027747264,0.9463657,-9.976657549337631e-05
CBC,2024-03-31,WATCH : CBC News Explore,https://www.cbc.cahttps://gem.cbc.ca/live,neutral,0.09840742,0.014817321,0.88677526,0.009464467482493077
CBC,2024-03-31,Canadians Josh Liendo and Ilya Kharun win national titles at NCAA swimming championships,https://www.cbc.ca/sports/olympics/summer/aquatics/josh-liendo-ilya-kharun-swimming-ncaa-championships-1.7160085,positive,0.5071478,0.0022996278,0.49055263,0.25719357665199105
CBC,2024-03-31,The federal government promised to plant two billion trees. How's that going?,https://www.cbc.cahttps://www.cbc.ca/newsinteractives/features/two-billion-trees,neutral,0.21768764,0.042246405,0.7400659,0.04560316439654777
CBC,2024-03-31,Carbon tax crash course: How it works and what it will cost you,https://www.cbc.ca/player/play/1.7159735,negative,0.016012553,0.57870054,0.40528685,-0.3346379496323877
CBC,2024-03-31,Monumental cleanup operation begins in Baltimore after bridge collapse,https://www.cbc.ca/player/play/1.7159522,neutral,0.038318917,0.17114998,0.79053104,-0.027823985529320083
CBC,2024-03-31,"Climate change is bringing earlier springs, but it's wreaking havoc on animals",https://www.cbc.ca/news/science/climate-change-natural-world-1.7148719,negative,0.011364384,0.8007809,0.18785469,-0.6411208997553777
CBC,2024-03-31,Maple Leafs' Auston Matthews reaches 60-goal mark for 2nd time in 3 seasons,https://www.cbc.ca/sports/hockey/nhl/auston-matthews-2nd-60-goal-season-1.7160064,positive,0.2925472,0.0043220473,0.70313084,0.08556515607228121
CBC,2024-03-31,A million mice are eating seabirds alive on a remote island. Conservationists have a plan,https://www.cbc.ca/radio/thecurrent/marion-island-million-mice-killing-seabirds-1.7157260,negative,0.026714396,0.6737034,0.2995822,-0.4531625950284628
CBC,2024-03-31,Family calls on Canadian government to help Fredericton man kidnapped in Congo,https://www.cbc.ca/news/canada/new-brunswick/family-calls-on-canadian-government-to-help-fredericton-man-1.7159677,neutral,0.03831787,0.07506524,0.886617,-0.00416652686409047
CBC,2024-03-31,Alberta NDP leadership candidates torn about automatic ties to federal party,https://www.cbc.ca/news/canada/calgary/alberta-ndp-federal-party-ties-1.7159926,neutral,0.025121585,0.09524097,0.8796374,-0.008439750483584252
CBC,2024-03-31,King Charles attends Easter service in first major public outing since cancer diagnosis,https://www.cbc.ca/news/world/king-charles-cancer-easter-service-1.7160092,positive,0.39429626,0.0063500972,0.5993537,0.1554292042831129
CBC,2024-03-31,Is there really a competitive advantage? Debate over trans athletes tests science and inclusion,https://www.cbc.ca/news/canada/edmonton/trans-athlete-competition-alberta-1.7157218,negative,0.028144695,0.35895926,0.61289597,-0.12805965476616166
CBC,2024-03-31,"From chocolate to home insurance, climate change is making life more expensive",https://www.cbc.ca/news/business/climate-change-inflation-1.7155668,negative,0.01955976,0.75455266,0.22588758,-0.568967147777033
CBC,2024-03-31,"Little recourse for parents denied rentals because of kids, says couple",https://www.cbc.ca/news/canada/nova-scotia/complaint-process-parents-denied-rentals-1.7159916,negative,0.010259241,0.6590114,0.33072925,-0.4341908823448648
