source,date,headline,url,chosen_label,positive,negative,neutral,compound
Global,2024-05-19,Does ‘No Mow May’ actually help bees? A master gardener and professor weigh in,https://globalnews.ca/news/10504895/no-mow-may-master-gardener-nova-scotia/,neutral,0.107896335,0.082386434,0.8097173,0.004854092967014445
Global,2024-05-19,Heading out for the May long weekend? Here’s what to expect for gas prices,https://globalnews.ca/news/10500571/gas-prices-may-long-weekend-2024/,neutral,0.07186271,0.027218862,0.90091836,0.004423385586147077
Global,2024-05-19,Taking your dog to the U.S.? New requirements go into effect Aug. 1,https://globalnews.ca/news/10500836/rules-dog-us-border-august-1-2024/,neutral,0.043339223,0.06053838,0.8961224,-0.0017866073934342808
Global,2024-05-19,"CRA’s handling of bare trust reporting rules needs ‘systemic review,’ MP says",https://globalnews.ca/video/10412956/cras-handling-of-bare-trust-reporting-rules-needs-systemic-review-mp-says/,negative,0.008290939,0.596071,0.3956379,-0.3552319906362751
Global,2024-05-19,Tenants don’t have to foot unpaid tax bills for foreign landlords: minister,https://globalnews.ca/news/10503736/tenant-landlord-tax-rules-cra/,neutral,0.051019747,0.10586637,0.8431138,-0.008604679796421433
Global,2024-05-19,"Arthur Irving celebrated at memorial service in Saint John, N.B.",https://globalnews.ca/news/10511566/arthur-irving-celebrated-memorial-service-saint-john/,positive,0.69591534,0.0031607237,0.30092403,0.48428811030717256
Global,2024-05-19,Golf pro Scottie Scheffler says arrest ahead of PGA Championship was big misunderstanding,https://globalnews.ca/video/10504584/golf-pro-scottie-scheffler-says-arrest-ahead-of-pga-championship-was-big-misunderstanding/,negative,0.016185027,0.39539927,0.58841574,-0.15607861862129724
Global,2024-05-19,Evacuation order lifted for residents of Fort McMurray,https://globalnews.ca/video/10505564/evacuation-order-lifted-for-residents-of-fort-mcmurray/,neutral,0.025526313,0.055347167,0.91912645,-0.0024117182841362217
Global,2024-05-19,"More wildfire resilience needed in B.C., University of Victoria report says",https://globalnews.ca/video/10505570/more-wildfire-resilience-needed-in-b-c-university-of-victoria-report-says/,neutral,0.07941792,0.028100977,0.892481,0.005517545307148097
Global,2024-05-19,"Man, 27, fatally stabbed in St. Henri apartment building: Montreal police",https://globalnews.ca/video/10505506/man-27-fatally-stabbed-in-st-henri-apartment-building-montreal-police/,negative,0.015150077,0.58178973,0.40306035,-0.338249683173963
Global,2024-05-19,Locals find ways to pinch their pennies for summer staycations near Regina,https://globalnews.ca/news/10505481/locals-summer-staycations-near-regina/,negative,0.06672289,0.23673506,0.696542,-0.05159155073137356
Global,2024-05-19,Refuse a breath test? What Ontario drivers should know under new police mandate,https://globalnews.ca/news/10494676/refuse-breath-test-ontario-drivers-new-police-mandate/,negative,0.015614408,0.32063192,0.6637538,-0.1025609733824151
Global,2024-05-19,"Scottie Scheffler, world’s No. 1 golfer, arrested outside PGA Championship",https://globalnews.ca/news/10502856/scottie-scheffler-arrested-pga-championship/,neutral,0.04694957,0.071565844,0.8814846,-0.0029174069936295233
Global,2024-05-19,Feds reject City of Toronto’s drug decriminalization request,https://globalnews.ca/video/10505457/canada-rejects-city-of-torontos-drug-decriminalization-request/,negative,0.013007584,0.55217093,0.4348215,-0.30472354129969403
Global,2024-05-19,"As Canada renews strategy for Rohingya crisis, advocates urge rethink",https://globalnews.ca/news/10511557/canada-rohingya-crisis/,neutral,0.02351112,0.16982645,0.8066624,-0.028288258773969233
Global,2024-05-19,Montreal’s La Ronde amusement park kicks off 2024 summer season,https://globalnews.ca/video/10505510/montreals-la-ronde-amusement-park-kicks-off-2024-summer-season/,positive,0.29852167,0.0032068444,0.6982715,0.08910489341545969
Global,2024-05-19,Did serial killer linked to 1970’s Alberta deaths also strike in BC?,https://globalnews.ca/video/10505604/did-serial-killer-linked-to-1970s-alberta-deaths-also-strike-in-bc/,negative,0.0065956675,0.6872651,0.3061392,-0.47228983246670353
Global,2024-05-19,B.C. mayor urges residents to not share images of wildfire-damaged properties,https://globalnews.ca/video/10505559/b-c-mayor-urges-residents-to-not-share-images-of-wildfire-damaged-properties/,negative,0.0095588835,0.483444,0.50699705,-0.23362676215171874
Global,2024-05-19,"3 people dead, 5 injured after serious boat collision north of Kingston, Ont.",https://globalnews.ca/news/10511631/3-people-dead-5-injured-boat-collision-kingston-ont/,negative,0.009157457,0.7035747,0.28726786,-0.4949334816560764
Global,2024-05-19,"New Brunswick man, 35, dead after ATV crash in Rollingdam, RCMP say",https://globalnews.ca/news/10511578/new-brunswick-man-dead-atv-crash-rollingdam/,negative,0.010587761,0.54963595,0.4397762,-0.3019876216655746
Global,2024-05-19,Overnight fires may be linked to Toronto tow truck wars,https://globalnews.ca/video/10505458/overnight-fires-may-be-linked-to-toronto-tow-truck-wars/,negative,0.011357195,0.4180218,0.5706211,-0.17461321375158434
Global,2024-05-19,More transparency needed after high-profile prison transfers: ex-watchdog,https://globalnews.ca/news/10503896/correctional-service-canada-prison-transfers-bail-west-block/,neutral,0.055853263,0.084205166,0.8599414,-0.003970927185783069
Global,2024-05-19,How were Egypt’s pyramids built? The mystery may finally be solved,https://globalnews.ca/news/10502645/egypt-pyramids-nile-river-branch-ahramat-mystery/,neutral,0.16568644,0.0733921,0.76092136,0.02206560604666752
Global,2024-05-19,Young athletes from across North America compete in Montreal’s Lindsay Burnett basketball tournament,https://globalnews.ca/video/10505512/young-athletes-from-across-north-america-compete-in-montreals-lindsay-burnett-basketball-tournament/,neutral,0.15593725,0.00384785,0.84021497,0.024301610019566766
Global,2024-05-19,Exclusive behind-the-scenes look at the RCMP training program to be one of the PM’s bodyguards,https://globalnews.ca/video/10504971/exclusive-behind-the-scenes-look-at-the-rcmp-training-program-to-be-one-of-the-pms-bodyguards/,neutral,0.058654774,0.013036327,0.9283089,0.0032704362892079786
Global,2024-05-19,Vaping in Canada may cost more as of July 1. Here’s why,https://globalnews.ca/news/10500449/vaping-tax-increase-canada/,negative,0.020149745,0.3546461,0.6252042,-0.12536782491254783
Global,2024-05-19,New rules for dog travel to U.S.,https://globalnews.ca/video/10502176/new-rules-for-dog-travel-to-u-s/,negative,0.027755983,0.23607339,0.7361706,-0.05496025649335223
Global,2024-05-19,More transparency needed after high-profile prison transfers: ex-watchdog,https://globalnews.ca/video/10504978/more-transparency-needed-after-high-profile-prison-transfers-ex-watchdog/,neutral,0.055853263,0.084205166,0.8599414,-0.003970927185783069
Global,2024-05-19,N.B. law grad frustrated after being unable to cross stage at his own graduation,https://globalnews.ca/news/10505290/new-brunswick-university-grad-embarrassed-after-unable-cross-the-stage/,negative,0.016324557,0.61390096,0.3697745,-0.3766078783528073
Global,2024-05-19,May long weekend marks unofficial start of gardening season,https://globalnews.ca/news/10505438/may-long-weekend-saskatchewan-gardening-season/,positive,0.34443408,0.0057956832,0.6497702,0.11860125729253035
Global,2024-05-19,"Universities’ and colleges’ growing deficits, layoffs concern unions across country",https://globalnews.ca/video/10505610/canadian-universities-and-colleges-growing-deficits-layoffs-concern-unions-across-country/,negative,0.016430264,0.62429506,0.3592746,-0.38947441772375946
Global,2024-05-19,No Mow May encouraging people not to mow lawns,https://globalnews.ca/video/10504122/no-mow-may-encouraging-people-not-to-mow-lawns/,negative,0.026277207,0.58593494,0.38778788,-0.3426292599729841
Global,2024-05-19,Will Quebec’s forest fire season be as bad as it was last year?,https://globalnews.ca/news/10497658/quebec-forest-wild-fire-outlook-summer-2024/,negative,0.0074122157,0.82402873,0.16855898,-0.6789684808856435
CTV,2024-05-19,Edmunds: The five things you need to know before buying your first used Tesla,https://www.ctvnews.ca/autos/edmunds-the-five-things-you-need-to-know-before-buying-your-first-used-tesla-1.6889932,neutral,0.12265643,0.014748249,0.8625952,0.014827101063064063
CTV,2024-05-19,Economists to have a close eye on April inflation report as BoC rate decision nears,https://www.ctvnews.ca/business/economists-to-have-a-close-eye-on-april-inflation-report-as-boc-rate-decision-nears-1.6893066,neutral,0.07438928,0.028359646,0.89725095,0.0047295012293608885
CTV,2024-05-19,'You can really start to feel the excitement': Unofficial start to summer kicks off in the Maritimes,https://atlantic.ctvnews.ca/you-can-really-start-to-feel-the-excitement-unofficial-start-to-summer-kicks-off-in-the-maritimes-1.6892379,positive,0.94008917,0.0017341037,0.058176596,0.8837647836261442
CTV,2024-05-19,"Flammable kids' sleepwear, salmonella-contaminated chips: Here are the recalls of this week",https://www.ctvnews.ca/health/flammable-kids-sleepwear-salmonella-contaminated-chips-here-are-the-recalls-of-this-week-1.6891474,negative,0.00919917,0.7942576,0.19654311,-0.6307606098068286
CTV,2024-05-19,"VIA Rail service delayed for hours due to suspicious package investigation in Kingston, Ont.",https://ottawa.ctvnews.ca/via-rail-service-delayed-for-hours-due-to-suspicious-package-investigation-in-kingston-ont-1.6892811,negative,0.0066272374,0.66996986,0.32340285,-0.44881570811125826
CTV,2024-05-19,Police remain tight-lipped one year after crash killed municipal worker near Victoria,https://bc.ctvnews.ca/police-remain-tight-lipped-one-year-after-crash-killed-municipal-worker-near-victoria-1.6891540,negative,0.008020288,0.7068648,0.2851149,-0.4995935049503597
CTV,2024-05-19,What to expect from PM Trudeau's visit to the U.S. next week,/video/c2925233-ctv-qp--one-on-one-with-ambassador-hillman?playlistId=1.6808280,neutral,0.059571236,0.011541727,0.928887,0.0034155219717377783
CTV,2024-05-19,"Suspect fled in 2-door Fiat after convenience store robbery, Merritt RCMP say",https://bc.ctvnews.ca/suspect-fled-in-2-door-fiat-after-convenience-store-robbery-merritt-rcmp-say-1.6882381,negative,0.018803649,0.28121117,0.6999852,-0.07872613546516583
CTV,2024-05-19,'Another pair of eyes watching over me:' How a B.C. woman's service dog saved her from drowning,https://bc.ctvnews.ca/another-pair-of-eyes-watching-over-me-how-a-b-c-woman-s-service-dog-saved-her-from-drowning-1.6890769,positive,0.27330166,0.03363467,0.6930637,0.07356250738320469
CTV,2024-05-19,'Sacred work': Sask. First Nation learning how to conduct its own underground searches,https://regina.ctvnews.ca/sacred-work-sask-first-nation-learning-how-to-conduct-its-own-underground-searches-1.6889689,neutral,0.03976188,0.021746024,0.93849206,0.001108118075878295
CTV,2024-05-19,'We're on standby': Team ready to help entangled right whale in Gulf of St. Lawrence,https://atlantic.ctvnews.ca/more/we-re-on-standby-team-ready-to-help-entangled-right-whale-in-gulf-of-st-lawrence-1.6886697,neutral,0.20364487,0.0127397645,0.78361547,0.04130891230880174
CTV,2024-05-19,Bernardeschi scores three goals as rampant Toronto FC thumps CF Montreal 5-1,https://montreal.ctvnews.ca/bernardeschi-scores-three-goals-as-rampant-toronto-fc-thumps-cf-montreal-5-1-1.6893106,positive,0.26214793,0.0047951154,0.73305696,0.06869854587955615
CTV,2024-05-19,U.S. ambassador 'not aware' of any plans for Trudeau-Trump meeting,https://www.ctvnews.ca/politics/u-s-ambassador-not-aware-of-any-plans-for-trudeau-trump-meeting-1.6892927,neutral,0.013755318,0.13471079,0.85153395,-0.017957780520248434
CTV,2024-05-19,Runners get ready to 'Giv'er' at the Blue Nose Marathon in Halifax,https://atlantic.ctvnews.ca/runners-get-ready-to-giv-er-at-the-blue-nose-marathon-in-halifax-1.6893086,neutral,0.17018576,0.0049759964,0.82483816,0.028938447092059505
CTV,2024-05-19,"Stock market today: Dow finishes above 40,000 to cap Wall Street's latest winning week",https://www.ctvnews.ca/business/stock-market-today-dow-finishes-above-40-000-to-cap-wall-street-s-latest-winning-week-1.6891887,positive,0.7891098,0.0040201824,0.20687015,0.6226780506978153
CTV,2024-05-19,Police investigating shooting at Waterloo business,https://kitchener.ctvnews.ca/police-investigating-shooting-at-waterloo-business-1.6893116,neutral,0.024539541,0.17415053,0.8013098,-0.02972623221652171
CTV,2024-05-19,Canada 'facing a crisis in family medicine': doctor,/video/c2925215-more-than-6m-canadians-without-a-family-doctor?playlistId=1.6822156,negative,0.016668994,0.38045353,0.6028775,-0.14446701961224662
CTV,2024-05-19,On the bright side with Julie Atchison,https://london.ctvnews.ca/on-the-bright-side-with-julie-atchison-1.6892873,positive,0.83137816,0.0070310887,0.16159075,0.6911402119665304
CTV,2024-05-19,'Reimagining Mother's Day': Toronto woman creates Motherless Day event after losing mom,https://toronto.ctvnews.ca/reimagining-mother-s-day-toronto-woman-creates-motherless-day-event-after-losing-mom-1.6883714,neutral,0.050837476,0.19078556,0.7583769,-0.033814690631209565
CTV,2024-05-19,"Oilers dominate Canucks, win to force deciding Game 7",https://edmonton.ctvnews.ca/oilers-dominate-canucks-win-to-force-deciding-game-7-1.6893041,positive,0.27509582,0.012559615,0.71234465,0.07551994282580665
CTV,2024-05-19,Northern Ont. man jailed 10 days for fishing violations,https://northernontario.ctvnews.ca/northern-ont-man-jailed-10-days-for-fishing-violations-1.6891463,negative,0.007536092,0.73974264,0.25272128,-0.5471623536986154
CTV,2024-05-19,63 traffic related charges issued during road safety week in Grenville County,https://ottawa.ctvnews.ca/63-traffic-related-charges-issued-during-road-safety-week-in-grenville-county-1.6893144,neutral,0.06794388,0.12458836,0.8074678,-0.010905886165202716
CTV,2024-05-19,Small plane crashes just outside Toronto,https://toronto.ctvnews.ca/small-plane-crashes-just-outside-toronto-1.6892765,negative,0.025752524,0.39387956,0.5803679,-0.15447791783858378
CTV,2024-05-19,"'A horrible way to start the summer': 3 killed in serious boat crash on lake north of Kingston, Ont.",https://ottawa.ctvnews.ca/a-horrible-way-to-start-the-summer-3-killed-in-serious-boat-crash-on-lake-north-of-kingston-ont-1.6893073,negative,0.0040977946,0.92865473,0.06724736,-0.8623828986842508
CTV,2024-05-19,Former Royal Regina Rifle troop member honoured with official headstone marking,https://regina.ctvnews.ca/former-royal-regina-rifle-troop-member-honoured-with-official-headstone-marking-1.6892963,positive,0.30921888,0.0055078682,0.68527323,0.09558599048878058
CTV,2024-05-19,Can the Liberals recover from 'Trudeau fatigue'?,/video/c2925239-ctv-qp--leadership-on-the-line-?playlistId=1.6851132,negative,0.027863782,0.36415192,0.60798424,-0.1318302546963217
CTV,2024-05-19,"Helicopter carrying Iran's president suffers a 'hard landing,' state TV says, and rescue is underway",https://www.ctvnews.ca/world/helicopter-carrying-iran-s-president-suffers-a-hard-landing-state-tv-says-and-rescue-is-underway-1.6893098,negative,0.011729847,0.45151857,0.5367515,-0.2037314651723321
CTV,2024-05-19,"2 dead, 5 missing after a boat collision on the Danube River in Hungary",https://www.ctvnews.ca/world/2-dead-5-missing-after-a-boat-collision-on-the-danube-river-in-hungary-1.6893176,negative,0.008545695,0.6878967,0.30355757,-0.47312888016980637
CTV,2024-05-19,The latest advice for expecting parents? Sign up for child care as soon as you're pregnant,https://www.ctvnews.ca/canada/the-latest-advice-for-expecting-parents-sign-up-for-child-care-as-soon-as-you-re-pregnant-1.6890479,neutral,0.0960342,0.03569586,0.86827,0.00794837082992439
CTV,2024-05-19,"No expert consensus on AI risks, trajectory 'remarkably uncertain': report",https://www.ctvnews.ca/sci-tech/no-expert-consensus-on-ai-risks-trajectory-remarkably-uncertain-report-1.6892555,negative,0.010581094,0.5193212,0.4700977,-0.26958256811538384
CTV,2024-05-19,'They can start walking': Robotics company helping children with mobility issues take steps forward,https://winnipeg.ctvnews.ca/they-can-start-walking-robotics-company-helping-children-with-mobility-issues-take-steps-forward-1.6892982,positive,0.51906246,0.006556268,0.47438136,0.26938280629903666
CTV,2024-05-19,Hundreds walk backwards in downtown Montreal to symbolize the decline of LGBTQ2S+ rights,https://montreal.ctvnews.ca/hundreds-walk-backwards-in-downtown-montreal-to-symbolize-the-decline-of-lgbtq2s-rights-1.6892610,negative,0.007647249,0.8182298,0.17412297,-0.6694414795462773
CTV,2024-05-19,Kamloops RCMP issue public warning about 2 men allegedly at centre of 'organized crime conflict',https://bc.ctvnews.ca/kamloops-rcmp-issue-public-warning-about-2-men-allegedly-at-centre-of-organized-crime-conflict-1.6879435,negative,0.009116524,0.45374444,0.53713894,-0.2058009466101396
CTV,2024-05-19,'Full pressure' for grocers to sign grocery code: Minister,/video/c2925231-ctv-qp--loblaw-ready-to-sign-grocery-code?playlistId=1.6604639,neutral,0.046514824,0.06672467,0.8867605,-0.002288553722920028
CTV,2024-05-19,"60 years on, Tim Hortons is synonymous with Canada, but still chasing growth",https://www.ctvnews.ca/business/60-years-on-tim-hortons-is-synonymous-with-canada-but-still-chasing-growth-1.6891454,positive,0.64854985,0.030282978,0.32116717,0.4196998555742404
CTV,2024-05-19,Bezos' Blue Origin launches first crew to edge of space since 2022 grounding,https://www.ctvnews.ca/sci-tech/bezos-blue-origin-launches-first-crew-to-edge-of-space-since-2022-grounding-1.6893152,positive,0.51118064,0.0048981523,0.48392132,0.26128160900995034
CTV,2024-05-19,B.C. musician's song catches attention of Canucks,https://bc.ctvnews.ca/b-c-musician-s-song-catches-attention-of-canucks-1.6887512,positive,0.31893268,0.0065735006,0.6744939,0.10167481701730097
CTV,2024-05-19,To plant or not to plant? Gardening tips for May long weekend,https://winnipeg.ctvnews.ca/to-plant-or-not-to-plant-gardening-tips-for-may-long-weekend-1.6891961,neutral,0.12946758,0.018412821,0.8521197,0.01642281234885523
CTV,2024-05-19,Thieves caught on camera stealing pet chicken from North Vancouver backyard,https://bc.ctvnews.ca/thieves-caught-on-camera-stealing-pet-chicken-from-north-vancouver-backyard-1.6885857,negative,0.015581296,0.6553114,0.3291072,-0.4291903183677981
CTV,2024-05-19,"In the fight for planetary health, how do we preserve our mental health?",https://www.ctvnews.ca/climate-and-environment/in-the-fight-for-planetary-health-how-do-we-preserve-our-mental-health-1.6893075,neutral,0.15450846,0.036088433,0.80940306,0.022570493177232365
CTV,2024-05-19,"OPP looking for missing equipment, lifejackets, impaired boating this week",https://northernontario.ctvnews.ca/opp-looking-for-missing-equipment-lifejackets-impaired-boating-this-week-1.6892825,negative,0.011108122,0.6818824,0.30700955,-0.4648401722317619
CTV,2024-05-19,Five things to know about the NHL playoffs,https://edmonton.ctvnews.ca/five-things-to-know-about-the-nhl-playoffs-1.6893155,neutral,0.18362051,0.02304067,0.79333884,0.03318561786868646
CTV,2024-05-19,From DVDs to rehearsals: Halifax theatre company transforms Video Difference building into arts hub,https://atlantic.ctvnews.ca/more/from-dvds-to-rehearsals-halifax-theatre-company-transforms-video-difference-building-into-arts-hub-1.6891796,positive,0.27186534,0.005180871,0.72295374,0.07388393658123604
CTV,2024-05-19,Montreal businessman writes scathing letter to government to care for homeless population,https://montreal.ctvnews.ca/montreal-businessman-writes-scathing-letter-to-government-to-care-for-homeless-population-1.6892912,negative,0.016560607,0.58449805,0.39894137,-0.34136369705000824
CTV,2024-05-19,'It's pure joy!': B.C. pilot takes 96-year-old grandma on meaningful flight,https://bc.ctvnews.ca/it-s-pure-joy-b-c-pilot-takes-96-year-old-grandma-on-meaningful-flight-1.6892363,positive,0.97369367,0.001966137,0.024340093,0.9480756109593749
CTV,2024-05-19,Lethbridge home prices continue to rise,https://calgary.ctvnews.ca/lethbridge-home-prices-continue-to-rise-1.6892312,negative,0.043799605,0.2737657,0.68243474,-0.0730292461506501
CTV,2024-05-19,Bear spotted in Lumsden euthanized after risk to public safety: Sask. RCMP,https://regina.ctvnews.ca/bear-spotted-in-lumsden-euthanized-after-risk-to-public-safety-sask-rcmp-1.6892842,negative,0.015173255,0.39449027,0.59033656,-0.15539231292685685
CTV,2024-05-19,"Adopted daughter in the Netherlands reunited with sister in Montreal and mother in Colombia, 40 years later",https://montreal.ctvnews.ca/adopted-daughter-in-the-netherlands-reunited-with-sister-in-montreal-and-mother-in-colombia-40-years-later-1.6883397,neutral,0.103847526,0.0073917722,0.8887606,0.010729677535199045
CTV,2024-05-19,"Winnipeg man charged after police seize weapons, drugs",https://winnipeg.ctvnews.ca/winnipeg-man-charged-after-police-seize-weapons-drugs-1.6893205,negative,0.01345502,0.50177777,0.48476726,-0.25159986156714353
CTV,2024-05-19,Crews on scene of structure fire in Saskatoon,https://saskatoon.ctvnews.ca/crews-on-scene-of-structure-fire-in-saskatoon-1.6892730,neutral,0.042812806,0.11892098,0.83826613,-0.012309268958478725
CTV,2024-05-19,Cell phone use and testing motions pass at Alberta Teachers’ Association General Assembly,https://calgary.ctvnews.ca/cell-phone-use-and-testing-motions-pass-at-alberta-teachers-association-general-assembly-1.6892876,neutral,0.09493872,0.009690492,0.89537084,0.00891945002686878
CTV,2024-05-19,Beloved Oakwood Village restaurant forced to shutter after landlord doesn't renew lease,https://toronto.ctvnews.ca/beloved-oakwood-village-restaurant-forced-to-shutter-after-landlord-doesn-t-renew-lease-1.6891384,negative,0.017221702,0.5186469,0.46413139,-0.26869803097553024
CTV,2024-05-19,"Walmart, Costco refusing to sign grocery code of conduct 'untenable': industry minister",https://www.ctvnews.ca/politics/walmart-costco-refusing-to-sign-grocery-code-of-conduct-untenable-industry-minister-1.6892920,negative,0.013180765,0.50325656,0.48356262,-0.2530934612608293
CTV,2024-05-19,"Police release photo of suspect who allegedly smashed windows, doors of North York synagogue",https://toronto.ctvnews.ca/police-release-photo-of-suspect-who-allegedly-smashed-windows-doors-of-north-york-synagogue-1.6892802,negative,0.014623126,0.5560174,0.42935956,-0.30894148032154334
CTV,2024-05-19,"Canucks lose to Oilers 5-1, series headed to Game 7",https://bc.ctvnews.ca/canucks-lose-to-oilers-5-1-series-headed-to-game-7-1.6892883,negative,0.013785562,0.6105662,0.3756483,-0.37260102422093055
CTV,2024-05-19,Two pedestrians killed in Chatham-Kent collision,https://windsor.ctvnews.ca/two-pedestrians-killed-in-chatham-kent-collision-1.6893177,negative,0.009914215,0.72164905,0.26843667,-0.5206791030711742
CTV,2024-05-19,Congolese army says it has foiled a coup. Self-exiled opposition leader threatens president,https://www.ctvnews.ca/world/congolese-army-says-it-has-foiled-a-coup-self-exiled-opposition-leader-threatens-president-1.6893085,negative,0.005664345,0.8404601,0.15387535,-0.7063412804810696
CTV,2024-05-19,'It could mean a cure': Cautious optimism for groundbreaking ALS research at Western,https://london.ctvnews.ca/it-could-mean-a-cure-cautious-optimism-for-groundbreaking-als-research-at-western-1.6888544,positive,0.9256878,0.0033809964,0.07093125,0.8568864050445679
CTV,2024-05-19,Ottawa driver who appeared to be racing another vehicle on Highway 416 facing charges,https://ottawa.ctvnews.ca/ottawa-driver-who-appeared-to-be-racing-another-vehicle-on-highway-416-facing-charges-1.6893101,negative,0.013371335,0.50768584,0.47894275,-0.2575661487742664
CTV,2024-05-19,The eight most expensive homes for sale in Ottawa this spring,https://ottawa.ctvnews.ca/the-eight-most-expensive-homes-for-sale-in-ottawa-this-spring-1.6891313,neutral,0.05842641,0.06379197,0.87778175,-0.0006557691117885511
CTV,2024-05-19,Brooks fall 4-3 to Crusaders in BCHL playoff game,https://calgary.ctvnews.ca/brooks-fall-4-3-to-crusaders-in-bchl-playoff-game-1.6892823,neutral,0.025759563,0.1302959,0.84394443,-0.016313478031610984
CTV,2024-05-19,Study says aquaculture likely driving wild salmon extinction in Newfoundland,https://www.ctvnews.ca/canada/study-says-aquaculture-likely-driving-wild-salmon-extinction-in-newfoundland-1.6888543,negative,0.010808,0.6784791,0.31071305,-0.46021696353616903
CTV,2024-05-19,"Heavy rains set off flash floods in northern Afghanistan, killing at least 84 people",https://www.ctvnews.ca/climate-and-environment/heavy-rains-set-off-flash-floods-in-northern-afghanistan-killing-at-least-84-people-1.6893115,negative,0.008546611,0.8304229,0.16103046,-0.6895291737667257
CTV,2024-05-19,"As missing St. Thomas, Ont. man turns 35, family still hopeful he’ll be found",https://london.ctvnews.ca/as-missing-st-thomas-ont-man-turns-35-family-still-hopeful-he-ll-be-found-1.6893109,neutral,0.099481136,0.047851257,0.8526677,0.007606749311226402
CTV,2024-05-19,Willy the Winmar mascot celebrated in Moose Jaw,https://regina.ctvnews.ca/willy-the-winmar-mascot-celebrated-in-moose-jaw-1.6893030,positive,0.874477,0.0023374485,0.12318567,0.7647044738243727
CTV,2024-05-19,"With interactive ambulance and EMS vehicle tours, EMS Fleet Day offers sneak peek into life of a paramedic",https://calgary.ctvnews.ca/with-interactive-ambulance-and-ems-vehicle-tours-ems-fleet-day-offers-sneak-peek-into-life-of-a-paramedic-1.6893210,positive,0.2998299,0.0052287905,0.6949414,0.0898706025329723
CTV,2024-05-19,"B.C. pipeline company argues its 'haulers' are not trucks, for tax purposes",https://bc.ctvnews.ca/b-c-pipeline-company-argues-its-haulers-are-not-trucks-for-tax-purposes-1.6892930,negative,0.032898176,0.2404334,0.7266683,-0.05672595545068493
