source,date,headline,url,chosen_label,positive,negative,neutral,compound
Global,2024-02-04,Rogers CEO ‘not concerned’ about wireless customers leaving despite price hikes,https://globalnews.ca/news/10266149/rogers-earnings-feb-2024/,neutral,0.045550205,0.14448261,0.8099673,-0.0188003946056714
Global,2024-02-04,Warning after chronic wasting disease found in B.C.,https://globalnews.ca/video/10271251/warning-after-chronic-wasting-disease-found-in-b-c/,negative,0.0075006825,0.778282,0.2142173,-0.6056665902205225
Global,2024-02-04,El Niño is almost over. A similar phenomenon may be next. What is La Niña?,https://globalnews.ca/news/10269270/what-is-la-nina-2024/,neutral,0.043592956,0.120981,0.835426,-0.012736062734092002
Global,2024-02-04,"Trump represents ‘unpredictability,’ Trudeau says as US election looms",https://globalnews.ca/video/10244517/trump-represents-unpredictability-trudeau-says-as-us-election-looms/,negative,0.019958965,0.3340687,0.64597243,-0.11120349812806474
Global,2024-02-04,Calls grow for minister’s resignation,https://globalnews.ca/video/10271271/calls-grow-for-ministers-resignation/,negative,0.018702969,0.4217034,0.5595937,-0.17748393045096122
Global,2024-02-04,Ottawa to extend foreign home buyer ban another two years,https://globalnews.ca/news/10271611/foreign-home-buyer-ban-extended-two-years/,negative,0.01598666,0.30800274,0.6760106,-0.09461011492064131
Global,2024-02-04,Toronto abuzz with hockey as fans flock to NHL All-Star Fan Fair,https://globalnews.ca/video/10271180/toronto-abuzz-with-hockey-as-fans-flock-to-nhl-all-star-fan-fair/,positive,0.44921234,0.004490054,0.5462976,0.20177156812666652
Global,2024-02-04,Nova Scotia snowstorm: Parts of Cape Breton under local state of emergency,https://globalnews.ca/video/10271951/nova-scotia-snowstorm-parts-of-cape-breton-under-local-state-of-emergency/,negative,0.021928791,0.29450554,0.68356574,-0.0862526231059988
Global,2024-02-04,"N.S. storm: Schools, universities to close Monday as snow keeps piling on",https://globalnews.ca/news/10271529/halifax-schools-cancelled-nova-scotia-snow-storm/,negative,0.020489737,0.5207768,0.45873347,-0.2707886391646923
Global,2024-02-04,Ontario man charged with 1st-degree murder in addition to other charges,https://globalnews.ca/video/10269486/ontario-man-charged-with-1st-degree-murder-in-addition-to-other-charges/,negative,0.007578134,0.8483778,0.14404398,-0.719687553958444
Global,2024-02-04,‘She’s trying to insert herself between kids and their parents’: Minister Boissonnault on Alberta premier’s new trans policies,https://globalnews.ca/video/10270724/shes-trying-to-insert-herself-between-kids-and-their-parents-minister-boissonnault-on-alberta-premiers-new-trans-policies/,neutral,0.018946826,0.15764599,0.8234072,-0.02449327657321021
Global,2024-02-04,Alberta’s new ‘navigation and support centre’ helps 145 since opening in mid-January,https://globalnews.ca/news/10271544/albertas-new-navigation-and-support-centre-helps-145-since-opening-in-mid-january/,positive,0.33974463,0.004827229,0.65542823,0.11540307979392317
Global,2024-02-04,"47 groups issue joint statement against Alberta’s new trans policy, rallies held",https://globalnews.ca/video/10271252/47-groups-issue-joint-statement-against-albertas-new-trans-policy-rallies-held/,negative,0.0087667825,0.55487025,0.43636286,-0.30780420077701365
Global,2024-02-04,How will Manulife-Loblaw deal on specialty drugs impact you?,https://globalnews.ca/video/10271308/how-will-manulife-loblaw-deal-on-specialty-drugs-impact-you/,neutral,0.040194865,0.028921597,0.9308837,0.0007791665519352176
Global,2024-02-04,"Pill found in Starbucks cake pop, says B.C. mom",https://globalnews.ca/news/10271872/pill-found-starbucks-cake-pop-says-bc-mom/,neutral,0.051334117,0.058277175,0.89038867,-0.0007610378628173375
Global,2024-02-04,"Flight Centre fights imposter websites, bogus booking costs B.C. man $2,280",https://globalnews.ca/news/10271368/flight-centre-imposter-websites-costs-bc-man/,negative,0.009527463,0.83892,0.15155268,-0.7036958906512041
Global,2024-02-04,Montreal-area minor hockey association hosts charity hockey tournament,https://globalnews.ca/news/10271695/cote-saint-luc-minor-hockey-tournament-montreal/,neutral,0.1100641,0.006957278,0.8829787,0.012065696303318774
Global,2024-02-04,‘I hope it doesn’t come to that’: Premier Smith on notwithstanding clause option for new trans policies,https://globalnews.ca/video/10270723/i-hope-it-doesnt-come-to-that-premier-smith-on-notwithstanding-clause-option-for-new-trans-policies/,neutral,0.045131877,0.16240266,0.7924654,-0.024337746272864003
Global,2024-02-04,Charity hockey tournament kicks off in Montreal area,https://globalnews.ca/video/10272058/charity-hockey-tournament-kicks-off-in-montreal-area/,neutral,0.13292876,0.0041591055,0.8629122,0.017652750997783073
Global,2024-02-04,Ontario man charged with 1st-degree murder after missing friend turns up dead,https://globalnews.ca/news/10268714/ontario-man-charged-with-1st-degree-murder-in-case-of-missing-friend/,negative,0.007459921,0.8026417,0.18989825,-0.6441781262789164
Global,2024-02-04,Canada extends foreign home buyer ban for 2 more years,https://globalnews.ca/video/10271777/canada-extends-foreign-home-buyer-ban-for-2-more-years/,negative,0.013854142,0.46811172,0.5180342,-0.2189366078539834
Global,2024-02-04,Kelowna-based LGBTQ group hosting rally in support of Alberta trans community,https://globalnews.ca/news/10271787/kelowna-based-lgbtq-group-rally-support-alberta-trans-community/,positive,0.28410864,0.00542734,0.71046394,0.08068828761718017
Global,2024-02-04,Business News: Canadian economy grows,https://globalnews.ca/video/10271612/business-news-canadian-economy-grows/,positive,0.8072148,0.008795376,0.18398982,0.6515183690383886
Global,2024-02-04,"Black History Month events taking place in London, Ont.",https://globalnews.ca/news/10271660/black-history-month-london/,neutral,0.084122516,0.005220728,0.9106567,0.007049347043745158
Global,2024-02-04,Inflatable domes a big hit for Quebec’s indoor tennis players,https://globalnews.ca/news/10269389/inflatable-domes-quebec-indoor-tennis-players/,positive,0.64960885,0.0053199725,0.34507108,0.4219634335264857
Global,2024-02-04,"47 groups issue joint statement against Alberta’s new trans policy, rallies held",https://globalnews.ca/news/10270912/alberta-trans-policy-statement-rallies/,negative,0.0087667825,0.55487025,0.43636286,-0.30780420077701365
Global,2024-02-04,El Niño to La Niña: How shifting weather patterns will impact Canada,https://globalnews.ca/video/10271004/el-nino-to-la-nina-how-shifting-weather-patterns-will-impact-canada/,neutral,0.024177417,0.039829027,0.9359936,-0.0010018030093268404
Global,2024-02-04,Nazi de-classified documents released in wake of Canada’s parliamentary scandal,https://globalnews.ca/video/10271305/nazi-de-classified-documents-released-in-wake-of-canadas-parliamentary-scandal/,negative,0.0106665185,0.5784129,0.41092065,-0.3344476808999488
Global,2024-02-04,Alberta policies on trans youth most anti-LGBTQ in Canada: Trudeau,https://globalnews.ca/video/10268980/alberta-policies-on-trans-youth-most-anti-lgbtq-in-canada-trudeau/,negative,0.010904898,0.53267395,0.45642126,-0.28362256307451617
Global,2024-02-04,Can Trump run for presidency? U.S. Supreme Court to rule in biggest involvement since Bush v. Gore,https://globalnews.ca/news/10270784/donald-trump-us-presidential-election-supreme-court/,neutral,0.1130667,0.027205186,0.8597281,0.012043958583046077
Global,2024-02-04,Quebec going ahead with out-of-province tuition hikes despite advisory body concern,https://globalnews.ca/news/10271769/quebec-hike-tutition-out-of-province-canadian-students/,neutral,0.018897526,0.1545181,0.82658434,-0.023518729770572122
Global,2024-02-04,"Alberta proposes parental consent for name changes in schools, age limits on gender affirmation care",https://globalnews.ca/news/10264436/alberta-parental-rights-policy/,neutral,0.04225783,0.048002172,0.90974,-0.0005184844529981802
Global,2024-02-04,"N.S. storm: Parts of Cape Breton under state of emergency, 100+ cm of snow possible",https://globalnews.ca/news/10271457/weekend-snowstorm-80-centimetres-nova-scotia-cape-breton/,negative,0.028592503,0.34004134,0.6313662,-0.11481057232629333
Global,2024-02-04,Cold War missile found in Seattle suburb,https://globalnews.ca/news/10271027/inert-cold-war-missile-seattle-suburb-garage/,negative,0.033814393,0.34366724,0.6225184,-0.11696373898260504
Global,2024-02-04,"Protests against Alberta Premier Danielle Smith’s sweeping new transgender policy in Calgary, Edmonton",https://globalnews.ca/video/10271280/protests-against-alberta-premier-danielle-smiths-sweeping-new-transgender-policy-in-calgary-edmonton/,negative,0.010923868,0.5700162,0.41906,-0.3247991102214627
CTV,2024-02-04,Moose Jaw podiatrist says patients facing unnecessary specialist referral delays,https://regina.ctvnews.ca/moose-jaw-podiatrist-says-patients-facing-unnecessary-specialist-referral-delays-1.6754894,negative,0.011996869,0.70275116,0.28525203,-0.4937152264661435
CTV,2024-02-04,Video shows Ontario 'crypto king' associate refusing to hand over phone found in toilet caddy,https://toronto.ctvnews.ca/video-shows-ontario-crypto-king-associate-refusing-to-hand-over-phone-found-in-toilet-caddy-1.6751865,negative,0.015565078,0.42819583,0.5562391,-0.1831093887672921
CTV,2024-02-04,NDP MLAs banned from some B.C. mosques after 'crappy' land comment from minister,https://bc.ctvnews.ca/ndp-mlas-banned-from-some-b-c-mosques-after-crappy-land-comment-from-minister-1.6755414,negative,0.007923094,0.64874184,0.3433351,-0.42080320168976115
CTV,2024-02-04,Minister sorry for 'crappy piece of land' remark that angered pro-Palestinian groups,https://bc.ctvnews.ca/minister-sorry-for-crappy-piece-of-land-remark-that-angered-pro-palestinian-groups-1.6754507,negative,0.012300443,0.70669967,0.28099984,-0.49927316344382433
CTV,2024-02-04,Risk of dementia nearly three times higher one year after stroke: study,https://www.ctvnews.ca/health/risk-of-dementia-nearly-three-times-higher-one-year-after-stroke-study-1.6754997,negative,0.03246162,0.34878972,0.61874866,-0.1206005136370436
CTV,2024-02-04,Property taxes going up in Brandon,https://winnipeg.ctvnews.ca/property-taxes-going-up-in-brandon-1.6755433,neutral,0.03697501,0.21240069,0.7506242,-0.04374692245094991
CTV,2024-02-04,Hundreds gather to question P.E.I. health minister on ICU closure,https://atlantic.ctvnews.ca/more/hundreds-gather-to-question-p-e-i-health-minister-on-icu-closure-1.6753650,negative,0.015624278,0.30784878,0.676527,-0.09452672777632642
CTV,2024-02-04,Why Apple is pushing the term 'spatial computing' along with its new Vision Pro headset,https://www.ctvnews.ca/business/why-apple-is-pushing-the-term-spatial-computing-along-with-its-new-vision-pro-headset-1.6753646,positive,0.24133378,0.017643861,0.7410222,0.057930715214538964
CTV,2024-02-04,Town of Aylmer shows up to support family of woman killed in apparent murder-suicide,https://london.ctvnews.ca/town-of-aylmer-shows-up-to-support-family-of-woman-killed-in-apparent-murder-suicide-1.6755439,negative,0.02088011,0.5441677,0.43495208,-0.2956825666006999
CTV,2024-02-04,‘He’s got a wonderful legacy’ Canucks’ announce death of team dog Ryp after sudden illness,https://bc.ctvnews.ca/he-s-got-a-wonderful-legacy-canucks-announce-death-of-team-dog-ryp-after-sudden-illness-1.6755331,positive,0.6865005,0.022933139,0.29056627,0.4707570732328712
CTV,2024-02-04,Grammys 2024: Phoebe Bridgers and boygenius win big while SZA and 'Barbie' also earn early trophies,https://www.ctvnews.ca/entertainment/grammys-2024-phoebe-bridgers-and-boygenius-win-big-while-sza-and-barbie-also-earn-early-trophies-1.6755286,positive,0.8840885,0.0019506465,0.11396088,0.7816086864697009
CTV,2024-02-04,2 in police custody after 3 attempted carjackings early Sunday morning in northeast Calgary,https://calgary.ctvnews.ca/2-in-police-custody-after-3-attempted-carjackings-early-sunday-morning-in-northeast-calgary-1.6755321,negative,0.014167563,0.38721138,0.5986211,-0.14973192329522966
CTV,2024-02-04,At least 28 people died when shelling hit a bakery in Russian-occupied Ukraine,https://www.ctvnews.ca/world/at-least-28-people-died-when-shelling-hit-a-bakery-in-russian-occupied-ukraine-1.6755129,negative,0.006213827,0.83980393,0.15398203,-0.7052321973492193
CTV,2024-02-04,"Justin Bieber takes the ice, grabs the spotlight at NHL All-Star Weekend",https://toronto.ctvnews.ca/justin-bieber-takes-the-ice-grabs-the-spotlight-at-nhl-all-star-weekend-1.6755171,positive,0.47316423,0.0028722673,0.5239636,0.2238761112051435
CTV,2024-02-04,Ottawa couple out $13k after scammer posing as TD Bank steals credit card info,https://ottawa.ctvnews.ca/ottawa-couple-out-13k-after-scammer-posing-as-td-bank-steals-credit-card-info-1.6755176,negative,0.011434519,0.7169569,0.2716085,-0.5138965311666261
CTV,2024-02-04,Lewis Hamilton says driving for Ferrari will be a 'childhood dream' come true,https://www.ctvnews.ca/autos/lewis-hamilton-says-driving-for-ferrari-will-be-a-childhood-dream-come-true-1.6754519,positive,0.83119166,0.004586125,0.16422203,0.6908587140722844
CTV,2024-02-04,Federal government extends foreign buyer ban on Canadian homes to 2027,https://www.ctvnews.ca/politics/federal-government-extends-foreign-buyer-ban-on-canadian-homes-to-2027-1.6755207,negative,0.018002626,0.22469567,0.75730175,-0.05016403914831269
CTV,2024-02-04,Government seeking public input on 2035 carbon emissions target,https://www.ctvnews.ca/climate-and-environment/government-seeking-public-input-on-2035-carbon-emissions-target-1.6754456,neutral,0.043200698,0.060002428,0.89679676,-0.0017339929033388657
CTV,2024-02-04,Snow totals from Maritime storm comparable to White Juan: More snow to come,https://atlantic.ctvnews.ca/snow-totals-from-maritime-storm-comparable-to-white-juan-more-snow-to-come-1.6755351,neutral,0.07232369,0.047427885,0.8802483,0.0029813144254653423
CTV,2024-02-04,Million dollar bidding war underway for hockey cards found in Sask. basement,https://regina.ctvnews.ca/million-dollar-bidding-war-underway-for-hockey-cards-found-in-sask-basement-1.6746741,neutral,0.04561366,0.13037683,0.8240095,-0.014917514401666665
CTV,2024-02-04,Sask. teachers announce second round of rotating strikes,https://regina.ctvnews.ca/sask-teachers-announce-second-round-of-rotating-strikes-1.6755214,neutral,0.021230644,0.16961507,0.80915415,-0.02831855357346491
CTV,2024-02-04,Senegal police fire tear gas as the opposition protests at election delay,https://www.ctvnews.ca/world/senegal-police-fire-tear-gas-as-the-opposition-protests-at-election-delay-1.6755270,negative,0.0066126287,0.75123775,0.24214965,-0.5643143854697428
CTV,2024-02-04,A Russian cosmonaut sets a new record for the most time in space,https://www.ctvnews.ca/sci-tech/a-russian-cosmonaut-sets-a-new-record-for-the-most-time-in-space-1.6755366,positive,0.4920437,0.006895582,0.50106066,0.2420594864483938
CTV,2024-02-04,"Kurt Hamrin, Sweden great who was the last living player from the 1958 World Cup final, dies at 89",https://www.ctvnews.ca/sports/kurt-hamrin-sweden-great-who-was-the-last-living-player-from-the-1958-world-cup-final-dies-at-89-1.6755147,neutral,0.11648232,0.056351922,0.82716584,0.010392586185821173
CTV,2024-02-04,'Crypto king' investor says she doesn’t believe Pleterski is orchestrating alleged Ponzi scheme alone,https://toronto.ctvnews.ca/crypto-king-investor-says-she-doesn-t-believe-pleterski-is-orchestrating-alleged-ponzi-scheme-alone-1.6753075,negative,0.021051794,0.37891403,0.6000342,-0.14313266288012017
CTV,2024-02-04,RCMP seeking missing boy in Grande Prairie,https://edmonton.ctvnews.ca/rcmp-seeking-missing-boy-in-grande-prairie-1.6755373,neutral,0.029782297,0.08269113,0.88752663,-0.0059508352179094
CTV,2024-02-04,Winnipegger to serve as seat filler at music's biggest night,https://winnipeg.ctvnews.ca/winnipegger-to-serve-as-seat-filler-at-music-s-biggest-night-1.6751430,neutral,0.19438466,0.036157764,0.7694576,0.03647801431945652
CTV,2024-02-04,Excitement builds with NHL players returning to Olympics,/video/c2860215-nhl-players-returning-to-the-olympics?playlistId=1.6753338,positive,0.9426413,0.002162639,0.055196032,0.8885679911300794
CTV,2024-02-04,"Pine Knot Golf Club in Dorchester, Ont. sells out Sunday with 160 players",https://london.ctvnews.ca/pine-knot-golf-club-in-dorchester-ont-sells-out-sunday-with-160-players-1.6755358,neutral,0.07105289,0.019546615,0.9094004,0.004666447591670231
CTV,2024-02-04,New AFN chief looks to turn page with Pierre Poilievre from Harper-era tensions,https://www.ctvnews.ca/politics/new-afn-chief-looks-to-turn-page-with-pierre-poilievre-from-harper-era-tensions-1.6755123,neutral,0.03993457,0.062080786,0.8979847,-0.002259253009752493
CTV,2024-02-04,Lawyer for father of murdered B.C. girl denies client brought gun to Ali verdict,https://bc.ctvnews.ca/lawyer-for-father-of-murdered-b-c-girl-denies-client-brought-gun-to-ali-verdict-1.6754521,negative,0.011450818,0.54812825,0.44042102,-0.30031340602099554
CTV,2024-02-04,New Brunswick super-fan gets one in a lifetime experience at U2 concert: 'I still can’t believe it happened',https://atlantic.ctvnews.ca/new-brunswick-super-fan-gets-one-in-a-lifetime-experience-at-u2-concert-i-still-can-t-believe-it-happened-1.6755229,positive,0.8899985,0.0044442196,0.105557226,0.7920776038392119
CTV,2024-02-04,Judge sets aside ruling that granted U.S. trans woman's refugee status in Canada,https://www.ctvnews.ca/canada/judge-sets-aside-ruling-that-granted-u-s-trans-woman-s-refugee-status-in-canada-1.6754271,neutral,0.061950006,0.026389666,0.91166025,0.003141391375764968
CTV,2024-02-04,Sask. government awards nearly $1 billion hospital expansion contract to PCL,https://saskatoon.ctvnews.ca/sask-government-awards-nearly-1-billion-hospital-expansion-contract-to-pcl-1.6755318,neutral,0.10320167,0.010458932,0.8863395,0.010541187656993856
CTV,2024-02-04,MAID expansion delay 'categorically' not a political move: justice minister,https://www.ctvnews.ca/politics/maid-expansion-delay-categorically-not-a-political-move-justice-minister-1.6754632,negative,0.014010688,0.40878135,0.5772079,-0.16690590394675908
CTV,2024-02-04,"Spotlight on London, Ont. as world junior hockey sex assault case goes to court",https://www.ctvnews.ca/sports/spotlight-on-london-ont-as-world-junior-hockey-sex-assault-case-goes-to-court-1.6755139,negative,0.020155216,0.43626168,0.5435831,-0.18991802372433142
CTV,2024-02-04,This is how many games Vancouver will host during the FIFA World Cup,https://bc.ctvnews.ca/this-is-how-many-games-vancouver-will-host-during-the-fifa-world-cup-1.6755357,neutral,0.1053854,0.016150406,0.8784641,0.010845254923991021
CTV,2024-02-04,"Name of Vancouver Island creek deemed offensive, could be changed",https://vancouverisland.ctvnews.ca/name-of-vancouver-island-creek-deemed-offensive-could-be-changed-1.6739119,negative,0.009798654,0.6393948,0.35080653,-0.40872972204293845
CTV,2024-02-04,Feds want your input on greenhouse gas emissions,/video/c2860187-feds-want-public-input-on-greenhouse-gas-emissions?playlistId=1.6677659,neutral,0.038559694,0.16890211,0.7925382,-0.027041070538562195
CTV,2024-02-04,Vehicle rollover on 14th Street as relentless snow turns Calgary streets into slippery mess,https://calgary.ctvnews.ca/vehicle-rollover-on-14th-street-as-relentless-snow-turns-calgary-streets-into-slippery-mess-1.6755161,negative,0.017497702,0.7138189,0.2686834,-0.5092312421449972
CTV,2024-02-04,"N.B. couple overcomes homelessness, addiction after staying at shelter",https://atlantic.ctvnews.ca/n-b-couple-overcomes-homelessness-addiction-after-staying-at-shelter-1.6753812,neutral,0.22158763,0.035808284,0.74260414,0.047818835709124485
CTV,2024-02-04,B.C. minister faces backlash over comments on Middle East,/video/c2859324-b-c--minister-under-fire-for-comments,negative,0.008857308,0.5628592,0.42828342,-0.3167320513910443
CTV,2024-02-04,Beaver seen carrying large branch in downtown Toronto,https://toronto.ctvnews.ca/beaver-seen-carrying-large-branch-in-downtown-toronto-1.6743984,neutral,0.045542125,0.02973184,0.92472595,0.0011901041695348002
CTV,2024-02-04,El Salvador votes in presidential election that the 'world's coolest dictator' has clear path to win,https://www.ctvnews.ca/world/el-salvador-votes-in-presidential-election-that-the-world-s-coolest-dictator-has-clear-path-to-win-1.6755138,positive,0.56540644,0.015644293,0.41894922,0.3194397161921039
CTV,2024-02-04,"Former Saskatoon Air Cadet shared child porn over Snapchat, judge rules",https://saskatoon.ctvnews.ca/former-saskatoon-air-cadet-shared-child-porn-over-snapchat-judge-rules-1.6755388,negative,0.0078042224,0.70039666,0.29179925,-0.49049448878833246
CTV,2024-02-04,Air Canada's first female pilot recalls sector's sexist hurdles on route to success,https://www.ctvnews.ca/business/air-canada-s-first-female-pilot-recalls-sector-s-sexist-hurdles-on-route-to-success-1.6755204,neutral,0.18398316,0.060403436,0.7556134,0.03020123062610569
CTV,2024-02-04,Ontario 'crypto king' associate sentenced to jail,https://toronto.ctvnews.ca/ontario-crypto-king-associate-sentenced-to-jail-1.6751774,negative,0.017262423,0.5104884,0.4722492,-0.2603003911124677
CTV,2024-02-04,'They leave us no choice': ATU Local 616 issues strike notice of Transit Windsor service,https://windsor.ctvnews.ca/they-leave-us-no-choice-atu-local-616-issues-strike-notice-of-transit-windsor-service-1.6755309,negative,0.014314546,0.5538716,0.4318139,-0.3065688124549304
CTV,2024-02-04,Groundhog Day: Spring predictions from furry forecasters across the country,https://www.ctvnews.ca/lifestyle/groundhog-day-spring-predictions-from-furry-forecasters-across-the-country-1.6752757,neutral,0.16915801,0.0086472705,0.8221947,0.02853966253913498
CTV,2024-02-04,"2 people, including child, suffer serious injuries after Hwy. 17 car crash",https://ottawa.ctvnews.ca/2-people-including-child-suffer-serious-injuries-after-hwy-17-car-crash-1.6755467,negative,0.013025353,0.6965704,0.2904043,-0.4850406372309788
CTV,2024-02-04,Black History Month celebrations kick off in Kitchener,https://kitchener.ctvnews.ca/black-history-month-celebrations-kick-off-in-kitchener-1.6755489,positive,0.38078463,0.0054822234,0.6137332,0.1449668690413084
CTV,2024-02-04,Single-vehicle crash sends woman to hospital with life-threatening injuries,https://windsor.ctvnews.ca/single-vehicle-crash-sends-woman-to-hospital-with-life-threatening-injuries-1.6755311,negative,0.0134491585,0.7894917,0.19705918,-0.6231162626786038
CTV,2024-02-04,Joni Mitchell wins 10th career Grammy with Newport live album,https://www.ctvnews.ca/entertainment/joni-mitchell-wins-10th-career-grammy-with-newport-live-album-1.6755126,positive,0.7432437,0.0030517562,0.2537046,0.5524018317801449
CTV,2024-02-04,"Fredericton man with Down Syndrome, dementia spent 131 days in hospital; his family says he didn't need to",https://atlantic.ctvnews.ca/more/fredericton-man-with-down-syndrome-dementia-spent-131-days-in-hospital-his-family-says-he-didn-t-need-to-1.6740612,negative,0.013402231,0.65007335,0.33652434,-0.4224157970245219
CTV,2024-02-04,Long-serving northern Ont. politician dies,https://northernontario.ctvnews.ca/long-serving-northern-ont-politician-dies-1.6755359,negative,0.023217497,0.51630515,0.46047732,-0.26603196889589853
CTV,2024-02-04,Ukrainian foreign minister will be 'more than happy' if war is won this year,https://www.ctvnews.ca/politics/ukrainian-foreign-minister-will-be-more-than-happy-if-war-is-won-this-year-1.6754808,positive,0.7223377,0.02558201,0.25208026,0.5211173462307919
CTV,2024-02-04,Brentwood Road closed in Angus for police investigation,https://barrie.ctvnews.ca/brentwood-road-closed-in-angus-for-police-investigation-1.6755265,negative,0.009798864,0.3619364,0.6282647,-0.13090194363898355
CTV,2024-02-04,"Bad fuel blamed for damaging vehicles in Guelph, Ont.",/video/c2858395-bad-gas-blamed-for-damaging-vehicles-in-guelph,negative,0.005393062,0.87109125,0.12351581,-0.7587707519658804
CTV,2024-02-04,"'Argylle,' with checkered reviews, flops with US$18M for the big-budget Apple release",https://www.ctvnews.ca/entertainment/argylle-with-checkered-reviews-flops-with-us-18m-for-the-big-budget-apple-release-1.6755320,negative,0.0467235,0.43151382,0.52176267,-0.18402108666609962
CTV,2024-02-04,'Pushing the envelope': Collaboration between UVic and Bombardier looking to make jet aviation more sustainable,https://vancouverisland.ctvnews.ca/pushing-the-envelope-collaboration-between-uvic-and-bombardier-looking-to-make-jet-aviation-more-sustainable-1.6750853,positive,0.57910025,0.0061564157,0.4147434,0.33531914790271244
CTV,2024-02-04,"Flight Centre fights hundreds of fake sites, as bogus booking costs B.C. man $2,280",https://bc.ctvnews.ca/flight-centre-fights-hundreds-of-fake-sites-as-bogus-booking-costs-b-c-man-2-280-1.6755215,negative,0.010232658,0.7911255,0.19864176,-0.625774869644224
CTV,2024-02-04,Ottawa man says he got a red light ticket for turning right,https://ottawa.ctvnews.ca/ottawa-man-says-he-got-a-red-light-ticket-for-turning-right-1.6755503,negative,0.036927603,0.36753604,0.59553635,-0.1337190909193211
CTV,2024-02-04,Cyclist hospitalized with life-threatening injuries after collision in Scarborough,https://toronto.ctvnews.ca/cyclist-hospitalized-with-life-threatening-injuries-after-collision-in-scarborough-1.6755284,negative,0.0127486605,0.7351992,0.25205207,-0.5403553976007771
CTV,2024-02-04,"Latest wave of U.S., Britain strikes on Yemin's Houthis had support of Canada",https://www.ctvnews.ca/canada/latest-wave-of-u-s-britain-strikes-on-yemin-s-houthis-had-support-of-canada-1.6755253,neutral,0.044527482,0.11289422,0.84257835,-0.010762404311178031
