source,date,headline,url,chosen_label,positive,negative,neutral,compound
Global,2024-02-03,"Two women attacked, including B.C. Crown prosecutor",https://globalnews.ca/video/10270460/two-women-attacked-including-a-b-c-crown-prosecutor/,negative,0.013870086,0.5273147,0.45881525,-0.2778684227267618
Global,2024-02-03,"Edmonton City Hall shooting suspect was a security guard, released manifestos",https://globalnews.ca/video/10249784/edmonton-city-hall-shooting-suspect-was-a-security-guard-released-manifestos/,neutral,0.019035192,0.10331836,0.8776464,-0.010312350773705958
Global,2024-02-03,El Niño is almost over. A similar phenomenon may be next. What is La Niña?,https://globalnews.ca/news/10269270/what-is-la-nina-2024/,neutral,0.043592956,0.120981,0.835426,-0.012736062734092002
Global,2024-02-03,Woman with ‘debilitating’ chronic pain waits decades for endometriosis diagnosis,https://globalnews.ca/video/10269177/woman-with-debilitating-chronic-pain-waits-decades-for-endometriosis-diagnosis/,negative,0.016218109,0.6475805,0.3362013,-0.41909751972853115
Global,2024-02-03,Daring daytime Surrey shooting caught on surveillance camera,https://globalnews.ca/video/10270486/daring-daytime-surrey-shooting-caught-on-surveillance-camera/,negative,0.020534495,0.45674494,0.5227205,-0.20819430028544517
Global,2024-02-03,Quebec committee recommends new ‘fundamental right’ to access French content online,https://globalnews.ca/news/10270690/french-content-quebec-streaming-platforms/,neutral,0.05118592,0.024231518,0.9245825,0.0020328342011222134
Global,2024-02-03,Rogers CEO ‘not concerned’ about wireless customers leaving despite price hikes,https://globalnews.ca/news/10266149/rogers-earnings-feb-2024/,neutral,0.045550205,0.14448261,0.8099673,-0.0188003946056714
Global,2024-02-03,Montreal police say 30-year-old man killed in armed assault Friday,https://globalnews.ca/news/10270796/montreal-30-year-old-man-killed-armed-assault/,negative,0.008148723,0.6914115,0.30043986,-0.4779833928209616
Global,2024-02-03,‘Communism territory’: Man miffed building not exempt from B.C.’s new short-term rental rules,https://globalnews.ca/news/10270899/kelowna-no-exemptions-bc-short-term-rental-rules/,negative,0.009493523,0.58114505,0.40936136,-0.33763947394444926
Global,2024-02-03,SAIT rocks on: Student radio station celebrates KISS-versary on campus,https://globalnews.ca/video/10270396/sait-rocks-on-student-radio-station-celebrates-kiss-versary-on-campus/,positive,0.9168387,0.0016224706,0.081538804,0.8405905726569518
Global,2024-02-03,Crosstown rivalry becomes partnership,https://globalnews.ca/video/10270452/crosstown-rivalry-becomes-partnership/,neutral,0.13556871,0.016890867,0.84754044,0.01809357142934065
Global,2024-02-03,Darius Rucker arrested on drug possession charges in Tennessee,https://globalnews.ca/news/10268490/darius-rucker-arrested-drug-charges-tennessee/,negative,0.011612189,0.41610333,0.5722845,-0.17300712922208028
Global,2024-02-03,"Alberta proposes parental consent for name changes in schools, age limits on gender affirmation care",https://globalnews.ca/news/10264436/alberta-parental-rights-policy/,neutral,0.04225783,0.048002172,0.90974,-0.0005184844529981802
Global,2024-02-03,Ontario man charged with 1st-degree murder in addition to other charges,https://globalnews.ca/video/10269486/ontario-man-charged-with-1st-degree-murder-in-addition-to-other-charges/,negative,0.007578134,0.8483778,0.14404398,-0.719687553958444
Global,2024-02-03,NHL players on leave and facing sex assault charges still being paid,https://globalnews.ca/video/10270476/nhl-players-on-leave-and-facing-sex-assault-charges-still-being-paid/,negative,0.010008233,0.7834228,0.20656906,-0.6136510819347905
Global,2024-02-03,Trudeau says government has ‘taken action’ against foreign interference,https://globalnews.ca/video/10270541/trudeau-says-government-has-taken-action-against-foreign-interference/,neutral,0.08690035,0.025899513,0.88720006,0.006880891117238441
Global,2024-02-03,Driver dead after 3-vehicle crash on Hwy 401 in Durham Region,https://globalnews.ca/news/10270689/driver-dead-3-vehicle-crash-401-durham-region/,negative,0.019849164,0.4960445,0.48410633,-0.24566615822757853
Global,2024-02-03,Woman with ‘debilitating’ chronic pain waits decades for endometriosis diagnosis,https://globalnews.ca/news/10265850/ontario-30-year-wait-endometriosis-diagnosis/,negative,0.016218109,0.6475805,0.3362013,-0.41909751972853115
Global,2024-02-03,Health Matters: Doctors criticize Alberta school policy targeting transgender youth,https://globalnews.ca/video/10268541/health-matters-doctors-criticize-alberta-school-policy-targeting-transgender-youth/,negative,0.0104106385,0.4744728,0.5151166,-0.2250160480023098
Global,2024-02-03,Man in life-threatening condition after being hit by vehicle in north Toronto,https://globalnews.ca/news/10270772/pedestrian-struck-willowdale-finch/,negative,0.019181378,0.65617347,0.32464507,-0.4301957515978465
Global,2024-02-03,Portion of Stony Plain Road closes for drainage work ahead of west LRT construction,https://globalnews.ca/news/10270948/portion-of-stony-plain-road-closes-for-drainage-work-ahead-of-west-lrt-construction/,neutral,0.020313974,0.22156094,0.7581251,-0.048676583492022196
Global,2024-02-03,Teacher shortage and wage challenges in B.C. education,https://globalnews.ca/video/10270415/teacher-shortage-and-wage-challenges-in-b-c-education/,negative,0.024637373,0.43293712,0.5424256,-0.18682752151635285
Global,2024-02-03,Shipwreck mysteriously appears along Newfoundland coastline,https://globalnews.ca/video/10270546/shipwreck-mysteriously-appears-along-newfoundland-coastline/,negative,0.02125131,0.53682995,0.4419187,-0.2877347902543441
Global,2024-02-03,"China executes couple for shocking murder of toddlers, aged 1 and 2",https://globalnews.ca/news/10268103/china-execution-couple-murder-toddlers-window/,negative,0.007104782,0.84200674,0.1508886,-0.7089247905576022
Global,2024-02-03,Ontario man charged with 1st-degree murder after missing friend turns up dead,https://globalnews.ca/news/10268714/ontario-man-charged-with-1st-degree-murder-in-case-of-missing-friend/,negative,0.007459921,0.8026417,0.18989825,-0.6441781262789164
Global,2024-02-03,Global News Hour at 6 Calgary: Feb. 2,https://globalnews.ca/video/10270406/global-news-hour-at-6-calgary-feb-2-4/,neutral,0.03606085,0.010924799,0.9530144,0.0011810331298178767
Global,2024-02-03,Groundhog Day 2024: Wiarton Willie predicts early spring,https://globalnews.ca/video/10268184/groundhog-day-2024-wiarton-willie-predicts-early-spring-for-canada/,positive,0.22408235,0.0041059526,0.7718118,0.050196021372224564
Global,2024-02-03,Fact checking Alberta Premier Danielle Smith’s claims about trans athletes,https://globalnews.ca/news/10268806/fact-check-alberta-premier-danielle-smith-trans-athletes/,neutral,0.023292396,0.13528438,0.84142315,-0.017759336031177853
Global,2024-02-03,Man charged in attack on B.C. Crown prosecutor in Vancouver,https://globalnews.ca/news/10270922/man-charged-in-attack-on-b-c-crown-prosecutor-in-vancouver/,negative,0.015670126,0.4679903,0.51633954,-0.21876939011486485
Global,2024-02-03,Canada’s foreign affairs minister in Ukraine to launch child repatriation effort,https://globalnews.ca/video/10270513/canadas-foreign-affairs-minister-in-ukraine-to-launch-child-repatriation-effort/,neutral,0.039192036,0.027022023,0.93378586,0.0008058269987303301
Global,2024-02-03,B.C. restricting cell phone use in schools,https://globalnews.ca/video/10270775/b-c-restricting-cell-phone-use-in-schools/,negative,0.01898845,0.23213743,0.74887407,-0.053527236536584866
Global,2024-02-03,"Man attempts to flee from London, Ont. police twice, gets seriously injured",https://globalnews.ca/news/10270851/london-police-siu-resist-arrest-injury/,negative,0.0076726233,0.69036007,0.30196738,-0.47653811564593695
Global,2024-02-03,Recruiters downplaying tough realities for international students in Canada,https://globalnews.ca/video/10270490/recruiters-downplaying-tough-realities-for-international-students-in-canada/,negative,0.018321779,0.51191145,0.46976677,-0.2617176467924365
Global,2024-02-03,"Heavy snowfall persists in N.S., will continue until Monday: Environment Canada",https://globalnews.ca/news/10270671/nova-scotia-snowstorm-weather-forecast-weekend/,neutral,0.038769826,0.20652941,0.7547008,-0.041151294724608434
CTV,2024-02-03,"Large amounts of snowfall in the Maritimes causing delays, cancellations and closures",https://atlantic.ctvnews.ca/large-amounts-of-snowfall-in-the-maritimes-causing-delays-cancellations-and-closures-1.6754495,negative,0.02116404,0.5177218,0.46111423,-0.26758790244610076
CTV,2024-02-03,How a lost dog from the Saskatchewan countryside ended up in downtown Toronto,https://toronto.ctvnews.ca/how-a-lost-dog-from-the-saskatchewan-countryside-ended-up-in-downtown-toronto-1.6742039,negative,0.023886912,0.2984529,0.67766017,-0.08850355683216904
CTV,2024-02-03,Groundhog Day: Spring predictions from furry forecasters across the country,https://www.ctvnews.ca/lifestyle/groundhog-day-spring-predictions-from-furry-forecasters-across-the-country-1.6752757,neutral,0.16915801,0.0086472705,0.8221947,0.02853966253913498
CTV,2024-02-03,"One dead, one in police custody following stabbing in Sudbury",https://northernontario.ctvnews.ca/one-dead-one-in-police-custody-following-stabbing-in-sudbury-1.6754454,negative,0.01021444,0.6312494,0.35853618,-0.39837146812802615
CTV,2024-02-03,Calgary Humane Society hosts a puppy party,https://calgary.ctvnews.ca/calgary-humane-society-hosts-a-puppy-party-1.6754609,neutral,0.20606354,0.006924737,0.7870117,0.042414238986435926
CTV,2024-02-03,Video shows Ontario 'crypto king' associate refusing to hand over phone found in toilet caddy,https://toronto.ctvnews.ca/video-shows-ontario-crypto-king-associate-refusing-to-hand-over-phone-found-in-toilet-caddy-1.6751865,negative,0.015565078,0.42819583,0.5562391,-0.1831093887672921
CTV,2024-02-03,Local hunters charged after shooting moose from motorboat,https://windsor.ctvnews.ca/local-hunters-charged-after-shooting-moose-from-motorboat-1.6754685,negative,0.014907075,0.55670035,0.42839262,-0.3096930417684671
CTV,2024-02-03,Unique doggy dating service gives shelter dogs a chance to shine,https://www.ctvnews.ca/lifestyle/unique-doggy-dating-service-gives-shelter-dogs-a-chance-to-shine-1.6752954,positive,0.85219973,0.0029235596,0.14487654,0.7262359900920146
CTV,2024-02-03,"U.S. launches retaliatory air strikes in Iraq, Syria",/video/c2860110-ctv-national-news--u-s--strikes-iraq--syria?playlistId=1.6754380,negative,0.01442758,0.41244227,0.57313013,-0.1699004805733324
CTV,2024-02-03,Has the foreign interference commission lost credibility because Uyghur Canadians refuse to testify?,https://www.ctvnews.ca/canada/has-the-foreign-interference-commission-lost-credibility-because-uyghur-canadians-refuse-to-testify-1.6752930,negative,0.007743062,0.7705699,0.22168697,-0.5937180815545355
CTV,2024-02-03,Man accused of killing Manitoba woman in 2007 had violent past: parole document,https://winnipeg.ctvnews.ca/man-accused-of-killing-manitoba-woman-in-2007-had-violent-past-parole-document-1.6753833,negative,0.009176087,0.6418299,0.3489941,-0.4118613737429122
CTV,2024-02-03,RCMP starting next round of body-worn camera field testing,https://edmonton.ctvnews.ca/rcmp-starting-next-round-of-body-worn-camera-field-testing-1.6753325,neutral,0.023676164,0.0339602,0.9423636,-0.0005927346317768922
CTV,2024-02-03,Police seek public help locating missing senior Gary Heafey,https://calgary.ctvnews.ca/police-seek-public-help-locating-missing-senior-gary-heafey-1.6754666,neutral,0.057274837,0.03763049,0.9050947,0.0018643528894097816
CTV,2024-02-03,"Suspect injured while resisting arrest, SIU investigating",https://london.ctvnews.ca/suspect-injured-while-resisting-arrest-siu-investigating-1.6754562,negative,0.010997241,0.6187018,0.37030104,-0.3826709431054116
CTV,2024-02-03,Windsor Express to host Skilled Trades Expo for students and parents,https://windsor.ctvnews.ca/windsor-express-to-host-skilled-trades-expo-for-students-and-parents-1.6754513,positive,0.23713137,0.0036109064,0.75925756,0.05621828724454403
CTV,2024-02-03,Police investigate early-morning robbery at Waterloo business,https://kitchener.ctvnews.ca/police-investigate-early-morning-robbery-at-waterloo-business-1.6754506,negative,0.026715245,0.23032483,0.7429599,-0.052335824907011386
CTV,2024-02-03,New Westminster Secondary School musical theatre fundraising restored after fight,https://bc.ctvnews.ca/new-westminster-secondary-school-musical-theatre-fundraising-restored-after-fight-1.6754650,neutral,0.08493231,0.019386953,0.8956807,0.006837644163876444
CTV,2024-02-03,"N.B. couple couple overcomes homelessness, addiction after staying at shelter",https://atlantic.ctvnews.ca/n-b-couple-couple-overcomes-homelessness-addiction-after-staying-at-shelter-1.6753812,neutral,0.20264153,0.032262787,0.7650958,0.04002268774797457
CTV,2024-02-03,"Pancake breakfast kicks off Winter Carnival in Riverview, N.B.",https://atlantic.ctvnews.ca/pancake-breakfast-kicks-off-winter-carnival-in-riverview-n-b-1.6754652,positive,0.274903,0.0028377243,0.7222593,0.07556360643891935
CTV,2024-02-03,Ference feels NHL making progress with support of LGBTQ+2S community,https://www.ctvnews.ca/sports/ference-feels-nhl-making-progress-with-support-of-lgbtq-2s-community-1.6754654,positive,0.5826333,0.0071209194,0.41024572,0.339410908497797
CTV,2024-02-03,Officer-involved shooting and suspicious death in Saskatoon under investigation,https://saskatoon.ctvnews.ca/officer-involved-shooting-and-suspicious-death-in-saskatoon-under-investigation-1.6754529,negative,0.010559229,0.4318315,0.55760926,-0.18636695469695042
CTV,2024-02-03,"Regina industrial accident leaves one dead, another injured",https://regina.ctvnews.ca/regina-industrial-accident-leaves-one-dead-another-injured-1.6753113,negative,0.0068259793,0.82601035,0.1671635,-0.6822466326044667
CTV,2024-02-03,Million dollar bidding war underway for hockey cards found in Sask. basement,https://regina.ctvnews.ca/million-dollar-bidding-war-underway-for-hockey-cards-found-in-sask-basement-1.6746741,neutral,0.04561366,0.13037683,0.8240095,-0.014917514401666665
CTV,2024-02-03,"Human remains found in Guelph park, say police",https://kitchener.ctvnews.ca/human-remains-found-in-guelph-park-say-police-1.6753595,neutral,0.018268904,0.15945865,0.8222725,-0.02509330489524686
CTV,2024-02-03,"Fredericton man with Down Syndrome, dementia spent 131 days in hospital; his family says he didn't need to",https://atlantic.ctvnews.ca/more/fredericton-man-with-down-syndrome-dementia-spent-131-days-in-hospital-his-family-says-he-didn-t-need-to-1.6740612,negative,0.013402231,0.65007335,0.33652434,-0.4224157970245219
CTV,2024-02-03,"Here's how other provinces have handled classroom size, complexity",https://regina.ctvnews.ca/here-s-how-other-provinces-have-handled-classroom-size-complexity-1.6750203,neutral,0.046859715,0.04274818,0.91039217,0.00036842582503471277
CTV,2024-02-03,Government seeking public input on 2035 carbon emissions target,https://www.ctvnews.ca/climate-and-environment/government-seeking-public-input-on-2035-carbon-emissions-target-1.6754456,neutral,0.043200698,0.060002428,0.89679676,-0.0017339929033388657
CTV,2024-02-03,Politics trumped legal advice in decision not to revoke citizenship of Nazi in 1960s,https://www.ctvnews.ca/politics/politics-trumped-legal-advice-in-decision-not-to-revoke-citizenship-of-nazi-in-1960s-1.6753570,negative,0.021762406,0.40540108,0.57283664,-0.16387638852701514
CTV,2024-02-03,Japan wants everyone to know: Taylor Swift will make it in time for the Super Bowl,https://www.ctvnews.ca/entertainment/japan-wants-everyone-to-know-taylor-swift-will-make-it-in-time-for-the-super-bowl-1.6754419,positive,0.7639435,0.0045408765,0.23151559,0.5835890869050715
CTV,2024-02-03,Alberta premier's policy changes around trans youth could be harmful: doctors,https://edmonton.ctvnews.ca/alberta-premier-s-policy-changes-around-trans-youth-could-be-harmful-doctors-1.6752908,negative,0.008545193,0.6428196,0.3486353,-0.41314393933144444
CTV,2024-02-03,Hunting moose from a motorboat in northern Ont. nets hunters $19.5K in fines,https://northernontario.ctvnews.ca/hunting-moose-from-a-motorboat-in-northern-ont-nets-hunters-19-5k-in-fines-1.6753290,negative,0.007585546,0.7049764,0.28743818,-0.49693409362763497
CTV,2024-02-03,Minister sorry for 'crappy piece of land' remark that angered pro-Palestinian groups,https://bc.ctvnews.ca/minister-sorry-for-crappy-piece-of-land-remark-that-angered-pro-palestinian-groups-1.6754507,negative,0.012300443,0.70669967,0.28099984,-0.49927316344382433
CTV,2024-02-03,"Carl Weathers, who starred in 'Rocky' movies and 'The Mandalorian,' dies",https://www.ctvnews.ca/entertainment/carl-weathers-who-starred-in-rocky-movies-and-the-mandalorian-dies-1.6753549,neutral,0.045101177,0.108756006,0.8461428,-0.00979375134314342
CTV,2024-02-03,23andMe is low on cash and its stock is worth pennies. The CEO wants another chance,https://www.ctvnews.ca/business/23andme-is-low-on-cash-and-its-stock-is-worth-pennies-the-ceo-wants-another-chance-1.6754303,negative,0.07311134,0.53125286,0.39563584,-0.2768843047632146
CTV,2024-02-03,"Case of missing Alliston man found dead ruled a homicide, longtime friend facing charges",https://barrie.ctvnews.ca/case-of-missing-alliston-man-found-dead-ruled-a-homicide-longtime-friend-facing-charges-1.6753241,negative,0.017810002,0.4042861,0.5779039,-0.1631300441460617
CTV,2024-02-03,Pakistan's ex-PM Imran Khan and wife convicted of marriage law violation in a fourth case,https://www.ctvnews.ca/world/pakistan-s-ex-pm-imran-khan-and-wife-convicted-of-marriage-law-violation-in-a-fourth-case-1.6754413,negative,0.009257736,0.6366344,0.35410792,-0.4052176282372031
CTV,2024-02-03,North Regina Little League named Team of the Year at Sask. Sports Awards,https://regina.ctvnews.ca/north-regina-little-league-named-team-of-the-year-at-sask-sports-awards-1.6754661,positive,0.38353696,0.0049654846,0.6114975,0.1470759585062531
CTV,2024-02-03,Three people found unresponsive at Wellington County home,https://kitchener.ctvnews.ca/three-people-found-unresponsive-at-wellington-county-home-1.6754493,negative,0.01312988,0.44290173,0.5439684,-0.19598954890254205
CTV,2024-02-03,"Oh, what a knight: London defeat Erie Otters 5-3 in Friday night game",https://london.ctvnews.ca/oh-what-a-knight-london-defeat-erie-otters-5-3-in-friday-night-game-1.6754487,positive,0.82717717,0.004677667,0.16814503,0.6842003076263339
CTV,2024-02-03,Beaver seen carrying large branch in downtown Toronto,https://toronto.ctvnews.ca/beaver-seen-carrying-large-branch-in-downtown-toronto-1.6743984,neutral,0.045542125,0.02973184,0.92472595,0.0011901041695348002
CTV,2024-02-03,Lieutenant-governor helping to kick off Orillia Winter Games,https://barrie.ctvnews.ca/lieutenant-governor-helping-to-kick-off-orillia-winter-games-1.6754345,neutral,0.07158352,0.008151898,0.9202648,0.005057734190252461
CTV,2024-02-03,"AI brings deepfake pornography to the masses, as Canadian laws play catch-up",https://bc.ctvnews.ca/ai-brings-deepfake-pornography-to-the-masses-as-canadian-laws-play-catch-up-1.6754498,negative,0.057663452,0.39721107,0.5451254,-0.15445158581164264
CTV,2024-02-03,'Fewer and milder' tornadoes in Canada in 2023: Northern Tornadoes Project,https://london.ctvnews.ca/fewer-and-milder-tornadoes-in-canada-in-2023-northern-tornadoes-project-1.6754599,neutral,0.075071886,0.034880687,0.89004743,0.00441912565088165
CTV,2024-02-03,First Nation leaders renew calls for policing following Sask. stabbing inquest,https://saskatoon.ctvnews.ca/first-nation-leaders-renew-calls-for-policing-following-sask-stabbing-inquest-1.6754117,neutral,0.082486786,0.03931116,0.8782021,0.005258701476644756
CTV,2024-02-03,'Pushing the envelope': Collaboration between UVic and Bombardier looking to make jet aviation more sustainable,https://vancouverisland.ctvnews.ca/pushing-the-envelope-collaboration-between-uvic-and-bombardier-looking-to-make-jet-aviation-more-sustainable-1.6750853,positive,0.57910025,0.0061564157,0.4147434,0.33531914790271244
CTV,2024-02-03,Manitoba cabinet minister at odds with Crown corporation CEO over development,https://winnipeg.ctvnews.ca/manitoba-cabinet-minister-at-odds-with-crown-corporation-ceo-over-development-1.6753717,neutral,0.01886382,0.1243766,0.85675967,-0.015113686120999503
CTV,2024-02-03,Southern Manitoba curling club celebrates 50 years,https://winnipeg.ctvnews.ca/southern-manitoba-curling-club-celebrates-50-years-1.6748933,positive,0.758289,0.0035959645,0.23811509,0.5749892343877576
CTV,2024-02-03,Ottawa police seek help locating missing man,https://ottawa.ctvnews.ca/ottawa-police-seek-help-locating-missing-man-1.6754425,neutral,0.059241667,0.06929762,0.8714607,-0.001292585241278843
CTV,2024-02-03,Winnipegger to serve as seat filler at music's biggest night,https://winnipeg.ctvnews.ca/winnipegger-to-serve-as-seat-filler-at-music-s-biggest-night-1.6751430,neutral,0.19438466,0.036157764,0.7694576,0.03647801431945652
CTV,2024-02-03,"Snowfall warning issued for southern Alberta, including Okotoks, Canmore, Bassano area",https://calgary.ctvnews.ca/snowfall-warning-issued-for-southern-alberta-including-okotoks-canmore-bassano-area-1.6754680,negative,0.03242105,0.23462686,0.73295206,-0.05399864454819614
CTV,2024-02-03,"Severe cases of strep A in hospitals, clinics: Health-care workers, we want to hear from you",https://www.ctvnews.ca/health/severe-cases-of-strep-a-in-hospitals-clinics-health-care-workers-we-want-to-hear-from-you-1.6751238,negative,0.058774635,0.27620664,0.6650187,-0.07283566127754604
CTV,2024-02-03,"Bad fuel blamed for damaging vehicles in Guelph, Ont.",/video/c2858395-bad-gas-blamed-for-damaging-vehicles-in-guelph,negative,0.005393062,0.87109125,0.12351581,-0.7587707519658804
CTV,2024-02-03,"Actor Carl Weathers of 'Rocky,' 'The Mandalorian' dies at 76",/video/c2860117-ctv-national-news--carl-weathers--legacy?playlistId=1.6753690,neutral,0.07271911,0.027519258,0.8997616,0.0045307604852160566
CTV,2024-02-03,"MAID expansion delay 'categorically' not a political move, minister says feds expect provinces to be ready",https://www.ctvnews.ca/politics/maid-expansion-delay-categorically-not-a-political-move-minister-says-feds-expect-provinces-to-be-ready-1.6754632,neutral,0.037524685,0.093264595,0.8692107,-0.007290182615591334
CTV,2024-02-03,Residents voice concerns over proposed 25-storey high-rise in Stittsville,https://ottawa.ctvnews.ca/residents-voice-concerns-over-proposed-25-storey-high-rise-in-stittsville-1.6753996,neutral,0.022889882,0.21486787,0.76224226,-0.045644254124810324
CTV,2024-02-03,Ex-CIA computer engineer gets 40 years in prison for giving spy agency hacking secrets to WikiLeaks,https://www.ctvnews.ca/world/ex-cia-computer-engineer-gets-40-years-in-prison-for-giving-spy-agency-hacking-secrets-to-wikileaks-1.6752110,negative,0.010287236,0.7514653,0.23824748,-0.5645942789530611
CTV,2024-02-03,Canada could sanction 'extremist' West Bank settlers amid spike in reported violence,https://www.ctvnews.ca/politics/canada-could-sanction-extremist-west-bank-settlers-amid-spike-in-reported-violence-1.6753209,negative,0.006787491,0.65139174,0.34182066,-0.4242652119234869
CTV,2024-02-03,Hamas shows signs of resurgence in parts of Gaza where Israeli troops largely withdrew weeks ago,https://www.ctvnews.ca/world/hamas-shows-signs-of-resurgence-in-parts-of-gaza-where-israeli-troops-largely-withdrew-weeks-ago-1.6754410,negative,0.02053776,0.3553123,0.62415,-0.12582501214661512
CTV,2024-02-03,Snow totals already 30+ cm for parts of the Maritimes with much more to come,https://atlantic.ctvnews.ca/snow-totals-already-30-cm-for-parts-of-the-maritimes-with-much-more-to-come-1.6754452,neutral,0.07182844,0.14512405,0.7830475,-0.01590166562987161
CTV,2024-02-03,Many immigrants leaving Canada within years of arriving: StatCan,https://www.ctvnews.ca/canada/many-immigrants-leaving-canada-within-years-of-arriving-statcan-1.6753003,neutral,0.025324052,0.135829,0.838847,-0.017808205862558157
CTV,2024-02-03,A painting by Rene Magritte may fetch US$64 million at an auction marking a century of surrealism,https://www.ctvnews.ca/entertainment/a-painting-by-rene-magritte-may-fetch-us-64-million-at-an-auction-marking-a-century-of-surrealism-1.6754179,positive,0.22600481,0.006416276,0.76757884,0.051037021516595615
CTV,2024-02-03,Police say suspect has stolen more than $30K from B.C. Lowe's stores over the last year,https://bc.ctvnews.ca/police-say-suspect-has-stolen-more-than-30k-from-b-c-lowe-s-stores-over-the-last-year-1.6754549,negative,0.020269385,0.50360584,0.47612488,-0.25320793874300307
CTV,2024-02-03,The NHL All-Star weekend in Toronto is in full swing. Here's what to know,https://toronto.ctvnews.ca/the-nhl-all-star-weekend-in-toronto-is-in-full-swing-here-s-what-to-know-1.6753065,neutral,0.16794437,0.0032991644,0.8287564,0.028194439784299696
CTV,2024-02-03,"B.C. senior wins right to sell home she paid $3.4M to build, despite objections of co-owners who paid just $115K",https://bc.ctvnews.ca/b-c-senior-wins-right-to-sell-home-she-paid-3-4m-to-build-despite-objections-of-co-owners-who-paid-just-115k-1.6745383,neutral,0.112835124,0.038765464,0.8483994,0.011229005433680328
CTV,2024-02-03,Lawyer for father of murdered B.C. girl denies client brought gun to Ali verdict,https://bc.ctvnews.ca/lawyer-for-father-of-murdered-b-c-girl-denies-client-brought-gun-to-ali-verdict-1.6754521,negative,0.011450818,0.54812825,0.44042102,-0.30031340602099554
CTV,2024-02-03,Winnipeg police investigating Saturday morning homicide,https://winnipeg.ctvnews.ca/winnipeg-police-investigating-saturday-morning-homicide-1.6754514,neutral,0.022892322,0.12775749,0.8493501,-0.015797926950302354
