source,date,headline,url,chosen_label,positive,negative,neutral,compound
CTV,2024-02-27,"Israel is ready to pause its war in Gaza during Ramadan if a hostage deal is reached, Biden says",https://www.ctvnews.ca/world/israel-is-ready-to-pause-its-war-in-gaza-during-ramadan-if-a-hostage-deal-is-reached-biden-says-1.6785022,neutral,0.08967913,0.04463187,0.86568904,0.006050340880891625
CTV,2024-02-27,B.C.'s first electric airplane for flight training arrives in Campbell River,https://vancouverisland.ctvnews.ca/b-c-s-first-electric-airplane-for-flight-training-arrives-in-campbell-river-1.6785399,neutral,0.069102265,0.008397707,0.92249995,0.004704606079188878
CTV,2024-02-27,Fatal crash in Aylmer knocks out power,https://london.ctvnews.ca/fatal-crash-in-aylmer-knocks-out-power-1.6785013,negative,0.013968303,0.76699317,0.21903853,-0.5880834133077224
CTV,2024-02-27,"Canada freezes merger notification threshold, funds housing innovation projects",https://www.ctvnews.ca/politics/canada-freezes-merger-notification-threshold-funds-housing-innovation-projects-1.6785409,negative,0.024664573,0.26589388,0.7094414,-0.07009124079780804
CTV,2024-02-27,Man charged after ex-girlfriend killed on California beach,/video/c2874689-university-student-killed-on-beach,negative,0.01177871,0.6498197,0.3384015,-0.422126944255762
CTV,2024-02-27,Final leg of the Special Olympics Canada Winter Games torch runs began in Lethbridge,https://calgary.ctvnews.ca/final-leg-of-the-special-olympics-canada-winter-games-torch-runs-began-in-lethbridge-1.6781403,neutral,0.060043402,0.010243842,0.9297128,0.0035002731150939326
CTV,2024-02-27,"Boundaries, communication are key for parents running the Bank of Mom and Dad",https://www.ctvnews.ca/business/boundaries-communication-are-key-for-parents-running-the-bank-of-mom-and-dad-1.6785296,positive,0.2263791,0.0258762,0.7477446,0.0505779358338696
CTV,2024-02-27,Sask. inquest hears last words of mass killer Myles Sanderson,https://saskatoon.ctvnews.ca/sask-inquest-hears-last-words-of-mass-killer-myles-sanderson-1.6785492,negative,0.014818247,0.5279007,0.45728108,-0.27845954876926093
CTV,2024-02-27,Josh Classen's forecast: Lengthy cold spell settles in,https://edmonton.ctvnews.ca/edmonton-area-weather/josh-classen-s-forecast-lengthy-cold-spell-settles-in-1.6785289,neutral,0.0315738,0.051283505,0.91714275,-0.0016330920858678155
CTV,2024-02-27,Nurse Police Team members honoured by Windsor police,https://windsor.ctvnews.ca/nurse-police-team-members-honoured-by-windsor-police-1.6785348,positive,0.902431,0.0041366606,0.09343227,0.8143646513051364
CTV,2024-02-27,Police find bodies of Australian couple allegedly killed by jilted police lover,https://www.ctvnews.ca/world/police-find-bodies-of-australian-couple-allegedly-killed-by-jilted-police-lover-1.6785038,negative,0.009277998,0.57770586,0.41301617,-0.3336579626243594
CTV,2024-02-27,Bayfield man charged following traffic stop in London,https://london.ctvnews.ca/bayfield-man-charged-following-traffic-stop-in-london-1.6785017,negative,0.014864062,0.39266866,0.59246725,-0.1539677511051618
CTV,2024-02-27,Ottawa's photo radar and red light cameras issue 143 tickets to OC Transpo drivers in 2023,https://ottawa.ctvnews.ca/ottawa-s-photo-radar-and-red-light-cameras-issue-143-tickets-to-oc-transpo-drivers-in-2023-1.6785213,negative,0.019935776,0.26503876,0.71502554,-0.06984809025609628
CTV,2024-02-27,Metro Vancouver skiers flock to B.C. Interior amid dismal snow conditions at home,https://bc.ctvnews.ca/metro-vancouver-skiers-flock-to-b-c-interior-amid-dismal-snow-conditions-at-home-1.6775946,negative,0.032146767,0.37894595,0.5889073,-0.14256661685889682
CTV,2024-02-27,"Strep throat bug also causes flesh-eating disease, but why is a 'random game': Montreal doctor",https://montreal.ctvnews.ca/strep-throat-bug-also-causes-flesh-eating-disease-but-why-is-a-random-game-montreal-doctor-1.6785011,negative,0.007940847,0.7815164,0.21054295,-0.6107046694794818
CTV,2024-02-27,Nearly 63K pieces of plastic collected from Toronto Harbour within 6 months last year,https://toronto.ctvnews.ca/nearly-63k-pieces-of-plastic-collected-from-toronto-harbour-within-6-months-last-year-1.6784077,neutral,0.06869916,0.16187985,0.76942104,-0.02148550734791721
CTV,2024-02-27,Paparazzo accuses Taylor Swift's dad of punching him in the face on Sydney waterfront,https://www.ctvnews.ca/entertainment/paparazzo-accuses-taylor-swift-s-dad-of-punching-him-in-the-face-on-sydney-waterfront-1.6785240,negative,0.011069961,0.6855598,0.30337033,-0.4698696478279025
CTV,2024-02-27,Man treated for 'multiple gunshot wounds' following shooting in Ottawa's east end,https://ottawa.ctvnews.ca/man-treated-for-multiple-gunshot-wounds-following-shooting-in-ottawa-s-east-end-1.6785024,negative,0.02067411,0.25484005,0.7244858,-0.06451603730735833
CTV,2024-02-27,"'Terrifying': Daycares discovering needles, weapons in Central Park",https://winnipeg.ctvnews.ca/terrifying-daycares-discovering-needles-weapons-in-central-park-1.6784724,negative,0.010439037,0.8041317,0.18542922,-0.6465188433224611
CTV,2024-02-27,Here's how to really stretch out on the couch,https://www.ctvnews.ca/lifestyle/here-s-how-to-really-stretch-out-on-the-couch-1.6785138,positive,0.40052718,0.015919354,0.5835535,0.1601685839042606
CTV,2024-02-27,'Small details make a big difference:' Police appeal for info in Toronto double homicide,https://toronto.ctvnews.ca/small-details-make-a-big-difference-police-appeal-for-info-in-toronto-double-homicide-1.6785001,neutral,0.11822784,0.044431534,0.8373406,0.012003662710206697
CTV,2024-02-27,Couple detained at Punta Cana airport claim household product was mistaken for cocaine,https://kitchener.ctvnews.ca/couple-detained-at-punta-cana-airport-claim-household-product-was-mistaken-for-cocaine-1.6779889,negative,0.010124565,0.58376116,0.4061143,-0.3406745628983021
CTV,2024-02-27,LIVE NOW: Standing committee meets on SNC-Lavalin affair,/video/c104070-live--standing-committee-meets-on-snc-lavalin,neutral,0.025565285,0.012587338,0.96184725,0.0004951444416481654
CTV,2024-02-27,"Man facing attempted murder, aggravated assault charges: N.S. RCMP",https://atlantic.ctvnews.ca/more/man-facing-attempted-murder-aggravated-assault-charges-n-s-rcmp-1.6785342,negative,0.0098915715,0.7071174,0.282991,-0.49991718568456633
CTV,2024-02-27,"U.S. will not send troops to fight in Ukraine, White House says",https://www.ctvnews.ca/world/u-s-will-not-send-troops-to-fight-in-ukraine-white-house-says-1.6785534,neutral,0.017312875,0.13677679,0.84591043,-0.01840814301210525
CTV,2024-02-27,'We just want to exist': Ukrainian-Canadians mark second anniversary of war,https://bc.ctvnews.ca/we-just-want-to-exist-ukrainian-canadians-mark-second-anniversary-of-war-1.6782414,negative,0.041587863,0.23999229,0.7184198,-0.055866761389353314
CTV,2024-02-27,We each have an average of 100 online accounts. Here's how to make sure they aren't a nightmare for your family if you die,https://www.ctvnews.ca/sci-tech/we-each-have-an-average-of-100-online-accounts-here-s-how-to-make-sure-they-aren-t-a-nightmare-for-your-family-if-you-die-1.6783708,negative,0.11592787,0.25848702,0.6255851,-0.05337626945809859
CTV,2024-02-27,Police investigation underway in Alliston neighbourhood,https://barrie.ctvnews.ca/police-investigation-underway-in-alliston-neighbourhood-1.6785421,neutral,0.03313303,0.053546395,0.91332066,-0.0017694170119537667
CTV,2024-02-27,Father of Kelowna crane collapse victim calls for better safety standards,https://bc.ctvnews.ca/father-of-kelowna-crane-collapse-victim-calls-for-better-safety-standards-1.6778328,negative,0.051164534,0.26857722,0.6802583,-0.06951590566434618
CTV,2024-02-27,County of Simcoe abandons organics and waste collections facility project,https://barrie.ctvnews.ca/county-of-simcoe-abandons-organics-and-waste-collections-facility-project-1.6785506,negative,0.01471204,0.5310617,0.4542263,-0.2818100793070677
CTV,2024-02-27,'Impossible to stay afloat': Vancouver restaurant closed for 3 days over capacity infraction,https://bc.ctvnews.ca/impossible-to-stay-afloat-vancouver-restaurant-closed-for-3-days-over-capacity-infraction-1.6785440,negative,0.0068318266,0.8448149,0.1483531,-0.7136656855027184
CTV,2024-02-27,"Toppled moon lander sends back more images, with only hours left until it dies",https://www.ctvnews.ca/sci-tech/toppled-moon-lander-sends-back-more-images-with-only-hours-left-until-it-dies-1.6785451,negative,0.03277209,0.6211481,0.34607974,-0.38475101826836067
CTV,2024-02-27,"Lethbridge boy, 14, facing child pornography, weapons charges in connection with online extremist activity: police",https://calgary.ctvnews.ca/lethbridge-boy-14-facing-child-pornography-weapons-charges-in-connection-with-online-extremist-activity-police-1.6785531,negative,0.0068748095,0.73394454,0.25918064,-0.5386273396283734
CTV,2024-02-27,"'There's a deer in the swimming pool': Wayward deer caught on tape in LaSalle, Ont. pool",https://windsor.ctvnews.ca/there-s-a-deer-in-the-swimming-pool-wayward-deer-caught-on-tape-in-lasalle-ont-pool-1.6783086,negative,0.019281773,0.33263382,0.6480844,-0.11027347346974636
CTV,2024-02-27,What's going on with Royal Family? Expert on what we know,/video/c2874766-what-s-going-on-with-the-royal-family-?playlistId=1.6785214,neutral,0.061244566,0.06387398,0.8748814,-0.0003289881923405069
CTV,2024-02-27,Arctic doomsday vault gets record batch of crop seeds,https://www.ctvnews.ca/climate-and-environment/arctic-doomsday-vault-gets-record-batch-of-crop-seeds-1.6785344,neutral,0.12420505,0.07418432,0.80161065,0.009923580573567126
CTV,2024-02-27,'Share your spare and be a hero': New Brunswick man searches for kidney donor,https://atlantic.ctvnews.ca/share-your-spare-and-be-a-hero-new-brunswick-man-searches-for-kidney-donor-1.6784710,neutral,0.20915692,0.05258596,0.7382571,0.04098133452393338
CTV,2024-02-27,What will astronauts eat in space? Menu has Canadian flavours,https://www.ctvnews.ca/canada/what-will-astronauts-eat-in-space-menu-has-canadian-flavours-1.6785306,neutral,0.06851256,0.01699143,0.91449606,0.004405259384557603
CTV,2024-02-27,"Sudbury curler wins first Scotties, undefeated in tournament",https://northernontario.ctvnews.ca/sudbury-curler-wins-first-scotties-undefeated-in-tournament-1.6783884,positive,0.5095684,0.0041186633,0.486313,0.2596429537194993
CTV,2024-02-27,Opposition pushing B.C. government for tax breaks at the pump,https://bc.ctvnews.ca/opposition-pushing-b-c-government-for-tax-breaks-at-the-pump-1.6784928,neutral,0.06310708,0.11547467,0.8214181,-0.009351903442983645
CTV,2024-02-27,"Thunderstorms, freezing rain and snow bring mix of messy weather across Canada",https://www.ctvnews.ca/climate-and-environment/thunderstorms-freezing-rain-and-snow-bring-mix-of-messy-weather-across-canada-1.6785126,negative,0.019060586,0.5911692,0.3897702,-0.3491176906723332
CTV,2024-02-27,Peek inside Seth Rogen's $2.3M penthouse up for sale in Vancouver,https://bc.ctvnews.ca/peek-inside-seth-rogen-s-2-3m-penthouse-up-for-sale-in-vancouver-1.6784907,neutral,0.07149753,0.0058936337,0.92260873,0.005077168695448719
CTV,2024-02-27,Latest big winners in two northern Ontario hospital lotteries,https://northernontario.ctvnews.ca/latest-big-winners-in-two-northern-ontario-hospital-lotteries-1.6784209,positive,0.76516485,0.0032440145,0.23159121,0.5854666476683956
CTV,2024-02-27,Manitoba couples open the barn doors for AirBnb seekers,https://winnipeg.ctvnews.ca/manitoba-couples-open-the-barn-doors-for-airbnb-seekers-1.6785545,neutral,0.057244398,0.030951517,0.9118042,0.00231892169438197
CBC,2024-02-27,"Consumers will ultimately pay the price for Quebec's new language rules, experts say",https://www.cbc.ca/news/canada/montreal/quebec-consumers-labelling-rules-1.7126064,negative,0.013340988,0.54169893,0.44496015,-0.2932597038551865
CBC,2024-02-27,"Long-awaited online harms bill proposes new regulatory bodies, Criminal Code changes",https://www.cbc.ca/news/politics/liberals-table-online-harms-legislation-1.7126080,neutral,0.054240625,0.07061217,0.8751473,-0.0020440318048693396
CBC,2024-02-27,"As Republican Party chair departs, some fear party will become 'Trump's playpen'",https://www.cbc.ca/news/world/rnc-trump-mcdaniel-resignation-1.7126616,negative,0.014003235,0.69339734,0.2925994,-0.48060380565457805
CBC,2024-02-27,Vending machines had eyes all over this Ontario campus — until the students wised up,https://www.cbc.ca/news/business/vending-machine-facial-analysis-invenda-waterloo-1.7126196,negative,0.06908711,0.3637761,0.56713676,-0.12756002094789665
CBC,2024-02-27,A First Nation in Alberta could soon have its health products delivered by drone,https://www.cbc.ca/news/canada/edmonton/a-first-nation-in-alberta-could-soon-have-its-health-products-delivered-by-drone-1.7126576,positive,0.2535055,0.010369439,0.7361251,0.06415750155258415
CBC,2024-02-27,I was ashamed of my disabilities. Then my parents insisted I compete in the Special Olympics,https://www.cbc.ca/news/canada/i-was-ashamed-of-my-disabilities-then-my-parents-insisted-i-compete-in-the-special-olympics-1.7122932,negative,0.013017165,0.8229263,0.16405655,-0.6770382080783399
CBC,2024-02-27,WATCH : CBC News Explore,https://www.cbc.cahttps://gem.cbc.ca/live,neutral,0.09840742,0.014817321,0.88677526,0.009464467482493077
CBC,2024-02-27,Biden hopes to have Israel-Hamas ceasefire deal in place by next week,https://www.cbc.ca/news/world/biden-israel-hamas-ceasefire-1.7126349,positive,0.4632579,0.011647469,0.5250946,0.214472226694582
CBC,2024-02-27,Her mom's lung cancer was caught too late. It's part of a pattern in Nunavik,https://www.cbc.ca/news/canada/montreal/lung-cancer-nunavik-mortality-inuit-patients-medical-care-1.7126038,negative,0.0074062096,0.77509695,0.21749668,-0.6007205370607211
CBC,2024-02-27,"Saskatoon police investigation finds RCMP officers did not cause death of Myles Sanderson, inquest hears",https://www.cbc.ca/news/canada/saskatoon/myles-sanderson-inquest-jury-saskatoon-news-saskatchewan-cbc-1.7126435,neutral,0.033545632,0.13304965,0.8334048,-0.016576894790539143
CBC,2024-02-27,"Ahead of official apology, some B.C. Doukhobor survivors dissatisfied with compensation offer",https://www.cbc.ca/news/canada/british-columbia/doukhobor-internment-camp-apology-compensation-1.7126517,negative,0.008245088,0.67277366,0.3189814,-0.4525562958784377
CBC,2024-02-27,WATCH: CBC News Network,https://www.cbc.cahttps://gem.cbc.ca/live,neutral,0.10073908,0.018231502,0.88102955,0.00981596340483426
CBC,2024-02-27,The drug crisis is affecting newcomers — but it's hard to tell how much,https://www.cbc.ca/player/play/2311204419750,negative,0.010262028,0.661894,0.32784393,-0.43799840875700546
CBC,2024-02-27,This P.E.I. senior has no fixed address. He says there aren't enough services for people like him,https://www.cbc.ca/player/play/2312132163641,negative,0.011108975,0.81245375,0.17643721,-0.6599577167467547
CBC,2024-02-27,"From classical to classic rock, this harpist is taking all requests",https://www.cbc.ca/player/play/2311470659909,positive,0.72759503,0.007150952,0.26525393,0.5293434578710823
CBC,2024-02-27,Canada's top pensions have trillions in assets. Should they do more to fuel the energy transition?,https://www.cbc.ca/news/climate/canada-pension-funds-climate-1.7125952,neutral,0.079183795,0.066047475,0.85476863,0.0019078056731762771
CBC,2024-02-27,Self-tapes are Hollywood's new normal for auditions. Not everyone is happy,https://www.cbc.ca/news/entertainment/self-tape-acting-1.7126250,negative,0.015691482,0.76555014,0.21875836,-0.5858208232266007
CBC,2024-02-27,Cineplex has made nearly $40M from online ticket fees at heart of drip-pricing lawsuit,https://www.cbc.ca/news/business/cineplex-online-booking-fees-competition-1.7126860,neutral,0.12353163,0.15516616,0.7213022,-0.008816474091808413
CBC,2024-02-27,"She's back on the street, and her brother worries she'll be back in jail soon",https://www.cbc.ca/news/canada/ottawa/barbara-cleary-cornwall-ontario-mental-illness-charge-1.7125574,negative,0.007939567,0.8090122,0.18304823,-0.6544376737135948
CBC,2024-02-27,WATCH | Addictions crisis frustrates and divides small Ontario city,https://www.cbc.cahttps://www.cbc.ca/player/play/2312142915552,negative,0.0063164155,0.8425301,0.15115352,-0.7098170121131018
CBC,2024-02-27,Canada's international student spike was blamed on private colleges. Here's what really happened,https://www.cbc.ca/news/canada/toronto/international-student-study-permits-data-1.7125827,negative,0.013464179,0.5018789,0.48465684,-0.2517011924454531
CBC,2024-02-27,She was murdered by her ex. Here are 5 ways friends think her death could've been prevented,https://www.cbc.cahttps://www.cbc.ca/newsinteractives/features/angies-angels-intimate-partner-violence,negative,0.008295621,0.7859687,0.20573552,-0.6176781408169507
CBC,2024-02-27,#TheMoment a man climbed up and down Mount Kilimanjaro backwards,https://www.cbc.ca/player/play/2311967299618,neutral,0.059170395,0.081770666,0.8590589,-0.0031853066534828223
CBC,2024-02-27,Saskatchewan father who killed toddler in police neglect case sentenced to 16 years,https://www.cbc.ca/news/canada/saskatchewan/saskatchewan-father-who-killed-toddler-in-police-neglect-case-sentenced-to-16-years-1.7126461,negative,0.006373042,0.80311614,0.19051078,-0.6449549467514633
CBC,2024-02-27,This 90-year-old hockey player shares his secret to a long life,https://www.cbc.ca/player/play/2312066627616,positive,0.70719755,0.0041669784,0.28863555,0.5001109649592195
CBC,2024-02-27,Jordan's story: 'No parent should have to bury their kid',https://www.cbc.ca/news/canada/calgary/jordan-kenneth-tomlinson-edmonton-stollery-children-s-hospital-1.7092202,negative,0.015738284,0.6115831,0.37267855,-0.3737862283320492
CBC,2024-02-27,"What will the online harms bill include? Here's what to watch for, one expert says",https://www.cbc.ca/player/play/2312046147771,neutral,0.08230661,0.010179393,0.9075141,0.006670750784490309
CBC,2024-02-27,"Winnipeg Jets unlikely to fly away again, experts in pro sports say",https://www.cbc.ca/news/canada/manitoba/true-north-nhl-viability-bettman-1.7126207,neutral,0.019155407,0.05776106,0.92308336,-0.0029694169028808837
CBC,2024-02-27,#TheMoment scientists discovered a new species of giant snake,https://www.cbc.ca/player/play/2311623747866,positive,0.35829455,0.015732538,0.625973,0.1281274493091331
CBC,2024-02-27,"Alberta gives cold shoulder to wind and solar industry, as the rest of the world is clamouring for more",https://www.cbc.ca/news/canada/calgary/alberta-renewables-wind-solar-ban-moratorium-1.7126195,negative,0.03068142,0.5403667,0.42895186,-0.2910548302203608
CBC,2024-02-27,Seth Rogen answers 8 questions in 2 minutes,https://www.cbc.ca/player/play/2311576643802,neutral,0.13853213,0.004630857,0.85683715,0.019169686720477586
CBC,2024-02-27,Curling champion Jennifer Jones wants to inspire people to chase their dreams,https://www.cbc.ca/player/play/2312134723992,positive,0.8457639,0.003496159,0.15074003,0.7153042877019686
CBC,2024-02-27,PWHL superfan Debbie Harrison 'living the dream' while soaking up league's inaugural season,https://www.cbc.ca/sports/hockey/pwhl/pwhl-superfan-debbie-harrison-1.7126241,positive,0.7710093,0.0029765258,0.22601423,0.5944464523113808
CBC,2024-02-27,#TheMoment an unopened case of hockey cards sold for $5M at auction,https://www.cbc.ca/player/play/2312250947746,neutral,0.052668136,0.05640742,0.89092445,-0.0004078646864442703
CBC,2024-02-27,Ukraine's allies keep hitting Russia with more sanctions. Russia keeps finding ways around them,https://www.cbc.ca/news/world/russia-ukraine-war-sanctions-effective-1.7126099,negative,0.019251382,0.5233597,0.45738885,-0.2735347906504977
CBC,2024-02-27,"1 million books and 4 months later, Toronto's library recovers from a cyberattack",https://www.cbc.ca/news/canada/toronto/toronto-library-ransomware-recovery-1.7126412,positive,0.27299166,0.030057888,0.6969505,0.07362095718827444
CBC,2024-02-27,B.C. lawyer reprimanded for citing fake cases invented by ChatGPT,https://www.cbc.ca/news/canada/british-columbia/lawyer-chatgpt-fake-precedent-1.7126393,negative,0.009245939,0.7431527,0.24760136,-0.5521904374493545
CBC,2024-02-27,Where does the term bunny hug come from?,https://www.cbc.ca/news/canada/saskatoon/good-question-bunny-hug-1.7125965,neutral,0.03387996,0.17152558,0.7945944,-0.028273179598675924
CBC,2024-02-27,"Canadians are deeply frustrated with the health care system, according to a big survey",https://www.cbc.ca/news/politics/primary-care-canada-10-000-canadians-report-1.7125990,negative,0.008174759,0.8735326,0.118292466,-0.7629925063342435
CBC,2024-02-27,Extreme cold warnings for parts of northern Sask. with wind chills around -45,https://www.cbc.ca/news/canada/saskatchewan/parts-of-saskatchewan-extreme-cold-1.7126716,negative,0.03654732,0.40080464,0.56264806,-0.15930864012850776
