source,date,headline,url,chosen_label,positive,negative,neutral,compound
Global,2024-02-27,NDP’s Singh questions provinces mulling pharmacare opt-out,https://globalnews.ca/news/10318091/ndp-jagmeet-singh-alberta-quebec-pharmacare-opt-out/,neutral,0.023206534,0.053739008,0.92305434,-0.002349341416429729
Global,2024-02-27,Saskatchewan street laws updated to crack down on stunting and street racing,https://globalnews.ca/news/10320100/saskatchewan-street-laws-updated-crack-down-stunting-street-racing/,neutral,0.036144413,0.11791321,0.84594244,-0.012597101364721475
Global,2024-02-27,Alberta intends to opt out of national pharmacare plan,https://globalnews.ca/news/10316372/alberta-intends-to-opt-out-of-national-pharmacare-plan/,negative,0.019454962,0.24399802,0.73654705,-0.0591565321899612
Global,2024-02-27,Here’s how sidelined homebuyers are preparing for possible rate cuts,https://globalnews.ca/news/10320176/sidelined-homebuyers-canada-possible-interest-rate-cuts/,neutral,0.037591662,0.10353003,0.8588784,-0.009305329763417802
Global,2024-02-27,American couple missing after their yacht was stolen while on Caribbean trip,https://globalnews.ca/video/10317963/american-couple-missing-after-their-yacht-was-stolen-while-on-caribbean-trip/,negative,0.018646788,0.38668638,0.5946668,-0.14917867975171362
Global,2024-02-27,"Man sets himself on fire outside Israeli embassy in Washington, D.C.",https://globalnews.ca/video/10317283/man-sets-himself-on-fire-outside-israeli-embassy-in-washington-d-c/,negative,0.010139853,0.69416654,0.29569367,-0.48176435038686805
Global,2024-02-27,"Canada’s Competition Bureau will have more time to review, stop mergers: Champagne",https://globalnews.ca/video/10320184/canadas-competition-bureau-will-have-more-time-to-review-stop-mergers-champagne/,neutral,0.12573385,0.068407685,0.80585843,0.011129392036908214
Global,2024-02-27,"Nova Scotia tables bill to restructure management, regulation of electricity sector",https://globalnews.ca/news/10320463/nova-scotia-bill-electricity-sector/,neutral,0.031621877,0.043156944,0.92522115,-0.0008625791091623203
Global,2024-02-27,N.S. auditor calls RCMP over ‘concealment’ by provincial Liberals of misuse of funds,https://globalnews.ca/news/10320210/ns-liberals-misuse-funds-concealment/,negative,0.014112391,0.52615845,0.4597292,-0.2766435259277955
Global,2024-02-27,Halifax harbour transshipment facility for imported vehicles hit by strike: Unifor,https://globalnews.ca/news/10320429/halifax-autoport-strike-unifor/,negative,0.014453947,0.3547375,0.63080853,-0.12562978064797115
Global,2024-02-27,CBSA makes ‘largest’ seizure of drugs at Winnipeg airport,https://globalnews.ca/news/10320317/cbsa-winnipeg-airport-largest-drug-seizure/,negative,0.0188072,0.41381562,0.56737727,-0.17088961915237455
Global,2024-02-27,BC Ferries starts vessel replacement process,https://globalnews.ca/video/10319640/bc-ferries-starts-vessel-replacement-process/,neutral,0.049142547,0.024838766,0.92601866,0.001798026389953411
Global,2024-02-27,Freeland says ‘being there’ to support Ukraine matters amid defence spending scrutiny,https://globalnews.ca/video/10320212/freeland-says-being-there-to-support-ukraine-matters-amid-defence-spending-scrutiny/,neutral,0.07502837,0.02479394,0.9001776,0.005014521419629325
Global,2024-02-27,Mother of child sex abuse victim on Online Harms Act: ‘The unregulated internet has damaged my child’,https://globalnews.ca/video/10319424/mother-of-child-sex-abuse-victim-on-online-harms-act-the-unregulated-internet-has-damaged-my-child/,negative,0.005146017,0.8935456,0.101308346,-0.7983973070024604
Global,2024-02-27,Singh brushes off possible pharmacare opt-outs by some provinces,https://globalnews.ca/video/10319089/singh-brushes-off-possible-pharmacare-opt-outs-by-some-provinces/,neutral,0.04516525,0.06605405,0.88878065,-0.002323239285061618
Global,2024-02-27,"Solar eclipse not a reason to close schools early, Ontario’s education minister says",https://globalnews.ca/news/10318360/ontario-education-minister-school-closure/,neutral,0.023730073,0.13070358,0.8455663,-0.01652031847954305
Global,2024-02-27,‘A champion by heart’: Special Olympic bowling athlete prepares for stiff competition,https://globalnews.ca/video/10319008/a-champion-by-heart-special-olympic-bowling-athlete-prepares-for-stiff-competition/,positive,0.60482985,0.007942805,0.38722742,0.3657560212234543
Global,2024-02-27,Fishing harbour demolition threatens bird population in Prince Edward County,https://globalnews.ca/news/10318722/prince-edward-county-fishing-harbour-demolition-birds/,negative,0.011942778,0.70343196,0.2846252,-0.4946739179091342
Global,2024-02-27,"Online Harms Act: Canada tables bill aiming to protect children, make internet safe",https://globalnews.ca/video/10319136/online-harms-act-canada-tables-bill-aiming-to-protect-children-make-internet-safe/,positive,0.31905907,0.011349529,0.6695915,0.1016698533333571
Global,2024-02-27,Arrest of Lethbridge teen prompts police to warn parents of online activity,https://globalnews.ca/news/10320207/arrest-of-lethbridge-teen-prompts-police-to-warn-parents-of-online-activity/,negative,0.013030361,0.43329892,0.55367076,-0.18757814772994053
Global,2024-02-27,Healthy Living Report: Fatty liver risks,https://globalnews.ca/video/10320045/healthy-living-report-fatty-liver-risks/,neutral,0.10442409,0.13492341,0.7606525,-0.0072999375330118355
Global,2024-02-27,U.S. couple likely dead after yacht hijacked by fugitives in Caribbean,https://globalnews.ca/news/10317460/couple-missing-yacht-stolen-escaped-prisoners-caribbean-grenada/,negative,0.009330122,0.57848674,0.41218323,-0.33455982446162125
Global,2024-02-27,B.C. proposes home flipping tax,https://globalnews.ca/video/10320057/b-c-proposes-home-flipping-tax/,neutral,0.05040065,0.047990244,0.901609,0.0002371620892174242
Global,2024-02-27,Mom who left toddler at home for 10 days while on holiday pleads guilty to murder,https://globalnews.ca/news/10312716/mom-vacation-toddler-dead-home-guilty-murder-kristel-candelario/,negative,0.011653763,0.792731,0.19561523,-0.628286607254001
Global,2024-02-27,Justice minister says Bill C-63 targets ‘worst of what we see online’,https://globalnews.ca/video/10319421/justice-minister-says-bill-c-63-targets-worst-of-what-we-see-online/,negative,0.006732333,0.7669062,0.22636156,-0.5880997186633126
Global,2024-02-27,Breaking Down the Online Harms Bill,https://globalnews.ca/video/10320039/breaking-down-the-online-harms-bill/,negative,0.030031614,0.22712176,0.7428467,-0.0506823767991591
Global,2024-02-27,"Canada is facing ‘irrelevance’ on world stage, ex-defence chief warns",https://globalnews.ca/news/10310531/rick-hillier-canada-defence-irrelevance/,negative,0.011706044,0.50775635,0.4805376,-0.25767948172237354
Global,2024-02-27,The Folklore of Leap Years,https://globalnews.ca/video/10320034/the-folklore-of-leap-years/,neutral,0.14792986,0.022526553,0.82954353,0.021375806254022578
Global,2024-02-27,Some Canadians exploring ‘non-traditional’ ways to own a home. What are they?,https://globalnews.ca/news/10318361/housing-affordability-non-traditional-ownership-remax-canada/,neutral,0.04030926,0.017406229,0.94228446,0.0013218607834355467
Global,2024-02-27,Police release videos appearing to show Vaughan arson,https://globalnews.ca/video/10320424/police-release-videos-appearing-to-show-vaughan-arson/,negative,0.015409171,0.29514125,0.6894496,-0.08687090648415285
Global,2024-02-27,3-year-old missing nearly a week as mom faces child neglect charge,https://globalnews.ca/news/10317170/elijah-vue-missing-wisconsin-boy-child-neglect/,negative,0.012360811,0.6426866,0.3449526,-0.4128932643898082
Global,2024-02-27,"Trudeau defends Canada’s NATO defence spending, Ukraine war aid",https://globalnews.ca/video/10319417/trudeau-defends-canadas-nato-defence-spending-ukraine-war-aid/,neutral,0.1802894,0.020115728,0.7995949,0.03209962358454277
Global,2024-02-27,3-year-old Elijah Vue missing nearly a week as mom faces child neglect charge,https://globalnews.ca/video/10320112/3-year-old-elijah-vue-missing-nearly-a-week-as-mom-faces-child-neglect-charge/,negative,0.0147052165,0.5530109,0.43228385,-0.3056048063838368
Global,2024-02-27,"Missing woman found dead, search for 3-year-old boy continues: N.S. police",https://globalnews.ca/news/10320382/ns-missing-toddler-lucas-robert-cooper/,negative,0.019719105,0.23073839,0.7495426,-0.052851340886121534
Global,2024-02-27,Saskatchewan teacher job action announced for Friday,https://globalnews.ca/news/10319990/saskatchewan-teacher-job-action-friday/,neutral,0.028797299,0.01817249,0.95303035,0.0004990435921192748
CTV,2024-02-27,"Special weather statements issued in parts of N.S., N.B.",https://atlantic.ctvnews.ca/special-weather-statements-issued-in-parts-of-n-s-n-b-1.6785163,neutral,0.044827152,0.012171745,0.94300103,0.0018613244880496538
CTV,2024-02-27,Eagles' Don Henley quizzed at lyrics trial about time a naked 16-year-old girl overdosed at his home,https://www.ctvnews.ca/entertainment/eagles-don-henley-quizzed-at-lyrics-trial-about-time-a-naked-16-year-old-girl-overdosed-at-his-home-1.6784881,negative,0.01659481,0.22831923,0.7550859,-0.051854297715743236
CTV,2024-02-27,"Legal challenge against Sask. pronoun policy halted, government to file appeal",https://regina.ctvnews.ca/legal-challenge-against-sask-pronoun-policy-halted-government-to-file-appeal-1.6784968,negative,0.018971566,0.40215644,0.57887197,-0.16136989540732571
CTV,2024-02-27,'It was sickening': Victim's relative disgusted by Robert Pickton T-shirt sold by comedy group,https://bc.ctvnews.ca/it-was-sickening-victim-s-relative-disgusted-by-robert-pickton-t-shirt-sold-by-comedy-group-1.6784848,negative,0.004684202,0.90702033,0.08829538,-0.8226640119422086
CTV,2024-02-27,"Electric school buses finally make headway in the U.S., but hurdles still stand",https://www.ctvnews.ca/autos/electric-school-buses-finally-make-headway-in-the-u-s-but-hurdles-still-stand-1.6783268,positive,0.36067036,0.01955252,0.619777,0.12970083621199002
CTV,2024-02-27,Gas mixed with windshield washer fluid causes vehicles to break down: fuel analysis company,https://kitchener.ctvnews.ca/gas-mixed-with-windshield-washer-fluid-causes-vehicles-to-break-down-fuel-analysis-company-1.6784723,negative,0.008834576,0.74382365,0.24734174,-0.553195579365946
CTV,2024-02-27,Wild weather coming: When to expect storms in Ontario,/video/c2874620-what-to-know-about-canada-s-forecast,neutral,0.030614575,0.16434896,0.8050364,-0.02607333472308504
CTV,2024-02-27,"'We're not wavering in our commitment to inclusion,' says Alta. mayor after passing of bylaw banning Pride crosswalks, flags",https://edmonton.ctvnews.ca/we-re-not-wavering-in-our-commitment-to-inclusion-says-alta-mayor-after-passing-of-bylaw-banning-pride-crosswalks-flags-1.6780508,neutral,0.18081386,0.023843635,0.79534245,0.03212514397867494
CTV,2024-02-27,Liberals push for long-term House rule changes they say are needed to combat Conservative obstruction,https://www.ctvnews.ca/politics/liberals-push-for-long-term-house-rule-changes-they-say-are-needed-to-combat-conservative-obstruction-1.6784194,neutral,0.14338839,0.024812575,0.83179903,0.019944566457638757
CTV,2024-02-27,Ottawa will shut down shady post-secondary institutions if provinces don't: Miller,https://www.ctvnews.ca/politics/ottawa-will-shut-down-shady-post-secondary-institutions-if-provinces-don-t-miller-1.6785461,negative,0.014682949,0.33966827,0.64564866,-0.11515898607371255
CTV,2024-02-27,"Changes needed to ensure safer, more resilient RCMP, union mental-health report says",https://www.ctvnews.ca/health/changes-needed-to-ensure-safer-more-resilient-rcmp-union-mental-health-report-says-1.6785385,neutral,0.16335961,0.025161881,0.8114786,0.0260532284236632
CTV,2024-02-27,"Fares may be down, but these Canadian airline fees may bring the price back up",https://www.ctvnews.ca/business/fares-may-be-down-but-these-canadian-airline-fees-may-bring-the-price-back-up-1.6785080,neutral,0.07683695,0.14107345,0.7820895,-0.013997809506156145
CTV,2024-02-27,Sudbury mom shares concerns after daughter's health card invalid at ER,https://northernontario.ctvnews.ca/sudbury-mom-shares-concerns-after-daughter-s-health-card-invalid-at-er-1.6784663,negative,0.0115128765,0.5633329,0.4251543,-0.31721137782711395
CTV,2024-02-27,'Blown away': CRA tells Ontario man he's on the hook for over $38K in CERB payments,https://toronto.ctvnews.ca/blown-away-cra-tells-ontario-man-he-s-on-the-hook-for-over-38k-in-cerb-payments-1.6778528,negative,0.010890998,0.697487,0.29162204,-0.4863694552493669
CTV,2024-02-27,Fort Sask. woman tragically killed in police incident well-known community pillar,https://edmonton.ctvnews.ca/fort-sask-woman-tragically-killed-in-police-incident-well-known-community-pillar-1.6784592,negative,0.013077394,0.68110365,0.30581906,-0.4637311000745594
CTV,2024-02-27,"In Quebec's strawberry fields, a tiny insect may forecast big climate impacts: study",https://montreal.ctvnews.ca/in-quebec-s-strawberry-fields-a-tiny-insect-may-forecast-big-climate-impacts-study-1.6781570,negative,0.033917174,0.23959853,0.72648424,-0.056257091989296626
CTV,2024-02-27,What careers is AI putting at risk? Tech expert explains,/video/c2874615-what-careers-is-ai-putting-at-risk-,negative,0.025254473,0.2549433,0.7198022,-0.06435830694455458
CTV,2024-02-27,Police describe the chaos as a Woolwich demonstration turned violent,https://kitchener.ctvnews.ca/police-describe-the-chaos-as-a-woolwich-demonstration-turned-violent-1.6784581,negative,0.0073991995,0.6867635,0.30583733,-0.4715893506084754
CTV,2024-02-27,Shovelling brigade: Volunteers coming together to help stranded N.L. seniors,https://www.ctvnews.ca/canada/shovelling-brigade-volunteers-coming-together-to-help-stranded-n-l-seniors-1.6779545,neutral,0.19874671,0.012137815,0.7891155,0.03935292579724692
CTV,2024-02-27,"Kids are using phones in class, even when it’s against the rules. Should schools ban them all day?",https://www.ctvnews.ca/sci-tech/kids-are-using-phones-in-class-even-when-it-s-against-the-rules-should-schools-ban-them-all-day-1.6785435,negative,0.020591768,0.58284503,0.39656332,-0.33928422575595363
CTV,2024-02-27,Priest facing sexual assault charge in Nunavut will not be dismissed from Oblates,https://www.ctvnews.ca/canada/priest-facing-sexual-assault-charge-in-nunavut-will-not-be-dismissed-from-oblates-1.6785422,negative,0.016961666,0.49793872,0.48509943,-0.24765535919857484
CTV,2024-02-27,New report suggests Canadian households are turning to 'creative solutions' to get into housing market,https://toronto.ctvnews.ca/new-report-suggests-canadian-households-are-turning-to-creative-solutions-to-get-into-housing-market-1.6785468,neutral,0.037250876,0.1313838,0.8313654,-0.01587406839107608
CTV,2024-02-27,36 per cent of food programs forced to turn people away,/video/c2874678-canadian-food-programs-forced-to-turn-people-away?playlistId=1.6775764,negative,0.008433663,0.816133,0.17543328,-0.6660020319610922
CTV,2024-02-27,'Just devastating': Over-capacity schools creating problems for Calgary families,https://calgary.ctvnews.ca/just-devastating-over-capacity-schools-creating-problems-for-calgary-families-1.6785278,negative,0.006610913,0.8774039,0.11598527,-0.7697938282180319
CTV,2024-02-27,Police warn farmers about series of thefts in the South Okanagan,https://bc.ctvnews.ca/police-warn-farmers-about-series-of-thefts-in-the-south-okanagan-1.6773985,negative,0.012738044,0.53723085,0.4500311,-0.2884547275100253
CTV,2024-02-27,"N.S. woman found dead, three-year-old boy still missing",https://atlantic.ctvnews.ca/n-s-woman-found-dead-three-year-old-boy-still-missing-1.6784993,negative,0.01710391,0.38098213,0.601914,-0.14485482936597016
CTV,2024-02-27,"Snowfall warning issued for Metro Vancouver, 5 cm expected",https://bc.ctvnews.ca/snowfall-warning-issued-for-metro-vancouver-5-cm-expected-1.6785538,neutral,0.043519493,0.16133723,0.79514337,-0.024135743550722566
CTV,2024-02-27,Fire destroys home in Ramara Township,https://barrie.ctvnews.ca/fire-destroys-home-in-ramara-township-1.6785493,negative,0.009545261,0.82219636,0.16825835,-0.6759157616315745
CTV,2024-02-27,Three people rescued from Sarnia apartment fire,https://london.ctvnews.ca/three-people-rescued-from-sarnia-apartment-fire-1.6785008,neutral,0.08797697,0.038936805,0.8730862,0.006223872977426659
CTV,2024-02-27,The Grandparent Scam is resurfacing in Manitoba. Here is how to protect yourself,https://winnipeg.ctvnews.ca/the-grandparent-scam-is-resurfacing-in-manitoba-here-is-how-to-protect-yourself-1.6785540,negative,0.014204958,0.7352047,0.25059026,-0.5403242075321373
CTV,2024-02-27,Montreal's English school boards are closing for the solar eclipse on April 8,https://montreal.ctvnews.ca/montreal-s-english-school-boards-are-closing-for-the-solar-eclipse-on-april-8-1.6785424,neutral,0.016861616,0.087993875,0.8951446,-0.0074586026165146535
CTV,2024-02-27,City councillor says motion could put brakes on controversial homeless shelter,https://saskatoon.ctvnews.ca/city-councillor-says-motion-could-put-brakes-on-controversial-homeless-shelter-1.6785473,negative,0.015702812,0.2499497,0.7343474,-0.062228291950694015
CTV,2024-02-27,Ontario will not give Toronto more money for FIFA World Cup,https://toronto.ctvnews.ca/ontario-will-not-give-toronto-more-money-for-fifa-world-cup-1.6785406,negative,0.037250865,0.41620398,0.5465451,-0.17183814416255672
CTV,2024-02-27,3 men snared in right-wing extremism probe charged in London court with prepping for terrorism,https://www.ctvnews.ca/world/3-men-snared-in-right-wing-extremism-probe-charged-in-london-court-with-prepping-for-terrorism-1.6785324,negative,0.008233345,0.64229274,0.34947392,-0.4124721539856022
CTV,2024-02-27,These driving offences will soon come with an automatic impoundment and suspension in Sask.,https://regina.ctvnews.ca/these-driving-offences-will-soon-come-with-an-automatic-impoundment-and-suspension-in-sask-1.6785471,negative,0.007005655,0.826006,0.16698848,-0.6822367399208691
CTV,2024-02-27,Unions call on government to extend compensation for public servants over Phoenix pay system,https://ottawa.ctvnews.ca/unions-call-on-government-to-extend-compensation-for-public-servants-over-phoenix-pay-system-1.6784575,neutral,0.070981696,0.13971964,0.7892986,-0.014483180393010109
CTV,2024-02-27,30-year solution for shoreline erosion in Chatham-Kent,https://windsor.ctvnews.ca/30-year-solution-for-shoreline-erosion-in-chatham-kent-1.6785033,neutral,0.03776223,0.20293227,0.75930566,-0.039755495325705326
CTV,2024-02-27,Police issue warning after senior with dementia loses $600K to repeated grandparent scams,https://toronto.ctvnews.ca/police-issue-warning-after-senior-with-dementia-loses-600k-to-repeated-grandparent-scams-1.6780188,negative,0.008756016,0.82094026,0.17030369,-0.6738662479556279
CTV,2024-02-27,Alberta intends to opt out of national pharmacare program: health minister,https://calgary.ctvnews.ca/alberta-intends-to-opt-out-of-national-pharmacare-program-health-minister-1.6784590,neutral,0.017408097,0.20253661,0.78005534,-0.04071802642797806
CTV,2024-02-27,'An angel on Earth': Vigil held for father of 4 killed in Toronto bus stop shooting,https://toronto.ctvnews.ca/an-angel-on-earth-vigil-held-for-father-of-4-killed-in-toronto-bus-stop-shooting-1.6782230,neutral,0.09526945,0.19353485,0.71119577,-0.028379464067830984
CTV,2024-02-27,Indigenous leader in Nova Scotia accusing radiologists of conducting secret tests,https://atlantic.ctvnews.ca/indigenous-leader-in-nova-scotia-accusing-radiologists-of-conducting-secret-tests-1.6784264,negative,0.010988398,0.4661751,0.52283657,-0.2171984606643349
CTV,2024-02-27,What to do if you have travel issues when flying,https://montreal.ctvnews.ca/what-to-do-if-you-have-travel-issues-when-flying-1.6785423,negative,0.020365845,0.2730099,0.7066243,-0.07411962120303883
CTV,2024-02-27,Saskatchewan father who killed toddler sentenced to 16 years,https://saskatoon.ctvnews.ca/saskatchewan-father-who-killed-toddler-sentenced-to-16-years-1.6784309,negative,0.0070031495,0.79887336,0.19412345,-0.6381496565771627
CTV,2024-02-27,'Representing our ancestors:' Labrador designer wows at New York Fashion Week,https://www.ctvnews.ca/entertainment/representing-our-ancestors-labrador-designer-wows-at-new-york-fashion-week-1.6771665,positive,0.66035384,0.00571732,0.33392882,0.4360345052630521
CTV,2024-02-27,Ukrainian President Zelenskyy lands in Saudi Arabia to push for peace and a POW exchange with Russia,https://www.ctvnews.ca/world/ukrainian-president-zelenskyy-lands-in-saudi-arabia-to-push-for-peace-and-a-pow-exchange-with-russia-1.6785375,neutral,0.081855245,0.00988122,0.9082635,0.006602644744622133
CTV,2024-02-27,String of drug-related deaths prompts police warning in N.L.,https://www.ctvnews.ca/canada/string-of-drug-related-deaths-prompts-police-warning-in-n-l-1.6776789,negative,0.007956212,0.62747973,0.36456403,-0.39366753135333
CTV,2024-02-27,Saskatoon digs out after winter storm,https://saskatoon.ctvnews.ca/saskatoon-digs-out-after-winter-storm-1.6784824,negative,0.024914315,0.24589288,0.7291928,-0.05984259006980164
CTV,2024-02-27,"2024 Special Olympics Canada Winter Games begin in Calgary with torch run, opening ceremony",https://calgary.ctvnews.ca/2024-special-olympics-canada-winter-games-begin-in-calgary-with-torch-run-opening-ceremony-1.6785458,neutral,0.08820839,0.0052395575,0.9065522,0.007753255100638512
CTV,2024-02-27,Vollmer pool closed again after swim student steps on glass,https://windsor.ctvnews.ca/vollmer-pool-closed-again-after-swim-student-steps-on-glass-1.6785073,negative,0.012023793,0.5835816,0.40439466,-0.3404228916637404
CTV,2024-02-27,One person rescued from downtown Sudbury fire,https://northernontario.ctvnews.ca/one-person-rescued-from-downtown-sudbury-fire-1.6784497,neutral,0.06343146,0.043045122,0.89352345,0.002170666470502347
CTV,2024-02-27,'We get that': Freeland says Canada needs more homes faster,/video/c2874626--we-have-to-build-more-faster-,neutral,0.090112306,0.03714122,0.8727464,0.006740761144063523
CTV,2024-02-27,Country star Corb Lund criticizes Alberta minister over coal application support,https://calgary.ctvnews.ca/country-star-corb-lund-criticizes-alberta-minister-over-coal-application-support-1.6781961,negative,0.018145535,0.2686377,0.7132166,-0.07183699134055743
CTV,2024-02-27,"Buyer pays nearly US$4M for unopened hockey card boxes, hoping for the ones that will make it all worth it",https://www.ctvnews.ca/canada/buyer-pays-nearly-us-4m-for-unopened-hockey-card-boxes-hoping-for-the-ones-that-will-make-it-all-worth-it-1.6784087,positive,0.32815015,0.17574741,0.4961024,0.07679537789899715
CTV,2024-02-27,The 'Doomsday Glacier' is rapidly melting. Scientists now have evidence for when it started and why,https://www.ctvnews.ca/climate-and-environment/the-doomsday-glacier-is-rapidly-melting-scientists-now-have-evidence-for-when-it-started-and-why-1.6784671,negative,0.02609251,0.43711105,0.5367964,-0.19038527590513254
CTV,2024-02-27,"Toronto woman says she lost $340,000 to cryptocurrency scam",https://toronto.ctvnews.ca/toronto-woman-says-she-lost-340-000-to-cryptocurrency-scam-1.6784858,negative,0.0058197957,0.88054234,0.11363804,-0.775320782368901
CTV,2024-02-27,"How police, U.S. secret service helped an Ont. business being scammed out of $615K",https://northernontario.ctvnews.ca/how-police-u-s-secret-service-helped-an-ont-business-being-scammed-out-of-615k-1.6783729,negative,0.019443147,0.5699351,0.41062173,-0.32444797943339054
CTV,2024-02-27,Toronto area made progress but residents worry bus stop shootings will revive stigma,https://toronto.ctvnews.ca/toronto-area-made-progress-but-residents-worry-bus-stop-shootings-will-revive-stigma-1.6785006,negative,0.03239432,0.5094495,0.4581562,-0.25848938271996413
CTV,2024-02-27,"Helicopter crashes in Colombia, but everybody survives",/video/c2874714-watch--helicopter-crashes-moments-after-takeoff,negative,0.13763735,0.3176047,0.54475796,-0.08192870032741695
CTV,2024-02-27,Man wearing ski mask and waving water gun outside bank arrested: GPS,https://kitchener.ctvnews.ca/man-wearing-ski-mask-and-waving-water-gun-outside-bank-arrested-gps-1.6785166,negative,0.01996333,0.28022593,0.6998107,-0.07812805450542015
CTV,2024-02-27,"Draisaitl, Bouchard help Oilers beat Kings 4-2 to snap three-game skid",https://edmonton.ctvnews.ca/draisaitl-bouchard-help-oilers-beat-kings-4-2-to-snap-three-game-skid-1.6785309,positive,0.225005,0.0133329565,0.761662,0.05044948880460254
CTV,2024-02-27,Will Taylor Swift endorse him in 2024? Biden says that's 'classified',https://www.ctvnews.ca/entertainment/will-taylor-swift-endorse-him-in-2024-biden-says-that-s-classified-1.6785420,neutral,0.030039594,0.13957077,0.83038956,-0.018577631555934282
CTV,2024-02-27,"Real Madrid, Alphonso Davies reach verbal agreement: report",https://www.ctvnews.ca/sports/real-madrid-alphonso-davies-reach-verbal-agreement-report-1.6784307,neutral,0.14688338,0.0076860655,0.8454306,0.021515644445862847
CTV,2024-02-27,Five things to know about Canada's proposed law to guard against online harms,https://www.ctvnews.ca/politics/five-things-to-know-about-canada-s-proposed-law-to-guard-against-online-harms-1.6785283,neutral,0.090578474,0.03366741,0.8757542,0.007070961759348515
CTV,2024-02-27,Police arrest three suspects in killing of man on New York subway car,https://www.ctvnews.ca/world/police-arrest-three-suspects-in-killing-of-man-on-new-york-subway-car-1.6785472,negative,0.011011655,0.63698953,0.3519988,-0.40563440964155006
CTV,2024-02-27,Sask. teachers now have job action planned for all 5 school days this week,https://regina.ctvnews.ca/sask-teachers-now-have-job-action-planned-for-all-5-school-days-this-week-1.6785364,neutral,0.09259944,0.009118938,0.89828163,0.008491500032997923
