source,date,headline,url,chosen_label,positive,negative,neutral,compound
CTV,2024-01-16,Meet the St. John’s group putting food on the move,https://www.ctvnews.ca/canada/meet-the-st-john-s-group-putting-food-on-the-move-1.6726607,neutral,0.08623875,0.008310944,0.90545034,0.00736804719460693
CTV,2024-01-16,Here's how much it cost to rent an apartment in Ottawa in December,https://ottawa.ctvnews.ca/here-s-how-much-it-cost-to-rent-an-apartment-in-ottawa-in-december-1.6727593,neutral,0.052532054,0.057718344,0.8897496,-0.0005717905668678469
CTV,2024-01-16,Drug-testing device in Kitchener could soon be powered down,https://kitchener.ctvnews.ca/drug-testing-device-in-kitchener-could-soon-be-powered-down-1.6726757,negative,0.022493044,0.30777648,0.6697305,-0.09422042559771882
CTV,2024-01-16,Teachers hit the picket line as Saskatchewan deep freeze continues,https://regina.ctvnews.ca/teachers-hit-the-picket-line-as-saskatchewan-deep-freeze-continues-1.6726764,negative,0.017217161,0.34974405,0.63303876,-0.12202448103264629
CTV,2024-01-16,Eagles star Jason Kelce intends to retire after 13 NFL seasons,https://www.ctvnews.ca/sports/eagles-star-jason-kelce-intends-to-retire-after-13-nfl-seasons-1.6727858,neutral,0.03299567,0.07611493,0.8908894,-0.0047047679730152225
CTV,2024-01-16,"Liberal, NDP MPs head to Jordan, West Bank to ask Palestinians how to advance peace",https://www.ctvnews.ca/politics/liberal-ndp-mps-head-to-jordan-west-bank-to-ask-palestinians-how-to-advance-peace-1.6726897,neutral,0.050400876,0.08595418,0.8636449,-0.004847874714799971
CTV,2024-01-16,"Are fingerprints unique? Not really, AI-based study finds",https://www.ctvnews.ca/sci-tech/are-fingerprints-unique-not-really-ai-based-study-finds-1.6723533,neutral,0.06069545,0.06682433,0.87248015,-0.0007815539771920399
CTV,2024-01-16,Food prices in Canada rose in December. Here's what cost you more,https://www.ctvnews.ca/business/food-prices-in-canada-rose-in-december-here-s-what-cost-you-more-1.6728111,negative,0.0390043,0.50711733,0.45387825,-0.2556467081208913
CTV,2024-01-16,"Cold replaced with snow, as new winter woes impact Alberta and B.C.",https://calgary.ctvnews.ca/cold-replaced-with-snow-as-new-winter-woes-impact-alberta-and-b-c-1.6727980,negative,0.019047517,0.5498848,0.43106776,-0.30201045018155526
CTV,2024-01-16,Water main breaks at West Edmonton Mall,https://edmonton.ctvnews.ca/water-main-breaks-at-west-edmonton-mall-1.6727780,negative,0.016739184,0.51787823,0.46538258,-0.26791766518192617
CTV,2024-01-16,Details of how stabbing rampage unfolded expected on Day 2 of Saskatchewan inquest,https://saskatoon.ctvnews.ca/details-of-how-stabbing-rampage-unfolded-expected-on-day-2-of-saskatchewan-inquest-1.6728185,neutral,0.014529447,0.16918898,0.8162817,-0.028413788597569933
CTV,2024-01-16,Calgary police block off scene near southwest school,https://calgary.ctvnews.ca/calgary-police-block-off-scene-near-southwest-school-1.6728163,negative,0.01300129,0.3020538,0.684945,-0.09106744417013957
CTV,2024-01-16,Province wants to expand major crime unit to more Vancouver Island communities,https://vancouverisland.ctvnews.ca/province-wants-to-expand-major-crime-unit-to-more-vancouver-island-communities-1.6727407,neutral,0.076342136,0.05651738,0.8671405,0.0026339075197936435
CTV,2024-01-16,Pallet shelters expected to arrive in the Halifax area by the end of the month,https://atlantic.ctvnews.ca/pallet-shelters-expected-to-arrive-in-the-halifax-area-by-the-end-of-the-month-1.6720246,neutral,0.10391598,0.0069352384,0.88914895,0.010750417147606939
CTV,2024-01-16,"Day after Trump win in Iowa, Trudeau says U.S. faces choice between optimism, retreat",https://www.ctvnews.ca/politics/day-after-trump-win-in-iowa-trudeau-says-u-s-faces-choice-between-optimism-retreat-1.6728212,neutral,0.087696135,0.056980018,0.85532385,0.004443889584667682
CTV,2024-01-16,Caledon fail-to-remain crash nets Brampton driver,https://barrie.ctvnews.ca/caledon-fail-to-remain-crash-nets-brampton-driver-1.6727621,negative,0.008955192,0.62214357,0.36890122,-0.38698244048631025
CTV,2024-01-16,B.C. regulator says unauthorized midwife operating in Fraser Valley,https://bc.ctvnews.ca/b-c-regulator-says-unauthorized-midwife-operating-in-fraser-valley-1.6728213,negative,0.014071468,0.33965904,0.6462695,-0.11517025408270243
CTV,2024-01-16,'What happened to Xavier?': Case against Ont. father accused of killing infant son hinges on circumstantial evidence,https://toronto.ctvnews.ca/what-happened-to-xavier-case-against-ont-father-accused-of-killing-infant-son-hinges-on-circumstantial-evidence-1.6726441,negative,0.009152926,0.4286812,0.5621659,-0.18368377832981686
CTV,2024-01-16,Here's when travel experts say you should book your next trip,https://toronto.ctvnews.ca/here-s-when-travel-experts-say-you-should-book-your-next-trip-1.6727075,positive,0.32592064,0.010938275,0.6631411,0.10610461838739482
CTV,2024-01-16,2 people hurt in crash on Ottawa's Baseline Road,https://ottawa.ctvnews.ca/2-people-hurt-in-crash-on-ottawa-s-baseline-road-1.6727736,negative,0.0111747375,0.6474671,0.3413582,-0.4190887217705246
CTV,2024-01-16,'A system that has gotten out of control': Immigration minister to consider cap on international students in Canada,https://www.ctvnews.ca/politics/a-system-that-has-gotten-out-of-control-immigration-minister-to-consider-cap-on-international-students-in-canada-1.6724706,negative,0.009502455,0.67527026,0.31522727,-0.4558996262581161
CTV,2024-01-16,Cold snap brings rare opportunity for outdoor skating on Vancouver Island,https://vancouverisland.ctvnews.ca/cold-snap-brings-rare-opportunity-for-outdoor-skating-on-vancouver-island-1.6727384,positive,0.4722392,0.009467718,0.51829296,0.22292027594854957
CTV,2024-01-16,Fears of bankruptcy as small businesses stare down federal CEBA loan deadline,https://www.ctvnews.ca/canada/fears-of-bankruptcy-as-small-businesses-stare-down-federal-ceba-loan-deadline-1.6728113,negative,0.018538538,0.60348254,0.37797892,-0.3638475041555864
CTV,2024-01-16,Snowstorm leads to stranded motorists on closed roads,https://london.ctvnews.ca/snowstorm-leads-to-stranded-motorists-on-closed-roads-1.6726899,negative,0.015808135,0.7366318,0.24755998,-0.5423765586241291
CTV,2024-01-16,Thieves make off with six vehicles from N.B. dealership,/video/c2847341-thieves-steal-from-used-n-b--car-dealership,neutral,0.07503224,0.05586341,0.8691043,0.002509117111328951
CTV,2024-01-16,Caring society tells human rights tribunal Canada is failing on Jordan's Principle,https://www.ctvnews.ca/canada/caring-society-tells-human-rights-tribunal-canada-is-failing-on-jordan-s-principle-1.6727632,negative,0.011622459,0.8274164,0.16096123,-0.6844827904225497
CTV,2024-01-16,Ontario's Matty Matheson steals the show with Emmys acceptance speech and co-star kiss,https://toronto.ctvnews.ca/ontario-s-matty-matheson-steals-the-show-with-emmys-acceptance-speech-and-co-star-kiss-1.6727901,positive,0.8832204,0.0023514538,0.11442824,0.78007263507331
CTV,2024-01-16,Up to 20 cm of snow in forecast for B.C.'s South Coast,https://bc.ctvnews.ca/up-to-20-cm-of-snow-in-forecast-for-b-c-s-south-coast-1.6728069,neutral,0.05465912,0.0892459,0.85609484,-0.0049772161743852905
CTV,2024-01-16,"Iran strikes targets in northern Iraq, Syria as regional tensions escalate",https://www.ctvnews.ca/world/iran-strikes-targets-in-northern-iraq-syria-as-regional-tensions-escalate-1.6727582,negative,0.010307756,0.5112818,0.47841045,-0.2613028327455247
CTV,2024-01-16,"Federal government to provide funding to speed up credentialing of 6,600 internationally educated health professionals",https://www.ctvnews.ca/health/federal-government-to-provide-funding-to-speed-up-credentialing-of-6-600-internationally-educated-health-professionals-1.6727224,positive,0.40647644,0.007853155,0.5856704,0.1651614227154603
CTV,2024-01-16,Bail decision reserved for one of two teens charged in P.E.I. murder,https://atlantic.ctvnews.ca/bail-decision-reserved-for-one-of-two-teens-charged-in-p-e-i-murder-1.6728187,negative,0.013608062,0.51575065,0.47064131,-0.2658135507494386
CBC,2024-01-16,Go beyond the headlines | Stream CBC News Explore,https://www.cbc.cahttps://www.cbc.ca/news/cbc-news-explore-1.6512577,neutral,0.09185704,0.0112939505,0.89684886,0.008310174861161368
CBC,2024-01-16,Empty Malta-flagged ship hit by missile off Yemen,https://www.cbc.ca/news/world/red-sea-yemen-houthi-greece-malta-ship-attacked-1.7084987,negative,0.013271557,0.55881494,0.42791352,-0.312097989503469
CBC,2024-01-16,Inquest examining stabbing massacre on James Smith Cree Nation enters 2nd day,https://www.cbc.ca/news/canada/saskatchewan/james-smith-cree-nation-stabbing-massacre-public-inquest-1.7084719,negative,0.0118127735,0.37779483,0.6103924,-0.1425893933947009
CBC,2024-01-16,"Her dad would've loved to see a Detroit Lions win, so this Windsor woman brought his ashes to Ford Field",https://www.cbc.ca/news/canada/windsor/windsor-detroit-lions-ashes-1.7084332,positive,0.5523927,0.07571586,0.3718914,0.29940482548923963
CBC,2024-01-16,Who gets Rover after a breakup? Changes to B.C. family law aim to help courts decide pet custody,https://www.cbc.ca/news/canada/british-columbia/bc-family-law-changes-1.7084748,neutral,0.06354024,0.028012183,0.9084475,0.0032526825739589427
CBC,2024-01-16,"SUV stolen from Toronto driveway shows up 50 days later — and 11,000 km away",https://www.cbc.ca/news/canada/toronto-man-finds-stolen-truck-in-uae-1.7083615,negative,0.015337068,0.542082,0.44258088,-0.2936177137033056
CBC,2024-01-16,WATCH: CBC News Network,https://www.cbc.cahttps://gem.cbc.ca/live,neutral,0.10073908,0.018231502,0.88102955,0.00981596340483426
CBC,2024-01-16,Buffalo Bills fans work hard and play hard while shovelling snow at stadium,https://www.cbc.ca/radio/asithappens/buffalo-bills-snow-1.7084555,positive,0.46868902,0.08080095,0.45051008,0.21314058491235954
CBC,2024-01-16,E is for error: Telus bid to appeal property assessments foiled by email mishap,https://www.cbc.ca/news/canada/british-columbia/telus-email-property-assessment-1.7079747,negative,0.009241046,0.77492976,0.21582925,-0.6004306933151682
CBC,2024-01-16,"Number of non-permanent residents in Alberta soared to 180,000 at the end of 2023",https://www.cbc.ca/news/canada/calgary/immigration-canada-non-permanent-residents-permanent-residency-1.7079018,negative,0.030234598,0.35643354,0.6133318,-0.12613075695128373
CBC,2024-01-16,'Demand is bigger than what we can produce by miles': How immigrants play role in housing crisis,https://www.cbc.ca/news/canada/calgary/unsettling-immigration-canada-housing-crisis-1.7080697,negative,0.054360308,0.30471855,0.64092124,-0.08989833253124502
CBC,2024-01-16,"In an Iowa gym, Republicans faced a choice. They chose Donald Trump",https://www.cbc.ca/news/world/iowa-caucus-2024-day-after-1.7084538,neutral,0.06076165,0.1899564,0.7492819,-0.03239146476177268
CBC,2024-01-16,"Acts of service, prayers and politics highlight MLK Day celebrations",https://www.cbc.ca/news/acts-of-service-prayers-and-politics-highlight-mlk-day-celebrations-1.7084570,positive,0.61681676,0.005459008,0.37772417,0.38043314996136246
CBC,2024-01-16,Why scientists say Canada's logging industry produces far more emissions than tallied,https://www.cbc.ca/news/climate/canada-logging-emissions-1.7081906,negative,0.016553335,0.60304034,0.3804063,-0.36338365306353815
CBC,2024-01-16,-50°C in Alberta: How extreme cold led to an electricity shortage,https://www.cbc.cahttps://www.cbc.ca/player/play/2299768899686,negative,0.018908069,0.5211929,0.45989895,-0.27128456196788875
CBC,2024-01-16,"Torched homes, threats have Edmonton's South Asian business community on edge",https://www.cbc.ca/news/canada/edmonton/homes-threats-edmonton-1.7084444,negative,0.009495158,0.7371671,0.25333786,-0.5433251183671928
CBC,2024-01-16,Rachel Notley announces intention to step down as Alberta NDP leader,https://www.cbc.ca/news/canada/edmonton/rachel-notley-announces-intention-to-step-down-as-alberta-ndp-leader-1.7085037,neutral,0.023939757,0.17576124,0.8002989,-0.0303189119647449
CBC,2024-01-16,IN PHOTOS | Dakar Rally drivers defy the desert,https://www.cbc.cahttps://www.cbc.ca/newsinteractives/features/dakar-rally,neutral,0.2210174,0.019656273,0.7593263,0.04846233350769946
CBC,2024-01-16,House ethics committee to discuss PM Trudeau's recent Jamaica trip,https://www.cbc.ca/news/politics/ethics-committee-trudeau-jamaica-trip-1.7084642,neutral,0.022936104,0.061593644,0.91547024,-0.0032677123627857796
CBC,2024-01-16,Iran's Revolutionary Guards claim deadly attack they say targeted Iraeli installation in Iraq,https://www.cbc.ca/news/world/irgc-attacks-erbil-us-israel-1.7084946,negative,0.005870799,0.77622783,0.21790147,-0.6024950885733062
CBC,2024-01-16,"The Bear, Succession tie for most wins at 75th Emmy Awards",https://www.cbc.ca/news/entertainment/emmy-awards-winners-list-1.7084653,positive,0.58845735,0.005613638,0.405929,0.3462505526011572
CBC,2024-01-16,WATCH : CBC News Explore,https://www.cbc.cahttps://gem.cbc.ca/live,neutral,0.09840742,0.014817321,0.88677526,0.009464467482493077
CBC,2024-01-16,Why Trump is facing a 2nd civil defamation case filed by E. Jean Carroll,https://www.cbc.ca/news/world/trump-carroll-second-trial-1.7084956,negative,0.018932838,0.5462269,0.4348403,-0.2980053793458577
CBC,2024-01-16,The best red carpet fashions from Monday's Emmy Awards,https://www.cbc.ca/news/entertainment/emmy-awards-fashion-scroller-1.7084608,positive,0.9253431,0.0030970324,0.071559936,0.8562501715697106
CBC,2024-01-16,Class-action against Google Photos resurrected by B.C. Court of Appeal,https://www.cbc.ca/news/canada/british-columbia/google-photos-class-action-1.7084343,neutral,0.049067505,0.14709483,0.8038377,-0.01922926413845838
CBC,2024-01-16,Gasoline prices help drive inflation up to 3.4%,https://www.cbc.ca/news/business/inflation-dec-2023-1.7084981,negative,0.06604354,0.44341102,0.49054545,-0.19225158748989202
CBC,2024-01-16,"Carolyn Bennett to be named ambassador to Denmark, sources say",https://www.cbc.ca/news/politics/carolyn-bennett-ambassador-denmark-1.7085194,neutral,0.0690768,0.0127193155,0.91820395,0.004609819608607513
CBC,2024-01-16,The Bear roars while Beef and Succession win big during a sentimental Emmy Awards,https://www.cbc.ca/news/entertainment/emmy-awards-recap-1.7084857,positive,0.8878133,0.004367612,0.10781893,0.7881935641887594
CBC,2024-01-16,"Small plane makes emergency landing on Ajax roadway, pilot escapes without injury",https://www.cbc.ca/news/canada/toronto/small-plane-emergency-landing-ajax-1.7084856,neutral,0.06202373,0.18399902,0.75397724,-0.03000869706102005
CBC,2024-01-16,Quebec coroner pushes for stronger penalties for dangerous drivers in wake of cyclist's death,https://www.cbc.ca/news/canada/montreal/quebec-coroner-cyclist-death-speeding-dangerous-driving-1.7084493,negative,0.013111104,0.5606242,0.42626476,-0.3141275397368304
