source,date,headline,url,chosen_label,positive,negative,neutral,compound
Global,2024-06-28,Bear cub trapped for hours at Sunshine Coast brewery,https://globalnews.ca/video/10593399/bear-cub-trapped-for-hours-at-sunshine-coast-brewery/,negative,0.023153104,0.42117122,0.5556757,-0.17684912912905304
Global,2024-06-28,Terrifying footage shows massive sinkhole swallow Illinois soccer field,https://globalnews.ca/news/10591804/sinkhole-soccer-field-alton-illinois/,negative,0.031645287,0.6878285,0.28052622,-0.47210659466049165
Global,2024-06-28,What’s open and what’s closed on Canada Day weekend in Winnipeg,https://globalnews.ca/news/10593914/open-closed-canada-day-weekend-winnipeg/,neutral,0.060195256,0.00806849,0.9317363,0.0035583663626326256
Global,2024-06-28,Canada’s economy is showing ‘more of a pulse’ in latest GDP uptick,https://globalnews.ca/news/10593853/canada-economy-gdp-april-2024/,positive,0.5783706,0.009484374,0.41214493,0.3344226494195386
Global,2024-06-28,‘Rolling spy vans’? Canada weighs possible security threat of Chinese EVs,https://globalnews.ca/news/10585303/china-electric-vehicles-canada-national-security/,negative,0.016920848,0.2697556,0.71332353,-0.0724817776326443
Global,2024-06-28,Driver sentenced in fatal Burnaby motorcycle crash,https://globalnews.ca/video/10593376/driver-sentenced-in-fatal-burnaby-motorcycle-crash/,negative,0.014746308,0.67466396,0.31058973,-0.4549540065734625
Global,2024-06-28,"Massive sinkhole swallows Illinois soccer field, drone video shows",https://globalnews.ca/video/10592128/massive-sinkhole-swallows-illinois-soccer-field-drone-video-shows/,negative,0.010652611,0.70788944,0.28145802,-0.5009939364905662
Global,2024-06-28,This is BC: Classic cars cruising the Okanagan,https://globalnews.ca/video/10593228/this-is-bc-classic-cars-cruising-the-okanagan/,positive,0.22387178,0.008286832,0.7678413,0.05004992583827761
Global,2024-06-28,"Canada Day 2024: What’s open, closed in Toronto and where to watch fireworks",https://globalnews.ca/news/10591318/canada-day-2024-whats-open-closed-toronto/,neutral,0.10966017,0.015526103,0.87481374,0.011784292584281264
Global,2024-06-28,"Lyme disease cases climb in Quebec, with more towns in endemic zone",https://globalnews.ca/news/10593894/quebec-lyme-disease-cases-rise/,negative,0.017725144,0.57642967,0.40584508,-0.3319570271068635
Global,2024-06-28,"Elon Musk announces birth of 12th child, third with Neuralink executive",https://globalnews.ca/news/10586300/elon-musk-12th-child-neuralink-shivon-zilis/,positive,0.26427677,0.0052879388,0.7304353,0.0698142425248971
Global,2024-06-28,"WestJet, mechanics union ordered into arbitration",https://globalnews.ca/video/10593290/westjet-mechanics-union-ordered-into-arbitration/,neutral,0.03377871,0.20889136,0.75732994,-0.04249459709396319
Global,2024-06-28,7 in 10 Canadians say they feel the country is ‘broken’: Ipsos poll,https://globalnews.ca/news/10592359/ipsos-polling-canada-broken/,negative,0.014583142,0.4597214,0.52569544,-0.2111310984196102
Global,2024-06-28,"At U.S. presidential debate, Biden tries to confront Trump",https://globalnews.ca/news/10593495/us-presidential-debate-summary/,neutral,0.07505181,0.015742496,0.9092058,0.005384941799985832
Global,2024-06-28,Innovative B.C. technology company tests wildfire suppression with drones,https://globalnews.ca/video/10593240/innovative-b-c-technology-company-tests-wildfire-suppression-with-drones/,neutral,0.19923285,0.0110086,0.7897586,0.03957252370809794
Global,2024-06-28,"Fireworks can be dangerous in hot and dry weather, fire chiefs warn",https://globalnews.ca/news/10593806/canada-day-fireworks-safety/,negative,0.020531463,0.57391685,0.40555167,-0.3289590120658943
Global,2024-06-28,Calgary Stampeders’ Demario Houston success leads back home,https://globalnews.ca/video/10593220/calgary-stampeders-demario-houston-success-leads-back-home/,positive,0.5549778,0.004783881,0.44023842,0.3079774121275207
Global,2024-06-28,7 in 10 Canadians say they feel the country is ‘broken’: poll,https://globalnews.ca/video/10593926/7-in-10-canadians-say-they-feel-the-country-is-broken-ipsos-poll/,negative,0.014024365,0.4807833,0.5051922,-0.2309559531372809
Global,2024-06-28,LCBO union set to strike early July,https://globalnews.ca/video/10574272/lcbo-union-set-to-strike-early-july/,negative,0.01304838,0.4062301,0.5807215,-0.16485263916694848
Global,2024-06-28,Quebec park agency investigates after woman killed by falling tree,https://globalnews.ca/news/10593818/falling-tree-kills-72-year-old-woman-in-quebec-provincial-park/,negative,0.014883396,0.4611139,0.5240027,-0.2124045264562291
Global,2024-06-28,Key takeaways from the U.S. presidential debate with Biden and Trump,https://globalnews.ca/news/10592733/u-s-presidential-debate-biden-and-trump-takeaways/,neutral,0.14946057,0.00938386,0.8411555,0.022250411178028173
Global,2024-06-28,Ottawa expands federal dental care program,https://globalnews.ca/video/10593291/ottawa-expands-federal-dental-care-program/,positive,0.3168719,0.008707436,0.6744208,0.10033195202100131
Global,2024-06-28,Vancouver 2SLGBTQI+ activist named to Order of Canada,https://globalnews.ca/video/10593334/vancouver-2slgbtqi-activist-named-to-order-of-canada/,neutral,0.05150316,0.085304424,0.8631923,-0.004624272658441342
Global,2024-06-28,Liberals stand by Trudeau after byelection loss,https://globalnews.ca/video/10590793/liberals-stand-by-trudeau-after-byelection-loss/,neutral,0.11853702,0.06388386,0.8175791,0.009969879199032139
Global,2024-06-28,Are smoky BBQ-flavoured chips a health risk? What’s behind a ban in Europe,https://globalnews.ca/news/10584235/smoky-bbq-flavoured-chips-ban-europe-health-risk/,negative,0.009246354,0.72628164,0.2644721,-0.5273994657496246
Global,2024-06-28,Your Saskatchewan photo of the day: June 2024,https://globalnews.ca/news/10539213/your-saskatchewan-photo-of-the-day-june-2024/,neutral,0.063566744,0.010727937,0.92570525,0.003925645671272404
Global,2024-06-28,Singh congratulates Nenshi on Alberta NDP win: ‘We have a united goal’,https://globalnews.ca/video/10592394/singh-congratulates-nenshi-on-alberta-ndp-win-we-have-a-united-goal/,positive,0.8979758,0.0029288982,0.099095225,0.8063520165543636
Global,2024-06-28,What’s open and closed in Guelph on Canada Day,https://globalnews.ca/news/10591856/guelph-canada-day-open-closed/,neutral,0.037143584,0.019908113,0.94294816,0.0009833152860997396
Global,2024-06-28,16 Ave reopened after water main repairs,https://globalnews.ca/video/10593207/16-ave-reopened-after-water-main-repairs/,neutral,0.1541575,0.019854987,0.8259876,0.023370305436390737
Global,2024-06-28,World’s largest hockey stick in Duncan to be ‘upcycled’,https://globalnews.ca/video/10593406/worlds-largest-hockey-stick-in-duncan-to-be-upcycled/,neutral,0.06141558,0.036856014,0.90172845,0.0024135064781680704
Global,2024-06-28,"WestJet strike averted as feds intervene, union says it will ‘comply’",https://globalnews.ca/news/10591136/westjet-flight-cancellations-june/,neutral,0.111755796,0.045671258,0.842573,0.0104034907768078
Global,2024-06-28,Canada Day 2024: What’s open and closed in London,https://globalnews.ca/news/10589573/canada-day-2024-whats-open-and-closed-in-london/,neutral,0.041523978,0.012247483,0.94622856,0.0015742391263040556
Global,2024-06-28,WestJet strike averted as feds intervene,https://globalnews.ca/video/10593688/westjet-strike-averted-as-feds-intervene/,neutral,0.050997365,0.10242306,0.8465795,-0.007889755739210136
Global,2024-06-28,Biden and Trump set to square off in debate tonight,https://globalnews.ca/video/10591453/biden-and-trump-set-to-square-off-in-debate-tonight/,neutral,0.06226172,0.0062251785,0.9315132,0.003837763810186523
CTV,2024-06-28,Charges laid in fatal hit and run in St. Thomas,https://london.ctvnews.ca/charges-laid-in-fatal-hit-and-run-in-st-thomas-1.6943844,negative,0.016725907,0.49137554,0.49189857,-0.24117016145370318
CTV,2024-06-28,Road Hogs: Saskatoon truck spills load of pig parts in rush hour traffic,https://saskatoon.ctvnews.ca/road-hogs-saskatoon-truck-spills-load-of-pig-parts-in-rush-hour-traffic-1.6944345,negative,0.019614222,0.64213705,0.3382488,-0.4119552370717372
CTV,2024-06-28,Legal action coming to recover COVID benefit overpayments,https://www.ctvnews.ca/canada/legal-action-coming-to-recover-covid-benefit-overpayments-1.6943304,neutral,0.059908416,0.17337488,0.76671666,-0.026469834063491682
CTV,2024-06-28,Showdown expected at Thursday night's Stratford council meeting,https://kitchener.ctvnews.ca/showdown-expected-at-thursday-night-s-stratford-council-meeting-1.6944161,neutral,0.030570166,0.010440704,0.958989,0.0008255288321934451
CTV,2024-06-28,'Absolutely amazing video': Basking shark spotted along eastern shore of Nova Scotia,https://atlantic.ctvnews.ca/absolutely-amazing-video-basking-shark-spotted-along-eastern-shore-of-nova-scotia-1.6943842,positive,0.96483827,0.0020293556,0.033132285,0.9309088480395307
CTV,2024-06-28,Calgary mayor pleads with residents to keep saving water as repairs progress,https://calgary.ctvnews.ca/calgary-mayor-pleads-with-residents-to-keep-saving-water-as-repairs-progress-1.6943314,positive,0.23446979,0.009873571,0.75565666,0.05487858996939554
CTV,2024-06-28,Ramara man admits to stabbing mother 30x after eating cannabis brownies,https://barrie.ctvnews.ca/ramara-man-admits-to-stabbing-mother-30x-after-eating-cannabis-brownies-1.6943519,negative,0.006178054,0.8268564,0.1669656,-0.6836532468476477
CTV,2024-06-28,Sask. family desperate to bring sick niece home from Asia,/video/c2948440-sask--family-fights-to-bring-home-orphaned-niece,negative,0.031078326,0.5422521,0.42666954,-0.293071502152376
CTV,2024-06-28,"Five survivors from Sudbury, Ont., rescued in human trafficking investigation",https://northernontario.ctvnews.ca/five-survivors-from-sudbury-ont-rescued-in-human-trafficking-investigation-1.6944623,neutral,0.031804796,0.10387766,0.86431766,-0.009779015100633615
CTV,2024-06-28,"'The weather conditions are favourable,' N.L. premier says as wildfire remains away from Churchill Falls",https://www.ctvnews.ca/climate-and-environment/the-weather-conditions-are-favourable-n-l-premier-says-as-wildfire-remains-away-from-churchill-falls-1.6942531,positive,0.34450778,0.007425761,0.6480665,0.11863045106349546
CTV,2024-06-28,Higher share of foreign workers became permanent residents in recent years: StatCan,https://www.ctvnews.ca/politics/higher-share-of-foreign-workers-became-permanent-residents-in-recent-years-statcan-1.6943475,neutral,0.074441634,0.019272314,0.906286,0.005170137737602332
CTV,2024-06-28,Outreach workers express concern over decision to expand encampment restrictions,https://london.ctvnews.ca/outreach-workers-express-concern-over-decision-to-expand-encampment-restrictions-1.6944457,negative,0.014969197,0.41864517,0.5663857,-0.17503968013030757
CTV,2024-06-28,"World's largest hockey stick in B.C. to be chopped up, sold to collectors",https://bc.ctvnews.ca/world-s-largest-hockey-stick-in-b-c-to-be-chopped-up-sold-to-collectors-1.6944032,negative,0.054413807,0.23495471,0.7106315,-0.05224285254553429
CTV,2024-06-28,'I felt my soul was broken': Women sexually assaulted by Manitoba doctor call for accountability,https://winnipeg.ctvnews.ca/i-felt-my-soul-was-broken-women-sexually-assaulted-by-manitoba-doctor-call-for-accountability-1.6943547,negative,0.0059262556,0.8789177,0.11515613,-0.7724611274889188
CTV,2024-06-28,Are car dealership employees linked to auto thefts in Canada? CTV News investigates,https://www.ctvnews.ca/autos/are-car-dealership-employees-linked-to-auto-thefts-in-canada-ctv-news-investigates-1.6941928,negative,0.014164023,0.35874063,0.62709534,-0.12849421824822116
CTV,2024-06-28,"Economy grew 0.3% in April, Statistics Canada reports",https://www.ctvnews.ca/business/economy-grew-0-3-in-april-statistics-canada-reports-1.6944616,neutral,0.046500765,0.132339,0.82116026,-0.01535128806235031
CTV,2024-06-28,"IPV program making a difference, Sault police say",https://northernontario.ctvnews.ca/ipv-program-making-a-difference-sault-police-say-1.6944590,positive,0.5674114,0.0051930444,0.42739546,0.3219287883378641
CTV,2024-06-28,East Windsor transit terminal could be on the move,https://windsor.ctvnews.ca/east-windsor-transit-terminal-could-be-on-the-move-1.6944622,neutral,0.13599253,0.018288165,0.8457193,0.018159513918730497
CTV,2024-06-28,Different schools of thought on why Canada drapes itself with red and white,https://www.ctvnews.ca/lifestyle/different-schools-of-thought-on-why-canada-drapes-itself-with-red-and-white-1.6944543,neutral,0.030223422,0.20394023,0.76583636,-0.040678161672797586
CTV,2024-06-28,LCBO to close all retail stores for 14 days if strike not averted,https://toronto.ctvnews.ca/lcbo-to-close-all-retail-stores-for-14-days-if-strike-not-averted-1.6943868,negative,0.009765668,0.69425297,0.29598138,-0.48189179435186524
CTV,2024-06-28,"N.S., Argentia, N.L, ferry service start date delayed again",https://atlantic.ctvnews.ca/more/n-s-argentia-n-l-ferry-service-start-date-delayed-again-1.6944641,negative,0.0121264085,0.51868767,0.4691859,-0.2688898752548994
CTV,2024-06-28,Why aren't free-ranging bison classified as wildlife in Alberta?,https://calgary.ctvnews.ca/why-aren-t-free-ranging-bison-classified-as-wildlife-in-alberta-1.6944609,negative,0.012288508,0.35825416,0.62945735,-0.1281950285427662
CTV,2024-06-28,B.C. Premier David Eby welcomes 'happy and healthy' daughter after early campaign start,https://bc.ctvnews.ca/b-c-premier-david-eby-welcomes-happy-and-healthy-daughter-after-early-campaign-start-1.6944642,positive,0.8579577,0.0024884301,0.13955373,0.7360853602802884
CTV,2024-06-28,Fines related to neighbour's 443 noise complaints at centre of B.C. dispute,https://bc.ctvnews.ca/fines-related-to-neighbour-s-443-noise-complaints-at-centre-of-b-c-dispute-1.6944222,negative,0.012720413,0.4340556,0.553224,-0.18824243964415466
CTV,2024-06-28,Evacuation planning for Canadians in volatile Lebanon underway: National Defence,https://www.ctvnews.ca/politics/evacuation-planning-for-canadians-in-volatile-lebanon-underway-national-defence-1.6943090,neutral,0.017152851,0.12400637,0.8588408,-0.015083354205675192
CTV,2024-06-28,This Ottawa 'fat cat' on a weight loss journey has become a TikTok star,https://ottawa.ctvnews.ca/this-ottawa-fat-cat-on-a-weight-loss-journey-has-become-a-tiktok-star-1.6940796,neutral,0.1696542,0.1251767,0.70516914,0.013113341721147087
CTV,2024-06-28,"Federated Co-operatives Limited reports cybersecurity incident, investigation underway",https://regina.ctvnews.ca/federated-co-operatives-limited-reports-cybersecurity-incident-investigation-underway-1.6944014,negative,0.014285593,0.51067615,0.47503835,-0.2605860030543372
CTV,2024-06-28,"AI regulation 'a start,' needs to 'have teeth': Hinton, godfather of AI, says",https://www.ctvnews.ca/politics/ai-regulation-a-start-needs-to-have-teeth-hinton-godfather-of-ai-says-1.6944266,positive,0.32257545,0.01882514,0.6585994,0.10370054392809891
CTV,2024-06-28,Killer Mike will likely avoid charges after Grammys arrest,https://www.ctvnews.ca/entertainment/killer-mike-will-likely-avoid-charges-after-grammys-arrest-1.6943678,neutral,0.050592806,0.21921521,0.730192,-0.04549567271926769
CTV,2024-06-28,Ottawa Public Health warning of increased overdose risk as new drug found in local supply,https://ottawa.ctvnews.ca/ottawa-public-health-warning-of-increased-overdose-risk-as-new-drug-found-in-local-supply-1.6944080,negative,0.018636102,0.5086651,0.4726988,-0.2583928640334392
CTV,2024-06-28,"Man shot dead in Princeton, B.C., was high-ranking gang member, court records suggest",https://bc.ctvnews.ca/man-shot-dead-in-princeton-b-c-was-high-ranking-gang-member-court-records-suggest-1.6937508,negative,0.017537545,0.33008072,0.65238184,-0.1086456872140662
CTV,2024-06-28,"Singer, songwriter, provocateur and politician Kinky Friedman dead at 79",https://www.ctvnews.ca/entertainment/singer-songwriter-provocateur-and-politician-kinky-friedman-dead-at-79-1.6943849,neutral,0.08479772,0.07217383,0.8430285,0.001981591322475218
CTV,2024-06-28,"Man stabbed in Kelowna, suspect at large: RCMP",https://bc.ctvnews.ca/man-stabbed-in-kelowna-suspect-at-large-rcmp-1.6938918,negative,0.015369684,0.29978237,0.68484807,-0.0896332056254181
CTV,2024-06-28,"Eligibility for Ottawa's dental plan expands to children, people with disabilities",https://www.ctvnews.ca/politics/eligibility-for-ottawa-s-dental-plan-expands-to-children-people-with-disabilities-1.6943020,neutral,0.14956088,0.020223796,0.8302153,0.021959461757847798
CTV,2024-06-28,Ont. man seeks compensation after cancelled flight,/video/c2947865-ont--man-seeks-compensation-after-cancelled-flight,negative,0.01267982,0.4938267,0.49349353,-0.2437040050700734
CTV,2024-06-28,'Egregious exploitation': Toronto woman sentenced to 3 years for Inuit identity fraud,https://toronto.ctvnews.ca/egregious-exploitation-toronto-woman-sentenced-to-3-years-for-inuit-identity-fraud-1.6943280,negative,0.005298459,0.8579475,0.13675381,-0.7360460785841187
CTV,2024-06-28,Shares of Trump Media & Technology rise following first presidential debate,https://www.ctvnews.ca/business/shares-of-trump-media-technology-rise-following-first-presidential-debate-1.6944638,neutral,0.11625251,0.011430742,0.8723168,0.013383981536767564
CTV,2024-06-28,U.S. presidential debate watch party draws dozens in Vancouver,https://bc.ctvnews.ca/u-s-presidential-debate-watch-party-draws-dozens-in-vancouver-1.6944626,neutral,0.08743081,0.008284162,0.904285,0.00757552084911417
CTV,2024-06-28,Canadians can soon fix their Apple products. Here's how,https://www.ctvnews.ca/sci-tech/canadians-can-soon-fix-their-apple-products-here-s-how-1.6943303,positive,0.41948897,0.025054632,0.5554564,0.17534325832016862
CTV,2024-06-28,"After split with NYC July 4 hot dog competition, Joey Chestnut heads to army base event in Texas",https://www.ctvnews.ca/entertainment/after-split-with-nyc-july-4-hot-dog-competition-joey-chestnut-heads-to-army-base-event-in-texas-1.6943811,neutral,0.05696042,0.011861749,0.9311778,0.0031037899030672556
CTV,2024-06-28,Nanos data shows more key Liberal ridings under threat,/video/c2949019-trend-line--new-data-from-nik-nanos?playlistId=1.6917681,negative,0.019115351,0.4081962,0.57268846,-0.16625873803186764
CTV,2024-06-28,Ready for summer? Two Barrie beaches open with lifeguards today,https://barrie.ctvnews.ca/ready-for-summer-two-barrie-beaches-open-with-lifeguards-today-1.6944581,positive,0.60944253,0.004252262,0.3863052,0.37140211821451885
CTV,2024-06-28,Canadian Association of Fire Chiefs calls for firework safety as heat intensifies,https://www.ctvnews.ca/climate-and-environment/canadian-association-of-fire-chiefs-calls-for-firework-safety-as-heat-intensifies-1.6944547,neutral,0.047872294,0.08444638,0.8676814,-0.004839432214426953
CTV,2024-06-28,Funeral arrangements released for Walsh family found dead in Harrow,https://windsor.ctvnews.ca/funeral-arrangements-released-for-walsh-family-found-dead-in-harrow-1.6943506,neutral,0.028875297,0.11506044,0.85606426,-0.01240512224753143
CTV,2024-06-28,Ottawa police warn residents to avoid Facebook Marketplace when looking for a place to rent,https://ottawa.ctvnews.ca/ottawa-police-warn-residents-to-avoid-facebook-marketplace-when-looking-for-a-place-to-rent-1.6944152,neutral,0.018871855,0.17855793,0.8025701,-0.031526804819858256
CTV,2024-06-28,'This disorder has almost killed me': His addiction to ultraprocessed food began as a child,https://www.ctvnews.ca/health/this-disorder-has-almost-killed-me-his-addiction-to-ultraprocessed-food-began-as-a-child-1.6943520,negative,0.007296451,0.90526193,0.08744142,-0.819446111353352
CTV,2024-06-28,'I just really like the sport': Meet the 90-year-old local slo-pitch player still living out his passion,https://regina.ctvnews.ca/i-just-really-like-the-sport-meet-the-90-year-old-local-slo-pitch-player-still-living-out-his-passion-1.6940480,positive,0.9374853,0.0027445608,0.059770267,0.878871019212015
CTV,2024-06-28,Canada's top court rejects appeal from Sask. man who murdered wife,https://saskatoon.ctvnews.ca/canada-s-top-court-rejects-appeal-from-sask-man-who-murdered-wife-1.6943832,negative,0.0089852875,0.62544143,0.3655732,-0.3910963047022129
CTV,2024-06-28,"Pope's top adviser, women who say they were abused by ex-Jesuit artist ask for mosaics to be removed",https://www.ctvnews.ca/world/pope-s-top-adviser-women-who-say-they-were-abused-by-ex-jesuit-artist-ask-for-mosaics-to-be-removed-1.6944647,negative,0.017930748,0.50016284,0.48190635,-0.2498413834946973
CTV,2024-06-28,'Hanging on for her life': Sask. family desperate to bring home sick niece from Philippines,https://saskatoon.ctvnews.ca/hanging-on-for-her-life-sask-family-desperate-to-bring-home-sick-niece-from-philippines-1.6943503,neutral,0.13387543,0.05480274,0.8113217,0.014919301518260042
CTV,2024-06-28,Six-year-old Montreal boy triumphs in Canadian math competition,https://montreal.ctvnews.ca/six-year-old-montreal-boy-triumphs-in-canadian-math-competition-1.6942692,positive,0.71053773,0.0032562702,0.28620607,0.5048532226995306
CTV,2024-06-28,"Police find vehicle in a ditch on Manitoulin Island, impaired driving charges follow",https://northernontario.ctvnews.ca/police-find-vehicle-in-a-ditch-on-manitoulin-island-impaired-driving-charges-follow-1.6944562,negative,0.010516388,0.5458899,0.44359365,-0.297885219425039
CTV,2024-06-28,Maritime gas prices increase ahead of Canada Day long weekend,https://atlantic.ctvnews.ca/maritime-gas-prices-increase-ahead-of-canada-day-long-weekend-1.6944508,negative,0.02268364,0.45690483,0.5204116,-0.20824743553957248
CTV,2024-06-28,What is going on with immigration in Canada? Here's what the data shows,https://www.ctvnews.ca/canada/what-is-going-on-with-immigration-in-canada-here-s-what-the-data-shows-1.6943736,neutral,0.02601569,0.03840824,0.93557614,-0.0007983758208703895
CTV,2024-06-28,"Judge acquits Newfoundland lawyer on sexual assault, interference charges",https://www.ctvnews.ca/canada/judge-acquits-newfoundland-lawyer-on-sexual-assault-interference-charges-1.6943831,negative,0.019641213,0.5234428,0.45691594,-0.2736066073798966
CTV,2024-06-28,"When heat waves strike, Environment Canada can link it to climate change -- fast",https://www.ctvnews.ca/climate-and-environment/when-heat-waves-strike-environment-canada-can-link-it-to-climate-change-fast-1.6944545,neutral,0.042673115,0.18476811,0.77255875,-0.03231826449839126
CTV,2024-06-28,Que. woman killed after being struck by falling tree in park,/video/c2949021-woman-fatally-struck-by-tree-in-mont-saint-bruno,negative,0.008714788,0.7143861,0.276899,-0.5102716232229909
CTV,2024-06-28,3 charged in Alta. auto theft ring connected to organized crime,https://edmonton.ctvnews.ca/3-charged-in-alta-auto-theft-ring-connected-to-organized-crime-1.6943355,negative,0.018738417,0.50979704,0.4714645,-0.25954190486978135
CTV,2024-06-28,Extended care registration will reopen in July for Waterloo Region schools,https://kitchener.ctvnews.ca/extended-care-registration-will-reopen-in-july-for-waterloo-region-schools-1.6943771,neutral,0.088861525,0.0049027065,0.9062359,0.00787232535646698
CTV,2024-06-28,Woman killed after tree falls on her in Mont-Saint-Bruno park,https://montreal.ctvnews.ca/woman-killed-after-tree-falls-on-her-in-mont-saint-bruno-park-1.6943879,negative,0.009238698,0.7091016,0.28165975,-0.5027396871901662
CTV,2024-06-28,UCP blasts new NDP leader Nenshi with attack ads; Smith says he has no policy,https://calgary.ctvnews.ca/ucp-blasts-new-ndp-leader-nenshi-with-attack-ads-smith-says-he-has-no-policy-1.6943769,negative,0.011105167,0.6723283,0.31656647,-0.4519020483971872
CTV,2024-06-28,Residents express frustration with decision to close Huron County pool,https://london.ctvnews.ca/residents-express-frustration-with-decision-to-close-huron-county-pool-1.6944091,negative,0.009535371,0.6896352,0.30082932,-0.4755058702699877
CTV,2024-06-28,What's open and closed? Where are the fireworks? What to know for Canada Day 2024,https://toronto.ctvnews.ca/what-s-open-and-closed-where-are-the-fireworks-what-to-know-for-canada-day-2024-1.6940453,neutral,0.040278442,0.07408658,0.88563496,-0.0038664686964460238
CTV,2024-06-28,News nonprofit sues ChatGPT maker OpenAI and Microsoft for 'exploitative' copyright infringement,https://www.ctvnews.ca/sci-tech/news-nonprofit-sues-chatgpt-maker-openai-and-microsoft-for-exploitative-copyright-infringement-1.6943424,negative,0.018511435,0.4699541,0.51153445,-0.22051418557286695
CTV,2024-06-28,Midland in mourning after loss of long-time councillor Jim Downer,https://barrie.ctvnews.ca/midland-in-mourning-after-loss-of-long-time-councillor-jim-downer-1.6944484,negative,0.022988819,0.5015314,0.47547972,-0.25100529553112594
CTV,2024-06-28,Saint John police search for man wanted on Canada-wide warrant,https://atlantic.ctvnews.ca/saint-john-police-search-for-man-wanted-on-canada-wide-warrant-1.6944566,neutral,0.022829609,0.104671545,0.8724988,-0.010434944488262321
CTV,2024-06-28,Tests show Paris' Seine River still has unsafe E. coli levels with Olympics less than a month away,https://www.ctvnews.ca/sports/tests-show-paris-seine-river-still-has-unsafe-e-coli-levels-with-olympics-less-than-a-month-away-1.6944632,negative,0.013847075,0.5697775,0.41637552,-0.3244546126247272
CTV,2024-06-28,Alex Munter stepping down as CHEO president and CEO to lead Canadian Medical Association,https://ottawa.ctvnews.ca/alex-munter-stepping-down-as-cheo-president-and-ceo-to-lead-canadian-medical-association-1.6943798,neutral,0.03032826,0.07879327,0.89087844,-0.005288577929889016
CTV,2024-06-28,"3-year-old boy dead, woman and girl hospitalized in Allard crash",https://edmonton.ctvnews.ca/3-year-old-boy-dead-woman-and-girl-hospitalized-in-allard-crash-1.6944426,negative,0.012659183,0.66377527,0.3235656,-0.44043730875987563
