source,date,headline,url,chosen_label,positive,negative,neutral,compound
CTV,2024-04-06,'Women are getting paid and they're playing their favourite sport': recent women’s sports shattering viewing records,https://atlantic.ctvnews.ca/women-are-getting-paid-and-they-re-playing-their-favourite-sport-recent-women-s-sports-shattering-viewing-records-1.6836351,positive,0.89082694,0.0044082087,0.10476503,0.7935530738417267
CTV,2024-04-06,1 dead in 3-vehicle crash near Edmonton International Airport Friday,https://edmonton.ctvnews.ca/1-dead-in-3-vehicle-crash-near-edmonton-international-airport-friday-1.6836350,negative,0.015378826,0.5055223,0.47909895,-0.2553162543285783
CTV,2024-04-06,Ont. paramedic killed in Swiss avalanche,https://kitchener.ctvnews.ca/ont-paramedic-killed-in-swiss-avalanche-1.6835542,negative,0.01349971,0.67536896,0.31113136,-0.4559409560984804
CTV,2024-04-06,Ontario family's car stolen from parking lot of Montreal hotel,https://montreal.ctvnews.ca/ontario-family-s-car-stolen-from-parking-lot-of-montreal-hotel-1.6831200,negative,0.015756005,0.40689242,0.5773516,-0.16531316533040297
CTV,2024-04-06,Alberta's second grid alert in 2 days leads to rolling blackouts,https://calgary.ctvnews.ca/alberta-s-second-grid-alert-in-2-days-leads-to-rolling-blackouts-1.6835023,negative,0.011728281,0.64747804,0.34079376,-0.4190902079544774
CTV,2024-04-06,The largest cheerleading event in Atlantic Canada hits Halifax,https://atlantic.ctvnews.ca/the-largest-cheerleading-event-in-atlantic-canada-hits-halifax-1.6836507,positive,0.52206546,0.005198827,0.47273573,0.2725253019340439
CTV,2024-04-06,"P&G recalls 8.2 million bags of Tide, Gain and other laundry detergents",https://www.ctvnews.ca/health/p-g-recalls-8-2-million-bags-of-tide-gain-and-other-laundry-detergents-1.6836309,negative,0.034730595,0.3620311,0.60323834,-0.12986029576635616
CTV,2024-04-06,21-year-old facing charges after robbery at Winnipeg outlet mall,https://winnipeg.ctvnews.ca/21-year-old-facing-charges-after-robbery-at-winnipeg-outlet-mall-1.6836423,negative,0.010496714,0.69344705,0.29605627,-0.4807585937494707
CTV,2024-04-06,"Canada's last evacuation flight from Haiti to leave Sunday, as demand for help drops",https://www.ctvnews.ca/politics/canada-s-last-evacuation-flight-from-haiti-to-leave-sunday-as-demand-for-help-drops-1.6835773,negative,0.021755064,0.27539387,0.702851,-0.0753685176048755
CTV,2024-04-06,Consumer warning: Fake solar eclipse glasses being sold,/video/c2898604-fake-solar-eclipse-glasses,negative,0.015932204,0.74606705,0.23800094,-0.5563620622875565
CTV,2024-04-06,Calgary police investigate assault at Market Mall,https://calgary.ctvnews.ca/calgary-police-investigate-assault-at-market-mall-1.6836675,negative,0.018239241,0.31099513,0.6707657,-0.09638528500280685
CTV,2024-04-06,"'You never know what the issue or the challenge is going to be': Competitive climbers hope to rise above the competition in London, Ont.",https://london.ctvnews.ca/you-never-know-what-the-issue-or-the-challenge-is-going-to-be-competitive-climbers-hope-to-rise-above-the-competition-in-london-ont-1.6836548,positive,0.4803934,0.009410243,0.5101963,0.23068928967540714
CTV,2024-04-06,'You can hear it': Those with low vision can enjoy the eclipse with interactive tools,https://www.ctvnews.ca/sci-tech/you-can-hear-it-those-with-low-vision-can-enjoy-the-eclipse-with-interactive-tools-1.6836248,positive,0.45397097,0.013419259,0.5326098,0.20590953736347473
CTV,2024-04-06,"Morneau, Charest push for focus on economic growth ahead of federal budget",https://www.ctvnews.ca/politics/morneau-charest-push-for-focus-on-economic-growth-ahead-of-federal-budget-1.6835736,positive,0.23494922,0.012563597,0.7524871,0.055043303396599796
CTV,2024-04-06,"Woman stabs taxi driver with needle, steals cab: Mission RCMP",https://bc.ctvnews.ca/woman-stabs-taxi-driver-with-needle-steals-cab-mission-rcmp-1.6836478,negative,0.013655727,0.6746577,0.31168643,-0.45497663521946485
CTV,2024-04-06,Liberal MP Anthony Housefather to stay in caucus,https://www.ctvnews.ca/politics/liberal-mp-anthony-housefather-to-stay-in-caucus-1.6835571,neutral,0.097518586,0.015371318,0.88711005,0.009273600883643596
CTV,2024-04-06,"East Coast earthquakes aren't common, but they are felt by millions. Here's what to know",https://www.ctvnews.ca/world/east-coast-earthquakes-aren-t-common-but-they-are-felt-by-millions-here-s-what-to-know-1.6836372,neutral,0.092403375,0.070301384,0.83729523,0.0035960992495396304
CTV,2024-04-06,Still need a pair of glasses for Monday’s solar eclipse? CTV News London has got you covered,https://london.ctvnews.ca/still-need-a-pair-of-glasses-for-monday-s-solar-eclipse-ctv-news-london-has-got-you-covered-1.6836276,neutral,0.20649947,0.00736148,0.7861391,0.04258783462479343
CTV,2024-04-06,No shots fired in southwest assault involving a firearm,https://calgary.ctvnews.ca/no-shots-fired-in-southwest-assault-involving-a-firearm-1.6836676,negative,0.034548942,0.26638913,0.699062,-0.06976952645120349
CTV,2024-04-06,Langford park closed after person drops off 'explosive material': RCMP,https://bc.ctvnews.ca/langford-park-closed-after-person-drops-off-explosive-material-rcmp-1.6836685,negative,0.009519697,0.47532284,0.5151575,-0.22584115231495616
CTV,2024-04-06,Regina's REAL required to pay feds $8M after CRA audit of pandemic relief program,https://regina.ctvnews.ca/regina-s-real-required-to-pay-feds-8m-after-cra-audit-of-pandemic-relief-program-1.6835757,neutral,0.036537737,0.14405662,0.81940573,-0.019417293438399597
CTV,2024-04-06,Sask. dancers take stage in Saskatoon,https://saskatoon.ctvnews.ca/sask-dancers-take-stage-in-saskatoon-1.6836679,neutral,0.08000312,0.0120129315,0.90798384,0.006256196352516508
CTV,2024-04-06,One person killed in Brant county collision,https://kitchener.ctvnews.ca/one-person-killed-in-brant-county-collision-1.6836421,negative,0.010155734,0.7094235,0.28042075,-0.5031785592438318
CTV,2024-04-06,"OPP officer who saw jailhouse assault video comes forward, pushes for change",https://toronto.ctvnews.ca/opp-officer-who-saw-jailhouse-assault-video-comes-forward-pushes-for-change-1.6835970,neutral,0.044870622,0.1577918,0.7973376,-0.022884876446550795
CTV,2024-04-06,"Survival clock ticks for trapped B.C. orca calf, as gear arrives for complex rescue",https://bc.ctvnews.ca/survival-clock-ticks-for-trapped-b-c-orca-calf-as-gear-arrives-for-complex-rescue-1.6834566,neutral,0.075057045,0.019944914,0.9049981,0.005235755849175572
CTV,2024-04-06,Ground-breaking Canadian giraffe researcher Anne Innis Dagg dies at 91,https://kitchener.ctvnews.ca/ground-breaking-canadian-giraffe-researcher-anne-innis-dagg-dies-at-91-1.6833600,neutral,0.08652028,0.064951986,0.8485277,0.0032669979915582736
CTV,2024-04-06,Inmates in Ontario jails held at least 50 hunger strikes in 2023. Experts say the true figure could be much higher,https://toronto.ctvnews.ca/inmates-in-ontario-jails-held-at-least-50-hunger-strikes-in-2023-experts-say-the-true-figure-could-be-much-higher-1.6836286,negative,0.020050684,0.5265462,0.45340312,-0.2768488491839207
CTV,2024-04-06,Beyonce's new album explores what it means to be country,https://www.ctvnews.ca/entertainment/beyonce-s-new-album-explores-what-it-means-to-be-country-1.6836287,positive,0.53753823,0.009275485,0.45318627,0.28886131433600326
CTV,2024-04-06,"School stories, art, teach kids about organ donation for Humboldt Broncos' Green Shirt Day",https://calgary.ctvnews.ca/school-stories-art-teach-kids-about-organ-donation-for-humboldt-broncos-green-shirt-day-1.6836374,positive,0.30667686,0.0056707365,0.6876524,0.09401854215886019
CTV,2024-04-06,Lamborghini written off after 13-year-old takes it for a joyride: West Vancouver police,https://bc.ctvnews.ca/lamborghini-written-off-after-13-year-old-takes-it-for-a-joyride-west-vancouver-police-1.6831987,negative,0.04220983,0.47407824,0.4837119,-0.2229685185512107
CTV,2024-04-06,"Fires destroy northwestern Ont. First Nation band office, home",https://northernontario.ctvnews.ca/fires-destroy-northwestern-ont-first-nation-band-office-home-1.6835615,negative,0.009842626,0.80997497,0.18018244,-0.6559625362719368
CTV,2024-04-06,Mysterious Newfoundland shipwreck finally out of the water,https://www.ctvnews.ca/canada/mysterious-newfoundland-shipwreck-finally-out-of-the-water-1.6832641,negative,0.08611663,0.4764812,0.4374022,-0.21961826239751403
CTV,2024-04-06,"Unstable nearby construction site forces evacuation of apartment in Kelowna, B.C.",https://bc.ctvnews.ca/unstable-nearby-construction-site-forces-evacuation-of-apartment-in-kelowna-b-c-1.6829299,negative,0.008912125,0.5259611,0.46512675,-0.2765556534751852
CTV,2024-04-06,"'He wanted to provide,' wife of Canadian aid worker killed in Gaza says",https://www.ctvnews.ca/canada/he-wanted-to-provide-wife-of-canadian-aid-worker-killed-in-gaza-says-1.6836119,negative,0.014306379,0.50807285,0.4776208,-0.2579333372091579
CTV,2024-04-06,"Canadian pilot who exposed Dominican Republic drug trafficking operation suing federal government, Pivot Airlines",https://www.ctvnews.ca/canada/canadian-pilot-who-exposed-dominican-republic-drug-trafficking-operation-suing-federal-government-pivot-airlines-1.6835979,negative,0.015604197,0.41467878,0.569717,-0.1717150133261054
CTV,2024-04-06,Barrie Colts force a game six with shutout win against Oshawa,https://barrie.ctvnews.ca/barrie-colts-force-a-game-six-with-shutout-win-against-oshawa-1.6836465,neutral,0.06961679,0.017541954,0.9128413,0.004538773852083011
CTV,2024-04-06,"'Pretty remarkable': Alberta distillery beats out Ireland, Scotland at international whisky competition",https://edmonton.ctvnews.ca/pretty-remarkable-alberta-distillery-beats-out-ireland-scotland-at-international-whisky-competition-1.6828621,positive,0.8969205,0.0030196763,0.10005983,0.8044572487302282
CTV,2024-04-06,Sudbury police arrest man for recent sexual assault in city’s Donovan community,https://northernontario.ctvnews.ca/sudbury-police-arrest-man-for-recent-sexual-assault-in-city-s-donovan-community-1.6835841,negative,0.008859129,0.6038941,0.3872467,-0.3646096345815941
CTV,2024-04-06,Maple Weekend 2024: Ontarians head to the bush for sweet celebrations,https://northernontario.ctvnews.ca/maple-weekend-2024-ontarians-head-to-the-bush-for-sweet-celebrations-1.6836355,positive,0.67566025,0.0065082875,0.3178314,0.45647445894029914
CTV,2024-04-06,"32 per cent of Canadians blame grocery stores for rising food prices, more than any other reason: Nanos",https://www.ctvnews.ca/business/32-per-cent-of-canadians-blame-grocery-stores-for-rising-food-prices-more-than-any-other-reason-nanos-1.6834573,negative,0.011624001,0.64328253,0.3450934,-0.413677356462415
CTV,2024-04-06,"2 men injured after 'road rage' incident with Dodge Ram driver, Kelowna RCMP say",https://bc.ctvnews.ca/2-men-injured-after-road-rage-incident-with-dodge-ram-driver-kelowna-rcmp-say-1.6830790,negative,0.0069282767,0.69293135,0.30014032,-0.48010590145158716
CTV,2024-04-06,Star Trek superfan turns his home into a Trekkie’s dream,https://atlantic.ctvnews.ca/star-trek-superfan-turns-his-home-into-a-trekkie-s-dream-1.6836305,neutral,0.16609181,0.03245524,0.80145293,0.026533150555192897
CTV,2024-04-06,This historical tavern in Toronto is closing after nearly 200 years,https://toronto.ctvnews.ca/this-historical-tavern-in-toronto-is-closing-after-nearly-200-years-1.6827368,negative,0.010661169,0.7277625,0.26157632,-0.5295246037403487
CTV,2024-04-06,'Violent altercation' ends in 51-year-old man being fatally stabbed in North York,https://toronto.ctvnews.ca/violent-altercation-ends-in-51-year-old-man-being-fatally-stabbed-in-north-york-1.6836281,negative,0.00709625,0.8230882,0.16981572,-0.6774237298237793
CTV,2024-04-06,Interested in starting a garden? Here are some tips for beginners,https://regina.ctvnews.ca/interested-in-starting-a-garden-here-are-some-tips-for-beginners-1.6836413,positive,0.3738124,0.018085923,0.6081017,0.1394085938677847
CTV,2024-04-06,Aftershocks rattle U.S. northeast after rare 4.8 magnitude earthquake hits region,https://www.ctvnews.ca/world/aftershocks-rattle-u-s-northeast-after-rare-4-8-magnitude-earthquake-hits-region-1.6835823,negative,0.024553645,0.25847948,0.7169667,-0.06620880349569713
CTV,2024-04-06,How A.I. and underwater microphones are protecting whales in B.C.,https://bc.ctvnews.ca/how-a-i-and-underwater-microphones-are-protecting-whales-in-b-c-1.6836131,neutral,0.062940836,0.028701762,0.90835726,0.003137762657439147
CTV,2024-04-06,"Suspects resist arrest, crash into apartment building in Hanover: police",https://kitchener.ctvnews.ca/suspects-resist-arrest-crash-into-apartment-building-in-hanover-police-1.6836567,negative,0.011960119,0.42677867,0.56126124,-0.18199697987919983
CTV,2024-04-06,Israel's military says it has recovered body of hostage,/video/c2898866-pressure-facing-israeli-pm-netanyahu?playlistId=1.6593355,neutral,0.04525185,0.049890745,0.90485734,-0.00044135685881041553
CTV,2024-04-06,Sainte-Anne-de-Bellevue grocery store to close on April 20,https://montreal.ctvnews.ca/sainte-anne-de-bellevue-grocery-store-to-close-on-april-20-1.6836504,neutral,0.020228947,0.07676382,0.90300715,-0.005483479047012629
CTV,2024-04-06,2024 solar eclipse: Police issue safety reminder for eclipse,/video/c2898921-police-issue-safety-reminders-for-eclipse?playlistId=1.6756927,neutral,0.07410382,0.030168707,0.8957274,0.004581228603088405
CTV,2024-04-06,"School in St. Jerome, Que. forced to toss thousands of counterfeit solar eclipse glasses",https://montreal.ctvnews.ca/school-in-st-jerome-que-forced-to-toss-thousands-of-counterfeit-solar-eclipse-glasses-1.6836477,negative,0.007799275,0.7540025,0.23819819,-0.5684589810111458
CTV,2024-04-06,"Canadian, U.S. markets rally after differing labour market reports",https://www.ctvnews.ca/business/canadian-u-s-markets-rally-after-differing-labour-market-reports-1.6835611,positive,0.2708077,0.011652752,0.7175394,0.07320106216076994
CTV,2024-04-06,Two men fined $2K each for illegal baitfish sales in northern Ont.,https://northernontario.ctvnews.ca/two-men-fined-2k-each-for-illegal-baitfish-sales-in-northern-ont-1.6835433,negative,0.006309655,0.80022633,0.19346395,-0.6403224400070826
CTV,2024-04-06,Slovak nationalist Peter Pellegrini on course to win country's presidential election,https://www.ctvnews.ca/world/slovak-nationalist-peter-pellegrini-on-course-to-win-country-s-presidential-election-1.6836649,positive,0.2949814,0.009905587,0.69511306,0.08691589164083169
CTV,2024-04-06,Did you feel it? New York earthquake reaches Ontario,https://toronto.ctvnews.ca/did-you-feel-it-new-york-earthquake-reaches-ontario-1.6835485,neutral,0.030089382,0.03820233,0.93170834,-0.0005540467463553966
CTV,2024-04-06,"Premiers making 'political hay' out of carbon pricing increase, Trudeau says",https://www.ctvnews.ca/politics/premiers-making-political-hay-out-of-carbon-pricing-increase-trudeau-says-1.6829043,negative,0.017155305,0.24922158,0.7336232,-0.061817069838049576
CBC,2024-04-06,St. John's museum overflows with Lego — and you can touch the exhibits,https://www.cbc.ca/player/play/1.7163841,positive,0.6121443,0.0066135055,0.3812422,0.37467691325173824
CBC,2024-04-06,Israeli troops recover body of hostage in Gaza as Hamas plans to attend ceasefire talks,https://www.cbc.ca/news/world/israel-hamas-hostage-body-recovered-1.7165892,neutral,0.06056134,0.043254416,0.8961842,0.0017967320427203504
CBC,2024-04-06,"U.S. 'unable to step up' on Ukraine aid, leaving Canada to fill the gap, says Freeland",https://www.cbc.ca/news/politics/freeland-canada-support-ukraine-us-aid-1.7164585,negative,0.012533363,0.400788,0.5866786,-0.16047394301148188
CBC,2024-04-06,Medical cannabis hurdles remain in Canada. Here's why,https://www.cbc.ca/news/health/second-opinion-medical-cannabis-1.7162603,negative,0.02007653,0.29369658,0.68622684,-0.08585462303685176
CBC,2024-04-06,Canada's Brad Gushue handles Scotland to advance to world men's curling final,https://www.cbc.ca/sports/olympics/winter/curling/gushue-canada-world-curling-championship-april-6-1.7165884,neutral,0.11832846,0.005210909,0.8764605,0.013974486810961029
CBC,2024-04-06,"Greta Thunberg released after Dutch climate protest arrest, rejoins protest and is arrested again",https://www.cbc.ca/news/world/greta-thunberg-climate-protest-arrest-1.7166069,negative,0.016288005,0.5494359,0.434276,-0.3016145724069581
CBC,2024-04-06,A smoky summer is expected in parts of Canada as wildfire season begins. Here's how to prepare now,https://www.cbc.ca/news/canada/kitchener-waterloo/smoky-summer-southern-ontario-wildfire-season-1.7164875,neutral,0.05876135,0.1689421,0.7722965,-0.025088542113262502
CBC,2024-04-06,Canadian women's soccer team to face U.S. in SheBelieves Cup final after shootout win over Brazil,https://www.cbc.ca/sports/soccer/shebelieves-cup-recap-apr-6-1.7165928,neutral,0.12598805,0.0053597144,0.8686523,0.01584425621467611
CBC,2024-04-06,"Montreal restaurant hands out 1,200 free meals a day during Ramadan",https://www.cbc.ca/news/canada/montreal/ramadan-montreal-restaurant-generosity-1.7163268,positive,0.26140383,0.009305872,0.72929025,0.06824537765308492
CBC,2024-04-06,WATCH: CBC News Network,https://www.cbc.cahttps://gem.cbc.ca/live,neutral,0.10073908,0.018231502,0.88102955,0.00981596340483426
CBC,2024-04-06,"Love, Sask., embraces name appeal with new wedding chapel",https://www.cbc.ca/news/canada/saskatoon/married-village-of-love-sk-new-chapel-1.7164175,positive,0.78885865,0.0033561622,0.2077852,0.6222866975101438
CBC,2024-04-06,Cops say thieves can easily steal cars. Experts say manufacturers need to do more,https://www.cbc.ca/player/play/9.4196398,negative,0.011753374,0.7633833,0.22486326,-0.5826159873166752
CBC,2024-04-06,South African girl starts new life in Canada after years of waiting,https://www.cbc.ca/player/play/1.7165816,positive,0.25048053,0.020116983,0.72940236,0.06233583161696643
CBC,2024-04-06,WATCH : CBC News Explore,https://www.cbc.cahttps://gem.cbc.ca/live,neutral,0.09840742,0.014817321,0.88677526,0.009464467482493077
CBC,2024-04-06,Why are so many Canadian festivals struggling or cancelling?,https://www.cbc.ca/news/why-are-so-many-canadian-festivals-struggling-or-cancelling-1.7159111,negative,0.0073266714,0.8091123,0.1835608,-0.6546092300853497
CBC,2024-04-06,Caitlin Clark brings magic to the basketball court,https://www.cbc.ca/player/play/1.7161497,positive,0.9119472,0.0042105964,0.083841994,0.8316301525536209
CBC,2024-04-06,"Zelenskyy warns air-defence missile supply could run out, as Kharkiv hit by new Russian strikes",https://www.cbc.ca/news/world/kharkiv-missile-attack-1.7165725,negative,0.01255291,0.51169956,0.47574756,-0.2616788463444717
CBC,2024-04-06,The Boss is awake. Albertans rushing to catch a glimpse are urged to keep their distance,https://www.cbc.ca/news/canada/calgary/the-boss-photos-grizzly-1.7165514,neutral,0.11863739,0.019427923,0.8619348,0.01369737651664149
CBC,2024-04-06,Iowa reaches U.S. women's college basketball final after record-breaking semi,https://www.cbc.ca/sports/basketball/women-march-madness-roundup-april-5-1.7165766,neutral,0.20639187,0.008106599,0.7855015,0.04253189623685216
CBC,2024-04-06,Calls grow louder for B.C. mayor to resign over residential school book controversy,https://www.cbc.ca/news/canada/british-columbia/quesnel-residential-school-report-1.7163588,negative,0.020189803,0.31572017,0.66409016,-0.09927156328211595
CBC,2024-04-06,Why are pet psychics on the rise?,https://www.cbc.ca/news/canada/pet-psychics-1.7143025,negative,0.016806493,0.59394664,0.38924688,-0.35249014820694313
CBC,2024-04-06,B.C. photographer wins prestigious award for climate photojournalism,https://www.cbc.ca/news/canada/british-columbia/bc-climate-photo-award-winner-1.7163565,positive,0.6900145,0.0049145943,0.30507076,0.4760959541324965
CBC,2024-04-06,Even Lady Liberty takes the occasional shaky selfie,https://www.cbc.ca/player/play/9.4197500,neutral,0.11549851,0.09278962,0.79171187,0.004729992891725487
CBC,2024-04-06,IN PHOTOS | This week's most compelling Canadian images,https://www.cbc.cahttps://www.cbc.ca/newsinteractives/features/compelling-canadian-images-3-30,positive,0.6136785,0.0044785333,0.38184288,0.3765813170976884
CBC,2024-04-06,"Welcome to the wholesome, yet splintered, community of online stick reviews",https://www.cbc.ca/radio/asithappens/online-stick-reviews-1.7165135,positive,0.7768914,0.020133836,0.20297469,0.6031549252715918
CBC,2024-04-06,India calls allegations of foreign interference in Canada's elections 'baseless',https://www.cbc.ca/news/politics/india-denies-foreign-interference-allegations-1.7165933,negative,0.014730328,0.48395792,0.5013118,-0.2339982682091346
CBC,2024-04-06,A closer look at the Baltimore cargo ship wreckage,https://www.cbc.ca/player/play/1.7164849,negative,0.01476406,0.25237605,0.7328598,-0.06347571793776563
CBC,2024-04-06,Canada's Zach Edey leads Purdue to U.S. men's college basketball final,https://www.cbc.ca/sports/basketball/ncaa-march-madness-men-basketball-april-6-semifinals-1.7165885,neutral,0.132737,0.0046163104,0.8626468,0.01759778451114613
CBC,2024-04-06,#TheMoment an octopus squeezed a B.C. woman's leg,https://www.cbc.ca/player/play/1.7164368,negative,0.028389411,0.2799405,0.6916701,-0.0775607087796022
CBC,2024-04-06,Whitehorse Star to close permanently after 124 years,https://www.cbc.ca/news/canada/north/whitehorse-star-to-close-permanently-after-124-years-1.7165800,negative,0.023073277,0.32277125,0.6541555,-0.10364889515212639
CBC,2024-04-06,'Get them home alive': Father of man held by Hamas wants more focus on freeing hostages,https://www.cbc.ca/player/play/9.4197174,neutral,0.07299353,0.10372294,0.8232836,-0.005430389537454783
CBC,2024-04-06,Vince Carter headlines 13-member class for Basketball Hall of Fame,https://www.cbc.ca/sports/basketball/nba/vince-carter-naismith-basketball-hall-of-fame-raptors-nba-1.7165973,positive,0.3094552,0.004034566,0.68651026,0.09574622529355814
CBC,2024-04-06,"Humboldt Broncos player who died in crash inspires 1,500 rural Sask. kids so far",https://www.cbc.ca/player/play/1.7162956,negative,0.047413483,0.29558146,0.6570051,-0.08512035740215751
CBC,2024-04-06,"Here's why Ecuador raided the Mexican Embassy, sparking a diplomatic row",https://www.cbc.ca/news/world/ecuador-mexico-embassy-raid-1.7166031,neutral,0.01876299,0.21058218,0.7706548,-0.0439928111881045
CBC,2024-04-06,How to protect your phone during the solar eclipse,https://www.cbc.ca/player/play/1.7164767,neutral,0.12511635,0.05089957,0.823984,0.01306333928766179
CBC,2024-04-06,Iowa star Caitlin Clark breaks Pete Maravich's NCAA scoring record,https://www.cbc.ca/sports/basketball/caitlin-clark-chasing-ncaa-scoring-record-pete-maravich-1.7132472,positive,0.32666174,0.0037056908,0.6696325,0.1066941864258002
CBC,2024-04-06,"Diagnosed with cancer, this Hamilton man didn't expect to live past 55. The solar eclipse will mark his 60th",https://www.cbc.ca/news/canada/hamilton/cancer-remission-birthday-eclipse-1.7163872,negative,0.052407023,0.4447411,0.50285196,-0.19504811461196425
CBC,2024-04-06,Women's basketball is commanding unprecedented attention. A Canadian icon hopes it's more than a 'moment',https://www.cbc.ca/news/canada/womens-basketball-lisa-thomaidas-1.7165021,positive,0.87167746,0.006759843,0.121562555,0.7597760378570317
CBC,2024-04-06,Trudeau responds to criticism carbon tax rollout was a 'dumpster fire',https://www.cbc.ca/player/play/1.7163185,negative,0.011664672,0.65921634,0.32911912,-0.43443002721424406
CBC,2024-04-06,"Ramadan leaves me feeling hungry, tired and a bit giddy. It also makes me a better person",https://www.cbc.ca/news/canada/prince-edward-island/first-person-fairouz-gaballa-ramadan-1.7162541,positive,0.8731328,0.025918638,0.10094856,0.7616891149722482
CBC,2024-04-06,Canadian NCAA hoops star Zach Edey wins 2nd straight AP player of the year,https://www.cbc.ca/sports/basketball/ncaa-zach-edey-ap-player-of-year-1.7165163,positive,0.5544273,0.002260196,0.44331238,0.3073846003379881
CBC,2024-04-06,RBC to disclose more info on climate-related investments after U.S. investors demand changes,https://www.cbc.ca/news/business/rbc-green-energy-nyc-pensions-1.7165467,neutral,0.053966846,0.022701826,0.92333126,0.0023970496965830534
CBC,2024-04-06,People are fed up with Loblaw stores' rising prices. Would a boycott accomplish anything?,https://www.cbc.ca/news/business/loblaws-boycott-canada-1.7164506,negative,0.007985852,0.872406,0.119608074,-0.7610285428590018
CBC,2024-04-06,WATCH | St. John's museum overflows with Lego — and you can touch the exhibits,https://www.cbc.cahttps://www.cbc.ca/player/play/1.7163841,positive,0.46586114,0.0039128456,0.5302262,0.2170112242052742
