source,date,headline,url,chosen_label,positive,negative,neutral,compound
Global,2024-08-24,Billions in federal contracts awarded to ‘Indigenous’ enterprises without verification,https://globalnews.ca/news/10700685/federal-contracts-indigenous-enterprises-canada/,negative,0.019459251,0.34104815,0.6394926,-0.11593518874157915
Global,2024-08-24,Thousands of rail employees ordered back to work,https://globalnews.ca/video/10714421/thousands-of-rail-employees-ordered-back-to-work/,negative,0.028224444,0.5126746,0.4591009,-0.26203867143911275
Global,2024-08-24,Public visit Fredericton research centre,https://globalnews.ca/video/10714319/public-visit-fredericton-research-centre/,neutral,0.16100192,0.010114355,0.82888377,0.025819311508909593
Global,2024-08-24,Ford government plans to expand Highway 401 to three lanes across Eastern Ontario,https://globalnews.ca/video/8803618/ford-government-plans-to-expand-highway-401-to-three-lanes-across-eastern-ontario/,neutral,0.17423886,0.0055673933,0.8201937,0.030328192290695277
Global,2024-08-24,"Taliban bans women’s voices, bare faces from public in new restrictive laws",https://globalnews.ca/news/10712505/taliban-bans-womens-voices-faces-laws/,negative,0.0053092786,0.841616,0.15307482,-0.7082891984086412
Global,2024-08-24,Superyacht sinking: Manslaughter charges considered as last body found,https://globalnews.ca/news/10712375/superyacht-sinking-final-body-found-daughter-manslaughter-charges/,negative,0.010251347,0.64309555,0.34665313,-0.41346678128848424
Global,2024-08-24,"Concern, frustration grows as CPKC, CN rail labour dispute continues",https://globalnews.ca/news/10714179/concern-frustration-cpkc-cn-rail-labour-dispute/,negative,0.007796516,0.80223167,0.1899719,-0.6435147945849629
Global,2024-08-24,West Coast Express stoppage has been a ‘game-changer’ for riders: councillor,https://globalnews.ca/news/10714098/west-coast-express-stoppage-effect/,positive,0.6492245,0.003931942,0.34684333,0.42147715148763787
Global,2024-08-24,What GO Train commuters need to know about the rail dispute,https://globalnews.ca/news/10713959/how-the-cn-rail-shutdown-is-impacting-metrolinx-commuters/,neutral,0.032138202,0.06185288,0.9060089,-0.0027929152461763085
Global,2024-08-24,Truck crashes through bridge barrier near Sicamous,https://globalnews.ca/video/10714199/truck-crashes-through-bridge-barrier-near-sicamous/,negative,0.01492278,0.671142,0.31393525,-0.4502088506608768
Global,2024-08-24,Dog owner in Second Beach fatal attack still not found as family offers reward,https://globalnews.ca/news/10714072/dog-owner-second-beach-fatal-attack-reward/,negative,0.013883181,0.57024044,0.41587633,-0.32498144776871385
Global,2024-08-24,CN and CPKC workers take to the picket lines,https://globalnews.ca/video/10714151/cn-and-cpkc-workers-take-to-the-picket-lines/,neutral,0.047248323,0.046407074,0.90634465,7.878744714329144e-05
Global,2024-08-24,‘Burned human remains’: Body of missing Ontario real estate agent identified,https://globalnews.ca/news/10710496/body-ontario-realtor-found-burned-human-remains/,negative,0.008763986,0.5162851,0.47495085,-0.2664735497201889
Global,2024-08-24,‘Dangerous precedent’: Union reacts to board ordering rail employees back to work,https://globalnews.ca/news/10714313/labour-board-rail-workers-back-to-work/,negative,0.0067940024,0.7933012,0.1999048,-0.629280675016517
Global,2024-08-24,Global News at 6 Maritimes: Aug. 24,https://globalnews.ca/video/10714305/global-news-at-6-maritimes-aug-24-2/,neutral,0.033317693,0.010027723,0.9566545,0.0010095156148158813
Global,2024-08-24,Public transit systems in Canada’s major cities in dire straits,https://globalnews.ca/video/10714078/public-transit-systems-in-canadas-major-cities-in-dire-straits/,negative,0.014617165,0.80219966,0.18318306,-0.6433107419757835
Global,2024-08-24,2nd-largest diamond ever unearthed found by Canadian company in Botswana,https://globalnews.ca/news/10710917/diamond-2nd-largest-botswana-lucara-canadian-company/,neutral,0.18173103,0.01347101,0.8047979,0.032844711887644706
Global,2024-08-24,"Canada’s rail shutdown, Harris clinches Democratic nomination and other top stories",https://globalnews.ca/news/10712916/canadas-rail-shutdown-kamala-harris-clinches-democratic-nomination-top-stories/,neutral,0.05861664,0.093725555,0.84765786,-0.005348567490505385
Global,2024-08-24,Zoo releases dozens of baby turtles back into Quebec river,https://globalnews.ca/news/10714234/zoo-releases-dozens-of-baby-turtles-back-into-quebec-river/,negative,0.021996133,0.5222793,0.4557245,-0.2722918750562986
Global,2024-08-24,Teamsters serve CN Rail with Monday strike notice,https://globalnews.ca/news/10712616/rail-shutdown-union-challenge-ottawa-arbitration-order/,neutral,0.0628669,0.09650012,0.8406329,-0.005360028957479557
Global,2024-08-24,Family offers reward in fatal dog attack,https://globalnews.ca/video/10713873/family-offers-reward-in-fatal-dog-attack/,negative,0.01833787,0.68860674,0.29305544,-0.4738429444928336
Global,2024-08-24,Cargo ship freed 2 days after running aground on St. Lawrence Seaway near Montreal,https://globalnews.ca/news/10714249/cargo-ship-freed-2-days-after-running-aground-on-st-lawrence-seaway-near-montreal/,neutral,0.03351857,0.046859834,0.9196217,-0.0010723479545298176
Global,2024-08-24,Industry awaits labour board decision in railway dispute,https://globalnews.ca/news/10713960/rail-shutdown-decision-wait/,neutral,0.038378526,0.06679149,0.89482987,-0.0029881951588071054
Global,2024-08-24,Global News at 6 Montreal: Aug. 24,https://globalnews.ca/video/10714367/global-news-at-6-montreal-aug-24/,neutral,0.035762277,0.013509324,0.9507285,0.001096436890985708
Global,2024-08-24,"Calgary woman’s sudden death leaves her son, mother reeling and in need of help",https://globalnews.ca/news/10713566/calgary-woman-sudden-death-son-mother-reeling/,negative,0.009378313,0.77917427,0.21144743,-0.6070245760515389
Global,2024-08-24,Family of a woman who died in Kananaskis Country in need of help,https://globalnews.ca/video/10713595/family-of-a-woman-who-died-in-kananaskis-country-in-need-of-help/,negative,0.03648843,0.44369838,0.5198132,-0.19553684271792093
Global,2024-08-24,"Montreal melon, once thought to be extinct, makes a comeback",https://globalnews.ca/video/10714371/montreal-melon-once-thought-to-be-extinct-makes-a-comeback/,neutral,0.18573003,0.08528943,0.72898054,0.027221354766922445
Global,2024-08-24,"Railway shutdown could cost Canada $341M each day, agency says",https://globalnews.ca/video/10714401/railway-shutdown-could-cost-canada-341m-each-day-agency-says/,negative,0.01207503,0.5892156,0.39870927,-0.34702927597299293
Global,2024-08-24,Etobicoke stabbings: Manhunt continues for suspect in deaths of 2 female relatives,https://globalnews.ca/video/10714404/etobicoke-stabbings-manhunt-continues-for-suspect-in-deaths-of-2-female-relatives/,negative,0.00872974,0.675785,0.31548533,-0.4566091048309495
Global,2024-08-24,"Taliban bans women’s voices, bare faces from public in new restrictive laws",https://globalnews.ca/video/10713772/taliban-bans-womens-voices-bare-faces-from-public-in-new-restrictive-laws/,negative,0.0053092786,0.841616,0.15307482,-0.7082891984086412
Global,2024-08-24,Liberals face storm clouds as cabinet meets in Halifax,https://globalnews.ca/news/10713981/liberals-storm-clouds-cabinet/,negative,0.024202228,0.26246676,0.71333104,-0.06830304439076862
Global,2024-08-24,B.C. rescuers blame province for making dog’s rescue more perilous,https://globalnews.ca/video/10712028/b-c-rescuers-blame-province-for-making-dogs-rescue-more-perilous/,negative,0.004802804,0.85090065,0.14429651,-0.7240088617104004
Global,2024-08-24,Global News at 6 Maritimes: Aug. 24,https://globalnews.ca/video/10714310/global-news-at-6-maritimes-aug-24-3/,neutral,0.033317693,0.010027723,0.9566545,0.0010095156148158813
Global,2024-08-24,Air Canada pilots strike: what it means for Canadian travelers,https://globalnews.ca/video/10714083/air-canada-pilots-strike-what-it-means-for-canadian-travelers/,negative,0.016848635,0.45695868,0.52619267,-0.20852737345049377
Global,2024-08-24,"RFK Jr. backs Trump in U.S. election, but says he can still win",https://globalnews.ca/news/10713093/rfk-jr-us-election-campaign-trump/,neutral,0.20738831,0.023690809,0.7689208,0.04244867672568908
CTV,2024-08-24,"B.C. businessman committed civil fraud, must pay company $72K, court rules",https://bc.ctvnews.ca/b-c-businessman-committed-civil-fraud-must-pay-company-72k-court-rules-1.7013405,negative,0.01343731,0.64893484,0.33762783,-0.4209358662092164
CTV,2024-08-24,"Justin and Hailey Bieber welcome a baby boy, Jack Blues",https://www.ctvnews.ca/entertainment/justin-and-hailey-bieber-welcome-a-baby-boy-jack-blues-1.7012979,positive,0.53892994,0.004443999,0.4566262,0.29042565063337733
CTV,2024-08-24,Dozens of baby turtles set free in Quebec river as part of zoo conservation project,https://montreal.ctvnews.ca/dozens-of-baby-turtles-set-free-in-quebec-river-as-part-of-zoo-conservation-project-1.7013168,neutral,0.18843664,0.009112261,0.802451,0.035425351021018514
CTV,2024-08-24,Woman missing after falling into sinkhole in Malaysia,/video/c2983092-woman-missing-after-falling-into-sinkhole,negative,0.013632597,0.6052356,0.38113177,-0.36612429081936426
CTV,2024-08-24,Trucker arrested for violent assault on Que. bridge,/video/c2983126-trucker-arrested-for-violent-bridge-assault,negative,0.01179951,0.57241356,0.41578704,-0.3275179925722007
CTV,2024-08-24,Does the Mediterranean diet reduce COVID-19 risk? Experts weigh in,https://www.ctvnews.ca/health/does-the-mediterranean-diet-reduce-covid-19-risk-experts-weigh-in-1.7009127,neutral,0.03882477,0.16889226,0.79228294,-0.02701723831619418
CTV,2024-08-24,USNTSB sends team to investigate California crash and lithium-ion battery fire involving a Tesla Semi,https://www.ctvnews.ca/autos/usntsb-sends-team-to-investigate-california-crash-and-lithium-ion-battery-fire-involving-a-tesla-semi-1.7010521,negative,0.02023776,0.33890894,0.64085335,-0.11444968351034035
CTV,2024-08-24,'Bank investigator' fraud spreading in eastern Ontario: What it is and how to avoid it,https://ottawa.ctvnews.ca/bank-investigator-fraud-spreading-in-eastern-ontario-what-it-is-and-how-to-avoid-it-1.7012325,negative,0.009515685,0.5712941,0.41919014,-0.32628644985363664
CTV,2024-08-24,Mayor Jyoti Gondek wants Calgary at forefront of worldwide energy transition,https://calgary.ctvnews.ca/mayor-jyoti-gondek-wants-calgary-at-forefront-of-worldwide-energy-transition-1.7013420,neutral,0.16086613,0.01942039,0.81971353,0.025500752938092397
CTV,2024-08-24,Italian prosecutors open shipwreck and manslaughter investigation into superyacht sinking,https://www.ctvnews.ca/world/italian-prosecutors-open-shipwreck-and-manslaughter-investigation-into-superyacht-sinking-1.7012943,negative,0.012300081,0.58830297,0.39939687,-0.3459491441072604
CTV,2024-08-24,Right to enjoy property doesn't trump freedom of expression: 'Freedom Convoy' defence,https://www.ctvnews.ca/canada/right-to-enjoy-property-doesn-t-trump-freedom-of-expression-freedom-convoy-defence-1.7012187,negative,0.03737264,0.2655038,0.6971236,-0.0690955429335336
CTV,2024-08-24,Two new out-of-control fires reported Friday in the northeast,https://northernontario.ctvnews.ca/two-new-out-of-control-fires-reported-friday-in-the-northeast-1.7012635,negative,0.010964845,0.57975215,0.40928292,-0.33599235769868585
CTV,2024-08-24,Is extra protection worth the additional cost of car rental insurance? Here's how to decide,https://toronto.ctvnews.ca/is-extra-protection-worth-the-additional-cost-of-car-rental-insurance-here-s-how-to-decide-1.7012537,neutral,0.13053195,0.06496965,0.8044984,0.012817536299082999
CTV,2024-08-24,'We have won': Kenyan man granted temporary residency day before deportation order,https://toronto.ctvnews.ca/we-have-won-kenyan-man-granted-temporary-residency-day-before-deportation-order-1.7013256,positive,0.61874896,0.0055235694,0.37572753,0.38281973277104697
CTV,2024-08-24,"$10,000 reward offered for the capture of murder suspect Elijah Blake Strawberry",https://calgary.ctvnews.ca/10-000-reward-offered-for-the-capture-of-murder-suspect-elijah-blake-strawberry-1.7012385,negative,0.03227322,0.30162445,0.66610235,-0.08993573750130501
CTV,2024-08-24,Ontario woman says she was left stranded by Flair Airlines in Dominican Republic,https://toronto.ctvnews.ca/ontario-woman-says-she-was-left-stranded-by-flair-airlines-in-dominican-republic-1.7012150,negative,0.008539523,0.6403117,0.35114878,-0.4099261731679711
CTV,2024-08-24,The CNE has spoken. These are the 5 foods worthy of being in its inaugural hall of fame,https://toronto.ctvnews.ca/the-cne-has-spoken-these-are-the-5-foods-worthy-of-being-in-its-inaugural-hall-of-fame-1.7010696,positive,0.31075463,0.011166407,0.6780789,0.09644377663104109
CTV,2024-08-24,Body found in Ont. identified as B.C. woman who went missing 19 years ago,https://kitchener.ctvnews.ca/body-found-in-ont-identified-as-b-c-woman-who-went-missing-19-years-ago-1.7011885,neutral,0.019246578,0.17748867,0.8032647,-0.03113180890762468
CTV,2024-08-24,Blackfalds mother hits dead end after daughter's busing application rejected,https://edmonton.ctvnews.ca/blackfalds-mother-hits-dead-end-after-daughter-s-busing-application-rejected-1.7012398,negative,0.008262538,0.7620802,0.22965735,-0.5806979058150219
CTV,2024-08-24,S.C. teen seriously burned by football field turf,/video/c2983116-teen-seriously-burned-by-football-field-turf,negative,0.014846014,0.610848,0.37430593,-0.3729149040631903
CTV,2024-08-24,"German police arrest suspect in stabbing rampage, official says",https://www.ctvnews.ca/world/german-police-arrest-suspect-in-stabbing-rampage-official-says-1.7013183,negative,0.015775673,0.31812313,0.6661012,-0.10095344600018308
CTV,2024-08-24,'Showing up really matters': Several groups set to march in Capital Pride parade as large organizations withdraw,https://ottawa.ctvnews.ca/showing-up-really-matters-several-groups-set-to-march-in-capital-pride-parade-as-large-organizations-withdraw-1.7012302,positive,0.4513874,0.007231368,0.5413813,0.2036982707849333
CTV,2024-08-24,Three injured after vehicle crashes into Saskatoon house,https://saskatoon.ctvnews.ca/three-injured-after-vehicle-crashes-into-saskatoon-house-1.7013289,negative,0.00981629,0.6878233,0.30236036,-0.4730045668444305
CTV,2024-08-24,Video shows swimmer bringing man to safety near Vancouver's Stanley Park,https://bc.ctvnews.ca/video-shows-swimmer-bringing-man-to-safety-near-vancouver-s-stanley-park-1.7009872,neutral,0.15082145,0.0149091175,0.83426946,0.022524823125133153
CTV,2024-08-24,Motorcyclist sought after Toronto cop seriously injured in hit-and-run,https://toronto.ctvnews.ca/motorcyclist-sought-after-toronto-cop-seriously-injured-in-hit-and-run-1.7013392,negative,0.021870276,0.391691,0.5864388,-0.15294350748779095
CTV,2024-08-24,Nanos on the Number: Should Canada match U.S. tax rates?,/video/c2982987-nanos-on-the-number--taxes-in-canada,neutral,0.035102315,0.047942363,0.9169555,-0.0010662956947058433
CTV,2024-08-24,Search continues for man wanted for murder in deaths of two female relatives in Etobicoke,https://toronto.ctvnews.ca/search-continues-for-man-wanted-for-murder-in-deaths-of-two-female-relatives-in-etobicoke-1.7013194,negative,0.007820576,0.73630446,0.25587496,-0.542083121457317
CTV,2024-08-24,"Watchdog clears police of criminal offences in handling of Lumby, B.C., death",https://bc.ctvnews.ca/watchdog-clears-police-of-criminal-offences-in-handling-of-lumby-b-c-death-1.7013184,negative,0.02004285,0.44870105,0.53125614,-0.2009309076564687
CTV,2024-08-24,"Many deaths predicted from Ontario's plan to shut supervised consumption sites: experts, data",https://toronto.ctvnews.ca/many-deaths-predicted-from-ontario-s-plan-to-shut-supervised-consumption-sites-experts-data-1.7013045,negative,0.00965554,0.65837,0.33197442,-0.4333578705811849
CTV,2024-08-24,Human remains found after house fire west of Renfrew,https://ottawa.ctvnews.ca/human-remains-found-after-house-fire-west-of-renfrew-1.7013285,negative,0.02530197,0.23035258,0.74434537,-0.052422140361516156
CTV,2024-08-24,Storm clouds still heavy around Liberals as cabinet meets for retreat in Halifax,https://www.ctvnews.ca/politics/storm-clouds-still-heavy-around-liberals-as-cabinet-meets-for-retreat-in-halifax-1.7012947,neutral,0.021323226,0.19350956,0.7851672,-0.036991271617452526
CTV,2024-08-24,French police arrest man suspected of attempted arson against synagogue,https://www.ctvnews.ca/world/french-police-arrest-man-suspected-of-attempted-arson-against-synagogue-1.7012956,negative,0.008364672,0.71843225,0.27320305,-0.5160749477803659
CTV,2024-08-24,This hitchhiking lobster has made his way to Saskatchewan,https://regina.ctvnews.ca/this-hitchhiking-lobster-has-made-his-way-to-saskatchewan-1.7013348,neutral,0.087171815,0.19931257,0.7135156,-0.032126578436141084
CTV,2024-08-24,"As Newfoundlanders say goodbye to a daily print paper, some worry culture will suffer",https://www.ctvnews.ca/canada/as-newfoundlanders-say-goodbye-to-a-daily-print-paper-some-worry-culture-will-suffer-1.7013102,negative,0.01515997,0.6399352,0.34490484,-0.40928722984502386
CTV,2024-08-24,Lando Norris denies Max Verstappen pole position for F1's Dutch Grand Prix,https://www.ctvnews.ca/sports/lando-norris-denies-max-verstappen-pole-position-for-f1-s-dutch-grand-prix-1.7013209,neutral,0.036218166,0.118871115,0.8449106,-0.012818594448255283
CTV,2024-08-24,Chatham-Kent Crime Stoppers to hold free fingerprint and car seat clinic in September,https://windsor.ctvnews.ca/chatham-kent-crime-stoppers-to-hold-free-fingerprint-and-car-seat-clinic-in-september-1.7013248,neutral,0.047047347,0.011084867,0.9418678,0.002090577120767989
CTV,2024-08-24,Lumsden winery holds annual Ladybug Picnic Festival in support of Mother Baby Unit,https://regina.ctvnews.ca/lumsden-winery-holds-annual-ladybug-picnic-festival-in-support-of-mother-baby-unit-1.7013408,positive,0.43354216,0.0029936733,0.5634643,0.18794979298373704
CTV,2024-08-24,"Five years later, fewer travellers visiting Canada than before pandemic",https://www.ctvnews.ca/business/five-years-later-fewer-travellers-visiting-canada-than-before-pandemic-1.7012297,negative,0.019457532,0.6010199,0.37952253,-0.36084636522108937
CTV,2024-08-24,1st-degree murder charge laid in South Vancouver shooting,https://bc.ctvnews.ca/1st-degree-murder-charge-laid-in-south-vancouver-shooting-1.7012189,negative,0.012124118,0.68431103,0.3035649,-0.4681345545408888
CTV,2024-08-24,Brother-in-law of man allegedly swarmed by teens says family reeling from loss,https://toronto.ctvnews.ca/brother-in-law-of-man-allegedly-swarmed-by-teens-says-family-reeling-from-loss-1.7011913,negative,0.010219619,0.65032446,0.33945593,-0.42281744828727064
CTV,2024-08-24,Leafs hold open practice at debut of Bracebridge’s new $78M community centre,https://barrie.ctvnews.ca/leafs-hold-open-practice-at-debut-of-bracebridge-s-new-78m-community-centre-1.7012538,neutral,0.06872848,0.005827054,0.9254444,0.00468965176728009
CTV,2024-08-24,"Francis loses no-hitter bid late, helps lead Blue Jays to 3-1 victory over Angels",https://toronto.ctvnews.ca/francis-loses-no-hitter-bid-late-helps-lead-blue-jays-to-3-1-victory-over-angels-1.7013273,neutral,0.09709318,0.0114001725,0.8915066,0.009297124869992235
CTV,2024-08-24,Big plans moving forward for former Mill Market in the Sault,https://northernontario.ctvnews.ca/big-plans-moving-forward-for-former-mill-market-in-the-sault-1.7012492,positive,0.70009613,0.0051415046,0.2947624,0.4901081360614299
CTV,2024-08-24,"Commercial truck plunges off bridge in B.C. Interior, driver unaccounted for, RCMP say",https://bc.ctvnews.ca/commercial-truck-plunges-off-bridge-in-b-c-interior-driver-unaccounted-for-rcmp-say-1.7013242,negative,0.009177845,0.4895363,0.5012859,-0.23956152777463657
CTV,2024-08-24,Premier Higgs 'strongly objects' to naming of nurses in Horizon Health lawsuit,https://atlantic.ctvnews.ca/premier-higgs-strongly-objects-to-naming-of-nurses-in-horizon-health-lawsuit-1.7013224,negative,0.018421244,0.24718158,0.7343971,-0.060759404501579795
CTV,2024-08-24,London Brewery packed as Home County Music Festival returns for one-day event,https://london.ctvnews.ca/london-brewery-packed-as-home-county-music-festival-returns-for-one-day-event-1.7013235,neutral,0.1483962,0.017404543,0.8341992,0.02171852208732261
CTV,2024-08-24,"Western Canadian pin collectors gather in Calgary to trade, buy and sell",https://calgary.ctvnews.ca/western-canadian-pin-collectors-gather-in-calgary-to-trade-buy-and-sell-1.7013386,neutral,0.052308388,0.009199902,0.93849164,0.002651532147045277
CTV,2024-08-24,Tugboats free grounded cargo ship blocking traffic in St. Lawrence Seaway,https://montreal.ctvnews.ca/tugboats-free-grounded-cargo-ship-blocking-traffic-in-st-lawrence-seaway-1.7013208,negative,0.011020706,0.41339627,0.57558304,-0.170775007030608
CTV,2024-08-24,"'Butter, crayfish, salt': How you can take advantage of an urban crustacean invasion",https://edmonton.ctvnews.ca/butter-crayfish-salt-how-you-can-take-advantage-of-an-urban-crustacean-invasion-1.7013310,neutral,0.06504676,0.21200551,0.72294766,-0.04071526695636596
CTV,2024-08-24,Pro Power Wrestling returns to Whoop-Up Days for a bare-knuckle brawl,https://calgary.ctvnews.ca/pro-power-wrestling-returns-to-whoop-up-days-for-a-bare-knuckle-brawl-1.7013227,neutral,0.13843517,0.019853577,0.8417113,0.01877012825359259
CTV,2024-08-24,Former Sears employees reunite for parking lot BBQ as demolition of Devonshire Mall 'landmark' continues,https://windsor.ctvnews.ca/former-sears-employees-reunite-for-parking-lot-bbq-as-demolition-of-devonshire-mall-landmark-continues-1.7013346,neutral,0.1125619,0.04582225,0.841616,0.010570494175739853
CTV,2024-08-24,Pedestrian struck in fail-to-remain overnight crash,https://barrie.ctvnews.ca/pedestrian-struck-in-fail-to-remain-overnight-crash-1.7013121,negative,0.016179696,0.70108634,0.28273386,-0.49126035898397546
CTV,2024-08-24,Major Canadian rental company warns tenants that hackers may have their banking info,https://saskatoon.ctvnews.ca/major-canadian-rental-company-warns-tenants-that-hackers-may-have-their-banking-info-1.7012152,negative,0.013011796,0.4921258,0.49486244,-0.24201849128857233
CTV,2024-08-24,Sister says hiker still missing in Grand Canyon flash flood amid intrepid search,https://www.ctvnews.ca/world/sister-says-hiker-still-missing-in-grand-canyon-flash-flood-amid-intrepid-search-1.7012978,negative,0.013658885,0.36535704,0.620984,-0.1332992235981152
CTV,2024-08-24,Police search for suspect in early morning robbery investigation,https://barrie.ctvnews.ca/police-search-for-suspect-in-early-morning-robbery-investigation-1.7013244,neutral,0.033834063,0.20644553,0.75972027,-0.041475039319394114
CTV,2024-08-24,RCMP find 'extremely dangerous' suspect in stabbing near Westlock,https://edmonton.ctvnews.ca/rcmp-find-extremely-dangerous-suspect-in-stabbing-near-westlock-1.7012823,negative,0.009240892,0.8131148,0.17764409,-0.6610704996919354
CTV,2024-08-24,Astronauts stuck in space to return home early next year: NASA,https://www.ctvnews.ca/world/astronauts-stuck-in-space-to-return-home-early-next-year-nasa-1.7013146,neutral,0.05577911,0.026343837,0.91787714,0.002417308893832404
CTV,2024-08-24,"Saskatoon hit by overnight flooding, traffic disrupted",https://saskatoon.ctvnews.ca/saskatoon-hit-by-overnight-flooding-traffic-disrupted-1.7013149,negative,0.0076483763,0.7492316,0.24312009,-0.5612894475634196
CTV,2024-08-24,Big crowds turn out for annual Rama First Nation Powwow,https://barrie.ctvnews.ca/big-crowds-turn-out-for-annual-rama-first-nation-powwow-1.7013263,positive,0.879001,0.003147879,0.11785119,0.7726327884369302
CTV,2024-08-24,"Man charged with mischief for allegedly starting several fires Vernon, B.C.",https://bc.ctvnews.ca/man-charged-with-mischief-for-allegedly-starting-several-fires-vernon-b-c-1.7008155,negative,0.009630773,0.5987538,0.39161542,-0.35841335505210026
CTV,2024-08-24,Sask. woman faces murder charge after man dies,https://saskatoon.ctvnews.ca/sask-woman-faces-murder-charge-after-man-dies-1.7013417,negative,0.0073380936,0.8019967,0.1906651,-0.6431449427475879
CTV,2024-08-24,Start applying for English eligibility certificates sooner rather than later: EMSB,https://montreal.ctvnews.ca/start-applying-for-english-eligibility-certificates-sooner-rather-than-later-emsb-1.7012673,neutral,0.076276965,0.017953753,0.9057693,0.0054958377583784745
CTV,2024-08-24,The dark side of frugality: When saving becomes an obsession,https://www.ctvnews.ca/business/the-dark-side-of-frugality-when-saving-becomes-an-obsession-1.7012076,negative,0.015132229,0.7397478,0.24511985,-0.5469979096213322
CTV,2024-08-24,Police launch investigation after woman found dead in Regina home,https://regina.ctvnews.ca/police-launch-investigation-after-woman-found-dead-in-regina-home-1.7013084,negative,0.015272678,0.31124607,0.6734813,-0.09664085091896091
CTV,2024-08-24,Waterloo Region embraces inaugural Caribana Ignite street party,https://kitchener.ctvnews.ca/waterloo-region-embraces-inaugural-caribana-ignite-street-party-1.7013294,neutral,0.10958236,0.005944242,0.88447356,0.011972941958433125
CTV,2024-08-24,Body found in Ont. 19 years ago ID'd as missing B.C. woman,/video/c2982943-big-break-in-a-very-cold-case,neutral,0.017747082,0.12682901,0.85542405,-0.01577062424175235
CTV,2024-08-24,Chappell Roan's comments about invasive fans show that we never really know our favourite celebrities,https://www.ctvnews.ca/entertainment/chappell-roan-s-comments-about-invasive-fans-show-that-we-never-really-know-our-favourite-celebrities-1.7013159,negative,0.013002989,0.6673221,0.319675,-0.44514964779926025
CTV,2024-08-24,"$10,000 reward offered in Alta. murder suspect's arrest",/video/c2982919--10-000-reward-put-up-for-murder-suspect-s-arrest,neutral,0.055046804,0.2091073,0.7358458,-0.04069572298359958
