source,date,headline,url,chosen_label,positive,negative,neutral,compound
CTV,2024-07-13,Judge in Coutts murder-conspiracy trial warns jury about defence statement,https://calgary.ctvnews.ca/judge-in-coutts-murder-conspiracy-trial-warns-jury-about-defence-statement-1.6962648,negative,0.015912531,0.32657787,0.6575096,-0.10639988854593163
CTV,2024-07-13,Work friends can be hard to find. Here's how to combat loneliness in the workplace,https://www.ctvnews.ca/lifestyle/work-friends-can-be-hard-to-find-here-s-how-to-combat-loneliness-in-the-workplace-1.6956168,negative,0.09610985,0.29562712,0.608263,-0.07815829168268351
CTV,2024-07-13,"A Black man got a job interview after he changed the name on his resume. Now, he's suing for discrimination",https://www.ctvnews.ca/business/a-black-man-got-a-job-interview-after-he-changed-the-name-on-his-resume-now-he-s-suing-for-discrimination-1.6962795,negative,0.010276445,0.7650916,0.22463185,-0.5852596382096316
CTV,2024-07-13,"1 dead, 17 displaced after Kelowna apartment fire",https://bc.ctvnews.ca/1-dead-17-displaced-after-kelowna-apartment-fire-1.6962961,negative,0.011239967,0.58079934,0.40796074,-0.3372015213826547
CTV,2024-07-13,Emergency workers uncover dozens of bodies in a Gaza City district after Israeli assault,https://www.ctvnews.ca/world/emergency-workers-uncover-dozens-of-bodies-in-a-gaza-city-district-after-israeli-assault-1.6961513,negative,0.017659694,0.56902915,0.4133113,-0.32348221183771386
CTV,2024-07-13,You can now visit Buckingham Palace's iconic balcony room,/video/c2957706-buckingham-palace-opens-balcony-room-to-public,positive,0.8254935,0.0021947566,0.17231165,0.6814347869032789
CTV,2024-07-13,Is it safe to swim in the North Saskatchewan River? Experts weigh in,https://edmonton.ctvnews.ca/is-it-safe-to-swim-in-the-north-saskatchewan-river-experts-weigh-in-1.6962382,neutral,0.036379788,0.066783145,0.89683706,-0.003136499825149963
CTV,2024-07-13,Mother searching for answers after son dies in OPP custody,https://kitchener.ctvnews.ca/mother-searching-for-answers-after-son-dies-in-opp-custody-1.6959276,negative,0.0152808605,0.5132137,0.47150537,-0.26315482041946314
CTV,2024-07-13,Barbora Krejcikova wins Wimbledon for her second Grand Slam trophy by beating Jasmine Paolini,https://www.ctvnews.ca/sports/barbora-krejcikova-wins-wimbledon-for-her-second-grand-slam-trophy-by-beating-jasmine-paolini-1.6962825,positive,0.56021875,0.004029504,0.4357518,0.31382877933267395
CTV,2024-07-13,"Cars and Coffee Ottawa takes place this Sunday, here's what you need to know",https://ottawa.ctvnews.ca/cars-and-coffee-ottawa-takes-place-this-sunday-here-s-what-you-need-to-know-1.6963008,neutral,0.17002341,0.004388482,0.825588,0.02888872143871879
CTV,2024-07-13,Open letter warns against granting Ukraine NATO membership,/video/c2957711-concerns-for-ukraine-nato-membership?playlistId=1.6962811,negative,0.0129908165,0.44960347,0.5374058,-0.2019744916247923
CTV,2024-07-13,Community evacuated in northern Alberta as wildfire creeps closer to highway,https://edmonton.ctvnews.ca/community-evacuated-in-northern-alberta-as-wildfire-creeps-closer-to-highway-1.6960601,negative,0.018962294,0.33240342,0.6486343,-0.11013245662990911
CTV,2024-07-13,Charges laid after paramedic assaulted during call on Victoria's Pandora Avenue,https://bc.ctvnews.ca/charges-laid-after-paramedic-assaulted-during-call-on-victoria-s-pandora-avenue-1.6962433,negative,0.011695371,0.5365886,0.451716,-0.2877905535133358
CTV,2024-07-13,Lethbridge policy committee says yes to Memorial Cup bid,https://calgary.ctvnews.ca/lethbridge-policy-committee-says-yes-to-memorial-cup-bid-1.6962408,neutral,0.17442228,0.0075534866,0.8180242,0.03036607871698127
CTV,2024-07-13,RCMP catch excessive speeder after high-speed crash in Kelowna,https://bc.ctvnews.ca/rcmp-catch-excessive-speeder-after-high-speed-crash-in-kelowna-1.6961950,negative,0.016488414,0.5910641,0.3924474,-0.34908493081424297
CTV,2024-07-13,Watch the moment the case against Alec Baldwin is dismissed,/video/c2957548-moment-case-against-baldwin-thrown-out?playlistId=1.6026688,negative,0.05194018,0.42139974,0.52666,-0.1748799833247041
CTV,2024-07-13,Stunt performer training comes to Sudbury this weekend,https://northernontario.ctvnews.ca/stunt-performer-training-comes-to-sudbury-this-weekend-1.6962076,neutral,0.043045286,0.0070847343,0.94986993,0.0018027049297189013
CTV,2024-07-13,"Kate, Princess of Wales to make rare public appearance at Wimbledon Sunday",https://www.ctvnews.ca/world/kate-princess-of-wales-to-make-rare-public-appearance-at-wimbledon-sunday-1.6962699,positive,0.25279418,0.0035869223,0.74361897,0.06389201475599293
CTV,2024-07-13,Webb Space Telescope's latest cosmic shot shows pair of intertwined galaxies glowing in infrared,https://www.ctvnews.ca/sci-tech/webb-space-telescope-s-latest-cosmic-shot-shows-pair-of-intertwined-galaxies-glowing-in-infrared-1.6961573,neutral,0.19232932,0.0054131737,0.8022575,0.03696126941609812
CTV,2024-07-13,Little free Blockbuster set up in Winnipeg,https://winnipeg.ctvnews.ca/little-free-blockbuster-set-up-in-winnipeg-1.6958239,neutral,0.15011513,0.011407927,0.83847696,0.022404410097004224
CTV,2024-07-13,'Things could have been different': Frustration building amid Spadina Avenue TTC construction,https://toronto.ctvnews.ca/things-could-have-been-different-frustration-building-amid-spadina-avenue-ttc-construction-1.6962169,negative,0.008070183,0.7966148,0.19531497,-0.6345300764081969
CTV,2024-07-13,Fees for paper and reusable bags mandatory in B.C. starting Monday,https://bc.ctvnews.ca/fees-for-paper-and-reusable-bags-mandatory-in-b-c-starting-monday-1.6963017,neutral,0.06766882,0.03856312,0.89376795,0.0030919577556693945
CTV,2024-07-13,Canada is building new National Urban Parks. What are they?,https://www.ctvnews.ca/canada/canada-is-building-new-national-urban-parks-what-are-they-1.6962425,neutral,0.07117563,0.026027342,0.9027971,0.004388543929056965
CTV,2024-07-13,"B.C. university gives pro-Palestinian protesters trespass notice, deadline to vacate",https://bc.ctvnews.ca/b-c-university-gives-pro-palestinian-protesters-trespass-notice-deadline-to-vacate-1.6962030,negative,0.009890889,0.66008514,0.33002388,-0.4356146028142618
CTV,2024-07-13,Silkworm satay? Singapore approves insects as food,https://www.ctvnews.ca/lifestyle/silkworm-satay-singapore-approves-insects-as-food-1.6959386,neutral,0.06526966,0.08595377,0.8487766,-0.00312792272167961
CTV,2024-07-13,'Tears come to my eyes': Track star and family granted extension to stay in Canada after deportation order,https://toronto.ctvnews.ca/tears-come-to-my-eyes-track-star-and-family-granted-extension-to-stay-in-canada-after-deportation-order-1.6956883,neutral,0.2064129,0.08513658,0.70845044,0.03535805786402335
CTV,2024-07-13,"Girl, 12, kicked out of Quebec karate class for wearing hijab: human rights commission",https://montreal.ctvnews.ca/girl-12-kicked-out-of-quebec-karate-class-for-wearing-hijab-human-rights-commission-1.6962203,negative,0.0065293345,0.79487026,0.19860032,-0.631776164380728
CTV,2024-07-13,"Conservatives would scale back supervised drug consumption sites, Poilievre says",https://www.ctvnews.ca/politics/conservatives-would-scale-back-supervised-drug-consumption-sites-poilievre-says-1.6962110,neutral,0.02046686,0.1622301,0.817303,-0.025899718409752026
CTV,2024-07-13,Second sexual assault investigation at Country Thunder underway,https://regina.ctvnews.ca/second-sexual-assault-investigation-at-country-thunder-underway-1.6962898,negative,0.011544998,0.58679336,0.4016617,-0.34419312960226733
CTV,2024-07-13,'They just go ham': How a small insect is leaving a big mess in some Edmonton neighbourhoods,https://edmonton.ctvnews.ca/they-just-go-ham-how-a-small-insect-is-leaving-a-big-mess-in-some-edmonton-neighbourhoods-1.6962970,negative,0.008587839,0.8071389,0.18427323,-0.6513994968560937
CTV,2024-07-13,"Northern Ontario distilleries, breweries see products fly off the shelf",https://northernontario.ctvnews.ca/northern-ontario-distilleries-breweries-see-products-fly-off-the-shelf-1.6962940,negative,0.04043773,0.23000045,0.7295618,-0.05126500052092808
CTV,2024-07-13,4 in 10 Canadians say theft is a risk factor in vehicle purchasing: Nanos,https://www.ctvnews.ca/autos/4-in-10-canadians-say-theft-is-a-risk-factor-in-vehicle-purchasing-nanos-1.6954438,negative,0.015829444,0.50194913,0.4822214,-0.2517023737946733
CTV,2024-07-13,'Surreal 24 hours': What A-list guests think of Indian billionaire's wedding,https://www.ctvnews.ca/entertainment/surreal-24-hours-what-a-list-guests-think-of-indian-billionaire-s-wedding-1.6962930,neutral,0.1330533,0.0095099285,0.8574367,0.017612749079394252
CTV,2024-07-13,"'Water was up to my boots': N.S. residents look to recover after heavy rain, flash flood",https://atlantic.ctvnews.ca/water-was-up-to-my-boots-n-s-residents-look-to-recover-after-heavy-rain-flash-flood-1.6961170,neutral,0.093485355,0.13053536,0.7759793,-0.008299969624033565
CTV,2024-07-13,Investigation underway after bullet hole discovered in south Lethbridge living room,https://calgary.ctvnews.ca/investigation-underway-after-bullet-hole-discovered-in-south-lethbridge-living-room-1.6962814,neutral,0.023625974,0.16199967,0.81437427,-0.02568571985760748
CTV,2024-07-13,"Former B.C. Realtor has licence cancelled, $130K in penalties for role in mortgage fraud",https://bc.ctvnews.ca/former-b-c-realtor-has-licence-cancelled-130k-in-penalties-for-role-in-mortgage-fraud-1.6962627,negative,0.0062749432,0.81938076,0.17434423,-0.6713455159011268
CTV,2024-07-13,Windsor Essex Hospice awards $20K to lucky winner of 2nd annual Rubber Duck Race,https://windsor.ctvnews.ca/windsor-essex-hospice-awards-20k-to-lucky-winner-of-2nd-annual-rubber-duck-race-1.6962996,positive,0.6779011,0.0038951307,0.31820375,0.459534755066187
CTV,2024-07-13,Strange summer for B.C. politics as alliances shift ahead of fall vote,https://bc.ctvnews.ca/strange-summer-for-b-c-politics-as-alliances-shift-ahead-of-fall-vote-1.6962503,neutral,0.019155135,0.21679008,0.76405466,-0.04663104632460069
CTV,2024-07-13,Ontario dad highlights Calgary Flames' act of kindness,https://calgary.ctvnews.ca/ontario-dad-highlights-calgary-flames-act-of-kindness-1.6959615,positive,0.4680809,0.013777447,0.5181416,0.21890993231926004
CTV,2024-07-13,"'We feel the brick falling': McDermot Avenue building set for demolition, neighbours worry about the mess left behind",https://winnipeg.ctvnews.ca/we-feel-the-brick-falling-mcdermot-avenue-building-set-for-demolition-neighbours-worry-about-the-mess-left-behind-1.6962258,negative,0.008283186,0.7858798,0.20583707,-0.6175383878455349
CTV,2024-07-13,"B.C. wildfire crews battle blaze in ancient forest park with 1,000-year-old trees",https://bc.ctvnews.ca/b-c-wildfire-crews-battle-blaze-in-ancient-forest-park-with-1-000-year-old-trees-1.6961866,neutral,0.038947467,0.12521572,0.83583677,-0.014162076544126379
CTV,2024-07-13,"Facebook lifts restrictions on Trump, giving him equal footing with Biden on the social media site",https://www.ctvnews.ca/sci-tech/facebook-lifts-restrictions-on-trump-giving-him-equal-footing-with-biden-on-the-social-media-site-1.6962909,neutral,0.19445086,0.01326127,0.79228795,0.03763526023484509
CBC,2024-07-13,She died from a tick-spread illness most Canadians have never heard of. Why more people could be at risk,https://www.cbc.ca/news/health/tick-spread-illness-second-opinion-1.7261678,negative,0.00815798,0.8401972,0.15164469,-0.7058649033379023
CBC,2024-07-13,"Drawn to Mars, these researchers found themselves in Yukon instead",https://www.cbc.ca/news/canada/north/yukon-mars-astroscience-conference-1.7262831,neutral,0.03950048,0.052594338,0.907905,-0.0012058791689391057
CBC,2024-07-13,WATCH: CBC News Network,https://www.cbc.cahttps://gem.cbc.ca/live,neutral,0.10073908,0.018231502,0.88102955,0.00981596340483426
CBC,2024-07-13,Biden says he'd restore Roe v. Wade at start of 2nd term if re-elected,https://www.cbc.ca/news/world/biden-detroit-100-days-campaign-1.7262819,positive,0.29948485,0.01506548,0.6854496,0.08946422269389132
CBC,2024-07-13,"WATCH | No power, extreme heat: How things spiralled out of control in Texas",https://www.cbc.cahttps://www.cbc.ca/player/play/9.6446524,negative,0.011185602,0.6666568,0.32215765,-0.444306141659343
CBC,2024-07-13,IN PHOTOS | This week's most compelling Canadian images,https://www.cbc.cahttps://www.cbc.ca/newsinteractives/features/compelling-canadian-images-7-13,positive,0.6136785,0.0044785333,0.38184288,0.3765813170976884
CBC,2024-07-13,This U.K. woman survived a crossbow bolt to the head. She says the weapon should be regulated like a gun,https://www.cbc.ca/news/world/crossbow-deaths-uk-restrictions-1.7261588,neutral,0.12780364,0.19659802,0.67559826,-0.022317017808729744
CBC,2024-07-13,See crews remove the roof of Montreal’s Olympic Stadium,https://www.cbc.ca/player/play/video/9.6445696,neutral,0.043353558,0.06365307,0.8929934,-0.002172181649325644
CBC,2024-07-13,Millions of bats have died from this disease. Now it's been found in Alberta,https://www.cbc.ca/news/canada/edmonton/millions-of-bats-died-from-this-disease-now-it-s-in-alberta-1.7262288,negative,0.0066694953,0.90976346,0.08356716,-0.8276249411357153
CBC,2024-07-13,Trudeau is asked if he wants to replace Freeland as finance minister,https://www.cbc.ca/player/play/video/9.6445426,neutral,0.0277377,0.05390941,0.9183531,-0.0021368395209542257
CBC,2024-07-13,"Family of Edmonton man killed by police questioning how it happened, lawyer says",https://www.cbc.ca/news/canada/edmonton/mathios-arkangelo-1.7262714,negative,0.0077587105,0.5090338,0.48320752,-0.259055180826806
CBC,2024-07-13,"Traces of arsenic and lead found in tampons — but potential health impacts unclear, U.S. study says",https://www.cbc.ca/news/health/tampons-heavy-metals-study-1.7262950,negative,0.012043404,0.4518741,0.5360826,-0.20404509926681058
CBC,2024-07-13,"Dr. Ruth Westheimer, America's diminutive sex therapist, dead at 96",https://www.cbc.ca/news/world/ruth-westheimer-obituary-1.7262991,neutral,0.076453075,0.17563808,0.7479088,-0.025003669762281966
CBC,2024-07-13,"No power, extreme heat: How things spiralled out of control in Texas | About That",https://www.cbc.ca/player/play/video/9.6446524,negative,0.00912745,0.77187496,0.21899751,-0.5957077184854498
CBC,2024-07-13,Google to offer dark web monitoring for free. But your data is possibly already there — and vulnerable,https://www.cbc.ca/news/world/google-free-dark-web-monitoring-1.7262043,negative,0.0494171,0.23674667,0.7138362,-0.05360694018567358
CBC,2024-07-13,Country Foods focuses on food sovereignty in northern Manitoba,https://www.cbc.ca/news/canada/manitoba/country-foods-nelson-house-nisichawayasihk-1.7261274,neutral,0.084116675,0.0071278773,0.90875536,0.007024815307553389
CBC,2024-07-13,"Judge drops charges against Alec Baldwin in Rust case, citing 'wilful' withholding of evidence",https://www.cbc.ca/news/entertainment/alec-baldwin-rust-shooting-charges-dismissed-1.7262655,negative,0.00978112,0.68155235,0.30866656,-0.464417916128836
CBC,2024-07-13,Biden news conference: Can he shake the doubters?,https://www.cbc.ca/player/play/video/9.6446011,neutral,0.12989609,0.014674746,0.85542923,0.016657638168722233
CBC,2024-07-13,"People living at B.C. highway rest stop given 2 weeks to leave, advocate warns issues 'growing exponentially'",https://www.cbc.ca/news/canada/british-columbia/highway-1-rest-stop-eviction-1.7262252,negative,0.010627942,0.48373646,0.5056356,-0.23388799079073053
CBC,2024-07-13,"Poilievre says his government will close supervised injection sites near schools, playgrounds",https://www.cbc.ca/player/play/video/9.6446234,negative,0.018002823,0.4086678,0.5733295,-0.16668522538393304
CBC,2024-07-13,"RCMP rescue bear that locked itself inside car in Belcarra, B.C., on hot day",https://www.cbc.ca/news/canada/british-columbia/rcmp-rescue-bear-that-locked-itself-inside-car-in-belcarra-1.7262396,negative,0.020357873,0.261871,0.717771,-0.06816201154651225
CBC,2024-07-13,This Canadian got caught supplying Russia with $7M in weapon parts,https://www.cbc.ca/news/investigates/canadian-caught-supplying-russia-weapons-parts-1.7262446,negative,0.016045235,0.62960577,0.35434908,-0.39614594033405837
CBC,2024-07-13,Anaplasmosis is a tick-borne disease that's on the rise in Canada,https://www.cbc.ca/radio/whitecoat/anaplasmosis-ticks-1.7239603,negative,0.0134768,0.67884934,0.30767384,-0.46065482170740957
CBC,2024-07-13,This pizza delivery man's car was stolen from under his nose,https://www.cbc.ca/player/play/video/9.6445452,negative,0.01720171,0.76266474,0.22013353,-0.5813616103764137
CBC,2024-07-13,'Slapped in the face': These seniors worked all their lives. Now they struggle to pay rent,https://www.cbc.ca/news/canada/seniors-rent-canada-1.7257034,negative,0.0056092073,0.9130603,0.08133039,-0.833647742984331
CBC,2024-07-13,"Water rushes down streets and floods N.S. homes, businesses after heavy rain",https://www.cbc.ca/player/play/video/9.6446135,negative,0.009844062,0.70287997,0.287276,-0.4939433193634759
CBC,2024-07-13,Czech tennis player Barbora Krejcikova wins Wimbledon title,https://www.cbc.ca/sports/tennis/wimbledon-womens-final-july-13-1.7262977,positive,0.4016654,0.0041436963,0.59419084,0.16131795056754328
CBC,2024-07-13,Kids beat the heat thanks to Sask. fire department’s giant slip and slide,https://www.cbc.ca/player/play/video/9.6444744,positive,0.8172035,0.0066926945,0.17610385,0.6677767432035298
CBC,2024-07-13,"I'm Japanese Canadian, but will my baby who passes as white be accepted that way?",https://www.cbc.ca/news/canada/i-m-japanese-canadian-but-will-my-baby-who-passes-as-white-be-accepted-that-way-1.7260167,neutral,0.027056212,0.09992981,0.87301403,-0.009253924554446069
CBC,2024-07-13,Anger and awe as Ambanis celebrate billionaire heir's extravagant wedding,https://www.cbc.ca/news/ambani-wedding-1.7260974,negative,0.08865147,0.49856353,0.4127849,-0.2407065435584368
CBC,2024-07-13,This robot is using AI to help P.E.I. farmers detect potato viruses,https://www.cbc.ca/player/play/video/9.6444533,neutral,0.097346574,0.030915558,0.8717379,0.008520581755631085
CBC,2024-07-13,Weather created 'extremely aggressive inferno' outside Labrador City as crews continue to battle wildfire,https://www.cbc.ca/news/canada/newfoundland-labrador/labrador-wildfires-evacuation-hospital-1.7262953,negative,0.009880493,0.69181687,0.29830265,-0.4785129526852643
CBC,2024-07-13,Meet the world's biggest reconstructed stegosaurus skeleton,https://www.cbc.ca/player/play/video/9.6445469,positive,0.44599238,0.01814738,0.53586036,0.1985798249841082
CBC,2024-07-13,'They were pretty much everywhere': Ontario couple pulled over a dozen ticks off their dog,https://www.cbc.ca/news/canada/kitchener-waterloo/season-of-the-ticks-cambridge-walks-pets-people-1.7203865,neutral,0.04712676,0.21111856,0.7417547,-0.04235011213418005
CBC,2024-07-13,Frustrated with dating apps? These experts have tips for a better swiping experience,https://www.cbc.ca/radio/thecurrent/dating-app-frustrations-tips-1.7262227,neutral,0.23519441,0.13979675,0.6250089,0.03577327755080173
CBC,2024-07-13,Dunes at P.E.I. National Park showing signs of recovery from Fiona's wrath,https://www.cbc.ca/news/canada/prince-edward-island/pei-parks-canada-dune-regrowth-1.7259385,positive,0.23730394,0.02764245,0.73505354,0.05554907202157011
CBC,2024-07-13,The disappearing chinook: How Alaska's Indigenous communities are grappling with new harvest restrictions,https://www.cbc.cahttps://www.cbc.ca/newsinteractives/features/alaska-chinook-salmon,negative,0.014707866,0.2576146,0.7276775,-0.06614896737064768
CBC,2024-07-13,"Blair defends the slow pace of Canada's defence spending, says some allies have it easier",https://www.cbc.ca/news/politics/bill-blair-nato-two-percent-defence-spending-1.7262356,neutral,0.06048437,0.09503628,0.84447944,-0.005373533079104487
CBC,2024-07-13,B.C. museum returns chief's seat to Heiltsuk First Nation,https://www.cbc.ca/news/canada/british-columbia/heiltsuk-chief-s-seat-1.7262679,neutral,0.06261923,0.011817979,0.92556286,0.0037815001884453636
CBC,2024-07-13,Gaza medics say 90 killed at tent camp by Israeli strike that IDF says targeted Hamas commander,https://www.cbc.ca/news/world/gaza-al-mawasi-airstrike-1.7262955,negative,0.0051528825,0.84755176,0.14729533,-0.7183174639835741
CBC,2024-07-13,0% financing on a new car? Deals are back — on some models,https://www.cbc.ca/radio/costofliving/car-deals-coming-back-to-dealerships-1.7257266,positive,0.31309703,0.016049521,0.67085356,0.09777212719239259
