source,date,headline,url,chosen_label,positive,negative,neutral,compound
Global,2024-05-15,Caution urged in dismantling of Metro Vancouver power plant,https://globalnews.ca/video/10496873/caution-urged-in-dismantling-of-metro-vancouver-power-plant/,negative,0.023471007,0.2701965,0.7063323,-0.07245529923278049
Global,2024-05-15,Luka Magnotta: Correctional staff told not to publicize murderer’s prison transfer,https://globalnews.ca/video/10496860/luka-magnotta-correctional-staff-told-not-to-publicize-murderers-prison-transfer/,negative,0.006555177,0.5629862,0.4304587,-0.3169104354681185
Global,2024-05-15,Used vs new cars: Which market is offering the better deal?,https://globalnews.ca/news/10494787/new-used-car-prices-spring-summer-2024/,neutral,0.17119841,0.040375102,0.78842646,0.02767875185002211
Global,2024-05-15,Wildfire evacuation order issued for several Fort McMurray neighbourhoods,https://globalnews.ca/video/10496694/wildfire-evacuation-order-issued-for-several-fort-mcmurray-neighbourhoods/,neutral,0.025358312,0.10336747,0.87127423,-0.010041788755152936
Global,2024-05-15,Fears of trade war escalating as Honda unveils home of new EV supply chain plant,https://globalnews.ca/video/10496869/fears-of-trade-war-escalating-as-honda-unveils-home-of-new-ev-supply-chain-plant/,negative,0.015721356,0.6478536,0.33642504,-0.4194671230968421
Global,2024-05-15,Ford government sets out new rules for people guilty of impaired driving in Ontario,https://globalnews.ca/news/10497152/ontario-impaired-driving-new-legislation/,negative,0.016839841,0.5701109,0.41304925,-0.32474286035020583
Global,2024-05-15,"Global News Hour at 6 Edmonton: May 14, 2024",https://globalnews.ca/video/10496926/global-news-hour-at-6-edmonton-may-14-5/,neutral,0.040003907,0.008131043,0.95186514,0.0015341959931765015
Global,2024-05-15,94-year-old B.C. man honoured for role in Polish underground during WW2,https://globalnews.ca/news/10496987/bc-man-polish-underground/,positive,0.5209576,0.012454829,0.4665876,0.2712416874561363
Global,2024-05-15,Wildfire evacuation order issued for parts of Fort McMurray,https://globalnews.ca/news/10495658/residents-near-fort-mcmurray-wildfire-now-on-2-hour-evacuation-alert/,neutral,0.023976343,0.12023621,0.85578746,-0.013881880681758663
Global,2024-05-15,Police warn impaired driving is on the rise,https://globalnews.ca/video/8937703/police-warn-impaired-driving-is-on-the-rise/,negative,0.014761475,0.675132,0.3101065,-0.4555853445312774
Global,2024-05-15,Anxious wildfire evacuees ‘waiting and waiting’ as flames inch closer to homes,https://globalnews.ca/video/10496865/anxious-wildfire-evacuees-waiting-and-waiting-as-flames-inch-closer-to-homes/,negative,0.014462964,0.44921827,0.53631884,-0.2015878403508129
Global,2024-05-15,Orcas sink yet another yacht in the Strait of Gibraltar,https://globalnews.ca/news/10494458/orcas-sink-yacht-gibraltar-killer-whales/,negative,0.012305736,0.6383041,0.3493902,-0.40728067392134193
Global,2024-05-15,Gang violence suspected after man shot and killed outside Montreal music studio,https://globalnews.ca/news/10497308/montreal-11th-homicide-2024/,negative,0.008530122,0.70321757,0.28825215,-0.4944422853791064
Global,2024-05-15,Proposed Surrey stadium could host 2026 World Cup events,https://globalnews.ca/video/10496910/proposed-surrey-stadium-could-host-2026-world-cup-events/,neutral,0.14937057,0.0068286513,0.8438008,0.022264935518101936
Global,2024-05-15,Ontario to change how it compensates injured migrant workers,https://globalnews.ca/news/10497292/ontario-to-change-compensation-injured-migrant-workers/,negative,0.013653988,0.5554695,0.43087658,-0.30835989982170275
Global,2024-05-15,Your Saskatchewan photo of the day: May 2024,https://globalnews.ca/news/10462028/your-saskatchewan-photo-of-the-day-may-2024/,neutral,0.06485466,0.010965268,0.92418003,0.00408589189493469
Global,2024-05-15,RCMP join search for stolen North Vancouver chicken ‘Snowflake’,https://globalnews.ca/video/10496883/rcmp-join-search-for-stolen-north-vancouver-chicken-snowflake/,negative,0.023588434,0.3986081,0.5778035,-0.15833199470326065
Global,2024-05-15,Miniscule payout for LifeLabs class action lawsuit claimants,https://globalnews.ca/video/10496939/miniscule-payout-for-lifelabs-class-action-lawsuit-claimants/,negative,0.06403742,0.317894,0.6180686,-0.09695581251002494
Global,2024-05-15,These forms of cancer are expected to grow in 2024. Here’s why,https://globalnews.ca/news/10487394/cancer-rates-canada-estimates-2024/,negative,0.017466208,0.59812766,0.3844061,-0.3574516683131037
Global,2024-05-15,Homebuyers find ‘bargaining power’ in spring housing market. Here’s why,https://globalnews.ca/news/10497486/canada-home-sales-april-2024/,neutral,0.14779931,0.014228773,0.8379718,0.021642192806753613
Global,2024-05-15,Be ready: Ontario set to get an emergency alert test,https://globalnews.ca/news/10497418/ontario-emergency-alert/,neutral,0.12975477,0.010416985,0.85982823,0.01672778772398331
Global,2024-05-15,Spy agency CSIS dealt with 24 harassment complaints against staff: Annual report,https://globalnews.ca/news/10497332/spy-agency-csis-dealt-with-24-harassment-complaints-against-staff-annual-report/,negative,0.015151469,0.52099097,0.46385744,-0.27120209768629344
Global,2024-05-15,‘I don’t feel safe’: Halifax senior on living at provincially run housing complex,https://globalnews.ca/news/10495014/halifax-senior-safety-provincially-run-housing-complex/,negative,0.0070530567,0.7830449,0.20990194,-0.6131096107879817
Global,2024-05-15,Shopping for a car? Here’s what deal hunters need to know,https://globalnews.ca/video/10495086/shopping-for-a-car-heres-what-deal-hunters-need-to-know/,neutral,0.14128515,0.029790064,0.8289248,0.01907404674935531
Global,2024-05-15,Kelly Clarkson reveals she used weight-loss medication for ‘bad’ bloodwork,https://globalnews.ca/news/10494768/kelly-clarkson-weight-loss-medication/,negative,0.01076497,0.6775945,0.31164056,-0.45901839896687946
Global,2024-05-15,‘FLiRT’ COVID-19 subvariant dominant in Canada. What to know about the strain,https://globalnews.ca/news/10482978/flirt-covid-subvariants-canada-what-to-know/,neutral,0.014441367,0.10409755,0.8814612,-0.010627736788815234
Global,2024-05-15,Three school districts to offer before and after-school care,https://globalnews.ca/video/10496871/three-school-districts-to-offer-before-and-after-school-care/,neutral,0.11660732,0.011025401,0.8723673,0.013475703702286346
Global,2024-05-15,Canadian author Alice Munro’s connection to Vancouver Island,https://globalnews.ca/video/10496861/canadian-author-alice-munros-connection-to-vancouver-island/,neutral,0.054889817,0.00772879,0.93738145,0.0029531553482575745
Global,2024-05-15,Wildfire smoke from Canada is prompting health warnings in the U.S. again,https://globalnews.ca/news/10492544/canada-wildfire-smoke-us-2024/,negative,0.020190774,0.46282208,0.5169871,-0.21379663639127955
Global,2024-05-15,"Wildfires are growing across Western Canada, displacing thousands",https://globalnews.ca/news/10497357/wildfires-growing-western-canada-displacing-thousands/,negative,0.0068006315,0.85171735,0.1414818,-0.7253763639865962
Global,2024-05-15,This is BC: Polish war resistor honoured,https://globalnews.ca/video/10496893/this-is-bc-polish-war-resistor-honoured/,neutral,0.18627255,0.016914643,0.79681283,0.034411351176224514
Global,2024-05-15,B.C. evening weather forecast: May 14,https://globalnews.ca/video/10496984/b-c-evening-weather-forecast-may-14-6/,neutral,0.03982594,0.0086959675,0.951478,0.0015104883212728737
Global,2024-05-15,Petitcodiac community group faces roadblocks converting church into library,https://globalnews.ca/news/10496072/petitcodiac-community-group-roadblocks-converting-church-into-library/,negative,0.011772748,0.6325427,0.35568437,-0.39997179930544746
CTV,2024-05-15,Accomplished UNB hockey coach Gardiner MacDougall retires,https://atlantic.ctvnews.ca/accomplished-unb-hockey-coach-gardiner-macdougall-retires-1.6887751,positive,0.407334,0.008770805,0.58389515,0.16584408438639642
CTV,2024-05-15,Trucker's body found in trailer in Newfoundland after failed police search in Ontario,https://www.ctvnews.ca/canada/trucker-s-body-found-in-trailer-in-newfoundland-after-failed-police-search-in-ontario-1.6879589,negative,0.013096271,0.42950118,0.5574026,-0.18429972289794705
CTV,2024-05-15,Wilfrid Laurier football player drafted despite only playing 27 games in his entire life,https://kitchener.ctvnews.ca/wilfrid-laurier-football-player-drafted-despite-only-playing-27-games-in-his-entire-life-1.6880215,neutral,0.09788608,0.097495295,0.8046186,7.635172147857361e-05
CTV,2024-05-15,"Oilers beat Canucks 3-2, tie series",https://bc.ctvnews.ca/oilers-beat-canucks-3-2-tie-series-1.6887530,positive,0.22874208,0.0072345305,0.76402336,0.05227060641985304
CTV,2024-05-15,Viral video shows concerning incident at Arizona university,/video/c2922618--had-nothing-to-do-with-me-,negative,0.011902901,0.34727886,0.6408182,-0.12046094981572608
CTV,2024-05-15,Ukrainian general applauds Canadian defence minister for talking Ukraine victory,https://www.ctvnews.ca/politics/ukrainian-general-applauds-canadian-defence-minister-for-talking-ukraine-victory-1.6887647,positive,0.7264256,0.0073308856,0.26624343,0.5276404573697402
CTV,2024-05-15,Man arrested 10 years after Longueuil bike path murder,https://montreal.ctvnews.ca/man-arrested-10-years-after-longueuil-bike-path-murder-1.6887596,negative,0.009805904,0.77067745,0.21951663,-0.5938475717834564
CTV,2024-05-15,'Altercation' in Penticton leaves 1 dead: RCMP,https://bc.ctvnews.ca/altercation-in-penticton-leaves-1-dead-rcmp-1.6883954,negative,0.0067205396,0.6865775,0.30670196,-0.47134349631639694
CTV,2024-05-15,Saskatoon mayor delivers final 'State of the City',https://saskatoon.ctvnews.ca/saskatoon-mayor-delivers-final-state-of-the-city-1.6887306,neutral,0.041230846,0.014394685,0.9443744,0.0014927780031672722
CTV,2024-05-15,'My house is on fire': Terrifying arson attempt in U.S.,/video/c2922601--my-house-is-on-fire-,negative,0.0079235695,0.90016866,0.09190763,-0.8102409819476875
CTV,2024-05-15,An Arizona judge helped revive an 1864 abortion law. His lawmaker wife joined Democrats to repeal it,https://www.ctvnews.ca/world/an-arizona-judge-helped-revive-an-1864-abortion-law-his-lawmaker-wife-joined-democrats-to-repeal-it-1.6887667,neutral,0.08211789,0.20332284,0.7145592,-0.03459683817981496
CTV,2024-05-15,Book Barrie's summer recreation programs for kids' summer vacation,https://barrie.ctvnews.ca/book-barrie-s-summer-recreation-programs-for-kids-summer-vacation-1.6887589,positive,0.31912446,0.0041357907,0.6767397,0.10182333514757147
CTV,2024-05-15,Sault city council approves $505K to help save YMCA,https://northernontario.ctvnews.ca/sault-city-council-approves-505k-to-help-save-ymca-1.6887051,positive,0.32217237,0.0075122155,0.6703153,0.10373863307473563
CTV,2024-05-15,$1.6B parts plant for Honda electric vehicle batteries coming to Niagara Region,https://toronto.ctvnews.ca/1-6b-parts-plant-for-honda-electric-vehicle-batteries-coming-to-niagara-region-1.6886522,neutral,0.12793769,0.0075476468,0.8645147,0.016311080021557345
CTV,2024-05-15,Cannes kicks off with a Palme d'Or for Meryl Streep and a post-'Barbie' fête of Greta Gerwig,https://www.ctvnews.ca/entertainment/cannes-kicks-off-with-a-palme-d-or-for-meryl-streep-and-a-post-barbie-f%C3%AAte-of-greta-gerwig-1.6886700,positive,0.28750196,0.006427049,0.7060709,0.08261609573773399
CTV,2024-05-15,"Adopted daughter in the Netherlands reunited with sister in Montreal and mother in Colombia, 40 years later",https://montreal.ctvnews.ca/adopted-daughter-in-the-netherlands-reunited-with-sister-in-montreal-and-mother-in-colombia-40-years-later-1.6883397,neutral,0.103847526,0.0073917722,0.8887606,0.010729677535199045
CTV,2024-05-15,"Sask. police seize 1.5M pieces of evidence, lay 60 more charges in child exploitation case",https://regina.ctvnews.ca/sask-police-seize-1-5m-pieces-of-evidence-lay-60-more-charges-in-child-exploitation-case-1.6886639,negative,0.014216498,0.6051496,0.38063392,-0.36600394474391074
CTV,2024-05-15,Winnipeg murder trial expected to hear from neighbours of admitted serial killer,https://winnipeg.ctvnews.ca/winnipeg-murder-trial-expected-to-hear-from-neighbours-of-admitted-serial-killer-1.6887595,negative,0.022889473,0.28992432,0.68718624,-0.08353217782050137
CTV,2024-05-15,'We're on standby': Team ready to help entangled right whale in Gulf of St. Lawrence,https://atlantic.ctvnews.ca/more/we-re-on-standby-team-ready-to-help-entangled-right-whale-in-gulf-of-st-lawrence-1.6886697,neutral,0.20364487,0.0127397645,0.78361547,0.04130891230880174
CTV,2024-05-15,Wildfire weather: Here's the forecast for Western Canada,/video/c2922584-wildfire-weather--smoke-and-haze-update?playlistId=1.6885739,neutral,0.02645757,0.0484114,0.925131,-0.0016436606925069874
CTV,2024-05-15,Slovakia's prime minister injured in shooting,https://www.ctvnews.ca/world/slovakia-s-prime-minister-injured-in-shooting-1.6887781,negative,0.00948337,0.5821711,0.40834546,-0.3388332686113671
CTV,2024-05-15,Going to a long weekend BBQ? Here's what you can bring,/video/c2922643-long-weekend-bbq--here-s-what-to-bring,positive,0.3408557,0.0058693774,0.65327483,0.11614818017204875
CTV,2024-05-15,Impaired drivers in Ontario could soon face stiffer penalties,https://toronto.ctvnews.ca/impaired-drivers-in-ontario-could-soon-face-stiffer-penalties-1.6887484,negative,0.009279091,0.77749777,0.21322314,-0.6044166901351309
CTV,2024-05-15,'We probably shouldn't jump to convicting someone': UWindsor legal expert shares insight as murder suspect arrested after repeatedly violating bail conditions,https://windsor.ctvnews.ca/we-probably-shouldn-t-jump-to-convicting-someone-uwindsor-legal-expert-shares-insight-as-murder-suspect-arrested-after-repeatedly-violating-bail-conditions-1.6887602,negative,0.007574644,0.6655665,0.3268588,-0.44292145524222803
CTV,2024-05-15,"1 killed, 3 injured in head-on crash on Hwy. 417 in Ottawa",https://ottawa.ctvnews.ca/1-killed-3-injured-in-head-on-crash-on-hwy-417-in-ottawa-1.6886364,negative,0.013178817,0.599934,0.3868872,-0.35974710119457143
CTV,2024-05-15,Toronto mayor says raising Israeli flag at city hall ceremony is 'divisive',https://toronto.ctvnews.ca/toronto-mayor-says-raising-israeli-flag-at-city-hall-ceremony-is-divisive-1.6886778,negative,0.009843865,0.6406345,0.3495216,-0.4103156500079841
CTV,2024-05-15,Massive manhunt in France for prison-break gang that gunned down officers,https://www.ctvnews.ca/world/massive-manhunt-in-france-for-prison-break-gang-that-gunned-down-officers-1.6887607,negative,0.007999763,0.83348316,0.15851714,-0.6946301192921984
CTV,2024-05-15,Lethbridge calls first year of encampment strategy a success,https://calgary.ctvnews.ca/lethbridge-calls-first-year-of-encampment-strategy-a-success-1.6887145,positive,0.71510285,0.005956999,0.27894005,0.5113366655326264
CTV,2024-05-15,Former Ottawa city councillor Diane Deans dies after 5-year cancer battle,https://ottawa.ctvnews.ca/former-ottawa-city-councillor-diane-deans-dies-after-5-year-cancer-battle-1.6886892,negative,0.017779889,0.52523327,0.45698684,-0.2755538622171194
CTV,2024-05-15,"Google shows off how AI Gmail, Photos and shopping will work",https://www.ctvnews.ca/sci-tech/google-shows-off-how-ai-gmail-photos-and-shopping-will-work-1.6886725,positive,0.67079395,0.005834189,0.3233719,0.44993048665583046
CTV,2024-05-15,Use of alert system delayed during deadly flash flooding in Nova Scotia: report,https://atlantic.ctvnews.ca/more/use-of-alert-system-delayed-during-deadly-flash-flooding-in-nova-scotia-report-1.6886757,negative,0.010189114,0.5773316,0.41247937,-0.3332079105385901
CTV,2024-05-15,'Reimagining Mother's Day': Toronto woman creates Motherless Day event after losing mom,https://toronto.ctvnews.ca/reimagining-mother-s-day-toronto-woman-creates-motherless-day-event-after-losing-mom-1.6883714,neutral,0.050837476,0.19078556,0.7583769,-0.033814690631209565
CTV,2024-05-15,"Miss USA's and Miss Teen USA's mothers speak out: 'They were ill-treated, abused, bullied and cornered'",https://www.ctvnews.ca/entertainment/miss-usa-s-and-miss-teen-usa-s-mothers-speak-out-they-were-ill-treated-abused-bullied-and-cornered-1.6886777,negative,0.009815588,0.75628775,0.23389661,-0.5718748652244088
CTV,2024-05-15,Moncton's Magnetic Hill Zoo welcomes birth of endangered ring-tailed lemur,https://atlantic.ctvnews.ca/moncton-s-magnetic-hill-zoo-welcomes-birth-of-endangered-ring-tailed-lemur-1.6887773,positive,0.3680292,0.0034208964,0.62854975,0.13543384904530775
CTV,2024-05-15,Chris Hadfield inspires youth musical in Sudbury,https://northernontario.ctvnews.ca/chris-hadfield-inspires-youth-musical-in-sudbury-1.6884201,positive,0.66560405,0.003818543,0.33057746,0.44301411727931495
CTV,2024-05-15,Sudbury councillors pull back CAO's powers,https://northernontario.ctvnews.ca/sudbury-councillors-pull-back-cao-s-powers-1.6887661,neutral,0.020943126,0.1405759,0.8384809,-0.019322979062418977
CTV,2024-05-15,ExxonMobil readying to drill exploratory deepwater oil well off Newfoundland,https://www.ctvnews.ca/business/exxonmobil-readying-to-drill-exploratory-deepwater-oil-well-off-newfoundland-1.6887344,neutral,0.041456237,0.029437294,0.92910653,0.000852064547173792
CTV,2024-05-15,Are these Canada's best restaurants? Annual top 100 list revealed,https://www.ctvnews.ca/canada/are-these-canada-s-best-restaurants-annual-top-100-list-revealed-1.6886383,positive,0.5900392,0.007212951,0.40274784,0.3480942409309655
CTV,2024-05-15,Elliot Lake man wins $100K in lottery,https://northernontario.ctvnews.ca/elliot-lake-man-wins-100k-in-lottery-1.6886352,positive,0.6102164,0.0068151783,0.38296846,0.3723175645352512
CTV,2024-05-15,CN Railway suspends service on some networks due to wildfires,https://www.ctvnews.ca/canada/cn-railway-suspends-service-on-some-networks-due-to-wildfires-1.6885838,negative,0.009620914,0.54837835,0.44200087,-0.30062618690323006
CTV,2024-05-15,"Suspect fled in 2-door Fiat after convenience store robbery, Merritt RCMP say",https://bc.ctvnews.ca/suspect-fled-in-2-door-fiat-after-convenience-store-robbery-merritt-rcmp-say-1.6882381,negative,0.018803649,0.28121117,0.6999852,-0.07872613546516583
CTV,2024-05-15,Committee approves Irish famine monument for Lowertown park,https://ottawa.ctvnews.ca/committee-approves-irish-famine-monument-for-lowertown-park-1.6886517,neutral,0.052623905,0.07095949,0.8764165,-0.0022659760933883
CTV,2024-05-15,Retired RCAF jets towed to CFB Borden,https://barrie.ctvnews.ca/retired-rcaf-jets-towed-to-cfb-borden-1.6886657,neutral,0.03784212,0.032085236,0.9300726,0.0004025639547986515
CTV,2024-05-15,Sask. NDP questions reliance on travel nurses as private company video sparks controversy,https://regina.ctvnews.ca/sask-ndp-questions-reliance-on-travel-nurses-as-private-company-video-sparks-controversy-1.6887367,negative,0.011917655,0.34672078,0.64136165,-0.12007324235152517
CTV,2024-05-15,YouTube blocks Hong Kong protest song after court injunction bans song in the city,https://www.ctvnews.ca/world/youtube-blocks-hong-kong-protest-song-after-court-injunction-bans-song-in-the-city-1.6887809,negative,0.008529496,0.6630391,0.32843137,-0.4395481194562052
CTV,2024-05-15,Spy agency CSIS reveals 24 harassment investigations in annual report,https://www.ctvnews.ca/politics/spy-agency-csis-reveals-24-harassment-investigations-in-annual-report-1.6886893,negative,0.020359125,0.4851672,0.49447381,-0.23497265374754406
CTV,2024-05-15,Whooping cough outbreak declared in Newfoundland,https://www.ctvnews.ca/health/whooping-cough-outbreak-declared-in-newfoundland-1.6880496,negative,0.024698721,0.6212298,0.35407153,-0.38531641764719105
CTV,2024-05-15,"About 1,000 wildfires confirmed so far this year: Here's a quick look at the situation in Canada",https://www.ctvnews.ca/canada/about-1-000-wildfires-confirmed-so-far-this-year-here-s-a-quick-look-at-the-situation-in-canada-1.6886852,negative,0.019713419,0.2798502,0.70043623,-0.07792755430410381
CTV,2024-05-15,'Very expensive lunch': Sask. driver handed a cell phone ticket for using points app in McDonald's drive-thru,https://saskatoon.ctvnews.ca/very-expensive-lunch-sask-driver-handed-a-cell-phone-ticket-for-using-points-app-in-mcdonald-s-drive-thru-1.6887468,negative,0.019589018,0.730646,0.24976495,-0.5334598900859557
CTV,2024-05-15,'Rust' armourer Hannah Gutierrez Reed appeals involuntary manslaughter conviction,https://www.ctvnews.ca/entertainment/rust-armourer-hannah-gutierrez-reed-appeals-involuntary-manslaughter-conviction-1.6887021,negative,0.015409134,0.48512876,0.49946216,-0.23511244445908464
CTV,2024-05-15,Kamloops RCMP issue public warning about 2 men allegedly at centre of 'organized crime conflict',https://bc.ctvnews.ca/kamloops-rcmp-issue-public-warning-about-2-men-allegedly-at-centre-of-organized-crime-conflict-1.6879435,negative,0.009116524,0.45374444,0.53713894,-0.2058009466101396
CTV,2024-05-15,Watch the moment a Delta Airlines flight catches fire,/video/c2922389-watch--passengers-exit-plane-after-fire-erupts,negative,0.040876914,0.45602497,0.5030981,-0.20628786682047284
CTV,2024-05-15,City of Ottawa looking at spending up to $5.4M to put bike lanes on bridge over 417,https://ottawa.ctvnews.ca/city-of-ottawa-looking-at-spending-up-to-5-4m-to-put-bike-lanes-on-bridge-over-417-1.6887276,neutral,0.06553916,0.011712119,0.9227485,0.004158219245951056
CTV,2024-05-15,'Most of the city is evacuating': Gridlock on Alberta highway after evacuation order in Fort McMurray,https://edmonton.ctvnews.ca/most-of-the-city-is-evacuating-gridlock-on-alberta-highway-after-evacuation-order-in-fort-mcmurray-1.6886693,negative,0.014082019,0.34261206,0.6433059,-0.11718472889197429
CTV,2024-05-15,Man dead after shooting in Ahuntsic-Cartierville,https://montreal.ctvnews.ca/man-dead-after-shooting-in-ahuntsic-cartierville-1.6887591,negative,0.013666553,0.62593615,0.36039737,-0.39160923468457476
CTV,2024-05-15,Civil society at 'high risk' of cyberthreats from state-sponsored actors: CSE,https://www.ctvnews.ca/politics/civil-society-at-high-risk-of-cyberthreats-from-state-sponsored-actors-cse-1.6886769,negative,0.014050669,0.50838155,0.4775678,-0.25825437473218926
CTV,2024-05-15,Fort Nelson evacuees wait it out as incoming weather holds key to B.C. firefight,https://bc.ctvnews.ca/fort-nelson-evacuees-wait-it-out-as-incoming-weather-holds-key-to-b-c-firefight-1.6886154,neutral,0.028558888,0.055112466,0.9163286,-0.0022217748640209756
CTV,2024-05-15,Kinew visits northern Manitoba to tour areas impacted by wildfire,https://winnipeg.ctvnews.ca/kinew-visits-northern-manitoba-to-tour-areas-impacted-by-wildfire-1.6886466,neutral,0.039985426,0.056872,0.9031426,-0.0016355900654052569
CTV,2024-05-15,"Steal a car, lose your driver's licence for 10 years under new Ontario proposal",https://toronto.ctvnews.ca/steal-a-car-lose-your-driver-s-licence-for-10-years-under-new-ontario-proposal-1.6885914,negative,0.009451084,0.7698971,0.2206518,-0.5926522265579983
CTV,2024-05-15,CCTV footage shows moment of prison-break ambush in France,/video/c2922644-warning--cctv-footage-shows-ambush-in-france,neutral,0.024521096,0.11913952,0.85633934,-0.013592945782390231
CTV,2024-05-15,TikTok content creators sue U.S. government over potential ban,https://www.ctvnews.ca/sci-tech/tiktok-content-creators-sue-u-s-government-over-potential-ban-1.6886745,negative,0.021706553,0.3534139,0.6248795,-0.12443023695222166
CTV,2024-05-15,LIVE NOW: PM Trudeau makes an announcement in Que.,/video/c68596-live--pm-trudeau-makes-an-announcement,neutral,0.073399484,0.0070451302,0.9195555,0.0053378440268692096
CTV,2024-05-15,"'Irate male' assaulted Newfoundland officers with block of cheese, police say",https://www.ctvnews.ca/canada/irate-male-assaulted-newfoundland-officers-with-block-of-cheese-police-say-1.6881630,negative,0.006508384,0.80473924,0.18875234,-0.6475628917905487
CTV,2024-05-15,'Not a scarient': New COVID-19 subvariant dominant in Canada,https://toronto.ctvnews.ca/not-a-scarient-new-covid-19-subvariant-dominant-in-canada-1.6886756,neutral,0.092600845,0.0392499,0.8681492,0.007034363539296651
CTV,2024-05-15,Three people arrested in Wiikwemikoong,https://northernontario.ctvnews.ca/three-people-arrested-in-wiikwemikoong-1.6886567,negative,0.013199697,0.5102798,0.4765205,-0.2602112315101479
CTV,2024-05-15,Palestinians across the Middle East mark their original 'catastrophe' with eyes on the war in Gaza,https://www.ctvnews.ca/world/palestinians-across-the-middle-east-mark-their-original-catastrophe-with-eyes-on-the-war-in-gaza-1.6887796,negative,0.02258864,0.38114545,0.5962659,-0.14476160546688988
CTV,2024-05-15,Maximum payout for LifeLabs class-action drops from $150 estimate to $7.86,https://bc.ctvnews.ca/maximum-payout-for-lifelabs-class-action-drops-from-150-estimate-to-7-86-1.6886594,negative,0.039707903,0.38543108,0.57486105,-0.14698039069067192
CTV,2024-05-15,Victim loses $2M in online romance scam,https://london.ctvnews.ca/victim-loses-2m-in-online-romance-scam-1.6886830,negative,0.011895519,0.78929156,0.19881289,-0.6228396754877403
CTV,2024-05-15,B.C. mom whose son died from wildfire smoke trying to make this year safer,https://bc.ctvnews.ca/b-c-mom-whose-son-died-from-wildfire-smoke-trying-to-make-this-year-safer-1.6887546,negative,0.042344987,0.43191457,0.5257405,-0.18475707282775744
CTV,2024-05-15,Ontario to change how it compensates injured migrant workers,https://toronto.ctvnews.ca/ontario-to-change-how-it-compensates-injured-migrant-workers-1.6887597,negative,0.013653988,0.5554695,0.43087658,-0.30835989982170275
CTV,2024-05-15,Federal Tory Leader Poilievre targets illicit drugs in B.C. hospitals,https://bc.ctvnews.ca/federal-tory-leader-poilievre-targets-illicit-drugs-in-b-c-hospitals-1.6886716,negative,0.014845291,0.38565138,0.5995033,-0.14850662646878732
