source,date,headline,url,chosen_label,positive,negative,neutral,compound
Global,2024-01-16,Vancouver Canucks plane briefly veers off taxiway at YVR as team comes home,https://globalnews.ca/news/10229422/vancouver-canucks-charter-plane-yvr/,neutral,0.03503198,0.023670385,0.9412977,0.0006669517688319138
Global,2024-01-16,‘Ice can be deceiving’: How to tell if it’s OK to skate,https://globalnews.ca/news/10226195/how-to-tell-if-ice-is-safe/,negative,0.031921443,0.3837013,0.58437717,-0.1462077362403882
Global,2024-01-16,Pets are no longer ‘property’ under B.C. family law,https://globalnews.ca/video/10228330/pets-are-no-longer-property-under-b-c-family-law/,neutral,0.032498114,0.16299285,0.80450904,-0.025510542216512277
Global,2024-01-16,Quebec martial arts coach charged with 61 sex offences,https://globalnews.ca/news/10229328/quebec-martial-arts-coach-abuse/,negative,0.009369918,0.7620587,0.22857143,-0.5806456181585506
Global,2024-01-16,"Tobacco use is on the decline globally, WHO says. Here is where Canada stands",https://globalnews.ca/news/10229024/tobacco-use-who-report/,negative,0.019198831,0.42005223,0.5607489,-0.1760753048601913
Global,2024-01-16,"Heather Stefanson steps down from PC leadership, experts explain next steps",https://globalnews.ca/video/10228350/heather-stefanson-steps-down-from-pc-leadership-experts-explain-next-steps/,neutral,0.019699967,0.08319025,0.89710957,-0.006532542228494531
Global,2024-01-16,Alberta government looks to avoid more electrical grid alerts,https://globalnews.ca/video/10228155/alberta-government-looks-to-avoid-more-electrical-grid-alerts/,negative,0.022754736,0.23024009,0.74700516,-0.05249272145685957
Global,2024-01-16,Canadians receive 1st carbon pricing rebate of 2024 starting Monday,https://globalnews.ca/video/10226084/canadians-receive-1st-carbon-pricing-rebate-of-2024-starting-monday/,positive,0.29357997,0.007964438,0.69845563,0.08612575564375113
Global,2024-01-16,December Inflation Numbers,https://globalnews.ca/video/10229256/december-inflation-numbers/,neutral,0.061435264,0.1189646,0.8196002,-0.010378278934747964
Global,2024-01-16,House ethics committee may probe Trudeau’s Jamaica holiday. Why?,https://globalnews.ca/news/10229043/justin-trudeau-jamaica-trip/,negative,0.013599694,0.25496656,0.73143387,-0.06482296475769544
Global,2024-01-16,‘Unsettling news’: What inflation’s uptick means for the Bank of Canada,https://globalnews.ca/news/10228769/canada-december-inflation/,neutral,0.023913203,0.1974103,0.77867645,-0.03839899309210271
Global,2024-01-16,Donald Trump wins Iowa caucuses in opening salvo for Republican nomination,https://globalnews.ca/news/10228219/donald-trump-wins-iowa-caucus-2024/,positive,0.5554673,0.004648942,0.43988383,0.30852228445187535
Global,2024-01-16,Teachers strike across Saskatchewan in one-day demonstration,https://globalnews.ca/news/10229120/teachers-protest-saskatchewan-one-day-demonstration/,negative,0.023985315,0.32665735,0.64935744,-0.10612969550707874
Global,2024-01-16,Saskatchewan stabbing massacre: Public inquest into crime begins,https://globalnews.ca/video/10228273/public-inquest-into-saskatchewan-stabbing-massacre-begins/,negative,0.01192018,0.5684035,0.41967636,-0.32294042877301976
Global,2024-01-16,Pregnant woman who died crossing into U.S. from Canada was looking for new life,https://globalnews.ca/news/10225423/pregnant-woman-died-crossing-into-u-s-canada-husband/,negative,0.014017336,0.5349498,0.4510329,-0.28597476515394504
Global,2024-01-16,Manitoba florists’ creativity in full bloom in international exhibit at The Leaf,https://globalnews.ca/news/10229002/manitoba-florists-international-exhibit-the-leaf/,positive,0.90944403,0.0023434514,0.08821258,0.8270828781792936
Global,2024-01-16,"Arrest made in Arrow Street homicide, Winnipeg police say",https://globalnews.ca/news/10229367/arrest-arrow-street-homicide-winnipeg-police/,neutral,0.019975904,0.1429983,0.83702576,-0.020049480705727873
Global,2024-01-16,"Saskatoon morning news rewind: Tuesday, Jan. 16",https://globalnews.ca/news/10228948/saskatoon-blades-greenhouse-gas-crop-uniglobe-travel/,neutral,0.021026157,0.018407071,0.96056664,0.00010327935480192174
Global,2024-01-16,"Winnipeg morning weather outlook: Tuesday, Jan. 16",https://globalnews.ca/video/10229071/winnipeg-morning-weather-outlook-tuesday-jan-16/,neutral,0.027509049,0.013036625,0.95945424,0.0005867954174382239
Global,2024-01-16,NS woman campaigns Canada Post to recognize war veteran drag performer,https://globalnews.ca/video/10228290/ns-woman-campaigns-canada-post-to-recognize-war-veteran-drag-performer/,neutral,0.16842748,0.028629297,0.80294317,0.027548186036612243
Global,2024-01-16,Keeping safe on frozen B.C. lakes and ponds,https://globalnews.ca/video/10228182/keeping-safe-on-frozen-b-c-lakes-and-ponds/,neutral,0.1581456,0.037760194,0.8040942,0.0235842002990978
Global,2024-01-16,Tim Reid removed as REAL president and CEO,https://globalnews.ca/news/10229453/tim-reid-removed-as-real-president-and-ceo/,negative,0.018693198,0.654823,0.3264838,-0.4284437320871213
Global,2024-01-16,BC Hydro sets new record for electricity demand,https://globalnews.ca/video/10228334/bc-hydro-sets-new-record-for-electricity-demand/,positive,0.3119186,0.01101395,0.67706734,0.09717193326807916
Global,2024-01-16,Why Canada’s in a cold snap despite El Niño,https://globalnews.ca/video/10227599/why-canadas-in-a-cold-snap-despite-el-nino/,negative,0.029447226,0.3506685,0.61988425,-0.12210126018485568
Global,2024-01-16,Department of National Defence wants to hire journalists for ‘role playing’,https://globalnews.ca/news/10228891/department-of-national-defence-hire-journalists-role-playing/,neutral,0.036852844,0.08398709,0.8791601,-0.005695696913491144
Global,2024-01-16,Canadians to receive first carbon pricing rebate of 2024. Here’s how much you could get,https://globalnews.ca/news/10225338/carbon-pricing-rebate-january-2024/,positive,0.3114955,0.007305231,0.6811992,0.09697610612469987
Global,2024-01-16,Saskatchewan crops produce lower greenhouse gas: study,https://globalnews.ca/video/10228940/saskatchewan-crops-produce-lower-greenhouse-gas-study/,positive,0.28282154,0.017787205,0.6993913,0.0796716203368888
Global,2024-01-16,Palestinians in Canada scramble to submit visa applications for family in Gaza,https://globalnews.ca/video/10228283/palestinians-in-canada-scramble-to-submit-visa-applications-for-family-in-gaza/,neutral,0.06410008,0.03415268,0.9017473,0.0029424133268136643
Global,2024-01-16,"Multiple arrests made following traffic stop, investigation by Thompson RCMP",https://globalnews.ca/news/10229133/arrests-traffic-stop-thompson-rcmp/,neutral,0.036578756,0.031668913,0.9317524,0.00033508509519997176
Global,2024-01-16,Do you know how to stay safe if you lose heat during extreme cold?,https://globalnews.ca/news/10227205/extreme-cold-survival-guide/,neutral,0.049516547,0.14121561,0.8092679,-0.017489956970955234
Global,2024-01-16,Palestinians in Canada scramble to submit family applications,https://globalnews.ca/news/10228945/gaza-immigration-canada/,neutral,0.059184123,0.03497747,0.9058384,0.002279337917849844
Global,2024-01-16,El Niño winters are typically mild. What’s driving extreme cold in Canada?,https://globalnews.ca/news/10226740/extreme-cold-weather-canada-el-nino/,negative,0.027150832,0.26950184,0.70334727,-0.07189408548251564
Global,2024-01-16,"Donald Trump wins Iowa caucus, opens Republican primary with decisive victory",https://globalnews.ca/video/10228289/trump-expected-to-win-iowa-caucuses-race-is-on-for-2nd-place/,positive,0.8592874,0.0031671356,0.13754545,0.7383647853445741
Global,2024-01-16,2024 Emmys: Christina Applegate receives standing ovation as she presents 1st award,https://globalnews.ca/video/10228960/2024-emmys-christina-applegate-receives-standing-ovation-as-she-presents-1st-award/,positive,0.63996243,0.0029319024,0.35710564,0.4095433409042304
Global,2024-01-16,Global News Hour at 6 Edmonton: January 15,https://globalnews.ca/video/10228285/global-news-hour-at-6-edmonton-january-15-2/,neutral,0.039804544,0.010732752,0.94946283,0.0014692061133692036
CTV,2024-01-16,Union says Transit Windsor buses will continue running this week,https://windsor.ctvnews.ca/union-says-transit-windsor-buses-will-continue-running-this-week-1.6728203,neutral,0.10456838,0.0061753234,0.8892562,0.010896422596003319
CTV,2024-01-16,Highway 401 eastbound closed near Chatham after crash,https://windsor.ctvnews.ca/highway-401-eastbound-closed-near-chatham-after-crash-1.6728124,negative,0.013497149,0.49859816,0.48790467,-0.24841796508092884
CTV,2024-01-16,"At Davos, Zelenskyy lashes out at Putin and presses allies to boost Ukraine's fight",https://www.ctvnews.ca/world/at-davos-zelenskyy-lashes-out-at-putin-and-presses-allies-to-boost-ukraine-s-fight-1.6727604,neutral,0.06511069,0.09061915,0.8442701,-0.003972429033058056
CTV,2024-01-16,'It is for him to decide': Former PM Chretien on whether Trudeau should run again,https://www.ctvnews.ca/politics/it-is-for-him-to-decide-former-pm-chretien-on-whether-trudeau-should-run-again-1.6724952,neutral,0.029175825,0.026407324,0.9444169,0.00015388195715893005
CTV,2024-01-16,Alleged Nazi links prompts Winnipeg Art Gallery to cut ties with former director,https://winnipeg.ctvnews.ca/alleged-nazi-links-prompts-winnipeg-art-gallery-to-cut-ties-with-former-director-1.6718270,negative,0.007289544,0.7409791,0.25173128,-0.5489969404596025
CTV,2024-01-16,"With 'God's-eye view,' secretive surveillance flights keep close watch on Russia and Ukraine",https://www.ctvnews.ca/world/with-god-s-eye-view-secretive-surveillance-flights-keep-close-watch-on-russia-and-ukraine-1.6663647,neutral,0.05425262,0.03438792,0.9113595,0.0017608172246919018
CTV,2024-01-16,'Bad news': Mischief charges being considered after false Ontario kangaroo sighting,https://london.ctvnews.ca/bad-news-mischief-charges-being-considered-after-false-ontario-kangaroo-sighting-1.6719966,negative,0.0044162855,0.8846287,0.110954836,-0.7825486007833984
CTV,2024-01-16,"At 40, the Sundance Film Festival celebrates its past and looks to the future",https://www.ctvnews.ca/lifestyle/at-40-the-sundance-film-festival-celebrates-its-past-and-looks-to-the-future-1.6728173,positive,0.7544211,0.0033187596,0.24226005,0.5691402378717587
CTV,2024-01-16,This frozen corn product has been recalled in Canada for possible salmonella contamination,https://www.ctvnews.ca/health/this-frozen-corn-product-has-been-recalled-in-canada-for-possible-salmonella-contamination-1.6727638,negative,0.0072654127,0.7975943,0.19514029,-0.6361039074149302
CTV,2024-01-16,What does rise in inflation mean for Canada's interest rate?,/video/c2847747-how-will-rising-inflation-impact-interest-rates-?playlistId=1.6688322,neutral,0.038173106,0.047310892,0.91451585,-0.0007811359213940605
CTV,2024-01-16,Dozens of charges laid against alleged sexual predator in Lanaudiere,https://montreal.ctvnews.ca/dozens-of-charges-laid-against-alleged-sexual-predator-in-lanaudiere-1.6728168,negative,0.015689624,0.6567656,0.32754484,-0.43109484429310285
CTV,2024-01-16,Pay increases of up to 24 per cent part of proposed deal with Quebec teachers' union,https://montreal.ctvnews.ca/pay-increases-of-up-to-24-per-cent-part-of-proposed-deal-with-quebec-teachers-union-1.6727416,positive,0.23642272,0.011460606,0.75211674,0.05576434257029206
CTV,2024-01-16,Armed suspects seen on video trying to break into Toronto home,https://toronto.ctvnews.ca/armed-suspects-seen-on-video-trying-to-break-into-toronto-home-1.6728141,negative,0.017989771,0.27141237,0.7105979,-0.07334103609626297
CTV,2024-01-16,Elton John achieves rare EGOT status with Emmy win for Dodger Stadium farewell concert special,https://www.ctvnews.ca/entertainment/elton-john-achieves-rare-egot-status-with-emmy-win-for-dodger-stadium-farewell-concert-special-1.6727590,positive,0.8821572,0.0017125284,0.116130285,0.7781984109422146
CTV,2024-01-16,Cyclone Belal: Cars swamped by heavy flooding in Mauritius,/video/c2847760-heavy-flooding-in-mauritius-after-cyclone-belal,negative,0.013867407,0.65910107,0.32703152,-0.4342219341724185
CTV,2024-01-16,Masked man opens fire in busy Massachusetts restaurant,/video/c2847517-masked-man-opens-fire-in-busy-restaurant,negative,0.014569233,0.4629647,0.522466,-0.21412409048390657
CTV,2024-01-16,'It's the end of an era': Five Lanark OPP officers retire after 30 years of service,https://ottawa.ctvnews.ca/it-s-the-end-of-an-era-five-lanark-opp-officers-retire-after-30-years-of-service-1.6727874,negative,0.012040453,0.6776177,0.31034184,-0.4590208141568155
CTV,2024-01-16,Suspect in Long Island's Gilgo Beach serial killings is charged with the death of a fourth woman,https://www.ctvnews.ca/world/suspect-in-long-island-s-gilgo-beach-serial-killings-is-charged-with-the-death-of-a-fourth-woman-1.6727894,negative,0.008313972,0.75814027,0.23354578,-0.5747075410129696
CTV,2024-01-16,Ottawa worried about 'chill' in ethnic communities over research security: memos,https://www.ctvnews.ca/politics/ottawa-worried-about-chill-in-ethnic-communities-over-research-security-memos-1.6727606,neutral,0.021086058,0.15991175,0.8190022,-0.02512714468668964
CTV,2024-01-16,"Canada's finance minister, Honda met on potential EV project",https://www.ctvnews.ca/autos/canada-s-finance-minister-honda-met-on-potential-ev-project-1.6721945,neutral,0.15785234,0.0080086095,0.83413917,0.02485320445807382
CTV,2024-01-16,'A bad batch of coke': Text messages show fatalistic tone prior to James Smith Cree Nation killings,https://saskatoon.ctvnews.ca/a-bad-batch-of-coke-text-messages-show-fatalistic-tone-prior-to-james-smith-cree-nation-killings-1.6727050,negative,0.0051206728,0.84285694,0.15202247,-0.7103815184908218
CTV,2024-01-16,Extreme cold warning in effect for London and surrounding areas,https://london.ctvnews.ca/extreme-cold-warning-in-effect-for-london-and-surrounding-areas-1.6725945,negative,0.036858458,0.30805928,0.65508235,-0.09354194600359378
CTV,2024-01-16,Lake effect snow squalls continue across northeast moving inland,https://northernontario.ctvnews.ca/lake-effect-snow-squalls-continue-across-northeast-moving-inland-1.6727707,negative,0.042525843,0.25773582,0.6997384,-0.06461929527675814
CTV,2024-01-16,One dead following fire in William Whyte neighbourhood,https://winnipeg.ctvnews.ca/one-dead-following-fire-in-william-whyte-neighbourhood-1.6728198,negative,0.015149823,0.40475917,0.580091,-0.163600467183187
CTV,2024-01-16,Double weekend theft hits local car dealership: 'This is devastating and it’s got to stop',https://atlantic.ctvnews.ca/double-weekend-theft-hits-local-car-dealership-this-is-devastating-and-it-s-got-to-stop-1.6726857,negative,0.006712965,0.90364313,0.08964396,-0.8165257845144009
CTV,2024-01-16,Weather alerts issued for parts of Muskoka and Grey Bruce,https://barrie.ctvnews.ca/weather-alerts-issued-for-parts-of-muskoka-and-grey-bruce-1.6727570,neutral,0.03456125,0.035078127,0.93036073,-3.599490528838345e-05
CTV,2024-01-16,Forecast: Winter weather rages across Canada,https://www.ctvnews.ca/canada/forecast-winter-weather-rages-across-canada-1.6727511,neutral,0.04622888,0.058138408,0.89563257,-0.0012429670526836745
CTV,2024-01-16,15-year-old dead after falling off chairlift at Quebec ski resort,https://montreal.ctvnews.ca/15-year-old-dead-after-falling-off-chairlift-at-quebec-ski-resort-1.6724666,negative,0.009735088,0.7197642,0.27050072,-0.5179656924622726
CTV,2024-01-16,Southwestern Ontario under extreme cold warning,https://kitchener.ctvnews.ca/southwestern-ontario-under-extreme-cold-warning-1.6728160,negative,0.040024973,0.25717804,0.702797,-0.0645385455106009
CTV,2024-01-16,Noise complaints may lead to eviction for Winnipeg family of boy living with autism,https://winnipeg.ctvnews.ca/noise-complaints-may-lead-to-eviction-for-winnipeg-family-of-boy-living-with-autism-1.6718789,negative,0.008996271,0.706059,0.2849448,-0.49843832861855475
CTV,2024-01-16,Saskatoon police investigate after man's sudden death in park,https://saskatoon.ctvnews.ca/saskatoon-police-investigate-after-man-s-sudden-death-in-park-1.6726985,negative,0.01786177,0.25097036,0.73116785,-0.0626670841099708
CTV,2024-01-16,Former NDP leader Ed Broadbent to have state funeral in Ottawa,https://www.ctvnews.ca/politics/former-ndp-leader-ed-broadbent-to-have-state-funeral-in-ottawa-1.6726348,neutral,0.019987658,0.1259974,0.8540149,-0.015475844815632911
CTV,2024-01-16,More work needed to reduce cancer risk for firefighters: Timmins fire dept.,https://northernontario.ctvnews.ca/more-work-needed-to-reduce-cancer-risk-for-firefighters-timmins-fire-dept-1.6728117,neutral,0.07589455,0.08169165,0.8424139,-0.0009135428473001639
CTV,2024-01-16,iPhone class-action: Who qualifies for the Apple settlement?,https://www.ctvnews.ca/sci-tech/iphone-class-action-who-qualifies-for-the-apple-settlement-1.6721999,neutral,0.07701283,0.02529036,0.89769673,0.00529137732128504
CTV,2024-01-16,"Here are the 'Worst in Show' CES products, according to consumer and privacy advocates",https://www.ctvnews.ca/business/here-are-the-worst-in-show-ces-products-according-to-consumer-and-privacy-advocates-1.6722423,negative,0.010859571,0.8443426,0.14479786,-0.7127964784326757
CTV,2024-01-16,Laval fire leaves one senior dead,https://montreal.ctvnews.ca/laval-fire-leaves-one-senior-dead-1.6727566,negative,0.010050916,0.6820394,0.3079097,-0.4650767155512483
CTV,2024-01-16,Snowfall warning called in southern Alberta,https://calgary.ctvnews.ca/snowfall-warning-called-in-southern-alberta-1.6727727,negative,0.041460954,0.33085454,0.62768453,-0.10774570347789769
CTV,2024-01-16,"Canada's annual inflation rate accelerates to 3.4 per cent in December, complicating path for BoC",https://www.ctvnews.ca/business/canada-s-annual-inflation-rate-accelerates-to-3-4-per-cent-in-december-complicating-path-for-boc-1.6727565,negative,0.018981885,0.4438399,0.5371783,-0.19663352675571844
CTV,2024-01-16,Schools and buses cancelled in Manitoba due to poor road conditions,https://winnipeg.ctvnews.ca/schools-and-buses-cancelled-in-manitoba-due-to-poor-road-conditions-1.6727669,negative,0.007025462,0.83723,0.15574467,-0.7009046118196736
CTV,2024-01-16,U.S. military seizes Iranian missile parts bound for Houthi rebels in raid where 2 SEALs went missing,https://www.ctvnews.ca/world/u-s-military-seizes-iranian-missile-parts-bound-for-houthi-rebels-in-raid-where-2-seals-went-missing-1.6727852,negative,0.009895625,0.50093603,0.48916832,-0.2508389987811501
CTV,2024-01-16,Parts of Canada can expect milder conditions. Here's where,/video/c2847520-forecast--when-will-cold-snap-break-?playlistId=1.6727626,neutral,0.08444173,0.017785594,0.89777267,0.006814078725336792
CTV,2024-01-16,"Man unknowingly buys car with $28,000 lien against it",https://kitchener.ctvnews.ca/man-unknowingly-buys-car-with-28-000-lien-against-it-1.6727970,negative,0.016698271,0.6098844,0.37341726,-0.371680197999666
CTV,2024-01-16,Quebec man who blamed wildfires on government pleads guilty to setting 14 fires,https://montreal.ctvnews.ca/quebec-man-who-blamed-wildfires-on-government-pleads-guilty-to-setting-14-fires-1.6726777,negative,0.012110505,0.60421276,0.38367668,-0.3649264131418892
CTV,2024-01-16,'It's beautiful': Over 30 years of restoration work is complete on nearly 130-year-old building in southern Manitoba,https://winnipeg.ctvnews.ca/it-s-beautiful-over-30-years-of-restoration-work-is-complete-on-nearly-130-year-old-building-in-southern-manitoba-1.6725707,positive,0.96826553,0.0033491377,0.028385445,0.937526825972447
CTV,2024-01-16,Falling tree splits young couple's Oregon home in half,/video/c2847561-falling-tree-splits-oregon-couple-s-house-in-half,negative,0.01821083,0.63563627,0.3461529,-0.4037018335307607
CTV,2024-01-16,4 hospitalized in north Edmonton fire,https://edmonton.ctvnews.ca/4-hospitalized-in-north-edmonton-fire-1.6727764,negative,0.017647337,0.22910304,0.75324965,-0.05217676967885154
CTV,2024-01-16,Windsor police officer under investigation for allegation of sexual assault,https://windsor.ctvnews.ca/windsor-police-officer-under-investigation-for-allegation-of-sexual-assault-1.6728162,negative,0.010404684,0.6238922,0.36570314,-0.3891331861471983
CTV,2024-01-16,B.C. police secretly took DNA from Kurdish community in tea-cup sting to solve murder,https://bc.ctvnews.ca/b-c-police-secretly-took-dna-from-kurdish-community-in-tea-cup-sting-to-solve-murder-1.6726260,negative,0.010272349,0.5733206,0.41640696,-0.3285910712856914
CTV,2024-01-16,"Toronto's Furnish wins Emmy for 'Elton John Live,' Matheson takes the stage for 'The Bear'",https://www.ctvnews.ca/entertainment/toronto-s-furnish-wins-emmy-for-elton-john-live-matheson-takes-the-stage-for-the-bear-1.6725933,positive,0.5207869,0.002639748,0.47657332,0.2712120229407766
CTV,2024-01-16,'Every megawatt matters': Albertans respond quickly to emergency electricity alert,https://calgary.ctvnews.ca/every-megawatt-matters-albertans-respond-quickly-to-emergency-electricity-alert-1.6725426,positive,0.36860177,0.01110906,0.62028915,0.135743863835307
CTV,2024-01-16,Important tax changes Canadians should know about in 2024,https://www.ctvnews.ca/canada/important-tax-changes-canadians-should-know-about-in-2024-1.6728110,positive,0.3400772,0.028371057,0.63155174,0.11484757886285024
CTV,2024-01-16,"Toronto ranked worst city in North America for traffic, new index finds",https://toronto.ctvnews.ca/toronto-ranked-worst-city-in-north-america-for-traffic-new-index-finds-1.6721437,negative,0.0062466804,0.8921515,0.10160184,-0.7958952331745195
CTV,2024-01-16,Security footage shows people passing by Regina man who died on street corner,https://regina.ctvnews.ca/security-footage-shows-people-passing-by-regina-man-who-died-on-street-corner-1.6722594,negative,0.016161745,0.39170447,0.5921339,-0.15317115634433875
CTV,2024-01-16,How a tea cup helped solve a 13-year-old B.C. girl's murder,/video/c2847251-how-a-teacup-solved-a-b-c--murder,negative,0.057300277,0.25630897,0.6863909,-0.06241094493566379
CTV,2024-01-16,More than 100 wildfires still not considered out after B.C.'s record wildfire season,https://bc.ctvnews.ca/more-than-100-wildfires-still-not-considered-out-after-b-c-s-record-wildfire-season-1.6727912,negative,0.01114422,0.7027911,0.28606468,-0.4937911292441406
CTV,2024-01-16,Orillia hospital considering changes that could impact generations,https://barrie.ctvnews.ca/orillia-hospital-considering-changes-that-could-impact-generations-1.6727335,neutral,0.045539174,0.17775525,0.7767057,-0.029523099603998126
CTV,2024-01-16,FCC chair asks automakers about plans to stop abusers from using car electronics to stalk partners,https://www.ctvnews.ca/autos/fcc-chair-asks-automakers-about-plans-to-stop-abusers-from-using-car-electronics-to-stalk-partners-1.6722608,neutral,0.017302532,0.20498583,0.77771163,-0.04171981467665731
CTV,2024-01-16,What experts think of Loblaw ending its 50 per cent discounts on last-day sale items,https://www.ctvnews.ca/canada/what-experts-think-of-loblaw-ending-its-50-per-cent-discounts-on-last-day-sale-items-1.6726915,neutral,0.033744197,0.16259012,0.8036656,-0.02529688824045362
CTV,2024-01-16,Lionel Messi wins FIFA’s best men’s player award. Aitana Bonmatí takes women's prize,https://www.ctvnews.ca/sports/lionel-messi-wins-fifa-s-best-men-s-player-award-aitana-bonmat%C3%AD-takes-women-s-prize-1.6726802,positive,0.8799209,0.0034376506,0.11664135,0.7742490706222056
CTV,2024-01-16,Guinness World Records suspends 'oldest dog ever' title for Portuguese canine during a review,https://www.ctvnews.ca/lifestyle/guinness-world-records-suspends-oldest-dog-ever-title-for-portuguese-canine-during-a-review-1.6727692,negative,0.025814256,0.33862185,0.6355639,-0.113998374935532
CTV,2024-01-16,"'Saddest day of the year' may be a myth, but experts say winter blues are real",https://www.ctvnews.ca/health/saddest-day-of-the-year-may-be-a-myth-but-experts-say-winter-blues-are-real-1.6726910,negative,0.059562832,0.6434782,0.29695886,-0.41051651312998416
CTV,2024-01-16,Tim Reid removed as president and CEO of REAL,https://regina.ctvnews.ca/tim-reid-removed-as-president-and-ceo-of-real-1.6728188,negative,0.021951891,0.46151686,0.5165312,-0.2125159373185781
CTV,2024-01-16,This sliver of a 4.5 billion-year-old asteroid in Winnipeg may hold a clue to life on Earth,https://winnipeg.ctvnews.ca/this-sliver-of-a-4-5-billion-year-old-asteroid-in-winnipeg-may-hold-a-clue-to-life-on-earth-1.6721879,neutral,0.19546744,0.03734478,0.7671878,0.03681288813118755
CTV,2024-01-16,Trump notches a commanding win in the Iowa caucuses as Haley and DeSantis fight for second place,https://www.ctvnews.ca/world/trump-notches-a-commanding-win-in-the-iowa-caucuses-as-haley-and-desantis-fight-for-second-place-1.6725964,positive,0.3492894,0.0057796985,0.6449309,0.12196967110844525
CTV,2024-01-16,10 patient deaths in Manitoba’s health-care system: latest critical incident report,https://winnipeg.ctvnews.ca/10-patient-deaths-in-manitoba-s-health-care-system-latest-critical-incident-report-1.6726766,negative,0.0074219913,0.81337357,0.1792045,-0.6615214476735929
CTV,2024-01-16,"After another playoff failure, only Bill Belichick can save the Dallas Cowboys: analysis",https://www.ctvnews.ca/sports/after-another-playoff-failure-only-bill-belichick-can-save-the-dallas-cowboys-analysis-1.6726079,negative,0.08345692,0.344154,0.57238907,-0.11147691616134736
CTV,2024-01-16,"Toronto struggles with high levels of COVID-19, influenza",/video/c2847362-toronto-experiencing-a-long-cold--flu--covd-season?playlistId=1.6713080,negative,0.012780348,0.7508167,0.23640297,-0.563562350460205
CTV,2024-01-16,Just-released data shows how Canada's tobacco use compares to that of the rest of the world,https://www.ctvnews.ca/health/just-released-data-shows-how-canada-s-tobacco-use-compares-to-that-of-the-rest-of-the-world-1.6727437,neutral,0.03463795,0.052202556,0.91315943,-0.001525320389574647
