source,date,headline,url,chosen_label,positive,negative,neutral,compound
CTV,2024-06-26,Violent incidents on the rise in Waterloo Region public schools,https://kitchener.ctvnews.ca/violent-incidents-on-the-rise-in-waterloo-region-public-schools-1.6942053,negative,0.007411395,0.7971338,0.19545476,-0.6353673830875648
CTV,2024-06-26,"Stakusic into third round of Wimbledon qualifying, Diallo and Galarneau eliminated",https://montreal.ctvnews.ca/stakusic-into-third-round-of-wimbledon-qualifying-diallo-and-galarneau-eliminated-1.6941909,neutral,0.026871558,0.06270307,0.9104255,-0.0032095905844495842
CTV,2024-06-26,Barrie police seek suspects in break-in & theft from Anne Street business,https://barrie.ctvnews.ca/barrie-police-seek-suspects-in-break-in-theft-from-anne-street-business-1.6941856,neutral,0.019776871,0.2012427,0.77898043,-0.040107499969044724
CTV,2024-06-26,Former Honduran president sentenced for helping traffickers get tons of cocaine into U.S.,https://www.ctvnews.ca/world/former-honduran-president-sentenced-for-helping-traffickers-get-tons-of-cocaine-into-u-s-1.6941878,negative,0.01104852,0.65923524,0.32971632,-0.4344689924838221
CTV,2024-06-26,'Armed and dangerous' man wanted for unprovoked attack with machete in Alberta: RCMP,https://edmonton.ctvnews.ca/armed-and-dangerous-man-wanted-for-unprovoked-attack-with-machete-in-alberta-rcmp-1.6941931,negative,0.008969115,0.76422983,0.22680089,-0.58396690658072
CTV,2024-06-26,Video of suspect in synagogue arson released by Vancouver police,https://bc.ctvnews.ca/video-of-suspect-in-synagogue-arson-released-by-vancouver-police-1.6941865,neutral,0.01985261,0.21660645,0.7635409,-0.04652423237760939
CTV,2024-06-26,U.S. health agencies launch new studies of H5N1 bird flu in dairy workers and dairy products,https://www.ctvnews.ca/health/u-s-health-agencies-launch-new-studies-of-h5n1-bird-flu-in-dairy-workers-and-dairy-products-1.6941536,neutral,0.03808273,0.14887556,0.81304187,-0.020713620886334105
CTV,2024-06-26,A U.S. officiant marries 10 same-sex couples in Hong Kong via video chat,https://www.ctvnews.ca/world/a-u-s-officiant-marries-10-same-sex-couples-in-hong-kong-via-video-chat-1.6941407,neutral,0.022858135,0.019188987,0.957953,0.0001542767662607858
CTV,2024-06-26,Teacher charged with sexually assaulting student: N.S. RCMP,https://atlantic.ctvnews.ca/more/teacher-charged-with-sexually-assaulting-student-n-s-rcmp-1.6942074,negative,0.009691564,0.635905,0.35440356,-0.4042812033305019
CTV,2024-06-26,'Not the result we wanted': Trudeau responds after surprise Conservative byelection win in Liberal stronghold,https://www.ctvnews.ca/politics/not-the-result-we-wanted-trudeau-responds-after-surprise-conservative-byelection-win-in-liberal-stronghold-1.6939817,negative,0.013442233,0.6377977,0.34876013,-0.4066051926174339
CTV,2024-06-26,This Ottawa 'fat cat' on a weight loss journey has become a TikTok star,https://ottawa.ctvnews.ca/this-ottawa-fat-cat-on-a-weight-loss-journey-has-become-a-tiktok-star-1.6940796,neutral,0.1696542,0.1251767,0.70516914,0.013113341721147087
CTV,2024-06-26,"Man stabbed in Kelowna, suspect at large: RCMP",https://bc.ctvnews.ca/man-stabbed-in-kelowna-suspect-at-large-rcmp-1.6938918,negative,0.015369684,0.29978237,0.68484807,-0.0896332056254181
CTV,2024-06-26,Lethbridge College to be redesignated as polytechnic institution,https://calgary.ctvnews.ca/lethbridge-college-to-be-redesignated-as-polytechnic-institution-1.6940419,neutral,0.03582707,0.021307318,0.9428657,0.0008295754941969324
CTV,2024-06-26,New pup taking over as Victim Services Toronto's trauma dog,https://toronto.ctvnews.ca/new-pup-taking-over-as-victim-services-toronto-s-trauma-dog-1.6937188,neutral,0.071740195,0.048320778,0.8799389,0.0028117610082882827
CTV,2024-06-26,Hearing held for Barrie police officer facing 2nd misconduct allegation,https://barrie.ctvnews.ca/hearing-held-for-barrie-police-officer-facing-2nd-misconduct-allegation-1.6941514,negative,0.012522896,0.28269216,0.70478505,-0.07975800430727986
CTV,2024-06-26,Why NASA astronauts are delayed at the space station after Boeing Starliner launch,https://www.ctvnews.ca/sci-tech/why-nasa-astronauts-are-delayed-at-the-space-station-after-boeing-starliner-launch-1.6942054,negative,0.013737064,0.5448282,0.4414348,-0.2966490028159896
CTV,2024-06-26,"Wildfire in Labrador jumps Churchill River, hydro generating station evacuated",https://www.ctvnews.ca/climate-and-environment/wildfire-in-labrador-jumps-churchill-river-hydro-generating-station-evacuated-1.6940435,neutral,0.019185556,0.17085242,0.809962,-0.028822471493067603
CTV,2024-06-26,'Why did I have this surgery?' Ont. mother seeks answers after son's tonsil surgery,https://toronto.ctvnews.ca/why-did-i-have-this-surgery-ont-mother-seeks-answers-after-son-s-tonsil-surgery-1.6940447,negative,0.016229713,0.39702964,0.5867408,-0.1573690731610622
CTV,2024-06-26,Man injured in afternoon Rideau Street assault,https://ottawa.ctvnews.ca/man-injured-in-afternoon-rideau-street-assault-1.6942024,negative,0.01236213,0.6379658,0.34967196,-0.40684761240424905
CTV,2024-06-26,Canadian businessman Frank Stronach facing new charges in connection with historical sexual assault investigation,https://toronto.ctvnews.ca/canadian-businessman-frank-stronach-facing-new-charges-in-connection-with-historical-sexual-assault-investigation-1.6942081,negative,0.008625341,0.55108,0.4402945,-0.30361485440870695
CTV,2024-06-26,Weather alerts in effect for region,https://windsor.ctvnews.ca/weather-alerts-in-effect-for-region-1.6941977,neutral,0.05354784,0.044735212,0.9017168,0.0008661330979089499
CTV,2024-06-26,Revival for Regina baseball stadium proposal possible,https://regina.ctvnews.ca/revival-for-regina-baseball-stadium-proposal-possible-1.6941772,neutral,0.05553189,0.0077417847,0.9367263,0.003023857951768516
CTV,2024-06-26,"Indictment alleges West Virginia couple used adopted Black children as 'slaves,' judge says",https://www.ctvnews.ca/world/indictment-alleges-west-virginia-couple-used-adopted-black-children-as-slaves-judge-says-1.6942082,negative,0.007175686,0.6879442,0.30488014,-0.47321569584255485
CTV,2024-06-26,"Rare weather event brings high winds, toppling trees and hydro wires",https://london.ctvnews.ca/rare-weather-event-brings-high-winds-toppling-trees-and-hydro-wires-1.6941777,negative,0.023368774,0.6685255,0.3081058,-0.44638020949654944
CTV,2024-06-26,Canada's Leylah Fernandez and Gabriela Dabrowski advance at Rothesay Classic,https://montreal.ctvnews.ca/canada-s-leylah-fernandez-and-gabriela-dabrowski-advance-at-rothesay-classic-1.6941915,neutral,0.202077,0.0034141238,0.79450876,0.04082348190589613
CTV,2024-06-26,"Dane Cook, Bassem Youssef to perform at 'revived' Montreal Just for Laughs festival",https://montreal.ctvnews.ca/dane-cook-bassem-youssef-to-perform-at-revived-montreal-just-for-laughs-festival-1.6941840,neutral,0.10283837,0.007655758,0.8895058,0.010517126285098932
CTV,2024-06-26,2 of the water features at the Alberta legislature grounds set to reopen on Canada Day,https://edmonton.ctvnews.ca/2-of-the-water-features-at-the-alberta-legislature-grounds-set-to-reopen-on-canada-day-1.6941954,neutral,0.07397693,0.0056465627,0.9203765,0.0054407040058572775
CTV,2024-06-26,A weird sea creature was anatomically unlike anything ever seen — flipping it around led to a revelation,https://www.ctvnews.ca/sci-tech/a-weird-sea-creature-was-anatomically-unlike-anything-ever-seen-flipping-it-around-led-to-a-revelation-1.6941949,neutral,0.12652023,0.19477452,0.6787052,-0.021929748046090936
CTV,2024-06-26,Coutts murder-conspiracy trial to see more video of accused talking with police,https://calgary.ctvnews.ca/coutts-murder-conspiracy-trial-to-see-more-video-of-accused-talking-with-police-1.6941399,neutral,0.021537488,0.1511558,0.82730675,-0.022384208735331868
CTV,2024-06-26,"Suspect drives truck through front door of Sault business, then surrenders to police",https://northernontario.ctvnews.ca/suspect-drives-truck-through-front-door-of-sault-business-then-surrenders-to-police-1.6940260,negative,0.013490212,0.52841806,0.45809168,-0.2790436956805138
CTV,2024-06-26,Police in Ont. seek suspect wanted for possible hate crime,/video/c2946848-police-seek-possible-hate-crime-suspect,negative,0.00959501,0.5776821,0.41272292,-0.3336245014532775
CTV,2024-06-26,'Scenic route' into Sask. national park closed due to road damage,https://saskatoon.ctvnews.ca/scenic-route-into-sask-national-park-closed-due-to-road-damage-1.6941855,negative,0.015683366,0.48843342,0.49588332,-0.23832119658896644
CTV,2024-06-26,Should he stay or should he go now? A look at Trudeau's options after byelection loss,https://www.ctvnews.ca/politics/should-he-stay-or-should-he-go-now-a-look-at-trudeau-s-options-after-byelection-loss-1.6940690,neutral,0.02131579,0.10854452,0.8701396,-0.011327557911592123
CTV,2024-06-26,"Sask. man accused of driving drunk, killing scooter rider released from jail",https://saskatoon.ctvnews.ca/sask-man-accused-of-driving-drunk-killing-scooter-rider-released-from-jail-1.6941998,negative,0.015035288,0.55399287,0.43097177,-0.30668208600053504
CTV,2024-06-26,"'We need to regroup,' says Liberal minister and Ontario campaign co-chair in light of byelection loss",https://www.ctvnews.ca/politics/we-need-to-regroup-says-liberal-minister-and-ontario-campaign-co-chair-in-light-of-byelection-loss-1.6940682,neutral,0.023738064,0.14690138,0.82936054,-0.021016521861196846
CTV,2024-06-26,Trudeau's cabinet all ears to the concerns of Canadians as political fortunes fall,https://www.ctvnews.ca/politics/trudeau-s-cabinet-all-ears-to-the-concerns-of-canadians-as-political-fortunes-fall-1.6941914,neutral,0.09116686,0.23872171,0.6701115,-0.048676649697137364
CTV,2024-06-26,"Water bombers dousing Labrador fires halted by thunderstorms, but rain is coming",https://www.ctvnews.ca/climate-and-environment/water-bombers-dousing-labrador-fires-halted-by-thunderstorms-but-rain-is-coming-1.6939533,neutral,0.06862237,0.103427574,0.8279502,-0.00598822858081105
CTV,2024-06-26,Lawyers looking for thousands of families owed money by Veterans Affairs,https://www.ctvnews.ca/politics/lawyers-looking-for-thousands-of-families-owed-money-by-veterans-affairs-1.6941899,negative,0.017386502,0.59382963,0.38878378,-0.35233139290270366
CTV,2024-06-26,House explodes in Winnipeg: Here's what we know,/video/c2947701-house-explosion-reported-in-winnipeg?playlistId=1.6942077,negative,0.02608844,0.2806627,0.6932489,-0.07809092089830116
CTV,2024-06-26,Suspects impersonating police officers make traffic stop in New Tecumseth,https://barrie.ctvnews.ca/suspects-impersonating-police-officers-make-traffic-stop-in-new-tecumseth-1.6941773,negative,0.01363657,0.5337212,0.45264226,-0.2846723409195846
CTV,2024-06-26,"When a mole went 'rogue,' she knew something was wrong. What followed was years of cancer 'being very sneaky'",https://www.ctvnews.ca/health/when-a-mole-went-rogue-she-knew-something-was-wrong-what-followed-was-years-of-cancer-being-very-sneaky-1.6936488,negative,0.007406824,0.7973747,0.1952185,-0.6357515443858333
CBC,2024-06-26,It took him 63 years to get his university degree but he has no regrets,https://www.cbc.ca/player/play/video/9.6432465,positive,0.5307843,0.07487486,0.3943408,0.27612573524047335
CBC,2024-06-26,"As a post-pandemic graduate, I feel like I made it through the darkness and out the other side",https://www.cbc.ca/news/canada/saskatchewan/pandemic-graduation-experience-1.7244586,positive,0.7802417,0.012941231,0.206817,0.6086097009874258
CBC,2024-06-26,P.E.I.'s lighthouses are iconic — and extremely expensive for volunteers to operate,https://www.cbc.ca/player/play/video/9.6432842,positive,0.784571,0.036219083,0.1792099,0.6142398545929613
CBC,2024-06-26,14-year-old Pan Am champion De Fazio Ebert named to Canadian Olympic skateboard team,https://www.cbc.ca/sports/olympics/summer/skateboarding/canada-olympic-skateboard-team-paris-1.7247484,positive,0.2929294,0.0038646713,0.703206,0.08579267822726955
CBC,2024-06-26,"Billionaire Frank Stronach charged with 8 more criminal counts including sexual assault, police say",https://www.cbc.ca/news/canada/frank-stronach-additional-charges-peel-police-1.7247553,negative,0.0099196145,0.69181633,0.29826412,-0.47851137410232525
CBC,2024-06-26,Same-day deaths of 2 dogs in care of Hamilton pet-sitting service prompt Ontario probe,https://www.cbc.ca/news/canada/hamilton/dog-sitting-hamilton-dog-death-investigation-1.7244766,negative,0.007301564,0.6455534,0.34714508,-0.41668585427896687
CBC,2024-06-26,Crews battling N.L. wildfire near Churchill Falls power plant 'finally getting some help from Mother Nature',https://www.cbc.ca/news/canada/newfoundland-labrador/churchill-falls-fire-june-26-1.7246880,positive,0.45107147,0.013913043,0.5350154,0.20327193845951008
CBC,2024-06-26,Ribbon skirts crafted by northern Manitoba students take the stage at graduation ceremony,https://www.cbc.ca/news/canada/manitoba/pimicikamak-grad-ribbon-skirts-1.7246545,neutral,0.14536221,0.00626632,0.84837157,0.02109089169533096
CBC,2024-06-26,'Felt like … an earthquake': House explodes in Winnipeg's Transcona area,https://www.cbc.ca/news/canada/manitoba/winnipeg-house-explodes-transcona-1.7247235,negative,0.012293225,0.6216556,0.3660512,-0.38630454110227674
CBC,2024-06-26,Shell gives go-ahead to 2 carbon capture and storage projects in Alberta,https://www.cbc.ca/news/canada/edmonton/shell-gives-go-ahead-to-2-carbon-capture-and-storage-projects-in-alberta-1.7247142,neutral,0.18743257,0.015329764,0.79723763,0.034895972625037075
CBC,2024-06-26,This DIY brick sauna is helping frogs fight disease,https://www.cbc.ca/news/science/frog-shelters-chytrid-bd-fungus-1.7246839,positive,0.6542925,0.033317804,0.31238967,0.426988630694499
CBC,2024-06-26,How long can the Churchill Falls power plant operate with staff off-site?,https://www.cbc.ca/player/play/video/9.6433639,neutral,0.015811987,0.080329955,0.9038582,-0.006202874498200117
CBC,2024-06-26,U.K. man pushes 'boundaries of common sense' with 510-km non-stop swim down frigid Yukon River,https://www.cbc.ca/news/canada/north/uk-swimmer-simon-edgley-yukon-river-nonstop-1.7246456,neutral,0.07145602,0.08279117,0.8457528,-0.0017484153334654806
CBC,2024-06-26,Furey says 'favourable' weather conditions helping with Churchill Falls wildfire,https://www.cbc.ca/player/play/video/9.6433604,positive,0.48379835,0.0061817667,0.5100199,0.2340226195741586
CBC,2024-06-26,WATCH : CBC News Explore,https://www.cbc.cahttps://gem.cbc.ca/live,neutral,0.09840742,0.014817321,0.88677526,0.009464467482493077
CBC,2024-06-26,"Ray St. Germain, Métis icon and country music legend, dead at 83",https://www.cbc.ca/news/canada/manitoba/ray-st-germain-dies-singer-tv-host-winnipeg-1.7246937,neutral,0.13085578,0.04387059,0.8252736,0.015198611973838982
CBC,2024-06-26,Why isn’t IUD sedation routinely offered in Canada?,https://www.cbc.ca/player/play/video/9.6428798,negative,0.011621839,0.5596425,0.42873576,-0.3130646047869359
CBC,2024-06-26,"Practise bear safety, officials urge public after 'extremely rare' attack in northwestern Ontario",https://www.cbc.ca/news/canada/thunder-bay/bear-safety-northwestern-ontario-1.7245835,neutral,0.034462497,0.12898125,0.8365563,-0.015448492909779787
CBC,2024-06-26,"Police called to Harrow, Ont., home to check on someone's well-being before finding family of 4 dead",https://www.cbc.ca/news/canada/windsor/harrow-deaths-names-1.7246991,negative,0.017502174,0.23409918,0.7483986,-0.05449610944109029
CBC,2024-06-26,"Canada's claims of Indian interference are politically motivated, envoy says",https://www.cbc.ca/news/politics/india-canada-interference-1.7247127,negative,0.012285713,0.46696135,0.52075285,-0.21790200814180416
CBC,2024-06-26,No charges will be laid in Manitoba bus crash that killed 17,https://www.cbc.ca/news/canada/manitoba/carberry-crash-rcmp-prosecutor-charges-update-1.7246544,negative,0.010089971,0.6911511,0.29875886,-0.4775880514886879
CBC,2024-06-26,Montreal tenant finally agrees to move after 5-year fight with real estate giant,https://www.cbc.ca/news/canada/montreal/montreal-tenant-settles-apartment-1.7246606,neutral,0.09956294,0.023173636,0.8772633,0.009375770668649253
CBC,2024-06-26,"Liberals need to give their 'heads a shake,' Trudeau's cabinet colleague and friend says after byelection loss",https://www.cbc.ca/news/politics/toronto-stpauls-marc-miller-liberals-head-shake-1.7247131,negative,0.018492464,0.4896018,0.49190572,-0.23936795661140486
CBC,2024-06-26,Kenya’s cost-of-living protests turn deadly,https://www.cbc.ca/player/play/video/9.6433060,negative,0.008751417,0.7810677,0.21018071,-0.6099903370035964
CBC,2024-06-26,WATCH: CBC News Network,https://www.cbc.cahttps://gem.cbc.ca/live,neutral,0.10073908,0.018231502,0.88102955,0.00981596340483426
CBC,2024-06-26,WATCH | P.E.I.'s lighthouses are iconic — and extremely expensive for volunteers to operate,https://www.cbc.cahttps://www.cbc.ca/player/play/video/9.6432842,positive,0.73739046,0.026916957,0.23569249,0.5430202174925318
CBC,2024-06-26,Miller says Trudeau should 'absolutely' stay on as Liberal leader,https://www.cbc.ca/player/play/video/9.6433359,neutral,0.12459041,0.014041815,0.8613679,0.015325586714399542
CBC,2024-06-26,Presidential campaigns are long. The 90-minute debate tomorrow could be crucial,https://www.cbc.ca/news/world/debate-preview-analysis-1.7245827,positive,0.2552837,0.09964959,0.64506674,0.05523972590794557
CBC,2024-06-26,Calgary's water supply isn't back to normal — even though repairs are done,https://www.cbc.ca/news/canada/calgary/calgary-water-main-break-repairs-work-complete-usage-1.7247135,negative,0.015862463,0.6913927,0.29274485,-0.47777225499204157
CBC,2024-06-26,Hundreds of buildings with Science Centre roof panels remain open,https://www.cbc.ca/news/canada/toronto/ontario-science-centre-closure-roof-concrete-panels-raac-1.7245973,neutral,0.20056395,0.0060960758,0.7933399,0.040188748373422456
CBC,2024-06-26,Chilliwack attracts families seeking more affordable way of life,https://www.cbc.ca/news/canada/british-columbia/chilliwack-bc-affordable-housing-living-1.7238054,positive,0.4458641,0.017982224,0.5361537,0.19847144559772545
CBC,2024-06-26,Why a Canadian address showed up on $80M in war-goods shipments to Russia,https://www.cbc.ca/news/canada/toronto/russian-sanctions-canada-equipment-china-1.7246038,negative,0.017784636,0.54773575,0.43447968,-0.29969811122958845
CBC,2024-06-26,WSJ reporter briefly seen in Russian court,https://www.cbc.ca/player/play/video/9.6433166,neutral,0.037456628,0.040486176,0.92205715,-0.00023613157119228845
CBC,2024-06-26,Art fraud investigation reveals fake Norval Morrisseau painting was on display at Winnipeg gallery,https://www.cbc.ca/news/canada/manitoba/norval-morrisseau-wag-fake-painting-1.7246764,negative,0.011310295,0.6727436,0.31594607,-0.45245607350958394
CBC,2024-06-26,Experts raise concerns over potential cyanide spread after Yukon mine failure,https://www.cbc.ca/news/canada/north/experts-worry-of-cyanide-leaching-into-water-after-yukon-mine-failure-1.7246827,negative,0.012316807,0.5412791,0.44640416,-0.2928313041140669
CBC,2024-06-26,How inflation took a bite out of workers' wages as they rose over the past decade,https://www.cbc.ca/news/business/workers-wages-inflation-2023-1.7213736,negative,0.02922562,0.41734362,0.5534308,-0.17332154592759963
CBC,2024-06-26,"Meet Albert Stalk, the 1st Indigenous person to climb the Eiffel Tower",https://www.cbc.cahttps://www.cbc.ca/newsinteractives/features/eiffel-al,positive,0.40371966,0.0042299796,0.5920504,0.16297166205008828
CBC,2024-06-26,"As Israel and Hezbollah inch toward war, Canada braces for a repeat of the 2006 evacuation",https://www.cbc.ca/news/politics/israel-lebanon-hezbollah-hamas-1.7246235,negative,0.010836847,0.5888126,0.40035057,-0.3465828286307442
CBC,2024-06-26,Reviving Indigenous tattooing in Yukon,https://www.cbc.ca/player/play/video/9.6432926,neutral,0.05313603,0.02361174,0.92325217,0.002265925256781376
CBC,2024-06-26,What happens when 50K satellites die? | About That,https://www.cbc.ca/player/play/video/9.6432396,negative,0.011592809,0.5873725,0.40103474,-0.3448720221065926
