source,date,headline,url,chosen_label,positive,negative,neutral,compound
Global,2024-04-16,Saskatchewan tourism sector optimistic about 2024 events,https://globalnews.ca/news/10427560/saskatchewan-tourism-sector-optimistic-2024-events/,positive,0.619122,0.0058449623,0.37503293,0.38327797737208513
Global,2024-04-16,Understanding the carbon tax: What Canadian families need to know about rebates,https://globalnews.ca/video/10402747/understanding-the-carbon-tax-what-canadian-families-need-to-know-about-rebates/,neutral,0.09060892,0.025962425,0.88342875,0.007535921981285387
Global,2024-04-16,Fredericton gears up for busy 2024 construction season,https://globalnews.ca/news/10427507/fredericton-2024-construction-season/,neutral,0.10554538,0.025465077,0.86898947,0.010491362810697069
Global,2024-04-16,Water-filling station begins operating in Township of South Frontenac,https://globalnews.ca/news/10427950/water-filling-station-township-south-frontenac/,neutral,0.09117907,0.01630788,0.892513,0.008047682101602227
Global,2024-04-16,"Go, Canada! The 2024 Olympics uniforms celebrate each province, territory",https://globalnews.ca/news/10426604/2024-olympics-team-canada-uniforms-lululemon/,positive,0.90227354,0.0036749246,0.09405161,0.8140839679510425
Global,2024-04-16,The body of a 14-year-old boy was pulled from Lake Ontario off Woodbine Beach Monday morning,https://globalnews.ca/video/10425427/the-body-of-a-14-year-old-boy-was-pulled-from-lake-ontario-off-woodbine-beach-monday-morning/,negative,0.012407479,0.3291695,0.65842307,-0.10819860301349848
Global,2024-04-16,Molly the magpie reunited with dog best friend after public outcry,https://globalnews.ca/news/10424468/molly-the-magpie-reunited-returned-peggy-dog-australia/,positive,0.26121402,0.027362855,0.71142304,0.06748405829859294
Global,2024-04-16,In-flight food service workers at Toronto Pearson International Airport go on strike,https://globalnews.ca/video/10427049/in-flight-food-service-workers-at-toronto-pearson-international-airport-go-on-strike/,negative,0.021370538,0.60201234,0.37661713,-0.36196215344417126
Global,2024-04-16,Budget 2024 introduces capital gains tax changes that will impact 0.13 per cent of Canadians,https://globalnews.ca/video/10428427/budget-2024-introduces-capital-gains-tax-changes-that-will-impact-0-13-per-cent-of-canadians/,negative,0.02504987,0.5798613,0.3950888,-0.3356116451935023
Global,2024-04-16,Calgary-area veteran plays ‘very exciting’ role in new salute to Canadian soldiers,https://globalnews.ca/video/10428273/calgary-area-veteran-plays-very-exciting-role-in-new-salute-to-canadian-soldiers/,positive,0.9395021,0.0021193884,0.058378402,0.8826598500742475
Global,2024-04-16,TC Energy natural gas pipeline catches fire in Yellowhead County,https://globalnews.ca/video/10427922/tc-energy-natural-gas-pipeline-catches-fire-in-yellowhead-county/,negative,0.013125799,0.54176205,0.44511214,-0.29333385284433966
Global,2024-04-16,Inflation ticked higher in March. Are Bank of Canada rate cuts still in the cards?,https://globalnews.ca/video/10427733/inflation-ticked-higher-in-march-are-bank-of-canada-rate-cuts-still-in-the-cards/,neutral,0.031594433,0.19342618,0.7749793,-0.03641549172075287
Global,2024-04-16,Here’s what to know about changes to capital gains taxes in Budget 2024,https://globalnews.ca/news/10427688/capital-gains-tax-changes-budget-2024/,neutral,0.071942925,0.021722987,0.90633416,0.004703892604101867
Global,2024-04-16,Team Canada’s 2024 Olympics uniforms unveiled,https://globalnews.ca/video/10427444/team-canadas-2024-olympics-uniforms-unveiled/,neutral,0.1557045,0.0066595175,0.83763593,0.02419954820892567
Global,2024-04-16,"Millennials, Gen Z to benefit from housing support in upcoming budget: Anand",https://globalnews.ca/video/10427555/millennials-gen-z-to-benefit-from-housing-support-in-upcoming-budget-anand/,positive,0.63218194,0.004317306,0.36350074,0.39963538815007205
Global,2024-04-16,El Niño looks to be fading. What Canadians can expect in the months to come,https://globalnews.ca/news/10426986/el-nino-over-canada-la-nina-approaches/,negative,0.025168577,0.4172907,0.5575407,-0.1734980728013813
Global,2024-04-16,Flood watch issued along Otonabee River,https://globalnews.ca/video/10428027/flood-watch-issued-along-otonabee-river/,neutral,0.03398087,0.14925522,0.81676394,-0.02112241752148014
Global,2024-04-16,What could this year’s federal budget mean for B.C.?,https://globalnews.ca/video/10427127/federal-budget-tee-up/,neutral,0.038235754,0.028236298,0.93352807,0.0006646831747489923
Global,2024-04-16,‘Body on display’: U.S. Olympians debate skimpy women’s uniform,https://globalnews.ca/news/10423750/olympics-uniform-skimpy-us-womens-2024-track-and-field-kit/,negative,0.046119362,0.2548986,0.6989821,-0.06284628599484066
Global,2024-04-16,"Kingston fire crews tackle residential blaze, no injuries reported",https://globalnews.ca/news/10427900/kingston-fire-crews-residential-blaze-no-injuries/,neutral,0.07784654,0.033508137,0.88864523,0.004937292829243489
Global,2024-04-16,Carbon rebate payments going out to some Canadians. Here’s what to expect,https://globalnews.ca/news/10423653/canada-carbon-rebate-april-15/,neutral,0.055651642,0.014566295,0.929782,0.0028849320275208257
Global,2024-04-16,"Budget 2024: Liberals look to offset drug plan cost with higher smoking, vaping taxes",https://globalnews.ca/news/10427958/budget-2024-smoking-vaping-taxes-national-drug-plan-cost/,neutral,0.06777005,0.12525722,0.8069728,-0.011096588303908028
Global,2024-04-16,New Brunswick officials say province is ready for wildfire season,https://globalnews.ca/news/10428346/new-brunswick-prepare-busy-wildfire-season/,neutral,0.08101101,0.015436176,0.9035529,0.006324503790404279
Global,2024-04-16,"Single-home construction down in Kelowna, but multi-units up: CMHC",https://globalnews.ca/news/10427542/kelowna-march-2024-housing-construction/,neutral,0.042432588,0.031534135,0.92603326,0.0008061230011593423
Global,2024-04-16,"Heavy rain, snow set to hit Saskatchewan: Environment Canada",https://globalnews.ca/news/10428094/heavy-rain-snow-saskatchewan/,negative,0.027862985,0.23428282,0.73785424,-0.05411208547527835
Global,2024-04-16,"After 5 years, Budget 2024 lays out promised small business carbon rebate",https://globalnews.ca/news/10427578/small-business-carbon-rebate-budget/,neutral,0.19920301,0.033644777,0.7671522,0.03854987214659822
Global,2024-04-16,Supply outpaces demand for RVs in Alberta after pandemic surge,https://globalnews.ca/video/10428272/supply-outpaces-demand-for-rvs-in-alberta-after-pandemic-surge/,negative,0.033086866,0.30649552,0.6604175,-0.0928447941247299
Global,2024-04-16,El Niño may be over — what weather could Canadians see in the coming months?,https://globalnews.ca/video/10428280/el-nino-may-be-over-what-weather-could-canadians-see-in-the-coming-months/,neutral,0.08580183,0.040104613,0.8740934,0.005753580947886583
Global,2024-04-16,Molly the magpie finally reunites with dog ‘best friend’ after public outcry,https://globalnews.ca/video/10425912/molly-the-magpie-finally-reunites-with-dog-best-friend-after-public-outcry/,positive,0.3762151,0.015647741,0.60813713,0.14129296068955455
Global,2024-04-16,Guilty pleas heard in beating of mentally ill man on Sask. farm,https://globalnews.ca/news/10427891/guilty-pleas-heard-in-beating-of-mentally-ill-man-on-sask-farm/,negative,0.014204396,0.63786423,0.3479314,-0.406668995465715
Global,2024-04-16,Premier Eby on what B.C. expects to see in 2024 federal budget,https://globalnews.ca/video/10427687/premier-eby-on-what-b-c-expects-to-see-in-2024-federal-budget/,neutral,0.040407486,0.015617216,0.9439752,0.001388869680318816
Global,2024-04-16,"Boy’s body pulled from Lake Ontario after friend, passerby tried to save him",https://globalnews.ca/news/10423646/water-rescue-missing-teen-ashbridges-bay-park/,negative,0.016000982,0.5054676,0.47853148,-0.25524142751979895
CTV,2024-04-16,Quebec's refusal to deliver English presentation to parents raises questions about language law,https://montreal.ctvnews.ca/quebec-s-refusal-to-deliver-english-presentation-to-parents-raises-questions-about-language-law-1.6849670,negative,0.007863077,0.6405274,0.35160962,-0.41021346230672506
CTV,2024-04-16,WATCH: Calif. store owners fight suspect armed with firearm,/video/c2905141-store-owners-go--straight-up-wwe-mode--with-robber,negative,0.01609925,0.3018807,0.6820201,-0.09087274676776147
CTV,2024-04-16,Ottawa barber shop steps away from Parliament Hill marks 100 years in business,https://ottawa.ctvnews.ca/ottawa-barber-shop-steps-away-from-parliament-hill-marks-100-years-in-business-1.6847583,neutral,0.10577094,0.041667677,0.8525614,0.009451294090710327
CTV,2024-04-16,Toronto police lay 54 charges after dramatic arrests in carjacking probe,https://toronto.ctvnews.ca/toronto-police-lay-54-charges-after-dramatic-arrests-in-carjacking-probe-1.6849237,negative,0.017533079,0.44220865,0.5402582,-0.19524110510871395
CTV,2024-04-16,Hazard ahead: Are cuts at Tesla a warning sign for the EV market in Canada?,https://www.ctvnews.ca/autos/hazard-ahead-are-cuts-at-tesla-a-warning-sign-for-the-ev-market-in-canada-1.6848638,neutral,0.02579725,0.20229967,0.7719031,-0.04025965560464595
CTV,2024-04-16,Relocated seal returns to Greater Victoria after 'astonishing' 204-kilometre trek,https://bc.ctvnews.ca/relocated-seal-returns-to-greater-victoria-after-astonishing-204-kilometre-trek-1.6849682,positive,0.24402817,0.012334545,0.74363714,0.0593976394063489
CTV,2024-04-16,"Unifor withdraws Amazon union applications, citing 'suspiciously high' employee data",https://bc.ctvnews.ca/unifor-withdraws-amazon-union-applications-citing-suspiciously-high-employee-data-1.6849788,negative,0.016845133,0.51989347,0.46326143,-0.2700054598400534
CTV,2024-04-16,Quebec court approves class action alleging opioid makers misled users about risks,https://montreal.ctvnews.ca/quebec-court-approves-class-action-alleging-opioid-makers-misled-users-about-risks-1.6849311,negative,0.012922228,0.6011021,0.38597554,-0.36115683727914316
CTV,2024-04-16,B.C. to add 240 complex-care housing units throughout province,https://bc.ctvnews.ca/b-c-to-add-240-complex-care-housing-units-throughout-province-1.6848052,neutral,0.058620326,0.01757784,0.92380184,0.0031273618153790927
CTV,2024-04-16,Some of the winners and losers in the 2024 federal budget,https://www.ctvnews.ca/politics/some-of-the-winners-and-losers-in-the-2024-federal-budget-1.6849585,neutral,0.055956744,0.19955792,0.74448544,-0.03669219240494215
CTV,2024-04-16,Grand River Rocks time in new home is limited,https://kitchener.ctvnews.ca/grand-river-rocks-time-in-new-home-is-limited-1.6849722,neutral,0.053120133,0.03283295,0.914047,0.001743744113446688
CTV,2024-04-16,'I just started crying': Blue Jays player signs jersey for man in hospital,https://toronto.ctvnews.ca/i-just-started-crying-blue-jays-player-signs-jersey-for-man-in-hospital-1.6848930,negative,0.025344772,0.4565476,0.51810765,-0.20779334338881483
CTV,2024-04-16,A painting of Winston Churchill by an artist whose work he hated is up for auction,https://www.ctvnews.ca/entertainment/a-painting-of-winston-churchill-by-an-artist-whose-work-he-hated-is-up-for-auction-1.6849300,negative,0.008756743,0.7881956,0.20304762,-0.6211756505215913
CTV,2024-04-16,Southern Alberta could be alive with the sound of rattlesnakes this weekend: expert,https://calgary.ctvnews.ca/southern-alberta-could-be-alive-with-the-sound-of-rattlesnakes-this-weekend-expert-1.6845454,positive,0.47973314,0.019606246,0.5006608,0.2297594119973816
CTV,2024-04-16,Kingpins or go-betweens? Jurors hear closing arguments in Coutts blockade trial,https://calgary.ctvnews.ca/kingpins-or-go-betweens-jurors-hear-closing-arguments-in-coutts-blockade-trial-1.6848822,neutral,0.030898033,0.028609475,0.9404926,0.00013618617961563828
CTV,2024-04-16,"'Not worth it': London, Ont. driver charged after travelling nearly 200 km/h on Highway 401",https://london.ctvnews.ca/not-worth-it-london-ont-driver-charged-after-travelling-nearly-200-km-h-on-highway-401-1.6849329,negative,0.011685025,0.78035396,0.20796104,-0.608815757154324
CTV,2024-04-16,Ottawa police get $50 million to boost security around Parliamentary Precinct,https://ottawa.ctvnews.ca/ottawa-police-get-50-million-to-boost-security-around-parliamentary-precinct-1.6849600,positive,0.4609508,0.007028675,0.5320205,0.21242624383238784
CTV,2024-04-16,"Pipeline involved in wildland fire, Yellowhead County says",https://edmonton.ctvnews.ca/pipeline-involved-in-wildland-fire-yellowhead-county-says-1.6849560,negative,0.018059846,0.22626977,0.75567037,-0.0508718522471705
CTV,2024-04-16,Sask. real estate company that lost investors' millions reaches settlement,https://saskatoon.ctvnews.ca/sask-real-estate-company-that-lost-investors-millions-reaches-settlement-1.6849328,negative,0.023650581,0.49730873,0.47904065,-0.24675663787685487
CTV,2024-04-16,"Outdated cancer screening guidelines jeopardizing early detection, doctors say",https://www.ctvnews.ca/health/outdated-cancer-screening-guidelines-jeopardizing-early-detection-doctors-say-1.6849248,negative,0.0067347474,0.8141989,0.17906636,-0.6628745104108482
CTV,2024-04-16,"B.C. court upholds conviction after man argues crowds, claustrophobia led to fatal Costco encounter",https://bc.ctvnews.ca/b-c-court-upholds-conviction-after-man-argues-crowds-claustrophobia-led-to-fatal-costco-encounter-1.6849546,negative,0.010943341,0.69539356,0.29366314,-0.48345240873663187
CTV,2024-04-16,"Doorbell video shows family of black bears scared off by dog in Sudbury, Ont.",https://northernontario.ctvnews.ca/doorbell-video-shows-family-of-black-bears-scared-off-by-dog-in-sudbury-ont-1.6843086,negative,0.013234726,0.46637654,0.5203887,-0.21733192170442805
CTV,2024-04-16,Developer subsidizing residents' transit use at Vancouver rental building,https://bc.ctvnews.ca/developer-subsidizing-residents-transit-use-at-vancouver-rental-building-1.6849775,neutral,0.03031735,0.10843886,0.86124384,-0.010839839826247477
CTV,2024-04-16,"Canada's health-care crisis was 'decades in the making,' says CMA",https://www.ctvnews.ca/health/canada-s-health-care-crisis-was-decades-in-the-making-says-cma-1.6849408,negative,0.020372167,0.46145067,0.5181772,-0.2125216652313533
CTV,2024-04-16,Casino Rama adds new shows to its 2024 performance lineup,https://barrie.ctvnews.ca/casino-rama-adds-new-shows-to-its-2024-performance-lineup-1.6848973,neutral,0.17349,0.0040293117,0.8224807,0.03008254564555557
CTV,2024-04-16,"From housing initiatives to a disability benefit, how the federal budget impacts you",https://www.ctvnews.ca/politics/from-housing-initiatives-to-a-disability-benefit-how-the-federal-budget-impacts-you-1.6849339,neutral,0.114983,0.022285877,0.8627311,0.01272443194145989
CTV,2024-04-16,Liberals to dole out five years worth of carbon rebates to businesses,https://www.ctvnews.ca/climate-and-environment/liberals-to-dole-out-five-years-worth-of-carbon-rebates-to-businesses-1.6849603,neutral,0.061518937,0.11348035,0.8250009,-0.009093201702598641
CTV,2024-04-16,Escaped N.B. inmate with violent past back behind bars,/video/c2905232-ctv-national-news--n-b--inmate-escapes,negative,0.011722958,0.48347077,0.50480616,-0.23360661188579712
CTV,2024-04-16,Landlord group to appeal court decision over residential rental bylaw,https://windsor.ctvnews.ca/landlord-group-to-appeal-court-decision-over-residential-rental-bylaw-1.6849684,neutral,0.026579196,0.12931451,0.8441064,-0.016015781056193834
CTV,2024-04-16,Your morning coffee may be hundreds of thousands of years old,https://www.ctvnews.ca/lifestyle/your-morning-coffee-may-be-hundreds-of-thousands-of-years-old-1.6847451,neutral,0.09268102,0.14112526,0.7661938,-0.011326563621635088
CTV,2024-04-16,Protest averted as Newfoundland and Labrador premier helps reach pricing deal on crab,https://www.ctvnews.ca/canada/protest-averted-as-newfoundland-and-labrador-premier-helps-reach-pricing-deal-on-crab-1.6847410,neutral,0.05586653,0.072778,0.8713554,-0.002175569452238957
CTV,2024-04-16,Annual inflation rate increased to 2.9% in March,https://www.ctvnews.ca/business/annual-inflation-rate-increased-to-2-9-in-march-1.6848687,neutral,0.043037962,0.21730962,0.7396523,-0.04537122952757322
CTV,2024-04-16,A 9-year-old boy's dream of a pet octopus is a sensation as thousands follow Terrance's story online,https://www.ctvnews.ca/lifestyle/a-9-year-old-boy-s-dream-of-a-pet-octopus-is-a-sensation-as-thousands-follow-terrance-s-story-online-1.6848789,positive,0.47241598,0.012010069,0.515574,0.22303260618606657
CTV,2024-04-16,Toronto woman has close encounter with coyote near Ontario Place,https://toronto.ctvnews.ca/toronto-woman-has-close-encounter-with-coyote-near-ontario-place-1.6849714,negative,0.02124558,0.24484922,0.73390514,-0.05949977898748493
CTV,2024-04-16,Full coverage from the 2024 federal budget,/video/c2905345-full-coverage--ottawa-unveils-federal-budget?playlistId=1.6735503,positive,0.25745675,0.0068313316,0.73571175,0.06623735586237345
CTV,2024-04-16,Mussolini's wartime bunker opens to the public in Rome,https://www.ctvnews.ca/world/mussolini-s-wartime-bunker-opens-to-the-public-in-rome-1.6849286,neutral,0.042912673,0.059110045,0.89797735,-0.0016524988030273136
CTV,2024-04-16,A fish harvester's protest threatens Newfoundland and Labrador's crab season -- again,https://www.ctvnews.ca/canada/a-fish-harvester-s-protest-threatens-newfoundland-and-labrador-s-crab-season-again-1.6842151,negative,0.007648409,0.8247899,0.16756181,-0.680219765579241
CTV,2024-04-16,"Participant, studio behind 'Spotlight,' 'An Inconvenient Truth,' shutters after 20 years",https://www.ctvnews.ca/entertainment/participant-studio-behind-spotlight-an-inconvenient-truth-shutters-after-20-years-1.6849550,neutral,0.051369827,0.12349506,0.8251352,-0.012612165326588709
CTV,2024-04-16,Lethbridge police team up with campaign to urge drivers to slow down,https://calgary.ctvnews.ca/lethbridge-police-team-up-with-campaign-to-urge-drivers-to-slow-down-1.6844953,neutral,0.029846946,0.19386092,0.776292,-0.036691232239884464
CTV,2024-04-16,'It was a special game': Edmonton pinball player celebrates high score and shout out from game designer,https://edmonton.ctvnews.ca/it-was-a-special-game-edmonton-pinball-player-celebrates-high-score-and-shout-out-from-game-designer-1.6848067,positive,0.97551143,0.0016165567,0.022871876,0.9516200907357292
CTV,2024-04-16,First 7 jurors are chosen for Trump's hush money criminal trial; 11 more still needed,https://www.ctvnews.ca/world/first-7-jurors-are-chosen-for-trump-s-hush-money-criminal-trial-11-more-still-needed-1.6848784,neutral,0.04210385,0.060698897,0.8971973,-0.0019116209540892548
CTV,2024-04-16,Liberals aim to hit the brakes on car theft with new criminal offences,https://www.ctvnews.ca/politics/liberals-aim-to-hit-the-brakes-on-car-theft-with-new-criminal-offences-1.6849626,negative,0.023393575,0.56969535,0.40691113,-0.32400550406471496
CTV,2024-04-16,Calgary police catch driver travelling more than 100 km/h over the speed limit,https://calgary.ctvnews.ca/calgary-police-catch-driver-travelling-more-than-100-km-h-over-the-speed-limit-1.6849351,negative,0.03790661,0.38566634,0.576427,-0.14730163538501984
CTV,2024-04-16,Teen hockey players arrested for sexual assault following hazing incident: Manitoba RCMP,https://winnipeg.ctvnews.ca/teen-hockey-players-arrested-for-sexual-assault-following-hazing-incident-manitoba-rcmp-1.6849360,negative,0.006629342,0.7531918,0.24017875,-0.5672540382331803
CTV,2024-04-16,"Grocery inflation slows in March, but price growth at restaurants remains strong",https://www.ctvnews.ca/canada/grocery-inflation-slows-in-march-but-price-growth-at-restaurants-remains-strong-1.6848978,neutral,0.15562065,0.0870744,0.75730497,0.016635834555748907
CTV,2024-04-16,Phillips calls for funding to be reinstated to Lethbridge Elder Abuse Response Network,https://calgary.ctvnews.ca/phillips-calls-for-funding-to-be-reinstated-to-lethbridge-elder-abuse-response-network-1.6845500,neutral,0.115268975,0.015718598,0.8690125,0.013039858058297327
CTV,2024-04-16,Sault College success spurs the growth of girls hockey,https://northernontario.ctvnews.ca/sault-college-success-spurs-the-growth-of-girls-hockey-1.6849902,positive,0.8966473,0.0035646847,0.099788144,0.8039635615471497
CTV,2024-04-16,"General Motors to move Detroit HQ to new downtown building, plans to redevelop Renaissance Center",https://windsor.ctvnews.ca/general-motors-to-move-detroit-hq-to-new-downtown-building-plans-to-redevelop-renaissance-center-1.6848564,neutral,0.11522001,0.0066430056,0.878137,0.01323152044845255
CTV,2024-04-16,Ontario asks feds to close loophole that’s led to 'disturbing' rise in pay for care clinics,https://toronto.ctvnews.ca/ontario-asks-feds-to-close-loophole-that-s-led-to-disturbing-rise-in-pay-for-care-clinics-1.6849875,negative,0.012721165,0.51627225,0.4710066,-0.2663751894038757
CTV,2024-04-16,"Fatal crash on Highway 401 claims 1 life, eastbound lanes closed",https://london.ctvnews.ca/fatal-crash-on-highway-401-claims-1-life-eastbound-lanes-closed-1.6849569,negative,0.010516895,0.7917408,0.19774225,-0.6267429200102121
CTV,2024-04-16,'It’s pretty messed up': Vaping and vandalism continue to impact high school students and staff across the region,https://london.ctvnews.ca/it-s-pretty-messed-up-vaping-and-vandalism-continue-to-impact-high-school-students-and-staff-across-the-region-1.6849591,negative,0.0042424877,0.92806,0.067697465,-0.8612774110720736
CTV,2024-04-16,500 Newfoundlanders wound up on the same cruise and it turned into a rocking kitchen party,https://www.ctvnews.ca/canada/500-newfoundlanders-wound-up-on-the-same-cruise-and-it-turned-into-a-rocking-kitchen-party-1.6849631,positive,0.4604207,0.013571196,0.5260082,0.2118030015843484
CTV,2024-04-16,Police to announce arrests in Toronto Pearson airport gold heist,https://toronto.ctvnews.ca/police-to-announce-arrests-in-toronto-pearson-airport-gold-heist-1.6849426,neutral,0.025384104,0.11375531,0.8608606,-0.01229591729470414
CTV,2024-04-16,"New funding for NAC, no cash for OC Transpo in federal budget",https://ottawa.ctvnews.ca/new-funding-for-nac-no-cash-for-oc-transpo-in-federal-budget-1.6849669,negative,0.0391372,0.2502408,0.71062195,-0.0610887484191327
CTV,2024-04-16,"2 men injured after 'road rage' incident with Dodge Ram driver, Kelowna RCMP say",https://bc.ctvnews.ca/2-men-injured-after-road-rage-incident-with-dodge-ram-driver-kelowna-rcmp-say-1.6830790,negative,0.0069282767,0.69293135,0.30014032,-0.48010590145158716
CTV,2024-04-16,Northern Ont. driver missing after vehicle pulled into creek,https://northernontario.ctvnews.ca/northern-ont-driver-missing-after-vehicle-pulled-into-creek-1.6848801,negative,0.011169112,0.4614929,0.52733785,-0.21285101131213402
CTV,2024-04-16,"Budget 2024 prioritizes housing while taxing highest earners, deficit projected at $39.8B",https://www.ctvnews.ca/politics/budget-2024-prioritizes-housing-while-taxing-highest-earners-deficit-projected-at-39-8b-1.6848420,neutral,0.13257854,0.098065116,0.7693564,0.007960298729221993
CTV,2024-04-16,Inmate who escaped from N.B. prison has long history of violent crimes,https://atlantic.ctvnews.ca/inmate-who-escaped-from-n-b-prison-has-long-history-of-violent-crimes-1.6848882,negative,0.0082322415,0.7545991,0.23716868,-0.5693520124257336
CTV,2024-04-16,Proposed class-action lawsuit against Shoppers Drug Mart alleges 'unsafe and unethical corporate practices',https://toronto.ctvnews.ca/proposed-class-action-lawsuit-against-shoppers-drug-mart-alleges-unsafe-and-unethical-corporate-practices-1.6849507,negative,0.009572773,0.76754904,0.22287822,-0.5890398881976466
CTV,2024-04-16,Australia's leader says French worker who intervened in stabbing attack can stay as long as he likes,https://www.ctvnews.ca/world/australia-s-leader-says-french-worker-who-intervened-in-stabbing-attack-can-stay-as-long-as-he-likes-1.6848820,neutral,0.056902193,0.054430377,0.88866735,0.0002751938149794242
CTV,2024-04-16,"Feds cutting 5,000 public service jobs, looking to turn underused buildings into housing",https://ottawa.ctvnews.ca/feds-cutting-5-000-public-service-jobs-looking-to-turn-underused-buildings-into-housing-1.6849582,negative,0.012985999,0.6882209,0.29879314,-0.47347935566235577
CTV,2024-04-16,Deer family appears to accept B.C. man as one of their own,https://bc.ctvnews.ca/deer-family-appears-to-accept-b-c-man-as-one-of-their-own-1.6843307,neutral,0.119629174,0.014213014,0.8661578,0.014109128141496008
CTV,2024-04-16,Edmonton Zone health staff sound alarm over capacity for babies in intensive care,https://edmonton.ctvnews.ca/edmonton-zone-health-staff-sound-alarm-over-capacity-for-babies-in-intensive-care-1.6849808,negative,0.02249342,0.32825077,0.6492558,-0.1072426112139162
CTV,2024-04-16,4 people charged in connection with N.S. man’s 2022 death,https://atlantic.ctvnews.ca/4-people-charged-in-connection-with-n-s-man-s-2022-death-1.6849033,negative,0.0075671067,0.6461786,0.34625435,-0.41748948801489405
CTV,2024-04-16,'How much time do we have?': 'Contamination' in Prairie groundwater identified,https://calgary.ctvnews.ca/how-much-time-do-we-have-contamination-in-prairie-groundwater-identified-1.6847525,neutral,0.0105585605,0.11642561,0.8730158,-0.013443440504194992
CTV,2024-04-16,Federal budget: Here are the key spending priorities,/video/c2905229-federal-budget--breaking-down-the-numbers?playlistId=1.6848861,neutral,0.13642302,0.015049361,0.8485275,0.018384772926100634
CTV,2024-04-16,"Evacuation of Kelowna, B.C., apartment near construction site extended for two weeks",https://bc.ctvnews.ca/evacuation-of-kelowna-b-c-apartment-near-construction-site-extended-for-two-weeks-1.6836568,negative,0.010701711,0.3426924,0.64660597,-0.11732352802822277
