source,date,headline,url,chosen_label,positive,negative,neutral,compound
Global,2024-05-03,Neighbourhood Starbucks closure in Winnipeg raises alarms about local crime,https://globalnews.ca/news/10467445/starbucks-closure-osborne-village-winnipeg-crime/,negative,0.011844415,0.61032766,0.37782788,-0.3723595997692115
Global,2024-05-03,Some 2019 candidates ‘appeared willing’ to engage with foreign interference: Hogue inquiry,https://globalnews.ca/news/10468617/candidates-appeared-willing-foreign-interference/,neutral,0.049409118,0.044535108,0.9060558,0.00045788489701026336
Global,2024-05-03,"London Drugs remains closed, says it is reviewing billions of lines of data",https://globalnews.ca/news/10466249/london-drugs-data-review-cybersecurity/,neutral,0.023377206,0.22302097,0.75360173,-0.04919187733286101
Global,2024-05-03,North Okanagan senior reported missing after leaving Enderby home: Vernon RCMP,https://globalnews.ca/news/10468239/north-okanagan-missing-senior-enderby/,neutral,0.017015178,0.11663974,0.8663451,-0.013315309755845384
Global,2024-05-03,Pam Lovelace announces candidacy for Halifax mayor,https://globalnews.ca/video/10468723/pam-lovelace-announces-candidacy-for-halifax-mayor/,neutral,0.13982704,0.0049239444,0.8552491,0.019527344659751478
Global,2024-05-03,Hardeep Singh Nijjar killing: RCMP make arrests in B.C. Sikh leader murder case,https://globalnews.ca/video/10468103/hardeep-singh-nijjar-killing-rcmp-make-arrests-in-b-c-sikh-leader-murder-case/,negative,0.014775152,0.41297662,0.57224816,-0.17033140926983492
Global,2024-05-03,Search to resume for missing senior in Dee Lake area,https://globalnews.ca/news/10468573/missing-senior-dee-lake-search-resumes/,neutral,0.031648804,0.10913286,0.85921824,-0.010908341842112534
Global,2024-05-03,"Global News Montreal at 5:30: May 3, 2024",https://globalnews.ca/video/10468985/global-news-montreal-at-530-may-3-2024/,neutral,0.03871041,0.010106613,0.95118296,0.0013963527893592342
Global,2024-05-03,"Majority of Canadian youth see the dentist, but lack of insurance creates barriers",https://globalnews.ca/video/10431034/majority-of-canadian-youth-see-the-dentist-but-lack-of-insurance-creates-barriers/,negative,0.048680764,0.35274118,0.59857804,-0.12205653476944356
Global,2024-05-03,Highway 115 bridge dedicated in honour of Peterborough OPP officer who died in line of duty,https://globalnews.ca/video/10468856/highway-115-bridge-dedicated-in-honour-of-opp-officer-who-died-in-uniform/,neutral,0.14586996,0.20311147,0.6510186,-0.019976222688960377
Global,2024-05-03,‘I will never go back’: Ontario family doctor says new AI notetaking saved her job,https://globalnews.ca/news/10463535/ontario-family-doctor-artificial-intelligence-notes/,positive,0.42602468,0.058163725,0.51581156,0.17811401523266213
Global,2024-05-03,Pro-Palestinian encampment on McGill University campus enters seventh day,https://globalnews.ca/video/10468882/pro-palestinian-encampment-on-mcgill-universtiy-campus-enters-seventh-day/,negative,0.010121905,0.7133004,0.27657774,-0.5086949970797399
Global,2024-05-03,"2nd Boeing safety whistleblower dies, lawyers say death is ‘loss to aviation community’",https://globalnews.ca/video/10468759/2nd-boeing-safety-whistleblower-dies-lawyers-say-death-is-loss-to-aviation-community/,negative,0.007449775,0.7951565,0.19739379,-0.6322183154525849
Global,2024-05-03,"Arrest made in Kindersley, Sask., sexual assault investigation",https://globalnews.ca/news/10468707/arrest-kindersley-sask-sexual-assault-investigation/,negative,0.018973019,0.32319006,0.657837,-0.10409182325277655
Global,2024-05-03,"Toddler, 2, dies after bouncy castle carried away by strong wind",https://globalnews.ca/news/10464584/bouncy-castle-child-dead-airborne-wind/,negative,0.02460002,0.67903924,0.29636067,-0.46048916688268093
Global,2024-05-03,Quebec woman wonders why she’s being asked to pay thousands for cancer medication,https://globalnews.ca/video/10468880/quebec-woman-wonders-why-shes-being-asked-to-pay-thousands-for-cancer-medication/,negative,0.0080389045,0.7387334,0.2532277,-0.5456624287177192
Global,2024-05-03,Regina’s downtown district aims to enhance vibrancy with new initiatives,https://globalnews.ca/news/10468721/regina-downtown-district-looking-to-enhance-vibrancy/,positive,0.68092656,0.0039871,0.31508628,0.4636451457243851
Global,2024-05-03,N.B. community food hub aims for zero food waste,https://globalnews.ca/video/10468732/n-b-community-food-hub-aims-for-zero-food-waste/,positive,0.30135006,0.016963994,0.6816859,0.09052408849738924
Global,2024-05-03,Bird flu: Experts urge more surveillance in Canada — before it’s too late,https://globalnews.ca/news/10468249/bird-flu-surveillance-canada/,neutral,0.044598673,0.20049441,0.75490695,-0.03820896197685464
Global,2024-05-03,N.B. education minister wants to dissolve Anglophone East District Education Council,https://globalnews.ca/video/10468733/n-b-education-minister-wants-to-dissolve-anglophone-east-district-education-council/,negative,0.011631241,0.5400225,0.44834623,-0.2914890220692108
Global,2024-05-03,RCMP arrests alleged hitmen accused of killing B.C. Sikh leader,https://globalnews.ca/news/10459504/hardeep-nijjar-arrests-rcmp/,negative,0.007886562,0.72971404,0.26239952,-0.5324202684776846
Global,2024-05-03,Quebec judge worries French language law could cause delays in English language trials,https://globalnews.ca/video/10468878/quebec-judge-worries-french-language-law-could-cause-delays-in-english-language-trials/,negative,0.009510414,0.6109159,0.3795736,-0.37312784209051486
Global,2024-05-03,Canada’s dental plan has officially kicked in. Who is eligible?,https://globalnews.ca/news/10464461/canada-dental-plan-who-is-eligable/,positive,0.32639623,0.008112298,0.6654914,0.10646870629896199
Global,2024-05-03,Global News at 6 New Brunswick: May 3,https://globalnews.ca/video/10468798/global-news-at-6-new-brunswick-may-3-8/,neutral,0.031760648,0.017620446,0.950619,0.0006982575518219569
Global,2024-05-03,"As Loblaw boycott begins, what to know about all the company’s brands",https://globalnews.ca/news/10459526/loblaw-boycott-brands-subsidiaries/,negative,0.040433545,0.46839866,0.4911677,-0.21776247090961398
Global,2024-05-03,Calls for a homeless shelter in Côte-des-Neiges-Notre-Dame-de-Grâce,https://globalnews.ca/video/10468886/calls-for-a-homeless-shelter-in-cote-des-neiges-notre-dame-de-grace/,neutral,0.043751065,0.027638717,0.92860997,0.0011502610563181026
Global,2024-05-03,"Boeing 737 Max whistleblower Joshua Dean, 45, dead after sudden illness",https://globalnews.ca/news/10465319/boeing-whistleblower-joshua-dean-dead-737-max/,negative,0.014138983,0.5430291,0.442832,-0.29468066121762604
Global,2024-05-03,Boycott Loblaw month begins in Canada,https://globalnews.ca/video/10464020/boycott-loblaw-month-begins-in-canada/,negative,0.013053701,0.86489594,0.1220503,-0.7478746253282038
Global,2024-05-03,N.B. delays forced addiction treatment bill,https://globalnews.ca/video/10468726/n-b-delays-forced-addiction-treatment-bill/,negative,0.0078093456,0.700426,0.29176453,-0.4905356743282514
Global,2024-05-03,"Winnipeg committee upholds motion not to demolish home, gateway to Lemay Forest development",https://globalnews.ca/news/10468905/winnipeg-appeal-development-lemay-forest/,negative,0.02104377,0.2395206,0.7394357,-0.05692726872493381
Global,2024-05-03,Mayor initiates Kelowna political shakeup to ‘broaden perspectives’,https://globalnews.ca/news/10468122/mayor-initiates-kelowna-political-shakeup/,neutral,0.13658434,0.009233831,0.8541818,0.018570018690059698
Global,2024-05-03,"Foreign interference a ‘stain on the electoral process,’ inquiry finds",https://globalnews.ca/video/10468768/foreign-interference-a-stain-on-the-electoral-process-inquiry-finds/,negative,0.009440139,0.6024851,0.38807485,-0.36289915121451344
Global,2024-05-03,2 men arrested after ‘concerning’ amount of explosives found: Winnipeg police,https://globalnews.ca/news/10468680/winnipeg-explosives-found/,negative,0.009394551,0.4909098,0.49969554,-0.24090423166398267
CTV,2024-05-03,‘Fire your lobbyists’: Poilievre’s memo to corporate Canada,/video/c2915912-power-play--corporate-lobbyists-under-fire,neutral,0.0445429,0.15146807,0.803989,-0.020958509667460046
CTV,2024-05-03,Man arrested after body found 3 months after apartment fire,https://edmonton.ctvnews.ca/man-arrested-after-body-found-3-months-after-apartment-fire-1.6872879,negative,0.018357975,0.38213393,0.599508,-0.14568936974465885
CTV,2024-05-03,"Northern Ont. suspect charged with corrupting children, drug trafficking, weapons offences",https://northernontario.ctvnews.ca/northern-ont-suspect-charged-with-corrupting-children-drug-trafficking-weapons-offences-1.6873060,negative,0.008732634,0.7679152,0.22335209,-0.5896175584967178
CTV,2024-05-03,Nighttime LRT construction derails east-end residents' sleep,https://ottawa.ctvnews.ca/nighttime-lrt-construction-derails-east-end-residents-sleep-1.6873045,negative,0.01623273,0.6099397,0.3738276,-0.37176291162710484
CTV,2024-05-03,Fears in northern Ont. as cuts to homeless funding would affect front-line workers,https://northernontario.ctvnews.ca/fears-in-northern-ont-as-cuts-to-homeless-funding-would-affect-front-line-workers-1.6871963,negative,0.014397581,0.64776295,0.33783948,-0.41938955510076426
CTV,2024-05-03,"Foreign interference may have changed 2021 result in one B.C. riding, inquiry finds",https://bc.ctvnews.ca/foreign-interference-may-have-changed-2021-result-in-one-b-c-riding-inquiry-finds-1.6872614,negative,0.010713358,0.37330723,0.6159794,-0.13924352108124616
CTV,2024-05-03,Funeral today for broadcasting legend and voice of 'Hockey Night in Canada' Bob Cole,https://www.ctvnews.ca/sports/funeral-today-for-broadcasting-legend-and-voice-of-hockey-night-in-canada-bob-cole-1.6872458,positive,0.46374127,0.007833897,0.528425,0.21499453009977998
CTV,2024-05-03,Pro-Palestinian encampment remains at University of Toronto despite safety concerns,https://toronto.ctvnews.ca/pro-palestinian-encampment-remains-at-university-of-toronto-despite-safety-concerns-1.6872464,negative,0.009306657,0.5327812,0.45791218,-0.28376916003268526
CTV,2024-05-03,"Deflated for now, Saskatoon's Golf Dome is about to get a makeover",https://saskatoon.ctvnews.ca/deflated-for-now-saskatoon-s-golf-dome-is-about-to-get-a-makeover-1.6872434,neutral,0.085732125,0.12178486,0.792483,-0.007481556135115142
CTV,2024-05-03,Lethbridge football player Tanner McLachlan drafted by the NFL’s Cincinnati Bengals,https://calgary.ctvnews.ca/lethbridge-football-player-tanner-mclachlan-drafted-by-the-nfl-s-cincinnati-bengals-1.6871528,neutral,0.0596857,0.006596117,0.93371826,0.0035188696152261834
CTV,2024-05-03,B.C. breweries take home awards at World Beer Cup,https://bc.ctvnews.ca/b-c-breweries-take-home-awards-at-world-beer-cup-1.6864834,positive,0.36876705,0.0067499676,0.624483,0.13594357736604223
CTV,2024-05-03,Southern Brazil has been hit by the worst floods in 80 years. At least 37 people have died,https://www.ctvnews.ca/climate-and-environment/southern-brazil-has-been-hit-by-the-worst-floods-in-80-years-at-least-37-people-have-died-1.6872780,negative,0.0057523437,0.93398654,0.0602613,-0.8722976172018884
CTV,2024-05-03,Nanaimo family seeks transfer due to concerns about quality of care at long-term facility,https://bc.ctvnews.ca/nanaimo-family-seeks-transfer-due-to-concerns-about-quality-of-care-at-long-term-facility-1.6872443,negative,0.018168176,0.46149233,0.5203395,-0.2126450876899355
CTV,2024-05-03,"Quebec police officer anonymously donates kidney, changes schoolteacher's life",https://montreal.ctvnews.ca/quebec-police-officer-anonymously-donates-kidney-changes-schoolteacher-s-life-1.6866270,positive,0.24231371,0.026474476,0.7312117,0.0580150568534723
CTV,2024-05-03,Spain abolishes national bullfighting award in cultural shift,https://www.ctvnews.ca/world/spain-abolishes-national-bullfighting-award-in-cultural-shift-1.6873024,negative,0.021844544,0.42059445,0.55756104,-0.17642249893750162
CTV,2024-05-03,"Human remains found in rural Sask. possibly a decade old, RCMP say",https://regina.ctvnews.ca/human-remains-found-in-rural-sask-possibly-a-decade-old-rcmp-say-1.6873043,neutral,0.017401615,0.15449786,0.8281006,-0.023566758615158
CTV,2024-05-03,April auto sales jump 14 per cent; still below pre-pandemic levels: DesRosiers,https://www.ctvnews.ca/business/april-auto-sales-jump-14-per-cent-still-below-pre-pandemic-levels-desrosiers-1.6871041,neutral,0.17361794,0.04560247,0.7807796,0.02806360328520796
CTV,2024-05-03,Meet Saskatoon’s new Chief of Police,https://saskatoon.ctvnews.ca/meet-saskatoon-s-new-chief-of-police-1.6872964,neutral,0.07979406,0.0077213673,0.91248447,0.006307480071848115
CTV,2024-05-03,Benzene levels 424 times acceptable levels: Aamjiwnaang First Nation,https://london.ctvnews.ca/benzene-levels-424-times-acceptable-levels-aamjiwnaang-first-nation-1.6872831,positive,0.37262675,0.014644275,0.6127289,0.13863627355726926
CTV,2024-05-03,WATCH: Cop sent flying during vehicle theft in Toronto,/video/c2915717-cop-hit-by-fleeing-vehicle-in-new-video,negative,0.015087607,0.5325506,0.45236185,-0.2833824619425158
CTV,2024-05-03,Premier Legault reiterates that McGill pro-Palestinian camp must be dismantled,https://montreal.ctvnews.ca/premier-legault-reiterates-that-mcgill-pro-palestinian-camp-must-be-dismantled-1.6872771,negative,0.014431262,0.48160782,0.50396097,-0.23173780733993965
CTV,2024-05-03,"Brantford, Ont. woman, charged again with falsely soliciting pregnancy support, back in court",https://kitchener.ctvnews.ca/brantford-ont-woman-charged-again-with-falsely-soliciting-pregnancy-support-back-in-court-1.6872750,negative,0.013623078,0.5819149,0.4044619,-0.338439449810517
CTV,2024-05-03,"New weight-loss drug Wegovy not a 'magic bullet,' doctor warns",https://www.ctvnews.ca/health/new-weight-loss-drug-wegovy-not-a-magic-bullet-doctor-warns-1.6872714,neutral,0.060900893,0.20233628,0.7367628,-0.037231051597089504
CTV,2024-05-03,Police officer hit by driver of fleeing vehicle in Toronto,https://toronto.ctvnews.ca/police-officer-hit-by-driver-of-fleeing-vehicle-in-toronto-1.6872625,negative,0.013703592,0.37731862,0.6089778,-0.1421815532803521
CTV,2024-05-03,Canada's oldest hat store still going strong after 90 years,https://montreal.ctvnews.ca/canada-s-oldest-hat-store-still-going-strong-after-90-years-1.6865539,positive,0.6278818,0.010075634,0.3620426,0.3941340310089885
CTV,2024-05-03,"Kitchener family says their 10-year-old needs life-saving drug that cost $600,000",https://kitchener.ctvnews.ca/kitchener-family-says-their-10-year-old-needs-life-saving-drug-that-cost-600-000-1.6863760,negative,0.05070122,0.5366683,0.41263047,-0.2854422500986322
CTV,2024-05-03,Ontario to increase fines for 'bad actor' employers,https://toronto.ctvnews.ca/ontario-to-increase-fines-for-bad-actor-employers-1.6871911,negative,0.012207788,0.5593355,0.42845678,-0.31270710508201205
CTV,2024-05-03,Foreign meddling 'did not affect' overall federal election results: inquiry report,https://www.ctvnews.ca/politics/foreign-meddling-did-not-affect-overall-federal-election-results-inquiry-report-1.6871941,neutral,0.029401733,0.15138946,0.8192087,-0.022054322585196573
CTV,2024-05-03,Orangutan seen treating wound using medicinal plant,/video/c2915874-ctv-national-news--orangutan-stuns-scientists,neutral,0.06504445,0.09262723,0.8423283,-0.004349023462520307
CTV,2024-05-03,"An anchovy feast draws a crush of sea lions to one of San Francisco's piers, the most in 15 years",https://www.ctvnews.ca/world/an-anchovy-feast-draws-a-crush-of-sea-lions-to-one-of-san-francisco-s-piers-the-most-in-15-years-1.6872693,positive,0.27631283,0.015226213,0.70846087,0.07611696466866213
CTV,2024-05-03,"Hope Hicks, ex-Trump adviser, recounts fear in 2016 campaign over impact of 'Access Hollywood' tape",https://www.ctvnews.ca/world/hope-hicks-ex-trump-adviser-recounts-fear-in-2016-campaign-over-impact-of-access-hollywood-tape-1.6872176,negative,0.01642139,0.3466948,0.63688374,-0.11992765034378294
CTV,2024-05-03,"Chemical spill could be cause of stinky water in Puslinch, Ont., new report says",https://kitchener.ctvnews.ca/chemical-spill-could-be-cause-of-stinky-water-in-puslinch-ont-new-report-says-1.6873027,negative,0.010903609,0.43778712,0.55130935,-0.1915386446933809
CTV,2024-05-03,Chi-Cheemaun kicks off 50th season on the Georgian Bay,https://northernontario.ctvnews.ca/chi-cheemaun-kicks-off-50th-season-on-the-georgian-bay-1.6872345,neutral,0.122525156,0.009899665,0.86757517,0.01491441213257616
CTV,2024-05-03,Two Ontario nurses help deliver baby during a flight to Dubai,https://ottawa.ctvnews.ca/two-ontario-nurses-help-deliver-baby-during-a-flight-to-dubai-1.6872492,neutral,0.08997386,0.0154653285,0.89456093,0.007856110182162368
CTV,2024-05-03,"Gatineau, Que. elementary students get hands-on experience in skilled trades",https://ottawa.ctvnews.ca/gatineau-que-elementary-students-get-hands-on-experience-in-skilled-trades-1.6873000,neutral,0.19216608,0.009826289,0.7980076,0.036831249928965804
CTV,2024-05-03,Two baby bald eagles born in Toronto,https://toronto.ctvnews.ca/two-baby-bald-eagles-born-in-toronto-1.6872868,neutral,0.107839026,0.2099886,0.6821725,-0.03246594430622052
CTV,2024-05-03,"Sask. Party raises $3.6M, leads in donations ahead of looming election call",https://regina.ctvnews.ca/sask-party-raises-3-6m-leads-in-donations-ahead-of-looming-election-call-1.6872784,positive,0.41153044,0.005021558,0.5834481,0.16933203435537436
CTV,2024-05-03,Alberta impaired driving victims applaud Mandatory Alcohol Screening in Ontario,https://calgary.ctvnews.ca/alberta-impaired-driving-victims-applaud-mandatory-alcohol-screening-in-ontario-1.6873120,neutral,0.06502164,0.13548747,0.7994908,-0.01412904563272388
CTV,2024-05-03,Oilers wait on next opponent before extensively preparing for Round 2,https://edmonton.ctvnews.ca/oilers-wait-on-next-opponent-before-extensively-preparing-for-round-2-1.6873053,neutral,0.03288112,0.037935704,0.9291832,-0.00035794965535407286
CTV,2024-05-03,Okotoks resident charged in shooting of 53-year-old man,https://calgary.ctvnews.ca/okotoks-resident-charged-in-shooting-of-53-year-old-man-1.6872504,negative,0.012380128,0.62568176,0.36193818,-0.3913243581979984
CTV,2024-05-03,Woman charged in connection with fatal crash,https://calgary.ctvnews.ca/woman-charged-in-connection-with-fatal-crash-1.6872683,negative,0.009112834,0.76037645,0.23051086,-0.5780891951771707
CTV,2024-05-03,Officers seize 28kg of elvers at N.S. holding facility,https://atlantic.ctvnews.ca/more/officers-seize-28kg-of-elvers-at-n-s-holding-facility-1.6872698,negative,0.013820815,0.28921732,0.6969618,-0.08345565290906087
CTV,2024-05-03,Scientists identify 'degrees of Kevin Bacon' gene,https://www.ctvnews.ca/sci-tech/scientists-identify-degrees-of-kevin-bacon-gene-1.6871989,neutral,0.064452186,0.03137783,0.90416986,0.0031695203074977307
CTV,2024-05-03,Supreme Court orders new trial for B.C. francophone who was not given French option,https://bc.ctvnews.ca/supreme-court-orders-new-trial-for-b-c-francophone-who-was-not-given-french-option-1.6872348,neutral,0.031392697,0.1175507,0.85105664,-0.012832663508648423
CTV,2024-05-03,Former MP Kenny Chiu reacts to election interference inquiry,/video/c2915913-power-play--one-on-one-with-kenny-chiu?playlistId=1.6872478,neutral,0.019938098,0.1887146,0.7913473,-0.035215667652889415
CTV,2024-05-03,Twin Alberta Ballet dancers retire after 15 years with company,https://calgary.ctvnews.ca/twin-alberta-ballet-dancers-retire-after-15-years-with-company-1.6872674,neutral,0.048746586,0.16204181,0.78921175,-0.02388130269018518
CTV,2024-05-03,'Range anxiety': What’s driving a lack of interest in electric vehicle sales?,https://windsor.ctvnews.ca/range-anxiety-what-s-driving-a-lack-of-interest-in-electric-vehicle-sales-1.6872998,negative,0.013034052,0.56183755,0.42512852,-0.3154914852902557
CTV,2024-05-03,'Congratulations': Celine Dion praises Montreal DJ for new mashup featuring her vocals,https://montreal.ctvnews.ca/congratulations-celine-dion-praises-montreal-dj-for-new-mashup-featuring-her-vocals-1.6872663,positive,0.95657104,0.0015456488,0.041883282,0.9150257774486561
CTV,2024-05-03,Zebra remains on the loose in Washington state as officials close trailheads to keep people away,https://www.ctvnews.ca/world/zebra-remains-on-the-loose-in-washington-state-as-officials-close-trailheads-to-keep-people-away-1.6872826,negative,0.020077875,0.34739354,0.63252866,-0.12027912269212138
CTV,2024-05-03,Judge worries amendment to Quebec language law will cause 'undue delays' for English trials,https://montreal.ctvnews.ca/judge-worries-amendment-to-quebec-language-law-will-cause-undue-delays-for-english-trials-1.6871742,negative,0.0113442,0.5532564,0.43539947,-0.3059639127714675
CTV,2024-05-03,"Here's how one of Sask.'s largest power plants was knocked out for 73 days, and what it took to fix it",https://regina.ctvnews.ca/here-s-how-one-of-sask-s-largest-power-plants-was-knocked-out-for-73-days-and-what-it-took-to-fix-it-1.6865225,negative,0.009939904,0.70931786,0.28074226,-0.5030330081195356
CTV,2024-05-03,Police warn of scammers pretending to represent E.L.K. Energy,https://windsor.ctvnews.ca/police-warn-of-scammers-pretending-to-represent-e-l-k-energy-1.6872909,negative,0.022321539,0.44094664,0.5367319,-0.1939356489652564
CTV,2024-05-03,Two people exchange gunfire in Leamington parking lot,https://windsor.ctvnews.ca/two-people-exchange-gunfire-in-leamington-parking-lot-1.6872392,negative,0.013158083,0.273137,0.71370494,-0.07443067961277805
CTV,2024-05-03,California man gets 27 months in Canadian prison for attempting to smuggle 'ghost gun' over the border,https://bc.ctvnews.ca/california-man-gets-27-months-in-canadian-prison-for-attempting-to-smuggle-ghost-gun-over-the-border-1.6872748,negative,0.010495032,0.5857809,0.403724,-0.34302917371070407
CTV,2024-05-03,Planets aligned for Quebec astrologer's lottery win,https://montreal.ctvnews.ca/planets-aligned-for-quebec-astrologer-s-lottery-win-1.6871331,positive,0.502634,0.0059127696,0.4914533,0.2526059361713422
CTV,2024-05-03,'He was the coolest kid': Remembering Griffin Bell ahead of CN Cycle for CHEO,https://ottawa.ctvnews.ca/he-was-the-coolest-kid-remembering-griffin-bell-ahead-of-cn-cycle-for-cheo-1.6872955,positive,0.94599193,0.002912445,0.05109558,0.8948922801145383
CTV,2024-05-03,'I have the will to live': N.B. woman needs double lung transplant,https://atlantic.ctvnews.ca/i-have-the-will-to-live-n-b-woman-needs-double-lung-transplant-1.6872963,positive,0.31186557,0.029343206,0.6587912,0.09639911660442735
CTV,2024-05-03,WRDSB to lay off 106 elementary school teachers,https://kitchener.ctvnews.ca/wrdsb-to-lay-off-106-elementary-school-teachers-1.6872433,negative,0.011795358,0.6102919,0.37791273,-0.3723170888147287
CTV,2024-05-03,Italy bans puppy yoga classes amid welfare concerns,https://www.ctvnews.ca/world/italy-bans-puppy-yoga-classes-amid-welfare-concerns-1.6872658,negative,0.008916996,0.71224105,0.27884197,-0.5072078059799878
CTV,2024-05-03,Why your airfare may be getting more expensive,https://www.ctvnews.ca/business/why-your-airfare-may-be-getting-more-expensive-1.6872609,negative,0.011244111,0.77250296,0.21625285,-0.5966344478392607
CTV,2024-05-03,Trio found guilty of sex trafficking charges,https://london.ctvnews.ca/trio-found-guilty-of-sex-trafficking-charges-1.6872992,negative,0.01748816,0.64915603,0.33335584,-0.42109768232351996
CTV,2024-05-03,Frantic moments after girl gets arm stuck in elevator door,/video/c2915423-little-girl-gets-arm-stuck-in-elevator-door,neutral,0.12880099,0.18426028,0.6869388,-0.01736215087606574
CTV,2024-05-03,"Road closed in Oak Bay, B.C., so elephant seal can cross",https://bc.ctvnews.ca/road-closed-in-oak-bay-b-c-so-elephant-seal-can-cross-1.6865332,negative,0.029255848,0.2781308,0.6926134,-0.07650081822335952
CTV,2024-05-03,Lakers fire head coach Darvin Ham after 2 seasons,https://www.ctvnews.ca/sports/lakers-fire-head-coach-darvin-ham-after-2-seasons-1.6872948,negative,0.013326098,0.5255241,0.46114996,-0.2759978969592538
CTV,2024-05-03,TD worst-case scenario more likely after drug money laundering allegations: analyst,https://www.ctvnews.ca/business/td-worst-case-scenario-more-likely-after-drug-money-laundering-allegations-analyst-1.6872342,negative,0.008920291,0.6125659,0.37851387,-0.3751573433349762
CTV,2024-05-03,"These driving offences now come with an automatic impoundment, licence suspension in Sask.",https://regina.ctvnews.ca/these-driving-offences-now-come-with-an-automatic-impoundment-licence-suspension-in-sask-1.6869106,negative,0.007372443,0.7869229,0.20570475,-0.6191932072611124
CTV,2024-05-03,Manitoba man sentenced to house arrest for keeping fishing tournament funds meant for Children's Hospital Foundation,https://winnipeg.ctvnews.ca/manitoba-man-sentenced-to-house-arrest-for-keeping-fishing-tournament-funds-meant-for-children-s-hospital-foundation-1.6872910,negative,0.019562311,0.3920522,0.5883855,-0.15332223536435485
CTV,2024-05-03,"Bowness, Tocchet, Brunette named finalists for NHL's coach of the year award",https://www.ctvnews.ca/sports/bowness-tocchet-brunette-named-finalists-for-nhl-s-coach-of-the-year-award-1.6872407,positive,0.22483382,0.0073846136,0.7677814,0.05049575455920596
CTV,2024-05-03,Three Quebec men from same family father hundreds of children,https://montreal.ctvnews.ca/three-quebec-men-from-same-family-father-hundreds-of-children-1.6870263,neutral,0.052689232,0.10425711,0.84305376,-0.008093384158006867
CTV,2024-05-03,Bracebridge plant pauses operations after destructive fire,https://barrie.ctvnews.ca/bracebridge-plant-pauses-operations-after-destructive-fire-1.6872329,negative,0.010460229,0.6639199,0.32561985,-0.4406802312655991
