source,date,headline,url,chosen_label,positive,negative,neutral,compound
CTV,2024-02-09,"Explosion and fire at Sydney, N.S., seniors' residence displaces 62, seriously injures one",https://atlantic.ctvnews.ca/explosion-and-fire-at-sydney-n-s-seniors-residence-displaces-62-seriously-injures-one-1.6763314,negative,0.006575125,0.82987803,0.1635466,-0.6886545248598415
CTV,2024-02-09,"Didsbury RCMP arrest suspects, lift shelter-in-place order",https://calgary.ctvnews.ca/didsbury-rcmp-arrest-suspects-lift-shelter-in-place-order-1.6762671,neutral,0.01754679,0.08668817,0.895765,-0.007206951342920487
CTV,2024-02-09,"Astronauts from Turkiye, Italy and Sweden return to Earth, ending private space station trip",https://www.ctvnews.ca/sci-tech/astronauts-from-turkiye-italy-and-sweden-return-to-earth-ending-private-space-station-trip-1.6762630,neutral,0.06832106,0.008969834,0.92270917,0.004587305289338595
CTV,2024-02-09,What January's employment data suggests to expect from Bank of Canada in terms of interest rate changes,https://www.ctvnews.ca/business/what-january-s-employment-data-suggests-to-expect-from-bank-of-canada-in-terms-of-interest-rate-changes-1.6762393,neutral,0.075774245,0.01743536,0.90679044,0.00543774200652547
CTV,2024-02-09,Here's how this wallet lost for 40 years was returned home,/video/c2863010-wallet-lost-at-eaton-centre-40-years-ago-returned?playlistId=1.6762023,negative,0.05880809,0.2751473,0.6660446,-0.07224764586240084
CTV,2024-02-09,E.C. Row Expressway reopens between Walker and Central after fatal crash,https://windsor.ctvnews.ca/e-c-row-expressway-reopens-between-walker-and-central-after-fatal-crash-1.6762919,negative,0.021672837,0.27873644,0.6995907,-0.07722429973699718
CTV,2024-02-09,Sask. Paralympian reacts to medal compensation announcement,https://saskatoon.ctvnews.ca/sask-paralympian-reacts-to-medal-compensation-announcement-1.6763429,neutral,0.05537568,0.015285487,0.9293387,0.0028328253475207177
CTV,2024-02-09,One confirmed dead in Tottenham Road fire,https://barrie.ctvnews.ca/one-confirmed-dead-in-tottenham-road-fire-1.6763248,negative,0.010878328,0.69570214,0.29341957,-0.4838831030733193
CTV,2024-02-09,Video shows police interaction with driver who was caught speeding 131km/h in a 50km/h zone,https://toronto.ctvnews.ca/video-shows-police-interaction-with-driver-who-was-caught-speeding-131km-h-in-a-50km-h-zone-1.6763104,negative,0.023014776,0.29712465,0.67986065,-0.08775335526367023
CTV,2024-02-09,'It is just stupid': Tech experts voice concern over drivers using mixed reality headsets,https://www.ctvnews.ca/sci-tech/it-is-just-stupid-tech-experts-voice-concern-over-drivers-using-mixed-reality-headsets-1.6763380,negative,0.0073453053,0.8600196,0.13263503,-0.7395798257697788
CTV,2024-02-09,Sentencing hearing in manslaughter death of university student,https://london.ctvnews.ca/sentencing-hearing-in-manslaughter-death-of-university-student-1.6763532,negative,0.011712136,0.6459263,0.3423615,-0.41708364450472857
CTV,2024-02-09,"Infant dies from malnutrition, parent charged: Winnipeg police",https://winnipeg.ctvnews.ca/infant-dies-from-malnutrition-parent-charged-winnipeg-police-1.6762960,negative,0.009192281,0.729456,0.26135173,-0.5320215472267975
CTV,2024-02-09,"'Wild foot pursuit' after man allegedly stole condoms, lube and Band-Aids from store: RCMP",https://bc.ctvnews.ca/wild-foot-pursuit-after-man-allegedly-stole-condoms-lube-and-band-aids-from-store-rcmp-1.6762837,negative,0.011021538,0.5904005,0.39857784,-0.34845134759591545
CTV,2024-02-09,It's been so warm in Sask. bees are emerging from hibernation,https://regina.ctvnews.ca/it-s-been-so-warm-in-sask-bees-are-emerging-from-hibernation-1.6757854,positive,0.87100357,0.008821409,0.12017499,0.7585694110278425
CTV,2024-02-09,"Biden fires back at critics, says his memory is 'fine'",/video/c2864259-biden-says-his-memory-is--fine-?playlistId=1.6762647,positive,0.5059586,0.016142976,0.47789842,0.2557335265485001
CTV,2024-02-09,SIU clears cop in death of boy pursued by police near Canada's Wonderland,https://toronto.ctvnews.ca/siu-clears-cop-in-death-of-boy-pursued-by-police-near-canada-s-wonderland-1.6763466,negative,0.013001538,0.49860924,0.4883892,-0.24844215367788358
CTV,2024-02-09,Residents across the region take advantage of warm winter temperatures,https://barrie.ctvnews.ca/residents-across-the-region-take-advantage-of-warm-winter-temperatures-1.6763684,positive,0.8040865,0.0034372606,0.19247608,0.6465434021981808
CTV,2024-02-09,Former Quebec Major Junior Hockey League player Noah Corson guilty of sexual assault,https://montreal.ctvnews.ca/former-quebec-major-junior-hockey-league-player-noah-corson-guilty-of-sexual-assault-1.6763171,negative,0.015477922,0.53568023,0.44884184,-0.2867137638081605
CTV,2024-02-09,Delta flight makes emergency landing at Montreal airport after smoke detected,https://montreal.ctvnews.ca/delta-flight-makes-emergency-landing-at-montreal-airport-after-smoke-detected-1.6763584,negative,0.02236096,0.22797132,0.74966764,-0.051470923174044
CTV,2024-02-09,"Remains in Guelph park identified, police lay murder charge",https://kitchener.ctvnews.ca/remains-in-guelph-park-identified-police-lay-murder-charge-1.6763187,negative,0.010373384,0.709463,0.28016356,-0.5032302048223407
CTV,2024-02-09,Toronto breaks 86-year-old temperature record,https://toronto.ctvnews.ca/toronto-breaks-86-year-old-temperature-record-1.6762638,neutral,0.07953831,0.045310266,0.87515146,0.0042733211991707876
CTV,2024-02-09,'Garbage decision': PM reacts to mass layoffs at BCE Inc.,/video/c2864377-pm-calls-bell-layoffs-a-garbage-decision?playlistId=1.6760975,negative,0.0072299824,0.8443439,0.14842603,-0.7128644247944056
CTV,2024-02-09,Automakers caught in 'cat-and-mouse game' with car thieves as auto thefts surge,https://www.ctvnews.ca/autos/automakers-caught-in-cat-and-mouse-game-with-car-thieves-as-auto-thefts-surge-1.6760900,negative,0.011045244,0.7407076,0.24824713,-0.5485257710851448
CTV,2024-02-09,What a comeback! Three longtime friends have attended every Super Bowl - and don't intend to stop,https://www.ctvnews.ca/sports/what-a-comeback-three-longtime-friends-have-attended-every-super-bowl-and-don-t-intend-to-stop-1.6763030,positive,0.986532,0.0022250607,0.01124306,0.9732403093788644
CTV,2024-02-09,"King Charles III's health issues lead to questions about enlarged prostate, cancer",https://www.ctvnews.ca/canada/king-charles-iii-s-health-issues-lead-to-questions-about-enlarged-prostate-cancer-1.6761458,negative,0.010507827,0.62730384,0.36218825,-0.39339974690712154
CTV,2024-02-09,"Ottawa looking to hire new 'night mayor,' offering $112,000 a year salary",https://ottawa.ctvnews.ca/ottawa-looking-to-hire-new-night-mayor-offering-112-000-a-year-salary-1.6761797,neutral,0.09811073,0.011755869,0.8901333,0.00948752156825039
CTV,2024-02-09,"Third suspect arrested, one still outstanding in Tyendinaga kidnapping case",https://ottawa.ctvnews.ca/third-suspect-arrested-one-still-outstanding-in-tyendinaga-kidnapping-case-1.6763398,negative,0.020470155,0.24461696,0.7349128,-0.059418444289005556
CTV,2024-02-09,Canada Post is aiming to raise the cost of stamps by seven cents,https://www.ctvnews.ca/business/canada-post-is-aiming-to-raise-the-cost-of-stamps-by-seven-cents-1.6763107,neutral,0.073990725,0.08758598,0.8384233,-0.0021966759932237068
CTV,2024-02-09,"Ontario signs $3B health-care deal with feds to increase access to doctors, reduce wait times",https://toronto.ctvnews.ca/ontario-signs-3b-health-care-deal-with-feds-to-increase-access-to-doctors-reduce-wait-times-1.6762378,positive,0.4531447,0.0073374566,0.53951794,0.20528624049032196
CTV,2024-02-09,Dissuading young people from gang lifestyle a focus in Edmonton extortion case,https://edmonton.ctvnews.ca/dissuading-young-people-from-gang-lifestyle-a-focus-in-edmonton-extortion-case-1.6763345,negative,0.013323093,0.6217293,0.3649476,-0.3863698542683185
CTV,2024-02-09,Ontario teachers to get 2.75 per cent retroactive pay due to Bill 124,https://toronto.ctvnews.ca/ontario-teachers-to-get-2-75-per-cent-retroactive-pay-due-to-bill-124-1.6763210,neutral,0.0647649,0.030410307,0.90482485,0.0032697038529612144
CTV,2024-02-09,"Supreme Court upholds Ottawa's Indigenous child welfare act, denies Quebec's appeal",https://www.ctvnews.ca/canada/supreme-court-upholds-ottawa-s-indigenous-child-welfare-act-denies-quebec-s-appeal-1.6762663,neutral,0.02714462,0.18990223,0.78295314,-0.03532602666680518
CTV,2024-02-09,Trump tells NRA members 'no one will lay a finger on your firearms' if he returns to the White House,https://www.ctvnews.ca/world/trump-tells-nra-members-no-one-will-lay-a-finger-on-your-firearms-if-he-returns-to-the-white-house-1.6763687,negative,0.030181164,0.37690744,0.59291136,-0.1411483241899738
CTV,2024-02-09,B.C. sports betting site on pace for record-setting Super Bowl,https://bc.ctvnews.ca/b-c-sports-betting-site-on-pace-for-record-setting-super-bowl-1.6763697,positive,0.609407,0.0043604677,0.38623255,0.3713578510292024
CTV,2024-02-09,The Senate is pushing past far-right objections to aiding Ukraine. But next steps are uncertain,https://www.ctvnews.ca/world/the-senate-is-pushing-past-far-right-objections-to-aiding-ukraine-but-next-steps-are-uncertain-1.6763540,neutral,0.04785535,0.07091151,0.8812332,-0.002738306068209795
CTV,2024-02-09,"Movie reviews: 'Lisa Frankenstein' a story of loss and love, with a hint of mayhem",https://www.ctvnews.ca/entertainment/movie-reviews-lisa-frankenstein-a-story-of-loss-and-love-with-a-hint-of-mayhem-1.6762146,negative,0.068958454,0.24741304,0.68362856,-0.05645793195040483
CTV,2024-02-09,Woman riding her horses in Alberta town causing bylaw confusion,https://calgary.ctvnews.ca/woman-riding-her-horses-in-alberta-town-causing-bylaw-confusion-1.6760046,negative,0.009558497,0.43179852,0.5586429,-0.18635862015840132
CBC,2024-02-09,Government extends ban on foreign buying of Canadian housing,https://www.cbc.ca/news/politics/foreign-housing-buying-ban-extended-1.7104533,negative,0.015941117,0.35229468,0.63176423,-0.12385741487641688
CBC,2024-02-09,Tenants who face eviction demand cash for keys from landlords amid tribunal delays,https://www.cbc.ca/news/canada/toronto/landlord-tenant-cash-for-keys-1.7050393,negative,0.022468146,0.2808815,0.6966504,-0.07838958838047816
CBC,2024-02-09,Human trafficking victim says he was forced to target Canadians in crypto investment scam,https://www.cbc.ca/news/business/crypto-scam-human-trafficking-1.7105454,negative,0.005852112,0.8350462,0.1591019,-0.6972677142253474
CBC,2024-02-09,Prominent Vancouver street given 2nd name in honour of Komagata Maru ship,https://www.cbc.ca/news/canada/british-columbia/komagata-maru-place-canada-place-renaming-1.7110759,positive,0.3639327,0.0057657175,0.63030154,0.1324137873552722
CBC,2024-02-09,A court battle between the CRA and the Toronto Maple Leafs captain could be pivotal for other pro athletes,https://www.cbc.ca/news/business/john-tavares-maple-leafs-taxes-1.7109215,neutral,0.10406073,0.014837635,0.88110155,0.010608487733148042
CBC,2024-02-09,"Violent online groups are pressuring youth into harming themselves, authorities warn",https://www.cbc.ca/news/canada/online-groups-pressuring-youth-self-harm-1.7107885,negative,0.0063877916,0.8021793,0.19143282,-0.6434508954732632
CBC,2024-02-09,Canadian writer Mark Steyn ordered to pay climate scientist $1M US after defamation trial,https://www.cbc.ca/news/world/us-trial-mann-defamation-steyn-simberg-1.7110203,negative,0.02217087,0.35208383,0.6257453,-0.12347147723087915
CBC,2024-02-09,Mexican-style corn salad kits and bean dip recalled in Canada after listeria outbreak in U.S.,https://www.cbc.ca/news/health/canada-recalls-salad-bean-listera-1.7110215,negative,0.012806086,0.43589243,0.55130136,-0.18983826763678024
CBC,2024-02-09,Supreme Court declares Indigenous child welfare law constitutional,https://www.cbc.ca/news/indigenous/supreme-court-c92-child-welfare-ruling-1.7110141,positive,0.27172962,0.009251636,0.7190187,0.07375140855927498
CBC,2024-02-09,WATCH : CBC News Explore,https://www.cbc.cahttps://gem.cbc.ca/live,neutral,0.09840742,0.014817321,0.88677526,0.009464467482493077
CBC,2024-02-09,Uber Eats peanut butter gaffe shows how a Super Bowl ad can go awry,https://www.cbc.ca/news/business/uber-eats-superbowl-peanut-butter-1.7110653,negative,0.010048036,0.85624284,0.13370922,-0.7330507547833331
CBC,2024-02-09,"Trailing rival party, former Pakistan PM Nawaz Sharif faces tough climb back to top",https://www.cbc.ca/news/world/pakistan-elections-imran-khan-1.7110166,neutral,0.07328393,0.19005625,0.7366598,-0.03075084225266922
CBC,2024-02-09,Putin sat down with Tucker Carlson and lectured him on the Ukraine war,https://www.cbc.ca/news/world/tucker-carlson-vladimir-putin-interview-1.7110120,negative,0.02244492,0.23040912,0.74714595,-0.05258458925100751
CBC,2024-02-09,"Ford, Trudeau sign $3.1B health-care funding deal that will see Ontario hire more health workers",https://www.cbc.ca/news/canada/toronto/doug-ford-justin-trudeau-health-care-agreement-1.7110032,positive,0.57347,0.0051015317,0.4214284,0.32884182783952554
CBC,2024-02-09,Palestinians fear Israel's economic chokehold won't end — with or without a ceasefire,https://www.cbc.ca/news/world/israel-economic-measures-west-bank-palestinians-1.7109039,negative,0.008696382,0.81186,0.17944357,-0.6590410970361837
CBC,2024-02-09,Why some Albertans are turning  to motels and campgrounds for housing,https://www.cbc.ca/news/canada/calgary/calgary-motels-campgrounds-ashley-halas-meaghon-reid-1.7039101,negative,0.013377604,0.4250066,0.5616159,-0.18045161137455246
CBC,2024-02-09,Katz Group launches court battle with Edmonton homeless organization over $5M donation,https://www.cbc.ca/news/canada/edmonton/katz-group-launches-court-battle-with-edmonton-homeless-organization-over-5-million-donation-1.7109439,neutral,0.02412932,0.17383225,0.80203843,-0.02963542815071918
CBC,2024-02-09,Poilievre pledges to establish minimum prison sentences for extortion,https://www.cbc.ca/news/politics/poilievre-minimum-sentence-extortion-crimes-1.7110600,negative,0.027270483,0.5000295,0.4727001,-0.24928578295554615
CBC,2024-02-09,Daughters want inquest 2 years after their dad fell 3 floors from a Windsor retirement home,https://www.cbc.ca/news/canada/windsor/retirement-home-inquest-investigation-1.7105759,negative,0.045806948,0.35562497,0.59856796,-0.12437088275237329
CBC,2024-02-09,What's the cycling capital of Canada? This city is giving itself the prize,https://www.cbc.ca/news/canada/british-columbia/victoria-cycling-capital-1.7109605,positive,0.41184372,0.0847335,0.5034228,0.16243548363383198
CBC,2024-02-09,WATCH: CBC News Network,https://www.cbc.cahttps://gem.cbc.ca/live,neutral,0.10073908,0.018231502,0.88102955,0.00981596340483426
CBC,2024-02-09,"Family of James Wood, who died after police encounter, calls out systemic racism and brutality",https://www.cbc.ca/news/canada/manitoba/james-wood-died-encounter-winnipeg-police-1.7110327,negative,0.017817441,0.5669145,0.41526806,-0.32107458787209
CBC,2024-02-09,"New NASA climate satellite will keep eye on plankton, clouds. Here's why",https://www.cbc.ca/news/science/nasa-pace-1.7110230,neutral,0.099891625,0.009770278,0.8903381,0.009882875725396367
CBC,2024-02-09,"With aging U.S. presidential hopefuls, how much will their running mates matter to voters?",https://www.cbc.ca/news/world/us-presidential-candidate-age-biden-vice-president-1.7111017,neutral,0.050754678,0.042489074,0.9067563,0.0007707155875658067
CBC,2024-02-09,"NDP threatens stalling tactics, end of agreement with Liberals over slow pace of pharmacare talks",https://www.cbc.ca/news/politics/ndp-liberal-pharmacare-singh-trudeau-1.7109692,negative,0.0077856756,0.74130034,0.25091383,-0.5494656932288216
CBC,2024-02-09,"Private jets, yachts and parties: Ontario landlords flaunted lavish lifestyle as business began to crumble",https://www.cbc.ca/news/canada/hamilton/investors-bankruptcy-protection-1.7108994,negative,0.04892767,0.30696106,0.6441114,-0.09183114495399991
CBC,2024-02-09,"Behold, the Ballbecue: Quebec tailgating creation turning heads at Super Bowl LVIII",https://www.cbc.ca/player/play/2307578947618,positive,0.76260036,0.0043327985,0.2330669,0.5815405056944298
CBC,2024-02-09,WATCH | How to spot a crypto scam,https://www.cbc.cahttps://www.cbc.ca/player/play/2307660355858,negative,0.038437147,0.3687215,0.5928414,-0.13447810865401522
CBC,2024-02-09,"In an RV outside a B.C. Walmart, a senior dreams of housing",https://www.cbc.ca/news/canada/british-columbia/rv-walmart-seniors-housing-1.7097107,neutral,0.14343783,0.024728812,0.83183336,0.01996289677814289
CBC,2024-02-09,Trudeau 'pissed off' by Bell Media's 'garbage decision' to lay off journalists,https://www.cbc.ca/news/politics/trudeau-bell-media-cuts-pissed-1.7110512,negative,0.007079554,0.8375852,0.1553353,-0.7014988159387272
CBC,2024-02-09,"Korean 'orphans' find long-lost family, hope after CBC report on falsified adoption papers",https://www.cbc.ca/news/investigates/korean-canadian-paper-orphan-biological-1.7101609,negative,0.04566684,0.23535644,0.7189767,-0.05330719945108431
CBC,2024-02-09,"At 76, I love walking and hiking. But an ice storm forced me to face my body's limitations",https://www.cbc.ca/news/canada/montreal/first-person-ice-storm-senior-limitations-1.7107996,positive,0.7583956,0.02986583,0.21173844,0.5742720471346949
CBC,2024-02-09,"Famed former Boston Symphony, TSO conductor Seiji Ozawa dead at 88",https://www.cbc.ca/news/entertainment/obit-conductor-ozawa-1.7110105,negative,0.028346086,0.24781708,0.72383684,-0.06060980304383268
CBC,2024-02-09,"Mother in Inuit identity fraud case pleads guilty, charges against daughters withdrawn",https://www.cbc.ca/news/canada/north/mother-inuit-fraud-guilty-1.7110341,negative,0.02160712,0.4820927,0.4963002,-0.23194649762001873
CBC,2024-02-09,The National,https://www.cbc.ca/player/play/2307990595626,neutral,0.12646915,0.062769786,0.8107611,0.012054398075619588
CBC,2024-02-09,U.S Coast Guard honours those who helped after man fell off the Ambassador Bridge,https://www.cbc.ca/news/canada/windsor/detroit-river-ambassador-bridge-fall-rescue-1.7111093,positive,0.2531009,0.026579656,0.7203195,0.06335357531014552
