source,date,headline,url,chosen_label,positive,negative,neutral,compound
CTV,2024-02-16,"'91 open investigations': Tracking number given to people for Stanley cup orders belongs to Wilmot, Ont. woman",https://kitchener.ctvnews.ca/91-open-investigations-tracking-number-given-to-people-for-stanley-cup-orders-belongs-to-wilmot-ont-woman-1.6765872,neutral,0.022087969,0.055548627,0.9223636,-0.0025977657256694986
CTV,2024-02-16,She arrived at JFK airport in 1971 and two men were waiting for her. Here's how she ended up married to one of them,https://www.ctvnews.ca/lifestyle/she-arrived-at-jfk-airport-in-1971-and-two-men-were-waiting-for-her-here-s-how-she-ended-up-married-to-one-of-them-1.6770015,neutral,0.06726892,0.007525122,0.92520607,0.004468473828564079
CTV,2024-02-16,Crews respond to house fire in Regina,https://regina.ctvnews.ca/crews-respond-to-house-fire-in-regina-1.6772326,neutral,0.055568255,0.09993997,0.8444917,-0.006900169332409334
CTV,2024-02-16,Business relationship between 'disgraced' VicPD officer and former police union president under scrutiny,https://vancouverisland.ctvnews.ca/business-relationship-between-disgraced-vicpd-officer-and-former-police-union-president-under-scrutiny-1.6770725,negative,0.005585885,0.8509626,0.14345165,-0.7241059955324127
CTV,2024-02-16,What's open and closed for Family Day,https://kitchener.ctvnews.ca/what-s-open-and-closed-for-family-day-1.6772359,neutral,0.07276662,0.016354337,0.9108791,0.005027514510093312
CTV,2024-02-16,"Ottawa youth accused in terror plot facing additional charges, second youth arrested",https://ottawa.ctvnews.ca/ottawa-youth-accused-in-terror-plot-facing-additional-charges-second-youth-arrested-1.6772380,negative,0.0074709277,0.7266427,0.26588646,-0.5279537752078465
CTV,2024-02-16,Prime minister and Manitoba premier announce $633M in health funding,https://winnipeg.ctvnews.ca/prime-minister-and-manitoba-premier-announce-633m-in-health-funding-1.6770216,positive,0.45244396,0.0046130936,0.5429431,0.20468417373965764
CTV,2024-02-16,'Surreal moments': Alberta photographer captures stunning shots during Iceland volcanic eruption,https://calgary.ctvnews.ca/surreal-moments-alberta-photographer-captures-stunning-shots-during-iceland-volcanic-eruption-1.6767319,positive,0.7448804,0.0048851743,0.25023443,0.5548229127497031
CTV,2024-02-16,Skate Canada says ISU decision on 2022 figure skating team bronze will be appealed,https://www.ctvnews.ca/sports/skate-canada-says-isu-decision-on-2022-figure-skating-team-bronze-will-be-appealed-1.6772177,neutral,0.03738093,0.04660897,0.91601014,-0.0007750617357755729
CTV,2024-02-16,Here's what's happening in Edmonton on Family Day,https://edmonton.ctvnews.ca/here-s-what-s-happening-in-edmonton-on-family-day-1.6771996,neutral,0.0774752,0.006655918,0.9158689,0.0059581055474469125
CTV,2024-02-16,"Move over, plant-based beef: Hello, beef-infused rice",https://www.ctvnews.ca/lifestyle/move-over-plant-based-beef-hello-beef-infused-rice-1.6771700,neutral,0.13829458,0.06407884,0.79762655,0.015019294972555386
CTV,2024-02-16,Homeowner startled awake by brick thrown through bedroom window,https://barrie.ctvnews.ca/homeowner-startled-awake-by-brick-thrown-through-bedroom-window-1.6772242,negative,0.027392782,0.44155735,0.5310499,-0.1942225149182324
CTV,2024-02-16,Winter blast blankets region in just 24 hours with more on the way,https://barrie.ctvnews.ca/winter-blast-blankets-region-in-just-24-hours-with-more-on-the-way-1.6772297,neutral,0.1994783,0.020637583,0.77988416,0.039365673562669734
CTV,2024-02-16,Three charged following fatal North End shooting,https://winnipeg.ctvnews.ca/three-charged-following-fatal-north-end-shooting-1.6772263,negative,0.013291519,0.6464678,0.3402406,-0.4177439955477169
CTV,2024-02-16,The reason why Tennessee lawmakers are trying to ban cold beer,https://www.ctvnews.ca/world/the-reason-why-tennessee-lawmakers-are-trying-to-ban-cold-beer-1.6772308,negative,0.019922856,0.52959776,0.45047945,-0.28007683616788626
CTV,2024-02-16,Massive crater left behind after Russian missile strike,/video/c2868808-video-shows-massive-crater-from-russian-missile,negative,0.014655837,0.77284163,0.21250242,-0.5970694857928969
CTV,2024-02-16,Minor injuries after moose strikes vehicle on Hwy. 11 near Cochrane,https://northernontario.ctvnews.ca/minor-injuries-after-moose-strikes-vehicle-on-hwy-11-near-cochrane-1.6772371,negative,0.018217372,0.5362613,0.44552138,-0.2872442840243128
CTV,2024-02-16,Youth charged in downtown robbery with a knife,https://windsor.ctvnews.ca/youth-charged-in-downtown-robbery-with-a-knife-1.6772032,negative,0.018750519,0.604964,0.37628546,-0.3656298623806187
CTV,2024-02-16,"Trudeau downplays Liberal divisions on Israel-Hamas war, NDP calls for firmer stance",https://www.ctvnews.ca/canada/trudeau-downplays-liberal-divisions-on-israel-hamas-war-ndp-calls-for-firmer-stance-1.6770607,neutral,0.047658775,0.06594822,0.886393,-0.0020778085687156445
CTV,2024-02-16,0.05 vs 0.08: What's the difference when it comes to blood-alcohol limit?,https://montreal.ctvnews.ca/0-05-vs-0-08-what-s-the-difference-when-it-comes-to-blood-alcohol-limit-1.6771773,neutral,0.02182457,0.058204785,0.9199706,-0.0029114879155445195
CTV,2024-02-16,"Weather alerts have ended, some school buses cancelled",https://northernontario.ctvnews.ca/weather-alerts-have-ended-some-school-buses-cancelled-1.6771628,negative,0.014387851,0.60081875,0.38479337,-0.36077618161254676
CTV,2024-02-16,New video shows arrest of break-and-enter suspect found hiding in wooded area in York Region,https://toronto.ctvnews.ca/new-video-shows-arrest-of-break-and-enter-suspect-found-hiding-in-wooded-area-in-york-region-1.6772396,neutral,0.02207086,0.10082569,0.8771034,-0.009678701439296056
CTV,2024-02-16,"School closures may not have been necessary to prevent spread of COVID-19, researchers at McMaster find",https://toronto.ctvnews.ca/school-closures-may-not-have-been-necessary-to-prevent-spread-of-covid-19-researchers-at-mcmaster-find-1.6771132,negative,0.011731934,0.44170037,0.54656774,-0.19496156525785757
CTV,2024-02-16,Prince Harry and Meghan in Vancouver for third day of Invictus Games training camp,https://www.ctvnews.ca/canada/prince-harry-and-meghan-in-vancouver-for-third-day-of-invictus-games-training-camp-1.6771730,neutral,0.09597603,0.005437963,0.8985859,0.009181835435542851
CTV,2024-02-16,Vancouver police officer is directed to remove Star of David patch from uniform,https://bc.ctvnews.ca/vancouver-police-officer-is-directed-to-remove-star-of-david-patch-from-uniform-1.6772290,neutral,0.026992263,0.19437091,0.7786369,-0.03705146120002123
CTV,2024-02-16,A 'life-changing' experience for $6: Vancouver Story Slam celebrates 20 years,https://bc.ctvnews.ca/a-life-changing-experience-for-6-vancouver-story-slam-celebrates-20-years-1.6772333,positive,0.9480289,0.0020342849,0.04993676,0.898754709271322
CTV,2024-02-16,Hamilton police charge man who allegedly created a disturbance on a flight because he wanted a cigarette,https://toronto.ctvnews.ca/hamilton-police-charge-man-who-allegedly-created-a-disturbance-on-a-flight-because-he-wanted-a-cigarette-1.6771914,negative,0.008426989,0.62633324,0.3652399,-0.39222225441585046
CTV,2024-02-16,Air Canada loses lawsuit over wrong info given by chatbot,/video/c2868777-air-canada-loses-suit-over-wrong-info-by-chatbot?playlistId=1.6772347,negative,0.011265046,0.66086805,0.327867,-0.43661961855741893
CTV,2024-02-16,Tentative agreement in health unit dispute,https://london.ctvnews.ca/tentative-agreement-in-health-unit-dispute-1.6772321,neutral,0.04405097,0.06482002,0.891129,-0.002261147132376351
CTV,2024-02-16,Canadian military wages annual war against avalanches in Rogers Pass,https://calgary.ctvnews.ca/canadian-military-wages-annual-war-against-avalanches-in-rogers-pass-1.6771738,negative,0.02470683,0.31883857,0.6564547,-0.10104757724868207
CTV,2024-02-16,"Man checks into NYC hotel and won't leave, claims he owns it",/video/c2868459-man-tries-to-claim-ownership-of-iconic-hotel,neutral,0.049651265,0.060033247,0.8903156,-0.0011387415169723525
CTV,2024-02-16,Fatal Sudbury apartment fire under investigation,https://northernontario.ctvnews.ca/fatal-sudbury-apartment-fire-under-investigation-1.6771902,negative,0.013162778,0.56455094,0.4222863,-0.3185444840704754
CTV,2024-02-16,B.C. content creator finds himself deep in the delicious McCain cake assembly line in N.B.,https://atlantic.ctvnews.ca/more/b-c-content-creator-finds-himself-deep-in-the-delicious-mccain-cake-assembly-line-in-n-b-1.6768984,positive,0.69299436,0.0047666193,0.30223903,0.4802184362665063
CTV,2024-02-16,Snowfall warnings issued for B.C. Interior,https://bc.ctvnews.ca/snowfall-warnings-issued-for-b-c-interior-1.6764331,negative,0.030328875,0.29900244,0.6706688,-0.08848259403274206
CTV,2024-02-16,"ArriveCan investigation: GC Strategies had dozens of government contracts. Now, it's not eligible for any",https://www.ctvnews.ca/politics/arrivecan-investigation-gc-strategies-had-dozens-of-government-contracts-now-it-s-not-eligible-for-any-1.6771612,negative,0.015983496,0.67841595,0.30560058,-0.4599926943374584
CTV,2024-02-16,Delta flight forced back to Amsterdam after maggots fall onto passenger,https://www.ctvnews.ca/world/delta-flight-forced-back-to-amsterdam-after-maggots-fall-onto-passenger-1.6772026,negative,0.009656801,0.68500805,0.30533528,-0.46914269316843615
CTV,2024-02-16,Truck driver found guilty in deadly crash that killed 4 on Laval highway,https://montreal.ctvnews.ca/truck-driver-found-guilty-in-deadly-crash-that-killed-4-on-laval-highway-1.6772002,negative,0.010718585,0.75083894,0.23844238,-0.5636442960316872
CTV,2024-02-16,Ontario father finds unwanted surprise in McDonald's Happy Meal,https://toronto.ctvnews.ca/ontario-father-finds-unwanted-surprise-in-mcdonald-s-happy-meal-1.6769958,neutral,0.14159149,0.21617724,0.6422313,-0.026684448142240136
CTV,2024-02-16,"Canada, U.K., and U.S. 'deeply concerned' about foreign information manipulation",https://www.ctvnews.ca/canada/canada-u-k-and-u-s-deeply-concerned-about-foreign-information-manipulation-1.6771885,neutral,0.03663956,0.096008845,0.8673516,-0.007875241118713516
CTV,2024-02-16,Do you know him? Man found dead in Calgary last year remains unidentified,https://calgary.ctvnews.ca/do-you-know-him-man-found-dead-in-calgary-last-year-remains-unidentified-1.6772012,neutral,0.01224388,0.19387814,0.7938781,-0.037438803142897825
CTV,2024-02-16,Bridgehead closing some 'unprofitable' shops in Ottawa,https://ottawa.ctvnews.ca/bridgehead-closing-some-unprofitable-shops-in-ottawa-1.6772337,negative,0.012811105,0.576717,0.41047195,-0.33243834477422674
CTV,2024-02-16,Plane going from Ottawa to Orlando gets stuck in snow bank,https://ottawa.ctvnews.ca/plane-going-from-ottawa-to-orlando-gets-stuck-in-snow-bank-1.6772239,negative,0.013589205,0.71519727,0.27121356,-0.5113224407179651
CBC,2024-02-16,From fashion to burials: How fungi can help fight climate change,https://www.cbc.ca/news/science/what-on-earth-fungi-climate-change-1.7116376,neutral,0.19098175,0.030612037,0.7784062,0.035536932803988286
CBC,2024-02-16,FIRST PERSON — Teaching music to blind kids helped me connect with my heritage,https://www.cbc.cahttps://www.cbc.ca/kidsnews/post/first-person-teaching-music-to-blind-kids-helped-me-connect-with-my-heritage,positive,0.78773034,0.0042841826,0.2079856,0.6205006230887511
CBC,2024-02-16,U.S. reaction to Navalny death: 'Putin is responsible',https://www.cbc.ca/news/world/us-reaction-navalny-death-1.7117682,negative,0.02031273,0.3346068,0.64508045,-0.11154911077496976
CBC,2024-02-16,"Trump liable for more than $350M in civil fraud case, New York judge finds",https://www.cbc.ca/news/world/trump-liable-new-york-civil-fraud-case-1.7117197,negative,0.016150936,0.6914966,0.2923526,-0.47790660866365187
CBC,2024-02-16,Deaths of teens aged 12 and 19 at Nunavut care home trigger multiple investigations,https://www.cbc.ca/news/canada/north/multiple-investigations-underway-nunavut-care-home-two-deaths-1.7117576,negative,0.009167772,0.557177,0.43365517,-0.3103621853013845
CBC,2024-02-16,Antony Blinken says Navalny death would expose 'rot' of Putin's Russia,https://www.cbc.ca/player/play/2309592131967,negative,0.013361705,0.4670363,0.519602,-0.21794437709906234
CBC,2024-02-16,WATCH: CBC News Network,https://www.cbc.cahttps://gem.cbc.ca/live,neutral,0.10073908,0.018231502,0.88102955,0.00981596340483426
CBC,2024-02-16,"OpenAI unveils Sora, a tool that uses AI to generate videos from written prompts",https://www.cbc.ca/news/business/open-ai-sora-text-to-video-1.7117312,positive,0.35729763,0.0068325237,0.6358698,0.12761493346658526
CBC,2024-02-16,Kansas City parade-goers who helped tackle and subdue shooting suspect describe moment of chaos,https://www.cbc.ca/player/play/2309462595631,negative,0.025166353,0.2714736,0.70336,-0.0730645741574838
CBC,2024-02-16,Alberta couple raises contamination concerns as Health Canada cracks down on cord blood clinic,https://www.cbc.ca/news/canada/edmonton/edmonton-cord-blood-bank-health-canada-warning-1.7116322,negative,0.015241956,0.3794854,0.60527265,-0.14377685063552548
CBC,2024-02-16,"Prince Harry takes high-speed, face-first sled run in Whistler",https://www.cbc.ca/player/play/2309439043706,positive,0.25367278,0.009628625,0.73669857,0.06425717548416365
CBC,2024-02-16,Winnipeg man 'in constant pain' after nearly 3-year wait for jaw surgery,https://www.cbc.ca/news/canada/manitoba/winnipeg-jaw-surgery-wait-1.7110819,negative,0.013694049,0.77541906,0.21088691,-0.6010871747531565
CBC,2024-02-16,WATCH : CBC News Explore,https://www.cbc.cahttps://gem.cbc.ca/live,neutral,0.09840742,0.014817321,0.88677526,0.009464467482493077
CBC,2024-02-16,Ottawa floats new options for electricity rules that drew ire of Alberta and Saskatchewan,https://www.cbc.ca/news/canada/calgary/alberta-clean-electricity-regulations-ottawa-steven-guilbeault-1.7117495,neutral,0.02695914,0.1423675,0.83067334,-0.01954171264532789
CBC,2024-02-16,"London, Ont., police training with Chechen paramilitary group damages Canada's image, researcher warns",https://www.cbc.ca/news/canada/london/london-ontario-police-swat-competition-dubai-chechen-1.7117264,negative,0.006280589,0.7482722,0.24544734,-0.5598717217943836
CBC,2024-02-16,"Oppenheimer, leading in Oscar nominations, lands on Prime today. Read our original review",https://www.cbc.cahttps://www.cbc.ca/news/entertainment/oppenheimer-review-1.6913310,positive,0.5398123,0.0035216922,0.4566658,0.2913850414275032
CBC,2024-02-16,"Travis Kelce, Taylor Swift sign football jersey donated to Guelph children's charity for auction",https://www.cbc.ca/news/canada/kitchener-waterloo/guelph-travis-kelce-jersey-taylor-swift-1.7117808,neutral,0.15220213,0.0073904824,0.8404073,0.023110879715333432
CBC,2024-02-16,'Angry' B.C. public safety minister calls out police misconduct resulting in stayed drug charges,https://www.cbc.ca/news/canada/british-columbia/farnworth-project-juliet-victoria-police-1.7116839,negative,0.005581039,0.8387695,0.15564954,-0.7035030690991206
CBC,2024-02-16,Small Quebec towns play host to 400 Canadian soldiers training for Latvia NATO operation,https://www.cbc.ca/news/canada/montreal/quebec-small-town-training-canadian-armed-forces-latvia-nato-1.7116669,neutral,0.037792437,0.022585358,0.9396222,0.0009181695771574017
CBC,2024-02-16,"'I'm not going to die here,' says 71-year-old swallowed by manhole",https://www.cbc.ca/player/play/2309621315699,negative,0.035399355,0.55818415,0.4064165,-0.31031641033269786
CBC,2024-02-16,B.C. cancels operating licence of company involved in 6 overpass strikes in 3 years,https://www.cbc.ca/news/canada/british-columbia/chohan-freight-forwarders-ltd-cancelled-from-operating-in-bc-1.7117326,negative,0.008209231,0.72962075,0.26216996,-0.5322790972830589
CBC,2024-02-16,"Suspect in Vaudreuil-Dorion, Que., killings charged with 2nd-degree murder",https://www.cbc.ca/news/canada/montreal/suspect-vaudreuil-dorion-charged-2nd-degree-murder-1.7117905,negative,0.009071932,0.72144276,0.26948532,-0.5203973331297984
CBC,2024-02-16,"'We can't believe Putin,' says Navalny's wife after Russian dissident's reported death",https://www.cbc.ca/player/play/2309624387831,negative,0.007550354,0.81364596,0.17880382,-0.6619626304116011
CBC,2024-02-16,Stolen Beatles bass guitar returned to Paul McCartney 51 years later,https://www.cbc.ca/news/entertainment/stolen-mccartney-bass-returned-1.7117447,neutral,0.045348577,0.045040462,0.90961105,2.7850195655210186e-05
CBC,2024-02-16,Questions emerge after Russian activist Alexei Navalny reported dead in Russian prison,https://www.cbc.ca/player/play/2309583939764,negative,0.00989061,0.4420605,0.548049,-0.19531962307652861
CBC,2024-02-16,Federal money's kept hundreds of journalists employed in Canada. But the program's set to expire,https://www.cbc.ca/news/federal-funding-journalists-expire-1.7116950,neutral,0.13975978,0.11384478,0.74639547,0.006572160632625668
CBC,2024-02-16,"Russia has 'serious questions' to answer around Navalny, NATO chief says",https://www.cbc.ca/player/play/2309585987682,neutral,0.03427748,0.065688685,0.90003383,-0.00314005775751669
CBC,2024-02-16,Couple hit with $13K B.C. vacancy tax bill despite living in home year-round,https://www.cbc.ca/news/canada/british-columbia/couple-hit-with-b-c-vacancy-tax-despite-living-in-home-1.7116908,negative,0.032737132,0.46729103,0.49997172,-0.2172892359388756
CBC,2024-02-16,"Banned in Europe, this controversial ingredient is allowed in foods here",https://www.cbc.ca/news/business/snack-food-ingredient-banned-europe-available-canada-1.7115568,negative,0.01211002,0.7223181,0.2655718,-0.5215968676728178
CBC,2024-02-16,Dakota Johnson's Madame Web is a confusing contractually-obligated calamity,https://www.cbc.ca/player/play/2309683267658,negative,0.011248493,0.8222896,0.16646187,-0.6760336957190596
CBC,2024-02-16,Grassy Narrows chief calls out feds amid 'ridiculous' delays to mercury treatment centre construction,https://www.cbc.ca/news/indigenous/grass-narrows-chief-treatment-centre-mercury-1.7117352,negative,0.008499403,0.721641,0.26985967,-0.5206934567439063
CBC,2024-02-16,"Prince Harry hits 99 km/h on skeleton sled in B.C., says 'everyone should do this'",https://www.cbc.ca/news/canada/british-columbia/harry-skeleton-99-km-1.7116889,positive,0.63853514,0.004633289,0.35683167,0.4077055843935966
CBC,2024-02-16,"Manitoba rejects Sio Silica sand mining project, saying risk 'simply too great'",https://www.cbc.ca/news/canada/manitoba/sio-silica-sand-mining-project-southeastern-manitoba-1.7117246,negative,0.009873656,0.69562125,0.29450506,-0.483791478649124
CBC,2024-02-16,Air Canada found liable for chatbot's bad advice on plane tickets,https://www.cbc.ca/news/canada/british-columbia/air-canada-chatbot-lawsuit-1.7116416,negative,0.00980611,0.7850168,0.20517716,-0.6161551546047281
CBC,2024-02-16,Quebec doctors to face increased scrutiny for overprescription of anti-anxiety medication,https://www.cbc.ca/news/canada/montreal/benzos-quebec-problems-scrutiny-1.7116023,negative,0.02688917,0.3160022,0.65710866,-0.09913434779833707
CBC,2024-02-16,Biden has ‘no doubt’ Putin is responsible in Navalny’s reported death,https://www.cbc.ca/player/play/2309659715868,negative,0.02338206,0.36686733,0.6097506,-0.13404490917422507
CBC,2024-02-16,Pair of juveniles charged in mass shooting at Kansas City Super Bowl parade,https://www.cbc.ca/sports/football/nfl/super-bowl-parade-shooting-juveniles-charged-1.7117751,negative,0.010054305,0.6337917,0.35615388,-0.40159090429822264
CBC,2024-02-16,Defence minister expects more details from U.S. on emerging threat from Russia,https://www.cbc.ca/player/play/2309323331744,neutral,0.048833795,0.03942741,0.9117387,0.0008302197463845307
CBC,2024-02-16,WATCH |  AG report blasts ArriveCan app failures,https://www.cbc.cahttps://www.cbc.ca/player/play/2309496899775,negative,0.008649691,0.77024823,0.22110198,-0.5932075817142239
CBC,2024-02-16,Zelenskyy says he believes Navalny was 'killed by Putin',https://www.cbc.ca/player/play/2309590595832,negative,0.016506642,0.48975995,0.49373338,-0.23959235528696077
