source,date,headline,url,chosen_label,positive,negative,neutral,compound
CTV,2024-07-12,Over 240 trained security staff patrolling grounds at Country Thunder,https://regina.ctvnews.ca/over-240-trained-security-staff-patrolling-grounds-at-country-thunder-1.6962491,neutral,0.090118974,0.014857189,0.8950238,0.007900694645591955
CTV,2024-07-12,Debit card scam targeting victims in downtown Calgary: police,https://calgary.ctvnews.ca/debit-card-scam-targeting-victims-in-downtown-calgary-police-1.6962455,negative,0.010371589,0.6703199,0.31930852,-0.4492212188238227
CTV,2024-07-12,"2 bodies of people believed to be from B.C. wash ashore Sable Island, N.S.",https://atlantic.ctvnews.ca/2-bodies-of-people-believed-to-be-from-b-c-wash-ashore-sable-island-n-s-1.6961444,neutral,0.026342632,0.09780384,0.8758535,-0.008871660386639224
CTV,2024-07-12,Novice driver fled police travelling 188 km/h on Hwy. 11 while allegedly impaired,https://northernontario.ctvnews.ca/novice-driver-fled-police-travelling-188-km-h-on-hwy-11-while-allegedly-impaired-1.6954935,negative,0.016850483,0.5421615,0.44098806,-0.293655148726117
CTV,2024-07-12,2nd suspect arrested in Barrie car bombing,https://barrie.ctvnews.ca/2nd-suspect-arrested-in-barrie-car-bombing-1.6961809,negative,0.011959213,0.6497951,0.33824575,-0.4220906311038206
CTV,2024-07-12,"A B.C. man owes $27,000 in COVID benefit repayments. He's fighting back and is not the only one",https://www.ctvnews.ca/canada/a-b-c-man-owes-27-000-in-covid-benefit-repayments-he-s-fighting-back-and-is-not-the-only-one-1.6961962,negative,0.049087502,0.5293895,0.421523,-0.27784366123729765
CTV,2024-07-12,Stunt performer training comes to Sudbury this weekend,https://northernontario.ctvnews.ca/stunt-performer-training-comes-to-sudbury-this-weekend-1.6962076,neutral,0.043045286,0.0070847343,0.94986993,0.0018027049297189013
CTV,2024-07-12,"Poilievre blasts Montreal mayor's approach to addictions, homelessness",https://montreal.ctvnews.ca/poilievre-blasts-montreal-mayor-s-approach-to-addictions-homelessness-1.6961470,negative,0.0140445465,0.5158528,0.4701028,-0.2659068120507868
CTV,2024-07-12,Rare marine fossil found in eastern Saskatchewan,https://regina.ctvnews.ca/rare-marine-fossil-found-in-eastern-saskatchewan-1.6961570,positive,0.26298836,0.009222181,0.72778934,0.06907785848444092
CTV,2024-07-12,Mother of the 'miracle baby' found crawling by a highway faces a murder charge in older son's death,https://www.ctvnews.ca/world/mother-of-the-miracle-baby-found-crawling-by-a-highway-faces-a-murder-charge-in-older-son-s-death-1.6960682,negative,0.009613049,0.7392371,0.25114983,-0.5463791234272755
CTV,2024-07-12,Charges pending after toddler left in car in Walmart parking lot: Edmonton police,https://edmonton.ctvnews.ca/charges-pending-after-toddler-left-in-car-in-walmart-parking-lot-edmonton-police-1.6961827,negative,0.009345938,0.51159656,0.47905752,-0.2616436789678698
CTV,2024-07-12,RCMP catch excessive speeder after high-speed crash in Kelowna,https://bc.ctvnews.ca/rcmp-catch-excessive-speeder-after-high-speed-crash-in-kelowna-1.6961950,negative,0.016488414,0.5910641,0.3924474,-0.34908493081424297
CTV,2024-07-12,'Extreme fire behaviour': Labrador City ordered evacuated as wildfire approaches,https://www.ctvnews.ca/climate-and-environment/extreme-fire-behaviour-labrador-city-ordered-evacuated-as-wildfire-approaches-1.6962213,negative,0.012610443,0.54376805,0.44362152,-0.2955246672540994
CTV,2024-07-12,"Delta removes an employee, changes its uniform policy after backlash over social media post perceived to be anti-Palestinian",https://www.ctvnews.ca/world/delta-removes-an-employee-changes-its-uniform-policy-after-backlash-over-social-media-post-perceived-to-be-anti-palestinian-1.6962043,negative,0.0059888978,0.7948695,0.19914153,-0.6317816978946311
CTV,2024-07-12,Cancelled ferry sailings reinstated after 'mechanical difficulty' fixed: BC Ferries,https://bc.ctvnews.ca/cancelled-ferry-sailings-reinstated-after-mechanical-difficulty-fixed-bc-ferries-1.6961399,neutral,0.023169482,0.09715442,0.879676,-0.008902165476723845
CTV,2024-07-12,'He was loved': Family members devastated by death of Toronto man allegedly swarmed by teens,https://toronto.ctvnews.ca/he-was-loved-family-members-devastated-by-death-of-toronto-man-allegedly-swarmed-by-teens-1.6962152,negative,0.043597657,0.5419776,0.41442487,-0.29183888584865425
CTV,2024-07-12,Thieves take urn containing ashes of woman's dead son,/video/c2957528-mother-pleads-for-return-of-stolen-urn,negative,0.0118179675,0.62453157,0.36365053,-0.38989995859079585
CTV,2024-07-12,Child abduction attempt in Red Deer thwarted by witnesses: RCMP,https://edmonton.ctvnews.ca/red-deer/child-abduction-attempt-in-red-deer-thwarted-by-witnesses-rcmp-1.6962020,negative,0.017122796,0.30708823,0.675789,-0.09400997950015366
CTV,2024-07-12,B.C.'s campfire ban begins Friday amid heightened wildfire risk,https://bc.ctvnews.ca/b-c-s-campfire-ban-begins-friday-amid-heightened-wildfire-risk-1.6961357,negative,0.013317027,0.37249956,0.6141834,-0.13857857574714672
CTV,2024-07-12,"A detailed look at children's brains might show how sex and gender are different, new study says",https://www.ctvnews.ca/health/a-detailed-look-at-children-s-brains-might-show-how-sex-and-gender-are-different-new-study-says-1.6962554,neutral,0.048877448,0.027921556,0.92320096,0.0016093923061639703
CTV,2024-07-12,S&P/TSX composite breaks more records as investor optimism grows,https://www.ctvnews.ca/business/s-p-tsx-composite-breaks-more-records-as-investor-optimism-grows-1.6962234,positive,0.9127665,0.0034423636,0.08379112,0.8331308769084487
CTV,2024-07-12,Emergency workers uncover dozens of bodies in a Gaza City district after Israeli assault,https://www.ctvnews.ca/world/emergency-workers-uncover-dozens-of-bodies-in-a-gaza-city-district-after-israeli-assault-1.6961513,negative,0.017659694,0.56902915,0.4133113,-0.32348221183771386
CTV,2024-07-12,Jewish advocates say details around investigation into human-rights chief murky,https://www.ctvnews.ca/politics/jewish-advocates-say-details-around-investigation-into-human-rights-chief-murky-1.6961498,neutral,0.021917798,0.2209885,0.75709367,-0.04835553162075712
CTV,2024-07-12,Heat warning in effect for Windsor-Essex,https://windsor.ctvnews.ca/heat-warning-in-effect-for-windsor-essex-1.6961946,neutral,0.036343843,0.068896,0.8947602,-0.003425783120552861
CTV,2024-07-12,SpaceX rocket accident leaves company's Starlink satellites in wrong orbit,https://www.ctvnews.ca/business/spacex-rocket-accident-leaves-company-s-starlink-satellites-in-wrong-orbit-1.6961919,negative,0.02150871,0.48893288,0.48955843,-0.2385927198564488
CTV,2024-07-12,N.S. youth killed after heavy rain triggers flash floods,/video/c2957505-ctv-national-news--n-s--youth-killed-in-flood?playlistId=1.6961490,negative,0.0064721806,0.7960613,0.19746648,-0.6336717271989398
CTV,2024-07-12,"Housing complex for asylum seekers closing in Cornwall, Ont.",https://ottawa.ctvnews.ca/housing-complex-for-asylum-seekers-closing-in-cornwall-ont-1.6962310,neutral,0.01673232,0.10513327,0.8781345,-0.010773027246235856
CTV,2024-07-12,Total fire ban in B.C. as officials warn of wildfire risk,/video/c2957656-b-c--wide-campfire-ban-in-effect?playlistId=1.6962581,negative,0.01953092,0.3983883,0.58208084,-0.15833175517855125
CTV,2024-07-12,Argentina indicts 2 visiting French rugby players in a harrowing case of sexual assault,https://www.ctvnews.ca/sports/argentina-indicts-2-visiting-french-rugby-players-in-a-harrowing-case-of-sexual-assault-1.6962099,negative,0.008917434,0.6613358,0.32974678,-0.43728551482762157
CTV,2024-07-12,Sask. TikTok star 'Bella Brave' receives outpouring of support after return to hospital,https://regina.ctvnews.ca/sask-tiktok-star-bella-brave-receives-outpouring-of-support-after-return-to-hospital-1.6959986,positive,0.7271834,0.004250944,0.2685656,0.528777672108312
CTV,2024-07-12,"Three beaches with warnings, two closed due to bacteria levels",https://windsor.ctvnews.ca/three-beaches-with-warnings-two-closed-due-to-bacteria-levels-1.6962062,negative,0.022151886,0.58609277,0.3917553,-0.343014045853689
CTV,2024-07-12,"Woman, 87, pinned under her vehicle in Muskoka parking lot suffers serious injuries",https://barrie.ctvnews.ca/woman-87-pinned-under-her-vehicle-in-muskoka-parking-lot-suffers-serious-injuries-1.6962456,negative,0.0111652035,0.74170005,0.24713472,-0.5499943289826117
CTV,2024-07-12,JBS Foods Canada to produce 7 million kilograms of beef patties with new expansion,https://calgary.ctvnews.ca/jbs-foods-canada-to-produce-7-million-kilograms-of-beef-patties-with-new-expansion-1.6961860,neutral,0.14023937,0.011570835,0.8481896,0.01953322225908849
CTV,2024-07-12,'It's insane': Residents wake to crashed cars and police takedown on quiet Huron County street,https://london.ctvnews.ca/it-s-insane-residents-wake-to-crashed-cars-and-police-takedown-on-quiet-huron-county-street-1.6962005,negative,0.021132663,0.68201846,0.29684892,-0.4647025696958451
CTV,2024-07-12,"Newfoundland and Labrador aims to bring standards, oversight to for-profit shelters",https://www.ctvnews.ca/canada/newfoundland-and-labrador-aims-to-bring-standards-oversight-to-for-profit-shelters-1.6960165,neutral,0.15923469,0.013113306,0.82765216,0.02518370522135882
CTV,2024-07-12,'Her whole future ahead of her': Sask. photographer captures Manitoba graduate posing on iceberg,https://winnipeg.ctvnews.ca/her-whole-future-ahead-of-her-sask-photographer-captures-manitoba-graduate-posing-on-iceberg-1.6957208,positive,0.32662135,0.007128863,0.6662499,0.10663065937034943
CTV,2024-07-12,Canada is building new National Urban Parks. What are they?,https://www.ctvnews.ca/canada/canada-is-building-new-national-urban-parks-what-are-they-1.6962425,neutral,0.07117563,0.026027342,0.9027971,0.004388543929056965
CTV,2024-07-12,Early morning crime spree causes 'chaos' in Ont. town,/video/c2957544--chaos--early-morning-crime-spree,negative,0.007722324,0.73513496,0.25714266,-0.5403638174279095
CTV,2024-07-12,Northern Ont. First Nation chief among Indigenous leaders upset with Poilievre’s AFN speech,https://northernontario.ctvnews.ca/northern-ont-first-nation-chief-among-indigenous-leaders-upset-with-poilievre-s-afn-speech-1.6962235,negative,0.0083850585,0.5856275,0.40598738,-0.34288928949322184
CTV,2024-07-12,Ontario woman's licence suspended for 13-year-old ticket,/video/c2957582-woman-s-licence-suspended-for-13-year-old-ticket,negative,0.008114125,0.64782715,0.3440587,-0.4196142137717942
CTV,2024-07-12,Lethbridge policy committee says yes to Memorial Cup bid,https://calgary.ctvnews.ca/lethbridge-policy-committee-says-yes-to-memorial-cup-bid-1.6962408,neutral,0.17442228,0.0075534866,0.8180242,0.03036607871698127
CTV,2024-07-12,Calgary man wanted on Canada-wide warrant for murder,https://calgary.ctvnews.ca/calgary-man-wanted-on-canada-wide-warrant-for-murder-1.6962189,negative,0.009647688,0.8254232,0.16492932,-0.681230216623776
CTV,2024-07-12,A World War I veteran is first Tulsa Race Massacre victim identified from mass graves,https://www.ctvnews.ca/world/a-world-war-i-veteran-is-first-tulsa-race-massacre-victim-identified-from-mass-graves-1.6961942,negative,0.015151816,0.6075249,0.37732327,-0.36885692819098637
CBC,2024-07-12,"Water rushes down streets and floods N.S. homes, businesses after heavy rain",https://www.cbc.ca/player/play/video/9.6446135,negative,0.009844062,0.70287997,0.287276,-0.4939433193634759
CBC,2024-07-12,Jessica Campbell honoured to 'carry the torch' for women as NHL's first female assistant coach,https://www.cbc.ca/news/canada/jessica-campbell-coach-nhl-seattle-kraken-1.7262144,positive,0.9060082,0.0027442703,0.09124762,0.8208432446078362
CBC,2024-07-12,Anger and awe as Ambanis prepare for billionaire heir's extravagant wedding,https://www.cbc.ca/news/ambani-wedding-1.7260974,negative,0.039680883,0.6319187,0.32840025,-0.3977467761606164
CBC,2024-07-12,How to watch America Votes: Republican National Convention on CBC,https://www.cbc.ca/news/world/republican-national-convention-cbc-1.7262413,neutral,0.06141007,0.013490996,0.92509884,0.0035891942661678833
CBC,2024-07-12,NASA releases new 'Penguin and Egg' image from James Webb Space Telescope,https://www.cbc.ca/news/science/jwst-two-year-anniversary-1.7260994,neutral,0.22152941,0.0037256072,0.7747449,0.049061412042837205
CBC,2024-07-12,Tragedy strikes again nearly a year after deadly flood claimed lives of 4 Nova Scotians,https://www.cbc.ca/player/play/video/9.6446991,negative,0.00720354,0.8687864,0.124009974,-0.7547380050337358
CBC,2024-07-12,This pizza delivery man's car was stolen from under his nose,https://www.cbc.ca/player/play/video/9.6445452,negative,0.01720171,0.76266474,0.22013353,-0.5813616103764137
CBC,2024-07-12,Labrador City ordered to evacuate as wildfire draws nearer to town,https://www.cbc.ca/news/canada/newfoundland-labrador/wabush-labrador-city-fire-threat-1.7261579,neutral,0.021598136,0.17560017,0.80280167,-0.03036894543660118
CBC,2024-07-12,"'Familicide' very rarely happens without warning signs, say domestic violence researchers",https://www.cbc.ca/news/canada/windsor/familicide-domestic-violence-murder-suicide-walsh-harrow-1.7259570,negative,0.007888487,0.7303539,0.2617576,-0.5333545789718244
CBC,2024-07-12,N.S. officials assess flood damage in 'devastating day' after youth's death,https://www.cbc.ca/news/canada/nova-scotia/nova-scotia-death-flash-flooding-1.7261632,negative,0.006486114,0.8015623,0.19195168,-0.6424599829769173
CBC,2024-07-12,"Family of Edmonton man killed by police questioning how it happened, lawyer says",https://www.cbc.ca/news/canada/edmonton/mathios-arkangelo-1.7262714,negative,0.0077587105,0.5090338,0.48320752,-0.259055180826806
CBC,2024-07-12,AT&T data breach affected nearly all customers after info downloaded to 3rd-party platform,https://www.cbc.ca/news/business/data-breach-at-t-1.7262154,negative,0.010422101,0.75530124,0.23427671,-0.5703712939876127
CBC,2024-07-12,"Grassy Narrows First Nation taking Ontario to court over Mining Act, lack of consultation on land claims",https://www.cbc.ca/news/canada/thunder-bay/grassy-narrows-first-nation-mining-act-legal-action-1.7260724,negative,0.017224839,0.4865079,0.4962673,-0.23639322018683906
CBC,2024-07-12,"Judge drops charges against Alec Baldwin in Rust case, citing 'wilful' withholding of evidence",https://www.cbc.ca/news/entertainment/alec-baldwin-rust-shooting-charges-dismissed-1.7262655,negative,0.00978112,0.68155235,0.30866656,-0.464417916128836
CBC,2024-07-12,Poilievre wants to shut down Montreal's supervised drug-inhalation site and others that 'endanger the public',https://www.cbc.ca/news/canada/montreal/poilievre-shut-down-montreal-supervised-drug-inhalation-site-1.7261989,negative,0.0066707935,0.8108319,0.18249716,-0.6574040098107536
CBC,2024-07-12,"Poilievre won't commit to NATO 2% target, says he's 'inheriting a dumpster fire' budget balance",https://www.cbc.ca/news/politics/poilievre-dumpster-fire-economy-nato-1.7261981,negative,0.009003575,0.75426716,0.23672923,-0.5688379005722339
CBC,2024-07-12,Are you allowed to smash a window to save a dog from a hot car? Lawyers say law isn't clear,https://www.cbc.ca/news/canada/calgary/dead-dog-car-calgary-summer-heat-1.7261120,negative,0.013768423,0.6732023,0.31302938,-0.4530116759738263
CBC,2024-07-12,"Merritt, B.C., mayor bills province $103,831.87 for ER closures",https://www.cbc.ca/news/canada/british-columbia/merritt-mayor-bill-province-1.7262719,negative,0.016965332,0.28952459,0.6935102,-0.08353663854568438
CBC,2024-07-12,"Poilievre says his government will close supervised injection sites near schools, playgrounds",https://www.cbc.ca/player/play/video/9.6446234,negative,0.018002823,0.4086678,0.5733295,-0.16668522538393304
CBC,2024-07-12,Trudeau is asked if he wants to replace Freeland as finance minister,https://www.cbc.ca/player/play/video/9.6445426,neutral,0.0277377,0.05390941,0.9183531,-0.0021368395209542257
CBC,2024-07-12,WATCH: CBC News Network,https://www.cbc.cahttps://gem.cbc.ca/live,neutral,0.10073908,0.018231502,0.88102955,0.00981596340483426
CBC,2024-07-12,"Fredericton Pride cancels festival, board cites 'harassment'",https://www.cbc.ca/news/canada/new-brunswick/fredericton-pride-festival-cancelled-board-harassment-transgender-coalition-1.7261563,negative,0.006013109,0.83513397,0.15885292,-0.6974126025256489
CBC,2024-07-12,"Israel airstrike kills at least 4 aid workers in Gaza, IDF claims 1 is Hamas operative",https://www.cbc.ca/news/world/gaza-airstrike-israel-hamas-1.7262516,negative,0.005336767,0.8678123,0.12685092,-0.7530697037119918
CBC,2024-07-12,Biden news conference: Can he shake the doubters?,https://www.cbc.ca/player/play/video/9.6446011,neutral,0.12989609,0.014674746,0.85542923,0.016657638168722233
CBC,2024-07-12,"WATCH | No power, extreme heat: How things spiralled out of control in Texas",https://www.cbc.cahttps://www.cbc.ca/player/play/9.6446524,negative,0.011185602,0.6666568,0.32215765,-0.444306141659343
CBC,2024-07-12,"Canada's Arop nears personal best in Monaco 800m, setting stage for battle for Olympic gold in Paris",https://www.cbc.ca/sports/olympics/summer/athletics/arop-morales-williams-monaco-diamond-league-roundup-1.7262367,positive,0.5187201,0.005006224,0.47627354,0.26904553083659266
CBC,2024-07-12,This kind of public transportation is growing fast,https://www.cbc.ca/news/science/what-on-earth-bike-sharing-1.7260301,positive,0.4802697,0.03224439,0.48748592,0.22961928469730442
CBC,2024-07-12,This robot is using AI to help P.E.I. farmers detect potato viruses,https://www.cbc.ca/player/play/video/9.6444533,neutral,0.097346574,0.030915558,0.8717379,0.008520581755631085
CBC,2024-07-12,Authors drop out of Giller Prize to protest ties with Israeli defence contractor,https://www.cbc.ca/player/play/video/9.6446390,negative,0.0112001095,0.6805607,0.30823913,-0.4630374543728184
CBC,2024-07-12,"Heavy rains, flash flooding ravage parts of Nova Scotia",https://www.cbc.ca/player/play/video/9.6446133,negative,0.016124671,0.6515909,0.3322845,-0.4243106370405698
CBC,2024-07-12,Remains of 2 people found after life-raft washes ashore on Sable Island,https://www.cbc.ca/news/canada/nova-scotia/two-people-dead-boat-washes-ashore-sable-island-1.7261746,negative,0.024959464,0.35426915,0.6207712,-0.12488370214746602
CBC,2024-07-12,The new Stanley x Olivia Rodrigo mug is $72. Is it worth it?,https://www.cbc.cahttps://www.cbc.ca/kidsnews/post/the-new-stanley-x-olivia-rodrigo-mug-is-72-is-it-worth-it,neutral,0.10651291,0.025907286,0.8675798,0.0106738116976004
CBC,2024-07-12,See crews remove the roof of Montreal’s Olympic Stadium,https://www.cbc.ca/player/play/video/9.6445696,neutral,0.043353558,0.06365307,0.8929934,-0.002172181649325644
CBC,2024-07-12,Meet the world's biggest reconstructed stegosaurus skeleton,https://www.cbc.ca/player/play/video/9.6445469,positive,0.44599238,0.01814738,0.53586036,0.1985798249841082
CBC,2024-07-12,Tax agency watchdog looking into rollout of 'bare trust' reporting requirement,https://www.cbc.ca/news/politics/cra-bare-trust-taxation-1.7262343,negative,0.021061502,0.23769656,0.7412419,-0.0560560795131444
CBC,2024-07-12,This Canadian got caught supplying Russia with $7M in weapon parts,https://www.cbc.ca/news/investigates/canadian-caught-supplying-russia-weapons-parts-1.7262446,negative,0.016045235,0.62960577,0.35434908,-0.39614594033405837
CBC,2024-07-12,The National | Fatal flash flooding in N.S.,https://www.cbc.ca/player/play/video/9.4236164,negative,0.0150833,0.63534117,0.34957546,-0.4034309296962135
CBC,2024-07-12,Western University pauses research chair honouring Alice Munro after daughter speaks out,https://www.cbc.ca/news/canada/london/alice-munro-western-university-chair-legacy-1.7262505,negative,0.009679118,0.52253544,0.46778542,-0.27294960378575794
CBC,2024-07-12,"Canadian government buys new 3,600-square-foot condo for consul general in New York",https://www.cbc.ca/news/politics/global-affairs-consul-new-york-condo-1.7262656,neutral,0.05091579,0.024883049,0.924201,0.001973255374744909
CBC,2024-07-12,Victoria Gold warns it might not reopen Yukon gold mine or have the money to remediate it,https://www.cbc.ca/news/canada/north/victoria-gold-no-money-to-remediate-yukon-gold-mine-1.7262282,negative,0.005521634,0.8109387,0.18353957,-0.6575911603336522
CBC,2024-07-12,Biden says he'd restore Roe v. Wade at start of 2nd term if re-elected,https://www.cbc.ca/news/world/biden-detroit-100-days-campaign-1.7262819,positive,0.29948485,0.01506548,0.6854496,0.08946422269389132
