source,date,headline,url,chosen_label,positive,negative,neutral,compound
Global,2024-03-16,Pair to cycle across Canada in aid of mental health,https://globalnews.ca/video/10364976/pair-to-cycle-across-canada-in-aid-of-mental-health/,neutral,0.21800967,0.012196635,0.7697936,0.04737947184375635
Global,2024-03-16,Calgary-area project restores derelict 1905 hotel: ‘So cool’,https://globalnews.ca/video/10365005/calgary-area-project-restores-derelict-1905-hotel-so-cool/,positive,0.9629346,0.0033264672,0.033739034,0.9272318859431825
Global,2024-03-16,A N.B. mother says she can’t find housing because she has a child,https://globalnews.ca/news/10363581/new-brunswick-woman-cant-find-apartment-due-to-children/,negative,0.007486061,0.7288144,0.26369953,-0.5311144224205009
Global,2024-03-16,"Leave car keys by the front door to avoid home invasion, Toronto police officer says",https://globalnews.ca/news/10359055/leave-car-keys-the-front-door-to-avoid-home-invasion-toronto-police/,neutral,0.04594681,0.04491204,0.9091411,9.401805446862532e-05
Global,2024-03-16,Global News Hour at 6 Calgary: March 15,https://globalnews.ca/video/10365042/global-news-hour-at-6-calgary-march-15-2/,neutral,0.03632929,0.008934122,0.95473665,0.0012399971765286733
Global,2024-03-16,Who is Rose Hanbury and how does she tie into the Kate Middleton drama?,https://globalnews.ca/news/10357389/rose-hanbury-prince-william-affair-kate-middleton-drama-lies-rumours/,neutral,0.028713914,0.011759607,0.9595265,0.0006862004765564311
Global,2024-03-16,St. Patrick’s day trends are changing.,https://globalnews.ca/video/10365088/st-patricks-day-trends-are-changing/,neutral,0.073559254,0.058258936,0.8681819,0.002016859167468077
Global,2024-03-16,"BC Hydro power pole deliberately set on fire, Nanaimo RCMP say",https://globalnews.ca/news/10364427/nanaimo-power-pole-fire/,negative,0.007922723,0.5899885,0.40208876,-0.34802369583880477
Global,2024-03-16,"As alcohol consumption declines, a St. Patrick’s Day with fewer raised glasses",https://globalnews.ca/news/10364956/st-patricks-day-less-drinking/,negative,0.059147492,0.24013287,0.7007197,-0.05416535513275811
Global,2024-03-16,Brian Mulroney’s state funeral to take place at Notre-Dame Basilica. What you should know,https://globalnews.ca/news/10364911/brian-mulroney-state-funeral-location-eulogies/,neutral,0.038608253,0.05777924,0.9036124,-0.0018478460310928924
Global,2024-03-16,Woman rescued from Toronto’s Humber River dies in hospital,https://globalnews.ca/news/10365252/woman-rescued-humber-river-dies/,negative,0.035079908,0.272975,0.69194514,-0.07328473858630513
Global,2024-03-16,Toronto school boards say they’re struggling to build urgently needed daycares,https://globalnews.ca/video/10343471/toronto-school-boards-say-theyre-struggling-to-build-urgently-needed-daycares/,negative,0.012333951,0.6841703,0.3034957,-0.4679369214678957
Global,2024-03-16,Global News at 5 Lethbridge: March 15,https://globalnews.ca/video/10364941/global-news-at-5-lethbridge-march-15-3/,neutral,0.027876483,0.016603408,0.95552003,0.0005014259898961093
Global,2024-03-16,"“I’m coming for you,” Doug Ford tells carjackers in Ontario, promising to build more jails",https://globalnews.ca/video/10344856/im-coming-for-you-doug-ford-tells-carjackers-in-ontario-promising-to-build-more-jails/,negative,0.08648161,0.25571415,0.65780425,-0.05791065832060838
Global,2024-03-16,Treaty 8 First Nations of Alberta implement adoption law to end private adoption of Treaty 8 children,https://globalnews.ca/news/10364819/treaty-8-first-nations-alberta-adoption-law/,neutral,0.022515802,0.13240588,0.8450783,-0.01702435815848169
Global,2024-03-16,Kate Middleton’s absence continues to fuel conspiracy theories about health,https://globalnews.ca/video/10359440/kate-middletons-absence-continues-to-fuel-conspiracy-theories-about-health/,negative,0.012386771,0.6094317,0.37818155,-0.371253526904729
Global,2024-03-16,B.C. wine industry at a crossroads after ‘catastrophic’ losses,https://globalnews.ca/news/10362986/bc-wine-industry-catastrophic-loss-recovery-plan/,negative,0.01383705,0.7103798,0.27578318,-0.5044479672321813
Global,2024-03-16,Doctors ‘smuggling education’ into social media content to drown out misinformation,https://globalnews.ca/news/10365260/doctors-social-media-misinformation/,negative,0.026646288,0.28442553,0.6889282,-0.08018785575722376
Global,2024-03-16,‘I think it’s crazy’: Toronto home invasion victim slams advice from police officer,https://globalnews.ca/news/10364143/toronto-home-invasion-victim-police-advice-reaction/,negative,0.0052474583,0.8759661,0.11878639,-0.7672890818455018
Global,2024-03-16,CEOs urge CPP investment in Canadian companies in open letter to Chrystia Freeland,https://globalnews.ca/video/10365110/ceos-urge-cpp-investment-in-canadian-companies-in-open-letter-to-chrystia-freeland/,neutral,0.06411277,0.038406476,0.8974807,0.002635390304703833
Global,2024-03-16,Daycare providers upset over loss of Childhood Connections in Kelowna,https://globalnews.ca/news/10364372/daycare-providers-upset-over-loss-of-childhood-connections-in-kelowna/,negative,0.01271661,0.7036616,0.28362185,-0.4949779234499161
Global,2024-03-16,Toronto dog DNA testing company IDs woman as 40% Alaskan Malamute,https://globalnews.ca/news/10359199/dna-my-dog-testing-human-swab-id/,neutral,0.036432877,0.10238139,0.8611857,-0.009154595156966039
Global,2024-03-16,Ford on Toronto police officer’s auto theft advice: ‘Might as well leave cookies and milk’,https://globalnews.ca/news/10363506/doug-ford-toronto-police-car-keys-front-door-reaction/,negative,0.016564263,0.4682306,0.51520497,-0.218965605962552
Global,2024-03-16,Meet an Ontario family who say they’re out of options for child care,https://globalnews.ca/news/10359922/meet-an-ontario-family-who-say-theyre-out-of-options-for-child-care/,negative,0.019187303,0.5939432,0.38686937,-0.35240041430695257
Global,2024-03-16,Vancouver Island Wolf-dog WD40 attacks another dog,https://globalnews.ca/video/10365055/vancouver-island-wolf-dog-wd40-attacks-another-dog/,negative,0.020813465,0.3823852,0.5968012,-0.14578527959355014
Global,2024-03-16,Trudeau rejects Quebec’s ask for total powers on immigration,https://globalnews.ca/video/10365107/trudeau-rejects-quebecs-ask-for-total-powers-on-immigration/,negative,0.020698253,0.33841488,0.6408868,-0.11409624029731447
Global,2024-03-16,Human remains identified as family of 3 from Brampton house fire,https://globalnews.ca/news/10362656/brampton-fatal-house-fire-human-remains-identified/,neutral,0.020156765,0.21746707,0.76237607,-0.04688564859765876
Global,2024-03-16,Saskatchewan rural crime rates a focus on final day of SARM convention,https://globalnews.ca/news/10364856/saskatchewan-rural-crime-rates-sarm-convention/,neutral,0.018000454,0.22063869,0.76136094,-0.0483573981236578
Global,2024-03-16,Calgary Board of Education all boys program faces possible closure,https://globalnews.ca/video/10364991/calgary-board-of-education-all-boys-program-faces-possible-closure/,negative,0.011339527,0.60849935,0.38016117,-0.3701428358355585
Global,2024-03-16,Calgary to warm up for Saint Patrick’s Day,https://globalnews.ca/video/10364938/calgary-to-warm-up-for-saint-patricks-day/,neutral,0.15034944,0.008920559,0.8407299,0.022525391832032504
Global,2024-03-16,Standoff continues in southeast Calgary after police face gunshots,https://globalnews.ca/video/10364993/standoff-continues-in-southeast-calgary-after-police-face-gunshots/,negative,0.011369407,0.44269708,0.5459335,-0.19585145229552126
Global,2024-03-16,Ontario couple celebrating 65 years of marriage. Learn their secret to happiness,https://globalnews.ca/news/10362841/wasaga-beach-ont-couple-celebrating-65-year-marriage-secret-to-happiness/,positive,0.9381673,0.0021972656,0.059635483,0.8801529851045404
Global,2024-03-16,Car theft continues in Peel Region after government grant to tackle crime,https://globalnews.ca/video/10346569/car-theft-continues-in-peel-region-after-government-grant-to-tackle-crime/,negative,0.008456592,0.80469465,0.18684882,-0.6474619225178699
Global,2024-03-16,ArriveCan app: A look at Canada’s procurement process after baffling testimony from contractors,https://globalnews.ca/video/10365115/arrivecan-app-a-look-at-canadas-procurement-process-after-baffling-testimony-from-contractors/,negative,0.030304486,0.49238202,0.47731346,-0.24152170494589065
CTV,2024-03-16,Conservative leader Poilievre makes campaign style stops in the Maritimes,https://atlantic.ctvnews.ca/conservative-leader-poilievre-makes-campaign-style-stops-in-the-maritimes-1.6809764,neutral,0.05069919,0.0058109555,0.94348985,0.002536640948025859
CTV,2024-03-16,Israel approves plans for a ground offensive in Rafah,/video/c2886643-ctv-national-news--ground-offensive-in-rafah?playlistId=1.6595387,neutral,0.051626,0.17531747,0.7730565,-0.028070974113276748
CTV,2024-03-16,SaskEnergy announces new rebate program for energy-efficient homes,https://saskatoon.ctvnews.ca/saskenergy-announces-new-rebate-program-for-energy-efficient-homes-1.6810061,positive,0.5705295,0.0060432246,0.42342734,0.3254673799146559
CTV,2024-03-16,Canada reduces diplomatic footprint in Haiti citing 'volatile' environment,https://www.ctvnews.ca/politics/canada-reduces-diplomatic-footprint-in-haiti-citing-volatile-environment-1.6807484,negative,0.01854638,0.34961352,0.63184017,-0.12188562396298508
CTV,2024-03-16,Quebec woman gives birth outside after finding hospital door locked,https://montreal.ctvnews.ca/quebec-woman-gives-birth-outside-after-finding-hospital-door-locked-1.6809784,neutral,0.019535227,0.11676159,0.8637032,-0.013251642448333545
CTV,2024-03-16,Sault ponders bid for med school campus as physician crisis nears,https://northernontario.ctvnews.ca/sault-ponders-bid-for-med-school-campus-as-physician-crisis-nears-1.6809260,negative,0.02320983,0.25682655,0.71996355,-0.06542119808789693
CTV,2024-03-16,Extended cut of Taylor Swift’s ‘Eras Tour’ movie hits streaming with ‘Cardigan’ and four bonus songs,https://www.ctvnews.ca/entertainment/extended-cut-of-taylor-swift-s-eras-tour-movie-hits-streaming-with-cardigan-and-four-bonus-songs-1.6810073,neutral,0.12847602,0.00443658,0.8670873,0.01648641648633209
CTV,2024-03-16,'Lighthearted' Vancouver Whitecaps confident ahead of FC Dallas matchup,https://bc.ctvnews.ca/lighthearted-vancouver-whitecaps-confident-ahead-of-fc-dallas-matchup-1.6809627,positive,0.5700824,0.0038020457,0.42611557,0.32497948309378444
CTV,2024-03-16,"'You just have to laugh': Winnipeg woman's car stolen, recovered and then stolen again",https://winnipeg.ctvnews.ca/you-just-have-to-laugh-winnipeg-woman-s-car-stolen-recovered-and-then-stolen-again-1.6809869,negative,0.020410964,0.6161358,0.36345327,-0.37920668743797137
CTV,2024-03-16,Cold is coming: More wild temperature swings expected soon,/video/c2885915-forecast--wild-temperature-swings-continue,negative,0.044142183,0.50574285,0.4501149,-0.2538273230937236
CTV,2024-03-16,"CSU 52, library workers to receive 6.25% increase, $1k lump sum under tentative agreement with city",https://edmonton.ctvnews.ca/csu-52-library-workers-to-receive-6-25-increase-1k-lump-sum-under-tentative-agreement-with-city-1.6809527,neutral,0.18898103,0.008000239,0.8030187,0.035649832598112496
CTV,2024-03-16,Calgary standoff comes to an end; some residents allowed to return,https://calgary.ctvnews.ca/calgary-standoff-comes-to-an-end-some-residents-allowed-to-return-1.6809200,neutral,0.12102801,0.014586953,0.8643851,0.014434990483582766
CTV,2024-03-16,Toronto police make arrest as pro-Palestinian protesters rally outside Trudeau event,https://toronto.ctvnews.ca/toronto-police-make-arrest-as-pro-palestinian-protesters-rally-outside-trudeau-event-1.6810067,negative,0.013451877,0.5903842,0.39616403,-0.3483724817663152
CTV,2024-03-16,Rally held for construction worker killed in Vancouver crane incident,https://bc.ctvnews.ca/rally-held-for-construction-worker-killed-in-vancouver-crane-incident-1.6810106,negative,0.011303615,0.5841528,0.40454355,-0.3411067600741635
CTV,2024-03-16,"In search for freedom, Chinese migrants increasingly risk it all by braving the Darien Gap",https://www.ctvnews.ca/w5/in-search-for-freedom-chinese-migrants-increasingly-risk-it-all-by-braving-the-darien-gap-1.6809429,negative,0.030352456,0.42248905,0.5471585,-0.17757573574041174
CTV,2024-03-16,Video shows large flames engulfing Brampton home where remains of family were found,https://toronto.ctvnews.ca/video-shows-large-flames-engulfing-brampton-home-where-remains-of-family-were-found-1.6808704,negative,0.010961535,0.6120053,0.37703314,-0.37443034182775214
CTV,2024-03-16,Here's what's happening in Toronto this St. Patrick's Day weekend,https://toronto.ctvnews.ca/here-s-what-s-happening-in-toronto-this-st-patrick-s-day-weekend-1.6809398,neutral,0.1005188,0.0051081595,0.894373,0.0100779394449515
CTV,2024-03-16,Here are the locations the health unit says you may have been exposed to the measles virus,https://barrie.ctvnews.ca/here-are-the-locations-the-health-unit-says-you-may-have-been-exposed-to-the-measles-virus-1.6809210,negative,0.02467509,0.36317328,0.6121515,-0.13128600827636916
CTV,2024-03-16,Tesla settles race bias lawsuit by Black former worker after US$3 million verdict,https://www.ctvnews.ca/business/tesla-settles-race-bias-lawsuit-by-black-former-worker-after-us-3-million-verdict-1.6809369,negative,0.017353373,0.5173111,0.46533543,-0.26730967494765956
CTV,2024-03-16,Carjacking caught on camera as local vehicle thefts keep rising,https://kitchener.ctvnews.ca/carjacking-caught-on-camera-as-local-vehicle-thefts-keep-rising-1.6809588,negative,0.012737121,0.72848916,0.25877365,-0.5305342874160655
CTV,2024-03-16,Cryptocurrency fraud: Prosecutors seek up to 50 years in prison for Sam Bankman-Fried,https://www.ctvnews.ca/business/cryptocurrency-fraud-prosecutors-seek-up-to-50-years-in-prison-for-sam-bankman-fried-1.6809458,negative,0.014546056,0.6500449,0.335409,-0.42234684619044316
CTV,2024-03-16,RCMP investigating suspicious death in a Sask. home,https://saskatoon.ctvnews.ca/rcmp-investigating-suspicious-death-in-a-sask-home-1.6809804,negative,0.017331365,0.23764513,0.7450235,-0.056174837052733295
CTV,2024-03-16,Windows smashed as annual anti-police brutality march takes place in Montreal,https://montreal.ctvnews.ca/windows-smashed-as-annual-anti-police-brutality-march-takes-place-in-montreal-1.6809815,negative,0.010849138,0.8282307,0.1609201,-0.6858484395881996
CTV,2024-03-16,Victoria council approves 25 per cent pay hike. Here's how much councillors will make,https://bc.ctvnews.ca/victoria-council-approves-25-per-cent-pay-hike-here-s-how-much-councillors-will-make-1.6809168,neutral,0.16231437,0.01775436,0.8199313,0.026030728845467976
CTV,2024-03-16,"Cowan continues point streak, tying franchise record",https://london.ctvnews.ca/cowan-continues-point-streak-tying-franchise-record-1.6810224,positive,0.6223998,0.005450029,0.37215012,0.3873518538849652
CTV,2024-03-16,Terrorism peace bond hearing set for Calgary teen in TikTok video case,https://calgary.ctvnews.ca/terrorism-peace-bond-hearing-set-for-calgary-teen-in-tiktok-video-case-1.6809339,negative,0.013905774,0.52386576,0.46222854,-0.274241933185138
CTV,2024-03-16,Senior who 'likely' saved stranger's life during Vancouver Island crash dies from injuries,https://bc.ctvnews.ca/senior-who-likely-saved-stranger-s-life-during-vancouver-island-crash-dies-from-injuries-1.6803339,negative,0.03309627,0.38516146,0.5817422,-0.14725400880690387
CTV,2024-03-16,Tesla is the worst performing stock in the S&P 500. Analysts say it has further to fall,https://www.ctvnews.ca/business/tesla-is-the-worst-performing-stock-in-the-s-p-500-analysts-say-it-has-further-to-fall-1.6807625,negative,0.0063517503,0.9454488,0.04819945,-0.8938330868856226
CTV,2024-03-16,No concerns about kids' use of TikTok despite security review: industry minister,https://www.ctvnews.ca/politics/no-concerns-about-kids-use-of-tiktok-despite-security-review-industry-minister-1.6809104,neutral,0.085470594,0.092129104,0.8224003,-0.0011825494543638015
CTV,2024-03-16,Suspicious package call in south Regina determined to be hoax: police,https://regina.ctvnews.ca/suspicious-package-call-in-south-regina-determined-to-be-hoax-police-1.6809583,negative,0.021152543,0.38459802,0.59424937,-0.14746822551962424
CTV,2024-03-16,'Larger systemic failure': Advocates call for change to the child welfare system following comments from police chief,https://winnipeg.ctvnews.ca/larger-systemic-failure-advocates-call-for-change-to-the-child-welfare-system-following-comments-from-police-chief-1.6809960,negative,0.00634687,0.8307876,0.1628656,-0.6901676904673515
CTV,2024-03-16,Here’s how it feels in Ottawa this Saturday,https://ottawa.ctvnews.ca/here-s-how-it-feels-in-ottawa-this-saturday-1.6810287,neutral,0.039596517,0.023407428,0.93699616,0.0010199747445626128
CTV,2024-03-16,Hamilton enforcing 'nuisance party' bylaw with court injunction amid St. Patrick's Day weekend,https://toronto.ctvnews.ca/hamilton-enforcing-nuisance-party-bylaw-with-court-injunction-amid-st-patrick-s-day-weekend-1.6809604,neutral,0.025902534,0.17624259,0.7978549,-0.030390504479882452
CTV,2024-03-16,CTV National News for March 15: Debate on immigration,/video/c2878559-ctv-national-news-for-friday--march-15--2024?playlistId=1.6810260,neutral,0.024028962,0.014346294,0.96162474,0.00037157490125783177
CTV,2024-03-16,'My heart is broken today': L.A. home that appears to belong to model and actor Cara Delevingne is destroyed in fire,https://www.ctvnews.ca/entertainment/my-heart-is-broken-today-l-a-home-that-appears-to-belong-to-model-and-actor-cara-delevingne-is-destroyed-in-fire-1.6809586,negative,0.009119094,0.8533577,0.13752311,-0.7281362603175019
CTV,2024-03-16,Police looking for suspect after loss prevention officer threatened,https://windsor.ctvnews.ca/police-looking-for-suspect-after-loss-prevention-officer-threatened-1.6808969,negative,0.011014286,0.52269685,0.46628883,-0.27309070063163965
CTV,2024-03-16,"Montreal man returns from vacation, gets letter from Quebec government saying he's dead",https://montreal.ctvnews.ca/montreal-man-returns-from-vacation-gets-letter-from-quebec-government-saying-he-s-dead-1.6808017,negative,0.011929381,0.5994588,0.38861176,-0.35920857638021886
CTV,2024-03-16,'Baloney factory': Eby mocks Poilievre letter asking B.C. to join carbon price fight,https://bc.ctvnews.ca/baloney-factory-eby-mocks-poilievre-letter-asking-b-c-to-join-carbon-price-fight-1.6810150,negative,0.0136713125,0.38748947,0.59883916,-0.14996120530005896
CTV,2024-03-16,RTB decision allowing eviction for landlord's use found 'patently unreasonable' in B.C. court,https://bc.ctvnews.ca/rtb-decision-allowing-eviction-for-landlord-s-use-found-patently-unreasonable-in-b-c-court-1.6809986,negative,0.010004363,0.63227886,0.35771683,-0.3996764509203352
CTV,2024-03-16,Halifax Mooseheads player suspended after impaired charges,https://atlantic.ctvnews.ca/more/halifax-mooseheads-player-suspended-after-impaired-charges-1.6809155,negative,0.013362611,0.46894056,0.5176968,-0.2197266991707547
CTV,2024-03-16,10 distracted drivers nabbed in 3 hours in Elmvale,https://barrie.ctvnews.ca/10-distracted-drivers-nabbed-in-3-hours-in-elmvale-1.6809806,negative,0.023599813,0.47179693,0.50460315,-0.22203544570942313
CTV,2024-03-16,Open-ocean orcas that hunt the world's biggest predators may be a new population: UBC researchers,https://bc.ctvnews.ca/open-ocean-orcas-that-hunt-the-world-s-biggest-predators-may-be-a-new-population-ubc-researchers-1.6809499,neutral,0.054432657,0.16729674,0.77827054,-0.025025290570948044
CTV,2024-03-16,BC Corrections issues warning about 'high-risk' offender amid scrutiny of notification process,https://bc.ctvnews.ca/bc-corrections-issues-warning-about-high-risk-offender-amid-scrutiny-of-notification-process-1.6806539,negative,0.0125818765,0.37038296,0.6170351,-0.13702525797402387
CTV,2024-03-16,Regina woman speaks out after family dog fatally injured at local dog park,https://regina.ctvnews.ca/regina-woman-speaks-out-after-family-dog-fatally-injured-at-local-dog-park-1.6806648,negative,0.008436776,0.73354506,0.25801808,-0.5380172259191269
CTV,2024-03-16,'I was stunned': DNA tests reveal hidden family secret for B.C. woman,https://www.ctvnews.ca/canada/i-was-stunned-dna-tests-reveal-hidden-family-secret-for-b-c-woman-1.6810193,negative,0.0377694,0.23154393,0.73068655,-0.052186085763885615
CTV,2024-03-16,"Canada could follow U.S. and ban TikTok, tech analyst says",https://www.ctvnews.ca/sci-tech/canada-could-follow-u-s-and-ban-tiktok-tech-analyst-says-1.6809795,neutral,0.032527585,0.12187473,0.84559774,-0.01379539982995226
CTV,2024-03-16,A warming island's mice are breeding out of control and eating seabirds. An extermination is planned,https://www.ctvnews.ca/climate-and-environment/a-warming-island-s-mice-are-breeding-out-of-control-and-eating-seabirds-an-extermination-is-planned-1.6810301,negative,0.009671299,0.8571445,0.1331842,-0.7346031680277889
CTV,2024-03-16,Curling for pride: Canadian Pride Curling Championship gets underway in St. John's,https://www.ctvnews.ca/sports/curling-for-pride-canadian-pride-curling-championship-gets-underway-in-st-john-s-1.6808059,positive,0.73297745,0.002544358,0.2644782,0.537249468369339
CTV,2024-03-16,Tornadoes kill 3 and leave trails of destruction in the central U.S.,https://www.ctvnews.ca/climate-and-environment/tornadoes-kill-3-and-leave-trails-of-destruction-in-the-central-u-s-1.6809433,negative,0.0062790015,0.88148606,0.11223491,-0.7769782777302199
CTV,2024-03-16,Rezoning for Housing community walking tour of Capitol Hill cancelled after organizers receive threats,https://calgary.ctvnews.ca/rezoning-for-housing-community-walking-tour-of-capitol-hill-cancelled-after-organizers-receive-threats-1.6810040,negative,0.011631408,0.548801,0.43956757,-0.3010472528194441
CTV,2024-03-16,Magazine names Alberta town among the 'most beautiful in the world',https://calgary.ctvnews.ca/magazine-names-alberta-town-among-the-most-beautiful-in-the-world-1.6806309,positive,0.8894725,0.0049426034,0.10558479,0.791136983619888
CTV,2024-03-16,Giving up on B.C. health care: Why a Port Alberni man went to Mexico for surgery,https://bc.ctvnews.ca/giving-up-on-b-c-health-care-why-a-port-alberni-man-went-to-mexico-for-surgery-1.6810162,negative,0.009392473,0.70261353,0.28799403,-0.4935775157387994
CTV,2024-03-16,"TikTok creators warn of economic impact if app sees ban, call it a vital space for the marginalized",https://www.ctvnews.ca/business/tiktok-creators-warn-of-economic-impact-if-app-sees-ban-call-it-a-vital-space-for-the-marginalized-1.6810308,neutral,0.12594014,0.16297622,0.7110836,-0.010700330136292457
CTV,2024-03-16,Hamilton refuses to pay hackers 'huge' ransom in wake of cyberattack,https://toronto.ctvnews.ca/hamilton-refuses-to-pay-hackers-huge-ransom-in-wake-of-cyberattack-1.6809258,negative,0.01062538,0.66908765,0.3202871,-0.44756530440949405
CTV,2024-03-16,Buying an EV can save you money the longer and farther you drive it: UBC study,https://bc.ctvnews.ca/buying-an-ev-can-save-you-money-the-longer-and-farther-you-drive-it-ubc-study-1.6805794,positive,0.4336282,0.014313496,0.5520583,0.18782855364634976
CTV,2024-03-16,Riders sign Fiesta Bowl record-holding QB Jack Coan,https://regina.ctvnews.ca/riders-sign-fiesta-bowl-record-holding-qb-jack-coan-1.6809593,neutral,0.14620265,0.004901498,0.8488957,0.021351208089583906
CTV,2024-03-16,Ceasefire talks with Israel and Hamas expected to restart,https://www.ctvnews.ca/world/ceasefire-talks-with-israel-and-hamas-expected-to-restart-1.6810291,neutral,0.04864558,0.03554349,0.91581094,0.0011030524484412219
CTV,2024-03-16,"Mounties arrest suspect after alleged sexual assault, indecent exposure in Langford, B.C.",https://bc.ctvnews.ca/mounties-arrest-suspect-after-alleged-sexual-assault-indecent-exposure-in-langford-b-c-1.6809467,negative,0.007931795,0.52676743,0.46530077,-0.2774210306471794
CTV,2024-03-16,Lethbridge police seek woman wanted on warrants,https://calgary.ctvnews.ca/lethbridge-police-seek-woman-wanted-on-warrants-1.6809159,neutral,0.023497127,0.12596251,0.8505403,-0.01531444752370792
CTV,2024-03-16,Man who posed as cop during deadly Vancouver home invasion sentenced to 7 years,https://bc.ctvnews.ca/man-who-posed-as-cop-during-deadly-vancouver-home-invasion-sentenced-to-7-years-1.6809487,negative,0.010499301,0.70505637,0.2844443,-0.49699426932596324
CTV,2024-03-16,‘It was my dream’: Sask. singer takes stage on Canada’s Got Talent,https://saskatoon.ctvnews.ca/it-was-my-dream-sask-singer-takes-stage-on-canada-s-got-talent-1.6809942,positive,0.61430746,0.0048676417,0.38082507,0.37734987483224813
CTV,2024-03-16,Truck stolen from Kanata North driveway stopped by Ottawa police,https://ottawa.ctvnews.ca/truck-stolen-from-kanata-north-driveway-stopped-by-ottawa-police-1.6810306,negative,0.015590036,0.46506304,0.5193468,-0.2160406445484373
CTV,2024-03-16,"New allegations of unpaid work at Kitchener, Ont. grocer",https://kitchener.ctvnews.ca/new-allegations-of-unpaid-work-at-kitchener-ont-grocer-1.6809696,negative,0.009742123,0.4921521,0.49810562,-0.24211886199190946
CTV,2024-03-16,"Crab meat, fish cakes in luggage that was delayed for several days, traveller gets $780 from Flair Airlines",https://bc.ctvnews.ca/crab-meat-fish-cakes-in-luggage-that-was-delayed-for-several-days-traveller-gets-780-from-flair-airlines-1.6808010,negative,0.0159092,0.6886615,0.29542935,-0.4740015406407636
CTV,2024-03-16,'I'm struggling': Repayments of COVID-19 benefits leaving some Torontonians with little to spare,https://toronto.ctvnews.ca/i-m-struggling-repayments-of-covid-19-benefits-leaving-some-torontonians-with-little-to-spare-1.6802740,negative,0.019024799,0.64614064,0.33483452,-0.41713581498559194
