source,date,headline,url,chosen_label,positive,negative,neutral,compound
Global,2024-03-26,Sask. economy relatively strong: Desjardins economist,https://globalnews.ca/video/10384344/sask-economy-relatively-strong-desjardins-economist/,positive,0.37787625,0.009956853,0.61216694,0.14269130065691016
Global,2024-03-26,Metro Vancouver shelters see increase in abandoned pets,https://globalnews.ca/video/10383684/metro-vancouver-shelters-see-increase-in-abandoned-pets/,negative,0.02506308,0.3799904,0.5949465,-0.14376455646027964
Global,2024-03-26,"Toddler survives deadly Manitoba car crash, others sustain serious injuries",https://globalnews.ca/video/10383792/toddler-survives-deadly-manitoba-car-crash-others-sustain-serious-injuries/,negative,0.025804114,0.5275887,0.44660714,-0.27768402609472354
Global,2024-03-26,Toronto woman speaks out after being carjacked: ‘We are getting victimized here’,https://globalnews.ca/news/10382691/toronto-woman-speaks-out-carjacking/,negative,0.006716212,0.7936112,0.19967273,-0.6297735574589964
Global,2024-03-26,"Sticky spot: Canada’s maple syrup production hits 5-year low, reserves sink",https://globalnews.ca/news/10382527/maple-syrup-production-reserves-low-canada/,negative,0.009965317,0.7328519,0.2571827,-0.5369726977454636
Global,2024-03-26,Moncton microbrewer brews batch of Ukrainian beer: ‘A taste of freedom’,https://globalnews.ca/news/10384733/moncton-microbrewer-ukrainian-beer/,positive,0.2256456,0.007862252,0.76649195,0.05085416472345283
Global,2024-03-26,UBC Engineering students behind  interesting stunts in the city,https://globalnews.ca/video/10383767/ubc-engineering-students-behind-some-of-the-most-interesting-stunts-in-the-city/,positive,0.842134,0.0035118132,0.1543542,0.7091773519065061
Global,2024-03-26,Canada begins Haiti airlift evacuations after weather delay,https://globalnews.ca/news/10384953/canada-haiti-airlift-evacuations/,neutral,0.019803172,0.1296178,0.8505789,-0.016408621085886033
Global,2024-03-26,No threat found after weapons call prompts large police response at Dalhousie University,https://globalnews.ca/news/10384834/dalhousie-university-police-presence-weapons-complaint/,neutral,0.05113057,0.106956765,0.8419128,-0.008825406451637985
Global,2024-03-26,Calgary woman offering $50k reward for information in hit and run,https://globalnews.ca/video/10383661/calgary-woman-offering-50k-reward-for-information-in-hit-and-run/,neutral,0.081487834,0.06100071,0.85751134,0.0029191830935133556
Global,2024-03-26,Ex-member of Chinese cyber warfare department was living in Winnipeg: officials,https://globalnews.ca/video/10383529/ex-member-of-chinese-cyber-warfare-department-was-living-in-winnipeg-officials/,neutral,0.025084099,0.0845293,0.8903865,-0.006515995390987683
Global,2024-03-26,What’s behind Canada’s productivity problem and why it matters,https://globalnews.ca/video/10207191/whats-behind-canadas-productivity-problem-and-why-it-matters/,negative,0.0171879,0.49488392,0.48792827,-0.24461463256035287
Global,2024-03-26,More affordable housing unveiled in Calgary,https://globalnews.ca/video/10385030/more-affordable-housing-unveiled-in-calgary/,positive,0.73933786,0.0042536324,0.25640854,0.5466023582632271
Global,2024-03-26,Cleanup at Vancouver encampment,https://globalnews.ca/video/10383738/cleanup-at-vancouver-encampment/,neutral,0.09901947,0.033083174,0.86789733,0.008710360794106364
Global,2024-03-26,Unique sea creature encounter captured near Victoria,https://globalnews.ca/video/10383702/unique-sea-creature-encounter-captured-near-victoria/,positive,0.2970712,0.0147693185,0.6881595,0.0880331500485898
Global,2024-03-26,Canada is evacuating ‘most vulnerable’ citizens from Haiti: Joly,https://globalnews.ca/news/10382485/canada-evacuating-citizens-from-haiti-joly/,neutral,0.022471547,0.08391843,0.8936099,-0.006537341146963804
Global,2024-03-26,Baltimore bridge collapse: Biden says no indication cargo ship crash was ‘intentional’,https://globalnews.ca/video/10384926/baltimore-bridge-collapse-biden-says-no-indication-cargo-ship-crash-was-intentional/,negative,0.015029639,0.50196624,0.48300406,-0.2517442430888517
Global,2024-03-26,2 crew members die aboard Holland America Line cruise ship in the Bahamas,https://globalnews.ca/news/10382383/bahamas-cruise-ship-crew-deaths-holland-america/,negative,0.009688136,0.7658062,0.22450575,-0.5863652054404227
Global,2024-03-26,"Edmonton weather forecast: Monday, March 25, 2024",https://globalnews.ca/video/10383704/edmonton-weather-forecast-monday-march-25-2024/,neutral,0.030929424,0.012220677,0.95684993,0.0008072836875334666
Global,2024-03-26,‘Why is our tail on fire?’: Carnival cruise ship tail goes up in flames,https://globalnews.ca/video/10383206/why-is-our-tail-on-fire-carnival-cruise-ship-tail-goes-up-in-flames/,negative,0.016851341,0.71144795,0.27170077,-0.5058741608806354
Global,2024-03-26,"11-year-old girl reported missing in Smithers, B.C.",https://globalnews.ca/news/10385005/missing-child-smithers-bc/,negative,0.013699857,0.39349112,0.592809,-0.15464757469999313
Global,2024-03-26,Halifax considers moving forward with new high-density neighbourhood,https://globalnews.ca/news/10384721/halifax-strawberry-hill-development/,neutral,0.17136686,0.008597542,0.8200357,0.02929266695446131
Global,2024-03-26,N.B. woman warning others after finding AirTag in purse,https://globalnews.ca/video/10383282/n-b-woman-warning-others-after-finding-airtag-in-purse/,neutral,0.033055067,0.15830149,0.8086434,-0.0239667291057577
Global,2024-03-26,"Weak productivity is an economic ‘emergency,’ Bank of Canada warns",https://globalnews.ca/news/10384078/bank-of-canada-productivity-emergency/,negative,0.0108017875,0.74092764,0.24827057,-0.5488570839987723
Global,2024-03-26,"Canada to tighten foreign investment rules for AI, other sectors: report",https://globalnews.ca/news/10384877/canada-foreign-investment-ai-space-tech-report/,neutral,0.033171672,0.04657704,0.92025137,-0.0010690597182971828
Global,2024-03-26,Nova Scotia announces more modular housing for health workers,https://globalnews.ca/news/10385079/ns-modular-housing-health-workers/,positive,0.23504668,0.0050285696,0.7599249,0.05522162315966739
Global,2024-03-26,"Province, feds offer new housing supports to Manitoba survivors of gender-based violence",https://globalnews.ca/news/10384958/housing-funding-federal-provincial-gender-based-survivors-manitoba/,neutral,0.088918075,0.02716127,0.88392055,0.007168695888646326
Global,2024-03-26,"Winnipeg man was member of Chinese military branch behind cyber attacks on Canada, officials allege",https://globalnews.ca/news/10351645/winnipeg-pla-cyber-attacks-canada/,negative,0.007987877,0.64760584,0.34440622,-0.4193295706572773
Global,2024-03-26,Race to reuninte orphaned orca calf with its pod,https://globalnews.ca/video/10383737/race-to-reuninte-orphaned-orca-calf-with-its-pod/,neutral,0.06545567,0.06411242,0.87043196,0.00017404230581519187
Global,2024-03-26,Wilmot residents ‘devastated’ by potential expropriation of farms,https://globalnews.ca/news/10384865/wilmot-farmland-expropriation/,negative,0.008158773,0.7880812,0.20375997,-0.6210055044748515
Global,2024-03-26,New adult epilepsy monitoring unit running at HSC Winnipeg,https://globalnews.ca/news/10384849/epilepsy-monitoring-unit-hsc-winnipeg/,neutral,0.060275044,0.017446471,0.92227846,0.0033287026231638706
Global,2024-03-26,N.B. woman finds Apple AirTag in purse after night out: ‘I was so shocked’,https://globalnews.ca/news/10382664/nb-canada-woman-apple-airtag-bar-club/,negative,0.07996281,0.45694315,0.46309397,-0.20240301621070333
Global,2024-03-26,Canada’s maple syrup production hits 5-year low,https://globalnews.ca/video/10384361/canadas-maple-syrup-production-hits-5-year-low/,negative,0.020413538,0.55001193,0.42957455,-0.30209641456209013
Global,2024-03-26,Feds award contracts of nearly half a billion dollars for construction of Coast Guard multi-purpose vehicles,https://globalnews.ca/video/10385007/feds-award-contracts-of-nearly-half-a-billion-dollars-for-construction-of-coast-guard-multi-purpose-vehicles/,neutral,0.1723113,0.010428008,0.81726086,0.0295824138062315
Global,2024-03-26,Baltimore bridge collapse: Mayday call allowed officials to stem traffic before hit,https://globalnews.ca/news/10383999/baltimore-bridge-collapse/,negative,0.01510734,0.5172497,0.46764293,-0.2673190391096174
CTV,2024-03-26,Is there lead in your water pipes? Check out Montreal's interactive map to find out,https://montreal.ctvnews.ca/is-there-lead-in-your-water-pipes-check-out-montreal-s-interactive-map-to-find-out-1.6822478,neutral,0.036451887,0.108521074,0.8550269,-0.01044809281744552
CTV,2024-03-26,"Fish protesters meet riot police outside N.L. legislature, budget delivered in half-empty assembly",https://www.ctvnews.ca/canada/fish-protesters-meet-riot-police-outside-n-l-legislature-budget-delivered-in-half-empty-assembly-1.6816672,negative,0.011000319,0.56907094,0.41992876,-0.32372070533886976
CTV,2024-03-26,Robert F. Kennedy Jr. picks Nicole Shanahan as his running mate for his independent White House bid,https://www.ctvnews.ca/world/robert-f-kennedy-jr-picks-nicole-shanahan-as-his-running-mate-for-his-independent-white-house-bid-1.6822439,neutral,0.03430693,0.008818041,0.9568751,0.001099206063378766
CTV,2024-03-26,Commons committee to hear witnesses on security concerns about microbiology lab,https://www.ctvnews.ca/politics/commons-committee-to-hear-witnesses-on-security-concerns-about-microbiology-lab-1.6822943,neutral,0.032102004,0.06921709,0.89868087,-0.003760468744866241
CTV,2024-03-26,Court drops charges against Ontario police officers involved in fatal 2020 shooting of 18-month-old,https://toronto.ctvnews.ca/court-drops-charges-against-ontario-police-officers-involved-in-fatal-2020-shooting-of-18-month-old-1.6820984,negative,0.007068767,0.7474826,0.24544859,-0.558680310915264
CTV,2024-03-26,'I am not giving up': Search continues for missing pregnant cat at Ottawa Airport,https://ottawa.ctvnews.ca/i-am-not-giving-up-search-continues-for-missing-pregnant-cat-at-ottawa-airport-1.6821792,neutral,0.084471874,0.06277008,0.8527579,0.0031954178172122205
CTV,2024-03-26,"N.L. fishermen declare victory, head home after protests in St. John's",https://www.ctvnews.ca/canada/n-l-fishermen-declare-victory-head-home-after-protests-in-st-john-s-1.6818803,neutral,0.089583315,0.060260024,0.8501566,0.004393901473888073
CTV,2024-03-26,What some Ontarians are doing to protect their vehicles from auto theft,https://toronto.ctvnews.ca/what-some-ontarians-are-doing-to-protect-their-vehicles-from-auto-theft-1.6817013,neutral,0.044610437,0.17638552,0.7790039,-0.029121776618556083
CTV,2024-03-26,Child and youth mental health lead agency aims to improve crisis support,https://windsor.ctvnews.ca/child-and-youth-mental-health-lead-agency-aims-to-improve-crisis-support-1.6823087,positive,0.3732004,0.016095797,0.6107039,0.13901943302629505
CTV,2024-03-26,Young driver hospitalized & charged after totalling car in south end Barrie,https://barrie.ctvnews.ca/young-driver-hospitalized-charged-after-totalling-car-in-south-end-barrie-1.6822710,negative,0.008927599,0.7135446,0.2775278,-0.50906620466003
CTV,2024-03-26,"'Potential fraudsters' may be collecting money for fake charity, Kelowna RCMP warn",https://bc.ctvnews.ca/potential-fraudsters-may-be-collecting-money-for-fake-charity-kelowna-rcmp-warn-1.6814832,negative,0.01232817,0.63021564,0.35745633,-0.3970197021083095
CTV,2024-03-26,Economists defend Liberals' carbon price as political rhetoric heats up,https://www.ctvnews.ca/politics/economists-defend-liberals-carbon-price-as-political-rhetoric-heats-up-1.6823020,neutral,0.08625452,0.0609299,0.8528156,0.0037273888829432167
CTV,2024-03-26,St. Lawrence Seaway management offer assurances on safety of seaway bridges,https://ottawa.ctvnews.ca/st-lawrence-seaway-management-offer-assurances-on-safety-of-seaway-bridges-1.6822618,neutral,0.08440321,0.016615795,0.8989809,0.006847822730010389
CTV,2024-03-26,Ancient giant dolphin discovered in the Amazon,https://www.ctvnews.ca/sci-tech/ancient-giant-dolphin-discovered-in-the-amazon-1.6823049,positive,0.31318507,0.012749165,0.67406577,0.09792234434009828
CTV,2024-03-26,"Blue Jays relievers Romano, Swanson likely to start season on IL",https://toronto.ctvnews.ca/blue-jays-relievers-romano-swanson-likely-to-start-season-on-il-1.6822321,neutral,0.044961262,0.003858008,0.95118064,0.0020066347313247856
CTV,2024-03-26,Robbery suspect sought in west end,https://windsor.ctvnews.ca/robbery-suspect-sought-in-west-end-1.6822771,negative,0.026916817,0.4304259,0.5426573,-0.18454192596160723
CTV,2024-03-26,Serious crash reason for traffic diversion on Highway 825 in Sturgeon County,https://edmonton.ctvnews.ca/serious-crash-reason-for-traffic-diversion-on-highway-825-in-sturgeon-county-1.6822971,negative,0.010394458,0.7588081,0.23079732,-0.5756817636303833
CTV,2024-03-26,Alberta testing water tech as possible extreme drought looms,https://calgary.ctvnews.ca/alberta-testing-water-tech-as-possible-extreme-drought-looms-1.6821403,neutral,0.043229856,0.2114075,0.7453626,-0.04282431897492778
CTV,2024-03-26,"Former Victoria lawyer disbarred for misconduct, ordered to pay $49K in legal costs",https://bc.ctvnews.ca/former-victoria-lawyer-disbarred-for-misconduct-ordered-to-pay-49k-in-legal-costs-1.6821465,negative,0.009156662,0.745674,0.24516936,-0.5559458801807056
CTV,2024-03-26,Sask. highway traffic rerouted following gasoline spill,https://saskatoon.ctvnews.ca/sask-highway-traffic-rerouted-following-gasoline-spill-1.6822985,neutral,0.01858331,0.16883701,0.8125797,-0.028160594489006208
CTV,2024-03-26,Here’s what the province is forecasting for spring flood season,https://winnipeg.ctvnews.ca/here-s-what-the-province-is-forecasting-for-spring-flood-season-1.6822789,neutral,0.041654706,0.022133905,0.93621147,0.0012452032348675424
CTV,2024-03-26,Ontario woman shocked when U.S. car rental company forces her to buy its car insurance,https://toronto.ctvnews.ca/ontario-woman-shocked-when-u-s-car-rental-company-forces-her-to-buy-its-car-insurance-1.6822039,negative,0.016874637,0.5664182,0.41670716,-0.3205448246047027
CTV,2024-03-26,Winnipeg police make human trafficking arrest,https://winnipeg.ctvnews.ca/winnipeg-police-make-human-trafficking-arrest-1.6822720,negative,0.025821112,0.3568127,0.61736614,-0.1266485822104606
CTV,2024-03-26,Here's what we know about the Baltimore bridge collapse,https://www.ctvnews.ca/world/here-s-what-we-know-about-the-baltimore-bridge-collapse-1.6822793,neutral,0.025062133,0.1581563,0.81678146,-0.02438532056343856
CTV,2024-03-26,RCMP remain on scene of Sask. farm where 4 bodies were discovered Sunday night,https://regina.ctvnews.ca/rcmp-remain-on-scene-of-sask-farm-where-4-bodies-were-discovered-sunday-night-1.6821180,neutral,0.01706717,0.18542932,0.7975034,-0.03409276208729839
CTV,2024-03-26,"'Owning is better than renting,' and other financial beliefs that may be dated",https://www.ctvnews.ca/business/owning-is-better-than-renting-and-other-financial-beliefs-that-may-be-dated-1.6822703,positive,0.3373483,0.036898386,0.62575334,0.11244238470428591
CTV,2024-03-26,Doctors say unfair salaries driving them away from family medicine in Canada,https://www.ctvnews.ca/canada/doctors-say-unfair-salaries-driving-them-away-from-family-medicine-in-canada-1.6821795,negative,0.007931493,0.7959635,0.19610503,-0.6334950026441817
CTV,2024-03-26,"Police watchdog investigating crash that seriously injured cyclist in Langford, B.C.",https://bc.ctvnews.ca/police-watchdog-investigating-crash-that-seriously-injured-cyclist-in-langford-b-c-1.6822748,negative,0.012137932,0.50525624,0.48260576,-0.2551365786066295
CTV,2024-03-26,"PowerPoint parties are still bringing friends together, one hyper-specific subject at a time",https://www.ctvnews.ca/lifestyle/powerpoint-parties-are-still-bringing-friends-together-one-hyper-specific-subject-at-a-time-1.6821696,positive,0.6777572,0.008097192,0.3141457,0.45928920293999376
CTV,2024-03-26,"Canadian bridges are safe, officials say after Baltimore bridge collapse",https://www.ctvnews.ca/canada/canadian-bridges-are-safe-officials-say-after-baltimore-bridge-collapse-1.6822875,neutral,0.20595418,0.026775096,0.7672707,0.041700226381058414
CTV,2024-03-26,Pancholi backs out of NDP leadership race to throw support behind Nenshi,https://edmonton.ctvnews.ca/pancholi-backs-out-of-ndp-leadership-race-to-throw-support-behind-nenshi-1.6822648,neutral,0.03471488,0.15365283,0.8116324,-0.022404057621233875
CTV,2024-03-26,Manitoba RCMP make arrests after video of infant being sexually abused posted on X,https://winnipeg.ctvnews.ca/manitoba-rcmp-make-arrests-after-video-of-infant-being-sexually-abused-posted-on-x-1.6822850,negative,0.009430992,0.6856642,0.30490482,-0.4700464196937304
CTV,2024-03-26,Health officials sound alarm after 3 overdoses in 24 hours,https://barrie.ctvnews.ca/health-officials-sound-alarm-after-3-overdoses-in-24-hours-1.6823051,negative,0.022455009,0.39210302,0.5854419,-0.15324058116856598
CTV,2024-03-26,Statistics Canada reports retail sales down in January as new car sales fell,https://www.ctvnews.ca/business/statistics-canada-reports-retail-sales-down-in-january-as-new-car-sales-fell-1.6818068,negative,0.019666297,0.47629568,0.504038,-0.22647083908161392
CTV,2024-03-26,'Young child' dies after UTV falls through ice on B.C. lake: RCMP,https://bc.ctvnews.ca/young-child-dies-after-utv-falls-through-ice-on-b-c-lake-rcmp-1.6821578,negative,0.007719416,0.6731453,0.3191353,-0.4530649979909498
CTV,2024-03-26,Record-setting pop tab collection for Ontario boy,https://london.ctvnews.ca/record-setting-pop-tab-collection-for-ontario-boy-1.6822868,positive,0.53795147,0.010478356,0.4515701,0.2892820185007494
CTV,2024-03-26,LIVE SOON: Ontario to table 2024 provincial budget,/video/c68596-live--ontario-budget-to-be-tabled-at-queen-s-park,neutral,0.054552525,0.0071837474,0.9382637,0.002924372521024843
CTV,2024-03-26,13 arrested as RCMP raids 'suspected criminal organization' in Montreal,https://montreal.ctvnews.ca/13-arrested-as-rcmp-raids-suspected-criminal-organization-in-montreal-1.6822426,negative,0.012012044,0.5511986,0.43678927,-0.30367564098658306
CTV,2024-03-26,"Recent snowfall in Lethbridge will help drought, but benefits depend on melt rate: expert",https://calgary.ctvnews.ca/recent-snowfall-in-lethbridge-will-help-drought-but-benefits-depend-on-melt-rate-expert-1.6821710,positive,0.4979468,0.0146027375,0.48745042,0.24773778851803208
CTV,2024-03-26,Saskatoon man arrested after break-ins at assisted living facilities,https://saskatoon.ctvnews.ca/saskatoon-man-arrested-after-break-ins-at-assisted-living-facilities-1.6822961,negative,0.012478673,0.4266422,0.5608792,-0.181867832622995
CTV,2024-03-26,Mother of five dies after crash on rented motorized scooter,/video/c2891891-mom-dies-after-crash-on-rented-scooter,negative,0.016066168,0.69913757,0.28479627,-0.4885351967181961
CTV,2024-03-26,How to talk to your children about a cancer diagnosis,/video/c2892309-how-to-share-a-cancer-diagnosis,negative,0.023212107,0.2872946,0.6894933,-0.08199938331977563
CTV,2024-03-26,"'Difficult to detect' rail cracks caused 2021 Sask. derailment, safety board finds",https://regina.ctvnews.ca/difficult-to-detect-rail-cracks-caused-2021-sask-derailment-safety-board-finds-1.6822852,negative,0.005767021,0.7703923,0.22384079,-0.5934709325138323
CTV,2024-03-26,Vancouver Canucks kept from clinching playoff spot after loss to L.A. Kings,https://bc.ctvnews.ca/vancouver-canucks-kept-from-clinching-playoff-spot-after-loss-to-l-a-kings-1.6822513,neutral,0.02685666,0.14122018,0.83192307,-0.019221869848331963
CTV,2024-03-26,'Another step closer': Western University researchers work on cure for AIDS,https://london.ctvnews.ca/another-step-closer-western-university-researchers-work-on-cure-for-aids-1.6822577,positive,0.4079853,0.0063157324,0.58569896,0.1664121163278267
CTV,2024-03-26,Florida car rental company rejecting Canadian insurance,/video/c2892035-florida-car-rental-rejecting-canadian-insurance,negative,0.012414001,0.64921546,0.33837062,-0.42132656845355143
CTV,2024-03-26,Immigration minister criticizes Conestoga for international student strategy,https://kitchener.ctvnews.ca/immigration-minister-criticizes-conestoga-for-international-student-strategy-1.6823108,negative,0.009297236,0.6378209,0.3528818,-0.4067290983955516
CTV,2024-03-26,Ontario to table 2024 budget today. Here’s what you need to know,https://toronto.ctvnews.ca/ontario-to-table-2024-budget-today-here-s-what-you-need-to-know-1.6821572,neutral,0.077114366,0.007067893,0.91581756,0.005896682808200104
CTV,2024-03-26,Sudbury's Tracy Fleury wins gold at world curling championship,https://northernontario.ctvnews.ca/sudbury-s-tracy-fleury-wins-gold-at-world-curling-championship-1.6821843,positive,0.59562767,0.0029327387,0.40143964,0.3547636973791466
CTV,2024-03-26,Nova Scotia announces more modular housing for health workers,https://atlantic.ctvnews.ca/nova-scotia-announces-more-modular-housing-for-health-workers-1.6823094,positive,0.23504668,0.0050285696,0.7599249,0.05522162315966739
CTV,2024-03-26,"New strategy being tested, hopes remain high in effort to reunite orphaned orca with family",https://bc.ctvnews.ca/new-strategy-being-tested-hopes-remain-high-in-effort-to-reunite-orphaned-orca-with-family-1.6823117,positive,0.668303,0.0052509825,0.32644606,0.4466013045605166
CTV,2024-03-26,"CFIB says 200,000 small businesses took new loans to meet CEBA repayment deadline",https://www.ctvnews.ca/business/cfib-says-200-000-small-businesses-took-new-loans-to-meet-ceba-repayment-deadline-1.6822779,neutral,0.16976912,0.016872095,0.8133587,0.028536896779366216
CTV,2024-03-26,Decades-old murder case of woman found in Ont. river delayed over concerns accused not fit for trial,https://toronto.ctvnews.ca/decades-old-murder-case-of-woman-found-in-ont-river-delayed-over-concerns-accused-not-fit-for-trial-1.6822835,negative,0.0063477783,0.73316485,0.2604872,-0.5374905284374236
CTV,2024-03-26,Meet this Saskatchewan sculptor who looks to nature for artistic inspiration,https://regina.ctvnews.ca/meet-this-saskatchewan-sculptor-who-looks-to-nature-for-artistic-inspiration-1.6821269,positive,0.4970406,0.009136635,0.49382284,0.24696583569523867
CTV,2024-03-26,Manitoba agrees to pay $530M in settlement over children's allowance,https://winnipeg.ctvnews.ca/manitoba-agrees-to-pay-530m-in-settlement-over-children-s-allowance-1.6821070,neutral,0.072451055,0.034569252,0.8929796,0.004054124855773722
CTV,2024-03-26,Trump's Truth Social is now a public company. Experts warn its multibillion-dollar valuation defies logic,https://www.ctvnews.ca/business/trump-s-truth-social-is-now-a-public-company-experts-warn-its-multibillion-dollar-valuation-defies-logic-1.6822424,negative,0.024597563,0.6389941,0.33640835,-0.40770839739960074
CTV,2024-03-26,Mother of 2021 victim in Sudbury triple fatal arson fire breaks down speaking of final phone call,https://northernontario.ctvnews.ca/mother-of-2021-victim-in-sudbury-triple-fatal-arson-fire-breaks-down-speaking-of-final-phone-call-1.6822820,negative,0.012090737,0.5873718,0.40053737,-0.34485951041357765
CTV,2024-03-26,Search and rescue ongoing following bridge collapse: NTSB,/video/c2892533-ntsb-provide-update-on-bridge-investigation?playlistId=1.6822319,neutral,0.048883405,0.08049154,0.870625,-0.004089302281071738
CTV,2024-03-26,"Two more belugas dead at Marineland, bringing total whale deaths to 17 since 2019",https://toronto.ctvnews.ca/two-more-belugas-dead-at-marineland-bringing-total-whale-deaths-to-17-since-2019-1.6822647,negative,0.0066960407,0.8442461,0.149058,-0.7127065102177159
CTV,2024-03-26,"With completion in sight, what's next for the Trans Mountain pipeline project?",https://calgary.ctvnews.ca/with-completion-in-sight-what-s-next-for-the-trans-mountain-pipeline-project-1.6822425,neutral,0.11293784,0.012745111,0.87431693,0.012592529275181619
CTV,2024-03-26,Sask. residents can now track the status of their upcoming surgery online,https://regina.ctvnews.ca/sask-residents-can-now-track-the-status-of-their-upcoming-surgery-online-1.6822836,neutral,0.069132574,0.009772189,0.9210953,0.004683812674606713
CTV,2024-03-26,Ottawa police chief addresses mistaken arrest of Orleans man,https://ottawa.ctvnews.ca/ottawa-police-chief-addresses-mistaken-arrest-of-orleans-man-1.6821825,negative,0.013869253,0.29783717,0.6882935,-0.08851463929920911
CTV,2024-03-26,"Dog killed in Lethbridge hit-and-run, witnesses sought by police",https://calgary.ctvnews.ca/dog-killed-in-lethbridge-hit-and-run-witnesses-sought-by-police-1.6821235,negative,0.013637104,0.48212245,0.50424045,-0.23225608744397164
CTV,2024-03-26,Calgary bus attack leaves youth with serious injuries,https://calgary.ctvnews.ca/calgary-bus-attack-leaves-youth-with-serious-injuries-1.6822949,negative,0.008761742,0.83296376,0.15827437,-0.693751950719137
CTV,2024-03-26,'Quit dumping on us': London farmer tired of illegal trash,https://london.ctvnews.ca/quit-dumping-on-us-london-farmer-tired-of-illegal-trash-1.6822859,negative,0.010176597,0.8086348,0.18118851,-0.6537867645574327
CTV,2024-03-26,Another truck hits Kitchener’s Park Street Bridge,https://kitchener.ctvnews.ca/another-truck-hits-kitchener-s-park-street-bridge-1.6823046,negative,0.019566141,0.33704647,0.6433873,-0.11321751053844764
CTV,2024-03-26,"Trudeau, key election players to testify at foreign interference hearings. What you need to know",https://www.ctvnews.ca/politics/trudeau-key-election-players-to-testify-at-foreign-interference-hearings-what-you-need-to-know-1.6744422,neutral,0.031778693,0.07627747,0.8919438,-0.004808368399911167
