source,date,headline,url,chosen_label,positive,negative,neutral,compound
CTV,2024-08-13,Alberta man sees big benefits after receiving leading-edge pacemaker at Calgary hospital,https://calgary.ctvnews.ca/alberta-man-sees-big-benefits-after-receiving-leading-edge-pacemaker-at-calgary-hospital-1.6997812,positive,0.8828422,0.0027608343,0.11439696,0.7794027243436563
CTV,2024-08-13,'Outright fraud': This Saskatoon builder left a trail of customers who say they paid and got nothing,https://saskatoon.ctvnews.ca/outright-fraud-this-saskatoon-builder-left-a-trail-of-customers-who-say-they-paid-and-got-nothing-1.6997771,negative,0.005113319,0.9080496,0.08683704,-0.8245279673762456
CTV,2024-08-13,Region considers waste collection changes for businesses to combat pest problems,https://kitchener.ctvnews.ca/region-considers-waste-collection-changes-for-businesses-to-combat-pest-problems-1.6998162,neutral,0.039128076,0.09578853,0.86508334,-0.0076444394845442964
CTV,2024-08-13,Worried about learning loss? Expert tips on keeping kids on track over the summer break,https://www.ctvnews.ca/lifestyle/worried-about-learning-loss-expert-tips-on-keeping-kids-on-track-over-the-summer-break-1.6995346,neutral,0.14850684,0.088788465,0.7627047,0.014170890394424873
CTV,2024-08-13,Human-caused climate change made this summer's heat waves 2-10 times more likely: ECCC,https://www.ctvnews.ca/climate-and-environment/human-caused-climate-change-made-this-summer-s-heat-waves-2-10-times-more-likely-eccc-1.6997698,negative,0.022419088,0.6339689,0.34361207,-0.40141390085070583
CTV,2024-08-13,Scattered thunderstorms possible in central and southern Alberta Tuesday,https://calgary.ctvnews.ca/scattered-thunderstorms-possible-in-central-and-southern-alberta-tuesday-1.6998868,neutral,0.044453744,0.11367641,0.84186983,-0.010946190740256156
CTV,2024-08-13,Average rental rates in Nova Scotia well above national level: survey,https://atlantic.ctvnews.ca/average-rental-rates-in-nova-scotia-well-above-national-level-survey-1.6995380,neutral,0.1371992,0.017778438,0.8450224,0.018507543870572185
CTV,2024-08-13,"Toronto condo owner facing $40,000 bill for new windows",https://toronto.ctvnews.ca/toronto-condo-owner-facing-40-000-bill-for-new-windows-1.6998186,negative,0.054532148,0.25529805,0.6901699,-0.06220332713088439
CTV,2024-08-13,Saskatoon firefighters pull a body from the river,https://saskatoon.ctvnews.ca/saskatoon-firefighters-pull-a-body-from-the-river-1.6997951,neutral,0.02277635,0.14631975,0.8309039,-0.020890708058049157
CTV,2024-08-13,'Freedom Convoy' organizer Pat King granted bail after alleged breach,https://www.ctvnews.ca/canada/freedom-convoy-organizer-pat-king-granted-bail-after-alleged-breach-1.6994819,negative,0.021749342,0.32649052,0.6517603,-0.10612298105986362
CTV,2024-08-13,Chief human-rights commissioner resigns after investigation into Israel comments,https://www.ctvnews.ca/politics/chief-human-rights-commissioner-resigns-after-investigation-into-israel-comments-1.6997725,negative,0.0104258,0.6712506,0.3183236,-0.45046864605637893
CTV,2024-08-13,City garbage truck rollover in south London,https://london.ctvnews.ca/city-garbage-truck-rollover-in-south-london-1.6998040,negative,0.0317296,0.50927776,0.4589927,-0.25835704129431125
CTV,2024-08-13,"Netanyahu accuses defence minister of 'anti-Israel narrative,' exposing rift over war in Gaza",https://www.ctvnews.ca/world/netanyahu-accuses-defence-minister-of-anti-israel-narrative-exposing-rift-over-war-in-gaza-1.6998680,negative,0.0066953027,0.7598705,0.23343424,-0.5773583151003789
CTV,2024-08-13,"Canada taking review of immigration screening of terror plot suspects 'extremely seriously,' PM Trudeau says",https://www.ctvnews.ca/politics/canada-taking-review-of-immigration-screening-of-terror-plot-suspects-extremely-seriously-pm-trudeau-says-1.6997795,neutral,0.037430167,0.06237099,0.900199,-0.002489119101807935
CTV,2024-08-13,Pregnant woman hospitalized after vehicle rollover in Scarborough,https://toronto.ctvnews.ca/pregnant-woman-hospitalized-after-vehicle-rollover-in-scarborough-1.6998650,negative,0.012235499,0.4958806,0.49188393,-0.24574785152573675
CTV,2024-08-13,Ottawa MP and cabinet minister responds to Sutcliffe's transit funding request,https://ottawa.ctvnews.ca/ottawa-mp-and-cabinet-minister-responds-to-sutcliffe-s-transit-funding-request-1.6995417,neutral,0.031626288,0.012226758,0.956147,0.0008507273482520894
CTV,2024-08-13,Canadian Olympians return home after record-setting Summer Games,https://www.ctvnews.ca/sports/canadian-olympians-return-home-after-record-setting-summer-games-1.6998065,positive,0.704645,0.0023122234,0.29304284,0.496519156756122
CTV,2024-08-13,"Crews battle scattered fires in Athens suburbs, helped by calmer winds and reinforcements",https://www.ctvnews.ca/world/crews-battle-scattered-fires-in-athens-suburbs-helped-by-calmer-winds-and-reinforcements-1.6998589,positive,0.2646499,0.03117227,0.70417774,0.06906787852483731
CTV,2024-08-13,"'That is a real one, guys': Quake interrupts live broadcasts",/video/c2976065-quake-interrupts-live-broadcasts-in-l-a-,positive,0.46926373,0.025143005,0.5055933,0.2195762670179704
CTV,2024-08-13,On the lookout: New Brunswick bird watcher finds his 400th species of bird,https://www.ctvnews.ca/canada/on-the-lookout-new-brunswick-bird-watcher-finds-his-400th-species-of-bird-1.6996510,positive,0.22800094,0.0056651393,0.76633394,0.0519523310300567
CTV,2024-08-13,Man busted for stunt driving in F-150,https://barrie.ctvnews.ca/man-busted-for-stunt-driving-in-f-150-1.6998561,negative,0.024631094,0.5251534,0.45021555,-0.2751793868035346
CTV,2024-08-13,More than a dozen vehicles damaged in overnight St. Boniface smashing spree,https://winnipeg.ctvnews.ca/more-than-a-dozen-vehicles-damaged-in-overnight-st-boniface-smashing-spree-1.6998320,negative,0.0081773745,0.7581685,0.23365407,-0.5747526438209993
CTV,2024-08-13,"Sentencing hearing set for Coutts protesters convicted of mischief, weapons charges",https://calgary.ctvnews.ca/sentencing-hearing-set-for-coutts-protesters-convicted-of-mischief-weapons-charges-1.6997248,negative,0.012836323,0.46226028,0.52490336,-0.2135198046847986
CTV,2024-08-13,'Serious trouble': New Ontario report latest example of Canada's health-care crisis,https://www.ctvnews.ca/health/serious-trouble-new-ontario-report-latest-example-of-canada-s-health-care-crisis-1.6998126,negative,0.009051697,0.7648157,0.22613253,-0.5848611827260015
CTV,2024-08-13,Police investigating after human remains found in Parry Sound area,https://northernontario.ctvnews.ca/police-investigating-after-human-remains-found-in-parry-sound-area-1.6998840,neutral,0.02360789,0.11164186,0.86475027,-0.011906571582933623
CTV,2024-08-13,Failure of woman to come forward could be aggravating factor in dog mauling case: lawyer,https://bc.ctvnews.ca/failure-of-woman-to-come-forward-could-be-aggravating-factor-in-dog-mauling-case-lawyer-1.6998450,negative,0.007525711,0.80437225,0.18810204,-0.6469581060847052
CTV,2024-08-13,New study links early childhood tablet use to anger outbursts,https://www.ctvnews.ca/health/new-study-links-early-childhood-tablet-use-to-anger-outbursts-1.6998323,negative,0.012920884,0.6674685,0.31961063,-0.44534725373685724
CTV,2024-08-13,CBC paid more than $18 million in bonuses in 2024 after eliminating hundreds of jobs,https://www.ctvnews.ca/business/cbc-paid-more-than-18-million-in-bonuses-in-2024-after-eliminating-hundreds-of-jobs-1.6997575,negative,0.059790667,0.5639094,0.37629998,-0.3144188699286232
CTV,2024-08-13,Number of inmates released into homelessness is climbing in Newfoundland and Labrador,https://www.ctvnews.ca/canada/number-of-inmates-released-into-homelessness-is-climbing-in-newfoundland-and-labrador-1.6990437,negative,0.012047713,0.6486835,0.33926892,-0.42064504492077504
CTV,2024-08-13,Final chapter of 'Freedom Convoy' organizers' trial begins with closing arguments,https://www.ctvnews.ca/canada/final-chapter-of-freedom-convoy-organizers-trial-begins-with-closing-arguments-1.6998565,neutral,0.03959981,0.05275037,0.90764976,-0.0012144575794481582
CTV,2024-08-13,Racialized workers less likely to be unionized: report,https://www.ctvnews.ca/business/racialized-workers-less-likely-to-be-unionized-report-1.6998620,negative,0.017310487,0.27146915,0.71122044,-0.0733958210983463
CTV,2024-08-13,'Voluntary' Jasper townsite re-entry will start on Friday: officials,https://edmonton.ctvnews.ca/voluntary-jasper-townsite-re-entry-will-start-on-friday-officials-1.6997257,neutral,0.027213318,0.009993511,0.96279323,0.0006406934165386069
CTV,2024-08-13,Hundreds of B.C. wildfire evacuees can return to Village of Slocan,https://bc.ctvnews.ca/hundreds-of-b-c-wildfire-evacuees-can-return-to-village-of-slocan-1.6998220,neutral,0.07642654,0.02796118,0.8956123,0.005059187871385706
CTV,2024-08-13,Olympic medalist Skylar Park returns to hero's welcome,https://winnipeg.ctvnews.ca/olympic-medalist-skylar-park-returns-to-hero-s-welcome-1.6998571,positive,0.83502764,0.0021158848,0.16285639,0.6972667363781149
CTV,2024-08-13,Bones creator Hart Hanson creates a new kind of private investigator with The Seminarian,https://calgary.ctvnews.ca/bones-creator-hart-hanson-creates-a-new-kind-of-private-investigator-with-the-seminarian-1.6996682,neutral,0.053054508,0.011538007,0.9354075,0.0026816538173783933
CTV,2024-08-13,"Camper fined $1,150 for violating fire ban, causing grass fire in B.C. Interior",https://bc.ctvnews.ca/camper-fined-1-150-for-violating-fire-ban-causing-grass-fire-in-b-c-interior-1.6992687,negative,0.0077159354,0.7166816,0.27560255,-0.5135729161056979
CTV,2024-08-13,New Canadian navy tugboats to enter service following two-year delay,https://bc.ctvnews.ca/new-canadian-navy-tugboats-to-enter-service-following-two-year-delay-1.6997765,neutral,0.0482157,0.056283116,0.8955012,-0.0008430355177544424
CTV,2024-08-13,"Princess of Wales, Snoop Dogg and a bearded Prince William team up for Olympics video",https://www.ctvnews.ca/entertainment/princess-of-wales-snoop-dogg-and-a-bearded-prince-william-team-up-for-olympics-video-1.6997832,positive,0.2467598,0.0060229287,0.74721724,0.06085413142091589
CTV,2024-08-13,Russia intensifies attacks in eastern Ukraine as it fights against Kyiv's cross-border incursion,https://www.ctvnews.ca/world/russia-intensifies-attacks-in-eastern-ukraine-as-it-fights-against-kyiv-s-cross-border-incursion-1.6998688,negative,0.009347423,0.6789652,0.31168744,-0.4609063231514803
CTV,2024-08-13,"As Poilievre and industry call for Chinese EV tariff package, Liberals say stay tuned",https://www.ctvnews.ca/politics/as-poilievre-and-industry-call-for-chinese-ev-tariff-package-liberals-say-stay-tuned-1.6994821,neutral,0.052101962,0.050406862,0.8974912,0.00017376266099322635
CTV,2024-08-13,Homeowner shows his collapsed backyard after Que. rainstorm,/video/c2975941-quebecer-shows-damage-to-home-after-storm?playlistId=1.6995276,negative,0.015737519,0.6631973,0.32106528,-0.4395829029914964
CTV,2024-08-13,"Actor Bryan Cranston shares more photos from Alberta mountain trip through Lake Louise, Banff",https://calgary.ctvnews.ca/actor-bryan-cranston-shares-more-photos-from-alberta-mountain-trip-through-lake-louise-banff-1.6997689,neutral,0.0979601,0.0033074324,0.89873254,0.009585234951126509
CTV,2024-08-13,Sask. hockey player Duncan MacPherson died in Austria 35 years ago. His parents still search for answers.,https://saskatoon.ctvnews.ca/sask-hockey-player-duncan-macpherson-died-in-austria-35-years-ago-his-parents-still-search-for-answers-1.6998441,negative,0.015823362,0.506907,0.4772696,-0.2567043431098739
CTV,2024-08-13,Costco is cracking down on membership moochers,https://www.ctvnews.ca/business/costco-is-cracking-down-on-membership-moochers-1.6997905,negative,0.057850294,0.4058594,0.5362903,-0.1613752039481824
CTV,2024-08-13,Saskatchewan man arrested after three people have finger chopped off,https://saskatoon.ctvnews.ca/saskatchewan-man-arrested-after-three-people-have-finger-chopped-off-1.6998722,negative,0.010829596,0.65156275,0.3376076,-0.42441679537489385
CTV,2024-08-13,"P.E.I. substitute teacher re-arrested, charged with sexual offences",https://atlantic.ctvnews.ca/p-e-i-substitute-teacher-re-arrested-charged-with-sexual-offences-1.6997781,negative,0.013018419,0.6619943,0.3249872,-0.4380670031973608
CTV,2024-08-13,Final stages of water infrastructure project to close intersection in Lethbridge starting Monday,https://calgary.ctvnews.ca/final-stages-of-water-infrastructure-project-to-close-intersection-in-lethbridge-starting-monday-1.6996924,neutral,0.040544163,0.06605119,0.8934046,-0.0027189318979901067
CTV,2024-08-13,U.S. auto safety agency seeks information from Tesla on fatal Cybertruck crash and fire in Texas,https://www.ctvnews.ca/autos/u-s-auto-safety-agency-seeks-information-from-tesla-on-fatal-cybertruck-crash-and-fire-in-texas-1.6991923,neutral,0.027358208,0.20964555,0.7629962,-0.04320279530532645
CTV,2024-08-13,Northern Ont. First Nation receives new land conservation funding,https://northernontario.ctvnews.ca/northern-ont-first-nation-receives-new-land-conservation-funding-1.6997043,positive,0.3167143,0.0050396957,0.6782461,0.10028252239393964
CBC,2024-08-13,Just a handful of Canadian cities will be subject to the Costco membership crackdown — for now,https://www.cbc.ca/news/business/costco-memberships-photo-id-1.7293020,neutral,0.033655055,0.19218741,0.7741575,-0.03580333871636299
CBC,2024-08-13,Trudeau calls Poilievre's stance on Chinese EV tariffs 'baloney',https://www.cbc.ca/news/politics/trudeau-poilievre-criticism-goodyear-announcement-1.7292143,negative,0.013430931,0.4195604,0.5670088,-0.17585049334348213
CBC,2024-08-13,Canada's Olympic athletes return from historic Paris Games,https://www.cbc.ca/news/canada/toronto/canada-olympics-athletes-pearson-return-1.7292711,positive,0.46191528,0.0038303714,0.53425425,0.21335109915437833
CBC,2024-08-13,Best moments of 2024 Paris Olympics,https://www.cbc.ca/player/play/video/9.6477480,positive,0.9548023,0.0026876158,0.04251012,0.9116401355802248
CBC,2024-08-13,Musk blames cyberattack as his chat with Trump on X hit by technical issues,https://www.cbc.ca/news/world/donald-trump-elon-musk-x-twitter-interview-1.7292738,negative,0.013224241,0.61329883,0.373477,-0.3759605247299245
CBC,2024-08-13,WATCH : CBC News Explore,https://www.cbc.cahttps://gem.cbc.ca/live,neutral,0.09840742,0.014817321,0.88677526,0.009464467482493077
CBC,2024-08-13,"During a tense summer in politics, RCMP union calls for Mounties to police Parliament Hill again",https://www.cbc.ca/news/politics/rcmp-union-parliament-hill-safety-1.7292144,neutral,0.052776907,0.041007522,0.9062156,0.0011037845349104458
CBC,2024-08-13,"Starbucks replaces CEO after just 17 months, turns to Chipotle leader",https://www.cbc.ca/news/business/starbucks-ceo-change-chipotle-1.7293038,negative,0.046951912,0.2553117,0.69773644,-0.06297956780186453
CBC,2024-08-13,Family walked 100 km home to protest northern Manitoba train cancellations,https://www.cbc.ca/news/canada/manitoba/pukatawagan-family-walks-100-kilometres-after-train-cancellation-1.7292707,negative,0.02508785,0.4985876,0.4763246,-0.24796017408454052
CBC,2024-08-13,Canada’s Olympic athletes return home after historic medal haul,https://www.cbc.ca/player/play/video/9.6479663,positive,0.7860542,0.0021350814,0.21181087,0.6178765087256544
CBC,2024-08-13,Trump goes on offence with Elon Musk interview,https://www.cbc.ca/player/play/video/9.6479779,neutral,0.051996507,0.14444645,0.80355704,-0.018161140167499035
CBC,2024-08-13,WATCH: CBC News Network,https://www.cbc.cahttps://gem.cbc.ca/live,neutral,0.10073908,0.018231502,0.88102955,0.00981596340483426
CBC,2024-08-13,"Buying your first home isn't easy, even in Sask. Here's how two people in their 20s did it",https://www.cbc.ca/news/canada/saskatoon/buying-your-first-home-isn-t-easy-even-in-sask-here-s-how-two-people-in-their-20s-did-it-1.7291041,negative,0.037950706,0.53507316,0.4269762,-0.28486300290802546
CBC,2024-08-13,"FBI investigating whether Iran hacked Trump, Harris campaigns",https://www.cbc.ca/news/world/fbi-probe-iran-election-hacks-1.7292976,neutral,0.04472409,0.19161204,0.7636638,-0.03471493414191418
CBC,2024-08-13,Beautifying Vancouver one mural at a time,https://www.cbc.ca/player/play/video/9.6478768,positive,0.9503449,0.003517176,0.046137918,0.9031431075021694
CBC,2024-08-13,Jasper residents allowed to return home on Friday,https://www.cbc.ca/news/canada/edmonton/jasper-alberta-wildfire-1.7292071,neutral,0.12858188,0.0054036826,0.8660145,0.016504094964005844
CBC,2024-08-13,Firefighter's family pushes for training school to close following death,https://www.cbc.ca/news/canada/nova-scotia/firefighter-family-pushes-school-close-1.7292685,negative,0.021506095,0.38152173,0.59697217,-0.14509631931893807
CBC,2024-08-13,Ottawa woman’s dog was stolen 9 months. It was found in Wyoming,https://www.cbc.ca/news/canada/ottawa/ottawa-woman-reunites-with-stolen-dog-almost-year-later-1.7292532,negative,0.009634224,0.6632883,0.32707754,-0.4398585254132854
CBC,2024-08-13,This man gave Ireland's Olympic gold medal rowers a ride home from the airport,https://www.cbc.ca/radio/asithappens/ireland-olympics-ride-home-1.7292521,positive,0.7555537,0.0035038816,0.24094234,0.5708492064085666
CBC,2024-08-13,WATCH |  #TheMoment a photographer captured a colourful display of northern lights,https://www.cbc.cahttps://www.cbc.ca/player/play/video/9.6479809,positive,0.37744015,0.003625326,0.6189344,0.14244797178918134
CBC,2024-08-13,How far did your bouquet travel? Florists say demand for local flowers is growing,https://www.cbc.ca/player/play/video/9.6477180,positive,0.32342938,0.007827818,0.66874284,0.1045452770401365
CBC,2024-08-13,Driver says he's hitting roadblocks with Uber and police after assault by passenger,https://www.cbc.ca/news/canada/newfoundland-labrador/uber-alleged-assault-stjohns-rnc-1.7292372,negative,0.010981081,0.7253461,0.26367286,-0.5260063424991017
CBC,2024-08-13,Hamilton-Burlington SPCA just got a donation of $1.5 million in pet food. But has no place to keep it,https://www.cbc.ca/news/canada/hamilton/hbspca-food-donation-1.7292405,negative,0.07469022,0.42965364,0.4956561,-0.17902363549096734
CBC,2024-08-13,Booming solar industry has a growing appetite for weed-chomping crews,https://www.cbc.ca/news/canada/calgary/bakx-agrivoltaics-alberta-sheep-pigs-1.7287853,positive,0.3072548,0.07840654,0.61433864,0.08825792765927787
CBC,2024-08-13,"Lessons from the wildfire-ravaged rubble of Enterprise, N.W.T.",https://www.cbc.cahttps://www.cbc.ca/newsinteractives/features/enterprise-wildfire-one-year-later,negative,0.025788633,0.30667126,0.66754,-0.0933822342231867
CBC,2024-08-13,Jasper residents will be allowed back in — but years-long recovery is expected,https://www.cbc.ca/player/play/video/9.6479279,positive,0.5184402,0.007567301,0.4739926,0.26872293319790685
CBC,2024-08-13,Gaza man behind leaked photo from Israeli detention site describes his 'torture journey' in custody,https://www.cbc.ca/news/world/ibrahim-salem-sde-teiman-detainee-1.7291048,negative,0.0090734605,0.5367521,0.4541743,-0.28802057334812936
CBC,2024-08-13,Michel Band society looks for scattered descendants as it pushes to re-establish First Nation,https://www.cbc.ca/news/indigenous/michel-band-descendants-1.7292596,neutral,0.07052697,0.042784866,0.8866882,0.0031435087737297085
CBC,2024-08-13,Here's how the U.S. trial of a Canadian linked to the Pearson gold heist could play out,https://www.cbc.ca/news/canada/toronto/gold-heist-trial-suspects-canada-1.7290166,neutral,0.034850325,0.034589328,0.93056035,1.8123579358153563e-05
CBC,2024-08-13,What should you do if your house floods?,https://www.cbc.ca/player/play/video/9.6479712,neutral,0.02357407,0.09776102,0.8786648,-0.009001489151868824
CBC,2024-08-13,Canadians should be prepared for more wildfires and hurricanes: Environment Canada,https://www.cbc.ca/news/politics/more-wildfires-hurricanes-climate-change-1.7292734,neutral,0.08196055,0.089694224,0.82834524,-0.0013275217647130688
CBC,2024-08-13,New human rights commissioner resigns before starting role,https://www.cbc.ca/news/politics/dattani-resigns-human-rights-commissioner-1.7292374,negative,0.013089634,0.59881467,0.38809577,-0.35840761305768076
CBC,2024-08-13,She won boxing gold. Now Imane Khelif has filed a harassment complaint over claims she's a man and transgender,https://www.cbc.ca/sports/olympics/summer/boxing/boxing-harassment-imane-khelif-1.7292457,negative,0.059536476,0.2463243,0.6941391,-0.05713108913755072
CBC,2024-08-13,"Greece wildfire burns outside Athens, destroying homes and killing 1 person",https://www.cbc.ca/news/world/wildfire-greece-athens-1.7292969,negative,0.008097605,0.8243442,0.16755809,-0.6794779035760765
CBC,2024-08-13,"Trial of key convoy figures Lich, Barber nears end of the road",https://www.cbc.ca/news/canada/ottawa/lich-barber-freedom-convoy-ottawa-1.7292593,neutral,0.048644453,0.053288765,0.89806676,-0.0004734097702492335
CBC,2024-08-13,Inside the pressure campaign on Danielle Smith to make gun ownership (and more) an Alberta right,https://www.cbc.ca/news/canada/calgary/bill-rights-danielle-smith-alberta-inside-1.7291123,neutral,0.06269225,0.03140193,0.90590584,0.0029442361781879534
CBC,2024-08-13,Meet Yellowknife's award-worthy cats,https://www.cbc.ca/player/play/video/9.6476622,positive,0.46973026,0.009056896,0.52121276,0.2205645290922238
CBC,2024-08-13,Olympic breaking had its moment. But will we ever see it at the Games again?,https://www.cbc.ca/news/world/olympics-breaking-ray-gun-1.7292038,negative,0.0549255,0.23964337,0.705431,-0.05441215928482279
CBC,2024-08-13,Veteran Paralympian Katarina Roxon is swimming into her 5th games,https://www.cbc.ca/player/play/video/9.6479337,neutral,0.22182812,0.0037915106,0.77438045,0.04919332211952465
CBC,2024-08-13,Tiny train is back on track at Halifax children's hospital,https://www.cbc.ca/player/play/video/9.6478850,positive,0.26072064,0.004051926,0.73522735,0.06795885720337225
