source,date,headline,url,chosen_label,positive,negative,neutral,compound
CTV,2024-02-03,Mom who gave school shooter a gun wouldn't change anything,/video/c2859912-ctv-national-news--parents-of-shooter-charged?playlistId=1.6753266,negative,0.00748245,0.8341487,0.1583688,-0.6957480993556082
CTV,2024-02-03,"Dozens of drivers facing hefty repair bills after filling up at Guelph, Ont. gas station",https://kitchener.ctvnews.ca/dozens-of-drivers-facing-hefty-repair-bills-after-filling-up-at-guelph-ont-gas-station-1.6750634,negative,0.011000891,0.7594719,0.22952724,-0.5766765375514638
CTV,2024-02-03,Canada eyes sanctions over violence against Palestinians,/video/c2860116-ctv-national-news--canada-considers-sanctions?playlistId=1.6593355,negative,0.008610067,0.7571256,0.2342641,-0.5731652213662226
CTV,2024-02-03,"Name of Vancouver Island creek deemed offensive, could be changed",https://vancouverisland.ctvnews.ca/name-of-vancouver-island-creek-deemed-offensive-could-be-changed-1.6739119,negative,0.009798654,0.6393948,0.35080653,-0.40872972204293845
CTV,2024-02-03,"Search for missing Sudbury politician continues, as police deploy helicopter",https://northernontario.ctvnews.ca/search-for-missing-sudbury-politician-continues-as-police-deploy-helicopter-1.6753055,neutral,0.043659817,0.0916127,0.86472744,-0.006486708851558776
CTV,2024-02-03,Fani Willis acknowledges a 'personal relationship' with prosecutor she hired in Trump's Georgia case,https://www.ctvnews.ca/world/fani-willis-acknowledges-a-personal-relationship-with-prosecutor-she-hired-in-trump-s-georgia-case-1.6754111,neutral,0.04621876,0.03031527,0.923466,0.001217157252016654
CTV,2024-02-03,Why this B.C. minister is facing calls to resign,/video/c2859324-b-c--minister-under-fire-for-comments,negative,0.0097866915,0.6187362,0.37147704,-0.38273877007707213
CTV,2024-02-03,"For the first time, an Irish nationalist is chosen to lead Northern Ireland's government",https://www.ctvnews.ca/world/for-the-first-time-an-irish-nationalist-is-chosen-to-lead-northern-ireland-s-government-1.6754421,neutral,0.05968769,0.08181003,0.85850227,-0.003130260694641507
CTV,2024-02-03,Tesla ordered to pay US$1.5 million over alleged hazardous waste violations in California,https://www.ctvnews.ca/business/tesla-ordered-to-pay-us-1-5-million-over-alleged-hazardous-waste-violations-in-california-1.6754141,negative,0.01758411,0.60113597,0.38128,-0.36105521857629697
CTV,2024-02-03,Toronto conservation agency buys chunk of Ontario peninsula to protect against development,https://toronto.ctvnews.ca/toronto-conservation-agency-buys-chunk-of-ontario-peninsula-to-protect-against-development-1.6754579,neutral,0.048746936,0.066762514,0.8844906,-0.002080968485200785
CTV,2024-02-03,"Feds unveil web tool to track representation, pay disparity for women, minorities",https://www.ctvnews.ca/business/feds-unveil-web-tool-to-track-representation-pay-disparity-for-women-minorities-1.6753493,neutral,0.06984937,0.0559288,0.87422174,0.0017509052510022993
CTV,2024-02-03,Lewis Hamilton says driving for Ferrari will be a 'childhood dream' come true,https://www.ctvnews.ca/autos/lewis-hamilton-says-driving-for-ferrari-will-be-a-childhood-dream-come-true-1.6754519,positive,0.83119166,0.004586125,0.16422203,0.6908587140722844
CTV,2024-02-03,Connor McDavid wins the NHL All-Star Skills competition he helped revive,https://edmonton.ctvnews.ca/connor-mcdavid-wins-the-nhl-all-star-skills-competition-he-helped-revive-1.6754441,positive,0.71370333,0.0046432745,0.28165346,0.509350847295913
CTV,2024-02-03,"Former Montreal exec. committee president to sue Le Journal, TVA for defamation",https://montreal.ctvnews.ca/former-montreal-exec-committee-president-to-sue-le-journal-tva-for-defamation-1.6754547,negative,0.018636964,0.38928893,0.59207404,-0.15119855802188908
CTV,2024-02-03,Feed the Soul Dining week returns to Edmonton,https://edmonton.ctvnews.ca/feed-the-soul-dining-week-returns-to-edmonton-1.6753263,positive,0.26430705,0.011969962,0.723723,0.06971493788912397
CTV,2024-02-03,Canada takes gold at Four Continents skating championship,https://www.ctvnews.ca/sports/canada-takes-gold-at-four-continents-skating-championship-1.6754604,positive,0.60622793,0.004713302,0.38905883,0.3674900573783617
CTV,2024-02-03,"'Global concern': High stakes for Canada to have role in widening U.S.-Iran conflict, experts say",https://www.ctvnews.ca/politics/global-concern-high-stakes-for-canada-to-have-role-in-widening-u-s-iran-conflict-experts-say-1.6754630,neutral,0.024638208,0.17690635,0.7984554,-0.030688819060648242
CTV,2024-02-03,Don't open your door to strangers: Barrie police warn after suspicious incidents,https://barrie.ctvnews.ca/don-t-open-your-door-to-strangers-barrie-police-warn-after-suspicious-incidents-1.6753736,negative,0.019604847,0.40323848,0.5771566,-0.16221694024324051
CTV,2024-02-03,Quebecers take to the streets to defend lease transfers,https://montreal.ctvnews.ca/quebecers-take-to-the-streets-to-defend-lease-transfers-1.6754662,neutral,0.03888171,0.18001714,0.78110117,-0.03089437966225539
CTV,2024-02-03,Students stage walkout in support of Sask. teachers amid stalled contract talks,https://regina.ctvnews.ca/students-stage-walkout-in-support-of-sask-teachers-amid-stalled-contract-talks-1.6754192,negative,0.02533925,0.2835194,0.69114137,-0.0797411655663609
CTV,2024-02-03,A Vermont mom called police to talk to her son about stealing. He ended up handcuffed and sedated,https://www.ctvnews.ca/world/a-vermont-mom-called-police-to-talk-to-her-son-about-stealing-he-ended-up-handcuffed-and-sedated-1.6753946,negative,0.008135915,0.7068965,0.28496775,-0.49963634171447247
CTV,2024-02-03,Mexican bakery in Montreal a testament to community support,https://montreal.ctvnews.ca/mexican-bakery-in-montreal-a-testament-to-community-support-1.6754577,positive,0.8693638,0.0034113606,0.12722482,0.7557817916887553
CTV,2024-02-03,Judge sets aside ruling that granted U.S. trans woman's refugee status in Canada,https://www.ctvnews.ca/canada/judge-sets-aside-ruling-that-granted-u-s-trans-woman-s-refugee-status-in-canada-1.6754271,neutral,0.061950006,0.026389666,0.91166025,0.003141391375764968
CTV,2024-02-03,Winnipeg firefighters respond to two Friday evening fires,https://winnipeg.ctvnews.ca/winnipeg-firefighters-respond-to-two-friday-evening-fires-1.6754569,neutral,0.031989142,0.04971874,0.91829216,-0.0014486471555641423
CTV,2024-02-03,Hundreds gather to question P.E.I. health minister on ICU closure,https://atlantic.ctvnews.ca/more/hundreds-gather-to-question-p-e-i-health-minister-on-icu-closure-1.6753650,negative,0.015624278,0.30784878,0.676527,-0.09452672777632642
CTV,2024-02-03,Ontario 'crypto king' associate sentenced to jail,https://toronto.ctvnews.ca/ontario-crypto-king-associate-sentenced-to-jail-1.6751774,negative,0.017262423,0.5104884,0.4722492,-0.2603003911124677
CTV,2024-02-03,Advocates say Canada needs to look at alternatives after 9th province decides to stop immigration detention in jails,https://www.ctvnews.ca/canada/advocates-say-canada-needs-to-look-at-alternatives-after-9th-province-decides-to-stop-immigration-detention-in-jails-1.6753808,neutral,0.03918948,0.07234731,0.8884632,-0.003698318607453732
CTV,2024-02-03,Trudeau calls Alberta Premier Danielle Smith's transgender policies 'the most' anti-LGBTQ2S+ in Canada,https://www.ctvnews.ca/politics/trudeau-calls-alberta-premier-danielle-smith-s-transgender-policies-the-most-anti-lgbtq2s-in-canada-1.6753330,negative,0.01066304,0.6418229,0.34751403,-0.4118229396478412
CTV,2024-02-03,"Valentine’s Day: Canadians spending more, celebrating less according to new survey",https://winnipeg.ctvnews.ca/valentine-s-day-canadians-spending-more-celebrating-less-according-to-new-survey-1.6754031,neutral,0.14458777,0.15741847,0.6979938,-0.0038749521026932854
CTV,2024-02-03,PM Trudeau slams Alberta Premier over anti-LGBTQ2S+ policies,/video/c2860151-trudeau-slams-alberta-s-anti-lgbtq2s--policies?playlistId=1.6750850,negative,0.008685776,0.6675979,0.32371628,-0.4456115393137523
CTV,2024-02-03,Saskatoon woman fears homelessness as she navigates difficult housing market,https://saskatoon.ctvnews.ca/saskatoon-woman-fears-homelessness-as-she-navigates-difficult-housing-market-1.6754679,negative,0.010229867,0.6405025,0.3492675,-0.41013887425297213
CTV,2024-02-03,"Fishtailing tractor trailer forces Hwy. 401 ramp closed near Prescott, Ont.",https://ottawa.ctvnews.ca/fishtailing-tractor-trailer-forces-hwy-401-ramp-closed-near-prescott-ont-1.6754438,negative,0.011398214,0.5183666,0.47023517,-0.2685740176677669
CTV,2024-02-03,Feds want your input on greenhouse gas emissions,/video/c2860187-feds-want-public-input-on-greenhouse-gas-emissions?playlistId=1.6677659,neutral,0.038559694,0.16890211,0.7925382,-0.027041070538562195
CTV,2024-02-03,Why Apple is pushing the term 'spatial computing' along with its new Vision Pro headset,https://www.ctvnews.ca/business/why-apple-is-pushing-the-term-spatial-computing-along-with-its-new-vision-pro-headset-1.6753646,positive,0.24133378,0.017643861,0.7410222,0.057930715214538964
CTV,2024-02-03,Eby 'profoundly disturbed' by attack on B.C. Crown prosecutor near courthouse,https://bc.ctvnews.ca/eby-profoundly-disturbed-by-attack-on-b-c-crown-prosecutor-near-courthouse-1.6754340,negative,0.008606023,0.6926228,0.29877114,-0.4796522937311778
CTV,2024-02-03,'Crypto king' investor says she doesn’t believe Pleterski is orchestrating alleged Ponzi scheme alone,https://toronto.ctvnews.ca/crypto-king-investor-says-she-doesn-t-believe-pleterski-is-orchestrating-alleged-ponzi-scheme-alone-1.6753075,negative,0.021051794,0.37891403,0.6000342,-0.14313266288012017
CTV,2024-02-03,"It's called 'cozy cardio.' In a world seeking comfort, some seek a happier mode of exercise",https://www.ctvnews.ca/lifestyle/it-s-called-cozy-cardio-in-a-world-seeking-comfort-some-seek-a-happier-mode-of-exercise-1.6751359,positive,0.4858829,0.019071879,0.49504519,0.2357184778090442
CTV,2024-02-03,U.S. says it may bomb more Middle East targets. One militia says it doesn't want a wider fight,https://www.ctvnews.ca/world/u-s-says-it-may-bomb-more-middle-east-targets-one-militia-says-it-doesn-t-want-a-wider-fight-1.6754414,negative,0.00891856,0.63113254,0.35994887,-0.3982487458137314
CTV,2024-02-03,Did Windsor make the right call on HAF? What a housing expert thinks of the debate,https://windsor.ctvnews.ca/did-windsor-make-the-right-call-on-haf-what-a-housing-expert-thinks-of-the-debate-1.6754468,neutral,0.054473326,0.08604205,0.85948473,-0.004435887278080308
CBC,2024-02-03,"'Rest in peace, my beautiful boy': Sammy Yatim's mother welcomes coroner's inquest verdict",https://www.cbc.ca/news/canada/toronto/sammy-yatim-mother-verdict-1.7103854,positive,0.9048867,0.006277505,0.08883568,0.8187806606848391
CBC,2024-02-03,A primer on the messy U.S. migration debate now spreading everywhere from Ukraine to Canada,https://www.cbc.ca/news/world/us-migration-debate-primer-1.7102722,neutral,0.021324687,0.11717932,0.861496,-0.013276252742230099
CBC,2024-02-03,NHL commissioner says it's not 'necessary' to suspend NHL players charged with sexual assault,https://www.cbc.ca/news/politics/nhl-press-conference-sexual-assault-charges-1.7103104,negative,0.011110161,0.59675133,0.39213857,-0.3559886639753884
CBC,2024-02-03,WATCH : CBC News Explore,https://www.cbc.cahttps://gem.cbc.ca/live,neutral,0.09840742,0.014817321,0.88677526,0.009464467482493077
CBC,2024-02-03,"Remembering John Baker, believed to be among the last people in Canada born into slavery",https://www.cbc.ca/news/canada/ottawa/john-baker-last-born-into-slavery-canada-1.7100493,neutral,0.049789723,0.19637598,0.7538343,-0.03608450683063591
CBC,2024-02-03,WATCH: CBC News Network,https://www.cbc.cahttps://gem.cbc.ca/live,neutral,0.10073908,0.018231502,0.88102955,0.00981596340483426
CBC,2024-02-03,IN PHOTOS | This week's most compelling Canadian images,https://www.cbc.cahttps://www.cbc.ca/newsinteractives/features/compelling-canadian-images-1-29,positive,0.6136785,0.0044785333,0.38184288,0.3765813170976884
CBC,2024-02-03,Measles has exploded in Europe. Clinicians say it's only a matter of time before outbreaks hit Canada,https://www.cbc.ca/news/health/measles-has-exploded-in-europe-clinicians-say-it-s-only-a-matter-of-time-before-outbreaks-hit-canada-1.7102005,negative,0.021233473,0.66019857,0.318568,-0.4354112513356512
CBC,2024-02-03,B.C. minister under fire for comments about Middle East before creation of Israeli state,https://www.cbc.ca/news/canada/british-columbia/selina-robinson-israel-comments-calls-to-resign-1.7102824,negative,0.010582462,0.46306962,0.52634794,-0.21432148269591167
CBC,2024-02-03,Court challenge delays sentencing of oral surgeon who let prison guard do dental work on inmate,https://www.cbc.ca/news/canada/newfoundland-labrador/louis-bourget-sentencing-delayed-1.7102985,negative,0.0092333825,0.65361315,0.3371536,-0.427124818339248
CBC,2024-02-03,"Joly says Canada will sanction some 'extremist' Israeli settlers, Hamas leaders",https://www.cbc.ca/news/politics/canada-sanctions-settlers-hamas-1.7104203,negative,0.0112654315,0.4367526,0.55198205,-0.19062588753392617
CBC,2024-02-03,"Molly McGlynn, Emily Hampshire and Maddie Ziegler talk Fitting In",https://www.cbc.ca/news/entertainment/movie-fitting-in-interview-1.7103810,neutral,0.11056555,0.004838387,0.88459605,0.012201332594150571
CBC,2024-02-03,"Manulife-Loblaw deal raises questions over ties between insurance companies, big drug retailers",https://www.cbc.ca/news/business/manulife-loblaw-deal-deliver-specialty-drugs-1.7098861,neutral,0.03645312,0.08691816,0.8766287,-0.006225937733619791
CBC,2024-02-03,See the 'unholy' so-called bagels causing a stir at a famous Montreal bagel shop,https://www.cbc.ca/player/play/2304972867756,negative,0.023740785,0.570194,0.40606517,-0.3245576129251475
CBC,2024-02-03,All of Loblaw-less Labrador cut out as Manulife makes exclusive deal with retail giant,https://www.cbc.ca/news/canada/newfoundland-labrador/manulife-loblaws-labrador-1.7103254,negative,0.033769056,0.37597916,0.5902518,-0.14021997707133238
CBC,2024-02-03,24 Sussex is now asbestos and rodent-free — and nobody knows what to do with it,https://www.cbc.ca/news/politics/24-sussex-abatement-future-plan-1.7103058,negative,0.11618121,0.45164242,0.43217638,-0.19048279209402885
CBC,2024-02-03,Seniors with existing dental coverage feel left behind by national plan,https://www.cbc.cahttps://www.cbc.ca/player/play/2306099779885,negative,0.01795174,0.75257444,0.22947372,-0.5660461056146211
CBC,2024-02-03,"U.S. action on West Bank violence too little too late, says aunt of slain Palestinian American teen",https://www.cbc.ca/news/world/west-bank-israeli-settlers-palestinians-violence-1.7102765,negative,0.00786619,0.70784026,0.28429362,-0.5009758993735431
CBC,2024-02-03,"Snow day, now eclipse day? Why the celestial event has some schools going dark",https://www.cbc.ca/news/canada/montreal/school-closures-solar-total-eclipse-april-parents-quebec-ontario-1.7101784,negative,0.016630491,0.5563775,0.42699218,-0.3092792527722281
CBC,2024-02-03,People are nuts about this giant Alberta squirrel,https://www.cbc.ca/player/play/2305688131597,negative,0.031449985,0.7766923,0.19185777,-0.6022617722491015
CBC,2024-02-03,Trudeau and Poilievre have very different theories of change,https://www.cbc.ca/news/politics/trudeau-poilievre-election-1.7103710,negative,0.038440816,0.23522809,0.7263312,-0.05385454051080707
CBC,2024-02-03,Real estate receiverships on the rise in Canada as projects stall,https://www.cbc.ca/news/canada/british-columbia/real-estate-receiverships-1.7102448,negative,0.017974783,0.55419767,0.42782763,-0.30681191519923523
CBC,2024-02-03,A Gaza doctor has been missing since November. His Canadian cousin is still looking for answers,https://www.cbc.ca/news/world/gaza-doctor-missing-answers-1.7103214,negative,0.010533531,0.6853397,0.30412674,-0.46957957502195313
CBC,2024-02-03,At least 19 dead in Chile as intense forest fires approach densely populated areas,https://www.cbc.ca/news/world/chile-forest-fires-1.7104302,negative,0.008599736,0.81212044,0.17927997,-0.6594655176559527
CBC,2024-02-03,Authorities urge people to stay off roads as snowstorm rolls through N.S.,https://www.cbc.ca/news/canada/nova-scotia/long-duration-snowstorm-this-weekend-1.7103273,neutral,0.028044783,0.19882557,0.77312964,-0.03874509622711031
CBC,2024-02-03,Weird ancient tree from before dinosaurs found in Canadian quarry,https://www.cbc.ca/news/science/tree-fossil-1.7102888,neutral,0.06967162,0.10406539,0.826263,-0.005975469194216654
CBC,2024-02-03,Taking your dog out for a ski — you gotta see it to believe it,https://www.cbc.ca/player/play/2304643140001,neutral,0.19993615,0.05726258,0.74280125,0.03669546321313799
CBC,2024-02-03,"Athletes, advocates push back against Alberta's new gender-identity policies",https://www.cbc.ca/news/canada/edmonton/alberta-transgender-women-and-girls-athletes-sports-1.7104116,negative,0.030742506,0.2544753,0.71478224,-0.06381256404839775
CBC,2024-02-03,How a piece of the Eiffel Tower ended up on this Canadian bridge,https://www.cbc.ca/player/play/2306099267712,negative,0.033386115,0.35333422,0.6132798,-0.12373038969495553
CBC,2024-02-03,How will the Manulife-Loblaw deal impact your prescriptions?,https://www.cbc.ca/news/business/manulife-loblaw-deal-impact-audience-explainer-1.7100440,neutral,0.025692496,0.080719054,0.89358854,-0.005855456139014947
CBC,2024-02-03,'I'm not happy': Workers look to Loblaw to keep promises 10 years after garment factory collapse in Bangladesh,https://www.cbc.cahttps://www.cbc.ca/newsinteractives/features/made-in-bangladesh,negative,0.0070625874,0.8778454,0.11509215,-0.770562528033572
CBC,2024-02-03,Jeopardy! contestant hits the Canadian category jackpot,https://www.cbc.ca/player/play/2306110531536,positive,0.64636356,0.013240673,0.34039572,0.41761054988717383
