source,date,headline,url,chosen_label,positive,negative,neutral,compound
CTV,2024-03-04,"WATCH: Man wields nail gun at protest in Thornhill, Ont.",/video/c2877854-man-allegedly-shoots-nail-gun-at-protest?playlistId=1.6793257,negative,0.009109098,0.597247,0.39364392,-0.3566210090594488
CTV,2024-03-04,GardaWorld awarded Halifax Harbour Bridges contract,https://atlantic.ctvnews.ca/gardaworld-awarded-halifax-harbour-bridges-contract-1.6793436,neutral,0.07637545,0.029696928,0.89392763,0.004951301147266829
CTV,2024-03-04,Long-term roadwork resumes on this busy street in Barrie's north end,https://barrie.ctvnews.ca/long-term-roadwork-resumes-on-this-busy-street-in-barrie-s-north-end-1.6793547,neutral,0.03140254,0.11867431,0.8499231,-0.013097478177532373
CTV,2024-03-04,1st case of measles reported in B.C. over the weekend: Health Ministry,https://bc.ctvnews.ca/1st-case-of-measles-reported-in-b-c-over-the-weekend-health-ministry-1.6793601,neutral,0.017222136,0.14589362,0.8368842,-0.020988351683393525
CTV,2024-03-04,"Nurses 'toolkit' aims to address high rates of burnout, stress in Canada",https://www.ctvnews.ca/canada/nurses-toolkit-aims-to-address-high-rates-of-burnout-stress-in-canada-1.6793722,neutral,0.051835347,0.21629135,0.7318733,-0.044095051520827155
CTV,2024-03-04,Three levels of government spending $258 million on Bedford-Halifax ferries,https://atlantic.ctvnews.ca/more/three-levels-of-government-spending-258-million-on-bedford-halifax-ferries-1.6793562,neutral,0.04257645,0.11915835,0.8382652,-0.012385959014906689
CTV,2024-03-04,"Athens, Ont. junior jockey player suffers 'potentially life changing' injury after hit from behind",https://ottawa.ctvnews.ca/athens-ont-junior-jockey-player-suffers-potentially-life-changing-injury-after-hit-from-behind-1.6793581,negative,0.011677043,0.64689696,0.341426,-0.41833932177026156
CTV,2024-03-04,B.C. lawyer Hong Guo disbarred a 2nd time for being 'ungovernable',https://bc.ctvnews.ca/b-c-lawyer-hong-guo-disbarred-a-2nd-time-for-being-ungovernable-1.6786731,negative,0.008608272,0.6737941,0.3175977,-0.45392433456621717
CTV,2024-03-04,The eyes have it: The intriguing history of kohl,https://www.ctvnews.ca/lifestyle/the-eyes-have-it-the-intriguing-history-of-kohl-1.6789443,positive,0.29779306,0.006241202,0.695966,0.0886416760993356
CTV,2024-03-04,Three Red Sea underwater data cables have been cut as Houthi attacks continue in the vital waterway,https://www.ctvnews.ca/world/three-red-sea-underwater-data-cables-have-been-cut-as-houthi-attacks-continue-in-the-vital-waterway-1.6793584,negative,0.006630455,0.80184674,0.19152278,-0.6429142353974804
CTV,2024-03-04,Train derailment no longer affecting St. Albert traffic,https://edmonton.ctvnews.ca/train-derailment-no-longer-affecting-st-albert-traffic-1.6793456,negative,0.0132543985,0.43606937,0.5506762,-0.18998081562854452
CTV,2024-03-04,Here's why North Americans drive on the right and the U.K. drives on the left,https://www.ctvnews.ca/lifestyle/here-s-why-north-americans-drive-on-the-right-and-the-u-k-drives-on-the-left-1.6792545,neutral,0.062527545,0.061424583,0.87604785,0.00013671446204632787
CTV,2024-03-04,"AI has come for music. So far, there's a Great Big Sea between people and algorithms",https://www.ctvnews.ca/entertainment/ai-has-come-for-music-so-far-there-s-a-great-big-sea-between-people-and-algorithms-1.6792682,positive,0.5086231,0.04687822,0.44449866,0.2564999140382582
CTV,2024-03-04,Haiti orders nightly curfew trying to restore calm after a weekend of violence and prison break,https://www.ctvnews.ca/world/haiti-orders-nightly-curfew-trying-to-restore-calm-after-a-weekend-of-violence-and-prison-break-1.6793277,neutral,0.025458833,0.17978396,0.79475725,-0.03167411405048881
CTV,2024-03-04,"Fast car, slow return: Ferrari stolen in 1995 from a Formula One driver is recovered by U.K. police",https://www.ctvnews.ca/world/fast-car-slow-return-ferrari-stolen-in-1995-from-a-formula-one-driver-is-recovered-by-u-k-police-1.6793334,neutral,0.07005535,0.20787704,0.7220676,-0.03830511361890743
CTV,2024-03-04,Metro Vancouver skiers flock to B.C. Interior amid dismal snow conditions at home,https://bc.ctvnews.ca/metro-vancouver-skiers-flock-to-b-c-interior-amid-dismal-snow-conditions-at-home-1.6775946,negative,0.032146767,0.37894595,0.5889073,-0.14256661685889682
CTV,2024-03-04,String of drug-related deaths prompts police warning in N.L.,https://www.ctvnews.ca/canada/string-of-drug-related-deaths-prompts-police-warning-in-n-l-1.6776789,negative,0.007956212,0.62747973,0.36456403,-0.39366753135333
CTV,2024-03-04,Scientists have used cells from fluid drawn during pregnancy to grow mini lungs and other organs,https://www.ctvnews.ca/sci-tech/scientists-have-used-cells-from-fluid-drawn-during-pregnancy-to-grow-mini-lungs-and-other-organs-1.6793616,neutral,0.07266606,0.040069878,0.8872641,0.0036747603866849055
CTV,2024-03-04,"U.S. Supreme Court keeps Trump on Colorado ballot, rejecting 14th Amendment push",https://www.ctvnews.ca/world/u-s-supreme-court-keeps-trump-on-colorado-ballot-rejecting-14th-amendment-push-1.6793507,neutral,0.021798437,0.21619613,0.7620055,-0.046265582537476924
CTV,2024-03-04,'Unconscionable': Fake posters promise family doctors in B.C. community,https://bc.ctvnews.ca/unconscionable-fake-posters-promise-family-doctors-in-b-c-community-1.6788709,negative,0.012104028,0.6759889,0.3119069,-0.4568146012115548
CTV,2024-03-04,Here's a look at the hot spots for vehicle thefts in Ottawa so far in 2024,https://ottawa.ctvnews.ca/here-s-a-look-at-the-hot-spots-for-vehicle-thefts-in-ottawa-so-far-in-2024-1.6793443,neutral,0.019173797,0.18223023,0.798596,-0.032840213875338975
CTV,2024-03-04,Are you a health-care worker who decided to leave Canada?,https://www.ctvnews.ca/canada/are-you-a-health-care-worker-who-decided-to-leave-canada-1.6793691,neutral,0.03303603,0.057878427,0.90908563,-0.0022585307819955602
CTV,2024-03-04,Hurricanes hang on to edge Raiders in Prince Albert 4-3,https://calgary.ctvnews.ca/hurricanes-hang-on-to-edge-raiders-in-prince-albert-4-3-1.6792957,neutral,0.09579712,0.0069832955,0.89721954,0.009128326052509905
CTV,2024-03-04,Family seeks answers after son falls from resort balcony,/video/c2877924-ctv-national-news--questions-after-resort-death,negative,0.02213232,0.3588739,0.6189938,-0.1283006297320437
CTV,2024-03-04,Ottawa Catholic school principal charged with sexual assault against staff member,https://ottawa.ctvnews.ca/ottawa-catholic-school-principal-charged-with-sexual-assault-against-staff-member-1.6793713,negative,0.0109453285,0.6827367,0.306318,-0.46600957439019375
CTV,2024-03-04,Drivers urged to use caution in Metro Vancouver after snowfall,https://bc.ctvnews.ca/drivers-urged-to-use-caution-in-metro-vancouver-after-snowfall-1.6793441,neutral,0.04567067,0.15194121,0.8023882,-0.021000312992853765
CTV,2024-03-04,'How could they allow this?' Many Canadians frustrated with CERB experience,https://www.ctvnews.ca/canada/how-could-they-allow-this-many-canadians-frustrated-with-cerb-experience-1.6792740,negative,0.005198488,0.87140447,0.123397216,-0.7593185824531945
CTV,2024-03-04,Regina in cleanup mode following weekend snowstorm,https://regina.ctvnews.ca/regina-in-cleanup-mode-following-weekend-snowstorm-1.6793523,neutral,0.037686102,0.09018677,0.8721271,-0.006713411483847409
CTV,2024-03-04,Mondays daytime high will be 19 C colder than normal,https://calgary.ctvnews.ca/mondays-daytime-high-will-be-19-c-colder-than-normal-1.6793637,neutral,0.04123483,0.20653453,0.75223064,-0.04095620355116125
CTV,2024-03-04,Extremely cold conditions expected across Alberta,https://calgary.ctvnews.ca/extremely-cold-conditions-expected-across-alberta-1.6793362,negative,0.028473618,0.6675956,0.30393073,-0.444873190676617
CTV,2024-03-04,Celebrity owl Flaco memorialized in New York after fatal building collision,https://www.ctvnews.ca/lifestyle/celebrity-owl-flaco-memorialized-in-new-york-after-fatal-building-collision-1.6793091,neutral,0.058236055,0.21189316,0.7298708,-0.04150727238899776
CTV,2024-03-04,Firefighters rescue dog that fell through ice in Cape Breton,https://atlantic.ctvnews.ca/firefighters-rescue-dog-that-fell-through-ice-in-cape-breton-1.6793460,neutral,0.07288349,0.09153754,0.83557886,-0.0030671211570276746
CTV,2024-03-04,'Hometown feel for me': B.C. skip Catlin Schneider competing at Brier in home province,https://regina.ctvnews.ca/hometown-feel-for-me-b-c-skip-catlin-schneider-competing-at-brier-in-home-province-1.6793729,neutral,0.20221955,0.007509859,0.79027057,0.04083635256461804
CTV,2024-03-04,"Horses escape police stables, make a run on Ohio highway",/video/c2878170-runaway-horses-dash-around-cars-on-busy-highway,neutral,0.043275904,0.092515595,0.86420846,-0.006686333524300814
CTV,2024-03-04,Manitoba still dealing with winter weather warnings,https://winnipeg.ctvnews.ca/manitoba-still-dealing-with-winter-weather-warnings-1.6791634,negative,0.03162949,0.28029844,0.6880721,-0.0775667881820592
CTV,2024-03-04,Freeland promises to 'unlock pathways' to middle-class life in April 16 federal budget,https://www.ctvnews.ca/politics/freeland-promises-to-unlock-pathways-to-middle-class-life-in-april-16-federal-budget-1.6793614,neutral,0.14981966,0.013435638,0.8367446,0.022265427704463825
CTV,2024-03-04,"GM recalling 250,000 pickup trucks in Canada for tailgate issue",https://www.ctvnews.ca/autos/gm-recalling-250-000-pickup-trucks-in-canada-for-tailgate-issue-1.6791384,negative,0.012174613,0.61200845,0.37581694,-0.37440612478884816
CTV,2024-03-04,Peek inside Seth Rogen's $2.3M penthouse up for sale in Vancouver,https://bc.ctvnews.ca/peek-inside-seth-rogen-s-2-3m-penthouse-up-for-sale-in-vancouver-1.6784907,neutral,0.07149753,0.0058936337,0.92260873,0.005077168695448719
CBC,2024-03-04,WATCH : CBC News Explore,https://www.cbc.cahttps://gem.cbc.ca/live,neutral,0.09840742,0.014817321,0.88677526,0.009464467482493077
CBC,2024-03-04,"As measles cases climb,  parents urged to vaccinate their children",https://www.cbc.ca/radio/the-dose/measles-vaccine-1.7129447,neutral,0.054247573,0.15166989,0.7940826,-0.02006095190465107
CBC,2024-03-04,"Apple to pay $14.4 million settlement in iPhone throttling case, B.C. judge decides",https://www.cbc.ca/news/business/apple-settlement-british-columbia-supreme-court-1.7098096,neutral,0.043008994,0.12777941,0.8292115,-0.01447781363166456
CBC,2024-03-04,"Cargo ship hit by Houthis sinks, spilling oil and fertilizer into Red Sea",https://www.cbc.ca/news/world/houthi-attack-oil-spill-1.7132518,negative,0.0059786746,0.8037874,0.19023375,-0.646038562990225
CBC,2024-03-04,"See the new, immersive biodiversity exhibit at Montreal's Palais des Congrès",https://www.cbc.ca/player/play/2312870979681,positive,0.5750038,0.004632286,0.4203639,0.33060791505789666
CBC,2024-03-04,"They were supposed to get a new train station. Instead, these Toronto residents are 'staring at a hole in the ground'",https://www.cbc.ca/news/canada/toronto/mimico-go-redevelopment-cancelled-1.7123972,negative,0.009244334,0.8316505,0.15910509,-0.6915571627391621
CBC,2024-03-04,Tour of snowy Saskatoon gives glimpse into why city is urging residents to stay home,https://www.cbc.ca/player/play/2314078787943,neutral,0.060001973,0.06799974,0.87199837,-0.00102372758120306
CBC,2024-03-04,Sask. buried in snow as weekend storm forces school closures,https://www.cbc.ca/news/canada/saskatchewan/weekend-storm-school-closures-1.7132708,negative,0.0131312,0.68368137,0.30318743,-0.4672477856355606
CBC,2024-03-04,"This man, 92, thought he ordered a collector's coin. $1,000 later, the coins kept coming",https://www.cbc.ca/news/canada/newfoundland-labrador/bradford-exchange-coins-1.7120887,neutral,0.20331402,0.16340618,0.6332798,0.014635012103951794
CBC,2024-03-04,This Sudbury convenience store is famous for its sandwiches,https://www.cbc.ca/player/play/2313601603912,positive,0.88710445,0.007912427,0.10498298,0.7868917994302533
CBC,2024-03-04,"From Kyiv, with fraud: Why Canada is a main target of investment scammers",https://www.cbc.ca/news/ukraine-call-centre-canada-crypto-scam-1.7127166,negative,0.006076086,0.854279,0.13964486,-0.7297557101459944
CBC,2024-03-04,U.S. Supreme Court allows Trump to stay on Colorado primary ballot,https://www.cbc.ca/news/world/ussc-trump-colorado-ballot-1.7132814,neutral,0.11797662,0.0076504042,0.8743729,0.013859962574517048
CBC,2024-03-04,Can a compulsory curriculum lead to a deeper understanding of Black history?,https://www.cbc.ca/news/education-mandatory-black-history-1.7124113,neutral,0.15093334,0.04118637,0.8078803,0.021084556929030107
CBC,2024-03-04,Snowstorm pounds Saskatoon as residents dig out,https://www.cbc.ca/player/play/2313941571782,negative,0.029978247,0.33802173,0.632,-0.11335999165027033
CBC,2024-03-04,Wrongfully convicted of murder and the 40-year fight for justice,https://www.cbc.ca/player/play/2312879683591,negative,0.0072528617,0.9115545,0.081192516,-0.8308791179127937
CBC,2024-03-04,Chrystia Freeland to present federal budget on April 16,https://www.cbc.ca/news/politics/federal-budget-april-16-2024-1.7132999,neutral,0.07585799,0.013046911,0.9110952,0.005584206082875909
CBC,2024-03-04,"Haiti state of emergency in effect after police killings, massive prison break",https://www.cbc.ca/news/world/haiti-violence-curfew-1.7132831,negative,0.0069711553,0.8301119,0.16291685,-0.689037240550574
CBC,2024-03-04,His dying wish was to see the new Dune movie — so Denis Villeneuve sent him his laptop,https://www.cbc.ca/news/canada/montreal/dune-ii-man-dying-wish-1.7132622,positive,0.45311505,0.027030043,0.51985484,0.2045826466864753
CBC,2024-03-04,"Eleanor Collins, the first lady of Canadian jazz, dead at 104",https://www.cbc.ca/news/canada/british-columbia/eleanor-collins-obituary-1.7132681,neutral,0.08366372,0.16264963,0.7536867,-0.0194552792146796
CBC,2024-03-04,"Skijordue's 'gnarliest' weather ever doesn't stop these horses, skiers and fans in Alberta",https://www.cbc.ca/player/play/2313943107944,negative,0.043044426,0.6106898,0.34626576,-0.37108921344609236
CBC,2024-03-04,Desjardins stops offering mortgages in high-risk flood zones in Quebec,https://www.cbc.ca/news/climate/quebec-desjardins-flooding-mortgage-1.7129986,negative,0.013264433,0.4691228,0.5176129,-0.21990019899164537
CBC,2024-03-04,"Measles cases in Quebec underscore importance of vaccination, doctor says",https://www.cbc.ca/player/play/2313946179893,neutral,0.030651664,0.21429321,0.7550551,-0.044982056394509584
CBC,2024-03-04,Toronto police reviewing pro-Palestinian protest that prompted Trudeau team to scrap event,https://www.cbc.ca/news/canada/toronto-pro-palestinian-protest-trudeau-art-gallery-of-ontario-1.7132664,negative,0.010203097,0.58460206,0.40519476,-0.34165549665644335
CBC,2024-03-04,Russia's invasion decimated Mariupol. Now it claims to be making the Ukrainian city great again,https://www.cbc.cahttps://www.cbc.ca/newsinteractives/features/remaking-mariupol-into-a-russian-city,negative,0.013069856,0.81689763,0.1700325,-0.6671509175776009
CBC,2024-03-04,Retired N.B. scientist to launch balloon for high-altitude view of solar eclipse,https://www.cbc.ca/news/canada/new-brunswick/balloon-total-solar-eclipse-1.7131124,neutral,0.15592603,0.01131779,0.8327562,0.02418482920869547
CBC,2024-03-04,Blizzard buries parts of northern California,https://www.cbc.ca/player/play/2313994819826,negative,0.017585093,0.7339799,0.24843495,-0.5384172831112988
CBC,2024-03-04,RCMP lay terrorism charges against Edmonton city hall shooting suspect,https://www.cbc.ca/news/canada/edmonton/edmonton-city-hall-shooting-suspect-charged-with-terrorism-offences-1.7133063,negative,0.006705153,0.7376611,0.25563383,-0.5440988864192491
CBC,2024-03-04,New satellite will track elusive methane pollution from oil and gas industry globally,https://www.cbc.ca/news/climate/methanesat-launch-climate-1.7132770,neutral,0.055028975,0.07059536,0.8743757,-0.001955516365463872
CBC,2024-03-04,Canada's Joshua Liendo swims into the history book,https://www.cbc.ca/player/play/2313993283948,neutral,0.08450876,0.022661867,0.8928294,0.0066281679357516055
CBC,2024-03-04,"Quebec greenlights X gender markers for driver's licences, health cards in policy U-turn",https://www.cbc.ca/news/canada/montreal/quebec-greenlights-x-gender-marker-drivers-licence-ramq-1.7132822,neutral,0.056560338,0.04583436,0.89760536,0.0010982827387542304
CBC,2024-03-04,Humpback whale numbers fall 20% but scientists aren't worried yet,https://www.cbc.ca/news/canada/british-columbia/whales-pacific-science-1.7131768,negative,0.081594,0.30649132,0.6119147,-0.08727934713676078
CBC,2024-03-04,#TheMoment a herd of goats set off a police chase,https://www.cbc.ca/player/play/2313992771868,neutral,0.032308914,0.17669563,0.7909954,-0.03017748355775396
CBC,2024-03-04,"Israel skips key ceasefire meeting with Hamas over unanswered hostage questions, official says",https://www.cbc.ca/news/world/israel-hamas-hostages-ceasefire-talks-1.7132610,negative,0.007054466,0.6862586,0.30668676,-0.4709012415888125
CBC,2024-03-04,"Demanding a proper say, Cat Lake First Nation's injunction pauses First Mining Gold's road work for project",https://www.cbc.ca/news/canada/thunder-bay/cat-lake-first-nation-first-mining-gold-1.7131255,negative,0.039473247,0.25295514,0.7075715,-0.06242818694850172
CBC,2024-03-04,Apple fined almost $2B by the EU in music streaming antitrust probe,https://www.cbc.ca/news/business/apple-fined-2b-european-union-music-streaming-1.7132896,negative,0.022544138,0.5462357,0.43122023,-0.2978651490242825
CBC,2024-03-04,Skiers pulled by horses over ramps in a gnarly snowstorm? Only in Alberta,https://www.cbc.ca/player/play/2313943107944,negative,0.019152602,0.7149674,0.26587984,-0.5108117077420715
CBC,2024-03-04,Did you get a text with your SIN that claims to be from Canada Revenue Agency? It's a scam,https://www.cbc.ca/news/canada/kitchener-waterloo/text-sin-scam-canadian-revenue-agency-1.7131267,negative,0.009439054,0.84312016,0.14744072,-0.7107625667789819
CBC,2024-03-04,Sask. parent says mounting frequency of teacher job action taking toll on working families,https://www.cbc.ca/news/canada/saskatchewan/parent-says-mounting-frequency-of-teacher-job-action-taking-toll-on-working-families-1.7131740,negative,0.014810512,0.56230015,0.42288947,-0.31596203752008023
CBC,2024-03-04,WATCH: CBC News Network,https://www.cbc.cahttps://gem.cbc.ca/live,neutral,0.10073908,0.018231502,0.88102955,0.00981596340483426
CBC,2024-03-04,WATCH | Never heard of skijoring? Check out skiers being pulled by horses,https://www.cbc.cahttps://www.cbc.ca/player/play/2313943107944,neutral,0.053617552,0.07607885,0.87030375,-0.0029131457473710043
