source,date,headline,url,chosen_label,positive,negative,neutral,compound
CTV,2024-04-16,Housing starts down seven per cent in March from February: CMHC,https://www.ctvnews.ca/business/housing-starts-down-seven-per-cent-in-march-from-february-cmhc-1.6848846,negative,0.014474077,0.4801753,0.50535065,-0.23035880726364866
CTV,2024-04-16,Apartment fire linked to battery-operated vacuum cleaner,https://barrie.ctvnews.ca/apartment-fire-linked-to-battery-operated-vacuum-cleaner-1.6849450,negative,0.02140918,0.46059272,0.51799804,-0.21168732392001388
CTV,2024-04-16,"2023 was a record year for wind installations as world ramps up clean energy, report says",https://www.ctvnews.ca/climate-and-environment/2023-was-a-record-year-for-wind-installations-as-world-ramps-up-clean-energy-report-says-1.6849430,positive,0.820568,0.004905449,0.1745265,0.6733078324307433
CTV,2024-04-16,Teenagers' screen time has dropped post-pandemic: Montreal Public Health,https://montreal.ctvnews.ca/teenagers-screen-time-has-dropped-post-pandemic-montreal-public-health-1.6849761,negative,0.013519087,0.5500333,0.43644756,-0.3023538652405975
CTV,2024-04-16,Halifax Transit bus involved in three-vehicle crash in city’s downtown,https://atlantic.ctvnews.ca/more/halifax-transit-bus-involved-in-three-vehicle-crash-in-city-s-downtown-1.6848972,negative,0.015418756,0.51693565,0.46764556,-0.26698473919940646
CTV,2024-04-16,Phonebooks in a digital age: Who’s still using them?,/video/c2905241-ctv-national-news--phonebooks-in-a-digital-age,neutral,0.041451495,0.11062045,0.847928,-0.010518662197478434
CTV,2024-04-16,"Infrastructure, housing investments among budget highlights for local mayors",https://kitchener.ctvnews.ca/infrastructure-housing-investments-among-budget-highlights-for-local-mayors-1.6849858,positive,0.35343635,0.008091584,0.63847214,0.12485176001051457
CTV,2024-04-16,Quebec teacher fired after taking leave to be on 'Survivor' reality TV series,https://montreal.ctvnews.ca/quebec-teacher-fired-after-taking-leave-to-be-on-survivor-reality-tv-series-1.6840465,negative,0.020093823,0.44581363,0.53409266,-0.19834597648157626
CTV,2024-04-16,Stretching isn't always the answer for pain and muscle tension,https://www.ctvnews.ca/health/stretching-isn-t-always-the-answer-for-pain-and-muscle-tension-1.6849815,negative,0.016437696,0.64051753,0.3430448,-0.4099924929697316
CTV,2024-04-16,"Parts of Sask. could see up to 30 centimetres of snow, dangerous driving conditions: ECCC",https://regina.ctvnews.ca/parts-of-sask-could-see-up-to-30-centimetres-of-snow-dangerous-driving-conditions-eccc-1.6849520,negative,0.018089432,0.5904796,0.391431,-0.3483389286570535
CTV,2024-04-16,Step inside 'The Brain': Northern education tool aims to promote drug safety,https://www.ctvnews.ca/canada/step-inside-the-brain-northern-education-tool-aims-to-promote-drug-safety-1.6849268,positive,0.3889607,0.007092488,0.60394675,0.15124014875301306
CTV,2024-04-16,"Yorkton woman left breathless after winning $100,000",https://regina.ctvnews.ca/yorkton-woman-left-breathless-after-winning-100-000-1.6849856,positive,0.65177244,0.026767232,0.32146037,0.4240907897322259
CTV,2024-04-16,YMCA in the Sault ceasing operations next month,https://northernontario.ctvnews.ca/ymca-in-the-sault-ceasing-operations-next-month-1.6849660,neutral,0.018087639,0.13469377,0.84721863,-0.017815244159917754
CTV,2024-04-16,Trump's hush money trial: Challenges of selecting a jury,/video/c2905129-unlikely-trump-will-testify-at-trial--farnsworth?playlistId=1.6844226,negative,0.015053043,0.5670594,0.41788766,-0.3213297173363294
CTV,2024-04-16,From $60M to $215M: A brief history of Sudbury’s efforts to build a new arena,https://northernontario.ctvnews.ca/from-60m-to-215m-a-brief-history-of-sudbury-s-efforts-to-build-a-new-arena-1.6849354,neutral,0.10215022,0.006049509,0.89180017,0.01039808098439643
CTV,2024-04-16,What Winnie the Pooh and Mickey Mouse can tell us about the public domain and remix culture,https://www.ctvnews.ca/entertainment/what-winnie-the-pooh-and-mickey-mouse-can-tell-us-about-the-public-domain-and-remix-culture-1.6849210,neutral,0.16965117,0.023836074,0.80651265,0.028213374669241453
CTV,2024-04-16,'He’s done great things': incarcerated Windsorite works to make prison more culturally sensitive for fellow inmates,https://windsor.ctvnews.ca/he-s-done-great-things-incarcerated-windsorite-works-to-make-prison-more-culturally-sensitive-for-fellow-inmates-1.6849191,positive,0.9158316,0.0048716073,0.07929694,0.8387236775373581
CTV,2024-04-16,Liberals plan to convert some Montreal office buildings into housing under federal budget,https://montreal.ctvnews.ca/liberals-plan-to-convert-some-montreal-office-buildings-into-housing-under-federal-budget-1.6849881,neutral,0.05461749,0.02429307,0.9210894,0.0023929178467718693
CTV,2024-04-16,"Facing a Republican revolt, House Speaker Johnson pushes ahead on U.S. aid for Ukraine, allies",https://www.ctvnews.ca/world/facing-a-republican-revolt-house-speaker-johnson-pushes-ahead-on-u-s-aid-for-ukraine-allies-1.6849680,neutral,0.039236713,0.061039347,0.89972395,-0.0021862820815510275
CTV,2024-04-16,"Glenn Howard, iconic Canadian curler, announces retirement",https://barrie.ctvnews.ca/glenn-howard-iconic-canadian-curler-announces-retirement-1.6849774,neutral,0.196149,0.01266963,0.79118145,0.038313896619122545
CTV,2024-04-16,Sault bartender realizes her dream of business ownership,https://northernontario.ctvnews.ca/sault-bartender-realizes-her-dream-of-business-ownership-1.6849882,positive,0.5354978,0.014188407,0.45031384,0.286556550845134
CTV,2024-04-16,"Feds offer $5B in Indigenous loan guarantees, fall $420B short on infrastructure asks",https://www.ctvnews.ca/politics/feds-offer-5b-in-indigenous-loan-guarantees-fall-420b-short-on-infrastructure-asks-1.6849649,neutral,0.040267766,0.17319606,0.78653616,-0.028375385087325178
CTV,2024-04-16,NASA looks for new ways to return Martian samples to Earth due to budget cuts,https://www.ctvnews.ca/sci-tech/nasa-looks-for-new-ways-to-return-martian-samples-to-earth-due-to-budget-cuts-1.6847822,neutral,0.070521586,0.17236343,0.757115,-0.024735855773562854
CTV,2024-04-16,Contest launched to decide fate of old Montreal stadium roof,/video/c2905238-ctv-national-news--new-roof-for-montreal-stadium?playlistId=1.6757503,neutral,0.06710975,0.03777667,0.8951136,0.0030766412565776946
CTV,2024-04-16,'Why not do it together?': Lifelong friends take part in 'brosectomy' in Vancouver,https://bc.ctvnews.ca/why-not-do-it-together-lifelong-friends-take-part-in-brosectomy-in-vancouver-1.6845608,neutral,0.2092799,0.01073482,0.7799853,0.043682831966190605
CTV,2024-04-16,Grain-gobbling bears spark 'no stopping' zone in Banff National Park,https://calgary.ctvnews.ca/grain-gobbling-bears-spark-no-stopping-zone-in-banff-national-park-1.6845229,negative,0.03528648,0.31354412,0.6511694,-0.09706477352626663
CTV,2024-04-16,"‘They need to come down’: Christmas decorations still up on city property in Cambridge, Waterloo",https://kitchener.ctvnews.ca/they-need-to-come-down-christmas-decorations-still-up-on-city-property-in-cambridge-waterloo-1.6849703,neutral,0.061205912,0.075969554,0.86282456,-0.002025209113047932
CTV,2024-04-16,"HRF, Municipal Hail Insurance teaming up to bring latest technology to Regina General Hospital",https://regina.ctvnews.ca/hrf-municipal-hail-insurance-teaming-up-to-bring-latest-technology-to-regina-general-hospital-1.6849750,positive,0.38493216,0.0061062523,0.60896176,0.14813541397363394
CTV,2024-04-16,"Living paycheque-to-paycheque: 'Canadians are under stress,' warns Equifax",https://www.ctvnews.ca/business/living-paycheque-to-paycheque-canadians-are-under-stress-warns-equifax-1.6849035,negative,0.03376571,0.3775446,0.58868974,-0.14139979059838836
CTV,2024-04-16,Author Salman Rushdie relives day of stabbing in newest memoir 'Knife',https://www.ctvnews.ca/lifestyle/author-salman-rushdie-relives-day-of-stabbing-in-newest-memoir-knife-1.6849305,neutral,0.03488737,0.15414044,0.81097215,-0.022542150775899827
CTV,2024-04-16,Fears regional war could erupt after Iran’s missile attack,/video/c2905150-israel-vows-to-respond-to-iran-s-attack?playlistId=1.6846542,negative,0.008308752,0.724832,0.26685923,-0.5253123901992929
CTV,2024-04-16,Extended construction in Marda Loop creates further financial concern among businesses,https://calgary.ctvnews.ca/extended-construction-in-marda-loop-creates-further-financial-concern-among-businesses-1.6849826,negative,0.016384551,0.63316274,0.3504527,-0.40062661655470855
CTV,2024-04-16,U.K. plan to phase out smoking for good passes first hurdle,https://www.ctvnews.ca/world/u-k-plan-to-phase-out-smoking-for-good-passes-first-hurdle-1.6849438,neutral,0.17507774,0.030459892,0.79446244,0.02972439775239266
CTV,2024-04-16,Guilty pleas entered in beating of mentally ill man on Saskatchewan farm,https://saskatoon.ctvnews.ca/guilty-pleas-entered-in-beating-of-mentally-ill-man-on-saskatchewan-farm-1.6849634,negative,0.014098641,0.66150284,0.32439846,-0.437387271678773
CTV,2024-04-16,Young P.E.I. actor fulfills childhood dream to play Anne Shirley,https://atlantic.ctvnews.ca/young-p-e-i-actor-fulfills-childhood-dream-to-play-anne-shirley-1.6841414,positive,0.74895686,0.0033005697,0.24774262,0.5609254609738432
CTV,2024-04-16,NASA confirms mystery object that crashed through roof of Florida home came from space station,https://www.ctvnews.ca/sci-tech/nasa-confirms-mystery-object-that-crashed-through-roof-of-florida-home-came-from-space-station-1.6848198,neutral,0.085560024,0.038210142,0.8762298,0.005860503216682078
CTV,2024-04-16,$440K in stolen property recovered by RCMP during rural crime investigation,https://edmonton.ctvnews.ca/440k-in-stolen-property-recovered-by-rcmp-during-rural-crime-investigation-1.6849589,negative,0.020016134,0.4364836,0.5435002,-0.19011731752961936
CTV,2024-04-16,'It's troubling': Winnipeg sports memorabilia store target of three break-ins,https://winnipeg.ctvnews.ca/it-s-troubling-winnipeg-sports-memorabilia-store-target-of-three-break-ins-1.6849571,negative,0.00650654,0.7947331,0.1987605,-0.6315582469524292
CBC,2024-04-16,"Driven by athlete insights, Team Canada unveils outfits for Paris Olympics, Paralympics",https://www.cbc.ca/sports/olympics/olympics-paralympics-paris-team-canada-uniforms-1.7175207,positive,0.39554933,0.0047349227,0.5997159,0.15643679236705843
CBC,2024-04-16,WATCH : CBC News Explore,https://www.cbc.cahttps://gem.cbc.ca/live,neutral,0.09840742,0.014817321,0.88677526,0.009464467482493077
CBC,2024-04-16,"New investment to lead 'housing revolution in Canada,' Freeland says",https://www.cbc.ca/player/play/1.7175635,positive,0.3434772,0.008819626,0.6477032,0.11789879369075607
CBC,2024-04-16,Fire engulfs Copenhagen's historic stock exchange building,https://www.cbc.ca/news/world/fire-denmark-stock-exchange-1.7174862,negative,0.018031536,0.6563492,0.32561928,-0.43046911253548714
CBC,2024-04-16,#TheMoment a man outran the New York City subway,https://www.cbc.ca/player/play/1.7174827,positive,0.28073806,0.018489003,0.7007729,0.0784720283142164
CBC,2024-04-16,Judge orders Alberta to produce massive trove of coal documents after 4-year fight,https://www.cbc.ca/news/canada/calgary/judge-alberta-coal-documents-1.7174263,negative,0.023530902,0.3736551,0.602814,-0.1390644279638753
CBC,2024-04-16,Budget hikes taxes on the rich to cover billions in new spending,https://www.cbc.ca/news/politics/federal-budget-2024-main-1.7175052,negative,0.098824844,0.31354642,0.5876287,-0.08854501041238372
CBC,2024-04-16,Are you renting with no plans to buy? Here's what the federal budget has for you,https://www.cbc.ca/news/business/young-renters-federal-government-budget-1.7174007,neutral,0.1639204,0.07693425,0.7591453,0.020951022409471776
CBC,2024-04-16,Conservative leader rises in House of Commons to reject Liberal budget,https://www.cbc.ca/player/play/1.7175698,neutral,0.03790045,0.17466612,0.78743345,-0.02907180805065135
CBC,2024-04-16,Canadian Aaliyah Edwards is headed to the WNBA. Her high school basketball coach couldn't be prouder,https://www.cbc.ca/radio/asithappens/aaliyah-edwards-high-school-coach-1.7175734,positive,0.9723695,0.002144307,0.025486078,0.9454979793422562
CBC,2024-04-16,"Virtual doctor, virtual waiting room: New tech holds promise of speeding up ER wait times",https://www.cbc.ca/news/canada/nova-scotia/new-technologies-hold-promise-to-speed-up-er-wait-times-1.7173776,positive,0.47951826,0.008722097,0.5117597,0.22986166298770527
CBC,2024-04-16,"Basketball star Caitlin Clark picked 1st overall in WNBA draft, Canada's Aaliyah Edwards goes 6th",https://www.cbc.ca/sports/basketball/wnba-draft-recap-clark-edwards-april-15-1.7174492,neutral,0.123435,0.00381705,0.872748,0.015221620850421225
CBC,2024-04-16,Police to announce arrests in Toronto airport gold heist,https://www.cbc.ca/news/canada/toronto/peel-police-arrests-pearson-airport-gold-heist-1.7175478,neutral,0.027070684,0.09491708,0.87801224,-0.008276429763858228
CBC,2024-04-16,"Despite weather glitch, Paris Olympics flame lit at Greek cradle of ancient games",https://www.cbc.ca/sports/olympics/olympic-torch-lighting-paris-games-greece-1.7174961,positive,0.5548205,0.009099869,0.43607962,0.3077429881856446
CBC,2024-04-16,The search is on for unbiased jurors in Trump's trial,https://www.cbc.ca/player/play/9.4204606,neutral,0.14283377,0.14867264,0.70849353,-0.0017020686702551302
CBC,2024-04-16,"Iron Dome, David’s Sling, Arrow 3: How Israeli missile defence works | About That",https://www.cbc.ca/player/play/1.7175499,neutral,0.032234974,0.043267246,0.92449784,-0.0008329603447760903
CBC,2024-04-16,"Manitoba's rural emergency departments closed for 80,000 hours in 2023: data",https://www.cbc.ca/news/canada/manitoba/rural-emergency-department-closures-1.7172529,neutral,0.021848049,0.12792574,0.8502263,-0.015887649308028884
CBC,2024-04-16,What's in the new federal budget?,https://www.cbc.ca/player/play/9.4204760,neutral,0.036110584,0.02093314,0.94295627,0.0008657780145560068
CBC,2024-04-16,'A race against time': Alberta community chasing solutions after months of hauling water,https://www.cbc.ca/news/canada/calgary/pincher-creek-david-desabrais-cowley-when-in-drought-1.7170621,neutral,0.05778981,0.21308951,0.7291206,-0.042067485867722354
CBC,2024-04-16,Thunder Bay Police Service's promises of reform after charges against ex-chief met with skepticism,https://www.cbc.ca/news/canada/thunder-bay/reaction-police-charges-1.7174642,negative,0.0111180255,0.593889,0.39499307,-0.3525804613778689
CBC,2024-04-16,Mysterious object that hit Florida man's roof was part of the International Space Station,https://www.cbc.ca/news/science/space-debris-florida-roof-iss-international-space-station-nasa-1.7174960,negative,0.048621494,0.36891735,0.5824611,-0.13373596692876077
CBC,2024-04-16,"McDavid 4th NHL player to reach 100-assist milestone, joining Gretzky, Lemieux, Orr",https://www.cbc.ca/sports/hockey/nhl/connor-mcdavid-100-assist-milestone-oilers-nhl-1.7175075,positive,0.37562156,0.0052248295,0.61915374,0.1410642113201277
CBC,2024-04-16,Trump's 1st criminal trial begins with huge challenge: finding 12 unbiased jurors,https://www.cbc.ca/news/world/trump-trial-jury-1.7174008,negative,0.03762057,0.4979535,0.4644259,-0.24654239858166171
CBC,2024-04-16,'We thrived': Nova Scotians who wintered in RVs call for permanent setup,https://www.cbc.ca/news/canada/nova-scotia/winter-rv-housing-pilot-project-1.7173791,positive,0.76267207,0.0076497947,0.229678,0.5816102746904122
CBC,2024-04-16,Drought puts Alberta farmers at risk of another scourge of grasshoppers,https://www.cbc.ca/news/canada/edmonton/drought-puts-alberta-farmers-at-risk-of-another-scourge-of-grasshoppers-1.7174491,negative,0.0087667955,0.8657801,0.12545292,-0.749498517504124
CBC,2024-04-16,Federal budget's funding boost for defence spread out over multiple years,https://www.cbc.ca/news/politics/federal-budget-2024-defence-spending-1.7175110,positive,0.32661957,0.013791749,0.6595887,0.10649012846826622
CBC,2024-04-16,"With a staff of just 3, this Ontario network is 'empowering' 150 Black businesses",https://www.cbc.ca/news/canada/hamilton/swoben-one-year-1.7174396,positive,0.5634588,0.0070065837,0.42953458,0.31743674399521105
CBC,2024-04-16,Liberals pledge $9B in new money for Indigenous communities in 2024 budget,https://www.cbc.ca/news/indigenous/budget-2024-indigenous-peoples-1.7175534,positive,0.5232636,0.00872966,0.4680068,0.27372856094897813
CBC,2024-04-16,"WATCH | Iron Dome, David's Sling, Arrow 3: How Israeli missile defence works | About That",https://www.cbc.cahttps://www.cbc.ca/player/play/1.7175499,neutral,0.035869926,0.023788277,0.9403417,0.0007207705163159162
CBC,2024-04-16,Ticket resale prices keep rising. What's Quebec doing to crack down?,https://www.cbc.ca/player/play/9.4203840,negative,0.009640845,0.7307934,0.25956565,-0.5339661141617711
CBC,2024-04-16,PHOTOS | In the sumo ring: Top wrestlers at the Honozumo festival,https://www.cbc.cahttps://www.cbc.ca/newsinteractives/features/sumo-festival,neutral,0.20267843,0.003983841,0.79333764,0.041062691592578915
CBC,2024-04-16,"Our reporter on covering Jennifer Pan’s murder plot, now the subject of a Netflix doc",https://www.cbc.ca/player/play/1.7174563,neutral,0.0301665,0.17638947,0.79344404,-0.030203228141065352
CBC,2024-04-16,Manitoba RCMP arrest 3 teens suspected of sexual assault in hockey hazing case,https://www.cbc.ca/news/canada/manitoba/teens-arrested-sexual-assault-hockey-hazing-1.7175286,negative,0.008064728,0.6618591,0.33007616,-0.437992421620212
CBC,2024-04-16,"Israeli artist and curators decline to show work at Venice Biennale, call for ceasefire",https://www.cbc.ca/news/world/israel-artist-venice-biennale-1.7174886,negative,0.010023454,0.68647695,0.30349964,-0.4711500868560208
CBC,2024-04-16,Uniform or costume? Athletes sound off on revealing U.S. women's Olympic track kit,https://www.cbc.ca/news/canada/olympic-women-track-uniforms-1.7174920,neutral,0.02270258,0.04806234,0.92923504,-0.001794582309884496
CBC,2024-04-16,WATCH: CBC News Network,https://www.cbc.cahttps://gem.cbc.ca/live,neutral,0.10073908,0.018231502,0.88102955,0.00981596340483426
CBC,2024-04-16,Quebec wants to stop sky-high prices from ticket resellers. It won't be easy,https://www.cbc.ca/news/canada/montreal/quebec-inflated-ticket-prices-1.7170721,negative,0.012564322,0.79598516,0.19145054,-0.6334345168631792
CBC,2024-04-16,"Mortgage interest still driving inflation, as overall rate nudges up to 2.9%",https://www.cbc.ca/news/business/inflation-up-march-2024-1.7174911,neutral,0.05766774,0.1941261,0.7482062,-0.03435937103975739
CBC,2024-04-16,"Liberals 'ignored opportunity' in budget to tackle corporate greed, NDP says",https://www.cbc.ca/player/play/1.7175657,negative,0.01672357,0.5523867,0.43088973,-0.30485138965906344
CBC,2024-04-16,"Heavy rains, flash floods sweep through Dubai",https://www.cbc.ca/player/play/9.4204727,negative,0.017016307,0.733011,0.2499727,-0.5370155826556555
CBC,2024-04-16,"NASA pauses Mars sample return plan until a cheaper, faster one can be developed",https://www.cbc.ca/news/science/nasa-mars-sample-return-1.7174976,neutral,0.06337199,0.11021395,0.82641405,-0.008131105611516976
CBC,2024-04-16,Poilievre rejects new federal budget,https://www.cbc.ca/player/play/1.7175698,negative,0.02000805,0.57997614,0.40001583,-0.3359720034878819
CBC,2024-04-16,Overwhelmed by the new federal budget? Here are the key takeaways,https://www.cbc.ca/news/politics/federal-budget-2024-highlights-need-to-know-1.7175062,negative,0.026661325,0.6615503,0.31178838,-0.4369379506491633
CBC,2024-04-16,'Woodland rapist' victim says genealogy website led police to alleged attacker,https://www.cbc.ca/news/canada/victim-in-historical-sex-assault-speaks-1.7171193,negative,0.0067662797,0.7788976,0.21433605,-0.6066357438278747
CBC,2024-04-16,Alberta's wildfire season has begun. Here's how its 500 new firefighters are preparing for it,https://www.cbc.ca/news/canada/edmonton/new-alberta-wildfire-fighters-2024-1.7174149,neutral,0.084599234,0.031294152,0.88410664,0.006177705271433354
