source,date,headline,url,chosen_label,positive,negative,neutral,compound
Global,2024-08-11,Matt Berger talks about his Paris 2024 Olympic skateboarding experience,https://globalnews.ca/video/10693432/matt-berger-talks-about-his-paris-2024-olympic-skateboarding-experience/,neutral,0.11514445,0.0048205694,0.880035,0.013235005659497645
Global,2024-08-11,"Alberta manhunt: Person of interest sought, rural residents asked to look for stolen quad",https://globalnews.ca/news/10690774/alberta-manhunt-strathmore-homicide-person-of-interest-stolen-quad/,neutral,0.022502027,0.16262662,0.8148714,-0.02594107311776206
Global,2024-08-11,"Tina Fontaine: Winnipeg honours life, legacy for 10-year anniversary of death",https://globalnews.ca/video/10693017/tina-fontaine-winnipeg-honours-life-legacy-for-10-year-anniversary-of-death/,neutral,0.07736382,0.12288124,0.7997549,-0.009114639969876048
Global,2024-08-11,Jasper wildfire: Re-entry plan for evacuated residents expected for Monday,https://globalnews.ca/video/10692997/jasper-wildfire-re-entry-plan-for-evacuated-residents-expected-for-monday/,neutral,0.021344963,0.06134362,0.91731143,-0.003307431832960006
Global,2024-08-11,UBC engineering students test their skills with burger flipping robots,https://globalnews.ca/video/10693009/ubc-engineering-students-test-their-skills-with-burger-flipping-robots/,neutral,0.067593254,0.032173038,0.90023375,0.003533742343098112
Global,2024-08-11,Restaurant industry in Okanagan hoping for busy August,https://globalnews.ca/news/10692430/okanagan-restaurant-industry-troubles/,positive,0.8302383,0.0037880014,0.16597377,0.689281220181619
Global,2024-08-11,Paris 2024: Breaking gold-medallist Philip Kim reflects on how his passion became an obsession,https://globalnews.ca/video/10693002/paris-2024-breaking-gold-medallist-philip-kim-reflects-on-how-his-passion-became-an-obsession/,positive,0.30824658,0.008364855,0.68338865,0.09494595814341444
Global,2024-08-11,Palma’s Picks: A new life and ancestral heritage explored,https://globalnews.ca/video/10693515/palmas-picks-a-new-life-and-ancestral-heritage-explored/,positive,0.3952838,0.005514761,0.5992015,0.15621883747711607
Global,2024-08-11,Hamilton police investigate double fatality,https://globalnews.ca/video/10691950/hamilton-police-investigate-double-fatality/,negative,0.023425825,0.3178856,0.65868855,-0.1005024992940946
Global,2024-08-11,Global News Hour at 6 BC: Aug. 10,https://globalnews.ca/video/9890000/global-news-hour-at-6-bc-aug-10/,neutral,0.04084275,0.007426763,0.95173055,0.001612971388403217
Global,2024-08-11,Fierce opposition to Richmond proposal,https://globalnews.ca/video/10692986/fierce-opposition-to-richmond-proposal/,negative,0.021410262,0.5898802,0.3887095,-0.3475002830707261
Global,2024-08-11,Crews continue to battle fires in the Interior,https://globalnews.ca/video/10692959/crews-continue-to-battle-fires-in-the-interior/,neutral,0.078498885,0.038682554,0.8828186,0.004665734232627283
Global,2024-08-11,Anti-tourist sentiment is spreading across Europe. Is Canada next?,https://globalnews.ca/news/10690978/anti-tourist-protests/,negative,0.0079963645,0.7461099,0.24589366,-0.5566160890404959
Global,2024-08-11,"‘On the brink’: Airlines flee small cities, cutting key links to rest of the country",https://globalnews.ca/news/10693309/airlines-canada-small-cities/,negative,0.011837036,0.59672785,0.39143515,-0.3559439736667116
Global,2024-08-11,"Inaugural Saskatchewan Open Farm Days sows seeds of knowledge, connection",https://globalnews.ca/news/10693447/inaugural-saskatchewan-open-farm-days-2024/,positive,0.5744956,0.0064682555,0.4190361,0.33000340579123844
Global,2024-08-11,NDP staffer who complained about alleged MPP harassment wrongly let go: arbitrator,https://globalnews.ca/news/10691697/ndp-staff-michael-mantha-arbitration-decision/,negative,0.00942455,0.6509753,0.33960024,-0.4236799444070005
Global,2024-08-11,Markets wild ride and the Bank of Canada,https://globalnews.ca/video/10693485/markets-wild-ride-and-the-bank-of-canada/,neutral,0.17115614,0.082288116,0.7465558,0.02252308426983518
Global,2024-08-11,Montreal drenched in record-breaking rain as tropical storm Debby’s remnants hit Canada,https://globalnews.ca/news/10692242/montreal-rain-record-tropical-storm-debby-eastern-canada/,negative,0.031650648,0.33849862,0.62985075,-0.11357955467186542
Global,2024-08-11,Spain tourism: Thousands protest in Mallorca over cost of living,https://globalnews.ca/video/10637089/spain-tourism-thousands-protest-in-mallorca-over-cost-of-living/,negative,0.009875722,0.76907027,0.22105397,-0.5913715808214919
Global,2024-08-11,"Debby in Canada: Heavy rain hits Quebec, Ontario as remnants of tropical storm move in",https://globalnews.ca/news/10689847/debby-storm-rain-quebec-ontario/,neutral,0.030195374,0.1743757,0.795429,-0.029495115060292676
Global,2024-08-11,Residential real estate activity trending upwards across the Okanagan,https://globalnews.ca/news/10693716/real-estate-trending-up-okanagan/,neutral,0.11608243,0.00673688,0.87718076,0.013429737616517112
Global,2024-08-11,Paris 2024: Team Canada’s historic Olympic medal wins,https://globalnews.ca/video/10692996/paris-2024-team-canadas-historic-olympic-medal-wins/,positive,0.8572646,0.002756664,0.13997881,0.7348949199331756
Global,2024-08-11,Growing calls for owner of dog to come forward following deadly attack in Stanley Park,https://globalnews.ca/video/10691851/growing-calls-for-owner-of-dog-to-come-forward-following-deadly-attack-in-stanley-park/,negative,0.012507494,0.64061046,0.34688202,-0.4102253381405365
Global,2024-08-11,Brazil plane crash: ATR-72 aircraft still used by some Canadian carriers,https://globalnews.ca/video/10692940/brazil-plane-crash-atr-72-aircraft-still-used-by-some-canadian-carriers/,neutral,0.017225454,0.18284726,0.79992735,-0.033136392226966294
Global,2024-08-11,CFL initiates review of possible Chad Kelly reinstatement after receiving assessment,https://globalnews.ca/news/10692542/chad-kelly-review-cfl/,neutral,0.024709813,0.031557858,0.94373226,-0.0003853239869684444
Global,2024-08-11,New leader named for B.C.’s police watchdog service,https://globalnews.ca/news/10692413/bc-iio-new-leader/,neutral,0.07453089,0.013733763,0.9117353,0.005366240564748104
Global,2024-08-11,"Dunbar fire aftermath: 2 houses destroyed, removing collapsed crane will take 2 weeks",https://globalnews.ca/news/10692580/vancouver-fire-aftermath-crane-collapse-removal/,negative,0.0075414656,0.84266603,0.14979258,-0.7100290894466266
CTV,2024-08-11,Two impaired driving incidents in one day,https://barrie.ctvnews.ca/two-impaired-driving-incidents-in-one-day-1.6997008,negative,0.016210794,0.7473176,0.23647164,-0.5582207909215393
CTV,2024-08-11,B.C. researchers discover 'super-black' material that absorbs more than 99% of light,https://bc.ctvnews.ca/b-c-researchers-discover-super-black-material-that-absorbs-more-than-99-of-light-1.6993536,neutral,0.14975765,0.035014864,0.8152275,0.02120131038884665
CTV,2024-08-11,Harris needs to avoid this 2016 Clinton mistake: expert,/video/c2975118-harris-tries-to-avoid-clinton-s-2016-mistake?playlistId=1.6992037,neutral,0.07164458,0.1822876,0.74606776,-0.02809583009372396
CTV,2024-08-11,"Gatineau Park remains closed to vehicles after torrential downpour damages roads, trails",https://ottawa.ctvnews.ca/gatineau-park-remains-closed-to-vehicles-after-torrential-downpour-damages-roads-trails-1.6996747,negative,0.013254355,0.6240337,0.36271197,-0.38924236798245815
CTV,2024-08-11,Ottawa MP and cabinet minister responds to Sutcliffe's transit funding request,https://ottawa.ctvnews.ca/ottawa-mp-and-cabinet-minister-responds-to-sutcliffe-s-transit-funding-request-1.6995417,neutral,0.031626288,0.012226758,0.956147,0.0008507273482520894
CTV,2024-08-11,"Salon owner hosts fundraiser for Cambridge, Ont. school supporting neurodivergent children",https://kitchener.ctvnews.ca/salon-owner-hosts-fundraiser-for-cambridge-ont-school-supporting-neurodivergent-children-1.6996411,neutral,0.19007608,0.006961953,0.80296195,0.03608045119629644
CTV,2024-08-11,'We're still working for peace': National Peacekeepers Day commemorated in Windsor,https://windsor.ctvnews.ca/we-re-still-working-for-peace-national-peacekeepers-day-commemorated-in-windsor-1.6996862,positive,0.63594514,0.005642886,0.358412,0.4043943617602199
CTV,2024-08-11,Cavalry FC knock off Halifax 3-2 to move up to third place,https://calgary.ctvnews.ca/cavalry-fc-knock-off-halifax-3-2-to-move-up-to-third-place-1.6996914,positive,0.22938573,0.00432567,0.7662885,0.05259912010275869
CTV,2024-08-11,Ukraine troops inside Russia in surprise military incursion,/video/c2975202-what-impact-will-offensive-have-on-war-?playlistId=1.6996817,negative,0.020875366,0.40873963,0.57038504,-0.16663228979182598
CTV,2024-08-11,"'I don't want to die,' Uvalde student told 911 dispatcher during mass shooting",https://www.ctvnews.ca/world/i-don-t-want-to-die-uvalde-student-told-911-dispatcher-during-mass-shooting-1.6996603,negative,0.013696101,0.6736576,0.3126464,-0.4536269350053601
CTV,2024-08-11,Old-fashioned flea market get new lease on life in Cape Breton,https://atlantic.ctvnews.ca/old-fashioned-flea-market-get-new-lease-on-life-in-cape-breton-1.6996913,neutral,0.08533528,0.052657012,0.8620076,0.004509351645785031
CTV,2024-08-11,The strongest meteor shower of the year is about to peak. Here’s how to watch,https://www.ctvnews.ca/climate-and-environment/the-strongest-meteor-shower-of-the-year-is-about-to-peak-here-s-how-to-watch-1.6996719,positive,0.66018456,0.0035810468,0.3362343,0.4358308909823787
CTV,2024-08-11,Ontario police reporting 'sharp increase' in motorcyclist fatalities: OPP,https://kitchener.ctvnews.ca/ontario-police-reporting-sharp-increase-in-motorcyclist-fatalities-opp-1.6996763,negative,0.014247573,0.35919788,0.6265546,-0.1288201067326753
CTV,2024-08-11,Sask. RCMP searching for two armed robbery suspects in vehicle stolen from Edmonton,https://saskatoon.ctvnews.ca/sask-rcmp-searching-for-two-armed-robbery-suspects-in-vehicle-stolen-from-edmonton-1.6996713,negative,0.018022003,0.23238607,0.7495921,-0.05367845033458263
CTV,2024-08-11,Chatham-Kent police investigate mischief incidents,https://windsor.ctvnews.ca/chatham-kent-police-investigate-mischief-incidents-1.6996786,neutral,0.015711231,0.13057032,0.8537185,-0.016801757658367222
CTV,2024-08-11,"Thieves used pickup truck to break into Lululemon store in Kamloops, RCMP say",https://bc.ctvnews.ca/thieves-used-pickup-truck-to-break-into-lululemon-store-in-kamloops-rcmp-say-1.6990254,negative,0.015507982,0.46923706,0.51525503,-0.21994287936289503
CTV,2024-08-11,Ukraine's Zelenskyy indirectly confirms daring military incursion onto Russian soil,https://www.ctvnews.ca/world/ukraine-s-zelenskyy-indirectly-confirms-daring-military-incursion-onto-russian-soil-1.6996543,negative,0.018418245,0.35013974,0.63144195,-0.12225862326507553
CTV,2024-08-11,Chinese mystery snails invading Quebec lakes by the thousands,https://montreal.ctvnews.ca/chinese-mystery-snails-invading-quebec-lakes-by-the-thousands-1.6996195,negative,0.029613255,0.42806348,0.54232335,-0.18236136407939085
CTV,2024-08-11,Hiker in distress transported to hospital in Calgary by STARS Air Ambulance,https://calgary.ctvnews.ca/hiker-in-distress-transported-to-hospital-in-calgary-by-stars-air-ambulance-1.6996606,negative,0.0160907,0.47706386,0.5068453,-0.2273310891332141
CTV,2024-08-11,Lightning expected to continue to challenge B.C. wildfire crews,https://bc.ctvnews.ca/lightning-expected-to-continue-to-challenge-b-c-wildfire-crews-1.6996733,negative,0.014446037,0.3782685,0.6072854,-0.14287839906268118
CTV,2024-08-11,"Rail shutdown possible in two weeks, as lockout warnings follow labour board ruling",https://www.ctvnews.ca/business/rail-shutdown-possible-in-two-weeks-as-lockout-warnings-follow-labour-board-ruling-1.6995165,negative,0.010629909,0.61548615,0.3738839,-0.37871023615188903
CTV,2024-08-11,"Survivor in deadly Stratford, Ont. shooting shares his story",/video/c2974826-ont--shooting-survivor-shares-his-story?playlistId=1.6987483,neutral,0.03055759,0.1998601,0.76958233,-0.03901028927278549
CTV,2024-08-11,'Freedom Convoy' organizer Pat King granted bail after alleged breach,https://www.ctvnews.ca/canada/freedom-convoy-organizer-pat-king-granted-bail-after-alleged-breach-1.6994819,negative,0.021749342,0.32649052,0.6517603,-0.10612298105986362
CTV,2024-08-11,"Summer McIntosh, Ethan Katzberg named Canada's flag-bearers",https://www.ctvnews.ca/sports/summer-mcintosh-ethan-katzberg-named-canada-s-flag-bearers-1.6996749,neutral,0.10500148,0.009243299,0.88575524,0.010939869900419286
CTV,2024-08-11,Demotion of VicPD officer who leaked documents to media will be reviewed: OPCC,https://bc.ctvnews.ca/demotion-of-vicpd-officer-who-leaked-documents-to-media-will-be-reviewed-opcc-1.6996944,negative,0.01683349,0.24192548,0.7412411,-0.058244557290684895
CTV,2024-08-11,"Historic rainfall damages properties, washes out road",/video/c2975208-rawdon-isolated-after-road-washes-out?playlistId=1.6995276,negative,0.010314806,0.8158644,0.17382064,-0.6655284178434702
CTV,2024-08-11,"Dog saved, cat dies in Alliston fire",https://barrie.ctvnews.ca/dog-saved-cat-dies-in-alliston-fire-1.6996659,neutral,0.08090165,0.17979634,0.7393019,-0.025781654640049112
CTV,2024-08-11,"Police arrest a man climbing the Eiffel Tower, prompting an evacuation hours before closing ceremony",https://www.ctvnews.ca/world/police-arrest-a-man-climbing-the-eiffel-tower-prompting-an-evacuation-hours-before-closing-ceremony-1.6996641,negative,0.01311662,0.4243469,0.5625364,-0.1798982650522838
CTV,2024-08-11,Toronto police officer injured after locating stolen vehicle in North York,https://toronto.ctvnews.ca/toronto-police-officer-injured-after-locating-stolen-vehicle-in-north-york-1.6997056,negative,0.008530061,0.6558768,0.33559307,-0.4301016538952709
CTV,2024-08-11,Kayaker found dead in Lake Erie,https://london.ctvnews.ca/kayaker-found-dead-in-lake-erie-1.6996567,negative,0.021997606,0.27709067,0.7009118,-0.07629532142079576
CTV,2024-08-11,Parade runs through downtown Montreal to end the 18th Pride festival,https://montreal.ctvnews.ca/parade-runs-through-downtown-montreal-to-end-the-18th-pride-festival-1.6996634,neutral,0.10272825,0.00792976,0.8893421,0.010490199100389397
CTV,2024-08-11,Man taken to hospital with stab wounds after fight between two groups in Etobicoke,https://toronto.ctvnews.ca/man-taken-to-hospital-with-stab-wounds-after-fight-between-two-groups-in-etobicoke-1.6996542,negative,0.0136297,0.5061241,0.48024616,-0.25597584407819785
CTV,2024-08-11,South Okanagan police seek help identifying person of interest in string of thefts,https://bc.ctvnews.ca/south-okanagan-police-seek-help-identifying-person-of-interest-in-string-of-thefts-1.6989256,negative,0.019463466,0.30237037,0.6781662,-0.0910489964143224
CTV,2024-08-11,Paris closes out 2024 Olympics with a final star-studded show,https://www.ctvnews.ca/sports/paris-closes-out-2024-olympics-with-a-final-star-studded-show-1.6996824,positive,0.5336971,0.005555417,0.46074748,0.28480176237866317
CTV,2024-08-11,'Lucky the Lobster' stops in northern Ontario as he 'hitchhikes' to Alberta,https://northernontario.ctvnews.ca/lucky-the-lobster-stops-in-northern-ontario-as-he-hitchhikes-to-alberta-1.6995671,neutral,0.20459856,0.086676635,0.70872474,0.034347740013027206
CTV,2024-08-11,Missing woman in Orillia,https://barrie.ctvnews.ca/missing-woman-in-orillia-1.6996826,negative,0.022481522,0.45572987,0.52178866,-0.20718427116703353
CTV,2024-08-11,Former YouTube CEO Susan Wojcicki dies at 56 of lung cancer,https://www.ctvnews.ca/business/former-youtube-ceo-susan-wojcicki-dies-at-56-of-lung-cancer-1.6996016,negative,0.03439472,0.39326608,0.5723391,-0.15347524702540305
CTV,2024-08-11,"In years following legalization, Canada had world's fastest-growing rate of MAID deaths, says report",https://www.ctvnews.ca/health/in-years-following-legalization-canada-had-world-s-fastest-growing-rate-of-maid-deaths-says-report-1.6995297,negative,0.03778407,0.2803492,0.68186677,-0.07716802798123368
CTV,2024-08-11,Community steps in to help after popular Ottawa pizzeria vandalized,https://ottawa.ctvnews.ca/community-steps-in-to-help-after-popular-ottawa-pizzeria-vandalized-1.6996958,negative,0.05084921,0.23461418,0.71453655,-0.05245818114008571
CTV,2024-08-11,Meet the trio bringing you the first St. John's Fashion Week,https://www.ctvnews.ca/lifestyle/meet-the-trio-bringing-you-the-first-st-john-s-fashion-week-1.6995714,positive,0.5673326,0.0027785536,0.42988873,0.321858654901348
CTV,2024-08-11,"Wildfire near Temiskaming Shores, Kirkland Lake 5, still not under control",https://northernontario.ctvnews.ca/wildfire-near-temiskaming-shores-kirkland-lake-5-still-not-under-control-1.6996952,negative,0.0144168185,0.3529113,0.6326719,-0.12433853656292015
CTV,2024-08-11,One person killed in plane crash in west Newfoundland,https://www.ctvnews.ca/canada/one-person-killed-in-plane-crash-in-west-newfoundland-1.6996259,negative,0.008398123,0.69763345,0.2939685,-0.4866218545215517
CTV,2024-08-11,Cat dies in Sarnia apartment fire,https://london.ctvnews.ca/cat-dies-in-sarnia-apartment-fire-1.6996871,negative,0.01393769,0.54490817,0.44115412,-0.296730649491181
CTV,2024-08-11,'Having fun': Regina BMX race draws in athletes of all ages,https://regina.ctvnews.ca/having-fun-regina-bmx-race-draws-in-athletes-of-all-ages-1.6997058,positive,0.84310293,0.0029482013,0.15394895,0.7108137742441345
CTV,2024-08-11,Ontario police seeing 'sharp increase' in motorcyclist fatalities: OPP,https://toronto.ctvnews.ca/ontario-police-seeing-sharp-increase-in-motorcyclist-fatalities-opp-1.6995407,negative,0.014304667,0.41002655,0.5756689,-0.16791711304652956
CTV,2024-08-11,"Old pantry staple is new again with people using it to improve fitness, disease and more. But it has risks",https://www.ctvnews.ca/health/old-pantry-staple-is-new-again-with-people-using-it-to-improve-fitness-disease-and-more-but-it-has-risks-1.6995120,neutral,0.16993245,0.17592074,0.6541469,-0.002071066853911674
CTV,2024-08-11,Recordings related to 2022 Uvalde school shooting released,/video/c2975200-recordings-in-deadly-school-shooting-released,neutral,0.01628632,0.161896,0.8218177,-0.025945070345037458
CTV,2024-08-11,Average rental rates in Nova Scotia well above national level: survey,https://atlantic.ctvnews.ca/average-rental-rates-in-nova-scotia-well-above-national-level-survey-1.6995380,neutral,0.1371992,0.017778438,0.8450224,0.018507543870572185
CTV,2024-08-11,"Airlines flee small cities, cutting key links to rest of the country",https://www.ctvnews.ca/business/airlines-flee-small-cities-cutting-key-links-to-rest-of-the-country-1.6996877,negative,0.013431443,0.5314576,0.4551109,-0.2822668113314606
CTV,2024-08-11,Aftermath of deadly explosion that levelled Maryland home,/video/c2975199-aftermath-of-house-explosion-in-maryland,negative,0.011537496,0.7480028,0.24045967,-0.5593751266967768
CTV,2024-08-11,U.S. auto safety agency seeks information from Tesla on fatal Cybertruck crash and fire in Texas,https://www.ctvnews.ca/autos/u-s-auto-safety-agency-seeks-information-from-tesla-on-fatal-cybertruck-crash-and-fire-in-texas-1.6991923,neutral,0.027358208,0.20964555,0.7629962,-0.04320279530532645
CTV,2024-08-11,Heavy smoke but no injuries reported in central Regina house fire,https://regina.ctvnews.ca/heavy-smoke-but-no-injuries-reported-in-central-regina-house-fire-1.6996721,negative,0.025694244,0.24376719,0.7305385,-0.058762267182991934
CTV,2024-08-11,"As Poilievre and industry call for Chinese EV tariff package, Liberals say stay tuned",https://www.ctvnews.ca/politics/as-poilievre-and-industry-call-for-chinese-ev-tariff-package-liberals-say-stay-tuned-1.6994821,neutral,0.052101962,0.050406862,0.8974912,0.00017376266099322635
CTV,2024-08-11,Summer surge: How severe is COVID in Canada? And what should you do?,https://www.ctvnews.ca/health/summer-surge-how-severe-is-covid-in-canada-and-what-should-you-do-1.6993777,neutral,0.023544764,0.1827919,0.7936633,-0.03285852674459466
CTV,2024-08-11,Man spotted climbing Eiffel Tower ahead of Olympics ceremony,/video/c2975182-man-scales-eiffel-tower-ahead-of-closing-ceremony?playlistId=1.6996803,positive,0.57677317,0.0030490248,0.42017794,0.3326579208831504
CTV,2024-08-11,"Man steals firearm, K9 unit assists in tracking, suspect flees from cops prior to arrest: Sault Police",https://northernontario.ctvnews.ca/man-steals-firearm-k9-unit-assists-in-tracking-suspect-flees-from-cops-prior-to-arrest-sault-police-1.6996679,negative,0.016370378,0.30922377,0.674406,-0.09535130743779696
CTV,2024-08-11,Storm Debby: 35 Quebec municipalities affected by rainstorm as clean up begins,https://montreal.ctvnews.ca/storm-debby-35-quebec-municipalities-affected-by-rainstorm-as-clean-up-begins-1.6996580,negative,0.012936888,0.5118262,0.47523683,-0.26179874319719687
CTV,2024-08-11,Search for missing swimmer in Leamington,https://windsor.ctvnews.ca/search-for-missing-swimmer-in-leamington-1.6996581,neutral,0.04601401,0.11599264,0.8379934,-0.011337001409410519
CTV,2024-08-11,On the lookout: New Brunswick bird watcher finds his 400th species of bird,https://www.ctvnews.ca/canada/on-the-lookout-new-brunswick-bird-watcher-finds-his-400th-species-of-bird-1.6996510,positive,0.22800094,0.0056651393,0.76633394,0.0519523310300567
CTV,2024-08-11,B.C. volunteers rescue injured hiker who fell 50 feet,https://bc.ctvnews.ca/b-c-volunteers-rescue-injured-hiker-who-fell-50-feet-1.6997053,neutral,0.05866882,0.109808296,0.8315228,-0.0086158348578107
CTV,2024-08-11,Federal workers rally to protest government's 3-day back-to-office mandate,https://ottawa.ctvnews.ca/federal-workers-rally-to-protest-government-s-3-day-back-to-office-mandate-1.6993986,negative,0.02186474,0.48633802,0.49179724,-0.23604660214123552
CTV,2024-08-11,"Regatta a 'go,' bringing thousands to Quidi Vidi Lake in St. John's",https://www.ctvnews.ca/canada/regatta-a-go-bringing-thousands-to-quidi-vidi-lake-in-st-john-s-1.6992234,neutral,0.07342385,0.026674146,0.89990205,0.0046795496918483614
CTV,2024-08-11,Anglers find body in Thames River at North London Athletic Fields,https://london.ctvnews.ca/anglers-find-body-in-thames-river-at-north-london-athletic-fields-1.6996225,neutral,0.012843265,0.16787255,0.81928426,-0.028016231371251088
CTV,2024-08-11,Report details sexual harassment investigation of northern Ont. MPP Michael Mantha,https://northernontario.ctvnews.ca/report-details-sexual-harassment-investigation-of-northern-ont-mpp-michael-mantha-1.6996236,negative,0.008988055,0.6207274,0.37028453,-0.3852217259009816
CTV,2024-08-11,'Bold and brilliant:' Loved ones remember firefighter killed fighting Jasper blaze,https://calgary.ctvnews.ca/bold-and-brilliant-loved-ones-remember-firefighter-killed-fighting-jasper-blaze-1.6996349,positive,0.70093787,0.04532093,0.25374112,0.48925996571844443
CTV,2024-08-11,Calgary officer helps save choking child after pulling over speeding vehicle,https://calgary.ctvnews.ca/calgary-officer-helps-save-choking-child-after-pulling-over-speeding-vehicle-1.6993427,neutral,0.04598487,0.19973385,0.7542811,-0.03777903192386134
CTV,2024-08-11,'It's an adult way to play with my toys': Bringing action figures to life through toy photography,https://atlantic.ctvnews.ca/it-s-an-adult-way-to-play-with-my-toys-bringing-action-figures-to-life-through-toy-photography-1.6993837,positive,0.6244918,0.0043596276,0.3711486,0.3899710156168794
CTV,2024-08-11,"Hamas leader Sinwar wants a ceasefire deal, mediators say, but Netanyahu’s stance unclear",https://www.ctvnews.ca/world/hamas-leader-sinwar-wants-a-ceasefire-deal-mediators-say-but-netanyahu-s-stance-unclear-1.6996655,neutral,0.02526082,0.12225113,0.85248804,-0.014307230588688213
CTV,2024-08-11,Montreal storm: First-hand stories of flooding and mayhem,https://montreal.ctvnews.ca/montreal-storm-first-hand-stories-of-flooding-and-mayhem-1.6996287,negative,0.0092009725,0.77807915,0.21272005,-0.6053223597799517
CTV,2024-08-11,Paris and the Olympics have changed each other during their summer fling,https://www.ctvnews.ca/sports/paris-and-the-olympics-have-changed-each-other-during-their-summer-fling-1.6996566,neutral,0.08048852,0.079092555,0.8404188,0.00022276945002630555
CTV,2024-08-11,The Perseid meteor shower peaks tonight. Here's how to watch it in B.C.,https://bc.ctvnews.ca/the-perseid-meteor-shower-peaks-tonight-here-s-how-to-watch-it-in-b-c-1.6996988,neutral,0.084968746,0.0057639363,0.9092673,0.0071864660031639715
CTV,2024-08-11,Here's who's running in Regina's 2024 municipal election so far,https://regina.ctvnews.ca/here-s-who-s-running-in-regina-s-2024-municipal-election-so-far-1.6996949,neutral,0.05023604,0.0064752423,0.94328856,0.002481737503399195
CTV,2024-08-11,Minister for women won't comment on committee drama as Liberal MP defends actions,https://www.ctvnews.ca/politics/minister-for-women-won-t-comment-on-committee-drama-as-liberal-mp-defends-actions-1.6994128,negative,0.018549943,0.22559234,0.75585765,-0.05054781785764462
CTV,2024-08-11,At least 18 dead after landfill site collapses in Uganda's capital,https://www.ctvnews.ca/world/at-least-18-dead-after-landfill-site-collapses-in-uganda-s-capital-1.6996780,negative,0.008819508,0.812755,0.17842546,-0.6604929116263012
CTV,2024-08-11,These cities will be too hot for the Olympics by 2050,https://www.ctvnews.ca/climate-and-environment/these-cities-will-be-too-hot-for-the-olympics-by-2050-1.6996726,negative,0.028640166,0.72665834,0.24470136,-0.5272121950576185
CTV,2024-08-11,Hilltops kick off season with win over Edmonton Huskies,https://saskatoon.ctvnews.ca/hilltops-kick-off-season-with-win-over-edmonton-huskies-1.6997036,positive,0.40996155,0.005249811,0.5847887,0.1680409012056039
