source,date,headline,url,chosen_label,positive,negative,neutral,compound
Global,2024-01-07,Manitoba has a ‘strong case’ to review carbon price in province: Kinew,https://globalnews.ca/news/10204257/wab-kinew-carbon-tax/,neutral,0.12586002,0.013796394,0.8603436,0.015650405041944815
Global,2024-01-07,Canadian soldier explains why he’s returning to Ukraine’s eastern trenches,https://globalnews.ca/video/10207992/canadian-soldier-explains-why-hes-returning-to-ukraines-eastern-trenches/,neutral,0.012112412,0.21001999,0.7778676,-0.043961683138550534
Global,2024-01-07,Will car prices come down in 2024? Here’s what industry experts predict,https://globalnews.ca/video/10209098/will-car-prices-come-down-in-2024-heres-what-industry-experts-predict/,neutral,0.073214225,0.046409782,0.8803759,0.003206456841202021
Global,2024-01-07,Will car prices come down in 2024? Industry experts share their outlook,https://globalnews.ca/news/10204235/auto-market-2024-forecast/,neutral,0.05622188,0.059323207,0.8844549,-0.00035834306492121826
Global,2024-01-07,"Nurses ‘frustrated’ as N.S. hospitals overflow with patients, exceed capacity",https://globalnews.ca/news/10208247/nova-scotia-hospitals-over-capacity-health-care/,negative,0.00991212,0.69260556,0.29748234,-0.479604184165785
Global,2024-01-07,‘The Curious Case of Natalia Grace: Natalia Speaks’ trailer,https://globalnews.ca/video/10207860/the-curious-case-of-natalia-grace-natalia-speaks-trailer/,neutral,0.07090793,0.0074431347,0.92164874,0.004972546259018884
Global,2024-01-07,Okanagan to host competing car shows on May long weekend,https://globalnews.ca/news/10208652/okanagan-competing-car-shows-may-long-weekend/,neutral,0.08135296,0.0075841206,0.911063,0.006560778114956811
Global,2024-01-07,World-famous latte artist helps draw business to Fredericton cafes,https://globalnews.ca/video/10208628/world-famous-latte-artist-helps-draw-business-to-fredericton-cafes/,positive,0.56368476,0.004265537,0.4320497,0.31772231548510277
Global,2024-01-07,B.C. government looks to modernize how it helps disaster evacuees,https://globalnews.ca/video/10208360/b-c-government-looks-to-modernize-how-it-helps-disaster-evacuees/,neutral,0.17266549,0.021134272,0.80620015,0.029366728109835094
Global,2024-01-07,Thompson RCMP searching for missing 53-year-old man,https://globalnews.ca/news/10208688/thompson-rcmp-searching-for-missing-53-year-old-man/,neutral,0.027011152,0.10430275,0.86868614,-0.010149457448732413
Global,2024-01-07,"Orphan Natalia Grace’s age finally proven, but new shocking twist revealed",https://globalnews.ca/news/10206895/curious-case-of-natalia-grace-age-confirmed/,neutral,0.11559693,0.09937748,0.78502554,0.0034867663869957433
Global,2024-01-07,Bowen Island considers opting in to short term rental rules,https://globalnews.ca/video/10208809/bowen-island-considers-opting-in-to-short-term-rental-rules/,neutral,0.035329245,0.021325793,0.94334483,0.0007933679282130512
Global,2024-01-07,6th high-risk Edmonton homeless encampment dismantled near Hope Mission,https://globalnews.ca/news/10208649/6th-high-risk-edmonton-homeless-encampment-dismantled-near-hope-mission/,negative,0.014633308,0.4405648,0.5448018,-0.1938832702608373
Global,2024-01-07,Canadian soldier explains why he’s returning to Ukraine’s eastern trenches,https://globalnews.ca/news/10204233/canadian-soldier-return-ukraine-eastern-trenches/,neutral,0.012112412,0.21001999,0.7778676,-0.043961683138550534
Global,2024-01-07,"Police, search and rescue looking for missing helicopter near Revelstoke, B.C.",https://globalnews.ca/news/10208677/search-missing-helicopter-revelstoke-bc/,neutral,0.024835818,0.07413493,0.90102935,-0.004879165383000483
Global,2024-01-07,"Tour bus crash in New York state kills 1, injures 11",https://globalnews.ca/video/10208460/tour-bus-crash-in-new-york-state-kills-1-injures-11/,negative,0.010034467,0.67091185,0.31905374,-0.4500219987972809
Global,2024-01-07,Trudeau’s plane breaks down during Jamaica family vacation,https://globalnews.ca/video/10208047/trudeaus-plane-broke-down-during-jamaica-family-vacation/,negative,0.015048931,0.6201252,0.3648258,-0.384328834180625
Global,2024-01-07,First major snowfall of 2024 to hit Nova Scotia on weekend,https://globalnews.ca/video/10208621/first-major-snowfall-of-2024-to-hit-nova-scotia-on-weekend/,neutral,0.117909,0.036373153,0.8457179,0.012579520978547976
Global,2024-01-07,Family friend finds missing senior who drove off embankment in southern Alberta,https://globalnews.ca/news/10208461/family-friend-finds-missing-senior-who-drove-off-embankment-in-southern-alberta/,neutral,0.020061845,0.1839185,0.7960197,-0.03342353408437404
Global,2024-01-07,"Most passengers on fatal New York bus crash were Canadian, officials say",https://globalnews.ca/news/10208318/canadians-on-new-york-bus-crash/,neutral,0.01381117,0.2097427,0.7764462,-0.04380123218139076
Global,2024-01-07,Global News turns 50: A trip down memory lane!,https://globalnews.ca/video/10208685/global-news-turns-50-a-trip-down-memory-lane/,positive,0.2422043,0.019708944,0.7380867,0.05827449053811051
Global,2024-01-07,JN.1 is Canada’s new dominant COVID-19 subvariant. Here’s what to know,https://globalnews.ca/news/10203470/jn1-covid-symptoms/,neutral,0.04806786,0.029241398,0.92269087,0.001455457454131448
Global,2024-01-07,"Bowen Island to consider opting in to B.C.’s new, stiffer short-term rental rules",https://globalnews.ca/news/10208285/bowen-island-short-term-rental/,neutral,0.023864096,0.05483071,0.9213051,-0.0024369140756513863
Global,2024-01-07,Multiple cougar sightings in Kelowna area: Conservation Officer Service,https://globalnews.ca/news/10208755/kelowna-multiple-cougar-sightings/,neutral,0.02590663,0.03099859,0.9430948,-0.00028975903104411227
Global,2024-01-07,‘It was poison’: Father speaks out after 15-year-old son dies from overdose,https://globalnews.ca/news/10206310/montreal-teen-overdose-opioid-crisis/,negative,0.0053090407,0.8472653,0.14742579,-0.7178301950190171
Global,2024-01-07,U.S. Secretary of Defense Lloyd Austin hospitalized secretly on New Year’s Day,https://globalnews.ca/video/10208700/u-s-secretary-of-defense-lloyd-austin-hospitalized-secretly-on-new-years-day/,neutral,0.017299488,0.1002041,0.88249636,-0.00974159422919385
Global,2024-01-07,How Canada’s mild winter is negatively impacting farmlands,https://globalnews.ca/video/10208452/how-canadas-mild-winter-is-negatively-impacting-farmlands/,negative,0.014767256,0.52321696,0.46201578,-0.2735379342608457
Global,2024-01-07,"Global National: Jan. 6, 2024",https://globalnews.ca/video/10208834/global-national-jan-6-2024/,neutral,0.0573375,0.011943962,0.9307186,0.0031449278108419687
Global,2024-01-07,Tensions flare at Pointe-Claire city council as councilor asks for mayor’s resignation,https://globalnews.ca/video/10208711/tensions-flare-at-pointe-claire-city-council-as-councilor-asks-for-mayors-resignation/,negative,0.012929248,0.39411378,0.59295696,-0.15515850506821138
Global,2024-01-07,Search underway for possible missing helicopter in Revelstoke,https://globalnews.ca/video/10209075/search-underway-for-possible-missing-helicopter-in-revelstoke/,neutral,0.040250644,0.08749443,0.8722549,-0.00603516214757871
Global,2024-01-07,Fishway completed through BCIT campus,https://globalnews.ca/video/10208814/fishway-completed-through-bcit-campus/,positive,0.3151209,0.014811147,0.670068,0.0990817879135264
Global,2024-01-07,Trudeau’s latest family vacation sparks questions – again,https://globalnews.ca/news/10206214/trudeau-vacation-raises-questions/,negative,0.016237097,0.22642498,0.757338,-0.051004614510317126
Global,2024-01-07,"“Our lawn was on fire”: homes, vehicles and property damaged in Sage Hill fire",https://globalnews.ca/news/10208359/calgary-homes-construction-sage-hill-fire/,negative,0.008954252,0.7465751,0.24447061,-0.5572942602831921
Global,2024-01-07,Canadian airlines say they don’t operate aircraft model involved in Alaska Airlines incident,https://globalnews.ca/news/10208498/canada-operators-alaska-airlines-window-incident/,negative,0.011094571,0.4227151,0.5661903,-0.17856497657481007
Global,2024-01-07,Abbotsford police traffic enforcement,https://globalnews.ca/video/10208810/abbotsford-police-traffic-enforcement/,neutral,0.032535113,0.10038688,0.86707807,-0.009018988096176628
CTV,2024-01-07,One day at a time: Tips for keeping your 2024 New Year's resolutions,https://ottawa.ctvnews.ca/one-day-at-a-time-tips-for-keeping-your-2024-new-year-s-resolutions-1.6714670,positive,0.4646258,0.014392352,0.5209819,0.21566997278114286
CTV,2024-01-07,"North Korea again fires near the sea border with the South, as its leader's sister mocks Seoul",https://www.ctvnews.ca/world/north-korea-again-fires-near-the-sea-border-with-the-south-as-its-leader-s-sister-mocks-seoul-1.6714910,negative,0.008901175,0.5545661,0.43653268,-0.3074643445472489
CTV,2024-01-07,Woman dies after Reenders collision: Police,https://winnipeg.ctvnews.ca/woman-dies-after-reenders-collision-police-1.6714698,negative,0.012561855,0.68621886,0.30121925,-0.470738540560232
CTV,2024-01-07,Looking for a job or career change? These skills will be in high demand in Canada in 2024,https://www.ctvnews.ca/business/looking-for-a-job-or-career-change-these-skills-will-be-in-high-demand-in-canada-in-2024-1.6691272,positive,0.5672283,0.0059912116,0.4267805,0.3217120524535133
CTV,2024-01-07,Group of sea lions set up extended residency in Vancouver's Coal Harbour,https://bc.ctvnews.ca/group-of-sea-lions-set-up-extended-residency-in-vancouver-s-coal-harbour-1.6708612,neutral,0.06112673,0.016247429,0.922626,0.003472490311189347
CTV,2024-01-07,Travel advisory issued after snowfall blankets Montreal roads,https://montreal.ctvnews.ca/travel-advisory-issued-after-snowfall-blankets-montreal-roads-1.6714923,neutral,0.0437666,0.14262731,0.813606,-0.018427040988164833
CTV,2024-01-07,U.S. officials order grounding of some Boeing 737 Max 9 jetliners after plane suffers a blowout,https://www.ctvnews.ca/world/u-s-officials-order-grounding-of-some-boeing-737-max-9-jetliners-after-plane-suffers-a-blowout-1.6714283,negative,0.011753805,0.59098196,0.3972642,-0.34912154290199027
CTV,2024-01-07,London Lightning return home as members of new Basketball Super League,https://london.ctvnews.ca/london-lightning-return-home-as-members-of-new-basketball-super-league-1.6714439,positive,0.25229752,0.0035637296,0.74413884,0.06364131649618443
CTV,2024-01-07,'A bit of a mess': Fraser on Israel's post-war plan,/video/c2841400--a-bit-of-a-mess---fraser-on--day-after--plan?playlistId=1.6604661,negative,0.005779354,0.74343234,0.25078812,-0.5526584019054255
CTV,2024-01-07,The most iconic 1999 style moments turning 25 this year,https://www.ctvnews.ca/entertainment/the-most-iconic-1999-style-moments-turning-25-this-year-1.6713178,positive,0.7512599,0.00976178,0.23897827,0.5642962242978555
CTV,2024-01-07,Fatal New York bus crash: officials say most people on board were Canadian,https://montreal.ctvnews.ca/fatal-new-york-bus-crash-officials-say-most-people-on-board-were-canadian-1.6714428,negative,0.013829852,0.65070325,0.33546692,-0.4232234572094917
CTV,2024-01-07,Search for suspect in Cambridge shooting continues,https://kitchener.ctvnews.ca/search-for-suspect-in-cambridge-shooting-continues-1.6714337,negative,0.02713878,0.26307893,0.70978236,-0.0684739911497978
CTV,2024-01-07,Six civilians dead after minibus explosion in Afghanistan,/video/c2841655-six-dead-in-afghanistan-minibus-explosion,negative,0.008303821,0.8071548,0.1845414,-0.6514298768212079
CTV,2024-01-07,"Blackhawks' Bedard breaks his jaw, pausing the No. 1 pick's stellar start to career",https://regina.ctvnews.ca/blackhawks-bedard-breaks-his-jaw-pausing-the-no-1-pick-s-stellar-start-to-career-1.6714401,neutral,0.053803336,0.18424864,0.7619479,-0.031052781845161803
CTV,2024-01-07,"One dead, 11 injured after tour bus from Montreal crashes in New York state",https://montreal.ctvnews.ca/one-dead-11-injured-after-tour-bus-from-montreal-crashes-in-new-york-state-1.6713540,negative,0.01108917,0.6157629,0.37314796,-0.37904096678198584
CTV,2024-01-07,Prime Minister Justin Trudeau's plane breaks down during his family vacation in Jamaica,https://www.ctvnews.ca/politics/prime-minister-justin-trudeau-s-plane-breaks-down-during-his-family-vacation-in-jamaica-1.6714040,negative,0.02067211,0.47718158,0.5021463,-0.22727492752438394
CTV,2024-01-07,Two residents pronounced dead after house fire in Ontario,/video/c2841624-two-people-dead-after-house-fire-in-ontario,negative,0.010022336,0.67580074,0.31417692,-0.45660619381285983
CTV,2024-01-07,Travis Konecny scores short-handed goal as Philadelphia Flyers top the Calgary Flames 3-2,https://calgary.ctvnews.ca/travis-konecny-scores-short-handed-goal-as-philadelphia-flyers-top-the-calgary-flames-3-2-1.6714528,neutral,0.15887962,0.0042768754,0.8368435,0.025224445218867686
CTV,2024-01-07,"Environment Canada issues icy, slippery roads advisory in Ottawa",https://ottawa.ctvnews.ca/environment-canada-issues-icy-slippery-roads-advisory-in-ottawa-1.6714427,negative,0.02236183,0.50208867,0.4755495,-0.2515929920156861
CTV,2024-01-07,TTC is making changes to several bus routes. Here's what you need to know,https://toronto.ctvnews.ca/ttc-is-making-changes-to-several-bus-routes-here-s-what-you-need-to-know-1.6713524,neutral,0.08193997,0.005520134,0.91254,0.006683677593375403
CTV,2024-01-07,Italy divided over new pineapple pizza,https://www.ctvnews.ca/lifestyle/italy-divided-over-new-pineapple-pizza-1.6711463,negative,0.055876702,0.26827282,0.67585045,-0.06884810490912407
CTV,2024-01-07,Man suffers life-threatening injuries in 3rd shooting in 3 days in Coquitlam,https://bc.ctvnews.ca/man-suffers-life-threatening-injuries-in-3rd-shooting-in-3-days-in-coquitlam-1.6714482,negative,0.011582427,0.7420292,0.24638835,-0.550473187893795
CTV,2024-01-07,32 Sask. students outed as transgender due to Edsby glitch: privacy commissioner,https://saskatoon.ctvnews.ca/32-sask-students-outed-as-transgender-due-to-edsby-glitch-privacy-commissioner-1.6709402,negative,0.012980922,0.25923678,0.7277823,-0.0670352015180109
CTV,2024-01-07,Two people dead following house fire in Thornhill,https://toronto.ctvnews.ca/two-people-dead-following-house-fire-in-thornhill-1.6714793,negative,0.009702463,0.7123452,0.27795228,-0.5073415849947498
CTV,2024-01-07,Move to allow Canadian drugs to be imported by U.S. creates shortage fears,https://www.ctvnews.ca/canada/move-to-allow-canadian-drugs-to-be-imported-by-u-s-creates-shortage-fears-1.6713476,negative,0.014299743,0.43673557,0.54896456,-0.19053352597830653
CTV,2024-01-07,"More start-ups, applications in health-care, questions around flaws and CO2 emissions: AI predictions for 2024",https://www.ctvnews.ca/sci-tech/more-start-ups-applications-in-health-care-questions-around-flaws-and-co2-emissions-ai-predictions-for-2024-1.6698041,neutral,0.13489534,0.021033708,0.8440709,0.017754341022246933
CTV,2024-01-07,"Teen charged after vehicle crashes into Toronto house, injuring 6 people",https://toronto.ctvnews.ca/teen-charged-after-vehicle-crashes-into-toronto-house-injuring-6-people-1.6714256,negative,0.00800183,0.77778596,0.21421225,-0.6048869543444235
CTV,2024-01-07,Quebec man sought by U.S. after pregnant Mexican migrant dies crossing border,https://montreal.ctvnews.ca/quebec-man-sought-by-u-s-after-pregnant-mexican-migrant-dies-crossing-border-1.6713345,negative,0.013160054,0.37478495,0.612055,-0.1402905691654972
CTV,2024-01-07,"Man charged with murder, Fentanyl sniffing dogs at border, have patience when flying from Detroit, and record-low ice coverage reported on the Great Lakes: Top Windsor stories this week",https://windsor.ctvnews.ca/man-charged-with-murder-fentanyl-sniffing-dogs-at-border-have-patience-when-flying-from-detroit-and-record-low-ice-coverage-reported-on-the-great-lakes-top-windsor-stories-this-week-1.6714450,negative,0.020914977,0.66987514,0.30920988,-0.44829527378658085
CTV,2024-01-07,"'We'll never know': N.S. wildfire victim grateful for new home, says unanswered questions remain",https://atlantic.ctvnews.ca/we-ll-never-know-n-s-wildfire-victim-grateful-for-new-home-says-unanswered-questions-remain-1.6708153,neutral,0.052947085,0.18437155,0.7626815,-0.031189457032908763
CTV,2024-01-07,How a Winnipeg goalie coach became an emergency backup goaltender for the Winnipeg Jets,https://winnipeg.ctvnews.ca/how-a-winnipeg-goalie-coach-became-an-emergency-backup-goaltender-for-the-winnipeg-jets-1.6704662,neutral,0.03506215,0.08896715,0.8759706,-0.006685805041184878
CTV,2024-01-07,'We're very optimistic moving forward': North Shore mountains get fresh dump of snow,https://bc.ctvnews.ca/we-re-very-optimistic-moving-forward-north-shore-mountains-get-fresh-dump-of-snow-1.6714795,positive,0.89322025,0.0028164305,0.10396344,0.7978343624699522
CTV,2024-01-07,"'It's bad news': Warm December and low snowpack could mean trouble for B.C. salmon, wildfires",https://vancouverisland.ctvnews.ca/it-s-bad-news-warm-december-and-low-snowpack-could-mean-trouble-for-b-c-salmon-wildfires-1.6712874,negative,0.0056107487,0.8748997,0.11948962,-0.7654179205196705
CTV,2024-01-07,Pressure mounts on Canada to support South Africa's legal battle for ceasefire in Gaza,https://www.ctvnews.ca/canada/pressure-mounts-on-canada-to-support-south-africa-s-legal-battle-for-ceasefire-in-gaza-1.6714744,neutral,0.04717554,0.17013091,0.7826935,-0.026718999802186616
CTV,2024-01-07,'The future of heating globally': Do heat pumps work in Saskatchewan?,https://saskatoon.ctvnews.ca/the-future-of-heating-globally-do-heat-pumps-work-in-saskatchewan-1.6714503,neutral,0.06650212,0.0096733,0.9238245,0.004328964052845885
CTV,2024-01-07,Analyst on why Blinken needs to keep a 'lid on hostilities',/video/c2841630-blinken-needs-to--keep-the-lid-on-hostilities-?playlistId=1.6594997,neutral,0.043532882,0.047866743,0.9086004,-0.00039611322111765546
CTV,2024-01-07,"'History is hers': Ella Shelton of Ingersoll, Ont. scores first ever PWHL goal",https://london.ctvnews.ca/history-is-hers-ella-shelton-of-ingersoll-ont-scores-first-ever-pwhl-goal-1.6706876,positive,0.7477336,0.003477478,0.24878916,0.5590932781297973
CTV,2024-01-07,Sweet revenge: U.S. beats hosts Sweden for world junior gold,https://www.ctvnews.ca/sports/sweet-revenge-u-s-beats-hosts-sweden-for-world-junior-gold-1.6713568,positive,0.75365186,0.0052653644,0.24108267,0.5679634873766304
CTV,2024-01-07,Dakota Dunes Powwow welcomes First Nations communities for New Year celebrations,https://saskatoon.ctvnews.ca/dakota-dunes-powwow-welcomes-first-nations-communities-for-new-year-celebrations-1.6714724,positive,0.7840348,0.002478381,0.21348676,0.6147044773511556
CTV,2024-01-07,What we expect to learn about UFOs in 2024,https://www.ctvnews.ca/sci-tech/what-we-expect-to-learn-about-ufos-in-2024-1.6693082,neutral,0.05016581,0.08552509,0.8643091,-0.0047979332713374845
CTV,2024-01-07,Weather stalls search for missing helicopter in B.C.,/video/c2841552-search-for-missing-helicopter-near-revelstoke,negative,0.010126361,0.4707432,0.5191304,-0.22149663965233835
CTV,2024-01-07,"Celine Song, Ryan Gosling and Martin Short among Canadians up for Golden Globe Awards",https://www.ctvnews.ca/entertainment/celine-song-ryan-gosling-and-martin-short-among-canadians-up-for-golden-globe-awards-1.6714938,neutral,0.19283663,0.0044940514,0.80266935,0.03716576269985694
CTV,2024-01-07,Vigil held for Corunna woman found dead on New Year's Eve 2020,https://london.ctvnews.ca/vigil-held-for-corunna-woman-found-dead-on-new-year-s-eve-2020-1.6714552,negative,0.017731298,0.39762408,0.58464456,-0.15779052867459598
CTV,2024-01-07,"Supports for passengers, farmers, artists: 7 bills from MPs and Senators to watch in 2024",https://www.ctvnews.ca/politics/supports-for-passengers-farmers-artists-7-bills-from-mps-and-senators-to-watch-in-2024-1.6712843,neutral,0.13706753,0.01094761,0.8519849,0.018667649052947155
CTV,2024-01-07,Montreal tour bus crash: Canadian confirmed dead in rollover,/video/c2841572-canadian-confirmed-dead-in-n-y--tour-bus-crash?playlistId=1.6713681,negative,0.013084418,0.48051903,0.5063965,-0.23072737481012062
CTV,2024-01-07,Revamped Forest City Velodrome reopens,https://london.ctvnews.ca/revamped-forest-city-velodrome-reopens-1.6714529,neutral,0.1993109,0.0050042286,0.79568475,0.039699815246496684
CTV,2024-01-07,Another member of Lennon and Ono's Montreal Bed-in For Peace has died: Tommy Smothers,https://montreal.ctvnews.ca/another-member-of-lennon-and-ono-s-montreal-bed-in-for-peace-has-died-tommy-smothers-1.6702276,negative,0.031203767,0.3574642,0.6113321,-0.12680694536103765
CTV,2024-01-07,"Community leaders, RCMP host forum on extortion plots targeting South Asian businesses",https://bc.ctvnews.ca/community-leaders-rcmp-host-forum-on-extortion-plots-targeting-south-asian-businesses-1.6714829,negative,0.02056788,0.3171175,0.6623146,-0.10014047829762163
CTV,2024-01-07,"Calls for power in Dartmouth, N.S., homeless encampment ignite debate",https://atlantic.ctvnews.ca/calls-for-power-in-dartmouth-n-s-homeless-encampment-ignite-debate-1.6714375,neutral,0.032412764,0.06265995,0.9049274,-0.002875679375406559
CTV,2024-01-07,"'Intense storms' headed for Canada, bringing 35 cm of snow in some spots",https://www.ctvnews.ca/climate-and-environment/intense-storms-headed-for-canada-bringing-35-cm-of-snow-in-some-spots-1.6712765,negative,0.03604121,0.2566486,0.70731014,-0.06456954461280784
CTV,2024-01-07,Canadians 'deeply alarmed' by speeding in residential neighbourhoods: CAA,https://www.ctvnews.ca/autos/canadians-deeply-alarmed-by-speeding-in-residential-neighbourhoods-caa-1.6710613,negative,0.012056908,0.53570414,0.45223898,-0.2868335526870247
CTV,2024-01-07,2 dead in Kherson while soldiers celebrate Orthodox Christmas on the front line,https://www.ctvnews.ca/world/2-dead-in-kherson-while-soldiers-celebrate-orthodox-christmas-on-the-front-line-1.6714912,negative,0.018813726,0.6076433,0.3735431,-0.368876343484823
CTV,2024-01-07,PepsiCo products are being pulled from some grocery stores in Europe over price hikes,https://www.ctvnews.ca/business/pepsico-products-are-being-pulled-from-some-grocery-stores-in-europe-over-price-hikes-1.6712533,negative,0.012799564,0.73974735,0.24745303,-0.5470623496637472
CTV,2024-01-07,1 person dead after stabbing downtown Toronto,https://toronto.ctvnews.ca/1-person-dead-after-stabbing-downtown-toronto-1.6714929,negative,0.0088084,0.78603226,0.20515934,-0.6177691486219157
CTV,2024-01-07,A portion of Highway 101 was shut down following a motor vehicle accident Saturday afternoon,https://atlantic.ctvnews.ca/a-portion-of-highway-101-was-shut-down-following-a-motor-vehicle-accident-saturday-afternoon-1.6714496,negative,0.009673208,0.6416696,0.34865716,-0.4116463249887303
CTV,2024-01-07,"Ford is recalling 20,000 F-150 pickup trucks in Canada. Here's what you need to know",https://www.ctvnews.ca/autos/ford-is-recalling-20-000-f-150-pickup-trucks-in-canada-here-s-what-you-need-to-know-1.6711770,neutral,0.043138016,0.15742533,0.7994365,-0.022921863164636846
CTV,2024-01-07,"Living near nature can improve mental and physical health in older adults, study finds",https://www.ctvnews.ca/health/living-near-nature-can-improve-mental-and-physical-health-in-older-adults-study-finds-1.6713449,positive,0.78856987,0.0046086055,0.20682144,0.6218212433507233
CTV,2024-01-07,Downtown Windsor BIA supports street cleanup program with further funding,https://windsor.ctvnews.ca/downtown-windsor-bia-supports-street-cleanup-program-with-further-funding-1.6714763,positive,0.29156885,0.0055362526,0.7028949,0.08498173299279443
CTV,2024-01-07,Artist shares skills with others in unique workshop,https://regina.ctvnews.ca/artist-shares-skills-with-others-in-unique-workshop-1.6714640,positive,0.51777875,0.008565089,0.47365615,0.26802149311814816
CTV,2024-01-07,"Mary Dawson, Canada's first conflict of interest and ethics commissioner dies at 81",https://www.ctvnews.ca/politics/mary-dawson-canada-s-first-conflict-of-interest-and-ethics-commissioner-dies-at-81-1.6713242,negative,0.014894869,0.53220016,0.45290485,-0.28301522852803807
CTV,2024-01-07,Quebec teachers hopeful but weary as students return to school after strikes,https://montreal.ctvnews.ca/quebec-teachers-hopeful-but-weary-as-students-return-to-school-after-strikes-1.6714915,negative,0.04771652,0.25236645,0.69991696,-0.061411971943130084
CTV,2024-01-07,Arson unit investigating as 2-alarm fire burns multi-family units in Sage Hill,https://calgary.ctvnews.ca/arson-unit-investigating-as-2-alarm-fire-burns-multi-family-units-in-sage-hill-1.6714293,negative,0.015771529,0.35469624,0.62953216,-0.12556070429868882
CTV,2024-01-07,'The community is very shaken': South Asian businesses targeted for extortion in 3 provinces,https://bc.ctvnews.ca/the-community-is-very-shaken-south-asian-businesses-targeted-for-extortion-in-3-provinces-1.6713430,negative,0.005811177,0.82523924,0.16894962,-0.6809860233585621
CTV,2024-01-07,Personal injury lawyer advocates for safer roads following multiple pedestrian collisions,https://kitchener.ctvnews.ca/personal-injury-lawyer-advocates-for-safer-roads-following-multiple-pedestrian-collisions-1.6714571,positive,0.23486257,0.057672523,0.707465,0.051834288299184905
CTV,2024-01-07,The Ring’s Wedding Expo stops in Kitchener for the weekend,https://kitchener.ctvnews.ca/the-ring-s-wedding-expo-stops-in-kitchener-for-the-weekend-1.6714532,neutral,0.07743007,0.004026711,0.9185431,0.005979210003488333
CTV,2024-01-07,Local business commissions artwork celebrating Albertan's 'journey of struggle',https://edmonton.ctvnews.ca/local-business-commissions-artwork-celebrating-albertan-s-journey-of-struggle-1.6714841,neutral,0.1615959,0.018534482,0.81986976,0.02576968737588814
