source,date,headline,url,chosen_label,positive,negative,neutral,compound
CTV,2024-06-28,Northwestern Ont. police investigate fatal Hwy. 17 crash,https://northernontario.ctvnews.ca/northwestern-ont-police-investigate-fatal-hwy-17-crash-1.6944249,negative,0.01783985,0.24948648,0.7326736,-0.06192526229683004
CTV,2024-06-28,Stadium agreement with FIFA reveals obligations for hosting World Cup at BC Place,https://bc.ctvnews.ca/stadium-agreement-with-fifa-reveals-obligations-for-hosting-world-cup-at-bc-place-1.6944454,neutral,0.07173924,0.011112063,0.9171487,0.005023039895752035
CTV,2024-06-28,'Really disappointed': Painting at Winnipeg Art Gallery found to be a forgery,https://winnipeg.ctvnews.ca/really-disappointed-painting-at-winnipeg-art-gallery-found-to-be-a-forgery-1.6943383,negative,0.004988871,0.9074574,0.08755372,-0.8234540848594962
CTV,2024-06-28,"'The line has already been crossed': Day 4 of Dumba trial sees vastly different accounts from accused, victim",https://regina.ctvnews.ca/the-line-has-already-been-crossed-day-4-of-dumba-trial-sees-vastly-different-accounts-from-accused-victim-1.6944351,negative,0.013426212,0.5002146,0.4863592,-0.2500343595297272
CTV,2024-06-28,"July is the worst month for impaired driving deaths in Saskatchewan, SGI says",https://saskatoon.ctvnews.ca/july-is-the-worst-month-for-impaired-driving-deaths-in-saskatchewan-sgi-says-1.6944464,negative,0.0075560873,0.8784567,0.11398722,-0.7716290871174252
CTV,2024-06-28,German court convicts a 15-year-old of planning an extremist attack on a Christmas market,https://www.ctvnews.ca/world/german-court-convicts-a-15-year-old-of-planning-an-extremist-attack-on-a-christmas-market-1.6944613,negative,0.00839673,0.69459486,0.2970085,-0.48239143252203576
CTV,2024-06-28,"Genes known to increase the risk of Alzheimer's may actually be an inherited form of the disorder, researchers say",https://www.ctvnews.ca/health/genes-known-to-increase-the-risk-of-alzheimer-s-may-actually-be-an-inherited-form-of-the-disorder-researchers-say-1.6943195,negative,0.012803435,0.473937,0.5132596,-0.22445234282417736
CTV,2024-06-28,'I am very proud': Manitoba grandfather and grandson graduate high school in same class,https://winnipeg.ctvnews.ca/i-am-very-proud-manitoba-grandfather-and-grandson-graduate-high-school-in-same-class-1.6944596,positive,0.95382726,0.0022612342,0.043911476,0.9097813714620508
CTV,2024-06-28,No WestJet strike: O'Regan imposes binding arbitration,/video/c2948600-power-play--westjet-strike-averted?playlistId=1.6932705,neutral,0.03363493,0.15834768,0.80801743,-0.02394267398193417
CTV,2024-06-28,Guilty plea to second-degree murder of Kitchener man,https://kitchener.ctvnews.ca/guilty-plea-to-second-degree-murder-of-kitchener-man-1.6944107,negative,0.026864141,0.5556519,0.41748402,-0.30802730651462085
CTV,2024-06-28,Liberal caucus staying quiet after major byelection defeat that rattled party,https://www.ctvnews.ca/politics/liberal-caucus-staying-quiet-after-major-byelection-defeat-that-rattled-party-1.6944546,negative,0.01481911,0.5890299,0.39615098,-0.34673664454567366
CTV,2024-06-28,'Get back on the horse': Liberal ministers stand by their man after byelection loss,https://www.ctvnews.ca/politics/get-back-on-the-horse-liberal-ministers-stand-by-their-man-after-byelection-loss-1.6941914,neutral,0.14227019,0.077858396,0.7798714,0.014178878346859936
CTV,2024-06-28,Here is the schedule for the International fireworks competition in Montreal,https://montreal.ctvnews.ca/here-is-the-schedule-for-the-international-fireworks-competition-in-montreal-1.6944453,neutral,0.06851094,0.0062508075,0.92523825,0.004654676618239151
CTV,2024-06-28,Ever feel exhausted by swiping through dating apps? You might be experiencing burnout,https://www.ctvnews.ca/lifestyle/ever-feel-exhausted-by-swiping-through-dating-apps-you-might-be-experiencing-burnout-1.6944561,negative,0.045298196,0.4674024,0.48729932,-0.2164131140233927
CTV,2024-06-28,What's happening in Ottawa this weekend: June 28-July 1,https://ottawa.ctvnews.ca/what-s-happening-in-ottawa-this-weekend-june-28-july-1-1.6943108,neutral,0.036900435,0.006543747,0.9565558,0.001318822455687707
CTV,2024-06-28,Police still investigating cause after woman found dead in Kelowna park,https://bc.ctvnews.ca/police-still-investigating-cause-after-woman-found-dead-in-kelowna-park-1.6937902,negative,0.011651847,0.44828284,0.54006535,-0.20082172425051503
CTV,2024-06-28,Russia to prepare a 'response' to U.S. drones over Black Sea,https://www.ctvnews.ca/world/russia-to-prepare-a-response-to-u-s-drones-over-black-sea-1.6944603,neutral,0.018126544,0.1723764,0.80949694,-0.029385067971833934
CTV,2024-06-28,'A lot of work': Raymond Stampede ready to kick off in new location,https://calgary.ctvnews.ca/a-lot-of-work-raymond-stampede-ready-to-kick-off-in-new-location-1.6944008,neutral,0.07039962,0.08231457,0.8472858,-0.0018195825204623262
CTV,2024-06-28,'No additional flights will be cancelled': WestJet avoids strike as feds order binding arbitration,https://calgary.ctvnews.ca/no-additional-flights-will-be-cancelled-westjet-avoids-strike-as-feds-order-binding-arbitration-1.6943509,neutral,0.07112776,0.06594662,0.8629257,0.0007102002386183415
CTV,2024-06-28,Ontario MPP removed from PC caucus over 'serious lapses in judgement',https://toronto.ctvnews.ca/ontario-mpp-removed-from-pc-caucus-over-serious-lapses-in-judgement-1.6944653,negative,0.008633439,0.6964939,0.29487258,-0.48502929050471266
CTV,2024-06-28,B.C. coffee chain fined nearly $31K for lack of recycling plan,https://bc.ctvnews.ca/b-c-coffee-chain-fined-nearly-31k-for-lack-of-recycling-plan-1.6943947,negative,0.0070747617,0.8022037,0.19072136,-0.6434808661812674
CTV,2024-06-28,Ont. tenants left living in disrepair for months after flood,/video/c2947858-tenants-frustrated-with-flood-response,negative,0.005975377,0.85791034,0.13611433,-0.7359744126253549
CTV,2024-06-28,"Threat from Churchill Falls wildfire eases, officials say 'promising' forecast ahead",https://www.ctvnews.ca/climate-and-environment/threat-from-churchill-falls-wildfire-eases-officials-say-promising-forecast-ahead-1.6943333,neutral,0.15135211,0.015442985,0.8332051,0.022668948421758373
CTV,2024-06-28,Southern Alberta farmers feeling optimistic about crop conditions,https://calgary.ctvnews.ca/southern-alberta-farmers-feeling-optimistic-about-crop-conditions-1.6942488,positive,0.47937572,0.010544387,0.51007986,0.22968991077125622
CTV,2024-06-28,Calgary's 16 Avenue reopens as water main prepares for flushing,https://calgary.ctvnews.ca/calgary-s-16-avenue-reopens-as-water-main-prepares-for-flushing-1.6944588,neutral,0.103653304,0.0053574042,0.8909892,0.010715315930863056
CTV,2024-06-28,'Our last stand': Murder-conspiracy trial sees phone texts from Coutts blockade,https://calgary.ctvnews.ca/our-last-stand-murder-conspiracy-trial-sees-phone-texts-from-coutts-blockade-1.6943139,negative,0.020819133,0.29517123,0.68400973,-0.08669259502726767
CTV,2024-06-28,Deadly bat illness found in Alberta,https://calgary.ctvnews.ca/deadly-bat-illness-found-in-alberta-1.6943540,negative,0.0098855365,0.79734236,0.19277208,-0.6356571267259676
CTV,2024-06-28,'Godfather' of modern AI wants Ont. Science Centre saved,/video/c2948611-power-play--one-on-one-with-geoffrey-hinton,neutral,0.09505367,0.14180472,0.76314145,-0.011073386268440899
CTV,2024-06-28,"Slovak train and bus collision that killed 7 was likely caused by human error, minister says",https://www.ctvnews.ca/world/slovak-train-and-bus-collision-that-killed-7-was-likely-caused-by-human-error-minister-says-1.6944654,negative,0.00899616,0.6041916,0.38681224,-0.3649665419046748
CTV,2024-06-28,'Houses don't just explode': Winnipeg police give update on Transcona blast,https://winnipeg.ctvnews.ca/houses-don-t-just-explode-winnipeg-police-give-update-on-transcona-blast-1.6943454,negative,0.013438529,0.44389775,0.54266363,-0.1968646605559332
CTV,2024-06-28,Halifax icon who wore high heels with pride dies at 86,https://atlantic.ctvnews.ca/more/halifax-icon-who-wore-high-heels-with-pride-dies-at-86-1.6941646,positive,0.33018884,0.049581937,0.62022924,0.10656629284802932
CTV,2024-06-28,Rental scam warning: More victims come forward in Ottawa,/video/c2949008-more-rental-scam-victims-in-ottawa?playlistId=1.6942507,negative,0.017286345,0.69571537,0.28699833,-0.48372101429610126
CTV,2024-06-28,U.S. shifts assault ship to the Mediterranean to deter risk of Israel-Lebanon conflict escalating,https://www.ctvnews.ca/world/u-s-shifts-assault-ship-to-the-mediterranean-to-deter-risk-of-israel-lebanon-conflict-escalating-1.6944643,neutral,0.024989165,0.18798506,0.78702575,-0.03471393060476835
CTV,2024-06-28,Princess Anne leaves hospital after treatment for concussion,https://www.ctvnews.ca/world/princess-anne-leaves-hospital-after-treatment-for-concussion-1.6944579,negative,0.042858027,0.32758716,0.62955487,-0.10547651766954402
CTV,2024-06-28,"2024 NBA Draft: Lakers select Bronny James, son of LeBron James, in second round",https://www.ctvnews.ca/sports/2024-nba-draft-lakers-select-bronny-james-son-of-lebron-james-in-second-round-1.6943451,neutral,0.09810474,0.0067020715,0.8951933,0.009579613605557036
CTV,2024-06-28,Holland leaves Oilers; CEO searching for new GM before starting negotiations with Draisaitl,https://edmonton.ctvnews.ca/holland-leaves-oilers-ceo-searching-for-new-gm-before-starting-negotiations-with-draisaitl-1.6943374,neutral,0.02287735,0.054423682,0.9226988,-0.002438569447359651
CTV,2024-06-28,Jagmeet Singh makes his case to Alberta's new NDP leader amid party separation talks,https://edmonton.ctvnews.ca/jagmeet-singh-makes-his-case-to-alberta-s-new-ndp-leader-amid-party-separation-talks-1.6944617,neutral,0.054236013,0.023993094,0.92177093,0.002365875490795588
CTV,2024-06-28,Rainfall expected as Montrealers get ready for moving day,https://montreal.ctvnews.ca/rainfall-expected-as-montrealers-get-ready-for-moving-day-1.6944646,neutral,0.0544566,0.2276384,0.71790516,-0.0488536920837781
CTV,2024-06-28,Nova Scotia in talks for agency to investigate wrongful conviction of Glen Assoun,https://atlantic.ctvnews.ca/nova-scotia-in-talks-for-agency-to-investigate-wrongful-conviction-of-glen-assoun-1.6943713,neutral,0.016960308,0.20654541,0.77649426,-0.04237335822058341
CTV,2024-06-28,Buying a car? Why you may have to pay more at some dealers if you use cash,https://toronto.ctvnews.ca/buying-a-car-why-you-may-have-to-pay-more-at-some-dealers-if-you-use-cash-1.6944225,negative,0.026680103,0.32203546,0.65128446,-0.10299500139679907
CBC,2024-06-28,Princess Anne released from hospital,https://www.cbc.ca/news/world/princess-anne-returns-1.7249514,positive,0.47703686,0.009993545,0.5129695,0.2274643398524887
CBC,2024-06-28,Analyzing the 1st Biden-Trump presidential debate,https://www.cbc.ca/player/play/video/9.6435336,neutral,0.059958126,0.01713829,0.9229036,0.0033012552592928124
CBC,2024-06-28,WATCH | #TheMoment a rare white loon was caught on camera,https://www.cbc.cahttps://www.cbc.ca/player/play/video/9.6435322,neutral,0.10650667,0.0065494687,0.8869439,0.011300773286693655
CBC,2024-06-28,"Canada's GDP grew 0.3% in April, with rebound in some sectors",https://www.cbc.ca/news/business/canada-gdp-april-1.7249542,positive,0.3770939,0.013243476,0.60966265,0.14202441759062268
CBC,2024-06-28,Ontario trucker found at border with as much as $29M worth of meth sentenced to 12 years,https://www.cbc.ca/news/canada/windsor/windsor-ontario-truck-methamphetamine-1.7248801,negative,0.01611724,0.62296164,0.36092094,-0.38782156733070394
CBC,2024-06-28,Mother of 2 teens says she spends 100% of her income on rent,https://www.cbc.ca/news/canada/canadian-rent-expensive-1.7240858,negative,0.04134692,0.43219757,0.52645546,-0.1850851967332332
CBC,2024-06-28,The 1st Indigenous pro baseball player took the field 50 years before Jackie Robinson,https://www.cbc.ca/player/play/video/9.6434788,neutral,0.09364655,0.010701447,0.8956519,0.00865516560364954
CBC,2024-06-28,"The National breaks down Biden's struggles, Trump's attacks",https://www.cbc.ca/player/play/video/9.6435336,negative,0.028568503,0.2791414,0.69229007,-0.07710376703825972
CBC,2024-06-28,CBC Sports host Scott Russell to retire after Paris Olympics and Paralympics,https://www.cbc.ca/player/play/video/9.6434421,neutral,0.028738026,0.09475175,0.87651026,-0.008152017400927747
CBC,2024-06-28,Biden's debate disaster: U.S. President freezes up against Trump,https://www.cbc.ca/news/world/2024-us-debate-analysis-1.7249398,negative,0.018272912,0.7223064,0.25942075,-0.5213925510383106
CBC,2024-06-28,$4M worth of prescription opioids disappeared from an Ontario pharmacy. No one can say where they went,https://www.cbc.ca/news/canada/unexplained-losses-prescription-drugs-1.7247602,negative,0.013749483,0.67406577,0.31218487,-0.45417553363544627
CBC,2024-06-28,Large asteroid to pass between Earth and the moon on Saturday,https://www.cbc.ca/news/science/asteroid-2024mk-1.7247336,neutral,0.105254404,0.010789185,0.88395643,0.010962080972472421
CBC,2024-06-28,"Murder trial for alleged poison seller Kenneth Law set for Sept. 2025, families told",https://www.cbc.ca/news/canada/kenneth-law-trial-sept-2025-1.7248844,negative,0.012556813,0.34374845,0.6436947,-0.11800533318332107
CBC,2024-06-28,How to throw a summer party without plastic waste,https://www.cbc.ca/news/science/what-on-earth-plastic-waste-parties-1.7248575,negative,0.09335485,0.29229593,0.61434925,-0.07672177817822146
CBC,2024-06-28,Former Trudeau minister Catherine McKenna says Liberals need a new leader,https://www.cbc.ca/news/politics/catherine-mckenna-trudeau-liberal-1.7249166,neutral,0.030745076,0.044015024,0.92523986,-0.0009920631450203166
CBC,2024-06-28,#TheMoment a rare white loon was caught on camera,https://www.cbc.ca/player/play/video/9.6435322,neutral,0.15275767,0.018036341,0.8292059,0.023009613759406022
CBC,2024-06-28,Why the Bolivia coup attempt may not be what it seems,https://www.cbc.ca/player/play/video/9.6435126,negative,0.021108884,0.41488498,0.5640061,-0.17168397662248225
CBC,2024-06-28,Biden stumbles on health-care answer as Trump pounces,https://www.cbc.ca/player/play/video/9.6435324,negative,0.02883604,0.49862683,0.47253707,-0.24779722449590214
CBC,2024-06-28,WATCH : CBC News Explore,https://www.cbc.cahttps://gem.cbc.ca/live,neutral,0.09840742,0.014817321,0.88677526,0.009464467482493077
CBC,2024-06-28,Over 600 B.C. residents have gone to U.S. for cancer care,https://www.cbc.ca/news/canada/british-columbia/bc-cancer-care-bellingham-1.7249258,neutral,0.070063494,0.089973815,0.83996266,-0.003186394728497355
CBC,2024-06-28,"Artist says he lost $2M in stolen paintings, forged mortgage to alleged fraudster killed last week",https://www.cbc.ca/news/canada/toronto/toronto-artist-lost-millions-to-killed-alleged-fraudster-1.7247419,negative,0.006770269,0.813046,0.18018357,-0.6609980830896927
CBC,2024-06-28,"Tear-gassed on CNN, Obama's sister says she stands in solidarity with Kenya's youth",https://www.cbc.ca/radio/asithappens/auma-obama-kenya-protests-1.7248854,neutral,0.21398544,0.058301922,0.7277125,0.0423906738885762
CBC,2024-06-28,Tearful goodbyes as sick children are evacuated from Gaza for medical care,https://www.cbc.ca/news/world/medical-evacuations-children-gaza-israel-hamas-war-1.7248959,negative,0.043152977,0.7333269,0.22352001,-0.535906241092059
CBC,2024-06-28,WATCH: CBC News Network,https://www.cbc.cahttps://gem.cbc.ca/live,neutral,0.10073908,0.018231502,0.88102955,0.00981596340483426
CBC,2024-06-28,Bell Media announces additional job cuts impacting 43 technicians,https://www.cbc.ca/news/business/bell-media-layoffs-june-1.7248798,negative,0.009621405,0.77793497,0.21244359,-0.6050902899788895
CBC,2024-06-28,Entrepreneur removed from Toronto police board after CBC investigation into seemingly fabricated employees,https://www.cbc.ca/news/canada/toronto/nadine-spencer-removed-from-toronto-police-service-board-1.7248855,negative,0.009130224,0.7273859,0.2634838,-0.5290069192767355
CBC,2024-06-28,Canada urges dual citizens to leave Lebanon. Lebanese Montrealers say it's not that easy,https://www.cbc.ca/news/canada/montreal/lebanon-montrealers-loved-ones-1.7247653,negative,0.012090178,0.610988,0.37692177,-0.3731601885948663
CBC,2024-06-28,CRA preparing to take legal action against people who received pandemic benefits while ineligible,https://www.cbc.ca/news/politics/cra-to-sending-1.7248374,negative,0.016356317,0.43706265,0.54658115,-0.19075618149879148
CBC,2024-06-28,"Sorry, but the Stanley Cup is having a better summer vacation than you are",https://www.cbc.ca/news/world/stanley-cup-florida-1.7248206,negative,0.17175144,0.46952635,0.35872224,-0.19095642794293255
CBC,2024-06-28,Head of National Microbiology Lab resigns in wake of scientist security scandal,https://www.cbc.ca/news/canada/manitoba/national-microbiology-lab-resigns-guillaume-poliquin-1.7248556,negative,0.01292913,0.5661209,0.42095006,-0.3203256703202868
CBC,2024-06-28,Hear the desperate letters written a century ago by Newfoundland families of WW I soldiers,https://www.cbc.ca/player/play/video/9.6433332,negative,0.027951423,0.539722,0.43232653,-0.2905185981039544
CBC,2024-06-28,"Biden repeatedly stumbles, Trump shares litany of falsehoods during U.S. presidential debate",https://www.cbc.ca/news/world/biden-trump-us-presidential-debate-1.7249028,negative,0.015567328,0.61138445,0.37304828,-0.37354858873040264
CBC,2024-06-28,"These P.E.I. kindergarteners are dreaming of the park, the beach and playing with 'fwiends'",https://www.cbc.ca/player/play/video/9.6433680,neutral,0.1589704,0.16055647,0.68047315,-0.0005067902581759043
CBC,2024-06-28,Going after the 'double haters' in the Trump-Biden debate,https://www.cbc.ca/player/play/video/9.6434191,neutral,0.05968481,0.18014461,0.76017064,-0.028889795713453736
CBC,2024-06-28,"With questions swirling about his future, Trudeau largely stays on message in speech to donors",https://www.cbc.ca/news/politics/trudeau-first-speech-to-donors-after-byelection-loss-1.7249195,neutral,0.03437096,0.15229921,0.8133298,-0.02201368844544227
CBC,2024-06-28,Edmonton Public Schools adding 25 seclusion rooms despite promise to phase them out,https://www.cbc.ca/news/canada/edmonton/edmonton-public-schools-adding-25-seclusion-rooms-despite-promise-to-phase-them-out-1.7246491,negative,0.025883699,0.22515501,0.7489612,-0.050024827589265186
CBC,2024-06-28,She's cycling all of Montreal's bike paths — on the city's dime — to make sure they're bikeworthy,https://www.cbc.ca/player/play/video/9.6434628,positive,0.254334,0.009931542,0.7357344,0.06458716413573384
CBC,2024-06-28,They didn't shake hands and it got worse from there. Key moments in Biden-Trump debate,https://www.cbc.ca/news/world/biden-trump-cnn-debate-key-moments-1.7248876,negative,0.013682986,0.7308708,0.2554461,-0.5339849853588508
CBC,2024-06-28,Trudeau government negotiating with provinces to keep migrants behind bars,https://www.cbc.ca/news/canada/ottawa/trudeau-government-negotiating-with-provinces-to-keep-migrants-behind-bars-1.7248768,negative,0.019568468,0.37090716,0.6095243,-0.13718921540499807
CBC,2024-06-28,Biden to Trump: ‘You have the morals of an alley cat’,https://www.cbc.ca/player/play/video/9.6435331,negative,0.042694014,0.33411077,0.62319523,-0.1098072265508776
CBC,2024-06-28,Los Angeles Lakers draft Bronny James — setting up potential father-son duo for next season,https://www.cbc.cahttps://www.cbc.ca/sports/basketball/nba/toronto-raptors-nba-draft-day-2-recap-june-27-1.7249101,neutral,0.15816605,0.0037875948,0.8380465,0.025002133103437352
CBC,2024-06-28,Crunching the numbers on Canada's rental crisis,https://www.cbc.ca/player/play/video/9.6434030,neutral,0.029501209,0.1825013,0.78799754,-0.03243639414474764
CBC,2024-06-28,WestJet strike averted after federal labour minister imposes binding arbitration,https://www.cbc.ca/news/canada/calgary/westjet-flight-cancellations-work-stoppage-1.7248086,neutral,0.04476533,0.14209078,0.8131439,-0.018185853456442747
CBC,2024-06-28,Key moments from the Biden-Trump debate,https://www.cbc.ca/player/play/video/9.6435350,positive,0.36481622,0.01123448,0.62394917,0.13296470170254082
