source,date,headline,url,chosen_label,positive,negative,neutral,compound
CTV,2024-06-23,"Woman found dead alongside three relatives remembered as selfless, caring mother",https://windsor.ctvnews.ca/woman-found-dead-alongside-three-relatives-remembered-as-selfless-caring-mother-1.6937367,negative,0.12672547,0.27618533,0.5970891,-0.06021900843514594
CTV,2024-06-23,"Likely tornado, golf ball-sized hail hits during storm in southern Manitoba",https://winnipeg.ctvnews.ca/likely-tornado-golf-ball-sized-hail-hits-during-storm-in-southern-manitoba-1.6937879,negative,0.027384585,0.4066529,0.56596255,-0.16461665264348113
CTV,2024-06-23,"OPP, Treaty Three police lay murder charge in northwestern Ont.",https://northernontario.ctvnews.ca/opp-treaty-three-police-lay-murder-charge-in-northwestern-ont-1.6937773,negative,0.008854635,0.74046075,0.25068477,-0.5482036139382949
CTV,2024-06-23,Vigil planned for family found dead in Harrow,https://windsor.ctvnews.ca/vigil-planned-for-family-found-dead-in-harrow-1.6937787,negative,0.016395861,0.49305445,0.49054968,-0.2428338657787492
CTV,2024-06-23,Mbappe getting used to new mask ahead of France's game against Poland,https://www.ctvnews.ca/sports/mbappe-getting-used-to-new-mask-ahead-of-france-s-game-against-poland-1.6937924,positive,0.31562948,0.011495087,0.6728754,0.0994898421951973
CTV,2024-06-23,'I feel like I have my life again': Canadian woman describes her freedom from a life controlled by OCD,https://www.ctvnews.ca/health/i-feel-like-i-have-my-life-again-canadian-woman-describes-her-freedom-from-a-life-controlled-by-ocd-1.6937739,positive,0.6102854,0.01243029,0.3772842,0.3722938119334884
CTV,2024-06-23,LIVE SOON: Calgary officials provide update on water repairs,/video/c68596-live--calgary-water-main-afternoon-update--june-23?playlistId=1.6915886,neutral,0.0399285,0.0118978685,0.94817364,0.0014527254713248006
CTV,2024-06-23,Tenants raise concerns about rental units in Montreal,/video/c2945475-fed-up-tenants-feel-they-re-being-overcharged,negative,0.014558275,0.3039691,0.6814726,-0.09218526971651819
CTV,2024-06-23,'Historic victory': Judge orders Quebec to pay taxi drivers $143 million for abolishing permits,https://montreal.ctvnews.ca/historic-victory-judge-orders-quebec-to-pay-taxi-drivers-143-million-for-abolishing-permits-1.6936639,positive,0.37287793,0.01611944,0.61100274,0.13877806821751193
CTV,2024-06-23,Homicide detectives investigating death of man found in Scarborough restaurant after fire,https://toronto.ctvnews.ca/homicide-detectives-investigating-death-of-man-found-in-scarborough-restaurant-after-fire-1.6937160,negative,0.019789314,0.28520223,0.69500846,-0.0809486981161811
CTV,2024-06-23,Doors closed for Catholic church one day before 'Doors Open' event in Halifax,https://atlantic.ctvnews.ca/doors-closed-for-catholic-church-one-day-before-doors-open-event-in-halifax-1.6937738,neutral,0.03423,0.044682287,0.9210877,-0.0008248140674362858
CTV,2024-06-23,'Happy Bday M8!': William meets Taylor Swift backstage at London show,https://www.ctvnews.ca/entertainment/happy-bday-m8-william-meets-taylor-swift-backstage-at-london-show-1.6937454,positive,0.9454832,0.0014971922,0.05301952,0.8939363141952337
CTV,2024-06-23,Economists say BoC could cut interest rates again in July if inflation keeps cooling,https://www.ctvnews.ca/business/economists-say-boc-could-cut-interest-rates-again-in-july-if-inflation-keeps-cooling-1.6937675,neutral,0.09579545,0.028443463,0.8757611,0.008367737640246009
CTV,2024-06-23,Dashcam video shows dangerous passing attempt on northern Ont. highway,https://northernontario.ctvnews.ca/dashcam-video-shows-dangerous-passing-attempt-on-northern-ont-highway-1.6937810,negative,0.012205157,0.6673211,0.32047373,-0.4451684652222063
CTV,2024-06-23,Presidential debate important moment to demonstrate 'the way our democracy works': U.S. ambassador,https://www.ctvnews.ca/politics/presidential-debate-important-moment-to-demonstrate-the-way-our-democracy-works-u-s-ambassador-1.6937377,positive,0.5095187,0.0067045037,0.4837768,0.2595643378375314
CTV,2024-06-23,Motor yacht crew face criminal charges over Greek island fire allegedly started by firework display,https://www.ctvnews.ca/world/motor-yacht-crew-face-criminal-charges-over-greek-island-fire-allegedly-started-by-firework-display-1.6937890,negative,0.009790952,0.70388395,0.28632513,-0.49535672583072454
CTV,2024-06-23,"Guelph, Ont. high school choir sings at Foreigner concert",https://kitchener.ctvnews.ca/guelph-ont-high-school-choir-sings-at-foreigner-concert-1.6934410,neutral,0.10432305,0.0043768063,0.8913003,0.010864124846110101
CTV,2024-06-23,Two-vehicle crash shuts down Sask. highway,https://saskatoon.ctvnews.ca/two-vehicle-crash-shuts-down-sask-highway-1.6937863,negative,0.011718744,0.71377647,0.27450472,-0.5093395607717142
CTV,2024-06-23,1 man in hospital following Saturday night Calgary shooting on Cornerstone,https://calgary.ctvnews.ca/1-man-in-hospital-following-saturday-night-calgary-shooting-on-cornerstone-1.6937803,negative,0.012339669,0.5210586,0.46660176,-0.27134980229526207
CTV,2024-06-23,"Saturday's storm near Angus, Ont. being investigated for possible tornado",https://barrie.ctvnews.ca/saturday-s-storm-near-angus-ont-being-investigated-for-possible-tornado-1.6937804,neutral,0.017127743,0.1365321,0.8463402,-0.01834765148660722
CTV,2024-06-23,"B.C. First Nations involved in salmon farming demand apology from William Shatner, Ryan Reynolds",https://bc.ctvnews.ca/b-c-first-nations-involved-in-salmon-farming-demand-apology-from-william-shatner-ryan-reynolds-1.6937044,negative,0.015301933,0.32358897,0.66110915,-0.10447565194379393
CTV,2024-06-23,Four-year-old boy found safe after spending 22 hours alone in California wilderness,https://www.ctvnews.ca/world/four-year-old-boy-found-safe-after-spending-22-hours-alone-in-california-wilderness-1.6937943,neutral,0.20913422,0.027466267,0.76339954,0.04298272116934676
CTV,2024-06-23,Police still investigating cause after woman found dead in Kelowna park,https://bc.ctvnews.ca/police-still-investigating-cause-after-woman-found-dead-in-kelowna-park-1.6937902,negative,0.011651847,0.44828284,0.54006535,-0.20082172425051503
CTV,2024-06-23,Collison with deer sparks three-vehicle crash on Hwy. 11,https://northernontario.ctvnews.ca/collison-with-deer-sparks-three-vehicle-crash-on-hwy-11-1.6936565,negative,0.016418869,0.32894114,0.6546399,-0.10793271985634867
CTV,2024-06-23,FDA warns company against selling products containing human fecal matter to those in U.S. and Canada. Here's what Health Canada says about selling these products,https://www.ctvnews.ca/health/fda-warns-company-against-selling-products-containing-human-fecal-matter-to-those-in-u-s-and-canada-here-s-what-health-canada-says-about-selling-these-products-1.6937910,negative,0.014323941,0.534015,0.4516611,-0.2849668135681327
CTV,2024-06-23,"'Everything is at stake' for reproductive rights in 2024, Kamala Harris says as Biden-Trump debate nears",https://www.ctvnews.ca/world/everything-is-at-stake-for-reproductive-rights-in-2024-kamala-harris-says-as-biden-trump-debate-nears-1.6937844,neutral,0.1251455,0.027318396,0.8475361,0.014915102347643483
CTV,2024-06-23,"Newfoundland and Labrador getting help from Quebec, Ontario to battle wildfires",https://www.ctvnews.ca/canada/newfoundland-and-labrador-getting-help-from-quebec-ontario-to-battle-wildfires-1.6936000,neutral,0.11811382,0.010668481,0.87121767,0.013837061999146805
CTV,2024-06-23,Deer makes unexpected visit to Ottawa apartment,https://ottawa.ctvnews.ca/deer-makes-unexpected-visit-to-ottawa-apartment-1.6935990,neutral,0.050529703,0.028711637,0.9207588,0.0017288900858497547
CTV,2024-06-23,Group rallies to save Ontario Science Centre,https://toronto.ctvnews.ca/group-rallies-to-save-ontario-science-centre-1.6937958,neutral,0.14508024,0.034514215,0.8204056,0.01985703775297054
CTV,2024-06-23,"Donald Sutherland was 'in awe' of son Kiefer while filming 'Forsaken,' says director",https://www.ctvnews.ca/entertainment/donald-sutherland-was-in-awe-of-son-kiefer-while-filming-forsaken-says-director-1.6937131,positive,0.4865406,0.005030445,0.50842875,0.23669653657947798
CTV,2024-06-23,Driver charged after vehicle rollover near Huntsville,https://barrie.ctvnews.ca/driver-charged-after-vehicle-rollover-near-huntsville-1.6937885,neutral,0.027922153,0.18709084,0.7849869,-0.03422335145340405
CTV,2024-06-23,"Drugs, cash and firearm seized by Toronto police, 3 suspects charged",https://toronto.ctvnews.ca/drugs-cash-and-firearm-seized-by-toronto-police-3-suspects-charged-1.6937840,neutral,0.034026157,0.16033505,0.8056387,-0.024549563384407946
CTV,2024-06-23,Driver travelling 236 km/h among seven drivers charged on Saturday,https://barrie.ctvnews.ca/driver-travelling-236-km-h-among-seven-drivers-charged-on-saturday-1.6937894,neutral,0.04370882,0.0690776,0.8872135,-0.002861255599802659
CTV,2024-06-23,Windy conditions and tricky terrain challenge firefighters battling large grass fire,https://calgary.ctvnews.ca/windy-conditions-and-tricky-terrain-challenge-firefighters-battling-large-grass-fire-1.6937858,negative,0.027280768,0.45737654,0.5153426,-0.2084490966965511
CTV,2024-06-23,"Illegal moose hunters fined $56.5K, suspended for 27 years in northern Ont.",https://northernontario.ctvnews.ca/illegal-moose-hunters-fined-56-5k-suspended-for-27-years-in-northern-ont-1.6936035,negative,0.0052165673,0.8669412,0.12784213,-0.7515599582991719
CTV,2024-06-23,'Build relationships on both sides': Provinces make push ahead of U.S. election,https://www.ctvnews.ca/politics/build-relationships-on-both-sides-provinces-make-push-ahead-of-u-s-election-1.6937130,positive,0.4362653,0.012471827,0.5512629,0.19017184402388487
CTV,2024-06-23,Pedestrian killed on Hwy. 97 following bus crash that caused 'numerous' injuries,https://bc.ctvnews.ca/pedestrian-killed-on-hwy-97-following-bus-crash-that-caused-numerous-injuries-1.6936606,negative,0.009235752,0.72096944,0.26979464,-0.519711759707171
CTV,2024-06-23,Warning labels on social media not enough on their own to protect teens: expert,https://ottawa.ctvnews.ca/warning-labels-on-social-media-not-enough-on-their-own-to-protect-teens-expert-1.6937494,negative,0.018325655,0.51251704,0.46915728,-0.2623378962091625
CTV,2024-06-23,New pup taking over as Victim Services Toronto's trauma dog,https://toronto.ctvnews.ca/new-pup-taking-over-as-victim-services-toronto-s-trauma-dog-1.6937188,neutral,0.071740195,0.048320778,0.8799389,0.0028117610082882827
CTV,2024-06-23,"Sporting sequins and silver, Mama Stanley becomes an Edmonton celebrity for playoffs",https://edmonton.ctvnews.ca/sporting-sequins-and-silver-mama-stanley-becomes-an-edmonton-celebrity-for-playoffs-1.6937869,positive,0.2853566,0.0070911427,0.70755225,0.08137811125649819
CTV,2024-06-23,Northern Ontario Indigenous not-for-profit energy company releases new book,https://northernontario.ctvnews.ca/northern-ontario-indigenous-not-for-profit-energy-company-releases-new-book-1.6937481,neutral,0.027216045,0.08869086,0.8840931,-0.007125354879877754
CTV,2024-06-23,"Hikers injured in Waterton bear attack out of hospital, bear not yet located",https://calgary.ctvnews.ca/hikers-injured-in-waterton-bear-attack-out-of-hospital-bear-not-yet-located-1.6936182,negative,0.0101867,0.5627163,0.42709693,-0.3165459213101105
CTV,2024-06-23,DIY investing vs. hiring a professional: Which is right for you?,https://www.ctvnews.ca/business/diy-investing-vs-hiring-a-professional-which-is-right-for-you-1.6932948,neutral,0.08021941,0.04646987,0.87331086,0.0042756999885857905
CTV,2024-06-23,Trump floats 'migrant league of fighters' in latest dehumanizing rhetoric against migrants,https://www.ctvnews.ca/world/trump-floats-migrant-league-of-fighters-in-latest-dehumanizing-rhetoric-against-migrants-1.6937624,negative,0.006767003,0.8187072,0.1745256,-0.6702358900349674
CTV,2024-06-23,More than 100 stolen vehicles recovered in auto theft probe involving ServiceOntario employee: Toronto police,https://toronto.ctvnews.ca/more-than-100-stolen-vehicles-recovered-in-auto-theft-probe-involving-serviceontario-employee-toronto-police-1.6935708,negative,0.01367328,0.5373579,0.44896874,-0.28856659735469137
CTV,2024-06-23,"CDK hackers want millions in ransom to end car dealership outage, Bloomberg News reports",https://www.ctvnews.ca/business/cdk-hackers-want-millions-in-ransom-to-end-car-dealership-outage-bloomberg-news-reports-1.6936612,negative,0.010338749,0.6929072,0.29675406,-0.48001351823462457
CTV,2024-06-23,Vehicle involved in inter-provincial missing child investigation located in Saskatchewan,https://regina.ctvnews.ca/vehicle-involved-in-inter-provincial-missing-child-investigation-located-in-saskatchewan-1.6937453,neutral,0.02372496,0.20932043,0.76695454,-0.04325218091705629
CTV,2024-06-23,RCMP in N.B. seeking man who allegedly assaulted woman during home invasion,https://atlantic.ctvnews.ca/rcmp-in-n-b-seeking-man-who-allegedly-assaulted-woman-during-home-invasion-1.6937836,negative,0.009848617,0.6131391,0.37701228,-0.3758425704320434
CTV,2024-06-23,'We're enraged': Tori Dunn’s father shares her heartbreaking final moments,https://bc.ctvnews.ca/we-re-enraged-tori-dunn-s-father-shares-her-heartbreaking-final-moments-1.6937654,negative,0.010577506,0.81020397,0.17921849,-0.6563186244015551
CTV,2024-06-23,Is a population boom an economic necessity for Canada?,/video/c2945542-ctv-national-news--population-boom-in-canada,neutral,0.10246878,0.11294354,0.78458774,-0.002256390931060892
CBC,2024-06-23,"Wait, where's the loot? The Toronto gold heist is far from solved",https://www.cbc.ca/news/canada/toronto/toronto-gold-heist-questions-india-1.7238601,negative,0.01146195,0.7544689,0.2340692,-0.5690919047373271
CBC,2024-06-23,Montreal borough gives red card to litter in parks,https://www.cbc.ca/player/play/video/9.6428812,negative,0.02191027,0.5439591,0.43413064,-0.29541143848552665
CBC,2024-06-23,Five key takeaways from CBC's interview with Prime Minister Justin Trudeau,https://www.cbc.ca/news/politics/five-key-takeaways-from-cbc-s-interview-with-prime-minister-justin-trudeau-1.7237911,neutral,0.19255948,0.007365754,0.8000747,0.03702491314498069
CBC,2024-06-23,Oilers fans elated after Game 6,https://www.cbc.ca/player/play/video/9.6430379,positive,0.9694368,0.0037501447,0.026813136,0.9397935902325456
CBC,2024-06-23,Indigenous women stake their claim in beauty industry,https://www.cbc.ca/player/play/video/9.6429001,neutral,0.16510938,0.024388768,0.81050175,0.02666630794472269
CBC,2024-06-23,She lied to get her twin daughters Inuit status and is about to be sentenced for fraud. Again.,https://www.cbc.ca/news/canada/north/karima-manji-history-of-fraud-1.7240404,negative,0.006676897,0.8912382,0.10208485,-0.7942609901860269
CBC,2024-06-23,A report claims certain parliamentarians colluded with foreign states — could they be charged?,https://www.cbc.ca/news/politics/foreign-interference-parliamentarians-conspired-now-what-1.7228005,negative,0.013176705,0.47710565,0.50971764,-0.22745617303893084
CBC,2024-06-23,The Bikeriders thinks masculinity is a curse — but at least it looks cool on a motorcycle,https://www.cbc.ca/news/entertainment/the-bikeriders-review-1.7240565,neutral,0.29100257,0.21524407,0.49375328,0.03835249277317798
CBC,2024-06-23,WATCH | Calgary officials deliver update on water main break,https://www.cbc.ca/news/canada/calgary/watch-calgary-officials-deliver-update-on-water-main-break-1.7243760,neutral,0.023140201,0.030767418,0.9460923,-0.0004111656734918645
CBC,2024-06-23,Future of Halifax church in limbo again as municipality orders building closed for safety reasons,https://www.cbc.ca/news/canada/nova-scotia/st-patrick-s-catholic-church-halifax-closed-safety-1.7243007,negative,0.010518158,0.635796,0.35368592,-0.40412589855564107
CBC,2024-06-23,Ohio troopers and road crew rescue kitten in a tight spot,https://www.cbc.ca/player/play/video/9.6430114,neutral,0.054338314,0.09684251,0.8488191,-0.006425824012763481
CBC,2024-06-23,Naheed Nenshi won the Alberta NDP leadership easily. His next moves will likely be harder,https://www.cbc.ca/news/canada/calgary/nenshi-partisan-leader-alberta-ndp-analysis-1.7243479,neutral,0.13228461,0.18314408,0.6845713,-0.016042533993512187
CBC,2024-06-23,Toronto voters say federal byelection is a referendum on Justin Trudeau's future,https://www.cbc.ca/news/politics/toronto-st-pauls-byelection-referendum-trudeau-1.7239518,neutral,0.039416134,0.05400257,0.9065813,-0.0013626462818554508
CBC,2024-06-23,"More than 1,300 Hajj pilgrims have died this year amid scorching heat, Saudi Arabia says",https://www.cbc.ca/news/world/hajj-pilgrimage-heat-deaths-1.7244197,negative,0.0052340887,0.85094243,0.14382346,-0.7240756664704762
CBC,2024-06-23,How coffee can be a small comfort in a crisis,https://www.cbc.ca/player/play/video/9.6428159,positive,0.38183552,0.14438458,0.4737799,0.12495146174943228
CBC,2024-06-23,WATCH | A Canadian island is agonizingly close to a U.S. town — but getting a ferry to connect them isn't easy,https://www.cbc.cahttps://www.cbc.ca/player/play/video/9.6429974,negative,0.021963572,0.6164407,0.3615957,-0.3795167535796544
CBC,2024-06-23,Production of a favourite sriracha was halted — again. What's at risk when a brand becomes scarce?,https://www.cbc.ca/radio/costofliving/brands-power-hot-sauce-1.7239926,negative,0.008242816,0.84792924,0.14382792,-0.7189160503116909
CBC,2024-06-23,The gas network keeps growing. The last customers could be left paying for it all,https://www.cbc.ca/news/science/gas-network-policies-1.7240239,negative,0.027057698,0.73295665,0.23998562,-0.5364933491736839
CBC,2024-06-23,"Gunmen reportedly launch deadly attack on religious sites, police post in Russia's Dagestan",https://www.cbc.ca/news/world/russia-attack-religious-sites-1.7244164,negative,0.006764106,0.7462675,0.24696833,-0.556869468724841
CBC,2024-06-23,"Blue Jays' Orelvis Martinez gets 80-game drug suspension, 2 days after his major league debut",https://www.cbc.ca/sports/baseball/mlb/orelvis-martinez-suspension-blue-jays-mlb-1.7244041,negative,0.012942663,0.3207669,0.66629046,-0.1027238796489609
CBC,2024-06-23,Top Mountie says he's keen on Ottawa's plan for a 'separate and distinct' federal policing unit,https://www.cbc.ca/news/politics/rcmp-federal-policing-structure-duheme-distinct-1.7241797,neutral,0.22247115,0.007224871,0.770304,0.04944120318470535
CBC,2024-06-23,"Ontario Liberal MP's map of Canada forgets P.E.I., Yukon",https://www.cbc.ca/news/politics/ontario-liberal-mp-s-map-of-canada-forgets-p-e-i-yukon-1.7244014,negative,0.024033157,0.31167307,0.66429377,-0.09656251292310003
CBC,2024-06-23,Many Montreal renters move on July 1. But what if you have nowhere to go?,https://www.cbc.ca/player/play/video/9.6430272,neutral,0.029090753,0.13910535,0.8318039,-0.01850402386985106
CBC,2024-06-23,He died in Hamilton's jail within 24 hours of going in. His family won't give up till they get answers,https://www.cbc.ca/news/canada/hamilton/hamilton-prisoner-death-2024-jamie-dooley-1.7241017,negative,0.00975215,0.8162611,0.17398684,-0.6661870154499594
CBC,2024-06-23,"In a world that embraces minimalism, what's a collector like me to do?",https://www.cbc.ca/news/canada/first-person-collector-minimalism-1.7242994,positive,0.27012882,0.039978802,0.68989253,0.07137123851070015
CBC,2024-06-23,"In Paris, police step up encampment evictions ahead of the Olympics",https://www.cbc.ca/news/world/paris-olympics-social-cleansing-1.7239091,negative,0.014995786,0.38864568,0.5963585,-0.1508206123642175
CBC,2024-06-23,WATCH : CBC News Explore,https://www.cbc.cahttps://gem.cbc.ca/live,neutral,0.09840742,0.014817321,0.88677526,0.009464467482493077
CBC,2024-06-23,Why are so many big-city condos sitting empty? | About That,https://www.cbc.ca/player/play/video/9.6428660,negative,0.018756457,0.5524112,0.4288324,-0.30480629616065613
CBC,2024-06-23,"Fire suppression efforts working against Churchill Falls, N.L., wildfires",https://www.cbc.ca/news/canada/newfoundland-labrador/fire-suppression-efforts-working-against-churchill-falls-wildfires-1.7244153,negative,0.025593333,0.28600895,0.68839777,-0.08114608720106986
CBC,2024-06-23,Swimmer Apollo Hess 1st member of Blood Tribe to go to Olympics,https://www.cbc.ca/player/play/video/9.6429559,neutral,0.13780066,0.006756988,0.85544235,0.01894336598944335
CBC,2024-06-23,There's an old problem Canada's new foreign-interference law won't fix,https://www.cbc.ca/news/world/foreign-interference-intelligence-comparison-us-1.7240299,negative,0.007587491,0.8637126,0.12869988,-0.7459419133400367
CBC,2024-06-23,RCMP chief says he hopes MPs don't name politicians accused of aiding foreign powers in the House,https://www.cbc.ca/news/politics/duheme-nsicop-arrest-parliamentary-privilege-1.7243015,negative,0.014305505,0.33609784,0.6495966,-0.1127571370742082
CBC,2024-06-23,TikTok has been called the therapist's couch of Gen Z. But not all the #mentalhealth info checks out,https://www.cbc.ca/radio/spark/mental-health-tiktok-1.7242717,negative,0.048279658,0.3374777,0.6142427,-0.11156026327829238
CBC,2024-06-23,Proposed legislation would ensure flight attendants are paid for pre- and post-flight duties,https://www.cbc.ca/news/politics/legislation-flight-attendants-unpaid-work-hours-1.7242837,neutral,0.15820748,0.031309154,0.8104833,0.024049353501643722
CBC,2024-06-23,Penny Oleksiak just misses qualifying for 100m freestyle Olympic event,https://www.cbc.ca/sports/olympics/summer/aquatics/penny-oleksiak-last-chance-qualifier-june-22-1.7243794,negative,0.026894147,0.40472922,0.5683766,-0.1630824551686043
CBC,2024-06-23,Nomination races are a 'gateway' for foreign interference — is anyone doing anything about it?,https://www.cbc.ca/news/politics/foreign-interference-nominations-nsicop-hogue-1.7238450,negative,0.006809379,0.8174399,0.17575063,-0.6681617298469043
CBC,2024-06-23,B.C. man fined over $11K for installing heat pump has penalty reduced,https://www.cbc.ca/news/canada/british-columbia/strata-fine-heat-pump-richmond-1.7242968,negative,0.014552682,0.4752516,0.51019573,-0.22565228870604415
CBC,2024-06-23,WATCH: CBC News Network,https://www.cbc.cahttps://gem.cbc.ca/live,neutral,0.10073908,0.018231502,0.88102955,0.00981596340483426
CBC,2024-06-23,To catch a rising star: Audrey Leduc is gaining attention as she burns up the track,https://www.cbc.cahttps://www.cbc.ca/sportslongform/entry/audrey-leduc-olympics-track,positive,0.35018364,0.0088853715,0.64093095,0.12254963901687965
CBC,2024-06-23,Naheed Nenshi wins Alberta NDP leadership in landslide,https://www.cbc.ca/player/play/video/9.6430574,positive,0.30355087,0.0128353555,0.6836138,0.09197838390576862
CBC,2024-06-23,"Sore back? Your bad posture may not be to blame after all, experts say",https://www.cbc.ca/radio/sunday/posture-myths-and-back-pain-1.7238119,negative,0.01955867,0.7189404,0.26150092,-0.516492745363319
CBC,2024-06-23,First responders praised following B.C. school bus crash,https://www.cbc.ca/news/canada/british-columbia/crash-bus-school-b-c-1.7243905,neutral,0.20142147,0.07506182,0.72351664,0.0349363378796248
CBC,2024-06-23,Canada doesn't count emissions from oil and gas exports. So we did,https://www.cbc.cahttps://newsinteractives.cbc.ca/features/2024/emissions/,negative,0.05772075,0.2597959,0.68248326,-0.06416224483860411
CBC,2024-06-23,This Canadian band just released an album recorded more than 50 years ago,https://www.cbc.ca/news/canada/british-columbia/canada-fox-album-release-1.7242670,negative,0.11967499,0.26862875,0.61169624,-0.057839306771086285
CBC,2024-06-23,A Canadian island is agonizingly close to a U.S. town — but getting a ferry to connect them isn't easy,https://www.cbc.ca/player/play/video/9.6429974,negative,0.024198886,0.6836602,0.2921408,-0.46680575431072846
