source,date,headline,url,chosen_label,positive,negative,neutral,compound
CTV,2024-01-27,What you should know about the moon area where Japan’s lander touched down,https://www.ctvnews.ca/sci-tech/what-you-should-know-about-the-moon-area-where-japan-s-lander-touched-down-1.6745093,neutral,0.06612243,0.0133739645,0.92050344,0.0041933215679574865
CTV,2024-01-27,Nerene Virgin of 'Today's Special' fame dies at 77,https://toronto.ctvnews.ca/nerene-virgin-of-today-s-special-fame-dies-at-77-1.6733282,neutral,0.09775848,0.033240605,0.86900103,0.00845177452855772
CTV,2024-01-27,Edmonton father charged with murder in death of infant son,https://edmonton.ctvnews.ca/edmonton-father-charged-with-murder-in-death-of-infant-son-1.6743959,negative,0.0065376684,0.8357297,0.1577327,-0.6984013465553822
CTV,2024-01-27,U.S. condemns ban on Venezuelan opposition leader's candidacy and puts sanctions relief under review,https://www.ctvnews.ca/world/u-s-condemns-ban-on-venezuelan-opposition-leader-s-candidacy-and-puts-sanctions-relief-under-review-1.6745200,negative,0.018123338,0.29960307,0.6822737,-0.08943352221414891
CTV,2024-01-27,7 people hospitalized after fire erupts in police standoff,/video/c2855412-edmonton-apartment-destroyed-by-fire,negative,0.008813613,0.6017152,0.3894712,-0.36198349289475473
CTV,2024-01-27,Serious collision blocks off highway near Milestone,https://regina.ctvnews.ca/serious-collision-blocks-off-highway-near-milestone-1.6745050,negative,0.017655114,0.64031106,0.34203377,-0.40968657134275155
CTV,2024-01-27,A new study suggests the Milky Way contains less dark matter than previously thought,https://www.ctvnews.ca/sci-tech/a-new-study-suggests-the-milky-way-contains-less-dark-matter-than-previously-thought-1.6745278,neutral,0.1026086,0.02344377,0.87394756,0.009978920278149062
CTV,2024-01-27,"Woodstock, Ont. singer-songwriter gaining notoriety after Zack Bryan song rendition",https://kitchener.ctvnews.ca/woodstock-ont-singer-songwriter-gaining-notoriety-after-zack-bryan-song-rendition-1.6745288,positive,0.2362658,0.004872867,0.75886136,0.055797773359653746
CTV,2024-01-27,Mom pleads for answers 5 years after son's disappearance in B.C.,https://bc.ctvnews.ca/mom-pleads-for-answers-5-years-after-son-s-disappearance-in-b-c-1.6745268,neutral,0.03892691,0.10960138,0.8514717,-0.010497156443414646
CTV,2024-01-27,National Non-Smoking Week wraps up in the Sault,https://northernontario.ctvnews.ca/national-non-smoking-week-wraps-up-in-the-sault-1.6745244,positive,0.2449026,0.015191802,0.7399056,0.05974649042688185
CTV,2024-01-27,Glebe residents gather for 'bring a cup' events focusing on sustainability,https://ottawa.ctvnews.ca/glebe-residents-gather-for-bring-a-cup-events-focusing-on-sustainability-1.6745164,positive,0.26359814,0.009645508,0.72675633,0.06939094546120828
CTV,2024-01-27,"Brick by brick, animal super powers on display in LaSalle",https://windsor.ctvnews.ca/brick-by-brick-animal-super-powers-on-display-in-lasalle-1.6745039,positive,0.30852264,0.049371198,0.6421062,0.09274870671333701
CTV,2024-01-27,"Bodies of B.C. helicopter crash victims still 'in the mountains,' family member says",https://bc.ctvnews.ca/bodies-of-b-c-helicopter-crash-victims-still-in-the-mountains-family-member-says-1.6744284,neutral,0.01523899,0.22325727,0.76150376,-0.04961158036557212
CTV,2024-01-27,'It just spread like wildfire': Kitchener Ont. man saves driver from burning car,https://kitchener.ctvnews.ca/it-just-spread-like-wildfire-kitchener-ont-man-saves-driver-from-burning-car-1.6745201,negative,0.019649189,0.4965288,0.48382193,-0.24615480595033823
CTV,2024-01-27,"James Smith stabbing victims had little chance of being saved by paramedics, pathologist says",https://saskatoon.ctvnews.ca/james-smith-stabbing-victims-had-little-chance-of-being-saved-by-paramedics-pathologist-says-1.6744138,negative,0.0117844185,0.63725674,0.35095888,-0.40595724444419545
CTV,2024-01-27,Canada is less likely to need to invoke Emergencies Act again: former security official,https://www.ctvnews.ca/politics/canada-is-less-likely-to-need-to-invoke-emergencies-act-again-former-security-official-1.6745040,neutral,0.04912537,0.040447254,0.9104273,0.0007773225126759264
CTV,2024-01-27,"University students, staff concerned over increased surveillance on exams",https://www.ctvnews.ca/canada/university-students-staff-concerned-over-increased-surveillance-on-exams-1.6744152,negative,0.017979164,0.3248462,0.6571746,-0.10520181733103584
CTV,2024-01-27,1 climber dead after fall on Mt. Temple in Banff National Park,https://calgary.ctvnews.ca/1-climber-dead-after-fall-on-mt-temple-in-banff-national-park-1.6744947,negative,0.025152165,0.42772081,0.54712707,-0.1823124395521596
CTV,2024-01-27,Donald Trump is on the hook for US$88.3 million in defamation damages. What happens next?,https://www.ctvnews.ca/world/donald-trump-is-on-the-hook-for-us-88-3-million-in-defamation-damages-what-happens-next-1.6745163,negative,0.009955942,0.81529003,0.17475411,-0.6645986464456541
CTV,2024-01-27,'Amputation' and 'flesh-eating disease': Canadians ending up in the hospital with invasive strep A,https://www.ctvnews.ca/health/amputation-and-flesh-eating-disease-canadians-ending-up-in-the-hospital-with-invasive-strep-a-1.6740437,negative,0.0077479887,0.80236113,0.18989098,-0.6437232577315797
CTV,2024-01-27,'It's one to remember.' Retirement residence couple exchange vows in London,https://london.ctvnews.ca/it-s-one-to-remember-retirement-residence-couple-exchange-vows-in-london-1.6745283,positive,0.533764,0.004218595,0.46201748,0.28488618475464733
CTV,2024-01-27,Waning measles immunization rates means risk of virus's return to Canada: experts,https://www.ctvnews.ca/health/waning-measles-immunization-rates-means-risk-of-virus-s-return-to-canada-experts-1.6743637,negative,0.017654138,0.3392359,0.64311004,-0.11476929930271496
CTV,2024-01-27,MacKenzie Scott sold 65 million Amazon shares worth more than US$10B in the last year,https://www.ctvnews.ca/business/mackenzie-scott-sold-65-million-amazon-shares-worth-more-than-us-10b-in-the-last-year-1.6744762,neutral,0.14523746,0.050618954,0.8041437,0.018531628101376096
CTV,2024-01-27,Montreal researchers developing AI that could help us settle the moon,https://montreal.ctvnews.ca/montreal-researchers-developing-ai-that-could-help-us-settle-the-moon-1.6744999,neutral,0.19319312,0.0127427,0.7940641,0.03716121976317144
CTV,2024-01-27,World Court orders Israel to prevent acts of genocide,/video/c2855464-ctv-national-news--landmark-genocide-case?playlistId=1.6720759,negative,0.042243782,0.46341082,0.4943453,-0.21296509311425993
CTV,2024-01-27,Province moves forward with cuts to harm reduction measures despite concerns,https://regina.ctvnews.ca/province-moves-forward-with-cuts-to-harm-reduction-measures-despite-concerns-1.6745016,neutral,0.056679334,0.080491036,0.8628297,-0.0032662586158149765
CTV,2024-01-27,Commemorating International Holocaust Remembrance day,/video/c2855561-marking-holocaust-remembrance-day?playlistId=1.6744909,positive,0.37142888,0.092704274,0.53586686,0.12936532976306836
CTV,2024-01-27,"Cochrane mayor’s pay should be suspended 90 days, integrity commissioner rules",https://northernontario.ctvnews.ca/cochrane-mayor-s-pay-should-be-suspended-90-days-integrity-commissioner-rules-1.6744271,negative,0.01309406,0.6696357,0.31727016,-0.4482405727868368
CTV,2024-01-27,Charges against country singer Chris Young in Nashville bar arrest have been dropped,https://www.ctvnews.ca/entertainment/charges-against-country-singer-chris-young-in-nashville-bar-arrest-have-been-dropped-1.6744973,negative,0.01577835,0.23908748,0.7451343,-0.056913838932905136
CTV,2024-01-27,Britney Spears’ 2011 track ‘Selfish’ is charting higher than Justin Timberlake’s new song of same name,https://www.ctvnews.ca/entertainment/britney-spears-2011-track-selfish-is-charting-higher-than-justin-timberlake-s-new-song-of-same-name-1.6745120,positive,0.3148112,0.013543567,0.6716452,0.09892266313374876
CTV,2024-01-27,B.C. 14-year-old who brought handgun to school because he 'thought it would be cool' sentenced,https://bc.ctvnews.ca/b-c-14-year-old-who-brought-handgun-to-school-because-he-thought-it-would-be-cool-sentenced-1.6745130,negative,0.067327924,0.2741547,0.6585173,-0.07062776576773011
CTV,2024-01-27,Man convicted of manslaughter in the killing of former New Orleans Saints star Will Smith,https://www.ctvnews.ca/sports/man-convicted-of-manslaughter-in-the-killing-of-former-new-orleans-saints-star-will-smith-1.6744872,negative,0.010787139,0.6290508,0.36016214,-0.3955884989772116
CTV,2024-01-27,Police investigating sexual assault in Alliston,https://barrie.ctvnews.ca/police-investigating-sexual-assault-in-alliston-1.6745199,negative,0.01592927,0.4423562,0.5417145,-0.19542527750949112
CTV,2024-01-27,251 vehicles stolen in Canada and bound for Middle East seized in Italy,https://www.ctvnews.ca/autos/251-vehicles-stolen-in-canada-and-bound-for-middle-east-seized-in-italy-1.6741787,negative,0.013120692,0.5740501,0.4128292,-0.3293613802146602
CTV,2024-01-27,"Meet Efruz, the Jack Russell terrier that loves to surf the waves of Peru",https://www.ctvnews.ca/lifestyle/meet-efruz-the-jack-russell-terrier-that-loves-to-surf-the-waves-of-peru-1.6742926,positive,0.8769816,0.0030476004,0.119970754,0.7690875061279989
CTV,2024-01-27,'I lost my appetite': Cheeseburger served with waiver at Toronto restaurant,https://toronto.ctvnews.ca/i-lost-my-appetite-cheeseburger-served-with-waiver-at-toronto-restaurant-1.6733779,negative,0.021751812,0.58301,0.39523804,-0.3394276061275292
CTV,2024-01-27,How Celine Dion sharing her story is inspiring other sufferers of stiff person syndrome,https://www.ctvnews.ca/w5/how-celine-dion-sharing-her-story-is-inspiring-other-sufferers-of-stiff-person-syndrome-1.6743974,positive,0.90558684,0.0062972624,0.08811585,0.8200478867021688
CBC,2024-01-27,'It's like a weight being lifted': Relief and remembrance as arrest made in P.E.I. murder from 1988,https://www.cbc.ca/news/canada/prince-edward-island/pei-byron-carr-arrest-reaction-1.7096663,positive,0.26779234,0.082594745,0.64961284,0.06489085748420109
CBC,2024-01-27,Go beyond the headlines | Stream CBC News Explore,https://www.cbc.cahttps://www.cbc.ca/news/cbc-news-explore-1.6512577,neutral,0.09185704,0.0112939505,0.89684886,0.008310174861161368
CBC,2024-01-27,"Why deadly, invasive strep A infections are surging in Canada and beyond",https://www.cbc.ca/news/health/why-deadly-invasive-strep-a-infections-are-surging-in-canada-and-beyond-1.7095026,negative,0.0052397023,0.89555717,0.099203125,-0.8019951680580917
CBC,2024-01-27,"For Expats, Lulu Wang mined tragedy for connection",https://www.cbc.ca/news/entertainment/lulu-wang-expats-kidman-1.7096624,neutral,0.100742646,0.22690795,0.6723494,-0.04133813728004476
CBC,2024-01-27,"Health centre in Sault Ste. Marie, Ont., drops thousands of patients due to doctor shortage",https://www.cbc.ca/news/canada/sudbury/doctor-shortage-sault-family-physicians-1.7096429,negative,0.011962179,0.76924634,0.21879143,-0.5915968827906681
CBC,2024-01-27,"Israel must take steps to prevent genocide in Gaza, UN court says",https://www.cbc.ca/news/world/icj-decision-south-africa-israel-genocide-1.7095027,negative,0.04021797,0.280426,0.679356,-0.07702126854279356
CBC,2024-01-27,Israeli airstrikes pound southern Gaza as more countries pull funding for UN agency,https://www.cbc.ca/news/world/israel-hamas-jan27-1.7096954,negative,0.007147059,0.79352003,0.19933297,-0.6296229040904278
CBC,2024-01-27,U.S. government among those concerned about Quebec's new French-language sign rules,https://www.cbc.ca/news/canada/montreal/quebec-storefront-signs-french-language-1.7094910,neutral,0.018705402,0.167892,0.8134026,-0.027837832003689833
CBC,2024-01-27,"Cap on international study permits sparks fear of rising tuition, program cuts, layoffs on campus",https://www.cbc.ca/news/canada/campus-impact-intl-students-cap-1.7094629,negative,0.009539232,0.6951147,0.29534596,-0.48309349198749985
CBC,2024-01-27,"Explicit fake images of Taylor Swift prove laws haven't kept pace with tech, experts say",https://www.cbc.ca/news/canada/taylor-swift-ai-images-highlight-need-for-better-legislation-1.7096094,negative,0.011659305,0.65355074,0.33478993,-0.4269926352169868
CBC,2024-01-27,Some doctors caution against full-body MRIs as celebrity endorsements drive up demand,https://www.cbc.ca/radio/thecurrent/full-body-mri-doctors-caution-1.7095942,negative,0.028298475,0.27210742,0.69959414,-0.0732416387758299
CBC,2024-01-27,An alleged group sexual assault involving hockey players may be going to court. Here's what might happen next,https://www.cbc.ca/news/politics/world-junior-hockey-sexual-assault-london-1.7096096,negative,0.009475343,0.57766545,0.41285917,-0.33360760469970785
CBC,2024-01-27,"Heavy snowfall in Juneau, Alaska, sinks boats in harbour",https://www.cbc.ca/news/canada/north/juneau-alaska-snowfall-sinks-boats-1.7095587,negative,0.01539319,0.68239516,0.3022116,-0.46542622400975375
CBC,2024-01-27,Is it time to ditch sick note requirements? Doctors and patients are tired of them,https://www.cbc.ca/radio/whitecoat/the-high-cost-of-sick-notes-1.7093843,negative,0.024450446,0.69752246,0.27802724,-0.48593968083769923
CBC,2024-01-27,IN PHOTOS | This week's most compelling Canadian images,https://www.cbc.cahttps://www.cbc.ca/newsinteractives/features/compelling-canadian-images-1-22,positive,0.6136785,0.0044785333,0.38184288,0.3765813170976884
CBC,2024-01-27,"On International Holocaust Remembrance Day, survivor fears world has not learned from atrocities",https://www.cbc.ca/news/world/holocaust-remembrance-day-2024-1.7097030,negative,0.009111813,0.8419579,0.14893031,-0.7088100754821625
CBC,2024-01-27,Are Canadians still willing to give Justin Trudeau another look?,https://www.cbc.ca/news/politics/trudeau-liberal-leadership-wherry-analysis-1.7096456,negative,0.019597664,0.546481,0.43392143,-0.2982573829193669
CBC,2024-01-27,"Meet some of the estimated 14,400 newcomers that came to Saskatoon last year",https://www.cbc.ca/news/canada/saskatoon/2023-newcomers-to-saskatoon-1.7092050,neutral,0.11159854,0.0069742906,0.88142705,0.01240560588833084
CBC,2024-01-27,Vince McMahon resigns from WWE parent company after ex-employee files sex abuse lawsuit,https://www.cbc.ca/sports/wwe-mcmahon-sex-abuse-lawsuit-1.7096901,negative,0.017145984,0.48487106,0.4979831,-0.23480588977707484
CBC,2024-01-27,Parts of B.C. under flood watch as atmospheric rivers wash over South Coast,https://www.cbc.ca/news/canada/british-columbia/weather-file-bc-jan-27-1.7096939,neutral,0.018977117,0.10671491,0.8743081,-0.011027929804754422
CBC,2024-01-27,WATCH : CBC News Explore,https://www.cbc.cahttps://gem.cbc.ca/live,neutral,0.09840742,0.014817321,0.88677526,0.009464467482493077
CBC,2024-01-27,"Periods are considered unclean in my community. Now, I make a point to talk about them",https://www.cbc.ca/news/canada/first-person-period-positivity-1.7096370,negative,0.015344822,0.65998936,0.3246659,-0.4353504500793761
CBC,2024-01-27,"Skier killed on Mount Temple, near Lake Louise, Alta.",https://www.cbc.ca/news/canada/calgary/mount-temple-avalanche-death-1.7097045,negative,0.008660255,0.6402195,0.35112005,-0.4098061333571721
CBC,2024-01-27,"These Windsor, Ont., Detroit Lions fans travelled to San Francisco to cheer on their team",https://www.cbc.ca/news/canada/windsor/lions-windsor-san-francisco-1.7096212,neutral,0.18441887,0.013024707,0.80255634,0.03384069279354307
CBC,2024-01-27,Alaska Airlines flying Boeing Max 9s again after panel blowout grounded jets for weeks,https://www.cbc.ca/news/world/boeing-max-9-alaska-airlines-flying-again-1.7097097,negative,0.018450283,0.572289,0.40926072,-0.3271742925045942
CBC,2024-01-27,Documentary on the legacy of residential schools in B.C. wins at Sundance Film Festival,https://www.cbc.ca/news/canada/british-columbia/sugarcane-documentary-film-sundance-film-festival-1.7096710,positive,0.34636545,0.0056657363,0.6479688,0.11993691534054385
CBC,2024-01-27,"AI is increasingly being used to deal with climate change, but it has its own emissions problem",https://www.cbc.ca/news/science/ai-climate-change-emissions-1.7094616,neutral,0.06395765,0.19587903,0.7401633,-0.03427801277096876
CBC,2024-01-27,"Windows smashed at Fredericton synagogue, police investigating",https://www.cbc.ca/news/canada/new-brunswick/police-investigating-vanalism-synagogue-1.7097108,negative,0.010782437,0.6554951,0.33372232,-0.4295576710038702
CBC,2024-01-27,Jury says Donald Trump must pay $83M US more to writer E. Jean Carroll,https://www.cbc.ca/news/world/trump-carroll-defamation-trial-closing-arguments-1.7095799,neutral,0.021063877,0.21577653,0.7631596,-0.04611582804268988
CBC,2024-01-27,Former Supreme Court justice 'terrified' by rise of antisemitism in Canada,https://www.cbc.ca/player/play/2302632515674,negative,0.009722994,0.66950846,0.32076865,-0.4481469587098026
CBC,2024-01-27,WATCH: CBC News Network,https://www.cbc.cahttps://gem.cbc.ca/live,neutral,0.10073908,0.018231502,0.88102955,0.00981596340483426
CBC,2024-01-27,Why is an accused human smuggler living freely in a Toronto-area suburb?,https://www.cbc.ca/news/canada/patel-family-death-accused-human-smuggler-1.7092020,negative,0.008768296,0.7501756,0.24105611,-0.5626865182262186
