source,date,headline,url,chosen_label,positive,negative,neutral,compound
Global,2024-01-27,Mother on 12-hour ER wait with sick newborn: ‘How’s there only 1 doctor?’,https://globalnews.ca/news/10250008/nb-mother-stressful-hospital-wait/,negative,0.027410876,0.35567552,0.6169136,-0.1257537189585669
Global,2024-01-27,Remembering the Holocaust as anti-Semitism on the rise across Montreal,https://globalnews.ca/video/10255551/remembering-the-holocaust-as-anti-semitism-on-the-rise-across-montreal/,negative,0.018012071,0.67070127,0.31128657,-0.449515831298271
Global,2024-01-27,NWT plane crash: Fort Smith mourns victims in close-knit community,https://globalnews.ca/video/10252289/nwt-plane-crash-fort-smith-mourns-victims-in-close-knit-community/,negative,0.017372612,0.48989752,0.49272978,-0.2396978141972106
Global,2024-01-27,Winter Adaptive Games at Queen’s helping people with disabilities,https://globalnews.ca/news/10255293/winter-adaptive-games-at-queens-helping-people-with-disabilities/,positive,0.30741075,0.0058881165,0.68670124,0.094466670523909
Global,2024-01-27,Calgary ski jumper Alexandria Loutitt wins World Cup bronze in Slovenia,https://globalnews.ca/news/10255359/calgary-ski-jumper-alexandria-loutitt-wins-world-cup-bronze-in-slovenia/,positive,0.44915348,0.0040419027,0.5468045,0.2017225672373506
Global,2024-01-27,Holocaust Remembrance Day sparks conversations about global rise of antisemitism,https://globalnews.ca/news/10255333/holocaust-remembrance-day-antisemitism-2024/,neutral,0.059394687,0.21626157,0.7243438,-0.04324133122462115
Global,2024-01-27,Saturday Sips: Three unique teas made with a rooibos base,https://globalnews.ca/video/10255381/saturday-sips-three-unique-teas-made-with-a-rooibos-base/,positive,0.34750113,0.003626225,0.6488728,0.12074383382873854
Global,2024-01-27,Remembering the Holocaust as antisemitism rises across Montreal,https://globalnews.ca/news/10255379/holocaust-day-2024-antisemitism-montreal/,negative,0.012798204,0.75910366,0.2280981,-0.5760746110848913
Global,2024-01-27,Mother arrested for murder after her son’s body found behind fake wall,https://globalnews.ca/news/10253212/mother-murder-son-false-wall-jerri-lynn-roby-isreal/,negative,0.0062655937,0.8014252,0.1923091,-0.6422432064201322
Global,2024-01-27,Edmonton Downtown Farmers Market files for bankruptcy,https://globalnews.ca/news/10255378/edmonton-downtown-farmers-market-bankruptcy/,negative,0.028155616,0.34624544,0.62559897,-0.11909315454776426
Global,2024-01-27,N.B. synagogue vandalized on International Holocaust Remembrance Day,https://globalnews.ca/video/10255495/n-b-synagogue-vandalized-on-international-holocaust-remembrance-day/,negative,0.009252978,0.7868988,0.2038481,-0.6191242070292091
Global,2024-01-27,5-storey apartment building in Osoyoos to feature affordable housing,https://globalnews.ca/news/10255432/osoyoos-apartment-building-affordable-housing/,positive,0.23655882,0.0092240535,0.7542172,0.05587497402366459
Global,2024-01-27,Biden administration raises ‘concerns’ about aspects of Quebec language law,https://globalnews.ca/news/10255373/biden-administration-raises-concerns-about-aspects-of-quebec-language-law/,negative,0.012628024,0.38353544,0.6038365,-0.1469399926167867
Global,2024-01-27,B.C. government taking on social media companies over kids’ health,https://globalnews.ca/video/10254761/b-c-government-taking-on-social-media-companies-over-kids-health/,negative,0.030166369,0.2774291,0.69240457,-0.07605688657096987
Global,2024-01-27,"Twin sisters, sold illegally at birth, reunited thanks to TikTok",https://globalnews.ca/news/10254141/twin-sisters-sold-illegal-adoption-georgia/,neutral,0.21944684,0.03579084,0.7447623,0.04687593656561617
Global,2024-01-27,Singer Elle King drunkenly performs profanity-heavy tribute for Dolly Parton’s 78th birthday,https://globalnews.ca/video/10243529/singer-elle-king-drunkenly-performs-profanity-heavy-tribute-for-dolly-partons-78th-birthday/,neutral,0.11955568,0.11479728,0.765647,0.0011151459771783223
Global,2024-01-27,Taylor Swift deepfake images: Why people are concerned over pornographic AI photos,https://globalnews.ca/video/10255477/taylor-swift-deepfake-images-why-people-are-concerned-over-pornographic-ai-photos/,negative,0.009201767,0.6495277,0.34127048,-0.42180161676815153
Global,2024-01-27,Weekend Dish: bananas flambe or is it bananas foster?,https://globalnews.ca/video/10253953/weekend-dish-bananas-flambe-or-is-it-bananas-foster/,neutral,0.055982802,0.007614762,0.9364024,0.003076092235538175
Global,2024-01-27,‘A long 35 years’: Murder charge laid in Canadian cold case thanks to genetic genealogy,https://globalnews.ca/news/10253084/pei-cold-case-byron-howard-carr-arrest/,negative,0.015990503,0.6231555,0.36085403,-0.3880670496500471
Global,2024-01-27,New York man convicted of murdering woman in car that turned into his driveway by mistake,https://globalnews.ca/video/10247356/new-york-man-convicted-of-murdering-woman-in-car-that-turned-into-his-driveway-by-mistake/,negative,0.008136954,0.7829538,0.20890921,-0.6129504875938707
Global,2024-01-27,RAW VIDEO: Gunman fires bullets inside Edmonton City Hall,https://globalnews.ca/video/10246149/raw-video-gunman-fires-bullets-inside-edmonton-city-hall/,negative,0.010708838,0.49700367,0.49228743,-0.24689800223270186
Global,2024-01-27,Hockey Canada faces reckoning over arrests in alleged 2018 sex assault,https://globalnews.ca/video/10255117/hockey-canada-faces-reckoning-over-arrests-in-alleged-2018-sex-assault/,negative,0.010468882,0.66713625,0.3223949,-0.4449611416225352
Global,2024-01-27,National Ballet of Ukraine preserves culture on Canadian tour,https://globalnews.ca/video/10254888/national-ballet-of-ukraine-preserves-culture-on-canadian-tour/,neutral,0.15890065,0.010061711,0.8310376,0.025148186889570212
Global,2024-01-27,"Ice festival kicks off in Dartmouth, N.S.",https://globalnews.ca/video/10255523/ice-festival-kicks-off-in-dartmouth-n-s/,neutral,0.15288812,0.0034162474,0.84369546,0.023363133029299377
Global,2024-01-27,"Man convicted of murdering Kaylin Gillis, 20, who drove down wrong driveway",https://globalnews.ca/news/10247432/kaylin-gillis-murder-kevin-monahan-convicted-wrong-driveway/,negative,0.0076405755,0.7644949,0.22786443,-0.5843941235293109
Global,2024-01-27,‘Very sad day’: N.B. synagogue vandalized on International Holocaust Remembrance Day,https://globalnews.ca/news/10255221/fredericton-sgoolai-israel-synagogue-vandalized-international-holocaust-remembrance-day/,negative,0.004934432,0.919487,0.07557832,-0.8454322253446502
Global,2024-01-27,"Nova Scotia to receive heavy snow, high winds into Monday",https://globalnews.ca/news/10255377/winter-storm-watch-nova-scotia-snow-wind/,neutral,0.041329194,0.15757047,0.8011004,-0.023120346459784002
Global,2024-01-27,Man dies after head-on collision southeast of Montreal,https://globalnews.ca/news/10255110/fatal-collision-chambly-que/,negative,0.01733679,0.5712891,0.41137406,-0.3260707134025189
Global,2024-01-27,"STARS helicopter dispatched to Milestone, Sask. following collision",https://globalnews.ca/news/10255404/stars-helicopter-car-crash-milestone-saskatchewan/,neutral,0.023479514,0.20001371,0.7765067,-0.03945420831015234
Global,2024-01-27,U.K. suspends post-Brexit trade deal discussions with Canadian government,https://globalnews.ca/video/10255430/u-k-suspends-post-brexit-trade-deal-discussions-with-canadian-government/,neutral,0.015890019,0.17971303,0.804397,-0.032044274074948476
Global,2024-01-27,Israel-Gaza: Canada’s position stays vague over ICJ ruling,https://globalnews.ca/video/10254884/israel-gaza-canadas-position-stays-vague-over-icj-ruling/,neutral,0.014504152,0.15002681,0.83546907,-0.02229767027054308
Global,2024-01-27,Dancer with severe peanut allergy dies after eating mislabelled cookies,https://globalnews.ca/news/10253166/dancer-peanut-allergy-dies-stew-leonard-cookie-orla-baxendale/,negative,0.009091688,0.8526504,0.13825774,-0.7269302036818175
Global,2024-01-27,Global News Hour at 6 Edmonton: January 26,https://globalnews.ca/video/10254771/global-news-hour-at-6-edmonton-january-26-3/,neutral,0.041682772,0.010825929,0.94749135,0.001620251291884811
Global,2024-01-27,Disability advocacy group asks UN to investigate ‘discriminatory’ Quebec policy,https://globalnews.ca/news/10255130/disability-advocacy-group-quebecs-discrimination-un/,negative,0.010887441,0.5263527,0.46275988,-0.2769286167575018
CTV,2024-01-27,"In an RV outside Walmart, a senior dreams of housing as 'dramatic reversal' plays out",https://bc.ctvnews.ca/in-an-rv-outside-walmart-a-senior-dreams-of-housing-as-dramatic-reversal-plays-out-1.6744940,neutral,0.10643579,0.025774416,0.8677898,0.010664255640395304
CTV,2024-01-27,Fredericton synagogue vandalized on International Holocaust Remembrance Day,https://atlantic.ctvnews.ca/fredericton-synagogue-vandalized-on-international-holocaust-remembrance-day-1.6744954,negative,0.008888078,0.81813633,0.17297575,-0.6692679433956474
CTV,2024-01-27,Ontario takes action to 'improve integrity' for International students,https://barrie.ctvnews.ca/ontario-takes-action-to-improve-integrity-for-international-students-1.6745188,neutral,0.13713343,0.023876833,0.8389896,0.01823548928013352
CTV,2024-01-27,27-year-old man fatally shot inside Montreal taxi,https://montreal.ctvnews.ca/27-year-old-man-fatally-shot-inside-montreal-taxi-1.6744854,negative,0.015853222,0.5730783,0.41106865,-0.3281673011504527
CTV,2024-01-27,Man charged in Montreal with 2nd-degree murder of wife,https://montreal.ctvnews.ca/man-charged-in-montreal-with-2nd-degree-murder-of-wife-1.6744875,negative,0.0085847685,0.822545,0.16887021,-0.6765065650689337
CTV,2024-01-27,Ottawa police release new photos of missing 42-year-old man,https://ottawa.ctvnews.ca/ottawa-police-release-new-photos-of-missing-42-year-old-man-1.6743860,negative,0.014827359,0.2795813,0.70559126,-0.07794587284737275
CTV,2024-01-27,New student housing on hold at St. Clair College amid expected $40M student cap hit,https://windsor.ctvnews.ca/new-student-housing-on-hold-at-st-clair-college-amid-expected-40m-student-cap-hit-1.6745024,negative,0.01554305,0.2395414,0.74491554,-0.057138497769604335
CTV,2024-01-27,"'Risky play' can be good for kids, pediatricians say in new guidance",https://www.ctvnews.ca/canada/risky-play-can-be-good-for-kids-pediatricians-say-in-new-guidance-1.6741810,positive,0.80038154,0.004740969,0.19487752,0.6405881230816046
CTV,2024-01-27,Mexican asylum trends still concerning despite December drop: IRCC,https://www.ctvnews.ca/politics/mexican-asylum-trends-still-concerning-despite-december-drop-ircc-1.6745019,negative,0.010931825,0.42071128,0.56835693,-0.17687846331279822
CTV,2024-01-27,"Flood warning issued for New Hamburg, flood watch for Ayr",https://kitchener.ctvnews.ca/flood-warning-issued-for-new-hamburg-flood-watch-for-ayr-1.6745111,neutral,0.033323035,0.10174778,0.86492926,-0.009242181210280087
CTV,2024-01-27,Police investigating after Fredericton synagogue vandalized,/video/c2855626-fredericton-synagogue-found-vandalized-saturday?playlistId=1.6745053,negative,0.010895344,0.55873513,0.4303696,-0.31206618987456025
CTV,2024-01-27,More countries pause funds for UN Palestinian agency; Israel wants it replaced,https://www.ctvnews.ca/world/more-countries-pause-funds-for-un-palestinian-agency-israel-wants-it-replaced-1.6745102,negative,0.013628536,0.619177,0.36719444,-0.3831944181870863
CTV,2024-01-27,'Improper use of compressed Gas'; Dozens of residents displaced after 'explosion' in St. Thomas affordable housing complex,https://london.ctvnews.ca/improper-use-of-compressed-gas-dozens-of-residents-displaced-after-explosion-in-st-thomas-affordable-housing-complex-1.6745150,negative,0.00515682,0.80433923,0.19050395,-0.6469350042729616
CTV,2024-01-27,Toronto mayor says she's not giving up fight to keep Ontario Science Centre where it is,https://toronto.ctvnews.ca/toronto-mayor-says-she-s-not-giving-up-fight-to-keep-ontario-science-centre-where-it-is-1.6745195,positive,0.2732337,0.010729825,0.71603656,0.07454150872306542
CTV,2024-01-27,A Canadian with strep A says he was turned away from hospital. He's one of many who had treatment issues,https://www.ctvnews.ca/health/a-canadian-with-strep-a-says-he-was-turned-away-from-hospital-he-s-one-of-many-who-had-treatment-issues-1.6743635,negative,0.01029041,0.64308286,0.3466267,-0.41344970684548343
CTV,2024-01-27,"Fredericton man with Down Syndrome, dementia spent 131 days in hospital; his family says he didn't need to",https://atlantic.ctvnews.ca/more/fredericton-man-with-down-syndrome-dementia-spent-131-days-in-hospital-his-family-says-he-didn-t-need-to-1.6740612,negative,0.013402231,0.65007335,0.33652434,-0.4224157970245219
CTV,2024-01-27,'Everyone has a right to live': Protesters demand answers in police shooting of Nigerian student,https://winnipeg.ctvnews.ca/everyone-has-a-right-to-live-protesters-demand-answers-in-police-shooting-of-nigerian-student-1.6745237,negative,0.043982964,0.24623767,0.70977926,-0.058698507515025256
CTV,2024-01-27,"Report details cost estimates, risks of proposed Manitoba landfill search for remains",https://winnipeg.ctvnews.ca/report-details-cost-estimates-risks-of-proposed-manitoba-landfill-search-for-remains-1.6744055,negative,0.011940898,0.41012466,0.5779345,-0.16805962761829107
CTV,2024-01-27,Newly released photos show site of N.W.T. plane crash,/video/c2855469-ctv-national-news--families-shaken-after-nwt-crash?playlistId=1.6738817,neutral,0.023921974,0.2000256,0.7760523,-0.039438001722094995
CTV,2024-01-27,Here's how a powerful jet stream could impact Canadian weather,https://www.ctvnews.ca/canada/here-s-how-a-powerful-jet-stream-could-impact-canadian-weather-1.6744524,neutral,0.05514033,0.05121848,0.8936412,0.00041712352359279947
CTV,2024-01-27,Police lay manslaughter charge in death of Winnipeg restaurant owner,https://winnipeg.ctvnews.ca/police-lay-manslaughter-charge-in-death-of-winnipeg-restaurant-owner-1.6744962,negative,0.00940191,0.7169711,0.2736271,-0.5139590769407043
CTV,2024-01-27,'Now that's a fish!' Quebec fishermen reel in 109-pound Atlantic halibut,https://montreal.ctvnews.ca/now-that-s-a-fish-quebec-fishermen-reel-in-109-pound-atlantic-halibut-1.6737786,positive,0.34997535,0.02667006,0.6233545,0.12177148022280981
CTV,2024-01-27,Kingsbury continues strong World Cup season with bronze in moguls,https://www.ctvnews.ca/sports/kingsbury-continues-strong-world-cup-season-with-bronze-in-moguls-1.6744863,positive,0.8794936,0.0023479774,0.11815839,0.7735034755895307
CTV,2024-01-27,Woman left stranded overnight on gondola at U.S. ski resort,/video/c2855604-u-s--woman-stuck-overnight-on-chairlift,negative,0.011458682,0.5298016,0.45873973,-0.28055842578217316
CTV,2024-01-27,Mystery deaths of 3 Chiefs fans fuels speculation but police say there's still no sign of foul play,https://www.ctvnews.ca/sports/mystery-deaths-of-3-chiefs-fans-fuels-speculation-but-police-say-there-s-still-no-sign-of-foul-play-1.6745230,negative,0.009803852,0.4678187,0.5223775,-0.2187581998344399
CTV,2024-01-27,Man and dog treated for hypothermia after falling through ice on Ottawa River,https://ottawa.ctvnews.ca/man-and-dog-treated-for-hypothermia-after-falling-through-ice-on-ottawa-river-1.6744936,negative,0.026346048,0.43121666,0.54243726,-0.18525370272592845
CTV,2024-01-27,Winter Storm Watch issued in Nova Scotia as heavy snow likely for Monday,https://atlantic.ctvnews.ca/winter-storm-watch-issued-in-nova-scotia-as-heavy-snow-likely-for-monday-1.6745143,neutral,0.043138657,0.18942389,0.7674375,-0.034020457588855635
CTV,2024-01-27,Police launch sudden death investigation in Bradford,https://barrie.ctvnews.ca/police-launch-sudden-death-investigation-in-bradford-1.6744915,negative,0.01197526,0.43209913,0.5559257,-0.1865662044692229
CTV,2024-01-27,"Name of Vancouver Island creek deemed offensive, could be changed",https://vancouverisland.ctvnews.ca/name-of-vancouver-island-creek-deemed-offensive-could-be-changed-1.6739119,negative,0.009798654,0.6393948,0.35080653,-0.40872972204293845
CTV,2024-01-27,Rural N.B. homeowner questions property assessment increase,https://atlantic.ctvnews.ca/more/rural-n-b-homeowner-questions-property-assessment-increase-1.6744280,neutral,0.019456381,0.09653919,0.8840045,-0.00894126143887064
CTV,2024-01-27,'Absolutely devastating': Fire destroys iconic Steveston grocery store,https://bc.ctvnews.ca/absolutely-devastating-fire-destroys-iconic-steveston-grocery-store-1.6744956,negative,0.011014251,0.86407596,0.1249099,-0.7465058794287516
CTV,2024-01-27,Here's where you can see the world's largest cruise ship,https://www.ctvnews.ca/lifestyle/here-s-where-you-can-see-the-world-s-largest-cruise-ship-1.6744869,positive,0.67097116,0.004187694,0.32484105,0.45018481382319564
CTV,2024-01-27,"Killer Ibrahim Ali to be moved from psychiatric hospital to detention centre, judge rules",https://bc.ctvnews.ca/killer-ibrahim-ali-to-be-moved-from-psychiatric-hospital-to-detention-centre-judge-rules-1.6744593,negative,0.012205722,0.46094486,0.5268494,-0.21232119881640088
CTV,2024-01-27,'Sephora kids' taking over stores and making a mess,/video/c2855582-concerns-with-pre-teens-using-cosmetics-for-adults?playlistId=1.6721006,negative,0.012546631,0.8218664,0.1655868,-0.6753070700477295
CTV,2024-01-27,Beaver seen carrying large branch in downtown Toronto,https://toronto.ctvnews.ca/beaver-seen-carrying-large-branch-in-downtown-toronto-1.6743984,neutral,0.045542125,0.02973184,0.92472595,0.0011901041695348002
CTV,2024-01-27,Canada 'vastly underestimating' oil sands carbon emissions: study,https://www.ctvnews.ca/climate-and-environment/canada-vastly-underestimating-oil-sands-carbon-emissions-study-1.6744985,negative,0.010393283,0.5956323,0.39397445,-0.35466981695884314
CTV,2024-01-27,"Zero-emission goal still eludes the EU, where most cars emit the same CO2 levels as 12 years ago",https://www.ctvnews.ca/autos/zero-emission-goal-still-eludes-the-eu-where-most-cars-emit-the-same-co2-levels-as-12-years-ago-1.6741312,negative,0.03160641,0.41779226,0.55060124,-0.1735514426855289
CTV,2024-01-27,Police investigation in Exchange District,https://winnipeg.ctvnews.ca/police-investigation-in-exchange-district-1.6745051,neutral,0.0396134,0.08752989,0.87285674,-0.006092259003576128
CTV,2024-01-27,"Filmmakers want help finding 'The Human Fly' who could be in Fergus, Ont.",https://kitchener.ctvnews.ca/filmmakers-want-help-finding-the-human-fly-who-could-be-in-fergus-ont-1.6737840,neutral,0.05596369,0.029680049,0.9143563,0.002251028602911931
CTV,2024-01-27,13 people injured when more than 40 vehicles crash on Chesapeake Bay bridge in Maryland,https://www.ctvnews.ca/world/13-people-injured-when-more-than-40-vehicles-crash-on-chesapeake-bay-bridge-in-maryland-1.6745157,negative,0.008594008,0.7643033,0.22710264,-0.5840857176056176
CTV,2024-01-27,Holocaust Remembrance Day has sombre tone as war rages on: antisemitism envoy,https://www.ctvnews.ca/canada/holocaust-remembrance-day-has-sombre-tone-as-war-rages-on-antisemitism-envoy-1.6745055,negative,0.014050858,0.6869383,0.29901102,-0.4716866821256467
CTV,2024-01-27,Man charged with first-degree murder in Charlottetown man's 1988 death,https://atlantic.ctvnews.ca/man-charged-with-first-degree-murder-in-charlottetown-man-s-1988-death-1.6743362,negative,0.00790074,0.7583494,0.23374978,-0.5750314865516515
CTV,2024-01-27,"Quebec Cardinal Gerald Lacroix denies sex assault allegations, stepping aside from his duties",https://montreal.ctvnews.ca/quebec-cardinal-gerald-lacroix-denies-sex-assault-allegations-stepping-aside-from-his-duties-1.6744174,negative,0.012184503,0.37018007,0.6176353,-0.13688486514075393
CTV,2024-01-27,Where to watch the state funeral for former NDP leader Ed Broadbent,https://www.ctvnews.ca/politics/where-to-watch-the-state-funeral-for-former-ndp-leader-ed-broadbent-1.6743679,neutral,0.02406681,0.11816895,0.8577642,-0.013384695228822352
CTV,2024-01-27,Ontario man pleads guilty in 'brazen' fraud scheme in the U.S.,https://www.ctvnews.ca/canada/ontario-man-pleads-guilty-in-brazen-fraud-scheme-in-the-u-s-1.6744564,negative,0.026458336,0.3817557,0.59178597,-0.14503737899287827
CTV,2024-01-27,"Canada suspends cash for UN agency serving Palestinians, amid probe into Hamas attack",https://www.ctvnews.ca/politics/canada-suspends-cash-for-un-agency-serving-palestinians-amid-probe-into-hamas-attack-1.6744404,negative,0.010018633,0.55677557,0.4332057,-0.30989871085686893
CTV,2024-01-27,"Man charged in 20-plus calls of false threats in U.S., Canada pleads guilty",https://www.ctvnews.ca/world/man-charged-in-20-plus-calls-of-false-threats-in-u-s-canada-pleads-guilty-1.6744742,negative,0.02564351,0.33016852,0.64418805,-0.10835364146468862
CTV,2024-01-27,Friday shooting at west Edmonton motel likely 'targeted':EPS,https://edmonton.ctvnews.ca/friday-shooting-at-west-edmonton-motel-likely-targeted-eps-1.6745090,neutral,0.013279457,0.13847007,0.84825045,-0.018997619751992545
CTV,2024-01-27,"Tesla recalling nearly 200,000 vehicles in the U.S. because software glitch can cause backup camera to go dark",https://www.ctvnews.ca/autos/tesla-recalling-nearly-200-000-vehicles-in-the-u-s-because-software-glitch-can-cause-backup-camera-to-go-dark-1.6743221,negative,0.008204575,0.7718124,0.21998295,-0.5956271020831441
CTV,2024-01-27,"Foiled by soil: Failed vandal in Trenton, Ont. caught on camera",https://ottawa.ctvnews.ca/foiled-by-soil-failed-vandal-in-trenton-ont-caught-on-camera-1.6735787,negative,0.00887382,0.7659309,0.22519517,-0.5865714754061457
CTV,2024-01-27,How a lost dog from the Saskatchewan countryside ended up in downtown Toronto,https://toronto.ctvnews.ca/how-a-lost-dog-from-the-saskatchewan-countryside-ended-up-in-downtown-toronto-1.6742039,negative,0.023886912,0.2984529,0.67766017,-0.08850355683216904
CTV,2024-01-27,Nazi death camp survivors mark 79th anniversary of Auschwitz liberation on Holocaust Remembrance Day,https://www.ctvnews.ca/world/nazi-death-camp-survivors-mark-79th-anniversary-of-auschwitz-liberation-on-holocaust-remembrance-day-1.6744865,negative,0.02602494,0.5502546,0.4237205,-0.302102793505437
CTV,2024-01-27,"Atmospheric rivers roll over B.C., melting snow and triggering flood advisories",https://bc.ctvnews.ca/atmospheric-rivers-roll-over-b-c-melting-snow-and-triggering-flood-advisories-1.6744934,negative,0.017503994,0.33642527,0.64607084,-0.11287553713048482
CTV,2024-01-27,Winter in the Woods Festival brings out the best of Bragg Creek,https://calgary.ctvnews.ca/winter-in-the-woods-festival-brings-out-the-best-of-bragg-creek-1.6745196,positive,0.77171165,0.005305371,0.22298291,0.5955107886886921
CTV,2024-01-27,"After LA police raid home of Black Lives Matter attorney, a judge orders photographs destroyed",https://www.ctvnews.ca/world/after-la-police-raid-home-of-black-lives-matter-attorney-a-judge-orders-photographs-destroyed-1.6745185,negative,0.008472512,0.7221042,0.26942345,-0.5213625741529047
CTV,2024-01-27,"Pallet shelter protests in Whitney Pier, N.S., continue",https://atlantic.ctvnews.ca/pallet-shelter-protests-in-whitney-pier-n-s-continue-1.6745193,negative,0.011335839,0.4566719,0.5319922,-0.20842074345542017
CTV,2024-01-27,Sunday final day for long-running Edmonton Downtown Farmers Market,https://edmonton.ctvnews.ca/sunday-final-day-for-long-running-edmonton-downtown-farmers-market-1.6745211,neutral,0.15281431,0.0050987056,0.84208703,0.023326211142364883
CTV,2024-01-27,Steve Pinsonneault is ready to 'Get It Done',https://london.ctvnews.ca/steve-pinsonneault-is-ready-to-get-it-done-1.6745114,positive,0.53538644,0.0111702075,0.45344338,0.28651385431632015
CTV,2024-01-27,Single dad struggling to find shelter or rental in Toronto,/video/c2855284-single-dad-says-no-one-willing-to-rent-to-them,negative,0.037978657,0.31116375,0.6508577,-0.0953804791346542
CTV,2024-01-27,Canada to re-start Turkiye arms exports after Sweden NATO backing: sources,https://www.ctvnews.ca/world/canada-to-re-start-turkiye-arms-exports-after-sweden-nato-backing-sources-1.6744898,neutral,0.110692605,0.0140569415,0.8752505,0.012055248748513048
CTV,2024-01-27,Elon Musk visits Auschwitz after uproar over antisemitic messages on X,https://www.ctvnews.ca/sci-tech/elon-musk-visits-auschwitz-after-uproar-over-antisemitic-messages-on-x-1.6736616,negative,0.012471671,0.630548,0.35698035,-0.3974352196081554
CTV,2024-01-27,Trudeau and Singh's teams quietly planning electoral reform legislation,https://www.ctvnews.ca/politics/trudeau-and-singh-s-teams-quietly-planning-electoral-reform-legislation-1.6744379,neutral,0.043524217,0.06937273,0.88710296,-0.002918220408961947
CTV,2024-01-27,"Man walking his dog in Brampton struck by gunfire, chased and almost shot again: police",https://toronto.ctvnews.ca/man-walking-his-dog-in-brampton-struck-by-gunfire-chased-and-almost-shot-again-police-1.6745251,negative,0.013340664,0.52841544,0.458244,-0.2790448597826778
CTV,2024-01-27,Yorkton Terriers seek help in midst of 'dire' financial situation,https://regina.ctvnews.ca/yorkton-terriers-seek-help-in-midst-of-dire-financial-situation-1.6745210,negative,0.017358106,0.51327485,0.46936706,-0.2631497666197502
CTV,2024-01-27,Four suspects sought after driver assaulted in alleged armed robbery: Windsor police,https://windsor.ctvnews.ca/four-suspects-sought-after-driver-assaulted-in-alleged-armed-robbery-windsor-police-1.6745242,negative,0.0151015,0.41930017,0.56559837,-0.17558456439710213
CTV,2024-01-27,Toronto mother of 18 to turn 100 years old in February,https://toronto.ctvnews.ca/toronto-mother-of-18-to-turn-100-years-old-in-february-1.6744559,neutral,0.1312762,0.019818518,0.8489053,0.016840663544083867
CTV,2024-01-27,Calgary ski jumper Alexandria Loutitt wins World Cup bronze in Slovenia,https://calgary.ctvnews.ca/calgary-ski-jumper-alexandria-loutitt-wins-world-cup-bronze-in-slovenia-1.6745184,positive,0.44915348,0.0040419027,0.5468045,0.2017225672373506
