source,date,headline,url,chosen_label,positive,negative,neutral,compound
Global,2024-05-24,Canada restoring citizenship to ‘lost Canadians’,https://globalnews.ca/video/10521675/canada-restoring-citizenship-to-lost-canadians/,neutral,0.0769846,0.052952692,0.87006277,0.0031226395058059353
Global,2024-05-24,B.C. boxer Terris Smith hoping for shot at Olympic glory,https://globalnews.ca/news/10521523/this-is-bc-terris-smith-boxing/,positive,0.2556334,0.0050451467,0.73932153,0.06532296634680002
Global,2024-05-24,‘Rooftop Ninja’: Woman lives undetected in Michigan store sign for a year,https://globalnews.ca/news/10518396/woman-living-grocery-store-sign-michigan/,negative,0.02093309,0.37235546,0.60671145,-0.13821039510071031
Global,2024-05-24,Dump truck crash survivor recounts harrowing experience,https://globalnews.ca/video/10521642/dump-truck-crash-survivor-recounts-harrowing-experience/,negative,0.011753822,0.85866,0.12958612,-0.7371589024410028
Global,2024-05-24,‘No excuse for driving drunk’: Ontario announces new legislation against impaired driving,https://globalnews.ca/video/10497879/no-excuse-for-driving-drunk-ontario-announces-new-legislation-against-impaired-driving/,negative,0.04580538,0.39839903,0.55579567,-0.15662363081673902
Global,2024-05-24,Minister Miller introduces bill to restore citizenship to ‘Lost Canadians’,https://globalnews.ca/video/10519844/minister-miller-introduces-bill-to-restore-citizenship-to-lost-canadians/,neutral,0.08525042,0.024198083,0.8905515,0.006682086281515787
Global,2024-05-24,"Economy is ‘strong, resilient’ according to credit rating agency: Freeland",https://globalnews.ca/video/10495558/economy-is-strong-resilient-according-to-credit-rating-agency-freeland/,positive,0.7413254,0.006474724,0.2521998,0.549521460215324
Global,2024-05-24,Scottie Scheffler arrest: New video footage of incident released,https://globalnews.ca/news/10519637/scottie-scheffler-arrest-video-footage/,neutral,0.015551963,0.15118754,0.8332605,-0.022615810247939017
Global,2024-05-24,Canada will reinstate citizenship rights to ‘lost Canadians’,https://globalnews.ca/news/10519355/citizenship-bill-canada/,neutral,0.04829734,0.074663594,0.87703913,-0.0032420176795073807
Global,2024-05-24,Growing B.C. drought concerns,https://globalnews.ca/video/10521629/growing-b-c-drought-concerns/,negative,0.019962467,0.39804995,0.58198744,-0.158045319710455
Global,2024-05-24,"Most Canadians ‘really need’ a vacation, poll shows. But can they afford it?",https://globalnews.ca/news/10520614/summer-vacation-2024-finances-ipsos/,neutral,0.07904537,0.17711443,0.74384016,-0.02512135411394123
Global,2024-05-24,"Manitoba students find new ways to learn new skills, develop passions with eSports",https://globalnews.ca/news/10520585/students-learn-skills-develop-passions-esports/,positive,0.7088392,0.006244122,0.2849167,0.5024139913168675
Global,2024-05-24,"Travel industry, Alberta government call for changes as plane ticket prices rise",https://globalnews.ca/news/10521539/plane-tickets-cost-alberta-travel/,neutral,0.044063676,0.103013195,0.8529231,-0.008670112784887829
Global,2024-05-24,Toronto officially receiving WNBA team in 2026,https://globalnews.ca/video/10521680/toronto-officially-receiving-wnba-team-in-2026/,neutral,0.1627093,0.0060069445,0.8312839,0.026438205895262357
Global,2024-05-24,Can parking and vehicle fees support public transit in Calgary?,https://globalnews.ca/video/10521448/can-parking-and-vehicle-fees-support-public-transit-in-calgary/,neutral,0.053657465,0.043499514,0.90284306,0.0009869153794954677
Global,2024-05-24,Does Alberta have a wildland firefighter ‘retention problem?’,https://globalnews.ca/news/10518174/alberta-wildland-firefighters-rentention-pay-contract/,negative,0.0118554905,0.25849602,0.7296484,-0.06667965999725034
Global,2024-05-24,Singh calls for action against ‘greedy’ grocery CEOs amid Loblaw deal with Rogers/Bell-owned telecom,https://globalnews.ca/video/10518342/singh-calls-for-action-against-greedy-grocery-ceos-amid-loblaw-deal-with-rogers-bell-owned-telecom/,negative,0.032168888,0.2898595,0.67797154,-0.08298370932731913
Global,2024-05-24,Calgary Hitmen hire former Seattle Kraken assistant Paul McFarland as head coach,https://globalnews.ca/video/10521637/calgary-hitmen-hire-former-seattle-kraken-assistant-paul-mcfarland-as-head-coach/,neutral,0.023492772,0.014845886,0.9616615,0.00033150848135482525
Global,2024-05-24,Addictions minister had ‘deep concerns’ with Toronto’s decriminalization pitch,https://globalnews.ca/news/10522005/toronto-decriminalization-pitch-addictions-minister/,negative,0.015223739,0.4225748,0.5622015,-0.17833767728760108
Global,2024-05-24,Canada set to see above-normal hurricane season: ‘Be prepared’,https://globalnews.ca/news/10519615/atlantic-hurricane-season-forecast-2024/,neutral,0.15833928,0.015427006,0.82623374,0.024833329769009538
Global,2024-05-24,Figuring out the future of Hangar 14 and the Alberta Aviation Museum,https://globalnews.ca/video/10521564/figuring-out-the-future-of-hangar-14-and-the-alberta-aviation-museum/,neutral,0.0915017,0.008775247,0.89972305,0.00829555572101981
Global,2024-05-24,Here’s why one B.C. centenarian made Chinese Canadian history,https://globalnews.ca/news/10521148/bc-immigration-certificate-chinese-canadian-history/,neutral,0.08601874,0.026521694,0.8874596,0.006695822912673455
Global,2024-05-24,‘God’s influencer’: Pope clears way for the first-ever millennial saint,https://globalnews.ca/news/10520842/carlo-acutis-millennial-saint-pope-francis-gods-influencer/,positive,0.62320256,0.005206359,0.37159103,0.388354364488805
Global,2024-05-24,Plan to wake Robert Pickton from coma after prison attack: Quebec police,https://globalnews.ca/news/10519819/robert-pickton-coma-quebec-police/,neutral,0.023609936,0.0928711,0.883519,-0.008067610008156478
Global,2024-05-24,Stanley Cup playoffs: Are the Edmonton Oilers really Canada’s team?,https://globalnews.ca/video/10521679/stanley-cup-playoffs-are-the-edmonton-oilers-really-canadas-team/,neutral,0.04380431,0.047690023,0.9085056,-0.0003555208592682657
Global,2024-05-24,Singh: Loblaw deal with Rogers/Bell-owned company needs competition probe,https://globalnews.ca/news/10518034/singh-competition-prob-loblaw-rogers-bell-deal/,neutral,0.022923216,0.16157123,0.8155057,-0.02557977137024192
Global,2024-05-24,Vancouver planners accused of protecting Shaughnessy neighbourhood from densification,https://globalnews.ca/video/10521647/vancouver-planners-accused-of-protecting-shaughnessy-neighbourhood-from-densification/,negative,0.020205766,0.24705572,0.7327385,-0.060628261293402375
Global,2024-05-24,"Canada, U.S. to see ‘extraordinary’ hurricane season, NOAA predicts",https://globalnews.ca/video/10521678/canada-u-s-to-see-extraordinary-hurricane-season-noaa-predicts/,neutral,0.11227556,0.014321769,0.87340266,0.012400690543017845
Global,2024-05-24,This is BC: Amateur boxer is Olympic hopeful,https://globalnews.ca/video/10521663/this-is-bc-amateur-boxer-is-olympic-hopeful/,positive,0.37217686,0.008085228,0.61973786,0.1384502628971518
Global,2024-05-24,‘Scary’ prospects for Calgary seniors facing possible eviction,https://globalnews.ca/news/10521341/senior-couple-facing-eviction/,negative,0.008386662,0.7306655,0.26094788,-0.5338017007873788
Global,2024-05-24,Police release video of Scottie Scheffler’s arrest outside PGA championship,https://globalnews.ca/video/10520216/police-release-video-of-scottie-schefflers-arrest-outside-pga-championship/,neutral,0.015794279,0.079940334,0.90426534,-0.006141000669587449
Global,2024-05-24,"Competition Bureau probing conduct of Loblaws, Sobeys owners. Why?",https://globalnews.ca/news/10522029/loblaws-sobeys-competition-bureau-probe/,neutral,0.014719991,0.21502632,0.7702537,-0.046019633714413644
Global,2024-05-24,Global News Hour at 6 Calgary: May 23,https://globalnews.ca/video/10521658/global-news-hour-at-6-calgary-may-23-3/,neutral,0.037608508,0.009509707,0.95288175,0.0013239662405380992
Global,2024-05-24,Summerland council votes to proceed with costly pool repairs,https://globalnews.ca/news/10521510/summerland-council-votes-to-proceed-with-costly-pool-repairs/,negative,0.018006833,0.40370986,0.57828325,-0.16265742698834273
Global,2024-05-24,"Canada, U.S. to see above-normal Atlantic hurricane season, officials stress to ‘be prepared’",https://globalnews.ca/video/10521034/canada-u-s-to-see-above-normal-atlantic-hurricane-season-officials-stress-to-be-prepared/,neutral,0.078532524,0.044756744,0.8767107,0.004164191880266399
CTV,2024-05-24,Tennessee attorney general looking into attempt to sell Graceland in foreclosure auction,https://www.ctvnews.ca/entertainment/tennessee-attorney-general-looking-into-attempt-to-sell-graceland-in-foreclosure-auction-1.6898849,neutral,0.014158657,0.16356464,0.82227683,-0.026552905360865964
CTV,2024-05-24,Sault tourism expecting fewer cruise ships this year,https://northernontario.ctvnews.ca/sault-tourism-expecting-fewer-cruise-ships-this-year-1.6898630,negative,0.028236564,0.4091971,0.5625663,-0.1666449790833724
CTV,2024-05-24,New gold mine in northern Ontario could become biggest in Canada,https://northernontario.ctvnews.ca/new-gold-mine-in-northern-ontario-could-become-biggest-in-canada-1.6899332,positive,0.40769595,0.007963101,0.58434093,0.16615258798683286
CTV,2024-05-24,Removing religion as hate speech defence an idea worth exploring: antisemitism envoy,https://www.ctvnews.ca/politics/removing-religion-as-hate-speech-defence-an-idea-worth-exploring-antisemitism-envoy-1.6897933,neutral,0.06769921,0.13679262,0.79550815,-0.014129038713335262
CTV,2024-05-24,Winnipeg flair on the menu at neighbourhood Houston restaurant,https://winnipeg.ctvnews.ca/winnipeg-flair-on-the-menu-at-neighbourhood-houston-restaurant-1.6896253,neutral,0.12618308,0.009233047,0.8645839,0.01583691552615063
CTV,2024-05-24,Ont. mother denied boarding flight after ticket mistake,/video/c2927931-mom-misses-flight-due-to-error-on-plane-ticket,negative,0.007939602,0.65012586,0.34193453,-0.4226006176133872
CTV,2024-05-24,Child struck by recycling truck in Ont. neighbourhood,/video/c2928094-young-child-in-life-threatening-condition-after-accident,negative,0.012994943,0.6157944,0.37121058,-0.3790339353343768
CTV,2024-05-24,Bandits claim Alberta Cup with 7-3 defeat of Crusaders,https://calgary.ctvnews.ca/bandits-claim-alberta-cup-with-7-3-defeat-of-crusaders-1.6898921,neutral,0.064675994,0.012179367,0.9231446,0.004034650370581261
CTV,2024-05-24,New bill would let Canadians pass citizenship rights down to children born abroad,https://www.ctvnews.ca/politics/new-bill-would-let-canadians-pass-citizenship-rights-down-to-children-born-abroad-1.6897595,neutral,0.107346,0.018195545,0.8744585,0.011192082090583977
CTV,2024-05-24,"Gildan CEO, board resign ahead of shareholder vote, paving way for ex-CEO's return",https://montreal.ctvnews.ca/gildan-ceo-board-resign-ahead-of-shareholder-vote-paving-way-for-ex-ceo-s-return-1.6898701,neutral,0.03284221,0.13696617,0.8301915,-0.01768113375481395
CTV,2024-05-24,"Police charge woman, 74, in hijab-pulling incident at Israeli flag raising event",https://ottawa.ctvnews.ca/police-charge-woman-74-in-hijab-pulling-incident-at-israeli-flag-raising-event-1.6898200,negative,0.009798907,0.6656787,0.32452238,-0.4430321258889265
CTV,2024-05-24,$33K drug seizure in Simcoe County results in charges for Barrie man,https://barrie.ctvnews.ca/33k-drug-seizure-in-simcoe-county-results-in-charges-for-barrie-man-1.6898881,negative,0.012612434,0.5571536,0.43023401,-0.31026100791787314
CTV,2024-05-24,A deep-dive into a failed 'Star Wars' hotel is going viral,https://www.ctvnews.ca/lifestyle/a-deep-dive-into-a-failed-star-wars-hotel-is-going-viral-1.6898976,negative,0.04196732,0.48292714,0.47510558,-0.23145734273138174
CTV,2024-05-24,Canadian Hurricane Centre says active storm season predicted for East Coast,https://atlantic.ctvnews.ca/canadian-hurricane-centre-says-active-storm-season-predicted-for-east-coast-1.6898303,neutral,0.04774866,0.03681504,0.91543627,0.0009245876278871634
CTV,2024-05-24,Canadian Hurricane Centre says active storm season ahead,/video/c2928100-the-2024-atlantic-hurricane-season-outlook?playlistId=1.6899277,neutral,0.05887386,0.045383915,0.89574224,0.0014064312722761318
CTV,2024-05-24,7-year-old Pokémon prodigy heading to Hawaii for world championship tournament,https://windsor.ctvnews.ca/7-year-old-pok%C3%A9mon-prodigy-heading-to-hawaii-for-world-championship-tournament-1.6893180,positive,0.36480358,0.0031878129,0.63200855,0.13307151320429966
CTV,2024-05-24,"Fire at former Windsor bar, soon to be boutique hotel",https://windsor.ctvnews.ca/fire-at-former-windsor-bar-soon-to-be-boutique-hotel-1.6899218,negative,0.018219074,0.24320771,0.73857313,-0.05881807488437474
CTV,2024-05-24,"BMW unveils its latest 'Art Car,' courtesy of abstract artist Julie Mehretu",https://www.ctvnews.ca/autos/bmw-unveils-its-latest-art-car-courtesy-of-abstract-artist-julie-mehretu-1.6896612,positive,0.5652707,0.0029548383,0.4317745,0.3195222244513829
CTV,2024-05-24,Newfoundland grandmothers can wail on the accordion. A historian wants them on stage,https://www.ctvnews.ca/canada/newfoundland-grandmothers-can-wail-on-the-accordion-a-historian-wants-them-on-stage-1.6893626,negative,0.043578293,0.5500105,0.4064113,-0.3006124571336173
CTV,2024-05-24,"WATCH: Speeding car skids across road, rolls into U.K. home",/video/c2927550-watch--speeding-car-rolls-into-u-k--home,negative,0.016306283,0.47086534,0.51282847,-0.22144823206624054
CTV,2024-05-24,Ontario mother denied boarding flight with her family after ticket mistake,https://toronto.ctvnews.ca/ontario-mother-denied-boarding-flight-with-her-family-after-ticket-mistake-1.6898706,negative,0.0070924405,0.7143537,0.27855375,-0.5102509840233527
CTV,2024-05-24,"Remaining wrongful death lawsuit filed after deadly Astroworld concert has been settled, lawyer says",https://www.ctvnews.ca/entertainment/remaining-wrongful-death-lawsuit-filed-after-deadly-astroworld-concert-has-been-settled-lawyer-says-1.6898808,negative,0.024747614,0.23597793,0.7392743,-0.05507316889657066
CTV,2024-05-24,Be prepared when using your credit card while travelling to ensure trip goes smoothly,https://www.ctvnews.ca/canada/be-prepared-when-using-your-credit-card-while-travelling-to-ensure-trip-goes-smoothly-1.6899187,positive,0.38667256,0.018651158,0.5946762,0.14916783309634418
CTV,2024-05-24,Allegedly armed man faces series of charges after fight near public school,https://barrie.ctvnews.ca/allegedly-armed-man-faces-series-of-charges-after-fight-near-public-school-1.6899177,negative,0.0116947135,0.54587084,0.44243446,-0.2978381919484363
CTV,2024-05-24,Hackers release corporate data stolen from London Drugs,https://bc.ctvnews.ca/hackers-release-corporate-data-stolen-from-london-drugs-1.6898558,negative,0.015708737,0.542182,0.4421093,-0.29371455576973915
CTV,2024-05-24,OpenAI to start using news content from News Corp. as part of a multi-year deal,https://www.ctvnews.ca/sci-tech/openai-to-start-using-news-content-from-news-corp-as-part-of-a-multi-year-deal-1.6898514,neutral,0.15267171,0.0087524345,0.8385759,0.02323203936957885
CTV,2024-05-24,Man treated for injuries following shooting in Ottawa's east end,https://ottawa.ctvnews.ca/man-treated-for-injuries-following-shooting-in-ottawa-s-east-end-1.6899180,negative,0.016695395,0.34926546,0.6340391,-0.12170764299668235
CTV,2024-05-24,What is 'slapped cheek disease' and should parents be concerned?,https://www.ctvnews.ca/health/what-is-slapped-cheek-disease-and-should-parents-be-concerned-1.6898664,negative,0.008056849,0.55008745,0.44185582,-0.30253121070736455
CTV,2024-05-24,Hidden gem: Rising Dough Scottish Bakery bringing traditional food to Waterloo Region for 28 years,https://kitchener.ctvnews.ca/hidden-gem-rising-dough-scottish-bakery-bringing-traditional-food-to-waterloo-region-for-28-years-1.6898978,positive,0.8425495,0.0024650204,0.15498552,0.7098835634428351
CTV,2024-05-24,Unsettled start to the weekend with both frost and funnel clouds possible,https://calgary.ctvnews.ca/unsettled-start-to-the-weekend-with-both-frost-and-funnel-clouds-possible-1.6899322,negative,0.01832046,0.6211163,0.36056304,-0.38544993912165637
CTV,2024-05-24,31-year-old man wanted by Lethbridge police turns himself in,https://calgary.ctvnews.ca/31-year-old-man-wanted-by-lethbridge-police-turns-himself-in-1.6898237,negative,0.015372453,0.38906726,0.5955603,-0.1511370111666892
CTV,2024-05-24,Alberta gets D- on latest poverty report card; food banks trying to keep up with demand,https://calgary.ctvnews.ca/alberta-gets-d-on-latest-poverty-report-card-food-banks-trying-to-keep-up-with-demand-1.6897112,negative,0.027977271,0.49340168,0.47862095,-0.2426625428100735
CTV,2024-05-24,Unknown Newfoundland soldier from the First World War heads back home from France after 100 years,https://www.ctvnews.ca/canada/unknown-newfoundland-soldier-from-the-first-world-war-heads-back-home-from-france-after-100-years-1.6898805,neutral,0.032131072,0.18204837,0.7858206,-0.032109194633976657
CTV,2024-05-24,"Putin wants Ukraine ceasefire on current frontlines, Reuters sources say",https://www.ctvnews.ca/world/putin-wants-ukraine-ceasefire-on-current-frontlines-reuters-sources-say-1.6899166,neutral,0.055748966,0.027847476,0.9164036,0.0023324642925393047
CTV,2024-05-24,Kamloops RCMP issue public warning about 2 men allegedly at centre of 'organized crime conflict',https://bc.ctvnews.ca/kamloops-rcmp-issue-public-warning-about-2-men-allegedly-at-centre-of-organized-crime-conflict-1.6879435,negative,0.009116524,0.45374444,0.53713894,-0.2058009466101396
CTV,2024-05-24,"Thunderstorms produce lightning, downpours; risk continues into Thursday evening and night",https://atlantic.ctvnews.ca/thunderstorms-produce-lightning-downpours-risk-continues-into-thursday-evening-and-night-1.6897979,negative,0.014525796,0.71706,0.2684142,-0.5139640878888834
CTV,2024-05-24,Londoners sound off about prohibiting gas lawn mowers and yard equipment after 6 p.m.,https://london.ctvnews.ca/londoners-sound-off-about-prohibiting-gas-lawn-mowers-and-yard-equipment-after-6-p-m-1.6898202,negative,0.018295528,0.6089986,0.37270588,-0.37054456445381234
CTV,2024-05-24,Ottawa willing to add to list of medications covered by pharmacare bill: minister,https://www.ctvnews.ca/health/ottawa-willing-to-add-to-list-of-medications-covered-by-pharmacare-bill-minister-1.6898975,neutral,0.21861409,0.007527885,0.773858,0.04773545287043657
CTV,2024-05-24,Ontario patients visiting emergency rooms out of fear of being booted by family doctor,https://toronto.ctvnews.ca/ontario-patients-visiting-emergency-rooms-out-of-fear-of-being-booted-by-family-doctor-1.6898224,negative,0.021290647,0.4353665,0.5433428,-0.18909070700146913
CTV,2024-05-24,"Donations to Halifax tent encampment could result in a public health concern, says those living there",https://atlantic.ctvnews.ca/donations-to-halifax-tent-encampment-could-result-in-a-public-health-concern-says-those-living-there-1.6899022,negative,0.010082093,0.58268505,0.40723282,-0.3394202574695697
CTV,2024-05-24,Here's how much rain fell in Manitoba overnight,https://winnipeg.ctvnews.ca/here-s-how-much-rain-fell-in-manitoba-overnight-1.6899202,neutral,0.054493196,0.04308253,0.9024242,0.0011134045575178497
CTV,2024-05-24,EMS workers quit after disturbing incident caught on camera,/video/c2927666-ems-workers-quit-after-video-emerges,negative,0.0069296313,0.857904,0.13516635,-0.7359512824808725
CTV,2024-05-24,"Northern Ont. police seize weapons, $200K in drugs, Toronto pair charged",https://northernontario.ctvnews.ca/northern-ont-police-seize-weapons-200k-in-drugs-toronto-pair-charged-1.6898517,negative,0.009140766,0.5968848,0.39397457,-0.3561878074372018
CTV,2024-05-24,Treasury Board president urges managers to be flexible on exemptions for new 3-day office mandate,https://ottawa.ctvnews.ca/treasury-board-president-urges-managers-to-be-flexible-on-exemptions-for-new-3-day-office-mandate-1.6897710,neutral,0.069144145,0.019673565,0.9111823,0.004393864006194015
CTV,2024-05-24,"Up to 70 mm of rain coming to parts of Manitoba, flooding possible",https://winnipeg.ctvnews.ca/up-to-70-mm-of-rain-coming-to-parts-of-manitoba-flooding-possible-1.6897618,negative,0.028609755,0.31658843,0.6548018,-0.09940972565634532
CTV,2024-05-24,"Michigan farmworker diagnosed with bird flu, becoming 2nd U.S. case tied to dairy cows",https://www.ctvnews.ca/sci-tech/michigan-farmworker-diagnosed-with-bird-flu-becoming-2nd-u-s-case-tied-to-dairy-cows-1.6896681,negative,0.009091905,0.73802906,0.252879,-0.5446042562899152
CTV,2024-05-24,'A special bird': The unbreakable bond between purple martins and humans,https://winnipeg.ctvnews.ca/a-special-bird-the-unbreakable-bond-between-purple-martins-and-humans-1.6893339,positive,0.6817836,0.0039706924,0.31424558,0.46481321426732336
CTV,2024-05-24,"Tick season, warmer weather sparks fears about Lyme disease spread in Canada",https://www.ctvnews.ca/sci-tech/tick-season-warmer-weather-sparks-fears-about-lyme-disease-spread-in-canada-1.6896956,negative,0.01732693,0.47124687,0.5114262,-0.2217733887512594
CTV,2024-05-24,Outdated rules and mounting losses: Can anything be done to fix Canada Post?,https://www.ctvnews.ca/canada/outdated-rules-and-mounting-losses-can-anything-be-done-to-fix-canada-post-1.6899173,negative,0.0049133943,0.92204297,0.073043555,-0.8501391715449405
CTV,2024-05-24,U.S. senators write to Trudeau asking him to meet 2% GDP defence spending commitment,https://www.ctvnews.ca/politics/u-s-senators-write-to-trudeau-asking-him-to-meet-2-gdp-defence-spending-commitment-1.6898128,neutral,0.11411009,0.02787027,0.85801965,0.012244360142668054
CTV,2024-05-24,'A lot of disappointed fans': Lionel Messi will not play against Vancouver Whitecaps Saturday,https://bc.ctvnews.ca/a-lot-of-disappointed-fans-lionel-messi-will-not-play-against-vancouver-whitecaps-saturday-1.6898910,negative,0.009563237,0.7643536,0.22608308,-0.5841449852066916
CTV,2024-05-24,'Best experience ever': B.C. baker on making it to the finals of Netflix's 'Is it Cake?',https://bc.ctvnews.ca/best-experience-ever-b-c-baker-on-making-it-to-the-finals-of-netflix-s-is-it-cake-1.6896713,positive,0.9785892,0.0017694683,0.019641383,0.9576336046810269
CTV,2024-05-24,Police probe possible drownings near Sandpoint Beach,https://windsor.ctvnews.ca/police-probe-possible-drownings-near-sandpoint-beach-1.6898994,neutral,0.016595483,0.1852021,0.7982024,-0.03402441283775026
CTV,2024-05-24,Montreal photographer captures dramatic Canada goose vs. fox fight on video,https://montreal.ctvnews.ca/montreal-photographer-captures-dramatic-canada-goose-vs-fox-fight-on-video-1.6895023,neutral,0.1041076,0.009945768,0.8859467,0.010739469235437227
CTV,2024-05-24,'I maintain my innocence': Quebec cardinal releases video to clear his name after sex-abuse allegations,https://montreal.ctvnews.ca/i-maintain-my-innocence-quebec-cardinal-releases-video-to-clear-his-name-after-sex-abuse-allegations-1.6898586,positive,0.28449902,0.017565615,0.69793534,0.08063114940063798
CTV,2024-05-24,'It broke me': Friend mourns death of slain Edmonton teen,https://edmonton.ctvnews.ca/it-broke-me-friend-mourns-death-of-slain-edmonton-teen-1.6898395,negative,0.007926064,0.8144225,0.1776515,-0.6632211430522705
CTV,2024-05-24,Calgary Philharmonic takes action following investigation into 'deeply troubling' comments by 2 musicians,https://calgary.ctvnews.ca/calgary-philharmonic-takes-action-following-investigation-into-deeply-troubling-comments-by-2-musicians-1.6898762,negative,0.011840407,0.5446181,0.44354144,-0.2964687279637648
CTV,2024-05-24,Montreal-area high school students protest 'sexist' dress code,https://montreal.ctvnews.ca/montreal-area-high-school-students-protest-sexist-dress-code-1.6898023,negative,0.008401728,0.69240403,0.29919428,-0.47935271299026994
CTV,2024-05-24,McDavid scores in 2OT to lift Oilers over Stars in West Final opener,https://edmonton.ctvnews.ca/mcdavid-scores-in-2ot-to-lift-oilers-over-stars-in-west-final-opener-1.6898421,positive,0.26667565,0.004272318,0.7290521,0.07109762676557274
CTV,2024-05-24,Sask. unveils 'NASA-style' Virtual Health Hub for remote medical care,https://saskatoon.ctvnews.ca/sask-unveils-nasa-style-virtual-health-hub-for-remote-medical-care-1.6898889,neutral,0.15216193,0.006200123,0.8416378,0.023114834172310417
CTV,2024-05-24,Canada's NATO spending called out over potential Trump win,/video/c2928180-why-a-trump-win-could-impact-canada-s-nato-pledge?playlistId=1.6898241,negative,0.02360418,0.48101595,0.49537984,-0.23081920069026296
CTV,2024-05-24,"Sam Butcher, artist who created Precious Moments figurines of teardrop-eyed children, dies at 85",https://www.ctvnews.ca/lifestyle/sam-butcher-artist-who-created-precious-moments-figurines-of-teardrop-eyed-children-dies-at-85-1.6898490,neutral,0.07051227,0.098692365,0.83079535,-0.00476820276588974
CTV,2024-05-24,Premier won't commit to public inquiry in tragic death of Port Alberni boy,https://bc.ctvnews.ca/premier-won-t-commit-to-public-inquiry-in-tragic-death-of-port-alberni-boy-1.6898987,negative,0.005914698,0.7458556,0.24822968,-0.5562656364380452
CTV,2024-05-24,Picture perfect Friday ahead of showers Saturday morning,https://london.ctvnews.ca/picture-perfect-friday-ahead-of-showers-saturday-morning-1.6899155,positive,0.9843943,0.0033173226,0.012288309,0.9690212381738601
CTV,2024-05-24,From DVDs to rehearsals: Halifax theatre company transforms Video Difference building into arts hub,https://atlantic.ctvnews.ca/more/from-dvds-to-rehearsals-halifax-theatre-company-transforms-video-difference-building-into-arts-hub-1.6891796,positive,0.27186534,0.005180871,0.72295374,0.07388393658123604
