source,date,headline,url,chosen_label,positive,negative,neutral,compound
Global,2024-06-23,School cellphone bans: Which provinces are doing it and why?,https://globalnews.ca/video/10581547/school-cellphone-bans-which-provinces-are-doing-it-and-why/,negative,0.008103267,0.2777691,0.7141277,-0.07708997938511963
Global,2024-06-23,"Toronto office shooting: Alleged mortgage fraud pushed husband ‘to the edge,’ wife says",https://globalnews.ca/news/10579917/toronto-office-shooting-interview/,negative,0.0061009694,0.8119451,0.18195398,-0.6592175805347713
Global,2024-06-23,What is ‘Stiff-Person Syndrome’?,https://globalnews.ca/video/9728778/what-is-stiff-person-syndrome/,neutral,0.019901417,0.13267697,0.8474216,-0.017207115527923644
Global,2024-06-23,Government announces sudden closure of Ontario Science Centre,https://globalnews.ca/video/10581645/government-announces-sudden-closure-of-ontario-science-centre/,negative,0.013188882,0.6263802,0.36043084,-0.3921782509130267
Global,2024-06-23,What’s the summer strategy for Trudeau and Poilievre as make-or-break byelection looms?,https://globalnews.ca/video/10582472/whats-the-summer-strategy-for-trudeau-and-poilievre-as-make-or-break-byelection-looms/,neutral,0.030396199,0.043386173,0.9262176,-0.000958431229087453
Global,2024-06-23,"Canadian domestic flight prices are up, data shows",https://globalnews.ca/video/10583378/canadian-domestic-flight-prices-are-up-data-shows/,neutral,0.037657112,0.12540653,0.8369363,-0.01430874579428476
Global,2024-06-23,Calgary water crisis warning,https://globalnews.ca/video/10583435/calgary-water-crisis-warning/,neutral,0.031880274,0.21324974,0.75486994,-0.044459109094141525
Global,2024-06-23,SilverStar Mountain Resort Bike Park turns 30,https://globalnews.ca/news/10583493/silverstar-bike-park-turns-30/,positive,0.28278902,0.004422395,0.7127884,0.0799501229969728
Global,2024-06-23,"School bus crash: Pedestrian killed, ‘numerous’ injuries in pair of Highway 97 collisions",https://globalnews.ca/news/10581456/highway-97-bus-crash-lac-la-hache/,negative,0.010735997,0.70768434,0.28157964,-0.5007018817009463
Global,2024-06-23,"Suspect in Vaughan shooting charged with 2 counts of 1st degree murder, 2 counts of attempted murder",https://globalnews.ca/video/10582988/suspect-in-vaughan-shooting-charged-with-2-counts-of-1st-degree-murder-2-counts-of-attempted-murder/,negative,0.009573992,0.7824874,0.20793858,-0.6121948809388389
Global,2024-06-23,"Mother and toddler killed, 1 arrested after ‘targeted’ daytime shooting at Vaughan home",https://globalnews.ca/news/10582427/adult-and-toddler-killed-1-arrest-daytime-shooting-vaughan-home/,negative,0.008091206,0.68837243,0.3035365,-0.47379103769942255
Global,2024-06-23,Hot weather and possible storms expected in Saskatchewan Sunday,https://globalnews.ca/news/10583289/hot-weather-possible-storms-saskatchewan-sunday/,negative,0.031190142,0.3350245,0.63378537,-0.1112685954918291
Global,2024-06-23,"Calgary water emergency: City providing non-potable water at Baker Park, Ogden boat launch",https://globalnews.ca/video/10583333/calgary-water-emergency-city-providing-non-potable-water-at-baker-park-ogden-boat-launch/,negative,0.01814723,0.5464512,0.4354015,-0.2982796355040662
Global,2024-06-23,"2 teens charged with murder, manslaughter in connection with fatal stabbing of 71-year-old N.B. man",https://globalnews.ca/news/10582611/3-teens-arrested-fatal-stabbing-fredericton/,negative,0.006572338,0.8363977,0.15703003,-0.6995178424989872
Global,2024-06-23,"Crashed B.C. school bus was filled with grade 6s, 7s, superintendent says",https://globalnews.ca/news/10582809/school-bus-crash-grade-6-7-students-bc/,negative,0.021677438,0.34858984,0.62973267,-0.12104498316531931
Global,2024-06-23,Business News: Canada’s population vs housing supply,https://globalnews.ca/video/10583571/business-news-canadas-population-vs-housing-supply/,neutral,0.035252783,0.02974188,0.93500525,0.000358179834188288
Global,2024-06-23,‘Too much red tape’ behind decision to cancel Montreal’s Canada Day parade,https://globalnews.ca/news/10578993/canada-day-parade-cancelled-montreal/,negative,0.01098776,0.55686754,0.43214464,-0.30998075867208286
Global,2024-06-23,"Crashed B.C. school bus was filled with grade 6s, 7s, superintendent says",https://globalnews.ca/video/10583037/crashed-b-c-school-bus-was-filled-with-grade-6s-7s-superintendent-says/,negative,0.021677438,0.34858984,0.62973267,-0.12104498316531931
Global,2024-06-23,RCMP commissioner urges ‘caution’ on naming alleged foreign state colluders,https://globalnews.ca/news/10580452/rcmp-commissioner-nsicop-report-foreign-interference/,negative,0.011688079,0.30366716,0.68464476,-0.09207713148622076
Global,2024-06-23,Your Saskatchewan photo of the day: June 2024,https://globalnews.ca/news/10539213/your-saskatchewan-photo-of-the-day-june-2024/,neutral,0.063566744,0.010727937,0.92570525,0.003925645671272404
Global,2024-06-23,"Maximum-security prison that held killers Magnotta, Pickton evacuated due to wildfires",https://globalnews.ca/news/10583315/wildfires-evacuation-maximum-security-prison/,negative,0.010284245,0.64549446,0.34422135,-0.41655729570159394
Global,2024-06-23,Calgary water emergency: Crews still on track to finish repairs by Stampede,https://globalnews.ca/news/10583423/calgary-water-emergency-crews-repairs-stampede/,neutral,0.03336691,0.0918096,0.87482345,-0.007315654180719555
Global,2024-06-23,Cricket field expansion coming to Regina as the sport grows in Saskatchewan,https://globalnews.ca/news/10582457/cricket-field-expansion-regina/,positive,0.25851643,0.0043387488,0.73714477,0.06681193549598419
Global,2024-06-23,Former Calgary mayor Naheed Nenshi named Alberta NDP leader in landslide victory,https://globalnews.ca/news/10582416/alberta-ndp-leader-results-nenshi/,positive,0.40128383,0.005957791,0.5927583,0.16099325271927611
Global,2024-06-23,RCMP commissioner urges ‘caution’ on naming alleged foreign state colluders,https://globalnews.ca/video/10582471/rcmp-commissioner-urges-caution-on-naming-alleged-foreign-state-colluders/,negative,0.011688079,0.30366716,0.68464476,-0.09207713148622076
Global,2024-06-23,B.C. evening weather forecast: June 22,https://globalnews.ca/video/7095646/b-c-evening-weather-forecast-june-22/,neutral,0.04390581,0.0076073874,0.94848675,0.0018698499589167028
Global,2024-06-23,Field Radio Day brings amateur enthusiasts together in Montreal,https://globalnews.ca/video/10582957/field-radio-day-brings-amateur-enthusiasts-in-montreal-together-to-partake-in-long-standing-north-american-tradition/,positive,0.47741318,0.0037415067,0.5188452,0.227909399664469
Global,2024-06-23,‘This could have been anybody’s daughter’: Vigil held for Surrey homicide victim,https://globalnews.ca/news/10583481/vigil-surrey-homicide-victim/,negative,0.016473789,0.5114072,0.472119,-0.26126593456965264
Global,2024-06-23,Business Matters: May ‘another sleepy month’ for homebuyers. Will a rate cut wake them up?,https://globalnews.ca/video/10570942/business-matters-may-another-sleepy-month-for-homebuyers-will-a-rate-cut-wake-them-up/,neutral,0.040756207,0.21441044,0.74483323,-0.04431078840129743
Global,2024-06-23,Alberta NDP leadership race sees former Calgary mayor Naheed Nenshi victorious,https://globalnews.ca/video/10582982/alberta-ndp-leadership-race-sees-former-calgary-mayor-naheed-nenshi-victorious/,neutral,0.21852733,0.0073839873,0.7740886,0.04769968412499992
Global,2024-06-23,B.C. teacher files human right complaint after online hate,https://globalnews.ca/video/10583032/b-c-teacher-files-human-right-complaint-after-online-hate/,negative,0.011378074,0.7456357,0.24298625,-0.5558431305968154
Global,2024-06-23,‘I can’t move’: Ontario woman opens up about stiff person syndrome fight,https://globalnews.ca/news/10583563/stiff-person-syndrome-symptons/,negative,0.00960477,0.74548423,0.24491094,-0.5556545450713566
Global,2024-06-23,"Sporting sequins and silver, Mama Stanley is an Edmonton celebrity for playoffs",https://globalnews.ca/news/10583321/mama-stanley-edmonton-oilers-playoffs/,positive,0.39656097,0.013167129,0.5902718,0.15708727257581856
Global,2024-06-23,Fishermen rescue 38 dogs on the verge of drowning from Mississippi lake,https://globalnews.ca/news/10581159/38-dogs-rescued-mississippi-lake-fishermen/,negative,0.025627388,0.58257556,0.3917971,-0.3387375037322471
CTV,2024-06-23,"Canada joins NASA asteroid impact exercise, new satellite to hunt for planet-killers",https://www.ctvnews.ca/sci-tech/canada-joins-nasa-asteroid-impact-exercise-new-satellite-to-hunt-for-planet-killers-1.6936653,neutral,0.07014179,0.078661226,0.8511971,-0.0012677162016059285
CTV,2024-06-23,Ceremony marks start of rebuilding for Pittsburgh synagogue targeted in antisemitic mass shooting,https://www.ctvnews.ca/world/ceremony-marks-start-of-rebuilding-for-pittsburgh-synagogue-targeted-in-antisemitic-mass-shooting-1.6937901,negative,0.034294166,0.37125134,0.5944545,-0.1366514615971468
CTV,2024-06-23,"Armed militants in Dagestan kill priest and police in attacks on churches, synagogue and police post",https://www.ctvnews.ca/world/armed-militants-in-dagestan-kill-priest-and-police-in-attacks-on-churches-synagogue-and-police-post-1.6937945,negative,0.008006334,0.76379836,0.22819516,-0.5833239399469612
CTV,2024-06-23,Severe thunderstorm warning issued for Ottawa,https://ottawa.ctvnews.ca/severe-thunderstorm-warning-issued-for-ottawa-1.6937678,negative,0.03338917,0.3017482,0.66486263,-0.08993713056435126
CTV,2024-06-23,Maximum-security prison in Quebec evacuated due to forest fires,https://montreal.ctvnews.ca/maximum-security-prison-in-quebec-evacuated-due-to-forest-fires-1.6937808,negative,0.014582545,0.43989065,0.54552674,-0.19329116124870893
CTV,2024-06-23,"Job losses and killer robots: The 'Godfather of AI' describes plenty to fear, but there may be room for hope",https://www.ctvnews.ca/sci-tech/job-losses-and-killer-robots-the-godfather-of-ai-describes-plenty-to-fear-but-there-may-be-room-for-hope-1.6936054,negative,0.03197573,0.74467105,0.22335318,-0.5535125407415169
CTV,2024-06-23,"In a smoky long house, Indigenous leader seeks First Nations unity to save salmon",https://bc.ctvnews.ca/in-a-smoky-long-house-indigenous-leader-seeks-first-nations-unity-to-save-salmon-1.6937338,neutral,0.06463934,0.086140566,0.8492201,-0.0032419531029868054
CTV,2024-06-23,"Ontario may now be Canada's tornado capital, researchers say",https://toronto.ctvnews.ca/ontario-may-now-be-canada-s-tornado-capital-researchers-say-1.6937671,negative,0.029822484,0.27183872,0.6983387,-0.07300693691200788
CTV,2024-06-23,Flames engulf diplomatic residence in Rockcliffe Park on Sunday,https://ottawa.ctvnews.ca/flames-engulf-diplomatic-residence-in-rockcliffe-park-on-sunday-1.6937914,negative,0.007584894,0.72710234,0.26531282,-0.5286202600744971
CTV,2024-06-23,Three people charged in two separate Manitoba homicides: RCMP,https://winnipeg.ctvnews.ca/three-people-charged-in-two-separate-manitoba-homicides-rcmp-1.6937372,negative,0.012135397,0.38565484,0.60220975,-0.14858239674607354
CTV,2024-06-23,Feds focused on 'restoring affordability' in housing market,/video/c2945606-ctv-qp--closing-housing-supply-gap?playlistId=1.6930806,neutral,0.060148437,0.08914638,0.8507052,-0.004329242442275172
CTV,2024-06-23,Pro-Palestinian protesters set up encampment in Montreal's Victoria Square,https://montreal.ctvnews.ca/pro-palestinian-protesters-set-up-encampment-in-montreal-s-victoria-square-1.6937407,negative,0.011237464,0.5460017,0.4427609,-0.2979915305890568
CTV,2024-06-23,'It was worth it': Former Alberta premier Rachel Notley bids farewell as NDP leader,https://calgary.ctvnews.ca/it-was-worth-it-former-alberta-premier-rachel-notley-bids-farewell-as-ndp-leader-1.6937172,positive,0.6617415,0.006322807,0.33193564,0.4378618676322077
CTV,2024-06-23,Edmonton police seek driver of BMW involved in southwest hit-and-run with motorbike,https://edmonton.ctvnews.ca/edmonton-police-seek-driver-of-bmw-involved-in-southwest-hit-and-run-with-motorbike-1.6937940,neutral,0.020864768,0.1488707,0.83026457,-0.0217271429293433
CTV,2024-06-23,"Man shot dead in Princeton, B.C., was high-ranking gang member, court records suggest",https://bc.ctvnews.ca/man-shot-dead-in-princeton-b-c-was-high-ranking-gang-member-court-records-suggest-1.6937508,negative,0.017537545,0.33008072,0.65238184,-0.1086456872140662
CTV,2024-06-23,57th annual Multicultural Festival underway in Kitchener,https://kitchener.ctvnews.ca/57th-annual-multicultural-festival-underway-in-kitchener-1.6937495,positive,0.23056622,0.004364395,0.7650694,0.05314172300226527
CTV,2024-06-23,"One person dead after motorcycle leaves road, hits tree and catches fire",https://windsor.ctvnews.ca/one-person-dead-after-motorcycle-leaves-road-hits-tree-and-catches-fire-1.6937797,negative,0.011205745,0.7382835,0.25051087,-0.5449368933635448
CTV,2024-06-23,Where is Louis Riel? Heritage Minute of Métis leader quietly removed,https://winnipeg.ctvnews.ca/where-is-louis-riel-heritage-minute-of-m%C3%A9tis-leader-quietly-removed-1.6936849,negative,0.011766046,0.44232994,0.54590404,-0.1955173259566969
CTV,2024-06-23,'It's so much fun': Manitoba holds first-ever provincial cornhole championship,https://winnipeg.ctvnews.ca/it-s-so-much-fun-manitoba-holds-first-ever-provincial-cornhole-championship-1.6937819,positive,0.9821382,0.0013876507,0.016474167,0.9645935123499543
CTV,2024-06-23,"If Dolly Parton can be cancelled, we're in serious trouble",https://www.ctvnews.ca/entertainment/if-dolly-parton-can-be-cancelled-we-re-in-serious-trouble-1.6933820,negative,0.0063878587,0.9017684,0.09184381,-0.8131453915917763
CTV,2024-06-23,Police investigating suspicious fire at west London clothing store,https://london.ctvnews.ca/police-investigating-suspicious-fire-at-west-london-clothing-store-1.6937759,neutral,0.021473233,0.13351859,0.8450082,-0.017366113051983767
CTV,2024-06-23,Parts of Sask. at 'high risk' for thunderstorms: Environment Canada,https://regina.ctvnews.ca/parts-of-sask-at-high-risk-for-thunderstorms-environment-canada-1.6937593,neutral,0.016817205,0.17749009,0.8056928,-0.031219897414050735
CTV,2024-06-23,Why Toronto byelection will be a test for Justin Trudeau,/video/c2945607-ctv-qp--liberal-stronghold-riding-up-for-grabs?playlistId=1.6937732,neutral,0.060528975,0.20849085,0.7309801,-0.03980468768635337
CTV,2024-06-23,NATO head says 'no imminent threat' to alliance member countries,https://www.ctvnews.ca/politics/nato-head-says-no-imminent-threat-to-alliance-member-countries-1.6937378,neutral,0.07631054,0.06962566,0.85406375,0.0009755658825287838
CTV,2024-06-23,"Untreated water available for residents, businesses at 2 Calgary locations as water consumption continues to drop",https://calgary.ctvnews.ca/untreated-water-available-for-residents-businesses-at-2-calgary-locations-as-water-consumption-continues-to-drop-1.6937780,negative,0.00956198,0.75039524,0.24004279,-0.5630015938507427
CTV,2024-06-23,Looking for the Fountain of Youth? Try the gym and weight-resistance training,https://www.ctvnews.ca/health/looking-for-the-fountain-of-youth-try-the-gym-and-weight-resistance-training-1.6937135,positive,0.2724339,0.0106237475,0.71694213,0.0741074240593651
CTV,2024-06-23,Calgary woman looking for her 'angel Natalie' who saved her life,https://calgary.ctvnews.ca/calgary-woman-looking-for-her-angel-natalie-who-saved-her-life-1.6934728,neutral,0.17691867,0.08131136,0.74176997,0.024688678718598922
CTV,2024-06-23,"Most-read stories of the week: Harm reduction vending machine, historic Paris home, air conditioning woes",https://kitchener.ctvnews.ca/most-read-stories-of-the-week-harm-reduction-vending-machine-historic-paris-home-air-conditioning-woes-1.6937837,neutral,0.08896953,0.2024113,0.70861906,-0.03305476842270494
CTV,2024-06-23,"Wildfire near Churchill Falls in Labrador stable, but weather not co-operating",https://www.ctvnews.ca/world/wildfire-near-churchill-falls-in-labrador-stable-but-weather-not-co-operating-1.6937296,negative,0.020687073,0.29349038,0.6858224,-0.08570868069313065
CTV,2024-06-23,Lethbridge celebrates National Indigenous Peoples Day,https://calgary.ctvnews.ca/lethbridge-celebrates-national-indigenous-peoples-day-1.6936696,positive,0.76985866,0.002726872,0.2274144,0.5926749866408727
CTV,2024-06-23,WATCH: Massive speeding falcon strikes drone in China,/video/c2945404-speeding-falcon-strikes-drone-in-china,neutral,0.11275686,0.10158978,0.7856534,0.0023936269198361337
CTV,2024-06-23,Max Verstappen holds off Lando Norris to win Spanish GP and increase F1 lead,https://www.ctvnews.ca/sports/max-verstappen-holds-off-lando-norris-to-win-spanish-gp-and-increase-f1-lead-1.6937832,positive,0.4317377,0.0042418847,0.5640204,0.1863794531342151
CTV,2024-06-23,One-on-one with NATO Secretary-General Jens Stoltenberg,/video/c2945603-ctv-qp--nato-expects-more-from-canada,neutral,0.06906657,0.011757229,0.91917616,0.004631960908194843
CTV,2024-06-23,No-swim advisory in place for Ambleside beach due to high E. coli levels,https://bc.ctvnews.ca/no-swim-advisory-in-place-for-ambleside-beach-due-to-high-e-coli-levels-1.6937930,negative,0.022560887,0.4615906,0.51584846,-0.21255690322391274
CTV,2024-06-23,This 16-year-old is U of T's youngest graduate since at least 1979,https://toronto.ctvnews.ca/this-16-year-old-is-u-of-t-s-youngest-graduate-since-at-least-1979-1.6935595,neutral,0.14602557,0.007385931,0.84658843,0.02126892503116462
CTV,2024-06-23,Ottawa MP apologizes for mailing map to constituents missing a province and a territory,https://ottawa.ctvnews.ca/ottawa-mp-apologizes-for-mailing-map-to-constituents-missing-a-province-and-a-territory-1.6937851,negative,0.015983954,0.41135293,0.5726631,-0.1689557487263933
CTV,2024-06-23,Father stopped from allegedly drowning his kids in Conn.,/video/c2945556-father-charged-after-alleged-drowning-attempt,negative,0.026163016,0.3996102,0.5742268,-0.15900380203162
CTV,2024-06-23,Saskatoon man on electric scooter killed in collision with alleged drunk driver,https://saskatoon.ctvnews.ca/saskatoon-man-on-electric-scooter-killed-in-collision-with-alleged-drunk-driver-1.6937484,negative,0.008743908,0.67460287,0.3166533,-0.45501253188469093
CTV,2024-06-23,Satellite imagery confirms 5 tornadoes hit Quebec during June 13 storm,https://montreal.ctvnews.ca/satellite-imagery-confirms-5-tornadoes-hit-quebec-during-june-13-storm-1.6936414,neutral,0.020159932,0.19959654,0.78024346,-0.039432369028401304
CTV,2024-06-23,"Alberta woman with cerebral palsy threatened with $5,000 fine for using mobility scooter",https://calgary.ctvnews.ca/alberta-woman-with-cerebral-palsy-threatened-with-5-000-fine-for-using-mobility-scooter-1.6936579,negative,0.010390167,0.74322265,0.24638712,-0.5522720014234537
CTV,2024-06-23,"Bugatti's new car is a US$4 million, 1,800 horsepower hybrid",https://www.ctvnews.ca/autos/bugatti-s-new-car-is-a-us-4-million-1-800-horsepower-hybrid-1.6935212,positive,0.37230736,0.008112562,0.6195801,0.1385469569744835
CTV,2024-06-23,Saskatoon's iconic Blue Diamond restaurant has sold,https://saskatoon.ctvnews.ca/saskatoon-s-iconic-blue-diamond-restaurant-has-sold-1.6937938,positive,0.32213998,0.015284394,0.6625756,0.10354056227926733
CTV,2024-06-23,Blue Jays rookie infielder Orelvis Martinez suspended 80 games for doping violation,https://toronto.ctvnews.ca/blue-jays-rookie-infielder-orelvis-martinez-suspended-80-games-for-doping-violation-1.6937811,negative,0.009830272,0.3864091,0.60376054,-0.14921539508839565
CTV,2024-06-23,'You can literally see the sculptor's handwork': Memorial restored as Newfoundlanders reflect on First World War's toll,https://www.ctvnews.ca/canada/you-can-literally-see-the-sculptor-s-handwork-memorial-restored-as-newfoundlanders-reflect-on-first-world-war-s-toll-1.6934215,positive,0.37320936,0.01507987,0.61171085,0.13905780094694364
CTV,2024-06-23,MP Marco Mendicino spat on by man in Ottawa,https://www.ctvnews.ca/politics/mp-marco-mendicino-spat-on-by-man-in-ottawa-1.6936406,negative,0.022957563,0.47245178,0.50459075,-0.22268359099179946
CTV,2024-06-23,'It's a tradition': Titanic model returning to Halifax Public Gardens,https://atlantic.ctvnews.ca/it-s-a-tradition-titanic-model-returning-to-halifax-public-gardens-1.6936194,neutral,0.19946207,0.0063554225,0.7941825,0.039744732186761667
CTV,2024-06-23,Why a yacht docked in Halifax is getting extra attention,https://atlantic.ctvnews.ca/why-a-yacht-docked-in-halifax-is-getting-extra-attention-1.6937877,negative,0.033987764,0.28532276,0.6806895,-0.08025389949186312
CTV,2024-06-23,Game 6 of Stanley Cup Final gets the big screen treatment in Lethbridge,https://calgary.ctvnews.ca/game-6-of-stanley-cup-final-gets-the-big-screen-treatment-in-lethbridge-1.6936233,neutral,0.15832683,0.012717653,0.82895553,0.024905645729367265
CTV,2024-06-23,"B.C. highway reopened after school bus, pedestrian crashes that killed 1 and sent 14 to hospital",https://bc.ctvnews.ca/b-c-highway-reopened-after-school-bus-pedestrian-crashes-that-killed-1-and-sent-14-to-hospital-1.6937306,negative,0.010109568,0.77425855,0.21563186,-0.59937413969823
CTV,2024-06-23,Canada’s missing navigation tool in the push to lower emissions,https://www.ctvnews.ca/climate-and-environment/canada-s-missing-navigation-tool-in-the-push-to-lower-emissions-1.6937676,neutral,0.13259113,0.179533,0.68787575,-0.014651698077386754
CTV,2024-06-23,Former Calgary mayor Naheed Nenshi wins Alberta NDP leadership,https://calgary.ctvnews.ca/former-calgary-mayor-naheed-nenshi-wins-alberta-ndp-leadership-1.6937486,neutral,0.104146406,0.009593684,0.88626003,0.010754423916949918
CTV,2024-06-23,U.K. election betting scandal widens as a fourth Conservative Party official reportedly investigated,https://www.ctvnews.ca/world/u-k-election-betting-scandal-widens-as-a-fourth-conservative-party-official-reportedly-investigated-1.6937685,negative,0.010651139,0.5827957,0.40655315,-0.33953739204867617
CTV,2024-06-23,Montreal woman desperately trying to get family out of Gaza,https://montreal.ctvnews.ca/montreal-woman-desperately-trying-to-get-family-out-of-gaza-1.6932443,negative,0.03184501,0.4381494,0.53000546,-0.19096084654464107
CTV,2024-06-23,"Basketball ties aside, B.C.'s Macklin Celebrini focused on hockey as NHL draft's presumptive No. 1 pick",https://bc.ctvnews.ca/basketball-ties-aside-b-c-s-macklin-celebrini-focused-on-hockey-as-nhl-draft-s-presumptive-no-1-pick-1.6937848,neutral,0.12500113,0.009765118,0.8652338,0.015529922152449416
CTV,2024-06-23,B.C. court overturns environmental board's ruling over 'apprehension of bias',https://bc.ctvnews.ca/b-c-court-overturns-environmental-board-s-ruling-over-apprehension-of-bias-1.6937596,negative,0.012150596,0.47183204,0.51601744,-0.22247780698236852
CTV,2024-06-23,Friday's Google Doodle celebrating Indigenous culture drawn by Ottawa-based artist,https://ottawa.ctvnews.ca/friday-s-google-doodle-celebrating-indigenous-culture-drawn-by-ottawa-based-artist-1.6936365,positive,0.5406704,0.0035907554,0.45573878,0.2923116143548583
CTV,2024-06-23,Wildfire that triggered town evacuation in central Labrador grows only slightly,https://www.ctvnews.ca/canada/wildfire-that-triggered-town-evacuation-in-central-labrador-grows-only-slightly-1.6937857,negative,0.019700661,0.37363276,0.6066667,-0.13921327965537245
CTV,2024-06-23,Pair charged in northwestern Ont. drug bust,https://northernontario.ctvnews.ca/pair-charged-in-northwestern-ont-drug-bust-1.6937909,negative,0.026887903,0.37224963,0.6008623,-0.13784688196012063
CTV,2024-06-23,Chicago's iconic 'Bean' sculpture reopens to tourists after nearly a year of construction,https://www.ctvnews.ca/lifestyle/chicago-s-iconic-bean-sculpture-reopens-to-tourists-after-nearly-a-year-of-construction-1.6937886,positive,0.6461151,0.002884788,0.35100022,0.4174563358032408
CTV,2024-06-23,Conservative surge combined with ballot confusion could crack a Liberal stronghold in Toronto byelection,https://www.ctvnews.ca/politics/conservative-surge-combined-with-ballot-confusion-could-crack-a-liberal-stronghold-in-toronto-byelection-1.6936595,neutral,0.081850134,0.097674005,0.8204759,-0.0028407665558827233
CTV,2024-06-23,A new study shows that 1 year of this kind of exercise yields results 4 years later,https://www.ctvnews.ca/health/a-new-study-shows-that-1-year-of-this-kind-of-exercise-yields-results-4-years-later-1.6932564,positive,0.29784334,0.011026463,0.69113034,0.08858902760987952
CTV,2024-06-23,New wellness centre opens in honour of Regina mom who died by suicide,https://regina.ctvnews.ca/new-wellness-centre-opens-in-honour-of-regina-mom-who-died-by-suicide-1.6937606,neutral,0.06767939,0.18999638,0.74232405,-0.03151814513299378
CTV,2024-06-23,Pedestrian in hospital with critical Injuries,https://london.ctvnews.ca/pedestrian-in-hospital-with-critical-injuries-1.6937622,negative,0.018560642,0.6687162,0.3127231,-0.4468368868707273
CTV,2024-06-23,One person sent to hospital after morning house fire,https://london.ctvnews.ca/one-person-sent-to-hospital-after-morning-house-fire-1.6937727,negative,0.012435448,0.53124267,0.456322,-0.2820640710503959
CTV,2024-06-23,Why Mount Rainier is the U.S. volcano keeping scientists up at night,https://www.ctvnews.ca/climate-and-environment/why-mount-rainier-is-the-u-s-volcano-keeping-scientists-up-at-night-1.6937776,neutral,0.03945291,0.16361943,0.7969276,-0.025214796465231615
CTV,2024-06-23,Old Montreal kidnapping: search for 4th victim continues as provincial police take over investigation,https://montreal.ctvnews.ca/old-montreal-kidnapping-search-for-4th-victim-continues-as-provincial-police-take-over-investigation-1.6937796,neutral,0.01962862,0.16586778,0.8145037,-0.027126819080599773
CTV,2024-06-23,"Heat warning comes down, chance of showers in Windsor-Essex",https://windsor.ctvnews.ca/heat-warning-comes-down-chance-of-showers-in-windsor-essex-1.6937696,neutral,0.039513733,0.059525665,0.9009606,-0.0019819692195799377
