source,date,headline,url,chosen_label,positive,negative,neutral,compound
Global,2024-02-09,"Salad kits, dip recalled in Canada after deadly Listeria outbreak in U.S.",https://globalnews.ca/news/10281345/canada-salad-kit-recall-listeria/,negative,0.010561389,0.63030183,0.3591368,-0.3971688390964072
Global,2024-02-09,Driver stopped for stunt driving near Toronto in dad’s car,https://globalnews.ca/video/10286143/driver-stopped-for-stunt-driving-near-toronto-in-dads-car/,negative,0.03252687,0.26050696,0.7069663,-0.06680585428022745
Global,2024-02-09,‘You don’t dig up anything that’s buried’: Old pet cemetery in Surrey slated for development,https://globalnews.ca/news/10285904/old-pet-cemetery-surrey-development-opposition/,negative,0.01760036,0.34951726,0.6328824,-0.12185252977963223
Global,2024-02-09,New Zealander nearing end of cross-Canada run to raise money for kids’ cancer care,https://globalnews.ca/news/10285985/jon-nabbs-cross-canada-run-cancer-care/,neutral,0.13208191,0.034771826,0.83314633,0.016236543804080128
Global,2024-02-09,Southern Alberta family achieves net zero with decades-old home as part of national challenge,https://globalnews.ca/news/10285970/southern-alberta-family-net-zero-home-retrofit/,neutral,0.065443635,0.20519423,0.72936213,-0.037821804654569746
Global,2024-02-09,Trudeau calls Bell layoffs a ‘garbage decision’: ‘I’m pretty pissed off’,https://globalnews.ca/news/10284437/trudeau-pissed-off-bell-layoffs/,negative,0.005890959,0.92237216,0.07173691,-0.8507356682479323
Global,2024-02-09,"‘Canadians need serious action’: Politicians, police gather to combat auto theft crisis",https://globalnews.ca/video/10283609/canadians-need-serious-action-politicians-police-gather-to-combat-auto-theft-crisis/,negative,0.050111465,0.27289796,0.67699057,-0.07196213620610692
Global,2024-02-09,"Dozens evacuated, 1 hurt after suspected explosion at seniors’ complex in Cape Breton",https://globalnews.ca/news/10286033/cape-breton-seniors-complex-explosion/,negative,0.013425924,0.42579445,0.5607796,-0.18112068506616197
Global,2024-02-09,‘I screamed’: B.C. Indigenous child welfare advocates celebrate court victory,https://globalnews.ca/news/10284914/bc-indigenous-advocates-celebrate-court-victory/,positive,0.6125688,0.008855505,0.3785756,0.3751621631540374
Global,2024-02-09,"Puberty blockers should not be used on children, Poilievre says",https://globalnews.ca/news/10278702/pierre-poilievre-puberty-blockers-stance/,negative,0.011190595,0.603722,0.38508737,-0.3643550305841856
Global,2024-02-09,Kelowna couple auctioning Taylor Swift tickets for hospice fundraiser,https://globalnews.ca/news/10282724/coha-fundraiser-taylor-swift-tickets/,neutral,0.090565525,0.009862857,0.89957154,0.008104845021512652
Global,2024-02-09,Driver makes lucky escape seconds before truck smashed by oncoming train,https://globalnews.ca/video/10282510/driver-makes-lucky-escape-seconds-before-truck-smashed-by-oncoming-train/,negative,0.12543088,0.26191473,0.61265445,-0.052866411540080094
Global,2024-02-09,Supreme Court of Canada upholds Indigenous child welfare act,https://globalnews.ca/video/10286270/scoc-upholds-indigenous-child-welfare-act/,neutral,0.19170196,0.010101688,0.7981964,0.03664759325566891
Global,2024-02-09,Grieving parents of car crash victim said they were told to pay $200 to meet Quebec minister,https://globalnews.ca/news/10282782/quebec-guilbault-financing/,negative,0.010220939,0.6678037,0.32197538,-0.44585730075085905
Global,2024-02-09,Salad kits recalled over Listeria risk,https://globalnews.ca/video/10281493/health-matters-salad-kits-recalled-over-listeria-risk/,negative,0.009418184,0.7251758,0.26540595,-0.525791278285439
Global,2024-02-09,Airdrie family retrofits home for net-zero competition,https://globalnews.ca/video/10286114/airdrie-family-retrofits-home-for-net-zero-competition/,neutral,0.18060362,0.019473223,0.7999232,0.032238457492447026
Global,2024-02-09,Supreme Court upholds Ottawa’s Indigenous child welfare law,https://globalnews.ca/video/10286296/supreme-court-upholds-ottawas-indigenous-child-welfare-law/,neutral,0.1755273,0.010148501,0.81432414,0.030706852491505288
Global,2024-02-09,Canadian cities grappling with terrifying increase in extortion cases,https://globalnews.ca/video/10286301/canadian-cities-grappling-with-terrifying-increase-in-extortion-cases/,negative,0.008645427,0.81413084,0.17722367,-0.6627343458196533
Global,2024-02-09,Let’s talk about Bell Media layoffs: Cuts at CTV News pose ‘significant concern’ about state of Canadian journalism,https://globalnews.ca/video/10283610/lets-talk-about-bell-media-layoffs-cuts-at-ctv-news-pose-significant-concern-about-state-of-canadian-journalism/,negative,0.013610423,0.59942615,0.38696337,-0.3591265010034874
Global,2024-02-09,Ontario signs on to $3.1B health-care deal with federal government,https://globalnews.ca/video/10286300/ontario-signs-on-to-3-1b-health-care-deal-with-federal-government/,neutral,0.20924293,0.0061974567,0.7845597,0.04374417208524761
Global,2024-02-09,‘Grey divorce’ getting more prevalent in Canada. Why it’s a concern,https://globalnews.ca/news/10281196/grey-divorce-canada/,negative,0.01846961,0.4968625,0.48466775,-0.24653128989943163
Global,2024-02-09,Southern Alberta communities sign neighbourly agreement,https://globalnews.ca/news/10286169/southern-alberta-communities-mutual-interest-agreement/,neutral,0.18573865,0.0064636995,0.8077976,0.034457073038838715
Global,2024-02-09,"Record-breaking temperatures allow Dorchester, Ont. golf course to open",https://globalnews.ca/news/10285707/record-breaking-temperatures-dorchester-golf-course/,neutral,0.11898946,0.025025748,0.85598475,0.013532207783351069
Global,2024-02-09,"Company out $35M after scammers stage video call with deepfake CFO, coworkers",https://globalnews.ca/news/10273167/deepfake-scam-cfo-coworkers-video-call-hong-kong-ai/,negative,0.0064645004,0.8493789,0.14415671,-0.7214026359898069
Global,2024-02-09,"Alberta woman, threatened with jail time for riding horse around town, rides again",https://globalnews.ca/news/10281291/alberta-high-river-horse-transportation/,negative,0.007996491,0.7887962,0.20320742,-0.6221353983049349
Global,2024-02-09,Global News Hour at 6 Edmonton:  February 9,https://globalnews.ca/video/10286313/global-news-hour-at-6-edmonton-february-9-4/,neutral,0.036902525,0.00853367,0.9545637,0.0012889764453388741
Global,2024-02-09,Global News at 5 Lethbridge: Feb. 9,https://globalnews.ca/video/10286123/global-news-at-5-lethbridge-feb-9-4/,neutral,0.02938754,0.016892051,0.95372045,0.0005782855533418285
Global,2024-02-09,1 person injured after shooting in Okotoks,https://globalnews.ca/video/10286108/1-person-injured-after-shooting-in-okotoks/,negative,0.01155144,0.6610726,0.32737595,-0.4368835623231
Global,2024-02-09,Vehicle close call with toddler a stark reminder for parking lot safety,https://globalnews.ca/news/10286093/vehicle-close-call-toddler-parking-lot/,neutral,0.14314458,0.09358552,0.76326996,0.011732117445266255
Global,2024-02-09,Winnipeg Mayor’s State of City Address looks to tackle affordable housing crisis,https://globalnews.ca/news/10285891/winnipeg-mayors-state-of-city-address-affordable-housing-crisis/,neutral,0.12996675,0.020496959,0.84953624,0.01647123676104245
Global,2024-02-09,Moncton veteran who fought in D-Day celebrates 100th birthday,https://globalnews.ca/video/10286306/moncton-veteran-who-fought-in-d-day-celebrates-100-th-birthday/,positive,0.74188006,0.0075054416,0.2506145,0.5503297129049578
Global,2024-02-09,Alberta Children’s Hospital Foundation grateful for Country 105 Caring for Kids Radiothon Support,https://globalnews.ca/video/10286263/alberta-childrens-hospital-foundation-grateful-for-country-105-caring-for-kids-radiothon-support/,positive,0.9092344,0.0028488934,0.087916784,0.826699039147166
Global,2024-02-09,Poilievre grills Liberal government about $54-million spent on ArriveCan app,https://globalnews.ca/video/10260809/poilievre-grills-liberal-government-about-54-million-spent-on-arrivecan-app/,neutral,0.057283964,0.16743352,0.7752825,-0.024752530691317887
Global,2024-02-09,‘Oasis of peace’: How Jews and Palestinians coexist in this Israeli village,https://globalnews.ca/video/10283624/oasis-of-peace-how-jews-and-palestinians-coexist-in-this-israeli-village/,neutral,0.07834247,0.017985705,0.9036718,0.005814058200549477
Global,2024-02-09,Global News Hour at 6 Calgary: Feb. 9,https://globalnews.ca/video/10286242/global-news-hour-at-6-calgary-feb-9-4/,neutral,0.039089445,0.0095699895,0.9513406,0.0014363985284041592
CTV,2024-02-09,'An incredible experience': The Manitoba actor appearing in Marvel's latest series,https://winnipeg.ctvnews.ca/an-incredible-experience-the-manitoba-actor-appearing-in-marvel-s-latest-series-1.6759446,positive,0.94749117,0.0016947058,0.050814066,0.8977367243868191
CTV,2024-02-09,Parents fuming after Montreal-area teacher allegedly lists students' art for sale online,https://montreal.ctvnews.ca/parents-fuming-after-montreal-area-teacher-allegedly-lists-students-art-for-sale-online-1.6761489,negative,0.007828923,0.73589313,0.25627795,-0.5414773850563925
CTV,2024-02-09,2 people dead after small plane attempts emergency landing on Florida interstate,https://www.ctvnews.ca/world/2-people-dead-after-small-plane-attempts-emergency-landing-on-florida-interstate-1.6763281,negative,0.008815405,0.73674536,0.2544393,-0.5427159670157309
CTV,2024-02-09,Newcomers praise firefighters after being rescued from blaze during N.S. snowstorm,https://atlantic.ctvnews.ca/newcomers-praise-firefighters-after-being-rescued-from-blaze-during-n-s-snowstorm-1.6762349,positive,0.64781266,0.012319539,0.33986777,0.4195094766206786
CTV,2024-02-09,Vehicle theft in Canada: What are the impacts on insurance?,/video/c2864199-vehicle-theft--what-are-the-insurance-impacts-?playlistId=1.6760185,negative,0.009556336,0.53863305,0.45181057,-0.29003425285674567
CTV,2024-02-09,Man accused of stalking outside Taylor Swift's Manhattan home to receive psychiatric treatment,https://www.ctvnews.ca/entertainment/man-accused-of-stalking-outside-taylor-swift-s-manhattan-home-to-receive-psychiatric-treatment-1.6763362,negative,0.013028336,0.52042824,0.4665435,-0.2706757858404174
CTV,2024-02-09,Poilievre proposes mandatory prison terms for extortion-related crimes,https://www.ctvnews.ca/politics/poilievre-proposes-mandatory-prison-terms-for-extortion-related-crimes-1.6762997,negative,0.018793995,0.6128725,0.36833352,-0.37525946394977083
CTV,2024-02-09,Teen accused of shooting tourist in Times Square and firing at officer arrested after search,https://www.ctvnews.ca/world/teen-accused-of-shooting-tourist-in-times-square-and-firing-at-officer-arrested-after-search-1.6763642,negative,0.010730613,0.6485598,0.3407096,-0.4205146601968046
CTV,2024-02-09,Eastern Ontario woman credits helmet for saving her after life-changing ski accident,https://ottawa.ctvnews.ca/eastern-ontario-woman-credits-helmet-for-saving-her-after-life-changing-ski-accident-1.6763354,positive,0.41504493,0.036732852,0.5482222,0.17091300569656553
CTV,2024-02-09,"Groups previously excluded from Chinatown parade will be allowed to march, organizers say",https://bc.ctvnews.ca/groups-previously-excluded-from-chinatown-parade-will-be-allowed-to-march-organizers-say-1.6763639,neutral,0.04523247,0.028737608,0.92602986,0.0012201272897534032
CTV,2024-02-09,"Canadians won't be fooled by Putin propaganda on Ukraine, Trudeau says",https://www.ctvnews.ca/politics/canadians-won-t-be-fooled-by-putin-propaganda-on-ukraine-trudeau-says-1.6762965,neutral,0.07047046,0.12925853,0.8002709,-0.011741687147059032
CTV,2024-02-09,"Trudeau says he's furious over Bell Media layoffs, calling it a 'garbage decision'",https://www.ctvnews.ca/politics/trudeau-says-he-s-furious-over-bell-media-layoffs-calling-it-a-garbage-decision-1.6762883,negative,0.006779968,0.85722864,0.13599125,-0.7347950944005586
CTV,2024-02-09,Mounties search for suspect after cyclist killed in hit-and-run crash on Vancouver Island,https://bc.ctvnews.ca/mounties-search-for-suspect-after-cyclist-killed-in-hit-and-run-crash-on-vancouver-island-1.6763077,negative,0.018429551,0.37542167,0.6061488,-0.14060178437993187
CTV,2024-02-09,3 novice drivers among 5 caught for stunt driving in Ottawa on Friday,https://ottawa.ctvnews.ca/3-novice-drivers-among-5-caught-for-stunt-driving-in-ottawa-on-friday-1.6763234,negative,0.012342687,0.5029378,0.48471966,-0.2527940092278058
CTV,2024-02-09,Everything you’ve been asking about the new entertainment district,https://saskatoon.ctvnews.ca/everything-you-ve-been-asking-about-the-new-entertainment-district-1.6763190,neutral,0.115896806,0.027046142,0.85705715,0.012700566495436938
CTV,2024-02-09,"She arranged a date with a guy she met on a plane. When he didn't show, she unexpectedly met her future husband",https://www.ctvnews.ca/lifestyle/she-arranged-a-date-with-a-guy-she-met-on-a-plane-when-he-didn-t-show-she-unexpectedly-met-her-future-husband-1.6762818,neutral,0.2062049,0.018008506,0.7757866,0.0421961600221179
CTV,2024-02-09,Regina police investigating fire at church as arson,https://regina.ctvnews.ca/regina-police-investigating-fire-at-church-as-arson-1.6763217,negative,0.01285346,0.25254115,0.73460543,-0.0636118126674372
CTV,2024-02-09,Puberty blockers can't be started at 18 when youth have already developed: experts,https://www.ctvnews.ca/health/puberty-blockers-can-t-be-started-at-18-when-youth-have-already-developed-experts-1.6761690,negative,0.024933225,0.3500763,0.6249905,-0.12193173231172416
CTV,2024-02-09,"Never mind the mess, Carnival kicks off in Rio de Janeiro with coronation of King Momo",https://www.ctvnews.ca/world/never-mind-the-mess-carnival-kicks-off-in-rio-de-janeiro-with-coronation-of-king-momo-1.6763424,positive,0.53424114,0.022565598,0.4431932,0.2849044195975665
CTV,2024-02-09,Northern Ontario First Nations declare state of emergency over winter roads,https://northernontario.ctvnews.ca/northern-ontario-first-nations-declare-state-of-emergency-over-winter-roads-1.6762771,negative,0.025528474,0.36290762,0.6115638,-0.1310502773196518
CTV,2024-02-09,'Go faster!' Moose spotted chasing after skiers in Wyoming,/video/c2864195-watch--moose-bombs-down-hill-after-skiers,neutral,0.20744097,0.04475459,0.74780446,0.041028778417404155
CTV,2024-02-09,City offers wage increases to workers as it applies for ability to lock them out if they strike,https://edmonton.ctvnews.ca/city-offers-wage-increases-to-workers-as-it-applies-for-ability-to-lock-them-out-if-they-strike-1.6763301,neutral,0.08084114,0.06289283,0.8562661,0.002579780512481644
CTV,2024-02-09,A 4.6-magnitude earthquake shakes greater Los Angeles. No reports of significant damage,https://www.ctvnews.ca/world/a-4-6-magnitude-earthquake-shakes-greater-los-angeles-no-reports-of-significant-damage-1.6763617,neutral,0.031883117,0.15707044,0.8110465,-0.023654585103477288
CTV,2024-02-09,Why some U.S. cities are cracking down on dollar stores,/video/c2864166-some-u-s--cities-cracking-down-on-dollar-stores,negative,0.03024009,0.35031223,0.61944765,-0.12180420714349616
CTV,2024-02-09,Que. students accuse teacher of profiting off their artwork,/video/c2864148-ctv-national-news--school-artwork-sold-online?playlistId=1.6761713,negative,0.022746483,0.46520978,0.51204365,-0.21590277888376086
CTV,2024-02-09,Calgary friends split $50-million lottery win,https://calgary.ctvnews.ca/calgary-friends-split-50-million-lottery-win-1.6759348,positive,0.4782324,0.009292693,0.512475,0.22861983132548858
CTV,2024-02-09,Edmonton prison stabbing leads to murder charges,https://edmonton.ctvnews.ca/edmonton-prison-stabbing-leads-to-murder-charges-1.6763700,negative,0.007464147,0.8343321,0.1582038,-0.6960542918230264
CTV,2024-02-09,Multiple shots fired at Okotoks home; suspects possibly headed to Calgary: RCMP,https://calgary.ctvnews.ca/multiple-shots-fired-at-okotoks-home-suspects-possibly-headed-to-calgary-rcmp-1.6762928,negative,0.011891068,0.4871049,0.5010041,-0.23712975072218256
CTV,2024-02-09,Celebrities are paid a shocking amount for 30-second Super Bowl ads,https://www.ctvnews.ca/sports/celebrities-are-paid-a-shocking-amount-for-30-second-super-bowl-ads-1.6763559,negative,0.031746466,0.7460664,0.22218719,-0.5556072022871561
CTV,2024-02-09,N.S. man arrested for allegedly threatening snowplow operator,https://atlantic.ctvnews.ca/more/n-s-man-arrested-for-allegedly-threatening-snowplow-operator-1.6762763,negative,0.011977699,0.67906344,0.30895886,-0.460983709928275
CTV,2024-02-09,UBC student commutes from Calgary -- cheaper than paying Vancouver rent,https://bc.ctvnews.ca/ubc-student-commutes-from-calgary-cheaper-than-paying-vancouver-rent-1.6759116,positive,0.35510978,0.010370566,0.6345195,0.12599545959109726
CTV,2024-02-09,Driver charged after travelling 125 km/h through city’s west end,https://london.ctvnews.ca/driver-charged-after-travelling-125-km-h-through-city-s-west-end-1.6762809,neutral,0.058727793,0.10284078,0.8384313,-0.007127278150502736
CTV,2024-02-09,Fashion History Museum says it’s at risk of closing without rent forgiveness,https://kitchener.ctvnews.ca/fashion-history-museum-says-it-s-at-risk-of-closing-without-rent-forgiveness-1.6763407,negative,0.013951728,0.54972106,0.43632713,-0.30199864365186
CTV,2024-02-09,'We were embarrassed. We felt shame': Lakeshore family duped out of $170K in a romance scam,https://windsor.ctvnews.ca/we-were-embarrassed-we-felt-shame-lakeshore-family-duped-out-of-170k-in-a-romance-scam-1.6763085,negative,0.0055659413,0.9102375,0.08419646,-0.8285014049218109
CTV,2024-02-09,'Bringing our children home': FSIN chiefs applaud Supreme Court decision on Indigenous child warfare,https://saskatoon.ctvnews.ca/bringing-our-children-home-fsin-chiefs-applaud-supreme-court-decision-on-indigenous-child-warfare-1.6763094,positive,0.55423456,0.007106246,0.43865916,0.30712546986352507
CTV,2024-02-09,Potentially habitable 'super-Earth' spotted 137 light-years away,https://www.ctvnews.ca/sci-tech/potentially-habitable-super-earth-spotted-137-light-years-away-1.6761561,neutral,0.17813718,0.02351086,0.7983519,0.031180107091726583
CTV,2024-02-09,"More housing, transit safety officers highlighted in Gillingham's State of the City",https://winnipeg.ctvnews.ca/more-housing-transit-safety-officers-highlighted-in-gillingham-s-state-of-the-city-1.6763606,positive,0.5912462,0.0047516464,0.40400213,0.3495495114940539
CTV,2024-02-09,'Making friends is hard': Calgirls Club building community to help lonely women,https://calgary.ctvnews.ca/making-friends-is-hard-calgirls-club-building-community-to-help-lonely-women-1.6763344,neutral,0.07688443,0.16142313,0.76169246,-0.020146208834106005
CTV,2024-02-09,B.C. Supreme Court acquits woman of assaulting grocery workers during COVID-19 pandemic,https://bc.ctvnews.ca/b-c-supreme-court-acquits-woman-of-assaulting-grocery-workers-during-covid-19-pandemic-1.6763701,negative,0.013108435,0.6264912,0.36040038,-0.3923193789012025
CTV,2024-02-09,RCMP close section of N.S. Highway 7 while man barricaded in home,https://atlantic.ctvnews.ca/rcmp-close-section-of-n-s-highway-7-while-man-barricaded-in-home-1.6763679,negative,0.011696357,0.41181815,0.57648546,-0.16945739284556005
CTV,2024-02-09,'We want the truth to be uncovered': Family of Winnipeg man who died after police interaction calls for transparency,https://winnipeg.ctvnews.ca/we-want-the-truth-to-be-uncovered-family-of-winnipeg-man-who-died-after-police-interaction-calls-for-transparency-1.6763381,neutral,0.07744847,0.091103494,0.831448,-0.00230158097887756
CTV,2024-02-09,Feds kicking in $5M for cobalt refinery construction in northern Ont.,https://northernontario.ctvnews.ca/feds-kicking-in-5m-for-cobalt-refinery-construction-in-northern-ont-1.6763084,neutral,0.105572104,0.009519206,0.8849086,0.011054861141091443
CTV,2024-02-09,"$50K reward offered in case of missing Barrie, Ont. woman",/video/c2863922--50k-reward-for-info-on-autumn-shaganash?playlistId=1.6573006,neutral,0.051133163,0.062856466,0.88601035,-0.0013363351406669999
CTV,2024-02-09,UW startup achieves a world’s first with tiny camera used in brain surgery,https://kitchener.ctvnews.ca/uw-startup-achieves-a-world-s-first-with-tiny-camera-used-in-brain-surgery-1.6763640,positive,0.7163099,0.0044472166,0.27924275,0.5130801871551682
CTV,2024-02-09,"More Canadians using AI tools, despite 'deep-rooted' fears about the tech: poll",https://www.ctvnews.ca/sci-tech/more-canadians-using-ai-tools-despite-deep-rooted-fears-about-the-tech-poll-1.6762434,positive,0.3498504,0.016661286,0.6334883,0.12211770431787627
CTV,2024-02-09,Cathy Burghardt-Jesson to be named as Liberal candidate for Lambton-Kent-Middlesex,https://london.ctvnews.ca/cathy-burghardt-jesson-to-be-named-as-liberal-candidate-for-lambton-kent-middlesex-1.6763370,neutral,0.044556227,0.0070847073,0.948359,0.0019350661846502248
CTV,2024-02-09,Canadian brands hope to score with Taylor Swift fans during Super Bowl,https://www.ctvnews.ca/business/canadian-brands-hope-to-score-with-taylor-swift-fans-during-super-bowl-1.6762476,positive,0.2860639,0.013919997,0.700016,0.0816388099026426
CTV,2024-02-09,"This Toronto woman is battling both an eviction and terminal cancer. Soon, she'll plead her case to the LTB",https://toronto.ctvnews.ca/this-toronto-woman-is-battling-both-an-eviction-and-terminal-cancer-soon-she-ll-plead-her-case-to-the-ltb-1.6757886,negative,0.022440335,0.64893574,0.32862395,-0.4206140207473261
CTV,2024-02-09,Floating hotel ship arrives in Nanaimo ahead of WoodFibre LNG construction project,https://bc.ctvnews.ca/floating-hotel-ship-arrives-in-nanaimo-ahead-of-woodfibre-lng-construction-project-1.6763333,neutral,0.04660021,0.014528041,0.93887186,0.0019605121775967405
CTV,2024-02-09,‘Just in pain’: Woman recounts being attacked by two dogs in Toronto,https://toronto.ctvnews.ca/just-in-pain-woman-recounts-being-attacked-by-two-dogs-in-toronto-1.6762862,negative,0.0077876025,0.81896615,0.17324615,-0.670645005526552
CTV,2024-02-09,Former southern Alberta teacher sentenced to 3 years for sexual exploitation of student,https://calgary.ctvnews.ca/former-southern-alberta-teacher-sentenced-to-3-years-for-sexual-exploitation-of-student-1.6763637,negative,0.0072051543,0.8274691,0.1653259,-0.6846531049281577
CTV,2024-02-09,"What Canadians think about the Emergencies Act, according to Nanos polling",https://www.ctvnews.ca/politics/what-canadians-think-about-the-emergencies-act-according-to-nanos-polling-1.6758343,neutral,0.021390721,0.04169127,0.93691796,-0.0012806000009228935
CTV,2024-02-09,Cockroaches and silverfish found in 2 City of Regina leisure centres,https://regina.ctvnews.ca/cockroaches-and-silverfish-found-in-2-city-of-regina-leisure-centres-1.6763114,negative,0.019230861,0.33437294,0.6463962,-0.11143542560733088
CTV,2024-02-09,Dakota Johnson says working on 'The Office' finale was the 'worst time of my life',https://www.ctvnews.ca/entertainment/dakota-johnson-says-working-on-the-office-finale-was-the-worst-time-of-my-life-1.6763535,negative,0.009315488,0.8874402,0.10324429,-0.7874633514943028
CTV,2024-02-09,"Minivan thief speeding on Hwy. 17 loses control, rolls across both lanes",https://northernontario.ctvnews.ca/minivan-thief-speeding-on-hwy-17-loses-control-rolls-across-both-lanes-1.6762944,negative,0.014524667,0.6719565,0.313519,-0.4513144669084568
CTV,2024-02-09,"Sask. NDP leading among decided voters in Saskatoon, Regina",https://regina.ctvnews.ca/sask-ndp-leading-among-decided-voters-in-saskatoon-regina-1.6763091,neutral,0.13699904,0.00806687,0.85493404,0.0187036706008179
CTV,2024-02-09,'Thick enough to skate on': Saskatoon residents making the most of icy conditions,https://saskatoon.ctvnews.ca/thick-enough-to-skate-on-saskatoon-residents-making-the-most-of-icy-conditions-1.6758749,positive,0.290703,0.011233815,0.69806314,0.08438205166392265
CTV,2024-02-09,Ontario sports bettors can wager on Swift prop bets for Super Bowl,https://toronto.ctvnews.ca/ontario-sports-bettors-can-wager-on-swift-prop-bets-for-super-bowl-1.6763046,neutral,0.080321416,0.015884679,0.903794,0.006199201009454924
CTV,2024-02-09,'It breaks my heart': Descendants of Chatham Coloured All-Stars disappointed with Canadian Baseball HOF,https://windsor.ctvnews.ca/it-breaks-my-heart-descendants-of-chatham-coloured-all-stars-disappointed-with-canadian-baseball-hof-1.6763503,negative,0.007968659,0.837253,0.15477827,-0.7009291178613175
CTV,2024-02-09,Family of Olando Brown questions upcoming inquest into his death,https://barrie.ctvnews.ca/family-of-olando-brown-questions-upcoming-inquest-into-his-death-1.6763106,neutral,0.018538477,0.19906686,0.78239465,-0.039283943364640805
CTV,2024-02-09,Many Montreal schools are undecided on closing for the solar eclipse. Here's what parents should know,https://montreal.ctvnews.ca/many-montreal-schools-are-undecided-on-closing-for-the-solar-eclipse-here-s-what-parents-should-know-1.6763164,neutral,0.027482152,0.04964641,0.92287153,-0.0017094953922820455
CTV,2024-02-09,More listeria-contaminated foods removed from shelves: Here are the recalls for the week,https://www.ctvnews.ca/health/more-listeria-contaminated-foods-removed-from-shelves-here-are-the-recalls-for-the-week-1.6763018,negative,0.013160116,0.65530735,0.3315326,-0.4292544995392191
CTV,2024-02-09,Charges laid in Highway 17 crash that killed horse and buggy driver,https://northernontario.ctvnews.ca/charges-laid-in-highway-17-crash-that-killed-horse-and-buggy-driver-1.6762672,negative,0.010833469,0.70385444,0.28531224,-0.49529362893555984
CTV,2024-02-09,They've spent eight years travelling the world with their kids. But there's one thing they miss,https://www.ctvnews.ca/lifestyle/they-ve-spent-eight-years-travelling-the-world-with-their-kids-but-there-s-one-thing-they-miss-1.6761284,neutral,0.24072787,0.23168492,0.52758723,0.004272004297513732
