source,date,headline,url,chosen_label,positive,negative,neutral,compound
CTV,2024-05-24,The latest advice for expecting parents? Sign up for child care as soon as you're pregnant,https://www.ctvnews.ca/canada/the-latest-advice-for-expecting-parents-sign-up-for-child-care-as-soon-as-you-re-pregnant-1.6890479,neutral,0.0960342,0.03569586,0.86827,0.00794837082992439
CTV,2024-05-24,"'Near and dear to all filmmakers': Return of Regina's discount theatre bodes well for fans, movie makers alike",https://regina.ctvnews.ca/near-and-dear-to-all-filmmakers-return-of-regina-s-discount-theatre-bodes-well-for-fans-movie-makers-alike-1.6897911,positive,0.8502055,0.0028818678,0.14691275,0.7228409537439937
CTV,2024-05-24,Canada ranks among the world's top 10 countries for stolen vehicles: Interpol,https://www.ctvnews.ca/autos/canada-ranks-among-the-world-s-top-10-countries-for-stolen-vehicles-interpol-1.6896136,negative,0.026118657,0.42603067,0.54785067,-0.18081994335215512
CTV,2024-05-24,Canadian border workers vote in favour of possible strike: union,https://www.ctvnews.ca/canada/canadian-border-workers-vote-in-favour-of-possible-strike-union-1.6899302,neutral,0.035785984,0.04914803,0.91506594,-0.0011348927887631088
CTV,2024-05-24,"Calgary's growing birding community concerned about migration, light pollution",https://calgary.ctvnews.ca/calgary-s-growing-birding-community-concerned-about-migration-light-pollution-1.6899225,neutral,0.04021993,0.13335119,0.82642883,-0.016164901544660104
CTV,2024-05-24,Pedestrian treated life-threatening injuries after being struck by vehicle in Barrhaven,https://ottawa.ctvnews.ca/pedestrian-treated-life-threatening-injuries-after-being-struck-by-vehicle-in-barrhaven-1.6899183,negative,0.027592037,0.6208634,0.3515445,-0.38471004762498495
CTV,2024-05-24,Here's a look at the tentative deal on the table for Sask. teachers,https://regina.ctvnews.ca/here-s-a-look-at-the-tentative-deal-on-the-table-for-sask-teachers-1.6898172,neutral,0.059442956,0.01231137,0.92824566,0.0033818957337188316
CTV,2024-05-24,One person wounded in shooting in Sudbury,https://northernontario.ctvnews.ca/one-person-wounded-in-shooting-in-sudbury-1.6899357,negative,0.01275346,0.54026216,0.44698438,-0.29172053728721004
CTV,2024-05-24,What it's really like to live in Antarctica,https://www.ctvnews.ca/lifestyle/what-it-s-really-like-to-live-in-antarctica-1.6898282,neutral,0.088772245,0.13169344,0.7795343,-0.009462651692786483
CTV,2024-05-24,Man escapes from prison in Laval,https://montreal.ctvnews.ca/man-escapes-from-prison-in-laval-1.6899209,neutral,0.06671816,0.08784948,0.84543234,-0.003266218938233756
CTV,2024-05-24,World Court orders Israel to halt assault on Gaza's Rafah,https://www.ctvnews.ca/world/world-court-orders-israel-to-halt-assault-on-gaza-s-rafah-1.6899315,neutral,0.051997174,0.21872234,0.72928035,-0.04513578020893938
CTV,2024-05-24,"Tim Meadows pledges not to shave until the Oilers win the cup, who are the team's other famous fans?",https://edmonton.ctvnews.ca/tim-meadows-pledges-not-to-shave-until-the-oilers-win-the-cup-who-are-the-team-s-other-famous-fans-1.6898451,neutral,0.07459867,0.07947437,0.845927,-0.0007512132937836924
CTV,2024-05-24,"Suspect fled in 2-door Fiat after convenience store robbery, Merritt RCMP say",https://bc.ctvnews.ca/suspect-fled-in-2-door-fiat-after-convenience-store-robbery-merritt-rcmp-say-1.6882381,negative,0.018803649,0.28121117,0.6999852,-0.07872613546516583
CTV,2024-05-24,"Search for truth goes on, regardless of killer Robert Pickton's fate, say victims' advocates",https://bc.ctvnews.ca/search-for-truth-goes-on-regardless-of-killer-robert-pickton-s-fate-say-victims-advocates-1.6899304,neutral,0.042189293,0.17243765,0.78537303,-0.027954812252826144
CTV,2024-05-24,UN countries adopt treaty to better trace origins of genetic resources under global patent system,https://www.ctvnews.ca/world/un-countries-adopt-treaty-to-better-trace-origins-of-genetic-resources-under-global-patent-system-1.6899269,neutral,0.17502621,0.023192389,0.80178124,0.030096311440179768
CTV,2024-05-24,Trudeau's speech to union delegates took aim at Conservatives,https://www.ctvnews.ca/politics/trudeau-s-speech-to-union-delegates-took-aim-at-conservatives-1.6897182,neutral,0.02753645,0.16793317,0.8045304,-0.027443292073229486
CTV,2024-05-24,Milk sold in Canadian stores tested for avian flu: Results of 303 samples,https://www.ctvnews.ca/health/milk-sold-in-canadian-stores-tested-for-avian-flu-results-of-303-samples-1.6899219,negative,0.017720327,0.41681305,0.5654665,-0.1734191532215945
CTV,2024-05-24,Addictions minister had 'deep concerns' with Toronto's decriminalization pitch,https://toronto.ctvnews.ca/addictions-minister-had-deep-concerns-with-toronto-s-decriminalization-pitch-1.6899162,negative,0.0150191095,0.42239138,0.5625894,-0.17818894447987788
CTV,2024-05-24,Teen boy faces arson charge after multiple vehicles burned in Saskatoon,https://saskatoon.ctvnews.ca/teen-boy-faces-arson-charge-after-multiple-vehicles-burned-in-saskatoon-1.6898811,negative,0.008332892,0.7442248,0.24744247,-0.5538009752452462
CTV,2024-05-24,'Altercation' in Penticton leaves 1 dead: RCMP,https://bc.ctvnews.ca/altercation-in-penticton-leaves-1-dead-rcmp-1.6883954,negative,0.0067205396,0.6865775,0.30670196,-0.47134349631639694
CTV,2024-05-24,B.C. firefighter without home 9 months after West Kelowna wildfire,https://bc.ctvnews.ca/b-c-firefighter-without-home-9-months-after-west-kelowna-wildfire-1.6898992,negative,0.014291794,0.56213945,0.42356876,-0.31579649040770974
CTV,2024-05-24,"'Nobody wants to pay this money': City of Regina dipping into reserves to pay EDR, REAL CRA debts",https://regina.ctvnews.ca/nobody-wants-to-pay-this-money-city-of-regina-dipping-into-reserves-to-pay-edr-real-cra-debts-1.6898917,negative,0.009528785,0.8135397,0.17693147,-0.6617560918385923
CTV,2024-05-24,Rapper Sean Kingston's home raided by SWAT; mother arrested on fraud and theft charges,https://www.ctvnews.ca/entertainment/rapper-sean-kingston-s-home-raided-by-swat-mother-arrested-on-fraud-and-theft-charges-1.6898722,negative,0.012622354,0.57886064,0.408517,-0.334920317268498
CTV,2024-05-24,"Tires 'destroyed' by massive Calgary pothole, driver says",https://calgary.ctvnews.ca/tires-destroyed-by-massive-calgary-pothole-driver-says-1.6899270,negative,0.007230817,0.8156714,0.17709772,-0.6652675827229029
CTV,2024-05-24,"Toddler dies after being struck by recycling truck in Barrie, Ont. neighbourhood",https://barrie.ctvnews.ca/toddler-dies-after-being-struck-by-recycling-truck-in-barrie-ont-neighbourhood-1.6898447,negative,0.010269005,0.71664727,0.27308363,-0.5134779379169636
CTV,2024-05-24,B.C. mayor hopes wildfire evacuees can return to Fort Nelson early next week,https://bc.ctvnews.ca/b-c-mayor-hopes-wildfire-evacuees-can-return-to-fort-nelson-early-next-week-1.6898226,neutral,0.13585806,0.009437025,0.8547048,0.018368369813462238
CTV,2024-05-24,Top Russian military officials are being arrested. Why is it happening?,https://www.ctvnews.ca/world/top-russian-military-officials-are-being-arrested-why-is-it-happening-1.6899223,negative,0.0077665797,0.8127695,0.17946377,-0.6605340153994081
CTV,2024-05-24,"Region of Waterloo sees 5.5% population growth, Kitchener breaks 300,000 mark",https://kitchener.ctvnews.ca/region-of-waterloo-sees-5-5-population-growth-kitchener-breaks-300-000-mark-1.6897985,positive,0.46943533,0.0052305707,0.52533424,0.22034210490565087
CTV,2024-05-24,"Building collapses in Spain's Palma de Mallorca, killing at least 4 people",https://www.ctvnews.ca/world/building-collapses-in-spain-s-palma-de-mallorca-killing-at-least-4-people-1.6898572,negative,0.010313996,0.83424926,0.15543675,-0.6958654461996616
CTV,2024-05-24,"Competition Bureau probes alleged anticompetitive conduct by Loblaws, Sobeys owners",https://www.ctvnews.ca/business/competition-bureau-probes-alleged-anticompetitive-conduct-by-loblaws-sobeys-owners-1.6899175,negative,0.015454837,0.52552974,0.45901543,-0.2759426582484359
CTV,2024-05-24,"Sault impaired driver crashes into stone wall at cemetery, hides in the woods",https://northernontario.ctvnews.ca/sault-impaired-driver-crashes-into-stone-wall-at-cemetery-hides-in-the-woods-1.6898350,negative,0.009153213,0.7674197,0.22342719,-0.5888491522523855
CTV,2024-05-24,"Born without front legs, this dog has been inspiring the world for 3 years: Dresden farm owner",https://windsor.ctvnews.ca/born-without-front-legs-this-dog-has-been-inspiring-the-world-for-3-years-dresden-farm-owner-1.6892892,positive,0.9646642,0.00274173,0.03259416,0.9305694126916881
CTV,2024-05-24,"Someone has been stealing bronze vases from graves in Nanaimo, RCMP say",https://bc.ctvnews.ca/someone-has-been-stealing-bronze-vases-from-graves-in-nanaimo-rcmp-say-1.6899041,negative,0.009507195,0.4636177,0.526875,-0.21485102316347593
CTV,2024-05-24,Manitoba parties line up candidates for June 18 byelection in former premier's seat,https://winnipeg.ctvnews.ca/manitoba-parties-line-up-candidates-for-june-18-byelection-in-former-premier-s-seat-1.6899086,neutral,0.03930121,0.013894103,0.94680494,0.0013515324935031714
CTV,2024-05-24,Confidential information from London Drugs hack released,/video/c2928070-ctv-national-news--information-leaked-after-hack?playlistId=1.6896668,negative,0.015062499,0.5507336,0.4342039,-0.30308063148376974
CTV,2024-05-24,"More aid getting from U.S. pier to people in Gaza, officials say, after troubled launch",https://www.ctvnews.ca/world/more-aid-getting-from-u-s-pier-to-people-in-gaza-officials-say-after-troubled-launch-1.6898943,neutral,0.11724462,0.030523345,0.8522321,0.012814621366007195
CTV,2024-05-24,Ont. man falls over after seeing $70M jackpot in his account,/video/c2927421-toronto-man-falls-off-chair-after--70m-lottery-win,neutral,0.07087542,0.23157106,0.6975535,-0.0486018320783721
CTV,2024-05-24,How to make your car ready for summer,https://ottawa.ctvnews.ca/how-to-make-your-car-ready-for-summer-1.6898163,positive,0.3724162,0.029417664,0.5981661,0.13782843599964778
CTV,2024-05-24,Gas prices in the Maritimes up slightly,https://atlantic.ctvnews.ca/gas-prices-in-the-maritimes-up-slightly-1.6899281,neutral,0.030924765,0.13029817,0.838777,-0.016021277138580814
CTV,2024-05-24,Here are the weekend road closures for the Montreal area,https://montreal.ctvnews.ca/here-are-the-weekend-road-closures-for-the-montreal-area-1.6898892,neutral,0.019547751,0.09652441,0.88392794,-0.00893483903810477
CTV,2024-05-24,Trillions of cicadas are emerging in the U.S. Here's what they sound like,https://www.ctvnews.ca/world/trillions-of-cicadas-are-emerging-in-the-u-s-here-s-what-they-sound-like-1.6898665,neutral,0.16484259,0.12237055,0.7127869,0.01219852633866303
CTV,2024-05-24,National Hurricane Center issues 2024 forecast,https://atlantic.ctvnews.ca/more/national-hurricane-center-issues-2024-forecast-1.6897880,neutral,0.04070975,0.16609369,0.7931966,-0.025929823457095935
CTV,2024-05-24,"Cybersecurity plan for federal government takes aim at 'inefficiencies, blind spots'",https://www.ctvnews.ca/canada/cybersecurity-plan-for-federal-government-takes-aim-at-inefficiencies-blind-spots-1.6899192,negative,0.027061429,0.3152755,0.6576631,-0.09866630504998142
CTV,2024-05-24,"Beyond books: Halifax libraries lends instruments, sports equipment, memory kits and more",https://atlantic.ctvnews.ca/beyond-books-halifax-libraries-lends-instruments-sports-equipment-memory-kits-and-more-1.6893992,positive,0.26594433,0.004721391,0.7293343,0.07070408822894159
CTV,2024-05-24,Murder retrial underway in case involving shooting death outside Clinton,https://london.ctvnews.ca/murder-retrial-underway-in-case-involving-shooting-death-outside-clinton-1.6898833,negative,0.016376201,0.45219597,0.53142774,-0.20421305640377696
CTV,2024-05-24,"'Heat dome' leads to sweltering temperatures in Mexico, Central America and U.S. South",https://www.ctvnews.ca/climate-and-environment/heat-dome-leads-to-sweltering-temperatures-in-mexico-central-america-and-u-s-south-1.6898885,negative,0.024133058,0.25330526,0.72256166,-0.06358115532156638
CBC,2024-05-24,Blackfoot language classes reconnect people to their culture,https://www.cbc.ca/player/play/video/9.4226602,neutral,0.2070025,0.02031546,0.7726821,0.04243731413857432
CBC,2024-05-24,Why an Ontario child-care centre faces closure after joining national $10/day program,https://www.cbc.ca/news/canada/toronto/ontario-child-care-daycare-10-federal-provincial-funding-1.7211652,negative,0.012474942,0.6036106,0.38391456,-0.3641900491600758
CBC,2024-05-24,International Court of Justice orders Israel to end military operation in Rafah,https://www.cbc.ca/news/world/icj-israel-gaza-military-campaign-1.7213567,neutral,0.04813915,0.18398854,0.76787233,-0.03153440106932237
CBC,2024-05-24,Israeli army recovers bodies of 3 more hostages from Gaza,https://www.cbc.ca/news/world/israel-hamas-war-day-231-1.7213523,neutral,0.025362693,0.20135199,0.77328527,-0.039899366681485304
CBC,2024-05-24,Hackers release corporate data stolen from London Drugs,https://www.cbc.ca/news/canada/british-columbia/hackers-london-drugs-data-1.7213141,negative,0.015708737,0.542182,0.4421093,-0.29371455576973915
CBC,2024-05-24,Tourist hotspots put visitors' money to work for the climate,https://www.cbc.ca/news/science/what-on-earth-tourist-fees-1.7212344,negative,0.035309955,0.47727534,0.48741475,-0.22654494676669223
CBC,2024-05-24,"Spinal surgeries needed for 22 on board turbulent Singapore Airlines flight, hospital says",https://www.cbc.ca/news/world/singapore-airlines-turbulence-passengers-hospital-update-1.7213352,negative,0.013486295,0.48716176,0.49935198,-0.23714468178731352
CBC,2024-05-24,"As NHL playoffs continue, Edmonton Oilers fans lean on superstition",https://www.cbc.ca/news/canada/edmonton/oilers-fans-superstition-1.7213012,neutral,0.07507517,0.12740722,0.7975177,-0.010596313186504336
CBC,2024-05-24,"Loblaws, Sobeys owners under investigation by Competition Bureau for alleged anti-competitive conduct",https://www.cbc.ca/news/politics/competition-bureau-probe-sobeys-loblaws-1.7213543,negative,0.016725715,0.5527825,0.43049186,-0.30528868408886467
CBC,2024-05-24,WATCH: CBC News Network,https://www.cbc.cahttps://gem.cbc.ca/live,neutral,0.10073908,0.018231502,0.88102955,0.00981596340483426
CBC,2024-05-24,This Toronto man just won a $70M Lotto Max jackpot,https://www.cbc.ca/player/play/video/9.4233631,positive,0.75181365,0.0096123805,0.23857401,0.5651313334673551
CBC,2024-05-24,"U.S. sues Live Nation, accusing Ticketmaster owner of illegal monopoly",https://www.cbc.ca/news/entertainment/doj-sues-live-nation-1.7212432,negative,0.018245606,0.4532141,0.5285404,-0.20507008745941135
CBC,2024-05-24,"Mercury poisoning near Grassy Narrows First Nation worsened by ongoing industrial pollution, study suggests",https://www.cbc.ca/news/canada/thunder-bay/grassy-narrows-first-nation-methylmercury-study-1.7211750,negative,0.008415678,0.7223665,0.26921773,-0.5217425959665576
CBC,2024-05-24,#TheMoment a giant inflatable duck blew across a Michigan road,https://www.cbc.ca/player/play/video/9.4233006,neutral,0.11325007,0.16925286,0.71749705,-0.015820952844945335
CBC,2024-05-24,"Norway, Ireland and Spain to recognize a Palestinian state",https://www.cbc.ca/news/world/palestinian-state-ireland-norway-spain-1.7210856,neutral,0.11868195,0.028390212,0.8529278,0.013279404263954575
CBC,2024-05-24,'Anti-competitive and illegal': U.S. DOJ vs. Ticketmaster,https://www.cbc.ca/player/play/video/9.4233894,negative,0.0118948,0.6193846,0.36872074,-0.3834956890628032
CBC,2024-05-24,Alcohol sales coming to some Ontario corner stores by September,https://www.cbc.ca/news/canada/toronto/alcohol-sales-convenience-stores-ontario-1.7213546,neutral,0.042812705,0.031930313,0.92525685,0.000813384315021537
CBC,2024-05-24,10-year-old Sask. boy qualifies for international braille competition,https://www.cbc.ca/player/play/video/9.4232793,positive,0.3300922,0.0039263917,0.6659814,0.10894543843032523
CBC,2024-05-24,"Connor McDavid scores in 2OT, Oilers win Game 1 of Western Conference final",https://www.cbc.ca/news/canada/edmonton/edmonton-oilers-dallas-sharks-1.7212971,positive,0.3668594,0.005059187,0.6280815,0.13456019626502247
CBC,2024-05-24,"Operatic Furiosa is bigger, but not better, than Fury Road. That's still more than enough",https://www.cbc.ca/news/entertainment/furiosa-review-1.7213051,positive,0.6254586,0.044269565,0.3302718,0.3892386812050681
CBC,2024-05-24,CSIS chief pushes back against PMO claim about mistake in intelligence report,https://www.cbc.ca/news/politics/csis-vigneault-telford-1.7212785,negative,0.021702988,0.22506025,0.75323665,-0.05018111952117543
CBC,2024-05-24,Louisiana passes bill to categorize abortion pills as controlled substances,https://www.cbc.ca/news/world/louisiana-mifepristone-bill-1.7213528,negative,0.012004978,0.54369533,0.44429964,-0.29546052488818475
CBC,2024-05-24,Seafood chain Red Lobster will ask Canadian court to enforce U.S. bankruptcy in Canada,https://www.cbc.ca/news/business/red-lobster-canada-seeking-enforce-bankruptcy-1.7212694,neutral,0.038445216,0.07171894,0.88983583,-0.0036655719246727614
CBC,2024-05-24,Why banning tweens from buying anti-aging products won't stop the Sephora kids,https://www.cbc.ca/news/canada/sephora-kids-bill-1.7210969,negative,0.031323414,0.52429616,0.44438043,-0.2739053125396387
CBC,2024-05-24,"Nothing highlights the generation gap quite like when I, a boomer, stay with the adult children in my life",https://www.cbc.ca/news/canada/first-person-generation-gap-boomers-millennials-1.7211033,negative,0.092229754,0.4034741,0.5042961,-0.15428502510761355
CBC,2024-05-24,"Abuse allegations at Quebec orphanage: Health authority, religious order agree to $65M settlement",https://www.cbc.ca/news/canada/montreal/65m-settlement-alleged-abuse-mont-d-youville-orphanage-1.7213090,negative,0.011178051,0.48520523,0.5036168,-0.23529912712068324
CBC,2024-05-24,#TheMoment a moose scoped out a Newfoundland property,https://www.cbc.ca/player/play/video/9.4234079,neutral,0.039427128,0.08204758,0.8785254,-0.005177303608726813
CBC,2024-05-24,University of Toronto says students have 24 hours to consider latest offer to end encampment,https://www.cbc.ca/news/canada/toronto/university-of-toronto-latest-offer-students-encampment-1.7213010,neutral,0.025904246,0.026994998,0.94710064,-5.770008136529725e-05
CBC,2024-05-24,WATCH | Insults and attacks in Parliament,https://www.cbc.cahttps://cbc.ca/player/play/video/9.4234044,negative,0.008867362,0.74117136,0.24996132,-0.5492563107777286
CBC,2024-05-24,"'You're going home, son': Emotions run high as body of unknown soldier is prepared for return to N.L.",https://www.cbc.ca/news/canada/newfoundland-labrador/repatriation-france-delegation-1.7212157,neutral,0.15025978,0.070583016,0.7791571,0.017596047064032838
CBC,2024-05-24,Bison may seem out of place in Nova Scotia — but they feel right at home on this new farm,https://www.cbc.ca/player/play/video/9.4230039,positive,0.82816774,0.007908101,0.16392401,0.6857993839197984
CBC,2024-05-24,Canadian dairy farmers urged to think about bird flu protections as U.S. identifies 2nd case,https://www.cbc.ca/news/health/ppe-dairy-farms-bird-flu-1.7212704,neutral,0.022138264,0.17708063,0.80078113,-0.030867442449203253
CBC,2024-05-24,Massive garbage dump becomes 'centre of the displaced' as thousands flee Rafah,https://www.cbc.ca/news/world/gaza-khan-younis-garbage-dump-1.7213244,negative,0.0064546717,0.8386777,0.15486771,-0.7033385796804552
CBC,2024-05-24,"Severe turbulence, emergency landing were 'surreal,' injured Singapore Airlines passenger says",https://www.cbc.ca/player/play/video/9.4233062,negative,0.0074324463,0.76923347,0.22333416,-0.5916648143918124
CBC,2024-05-24,What to expect from the 2024 Atlantic hurricane season,https://www.cbc.ca/player/play/video/9.4233856,neutral,0.04101159,0.07868419,0.8803042,-0.004509251092317701
CBC,2024-05-24,Trudeau's promised made-in-Canada vaccine plant hasn't produced any shots,https://www.cbc.ca/news/politics/trudeau-made-in-canada-covid-vaccine-novavax-1.7211462,negative,0.03648196,0.40413958,0.55937845,-0.16199786417279327
CBC,2024-05-24,Busy 2024 hurricane season expected in Atlantic Ocean,https://www.cbc.ca/news/canada/nova-scotia/weather-ryan-snoddon-hurricane-outlook-2024-1.7212351,neutral,0.18124259,0.043372512,0.7753849,0.030967699898155843
CBC,2024-05-24,U.S. attorney general says 'it is time' to break up Live Nation,https://www.cbc.ca/player/play/video/9.4233546,negative,0.017070293,0.5357108,0.4472189,-0.2866946787635243
CBC,2024-05-24,Trudeau gets an earful on defence spending from nearly one-quarter of the U.S. Senate,https://www.cbc.ca/news/politics/senators-note-canada-nato-spending-1.7212784,positive,0.4027709,0.02292116,0.574308,0.16169900037989393
CBC,2024-05-24,Woman becomes Canadian citizen for a 2nd time after IRCC revokes it over 'error',https://www.cbc.ca/news/canada/toronto/woman-gets-citizenship-after-ircc-cancelled-due-to-error-1.7210556,negative,0.028392635,0.2923271,0.67928016,-0.0846490183377675
CBC,2024-05-24,WATCH : CBC News Explore,https://www.cbc.cahttps://gem.cbc.ca/live,neutral,0.09840742,0.014817321,0.88677526,0.009464467482493077
CBC,2024-05-24,"Women in Gaza giving birth without enough painkillers, clean water or food",https://www.cbc.ca/news/world/women-gaza-birth-pregnancies-1.7143489,negative,0.0078058904,0.8240989,0.16809516,-0.6790781013514255
