source,date,headline,url,chosen_label,positive,negative,neutral,compound
Global,2024-07-13,Global News Hour at 6 Edmonton: July 12,https://globalnews.ca/video/10621327/global-news-hour-at-6-edmonton-july-12-7/,neutral,0.04339113,0.010553616,0.9460553,0.0017714100596646354
Global,2024-07-13,B.C. wildfires: Ancient forest east of Prince George threatened,https://globalnews.ca/video/10621344/ancient-forest-east-of-prince-george-threatened-by-wildfire/,negative,0.01116745,0.5873687,0.4014638,-0.3448773088296626
Global,2024-07-13,Tourist trampled to death by elephants while taking photos in South Africa,https://globalnews.ca/news/10614418/spanish-tourist-trampled-death-elephants-south-africa/,negative,0.010073367,0.8043265,0.18560004,-0.6468396998740786
Global,2024-07-13,Vancouver Island University tells pro-Palestinian protesters to vacate encampment,https://globalnews.ca/news/10620126/vancouver-island-university-trespass-notice/,negative,0.020223107,0.32312435,0.65665257,-0.10400036175025562
Global,2024-07-13,Global News at 5 Lethbridge: July 12,https://globalnews.ca/video/10621207/global-news-at-5-lethbridge-july-12-4/,neutral,0.033244185,0.017466525,0.94928926,0.0008000968049309831
Global,2024-07-13,Concerns raised about proposed West Hillhurst development,https://globalnews.ca/news/10620824/concerns-west-hillhurst-development-calgary/,neutral,0.025184546,0.19082943,0.78398603,-0.03578160869388114
Global,2024-07-13,Fire that forced evacuation of Labrador City was nearly out — but then it exploded,https://globalnews.ca/news/10621931/fire-evacuation-labrador-exploded/,negative,0.018849904,0.5941576,0.38699254,-0.35266788955847694
Global,2024-07-13,"Heiltsuk Nation celebrates ‘powerful, emotional’ return of historic chief’s seat",https://globalnews.ca/video/10621323/heiltsuk-nation-celebrates-powerful-emotional-return-of-historic-chiefs-seat/,positive,0.873242,0.0027780384,0.12398011,0.7625437468371912
Global,2024-07-13,Chow ambitious as mayor enters 2nd year on job: ‘We can do a lot more’,https://globalnews.ca/news/10618002/olivia-chow-toronto-1-year-interview/,positive,0.8393896,0.0054541654,0.15515636,0.704545053075516
Global,2024-07-13,Ontario Road Trips: Why Leamington is a hot place to be right now,https://globalnews.ca/news/10617082/ontario-road-trips-leamington-kingsville/,positive,0.2632848,0.011966322,0.72474897,0.0691756719606822
Global,2024-07-13,Costco members in Canada will have to pay more starting this fall,https://globalnews.ca/news/10616716/costco-membership-fee-hike-canada-us/,negative,0.029241616,0.5156885,0.45506987,-0.26507954938797695
Global,2024-07-13,"How to avoid shark attacks, according to experts",https://globalnews.ca/video/10620285/how-to-avoid-shark-attacks-according-to-experts/,neutral,0.10895704,0.06996416,0.8210788,0.006976652750179113
Global,2024-07-13,Costco members in Canada will have to pay more starting this fall,https://globalnews.ca/video/10616896/costco-members-in-canada-will-have-to-pay-more-starting-this-fall/,negative,0.029241616,0.5156885,0.45506987,-0.26507954938797695
Global,2024-07-13,B.C. couple on a sailing adventure across the Atlantic have been found dead in Nova Scotia,https://globalnews.ca/video/10621329/b-c-couple-on-a-sailing-adventure-across-the-atlantic-have-been-found-dead-in-nova-scotia/,negative,0.017702708,0.27852434,0.70377296,-0.07726242198474509
Global,2024-07-13,Judge in Coutts murder-conspiracy trial warns jury about defence statement,https://globalnews.ca/news/10621219/coutts-murder-conspiracy-trial-alberta-blockade/,negative,0.015912531,0.32657787,0.6575096,-0.10639988854593163
Global,2024-07-13,Clients raise concerns over animal care at Calgary pet hospital,https://globalnews.ca/video/10621254/clients-raise-concerns-over-animal-care-at-calgary-pet-hospital/,negative,0.0139046265,0.5103062,0.47578916,-0.26021907288667734
Global,2024-07-13,Massive AT&T data breach includes calls to Canada,https://globalnews.ca/news/10619289/att-data-breach-2022-canada/,negative,0.01823072,0.68908876,0.29268053,-0.47451094191044874
Global,2024-07-13,"Not everyone has AC, but do you have a legal ‘right to cooling’ in Canada?",https://globalnews.ca/news/10620062/right-to-cooling-legal-tenants-farmworkers-air-conditioning/,neutral,0.05282511,0.06104561,0.8861292,-0.0009360750492937164
Global,2024-07-13,Great White North: Why more sharks are heading to Canada,https://globalnews.ca/news/10602228/sharks-canada-ocean-warming-climate-change/,neutral,0.025479421,0.10975399,0.8647666,-0.011396736508491045
Global,2024-07-13,17-year-old girl reportedly falls from ride at Canada’s Wonderland,https://globalnews.ca/video/10620317/17-year-old-girl-reportedly-falls-from-ride-at-canadas-wonderland/,negative,0.018727478,0.45916355,0.52210915,-0.21048036517718316
Global,2024-07-13,‘Rust’ trial: Live bullets also found in actor Jensen Ackles’ prop holster,https://globalnews.ca/news/10619495/alec-baldwin-rust-trial-jensen-ackles-live-bullets/,negative,0.01624453,0.25278974,0.73096585,-0.06363873754750671
Global,2024-07-13,"Poilievre calls Trudeau a ‘joke’ on world stage, won’t commit to NATO timeline",https://globalnews.ca/news/10619936/pierre-poilievre-justin-trudeau-joke-canada-defence-spending-nato/,negative,0.009888865,0.73701155,0.2530996,-0.5430882158065948
Global,2024-07-13,Ontario Road Trips: Why Leamington is a hot place to be right now,https://globalnews.ca/video/10621433/ontario-road-trips-why-leamington-is-a-hot-place-to-be-right-now/,positive,0.2632848,0.011966322,0.72474897,0.0691756719606822
Global,2024-07-13,Telus tells Ontario call centre workers to relocate or risk losing their job,https://globalnews.ca/news/10617207/telus-ontario-call-centre-workers-relocate/,negative,0.015920995,0.538101,0.445978,-0.28929922687293086
Global,2024-07-13,Scarborough woman pleads guilty to manslaughter after leaving baby unattended in bathtub,https://globalnews.ca/video/10618639/scarborough-woman-pleads-guilty-to-manslaughter-after-leaving-baby-unattended-in-bathtub/,negative,0.011137383,0.6794476,0.30941507,-0.4615249684846834
Global,2024-07-13,Is Canada’s housing market perking up after interest rate cut?,https://globalnews.ca/video/10621393/is-canadas-housing-market-perking-up-after-interest-rate-cut/,neutral,0.2179115,0.009991968,0.7720965,0.04738558398056192
Global,2024-07-13,Witnesses recount injury at Canada’s Wonderland,https://globalnews.ca/video/10621025/witnesses-recount-injury-at-canadas-wonderland/,negative,0.023881622,0.24655268,0.72956556,-0.06021792370762746
Global,2024-07-13,Poilievre vows to shut down some supervised drug consumption sites,https://globalnews.ca/video/10621307/poilievre-vows-to-shut-down-some-supervised-drug-consumption-sites/,negative,0.015291807,0.44810712,0.53660107,-0.20056615456519467
Global,2024-07-13,How Project 2025 could upend Canada-U.S. relationship under Trump,https://globalnews.ca/news/10617647/donald-trump-project-2025-canada-us-election/,neutral,0.0775635,0.052447557,0.86998886,0.0032653526021442225
Global,2024-07-13,"Trudeau at NATO summit, a slow housing market: Top stories this week",https://globalnews.ca/news/10620460/trudeau-nato-slow-housing-market-top-stories/,neutral,0.031325743,0.17313302,0.7955412,-0.028993741065552747
Global,2024-07-13,Concerns raised about proposed West Hillhurst development,https://globalnews.ca/video/10621194/concerns-raised-about-proposed-west-hillhurst-development/,neutral,0.025184546,0.19082943,0.78398603,-0.03578160869388114
Global,2024-07-13,"Jennifer Lopez, Ben Affleck selling their $92M Beverly Hills mansion",https://globalnews.ca/news/10619806/jennifer-lopez-ben-affleck-mansion-house-for-sale/,neutral,0.069688894,0.014572479,0.9157385,0.004644190536495785
Global,2024-07-13,Weekend Dish: tacos in a pan,https://globalnews.ca/video/10620164/weekend-dish-tacos-in-a-pan/,neutral,0.22191186,0.0136556225,0.76443243,0.04905841743607198
Global,2024-07-13,Global News Hour at 6 Calgary: July 12,https://globalnews.ca/video/10621320/global-news-hour-at-6-calgary-july-12-4/,neutral,0.042119965,0.009567234,0.9483129,0.0016825569222249648
Global,2024-07-13,Bernard Avenue apartment fire on Friday was fatal: Kelowna RCMP,https://globalnews.ca/news/10621914/kelowna-bernard-avenue-fatal-apartment-fire/,negative,0.0186135,0.4193314,0.56205505,-0.17549238632492958
CTV,2024-07-13,What a geriatric doctor wishes you knew now for healthy aging,https://www.ctvnews.ca/health/what-a-geriatric-doctor-wishes-you-knew-now-for-healthy-aging-1.6962548,negative,0.04620468,0.58108157,0.37271366,-0.3355209648560109
CTV,2024-07-13,B.C. buyers who backed out of home purchase ordered to pay more than $350K in damages,https://bc.ctvnews.ca/b-c-buyers-who-backed-out-of-home-purchase-ordered-to-pay-more-than-350k-in-damages-1.6955911,negative,0.0083364295,0.7297562,0.26190725,-0.5324746886196241
CTV,2024-07-13,Novice driver fled police travelling 188 km/h on Hwy. 11 while allegedly impaired,https://northernontario.ctvnews.ca/novice-driver-fled-police-travelling-188-km-h-on-hwy-11-while-allegedly-impaired-1.6954935,negative,0.016850483,0.5421615,0.44098806,-0.293655148726117
CTV,2024-07-13,French sports minister takes a dip in the Seine ahead of Paris Olympics,https://www.ctvnews.ca/sports/french-sports-minister-takes-a-dip-in-the-seine-ahead-of-paris-olympics-1.6962874,neutral,0.028689634,0.1459364,0.82537407,-0.020474325211140787
CTV,2024-07-13,Collision between cyclist and truck in Saskatoon sends 1 to hospital,https://saskatoon.ctvnews.ca/collision-between-cyclist-and-truck-in-saskatoon-sends-1-to-hospital-1.6963001,negative,0.01465936,0.5415241,0.4438166,-0.29303343631680434
CTV,2024-07-13,Two people dead after shooting in Oshawa; 1 person in custody,https://toronto.ctvnews.ca/two-people-dead-after-shooting-in-oshawa-1-person-in-custody-1.6963000,negative,0.00826454,0.7524169,0.23931848,-0.5660629573547427
CTV,2024-07-13,'I thought we were having an earthquake': tractor trailer strikes N.B. home,https://atlantic.ctvnews.ca/i-thought-we-were-having-an-earthquake-tractor-trailer-strikes-n-b-home-1.6962746,negative,0.012544472,0.6074301,0.38002557,-0.3688138927011586
CTV,2024-07-13,Missing Polish coal miner found alive more than two days after an earthquake,https://www.ctvnews.ca/world/missing-polish-coal-miner-found-alive-more-than-two-days-after-an-earthquake-1.6962774,negative,0.02254405,0.4481188,0.5293371,-0.20030224240227845
CTV,2024-07-13,'I nearly died': WestJet employee and Spice Girls superfan dances with Mel C,https://calgary.ctvnews.ca/i-nearly-died-westjet-employee-and-spice-girls-superfan-dances-with-mel-c-1.6959692,negative,0.04899311,0.5143981,0.43660876,-0.26220509219605503
CTV,2024-07-13,Large crash on Highway 11 in Oro-Medonte,https://barrie.ctvnews.ca/large-crash-on-highway-11-in-oro-medonte-1.6962818,negative,0.026644034,0.44444478,0.5289112,-0.19682126712342018
CTV,2024-07-13,"RCMP seek witnesses after fatal crash down 300-metre embankment near Mission, B.C.",https://bc.ctvnews.ca/rcmp-seek-witnesses-after-fatal-crash-down-300-metre-embankment-near-mission-b-c-1.6962981,negative,0.016122036,0.46645266,0.5174253,-0.21731816204507481
CTV,2024-07-13,Ont. man facing sex assault charges after meeting up with 12-year-old at motel,https://kitchener.ctvnews.ca/ont-man-facing-sex-assault-charges-after-meeting-up-with-12-year-old-at-motel-1.6961458,negative,0.0067774556,0.72276807,0.27045435,-0.5223478318900199
CTV,2024-07-13,Montreal tenant 'appalled' after landlord orders removal of Palestinian flag,https://montreal.ctvnews.ca/montreal-tenant-appalled-after-landlord-orders-removal-of-palestinian-flag-1.6962093,negative,0.007214544,0.762575,0.2302104,-0.5814686038295225
CTV,2024-07-13,'Sky's the limit': Winnipeg's breaking community hopes to see sport grow with Olympic debut,https://winnipeg.ctvnews.ca/sky-s-the-limit-winnipeg-s-breaking-community-hopes-to-see-sport-grow-with-olympic-debut-1.6961523,positive,0.70605135,0.0041881395,0.28976068,0.49849086339034976
CTV,2024-07-13,All-night journeys for some fleeing roaring wildfire near Labrador City,https://www.ctvnews.ca/canada/all-night-journeys-for-some-fleeing-roaring-wildfire-near-labrador-city-1.6962754,negative,0.021561164,0.23414813,0.74429065,-0.05436047571973468
CTV,2024-07-13,"2 bodies of people believed to be from B.C. wash ashore Sable Island, N.S.",https://atlantic.ctvnews.ca/2-bodies-of-people-believed-to-be-from-b-c-wash-ashore-sable-island-n-s-1.6961444,neutral,0.026342632,0.09780384,0.8758535,-0.008871660386639224
CTV,2024-07-13,Family members devastated by death of Toronto man allegedly swarmed by teens,https://toronto.ctvnews.ca/family-members-devastated-by-death-of-toronto-man-allegedly-swarmed-by-teens-1.6962152,negative,0.009134461,0.68977726,0.30108836,-0.4757091621734819
CTV,2024-07-13,Inside the courtroom as case dismissed against Alec Baldwin in fatal shooting of cinematographer,https://www.ctvnews.ca/entertainment/inside-the-courtroom-as-case-dismissed-against-alec-baldwin-in-fatal-shooting-of-cinematographer-1.6962735,negative,0.016960923,0.3802137,0.60282534,-0.14427480156766315
CTV,2024-07-13,Crews searching for Alta. man swept away by river in B.C.,https://bc.ctvnews.ca/crews-searching-for-alta-man-swept-away-by-river-in-b-c-1.6963047,neutral,0.018803366,0.14714438,0.8340523,-0.021297893826144332
CTV,2024-07-13,SpaceX rocket accident leaves company's Starlink satellites in wrong orbit,https://www.ctvnews.ca/business/spacex-rocket-accident-leaves-company-s-starlink-satellites-in-wrong-orbit-1.6961919,negative,0.02150871,0.48893288,0.48955843,-0.2385927198564488
CTV,2024-07-13,Preteen author provides guide for parenting in new book,https://montreal.ctvnews.ca/preteen-author-provides-guide-for-parenting-in-new-book-1.6963025,neutral,0.1318574,0.008302198,0.8598406,0.0173174259365938
CTV,2024-07-13,Four people in hospital after two-vehicle crash in Stayner,https://barrie.ctvnews.ca/four-people-in-hospital-after-two-vehicle-crash-in-stayner-1.6962955,negative,0.01886991,0.56409985,0.41703033,-0.31785249931999715
CTV,2024-07-13,Hearing on Sask.'s request to stop collection of carbon money cancelled,https://regina.ctvnews.ca/hearing-on-sask-s-request-to-stop-collection-of-carbon-money-cancelled-1.6962013,negative,0.012709936,0.2965444,0.69074565,-0.0877770401413045
CTV,2024-07-13,"Dr. Ruth Westheimer, America’s pioneering sex therapist, dies at 96",https://www.ctvnews.ca/entertainment/dr-ruth-westheimer-america-s-pioneering-sex-therapist-dies-at-96-1.6962804,neutral,0.15028182,0.047404528,0.80231357,0.020337444391834936
CTV,2024-07-13,"5 people escape hot, acidic pond after SUV drove into inactive geyser in Yellowstone",https://www.ctvnews.ca/world/5-people-escape-hot-acidic-pond-after-suv-drove-into-inactive-geyser-in-yellowstone-1.6962489,negative,0.012017171,0.6450457,0.34293726,-0.4159394449120981
CTV,2024-07-13,Charges pending after toddler left in car in Walmart parking lot: Edmonton police,https://edmonton.ctvnews.ca/charges-pending-after-toddler-left-in-car-in-walmart-parking-lot-edmonton-police-1.6961827,negative,0.009345938,0.51159656,0.47905752,-0.2616436789678698
CTV,2024-07-13,Archaeologists from Alberta and Sask. are studying a site this local historian stumbled upon,https://saskatoon.ctvnews.ca/archaeologists-from-alberta-and-sask-are-studying-a-site-this-local-historian-stumbled-upon-1.6962177,neutral,0.083139904,0.0060567516,0.91080326,0.006875566302521285
CTV,2024-07-13,Calls to enforce leash bylaws in North Vancouver after dog mauled to death,https://bc.ctvnews.ca/calls-to-enforce-leash-bylaws-in-north-vancouver-after-dog-mauled-to-death-1.6962556,negative,0.009089062,0.7461229,0.244788,-0.5566167990065765
CTV,2024-07-13,LIVE SOON: Officials provide update on Calgary water supply,/video/c68596-live--calgary-offers-update-on-water-main-work?playlistId=1.6915886,neutral,0.04495498,0.011429112,0.9436158,0.0018903295120420438
CTV,2024-07-13,Jewish advocates say details around investigation into human-rights chief murky,https://www.ctvnews.ca/politics/jewish-advocates-say-details-around-investigation-into-human-rights-chief-murky-1.6961498,neutral,0.021917798,0.2209885,0.75709367,-0.04835553162075712
CTV,2024-07-13,"'We grieve together': Youth found dead after flash flood in Wolfville, N.S.",https://atlantic.ctvnews.ca/more/we-grieve-together-youth-found-dead-after-flash-flood-in-wolfville-n-s-1.6961544,negative,0.040888593,0.3036458,0.65546554,-0.0905289029940306
CTV,2024-07-13,Ontario driver has licence suspended for 13-year-old traffic ticket,https://toronto.ctvnews.ca/ontario-driver-has-licence-suspended-for-13-year-old-traffic-ticket-1.6962366,negative,0.008295831,0.67446786,0.31723633,-0.4548380556856273
CTV,2024-07-13,Calgary man wanted on Canada-wide warrant for murder,https://calgary.ctvnews.ca/calgary-man-wanted-on-canada-wide-warrant-for-murder-1.6962189,negative,0.009647688,0.8254232,0.16492932,-0.681230216623776
CTV,2024-07-13,"Active investigation in Chippewas of the Thames First Nation, heavy police presence",https://london.ctvnews.ca/active-investigation-in-chippewas-of-the-thames-first-nation-heavy-police-presence-1.6963028,neutral,0.05939154,0.04404785,0.8965606,0.001587141781500545
CTV,2024-07-13,"Gaza safe zone attacked by IDF, killing 71 Palestinians",/video/c2957788-idf-airstrike-palestinians-in-humanitarian-zone?playlistId=1.6893802,negative,0.009624346,0.8420956,0.14827995,-0.7090324559217986
CTV,2024-07-13,Annual Butter Tart Festival returns to Barrie,https://barrie.ctvnews.ca/annual-butter-tart-festival-returns-to-barrie-1.6962837,positive,0.22553384,0.0062065357,0.7682595,0.05082701279924606
CTV,2024-07-13,'Her whole future ahead of her': Sask. photographer captures Manitoba graduate posing on iceberg,https://winnipeg.ctvnews.ca/her-whole-future-ahead-of-her-sask-photographer-captures-manitoba-graduate-posing-on-iceberg-1.6957208,positive,0.32662135,0.007128863,0.6662499,0.10663065937034943
CTV,2024-07-13,"A detailed look at children's brains might show how sex and gender are different, new study says",https://www.ctvnews.ca/health/a-detailed-look-at-children-s-brains-might-show-how-sex-and-gender-are-different-new-study-says-1.6962554,neutral,0.048877448,0.027921556,0.92320096,0.0016093923061639703
CTV,2024-07-13,1 hospitalized following Saturday morning stabbing at Drop-In Centre,https://calgary.ctvnews.ca/1-hospitalized-following-saturday-morning-stabbing-at-drop-in-centre-1.6962986,negative,0.013150695,0.57612914,0.4107202,-0.3317518267160562
CTV,2024-07-13,'I told you it wasn't a dream': Ontario couple retires after winning $55-million Lotto Max jackpot,https://toronto.ctvnews.ca/i-told-you-it-wasn-t-a-dream-ontario-couple-retires-after-winning-55-million-lotto-max-jackpot-1.6961975,neutral,0.16005935,0.08376188,0.7561786,0.018602954481133693
CTV,2024-07-13,Housing on track to become the most concerning issue for surveyed Canadians: Nanos,https://www.ctvnews.ca/canada/housing-on-track-to-become-the-most-concerning-issue-for-surveyed-canadians-nanos-1.6957555,negative,0.014939696,0.62655425,0.358506,-0.3923470901603032
CTV,2024-07-13,Toronto's iconic 'Leslieville dollhouse' set to hit the market on Thursday,https://toronto.ctvnews.ca/toronto-s-iconic-leslieville-dollhouse-set-to-hit-the-market-on-thursday-1.6958856,positive,0.23562284,0.0037567294,0.7606206,0.05550397081368175
CTV,2024-07-13,Speed bumps aim to slow cyclists down in the Plateau,https://montreal.ctvnews.ca/speed-bumps-aim-to-slow-cyclists-down-in-the-plateau-1.6962589,negative,0.019319722,0.4928477,0.48783255,-0.2425256288853319
CTV,2024-07-13,Canada's defence spending commitment presents unsavoury choices: economists,https://www.ctvnews.ca/politics/canada-s-defence-spending-commitment-presents-unsavoury-choices-economists-1.6961904,negative,0.010687295,0.5641085,0.42520422,-0.3181041713527968
CTV,2024-07-13,'The guys definitely deserve it': Riders head coach calls out fans ahead of next home game,https://regina.ctvnews.ca/the-guys-definitely-deserve-it-riders-head-coach-calls-out-fans-ahead-of-next-home-game-1.6962942,positive,0.78240645,0.0050586197,0.21253474,0.6121343894501301
CTV,2024-07-13,"Man hit on the head with a bottle, police arrest 21-year-old",https://windsor.ctvnews.ca/man-hit-on-the-head-with-a-bottle-police-arrest-21-year-old-1.6962990,negative,0.013475515,0.594217,0.39230743,-0.3529122731334322
CTV,2024-07-13,Would a Trump victory cause Canada to spend more on defence and abandon Ukraine?,https://www.ctvnews.ca/canada/would-a-trump-victory-cause-canada-to-spend-more-on-defence-and-abandon-ukraine-1.6962038,negative,0.02477537,0.38653207,0.58869255,-0.14879323230117691
CTV,2024-07-13,'There are no words': N.S. mayor on deadly flash flooding,/video/c2957707-wolfville-mayor-on-deadly-flashing-flooding?playlistId=1.6961490,negative,0.01052719,0.72861147,0.26086128,-0.5307638941472348
CTV,2024-07-13,Should you wait to buy or sell your home?,https://ottawa.ctvnews.ca/should-you-wait-to-buy-or-sell-your-home-1.6962920,neutral,0.03868438,0.024559818,0.9367558,0.0008932969004606939
CTV,2024-07-13,Video released of wild police car chase involving white Lamborghini north of Toronto,https://toronto.ctvnews.ca/video-released-of-wild-police-car-chase-involving-white-lamborghini-north-of-toronto-1.6961914,neutral,0.032831416,0.09842246,0.86874604,-0.008609084212876539
CTV,2024-07-13,Two vehicle collision north of Goderich claims the life of a motorcycle driver,https://london.ctvnews.ca/two-vehicle-collision-north-of-goderich-claims-the-life-of-a-motorcycle-driver-1.6963048,negative,0.014133523,0.60614973,0.37971663,-0.36721781328151337
CTV,2024-07-13,Tony Grace named new anchor of CTV Kitchener’s News at 6,https://kitchener.ctvnews.ca/tony-grace-named-new-anchor-of-ctv-kitchener-s-news-at-6-1.6961647,neutral,0.09942699,0.004544095,0.8960288,0.009865087183391186
CTV,2024-07-13,'Aggressive inferno' outside Labrador City: N.L. premier,/video/c2957787-n-l--wildfire-reached-10k-hectares--premier?playlistId=1.6962185,negative,0.008387938,0.6998711,0.2917409,-0.4897492725405357
CTV,2024-07-13,He thought his gnomes were stolen. But then a secret society returned them,https://bc.ctvnews.ca/he-thought-his-gnomes-were-stolen-but-then-a-secret-society-returned-them-1.6959366,negative,0.037169185,0.23168845,0.7311424,-0.052297982811472465
CTV,2024-07-13,"Man, 57, allegedly kidnapped in Vaughan: police",https://toronto.ctvnews.ca/man-57-allegedly-kidnapped-in-vaughan-police-1.6962956,negative,0.015206878,0.42009524,0.56469786,-0.17624876962905844
CTV,2024-07-13,Rare marine fossil found in eastern Saskatchewan,https://regina.ctvnews.ca/rare-marine-fossil-found-in-eastern-saskatchewan-1.6961570,positive,0.26298836,0.009222181,0.72778934,0.06907785848444092
CTV,2024-07-13,"A B.C. man owes $27,000 in COVID benefit repayments. He's fighting back and is not the only one",https://www.ctvnews.ca/canada/a-b-c-man-owes-27-000-in-covid-benefit-repayments-he-s-fighting-back-and-is-not-the-only-one-1.6961962,negative,0.049087502,0.5293895,0.421523,-0.27784366123729765
CTV,2024-07-13,Western allies make the case for NATO in terms that would appeal to Trump,https://www.ctvnews.ca/world/western-allies-make-the-case-for-nato-in-terms-that-would-appeal-to-trump-1.6962812,neutral,0.1475036,0.0460961,0.8064003,0.01963246130810603
CTV,2024-07-13,Northern Ont. First Nation chief among Indigenous leaders upset with Poilievre’s AFN speech,https://northernontario.ctvnews.ca/northern-ont-first-nation-chief-among-indigenous-leaders-upset-with-poilievre-s-afn-speech-1.6962235,negative,0.0083850585,0.5856275,0.40598738,-0.34288928949322184
CTV,2024-07-13,Can AI be an author? Federal Court asked to decide in new copyright case,https://www.ctvnews.ca/sci-tech/can-ai-be-an-author-federal-court-asked-to-decide-in-new-copyright-case-1.6962705,neutral,0.061286215,0.031754773,0.906959,0.0027476349418207313
CTV,2024-07-13,"Two tornadoes confirmed for London, Ont. on July 10",https://london.ctvnews.ca/two-tornadoes-confirmed-for-london-ont-on-july-10-1.6962904,negative,0.02298819,0.27918187,0.6978299,-0.07741406561675923
CTV,2024-07-13,'Justice system failed me': Calgary woman speaks out after sex assault trial cut short,https://calgary.ctvnews.ca/justice-system-failed-me-calgary-woman-speaks-out-after-sex-assault-trial-cut-short-1.6962237,negative,0.0045486265,0.91977143,0.075679906,-0.8459588466222692
CTV,2024-07-13,'Extreme fire behaviour': Labrador City ordered evacuated as wildfire approaches,https://www.ctvnews.ca/climate-and-environment/extreme-fire-behaviour-labrador-city-ordered-evacuated-as-wildfire-approaches-1.6962213,negative,0.012610443,0.54376805,0.44362152,-0.2955246672540994
CTV,2024-07-13,Thousands without power as thunderstorms roll through southern Manitoba,https://winnipeg.ctvnews.ca/thousands-without-power-as-thunderstorms-roll-through-southern-manitoba-1.6962891,negative,0.013807286,0.7445164,0.24167643,-0.5541139115270539
CTV,2024-07-13,Tips for staying safe against blue-green algae this summer,https://atlantic.ctvnews.ca/tips-for-staying-safe-against-blue-green-algae-this-summer-1.6963005,neutral,0.17683806,0.048064604,0.7750973,0.028961495427139994
CTV,2024-07-13,New funding from VIA hopes to build on investments in Windsor-Quebec corridor,https://windsor.ctvnews.ca/new-funding-from-via-hopes-to-build-on-investments-in-windsor-quebec-corridor-1.6962901,positive,0.3535651,0.0075217425,0.63891304,0.12495174226464201
CTV,2024-07-13,"Housing complex for asylum seekers closing in Cornwall, Ont.",https://ottawa.ctvnews.ca/housing-complex-for-asylum-seekers-closing-in-cornwall-ont-1.6962310,neutral,0.01673232,0.10513327,0.8781345,-0.010773027246235856
CTV,2024-07-13,How division between Democrats is impacting Biden's campaign,/video/c2957798-joe-biden-on-campaign-trail?playlistId=1.6919983,negative,0.019107735,0.42899308,0.55189914,-0.18366997844578847
