source,date,headline,url,chosen_label,positive,negative,neutral,compound
CTV,2024-05-19,Cost of living causing consumers to turn to 'ugly food',/video/c2925122-ctv-national-news--what-is-ugly-food-,negative,0.010437549,0.7691715,0.22039089,-0.5915158854766798
CTV,2024-05-19,"Residents evacuated after threats made to residence in Fall River, N.S.",https://atlantic.ctvnews.ca/residents-evacuated-after-threats-made-to-residence-in-fall-river-n-s-1.6893113,neutral,0.0192451,0.18527906,0.79547584,-0.033957954761998366
CTV,2024-05-19,Woman killed in Montreal's Saint-Michel district: ex-husband arrested,https://montreal.ctvnews.ca/woman-killed-in-montreal-s-saint-michel-district-ex-husband-arrested-1.6893100,negative,0.00999031,0.5601674,0.42984232,-0.313687661727192
CTV,2024-05-19,"Manitoulin Island community looks to calm traffic, make community safer",https://northernontario.ctvnews.ca/manitoulin-island-community-looks-to-calm-traffic-make-community-safer-1.6892786,positive,0.40121272,0.013697099,0.58509016,0.16078404968088478
CTV,2024-05-19,Man shot after dispute outside house in Scarborough,https://toronto.ctvnews.ca/man-shot-after-dispute-outside-house-in-scarborough-1.6893089,negative,0.01601379,0.4616101,0.5223762,-0.21282741070958267
CTV,2024-05-19,"Nanos: Trudeau, Poilievre 'drowning on credibility'",/video/c2925145-nanos--leaders-score-poorly-on-credibility,negative,0.014467682,0.3807929,0.6047393,-0.1447939517616632
CTV,2024-05-19,"'Irate male' assaulted Newfoundland officers with block of cheese, police say",https://www.ctvnews.ca/canada/irate-male-assaulted-newfoundland-officers-with-block-of-cheese-police-say-1.6881630,negative,0.006508384,0.80473924,0.18875234,-0.6475628917905487
CTV,2024-05-19,Evacuation orders lifted in Fort McMurray Saturday as rain dampens wildfire activity,https://edmonton.ctvnews.ca/evacuation-orders-lifted-in-fort-mcmurray-saturday-as-rain-dampens-wildfire-activity-1.6892718,neutral,0.039169863,0.07274939,0.8880807,-0.0037581967634778835
CTV,2024-05-19,'Altercation' in Penticton leaves 1 dead: RCMP,https://bc.ctvnews.ca/altercation-in-penticton-leaves-1-dead-rcmp-1.6883954,negative,0.0067205396,0.6865775,0.30670196,-0.47134349631639694
CTV,2024-05-19,Lyon-bound Air Canada Boeing 787-8 Dreamliner from Montreal turns back midflight due to pressurization alert,https://montreal.ctvnews.ca/lyon-bound-air-canada-boeing-787-8-dreamliner-from-montreal-turns-back-midflight-due-to-pressurization-alert-1.6892870,neutral,0.024760894,0.21853879,0.7567003,-0.047146106656803966
CTV,2024-05-19,Red Deer shopping mall locked down after Saturday night weapon sighting,https://edmonton.ctvnews.ca/red-deer-shopping-mall-locked-down-after-saturday-night-weapon-sighting-1.6893202,negative,0.007804729,0.5892066,0.4029888,-0.3471034061581122
CTV,2024-05-19,Two people injured in robbery at Fairview Park Mall: police,https://kitchener.ctvnews.ca/two-people-injured-in-robbery-at-fairview-park-mall-police-1.6892972,negative,0.011049625,0.63084,0.3581103,-0.3978370526615791
CTV,2024-05-19,Man charged after downtown Barrie fire,https://barrie.ctvnews.ca/man-charged-after-downtown-barrie-fire-1.6892959,negative,0.010676579,0.47139,0.5179334,-0.2220945371559946
CTV,2024-05-19,Saskatchewan Roughriders visit Saskatoon for Green and White day,https://saskatoon.ctvnews.ca/saskatchewan-roughriders-visit-saskatoon-for-green-and-white-day-1.6893006,neutral,0.06500188,0.006067082,0.9289312,0.004188426912861143
CTV,2024-05-19,"Doctors, patients want options to reduce dialysis waste adding to climate change",https://bc.ctvnews.ca/doctors-patients-want-options-to-reduce-dialysis-waste-adding-to-climate-change-1.6892681,neutral,0.054732386,0.20068851,0.74457914,-0.037280240479065085
CTV,2024-05-19,"As Canada renews strategy for Rohingya crisis, advocates urge rethink",https://www.ctvnews.ca/canada/as-canada-renews-strategy-for-rohingya-crisis-advocates-urge-rethink-1.6893076,neutral,0.02351112,0.16982645,0.8066624,-0.028288258773969233
CTV,2024-05-19,Starbucks fan on decades-long journey to visit every store in the world,https://bc.ctvnews.ca/starbucks-fan-on-decades-long-journey-to-visit-every-store-in-the-world-1.6889784,positive,0.4842591,0.024359178,0.4913817,0.23391351944738226
CTV,2024-05-19,SIU investigating death of 28-year-old woman,https://barrie.ctvnews.ca/siu-investigating-death-of-28-year-old-woman-1.6892893,negative,0.013795907,0.48443508,0.501769,-0.2344870209751626
CTV,2024-05-19,Impaired driver sentenced to 7 years after double-fatal Cambridge crash,https://kitchener.ctvnews.ca/impaired-driver-sentenced-to-7-years-after-double-fatal-cambridge-crash-1.6891411,negative,0.011967394,0.769268,0.21876463,-0.5916299776115164
CTV,2024-05-19,Signs of Alzheimer’s were everywhere. Then his brain improved,https://www.ctvnews.ca/health/signs-of-alzheimer-s-were-everywhere-then-his-brain-improved-1.6892854,negative,0.045035865,0.5182635,0.43670067,-0.26656881723698067
CTV,2024-05-19,"Diddy admits beating ex-girlfriend Cassie, says he's sorry, calls his actions 'inexcusable'",https://www.ctvnews.ca/entertainment/diddy-admits-beating-ex-girlfriend-cassie-says-he-s-sorry-calls-his-actions-inexcusable-1.6893193,negative,0.0071343514,0.8251049,0.16776077,-0.6807471473063238
CTV,2024-05-19,Buttazzoni overtime goal propels Bandits past Crusaders 4-3 in BCHL playoff,https://calgary.ctvnews.ca/buttazzoni-overtime-goal-propels-bandits-past-crusaders-4-3-in-bchl-playoff-1.6893118,positive,0.2660822,0.007366614,0.7265512,0.07074546858792274
CTV,2024-05-19,Power expected to be restored to most affected by deadly Houston storm,https://www.ctvnews.ca/world/power-expected-to-be-restored-to-most-affected-by-deadly-houston-storm-1.6893206,neutral,0.07232389,0.1319455,0.7957307,-0.01217886541192037
CTV,2024-05-19,What we've learned so far in the Trump hush money trial and what to watch for as it wraps up,https://www.ctvnews.ca/world/what-we-ve-learned-so-far-in-the-trump-hush-money-trial-and-what-to-watch-for-as-it-wraps-up-1.6893084,neutral,0.047063153,0.043671843,0.909265,0.00030771062670975624
CTV,2024-05-19,"Information commissioner faces $700K funding shortfall, says system is 'overwhelmed'",https://www.ctvnews.ca/politics/information-commissioner-faces-700k-funding-shortfall-says-system-is-overwhelmed-1.6892180,negative,0.00782896,0.8043284,0.18784264,-0.6468828773808557
CTV,2024-05-19,OPP investigating crash in Minden Hills,https://barrie.ctvnews.ca/opp-investigating-crash-in-minden-hills-1.6892761,neutral,0.033990223,0.16430885,0.80170107,-0.025842044392057062
CTV,2024-05-19,"Man charged with punching actor Steve Buscemi is held on US$50,000 bond",https://www.ctvnews.ca/entertainment/man-charged-with-punching-actor-steve-buscemi-is-held-on-us-50-000-bond-1.6893208,negative,0.01868948,0.35380295,0.62750757,-0.12482723006572627
CTV,2024-05-19,7-year-old Pokémon prodigy heading to Hawaii for world championship tournament,https://windsor.ctvnews.ca/7-year-old-pok%C3%A9mon-prodigy-heading-to-hawaii-for-world-championship-tournament-1.6893180,positive,0.36480358,0.0031878129,0.63200855,0.13307151320429966
CTV,2024-05-19,Biden tells Morehouse graduates that he hears their voices of protest over the war in Gaza,https://www.ctvnews.ca/world/biden-tells-morehouse-graduates-that-he-hears-their-voices-of-protest-over-the-war-in-gaza-1.6893142,neutral,0.06669294,0.094106875,0.83920014,-0.004408156850860934
CTV,2024-05-19,Disneyland character and parade performers in California vote to join labor union,https://www.ctvnews.ca/world/disneyland-character-and-parade-performers-in-california-vote-to-join-labor-union-1.6893069,neutral,0.108247034,0.045213547,0.8465393,0.009673162539554525
CTV,2024-05-19,McDavid expects 'great Game 7' after Oilers rebound against Canucks,https://edmonton.ctvnews.ca/mcdavid-expects-great-game-7-after-oilers-rebound-against-canucks-1.6893196,positive,0.78573203,0.0046553104,0.20961252,0.6173532688895715
CTV,2024-05-19,"Three people dead, five injured in boat crash on Ont. lake",/video/c2925240-three-dead--five-injured-in-ont--boat-crash?playlistId=1.6893093,negative,0.009360594,0.66125923,0.32938012,-0.43717617286780097
CTV,2024-05-19,Formal merger not in the cards for B.C.'s right-wing parties,/video/c2925234-ctv-qp--merger-speculation-in-b-c-?playlistId=1.6890493,neutral,0.027089521,0.20058867,0.77232176,-0.0395019814699511
CTV,2024-05-19,Toronto man arrested on weapons charges in northwestern Ont.,https://northernontario.ctvnews.ca/toronto-man-arrested-on-weapons-charges-in-northwestern-ont-1.6892908,negative,0.0098756,0.53558224,0.45454213,-0.28675082879190583
CTV,2024-05-19,"Conservatives, NDP should be 'celebrating' EV deals: industry minister",https://www.ctvnews.ca/politics/conservatives-ndp-should-be-celebrating-ev-deals-industry-minister-1.6892837,neutral,0.16915658,0.029786501,0.801057,0.02772670521913767
CTV,2024-05-19,Feds refuse Toronto's request to decriminalize simple drug possession,https://toronto.ctvnews.ca/feds-refuse-toronto-s-request-to-decriminalize-simple-drug-possession-1.6892043,negative,0.013249035,0.526195,0.46055594,-0.27670564540097864
CTV,2024-05-19,"Born without front legs, this dog has been inspiring the world for 3 years: Dresden farm owner",https://windsor.ctvnews.ca/born-without-front-legs-this-dog-has-been-inspiring-the-world-for-3-years-dresden-farm-owner-1.6892892,positive,0.9646642,0.00274173,0.03259416,0.9305694126916881
CTV,2024-05-19,'The car was half inside my children's room': Car crashes into Saskatoon apartment building,https://saskatoon.ctvnews.ca/the-car-was-half-inside-my-children-s-room-car-crashes-into-saskatoon-apartment-building-1.6891888,negative,0.009556464,0.7072466,0.28319687,-0.5001064708714082
CTV,2024-05-19,The secret Italian lakes that most tourists don't know about,https://www.ctvnews.ca/lifestyle/the-secret-italian-lakes-that-most-tourists-don-t-know-about-1.6891562,neutral,0.19210589,0.12569594,0.6821982,0.02110519845731318
CTV,2024-05-19,Protecting your car from the growing risk of keyless vehicle thefts,https://www.ctvnews.ca/autos/protecting-your-car-from-the-growing-risk-of-keyless-vehicle-thefts-1.6889313,neutral,0.09300894,0.096702226,0.8102888,-0.0007006571232111014
CTV,2024-05-19,Banking mogul suing government after intelligence leaks leave him shut out of Canadian economy,https://www.ctvnews.ca/canada/banking-mogul-suing-government-after-intelligence-leaks-leave-him-shut-out-of-canadian-economy-1.6891833,negative,0.0099291075,0.7053851,0.28468573,-0.4974695776892091
CBC,2024-05-19,WATCH: CBC News Network,https://www.cbc.cahttps://gem.cbc.ca/live,neutral,0.10073908,0.018231502,0.88102955,0.00981596340483426
CBC,2024-05-19,"After industry boom, Quebec distilleries fight for space on liquor store shelves",https://www.cbc.ca/news/canada/montreal/distilleries-quebec-saq-1.7205388,neutral,0.1676997,0.020661008,0.8116392,0.027696325527974963
CBC,2024-05-19,Ontario's first measles death in decades offers grim reminder that unvaccinated kids are at risk,https://www.cbc.ca/news/health/measles-vaccination-rates-1.7207834,negative,0.011614448,0.80940664,0.17897896,-0.6550041749498341
CBC,2024-05-19,What are those plump pink statues popping up around Montreal?,https://www.cbc.ca/player/play/video/9.4227755,neutral,0.023460655,0.1600857,0.81645364,-0.02507702874079154
CBC,2024-05-19,Our reporter breaks down his reporting on arrests in Sikh activist's killing,https://www.cbc.ca/player/play/video/9.4230068,neutral,0.019189185,0.14935121,0.8314596,-0.021937563040465236
CBC,2024-05-19,"Oilers crank up the offence, beat Canucks 5-1 to force Game 7",https://www.cbc.ca/news/canada/edmonton/canucks-oilers-game-six-results-1.7208765,positive,0.31549788,0.010767948,0.6737342,0.09942296080339474
CBC,2024-05-19,London Drugs confirms employee info compromised in cyberattack,https://www.cbc.ca/news/canada/british-columbia/london-drugs-cyberattack-employee-information-1.7208786,negative,0.011630343,0.6752216,0.313148,-0.4557889933917032
CBC,2024-05-19,I fled to the city to feel safer as a gay man. I never imagined I'd move back to a small town,https://www.cbc.ca/news/canada/first-person-small-town-2slgbtq-1.7206637,negative,0.053505804,0.47061536,0.4758789,-0.21861591803166291
CBC,2024-05-19,Video appears to show Sean 'Diddy' Combs assault singer Cassie in 2016,https://www.cbc.ca/player/play/video/9.4230231,negative,0.012129912,0.43388775,0.55398226,-0.1881114826874608
CBC,2024-05-19,Summer McIntosh posts world-leading time in 200m butterfly at Canadian swim trials,https://www.cbc.ca/sports/olympics/summer/aquatics/canadian-swimming-trials-recap-may-18-1.7208840,positive,0.5876916,0.003549152,0.4087594,0.3453687391239626
CBC,2024-05-19,"Wildfire evacuation order, alerts lifted in northeastern Alberta",https://www.cbc.ca/news/canada/edmonton/residents-excited-to-come-home-as-evacuation-order-alerts-lifted-in-northeastern-alberta-1.7208700,neutral,0.035243474,0.04624599,0.9185105,-0.0008965894435009059
CBC,2024-05-19,"Helicopter carrying Iran's president makes rough landing, Iranian media say",https://www.cbc.ca/news/world/iran-president-ebrahim-raisi-helicopter-accident-1.7208959,negative,0.015591828,0.26881748,0.7155906,-0.0720197573846697
CBC,2024-05-19,How Carley Fortune's buzzy romance books are making beloved Canadian locations seem... sexy,https://www.cbc.ca/news/canada/carley-fortune-books-1.7205925,positive,0.76367587,0.013522943,0.2228012,0.5830179738782189
CBC,2024-05-19,This newsletter is not AI; gag orders at the bank: CBC's Marketplace cheat sheet,https://www.cbc.ca/news/business/marketplace-cheat-sheet-may19-1.7207477,negative,0.015272562,0.77952474,0.20520267,-0.6074255975742773
CBC,2024-05-19,Plastic pollution is the new front in the culture war,https://www.cbc.ca/news/politics/plastic-pollution-lids-straws-culture-war-1.7207579,negative,0.013360744,0.811397,0.17524216,-0.6581866796622418
CBC,2024-05-19,Scottie Scheffler goes from jail cell to the 1st tee,https://www.cbc.ca/player/play/video/9.4230211,neutral,0.059244577,0.07484145,0.86591405,-0.0020913212260869063
CBC,2024-05-19,"Wildfires, demonstrations and trials: This week's most compelling Canadian images",https://www.cbc.cahttps://www.cbc.ca/newsinteractives/features/compelling-canadian-images-5-11,neutral,0.16459583,0.033009317,0.80239487,0.026002169216837956
CBC,2024-05-19,"Sean (Diddy) Combs admits beating ex-girlfriend Cassie, calls actions 'inexcusable'",https://www.cbc.ca/news/entertainment/diddy-admits-beating-cassie-video-1.7209015,negative,0.0063591483,0.7817876,0.2118533,-0.6111513492913723
CBC,2024-05-19,Would you golf in 4-degree fog? They do in St. John's!,https://www.cbc.ca/player/play/video/9.4229701,neutral,0.12240891,0.12984943,0.7477417,-0.0018769335156321176
CBC,2024-05-19,The solar storm knocked out GPS equipment on farms  — and it could happen again,https://www.cbc.ca/radio/asithappens/solar-storm-farm-gps-1.7207999,negative,0.009656902,0.8100532,0.18028998,-0.6560928831005128
CBC,2024-05-19,CBC News gets rare access to Port-au-Prince as Haiti deals with gang crisis,https://www.cbc.ca/player/play/video/9.4230556,neutral,0.029575676,0.15959519,0.8108291,-0.024595908423370005
CBC,2024-05-19,A rare royal double act from King Charles and Prince William as rift with Prince Harry drags on,https://www.cbc.ca/news/world/king-charles-prince-william-rift-prince-harry-portrait-johnathan-yeo-princess-anne-visit-1.7207480,positive,0.42251325,0.007844713,0.56964207,0.17845589156652863
CBC,2024-05-19,Guide-dog owners say new U.S. rules complicate border crossings,https://www.cbc.ca/news/canada/british-columbia/dog-entry-requirements-u-s-guide-dogs-1.7207647,negative,0.021433685,0.4058663,0.5727,-0.16426804680568807
CBC,2024-05-19,Key member of Israel's war cabinet threatens resignation over war strategy in Gaza,https://www.cbc.ca/news/world/gantz-netanyahu-israel-hamas-war-rafah-1.7208745,negative,0.006533034,0.8191734,0.17429364,-0.6710023232391009
CBC,2024-05-19,Federal byelection called in Liberal stronghold of Toronto-St. Paul's,https://www.cbc.ca/news/politics/byelection-announce-toronto-st-pauls-1.7208962,neutral,0.041896038,0.016278036,0.94182587,0.0014903050526982042
CBC,2024-05-19,You paid $850 for the Trans Mountain pipeline. Here’s why,https://www.cbc.ca/player/play/video/9.4230229,negative,0.019781323,0.66054404,0.31967458,-0.43592714314339887
CBC,2024-05-19,#TheMoment a snow leopard gave birth to two cubs at the Toronto Zoo,https://www.cbc.ca/player/play/video/9.4230230,neutral,0.113571495,0.005081965,0.8813466,0.012872653201570827
CBC,2024-05-19,"Giuliani indicted in Arizona's fake elector case linked to 2020 election, alongside 17 others",https://www.cbc.ca/news/world/giuliani-indicted-arizona-election-1.7208819,negative,0.014296878,0.6416857,0.3440174,-0.411556167673254
CBC,2024-05-19,Parent praises bus driver that 'averted a catastrophe' after 18-wheeler fell from overpass above,https://www.cbc.ca/news/canada/nova-scotia/overpass-crash-bus-driver-praised-bedford-hwy-102-hwy-101-1.7208531,negative,0.11588599,0.2832755,0.60083854,-0.06681544763915959
CBC,2024-05-19,A Manitoba farmer had a surplus of potatoes. So he gave millions of them away,https://www.cbc.ca/radio/thecurrent/potato-donation-manitoba-1.7206483,negative,0.057838436,0.36497265,0.57718885,-0.12985976915323505
CBC,2024-05-19,N.S. doctor predicted decades ago his daughter's murder would be solved. Now it has been,https://www.cbc.ca/news/canada/nova-scotia/seriel-killer-calgary-1970s-nova-scotia-connection-1.7208640,negative,0.06797955,0.51589364,0.41612685,-0.2615250140612666
CBC,2024-05-19,WATCH | #TheMoment a snow leopard gave birth to two cubs at the Toronto Zoo,https://www.cbc.cahttps://www.cbc.ca/player/play/video/9.4230230,neutral,0.07643177,0.0044804085,0.9190877,0.005821750013609073
CBC,2024-05-19,"3 dead, 5 injured in evening boat collision north of Kingston",https://www.cbc.ca/news/canada/ottawa/3-dead-5-injured-in-evening-boat-collision-north-of-kingston-1.7208950,negative,0.011141749,0.5801348,0.40872338,-0.336432274395138
CBC,2024-05-19,New Democrats try out a sharper line of attack as Conservatives target NDP ridings,https://www.cbc.ca/news/politics/ndp-conservative-singh-poilievre-1.7206283,neutral,0.0402939,0.055255882,0.90445036,-0.0014296122311827641
CBC,2024-05-19,WATCH : CBC News Explore,https://www.cbc.cahttps://gem.cbc.ca/live,neutral,0.09840742,0.014817321,0.88677526,0.009464467482493077
CBC,2024-05-19,"For Gen Z, sustainable fashion isn't just about shopping. It's a 'mindset'",https://www.cbc.ca/news/entertainment/generation-z-sustainable-fashion-environment-1.7205071,positive,0.31432232,0.06324508,0.6224325,0.09479861128114919
CBC,2024-05-19,Officials seize around $500K worth of baby eels at Toronto airport,https://www.cbc.ca/news/canada/toronto/toronto-ont-elver-seizure-1.7208615,neutral,0.033019327,0.18125112,0.78572965,-0.03176168109540356
CBC,2024-05-19,"For her 105th birthday, East Preston, N.S., pulled out all the stops",https://www.cbc.ca/player/play/video/9.4230278,positive,0.6129385,0.0044383192,0.38262314,0.3756739344681925
CBC,2024-05-19,N.S. teen set to make NASCAR Canada debut,https://www.cbc.ca/player/play/video/9.4230054,neutral,0.06387701,0.009092239,0.9270306,0.0039976106152084245
