source,date,headline,url,chosen_label,positive,negative,neutral,compound
CTV,2024-04-30,'There have been deaths on that property': City plans to demolish former Dwayne's Home building,https://edmonton.ctvnews.ca/there-have-been-deaths-on-that-property-city-plans-to-demolish-former-dwayne-s-home-building-1.6866470,negative,0.006241604,0.8213537,0.17240462,-0.6745829727480466
CTV,2024-04-30,"Guinness World Record attempt made in Drumheller, Alta.",https://calgary.ctvnews.ca/guinness-world-record-attempt-made-in-drumheller-alta-1.6866573,neutral,0.11101264,0.009702052,0.8792853,0.012229679725801024
CTV,2024-04-30,Canada's new dental program offering hope of free care to millions but many dentists aren't signed up,https://toronto.ctvnews.ca/canada-s-new-dental-program-offering-hope-of-free-care-to-millions-but-many-dentists-aren-t-signed-up-1.6866628,neutral,0.16878551,0.14518084,0.68603355,0.007411076439724162
CTV,2024-04-30,Construction expected to start on Ontario Hwy. 413 in 2025,https://toronto.ctvnews.ca/construction-expected-to-start-on-ontario-hwy-413-in-2025-1.6867299,neutral,0.13156453,0.008989058,0.85944635,0.01722843000986307
CTV,2024-04-30,'Shocked and concerned': Calgary principal charged with possession of child pornography,https://calgary.ctvnews.ca/shocked-and-concerned-calgary-principal-charged-with-possession-of-child-pornography-1.6865985,negative,0.005614929,0.815198,0.17918703,-0.6645162827434881
CTV,2024-04-30,Alberta government announces 'master plan' for railway development,https://calgary.ctvnews.ca/alberta-government-announces-master-plan-for-railway-development-1.6865747,neutral,0.17362481,0.007898658,0.8184764,0.030083211771389173
CTV,2024-04-30,Protesters take over Columbia University's Hamilton Hall in escalation of anti-war demonstrations,https://www.ctvnews.ca/world/protesters-take-over-columbia-university-s-hamilton-hall-in-escalation-of-anti-war-demonstrations-1.6867181,negative,0.012154148,0.43842945,0.5494165,-0.19207261650362462
CTV,2024-04-30,Voice of 'Hockey Night in Canada' Bob Cole never considered moving out of St. John's,https://www.ctvnews.ca/sports/voice-of-hockey-night-in-canada-bob-cole-never-considered-moving-out-of-st-john-s-1.6863397,neutral,0.06836678,0.035814125,0.89581907,0.0033913660203537255
CTV,2024-04-30,Pro-Palestinian protest encampment established at UBC,https://bc.ctvnews.ca/pro-palestinian-protest-encampment-established-at-ubc-1.6866244,negative,0.016037634,0.4285595,0.5554029,-0.18340603695423496
CTV,2024-04-30,Cenovus fined $2.5 million for biggest oil spill in Newfoundland and Labrador history,https://www.ctvnews.ca/climate-and-environment/cenovus-fined-2-5-million-for-biggest-oil-spill-in-newfoundland-and-labrador-history-1.6863269,negative,0.007803344,0.79779637,0.19440016,-0.6364182716509603
CTV,2024-04-30,"Quebec police officer anonymously donates kidney, changes schoolteacher's life",https://montreal.ctvnews.ca/quebec-police-officer-anonymously-donates-kidney-changes-schoolteacher-s-life-1.6866270,positive,0.24231371,0.026474476,0.7312117,0.0580150568534723
CTV,2024-04-30,McGill requests 'police assistance' over pro-Palestinian encampment,https://montreal.ctvnews.ca/mcgill-requests-police-assistance-over-pro-palestinian-encampment-1.6867195,neutral,0.028239388,0.15633138,0.81542933,-0.02364202460723419
CTV,2024-04-30,Norovirus spreading at 'higher frequency' than expected in Canada,https://toronto.ctvnews.ca/norovirus-spreading-at-higher-frequency-than-expected-in-canada-1.6863382,negative,0.01525983,0.43684363,0.54789656,-0.19059948522081704
CTV,2024-04-30,Archeologists search for remnants of Halifax's 250-year-old wall that surrounded the city,https://www.ctvnews.ca/canada/archeologists-search-for-remnants-of-halifax-s-250-year-old-wall-that-surrounded-the-city-1.6866304,neutral,0.040654518,0.081620224,0.8777253,-0.005009069294901636
CTV,2024-04-30,Air Canada walks back new seat selection policy change after backlash,https://www.ctvnews.ca/business/air-canada-walks-back-new-seat-selection-policy-change-after-backlash-1.6866625,negative,0.017689057,0.42596817,0.5563428,-0.18113597953142957
CTV,2024-04-30,'I was scared': Ontario man's car repossessed after missing two repair loan payments,https://toronto.ctvnews.ca/i-was-scared-ontario-man-s-car-repossessed-after-missing-two-repair-loan-payments-1.6862390,negative,0.0090377405,0.75154155,0.23942079,-0.5647329728432995
CTV,2024-04-30,"G7 agrees to shut down coal plants by 2035, U.K. minister says, in climate breakthrough",https://www.ctvnews.ca/climate-and-environment/g7-agrees-to-shut-down-coal-plants-by-2035-u-k-minister-says-in-climate-breakthrough-1.6865997,neutral,0.10003999,0.039023105,0.8609368,0.00848520185022461
CTV,2024-04-30,"Taylor Swift's 'The Tortured Poets Department' hits No. 1, experiences largest streaming week ever",https://www.ctvnews.ca/entertainment/taylor-swift-s-the-tortured-poets-department-hits-no-1-experiences-largest-streaming-week-ever-1.6865820,positive,0.7081931,0.0038350897,0.2879717,0.501522855067078
CTV,2024-04-30,Shake Shack reveals plans for first Canadian location at Toronto's Yonge-Dundas Square,https://toronto.ctvnews.ca/shake-shack-reveals-plans-for-first-canadian-location-at-toronto-s-yonge-dundas-square-1.6867053,neutral,0.16604276,0.0046406407,0.8293165,0.027548679460062786
CTV,2024-04-30,"Kitchener family says their 10-year-old needs life-saving drug that cost $600,000",https://kitchener.ctvnews.ca/kitchener-family-says-their-10-year-old-needs-life-saving-drug-that-cost-600-000-1.6863760,negative,0.05070122,0.5366683,0.41263047,-0.2854422500986322
CTV,2024-04-30,Canada's oldest hat store still going strong after 90 years,https://montreal.ctvnews.ca/canada-s-oldest-hat-store-still-going-strong-after-90-years-1.6865539,positive,0.6278818,0.010075634,0.3620426,0.3941340310089885
CTV,2024-04-30,"Police searching for armed man in Dartmouth, N.S., residents asked to shelter in place",https://atlantic.ctvnews.ca/police-searching-for-armed-man-in-dartmouth-n-s-residents-asked-to-shelter-in-place-1.6867261,neutral,0.015619839,0.12777424,0.8566059,-0.016082280924394787
CTV,2024-04-30,Province boots mayor and council in small northern Ont. town out of office,https://northernontario.ctvnews.ca/province-boots-mayor-and-council-in-small-northern-ont-town-out-of-office-1.6866539,negative,0.021676041,0.48084974,0.49747425,-0.23074661111387051
CTV,2024-04-30,Mystery surrounds giant custom Canucks jerseys worn by Lions Gate Bridge statues,https://bc.ctvnews.ca/mystery-surrounds-giant-custom-canucks-jerseys-worn-by-lions-gate-bridge-statues-1.6857809,neutral,0.14824167,0.029178094,0.82258016,0.0211242398871212
CTV,2024-04-30,Turner's twin blasts power Blue Jays past Royals 6-5; Toronto wins two straight,https://toronto.ctvnews.ca/turner-s-twin-blasts-power-blue-jays-past-royals-6-5-toronto-wins-two-straight-1.6867071,positive,0.39805585,0.0030787056,0.59886557,0.15843893540798248
CTV,2024-04-30,"Haida Elder suing Catholic Church and priest, hopes for 'healing and reconciliation'",https://calgary.ctvnews.ca/haida-elder-suing-catholic-church-and-priest-hopes-for-healing-and-reconciliation-1.6864469,neutral,0.030867726,0.20975642,0.7593757,-0.043044968175733445
CTV,2024-04-30,Winnipeg trial of man accused of killing four women starts with bid to toss jury,https://winnipeg.ctvnews.ca/winnipeg-trial-of-man-accused-of-killing-four-women-starts-with-bid-to-toss-jury-1.6865522,negative,0.010876192,0.62122416,0.36789966,-0.385801171869673
CTV,2024-04-30,Teenager charged in Fergus attack,https://kitchener.ctvnews.ca/teenager-charged-in-fergus-attack-1.6867033,negative,0.010073251,0.5925915,0.39733538,-0.3510631574055889
CTV,2024-04-30,Treasury Board 'committed to hybrid work' after reports of mandated change coming in fall,https://ottawa.ctvnews.ca/treasury-board-committed-to-hybrid-work-after-reports-of-mandated-change-coming-in-fall-1.6866464,positive,0.27808806,0.007541948,0.7143699,0.07727611389476507
CTV,2024-04-30,London Drugs stores remain closed Monday after 'cybersecurity incident',https://bc.ctvnews.ca/london-drugs-stores-remain-closed-monday-after-cybersecurity-incident-1.6865914,negative,0.011628314,0.44063684,0.5477349,-0.1940255848686725
CTV,2024-04-30,Historic church in Vancouver for sale for $10M,https://bc.ctvnews.ca/historic-church-in-vancouver-for-sale-for-10m-1.6865942,neutral,0.09716162,0.01058397,0.89225453,0.00932834988954312
CTV,2024-04-30,Northern Ont. beekeeper advising others to have colonies tested for chemicals,https://northernontario.ctvnews.ca/northern-ont-beekeeper-advising-others-to-have-colonies-tested-for-chemicals-1.6865274,neutral,0.03231341,0.06623739,0.90144914,-0.0033432372568567015
CTV,2024-04-30,Sask. NDP criticized after email shows party attempt to secure sponsorship from previously criticized lobbying firm,https://regina.ctvnews.ca/sask-ndp-criticized-after-email-shows-party-attempt-to-secure-sponsorship-from-previously-criticized-lobbying-firm-1.6866895,negative,0.01027916,0.63141376,0.358307,-0.3985777090498672
CTV,2024-04-30,Global negotiations on a treaty to end plastic pollution at critical phase in Canada,https://www.ctvnews.ca/climate-and-environment/global-negotiations-on-a-treaty-to-end-plastic-pollution-at-critical-phase-in-canada-1.6866212,neutral,0.09079298,0.06772694,0.84147996,0.0036564290800789045
CTV,2024-04-30,Is there a cost to convenience? Canada approves new cancer immunotherapy treatment,https://www.ctvnews.ca/health/is-there-a-cost-to-convenience-canada-approves-new-cancer-immunotherapy-treatment-1.6866195,neutral,0.05754986,0.0633868,0.8790634,-0.0007058992247042095
CTV,2024-04-30,"Man sentenced in 'shocking, unprovoked attack on a stranger' at Cambridge grocery store",https://kitchener.ctvnews.ca/man-sentenced-in-shocking-unprovoked-attack-on-a-stranger-at-cambridge-grocery-store-1.6866467,negative,0.008570845,0.72693574,0.26449326,-0.5283622238968153
CTV,2024-04-30,Man held captive for two days at encampment: Saint John police,https://atlantic.ctvnews.ca/man-held-captive-for-two-days-at-encampment-saint-john-police-1.6867234,negative,0.009971131,0.38970014,0.6003287,-0.15176679029389817
CTV,2024-04-30,Man in hospital after shooting in Longueuil,https://montreal.ctvnews.ca/man-in-hospital-after-shooting-in-longueuil-1.6867055,negative,0.013336123,0.5643911,0.4222729,-0.31835938588685053
CTV,2024-04-30,Q&A: Quebec minister on the $603 million plan to protect the French language,https://montreal.ctvnews.ca/q-a-quebec-minister-on-the-603-million-plan-to-protect-the-french-language-1.6866672,neutral,0.09082626,0.010240429,0.8989333,0.008144544586328628
CTV,2024-04-30,Whiteout Street Party forcing road closures in downtown Winnipeg,https://winnipeg.ctvnews.ca/whiteout-street-party-forcing-road-closures-in-downtown-winnipeg-1.6867109,negative,0.012161279,0.60672086,0.38111794,-0.3679622761918111
CTV,2024-04-30,'I feel honoured to say I was his friend': Wayne Gretzky remembers Bob Cole,https://www.ctvnews.ca/sports/i-feel-honoured-to-say-i-was-his-friend-wayne-gretzky-remembers-bob-cole-1.6865945,positive,0.88606626,0.0043543493,0.10957944,0.7850944070679655
CTV,2024-04-30,Surging cost of eating disorders in Canada: report,/video/c2913177-surging-cost-of-eating-disorders-in-canada,negative,0.01133924,0.61881113,0.3698496,-0.3827986548364013
CTV,2024-04-30,"Cash is critical in keeping small businesses afloat, Saskatoon pub owner says",https://saskatoon.ctvnews.ca/cash-is-critical-in-keeping-small-businesses-afloat-saskatoon-pub-owner-says-1.6866805,positive,0.36746565,0.009814413,0.62271994,0.1349346776391087
CTV,2024-04-30,Algoma Steel worker injured when water hit molten slag,https://northernontario.ctvnews.ca/algoma-steel-worker-injured-when-water-hit-molten-slag-1.6866617,negative,0.008564537,0.78484505,0.20659037,-0.6159084425205688
CTV,2024-04-30,Preliminary matter for man accused of killing four women goes into second day,https://winnipeg.ctvnews.ca/preliminary-matter-for-man-accused-of-killing-four-women-goes-into-second-day-1.6867276,negative,0.015487068,0.56556344,0.41894954,-0.3196221227552698
CTV,2024-04-30,MPs targeted by Chinese hackers question why Canada didn't tell them,https://www.ctvnews.ca/politics/mps-targeted-by-chinese-hackers-question-why-canada-didn-t-tell-them-1.6866016,negative,0.009005421,0.5587721,0.43222257,-0.3121450984440095
CTV,2024-04-30,B.C. hospital infested with cockroaches says they don't bite,/video/c2913016-b-c--hospital-infested-with-cockroaches,negative,0.03928107,0.43474302,0.5259759,-0.18745850010103204
CTV,2024-04-30,LIVE NOW: Ont. Premier Doug Ford speaks to media,/video/c68596-live--premier-doug-ford-holds-press-conference,neutral,0.051261496,0.0061819614,0.9425567,0.0025895180740487245
CTV,2024-04-30,Aerial photos show wide devastation left by a deadly tornado in China's Guangzhou,https://www.ctvnews.ca/world/aerial-photos-show-wide-devastation-left-by-a-deadly-tornado-in-china-s-guangzhou-1.6865380,negative,0.007276306,0.85645455,0.13626899,-0.7334615930040735
CTV,2024-04-30,'Double whammy': What happens if you don't file your taxes by the deadline,https://www.ctvnews.ca/business/double-whammy-what-happens-if-you-don-t-file-your-taxes-by-the-deadline-1.6865868,negative,0.013829232,0.5072481,0.47892255,-0.2571094498074977
CTV,2024-04-30,"Fergus, Ont. man feels nickel-and-dimed for $0.05 property tax bill",https://kitchener.ctvnews.ca/fergus-ont-man-feels-nickel-and-dimed-for-0-05-property-tax-bill-1.6859128,negative,0.059735365,0.2867645,0.65350014,-0.07866556694171933
CBC,2024-04-30,"Right to protest at McGill must be respected but violence can’t be tolerated, minister says",https://www.cbc.ca/player/play/video/9.4213898,negative,0.03238343,0.31042293,0.65719366,-0.0953136980977689
CBC,2024-04-30,"From new equipment to more firefighters, B.C. is mobilizing for 'challenging' wildfire season",https://www.cbc.ca/news/canada/british-columbia/bc-wildfire-season-2024-preparations-1.7182227,positive,0.3411667,0.0120725725,0.6467606,0.11624902278494531
CBC,2024-04-30,These ice dancers are turning heads at the Ice Palace in West Edmonton Mall,https://www.cbc.ca/player/play/video/9.4212487,neutral,0.20156609,0.024064032,0.7743698,0.040049827482461886
CBC,2024-04-30,"Arrest made in White Rock, B.C., waterfront homicide case",https://www.cbc.ca/news/canada/british-columbia/white-rock-bc-homicide-1.7188873,neutral,0.023804748,0.1487547,0.82744056,-0.021561294184927693
CBC,2024-04-30,Columbia students occupy NYC campus building in pro-Palestinian protest,https://www.cbc.ca/news/world/us-campus-protests-columbia-building-1.7189020,negative,0.0201387,0.4564531,0.52340823,-0.20794385228662904
CBC,2024-04-30,For fog’s sake! Newfoundlanders and visitors do their best foghorn impressions,https://www.cbc.ca/player/play/video/9.4214028,positive,0.4325343,0.07658557,0.4908802,0.1812205575652719
CBC,2024-04-30,Federal addictions minister says B.C public decriminalization reversal under review,https://www.cbc.ca/news/politics/decriminalization-british-columbia-federal-government-1.7188534,neutral,0.023640344,0.074077286,0.90228236,-0.004928579254386278
CBC,2024-04-30,#TheMoment a golden retriever puppy was born with lime green fur,https://www.cbc.ca/player/play/video/1.7187075,neutral,0.14491658,0.010894555,0.8441889,0.020882115657109068
CBC,2024-04-30,Federal public servants to return to the office 3 days a week this fall,https://www.cbc.ca/news/canada/ottawa/public-servants-office-return-three-days-week-1.7188498,neutral,0.062358305,0.011044095,0.92659754,0.003766589373603191
CBC,2024-04-30,WATCH | Should Quebec catch up to other provinces and raise speed limits on highways?,https://www.cbc.cahttps://www.cbc.ca/player/play/video/9.4214314,neutral,0.026286393,0.051919863,0.9217937,-0.0020046988030237856
CBC,2024-04-30,"Billie Eilish announces world tour, hitting 3 Canadian cities",https://www.cbc.ca/news/entertainment/billie-eilish-tour-1.7188485,positive,0.43921027,0.0023984541,0.55839115,0.19289995710622776
CBC,2024-04-30,Canadian economy grew 0.2% in February,https://www.cbc.ca/news/business/canadan-gdp-february-1.7189053,neutral,0.08642501,0.11038359,0.80319136,-0.004715256666439682
CBC,2024-04-30,"4 killed, including infant, in crash that closed Highway 401",https://www.cbc.ca/news/canada/toronto/whitby-crash-highway-401-1.7188923,negative,0.008977505,0.7522165,0.23880586,-0.5657491602025946
CBC,2024-04-30,Punjabi superstar Diljit Dosanjh brings 6-year-old fan onstage to dance at Vancouver show,https://www.cbc.ca/player/play/video/1.7187661,positive,0.35456777,0.005851055,0.6395812,0.12568405552319462
CBC,2024-04-30,More stores are ditching self-checkout amid theft and customer complaints,https://www.cbc.ca/news/business/self-checkout-walmart-giant-tiger-1.7188556,negative,0.009495845,0.74964464,0.24085948,-0.5618769327523481
CBC,2024-04-30,London Drugs closes stores until further notice due to cyberattack,https://www.cbc.ca/news/canada/british-columbia/london-drugs-closure-western-canada-1.7187615,negative,0.014473658,0.6258958,0.3596305,-0.3915360811174562
CBC,2024-04-30,Canada is scaling back temporary foreign workers. Critics say the program needs an overhaul,https://www.cbc.ca/news/canada/montreal/temporary-foreign-workers-reduction-rights-permanent-status-1.7155233,negative,0.010569914,0.6118197,0.37761056,-0.37421149541470555
CBC,2024-04-30,This man does not love you. But someone might be using his face to rob you,https://www.cbc.ca/news/gopublic/romance-scam-sigi-fink-nigeria-1.7185461,negative,0.0065785055,0.8810982,0.11232324,-0.7762908194609555
CBC,2024-04-30,Hamilton police officer who assaulted Indigenous man in 'disturbing' act to be demoted for 1 year,https://www.cbc.ca/news/canada/hamilton/wren-assault-tomchuk-1.7188602,negative,0.005786292,0.78643847,0.20777516,-0.6184520363166346
CBC,2024-04-30,IN PHOTOS | Pro-Palestinian encampment grows at McGill University,https://www.cbc.ca/news/canada/montreal/photos/in-photos-pro-palestinian-encampment-grows-at-mcgill-university-1.7187911,neutral,0.040568825,0.07469864,0.88473266,-0.003934053100805857
CBC,2024-04-30,Sikh rally in Toronto with multi-party support prompts diplomatic rebuke from India,https://www.cbc.ca/news/politics/india-summons-canadian-diplomat-1.7189094,negative,0.018300658,0.399342,0.5823573,-0.1591391421806989
CBC,2024-04-30,"Military charges senior officer with making derogatory remarks about commanders, allies",https://www.cbc.ca/news/politics/robert-kearney-1.7188594,negative,0.006158251,0.76429445,0.22954738,-0.5841080304263002
CBC,2024-04-30,Pro-Palestinian protesters encamped at McGill for 3rd day,https://www.cbc.ca/player/play/video/9.4213668,negative,0.010852605,0.6712809,0.3178664,-0.45050031423262027
CBC,2024-04-30,Go Public's Erica Johnson meets man whose face was used in effort to scam her,https://www.cbc.ca/player/play/video/1.7187743,negative,0.014716496,0.6772635,0.30802,-0.4584692705890774
CBC,2024-04-30,Why is Ontario changing rules for cellphones in schools? Hear from the education minister,https://www.cbc.ca/player/play/video/9.4213817,negative,0.0166173,0.25853804,0.72484463,-0.06656578946705771
CBC,2024-04-30,Calgary contractor guilty of forgery tells judge he 'screwed up',https://www.cbc.ca/news/canada/calgary/calgary-contractor-alan-hrehirchuk-guilty-forgery-1.7188782,negative,0.0071094856,0.8010345,0.19185597,-0.6416057892826785
CBC,2024-04-30,WATCH : CBC News Explore,https://www.cbc.cahttps://gem.cbc.ca/live,neutral,0.09840742,0.014817321,0.88677526,0.009464467482493077
CBC,2024-04-30,The moment McGill encampment protesters are told to dismantle,https://www.cbc.ca/player/play/video/9.4214184,negative,0.027720958,0.31007913,0.6621999,-0.09538061383011609
CBC,2024-04-30,"Gaza protests spread across U.S., to the doorstep of the White House",https://www.cbc.ca/news/world/analysis-gaza-student-encampments-1.7186928,negative,0.019075202,0.5432715,0.43765324,-0.294780070566965
CBC,2024-04-30,Pro-Palestinian encampment set up at UBC campus in Vancouver,https://www.cbc.ca/news/canada/british-columbia/pro-palestinian-encampment-set-up-at-ubc-s-point-grey-campus-1.7188490,negative,0.015147099,0.39848176,0.58637106,-0.15855831016106592
CBC,2024-04-30,Ottawa plans to launch controversial firearms buyback program during election year,https://www.cbc.ca/news/politics/gun-buyback-assault-weapons-ottawa-1.7188410,neutral,0.016784405,0.20861088,0.7746047,-0.043236790667792846
CBC,2024-04-30,"Conservatives, worried about foreign workers, demand details of $15B Honda EV deal",https://www.cbc.ca/news/politics/ev-plants-foreign-workers-1.7188338,negative,0.032470122,0.26395008,0.70357984,-0.0686153253934707
CBC,2024-04-30,Dancing onstage with Punjabi superstar Diljit Dosanjh a dream come true for 6-year-old B.C. fan,https://www.cbc.ca/news/canada/british-columbia/diljit-dosanjh-fan-pulled-up-on-stage-1.7187636,positive,0.8329271,0.0048408634,0.1622321,0.6937440837318078
CBC,2024-04-30,Should Quebec catch up to other provinces and raise speed limits on highways?,https://www.cbc.ca/player/play/video/9.4214314,neutral,0.025266204,0.13945311,0.8352807,-0.018808786466605554
CBC,2024-04-30,"As wildfire season approaches, remote First Nations prepare to fight from the ground up",https://www.cbc.ca/news/canada/saskatchewan/first-nations-wildfire-fighting-2024-1.7187234,negative,0.041578475,0.25103113,0.70739055,-0.061287827989850996
CBC,2024-04-30,McGill asks police for help as pro-Palestinian encampment enters fourth day,https://www.cbc.ca/news/canada/montreal/mcgill-asks-police-for-help-as-pro-palestinian-encampment-enters-fourth-day-1.7189054,negative,0.028774466,0.24124385,0.72998166,-0.057370630209451434
CBC,2024-04-30,Moe says Canada Revenue Agency will audit Sask. to see how much owed in carbon levies,https://www.cbc.ca/news/canada/saskatchewan/cra-audit-sask-carbon-tax-1.7188772,neutral,0.019638835,0.08063277,0.89972854,-0.0061159508386108286
CBC,2024-04-30,Poilievre hints to police he would use notwithstanding clause to change justice laws,https://www.cbc.ca/news/politics/poilievre-notwithstanding-clause-1.7188964,negative,0.021435587,0.34369615,0.6348684,-0.11766751872748671
CBC,2024-04-30,WATCH: CBC News Network,https://www.cbc.cahttps://gem.cbc.ca/live,neutral,0.10073908,0.018231502,0.88102955,0.00981596340483426
CBC,2024-04-30,Asoka makeup trend inspired by Bollywood is shining a spotlight on South Asian beauty,https://www.cbc.ca/news/canada/asoka-makeup-trend-1.7187858,positive,0.78008187,0.0068497513,0.21306854,0.6084806634943547
CBC,2024-04-30,"Location, location location: Why real estate's golden rule also applies to morel mushrooms",https://www.cbc.ca/news/canada/london/morel-mushrooms-london-ontario-1.7187971,neutral,0.20205137,0.014249007,0.7836996,0.040621730714780035
CBC,2024-04-30,Lawyers try to toss jury again as Winnipeg trial begins for man accused of killing 4 women,https://www.cbc.ca/news/canada/manitoba/winnipeg-jury-trial-jeremy-skibicki-1.7188251,negative,0.0073352423,0.77063966,0.22202504,-0.5938317221109983
CBC,2024-04-30,"As major nations push Hamas to accept Israeli truce proposal, Palestinians hold out fragile hope",https://www.cbc.ca/news/world/israel-hamas-gaza-peace-negotiations-1.7188260,negative,0.044800732,0.24054277,0.71465635,-0.05585374781442454
CBC,2024-04-30,See the aftermath of punishing U.S. tornadoes,https://www.cbc.ca/player/play/video/9.4213578,negative,0.026542822,0.2913346,0.6821226,-0.08417132782398795
CBC,2024-04-30,"Canada is 'way behind the virus' as bird flu explodes among U.S. dairy cattle, scientists say",https://www.cbc.ca/news/health/bird-flu-canada-1.7188779,negative,0.016689243,0.4996925,0.48361838,-0.24941400585269946
CBC,2024-04-30,This Kokum is graduating Grade 12 with her grandson,https://www.cbc.ca/player/play/video/9.4213509,neutral,0.074830584,0.008376315,0.91679305,0.005529457144835437
