source,date,headline,url,chosen_label,positive,negative,neutral,compound
CTV,2024-05-06,British Columbian homeowners born in the 1990s most likely in Canada to co-own with their parents: StatsCan,https://bc.ctvnews.ca/british-columbian-homeowners-born-in-the-1990s-most-likely-in-canada-to-co-own-with-their-parents-statscan-1.6874586,neutral,0.053442944,0.00970599,0.93685097,0.002761946392989545
CTV,2024-05-06,"Man arrested after failing to stop for CKPS, charged with uttering threats to kill",https://windsor.ctvnews.ca/man-arrested-after-failing-to-stop-for-ckps-charged-with-uttering-threats-to-kill-1.6874318,negative,0.005999831,0.84873796,0.14526232,-0.7203200559846579
CTV,2024-05-06,Chad holds presidential election after years of military rule,https://www.ctvnews.ca/world/chad-holds-presidential-election-after-years-of-military-rule-1.6874904,neutral,0.058835737,0.17806779,0.7630966,-0.02824648174999389
CTV,2024-05-06,Police find human remains in remote northern Ont. hamlet,https://northernontario.ctvnews.ca/police-find-human-remains-in-remote-northern-ont-hamlet-1.6873655,neutral,0.019889237,0.16323757,0.81687325,-0.02625091458697426
CTV,2024-05-06,"Three dead, two hospitalized, following collision in Fredericton: police",https://atlantic.ctvnews.ca/three-dead-two-hospitalized-following-collision-in-fredericton-police-1.6874289,negative,0.010697308,0.5702082,0.41909453,-0.3250229330642096
CTV,2024-05-06,Video shows gaggle of geese stopping traffic on Highway 1 near Vancouver,https://bc.ctvnews.ca/video-shows-gaggle-of-geese-stopping-traffic-on-highway-1-near-vancouver-1.6874304,negative,0.018479083,0.3632621,0.61825883,-0.13161786756813143
CTV,2024-05-06,"Hundreds strike at Nestle chocolate plant in Toronto, Unifor says",https://toronto.ctvnews.ca/hundreds-strike-at-nestle-chocolate-plant-in-toronto-unifor-says-1.6874606,negative,0.01787905,0.41411722,0.5680038,-0.17117339762261352
CTV,2024-05-06,"Actor Bernard Hill, of 'Titanic' and 'Lord of the Rings,' has died at 79",https://www.ctvnews.ca/entertainment/actor-bernard-hill-of-titanic-and-lord-of-the-rings-has-died-at-79-1.6874577,neutral,0.07860509,0.029928064,0.89146674,0.005283076607973669
CTV,2024-05-06,"Police investigating e-bike collision in Kitchener, driver suffering serious injuries",https://kitchener.ctvnews.ca/police-investigating-e-bike-collision-in-kitchener-driver-suffering-serious-injuries-1.6874640,negative,0.015841872,0.551658,0.43250027,-0.3040754753924837
CTV,2024-05-06,Man charged after barricading himself inside Halifax hotel room: police,https://atlantic.ctvnews.ca/man-charged-after-barricading-himself-inside-halifax-hotel-room-police-1.6874142,negative,0.011543765,0.41412917,0.5743271,-0.17136969743907216
CTV,2024-05-06,"Trump fined US$1,000 for gag order violation in hush money case as judge warns of possible jail time",https://www.ctvnews.ca/world/trump-fined-us-1-000-for-gag-order-violation-in-hush-money-case-as-judge-warns-of-possible-jail-time-1.6874918,negative,0.010867223,0.6707932,0.3183395,-0.4498454467013602
CTV,2024-05-06,Southern Alberta animal shelters overrun with abandoned pets,https://calgary.ctvnews.ca/southern-alberta-animal-shelters-overrun-with-abandoned-pets-1.6873090,negative,0.010098028,0.7607992,0.22910266,-0.5787135525853593
CTV,2024-05-06,Boeing's new Starliner capsule set for first crewed flight to space station,https://www.ctvnews.ca/sci-tech/boeing-s-new-starliner-capsule-set-for-first-crewed-flight-to-space-station-1.6874745,positive,0.24877782,0.0066315588,0.74459064,0.0618464234441678
CTV,2024-05-06,Contractors want to repurpose Milk River high school rather than see it demolished,https://calgary.ctvnews.ca/contractors-want-to-repurpose-milk-river-high-school-rather-than-see-it-demolished-1.6871576,negative,0.05162044,0.30520856,0.64317095,-0.09048761438206299
CTV,2024-05-06,Newfoundland fisherman says police broke his leg during protest that delayed budget,https://www.ctvnews.ca/canada/newfoundland-fisherman-says-police-broke-his-leg-during-protest-that-delayed-budget-1.6868720,negative,0.006052265,0.80470926,0.18923852,-0.6475203326017027
CTV,2024-05-06,Prep work underway for York Street construction,https://london.ctvnews.ca/prep-work-underway-for-york-street-construction-1.6874638,neutral,0.08041081,0.0430233,0.8765658,0.004614896726830242
CTV,2024-05-06,Invasion in Rafah imminent despite calls for ceasefire,/video/c2916448-ctv-national-news--invasion-imminent-in-rafah?playlistId=1.6604512,negative,0.011935434,0.6087257,0.3793389,-0.3704045383636867
CTV,2024-05-06,"Amid climate change warnings, Canadians lukewarm on electric vehicles",https://www.ctvnews.ca/autos/amid-climate-change-warnings-canadians-lukewarm-on-electric-vehicles-1.6873815,negative,0.026979882,0.25902012,0.7139999,-0.06636352595789763
CTV,2024-05-06,'Love has no boundaries': Sask. couple in their 90s and 80s get married,https://saskatoon.ctvnews.ca/love-has-no-boundaries-sask-couple-in-their-90s-and-80s-get-married-1.6874020,positive,0.45724124,0.008752994,0.53400576,0.20899293392426443
CTV,2024-05-06,London Drugs begins 'gradual reopening' on 7th day after cyberattack,https://bc.ctvnews.ca/london-drugs-begins-gradual-reopening-on-7th-day-after-cyberattack-1.6873859,neutral,0.0503631,0.068050414,0.88158643,-0.0020944178632076316
CTV,2024-05-06,Princess Anne lays wreath at B.C. veteran's cemetery; receives 21-gun salute,https://bc.ctvnews.ca/princess-anne-lays-wreath-at-b-c-veteran-s-cemetery-receives-21-gun-salute-1.6873979,positive,0.30201492,0.010959205,0.68702596,0.09109287990955472
CTV,2024-05-06,Police lay second-degree murder charge in northwestern Ont.,https://northernontario.ctvnews.ca/police-lay-second-degree-murder-charge-in-northwestern-ont-1.6873822,negative,0.007817005,0.7447189,0.24746397,-0.5545452137416582
CTV,2024-05-06,"22-year-old Winkler man charged with manufacturing, possessing illegal weapons: police",https://winnipeg.ctvnews.ca/22-year-old-winkler-man-charged-with-manufacturing-possessing-illegal-weapons-police-1.6874393,negative,0.009702089,0.6613616,0.32893625,-0.43730506083544185
CTV,2024-05-06,"India's foreign minister reacts to murder charges, claims Canada welcomes criminals",https://www.ctvnews.ca/canada/india-s-foreign-minister-reacts-to-murder-charges-claims-canada-welcomes-criminals-1.6874532,negative,0.008801132,0.7592551,0.23194376,-0.5763908410878003
CTV,2024-05-06,B.C. breweries take home awards at World Beer Cup,https://bc.ctvnews.ca/b-c-breweries-take-home-awards-at-world-beer-cup-1.6864834,positive,0.36876705,0.0067499676,0.624483,0.13594357736604223
CTV,2024-05-06,'I feel honoured to say I was his friend': Wayne Gretzky remembers Bob Cole,https://www.ctvnews.ca/sports/i-feel-honoured-to-say-i-was-his-friend-wayne-gretzky-remembers-bob-cole-1.6865945,positive,0.88606626,0.0043543493,0.10957944,0.7850944070679655
CTV,2024-05-06,"This Ottawa photo radar camera issued 7,500 speeding tickets in its first month",https://ottawa.ctvnews.ca/this-ottawa-photo-radar-camera-issued-7-500-speeding-tickets-in-its-first-month-1.6874625,negative,0.01821307,0.63200766,0.3497792,-0.39910200019754427
CTV,2024-05-06,Heavy rains ease around Houston but flooding remains after hundreds of rescues and evacuations,https://www.ctvnews.ca/world/heavy-rains-ease-around-houston-but-flooding-remains-after-hundreds-of-rescues-and-evacuations-1.6874840,negative,0.024469925,0.32786694,0.64766324,-0.10689792773179718
CTV,2024-05-06,"With help from AI, Randy Travis got his voice back. Here's how his first song post-stroke came to be",https://www.ctvnews.ca/entertainment/with-help-from-ai-randy-travis-got-his-voice-back-here-s-how-his-first-song-post-stroke-came-to-be-1.6874659,positive,0.5611478,0.0030444788,0.4358076,0.31487766121344407
CTV,2024-05-06,Ottawa police launch new strategy to address speeding and traffic concerns in neighbourhoods,https://ottawa.ctvnews.ca/ottawa-police-launch-new-strategy-to-address-speeding-and-traffic-concerns-in-neighbourhoods-1.6874212,negative,0.035520315,0.24748349,0.71699613,-0.05998639860601429
CTV,2024-05-06,'Bet's on': Eby and Smith make playful wager ahead of Canucks-Oilers playoff matchup,https://bc.ctvnews.ca/bet-s-on-eby-and-smith-make-playful-wager-ahead-of-canucks-oilers-playoff-matchup-1.6873948,neutral,0.12177966,0.00744665,0.87077373,0.014774828272154483
CTV,2024-05-06,2024 Met Gala: Everything to know about fashion's annual soiree,https://www.ctvnews.ca/entertainment/2024-met-gala-everything-to-know-about-fashion-s-annual-soiree-1.6874898,positive,0.4581617,0.0045191245,0.5373192,0.20989171796270512
CTV,2024-05-06,Three Quebec men from same family father hundreds of children,https://montreal.ctvnews.ca/three-quebec-men-from-same-family-father-hundreds-of-children-1.6870263,neutral,0.052689232,0.10425711,0.84305376,-0.008093384158006867
CTV,2024-05-06,Canada's housing crisis linked to our worsening mental heath,/video/c2916413-housing-crisis-hurting-mental-health,negative,0.010376659,0.7919118,0.19771142,-0.6270167222314882
CTV,2024-05-06,April auto sales jump 14 per cent; still below pre-pandemic levels: DesRosiers,https://www.ctvnews.ca/business/april-auto-sales-jump-14-per-cent-still-below-pre-pandemic-levels-desrosiers-1.6871041,neutral,0.17361794,0.04560247,0.7807796,0.02806360328520796
CTV,2024-05-06,Highway 101 in Timmins reopened after single-vehicle crash,https://northernontario.ctvnews.ca/highway-101-in-timmins-reopened-after-single-vehicle-crash-1.6874149,neutral,0.038291402,0.13922979,0.8224787,-0.017918712546937332
CTV,2024-05-06,Declining interest in owning EVs among Canadians: survey,/video/c2916452-ctv-national-news--disinterest-in-evs?playlistId=1.6873597,negative,0.022459747,0.32425362,0.6532866,-0.10463598707575983
CTV,2024-05-06,'A tiny city:' Pro-Palestinian campus protesters organize for another week,https://montreal.ctvnews.ca/a-tiny-city-pro-palestinian-campus-protesters-organize-for-another-week-1.6874409,neutral,0.043613374,0.22740437,0.7289822,-0.049810629710318466
CTV,2024-05-06,Military personnel gather in Barrie to honour lives lost in Battle of the Atlantic,https://barrie.ctvnews.ca/military-personnel-gather-in-barrie-to-honour-lives-lost-in-battle-of-the-atlantic-1.6874415,negative,0.04590941,0.2539489,0.70014155,-0.06238239990553396
CBC,2024-05-06,"As it battles Russia, Ukraine faces an unexpected foe — problem gambling among its soldiers",https://www.cbc.ca/news/world/ukraine-war-soldiers-gambling-industry-1.7189835,negative,0.021589074,0.36982682,0.60858405,-0.13630581214911786
CBC,2024-05-06,"B.C. man 3D-prints a rolling, beeping R2-D2",https://www.cbc.ca/player/play/video/1.7193453,neutral,0.09327513,0.023046149,0.88367873,0.008169123724933947
CBC,2024-05-06,Green groups outraged after Ottawa changes the rules on environmental assessments,https://www.cbc.ca/news/politics/environmental-assessments-climate-change-1.7192998,negative,0.012371395,0.6171403,0.37048817,-0.380709161433856
CBC,2024-05-06,Astronauts are ready to test out Boeing's new spacecraft — and a Canadian will be talking them through it,https://www.cbc.ca/news/science/starliner-launch-1.7193093,positive,0.33129823,0.005886163,0.66281563,0.10972386191499872
CBC,2024-05-06,Israeli army urges Palestinians to evacuate parts of Rafah ahead of 'limited' action,https://www.cbc.ca/news/world/israel-rafah-evacuation-order-1.7194984,negative,0.015242014,0.3051389,0.6796191,-0.09287742949393163
CBC,2024-05-06,"Ontario man, whose infant son and parents were killed in highway crash, can't bear to be at home",https://www.cbc.ca/news/canada/toronto/highway-401-wrong-way-crash-four-killed-1.7194766,negative,0.0058461074,0.9017518,0.092402,-0.8131222482380469
CBC,2024-05-06,WATCH : CBC News Explore,https://www.cbc.cahttps://gem.cbc.ca/live,neutral,0.09840742,0.014817321,0.88677526,0.009464467482493077
CBC,2024-05-06,U.S. lawmakers are taking aim at private equity in health care. Here's what is happening in Canada,https://www.cbc.ca/news/health/health-care-private-equity-1.7193466,neutral,0.075922094,0.0074083144,0.9166696,0.00570928027153883
CBC,2024-05-06,Algonquin leaders seek answers on toxic sewage discharge at nuclear lab,https://www.cbc.ca/news/indigenous/algonquin-leaders-chalk-river-sewage-discharge-1.7193574,negative,0.017023686,0.30010307,0.6828732,-0.08977206273790728
CBC,2024-05-06,Canadian golfer Taylor Pendrith earns 1st PGA Tour victory,https://www.cbc.ca/sports/golf/byron-nelson-recap-may-5-1.7194833,positive,0.5013816,0.002733342,0.4958851,0.25137599875165684
CBC,2024-05-06,This mom took her 14-year-old daughter off life support. She says her suicide was preventable,https://www.cbc.ca/news/canada/newfoundland-labrador/darcel-suicide-nain-1.7189313,negative,0.00843187,0.8316131,0.15995489,-0.6915094013105705
CBC,2024-05-06,"In face of extreme weather, Canadians increasingly turn to crowdfunding for help",https://www.cbc.ca/news/climate/canada-extreme-weather-crowdfunding-1.7194851,neutral,0.071477644,0.18023841,0.74828374,-0.02737685300504733
CBC,2024-05-06,"Arrests in killing of B.C. Sikh activist, commission report refocus India as potential source of interference",https://www.cbc.ca/news/politics/india-foreign-interference-commission-arrests-1.7194744,negative,0.007427358,0.7438654,0.24870725,-0.5532805574210009
CBC,2024-05-06,UN accuses Israel of denying aid access amid 'full-blown famine' in north Gaza,https://www.cbc.ca/news/world/israel-gaza-crossing-closed-after-attack-1.7194741,negative,0.006674169,0.84533596,0.14798988,-0.7145483288765941
CBC,2024-05-06,"Confronting antisemitism on campus critical, Canadian student says",https://www.cbc.ca/player/play/video/1.7194803,negative,0.015247408,0.3339471,0.6508055,-0.1112881866037867
CBC,2024-05-06,"Canada's competition bureau investigating Lululemon's green claims, non-profit says",https://www.cbc.ca/news/business/canada-competition-bureau-lululemon-greenwashing-investigation-1.7194913,negative,0.027183415,0.28336832,0.68944836,-0.07955864349307262
CBC,2024-05-06,How some remote First Nations are preparing to fight wildfires this year,https://www.cbc.ca/player/play/video/9.4218030,neutral,0.03441559,0.10309223,0.8624922,-0.009443572820957868
CBC,2024-05-06,Why deathbed dreams and visions can be a comfort for the dying — and those left behind,https://www.cbc.ca/radio/thecurrent/dreams-visions-dying-christopher-kerr-1.7186375,positive,0.40488762,0.0514494,0.54366297,0.16128695308423424
CBC,2024-05-06,London Drugs begins to gradually reopen stores after cyberattack,https://www.cbc.ca/news/canada/british-columbia/drugstore-cyberattack-canada-1.7194503,neutral,0.06627083,0.08134032,0.85238886,-0.002224424935302949
CBC,2024-05-06,What to look for when buying a used EV,https://www.cbc.ca/radio/costofliving/used-ev-batteries-explainer-1.7192098,neutral,0.06365605,0.055106737,0.8812372,0.001015339949770766
CBC,2024-05-06,'We're not done': Andre De Grasse and Canada's 4x100m relay men have more to give at Paris 2024,https://www.cbc.ca/player/play/video/9.4218893,positive,0.24698144,0.02629034,0.7267282,0.06030865387481654
CBC,2024-05-06,Vancouver Whitecaps celebrate 50th anniversary,https://www.cbc.ca/news/canada/british-columbia/vancouver-whitecaps-50th-anniversary-1.7194774,positive,0.70023286,0.0030494332,0.2967177,0.4903167639790347
CBC,2024-05-06,"Taylor Swift fan says Booking.com cancelled her room, relisted at higher price | Go Public",https://www.cbc.ca/player/play/video/1.7194941,negative,0.018512232,0.42254493,0.55894285,-0.17820151257120642
CBC,2024-05-06,Taylor Swift fan had concert tickets and a place to stay. Then Booking.com pulled the rug out from under her,https://www.cbc.ca/news/canada/taylor-swift-fan-booking-com-rental-cancellation-1.7193442,negative,0.037221797,0.46249375,0.5002845,-0.21251499217414427
CBC,2024-05-06,WATCH | Moose hide tanning camp in Inuvik teaches traditional techniques to all ages,https://www.cbc.cahttps://www.cbc.ca/player/play/video/9.4216881,neutral,0.1258376,0.006679948,0.86748254,0.01579046870499301
CBC,2024-05-06,"Ultra-processed foods take up too much space on Canadian plates, experts warn",https://www.cbc.ca/radio/whitecoat/ultra-processed-foods-1.7191905,negative,0.020089578,0.48195875,0.49795163,-0.23188067056219808
CBC,2024-05-06,"Red Dress Day events honour missing and murdered Indigenous women, girls and 2-spirit people",https://www.cbc.ca/news/canada/manitoba/red-dress-events-in-downtown-winnipeg-1.7194860,negative,0.0062666005,0.8825266,0.1112068,-0.7788139141774284
CBC,2024-05-06,India's Hindu nationalists are petitioning courts to tear down mosques and replace them with temples,https://www.cbc.ca/news/world/hindu-nationalists-mosques-india-1.7193591,negative,0.018925486,0.5662525,0.414822,-0.3202837368948508
CBC,2024-05-06,Trudeau visits Toronto Holocaust Museum as Jewish Canadians mark Yom HaShoah,https://www.cbc.ca/player/play/video/9.4218801,neutral,0.03663009,0.08945994,0.87390995,-0.00666131847308904
CBC,2024-05-06,This man does not love you. But someone might be using his face to rob you,https://www.cbc.ca/news/gopublic/romance-scam-sigi-fink-nigeria-1.7185461,negative,0.0065785055,0.8810982,0.11232324,-0.7762908194609555
CBC,2024-05-06,Nunavut residents frustrated as Canada Post closes loophole that allowed free Amazon shipping to small communities,https://www.cbc.ca/news/canada/north/canada-post-nunavut-amazon-free-shipping-loophole-1.7193037,negative,0.021284377,0.562319,0.4163967,-0.31574956193260206
CBC,2024-05-06,Moose hide tanning camp in Inuvik teaches traditional techniques to all ages,https://www.cbc.ca/player/play/video/9.4216881,neutral,0.15219578,0.01257113,0.8352332,0.023005506038003887
CBC,2024-05-06,CRA reversed $246M in pandemic benefit debts after thousands contested eligibility status,https://www.cbc.ca/news/politics/government-cerb-crb-eligibility-pandemic-clawbacks-debts-1.7193533,negative,0.011828138,0.642975,0.34519696,-0.4132768734015855
CBC,2024-05-06,Townhouse development where builder asked buyers to pay extra $100K enters receivership,https://www.cbc.ca/news/canada/toronto/barrie-development-receivership-1.7191542,neutral,0.038610924,0.08572575,0.87566334,-0.005858099725674526
CBC,2024-05-06,#TheMoment a B.C. store created a Canucks goalie out of pop cases,https://www.cbc.ca/player/play/video/1.7194947,neutral,0.09145849,0.03695837,0.8715831,0.006998736443202258
CBC,2024-05-06,Alleged hit squad arrested in killing of B.C. Sikh separatist,https://www.cbc.ca/player/play/video/1.7194273,negative,0.0116540585,0.6349424,0.35340354,-0.4030160309025117
CBC,2024-05-06,"Work stoppage averted as WestJet, aircraft engineers' union reach tentative deal",https://www.cbc.ca/news/canada/british-columbia/work-stoppage-averted-as-westjet-aircraft-engineers-union-reach-tentative-deal-1.7194972,neutral,0.08555624,0.049071603,0.8653721,0.004911849197901663
CBC,2024-05-06,"After Oct. 7, this year's Holocaust Remembrance Day carries heavier weight for many Jews",https://www.cbc.ca/news/world/holocaust-remembrance-day-1.7194775,negative,0.015433084,0.73605365,0.24851322,-0.5415368324257201
CBC,2024-05-06,WATCH: CBC News Network,https://www.cbc.cahttps://gem.cbc.ca/live,neutral,0.10073908,0.018231502,0.88102955,0.00981596340483426
CBC,2024-05-06,Pipeline road trip: How Trans Mountain’s expansion is changing lives,https://www.cbc.ca/player/play/video/9.4218057,positive,0.6736725,0.0047397935,0.32158768,0.45381216767864885
