source,date,headline,url,chosen_label,positive,negative,neutral,compound
CTV,2024-01-17,"Canada's finance minister, Honda met on potential EV project",https://www.ctvnews.ca/autos/canada-s-finance-minister-honda-met-on-potential-ev-project-1.6721945,neutral,0.15785234,0.0080086095,0.83413917,0.02485320445807382
CTV,2024-01-17,"B.C. snow day: Here's which schools are open and closed in Metro Vancouver, Vancouver Island",https://bc.ctvnews.ca/b-c-snow-day-here-s-which-schools-are-open-and-closed-in-metro-vancouver-vancouver-island-1.6729711,neutral,0.037992258,0.01805355,0.94395405,0.001117483784511819
CTV,2024-01-17,"Day after Trump win in Iowa, Trudeau says U.S. faces choice between optimism, retreat",https://www.ctvnews.ca/politics/day-after-trump-win-in-iowa-trudeau-says-u-s-faces-choice-between-optimism-retreat-1.6728212,neutral,0.087696135,0.056980018,0.85532385,0.004443889584667682
CTV,2024-01-17,"Here's what we know about health of King, Princess of Wales",/video/c2848651-royal-family-medical-care--here-s-what-we-know?playlistId=1.6729700,neutral,0.18107867,0.005370367,0.8135509,0.03276065788759386
CTV,2024-01-17,Ontario expanding number of private clinics that can perform OHIP surgeries,https://toronto.ctvnews.ca/ontario-expanding-number-of-private-clinics-that-can-perform-ohip-surgeries-1.6729949,neutral,0.07815701,0.015669804,0.90617317,0.005862976256153063
CTV,2024-01-17,Toddler injured in flash bang police raid on wrong home,/video/c2848547-toddler-injured-after-police-raid-wrong-home,negative,0.00754913,0.7597711,0.2326798,-0.5771951372781787
CTV,2024-01-17,House ethics committee meets to discuss Trudeau's Jamaica vacation,https://www.ctvnews.ca/politics/house-ethics-committee-meets-to-discuss-trudeau-s-jamaica-vacation-1.6729155,neutral,0.020718444,0.073851384,0.90543014,-0.005024774805469923
CTV,2024-01-17,Researchers identify single-celled microbe that may help coral survive climate change,https://www.ctvnews.ca/sci-tech/researchers-identify-single-celled-microbe-that-may-help-coral-survive-climate-change-1.6728595,positive,0.43242413,0.011699883,0.55587596,0.18685375175112817
CTV,2024-01-17,Apple plans to remove sensor from some watch models depending on how a court rules in patent dispute,https://www.ctvnews.ca/business/apple-plans-to-remove-sensor-from-some-watch-models-depending-on-how-a-court-rules-in-patent-dispute-1.6729045,neutral,0.032465305,0.09929179,0.86824304,-0.008804853632180532
CTV,2024-01-17,Fernandez bounced in second round at Australian Open,https://www.ctvnews.ca/sports/fernandez-bounced-in-second-round-at-australian-open-1.6729624,neutral,0.027994331,0.15343827,0.8185674,-0.022759619953660604
CTV,2024-01-17,Strangers step up to help man living in a truck with his dogs,https://kitchener.ctvnews.ca/strangers-step-up-to-help-man-living-in-a-truck-with-his-dogs-1.6729270,neutral,0.08556184,0.05996309,0.8544751,0.0037252564931342658
CTV,2024-01-17,"'This is truly a dream come true': London, Ont. man wins $152K jackpot",https://london.ctvnews.ca/this-is-truly-a-dream-come-true-london-ont-man-wins-152k-jackpot-1.6728580,positive,0.9613531,0.002669474,0.035977338,0.9241927836223482
CTV,2024-01-17,Windsor police inspector charged with discreditable conduct,https://windsor.ctvnews.ca/windsor-police-inspector-charged-with-discreditable-conduct-1.6729730,negative,0.009483297,0.7723881,0.21812862,-0.5964934454278925
CTV,2024-01-17,Neighbours share concerns about emergency shelter space in trailers at public meeting,https://edmonton.ctvnews.ca/neighbours-share-concerns-about-emergency-shelter-space-in-trailers-at-public-meeting-1.6729888,negative,0.021315455,0.22653772,0.7521468,-0.050864998830554065
CTV,2024-01-17,Candlelight vigil planned for missing Alliston man as family's concern mounts,https://barrie.ctvnews.ca/candlelight-vigil-planned-for-missing-alliston-man-as-family-s-concern-mounts-1.6728701,negative,0.02083308,0.3334783,0.64568853,-0.11077378868385779
CTV,2024-01-17,Weapons seized from commercial vehicle at Ambassador Bridge,https://windsor.ctvnews.ca/weapons-seized-from-commercial-vehicle-at-ambassador-bridge-1.6729580,negative,0.013838046,0.4991183,0.4870437,-0.24892755506120334
CTV,2024-01-17,'I had a nice smile and looked trustworthy': Manitoba professor’s face used in cryptocurrency scam detailed by Netflix,https://winnipeg.ctvnews.ca/i-had-a-nice-smile-and-looked-trustworthy-manitoba-professor-s-face-used-in-cryptocurrency-scam-detailed-by-netflix-1.6730005,positive,0.52480334,0.036062356,0.43913424,0.2741180814679396
CTV,2024-01-17,Winning $70M Lotto Max ticket bought in Alberta,https://calgary.ctvnews.ca/winning-70m-lotto-max-ticket-bought-in-alberta-1.6729698,positive,0.77095586,0.0029086522,0.22613554,0.5943644444541629
CTV,2024-01-17,CPC calls for probe into Trudeau's family trip to Jamaica,/video/c2844182-power-play--is-an-ethics-probe-needed-?playlistId=1.6711848,neutral,0.03294178,0.038436957,0.9286213,-0.00039223854244596623
CTV,2024-01-17,This sliver of a 4.5 billion-year-old asteroid in Winnipeg may hold a clue to life on Earth,https://winnipeg.ctvnews.ca/this-sliver-of-a-4-5-billion-year-old-asteroid-in-winnipeg-may-hold-a-clue-to-life-on-earth-1.6721879,neutral,0.19546744,0.03734478,0.7671878,0.03681288813118755
CTV,2024-01-17,Quebec man arrested in Gravenhurst for bringing contraband to correctional facility: OPP,https://barrie.ctvnews.ca/quebec-man-arrested-in-gravenhurst-for-bringing-contraband-to-correctional-facility-opp-1.6729992,negative,0.010060277,0.48789623,0.50204355,-0.2379414972271512
CTV,2024-01-17,"Crash involving school bus, semi closes Trans-Canada Highway in Manitoba",https://winnipeg.ctvnews.ca/crash-involving-school-bus-semi-closes-trans-canada-highway-in-manitoba-1.6729757,negative,0.013731595,0.6246607,0.36160782,-0.39001234216254765
CTV,2024-01-17,Victims’ families want addictions challenges addressed in James Smith Cree Nation inquest,https://www.ctvnews.ca/canada/victims-families-want-addictions-challenges-addressed-in-james-smith-cree-nation-inquest-1.6729932,neutral,0.041643318,0.093751125,0.86460555,-0.007055108111716724
CTV,2024-01-17,Travel agent charged over alleged Alaskan cruise scam,/video/c2848432-travel-agent-charged-for-cruise-scam,negative,0.011328912,0.730343,0.25832814,-0.5332724869305352
CTV,2024-01-17,Winter weather warnings issued for southern B.C. and Alberta; up to 40 centimetres of snow possible,https://calgary.ctvnews.ca/winter-weather-warnings-issued-for-southern-b-c-and-alberta-up-to-40-centimetres-of-snow-possible-1.6730048,negative,0.040641826,0.25962174,0.6997365,-0.06575167947877425
CTV,2024-01-17,"Family of homicide victim files human rights complaints over Manitoba election ads, lack of landfill search",https://winnipeg.ctvnews.ca/family-of-homicide-victim-files-human-rights-complaints-over-manitoba-election-ads-lack-of-landfill-search-1.6728661,negative,0.007124745,0.75676966,0.23610564,-0.5726495411260268
CBC,2024-01-17,"Ontario woman who faked pregnancies, harassed doulas faces sentencing hearing today",https://www.cbc.ca/news/canada/london/kaitlyn-braun-sentencing-1.7085430,negative,0.008700297,0.69487137,0.2964283,-0.48277054035487765
CBC,2024-01-17,WATCH: CBC News Network,https://www.cbc.cahttps://gem.cbc.ca/live,neutral,0.10073908,0.018231502,0.88102955,0.00981596340483426
CBC,2024-01-17,"Aggressive, often deadly form of strep hits record-high case numbers in Canada",https://www.cbc.ca/news/canada/toronto/ontario-strep-deaths-invasive-group-a-streptococcal-disease-1.7085755,negative,0.007206315,0.87000525,0.12278843,-0.7568572039288028
CBC,2024-01-17,Penguins at Calgary Zoo kick off their annual royal waddles,https://www.cbc.ca/player/play/2300045379818,neutral,0.2034705,0.0030017581,0.7935277,0.04139123608559281
CBC,2024-01-17,Are cellphone bans in schools a good idea? Experts weigh in,https://www.cbc.cahttps://www.cbc.ca/kidsnews/post/are-cellphone-bans-in-schools-a-good-idea-experts-weigh-in,neutral,0.037134666,0.14783318,0.8150322,-0.020475663675458833
CBC,2024-01-17,Businesses need to pay CEBA loans or lose free money — because the deadline isn't changing,https://www.cbc.ca/news/business/ceba-loan-not-extended-1.7085696,negative,0.020175425,0.56794024,0.41188434,-0.3221490803531122
CBC,2024-01-17,"Launch day is finally close for these students and their teensy, climate-measuring satellite",https://www.cbc.ca/news/canada/newfoundland-labrador/mun-cube-satellite-launch-1.7083920,positive,0.7724053,0.0048844265,0.22271039,0.5965860276900798
CBC,2024-01-17,WATCH : CBC News Explore,https://www.cbc.cahttps://gem.cbc.ca/live,neutral,0.09840742,0.014817321,0.88677526,0.009464467482493077
CBC,2024-01-17,Former Cree grand chief spends 4 days in an ER hallway after travelling to Montreal for health care,https://www.cbc.ca/news/canada/montreal/former-cree-grand-chief-matthew-mukash-montreal-health-care-hospital-er-wait-1.7085709,negative,0.013082639,0.4266623,0.56025505,-0.18186955905946434
CBC,2024-01-17,"Edmonton declares homelessness emergency, while judge scraps lawsuit against city's dismantling of encampments",https://www.cbc.ca/news/canada/edmonton/edmonton-council-alberta-cabinet-homeless-housing-1.7085148,negative,0.016116764,0.42995462,0.5539287,-0.18460119884354143
CBC,2024-01-17,Ottawa planning to reduce volume of international students in certain provinces: source,https://www.cbc.ca/news/politics/international-students-provinces-volume-1.7085915,negative,0.0129812695,0.23622686,0.7507917,-0.05563464783523919
CBC,2024-01-17,"Medicine shipments for hostages, Palestinians en route to Gaza in deal brokered by France, Qatar",https://www.cbc.ca/news/world/israel-hamas-war-day-102-1.7086090,neutral,0.05194588,0.057392124,0.890662,-0.0005954813509967405
CBC,2024-01-17,"The key to capturing wildlife images? Patience, says Canadian Geographic's Photographer of the Year",https://www.cbc.ca/news/canada/windsor/windsor-photographer-canadian-geographic-1.7085402,positive,0.5001089,0.011468303,0.48842266,0.24997746065289128
CBC,2024-01-17,Dance clubs can overwhelm neurodiverse people — so why do so many become DJs?,https://www.cbc.ca/news/canada/ottawa/neurodiverse-djs-ottawa-1.7060726,negative,0.017938856,0.56186974,0.42019138,-0.31537581906216516
CBC,2024-01-17,Climate change threatens northern Ontario's winter road system — so what can be done about it?,https://www.cbc.ca/news/canada/thunder-bay/northern-ontario-winter-roads-1.7085333,negative,0.014522339,0.58529115,0.4001865,-0.34235484643245684
CBC,2024-01-17,"Many schools closed, commuters warned to prepare as snow blankets southwest B.C.",https://www.cbc.ca/news/canada/british-columbia/snowstorm-british-columbia-jan-17-2024-1.7086012,negative,0.018758992,0.38730952,0.59393156,-0.1496567440067622
CBC,2024-01-17,"After days of confusion, Trudeau government says it will abide by ICJ on genocide case against Israel",https://www.cbc.ca/news/politics/israel-gaza-genocide-international-court-justice-hague-south-africa-1.7084682,neutral,0.07179336,0.08074235,0.8474643,-0.001365040127604189
CBC,2024-01-17,Go beyond the headlines | Stream CBC News Explore,https://www.cbc.cahttps://www.cbc.ca/news/cbc-news-explore-1.6512577,neutral,0.09185704,0.0112939505,0.89684886,0.008310174861161368
CBC,2024-01-17,Some tenants facing eviction are demanding thousands from landlords,https://www.cbc.ca/news/canada/toronto/landlord-tenant-cash-for-keys-1.7050393,negative,0.024498932,0.44842345,0.5270776,-0.20048338818992661
CBC,2024-01-17,RCMP officers who responded to stabbing massacre at James Smith expected to testify at inquest Wednesday,https://www.cbc.ca/news/canada/saskatchewan/james-smith-cree-nation-mass-stabbing-public-coroners-inquest-1.7085869,negative,0.017156221,0.27165034,0.7111934,-0.07349958897440345
CBC,2024-01-17,Man who killed his estranged wife outside school was facing domestic violence charges,https://www.cbc.ca/news/canada/calgary/police-investigating-incident-calgary-school-southwest-1.7085323,negative,0.0066462066,0.80288446,0.1904694,-0.6445792237890826
CBC,2024-01-17,Kenyan cult leader faces 191 murder charges in child mass starvation deaths,https://www.cbc.ca/news/world/kenya-pastor-mackenzie-murder-charges-1.7086087,negative,0.0043834373,0.9028945,0.09272184,-0.8151994521145598
CBC,2024-01-17,End of 50% discount on some items at Loblaw stores raises concerns about anti-competitive behaviour,https://www.cbc.ca/news/business/loblaws-discount-competition-1.7085484,negative,0.009956653,0.74706274,0.2429804,-0.558003749297864
CBC,2024-01-17,"Princess of Wales hospitalized after abdominal surgery, King to be treated for enlarged prostate",https://www.cbc.ca/news/world/catherine-princess-of-wales-hospital-abdominal-surgery-1.7086170,negative,0.044315707,0.23782757,0.7178567,-0.05459807336551403
CBC,2024-01-17,Rachel Notley to step down as Alberta NDP leader,https://www.cbc.ca/news/canada/edmonton/rachel-notley-announces-intention-to-step-down-as-alberta-ndp-leader-1.7085037,neutral,0.023981795,0.12169584,0.8543223,-0.014234755816372235
CBC,2024-01-17,"When conflict breaks out on the International Space Station, you get this movie",https://www.cbc.ca/news/entertainment/iss-film-1.7085671,negative,0.028750293,0.5321462,0.43910345,-0.2823530298347343
CBC,2024-01-17,"Norwich, Ont., changes its stand on ban of Pride and other flags on township property",https://www.cbc.ca/news/canada/london/norwich-ont-flag-pride-allowed-community-flag-pole-1.7085806,neutral,0.022545196,0.06090362,0.91655105,-0.0032009700595028168
CBC,2024-01-17,Calgary's waitlist for English-language classes is thousands of names long,https://www.cbc.ca/news/canada/calgary/unsettling-integration-newcomers-canada-immigration-challenges-1.7082617,negative,0.020160908,0.60358536,0.37625366,-0.3639088620880173
CBC,2024-01-17,Notley made Alberta NDP a winner and planted unlikely dream: winning again,https://www.cbc.ca/news/canada/calgary/notley-resigns-alberta-ndp-winner-analysis-1.7085776,positive,0.4055345,0.041794077,0.55267143,0.16271149184012756
CBC,2024-01-17,I'm a lifelong learner but abbreviations are putting my skills to the test IRL,https://www.cbc.ca/news/canada/edmonton/first-person-desiree-kendrick-acronyms-1.7080047,positive,0.5192132,0.0237309,0.45705578,0.2690192499228372
