source,date,headline,url,chosen_label,positive,negative,neutral,compound
Global,2024-01-17,Providing care for animals in Canada’s north,https://globalnews.ca/video/10231799/providing-care-for-animals-in-canadas-north/,neutral,0.1382508,0.013303267,0.84844583,0.018936319318071604
Global,2024-01-17,"Murder, sex assault probe sparks concerns there may be more victims: Ontario police",https://globalnews.ca/news/10231693/murder-sex-assault-probe-sparks-concerns-there-may-be-more-victims-ontario-police/,negative,0.007882426,0.7090513,0.28306603,-0.5026917963394055
Global,2024-01-17,Canadians receive 1st carbon pricing rebate of 2024 starting Monday,https://globalnews.ca/video/10226084/canadians-receive-1st-carbon-pricing-rebate-of-2024-starting-monday/,positive,0.29357997,0.007964438,0.69845563,0.08612575564375113
Global,2024-01-17,The Southern Chiefs’ Organization launches campaign aimed at ’60s Scoop,https://globalnews.ca/news/10231996/southern-chiefs-organization-sixties-scoop/,neutral,0.06949176,0.021790966,0.9087172,0.004354261187847541
Global,2024-01-17,Duelling U.S. sandwich brands Jimmy John’s and Jersey Mike’s to expand in Canada,https://globalnews.ca/news/10231817/u-s-sandwich-brands-to-expand-in-canada/,neutral,0.14115673,0.008602741,0.8502405,0.019851216173766062
Global,2024-01-17,Emotional day at inquest into Saskatchewan massacre,https://globalnews.ca/video/10231223/emotional-day-at-inquest-into-saskatchewan-massacre/,negative,0.04754681,0.56748676,0.38496643,-0.3197805276147925
Global,2024-01-17,University of Winnipeg team working to analyze asteroid sample retrieved on recent NASA mission,https://globalnews.ca/video/10232007/university-of-winnipeg-team-working-to-analyze-asteroid-sample-retrieved-on-recent-nasa-mission/,neutral,0.07522568,0.010950445,0.91382384,0.005538992737051274
Global,2024-01-17,Canada names 85 Chinese research groups that ‘may pose’ threat to national security,https://globalnews.ca/news/10229572/canada-names-china-groups-national-security/,negative,0.009179509,0.6912652,0.2995553,-0.4777633073888694
Global,2024-01-17,Former U.S. special envoy: I don’t see Yemen being a front that has potential to explode,https://globalnews.ca/video/10224208/former-u-s-special-envoy-i-dont-see-yemen-being-a-front-that-has-potential-to-explode/,negative,0.023154287,0.42231703,0.5545288,-0.17781551541203733
Global,2024-01-17,"Israel-Hamas war tensions increased hate crimes and protests in 2023, VPD says",https://globalnews.ca/video/10231297/israel-hamas-war-tensions-increased-hate-crimes-and-protests-in-2023-vpd-says/,negative,0.0089888,0.73185354,0.25915754,-0.535528898596354
Global,2024-01-17,Banff to make decision on permanent pedestrian zone in its downtown,https://globalnews.ca/news/10231835/banff-to-make-decision-on-permanent-pedestrian-zone-in-its-downtown/,neutral,0.05309273,0.028533379,0.9183739,0.0020046844380349205
Global,2024-01-17,"Saskatoon morning news rewind: Wednesday, Jan. 17",https://globalnews.ca/news/10231826/saskatoon-real-estate-university-saskatchewan/,neutral,0.021269651,0.018444657,0.9602856,0.00011219292263320302
Global,2024-01-17,Several Winnipeg fire crews called to Magnus Ave. blaze,https://globalnews.ca/video/10232366/several-winnipeg-fire-crews-called-to-magnus-ave-blaze/,neutral,0.047991715,0.0867456,0.86526275,-0.005221591617900145
Global,2024-01-17,3rd-quarter report shows Ontario’s sports-betting industry continues to thrive,https://globalnews.ca/news/10232382/ontario-sports-betting-industry-continues-to-thrive/,positive,0.8055342,0.0038206703,0.19064519,0.6488707002403533
Global,2024-01-17,"$6.5 million reallocated from London, Ont. intersection upgrades to bus rapid transit",https://globalnews.ca/news/10232299/london-ont-funding-intersection-upgrades-bus-rapid-transit/,neutral,0.085897975,0.008292355,0.90580964,0.00730970121969321
Global,2024-01-17,This Halifax cartoonist has a mission in 2024: ‘Let me pet your cat’,https://globalnews.ca/news/10229738/halifax-cartoonist-pet-100-cats/,positive,0.397066,0.012604593,0.5903294,0.15750253027613326
Global,2024-01-17,U.S. strikes Houthi targets in Yemen a 3rd time to thwart Red Sea attacks,https://globalnews.ca/news/10230227/us-yemen-houthi-airstrikes-red-sea/,negative,0.033681307,0.28752995,0.6787888,-0.08153903173175436
Global,2024-01-17,Several factors to blame for temporary pause in kidney transplant program: AHS,https://globalnews.ca/news/10232183/alberta-kidney-transplant-program-pause/,negative,0.008429159,0.6562484,0.3353224,-0.4305909186684378
Global,2024-01-17,‘I’ve never seen anything like this before’: small plane crashes on Ajax streets,https://globalnews.ca/video/10231006/ive-never-seen-anything-like-this-before-small-plane-crashes-on-ajax-streets/,negative,0.021548409,0.6804201,0.2980315,-0.4625071802932048
Global,2024-01-17,Canadians to receive first carbon pricing rebate of 2024. Here’s how much you could get,https://globalnews.ca/news/10225338/carbon-pricing-rebate-january-2024/,positive,0.3114955,0.007305231,0.6811992,0.09697610612469987
Global,2024-01-17,Canadian chef Matty Matheson steals the show with spicy Emmy speech,https://globalnews.ca/video/10231214/canadian-chef-matty-matheson-steals-the-show-with-spicy-emmy-speech/,positive,0.9022647,0.0036703874,0.09406495,0.8140680892088454
Global,2024-01-17,Global News Hour at 6 Edmonton: January 16,https://globalnews.ca/video/10231271/global-news-hour-at-6-edmonton-january-16-2/,neutral,0.03875672,0.011407676,0.9498357,0.0013719451462670396
Global,2024-01-17,More job action set for Saskatchewan teachers after 1-day demonstration,https://globalnews.ca/news/10231883/saskatchewan-teachers-job-action-one-day-demonstration/,neutral,0.043570004,0.051766824,0.9046631,-0.0007814594832780131
Global,2024-01-17,Singer-songwriter Sarah Sleen and the Kingston Symphony perform Joni Mitchell’s songbook,https://globalnews.ca/video/10231714/singer-songwriter-sarah-sleen-and-the-kingston-symphony-perform-joni-mitchells-songbook/,neutral,0.15890843,0.0027659358,0.8383256,0.02524424000600156
Global,2024-01-17,Lucky Alberta lottery player wakes up $70M richer,https://globalnews.ca/news/10232254/alberta-lotto-max-winner-70-million/,positive,0.87653404,0.01153556,0.11193024,0.7681789714337883
Global,2024-01-17,Christina Applegate jokes about MS diagnosis in teary-eyed Emmys speech,https://globalnews.ca/news/10228869/christina-applegate-emmys-speech-2023-video/,positive,0.27948982,0.052083407,0.6684269,0.07540185563371793
Global,2024-01-17,2024 Emmys: Christina Applegate receives standing ovation as she presents 1st award,https://globalnews.ca/video/10228960/2024-emmys-christina-applegate-receives-standing-ovation-as-she-presents-1st-award/,positive,0.63996243,0.0029319024,0.35710564,0.4095433409042304
Global,2024-01-17,Canada names 100 foreign research groups possibly threatening to national security,https://globalnews.ca/video/10231216/canada-names-100-foreign-research-groups-possibly-threatening-to-national-security/,negative,0.010147311,0.69806594,0.2917867,-0.4871931039245414
Global,2024-01-17,NDP MP calls for Competition Bureau investigation into Loblaw discount reduction,https://globalnews.ca/news/10231929/loblaw-macgregor-competition-bureau/,neutral,0.035290517,0.06798339,0.8967262,-0.0033763174158978337
Global,2024-01-17,"Snow timeline for Lower Mainland, Vancouver Island",https://globalnews.ca/video/10231159/snow-timeline-for-lower-mainland-vancouver-island/,neutral,0.05085635,0.030542942,0.9186007,0.0016534977996880418
Global,2024-01-17,What’s Disease X? World leaders to discuss next possible global health threat,https://globalnews.ca/news/10228827/disease-x-davos/,neutral,0.032181572,0.16059372,0.8072247,-0.024754690440759397
Global,2024-01-17,"‘Another manifestation of corporate greed’: Food shoppers angry about inflation, deflating discounts",https://globalnews.ca/video/10231228/another-manifestation-of-corporate-greed-food-shoppers-angry-about-inflation-deflating-discounts/,negative,0.0066578723,0.8567256,0.13661644,-0.733934456747507
Global,2024-01-17,TTC sees rise in number of people seeking shelter in stations during cold snaps,https://globalnews.ca/news/10232210/ttc-rise-shelter-cold-snaps/,neutral,0.035518866,0.10407375,0.86040735,-0.009569756955443154
Global,2024-01-17,This is BC: Second World War veteran Charlie Lee celebrates 100th birthday,https://globalnews.ca/video/10231213/this-is-bc-second-world-war-veteran-charlie-lee-celebrates-100th-birthday/,positive,0.27695847,0.0044432934,0.7185983,0.07668623260422436
CTV,2024-01-17,'Every megawatt matters': Albertans respond quickly to emergency electricity alert,https://calgary.ctvnews.ca/every-megawatt-matters-albertans-respond-quickly-to-emergency-electricity-alert-1.6725426,positive,0.36860177,0.01110906,0.62028915,0.135743863835307
CTV,2024-01-17,'Bad news': Mischief charges being considered after false Ontario kangaroo sighting,https://london.ctvnews.ca/bad-news-mischief-charges-being-considered-after-false-ontario-kangaroo-sighting-1.6719966,negative,0.0044162855,0.8846287,0.110954836,-0.7825486007833984
CTV,2024-01-17,Car slams into row of plows on Highway 407 in Toronto,/video/c2848184-car-crashes-into-snow-plow-on-highway-in-toronto?playlistId=1.6728700,negative,0.020139458,0.54055315,0.43930748,-0.29179206653549805
CTV,2024-01-17,Concordia laments fewer applications amid tuition hikes,https://montreal.ctvnews.ca/concordia-laments-fewer-applications-amid-tuition-hikes-1.6729994,negative,0.008108146,0.6537159,0.33817607,-0.4272786701806659
CTV,2024-01-17,Employee at Regina 'children's entertainment business' accused of sexually assaulting 2 girls,https://regina.ctvnews.ca/employee-at-regina-children-s-entertainment-business-accused-of-sexually-assaulting-2-girls-1.6729865,negative,0.010432295,0.6592187,0.33034897,-0.434460499116085
CTV,2024-01-17,Chase the Ace jackpot in New Brunswick still up for grabs,https://atlantic.ctvnews.ca/chase-the-ace-jackpot-in-new-brunswick-still-up-for-grabs-1.6729188,neutral,0.10928576,0.013374523,0.87733966,0.011764504540417775
CTV,2024-01-17,"Stabbing in London leads to charges, non-life-threatening injuries for victim",https://london.ctvnews.ca/stabbing-in-london-leads-to-charges-non-life-threatening-injuries-for-victim-1.6729777,negative,0.015575509,0.67639965,0.30802482,-0.4572738869939492
CTV,2024-01-17,FCC chair asks automakers about plans to stop abusers from using car electronics to stalk partners,https://www.ctvnews.ca/autos/fcc-chair-asks-automakers-about-plans-to-stop-abusers-from-using-car-electronics-to-stalk-partners-1.6722608,neutral,0.017302532,0.20498583,0.77771163,-0.04171981467665731
CTV,2024-01-17,15-year-old dead after falling off chairlift at Quebec ski resort,https://montreal.ctvnews.ca/15-year-old-dead-after-falling-off-chairlift-at-quebec-ski-resort-1.6724666,negative,0.009735088,0.7197642,0.27050072,-0.5179656924622726
CTV,2024-01-17,What the health minister had to say about a U.S. approval to import cheaper medication from Canada,https://www.ctvnews.ca/politics/what-the-health-minister-had-to-say-about-a-u-s-approval-to-import-cheaper-medication-from-canada-1.6728869,neutral,0.04255871,0.04680023,0.9106411,-0.0003790175527553785
CTV,2024-01-17,Security footage shows people passing by Regina man who died on street corner,https://regina.ctvnews.ca/security-footage-shows-people-passing-by-regina-man-who-died-on-street-corner-1.6722594,negative,0.016161745,0.39170447,0.5921339,-0.15317115634433875
CTV,2024-01-17,Canada reaches yearly record number of strep infections,/video/c2848609-record-number-of-invasive-strep-infections?playlistId=1.6362437,negative,0.021604212,0.6596806,0.3187151,-0.4347117953759039
CTV,2024-01-17,Woman airlifted to trauma centre as police launch investigation in Bradford,https://barrie.ctvnews.ca/woman-airlifted-to-trauma-centre-as-police-launch-investigation-in-bradford-1.6730012,negative,0.012766857,0.36651614,0.620717,-0.13417109022549312
CTV,2024-01-17,"Record number of invasive strep A infections reported in Canada, 6 children dead in Ontario",https://www.ctvnews.ca/health/record-number-of-invasive-strep-a-infections-reported-in-canada-6-children-dead-in-ontario-1.6729641,negative,0.009341305,0.82799894,0.1626598,-0.6854949540342048
CTV,2024-01-17,Notley resignation: Alberta NDP leader says 'no intention' of running for the party federally,https://www.ctvnews.ca/politics/notley-resignation-alberta-ndp-leader-says-no-intention-of-running-for-the-party-federally-1.6728900,negative,0.015128845,0.3724271,0.6124441,-0.13847304578444408
CTV,2024-01-17,Here's why electric cars don't go as far in the cold,https://www.ctvnews.ca/autos/here-s-why-electric-cars-don-t-go-as-far-in-the-cold-1.6728386,negative,0.054635514,0.42157415,0.5237903,-0.1747397305717886
CTV,2024-01-17,Two Malaysian filmmakers are charged with offending the religious feelings of others in banned film,https://www.ctvnews.ca/entertainment/two-malaysian-filmmakers-are-charged-with-offending-the-religious-feelings-of-others-in-banned-film-1.6729597,negative,0.005627221,0.76282346,0.23154926,-0.5818680145043231
CTV,2024-01-17,Man dies after being found on OC Transpo bus in Ottawa's east end Wednesday morning,https://ottawa.ctvnews.ca/man-dies-after-being-found-on-oc-transpo-bus-in-ottawa-s-east-end-wednesday-morning-1.6729832,negative,0.011476334,0.6001325,0.38839114,-0.36002734119168167
CTV,2024-01-17,Hostages and residents in Gaza are set to receive medicines as Israel-Hamas war rages on,https://www.ctvnews.ca/world/hostages-and-residents-in-gaza-are-set-to-receive-medicines-as-israel-hamas-war-rages-on-1.6729482,negative,0.020949448,0.46855816,0.5104924,-0.2191078720134243
CTV,2024-01-17,"Highway 11 reopened from North Bay to Cobalt after transport, school bus crash",https://northernontario.ctvnews.ca/highway-11-reopened-from-north-bay-to-cobalt-after-transport-school-bus-crash-1.6729767,negative,0.029828243,0.2807459,0.68942595,-0.07792850988265343
CTV,2024-01-17,These new graphic health warnings on cigarette packs are meant to encourage more smokers to quit,https://www.ctvnews.ca/health/these-new-graphic-health-warnings-on-cigarette-packs-are-meant-to-encourage-more-smokers-to-quit-1.6729162,negative,0.011790219,0.77398854,0.21422113,-0.5989193380106901
CTV,2024-01-17,"Canada watching for UN court decision on Israel and genocide, Trudeau says",https://www.ctvnews.ca/politics/canada-watching-for-un-court-decision-on-israel-and-genocide-trudeau-says-1.6729958,neutral,0.034656238,0.06909353,0.8962501,-0.0035728649277131375
CTV,2024-01-17,Alleged Nazi links prompts Winnipeg Art Gallery to cut ties with former director,https://winnipeg.ctvnews.ca/alleged-nazi-links-prompts-winnipeg-art-gallery-to-cut-ties-with-former-director-1.6718270,negative,0.007289544,0.7409791,0.25173128,-0.5489969404596025
CTV,2024-01-17,'This crime has ruined me': Victims of doula defrauder speak in court,https://kitchener.ctvnews.ca/this-crime-has-ruined-me-victims-of-doula-defrauder-speak-in-court-1.6729835,negative,0.004489652,0.9283287,0.067181654,-0.8617739981532471
CTV,2024-01-17,Metro Vancouver transit operator urges 'essential travel only' amid B.C. snowstorm,https://bc.ctvnews.ca/metro-vancouver-transit-operator-urges-essential-travel-only-amid-b-c-snowstorm-1.6729870,neutral,0.026313534,0.19248837,0.781198,-0.03635938408383055
CTV,2024-01-17,One winning ticket sold for Tuesday's $70 million Lotto Max jackpot,https://www.ctvnews.ca/canada/one-winning-ticket-sold-for-tuesday-s-70-million-lotto-max-jackpot-1.6729480,positive,0.30795705,0.0045431247,0.68749994,0.0948168704458432
CTV,2024-01-17,Severed hand found in security guard's pocket during arrest,/video/c2848433-severed-hand-found-in-security-guard-s-pocket,neutral,0.051420256,0.038976114,0.9096037,0.0011249042303211887
CTV,2024-01-17,Snowstorm forces flight cancellations at Vancouver airport,https://bc.ctvnews.ca/snowstorm-forces-flight-cancellations-at-vancouver-airport-1.6729800,negative,0.013835564,0.57142544,0.41473907,-0.32633557544945546
CTV,2024-01-17,Sask. teachers start new 5-day countdown to job action,https://saskatoon.ctvnews.ca/sask-teachers-start-new-5-day-countdown-to-job-action-1.6729924,neutral,0.047547422,0.028719807,0.9237329,0.0014359280565090504
CTV,2024-01-17,"Grammys 2024: From how to watch the music-filled show to who's nominated, here's what to know",https://www.ctvnews.ca/entertainment/grammys-2024-from-how-to-watch-the-music-filled-show-to-who-s-nominated-here-s-what-to-know-1.6730001,neutral,0.16711347,0.0071763387,0.8257102,0.027875413736834886
CTV,2024-01-17,New dental care plan leaves out 4.4 million uninsured Canadians: report,https://www.ctvnews.ca/politics/new-dental-care-plan-leaves-out-4-4-million-uninsured-canadians-report-1.6728997,negative,0.018031577,0.49651387,0.4854546,-0.24620087473735275
CTV,2024-01-17,"Are fingerprints unique? Not really, AI-based study finds",https://www.ctvnews.ca/sci-tech/are-fingerprints-unique-not-really-ai-based-study-finds-1.6723533,neutral,0.06069545,0.06682433,0.87248015,-0.0007815539771920399
CTV,2024-01-17,"Video shows driver sliding, crashing on notorious Surrey, B.C., hill during snowstorm",https://bc.ctvnews.ca/video-shows-driver-sliding-crashing-on-notorious-surrey-b-c-hill-during-snowstorm-1.6730000,negative,0.012743294,0.61528236,0.37197435,-0.3784099869662896
CTV,2024-01-17,"Kenya doomsday cult leader, 30 others face charges of murdering 191 children; more charges to follow",https://www.ctvnews.ca/world/kenya-doomsday-cult-leader-30-others-face-charges-of-murdering-191-children-more-charges-to-follow-1.6729599,negative,0.00562644,0.8846169,0.109756656,-0.7825154165782364
CTV,2024-01-17,"Heather Mack, who killed and stuffed her mother into a suitcase in Bali, is set to be sentenced",https://www.ctvnews.ca/world/heather-mack-who-killed-and-stuffed-her-mother-into-a-suitcase-in-bali-is-set-to-be-sentenced-1.6729987,negative,0.007258252,0.79599655,0.19674526,-0.6335577851753351
CTV,2024-01-17,Man dies after fall on Quebec ski hill; second skiing fatality in 4 days,https://montreal.ctvnews.ca/man-dies-after-fall-on-quebec-ski-hill-second-skiing-fatality-in-4-days-1.6728522,negative,0.009511784,0.77982736,0.2106609,-0.6080402089906567
CTV,2024-01-17,"U.S. Supreme Court rebuffs Apple's appeal on app payments, threatening billions in revenue",https://www.ctvnews.ca/business/u-s-supreme-court-rebuffs-apple-s-appeal-on-app-payments-threatening-billions-in-revenue-1.6729248,negative,0.028674083,0.41455656,0.5567694,-0.17103492856981006
CTV,2024-01-17,Video shows moment truck hits ice on Alabama highway,/video/c2848515-video--truck-hits-ice-on-alabama-highway,negative,0.018139342,0.3949984,0.5868622,-0.15569472418907537
CTV,2024-01-17,'All our dreams are gone': Ottawa couple scammed out of $177k,https://ottawa.ctvnews.ca/all-our-dreams-are-gone-ottawa-couple-scammed-out-of-177k-1.6729020,negative,0.0066953534,0.86505616,0.12824853,-0.7482773147212951
CTV,2024-01-17,U.S. company's lunar lander will burn up in Earth's atmosphere after failed moonshot,https://www.ctvnews.ca/sci-tech/u-s-company-s-lunar-lander-will-burn-up-in-earth-s-atmosphere-after-failed-moonshot-1.6726277,negative,0.027324818,0.53057754,0.44209763,-0.28076589691121256
CTV,2024-01-17,Pallet shelters expected to arrive in the Halifax area by the end of the month,https://atlantic.ctvnews.ca/pallet-shelters-expected-to-arrive-in-the-halifax-area-by-the-end-of-the-month-1.6720246,neutral,0.10391598,0.0069352384,0.88914895,0.010750417147606939
CTV,2024-01-17,OCDSB dismisses Trustee Kaplan-Myrth's appeal of conduct complaint,https://ottawa.ctvnews.ca/ocdsb-dismisses-trustee-kaplan-myrth-s-appeal-of-conduct-complaint-1.6729901,negative,0.017488508,0.4030778,0.57943356,-0.16216591972696648
CTV,2024-01-17,James Smith inquest lawyer points to distrust of RCMP within First Nation communities,https://saskatoon.ctvnews.ca/james-smith-inquest-lawyer-points-to-distrust-of-rcmp-within-first-nation-communities-1.6728819,negative,0.008043943,0.66155654,0.33039957,-0.4375923141558573
CTV,2024-01-17,King Charles has sought treatment for an enlarged prostate: Buckingham Palace,https://www.ctvnews.ca/world/king-charles-has-sought-treatment-for-an-enlarged-prostate-buckingham-palace-1.6729812,neutral,0.038195774,0.014041119,0.94776326,0.0012617603652658183
CTV,2024-01-17,"Calgary digging out of latest storm, more snow expected Wednesday",https://calgary.ctvnews.ca/calgary-digging-out-of-latest-storm-more-snow-expected-wednesday-1.6729635,neutral,0.06283708,0.105026424,0.8321364,-0.007082055606165483
CTV,2024-01-17,'Irreconcilable breakdown': Nygard's lawyer withdraws from sex assault case,https://toronto.ctvnews.ca/irreconcilable-breakdown-nygard-s-lawyer-withdraws-from-sex-assault-case-1.6729825,negative,0.008791359,0.7255407,0.26566792,-0.5263320153502491
CTV,2024-01-17,"At Davos, Blinken calls pathway to Palestinian state a necessity for Israeli security",https://www.ctvnews.ca/world/at-davos-blinken-calls-pathway-to-palestinian-state-a-necessity-for-israeli-security-1.6729497,neutral,0.086420804,0.05631436,0.8572649,0.004297246993939741
CTV,2024-01-17,This lawn has been named the ugliest in the world - but it's all for a good cause,https://www.ctvnews.ca/climate-and-environment/this-lawn-has-been-named-the-ugliest-in-the-world-but-it-s-all-for-a-good-cause-1.6723250,negative,0.046416894,0.816517,0.13706598,-0.6645455919516081
CTV,2024-01-17,'Snow day': Here's a look at the B.C. snowstorm through the eyes of social media,https://bc.ctvnews.ca/snow-day-here-s-a-look-at-the-b-c-snowstorm-through-the-eyes-of-social-media-1.6729831,neutral,0.060809992,0.024002127,0.9151879,0.003121752492129204
CTV,2024-01-17,Toronto daycare pulls out of $10-a-day program,https://toronto.ctvnews.ca/toronto-daycare-pulls-out-of-10-a-day-program-1.6729907,negative,0.031587243,0.25314882,0.71526384,-0.06308659296443864
CTV,2024-01-17,"Extreme cold warning comes to an end, bitter temperatures still in the forecast",https://london.ctvnews.ca/extreme-cold-warning-comes-to-an-end-bitter-temperatures-still-in-the-forecast-1.6729167,negative,0.02998391,0.5927709,0.3772453,-0.35047820604397373
CTV,2024-01-17,Alberta opens new support centre in Edmonton for people living in encampments,https://edmonton.ctvnews.ca/alberta-opens-new-support-centre-in-edmonton-for-people-living-in-encampments-1.6730038,neutral,0.074674726,0.011221619,0.91410357,0.0054503956080846905
CTV,2024-01-17,Former hockey pro Terry Ryan gets one last call-up on 47th birthday,https://www.ctvnews.ca/sports/former-hockey-pro-terry-ryan-gets-one-last-call-up-on-47th-birthday-1.6729210,neutral,0.11269317,0.004629921,0.88267684,0.01267832207992825
CTV,2024-01-17,B.C. rescue group receives dozens of hummingbirds amid cold snap,https://bc.ctvnews.ca/b-c-rescue-group-receives-dozens-of-hummingbirds-amid-cold-snap-1.6728598,neutral,0.12977964,0.016264994,0.8539553,0.01657820931919307
CTV,2024-01-17,Cold snap brings rare opportunity for outdoor skating on Vancouver Island,https://vancouverisland.ctvnews.ca/cold-snap-brings-rare-opportunity-for-outdoor-skating-on-vancouver-island-1.6727384,positive,0.4722392,0.009467718,0.51829296,0.22292027594854957
CTV,2024-01-17,"Sante Quebec's new CEO to earn $652,050 a year for two years",https://montreal.ctvnews.ca/sante-quebec-s-new-ceo-to-earn-652-050-a-year-for-two-years-1.6729541,neutral,0.14984894,0.013606647,0.8365445,0.022269549009585887
CTV,2024-01-17,'Going to be one of the best summers': A first look at The Boathouse redevelopment in Kitchener,https://kitchener.ctvnews.ca/going-to-be-one-of-the-best-summers-a-first-look-at-the-boathouse-redevelopment-in-kitchener-1.6729689,positive,0.97219926,0.0015198169,0.026280949,0.945169084625615
CTV,2024-01-17,Alleged drunk man arrested at LCBO,https://windsor.ctvnews.ca/alleged-drunk-man-arrested-at-lcbo-1.6729869,negative,0.015117956,0.4524954,0.53238666,-0.20452353131616974
CTV,2024-01-17,What you need to know to prepare for 2024 tax-filing season,https://www.ctvnews.ca/business/what-you-need-to-know-to-prepare-for-2024-tax-filing-season-1.6729920,neutral,0.17681664,0.0348225,0.78836095,0.03005150621959629
CTV,2024-01-17,'It's like a bomb in their chest': N.B. woman heads to Montreal to reduce her risk of breast cancer a second time,https://atlantic.ctvnews.ca/more/it-s-like-a-bomb-in-their-chest-n-b-woman-heads-to-montreal-to-reduce-her-risk-of-breast-cancer-a-second-time-1.6728683,negative,0.014027386,0.6892915,0.29668108,-0.47492603417126844
CTV,2024-01-17,"Steely Dan, R.E.M., Timbaland, Hillary Lindsey and Dean Pitchford get into Songwriters Hall of Fame",https://www.ctvnews.ca/entertainment/steely-dan-r-e-m-timbaland-hillary-lindsey-and-dean-pitchford-get-into-songwriters-hall-of-fame-1.6729626,positive,0.41320002,0.007146193,0.57965374,0.17068321349967164
CTV,2024-01-17,Saskatoon woman loses garage door and sentimental items due to car boosting incident,https://saskatoon.ctvnews.ca/saskatoon-woman-loses-garage-door-and-sentimental-items-due-to-car-boosting-incident-1.6729084,negative,0.010504129,0.7026546,0.28684133,-0.49361310917279155
CTV,2024-01-17,All over for Ons in Australian Open's 2nd round. Jabeur loses to 16-year-old Mirra Andreeva,https://www.ctvnews.ca/sports/all-over-for-ons-in-australian-open-s-2nd-round-jabeur-loses-to-16-year-old-mirra-andreeva-1.6729358,neutral,0.017702946,0.2012109,0.78108615,-0.04017243222755873
CTV,2024-01-17,"4 dead, 1 in critical condition after crash in B.C. Interior",https://bc.ctvnews.ca/4-dead-1-in-critical-condition-after-crash-in-b-c-interior-1.6728808,negative,0.01103422,0.65930647,0.32965934,-0.43456326351005714
CTV,2024-01-17,Detectives DNA test dog poop to trace down owners not scooping in Italian province,https://www.ctvnews.ca/world/detectives-dna-test-dog-poop-to-trace-down-owners-not-scooping-in-italian-province-1.6730017,neutral,0.049319364,0.19012357,0.76055706,-0.0337145725764465
