source,date,headline,url,chosen_label,positive,negative,neutral,compound
Global,2024-07-12,Global News Hour at 6 Edmonton: July 12,https://globalnews.ca/video/10621327/global-news-hour-at-6-edmonton-july-12-7/,neutral,0.04339113,0.010553616,0.9460553,0.0017714100596646354
Global,2024-07-12,Concerns raised about proposed West Hillhurst development,https://globalnews.ca/news/10620824/concerns-west-hillhurst-development-calgary/,neutral,0.025184546,0.19082943,0.78398603,-0.03578160869388114
Global,2024-07-12,"Poilievre calls supervised consumption sites ‘drug dens,’ vows to close some",https://globalnews.ca/news/10619667/pierre-poilievre-supervised-consumption-sites-drug-dens-close/,negative,0.012055919,0.52930844,0.45863563,-0.28002207732476947
Global,2024-07-12,"Heiltsuk Nation celebrates ‘powerful, emotional’ return of historic Chief’s Seat",https://globalnews.ca/news/10620669/heiltsuk-nation-celebrates-powerful-emotional-return-of-historic-chiefs-seat/,positive,0.8760995,0.0027575975,0.12114295,0.7675426985135196
Global,2024-07-12,How Project 2025 could upend Canada-U.S. relationship under Trump,https://globalnews.ca/news/10617647/donald-trump-project-2025-canada-us-election/,neutral,0.0775635,0.052447557,0.86998886,0.0032653526021442225
Global,2024-07-12,Locals angered by trees cleared from land adjacent to l’Anse-à-l’Orme nature park,https://globalnews.ca/news/10620854/locals-angered-trees-cleared-from-land-lanse-a-lorme-nature-park/,negative,0.01980013,0.4471947,0.5330051,-0.19959107612213955
Global,2024-07-12,Cancer patient questions lack of new treatment in B.C.,https://globalnews.ca/video/10621294/cancer-patient-questions-lack-of-new-treatment-in-b-c/,negative,0.019474447,0.30516344,0.67536217,-0.09274545589212124
Global,2024-07-12,Global News Hour at 6 Calgary: July 12,https://globalnews.ca/video/10621320/global-news-hour-at-6-calgary-july-12-4/,neutral,0.042119965,0.009567234,0.9483129,0.0016825569222249648
Global,2024-07-12,Concerns raised about proposed West Hillhurst development,https://globalnews.ca/video/10621194/concerns-raised-about-proposed-west-hillhurst-development/,neutral,0.025184546,0.19082943,0.78398603,-0.03578160869388114
Global,2024-07-12,17-year-old girl reportedly falls from ride at Canada’s Wonderland,https://globalnews.ca/video/10620317/17-year-old-girl-reportedly-falls-from-ride-at-canadas-wonderland/,negative,0.018727478,0.45916355,0.52210915,-0.21048036517718316
Global,2024-07-12,Costco members in Canada will have to pay more starting this fall,https://globalnews.ca/news/10616716/costco-membership-fee-hike-canada-us/,negative,0.029241616,0.5156885,0.45506987,-0.26507954938797695
Global,2024-07-12,"Heiltsuk Nation celebrates ‘powerful, emotional’ return of historic chief’s seat",https://globalnews.ca/video/10621323/heiltsuk-nation-celebrates-powerful-emotional-return-of-historic-chiefs-seat/,positive,0.873242,0.0027780384,0.12398011,0.7625437468371912
Global,2024-07-12,Struggling with money? What you can do to tackle mounting debt,https://globalnews.ca/news/10619569/canada-debt-solutions-bankruptcy-pitfalls/,negative,0.04519062,0.3422709,0.6125384,-0.11510720079449754
Global,2024-07-12,Judge in Coutts murder-conspiracy trial warns jury about defence statement,https://globalnews.ca/news/10621219/coutts-murder-conspiracy-trial-alberta-blockade/,negative,0.015912531,0.32657787,0.6575096,-0.10639988854593163
Global,2024-07-12,Clients raise concerns over animal care at Calgary pet hospital,https://globalnews.ca/video/10621254/clients-raise-concerns-over-animal-care-at-calgary-pet-hospital/,negative,0.0139046265,0.5103062,0.47578916,-0.26021907288667734
Global,2024-07-12,Edmonton Oilers superstar Leon Draisaitl announces engagement,https://globalnews.ca/news/10617495/leon-draisaitl-edmonton-oilers-engagement-photos/,neutral,0.09871674,0.0044953115,0.89678794,0.009724787546637081
Global,2024-07-12,Global News at 5 Lethbridge: July 12,https://globalnews.ca/video/10621207/global-news-at-5-lethbridge-july-12-4/,neutral,0.033244185,0.017466525,0.94928926,0.0008000968049309831
Global,2024-07-12,"Montreal residents outraged by planned homeless shelter near daycare, nuns’ residence",https://globalnews.ca/news/10620648/montreal-residents-outraged-planned-homeless-shelter/,negative,0.009908407,0.5977994,0.39229217,-0.3572659885423324
Global,2024-07-12,Telus tells Ontario call centre workers to relocate or risk losing their job,https://globalnews.ca/news/10617207/telus-ontario-call-centre-workers-relocate/,negative,0.015920995,0.538101,0.445978,-0.28929922687293086
Global,2024-07-12,B.C. couple on a sailing adventure across the Atlantic have been found dead in Nova Scotia,https://globalnews.ca/video/10621329/b-c-couple-on-a-sailing-adventure-across-the-atlantic-have-been-found-dead-in-nova-scotia/,negative,0.017702708,0.27852434,0.70377296,-0.07726242198474509
Global,2024-07-12,Blue Jays’ Bo Bichette going viral for openly flirting with trade: ‘I want to win’,https://globalnews.ca/news/10616780/blue-jays-bo-bichette-san-francisco-giants/,positive,0.35804927,0.015048846,0.62690187,0.12797282513400177
Global,2024-07-12,"‘Extreme’ wildfire forces Labrador City, N.L. to evacuate",https://globalnews.ca/news/10620937/extreme-wildfires-force-labrador-city-n-l-to-evacuate/,negative,0.012195599,0.4934128,0.49439153,-0.24330749466092705
Global,2024-07-12,Ammonia leak forces evacuation of Rocky Ridge YMCA for 3rd time in 10 days,https://globalnews.ca/news/10620705/rocky-ridge-ymca-ammonia-leak/,negative,0.009374118,0.6274727,0.36315325,-0.393634057804638
Global,2024-07-12,Fire at Calgary Metal Recycling raising concerns for some area residents,https://globalnews.ca/video/10621166/fire-at-calgary-metal-recycling-raising-concerns-for-some-area-residents/,negative,0.012099803,0.38430136,0.6035988,-0.1475411556610382
Global,2024-07-12,Kelowna firefighters douse small blaze inside second-floor unit,https://globalnews.ca/news/10621073/kelowna-small-fire-second-floor-unit/,neutral,0.024439033,0.20151757,0.77404344,-0.0400120553871357
Global,2024-07-12,People on the autism spectrum in Quebec seek access to funding for service dogs,https://globalnews.ca/news/10620647/quebec-residents-autism-spectrum-service-dogs-financial-support/,neutral,0.06439981,0.033002455,0.9025978,0.0030581718110087586
Global,2024-07-12,Costco members in Canada will have to pay more starting this fall,https://globalnews.ca/video/10616896/costco-members-in-canada-will-have-to-pay-more-starting-this-fall/,negative,0.029241616,0.5156885,0.45506987,-0.26507954938797695
Global,2024-07-12,Poilievre vows to shut down some supervised drug consumption sites,https://globalnews.ca/video/10621307/poilievre-vows-to-shut-down-some-supervised-drug-consumption-sites/,negative,0.015291807,0.44810712,0.53660107,-0.20056615456519467
Global,2024-07-12,Poilievre is ‘embarrassed’ to see Trudeau ‘treated like a human piñata’,https://globalnews.ca/video/10620000/poilievre-is-embarrassed-to-see-trudeau-treated-like-a-human-pinata/,negative,0.008728687,0.85204446,0.13922682,-0.7259036024235588
Global,2024-07-12,Witnesses recount injury at Canada’s Wonderland,https://globalnews.ca/video/10621025/witnesses-recount-injury-at-canadas-wonderland/,negative,0.023881622,0.24655268,0.72956556,-0.06021792370762746
Global,2024-07-12,Ennismore U15 softball team slugs their way into the nationals,https://globalnews.ca/video/10621157/ennismore-u15-softball-team-slugs-their-way-into-the-nationals/,negative,0.03703059,0.3045378,0.65843177,-0.09137196987277463
Global,2024-07-12,Stray bullet shoots through window of Lethbridge home; police investigate,https://globalnews.ca/video/10621131/stray-bullet-shoots-through-window-of-lethbridge-home-police-investigate/,negative,0.012258718,0.3392465,0.64849484,-0.11493790011382288
Global,2024-07-12,Poilievre labels supervised consumption sites ‘drug dens’,https://globalnews.ca/video/10620207/poilievre-labels-supervised-consumption-sites-drug-dens/,negative,0.010837241,0.61749166,0.37167114,-0.3811784709631212
Global,2024-07-12,2 B.C. sailors found dead in Nova Scotia,https://globalnews.ca/video/10620487/2-b-c-sailors-found-dead-in-nova-scotia/,negative,0.01612891,0.35767883,0.6261924,-0.12767396382040985
Global,2024-07-12,Massive AT&T data breach includes calls to Canada,https://globalnews.ca/news/10619289/att-data-breach-2022-canada/,negative,0.01823072,0.68908876,0.29268053,-0.47451094191044874
CTV,2024-07-12,Chinook Regional Hospital emergency department seeing temporary staff reduction through summer,https://calgary.ctvnews.ca/chinook-regional-hospital-emergency-department-seeing-temporary-staff-reduction-through-summer-1.6962314,neutral,0.019730294,0.17481825,0.80545133,-0.03017215344002011
CTV,2024-07-12,Little free Blockbuster set up in Winnipeg,https://winnipeg.ctvnews.ca/little-free-blockbuster-set-up-in-winnipeg-1.6958239,neutral,0.15011513,0.011407927,0.83847696,0.022404410097004224
CTV,2024-07-12,More Ontarians living without a family doctor,https://windsor.ctvnews.ca/more-ontarians-living-without-a-family-doctor-1.6962206,negative,0.017917397,0.674404,0.30767864,-0.4544997168808962
CTV,2024-07-12,Tornado warnings issued for parts of south central Sask.,https://regina.ctvnews.ca/tornado-warnings-issued-for-parts-of-south-central-sask-1.6962506,neutral,0.029651152,0.15689309,0.81345576,-0.02373625080306674
CTV,2024-07-12,"Collapse of a school in northern Nigeria leaves 22 students dead, more than 100 people trapped, officials say",https://www.ctvnews.ca/world/collapse-of-a-school-in-northern-nigeria-leaves-22-students-dead-more-than-100-people-trapped-officials-say-1.6962494,negative,0.006832427,0.7818381,0.21132952,-0.6112241162000842
CTV,2024-07-12,"5 people escape hot, acidic pond after SUV drove into inactive geyser in Yellowstone",https://www.ctvnews.ca/world/5-people-escape-hot-acidic-pond-after-suv-drove-into-inactive-geyser-in-yellowstone-1.6962489,negative,0.012017171,0.6450457,0.34293726,-0.4159394449120981
CTV,2024-07-12,"Kim Kardashian, John Cena and other stars arrive in India for the year's most extravagant wedding",https://www.ctvnews.ca/world/kim-kardashian-john-cena-and-other-stars-arrive-in-india-for-the-year-s-most-extravagant-wedding-1.6961110,positive,0.49809116,0.0040580123,0.49785084,0.24807833752463537
CTV,2024-07-12,Owner of Ottawa Train Yards exits receivership after settling outstanding loan,https://ottawa.ctvnews.ca/owner-of-ottawa-train-yards-exits-receivership-after-settling-outstanding-loan-1.6962147,neutral,0.0249768,0.18452963,0.79049355,-0.03342734680470638
CTV,2024-07-12,RSV vaccination programs recommended for seniors: national immunization committee,https://www.ctvnews.ca/health/rsv-vaccination-programs-recommended-for-seniors-national-immunization-committee-1.6962166,neutral,0.10634356,0.014015619,0.8796407,0.011112526070677475
CTV,2024-07-12,Merivale Fish Market closes temporarily due to fire next door,https://ottawa.ctvnews.ca/merivale-fish-market-closes-temporarily-due-to-fire-next-door-1.6962262,negative,0.014609911,0.4496494,0.5357407,-0.20197114082420775
CTV,2024-07-12,U.S. federal appeals court says there's no fundamental right to change one's sex on a birth certificate,https://www.ctvnews.ca/world/u-s-federal-appeals-court-says-there-s-no-fundamental-right-to-change-one-s-sex-on-a-birth-certificate-1.6962463,negative,0.016780052,0.4642116,0.51900846,-0.2152107982188909
CTV,2024-07-12,Community evacuated in northern Alberta as wildfire creeps closer to highway,https://edmonton.ctvnews.ca/community-evacuated-in-northern-alberta-as-wildfire-creeps-closer-to-highway-1.6960601,negative,0.018962294,0.33240342,0.6486343,-0.11013245662990911
CTV,2024-07-12,'Justice system failed me': Calgary woman speaks out after sex assault trial cut short,https://calgary.ctvnews.ca/justice-system-failed-me-calgary-woman-speaks-out-after-sex-assault-trial-cut-short-1.6962237,negative,0.0045486265,0.91977143,0.075679906,-0.8459588466222692
CTV,2024-07-12,Ont. man facing sex assault charges after meeting up with 12-year-old at motel,https://kitchener.ctvnews.ca/ont-man-facing-sex-assault-charges-after-meeting-up-with-12-year-old-at-motel-1.6961458,negative,0.0067774556,0.72276807,0.27045435,-0.5223478318900199
CTV,2024-07-12,Actor Matthew McConaughey tells governors he is still mulling future run for political office,https://www.ctvnews.ca/world/actor-matthew-mcconaughey-tells-governors-he-is-still-mulling-future-run-for-political-office-1.6961970,neutral,0.0782119,0.00486884,0.9169194,0.006093384756091336
CTV,2024-07-12,Toronto's iconic 'Leslieville dollhouse' set to hit the market on Thursday,https://toronto.ctvnews.ca/toronto-s-iconic-leslieville-dollhouse-set-to-hit-the-market-on-thursday-1.6958856,positive,0.23562284,0.0037567294,0.7606206,0.05550397081368175
CTV,2024-07-12,Ontario dad highlights Calgary Flames' act of kindness,https://calgary.ctvnews.ca/ontario-dad-highlights-calgary-flames-act-of-kindness-1.6959615,positive,0.4680809,0.013777447,0.5181416,0.21890993231926004
CTV,2024-07-12,Alec Baldwin weeps in court when judge announces involuntary manslaughter case dismissed mid-trial,https://www.ctvnews.ca/entertainment/alec-baldwin-weeps-in-court-when-judge-announces-involuntary-manslaughter-case-dismissed-mid-trial-1.6961144,negative,0.017540641,0.58214706,0.40031233,-0.338587510934822
CTV,2024-07-12,Calls to enforce leash bylaws in North Vancouver after dog mauled to death,https://bc.ctvnews.ca/calls-to-enforce-leash-bylaws-in-north-vancouver-after-dog-mauled-to-death-1.6962556,negative,0.009089062,0.7461229,0.244788,-0.5566167990065765
CTV,2024-07-12,Archaeologists from Alberta and Sask. are studying a site this local historian stumbled upon,https://saskatoon.ctvnews.ca/archaeologists-from-alberta-and-sask-are-studying-a-site-this-local-historian-stumbled-upon-1.6962177,neutral,0.083139904,0.0060567516,0.91080326,0.006875566302521285
CTV,2024-07-12,Flin Flon keeping track of fire close to city,https://winnipeg.ctvnews.ca/flin-flon-keeping-track-of-fire-close-to-city-1.6962176,neutral,0.026831457,0.076568656,0.89659977,-0.005142837954409174
CTV,2024-07-12,Buckingham Palace is opening up the room behind its famous balcony to the public for the first time,https://www.ctvnews.ca/world/buckingham-palace-is-opening-up-the-room-behind-its-famous-balcony-to-the-public-for-the-first-time-1.6961248,positive,0.29115888,0.0036644624,0.7051765,0.0847601192902232
CTV,2024-07-12,"B.C. wildfire crews battle blaze in ancient forest park with 1,000-year-old trees",https://bc.ctvnews.ca/b-c-wildfire-crews-battle-blaze-in-ancient-forest-park-with-1-000-year-old-trees-1.6961866,neutral,0.038947467,0.12521572,0.83583677,-0.014162076544126379
CTV,2024-07-12,How much is your place worth? Heat map shows Edmonton property value assessments,https://edmonton.ctvnews.ca/how-much-is-your-place-worth-heat-map-shows-edmonton-property-value-assessments-1.6962124,neutral,0.040485848,0.022074929,0.93743926,0.0011518006785854462
CTV,2024-07-12,'This space is long overdue': Manitoba government provides more details on safe consumption site,https://winnipeg.ctvnews.ca/this-space-is-long-overdue-manitoba-government-provides-more-details-on-safe-consumption-site-1.6961725,neutral,0.13672927,0.05694821,0.8063224,0.015451803680065268
CTV,2024-07-12,Edmonton proves popular for U.S. restaurant chains looking to expand,https://edmonton.ctvnews.ca/edmonton-proves-popular-for-u-s-restaurant-chains-looking-to-expand-1.6962547,positive,0.6404686,0.004492952,0.35503846,0.4101798377745034
CTV,2024-07-12,"B.C. university gives pro-Palestinian protesters trespass notice, deadline to vacate",https://bc.ctvnews.ca/b-c-university-gives-pro-palestinian-protesters-trespass-notice-deadline-to-vacate-1.6962030,negative,0.009890889,0.66008514,0.33002388,-0.4356146028142618
CTV,2024-07-12,Pedestrian fighting for their life following 'serious collision' this afternoon near Lucan,https://london.ctvnews.ca/pedestrian-fighting-for-their-life-following-serious-collision-this-afternoon-near-lucan-1.6962041,negative,0.022041213,0.5824113,0.39554748,-0.338717111937914
CTV,2024-07-12,"Bodies of 2 people believed to be from B.C. wash ashore on Sable Island, N.S.",https://bc.ctvnews.ca/bodies-of-2-people-believed-to-be-from-b-c-wash-ashore-on-sable-island-n-s-1.6962550,neutral,0.01718891,0.17728254,0.80552846,-0.031133655495525048
CTV,2024-07-12,"Fredericton Pride festival cancelled, organizers cite harassment, safety concerns",https://atlantic.ctvnews.ca/more/fredericton-pride-festival-cancelled-organizers-cite-harassment-safety-concerns-1.6961265,negative,0.008858089,0.73907506,0.2520667,-0.5461535943475155
CTV,2024-07-12,B.C. Highway Patrol urging caution from drivers after deadly week,https://bc.ctvnews.ca/b-c-highway-patrol-urging-caution-from-drivers-after-deadly-week-1.6962383,negative,0.015009972,0.48149863,0.5034914,-0.23161563040542887
CTV,2024-07-12,Barrie students lose everything in destructive fire as neighbours rally to help,https://barrie.ctvnews.ca/barrie-students-lose-everything-in-destructive-fire-as-neighbours-rally-to-help-1.6962363,negative,0.0104980245,0.7468665,0.24263547,-0.5576993630933105
CTV,2024-07-12,Mother searching for answers after son dies in OPP custody,https://kitchener.ctvnews.ca/mother-searching-for-answers-after-son-dies-in-opp-custody-1.6959276,negative,0.0152808605,0.5132137,0.47150537,-0.26315482041946314
CTV,2024-07-12,Canada's wildfire season close to 10-year average heading into the peak summer,https://www.ctvnews.ca/climate-and-environment/canada-s-wildfire-season-close-to-10-year-average-heading-into-the-peak-summer-1.6961632,neutral,0.035823435,0.18101044,0.783166,-0.031481480391257755
CTV,2024-07-12,What a geriatric doctor wishes you knew now for healthy aging,https://www.ctvnews.ca/health/what-a-geriatric-doctor-wishes-you-knew-now-for-healthy-aging-1.6962548,negative,0.04620468,0.58108157,0.37271366,-0.3355209648560109
CTV,2024-07-12,"'Water was up to my boots': N.S. residents look to recover after heavy rain, flash flood",https://atlantic.ctvnews.ca/water-was-up-to-my-boots-n-s-residents-look-to-recover-after-heavy-rain-flash-flood-1.6961170,neutral,0.093485355,0.13053536,0.7759793,-0.008299969624033565
CTV,2024-07-12,Five tornadoes confirmed in Saskatchewan on July 1,https://regina.ctvnews.ca/five-tornadoes-confirmed-in-saskatchewan-on-july-1-1.6962420,negative,0.024512459,0.31928366,0.6562039,-0.10134117949803567
CTV,2024-07-12,'I nearly died': WestJet employee and Spice Girls superfan dances with Mel C,https://calgary.ctvnews.ca/i-nearly-died-westjet-employee-and-spice-girls-superfan-dances-with-mel-c-1.6959692,negative,0.04899311,0.5143981,0.43660876,-0.26220509219605503
CTV,2024-07-12,Newfoundland wildfires: Evacuation order in Labrador City,/video/c2957525-evacuation-order-in-labrador-city--n-l-?playlistId=1.6962185,negative,0.0115142865,0.4488961,0.53958964,-0.2013751260321257
CTV,2024-07-12,NHL pre-season game coming to northern Ont. this fall,https://northernontario.ctvnews.ca/nhl-pre-season-game-coming-to-northern-ont-this-fall-1.6962021,neutral,0.07131587,0.004991146,0.92369294,0.0050610447165944095
CTV,2024-07-12,Tony Grace named new anchor of CTV Kitchener’s News at 6,https://kitchener.ctvnews.ca/tony-grace-named-new-anchor-of-ctv-kitchener-s-news-at-6-1.6961647,neutral,0.09942699,0.004544095,0.8960288,0.009865087183391186
CTV,2024-07-12,Video released of wild police car chase involving white Lamborghini north of Toronto,https://toronto.ctvnews.ca/video-released-of-wild-police-car-chase-involving-white-lamborghini-north-of-toronto-1.6961914,neutral,0.032831416,0.09842246,0.86874604,-0.008609084212876539
CTV,2024-07-12,"Apple launches Vision Pro in Canada, but $5,000 price tag could make people 'pause'",https://www.ctvnews.ca/sci-tech/apple-launches-vision-pro-in-canada-but-5-000-price-tag-could-make-people-pause-1.6961175,negative,0.08175422,0.2486702,0.6695756,-0.05515311819184987
CTV,2024-07-12,"'We feel the brick falling': McDermot Avenue building set for demolition, neighbours worry about the mess left behind",https://winnipeg.ctvnews.ca/we-feel-the-brick-falling-mcdermot-avenue-building-set-for-demolition-neighbours-worry-about-the-mess-left-behind-1.6962258,negative,0.008283186,0.7858798,0.20583707,-0.6175383878455349
CTV,2024-07-12,"Kamloops shooting linked to ongoing drug conflict, RCMP say",https://bc.ctvnews.ca/kamloops-shooting-linked-to-ongoing-drug-conflict-rcmp-say-1.6959162,negative,0.008938486,0.30392045,0.6871412,-0.0922877068148864
CTV,2024-07-12,"Conservatives would scale back supervised drug consumption sites, Poilievre says",https://www.ctvnews.ca/politics/conservatives-would-scale-back-supervised-drug-consumption-sites-poilievre-says-1.6962110,neutral,0.02046686,0.1622301,0.817303,-0.025899718409752026
CTV,2024-07-12,"Girl, 12, kicked out of Quebec karate class for wearing hijab: human rights commission",https://montreal.ctvnews.ca/girl-12-kicked-out-of-quebec-karate-class-for-wearing-hijab-human-rights-commission-1.6962203,negative,0.0065293345,0.79487026,0.19860032,-0.631776164380728
CTV,2024-07-12,Indigo founder Heather Reisman acknowledges 'tough four years' for bookstore chain,https://toronto.ctvnews.ca/indigo-founder-heather-reisman-acknowledges-tough-four-years-for-bookstore-chain-1.6962207,neutral,0.06530222,0.06699624,0.8677016,-0.00022411564419089203
CTV,2024-07-12,Canada's defence spending commitment presents unsavoury choices: economists,https://www.ctvnews.ca/politics/canada-s-defence-spending-commitment-presents-unsavoury-choices-economists-1.6961904,negative,0.010687295,0.5641085,0.42520422,-0.3181041713527968
CTV,2024-07-12,'Tears come to my eyes': Track star and family granted extension to stay in Canada after deportation order,https://toronto.ctvnews.ca/tears-come-to-my-eyes-track-star-and-family-granted-extension-to-stay-in-canada-after-deportation-order-1.6956883,neutral,0.2064129,0.08513658,0.70845044,0.03535805786402335
CTV,2024-07-12,Sask. RCMP says three people were impersonating police in Onion Lake,https://saskatoon.ctvnews.ca/sask-rcmp-says-three-people-were-impersonating-police-in-onion-lake-1.6962490,negative,0.008676359,0.6580735,0.33325028,-0.4329853550597704
CTV,2024-07-12,WestJet and mechanics' union ratify contract in aftermath of strike,https://calgary.ctvnews.ca/westjet-and-mechanics-union-ratify-contract-in-aftermath-of-strike-1.6961801,neutral,0.049894825,0.044454496,0.9056505,0.0005132922712633992
CTV,2024-07-12,B.C. buyers who backed out of home purchase ordered to pay more than $350K in damages,https://bc.ctvnews.ca/b-c-buyers-who-backed-out-of-home-purchase-ordered-to-pay-more-than-350k-in-damages-1.6955911,negative,0.0083364295,0.7297562,0.26190725,-0.5324746886196241
CTV,2024-07-12,CFL fan looking to break Guinness World Record,https://winnipeg.ctvnews.ca/cfl-fan-looking-to-break-guinness-world-record-1.6961835,positive,0.38702607,0.037123583,0.5758504,0.14841098778747686
CTV,2024-07-12,He thought his gnomes were stolen. But then a secret society returned them,https://bc.ctvnews.ca/he-thought-his-gnomes-were-stolen-but-then-a-secret-society-returned-them-1.6959366,negative,0.037169185,0.23168845,0.7311424,-0.052297982811472465
CTV,2024-07-12,Watch the moment the case against Alec Baldwin is dismissed,/video/c2957548-moment-case-against-baldwin-thrown-out?playlistId=1.6026688,negative,0.05194018,0.42139974,0.52666,-0.1748799833247041
CTV,2024-07-12,Canada's NATO defence spending pledge amounts to $60 billion a year by 2032: minister,https://www.ctvnews.ca/politics/canada-s-nato-defence-spending-pledge-amounts-to-60-billion-a-year-by-2032-minister-1.6961456,neutral,0.12493945,0.010385094,0.86467546,0.015502014875334869
CTV,2024-07-12,"Man, 43, charged with series of apartment frauds; Montreal police seeking more victims",https://montreal.ctvnews.ca/man-43-charged-with-series-of-apartment-frauds-montreal-police-seeking-more-victims-1.6961956,negative,0.010514828,0.7145552,0.2749299,-0.5104785982397697
CTV,2024-07-12,Charges laid after paramedic assaulted during call on Victoria's Pandora Avenue,https://bc.ctvnews.ca/charges-laid-after-paramedic-assaulted-during-call-on-victoria-s-pandora-avenue-1.6962433,negative,0.011695371,0.5365886,0.451716,-0.2877905535133358
CTV,2024-07-12,"'We grieve together': Youth found dead after flash flood in Wolfville, N.S.",https://atlantic.ctvnews.ca/more/we-grieve-together-youth-found-dead-after-flash-flood-in-wolfville-n-s-1.6961544,negative,0.040888593,0.3036458,0.65546554,-0.0905289029940306
CTV,2024-07-12,Webb Space Telescope's latest cosmic shot shows pair of intertwined galaxies glowing in infrared,https://www.ctvnews.ca/sci-tech/webb-space-telescope-s-latest-cosmic-shot-shows-pair-of-intertwined-galaxies-glowing-in-infrared-1.6961573,neutral,0.19232932,0.0054131737,0.8022575,0.03696126941609812
CTV,2024-07-12,Hearing on Sask.'s request to stop collection of carbon money cancelled,https://regina.ctvnews.ca/hearing-on-sask-s-request-to-stop-collection-of-carbon-money-cancelled-1.6962013,negative,0.012709936,0.2965444,0.69074565,-0.0877770401413045
CTV,2024-07-12,'I told you it wasn't a dream': Ontario couple retires after winning $55-million Lotto Max jackpot,https://toronto.ctvnews.ca/i-told-you-it-wasn-t-a-dream-ontario-couple-retires-after-winning-55-million-lotto-max-jackpot-1.6961975,neutral,0.16005935,0.08376188,0.7561786,0.018602954481133693
CTV,2024-07-12,Bodies of missing B.C. sailors wash ashore on N.S. island,/video/c2957653-bodies-of-b-c--sailors-discovered-in-nova-scotia,negative,0.013807502,0.4123927,0.57379985,-0.1698770727351473
CTV,2024-07-12,4 in 10 Canadians say theft is a risk factor in vehicle purchasing: Nanos,https://www.ctvnews.ca/autos/4-in-10-canadians-say-theft-is-a-risk-factor-in-vehicle-purchasing-nanos-1.6954438,negative,0.015829444,0.50194913,0.4822214,-0.2517023737946733
