source,date,headline,url,chosen_label,positive,negative,neutral,compound
CTV,2024-05-03,Sault’s Queen Street to undergo reconstruction,https://northernontario.ctvnews.ca/sault-s-queen-street-to-undergo-reconstruction-1.6871987,neutral,0.036915448,0.033737175,0.92934734,0.00022455341078919666
CTV,2024-05-03,Regina's North Central Family Centre launches Hopes and Dreams campaign,https://regina.ctvnews.ca/regina-s-north-central-family-centre-launches-hopes-and-dreams-campaign-1.6872476,neutral,0.15660435,0.0061029224,0.83729273,0.024487676690387872
CTV,2024-05-03,White Rock stabbing suspect charged with 2nd-degree murder,https://bc.ctvnews.ca/white-rock-stabbing-suspect-charged-with-2nd-degree-murder-1.6873034,negative,0.010096319,0.7768708,0.21303284,-0.6034263301133009
CTV,2024-05-03,Driver charged with speeding while impaired on Hwy 11,https://barrie.ctvnews.ca/driver-charged-with-speeding-while-impaired-on-hwy-11-1.6873093,negative,0.019763693,0.623263,0.35697326,-0.38806618279367555
CTV,2024-05-03,Northern Ont. man guilty of three counts of first-degree murder in Sudbury firebombing,https://northernontario.ctvnews.ca/northern-ont-man-guilty-of-three-counts-of-first-degree-murder-in-sudbury-firebombing-1.6872638,negative,0.005947122,0.8436322,0.15042077,-0.7116798691529951
CTV,2024-05-03,"Police clear encampments as U.S. campus arrests exceed 2,300 amid pro-Palestinian protests",https://www.ctvnews.ca/world/police-clear-encampments-as-u-s-campus-arrests-exceed-2-300-amid-pro-palestinian-protests-1.6872168,negative,0.015810953,0.44720706,0.536982,-0.19974415806949786
CTV,2024-05-03,Drew Carey is never quitting 'The Price Is Right',https://www.ctvnews.ca/entertainment/drew-carey-is-never-quitting-the-price-is-right-1.6872672,neutral,0.16196218,0.090417884,0.7476199,0.01805635491461066
CTV,2024-05-03,Sask. man facing charges for sexual assault of teen girl,https://saskatoon.ctvnews.ca/sask-man-facing-charges-for-sexual-assault-of-teen-girl-1.6873055,negative,0.00979885,0.63280517,0.3573959,-0.4003464387441227
CTV,2024-05-03,Newfoundland fisherman says police broke his leg during protest that delayed budget,https://www.ctvnews.ca/canada/newfoundland-fisherman-says-police-broke-his-leg-during-protest-that-delayed-budget-1.6868720,negative,0.006052265,0.80470926,0.18923852,-0.6475203326017027
CTV,2024-05-03,Contractors want to repurpose Milk River high school rather than see it demolished,https://calgary.ctvnews.ca/contractors-want-to-repurpose-milk-river-high-school-rather-than-see-it-demolished-1.6871576,negative,0.05162044,0.30520856,0.64317095,-0.09048761438206299
CTV,2024-05-03,"UN agencies prepare for Rafah incursion, warn of 'slaughter'",https://www.ctvnews.ca/world/un-agencies-prepare-for-rafah-incursion-warn-of-slaughter-1.6872981,negative,0.008893225,0.6432827,0.3478242,-0.4137334624701712
CTV,2024-05-03,Five areas Canada's foreign interference commissioner says needs more investigation,https://www.ctvnews.ca/politics/five-areas-canada-s-foreign-interference-commissioner-says-needs-more-investigation-1.6872689,negative,0.015292493,0.24545144,0.73925614,-0.060012529596402686
CTV,2024-05-03,Winnipeg man accused of killing four women will face jury,https://winnipeg.ctvnews.ca/winnipeg-man-accused-of-killing-four-women-will-face-jury-1.6872179,negative,0.012825304,0.6356283,0.35154635,-0.4038588627192752
CTV,2024-05-03,Search crews called in after missing Kelowna senior's truck found,https://bc.ctvnews.ca/search-crews-called-in-after-missing-kelowna-senior-s-truck-found-1.6859073,neutral,0.034902282,0.06520745,0.89989036,-0.003033839513589154
CTV,2024-05-03,Loblaw boycott organizer says she met with CEO to talk about grocery prices,https://www.ctvnews.ca/business/loblaw-boycott-organizer-says-she-met-with-ceo-to-talk-about-grocery-prices-1.6872927,negative,0.021397041,0.46833065,0.5102724,-0.21887572526750532
CTV,2024-05-03,2 charged after police find 'concerning and diverse' explosives at Manitoba home,https://winnipeg.ctvnews.ca/2-charged-after-police-find-concerning-and-diverse-explosives-at-manitoba-home-1.6872881,negative,0.011440955,0.5517171,0.43684188,-0.3042609145837183
CTV,2024-05-03,"More than half of Canadians say freedom of speech is under threat, new poll suggests",https://www.ctvnews.ca/canada/more-than-half-of-canadians-say-freedom-of-speech-is-under-threat-new-poll-suggests-1.6871927,negative,0.0077907415,0.7590815,0.23312783,-0.5761439571850957
CTV,2024-05-03,New Red Dress Alert system to be developed in Manitoba,https://winnipeg.ctvnews.ca/new-red-dress-alert-system-to-be-developed-in-manitoba-1.6872737,neutral,0.061337933,0.013554847,0.92510724,0.0035786070257355362
CTV,2024-05-03,'I feel honoured to say I was his friend': Wayne Gretzky remembers Bob Cole,https://www.ctvnews.ca/sports/i-feel-honoured-to-say-i-was-his-friend-wayne-gretzky-remembers-bob-cole-1.6865945,positive,0.88606626,0.0043543493,0.10957944,0.7850944070679655
CTV,2024-05-03,China sends a probe to get samples from the less-explored far side of the moon,https://www.ctvnews.ca/sci-tech/china-sends-a-probe-to-get-samples-from-the-less-explored-far-side-of-the-moon-1.6871950,neutral,0.06390643,0.07012281,0.8659707,-0.0008331768396860895
CTV,2024-05-03,"B.C. mayor stripped of budget, barred from committees over Indigenous residential schools book",https://bc.ctvnews.ca/b-c-mayor-stripped-of-budget-barred-from-committees-over-indigenous-residential-schools-book-1.6870928,negative,0.0073953513,0.69733024,0.29527438,-0.4862148089069436
CTV,2024-05-03,Magnitude 4.8 earthquake recorded west of Vancouver Island,https://bc.ctvnews.ca/magnitude-4-8-earthquake-recorded-west-of-vancouver-island-1.6872252,neutral,0.066112645,0.063363835,0.87052345,0.0003559063960807407
CTV,2024-05-03,Video of Michelle Hadwen before her death in 2009 released by Edmonton police,https://edmonton.ctvnews.ca/video-of-michelle-hadwen-before-her-death-in-2009-released-by-edmonton-police-1.6872417,neutral,0.016733836,0.13983727,0.84342897,-0.01927443011009977
CTV,2024-05-03,"Google's search engine is an illegal monopoly, U.S. Justice Department says",https://www.ctvnews.ca/sci-tech/google-s-search-engine-is-an-illegal-monopoly-u-s-justice-department-says-1.6872751,negative,0.016933115,0.63601595,0.34705096,-0.4042295224954344
CTV,2024-05-03,Rolls-Royce is growing its factory so it can build its 'bespoke' cars more slowly,https://www.ctvnews.ca/autos/rolls-royce-is-growing-its-factory-so-it-can-build-its-bespoke-cars-more-slowly-1.6866283,positive,0.3959751,0.0142831355,0.58974177,0.15659228251308477
CTV,2024-05-03,Mandatory alcohol screenings raise concern in N.S. community,/video/c2915894-n-s--police-conduct-mandatory-alcohol-screenings,negative,0.02237196,0.2960922,0.6815358,-0.08717011039377098
CTV,2024-05-03,Princess Anne to take part in B.C. ceremony bringing new ship into Pacific fleet,https://bc.ctvnews.ca/princess-anne-to-take-part-in-b-c-ceremony-bringing-new-ship-into-pacific-fleet-1.6872131,positive,0.3017643,0.004929564,0.693306,0.09103742428704997
CTV,2024-05-03,B.C. man rescues starving dachshund trapped in carrier: BC SPCA,https://bc.ctvnews.ca/b-c-man-rescues-starving-dachshund-trapped-in-carrier-bc-spca-1.6860519,neutral,0.046962813,0.0621451,0.89089215,-0.0016565066682936447
CTV,2024-05-03,"Biscuits with possible plastic pieces, metal found in ground pork: Here are the recalls for this week",https://www.ctvnews.ca/health/biscuits-with-possible-plastic-pieces-metal-found-in-ground-pork-here-are-the-recalls-for-this-week-1.6870853,negative,0.011133718,0.5589622,0.42990404,-0.3123148100458586
CTV,2024-05-03,Police launch Mandatory Alcohol Screening program in Halifax area,https://atlantic.ctvnews.ca/more/police-launch-mandatory-alcohol-screening-program-in-halifax-area-1.6873064,neutral,0.037926093,0.030377172,0.9316968,0.0005156156549110946
CTV,2024-05-03,Southern Alberta animal shelters overrun with abandoned pets,https://calgary.ctvnews.ca/southern-alberta-animal-shelters-overrun-with-abandoned-pets-1.6873090,negative,0.010098028,0.7607992,0.22910266,-0.5787135525853593
CTV,2024-05-03,"Almost $17K in fines for illegal hunting, fishing in northern Ont.",https://northernontario.ctvnews.ca/almost-17k-in-fines-for-illegal-hunting-fishing-in-northern-ont-1.6872502,negative,0.00982671,0.7463721,0.24380112,-0.5569747966485465
CTV,2024-05-03,Conservative MP says Chinese hacking attack targeted his personal email,https://www.ctvnews.ca/politics/conservative-mp-says-chinese-hacking-attack-targeted-his-personal-email-1.6871209,negative,0.012665728,0.5383571,0.44897717,-0.28966792335322467
CTV,2024-05-03,Police arrest 3 Indian nationals in killing of B.C. Sikh activist Hardeep Singh Nijjar,https://bc.ctvnews.ca/police-arrest-3-indian-nationals-in-killing-of-b-c-sikh-activist-hardeep-singh-nijjar-1.6872496,negative,0.011898078,0.50375324,0.48434874,-0.25362573832373503
CTV,2024-05-03,Extremely close call as driver passes truck on highway,/video/c2915760-watch--reckless-pass-on-oregon-highway,neutral,0.06895066,0.18729037,0.74375886,-0.030323502507081823
CTV,2024-05-03,'I felt like the wildebeest in National Geographic': Cyclist recounts wild dog attack,https://london.ctvnews.ca/i-felt-like-the-wildebeest-in-national-geographic-cyclist-recounts-wild-dog-attack-1.6872781,neutral,0.09530266,0.10702025,0.7976771,-0.0023707378372583854
CTV,2024-05-03,80-year-old Ont. man to face jury in historical sexual assault case involving children,https://barrie.ctvnews.ca/80-year-old-ont-man-to-face-jury-in-historical-sexual-assault-case-involving-children-1.6872880,negative,0.009182976,0.64717346,0.34364367,-0.41874908953946033
CTV,2024-05-03,Video shows suspect setting Toronto-area barbershop on fire,https://toronto.ctvnews.ca/video-shows-suspect-setting-toronto-area-barbershop-on-fire-1.6872660,negative,0.015245648,0.5288607,0.45589373,-0.27946115097476465
CTV,2024-05-03,Three Indian nationals arrested in killing of Sikh activist,/video/c2915870-ctv-national-news--arrest-in-nijjar-killing?playlistId=1.6872536,negative,0.008539767,0.69362694,0.29783335,-0.48104534287596756
CBC,2024-05-03,Karate Olympian fights for refugees in sport,https://www.cbc.ca/player/play/video/1.7192702,neutral,0.092307456,0.0389834,0.86870915,0.007000960657991273
CBC,2024-05-03,Police make arrests in killing of B.C. Sikh activist Hardeep Singh Nijjar,https://www.cbc.ca/news/politics/nijjar-killing-arrests-made-1.7192807,negative,0.016151153,0.42545876,0.55839,-0.1807543200961419
CBC,2024-05-03,What's the climate-friendly way to get rid of worn-out clothes and linens?,https://www.cbc.ca/news/science/what-on-earth-clothing-disposal-1.7191603,neutral,0.069536634,0.10009796,0.83036536,-0.005184259868677543
CBC,2024-05-03,Allegations of RCMP bullying detailed in Surrey police court docs,https://www.cbc.ca/news/canada/british-columbia/surrey-rcmp-municipal-toxic-workplace-1.7192430,negative,0.0120893195,0.5294801,0.45843065,-0.2802029936496879
CBC,2024-05-03,Is the Loblaw boycott privileged? Here's why some people aren't shopping around,https://www.cbc.ca/news/business/loblaw-boycott-privilege-1.7192869,negative,0.01999362,0.6842069,0.29579952,-0.46773932212138547
CBC,2024-05-03,Indonesia eruption: Why this volcano shoots lightning | About That,https://www.cbc.ca/player/play/video/1.7193305,negative,0.014951926,0.3461675,0.63888055,-0.11960839149308278
CBC,2024-05-03,Texas onlookers capture looming tornado on camera,https://www.cbc.ca/player/play/video/9.4217640,neutral,0.06573091,0.059820566,0.8744485,0.0007420522686818476
CBC,2024-05-03,"The Fall Guy is a goofy, over-the-top love letter to stunt performers",https://www.cbc.ca/player/play/video/9.4217325,negative,0.061893832,0.60817194,0.32993424,-0.36604226337213674
CBC,2024-05-03,"Foreign meddling didn't affect who formed government in past 2 elections, but inquiry flags 'troubling' events",https://www.cbc.ca/news/politics/foreign-interference-inquiry-first-report-1.7191156,negative,0.021550288,0.33042336,0.6480264,-0.10871515985439117
CBC,2024-05-03,Pro-Palestinian encampment remains at U of T for 2nd day,https://www.cbc.ca/news/canada/toronto/encampment-uoft-day-2-1.7193100,negative,0.009191094,0.6273034,0.36350545,-0.3934251248009204
CBC,2024-05-03,Hacker demands ransom from B.C. libraries after data breach,https://www.cbc.ca/news/canada/british-columbia/libraries-cariboo-hacker-data-breach-1.7193435,negative,0.012168414,0.58150804,0.40632352,-0.3380035479106134
CBC,2024-05-03,"Murder charges offer 'relief,' but many questions remain, Sikh leader says",https://www.cbc.ca/news/canada/british-columbia/surrey-bc-sikh-community-1.7193287,negative,0.013211863,0.29292923,0.693859,-0.08563295635052626
CBC,2024-05-03,"At long last, the Hogue inquiry lays the foundation for a real debate about foreign interference",https://www.cbc.ca/news/politics/hogue-inquiry-foreign-interference-china-1.7193727,positive,0.38536772,0.025754906,0.58887744,0.1478449443886518
CBC,2024-05-03,New dashcam video shows scale of Highway 401 police chase,https://www.cbc.ca/player/play/video/1.7192721,neutral,0.03744118,0.03902692,0.9235319,-0.0001212585864647231
CBC,2024-05-03,WATCH | Poilievre calls Trudeau's drug policies 'wacko',https://www.cbc.cahttps://www.cbc.ca/player/play/video/1.7192707,negative,0.011574543,0.6987143,0.2897111,-0.4880677451232387
CBC,2024-05-03,"Foreign interference 'did occur' but didn't undermine integrity of vote, Hogue says",https://www.cbc.ca/player/play/video/9.4217722,neutral,0.036609825,0.13823152,0.82515854,-0.0177676845571888
CBC,2024-05-03,What we know about the arrests and the investigation into Hardeep Singh Nijjar's killing,https://www.cbc.ca/news/politics/hardeep-singh-nijjar-killing-arrests-made-faq-1.7193911,neutral,0.016665474,0.20756792,0.7757666,-0.04280670146079757
CBC,2024-05-03,"When this orangutan got roughed up, he treated his wound with a medicinal plant",https://www.cbc.ca/radio/asithappens/orangutan-healing-plants-1.7193830,negative,0.026302617,0.43486705,0.5388304,-0.18841750342171792
CBC,2024-05-03,Video shows alleged contract killing of B.C. Sikh leader,https://www.cbc.ca/news/canada/video-killing-hardeep-singh-nijjar-1.7137924,negative,0.0072941794,0.7325219,0.26018384,-0.5365351814719368
CBC,2024-05-03,Ryan Gosling's good graces ground The Fall Guy's meta-movie shenanigans,https://www.cbc.ca/news/entertainment/ryan-gosling-the-fall-guy-1.7188468,positive,0.2853342,0.035687312,0.67897844,0.08014203238736428
CBC,2024-05-03,This Welsh lawmaker is trying to make it illegal for politicians to lie,https://www.cbc.ca/radio/asithappens/welsh-politicians-lying-vote-1.7192025,negative,0.017485907,0.65031826,0.33219576,-0.422608126182098
CBC,2024-05-03,Amazon Prime's NHL deal breaches cable TV's last line of defence: live sports,https://www.cbc.ca/news/business/armstrong-amazon-nhl-sports-broadcasting-1.7192269,neutral,0.09746122,0.06493653,0.8376022,0.005281938167898126
CBC,2024-05-03,Hope Hicks testifies Trump told her to deny 'any' relationship with Stormy Daniels,https://www.cbc.ca/news/world/trump-trial-hope-hicks-testimony-access-hollywood-tape-1.7193394,negative,0.020792514,0.3289565,0.6502509,-0.10778007822176505
CBC,2024-05-03,Giant Canucks display made out of Pepsi boxes draw fans into Kelowna grocery store,https://www.cbc.ca/news/canada/british-columbia/vancouver-canucks-playoffs-tributes-from-fans-1.7192693,positive,0.24496222,0.020596348,0.73444134,0.059582297197584566
CBC,2024-05-03,Watchdog agency accuses chief of military police of blocking investigations,https://www.cbc.ca/news/politics/military-police-provost-marshal-complaints-1.7193973,negative,0.008524719,0.75064063,0.24083468,-0.5633886635928302
CBC,2024-05-03,How the search for a missing woman led investigators to the Saskatoon landfill,https://www.cbc.ca/player/play/video/9.4216661,neutral,0.030806215,0.10355481,0.86563903,-0.009774571586197656
CBC,2024-05-03,Canadian track stars prepare for World Relays with Paris Olympics on the line,https://www.cbc.ca/sports/olympics/summer/trackandfield/athletics-canada-olympics-world-relays-1.7193137,neutral,0.16952975,0.0038742253,0.826596,0.02872532681687545
CBC,2024-05-03,At Issue | Poilievre calls Trudeau’s drug policies ‘wacko’,https://www.cbc.ca/player/play/video/1.7192707,negative,0.009897031,0.71433777,0.2757652,-0.5101804715206235
CBC,2024-05-03,"Alberta semi-automated truck convoys didn't save fuel but tech still has promise, researchers say",https://www.cbc.ca/news/canada/edmonton/truck-platooning-alberta-highway-2-1.7191266,neutral,0.1198522,0.12015673,0.75999117,-7.308930866756214e-05
CBC,2024-05-03,"TD Bank could face more severe penalties after drug money laundering allegations, says analyst",https://www.cbc.ca/news/business/td-bank-money-laundering-allegations-1.7193529,negative,0.0075573055,0.7527616,0.23968108,-0.5665929056712633
CBC,2024-05-03,A timeline of Canada-India tensions — from 2018 to today's arrests,https://www.cbc.ca/news/politics/timeline-canada-india-tensions-arrests-1.7193238,neutral,0.021716647,0.042779677,0.9355037,-0.0013584870393827941
CBC,2024-05-03,Princess Anne to take part in ceremony for new Pacific fleet ship,https://www.cbc.ca/news/canada/british-columbia/princess-anne-bc-commissioning-ceremony-canadian-pacific-fleet-1.7193094,positive,0.4098844,0.0059247185,0.5841909,0.16797010131917567
CBC,2024-05-03,Hockey fans gather in St. John's as Bob Cole is laid to rest,https://www.cbc.ca/news/canada/newfoundland-labrador/nl-bob-cole-funeral-1.7193278,neutral,0.058442723,0.0527082,0.88884914,0.0006373970448998456
CBC,2024-05-03,WATCH : CBC News Explore,https://www.cbc.cahttps://gem.cbc.ca/live,neutral,0.09840742,0.014817321,0.88677526,0.009464467482493077
CBC,2024-05-03,#TheMoment babies Johnny Cash and June Carter were born at same hospital,https://www.cbc.ca/player/play/video/1.7192715,neutral,0.113423556,0.007722243,0.8788544,0.01280524955277862
CBC,2024-05-03,Brutal details of Tiki Laverdiere's murder now public after last of 10 accused sentenced,https://www.cbc.ca/news/canada/saskatoon/details-tiki-laverdiere-murder-public-1.7191557,negative,0.005578384,0.8771238,0.11729772,-0.7693150922043368
CBC,2024-05-03,"Trial of Winnipeg man accused of killing 4 women to be heard by jury, judge rules",https://www.cbc.ca/news/canada/manitoba/jeremy-skibick-trial-jury-judge-ruling-1.7192833,neutral,0.025443168,0.1812663,0.7932906,-0.032210102621469616
CBC,2024-05-03,Why is everyone arguing about Drake and Kendrick Lamar?,https://www.cbc.ca/news/entertainment/drake-vs-kendrick-lamar-beef-1.7192419,negative,0.03970401,0.2784038,0.6818922,-0.07593225766269018
CBC,2024-05-03,Americans arrested for allegedly swindling Canada out of 12 million COVID masks,https://www.cbc.ca/news/world/americans-charged-pandemic-mask-swindle-1.7193553,negative,0.012242193,0.6723123,0.31544554,-0.4518539438990459
CBC,2024-05-03,WATCH: CBC News Network,https://www.cbc.cahttps://gem.cbc.ca/live,neutral,0.10073908,0.018231502,0.88102955,0.00981596340483426
CBC,2024-05-03,"Can Montreal's nightlife be saved, or is it just too pricey?",https://www.cbc.ca/player/play/video/9.4217416,negative,0.019802913,0.61173385,0.3684631,-0.3738262225132267
CBC,2024-05-03,RCMP calls collaboration with partner agencies in India ‘rather challenging’,https://www.cbc.ca/player/play/video/9.4218053,negative,0.015724799,0.35317266,0.6311025,-0.12448366815324441
CBC,2024-05-03,Top court orders new trial for francophone B.C. man who was not given French option,https://www.cbc.ca/news/politics/supreme-court-french-trial-ruling-1.7192936,neutral,0.024439378,0.1693604,0.80620015,-0.028085672356388258
CBC,2024-05-03,Manitoba partners with federal government on Red Dress Alert for missing Indigenous women and girls,https://www.cbc.ca/news/canada/manitoba/red-dress-alert-pilot-1.7193608,neutral,0.04016701,0.08516583,0.87466717,-0.005639829204675095
